Organisation Chain,Tender Reference Number,Tender ID,Withdrawal Allowed,Tender Type,Form of contract,Tender Category,No. of Covers,General Technical Evaluation Allowed,ItemWise Technical Evaluation Allowed,Payment Mode,Is Multi Currency Allowed For BOQ,Is Multi Currency Allowed For Fee,Allow Two Stage Bidding,Cover No,Cover,Document Type,Description,Publish Date,Bid Opening Date,Document Download / Sale Start Date,Document Download / Sale End Date,Clarification Start Date,Clarification End Date,Bid Submission Start Date,Bid Submission End Date,Financial Bid Opening Date,EMD Amount in ₹,EMD Exemption Allowed,EMD Fee Type,EMD Percentage,EMD Payable To,EMD Payable At,S.No,Bank Name,Tender Fee in ₹,VAT Charges in ₹,Fee Payable To,Fee Payable At,Tender Fee Exemption Allowed,Name,Address,Title,Work Description,Pre Qualification Details,Independent External Monitor/Remarks,Tender Value in ₹,Product Category,Sub category,Contract Type,Bid Validity(Days),Period Of Work(Days),Location,Pincode,Pre Bid Meeting Place,Pre Bid Meeting Address,Pre Bid Meeting Date,Bid Opening Place,Should Allow NDA Tender,Allow Preferential Bidder,Tender Stage,Contract Date :,Contract Value :,Work Completion Period in days :,Updated By :,Updated on :,AOC document :,AOC Description :,S.No,Bid Number,Bidder Name,Awarded Currency,Awarded Value,S.No.1,Bid Number.1,Bidder Name.1,Submitted Date,Status,Remarks,Status Updated On,Type :,Summary :,Updated By :.1,Updated On :,Document :,BOQ Comparative Chart :,Committee Chairperson/Co-ordinator Name :,Committee Chairperson/Co-ordinator Type :,Committee Members :,Updated By :.2,Updated on :.1,Document :.1,Organisation Chain :,Tender ID :,Tender Ref No :,Tender Title :,Type :.1,Summary :.1,Updated By :.3,Updated On :.1,Document :.2,Committee Chairperson/Co-ordinator Name :.1,Committee Chairperson/Co-ordinator Type :.1,Committee Members :.1,Updated By :.4,Updated On :.2,Financial Bid Opening Date:,Document :.3,Tender Stage
Municipal Bodies||Bhadrak Municipality,BM-BDK-12-2023-24,2024_ORULB_104255_1,Yes,Open Tender,Percentage,Works,2.0,No,No,Online,No,No,No,1.0,Fee/PreQual/Technical,.pdf,"Bid document cost, EMD, GST, Registration Certificate, Affidavit and other documents as per DTCN",16-Aug-2024 10:00 AM,02-Sep-2024 11:00 AM,16-Aug-2024 10:00 AM,31-Aug-2024 05:00 PM,NA ,NA ,16-Aug-2024 10:00 AM,31-Aug-2024 05:00 PM,30-Sep-2024 10:30 AM,"2,34,000",Yes,fixed,,Nil,Nil,1.0,ICICI BANK,"10,000",0.0,Nil,Nil,No,Executive Officer,"Executive Officer, Bhadrak Municipality","Construction of Wealth Centre (MCC and MRF) over plot No.1373, Khata No.523, Mz.Randia near Ward No.9 of Bhadrak Municipality","Construction of Wealth Centre (MCC and MRF) over plot No.1373, Khata No.523, Mz.Randia near Ward No.9 of Bhadrak Municipality",Please refer Tender documents. ,NA ,"2,33,02,352",Civil Works - Others,NA ,Tender,90.0,180.0,Bhadrak Municipality,756100.0,Bhadrak Municipality ,"Executive Officer, Bhadrak Municipality ",22-Aug-2024 11:00 AM ,Bhadrak Municipality,No ,No,AOC,25-Nov-2024,"INR 20,685,498",180.0,Samir Ranjan Dash,25-Nov-2024 06:10 PM,9.pdf (1305.00 KB),work order issued,1.0,2538179.0,Nihar Ranjan Mohapatra,INR,"20,685,498",1,2538459,ASIT KUMAR BHUYAN,30-Aug-2024 10:00 PM,Rejected-Technical,Disqualified for failure to submit the average annual financial turn over for the last three year,26-Sep-2024 06:34 PM,Finance,ok,Deviprasad Mohanty,30-Sep-2024 02:14 PM,,BOQ Comparative Chart,Gulmaki Dalawzi,Internal,Details attached below,Deviprasad Mohanty,08-Oct-2024 04:57 PM,finsummary_504881.pdf (580.78 KB),Municipal Bodies||Bhadrak Municipality,2024_ORULB_104255_1,BM-BDK-12-2023-24,"Construction of Wealth Centre (MCC and MRF) over plot No.1373, Khata No.523, Mz.Randia near Ward No.9 of Bhadrak Municipality",Technical,ok,Prahallad Mohapatra,02-Sep-2024 12:51 PM,,Gulmaki Dalawzi,Internal,Details attached below,Deviprasad Mohanty,26-Sep-2024 06:34 PM,30-Sep-2024 10:30 AM,techsummary_504881.pdf (1169.64 KB),AOC
,,,,,,,,,,,,,,,,.pdf,"undertakings, list of machineries and special conditions if any specifically mentioned by the OIT",,,,,,,,,,,,,,,,2.0,ICICI NEFT/RTGS,,,,,,,,,,,,,,,,,,,,,,,,,,AOC,,,,,,,,,,,,,2,2538728,JYOTIRMAYA SWAIN,31-Aug-2024 03:57 PM,Rejected-AOC,Quoted second lowest,25-Nov-2024 06:10 PM,,,,,,,,,,,,,,,,,,,,,,,,,,,,,AOC
,,,,,,,,,,,,,,2.0,Finance,.xls,Bill of Quantity,,,,,,,,,,,,,,,,,,,,,,,,,,,,,,,,,,,,,,,,,,,AOC,,,,,,,,,,,,,3,2538193,Kailash Chandra Jena,31-Aug-2024 04:53 PM,Rejected-Technical,Disqualified for failure to submit the required average annual financial turn over for the last three years i.e 40 percentage,26-Sep-2024 06:34 PM,,,,,,,,,,,,,,,,,,,,,,,,,,,,,AOC
,,,,,,,,,,,,,,,,,,,,,,,,,,,,,,,,,,,,,,,,,,,,,,,,,,,,,,,,,,,,AOC,,,,,,,,,,,,,4,2538586,Laxmidhar Mallik,31-Aug-2024 02:31 PM,Rejected-Technical,Disqualified for failure to submit the average annual financial turn over for the last three year,26-Sep-2024 06:34 PM,,,,,,,,,,,,,,,,,,,,,,,,,,,,,AOC
,,,,,,,,,,,,,,,,,,,,,,,,,,,,,,,,,,,,,,,,,,,,,,,,,,,,,,,,,,,,AOC,,,,,,,,,,,,,5,2538179,Nihar Ranjan Mohapatra,30-Aug-2024 04:11 PM,Accepted-AOC,Quoted first lowest,25-Nov-2024 06:10 PM,,,,,,,,,,,,,,,,,,,,,,,,,,,,,AOC
,,,,,,,,,,,,,,,,,,,,,,,,,,,,,,,,,,,,,,,,,,,,,,,,,,,,,,,,,,,,AOC,,,,,,,,,,,,,6,2538293,OMKAR PRASAD NAYAK,31-Aug-2024 04:45 PM,Rejected-AOC,Quoted third lowest,25-Nov-2024 06:10 PM,,,,,,,,,,,,,,,,,,,,,,,,,,,,,AOC
