Organisation Chain,Tender Reference Number,Tender ID,Withdrawal Allowed,Tender Type,Form of contract,Tender Category,No. of Covers,General Technical Evaluation Allowed,ItemWise Technical Evaluation Allowed,Payment Mode,Is Multi Currency Allowed For BOQ,Is Multi Currency Allowed For Fee,Allow Two Stage Bidding,Cover No,Cover,Document Type,Description,Publish Date,Bid Opening Date,Document Download / Sale Start Date,Document Download / Sale End Date,Clarification Start Date,Clarification End Date,Bid Submission Start Date,Bid Submission End Date,EMD Amount in ₹,EMD Exemption Allowed,EMD Fee Type,EMD Percentage,EMD Payable To,EMD Payable At,S.No,Bank Name,Tender Fee in ₹,VAT Charges in ₹,Fee Payable To,Fee Payable At,Tender Fee Exemption Allowed,Name,Address,Title,Work Description,Pre Qualification Details,Independent External Monitor/Remarks,Tender Value in ₹,Product Category,Sub category,Contract Type,Bid Validity(Days),Period Of Work(Days),Location,Pincode,Pre Bid Meeting Place,Pre Bid Meeting Address,Pre Bid Meeting Date,Bid Opening Place,Should Allow NDA Tender,Allow Preferential Bidder,Tender Stage,Contract Date :,Contract Value :,Work Completion Period in days :,Updated By :,Updated on :,AOC document :,AOC Description :,S.No,Bid Number,Bidder Name,Awarded Currency,Awarded Value,S.No.1,Bid Number.1,Bidder Name.1,Submitted Date,Status,Remarks,Status Updated On,Type :,Summary :,Updated By :.1,Updated On :,Document :,BOQ Comparative Chart :,Committee Chairperson/Co-ordinator Name :,Committee Chairperson/Co-ordinator Type :,Committee Members :,Updated By :.2,Updated on :.1,Document :.1,Organisation Chain :,Tender ID :,Tender Ref No :,Tender Title :,Committee Chairperson/Co-ordinator Name :.1,Committee Chairperson/Co-ordinator Type :.1,Committee Members :.1,Updated By :.3,Updated On :.1,Document :.2,Tender Stage
EIC-CIVIL||SERNB-CIRCLE-PHULBANI||EERNB DIVN BALIGUDA,SE-BLG-05/2024-25,2024_EICCL_104908_3,Yes,Open Tender,Percentage,Works,1.0,No,No,Online,No,No,No,1.0,Fee/PreQual/Technical/Finance,.pdf,"GSTIN, AFFIDAVIT, PAN, LICENCE AND OTHER DOCUMENTS AS PER DTCN",17-Sep-2024 10:00 AM,24-Sep-2024 11:30 AM,17-Sep-2024 10:00 AM,23-Sep-2024 05:00 PM,NA ,NA ,17-Sep-2024 10:00 AM,23-Sep-2024 05:00 PM,"21,000",Yes,fixed,,Nil,Nil,1.0,ICICI BANK,"6,000",0.0,Nil,Nil,No,SUPERITENDING ENGINEER BALLIGUDA R AND B DIVISION,SUPERITENDING ENGINEER BALLIGUDA R AND B DIVISION,"M/R to B.M Road (SH-5) Such as Pot hole repair with BUSG, SDBC from 93.00km to 100.00km in stretches for the year 2024-25.","M/R to B.M Road (SH-5) Such as Pot hole repair with BUSG, SDBC from 93.00km to 100.00km in stretches for the year 2024-25.",Please refer Tender documents. ,NA ,,Civil Works - Roads,NA ,Tender,90.0,15.0,SUPERITENDING ENGINEER BALLIGUDA R AND B DIVISION,762103.0,NA ,NA ,NA ,SUPERITENDING ENGINEER BALLIGUDA R AND B DIVISION,No ,No,AOC,11-Nov-2024,"INR 1,784,521",15.0,Santosh Kumar Patro,11-Nov-2024 07:29 PM,agrt0503.pdf (590.00 KB),The work awarded to Sri. Shashi Bhusan Praharaj which is being 14.99% less then the estimated cost.,1.0,2556842.0,SHASHI BHUSAN PRAHARAJ,INR,"1,784,521",1,2553685,BINAYAK MAHAPATRA,20-Sep-2024 08:37 PM,Rejected-Finance,Not Winner in Lottry System,11-Nov-2024 07:25 PM,Finance,opening summary,Santosh Kumar Patro,11-Nov-2024 07:15 PM,finance_506815.pdf,BOQ Comparative Chart,DAO,Internal,DAO,Santosh Kumar Patro,11-Nov-2024 07:25 PM,finsummary_506815.pdf (258.10 KB),EIC-CIVIL||SERNB-CIRCLE-PHULBANI||EERNB DIVN BALIGUDA,2024_EICCL_104908_3,SE-BLG-05/2024-25,"M/R to B.M Road (SH-5) Such as Pot hole repair with BUSG, SDBC from 93.00km to 100.00km in stretches for the year 2024-25.",DAO,Internal,DAO,Santosh Kumar Patro,11-Nov-2024 07:18 PM,techsummary_506815.pdf (260.54 KB),AOC
,,,,,,,,,,,,,,,,.pdf,MEMORANDUM,,,,,,,,,,,,,,,2.0,ICICI NEFT/RTGS,,,,,,,,,,,,,,,,,,,,,,,,,,AOC,,,,,,,,,,,,,2,2555873,JAGANNATH PATRO,23-Sep-2024 01:22 PM,Rejected-Finance,Highest Quoted Rate,11-Nov-2024 07:25 PM,,,,,,,,,,,,,,,,,,,,,,,AOC
,,,,,,,,,,,,,,,,.xls,BOQ,,,,,,,,,,,,,,,,,,,,,,,,,,,,,,,,,,,,,,,,,,AOC,,,,,,,,,,,,,3,2553694,KUMUDINI MAHAPATRA,20-Sep-2024 08:54 PM,Rejected-Finance,Not Winner in Lottry System,11-Nov-2024 07:25 PM,,,,,,,,,,,,,,,,,,,,,,,AOC
,,,,,,,,,,,,,,,,,,,,,,,,,,,,,,,,,,,,,,,,,,,,,,,,,,,,,,,,,,,AOC,,,,,,,,,,,,,4,2555288,M/S SANJUKTA SAHU,22-Sep-2024 02:00 PM,Rejected-Finance,Not Winner in Lottry System,11-Nov-2024 07:25 PM,,,,,,,,,,,,,,,,,,,,,,,AOC
,,,,,,,,,,,,,,,,,,,,,,,,,,,,,,,,,,,,,,,,,,,,,,,,,,,,,,,,,,,AOC,,,,,,,,,,,,,5,2552806,PRANAD NAYAK,22-Sep-2024 11:49 AM,Rejected-Finance,Highest Quoted Rate,11-Nov-2024 07:25 PM,,,,,,,,,,,,,,,,,,,,,,,AOC
,,,,,,,,,,,,,,,,,,,,,,,,,,,,,,,,,,,,,,,,,,,,,,,,,,,,,,,,,,,AOC,,,,,,,,,,,,,6,2557380,RAJAN CHOUDHURY,23-Sep-2024 02:59 PM,Rejected-Finance,Not Winner in Lottry System,11-Nov-2024 07:25 PM,,,,,,,,,,,,,,,,,,,,,,,AOC
,,,,,,,,,,,,,,,,,,,,,,,,,,,,,,,,,,,,,,,,,,,,,,,,,,,,,,,,,,,AOC,,,,,,,,,,,,,7,2556842,SHASHI BHUSAN PRAHARAJ,23-Sep-2024 02:43 PM,Accepted-AOC,The work awarded to Sri. Shashi Bhusan Praharaj.,11-Nov-2024 07:29 PM,,,,,,,,,,,,,,,,,,,,,,,AOC
