Organisation Chain,Tender Reference Number,Tender ID,Withdrawal Allowed,Tender Type,Form of contract,Tender Category,No. of Covers,General Technical Evaluation Allowed,ItemWise Technical Evaluation Allowed,Payment Mode,Is Multi Currency Allowed For BOQ,Is Multi Currency Allowed For Fee,Allow Two Stage Bidding,Cover No,Cover,Document Type,Description,Publish Date,Bid Opening Date,Document Download / Sale Start Date,Document Download / Sale End Date,Clarification Start Date,Clarification End Date,Bid Submission Start Date,Bid Submission End Date,Financial Bid Opening Date,EMD Amount in ₹,EMD Exemption Allowed,EMD Fee Type,EMD Percentage,EMD Payable To,EMD Payable At,S.No,Bank Name,Tender Fee in ₹,VAT Charges in ₹,Fee Payable To,Fee Payable At,Tender Fee Exemption Allowed,Name,Address,Title,Work Description,Pre Qualification Details,Independent External Monitor/Remarks,Tender Value in ₹,Product Category,Sub category,Contract Type,Bid Validity(Days),Period Of Work(Days),Location,Pincode,Pre Bid Meeting Place,Pre Bid Meeting Address,Pre Bid Meeting Date,Bid Opening Place,Should Allow NDA Tender,Allow Preferential Bidder,Tender Stage,Contract Date :,Contract Value :,Work Completion Period in days :,Updated By :,Updated on :,AOC document :,AOC Description :,S.No,Bid Number,Bidder Name,Awarded Currency,Awarded Value,S.No.1,Bid Number.1,Bidder Name.1,Submitted Date,Status,Remarks,Status Updated On,Type :,Summary :,Updated By :.1,Updated On :,Document :,BOQ Comparative Chart :,Committee Chairperson/Co-ordinator Name :,Committee Chairperson/Co-ordinator Type :,Committee Members :,Updated By :.2,Updated on :.1,Document :.1,Organisation Chain :,Tender ID :,Tender Ref No :,Tender Title :,Type :.1,Summary :.1,Updated By :.3,Updated On :.1,Document :.2,Committee Chairperson/Co-ordinator Name :.1,Committee Chairperson/Co-ordinator Type :.1,Committee Members :.1,Updated By :.4,Updated On :.2,Financial Bid Opening Date:,Document :.3,S.No.2,Revocation Title,Revocation Description,Published Date,Document Name,Document Size(in KB),Revocated To,Tender Stage
CE RW I||RWCIRCLE-SAMBALPUR,Road Tender Online RWCSBP-69/2023-24,2024_CERWI_102286_1,Yes,Open Tender,Percentage,Works,2.0,No,No,Online,No,No,No,1.0,Fee/PreQual/Technical,.pdf,"Online copy of Tender cost, EMD, GSTIN, PAN, RC, Affidavit and other document as per DTCN",06-Mar-2024 06:00 PM,19-Mar-2024 11:00 AM,06-Mar-2024 06:00 PM,18-Mar-2024 05:00 PM,06-Mar-2024 06:00 PM ,15-Mar-2024 05:00 PM ,06-Mar-2024 06:00 PM,18-Mar-2024 05:00 PM,05-Sep-2024 10:00 AM,"9,58,805",Yes,percentage,1.0%,Nil,Nil,1.0,ICICI BANK,"10,000",0.0,Nil,Nil,No,CCE RW CIRCLE SAMBALPUR,CCE RW CIRCLE SAMBALPUR,"Construction of Arda RD road to Litipali via Deheripali, Brahmanipali road in the district of Bargarh under MMSY Transferred Road Improvement Programme (MMSY-TRIP) for the year 2023-24","Construction of Arda RD road to Litipali via Deheripali, Brahmanipali road in the district of Bargarh under MMSY Transferred Road Improvement Programme (MMSY-TRIP) for the year 2023-24",Please refer Tender documents. ,NA ,"9,58,80,539",Civil Works - Roads,NA ,Tender,90.0,450.0,Padampur,768036.0,NA ,NA ,NA ,CCE RW CIRCLE SAMBALPUR,No ,No,AOC,21-Nov-2024,"INR 100,664,978.106",450.0,Mousumee Patel,21-Nov-2024 11:22 AM,TECH.pdf (27.00 KB),AOC,1.0,2479603.0,MOTIRANJAN SAHOO,INR,"100,664,978.106",1,2479474,Jayanta Barik,17-Mar-2024 09:50 PM,Rejected-Technical,Insufficient experience in bridge work as per clause No.9 vi of eligibility criteria of DTCN,02-Sep-2024 02:03 PM,Finance,2 NOS BIDDER,Mousumee Patel,05-Sep-2024 11:38 AM,finance_498497.pdf,BOQ Comparative Chart,SUSHIL CHANDRA SAMANTARAY,Internal,EE ESTIMATOR DAO,Mousumee Patel,21-Nov-2024 11:19 AM,finsummary_498497.pdf (27.16 KB),CE RW I||RWCIRCLE-SAMBALPUR,2024_CERWI_102286_1,Road Tender Online RWCSBP-69/2023-24,"Construction of Arda RD road to Litipali via Deheripali, Brahmanipali road in the district of Bargarh under MMSY Transferred Road Improvement Programme (MMSY-TRIP) for the year 2023-24",Technical,5 NOS BIDDER,Mousumee Patel,02-Sep-2024 01:59 PM,technical_498497.pdf,SUSHIL CHANDRA SAMANTARAY,Internal,EE ESTIMATOR DAO,Mousumee Patel,02-Sep-2024 02:03 PM,05-Sep-2024 10:00 AM,techsummary_498497.pdf (1503.86 KB),1.0,Tender Revocation,Tender Revocation,02-Sep-2024 01:50 PM,2861.pdf ,1486.91,Technical Opening,AOC
,,,,,,,,,,,,,,2.0,Finance,.xls,BILL OF QUANTITIES,,,,,,,,,,,,,,,,2.0,ICICI NEFT/RTGS,,,,,,,,,,,,,,,,,,,,,,,,,,AOC,,,,,,,,,,,,,2,2479603,MOTIRANJAN SAHOO,18-Mar-2024 02:59 PM,Accepted-AOC,AOC,21-Nov-2024 11:22 AM,,,,,,,,,,,,,,,,,,,,,,,,,,,,,,,,,,,,AOC
,,,,,,,,,,,,,,,,,,,,,,,,,,,,,,,,,,,,,,,,,,,,,,,,,,,,,,,,,,,,AOC,,,,,,,,,,,,,3,2479683,M/S L.N. CONSTRUCTION,18-Mar-2024 11:51 AM,Rejected-Technical,Bid rejected due to non extension of bid validity by bidder,02-Sep-2024 02:03 PM,,,,,,,,,,,,,,,,,,,,,,,,,,,,,,,,,,,,AOC
,,,,,,,,,,,,,,,,,,,,,,,,,,,,,,,,,,,,,,,,,,,,,,,,,,,,,,,,,,,,AOC,,,,,,,,,,,,,4,2479783,RUPESH CHANDRA PRADHAN,18-Mar-2024 01:08 PM,Rejected-Finance,L2 BIDDER,21-Nov-2024 11:19 AM,,,,,,,,,,,,,,,,,,,,,,,,,,,,,,,,,,,,AOC
,,,,,,,,,,,,,,,,,,,,,,,,,,,,,,,,,,,,,,,,,,,,,,,,,,,,,,,,,,,,AOC,,,,,,,,,,,,,5,2479769,sarasi pati,18-Mar-2024 01:05 PM,Rejected-Technical,Insufficient experience in bridge work as per clause No.9 vi of eligibility criteria of DTCN,02-Sep-2024 02:03 PM,,,,,,,,,,,,,,,,,,,,,,,,,,,,,,,,,,,,AOC
