Organisation Chain,Tender Reference Number,Tender ID,Withdrawal Allowed,Tender Type,Form of contract,Tender Category,No. of Covers,General Technical Evaluation Allowed,ItemWise Technical Evaluation Allowed,Payment Mode,Is Multi Currency Allowed For BOQ,Is Multi Currency Allowed For Fee,Allow Two Stage Bidding,Cover No,Cover,Document Type,Description,Publish Date,Bid Opening Date,Document Download / Sale Start Date,Document Download / Sale End Date,Clarification Start Date,Clarification End Date,Bid Submission Start Date,Bid Submission End Date,EMD Amount in ₹,EMD Exemption Allowed,EMD Fee Type,EMD Percentage,EMD Payable To,EMD Payable At,S.No,Bank Name,Tender Fee in ₹,VAT Charges in ₹,Fee Payable To,Fee Payable At,Tender Fee Exemption Allowed,Name,Address,Title,Work Description,Pre Qualification Details,Independent External Monitor/Remarks,Tender Value in ₹,Product Category,Sub category,Contract Type,Bid Validity(Days),Period Of Work(Days),Location,Pincode,Pre Bid Meeting Place,Pre Bid Meeting Address,Pre Bid Meeting Date,Bid Opening Place,Should Allow NDA Tender,Allow Preferential Bidder,Tender Stage,Contract Date :,Contract Value :,Work Completion Period in days :,Updated By :,Updated on :,AOC document :,S.No,Bid Number,Bidder Name,Awarded Currency,Awarded Value,S.No.1,Bid Number.1,Bidder Name.1,Submitted Date,Status,Remarks,Status Updated On,Type :,Summary :,Updated By :.1,Updated On :,Document :,BOQ Comparative Chart :,Committee Chairperson/Co-ordinator Name :,Committee Chairperson/Co-ordinator Type :,Committee Members :,Updated By :.2,Updated on :.1,Document :.1,Organisation Chain :,Tender ID :,Tender Ref No :,Tender Title :,Committee Chairperson/Co-ordinator Name :.1,Committee Chairperson/Co-ordinator Type :.1,Committee Members :.1,Updated By :.3,Updated On :.1,Document :.2,Tender Stage
"CE,Minor Irrigation,BBSR||Angul Minor Irrigation Circle Dhenkanal||MI Division Deogarh","SE,MID,DGR /01 / 2024-25",2024_CEMIB_105566_15,Yes,Open Tender,Item Rate,Works,1.0,No,No,Online,No,No,No,1.0,Fee/PreQual/Technical/Finance,.pdf,"AFFIDAVIT, REGISTRATION CERTIFICATE, PANCARD, GSTIN AND OTHERS DOCUMENTS AS PER DTCN",14-Oct-2024 10:00 AM,29-Oct-2024 11:00 AM,14-Oct-2024 10:00 AM,28-Oct-2024 05:00 PM,14-Oct-2024 10:00 AM ,28-Oct-2024 05:00 PM ,14-Oct-2024 10:00 AM,28-Oct-2024 05:00 PM,"6,700",Yes,fixed,,Nil,Nil,1.0,ICICI BANK,"4,000",0.0,Nil,Nil,No,"S.E., M.I. Division, Deogarh","O/O the S.E., M.I. Division, Deogarh",Improvement to Mundamal CD in Village Mundamal of Barkote Block under IMP to CD 2024-25,Improvement to Mundamal CD in Village Mundamal of Barkote Block under IMP to CD 2024-25,D AND C CLASS CONTRACTOR ,NA ,"6,66,834",Civil Works - Others,Imp to CD ,Tender,90.0,30.0,DEOGARH,768119.0,NA ,NA ,NA ,"O/O the S.E., M.I. Division, Deogarh",No ,No,AOC,20-Nov-2024,"INR 566,875.84",30.0,Rashmi Rekha Chattar,20-Nov-2024 04:40 PM,15munda.pdf (499.00 KB),1.0,2596155.0,RANJIT KUMAR PRADHAN,INR,"566,875.84",1,2593231,DUSMANTA PRADHAN,25-Oct-2024 02:19 PM,Rejected-AOC,NOT QUALIFIED IN LOTTERY SYSTEM,20-Nov-2024 04:40 PM,Finance,5 nos bidders,Rashmi Rekha Chattar,19-Nov-2024 11:07 AM,finance_509266.pdf,BOQ Comparative Chart,"S.E., M.I. Division, Deogarh",Internal,,Rashmi Rekha Chattar,20-Nov-2024 12:28 PM,finsummary_509266.pdf (240.60 KB),"CE,Minor Irrigation,BBSR||Angul Minor Irrigation Circle Dhenkanal||MI Division Deogarh",2024_CEMIB_105566_15,"SE,MID,DGR /01 / 2024-25",Improvement to Mundamal CD in Village Mundamal of Barkote Block under IMP to CD 2024-25,"S.E., M.I. Division, Deogarh",Internal,,Rashmi Rekha Chattar,19-Nov-2024 03:48 PM,techsummary_509266.pdf (240.60 KB),AOC
,,,,,,,,,,,,,,,,.xls,BILL OF QUANTITY,,,,,,,,,,,,,,,2.0,ICICI NEFT/RTGS,,,,,,,,,,,,,,,,,,,,,,,,,,AOC,,,,,,,,,,,,2,2596513,LITU NAYAK,28-Oct-2024 03:44 PM,Rejected-AOC,NOT QUALIFIED IN LOTTERY SYSTEM,20-Nov-2024 04:40 PM,,,,,,,,,,,,,,,,,,,,,,,AOC
,,,,,,,,,,,,,,,,,,,,,,,,,,,,,,,,,,,,,,,,,,,,,,,,,,,,,,,,,,,AOC,,,,,,,,,,,,3,2587469,Lokanath sahu,21-Oct-2024 04:09 PM,Rejected-AOC,NOT QUALIFIED IN LOTTERY SYSTEM,20-Nov-2024 04:40 PM,,,,,,,,,,,,,,,,,,,,,,,AOC
,,,,,,,,,,,,,,,,,,,,,,,,,,,,,,,,,,,,,,,,,,,,,,,,,,,,,,,,,,,AOC,,,,,,,,,,,,4,2587785,Omprakash Pradhan,27-Oct-2024 06:32 PM,Rejected-AOC,NOT QUALIFIED IN LOTTERY SYSTEM,20-Nov-2024 04:40 PM,,,,,,,,,,,,,,,,,,,,,,,AOC
,,,,,,,,,,,,,,,,,,,,,,,,,,,,,,,,,,,,,,,,,,,,,,,,,,,,,,,,,,,AOC,,,,,,,,,,,,5,2596155,RANJIT KUMAR PRADHAN,28-Oct-2024 01:30 PM,Accepted-AOC,QUALIFIED IN LOTTERY SYSTEM,20-Nov-2024 04:40 PM,,,,,,,,,,,,,,,,,,,,,,,AOC
