Organisation Chain,Tender Reference Number,Tender ID,Withdrawal Allowed,Tender Type,Form of contract,Tender Category,No. of Covers,General Technical Evaluation Allowed,ItemWise Technical Evaluation Allowed,Payment Mode,Is Multi Currency Allowed For BOQ,Is Multi Currency Allowed For Fee,Allow Two Stage Bidding,Cover No,Cover,Document Type,Description,Publish Date,Bid Opening Date,Document Download / Sale Start Date,Document Download / Sale End Date,Clarification Start Date,Clarification End Date,Bid Submission Start Date,Bid Submission End Date,Financial Bid Opening Date,EMD Amount in ₹,EMD Exemption Allowed,EMD Fee Type,EMD Percentage,EMD Payable To,EMD Payable At,S.No,Bank Name,Tender Fee in ₹,VAT Charges in ₹,Fee Payable To,Fee Payable At,Tender Fee Exemption Allowed,Name,Address,Title,Work Description,Pre Qualification Details,Independent External Monitor/Remarks,Tender Value in ₹,Product Category,Sub category,Contract Type,Bid Validity(Days),Period Of Work(Days),Location,Pincode,Pre Bid Meeting Place,Pre Bid Meeting Address,Pre Bid Meeting Date,Bid Opening Place,Should Allow NDA Tender,Allow Preferential Bidder,Tender Stage,Contract Date :,Contract Value :,Work Completion Period in days :,Updated By :,Updated on :,AOC document :,AOC Description :,S.No,Bid Number,Bidder Name,Awarded Currency,Awarded Value,S.No.1,Bid Number.1,Bidder Name.1,Submitted Date,Status,Remarks,Status Updated On,Type :,Summary :,Updated By :.1,Updated On :,Document :,BOQ Comparative Chart :,Committee Chairperson/Co-ordinator Name :,Committee Chairperson/Co-ordinator Type :,Committee Members :,Updated By :.2,Updated on :.1,Document :.1,Organisation Chain :,Tender ID :,Tender Ref No :,Tender Title :,Type :.1,Summary :.1,Updated By :.3,Updated On :.1,Document :.2,Committee Chairperson/Co-ordinator Name :.1,Committee Chairperson/Co-ordinator Type :.1,Committee Members :.1,Updated By :.4,Updated On :.2,Financial Bid Opening Date:,Document :.3,Tender Stage
CE RW I||RWCIRCLE-BHUBANESWAR,Tender Online C.C-09 of 2024,2024_CERWI_102048_1,Yes,National Competitive Bid,Percentage,Works,2.0,No,No,Online,No,No,No,1.0,Fee/PreQual/Technical,.pdf,"Tender Paper Cost, EMD, GSTIN, PAN, Registration Certificate",23-Mar-2024 09:00 AM,06-Apr-2024 11:00 AM,23-Mar-2024 09:00 AM,05-Apr-2024 05:00 PM,NA ,NA ,23-Mar-2024 09:00 AM,05-Apr-2024 05:00 PM,18-Jun-2024 05:00 PM,"2,08,182",Yes,percentage,1.0%,Nil,Nil,1.0,ICICI BANK,"10,000",0.0,Nil,Nil,No,Chief Construction Engineer,"O/o ChiefConstructionEngineer,CentralRWCircle,BBSR",Construction of Multipurpose Hall 1) Pipili NAC (Bhabanipur Mouza) (300) in the dist. of Puri under Package No.MPH-OD-PUR-04,Construction of Multipurpose Hall 1) Pipili NAC (Bhabanipur Mouza) (300) in the dist. of Puri under Package No.MPH-OD-PUR-04,Please refer Tender documents. ,NA ,"2,08,18,160",Civil Works - Roads,NA ,Tender,90.0,180.0,Puri,752001.0,NA ,NA ,NA ,"O/o ChiefConstructionEngineer,CentralRWCircle,BBSR",No ,No,AOC,05-Nov-2024,"INR 18,463,626",180.0,Priyadarshini Dalai,05-Nov-2024 12:41 PM,BhabanipurAgmtDetails.PDF (1726.00 KB),"Work order letter No.7759 dtd.18.10.2024 and Agmt No.09 P1 of 2024-25 dtd.18.10.2024 of Superintending Engineer, Rural Works Division, Puri",1.0,2490069.0,OM SAMANTARAY,INR,"18,463,626",1,2488893,BHAJAMAN SAHOO,31-Mar-2024 07:14 AM,Rejected-Finance,Other than L1 and L2,05-Nov-2024 12:31 PM,Finance,7 nos bidder qualified in the tender,Priyadarshini Dalai,18-Jun-2024 06:02 PM,,BOQ Comparative Chart,"Chief Engineer CentralRWCircle,BBSR",Internal,SuperintendingEngineerRWDivision Nimapara SrDAORWDivision Puri PAtoChiefConstructionEngineerCentralRuralWorksCircleBBSR,Priyadarshini Dalai,05-Nov-2024 12:31 PM,finsummary_497435.pdf (112.48 KB),CE RW I||RWCIRCLE-BHUBANESWAR,2024_CERWI_102048_1,Tender Online C.C-09 of 2024,Construction of Multipurpose Hall 1) Pipili NAC (Bhabanipur Mouza) (300) in the dist. of Puri under Package No.MPH-OD-PUR-04,Technical,8 nos bidder participated in the tender,Priyadarshini Dalai,06-Apr-2024 12:33 PM,,"Chief Engineer CentralRWCircle,BBSR",Internal,SuperintendingEngineerRWDivision Nimapara SrDAORWDivision Puri PAtoChiefConstructionEngineerCentralRuralWorksCircleBBSR,Priyadarshini Dalai,11-Jun-2024 12:18 PM,18-Jun-2024 05:00 PM,techsummary_497435.pdf (361.52 KB),AOC
,,,,,,,,,,,,,,,,.pdf,"Work in Hand, Machineries, Affidavit of Correctness Certificate",,,,,,,,,,,,,,,,2.0,ICICI NEFT/RTGS,,,,,,,,,,,,,,,,,,,,,,,,,,AOC,,,,,,,,,,,,,2,2488975,MAHENDRA PRASAD BEHERA,31-Mar-2024 05:35 PM,Rejected-Finance,Other than L1,05-Nov-2024 12:31 PM,,,,,,,,,,,,,,,,,,,,,,,,,,,,,AOC
,,,,,,,,,,,,,,,,.pdf,"No Relationship Certificate, ATO, Work Experience and required documents as per DTCN",,,,,,,,,,,,,,,,,,,,,,,,,,,,,,,,,,,,,,,,,,,AOC,,,,,,,,,,,,,3,2490069,OM SAMANTARAY,05-Apr-2024 02:47 PM,Accepted-AOC,Accepted,05-Nov-2024 12:42 PM,,,,,,,,,,,,,,,,,,,,,,,,,,,,,AOC
,,,,,,,,,,,,,,2.0,Finance,.xls,BOQ,,,,,,,,,,,,,,,,,,,,,,,,,,,,,,,,,,,,,,,,,,,AOC,,,,,,,,,,,,,4,2489988,P ATISH PRASAD,05-Apr-2024 08:35 AM,Rejected-Technical,"As per Clause No. 1 (e) of Eligibility Criteria of ITB of the DTCN (Valid License, GSTIN and PAN of Electrical contractor not furnished)",11-Jun-2024 12:18 PM,,,,,,,,,,,,,,,,,,,,,,,,,,,,,AOC
,,,,,,,,,,,,,,,,,,,,,,,,,,,,,,,,,,,,,,,,,,,,,,,,,,,,,,,,,,,,AOC,,,,,,,,,,,,,5,2489926,PRAMESH KUMAR SWAIN,04-Apr-2024 04:28 PM,Rejected-Finance,Other than L1 and L2,05-Nov-2024 12:31 PM,,,,,,,,,,,,,,,,,,,,,,,,,,,,,AOC
,,,,,,,,,,,,,,,,,,,,,,,,,,,,,,,,,,,,,,,,,,,,,,,,,,,,,,,,,,,,AOC,,,,,,,,,,,,,6,2490061,SATYA RANJAN PRADHAN,05-Apr-2024 03:06 PM,Rejected-Finance,Other than L1 and L2,05-Nov-2024 12:31 PM,,,,,,,,,,,,,,,,,,,,,,,,,,,,,AOC
,,,,,,,,,,,,,,,,,,,,,,,,,,,,,,,,,,,,,,,,,,,,,,,,,,,,,,,,,,,,AOC,,,,,,,,,,,,,7,2490018,SUNIL KAPOOR SAHOO,05-Apr-2024 12:39 PM,Rejected-Finance,Other than L1 and L2,05-Nov-2024 12:31 PM,,,,,,,,,,,,,,,,,,,,,,,,,,,,,AOC
,,,,,,,,,,,,,,,,,,,,,,,,,,,,,,,,,,,,,,,,,,,,,,,,,,,,,,,,,,,,AOC,,,,,,,,,,,,,8,2490038,SUSANTA KUMAR NAYAK,05-Apr-2024 01:25 PM,Rejected-Finance,Other than L1 and L2,05-Nov-2024 12:31 PM,,,,,,,,,,,,,,,,,,,,,,,,,,,,,AOC
