Organisation Chain,Tender Reference Number,Tender ID,Withdrawal Allowed,Tender Type,Form of contract,Tender Category,No. of Covers,General Technical Evaluation Allowed,ItemWise Technical Evaluation Allowed,Payment Mode,Is Multi Currency Allowed For BOQ,Is Multi Currency Allowed For Fee,Allow Two Stage Bidding,Cover No,Cover,Document Type,Description,Publish Date,Bid Opening Date,Document Download / Sale Start Date,Document Download / Sale End Date,Clarification Start Date,Clarification End Date,Bid Submission Start Date,Bid Submission End Date,Financial Bid Opening Date,EMD Amount in ₹,EMD Exemption Allowed,EMD Fee Type,EMD Percentage,EMD Payable To,EMD Payable At,S.No,Bank Name,Tender Fee in ₹,VAT Charges in ₹,Fee Payable To,Fee Payable At,Tender Fee Exemption Allowed,Name,Address,Title,Work Description,Pre Qualification Details,Independent External Monitor/Remarks,Tender Value in ₹,Product Category,Sub category,Contract Type,Bid Validity(Days),Period Of Work(Days),Location,Pincode,Pre Bid Meeting Place,Pre Bid Meeting Address,Pre Bid Meeting Date,Bid Opening Place,Should Allow NDA Tender,Allow Preferential Bidder,Tender Stage,Contract Date :,Contract Value :,Work Completion Period in days :,Updated By :,Updated on :,AOC document :,S.No,Bid Number,Bidder Name,Awarded Currency,Awarded Value,S.No.1,Bid Number.1,Bidder Name.1,Submitted Date,Status,Remarks,Status Updated On,Type :,Summary :,Updated By :.1,Updated On :,Document :,BOQ Comparative Chart :,Committee Chairperson/Co-ordinator Name :,Committee Chairperson/Co-ordinator Type :,Committee Members :,Updated By :.2,Updated on :.1,Document :.1,Organisation Chain :,Tender ID :,Tender Ref No :,Tender Title :,Type :.1,Summary :.1,Updated By :.3,Updated On :.1,Document :.2,Committee Chairperson/Co-ordinator Name :.1,Committee Chairperson/Co-ordinator Type :.1,Committee Members :.1,Updated By :.4,Updated On :.2,Financial Bid Opening Date:,Document :.3,Tender Stage
CE RW I||RW-CIRCLE-SUNDARGARH,Online-RWCCESNG-32 of 2022-23,2023_CERWI_86775_3,Yes,National Competitive Bid,Percentage,Works,2.0,No,No,Online,No,No,No,1.0,Fee/PreQual/Technical,.pdf,"EMD,REGISTRATION CERTIFICATE,PAN,GSTIN,AFFIDAVITSetc.",07-Mar-2023 01:10 PM,22-Mar-2023 10:00 AM,07-Mar-2023 01:10 PM,21-Mar-2023 05:00 PM,07-Mar-2023 01:10 PM ,20-Mar-2023 05:00 PM ,07-Mar-2023 01:10 PM,21-Mar-2023 05:00 PM,20-Apr-2023 09:00 AM,"3,27,638",Yes,percentage,1.0%,Nil,Nil,1.0,ICICI BANK,"10,000",0.0,Nil,Nil,No,"C.C.E, R.W. Circle, Sundargarh","O/o the C.C.E, R.W Circle, Sundargarh",Construction of road from Balani to Badbhulata under CMRL in the districts of Sundargarh for the year 2022.23.,Construction of road from Balani to Badbhulata under CMRL in the districts of Sundargarh for the year 2022.23.,Please refer Tender documents. ,NA ,"3,27,63,797",Civil Works - Roads,NA ,Tender,90.0,270.0,Rourkela,769004.0,NA ,NA ,NA ,"O/o the C.C.E, R.W Circle, Sundargarh",No ,No,AOC,28-Nov-2024,"INR 32,763,797.19",270.0,Biswanath Sethy,28-Nov-2024 06:52 PM,6.pdf (358.00 KB),1.0,2100736.0,RAJESH KUMAR AGARWAL,INR,"27,852,503.99",1,2100553,AJAY TIWARI,20-Mar-2023 06:54 PM,Rejected-Technical,Undertaking in shape of declaration for the establishment of hotmix plant within 60km from the work site has not been furnished as required under DTCN.,13-Apr-2023 08:14 PM,Finance,2 nos of bidder only,Biswanath Sethy,20-Apr-2023 11:04 AM,finance_430653.pdf,BOQ Comparative Chart,B.Sethy,Internal,,Biswanath Sethy,28-Nov-2024 06:48 PM,finsummary_430653.pdf (21.46 KB),CE RW I||RW-CIRCLE-SUNDARGARH,2023_CERWI_86775_3,Online-RWCCESNG-32 of 2022-23,Construction of road from Balani to Badbhulata under CMRL in the districts of Sundargarh for the year 2022.23.,Technical,06 nos of valid tenderers,Biswanath Sethy,22-Mar-2023 04:25 PM,,B.Sethy,Internal,,Biswanath Sethy,13-Apr-2023 08:14 PM,20-Apr-2023 09:00 AM,techsummary_430653.pdf (249.07 KB),AOC
,,,,,,,,,,,,,,,,.pdf,"ANNUAL TURNOVER,WORK IN HAND,WORK EXPERIENCE,MACHINARIES AND OTHER DOCUMENTS AS PER DTCN.",,,,,,,,,,,,,,,,2.0,ICICI NEFT/RTGS,,,,,,,,,,,,,,,,,,,,,,,,,,AOC,,,,,,,,,,,,2,2101570,MANOJ KUMAR JAISWAL,20-Mar-2023 07:41 PM,Rejected-Technical,Undertaking in shape of declaration for the establishment of hotmix plant within 60km from the work site has not been furnished.,13-Apr-2023 08:14 PM,,,,,,,,,,,,,,,,,,,,,,,,,,,,,AOC
,,,,,,,,,,,,,,2.0,Finance,.xls,BOQ,,,,,,,,,,,,,,,,,,,,,,,,,,,,,,,,,,,,,,,,,,,AOC,,,,,,,,,,,,3,2101976,M/S GODAVARI BUILDERS,21-Mar-2023 04:34 PM,Rejected-Technical,the financial turn over furnished by the bidder is not relevant to the civil engineering works.,13-Apr-2023 08:14 PM,,,,,,,,,,,,,,,,,,,,,,,,,,,,,AOC
,,,,,,,,,,,,,,,,,,,,,,,,,,,,,,,,,,,,,,,,,,,,,,,,,,,,,,,,,,,,AOC,,,,,,,,,,,,4,2100640,M/S SUN CONSTRUCTION,20-Mar-2023 10:12 PM,Rejected-Finance,Not Qualified,28-Nov-2024 06:48 PM,,,,,,,,,,,,,,,,,,,,,,,,,,,,,AOC
,,,,,,,,,,,,,,,,,,,,,,,,,,,,,,,,,,,,,,,,,,,,,,,,,,,,,,,,,,,,AOC,,,,,,,,,,,,5,2100736,RAJESH KUMAR AGARWAL,20-Mar-2023 08:31 AM,Accepted-AOC,Successful bidder,28-Nov-2024 06:52 PM,,,,,,,,,,,,,,,,,,,,,,,,,,,,,AOC
,,,,,,,,,,,,,,,,,,,,,,,,,,,,,,,,,,,,,,,,,,,,,,,,,,,,,,,,,,,,AOC,,,,,,,,,,,,6,2101994,Suryakanta Mishra,21-Mar-2023 04:41 PM,Rejected-Technical,In adequate of financial turn over.,13-Apr-2023 08:14 PM,,,,,,,,,,,,,,,,,,,,,,,,,,,,,AOC
