Organisation Chain,Tender Reference Number,Tender ID,Withdrawal Allowed,Tender Type,Form of contract,Tender Category,No. of Covers,General Technical Evaluation Allowed,ItemWise Technical Evaluation Allowed,Payment Mode,Is Multi Currency Allowed For BOQ,Is Multi Currency Allowed For Fee,Allow Two Stage Bidding,Cover No,Cover,Document Type,Description,Publish Date,Bid Opening Date,Document Download / Sale Start Date,Document Download / Sale End Date,Clarification Start Date,Clarification End Date,Bid Submission Start Date,Bid Submission End Date,Financial Bid Opening Date,EMD Amount in ₹,EMD Exemption Allowed,EMD Fee Type,EMD Percentage,EMD Payable To,EMD Payable At,S.No,Bank Name,Tender Fee in ₹,VAT Charges in ₹,Fee Payable To,Fee Payable At,Tender Fee Exemption Allowed,Name,Address,Title,Work Description,Pre Qualification Details,Independent External Monitor/Remarks,Tender Value in ₹,Product Category,Sub category,Contract Type,Bid Validity(Days),Period Of Work(Days),Location,Pincode,Pre Bid Meeting Place,Pre Bid Meeting Address,Pre Bid Meeting Date,Bid Opening Place,Should Allow NDA Tender,Allow Preferential Bidder,Tender Stage,Contract Date :,Contract Value :,Work Completion Period in days :,Updated By :,Updated on :,AOC document :,AOC Description :,S.No,Bid Number,Bidder Name,Awarded Currency,Awarded Value,S.No.1,Bid Number.1,Bidder Name.1,Submitted Date,Status,Remarks,Status Updated On,Type :,Summary :,Updated By :.1,Updated On :,Document :,BOQ Comparative Chart :,Committee Chairperson/Co-ordinator Name :,Committee Chairperson/Co-ordinator Type :,Committee Members :,Updated By :.2,Updated on :.1,Document :.1,Organisation Chain :,Tender ID :,Tender Ref No :,Tender Title :,Type :.1,Summary :.1,Updated By :.3,Updated On :.1,Document :.2,Committee Chairperson/Co-ordinator Name :.1,Committee Chairperson/Co-ordinator Type :.1,Committee Members :.1,Updated By :.4,Updated On :.2,Financial Bid Opening Date:,Document :.3,Tender Stage
EIC-CIVIL||SERNB-CIRCLE-BERHAMPUR,"CCE, SC-(RandB)-BAM-02/2024-25",2024_EICCL_104270_1,Yes,National Competitive Bid,Percentage,Works,2.0,No,No,Online,No,No,No,1.0,Fee/PreQual/Technical,.pdf,"Proof of tender cost and EMD, PAN, GSTIN, Contract Registration Certificate, Affidavit",16-Aug-2024 10:00 AM,31-Aug-2024 11:30 AM,16-Aug-2024 10:00 AM,30-Aug-2024 05:30 PM,16-Aug-2024 10:00 AM ,29-Aug-2024 04:00 PM ,16-Aug-2024 10:00 AM,30-Aug-2024 05:30 PM,12-Sep-2024 05:00 PM,"5,36,900",Yes,fixed,,Nil,Nil,1.0,ICICI BANK,"10,000",0.0,Nil,Nil,No,Chief Construction Engineer,"Southern Circle RandB, Courtpeta, Berhampur, Ganjam, 760004","Construction of Tahasil Office building and Sub-Register Office building at Konisi, District, Ganjam",Building work (Composite Bid),Please refer Tender documents. ,NA ,"5,36,83,785",Civil Works - Buildings,NA ,Tender,90.0,330.0,"Kanisi, Ganjam",761008.0,NA ,NA ,NA ,"O/o the CCE, Southern Circle (RandB), Berhampur",No ,No,AOC,14-Nov-2024,"INR 45,636,586",330.0,P Sandhyarani,14-Nov-2024 04:02 PM,AOCKanisiTahasil1.pdf (113.00 KB),"Sarika Civcon Pvt Ltd, being L1 in transperant lottry",1.0,2529943.0,Sarika Civcon Pvt Ltd,INR,"45,636,586",1,2538205,DHRUTI CONSTRUCTION & DEVELOPMENT PVT. LTD.,30-Aug-2024 04:31 PM,Rejected-Technical,Disqualified by the TEC as per DTCN cL.7 and 112(e),11-Sep-2024 07:47 PM,Finance,Three Nos BOQ received which is under scrutiny.,P Sandhyarani,12-Sep-2024 05:26 PM,finance_504929.pdf,BOQ Comparative Chart,Chief Constructio Engineer,Internal,"PA to CCE SC RandB, Berhampur, SE and SrDAO, Ganjam RnadB Division No.I, Berhampur, AE Estr, O/o the CCE SC RandB, Berhampur",P Sandhyarani,14-Nov-2024 03:55 PM,finsummary_504929.pdf (410.78 KB),EIC-CIVIL||SERNB-CIRCLE-BERHAMPUR,2024_EICCL_104270_1,"CCE, SC-(RandB)-BAM-02/2024-25","Construction of Tahasil Office building and Sub-Register Office building at Konisi, District, Ganjam",Technical,"Six Nos bidder participated in this tender, received scan copy of documents which is under scrutiny.",P Sandhyarani,31-Aug-2024 12:12 PM,technical_504929.pdf,Chief Construction Engineer,Internal,"PA to CCE SC RnadB, Berhampur, EE and Sr.DAO, Ganjam RandB Division No.I, Berhampur and AE, Estr, O/o the CCE SC RandB, Berhampur",Durga Charan Behera,11-Sep-2024 07:47 PM,12-Sep-2024 05:00 PM,techsummary_504929.pdf (1007.90 KB),AOC
,,,,,,,,,,,,,,,,.pdf,"Proof of ownership of machineries, lease deed, MOU other documents and forms as per DTCN",,,,,,,,,,,,,,,,2.0,ICICI NEFT/RTGS,,,,,,,,,,,,,,,,,,,,,,,,,,AOC,,,,,,,,,,,,,2,2536297,K.Rabinarayan Das,27-Aug-2024 08:55 PM,Rejected-AOC,L2 Quoted 9.99 percent less,14-Nov-2024 04:02 PM,,,,,,,,,,,,,,,,,,,,,,,,,,,,,AOC
,,,,,,,,,,,,,,2.0,Finance,.xls,Bill of Quantity,,,,,,,,,,,,,,,,,,,,,,,,,,,,,,,,,,,,,,,,,,,AOC,,,,,,,,,,,,,3,2537966,M/s Manas Ranjan Sahu,30-Aug-2024 02:33 PM,Rejected-Technical,Disqualified by the TEC as per DTCN cL.7 and 112(e),11-Sep-2024 07:47 PM,,,,,,,,,,,,,,,,,,,,,,,,,,,,,AOC
,,,,,,,,,,,,,,,,,,,,,,,,,,,,,,,,,,,,,,,,,,,,,,,,,,,,,,,,,,,,AOC,,,,,,,,,,,,,4,2534335,Rabindra Kumar Sahu,23-Aug-2024 09:02 PM,Rejected-AOC,Unsuccess in lottery quoted 14.99 percent less,14-Nov-2024 04:02 PM,,,,,,,,,,,,,,,,,,,,,,,,,,,,,AOC
,,,,,,,,,,,,,,,,,,,,,,,,,,,,,,,,,,,,,,,,,,,,,,,,,,,,,,,,,,,,AOC,,,,,,,,,,,,,5,2529943,Sarika Civcon Pvt Ltd,26-Aug-2024 12:45 AM,Accepted-AOC,L1 through lottery quoted 14.99 percent less,14-Nov-2024 04:02 PM,,,,,,,,,,,,,,,,,,,,,,,,,,,,,AOC
,,,,,,,,,,,,,,,,,,,,,,,,,,,,,,,,,,,,,,,,,,,,,,,,,,,,,,,,,,,,AOC,,,,,,,,,,,,,6,2537928,Sudhansu Padhy,30-Aug-2024 03:33 PM,Rejected-Technical,Disqualified by the TEC as per DTCN Cl.112(h),11-Sep-2024 07:47 PM,,,,,,,,,,,,,,,,,,,,,,,,,,,,,AOC
