Organisation Chain,Tender Reference Number,Tender ID,Withdrawal Allowed,Tender Type,Form of contract,Tender Category,No. of Covers,General Technical Evaluation Allowed,ItemWise Technical Evaluation Allowed,Payment Mode,Is Multi Currency Allowed For BOQ,Is Multi Currency Allowed For Fee,Allow Two Stage Bidding,Cover No,Cover,Document Type,Description,Publish Date,Bid Opening Date,Document Download / Sale Start Date,Document Download / Sale End Date,Clarification Start Date,Clarification End Date,Bid Submission Start Date,Bid Submission End Date,Financial Bid Opening Date,EMD Amount in ₹,EMD Exemption Allowed,EMD Fee Type,EMD Percentage,EMD Payable To,EMD Payable At,S.No,Bank Name,Tender Fee in ₹,VAT Charges in ₹,Fee Payable To,Fee Payable At,Tender Fee Exemption Allowed,Name,Address,Title,Work Description,Pre Qualification Details,Independent External Monitor/Remarks,Tender Value in ₹,Product Category,Sub category,Contract Type,Bid Validity(Days),Period Of Work(Days),Location,Pincode,Pre Bid Meeting Place,Pre Bid Meeting Address,Pre Bid Meeting Date,Bid Opening Place,Should Allow NDA Tender,Allow Preferential Bidder,Tender Stage,Contract Date :,Contract Value :,Work Completion Period in days :,Updated By :,Updated on :,AOC document :,AOC Description :,S.No,Bid Number,Bidder Name,Awarded Currency,Awarded Value,S.No.1,Bid Number.1,Bidder Name.1,Submitted Date,Status,Remarks,Status Updated On,Type :,Summary :,Updated By :.1,Updated On :,Document :,BOQ Comparative Chart :,Committee Chairperson/Co-ordinator Name :,Committee Chairperson/Co-ordinator Type :,Committee Members :,Updated By :.2,Updated on :.1,Document :.1,Organisation Chain :,Tender ID :,Tender Ref No :,Tender Title :,Type :.1,Summary :.1,Updated By :.3,Updated On :.1,Document :.2,Committee Chairperson/Co-ordinator Name :.1,Committee Chairperson/Co-ordinator Type :.1,Committee Members :.1,Updated By :.4,Updated On :.2,Financial Bid Opening Date:,Document :.3,Tender Stage
Odisha Hydro Power Corporation Ltd||Rengali H.E. Project Rengali,RHEP/TCN/10/2023-24,2023_OHPCL_89297_1,Yes,Open Tender,Percentage,Works,2.0,No,No,Online,No,No,No,1.0,Fee/PreQual/Technical,.pdf,"PAN,GST,TENDER PAPER COST,EMD,CONTRACTOR REGISTRATION CERTIFICATE",26-May-2023 10:00 AM,07-Jun-2023 11:30 AM,26-May-2023 10:00 AM,06-Jun-2023 05:00 PM,26-May-2023 10:00 AM ,02-Jun-2023 01:00 PM ,26-May-2023 10:00 AM,06-Jun-2023 05:00 PM,28-Jun-2024 12:30 PM,"12,700",Yes,fixed,,Nil,Nil,1.0,ICICI BANK,"6,000","1,080",Nil,Nil,No,CP HEAD,"RHEP,Rengali",RHEP/TCN-10-2023-24,"Repair of cement work like repair of water tank,flooring work,courtyard boundary wall,plastering,repair of doors and windows,water supply pipe line work etc.in residential qtrs. of Electrical Colony,RHEP,Rengali",please refer tender documents ,please refer tender specifications ,,Civil Works - Others,NA ,Tender,120.0,300.0,"RHEP,Rengali Dam Site",759105.0,NA ,NA ,NA ,"Office of the CP HEAD,RHEP,Rengali",No ,No,AOC,26-Nov-2024,"INR 1,074,764",300.0,ARCHANA BEHERA,26-Nov-2024 12:25 PM,tcc44.pdf (1040.00 KB),"Work order placed on Sri Paramananda Mohanty, At/PO-Kunjam, PS-Khamar, Dist.-Angul-759118 vide this office work order No.7545 dt.01.11.2024",1.0,2155228.0,PARAMANANDA MOHANTY,INR,"1,074,764",1,2155228,PARAMANANDA MOHANTY,06-Jun-2023 11:59 AM,Accepted-AOC,Through transparent lottery system,26-Nov-2024 12:25 PM,Finance,"On due date of opening of price bids i.e. 28.06.2024 at 12.30 PM, 05 nos. of price bids were opened. From comp. statement of price bids it is seen that 05 nos. of bidders have quoted 14.99 percentage less from the estimated price.",Saroj Kumar Bohidar,28-Jun-2024 01:38 PM,finance_439120.pdf,BOQ Comparative Chart,CP HEAD,Internal,"P K PRADHAN, MD F ALI AHEMAD, A BILUNG",ARCHANA BEHERA,11-Nov-2024 12:56 PM,finsummary_439120.pdf (1452.03 KB),Odisha Hydro Power Corporation Ltd||Rengali H.E. Project Rengali,2023_OHPCL_89297_1,RHEP/TCN/10/2023-24,RHEP/TCN-10-2023-24,Technical,"On due date of opening of this tender, 05 nos. of offers were downloaded from e-procurement website and opened on the same date. All the bids are kept for further evaluation.",CHANDAN KUMAR SAHU,07-Jun-2023 12:46 PM,technical_439120.pdf,CP HEAD,Internal,"P K PRADHAN, MD F ALI AHEMAD, A BILUNG",ARCHANA BEHERA,27-Jun-2024 05:59 PM,28-Jun-2024 12:30 PM,techsummary_439120.pdf (2745.05 KB),AOC
,,,,,,,,,,,,,,,,.pdf,OTHER DOCUMENTS AS PER TENDER SPECIFICATION,,,,,,,,,,,,,,,,2.0,ICICI NEFT/RTGS,,,,,,,,,,,,,,,,,,,,,,,,,,AOC,,,,,,,,,,,,,2,2155128,SANTOSH KUMAR SATAPATHY,06-Jun-2023 08:34 AM,Rejected-AOC,Through transparent lottery system,26-Nov-2024 12:25 PM,,,,,,,,,,,,,,,,,,,,,,,,,,,,,AOC
,,,,,,,,,,,,,,2.0,Finance,.xls,PRICE BID,,,,,,,,,,,,,,,,,,,,,,,,,,,,,,,,,,,,,,,,,,,AOC,,,,,,,,,,,,,3,2153832,SUKANTA CHARAN BEHERA,05-Jun-2023 09:37 AM,Rejected-AOC,Through transparent lottery system,26-Nov-2024 12:25 PM,,,,,,,,,,,,,,,,,,,,,,,,,,,,,AOC
,,,,,,,,,,,,,,,,,,,,,,,,,,,,,,,,,,,,,,,,,,,,,,,,,,,,,,,,,,,,AOC,,,,,,,,,,,,,4,2149850,SUMATI MOHANTY,05-Jun-2023 11:12 AM,Rejected-AOC,Through transparent lottery system,26-Nov-2024 12:25 PM,,,,,,,,,,,,,,,,,,,,,,,,,,,,,AOC
,,,,,,,,,,,,,,,,,,,,,,,,,,,,,,,,,,,,,,,,,,,,,,,,,,,,,,,,,,,,AOC,,,,,,,,,,,,,5,2153795,SUNIL SAMAL,04-Jun-2023 08:49 PM,Rejected-AOC,Through transparent lottery system,26-Nov-2024 12:25 PM,,,,,,,,,,,,,,,,,,,,,,,,,,,,,AOC
