Organisation Chain,Tender Reference Number,Tender ID,Withdrawal Allowed,Tender Type,Form of contract,Tender Category,No. of Covers,General Technical Evaluation Allowed,ItemWise Technical Evaluation Allowed,Payment Mode,Is Multi Currency Allowed For BOQ,Is Multi Currency Allowed For Fee,Allow Two Stage Bidding,Cover No,Cover,Document Type,Description,Publish Date,Bid Opening Date,Document Download / Sale Start Date,Document Download / Sale End Date,Clarification Start Date,Clarification End Date,Bid Submission Start Date,Bid Submission End Date,Financial Bid Opening Date,EMD Amount in ₹,EMD Exemption Allowed,EMD Fee Type,EMD Percentage,EMD Payable To,EMD Payable At,S.No,Bank Name,Tender Fee in ₹,VAT Charges in ₹,Fee Payable To,Fee Payable At,Tender Fee Exemption Allowed,Name,Address,Title,Work Description,Pre Qualification Details,Independent External Monitor/Remarks,Tender Value in ₹,Product Category,Sub category,Contract Type,Bid Validity(Days),Period Of Work(Days),Location,Pincode,Pre Bid Meeting Place,Pre Bid Meeting Address,Pre Bid Meeting Date,Bid Opening Place,Should Allow NDA Tender,Allow Preferential Bidder,Tender Stage,Contract Date :,Contract Value :,Work Completion Period in days :,Updated By :,Updated on :,AOC document :,AOC Description :,S.No,Bid Number,Bidder Name,Awarded Currency,Awarded Value,S.No.1,Bid Number.1,Bidder Name.1,Submitted Date,Status,Remarks,Status Updated On,Type :,Summary :,Updated By :.1,Updated On :,Document :,BOQ Comparative Chart :,Committee Chairperson/Co-ordinator Name :,Committee Chairperson/Co-ordinator Type :,Committee Members :,Updated By :.2,Updated on :.1,Document :.1,Organisation Chain :,Tender ID :,Tender Ref No :,Tender Title :,Type :.1,Summary :.1,Updated By :.3,Updated On :.1,Document :.2,Committee Chairperson/Co-ordinator Name :.1,Committee Chairperson/Co-ordinator Type :.1,Committee Members :.1,Updated By :.4,Updated On :.2,Financial Bid Opening Date:,Document :.3,Tender Stage
Orissa State Police Housing and Welfare Corporation Ltd,06/OPHWC/2024-25,2024_OSPHW_105395_2,Yes,National Competitive Bid,Percentage,Works,2.0,No,No,Online,No,No,No,1.0,Fee/PreQual/Technical,.pdf,"GST, GSTR-1, PAN, Contractor Registration Certificate and Affidavit",03-Oct-2024 06:00 PM,18-Oct-2024 10:30 AM,03-Oct-2024 06:00 PM,17-Oct-2024 05:00 PM,NA ,NA ,03-Oct-2024 06:00 PM,17-Oct-2024 05:00 PM,30-Oct-2024 10:30 AM,"5,35,400",Yes,fixed,,Nil,Nil,1.0,ICICI BANK,"11,800",0.0,Nil,Nil,No,OPHWC BHUBANESWAR,OPHWC BHUBANESWAR,Constn. of Ancillary work at Automated Testing Station(ATS) at Sundergarh,Building Work,Please refer Tender documents  ,NA ,"5,35,42,622",Civil Works - Buildings,NA ,Tender,90.0,180.0,Sundergarh,751022.0,NA ,NA ,NA ,OPHWC BHUBANESWAR,No ,No,AOC,19-Nov-2024,"INR 48,193,714",180.0,Bikram Keshari Malla,19-Nov-2024 03:47 PM,wotyuri.pdf (1013.00 KB),AWARDED AS L1 TENDERER AND AWARDED ON DATE 18.11.2024,1.0,2582167.0,ASHISH AGARWAL,INR,"48,193,714",1,2582167,ASHISH AGARWAL,17-Oct-2024 04:47 PM,Accepted-AOC,QUALIFIED BIDDER,19-Nov-2024 03:47 PM,Finance,FINANCIAL BID OPEN AND COMPARATIVE GENERATED,Bikram Keshari Malla,30-Oct-2024 10:57 AM,,BOQ Comparative Chart,AS PER AS ACCEPTANCE LETTER,Internal,AS PER AS ACCEPTANCE LETTER,Bikram Keshari Malla,19-Nov-2024 03:45 PM,finsummary_508367.pdf (454.83 KB),Orissa State Police Housing and Welfare Corporation Ltd,2024_OSPHW_105395_2,06/OPHWC/2024-25,Constn. of Ancillary work at Automated Testing Station(ATS) at Sundergarh,Technical,five bidder have participated,Bikram Keshari Malla,18-Oct-2024 11:55 AM,,AS PER TC MINUTES,Internal,AS PER TC MINUTES,Mohan Kumar Ka,29-Oct-2024 07:02 PM,30-Oct-2024 10:30 AM,techsummary_508367.pdf (328.10 KB),AOC
,,,,,,,,,,,,,,,,.pdf,Other Document as per DTCN,,,,,,,,,,,,,,,,2.0,ICICI NEFT/RTGS,,,,,,,,,,,,,,,,,,,,,,,,,,AOC,,,,,,,,,,,,,2,2577584,Biswa Bihari Pattanaik,16-Oct-2024 01:26 PM,Rejected-Finance,DUE TO L3 BIDDER,19-Nov-2024 03:45 PM,,,,,,,,,,,,,,,,,,,,,,,,,,,,,AOC
,,,,,,,,,,,,,,2.0,Finance,.xls,Bill of Quantity,,,,,,,,,,,,,,,,,,,,,,,,,,,,,,,,,,,,,,,,,,,AOC,,,,,,,,,,,,,3,2581779,KT CONSTRUCTION,17-Oct-2024 02:37 PM,Rejected-Finance,DUE TO L4 BIDDER,19-Nov-2024 03:45 PM,,,,,,,,,,,,,,,,,,,,,,,,,,,,,AOC
,,,,,,,,,,,,,,,,,,,,,,,,,,,,,,,,,,,,,,,,,,,,,,,,,,,,,,,,,,,,AOC,,,,,,,,,,,,,4,2579453,Rajesh Kumar Panda,17-Oct-2024 01:41 PM,Rejected-Finance,DUE TO L2 BIDDER,19-Nov-2024 03:45 PM,,,,,,,,,,,,,,,,,,,,,,,,,,,,,AOC
,,,,,,,,,,,,,,,,,,,,,,,,,,,,,,,,,,,,,,,,,,,,,,,,,,,,,,,,,,,,AOC,,,,,,,,,,,,,5,2579177,SUSANTA KUMAR SAHOO,16-Oct-2024 12:39 PM,Rejected-Finance,DUE TO L1 BIDDER BUT LOWEST TURNOVER,19-Nov-2024 03:45 PM,,,,,,,,,,,,,,,,,,,,,,,,,,,,,AOC
