Organisation Chain,Tender Reference Number,Tender ID,Withdrawal Allowed,Tender Type,Form of contract,Tender Category,No. of Covers,General Technical Evaluation Allowed,ItemWise Technical Evaluation Allowed,Payment Mode,Is Multi Currency Allowed For BOQ,Is Multi Currency Allowed For Fee,Allow Two Stage Bidding,Cover No,Cover,Document Type,Description,Publish Date,Bid Opening Date,Document Download / Sale Start Date,Document Download / Sale End Date,Clarification Start Date,Clarification End Date,Bid Submission Start Date,Bid Submission End Date,EMD Amount in ₹,EMD Exemption Allowed,EMD Fee Type,EMD Percentage,EMD Payable To,EMD Payable At,S.No,Bank Name,Tender Fee in ₹,VAT Charges in ₹,Fee Payable To,Fee Payable At,Tender Fee Exemption Allowed,Name,Address,Title,Work Description,Pre Qualification Details,Independent External Monitor/Remarks,Tender Value in ₹,Product Category,Sub category,Contract Type,Bid Validity(Days),Period Of Work(Days),Location,Pincode,Pre Bid Meeting Place,Pre Bid Meeting Address,Pre Bid Meeting Date,Bid Opening Place,Should Allow NDA Tender,Allow Preferential Bidder,Tender Stage,Contract Date :,Contract Value :,Work Completion Period in days :,Updated By :,Updated on :,AOC document :,AOC Description :,S.No,Bid Number,Bidder Name,Awarded Currency,Awarded Value,S.No.1,Bid Number.1,Bidder Name.1,Submitted Date,Status,Remarks,Status Updated On,Type :,Summary :,Updated By :.1,Updated On :,Document :,BOQ Comparative Chart :,Committee Chairperson/Co-ordinator Name :,Committee Chairperson/Co-ordinator Type :,Committee Members :,Updated By :.2,Updated on :.1,Document :.1,Organisation Chain :,Tender ID :,Tender Ref No :,Tender Title :,Committee Chairperson/Co-ordinator Name :.1,Committee Chairperson/Co-ordinator Type :.1,Committee Members :.1,Updated By :.3,Updated On :.1,Document :.2,Tender Stage
CE RW I||RWCIRCLE-CUTTACK||RWDIVISION-CUTTACK-II,SECTC-II-06 of 2024-25 dt. 30.08.2024,2024_CERWI_104643_4,Yes,National Competitive Bid,Percentage,Works,1.0,No,No,Online,No,No,No,1.0,Fee/PreQual/Technical/Finance,.pdf,"Tender Cost, Valid GSTIN, PAN, License, Work Affidavit, Other documents as per DTCN",05-Sep-2024 03:00 PM,18-Sep-2024 11:30 AM,05-Sep-2024 03:00 PM,17-Sep-2024 04:00 PM,NA ,NA ,05-Sep-2024 03:00 PM,17-Sep-2024 04:00 PM,"40,180",Yes,percentage,1.0%,Nil,Nil,1.0,ICICI BANK,"6,000",0.0,Nil,Nil,No,"The Executive Engineer, R.W. Divn-II, Cuttack","REO Colony, Nayabazar, Cuttack-753004",Construction of Day Care Sub-Centre Cum HWC building at Santrabali under Baramba Block of Cuttack district for the year 2023-24,Construction of Day Care Sub-Centre Cum HWC building at Santrabali under Baramba Block of Cuttack district for the year 2023-24,Please refer Tender documents. ,NA ,"40,18,000",Civil Works - Buildings,NA ,Tender,90.0,180.0,Santrabali,754035.0,NA ,NA ,NA ,"O/o the Executive Engineer, R.W. Divn-II, Cuttack",No ,No,AOC,25-Nov-2024,"INR 3,416,488",180.0,Abhisek Swain,25-Nov-2024 05:07 PM,AOC-SantrabaliHWC.pdf (458.00 KB),Agreement,1.0,2548121.0,JITENDRA SAHOO,INR,"3,416,488",1,2549879,Anil Kumar Panda,17-Sep-2024 11:48 AM,Rejected-Finance,Not qualified in lottery,25-Nov-2024 04:57 PM,Finance,Bid Opening,Abhisek Swain,20-Sep-2024 01:30 PM,finance_506166.pdf,BOQ Comparative Chart,Superintending Engineer,Internal,"DAO,AEE(Est),JE(Est)",Abhisek Swain,25-Nov-2024 04:57 PM,finsummary_506166.pdf (169.06 KB),CE RW I||RWCIRCLE-CUTTACK||RWDIVISION-CUTTACK-II,2024_CERWI_104643_4,SECTC-II-06 of 2024-25 dt. 30.08.2024,Construction of Day Care Sub-Centre Cum HWC building at Santrabali under Baramba Block of Cuttack district for the year 2023-24,Superintending Engineer,Internal,"DAO,AEE(Est),JE(Est)",Abhisek Swain,25-Nov-2024 04:39 PM,techsummary_506166.pdf (169.06 KB),AOC
,,,,,,,,,,,,,,,,.xls,BOQ,,,,,,,,,,,,,,,2.0,ICICI NEFT/RTGS,,,,,,,,,,,,,,,,,,,,,,,,,,AOC,,,,,,,,,,,,,2,2548121,JITENDRA SAHOO,15-Sep-2024 01:52 PM,Accepted-AOC,AOC,25-Nov-2024 05:07 PM,,,,,,,,,,,,,,,,,,,,,,,AOC
,,,,,,,,,,,,,,,,,,,,,,,,,,,,,,,,,,,,,,,,,,,,,,,,,,,,,,,,,,,AOC,,,,,,,,,,,,,3,2548070,PARTHA SARATHI RATH,15-Sep-2024 12:57 PM,Rejected-Finance,Rejected due to L3,25-Nov-2024 04:57 PM,,,,,,,,,,,,,,,,,,,,,,,AOC
,,,,,,,,,,,,,,,,,,,,,,,,,,,,,,,,,,,,,,,,,,,,,,,,,,,,,,,,,,,AOC,,,,,,,,,,,,,4,2550563,RATIKANTA SWAIN,17-Sep-2024 03:01 PM,Rejected-Technical,License not submitted,25-Nov-2024 04:39 PM,,,,,,,,,,,,,,,,,,,,,,,AOC
,,,,,,,,,,,,,,,,,,,,,,,,,,,,,,,,,,,,,,,,,,,,,,,,,,,,,,,,,,,AOC,,,,,,,,,,,,,5,2547380,SATYABRATA BEHERA,14-Sep-2024 07:35 PM,Rejected-Finance,Rejected due to L2,25-Nov-2024 04:57 PM,,,,,,,,,,,,,,,,,,,,,,,AOC
,,,,,,,,,,,,,,,,,,,,,,,,,,,,,,,,,,,,,,,,,,,,,,,,,,,,,,,,,,,AOC,,,,,,,,,,,,,6,2550596,SITIKANTHA DASH,17-Sep-2024 03:09 PM,Rejected-Finance,Rejected due to L4,25-Nov-2024 04:57 PM,,,,,,,,,,,,,,,,,,,,,,,AOC
