Organisation Chain,Tender Reference Number,Tender ID,Withdrawal Allowed,Tender Type,Form of contract,Tender Category,No. of Covers,General Technical Evaluation Allowed,ItemWise Technical Evaluation Allowed,Payment Mode,Is Multi Currency Allowed For BOQ,Is Multi Currency Allowed For Fee,Allow Two Stage Bidding,Cover No,Cover,Document Type,Description,Publish Date,Bid Opening Date,Document Download / Sale Start Date,Document Download / Sale End Date,Clarification Start Date,Clarification End Date,Bid Submission Start Date,Bid Submission End Date,Financial Bid Opening Date,EMD Amount in ₹,EMD Exemption Allowed,EMD Fee Type,EMD Percentage,EMD Payable To,EMD Payable At,S.No,Bank Name,Tender Fee in ₹,VAT Charges in ₹,Fee Payable To,Fee Payable At,Tender Fee Exemption Allowed,Name,Address,Title,Work Description,Pre Qualification Details,Independent External Monitor/Remarks,Tender Value in ₹,Product Category,Sub category,Contract Type,Bid Validity(Days),Period Of Work(Days),Location,Pincode,Pre Bid Meeting Place,Pre Bid Meeting Address,Pre Bid Meeting Date,Bid Opening Place,Should Allow NDA Tender,Allow Preferential Bidder,Tender Stage,Contract Date :,Contract Value :,Work Completion Period in days :,Updated By :,Updated on :,AOC document :,AOC Description :,S.No,Bid Number,Bidder Name,Awarded Currency,Awarded Value,S.No.1,Bid Number.1,Bidder Name.1,Submitted Date,Status,Remarks,Status Updated On,Type :,Summary :,Updated By :.1,Updated On :,Document :,BOQ Comparative Chart :,Committee Chairperson/Co-ordinator Name :,Committee Chairperson/Co-ordinator Type :,Committee Members :,Updated By :.2,Updated on :.1,Document :.1,Organisation Chain :,Tender ID :,Tender Ref No :,Tender Title :,Type :.1,Summary :.1,Updated By :.3,Updated On :.1,Document :.2,Committee Chairperson/Co-ordinator Name :.1,Committee Chairperson/Co-ordinator Type :.1,Committee Members :.1,Updated By :.4,Updated On :.2,Financial Bid Opening Date:,Document :.3,Tender Stage
Orissa State Police Housing and Welfare Corporation Ltd,39 /OPHWC/2021-22,2022_OSPHW_75937_7,Yes,National Competitive Bid,Percentage,Works,2.0,No,No,Online,No,No,No,1.0,Fee/PreQual/Technical,.pdf,"GST, GSTR-1, PAN, Contractor Registration Certificate and Affidavit",24-Jan-2022 06:30 PM,08-Feb-2022 11:30 AM,24-Jan-2022 06:30 PM,07-Feb-2022 05:00 PM,24-Jan-2022 06:30 PM ,28-Jan-2022 05:00 PM ,24-Jan-2022 06:30 PM,07-Feb-2022 05:00 PM,18-Feb-2022 11:00 AM,0.0,No,fixed,,Nil,Nil,1.0,ICICI BANK,"11,800",0.0,Nil,Nil,No,CHIEF ENGINEER,OPHWC BHUBANESWAR,"CONSTRUCTION OF 6 NOS. F TYPE QTR. AT GANDIA F.S., DHENKANAL",Building Work,Please refer Tender documents  ,NA ,"72,14,722",Civil Works - Buildings,NA ,Tender,90.0,180.0,DHENKANAL,751022.0,NA ,NA ,NA ,OPHWC BHUBANESWAR,No ,No,AOC,08-Nov-2024,"INR 6,341,019.24",180.0,Bikram Keshari Malla,08-Nov-2024 05:09 PM,WOORFHG.pdf (386.00 KB),AWARDED AS L1 TENDERER AND AWARDED ON DATE 07.03.2022,1.0,1804086.0,PRADIP KUMAR PANI,INR,"6,341,019.24",1,1805470,CHANDAN DUTTA,05-Feb-2022 02:12 PM,Rejected-Finance,DUE TO L4 BIDDER,08-Nov-2024 05:06 PM,Finance,FINANCE BID OPENED,BIDYUT RANJAN BHOLA,18-Feb-2022 12:04 PM,,BOQ Comparative Chart,AS PER AS ACCEPTANCE LETTER,Internal,AS PER AS ACCEPTANCE LETTER,Bikram Keshari Malla,08-Nov-2024 05:06 PM,finsummary_392655.pdf (758.01 KB),Orissa State Police Housing and Welfare Corporation Ltd,2022_OSPHW_75937_7,39 /OPHWC/2021-22,"CONSTRUCTION OF 6 NOS. F TYPE QTR. AT GANDIA F.S., DHENKANAL",Technical,5 NOS OF BIDDERS PARTICIPATED,BIDYUT RANJAN BHOLA,09-Feb-2022 12:57 PM,,AS PER TC MINUTES,Internal,AS PER TC MINUTES,BIDYUT RANJAN BHOLA,17-Feb-2022 05:15 PM,18-Feb-2022 11:00 AM,techsummary_392655.pdf (108.55 KB),AOC
,,,,,,,,,,,,,,,,.pdf,Other Document as per DTCN,,,,,,,,,,,,,,,,2.0,ICICI NEFT/RTGS,,,,,,,,,,,,,,,,,,,,,,,,,,AOC,,,,,,,,,,,,,2,1805553,DULEI KISAN,06-Feb-2022 02:50 PM,Rejected-Finance,DUE TO L2 BIDDER,08-Nov-2024 05:06 PM,,,,,,,,,,,,,,,,,,,,,,,,,,,,,AOC
,,,,,,,,,,,,,,2.0,Finance,.xls,Bill of Quantity,,,,,,,,,,,,,,,,,,,,,,,,,,,,,,,,,,,,,,,,,,,AOC,,,,,,,,,,,,,3,1805058,PABITRA KUMAR ROUTRAY,02-Feb-2022 03:04 PM,Rejected-Technical,"Has not submitted 1.Adequate similar nature of work as per DTCN-CL 11 and 110(j) ,2.GSTR-1 Certificate as per DTCN Cl. No-110(c),3.M.O.U for E.I. work",17-Feb-2022 05:15 PM,,,,,,,,,,,,,,,,,,,,,,,,,,,,,AOC
,,,,,,,,,,,,,,,,,,,,,,,,,,,,,,,,,,,,,,,,,,,,,,,,,,,,,,,,,,,,AOC,,,,,,,,,,,,,4,1804086,PRADIP KUMAR PANI,31-Jan-2022 12:48 PM,Accepted-AOC,QUALIFIED BIDDER,08-Nov-2024 05:09 PM,,,,,,,,,,,,,,,,,,,,,,,,,,,,,AOC
,,,,,,,,,,,,,,,,,,,,,,,,,,,,,,,,,,,,,,,,,,,,,,,,,,,,,,,,,,,,AOC,,,,,,,,,,,,,5,1805983,PRIYARANJAN SAHOO,07-Feb-2022 04:43 PM,Rejected-Finance,DUE TO L3 BIDDER,08-Nov-2024 05:06 PM,,,,,,,,,,,,,,,,,,,,,,,,,,,,,AOC
