Organisation Chain,Tender Reference Number,Tender ID,Withdrawal Allowed,Tender Type,Form of contract,Tender Category,No. of Covers,General Technical Evaluation Allowed,ItemWise Technical Evaluation Allowed,Payment Mode,Is Multi Currency Allowed For BOQ,Is Multi Currency Allowed For Fee,Allow Two Stage Bidding,Cover No,Cover,Document Type,Description,Publish Date,Bid Opening Date,Document Download / Sale Start Date,Document Download / Sale End Date,Clarification Start Date,Clarification End Date,Bid Submission Start Date,Bid Submission End Date,EMD Amount in ₹,EMD Exemption Allowed,EMD Fee Type,EMD Percentage,EMD Payable To,EMD Payable At,S.No,Bank Name,Tender Fee in ₹,VAT Charges in ₹,Fee Payable To,Fee Payable At,Tender Fee Exemption Allowed,Name,Address,Title,Work Description,Pre Qualification Details,Independent External Monitor/Remarks,Tender Value in ₹,Product Category,Sub category,Contract Type,Bid Validity(Days),Period Of Work(Days),Location,Pincode,Pre Bid Meeting Place,Pre Bid Meeting Address,Pre Bid Meeting Date,Bid Opening Place,Should Allow NDA Tender,Allow Preferential Bidder,Tender Stage,Contract Date :,Contract Value :,Work Completion Period in days :,Updated By :,Updated on :,AOC document :,AOC Description :,S.No,Bid Number,Bidder Name,Awarded Currency,Awarded Value,S.No.1,Bid Number.1,Bidder Name.1,Submitted Date,Status,Remarks,Status Updated On,Type :,Summary :,Updated By :.1,Updated On :,Document :,BOQ Comparative Chart :,Committee Chairperson/Co-ordinator Name :,Committee Chairperson/Co-ordinator Type :,Committee Members :,Updated By :.2,Updated on :.1,Document :.1,Organisation Chain :,Tender ID :,Tender Ref No :,Tender Title :,Committee Chairperson/Co-ordinator Name :.1,Committee Chairperson/Co-ordinator Type :.1,Committee Members :.1,Updated By :.3,Updated On :.1,Document :.2,Tender Stage
EIC-CIVIL||SERNB-CIRCLE-CENTRAL||EERNB-DIVN-III-BBSR,eTCN-09 of 2024-25,2024_EICCL_104584_2,Yes,Open Tender,Percentage,Works,1.0,No,No,Online,No,No,No,1.0,Fee/PreQual/Technical/Finance,.pdf,DTCN,02-Sep-2024 06:55 PM,13-Sep-2024 11:30 AM,02-Sep-2024 06:55 PM,12-Sep-2024 05:30 PM,NA ,NA ,02-Sep-2024 06:55 PM,12-Sep-2024 05:30 PM,"17,812",Yes,fixed,,Nil,Nil,1.0,ICICI BANK,"6,000",0.0,Nil,Nil,No,O.O.S.E.BBSR RandB Divn No.3 BBSR,In front of Nirman Soudha Unit 5 Bhubaneswar Dist Khordha Odisha,"Supply, Installation Testing and Commissioning of G plus 5 for 6 passenger lift along with dismantling of old Lift in BDA Apartment at Nilakantha Nagar Bhubaneswar","Supply, Installation Testing and Commissioning of G plus 5 for 6 passenger lift along with dismantling of old Lift in BDA Apartment at Nilakantha Nagar Bhubaneswar",Pl refer DTCN ,NA ,"17,81,200",Electrical Works,Lift ,Tender,90.0,60.0,Bhubaneswar,751001.0,NA ,NA ,NA ,S.E.BBSR RandB Divn No.3,No ,No,AOC,02-Nov-2024,"INR 1,514,174",60.0,Gayatri Patel,02-Nov-2024 01:17 PM,AscensorLift.pdf (1851.00 KB),Work Order awarded,1.0,2544225.0,ASCENSOR LIFTS AND AUTOMATION PRIVATE LIMITED,INR,"1,514,174",1,2546220,AJANTA ENTERPRISES,12-Sep-2024 02:20 PM,Rejected-Finance,Disqualified through transparent lottery,02-Nov-2024 01:07 PM,Finance,Received,Gayatri Patel,13-Sep-2024 06:48 PM,,BOQ Comparative Chart,Er.Gayatri Patel S.E,Internal,SriS.K.Mishra Sr.D.A.O M.Rath A.E.Estimator,Gayatri Patel,02-Nov-2024 01:07 PM,finsummary_505982.pdf (1850.86 KB),EIC-CIVIL||SERNB-CIRCLE-CENTRAL||EERNB-DIVN-III-BBSR,2024_EICCL_104584_2,eTCN-09 of 2024-25,"Supply, Installation Testing and Commissioning of G plus 5 for 6 passenger lift along with dismantling of old Lift in BDA Apartment at Nilakantha Nagar Bhubaneswar",Er.Gayatri Patel S.E,Internal,Sri S.K.Mishra Sr.D.A.O M.Rath AE Estimator,Gayatri Patel,02-Nov-2024 01:01 PM,techsummary_505982.pdf (1850.86 KB),AOC
,,,,,,,,,,,,,,,,.xls,BOQ,,,,,,,,,,,,,,,2.0,ICICI NEFT/RTGS,,,,,,,,,,,,,,,,,,,,,,,,,,AOC,,,,,,,,,,,,,2,2544225,ASCENSOR LIFTS AND AUTOMATION PRIVATE LIMITED,11-Sep-2024 01:38 PM,Accepted-AOC,Through transparent lottery,02-Nov-2024 01:17 PM,,,,,,,,,,,,,,,,,,,,,,,AOC
,,,,,,,,,,,,,,,,,,,,,,,,,,,,,,,,,,,,,,,,,,,,,,,,,,,,,,,,,,,AOC,,,,,,,,,,,,,3,2544450,Fusion Power,11-Sep-2024 06:57 PM,Rejected-Finance,Disqualified through transparent lottery,02-Nov-2024 01:07 PM,,,,,,,,,,,,,,,,,,,,,,,AOC
,,,,,,,,,,,,,,,,,,,,,,,,,,,,,,,,,,,,,,,,,,,,,,,,,,,,,,,,,,,AOC,,,,,,,,,,,,,4,2545310,M/s. TECHNO CRAFTS,11-Sep-2024 04:09 PM,Rejected-Finance,Disqualified through transparent lottery,02-Nov-2024 01:07 PM,,,,,,,,,,,,,,,,,,,,,,,AOC
,,,,,,,,,,,,,,,,,,,,,,,,,,,,,,,,,,,,,,,,,,,,,,,,,,,,,,,,,,,AOC,,,,,,,,,,,,,5,2543994,PARADISE ENTERPRISES,10-Sep-2024 01:06 PM,Rejected-Finance,Disqualified through transparent lottery,02-Nov-2024 01:07 PM,,,,,,,,,,,,,,,,,,,,,,,AOC
,,,,,,,,,,,,,,,,,,,,,,,,,,,,,,,,,,,,,,,,,,,,,,,,,,,,,,,,,,,AOC,,,,,,,,,,,,,6,2546216,SKYTOUCH LIFTS AND ESCALATORS PRIVATE LIMITED,12-Sep-2024 02:20 PM,Rejected-Finance,Disqualified through transparent lottery,02-Nov-2024 01:07 PM,,,,,,,,,,,,,,,,,,,,,,,AOC
