Organisation Chain,Tender Reference Number,Tender ID,Withdrawal Allowed,Tender Type,Form of contract,Tender Category,No. of Covers,General Technical Evaluation Allowed,ItemWise Technical Evaluation Allowed,Payment Mode,Is Multi Currency Allowed For BOQ,Is Multi Currency Allowed For Fee,Allow Two Stage Bidding,Cover No,Cover,Document Type,Description,Publish Date,Bid Opening Date,Document Download / Sale Start Date,Document Download / Sale End Date,Clarification Start Date,Clarification End Date,Bid Submission Start Date,Bid Submission End Date,Financial Bid Opening Date,EMD Amount in ₹,EMD Exemption Allowed,EMD Fee Type,EMD Percentage,EMD Payable To,EMD Payable At,S.No,Bank Name,Tender Fee in ₹,VAT Charges in ₹,Fee Payable To,Fee Payable At,Tender Fee Exemption Allowed,Name,Address,Title,Work Description,Pre Qualification Details,Independent External Monitor/Remarks,Tender Value in ₹,Product Category,Sub category,Contract Type,Bid Validity(Days),Period Of Work(Days),Location,Pincode,Pre Bid Meeting Place,Pre Bid Meeting Address,Pre Bid Meeting Date,Bid Opening Place,Should Allow NDA Tender,Allow Preferential Bidder,Tender Stage,Contract Date :,Contract Value :,Work Completion Period in days :,Updated By :,Updated on :,AOC document :,AOC Description :,S.No,Bid Number,Bidder Name,Awarded Currency,Awarded Value,S.No.1,Bid Number.1,Bidder Name.1,Submitted Date,Status,Remarks,Status Updated On,Type :,Summary :,Updated By :.1,Updated On :,Document :,BOQ Comparative Chart :,Committee Chairperson/Co-ordinator Name :,Committee Chairperson/Co-ordinator Type :,Committee Members :,Updated By :.2,Updated on :.1,Document :.1,Organisation Chain :,Tender ID :,Tender Ref No :,Tender Title :,Type :.1,Summary :.1,Updated By :.3,Updated On :.1,Document :.2,Committee Chairperson/Co-ordinator Name :.1,Committee Chairperson/Co-ordinator Type :.1,Committee Members :.1,Updated By :.4,Updated On :.2,Financial Bid Opening Date:,Document :.3,Tender Stage
EIC-CIVIL||SERNB-CIRCLE-PHULBANI,CCE_R and B_PLB_03 of 2024_25,2024_EICCL_105083_2,Yes,Open Tender,Percentage,Works,2.0,No,No,Online,No,No,No,1.0,Fee/PreQual/Technical,.pdf,"Online Bid Cost, EMD as per clause 06 of DTCN, affidavit, RC, PAN,GST",30-Sep-2024 10:00 AM,17-Oct-2024 11:00 AM,30-Sep-2024 10:00 AM,15-Oct-2024 05:00 PM,30-Sep-2024 10:00 AM ,14-Oct-2024 05:00 PM ,30-Sep-2024 10:00 AM,15-Oct-2024 05:00 PM,14-Nov-2024 11:00 AM,"2,85,200",Yes,fixed,,Nil,Nil,1.0,ICICI BANK,"10,000",0.0,Nil,Nil,No,CCE Phulbani RandB Circle Phulbani,Office of the CCE Phulbani RandB Circle Phulbani District Kandhamal PIN 762001,Improvement to Simanbadi-Budaguda Road (ODR) from Ch-14/430Km to 15/044Km in the district of Kandhamal under State Plan for the year 2024-25,Improvement to Simanbadi-Budaguda Road (ODR) from Ch-14/430Km to 15/044Km in the district of Kandhamal under State Plan for the year 2024-25,Please Refer Tender Documents ,NA ,"2,85,19,844",Civil Works - Roads,NA ,Tender,90.0,90.0,Balliguda,762103.0,NA ,NA ,NA ,Office of the CCE Phulbani RandB Circle Phulbani,No ,No,AOC,27-Jan-2025,"INR 24,244,719",90.0,Pravat Kumar Das,27-Jan-2025 02:48 PM,75P1of2024_25_Simanbadi_Budaguda.pdf (79.00 KB),Awarded being L1 bidder,1.0,2578078.0,ASHUTOSH PANDA,INR,"24,244,719",1,2577936,AJIT MALLICK,15-Oct-2024 02:25 PM,Rejected-Technical,Work experience ie execution of similar nature of work as per clause 122 not furnished at least 1 road work costing not less than 2cr or 2nos of road work of not less than 1cr each having DLC PQC GSBandRCCwork Hence rejected asperClause122 of DTCN,08-Nov-2024 05:54 PM,Finance,All document are received and under scrutiny,Pravat Kumar Das,14-Nov-2024 01:27 PM,,BOQ Comparative Chart,CCE Phulbani RandB Circle Phulbani,Internal,CCE Phulbani RandB Circle Phulbani SE Balliguda RandB Division Balliguda DAO Balliguda RandB Division Balliguda PA to CCE Phulbani RandB Circle Phulbani,Pravat Kumar Das,27-Jan-2025 02:36 PM,finsummary_507351.pdf (115.22 KB),EIC-CIVIL||SERNB-CIRCLE-PHULBANI,2024_EICCL_105083_2,CCE_R and B_PLB_03 of 2024_25,Improvement to Simanbadi-Budaguda Road (ODR) from Ch-14/430Km to 15/044Km in the district of Kandhamal under State Plan for the year 2024-25,Technical,All document are received and under scrutiny,Pravat Kumar Das,17-Oct-2024 12:33 PM,,CCE Phulbani RandB Circle Phulbani,Internal,CCE Phulbani RandB Circle Phulbani SE Balliguda RandB Division Balliguda DAO Balliguda RandB Division Balliguda PA to CCE Phulbani RandB Circle Phulbani,Pravat Kumar Das,08-Nov-2024 05:54 PM,14-Nov-2024 11:00 AM,techsummary_507351.pdf (2881.20 KB),AOC
,,,,,,,,,,,,,,,,.pdf,"Work Experience, Machineries and other documents as per DTCN",,,,,,,,,,,,,,,,2.0,ICICI NEFT/RTGS,,,,,,,,,,,,,,,,,,,,,,,,,,AOC,,,,,,,,,,,,,2,2578078,ASHUTOSH PANDA,15-Oct-2024 04:31 PM,Accepted-AOC,Awarded being L1 bidder,27-Jan-2025 02:49 PM,,,,,,,,,,,,,,,,,,,,,,,,,,,,,AOC
,,,,,,,,,,,,,,2.0,Finance,.xls,BOQ,,,,,,,,,,,,,,,,,,,,,,,,,,,,,,,,,,,,,,,,,,,AOC,,,,,,,,,,,,,3,2577549,NARAYAN PRADHAN,15-Oct-2024 04:27 PM,Rejected-Finance,Rejected being L2 bidder,27-Jan-2025 02:36 PM,,,,,,,,,,,,,,,,,,,,,,,,,,,,,AOC
,,,,,,,,,,,,,,,,,,,,,,,,,,,,,,,,,,,,,,,,,,,,,,,,,,,,,,,,,,,,AOC,,,,,,,,,,,,,4,2574410,PURUSOTTAM BEHERA,14-Oct-2024 11:26 AM,Rejected-Finance,Rejected being L3 bidder,27-Jan-2025 02:36 PM,,,,,,,,,,,,,,,,,,,,,,,,,,,,,AOC
,,,,,,,,,,,,,,,,,,,,,,,,,,,,,,,,,,,,,,,,,,,,,,,,,,,,,,,,,,,,AOC,,,,,,,,,,,,,5,2576628,RAHUL BOSE,15-Oct-2024 10:27 AM,Rejected-Technical,Work experience ie execution of similar nature of work as per clause 122 not furnished at least 1 road work costing not less than 2cr or 2nos of road work of not less than 1cr each having DLC PQC GSBandRCCwork Hence rejected asperClause122 of DTCN,08-Nov-2024 05:54 PM,,,,,,,,,,,,,,,,,,,,,,,,,,,,,AOC
,,,,,,,,,,,,,,,,,,,,,,,,,,,,,,,,,,,,,,,,,,,,,,,,,,,,,,,,,,,,AOC,,,,,,,,,,,,,6,2577221,Sri Pradeep Kumar Nayak,15-Oct-2024 01:45 PM,Rejected-Technical,Work experience ie execution of similar nature of work as per clause 122 not furnished at least 1 road work costing not less than 2cr or 2nos of road work of not less than 1cr each having DLC PQC GSBandRCCwork Hence rejected asperClause122 of DTCN,08-Nov-2024 05:54 PM,,,,,,,,,,,,,,,,,,,,,,,,,,,,,AOC
,,,,,,,,,,,,,,,,,,,,,,,,,,,,,,,,,,,,,,,,,,,,,,,,,,,,,,,,,,,,AOC,,,,,,,,,,,,,7,2577841,Umakanta Sahu,15-Oct-2024 04:22 PM,Rejected-Technical,Work experience ie execution of similar nature of work as per clause 122 not furnished at least 1 road work costing not less than 2cr or 2nos of road work of not less than 1cr each having DLC PQC GSBandRCCwork Hence rejected asperClause122 of DTCN,08-Nov-2024 05:54 PM,,,,,,,,,,,,,,,,,,,,,,,,,,,,,AOC
