Organisation Chain,Tender Reference Number,Tender ID,Withdrawal Allowed,Tender Type,Form of contract,Tender Category,No. of Covers,General Technical Evaluation Allowed,ItemWise Technical Evaluation Allowed,Payment Mode,Is Multi Currency Allowed For BOQ,Is Multi Currency Allowed For Fee,Allow Two Stage Bidding,Cover No,Cover,Document Type,Description,Publish Date,Bid Opening Date,Document Download / Sale Start Date,Document Download / Sale End Date,Clarification Start Date,Clarification End Date,Bid Submission Start Date,Bid Submission End Date,Financial Bid Opening Date,EMD Amount in ₹,EMD Exemption Allowed,EMD Fee Type,EMD Percentage,EMD Payable To,EMD Payable At,S.No,Bank Name,Tender Fee in ₹,VAT Charges in ₹,Fee Payable To,Fee Payable At,Tender Fee Exemption Allowed,Name,Address,Title,Work Description,Pre Qualification Details,Independent External Monitor/Remarks,Tender Value in ₹,Product Category,Sub category,Contract Type,Bid Validity(Days),Period Of Work(Days),Location,Pincode,Pre Bid Meeting Place,Pre Bid Meeting Address,Pre Bid Meeting Date,Bid Opening Place,Should Allow NDA Tender,Allow Preferential Bidder,Tender Stage,Contract Date :,Contract Value :,Work Completion Period in days :,Updated By :,Updated on :,AOC document :,AOC Description :,S.No,Bid Number,Bidder Name,Awarded Currency,Awarded Value,S.No.1,Bid Number.1,Bidder Name.1,Submitted Date,Status,Remarks,Status Updated On,Type :,Summary :,Updated By :.1,Updated On :,Document :,BOQ Comparative Chart :,Committee Chairperson/Co-ordinator Name :,Committee Chairperson/Co-ordinator Type :,Committee Members :,Updated By :.2,Updated on :.1,Document :.1,Organisation Chain :,Tender ID :,Tender Ref No :,Tender Title :,Type :.1,Summary :.1,Updated By :.3,Updated On :.1,Document :.2,Committee Chairperson/Co-ordinator Name :.1,Committee Chairperson/Co-ordinator Type :.1,Committee Members :.1,Updated By :.4,Updated On :.2,Financial Bid Opening Date:,Document :.3,Tender Stage
EIC-CIVIL||SERNB-CIRCLE-PHULBANI||EERNB DIVN BALIGUDA,SE-BLG-08/2024-25,2024_EICCL_105792_3,Yes,Open Tender,Percentage,Works,2.0,No,No,Online,No,No,No,1.0,Fee/PreQual/Technical,.pdf,DTCN,19-Oct-2024 10:30 AM,04-Nov-2024 11:30 AM,19-Oct-2024 10:30 AM,02-Nov-2024 05:00 PM,NA ,NA ,19-Oct-2024 10:30 AM,02-Nov-2024 05:00 PM,19-Nov-2024 04:00 PM,"50,500",Yes,fixed,,Nil,Nil,1.0,ICICI BANK,"10,000",0.0,Nil,Nil,No,SUPERITENDING ENGINEER BALLIGUDA R AND B DIVISION,SUPERITENDING ENGINEER BALLIGUDA R AND B DIVISION,Construction of need based infrastructures in the PPC at K.Nuagaon LAMPCS under K.Nuagaon Block in the District of Kandhamal for the year 2024-25. Composite Tender,Construction of need based infrastructures in the PPC at K.Nuagaon LAMPCS under K.Nuagaon Block in the District of Kandhamal for the year 2024-25. Composite Tender,Please refer Tender documents. ,NA ,,Civil Works - Buildings,NA ,Rate Contract,90.0,90.0,SUPERITENDING ENGINEER BALLIGUDA R AND B DIVISION,762103.0,NA ,NA ,NA ,SUPERITENDING ENGINEER BALLIGUDA R AND B DIVISION,No ,No,AOC,10-Jan-2025,"INR 4,290,260",90.0,Dinesh Kumar Sahu,10-Jan-2025 08:20 PM,agrtppck.pdf (591.00 KB),The work awarded to Sri.Uma Kanta Nayak being 14.99% less then the estimated cost.,1.0,2606959.0,UMA KANTA NAIK,INR,"4,290,260",1,2594915,AJIT MALLICK,27-Oct-2024 06:36 PM,Rejected-Finance,Not Winner in lottery system,10-Jan-2025 06:00 PM,Finance,opening summary,Prasanta Kumar Behera,10-Jan-2025 05:52 PM,finance_510242.pdf,BOQ Comparative Chart,DAO,Internal,DAO,Prasanta Kumar Behera,10-Jan-2025 06:00 PM,finsummary_510242.pdf (811.77 KB),EIC-CIVIL||SERNB-CIRCLE-PHULBANI||EERNB DIVN BALIGUDA,2024_EICCL_105792_3,SE-BLG-08/2024-25,Construction of need based infrastructures in the PPC at K.Nuagaon LAMPCS under K.Nuagaon Block in the District of Kandhamal for the year 2024-25. Composite Tender,Technical,TENDER OPENING SUMMARY,Prasanta Kumar Behera,16-Nov-2024 08:35 PM,technical_510242.pdf,DAO,Internal,DAO,Prasanta Kumar Behera,16-Nov-2024 08:59 PM,19-Nov-2024 04:00 PM,techsummary_510242.pdf (864.83 KB),AOC
,,,,,,,,,,,,,,,,.pdf,MEMORENDUM,,,,,,,,,,,,,,,,2.0,ICICI NEFT/RTGS,,,,,,,,,,,,,,,,,,,,,,,,,,AOC,,,,,,,,,,,,,2,2599473,BISWARANJAN PATTANAYAK,29-Oct-2024 08:28 PM,Rejected-Finance,Highest quoted rate,10-Jan-2025 06:00 PM,,,,,,,,,,,,,,,,,,,,,,,,,,,,,AOC
,,,,,,,,,,,,,,2.0,Finance,.xls,BOQ,,,,,,,,,,,,,,,,,,,,,,,,,,,,,,,,,,,,,,,,,,,AOC,,,,,,,,,,,,,3,2590842,Mukesh kumar yadav,23-Oct-2024 04:51 PM,Rejected-Finance,Not Winner in lottery system,10-Jan-2025 06:00 PM,,,,,,,,,,,,,,,,,,,,,,,,,,,,,AOC
,,,,,,,,,,,,,,,,,,,,,,,,,,,,,,,,,,,,,,,,,,,,,,,,,,,,,,,,,,,,AOC,,,,,,,,,,,,,4,2599059,Sri Pradeep Kumar Nayak,02-Nov-2024 10:53 AM,Rejected-Finance,Not Winner in lottery system,10-Jan-2025 06:00 PM,,,,,,,,,,,,,,,,,,,,,,,,,,,,,AOC
,,,,,,,,,,,,,,,,,,,,,,,,,,,,,,,,,,,,,,,,,,,,,,,,,,,,,,,,,,,,AOC,,,,,,,,,,,,,5,2606959,UMA KANTA NAIK,02-Nov-2024 04:38 PM,Accepted-AOC,The work awarded to Sri. Uma Kanta Nayak .,10-Jan-2025 08:20 PM,,,,,,,,,,,,,,,,,,,,,,,,,,,,,AOC
