Organisation Chain,Tender Reference Number,Tender ID,Withdrawal Allowed,Tender Type,Form of contract,Tender Category,No. of Covers,General Technical Evaluation Allowed,ItemWise Technical Evaluation Allowed,Payment Mode,Is Multi Currency Allowed For BOQ,Is Multi Currency Allowed For Fee,Allow Two Stage Bidding,Cover No,Cover,Document Type,Description,Publish Date,Bid Opening Date,Document Download / Sale Start Date,Document Download / Sale End Date,Clarification Start Date,Clarification End Date,Bid Submission Start Date,Bid Submission End Date,Financial Bid Opening Date,EMD Amount in ₹,EMD Exemption Allowed,EMD Fee Type,EMD Percentage,EMD Payable To,EMD Payable At,S.No,Bank Name,Tender Fee in ₹,Fee Payable To,Fee Payable At,Tender Fee Exemption Allowed,Name,Address,Title,Work Description,Pre Qualification Details,Independent External Monitor/Remarks,Tender Value in ₹,Product Category,Sub category,Contract Type,Bid Validity(Days),Period Of Work(Days),Location,Pincode,Pre Bid Meeting Place,Pre Bid Meeting Address,Pre Bid Meeting Date,Bid Opening Place,Should Allow NDA Tender,Allow Preferential Bidder,Tender Stage,Contract Date :,Contract Value :,Work Completion Period in days :,Updated By :,Updated on :,AOC document :,S.No,Bid Number,Bidder Name,Awarded Currency,Awarded Value,S.No.1,Bid Number.1,Bidder Name.1,Submitted Date,Status,Remarks,Status Updated On,Type :,Summary :,Updated By :.1,Updated On :,Document :,BOQ Comparative Chart :,Committee Chairperson/Co-ordinator Name :,Committee Chairperson/Co-ordinator Type :,Committee Members :,Updated By :.2,Updated on :.1,Document :.1,Organisation Chain :,Tender ID :,Tender Ref No :,Tender Title :,Type :.1,Summary :.1,Updated By :.3,Updated On :.1,Document :.2,Committee Chairperson/Co-ordinator Name :.1,Committee Chairperson/Co-ordinator Type :.1,Committee Members :.1,Updated By :.4,Updated On :.2,Financial Bid Opening Date:,Document :.3,Tender Stage
WATCO Bhubaneswar,WATCO (W)-17(1)/2024-25 Dtd.07.12.2024,2024_WATCO_108194_1,Yes,National Competitive Bid,Percentage,Works,2.0,No,No,Online,No,No,No,1.0,Fee/PreQual/Technical,.pdf,"Copy of PAN, GST, Affidavits as per DTCN",16-Dec-2024 11:00 AM,31-Dec-2024 12:30 PM,16-Dec-2024 11:00 AM,30-Dec-2024 05:00 PM,16-Dec-2024 11:00 AM ,20-Dec-2024 05:00 PM ,16-Dec-2024 11:00 AM,30-Dec-2024 05:00 PM,09-Jan-2025 11:30 AM,"1,46,000",Yes,fixed,,Nil,Nil,1.0,ICICI BANK,"11,800",Nil,Nil,No,Managing Director,"The Managing Director, WATCO Ground Floor, Unnati Bhawan, Satyanagar, Bhubaneswar-751007, Odisha, India (0674) 2391444","Improvement Distribution system including Installation of Isolation of Valve for provision of Drink from Tap and 24x7 Water Supply to Ward No.01,02,03,21 and 22 of Jemadei and its adjoining areas of Khordha Town","Improvement Distribution system including Installation of Isolation of Valve for provision of Drink from Tap and 24x7 Water Supply to Ward No.01,02,03,21 and 22 of Jemadei and its adjoining areas of Khordha Town",Please refer Tender documents. ,NA ,"1,46,44,000",Civil Works - Water Works,NA ,Tender,120.0,90.0,"Jemadei, Khordha Town",752055.0,NA ,NA ,NA ,Bhubaneswar,No ,No,AOC,30-Jan-2025,"INR 12,448,983",90.0,Guru Charan Das,30-Jan-2025 02:13 PM,AOC.pdf (11243.00 KB),1.0,2713698.0,SISIRA KANTA JENA,INR,"12,448,983",1,2715748,BIBHUTI BHUSAN JENA,30-Dec-2024 04:10 PM,Rejected-AOC,Not a lowest bidder,30-Jan-2025 02:13 PM,Finance,Six no financial bids are received online and the bid is admitted subject to detail scrutiny after downloading the bid documents and after which the bid will be finally determined as valid or invalid,Guru Charan Das,09-Jan-2025 12:07 PM,,BOQ Comparative Chart,Managing Director,Internal,,Guru Charan Das,30-Jan-2025 02:05 PM,finsummary_520250.pdf (1030.01 KB),WATCO Bhubaneswar,2024_WATCO_108194_1,WATCO (W)-17(1)/2024-25 Dtd.07.12.2024,"Improvement Distribution system including Installation of Isolation of Valve for provision of Drink from Tap and 24x7 Water Supply to Ward No.01,02,03,21 and 22 of Jemadei and its adjoining areas of Khordha Town",Technical,Seven no technical bids are received online and the bid is admitted subject to detail scrutiny after downloading the bid documents and after which the bid will be finally determined as valid or invalid,Guru Charan Das,31-Dec-2024 12:40 PM,,Managing Director,Internal,,Guru Charan Das,08-Jan-2025 12:33 PM,09-Jan-2025 11:30 AM,techsummary_520250.pdf (3199.99 KB),AOC
,,,,,,,,,,,,,,,,.pdf,"Certificates, Formats, Schedules and other documents if any as per DTCN",,,,,,,,,,,,,,,,2.0,ICICI NEFT/RTGS,,,,,,,,,,,,,,,,,,,,,,,,,AOC,,,,,,,,,,,,2,2701379,Biswajeet Sahoo,17-Dec-2024 06:55 PM,Rejected-Technical,Technically disqualified,08-Jan-2025 12:33 PM,,,,,,,,,,,,,,,,,,,,,,,,,,,,,AOC
,,,,,,,,,,,,,,2.0,Finance,.xls,Bill of Quantity,,,,,,,,,,,,,,,,,,,,,,,,,,,,,,,,,,,,,,,,,,AOC,,,,,,,,,,,,3,2709438,CHANDRABHANU BISWAL,29-Dec-2024 11:46 AM,Rejected-AOC,Not a lowest bidder,30-Jan-2025 02:13 PM,,,,,,,,,,,,,,,,,,,,,,,,,,,,,AOC
,,,,,,,,,,,,,,,,,,,,,,,,,,,,,,,,,,,,,,,,,,,,,,,,,,,,,,,,,,,AOC,,,,,,,,,,,,4,2713148,CHINTAMANI KUNDA,30-Dec-2024 02:37 PM,Rejected-AOC,Not a lowest bidder,30-Jan-2025 02:13 PM,,,,,,,,,,,,,,,,,,,,,,,,,,,,,AOC
,,,,,,,,,,,,,,,,,,,,,,,,,,,,,,,,,,,,,,,,,,,,,,,,,,,,,,,,,,,AOC,,,,,,,,,,,,5,2701843,M/S HARA ENGINEERING WORKS,27-Dec-2024 02:17 PM,Rejected-AOC,Not a lowest bidder,30-Jan-2025 02:13 PM,,,,,,,,,,,,,,,,,,,,,,,,,,,,,AOC
,,,,,,,,,,,,,,,,,,,,,,,,,,,,,,,,,,,,,,,,,,,,,,,,,,,,,,,,,,,AOC,,,,,,,,,,,,6,2713698,SISIRA KANTA JENA,27-Dec-2024 03:33 PM,Accepted-AOC,Lowest bidder,30-Jan-2025 02:13 PM,,,,,,,,,,,,,,,,,,,,,,,,,,,,,AOC
,,,,,,,,,,,,,,,,,,,,,,,,,,,,,,,,,,,,,,,,,,,,,,,,,,,,,,,,,,,AOC,,,,,,,,,,,,7,2714000,SRABANI KAR,27-Dec-2024 04:51 PM,Rejected-AOC,Not a lowest bidder,30-Jan-2025 02:13 PM,,,,,,,,,,,,,,,,,,,,,,,,,,,,,AOC
