Organisation Chain,Tender Reference Number,Tender ID,Withdrawal Allowed,Tender Type,Form of contract,Tender Category,No. of Covers,General Technical Evaluation Allowed,ItemWise Technical Evaluation Allowed,Payment Mode,Is Multi Currency Allowed For BOQ,Is Multi Currency Allowed For Fee,Allow Two Stage Bidding,Cover No,Cover,Document Type,Description,Publish Date,Bid Opening Date,Document Download / Sale Start Date,Document Download / Sale End Date,Clarification Start Date,Clarification End Date,Bid Submission Start Date,Bid Submission End Date,EMD Amount in ₹,EMD Exemption Allowed,EMD Fee Type,EMD Percentage,EMD Payable To,EMD Payable At,S.No,Bank Name,Tender Fee in ₹,VAT Charges in ₹,Fee Payable To,Fee Payable At,Tender Fee Exemption Allowed,Name,Address,Title,Work Description,Pre Qualification Details,Independent External Monitor/Remarks,Tender Value in ₹,Product Category,Sub category,Contract Type,Bid Validity(Days),Period Of Work(Days),Location,Pincode,Pre Bid Meeting Place,Pre Bid Meeting Address,Pre Bid Meeting Date,Bid Opening Place,Should Allow NDA Tender,Allow Preferential Bidder,Tender Stage,Contract Date :,Contract Value :,Work Completion Period in days :,Updated By :,Updated on :,AOC document :,AOC Description :,S.No,Bid Number,Bidder Name,Awarded Currency,Awarded Value,S.No.1,Bid Number.1,Bidder Name.1,Submitted Date,Status,Remarks,Status Updated On,Type :,Summary :,Updated By :.1,Updated On :,Document :,BOQ Comparative Chart :,Committee Chairperson/Co-ordinator Name :,Committee Chairperson/Co-ordinator Type :,Committee Members :,Updated By :.2,Updated on :.1,Document :.1,Organisation Chain :,Tender ID :,Tender Ref No :,Tender Title :,Committee Chairperson/Co-ordinator Name :.1,Committee Chairperson/Co-ordinator Type :.1,Committee Members :.1,Updated By :.3,Updated On :.1,Document :.2,Tender Stage
EIC-CIVIL||SERNB-CIRCLE-KHURDA||EERNB DIVN KHURDA,NIT-11-24-25,2024_EICCL_105145_3,Yes,Open Tender,Percentage,Works,1.0,No,No,Online,No,No,No,1.0,Fee/PreQual/Technical/Finance,.pdf,"Online proof copy Tender cost, EMD, GSTIN, PAN, Contractor RC and Affidavit",25-Sep-2024 12:00 PM,08-Oct-2024 11:30 AM,25-Sep-2024 12:00 PM,07-Oct-2024 05:00 PM,NA ,NA ,25-Sep-2024 12:00 PM,07-Oct-2024 05:00 PM,"26,800",Yes,fixed,,Nil,Nil,1.0,ICICI BANK,"6,000",0.0,Nil,Nil,No,SE RANDB KHURDA,"O/o the SUPERINTENDING Engineer R and B Division, Khurda",Shifting and construction of 11KV line and 3ph 4w ABC LT Line from Odagon to Ayatpur (3.2 Km) for Widening and strengthening of Banpur to Ayatpur Road from 0/0 to 9/300 Km under State Plan.,Shifting and construction of 11KV line and 3ph 4w ABC LT Line from Odagon to Ayatpur (3.2 Km) for Widening and strengthening of Banpur to Ayatpur Road from 0/0 to 9/300 Km under State Plan.,Please refer Tender documents. ,NA ,"26,75,057",Electrical Works,NA ,Tender,90.0,60.0,Khordha,752056.0,NA ,NA ,NA ,O/O SE RANDB KHURDA,No ,No,AOC,29-Nov-2025,"INR 2,274,066",60.0,Shibalal Sahoo,02-Jan-2025 01:27 PM,158.pdf (169.00 KB),agreement done,1.0,2571516.0,AYUSH POWER INFRASTRUCTURE,INR,"2,274,066",1,2571516,AYUSH POWER INFRASTRUCTURE,07-Oct-2024 04:47 PM,Accepted-AOC,agreement done,02-Jan-2025 01:27 PM,Finance,6 bidder are admitted,Shibalal Sahoo,08-Oct-2024 03:33 PM,finance_507618.pdf,BOQ Comparative Chart,"SE, Khordha (RB) Division",Internal,"Estimator, DAO",Shibalal Sahoo,02-Jan-2025 01:24 PM,finsummary_507618.pdf (451.19 KB),EIC-CIVIL||SERNB-CIRCLE-KHURDA||EERNB DIVN KHURDA,2024_EICCL_105145_3,NIT-11-24-25,Shifting and construction of 11KV line and 3ph 4w ABC LT Line from Odagon to Ayatpur (3.2 Km) for Widening and strengthening of Banpur to Ayatpur Road from 0/0 to 9/300 Km under State Plan.,"EE, Khordha (RB) Division",Internal,"DAO, Estimator",Shibalal Sahoo,28-Oct-2024 05:08 PM,techsummary_507618.pdf (163.64 KB),AOC
,,,,,,,,,,,,,,,,.pdf,Other Documents as per DTCN,,,,,,,,,,,,,,,2.0,ICICI NEFT/RTGS,,,,,,,,,,,,,,,,,,,,,,,,,,AOC,,,,,,,,,,,,,2,2568720,DEBASISH KUMAR KAR,04-Oct-2024 08:17 PM,Rejected-Finance,L2 bidder,02-Jan-2025 01:23 PM,,,,,,,,,,,,,,,,,,,,,,,AOC
,,,,,,,,,,,,,,,,.xls,Bill of Quantity,,,,,,,,,,,,,,,,,,,,,,,,,,,,,,,,,,,,,,,,,,AOC,,,,,,,,,,,,,3,2571241,MANGALA PRASANNA NAYAK,07-Oct-2024 02:27 PM,Rejected-Finance,Not Successful in transparent lottery,02-Jan-2025 01:23 PM,,,,,,,,,,,,,,,,,,,,,,,AOC
,,,,,,,,,,,,,,,,,,,,,,,,,,,,,,,,,,,,,,,,,,,,,,,,,,,,,,,,,,,AOC,,,,,,,,,,,,,4,2571210,M/S. BALIYARSINGH ELECTRICAL ENGINEERING & CONSTRUCTION,07-Oct-2024 02:06 PM,Rejected-Finance,Not Successful in transparent lottery,02-Jan-2025 01:23 PM,,,,,,,,,,,,,,,,,,,,,,,AOC
,,,,,,,,,,,,,,,,,,,,,,,,,,,,,,,,,,,,,,,,,,,,,,,,,,,,,,,,,,,AOC,,,,,,,,,,,,,5,2571412,M/s Ellexo Transmission,07-Oct-2024 04:04 PM,Rejected-Finance,L2 bidder,02-Jan-2025 01:23 PM,,,,,,,,,,,,,,,,,,,,,,,AOC
,,,,,,,,,,,,,,,,,,,,,,,,,,,,,,,,,,,,,,,,,,,,,,,,,,,,,,,,,,,AOC,,,,,,,,,,,,,6,2567632,M/S. M.C.C. ASSOCIATES,03-Oct-2024 07:02 PM,Rejected-Finance,Not Successful in transparent lottery,02-Jan-2025 01:23 PM,,,,,,,,,,,,,,,,,,,,,,,AOC
