Organisation Chain,Tender Reference Number,Tender ID,Withdrawal Allowed,Tender Type,Form of contract,Tender Category,No. of Covers,General Technical Evaluation Allowed,ItemWise Technical Evaluation Allowed,Payment Mode,Is Multi Currency Allowed For BOQ,Is Multi Currency Allowed For Fee,Allow Two Stage Bidding,Cover No,Cover,Document Type,Description,Publish Date,Bid Opening Date,Document Download / Sale Start Date,Document Download / Sale End Date,Clarification Start Date,Clarification End Date,Bid Submission Start Date,Bid Submission End Date,EMD Amount in ₹,EMD Exemption Allowed,EMD Fee Type,EMD Percentage,EMD Payable To,EMD Payable At,S.No,Bank Name,Tender Fee in ₹,Fee Payable To,Fee Payable At,Tender Fee Exemption Allowed,Name,Address,Title,Work Description,Pre Qualification Details,Independent External Monitor/Remarks,Tender Value in ₹,Product Category,Sub category,Contract Type,Bid Validity(Days),Period Of Work(Days),Location,Pincode,Pre Bid Meeting Place,Pre Bid Meeting Address,Pre Bid Meeting Date,Bid Opening Place,Should Allow NDA Tender,Allow Preferential Bidder,Tender Stage,Contract Date :,Contract Value :,Work Completion Period in days :,Updated By :,Updated on :,AOC document :,S.No,Bid Number,Bidder Name,Awarded Currency,Awarded Value,S.No.1,Bid Number.1,Bidder Name.1,Submitted Date,Status,Remarks,Status Updated On,Type :,Summary :,Updated By :.1,Updated On :,Document :,BOQ Comparative Chart :,Committee Chairperson/Co-ordinator Name :,Committee Chairperson/Co-ordinator Type :,Committee Members :,Updated By :.2,Updated on :.1,Document :.1,Organisation Chain :,Tender ID :,Tender Ref No :,Tender Title :,Committee Chairperson/Co-ordinator Name :.1,Committee Chairperson/Co-ordinator Type :.1,Committee Members :.1,Updated By :.3,Updated On :.1,Document :.2,Tender Stage
WATCO Bhubaneswar||Director (Projects) Watco||GM WATCO PROJECT DIVISION BBSR,11/ Project-I/WATCO/ 2024-25 Dtd.20.11.2024,2024_GWCII_107398_1,Yes,National Competitive Bid,Percentage,Works,1.0,No,No,Online,No,No,No,1.0,Fee/PreQual/Technical/Finance,.pdf,"Copy of PAN, GST, Affidavits as per DTCN",25-Nov-2024 11:00 AM,10-Dec-2024 12:30 PM,25-Nov-2024 11:00 AM,09-Dec-2024 05:00 PM,NA ,NA ,25-Nov-2024 11:00 AM,09-Dec-2024 05:00 PM,"29,000",Yes,fixed,,Nil,Nil,1.0,ICICI BANK,"7,080",Nil,Nil,No,General Manager,"General Manager, WATCO Project Division-I, Ground Floor, Unnati Bhawan, Satya Nagar Bhubaneswar-751007, Odisha, Phone (0674) 2571444","Shifting and crossing of 800mm dia and 300mm dia C.I pipe line over PWD Drain at Haribhaina Chhak, Ward no-09, Jatni","Shifting and crossing of 800mm dia and 300mm dia C.I pipe line over PWD Drain at Haribhaina Chhak, Ward no-09, Jatni",Please refer Tender documents. ,NA ,"27,84,000",Civil Works - Water Works,NA ,Tender,120.0,30.0,"Haribhaina Chhak,Jatni",752050.0,NA ,NA ,NA ,Bhubaneswar,No ,No,AOC,16-Jan-2025,"INR 2,366,402",30.0,Sarada Prasanna Nayak,16-Jan-2025 11:29 AM,AOC.pdf (535.00 KB),1.0,2680275.0,SRABANI KAR,INR,"2,366,402",1,2672652,CHINTAMANI KUNDA,09-Dec-2024 01:03 PM,Rejected-AOC,Not a lowest bidder,16-Jan-2025 11:30 AM,Finance,Seven no bids are received online and the bid is admitted subject to detail scrutiny after downloading the bid documents and after which the bid will be finally determined as valid or invalid,Sarada Prasanna Nayak,10-Dec-2024 12:43 PM,,BOQ Comparative Chart,General Manager,Internal,,Sarada Prasanna Nayak,16-Jan-2025 11:19 AM,finsummary_517346.pdf (592.71 KB),WATCO Bhubaneswar||Director (Projects) Watco||GM WATCO PROJECT DIVISION BBSR,2024_GWCII_107398_1,11/ Project-I/WATCO/ 2024-25 Dtd.20.11.2024,"Shifting and crossing of 800mm dia and 300mm dia C.I pipe line over PWD Drain at Haribhaina Chhak, Ward no-09, Jatni",General Manager,Internal,,Sarada Prasanna Nayak,16-Jan-2025 11:13 AM,techsummary_517346.pdf (592.71 KB),AOC
,,,,,,,,,,,,,,,,.pdf,"Certificates, Formats, Schedules and other documents if any as per DTCN",,,,,,,,,,,,,,,2.0,ICICI NEFT/RTGS,,,,,,,,,,,,,,,,,,,,,,,,,AOC,,,,,,,,,,,,2,2686363,MADHAB CHANDRA PAIKARAY,06-Dec-2024 06:50 PM,Rejected-AOC,Not a lowest bidder,16-Jan-2025 11:30 AM,,,,,,,,,,,,,,,,,,,,,,,AOC
,,,,,,,,,,,,,,,,.xls,Bill of Quantity,,,,,,,,,,,,,,,,,,,,,,,,,,,,,,,,,,,,,,,,,AOC,,,,,,,,,,,,3,2669182,M/S HARA ENGINEERING WORKS,03-Dec-2024 12:09 PM,Rejected-AOC,Not a lowest bidder,16-Jan-2025 11:30 AM,,,,,,,,,,,,,,,,,,,,,,,AOC
,,,,,,,,,,,,,,,,,,,,,,,,,,,,,,,,,,,,,,,,,,,,,,,,,,,,,,,,,,AOC,,,,,,,,,,,,4,2669222,M/S SMALL ENGINEERING AND CONSTRUCTION,03-Dec-2024 12:42 PM,Rejected-AOC,Not a lowest bidder,16-Jan-2025 11:30 AM,,,,,,,,,,,,,,,,,,,,,,,AOC
,,,,,,,,,,,,,,,,,,,,,,,,,,,,,,,,,,,,,,,,,,,,,,,,,,,,,,,,,,AOC,,,,,,,,,,,,5,2671348,SNEHANJALI JENA,02-Dec-2024 01:22 PM,Rejected-AOC,Not a lowest bidder,16-Jan-2025 11:30 AM,,,,,,,,,,,,,,,,,,,,,,,AOC
,,,,,,,,,,,,,,,,,,,,,,,,,,,,,,,,,,,,,,,,,,,,,,,,,,,,,,,,,,AOC,,,,,,,,,,,,6,2680275,SRABANI KAR,04-Dec-2024 09:52 AM,Accepted-AOC,Lowest bidder,16-Jan-2025 11:30 AM,,,,,,,,,,,,,,,,,,,,,,,AOC
,,,,,,,,,,,,,,,,,,,,,,,,,,,,,,,,,,,,,,,,,,,,,,,,,,,,,,,,,,AOC,,,,,,,,,,,,7,2686377,SUNIL KUMAR PAIKARAY,06-Dec-2024 06:58 PM,Rejected-AOC,Not a lowest bidder,16-Jan-2025 11:30 AM,,,,,,,,,,,,,,,,,,,,,,,AOC
