Organisation Chain,Tender Reference Number,Tender ID,Withdrawal Allowed,Tender Type,Form of contract,Tender Category,No. of Covers,General Technical Evaluation Allowed,ItemWise Technical Evaluation Allowed,Payment Mode,Is Multi Currency Allowed For BOQ,Is Multi Currency Allowed For Fee,Allow Two Stage Bidding,Cover No,Cover,Document Type,Description,Publish Date,Bid Opening Date,Document Download / Sale Start Date,Document Download / Sale End Date,Clarification Start Date,Clarification End Date,Bid Submission Start Date,Bid Submission End Date,EMD Amount in ₹,EMD Exemption Allowed,EMD Fee Type,EMD Percentage,EMD Payable To,EMD Payable At,S.No,Bank Name,Tender Fee in ₹,VAT Charges in ₹,Fee Payable To,Fee Payable At,Tender Fee Exemption Allowed,Name,Address,Title,Work Description,Pre Qualification Details,Independent External Monitor/Remarks,Tender Value in ₹,Product Category,Sub category,Contract Type,Bid Validity(Days),Period Of Work(Days),Location,Pincode,Pre Bid Meeting Place,Pre Bid Meeting Address,Pre Bid Meeting Date,Bid Opening Place,Should Allow NDA Tender,Allow Preferential Bidder,Tender Stage,Contract Date :,Contract Value :,Work Completion Period in days :,Updated By :,Updated on :,AOC document :,AOC Description :,S.No,Bid Number,Bidder Name,Awarded Currency,Awarded Value,S.No.1,Bid Number.1,Bidder Name.1,Submitted Date,Status,Remarks,Status Updated On,Type :,Summary :,Updated By :.1,Updated On :,Document :,BOQ Comparative Chart :,Committee Chairperson/Co-ordinator Name :,Committee Chairperson/Co-ordinator Type :,Committee Members :,Updated By :.2,Updated on :.1,Document :.1,Organisation Chain :,Tender ID :,Tender Ref No :,Tender Title :,Committee Chairperson/Co-ordinator Name :.1,Committee Chairperson/Co-ordinator Type :.1,Committee Members :.1,Updated By :.3,Updated On :.1,Document :.2,Tender Stage
CE RW I||RW-CIRCLE-SUNDARGARH||RW-Division-Sundargarh II,Online -SERKL-12 of 2024-25,2024_CERWI_106151_4,Yes,Open Tender,Percentage,Works,1.0,No,No,Online,No,No,No,1.0,Fee/PreQual/Technical/Finance,.pdf,Affidavit Towards Authenticity of Documents,30-Oct-2024 09:00 AM,11-Nov-2024 09:00 AM,30-Oct-2024 09:00 AM,08-Nov-2024 06:00 PM,30-Oct-2024 09:00 AM ,07-Nov-2024 06:00 PM ,30-Oct-2024 09:00 AM,08-Nov-2024 06:00 PM,"39,740",Yes,fixed,,Nil,Nil,1.0,ICICI BANK,"6,000",0.0,Nil,Nil,No,"Ececutive Engineer, RW Division,Rourkela","Office of the Executive Engineer,RW Division,Rourk",S/R to NH-23 to Chudakhai to Bhoidihi road for the year 2024-25,S/R to NH-23 to Chudakhai to Bhoidihi road for the year 2024-25,Please refer Tender documents. ,NA ,"39,73,770",Civil Works - Roads,NA ,Tender,90.0,30.0,ROURKELA,769004.0,NA ,NA ,NA ,"Office of the Executive Engineer,RW Division,Rourk",No ,No,AOC,16-Jan-2025,"INR 3,378,102",30.0,Kishore Chandra Khatua,16-Jan-2025 03:54 PM,04.pdf (386.00 KB),Awarded Cost,1.0,2631259.0,ASIT KUMAR LENKA,INR,"3,378,102",1,2631683,AJAY KUMAR BEHERA,08-Nov-2024 02:30 PM,Rejected-AOC,Rejected by the Committee,16-Jan-2025 03:54 PM,Finance,8 Bidders Applied,Kishore Chandra Khatua,16-Jan-2025 03:44 PM,,BOQ Comparative Chart,"AE Estt, DAO, SE",Internal,"AE Estt, DAO, SE",Kishore Chandra Khatua,16-Jan-2025 03:50 PM,finsummary_512967.pdf (385.57 KB),CE RW I||RW-CIRCLE-SUNDARGARH||RW-Division-Sundargarh II,2024_CERWI_106151_4,Online -SERKL-12 of 2024-25,S/R to NH-23 to Chudakhai to Bhoidihi road for the year 2024-25,"AE Estt, DAO, SE",Internal,"AE Estt, DAO, SE",Kishore Chandra Khatua,16-Jan-2025 03:47 PM,techsummary_512967.pdf (385.57 KB),AOC
,,,,,,,,,,,,,,,,.pdf,"PAN Card, GSTN, Regestration Certificate another as per DTCN, Contact No",,,,,,,,,,,,,,,2.0,ICICI NEFT/RTGS,,,,,,,,,,,,,,,,,,,,,,,,,,AOC,,,,,,,,,,,,,2,2631259,ASIT KUMAR LENKA,08-Nov-2024 12:59 PM,Accepted-AOC,Awarded,16-Jan-2025 03:54 PM,,,,,,,,,,,,,,,,,,,,,,,AOC
,,,,,,,,,,,,,,,,.pdf,Affidavit Regarding norelation certificate,,,,,,,,,,,,,,,,,,,,,,,,,,,,,,,,,,,,,,,,,,AOC,,,,,,,,,,,,,3,2631394,BHAVESH JAISWAL,08-Nov-2024 01:22 PM,Rejected-AOC,Rejected by the Committee,16-Jan-2025 03:54 PM,,,,,,,,,,,,,,,,,,,,,,,AOC
,,,,,,,,,,,,,,,,.pdf,Affidavit Regarding correctness of information,,,,,,,,,,,,,,,,,,,,,,,,,,,,,,,,,,,,,,,,,,AOC,,,,,,,,,,,,,4,2629614,BIBRAT KUMAR SAHOO,08-Nov-2024 11:35 AM,Rejected-AOC,Rejected by the Committee,16-Jan-2025 03:54 PM,,,,,,,,,,,,,,,,,,,,,,,AOC
,,,,,,,,,,,,,,,,.xls,BOQ,,,,,,,,,,,,,,,,,,,,,,,,,,,,,,,,,,,,,,,,,,AOC,,,,,,,,,,,,,5,2631373,KARAN PRASAD,08-Nov-2024 01:16 PM,Rejected-AOC,Rejected by the Committee,16-Jan-2025 03:54 PM,,,,,,,,,,,,,,,,,,,,,,,AOC
,,,,,,,,,,,,,,,,,,,,,,,,,,,,,,,,,,,,,,,,,,,,,,,,,,,,,,,,,,,AOC,,,,,,,,,,,,,6,2619169,MISS MAYURI PUHAN,05-Nov-2024 02:11 PM,Rejected-AOC,Rejected by the Committee,16-Jan-2025 03:54 PM,,,,,,,,,,,,,,,,,,,,,,,AOC
,,,,,,,,,,,,,,,,,,,,,,,,,,,,,,,,,,,,,,,,,,,,,,,,,,,,,,,,,,,AOC,,,,,,,,,,,,,7,2630132,SUMITRA BEHERA,08-Nov-2024 12:16 PM,Rejected-AOC,Rejected by the Committee,16-Jan-2025 03:54 PM,,,,,,,,,,,,,,,,,,,,,,,AOC
,,,,,,,,,,,,,,,,,,,,,,,,,,,,,,,,,,,,,,,,,,,,,,,,,,,,,,,,,,,AOC,,,,,,,,,,,,,8,2631879,UDIT NARAYAN MOHANTY,08-Nov-2024 03:26 PM,Rejected-AOC,Rejected by the Committee,16-Jan-2025 03:54 PM,,,,,,,,,,,,,,,,,,,,,,,AOC
