Organisation Chain,Tender Reference Number,Tender ID,Withdrawal Allowed,Tender Type,Form of contract,Tender Category,No. of Covers,General Technical Evaluation Allowed,ItemWise Technical Evaluation Allowed,Payment Mode,Is Multi Currency Allowed For BOQ,Is Multi Currency Allowed For Fee,Allow Two Stage Bidding,Cover No,Cover,Document Type,Description,Publish Date,Bid Opening Date,Document Download / Sale Start Date,Document Download / Sale End Date,Clarification Start Date,Clarification End Date,Bid Submission Start Date,Bid Submission End Date,EMD Amount in ₹,EMD Exemption Allowed,EMD Fee Type,EMD Percentage,EMD Payable To,EMD Payable At,S.No,Bank Name,Tender Fee in ₹,VAT Charges in ₹,Fee Payable To,Fee Payable At,Tender Fee Exemption Allowed,Name,Address,Title,Work Description,Pre Qualification Details,Independent External Monitor/Remarks,Tender Value in ₹,Product Category,Sub category,Contract Type,Bid Validity(Days),Period Of Work(Days),Location,Pincode,Pre Bid Meeting Place,Pre Bid Meeting Address,Pre Bid Meeting Date,Bid Opening Place,Should Allow NDA Tender,Allow Preferential Bidder,Tender Stage,Contract Date :,Contract Value :,Work Completion Period in days :,Updated By :,Updated on :,AOC document :,AOC Description :,S.No,Bid Number,Bidder Name,Awarded Currency,Awarded Value,S.No.1,Bid Number.1,Bidder Name.1,Submitted Date,Status,Remarks,Status Updated On,Type :,Summary :,Updated By :.1,Updated On :,Document :,BOQ Comparative Chart :,Committee Chairperson/Co-ordinator Name :,Committee Chairperson/Co-ordinator Type :,Committee Members :,Updated By :.2,Updated on :.1,Document :.1,Organisation Chain :,Tender ID :,Tender Ref No :,Tender Title :,Committee Chairperson/Co-ordinator Name :.1,Committee Chairperson/Co-ordinator Type :.1,Committee Members :.1,Updated By :.3,Updated On :.1,Document :.2,Tender Stage
EIC-CIVIL||SERNB-CIRCLE-NORTHERN||EERNB-DIVN-JHARSUGUDA,Bid Identification No-SE-RandB-JSG-01- OF 2024-25,2024_EICCL_103369_8,Yes,Open Tender,Percentage,Works,1.0,No,No,Online,No,No,No,1.0,Fee/PreQual/Technical/Finance,.pdf,"RC BOOK,TENDER COST,AFFIDAVIT,EMD,PAN, GSTN, LEASE AGREEMENT, MOU OF ELECTRICAL CONTRACTOR etc",29-Jun-2024 05:00 PM,11-Jul-2024 11:30 AM,29-Jun-2024 05:00 PM,10-Jul-2024 05:00 PM,29-Jun-2024 05:00 PM ,10-Jul-2024 05:00 PM ,29-Jun-2024 05:00 PM,10-Jul-2024 05:00 PM,"34,622",Yes,percentage,1.0%,Nil,Nil,1.0,ICICI BANK,"6,000",0.0,Nil,Nil,No,EE Jharsuguda R and B Division,O/O the SE Jharsuguda R and B Division,"Construction of 250KVA 11/04KV S/s for Staff quarters and 100 seated nurse hostel for Cardiac Care Hospital, Jharsuguda for the year 2024-25","Construction of 250KVA 11/04KV S/s for Staff quarters and 100 seated nurse hostel for Cardiac Care Hospital, Jharsuguda for the year 2024-25",Please refer Tender documents. ,NA ,"34,62,243",Electrical Works,NA ,Tender,90.0,60.0,Jharsuguda,768201.0,NA ,NA ,NA ,O/O the SE Jharsuguda R and B Division,No ,No,AOC,06-Jan-2025,"INR 2,943,253",60.0,Sandipta Panigrahi,06-Jan-2025 10:47 AM,cardiac.pdf (784.00 KB),aoc,1.0,2510472.0,UNITED POWER,INR,"2,943,253",1,2510670,Ambika Prasad Samal,09-Jul-2024 08:11 PM,Rejected-AOC,Lottery not in favour,06-Jan-2025 10:47 AM,Finance,cs,Sandipta Panigrahi,05-Aug-2024 10:45 AM,,BOQ Comparative Chart,Superintending Engineer,Internal,EE DAO-1,Sandipta Panigrahi,06-Jan-2025 10:28 AM,finsummary_502176.pdf (783.96 KB),EIC-CIVIL||SERNB-CIRCLE-NORTHERN||EERNB-DIVN-JHARSUGUDA,2024_EICCL_103369_8,Bid Identification No-SE-RandB-JSG-01- OF 2024-25,"Construction of 250KVA 11/04KV S/s for Staff quarters and 100 seated nurse hostel for Cardiac Care Hospital, Jharsuguda for the year 2024-25",Superintending Engineer,Internal,EE DAO-1,Sandipta Panigrahi,06-Jan-2025 10:24 AM,techsummary_502176.pdf (783.96 KB),AOC
,,,,,,,,,,,,,,,,.xls,BOQ,,,,,,,,,,,,,,,2.0,ICICI NEFT/RTGS,,,,,,,,,,,,,,,,,,,,,,,,,,AOC,,,,,,,,,,,,,2,2509903,ELECTRICAL CONSTRUCTION AND MAINTENANCE SERVICE,10-Jul-2024 10:45 AM,Rejected-AOC,Lottery not in favour,06-Jan-2025 10:47 AM,,,,,,,,,,,,,,,,,,,,,,,AOC
,,,,,,,,,,,,,,,,,,,,,,,,,,,,,,,,,,,,,,,,,,,,,,,,,,,,,,,,,,,AOC,,,,,,,,,,,,,3,2509986,M B Power & Solution,09-Jul-2024 10:07 PM,Rejected-AOC,Lottery not in favour,06-Jan-2025 10:47 AM,,,,,,,,,,,,,,,,,,,,,,,AOC
,,,,,,,,,,,,,,,,,,,,,,,,,,,,,,,,,,,,,,,,,,,,,,,,,,,,,,,,,,,AOC,,,,,,,,,,,,,4,2510689,M/S AJAYA KUMAR PATEL,09-Jul-2024 08:17 PM,Rejected-AOC,Lottery not in favour,06-Jan-2025 10:47 AM,,,,,,,,,,,,,,,,,,,,,,,AOC
,,,,,,,,,,,,,,,,,,,,,,,,,,,,,,,,,,,,,,,,,,,,,,,,,,,,,,,,,,,AOC,,,,,,,,,,,,,5,2509858,M/s. GLOBAL ELECTRICALS,09-Jul-2024 10:13 PM,Rejected-AOC,Lottery not in favour,06-Jan-2025 10:47 AM,,,,,,,,,,,,,,,,,,,,,,,AOC
,,,,,,,,,,,,,,,,,,,,,,,,,,,,,,,,,,,,,,,,,,,,,,,,,,,,,,,,,,,AOC,,,,,,,,,,,,,6,2510472,UNITED POWER,09-Jul-2024 04:27 PM,Accepted-AOC,Lottery in favour,06-Jan-2025 10:47 AM,,,,,,,,,,,,,,,,,,,,,,,AOC
