Organisation Chain,Tender Reference Number,Tender ID,Withdrawal Allowed,Tender Type,Form of contract,Tender Category,No. of Covers,General Technical Evaluation Allowed,ItemWise Technical Evaluation Allowed,Payment Mode,Is Multi Currency Allowed For BOQ,Is Multi Currency Allowed For Fee,Allow Two Stage Bidding,Cover No,Cover,Document Type,Description,Publish Date,Bid Opening Date,Document Download / Sale Start Date,Document Download / Sale End Date,Clarification Start Date,Clarification End Date,Bid Submission Start Date,Bid Submission End Date,Financial Bid Opening Date,EMD Amount in ₹,EMD Exemption Allowed,EMD Fee Type,EMD Percentage,EMD Payable To,EMD Payable At,S.No,Bank Name,Tender Fee in ₹,VAT Charges in ₹,Fee Payable To,Fee Payable At,Tender Fee Exemption Allowed,Name,Address,Title,Work Description,Pre Qualification Details,Independent External Monitor/Remarks,Tender Value in ₹,Product Category,Sub category,Contract Type,Bid Validity(Days),Period Of Work(Days),Location,Pincode,Pre Bid Meeting Place,Pre Bid Meeting Address,Pre Bid Meeting Date,Bid Opening Place,Should Allow NDA Tender,Allow Preferential Bidder,Tender Stage,Contract Date :,Contract Value :,Work Completion Period in days :,Updated By :,Updated on :,AOC document :,S.No,Bid Number,Bidder Name,Awarded Currency,Awarded Value,S.No.1,Bid Number.1,Bidder Name.1,Submitted Date,Status,Remarks,Status Updated On,Type :,Summary :,Updated By :.1,Updated On :,Document :,BOQ Comparative Chart :,Committee Chairperson/Co-ordinator Name :,Committee Chairperson/Co-ordinator Type :,Committee Members :,Updated By :.2,Updated on :.1,Document :.1,Organisation Chain :,Tender ID :,Tender Ref No :,Tender Title :,Type :.1,Summary :.1,Updated By :.3,Updated On :.1,Document :.2,Committee Chairperson/Co-ordinator Name :.1,Committee Chairperson/Co-ordinator Type :.1,Committee Members :.1,Updated By :.4,Updated On :.2,Financial Bid Opening Date:,Document :.3,Tender Stage
CE RW I||RWCIRCLE-BARIPADA,Bridge Online N.C.B. No-354 Bridge work,2024_CERWI_102838_2,Yes,National Competitive Bid,Percentage,Works,2.0,No,No,Online,No,No,No,1.0,Fee/PreQual/Technical,.pdf,"Paper cost, RC, PAN, GSTIN and EMD etc as per DTCN",19-Mar-2024 03:00 PM,03-Apr-2024 11:00 AM,19-Mar-2024 03:00 PM,02-Apr-2024 05:00 PM,19-Mar-2024 03:00 PM ,30-Mar-2024 05:00 PM ,19-Mar-2024 03:00 PM,02-Apr-2024 05:00 PM,12-Jun-2024 11:00 AM,"6,37,660",Yes,percentage,1.0%,Nil,Nil,1.0,ICICI BANK,"10,000",0.0,Nil,Nil,No,CCE RWC Baripada,CCE RWC Baripada,Construction of Bridge over Chipat Nallah at 2.60 KM on Palashbani to Jhanjadapali Road under Kuliana Block in the District of Mayurbhanj for the year 2023-24.,Construction of Bridge over Chipat Nallah at 2.60 KM on Palashbani to Jhanjadapali Road under Kuliana Block in the District of Mayurbhanj for the year 2023-24.,Please refer Tender documents. ,NA ,"6,37,66,000",Civil Works - Bridges,NA ,Tender,90.0,365.0,"SE RW Division, Baripada",757105.0,NA ,NA ,NA ,CCE RWC Baripada,No ,No,AOC,02-Jan-2025,"INR 54,206,862",365.0,Ashwani Pradhan,02-Jan-2025 06:49 PM,Chipat2.60.pdf (426.00 KB),1.0,2488610.0,SWARUP KUMAR MOHAPATRA,INR,"54,206,862",1,2486551,Akash Giri,01-Apr-2024 12:19 PM,Rejected-AOC,L1,02-Jan-2025 06:49 PM,Finance,05 Apradhan1234#,Ashwani Pradhan,09-Aug-2024 04:33 PM,,BOQ Comparative Chart,CCE RWC Baripada,Internal,,Ashwani Pradhan,09-Aug-2024 05:13 PM,finsummary_500389.pdf (149.80 KB),CE RW I||RWCIRCLE-BARIPADA,2024_CERWI_102838_2,Bridge Online N.C.B. No-354 Bridge work,Construction of Bridge over Chipat Nallah at 2.60 KM on Palashbani to Jhanjadapali Road under Kuliana Block in the District of Mayurbhanj for the year 2023-24.,Technical,05 Nos of bidders participated,Ashwani Pradhan,07-Jun-2024 10:56 AM,technical_500389.pdf,CCE RWC Baripada,Internal,,Ashwani Pradhan,07-Jun-2024 10:59 AM,12-Jun-2024 11:00 AM,techsummary_500389.pdf (217.60 KB),AOC
,,,,,,,,,,,,,,,,.pdf,"ATO, similar nature of work experience etc as per DTCN",,,,,,,,,,,,,,,,2.0,ICICI NEFT/RTGS,,,,,,,,,,,,,,,,,,,,,,,,,,AOC,,,,,,,,,,,,2,2488865,M/S SANTOSH KUMAR KHANDELWAL,02-Apr-2024 02:43 PM,Rejected-AOC,L1,02-Jan-2025 06:49 PM,,,,,,,,,,,,,,,,,,,,,,,,,,,,,AOC
,,,,,,,,,,,,,,,,.pdf,"Machineries, Affidavit etc as per DTCN",,,,,,,,,,,,,,,,,,,,,,,,,,,,,,,,,,,,,,,,,,,AOC,,,,,,,,,,,,3,2487779,Ranjit Kumar Sahu,01-Apr-2024 03:48 PM,Rejected-AOC,L1,02-Jan-2025 06:49 PM,,,,,,,,,,,,,,,,,,,,,,,,,,,,,AOC
,,,,,,,,,,,,,,2.0,Finance,.xls,Bill of Quantity,,,,,,,,,,,,,,,,,,,,,,,,,,,,,,,,,,,,,,,,,,,AOC,,,,,,,,,,,,4,2488610,SWARUP KUMAR MOHAPATRA,02-Apr-2024 01:01 PM,Accepted-AOC,L1,02-Jan-2025 06:49 PM,,,,,,,,,,,,,,,,,,,,,,,,,,,,,AOC
,,,,,,,,,,,,,,,,,,,,,,,,,,,,,,,,,,,,,,,,,,,,,,,,,,,,,,,,,,,,AOC,,,,,,,,,,,,5,2487870,TARUN MOHANTY,30-Mar-2024 10:36 PM,Rejected-AOC,L1,02-Jan-2025 06:49 PM,,,,,,,,,,,,,,,,,,,,,,,,,,,,,AOC
