Organisation Chain,Tender Reference Number,Tender ID,Withdrawal Allowed,Tender Type,Form of contract,Tender Category,No. of Covers,General Technical Evaluation Allowed,ItemWise Technical Evaluation Allowed,Payment Mode,Is Multi Currency Allowed For BOQ,Is Multi Currency Allowed For Fee,Allow Two Stage Bidding,Cover No,Cover,Document Type,Description,Publish Date,Bid Opening Date,Document Download / Sale Start Date,Document Download / Sale End Date,Clarification Start Date,Clarification End Date,Bid Submission Start Date,Bid Submission End Date,Financial Bid Opening Date,EMD Amount in ₹,EMD Exemption Allowed,EMD Fee Type,EMD Percentage,EMD Payable To,EMD Payable At,S.No,Bank Name,Tender Fee in ₹,Fee Payable To,Fee Payable At,Tender Fee Exemption Allowed,Name,Address,Title,Work Description,Pre Qualification Details,Independent External Monitor/Remarks,Tender Value in ₹,Product Category,Sub category,Contract Type,Bid Validity(Days),Period Of Work(Days),Location,Pincode,Pre Bid Meeting Place,Pre Bid Meeting Address,Pre Bid Meeting Date,Bid Opening Place,Should Allow NDA Tender,Allow Preferential Bidder,Tender Stage,Contract Date :,Contract Value :,Work Completion Period in days :,Updated By :,Updated on :,AOC document :,S.No,Bid Number,Bidder Name,Awarded Currency,Awarded Value,S.No.1,Bid Number.1,Bidder Name.1,Submitted Date,Status,Remarks,Status Updated On,Type :,Summary :,Updated By :.1,Updated On :,Document :,BOQ Comparative Chart :,Committee Chairperson/Co-ordinator Name :,Committee Chairperson/Co-ordinator Type :,Committee Members :,Updated By :.2,Updated on :.1,Document :.1,Organisation Chain :,Tender ID :,Tender Ref No :,Tender Title :,Type :.1,Summary :.1,Updated By :.3,Updated On :.1,Document :.2,Committee Chairperson/Co-ordinator Name :.1,Committee Chairperson/Co-ordinator Type :.1,Committee Members :.1,Updated By :.4,Updated On :.2,Financial Bid Opening Date:,Document :.3,Tender Stage
WATCO Bhubaneswar,WATCO (W)-13(2)/2024-25 Dtd.30.10.2024,2024_WATCO_106541_1,Yes,National Competitive Bid,Percentage,Works,2.0,No,No,Online,No,No,No,1.0,Fee/PreQual/Technical,.pdf,"Copy of PAN, GST, Affidavits as per DTCN",08-Nov-2024 11:00 AM,29-Nov-2024 12:30 PM,08-Nov-2024 11:00 AM,28-Nov-2024 05:00 PM,NA ,NA ,08-Nov-2024 11:00 AM,28-Nov-2024 05:00 PM,09-Jan-2025 11:30 AM,"5,92,000",Yes,fixed,,Nil,Nil,1.0,ICICI BANK,"11,800",Nil,Nil,No,Managing Director,"The Managing Director, WATCO Ground Floor, Unnati Bhawan, Satyanagar, Bhubaneswar-751007, Odisha, India (0674) 2391444",Installation of bulk flow meter and control valve zones under 4.5 MLD WTP at Koelnagar and 5.00 MLD WTP at Vedvyas in connection with 24x7 water supply to Rourkela town under Amrut 2.0 SWAP-II,Installation of bulk flow meter and control valve zones under 4.5 MLD WTP at Koelnagar and 5.00 MLD WTP at Vedvyas in connection with 24x7 water supply to Rourkela town under Amrut 2.0 SWAP-II,Please refer Tender documents. ,NA ,"5,92,19,000",Civil Works - Water Works,NA ,Tender,120.0,180.0,"Vedvyas, Rourkela",769004.0,NA ,NA ,NA ,Bhubaneswar,No ,No,AOC,30-Jan-2025,"INR 52,705,310",180.0,Guru Charan Das,30-Jan-2025 01:38 PM,AOC.pdf (5859.00 KB),1.0,2661045.0,M/s WATCO,INR,"52,705,310",1,2666053,ASCENSOR LIFTS AND AUTOMATION PRIVATE LIMITED,27-Nov-2024 04:58 PM,Rejected-Technical,Technically disqualified,08-Jan-2025 12:11 PM,Finance,Three financial bids are received online and the bid is admitted subject to detail scrutiny after downloading the bid documents and after which the bid will be finally determined as valid or invalid,Guru Charan Das,09-Jan-2025 11:46 AM,,BOQ Comparative Chart,Managing Director,Internal,,Guru Charan Das,30-Jan-2025 01:07 PM,finsummary_514823.pdf (928.67 KB),WATCO Bhubaneswar,2024_WATCO_106541_1,WATCO (W)-13(2)/2024-25 Dtd.30.10.2024,Installation of bulk flow meter and control valve zones under 4.5 MLD WTP at Koelnagar and 5.00 MLD WTP at Vedvyas in connection with 24x7 water supply to Rourkela town under Amrut 2.0 SWAP-II,Technical,Five no technical bids are received online and the bid is admitted subject to detail scrutiny after downloading the bid documents and after which the bid will be finally determined as valid or invalid,Guru Charan Das,29-Nov-2024 01:20 PM,,Managing Director,Internal,,Guru Charan Das,08-Jan-2025 12:11 PM,09-Jan-2025 11:30 AM,techsummary_514823.pdf (3199.99 KB),AOC
,,,,,,,,,,,,,,,,.pdf,"Certificates, Formats, Schedules and other documents if any as per DTCN",,,,,,,,,,,,,,,,2.0,ICICI NEFT/RTGS,,,,,,,,,,,,,,,,,,,,,,,,,AOC,,,,,,,,,,,,2,2671554,KAPIL CONSTRUCTION CO.,28-Nov-2024 04:12 PM,Rejected-AOC,Not a lowest bidder,30-Jan-2025 01:38 PM,,,,,,,,,,,,,,,,,,,,,,,,,,,,,AOC
,,,,,,,,,,,,,,2.0,Finance,.xls,Bill of Quantity,,,,,,,,,,,,,,,,,,,,,,,,,,,,,,,,,,,,,,,,,,AOC,,,,,,,,,,,,3,2669561,MANO RANJAN PANI,27-Nov-2024 09:43 PM,Rejected-Technical,Technically disqualified,08-Jan-2025 12:11 PM,,,,,,,,,,,,,,,,,,,,,,,,,,,,,AOC
,,,,,,,,,,,,,,,,,,,,,,,,,,,,,,,,,,,,,,,,,,,,,,,,,,,,,,,,,,,AOC,,,,,,,,,,,,4,2661045,M/s WATCO,26-Nov-2024 11:30 AM,Accepted-AOC,Lowest bidder,30-Jan-2025 01:38 PM,,,,,,,,,,,,,,,,,,,,,,,,,,,,,AOC
,,,,,,,,,,,,,,,,,,,,,,,,,,,,,,,,,,,,,,,,,,,,,,,,,,,,,,,,,,,AOC,,,,,,,,,,,,5,2669666,RANJIT KUMAR SWAIN,28-Nov-2024 03:39 PM,Rejected-AOC,Not a lowest bidder,30-Jan-2025 01:38 PM,,,,,,,,,,,,,,,,,,,,,,,,,,,,,AOC
