Organisation Chain,Tender Reference Number,Tender ID,Withdrawal Allowed,Tender Type,Form of contract,Tender Category,No. of Covers,General Technical Evaluation Allowed,ItemWise Technical Evaluation Allowed,Payment Mode,Is Multi Currency Allowed For BOQ,Is Multi Currency Allowed For Fee,Allow Two Stage Bidding,Cover No,Cover,Document Type,Description,Publish Date,Bid Opening Date,Document Download / Sale Start Date,Document Download / Sale End Date,Clarification Start Date,Clarification End Date,Bid Submission Start Date,Bid Submission End Date,EMD Amount in ₹,EMD Exemption Allowed,EMD Fee Type,EMD Percentage,EMD Payable To,EMD Payable At,S.No,Bank Name,Tender Fee in ₹,VAT Charges in ₹,Fee Payable To,Fee Payable At,Tender Fee Exemption Allowed,Name,Address,Title,Work Description,Pre Qualification Details,Independent External Monitor/Remarks,Tender Value in ₹,Product Category,Sub category,Contract Type,Bid Validity(Days),Period Of Work(Days),Location,Pincode,Pre Bid Meeting Place,Pre Bid Meeting Address,Pre Bid Meeting Date,Bid Opening Place,Should Allow NDA Tender,Allow Preferential Bidder,Tender Stage,Contract Date :,Contract Value :,Work Completion Period in days :,Updated By :,Updated on :,AOC document :,S.No,Bid Number,Bidder Name,Awarded Currency,Awarded Value,S.No.1,Bid Number.1,Bidder Name.1,Submitted Date,Status,Remarks,Status Updated On,Type :,Summary :,Updated By :.1,Updated On :,Document :,BOQ Comparative Chart :,Committee Chairperson/Co-ordinator Name :,Committee Chairperson/Co-ordinator Type :,Committee Members :,Updated By :.2,Updated on :.1,Document :.1,Organisation Chain :,Tender ID :,Tender Ref No :,Tender Title :,Committee Chairperson/Co-ordinator Name :.1,Committee Chairperson/Co-ordinator Type :.1,Committee Members :.1,Updated By :.3,Updated On :.1,Document :.2,Tender Stage
CE RW I||RWCIRCLE-SUNABEDA||RWDIVISION-NAWARANGAPUR,EERWNGP Online 5 2024 25,2024_CERWI_108556_1,Yes,Open Tender,Percentage,Works,1.0,No,No,Online,No,No,No,1.0,Fee/PreQual/Technical/Finance,.pdf,License PAN Card GSTIN affidavit and as per DTCN,20-Dec-2024 01:30 PM,30-Dec-2024 11:00 AM,20-Dec-2024 01:30 PM,27-Dec-2024 03:00 PM,20-Dec-2024 01:30 PM ,27-Dec-2024 03:00 PM ,20-Dec-2024 01:30 PM,27-Dec-2024 03:00 PM,"43,322",Yes,percentage,1.0%,Nil,Nil,1.0,ICICI BANK,"6,000",0.0,Nil,Nil,No,Superintending Engineer,"RURAL WORKS DIVISION, NAWARANGPUR",Construction of 1 No D Type Quarter Building for SDO at RW Sub Division Tentulikhunti for the year 2024 25,Construction of 1 No D Type Quarter Building for SDO at RW Sub Division Tentulikhunti for the year 2024 25,Please refer tender documents ,NA ,"43,32,174",Civil Works - Buildings,NA ,Tender,90.0,180.0,Tentulikhunti Block,764070.0,NA ,NA ,NA ,"RURAL WORKS DIVISION, NAWARANGPUR",No ,No,AOC,16-Jan-2025,"INR 4,332,174",180.0,Debarsi Naik,16-Jan-2025 06:47 PM,313.pdf (247.00 KB),1.0,2712481.0,RAMA CHANDRA PRADHAN,INR,"3,682,781",1,2713412,DHANANJAYA BISSOYI,27-Dec-2024 12:13 PM,Rejected-AOC,Disqualified in transparent lottery,16-Jan-2025 06:47 PM,Finance,Tender Opening,Debarsi Naik,09-Jan-2025 04:33 PM,finance_521312.pdf,BOQ Comparative Chart,Superintending Engineer,Internal,"Estimator,DAO,SE",Debarsi Naik,09-Jan-2025 05:15 PM,finsummary_521312.pdf (293.40 KB),CE RW I||RWCIRCLE-SUNABEDA||RWDIVISION-NAWARANGAPUR,2024_CERWI_108556_1,EERWNGP Online 5 2024 25,Construction of 1 No D Type Quarter Building for SDO at RW Sub Division Tentulikhunti for the year 2024 25,Superintending Engineer,Internal,"Estimator,DAO,SE",Debarsi Naik,09-Jan-2025 05:08 PM,techsummary_521312.pdf (293.40 KB),AOC
,,,,,,,,,,,,,,,,.xls,Boq,,,,,,,,,,,,,,,2.0,ICICI NEFT/RTGS,,,,,,,,,,,,,,,,,,,,,,,,,,AOC,,,,,,,,,,,,2,2712567,KHIRASINDHU HARIJAN,26-Dec-2024 04:30 PM,Rejected-AOC,Disqualified in transparent lottery,16-Jan-2025 06:47 PM,,,,,,,,,,,,,,,,,,,,,,,AOC
,,,,,,,,,,,,,,,,.pdf,Required machineries as per DTCN,,,,,,,,,,,,,,,,,,,,,,,,,,,,,,,,,,,,,,,,,,AOC,,,,,,,,,,,,3,2713711,KHYAMANIDHI HARIJAN,27-Dec-2024 02:08 PM,Rejected-AOC,Disqualified in transparent lottery,16-Jan-2025 06:47 PM,,,,,,,,,,,,,,,,,,,,,,,AOC
,,,,,,,,,,,,,,,,,,,,,,,,,,,,,,,,,,,,,,,,,,,,,,,,,,,,,,,,,,,AOC,,,,,,,,,,,,4,2713622,NIHAR RANJAN JENA,27-Dec-2024 01:27 PM,Rejected-AOC,Disqualified in transparent lottery,16-Jan-2025 06:47 PM,,,,,,,,,,,,,,,,,,,,,,,AOC
,,,,,,,,,,,,,,,,,,,,,,,,,,,,,,,,,,,,,,,,,,,,,,,,,,,,,,,,,,,AOC,,,,,,,,,,,,5,2712481,RAMA CHANDRA PRADHAN,26-Dec-2024 04:01 PM,Accepted-AOC,Awarded of Contract,16-Jan-2025 06:47 PM,,,,,,,,,,,,,,,,,,,,,,,AOC
,,,,,,,,,,,,,,,,,,,,,,,,,,,,,,,,,,,,,,,,,,,,,,,,,,,,,,,,,,,AOC,,,,,,,,,,,,6,2713760,SAHIL KHAN,27-Dec-2024 02:38 PM,Rejected-AOC,Disqualified in transparent lottery,16-Jan-2025 06:47 PM,,,,,,,,,,,,,,,,,,,,,,,AOC
