Organisation Chain,Tender Reference Number,Tender ID,Withdrawal Allowed,Tender Type,Form of contract,Tender Category,No. of Covers,General Technical Evaluation Allowed,ItemWise Technical Evaluation Allowed,Payment Mode,Is Multi Currency Allowed For BOQ,Is Multi Currency Allowed For Fee,Allow Two Stage Bidding,Cover No,Cover,Document Type,Description,Publish Date,Bid Opening Date,Document Download / Sale Start Date,Document Download / Sale End Date,Clarification Start Date,Clarification End Date,Bid Submission Start Date,Bid Submission End Date,EMD Amount in ₹,EMD Exemption Allowed,EMD Fee Type,EMD Percentage,EMD Payable To,EMD Payable At,S.No,Bank Name,Tender Fee in ₹,Fee Payable To,Fee Payable At,Tender Fee Exemption Allowed,Name,Address,Title,Work Description,Pre Qualification Details,Independent External Monitor/Remarks,Tender Value in ₹,Product Category,Sub category,Contract Type,Bid Validity(Days),Period Of Work(Days),Location,Pincode,Pre Bid Meeting Place,Pre Bid Meeting Address,Pre Bid Meeting Date,Bid Opening Place,Should Allow NDA Tender,Allow Preferential Bidder,Tender Stage,Contract Date :,Contract Value :,Work Completion Period in days :,Updated By :,Updated on :,AOC document :,AOC Description :,S.No,Bid Number,Bidder Name,Awarded Currency,Awarded Value,S.No.1,Bid Number.1,Bidder Name.1,Submitted Date,Status,Remarks,Status Updated On,Type :,Summary :,Updated By :.1,Updated On :,Document :,BOQ Comparative Chart :,Committee Chairperson/Co-ordinator Name :,Committee Chairperson/Co-ordinator Type :,Committee Members :,Updated By :.2,Updated on :.1,Document :.1,Organisation Chain :,Tender ID :,Tender Ref No :,Tender Title :,Committee Chairperson/Co-ordinator Name :.1,Committee Chairperson/Co-ordinator Type :.1,Committee Members :.1,Updated By :.3,Updated On :.1,Document :.2,Tender Stage
Panchayati Raj and Drinking Water Department Odisha||Zilla Parisad Balangir||TITLAGARH Block,01/2024-25/Titilagarh block,2024_PRBTL_104813_4,Yes,Open Tender,Percentage,Works,1.0,No,No,Online,No,No,No,1.0,Fee/PreQual/Technical/Finance,.pdf,"online proof copy of Tender paper cost, EMD, Registration Certificate, GST, PAN card etc.",12-Sep-2024 03:00 PM,04-Oct-2024 11:00 AM,12-Sep-2024 03:00 PM,03-Oct-2024 05:30 PM,12-Sep-2024 03:00 PM ,01-Oct-2024 05:30 PM ,12-Sep-2024 03:00 PM,03-Oct-2024 05:30 PM,"12,524",No,percentage,1.0%,Nil,Nil,1.0,ICICI BANK,"6,000",Nil,Nil,No,BDO,"Panchayat Samiti Office, Titilagarh",Construction of Additional Class room at Ghodar Govt UPS,Building Works,Please refer Tender documents. ,NA ,"12,52,373",Civil Works - Buildings,NA ,Tender,90.0,90.0,Titilagarh,767033.0,NA ,NA ,NA ,Titilagarh Block Office,No ,No,AOC,19-Nov-2024,"INR 1,064,642.28",90.0,SHIBANI PRADHAN,04-Jan-2025 07:13 PM,GHODAR.pdf (1198.00 KB),Construction of Additional Class room at Ghodar Govt UPS,1.0,2564550.0,SURESH CHANDRA BHOI,INR,"1,064,642.28",1,2548247,ASHOK MEHER,15-Sep-2024 06:30 PM,Rejected-AOC,Not qualifying in Lottery System,04-Jan-2025 07:13 PM,Finance,07 NOS. OF BID ARE ADMITTED.,SHIBANI PRADHAN,28-Oct-2024 04:54 PM,,BOQ Comparative Chart,BDO Titilagarh,Internal,"BDO Titilagarh,Asst. Executive Engineer,Block Finance Officer,Section Officer,TC Sarva Sikshya Aviyan",Rajkishor Seth,28-Oct-2024 06:21 PM,finsummary_506582.pdf (384.04 KB),Panchayati Raj and Drinking Water Department Odisha||Zilla Parisad Balangir||TITLAGARH Block,2024_PRBTL_104813_4,01/2024-25/Titilagarh block,Construction of Additional Class room at Ghodar Govt UPS,BDO Titilagarh,Internal,"BDO Titilagarh,Asst. Executive Engineer,Block Finance Officer,Section Officer,TC Sarva Sikshya Aviyan",Rajkishor Seth,28-Oct-2024 05:34 PM,techsummary_506582.pdf (660.49 KB),AOC
,,,,,,,,,,,,,,,,.pdf,"No Relationship Certificate, Affidavits, and Others documents as per DTCN",,,,,,,,,,,,,,,2.0,ICICI NEFT/RTGS,,,,,,,,,,,,,,,,,,,,,,,,,AOC,,,,,,,,,,,,,2,2565784,JYOTI DORA,02-Oct-2024 08:56 PM,Rejected-AOC,Not qualifying in Lottery System,04-Jan-2025 07:13 PM,,,,,,,,,,,,,,,,,,,,,,,AOC
,,,,,,,,,,,,,,,,.xls,BOQ,,,,,,,,,,,,,,,,,,,,,,,,,,,,,,,,,,,,,,,,,AOC,,,,,,,,,,,,,3,2565749,MAA MANGALA TRADERS,02-Oct-2024 08:46 PM,Rejected-AOC,Not qualifying in Lottery System,04-Jan-2025 07:13 PM,,,,,,,,,,,,,,,,,,,,,,,AOC
,,,,,,,,,,,,,,,,,,,,,,,,,,,,,,,,,,,,,,,,,,,,,,,,,,,,,,,,,,AOC,,,,,,,,,,,,,4,2566196,MANASH KUMAR SAHU,03-Oct-2024 12:43 PM,Rejected-AOC,Not qualifying in Lottery System,04-Jan-2025 07:13 PM,,,,,,,,,,,,,,,,,,,,,,,AOC
,,,,,,,,,,,,,,,,,,,,,,,,,,,,,,,,,,,,,,,,,,,,,,,,,,,,,,,,,,AOC,,,,,,,,,,,,,5,2564083,SATYABHAMA BEHERA,01-Oct-2024 06:41 PM,Rejected-Finance,Quoted Percentage 0.50 Less,28-Oct-2024 06:21 PM,,,,,,,,,,,,,,,,,,,,,,,AOC
,,,,,,,,,,,,,,,,,,,,,,,,,,,,,,,,,,,,,,,,,,,,,,,,,,,,,,,,,,AOC,,,,,,,,,,,,,6,2564550,SURESH CHANDRA BHOI,01-Oct-2024 01:46 PM,Accepted-AOC,win in Lottery System,04-Jan-2025 07:13 PM,,,,,,,,,,,,,,,,,,,,,,,AOC
,,,,,,,,,,,,,,,,,,,,,,,,,,,,,,,,,,,,,,,,,,,,,,,,,,,,,,,,,,AOC,,,,,,,,,,,,,7,2564078,SUSANTA SAHU,30-Sep-2024 08:36 PM,Rejected-Finance,Quoted Percentage 2.00 High,28-Oct-2024 06:21 PM,,,,,,,,,,,,,,,,,,,,,,,AOC
