Organisation Chain,Tender Reference Number,Tender ID,Withdrawal Allowed,Tender Type,Form of contract,Tender Category,No. of Covers,General Technical Evaluation Allowed,ItemWise Technical Evaluation Allowed,Payment Mode,Is Multi Currency Allowed For BOQ,Is Multi Currency Allowed For Fee,Allow Two Stage Bidding,Cover No,Cover,Document Type,Description,Publish Date,Bid Opening Date,Document Download / Sale Start Date,Document Download / Sale End Date,Clarification Start Date,Clarification End Date,Bid Submission Start Date,Bid Submission End Date,Financial Bid Opening Date,EMD Amount in ₹,EMD Exemption Allowed,EMD Fee Type,EMD Percentage,EMD Payable To,EMD Payable At,S.No,Corrigendum Title,Corrigendum Type,View,S.No.1,Bank Name,Tender Fee in ₹,VAT Charges in ₹,Fee Payable To,Fee Payable At,Tender Fee Exemption Allowed,Name,Address,Title,Work Description,Pre Qualification Details,Independent External Monitor/Remarks,Tender Value in ₹,Product Category,Sub category,Contract Type,Bid Validity(Days),Period Of Work(Days),Location,Pincode,Pre Bid Meeting Place,Pre Bid Meeting Address,Pre Bid Meeting Date,Bid Opening Place,Should Allow NDA Tender,Allow Preferential Bidder,Tender Stage,Contract Date :,Contract Value :,Work Completion Period in days :,Updated By :,Updated on :,AOC document :,AOC Description :,S.No,Bid Number,Bidder Name,Awarded Currency,Awarded Value,S.No.1,Bid Number.1,Bidder Name.1,Submitted Date,Status,Remarks,Status Updated On,Type :,Summary :,Updated By :.1,Updated On :,Document :,BOQ Comparative Chart :,Committee Chairperson/Co-ordinator Name :,Committee Chairperson/Co-ordinator Type :,Committee Members :,Updated By :.2,Updated on :.1,Document :.1,Organisation Chain :,Tender ID :,Tender Ref No :,Tender Title :,Type :.1,Summary :.1,Updated By :.3,Updated On :.1,Document :.2,Committee Chairperson/Co-ordinator Name :.1,Committee Chairperson/Co-ordinator Type :.1,Committee Members :.1,Updated By :.4,Updated On :.2,Financial Bid Opening Date:,Document :.3,Tender Stage
PHEO||PH Circle Bhawanipatna||PH Division Balangir,SEPHBGR 06/2024-25,2024_PHEO_106116_1,Yes,National Competitive Bid,Percentage,Works,2.0,No,No,Online,No,No,No,1.0,Fee/PreQual/Technical,.pdf,"Tender paper cost, EMD, PAN, GSTIN, Contractor registration certificate, Experience certificate, etc",28-Oct-2024 01:00 PM,13-Nov-2024 11:00 AM,28-Oct-2024 01:00 PM,12-Nov-2024 05:00 PM,28-Oct-2024 01:00 PM ,08-Nov-2024 05:00 PM ,28-Oct-2024 01:00 PM,12-Nov-2024 05:00 PM,04-Dec-2024 10:45 AM,"2,25,152",Yes,percentage,1.0%,Nil,Nil,1.0,Class of Contrctor,Other,,1.0,ICICI BANK,"10,000",0.0,Nil,Nil,No,Superintending Engineer,"Superintending Engineer, P.H. Division, Balangir","Scada and Automation for intake, WTP, ESRs and GSRs under Improvement of water supply to Titilagarh Town.","Scada and Automation for intake, WTP, ESRs and GSRs under Improvement of water supply to Titilagarh Town.",Please refer DTCN ,NA ,"2,25,15,223",Civil Works - Water Works,NA ,Tender,120.0,150.0,Titilagarh Municipality,767033.0,NA ,NA ,NA ,"Superintending Engineer, P.H. Division, Balangir",No ,No,AOC,24-Jan-2025,"INR 22,515,222.53",150.0,Indrajit Sahu,24-Jan-2025 05:12 PM,WO.pdf (584.00 KB),L1 Bidder has respond,1.0,2641778.0,parthasarathi chhotaray,INR,"19,140,191",1,2641045,ASCENSOR LIFTS AND AUTOMATION PRIVATE LIMITED,12-Nov-2024 10:44 AM,Rejected-AOC,Rejected as per OPWD code,24-Jan-2025 05:12 PM,Finance,Bid had opened,Indrajit Sahu,04-Dec-2024 11:49 AM,finance_512586.pdf,BOQ Comparative Chart,Superintending Engineer,Internal,"Superintending Engineer, Divisional Account Officer, EE Estimator",Indrajit Sahu,24-Jan-2025 05:07 PM,finsummary_512586.pdf (715.15 KB),PHEO||PH Circle Bhawanipatna||PH Division Balangir,2024_PHEO_106116_1,SEPHBGR 06/2024-25,"Scada and Automation for intake, WTP, ESRs and GSRs under Improvement of water supply to Titilagarh Town.",Technical,Opening Summary,Indrajit Sahu,14-Nov-2024 10:50 AM,technical_512586.pdf,Superintending Engineer,Internal,"Superintending Engineer, Divisional Accounts officer, EE Estimator",Bachanlal Sahu,04-Dec-2024 10:23 AM,04-Dec-2024 10:45 AM,techsummary_512586.pdf (10265.86 KB),AOC
,,,,,,,,,,,,,,,,.pdf,Other documents as per DTCN,,,,,,,,,,,,,,,,,,,,2.0,ICICI NEFT/RTGS,,,,,,,,,,,,,,,,,,,,,,,,,,AOC,,,,,,,,,,,,,2,2627280,Automatech Electric Co,12-Nov-2024 04:31 PM,Rejected-AOC,Rejected as per OPWD code,24-Jan-2025 05:12 PM,,,,,,,,,,,,,,,,,,,,,,,,,,,,,AOC
,,,,,,,,,,,,,,2.0,Finance,.xls,BOQ,,,,,,,,,,,,,,,,,,,,,,,,,,,,,,,,,,,,,,,,,,,,,,,AOC,,,,,,,,,,,,,3,2639578,Drite Automation and Engineering,11-Nov-2024 04:06 PM,Rejected-AOC,Rejected as per OPWD code,24-Jan-2025 05:12 PM,,,,,,,,,,,,,,,,,,,,,,,,,,,,,AOC
,,,,,,,,,,,,,,,,,,,,,,,,,,,,,,,,,,,,,,,,,,,,,,,,,,,,,,,,,,,,,,,,AOC,,,,,,,,,,,,,4,2633951,JUBARAJ KUMBHAR,09-Nov-2024 02:28 PM,Rejected-Technical,Do not fulfill the Minimum eligibility criteria as per the clause of DTCN,04-Dec-2024 10:23 AM,,,,,,,,,,,,,,,,,,,,,,,,,,,,,AOC
,,,,,,,,,,,,,,,,,,,,,,,,,,,,,,,,,,,,,,,,,,,,,,,,,,,,,,,,,,,,,,,,AOC,,,,,,,,,,,,,5,2637824,M/s WATCO,12-Nov-2024 12:35 PM,Rejected-AOC,Rejected as per OPWD code,24-Jan-2025 05:12 PM,,,,,,,,,,,,,,,,,,,,,,,,,,,,,AOC
,,,,,,,,,,,,,,,,,,,,,,,,,,,,,,,,,,,,,,,,,,,,,,,,,,,,,,,,,,,,,,,,AOC,,,,,,,,,,,,,6,2641778,parthasarathi chhotaray,12-Nov-2024 02:30 PM,Accepted-AOC,Awarded as per OPWD code,24-Jan-2025 05:12 PM,,,,,,,,,,,,,,,,,,,,,,,,,,,,,AOC
,,,,,,,,,,,,,,,,,,,,,,,,,,,,,,,,,,,,,,,,,,,,,,,,,,,,,,,,,,,,,,,,AOC,,,,,,,,,,,,,7,2640293,SABITA JENA,12-Nov-2024 04:37 PM,Rejected-Technical,Do not fulfill the Minimum eligibility criteria as per the clause of DTCN,04-Dec-2024 10:23 AM,,,,,,,,,,,,,,,,,,,,,,,,,,,,,AOC
