Organisation Chain,Tender Reference Number,Tender ID,Withdrawal Allowed,Tender Type,Form of contract,Tender Category,No. of Covers,General Technical Evaluation Allowed,ItemWise Technical Evaluation Allowed,Payment Mode,Is Multi Currency Allowed For BOQ,Is Multi Currency Allowed For Fee,Allow Two Stage Bidding,Cover No,Cover,Document Type,Description,Publish Date,Bid Opening Date,Document Download / Sale Start Date,Document Download / Sale End Date,Clarification Start Date,Clarification End Date,Bid Submission Start Date,Bid Submission End Date,Financial Bid Opening Date,EMD Amount in ₹,EMD Exemption Allowed,EMD Fee Type,EMD Percentage,EMD Payable To,EMD Payable At,S.No,Bank Name,Tender Fee in ₹,VAT Charges in ₹,Fee Payable To,Fee Payable At,Tender Fee Exemption Allowed,Name,Address,Title,Work Description,Pre Qualification Details,Independent External Monitor/Remarks,Tender Value in ₹,Product Category,Sub category,Contract Type,Bid Validity(Days),Period Of Work(Days),Location,Pincode,Pre Bid Meeting Place,Pre Bid Meeting Address,Pre Bid Meeting Date,Bid Opening Place,Should Allow NDA Tender,Allow Preferential Bidder,Tender Stage,Contract Date :,Contract Value :,Work Completion Period in days :,Updated By :,Updated on :,AOC document :,AOC Description :,S.No,Bid Number,Bidder Name,Awarded Currency,Awarded Value,S.No.1,Bid Number.1,Bidder Name.1,Submitted Date,Status,Remarks,Status Updated On,Type :,Summary :,Updated By :.1,Updated On :,Document :,BOQ Comparative Chart :,Committee Chairperson/Co-ordinator Name :,Committee Chairperson/Co-ordinator Type :,Committee Members :,Updated By :.2,Updated on :.1,Document :.1,Organisation Chain :,Tender ID :,Tender Ref No :,Tender Title :,Type :.1,Summary :.1,Updated By :.3,Updated On :.1,Document :.2,Committee Chairperson/Co-ordinator Name :.1,Committee Chairperson/Co-ordinator Type :.1,Committee Members :.1,Updated By :.4,Updated On :.2,Financial Bid Opening Date:,Document :.3,Tender Stage
EIC-CIVIL||SERNB-CIRCLE-DHENKANAL||EERNB DIVN CHARBATIA,CCE DKL R and B/09-2024-25,2024_EICCL_106803_1,Yes,Open Tender,Percentage,Works,2.0,No,No,Online,No,No,No,1.0,Fee/PreQual/Technical,.pdf,"GSTIN, EMD, PAN, Valid RC",13-Nov-2024 10:00 AM,28-Nov-2024 11:00 AM,13-Nov-2024 10:00 AM,27-Nov-2024 05:00 PM,NA ,NA ,13-Nov-2024 10:00 AM,27-Nov-2024 05:00 PM,09-Dec-2024 03:00 PM,"4,83,000",Yes,fixed,,Nil,Nil,1.0,ICICI BANK,"10,000",0.0,Nil,Nil,No,CCE Dhenkanal R and B Circle Dhenkanal,CCE Dhenkanal R and B Circle Dhenkanal,Repair and Rehabilitation of Bridge over river Ramial on Dhenkanal Kamakhyanagar road at 26.105 Km in the District of Dhenkanal for the year 2024-25,Repair and Rehabilitation of Bridge over river Ramial on Dhenkanal Kamakhyanagar road at 26.105 Km in the District of Dhenkanal for the year 2024-25,Please refer Tender documents  ,NA ,"4,83,27,276",Civil Works - Bridges,NA ,Tender,90.0,210.0,Dhenkanal,759001.0,NA ,NA ,NA ,CCE Dhenkanal R and B Circle Dhenkanal,No ,No,AOC,02-Apr-2025,"INR 48,327,276.32",210.0,Ajit Kumar Ray,02-Apr-2025 07:31 PM,Rehabilitation_Bridge_Sanrachana.pdf (620.00 KB),Agreement on dt. 19.03.2025,1.0,2664313.0,SANRACHANA STRUCTURAL STRENGTHENING PVT LTD,INR,"41,083,018",1,2666519,Dynasoure Concrete Treatment Pvt. Ltd.,27-Nov-2024 02:17 PM,Rejected-Technical,Disqualified as per clause No 10 of DTCN and 14 iii,07-Dec-2024 01:44 PM,Finance,Opened,Ajit Kumar Ray,09-Dec-2024 04:54 PM,finance_515611.pdf,BOQ Comparative Chart,CCE Dhenkanal Circle,Internal,SE DAO Estimator of Division PA to CCE Estimator of Circle,Ajit Kumar Ray,02-Apr-2025 07:27 PM,finsummary_515611.pdf (158.12 KB),EIC-CIVIL||SERNB-CIRCLE-DHENKANAL||EERNB DIVN CHARBATIA,2024_EICCL_106803_1,CCE DKL R and B/09-2024-25,Repair and Rehabilitation of Bridge over river Ramial on Dhenkanal Kamakhyanagar road at 26.105 Km in the District of Dhenkanal for the year 2024-25,Technical,Opened,Ajit Kumar Ray,28-Nov-2024 12:47 PM,technical_515611.pdf,CCE Dhenkanal Circle,Internal,SE DAO Estimator of Division PA to CCE Estimator of Circle,Ajit Kumar Ray,07-Dec-2024 01:44 PM,09-Dec-2024 03:00 PM,techsummary_515611.pdf (1051.52 KB),AOC
,,,,,,,,,,,,,,,,.pdf,"Affidavit, Machineries and other documents as per DTCN",,,,,,,,,,,,,,,,2.0,ICICI NEFT/RTGS,,,,,,,,,,,,,,,,,,,,,,,,,,AOC,,,,,,,,,,,,,2,2668936,Hercules Structural Systems Pvt. Ltd.,27-Nov-2024 01:38 PM,Rejected-AOC,Quoted rate is in higher side,02-Apr-2025 07:31 PM,,,,,,,,,,,,,,,,,,,,,,,,,,,,,AOC
,,,,,,,,,,,,,,2.0,Finance,.xls,Bill of Quantity,,,,,,,,,,,,,,,,,,,,,,,,,,,,,,,,,,,,,,,,,,,AOC,,,,,,,,,,,,,3,2664313,SANRACHANA STRUCTURAL STRENGTHENING PVT LTD,27-Nov-2024 12:49 PM,Accepted-AOC,Work has been awarded,02-Apr-2025 07:31 PM,,,,,,,,,,,,,,,,,,,,,,,,,,,,,AOC
,,,,,,,,,,,,,,,,,,,,,,,,,,,,,,,,,,,,,,,,,,,,,,,,,,,,,,,,,,,,AOC,,,,,,,,,,,,,4,2669442,Santosh Kumar Behera,27-Nov-2024 03:00 PM,Rejected-Technical,Disqualified as per DTCN clause No 14 iii,07-Dec-2024 01:44 PM,,,,,,,,,,,,,,,,,,,,,,,,,,,,,AOC
,,,,,,,,,,,,,,,,,,,,,,,,,,,,,,,,,,,,,,,,,,,,,,,,,,,,,,,,,,,,AOC,,,,,,,,,,,,,5,2668897,SSA TECHNO CONSTRUCTION PVT LTD,27-Nov-2024 04:59 PM,Rejected-Technical,Disqualified as per clause No 11 of DTCN,07-Dec-2024 01:44 PM,,,,,,,,,,,,,,,,,,,,,,,,,,,,,AOC
