Organisation Chain,Tender Reference Number,Tender ID,Withdrawal Allowed,Tender Type,Form of contract,Tender Category,No. of Covers,General Technical Evaluation Allowed,ItemWise Technical Evaluation Allowed,Payment Mode,Is Multi Currency Allowed For BOQ,Is Multi Currency Allowed For Fee,Allow Two Stage Bidding,Cover No,Cover,Document Type,Description,Publish Date,Bid Opening Date,Document Download / Sale Start Date,Document Download / Sale End Date,Clarification Start Date,Clarification End Date,Bid Submission Start Date,Bid Submission End Date,EMD Amount in ₹,EMD Exemption Allowed,EMD Fee Type,EMD Percentage,EMD Payable To,EMD Payable At,S.No,Corrigendum Title,Corrigendum Type,View,S.No.1,Bank Name,Tender Fee in ₹,VAT Charges in ₹,Fee Payable To,Fee Payable At,Tender Fee Exemption Allowed,Name,Address,Title,Work Description,Pre Qualification Details,Independent External Monitor/Remarks,Tender Value in ₹,Product Category,Sub category,Contract Type,Bid Validity(Days),Period Of Work(Days),Location,Pincode,Pre Bid Meeting Place,Pre Bid Meeting Address,Pre Bid Meeting Date,Bid Opening Place,Should Allow NDA Tender,Allow Preferential Bidder,Tender Stage,Contract Date :,Contract Value :,Work Completion Period in days :,Updated By :,Updated on :,AOC document :,AOC Description :,S.No,Bid Number,Bidder Name,Awarded Currency,Awarded Value,S.No.1,Bid Number.1,Bidder Name.1,Submitted Date,Status,Remarks,Status Updated On,Type :,Summary :,Updated By :.1,Updated On :,Document :,BOQ Comparative Chart :,Committee Chairperson/Co-ordinator Name :,Committee Chairperson/Co-ordinator Type :,Committee Members :,Updated By :.2,Updated on :.1,Document :.1,Organisation Chain :,Tender ID :,Tender Ref No :,Tender Title :,Committee Chairperson/Co-ordinator Name :.1,Committee Chairperson/Co-ordinator Type :.1,Committee Members :.1,Updated By :.3,Updated On :.1,Document :.2,Tender Stage
"CCE Potteru Irr.Project,Balimela||CCE Potteru Irr.Project||Earth Dam Divn. Chitrakonda",SE-PID-BML-06/2024-25,2025_CCEBA_111703_1,Yes,Open Tender,Percentage,Services,1.0,No,No,Online,No,No,No,1.0,Fee/PreQual/Technical/Finance,.pdf,"Affidavit, No Relation Certificate, No Litigation Certificate, Bid Cost, Bid Security (EMD)",18-Mar-2025 10:00 AM,28-Mar-2025 11:00 AM,18-Mar-2025 10:00 AM,27-Mar-2025 05:00 PM,NA ,NA ,18-Mar-2025 10:00 AM,27-Mar-2025 05:00 PM,"36,000",No,fixed,,Nil,Nil,1.0,Man Power Requirement Change,Other,,1.0,ICICI BANK,"6,000",0.0,Nil,Nil,No,"O/O SE, PID, BALIMELA","O/O SE, PID, BALIMELA","Providing Security arrangement for P.I. Division, Balimela for the period from April 2025 to March 2026","Providing Security arrangement for P.I. Division, Balimela for the period from April 2025 to March 2026",Please refer Tender documents. ,NA ,"35,61,816",Human Resources Supply,NA ,Tender,90.0,365.0,BALIMELA,764051.0,NA ,NA ,NA ,"O/O SE, PID, BALIMELA",No ,No,AOC,23-Apr-2025,"INR 3,205,991",365.0,Ramakanta Patra,23-Apr-2025 07:53 PM,WORK_ORDER.pdf (701.00 KB),Agreement Drawn Vide Agreement No.01(Security Services)/2025-26 dtd.07.04.2025,1.0,2869641.0,SISF SERVICE PRIVATE LIMITED,INR,"3,205,991",1.0,2867827.0,ACTIVE SECURITY AND INTELLIGENCE SEVICES,25-Mar-2025 04:51 PM,Rejected-Technical,REJECTED,23-Apr-2025 07:42 PM,Finance,BID OPENING SUMMARY,Ramakanta Patra,23-Apr-2025 07:37 PM,finance_533354.pdf,BOQ Comparative Chart,Er. Karuna Sagar Behera,Internal,"Er.Karuna Sagar Behera, S.E., P.I.D, Balimela, Er.Abhishek Sahu, A.E.E (Estimator), P.I.D, Balimela, Sri Vijay Singh Meena, D.A., P.I.D, Balimela",Ramakanta Patra,23-Apr-2025 07:48 PM,finsummary_533354.pdf (573.45 KB),"CCE Potteru Irr.Project,Balimela||CCE Potteru Irr.Project||Earth Dam Divn. Chitrakonda",2025_CCEBA_111703_1,SE-PID-BML-06/2024-25,"Providing Security arrangement for P.I. Division, Balimela for the period from April 2025 to March 2026",Er. Karuna Sagar Behera,Internal,"Er.Karuna Sagar Behera, S.E., P.I.D, Balimela, Er.Abhishek Sahu, A.E.E (Estimator), P.I.D, Balimela, Sri Vijay Singh Meena, D.A., P.I.D, Balimela",Ramakanta Patra,23-Apr-2025 07:42 PM,techsummary_533354.pdf (492.44 KB),AOC
,,,,,,,,,,,,,,,,.pdf,"Certificate of Registration Under Company Act, Active GSTIN, PAN Card",,,,,,,,,,,,,,,,,,,2.0,ICICI NEFT/RTGS,,,,,,,,,,,,,,,,,,,,,,,,,,AOC,,,,,,,,,,,,,2.0,2869258.0,M/SMANOJ KUMAR PATRA,26-Mar-2025 02:36 PM,Rejected-Technical,REJECTED,23-Apr-2025 07:42 PM,,,,,,,,,,,,,,,,,,,,,,,AOC
,,,,,,,,,,,,,,,,.pdf,"Registration Certificate under EPF, Registration Certificate under ESIC",,,,,,,,,,,,,,,,,,,,,,,,,,,,,,,,,,,,,,,,,,,,,,AOC,,,,,,,,,,,,,3.0,2870394.0,SAMAYA SECURITY SERVICE PVT LTD,27-Mar-2025 04:48 PM,Rejected-Finance,Not Selected through Transparent Lottery Process,23-Apr-2025 07:48 PM,,,,,,,,,,,,,,,,,,,,,,,AOC
,,,,,,,,,,,,,,,,.pdf,Valid License under Private Security Regulation Act and other documets as per DTCN,,,,,,,,,,,,,,,,,,,,,,,,,,,,,,,,,,,,,,,,,,,,,,AOC,,,,,,,,,,,,,4.0,2869641.0,SISF SERVICE PRIVATE LIMITED,26-Mar-2025 06:10 PM,Accepted-AOC,Lowest Valid Responsive L1 Bidder,23-Apr-2025 07:53 PM,,,,,,,,,,,,,,,,,,,,,,,AOC
,,,,,,,,,,,,,,,,.xls,BOQ,,,,,,,,,,,,,,,,,,,,,,,,,,,,,,,,,,,,,,,,,,,,,,AOC,,,,,,,,,,,,,,,,,,,,,,,,,,,,,,,,,,,,,,,,,,AOC
