Organisation Chain,Tender Reference Number,Tender ID,Withdrawal Allowed,Tender Type,Form of contract,Tender Category,No. of Covers,General Technical Evaluation Allowed,ItemWise Technical Evaluation Allowed,Payment Mode,Is Multi Currency Allowed For BOQ,Is Multi Currency Allowed For Fee,Allow Two Stage Bidding,Cover No,Cover,Document Type,Description,Publish Date,Bid Opening Date,Document Download / Sale Start Date,Document Download / Sale End Date,Clarification Start Date,Clarification End Date,Bid Submission Start Date,Bid Submission End Date,Financial Bid Opening Date,EMD Amount in ₹,EMD Exemption Allowed,EMD Fee Type,EMD Percentage,EMD Payable To,EMD Payable At,S.No,Bank Name,Tender Fee in ₹,VAT Charges in ₹,Fee Payable To,Fee Payable At,Tender Fee Exemption Allowed,Name,Address,Title,Work Description,Pre Qualification Details,Independent External Monitor/Remarks,Tender Value in ₹,Product Category,Sub category,Contract Type,Bid Validity(Days),Period Of Work(Days),Location,Pincode,Pre Bid Meeting Place,Pre Bid Meeting Address,Pre Bid Meeting Date,Bid Opening Place,Should Allow NDA Tender,Allow Preferential Bidder,Tender Stage,Contract Date :,Contract Value :,Work Completion Period in days :,Updated By :,Updated on :,AOC document :,AOC Description :,S.No,Bid Number,Bidder Name,Awarded Currency,Awarded Value,S.No.1,Bid Number.1,Bidder Name.1,Submitted Date,Status,Remarks,Status Updated On,Type :,Summary :,Updated By :.1,Updated On :,Document :,BOQ Comparative Chart :,Committee Chairperson/Co-ordinator Name :,Committee Chairperson/Co-ordinator Type :,Committee Members :,Updated By :.2,Updated on :.1,Document :.1,Organisation Chain :,Tender ID :,Tender Ref No :,Tender Title :,Type :.1,Summary :.1,Updated By :.3,Updated On :.1,Document :.2,Committee Chairperson/Co-ordinator Name :.1,Committee Chairperson/Co-ordinator Type :.1,Committee Members :.1,Updated By :.4,Updated On :.2,Financial Bid Opening Date:,Document :.3,Tender Stage
Orissa State Police Housing and Welfare Corporation Ltd,12/OPHWC/2024-25,2024_OSPHW_108085_6,Yes,National Competitive Bid,Percentage,Works,2.0,No,No,Online,No,No,No,1.0,Fee/PreQual/Technical,.pdf,"GST, GSTR-1, PAN, Contractor Registration Certificate and Affidavit",09-Dec-2024 06:55 PM,26-Dec-2024 10:30 AM,09-Dec-2024 06:55 PM,24-Dec-2024 05:00 PM,NA ,NA ,09-Dec-2024 06:55 PM,24-Dec-2024 05:00 PM,12-Mar-2025 10:30 AM,"3,08,300",Yes,fixed,,Nil,Nil,1.0,ICICI BANK,"11,800",0.0,Nil,Nil,No,CHIEF ENGINEER OPHWC,OPHWC BHUBANESWAR,"Cluster of Constn. of 6 nos. F type Qtrs. and 4 nos. E type Qtrs.at Nimapada PS, Puri.",Building Work,Please refer Tender documents  ,NA ,"3,08,34,623",Civil Works - Buildings,NA ,Tender,90.0,365.0,Puri.,751022.0,NA ,NA ,NA ,OPHWC BHUBANESWAR,No ,No,AOC,11-Apr-2025,"INR 26,212,513.02",365.0,Bikram Keshari Malla,11-Apr-2025 12:17 PM,ACCFGHUYT.pdf (458.00 KB),AWARDED AS L1 TENDERER AND AWARDED ON DATE 09.04.2025,1.0,2709930.0,SUBHENDU KUMAR MOHANTY,INR,"26,212,513.02",1,2709750,BISWAJIT ROUT,24-Dec-2024 01:22 PM,Rejected-Finance,DUE TO L3 BIDDER,11-Apr-2025 12:14 PM,Finance,FINANCIAL BID OPEN AND COMPARATIVE GENERATED,Bikram Keshari Malla,12-Mar-2025 03:37 PM,,BOQ Comparative Chart,AS PER AS ACCEPTANCE LETTER,Internal,AS PER AS ACCEPTANCE LETTER,Bikram Keshari Malla,11-Apr-2025 12:14 PM,finsummary_519991.pdf (457.84 KB),Orissa State Police Housing and Welfare Corporation Ltd,2024_OSPHW_108085_6,12/OPHWC/2024-25,"Cluster of Constn. of 6 nos. F type Qtrs. and 4 nos. E type Qtrs.at Nimapada PS, Puri.",Technical,five bidder have partcipated,Bikram Keshari Malla,26-Dec-2024 01:07 PM,,AS PER TC MINUTES,Internal,AS PER TC MINUTES,BIBHUTI BHUSHAN NAIK,11-Mar-2025 06:53 PM,12-Mar-2025 10:30 AM,techsummary_519991.pdf (335.87 KB),AOC
,,,,,,,,,,,,,,,,.pdf,Other Document as per DTCN,,,,,,,,,,,,,,,,2.0,ICICI NEFT/RTGS,,,,,,,,,,,,,,,,,,,,,,,,,,AOC,,,,,,,,,,,,,2,2709309,ROUTRAY DEVELOPER,24-Dec-2024 08:19 AM,Rejected-Finance,DUE TO L4 BIDDER,11-Apr-2025 12:14 PM,,,,,,,,,,,,,,,,,,,,,,,,,,,,,AOC
,,,,,,,,,,,,,,2.0,Finance,.xls,Bill of Quantity,,,,,,,,,,,,,,,,,,,,,,,,,,,,,,,,,,,,,,,,,,,AOC,,,,,,,,,,,,,3,2706833,SANTOSH KUMAR SENAPATI,23-Dec-2024 10:43 PM,Rejected-Technical,Non-securing qualifying marks in the Point of Presentation as per DTCN Cl.110(m).,11-Mar-2025 06:53 PM,,,,,,,,,,,,,,,,,,,,,,,,,,,,,AOC
,,,,,,,,,,,,,,,,,,,,,,,,,,,,,,,,,,,,,,,,,,,,,,,,,,,,,,,,,,,,AOC,,,,,,,,,,,,,4,2709930,SUBHENDU KUMAR MOHANTY,24-Dec-2024 03:02 PM,Accepted-AOC,QUALIFIED BIDDER,11-Apr-2025 12:17 PM,,,,,,,,,,,,,,,,,,,,,,,,,,,,,AOC
,,,,,,,,,,,,,,,,,,,,,,,,,,,,,,,,,,,,,,,,,,,,,,,,,,,,,,,,,,,,AOC,,,,,,,,,,,,,5,2701063,SUMANTA KUMAR SAHOO,22-Dec-2024 08:20 AM,Rejected-Finance,DUE TO L2 BIDDER,11-Apr-2025 12:14 PM,,,,,,,,,,,,,,,,,,,,,,,,,,,,,AOC
