Organisation Chain,Tender Reference Number,Tender ID,Withdrawal Allowed,Tender Type,Form of contract,Tender Category,No. of Covers,General Technical Evaluation Allowed,ItemWise Technical Evaluation Allowed,Payment Mode,Is Multi Currency Allowed For BOQ,Is Multi Currency Allowed For Fee,Allow Two Stage Bidding,Cover No,Cover,Document Type,Description,Publish Date,Bid Opening Date,Document Download / Sale Start Date,Document Download / Sale End Date,Clarification Start Date,Clarification End Date,Bid Submission Start Date,Bid Submission End Date,EMD Amount in ₹,EMD Exemption Allowed,EMD Fee Type,EMD Percentage,EMD Payable To,EMD Payable At,S.No,Bank Name,Tender Fee in ₹,Fee Payable To,Fee Payable At,Tender Fee Exemption Allowed,Name,Address,Title,Work Description,Pre Qualification Details,Independent External Monitor/Remarks,Tender Value in ₹,Product Category,Sub category,Contract Type,Bid Validity(Days),Period Of Work(Days),Location,Pincode,Pre Bid Meeting Place,Pre Bid Meeting Address,Pre Bid Meeting Date,Bid Opening Place,Should Allow NDA Tender,Allow Preferential Bidder,Tender Stage,Contract Date :,Contract Value :,Work Completion Period in days :,Updated By :,Updated on :,AOC document :,AOC Description :,S.No,Bid Number,Bidder Name,Awarded Currency,Awarded Value,S.No.1,Bid Number.1,Bidder Name.1,Submitted Date,Status,Remarks,Status Updated On,Type :,Summary :,Updated By :.1,Updated On :,Document :,BOQ Comparative Chart :,Committee Chairperson/Co-ordinator Name :,Committee Chairperson/Co-ordinator Type :,Committee Members :,Updated By :.2,Updated on :.1,Document :.1,Organisation Chain :,Tender ID :,Tender Ref No :,Tender Title :,Committee Chairperson/Co-ordinator Name :.1,Committee Chairperson/Co-ordinator Type :.1,Committee Members :.1,Updated By :.3,Updated On :.1,Document :.2,Tender Stage
CE and BM Brahmani Basin Samal||APD cum CCE RIP Samal||Rourkela Irrigation Division Rourkela,SERID-RKL-09-2024-25,2024_CEBBS_108043_4,Yes,Open Tender,Percentage,Works,1.0,No,No,Online,No,No,No,1.0,Fee/PreQual/Technical/Finance,.pdf,"Cost of tender paper,valid licence,required EMD,MSME,PANCARD,GSTIN",10-Dec-2024 10:00 AM,20-Dec-2024 11:30 AM,10-Dec-2024 10:00 AM,19-Dec-2024 05:00 PM,10-Dec-2024 10:00 AM ,16-Dec-2024 05:00 PM ,10-Dec-2024 10:00 AM,19-Dec-2024 05:00 PM,"5,000",Yes,fixed,,Nil,Nil,1.0,ICICI BANK,"2,000",Nil,Nil,No,Superintending Engineer,"Superintending Engineer, Rourkela Irrigation Division, Rourkela",Renovation of Inspection Bungalow (IB) at Kansbahal Dam site and Rest shed for night watchman of the Kansbahal Irrigation Project for the year 2024-25,Renovation of Inspection Bungalow (IB) at Kansbahal Dam site and Rest shed for night watchman of the Kansbahal Irrigation Project for the year 2024-25,Please refer Tender documents. ,NA ,"4,96,927",Civil Works - Buildings,NA ,Tender,90.0,45.0,Kanshbahal,770034.0,NA ,NA ,NA ,Rourkela,No ,No,AOC,02-Apr-2025,"INR 422,438",45.0,Dhananjay Kalah,02-Apr-2025 12:55 PM,woibkansbahl.pdf (476.00 KB),"Smt. Suman Tanty has won the transparent lottery which was held on 04.01.2025 in the chamber of SE, RID, Rourkela in the presence of bidders and officials.",1.0,2703504.0,SUMAN TANTY (S.C.),INR,"422,438",1,2703540,BIKRANT SAHOO,19-Dec-2024 02:00 PM,Rejected-AOC,He has not won the transparent lottery,02-Apr-2025 12:55 PM,Finance,Bid,Dhananjay Kalah,03-Jan-2025 06:37 PM,finance_519821.pdf,BOQ Comparative Chart,Er Dhananjay Kalah,Internal,"Er.DhananjayKalahSE,Smt.MousumiMundaryAEE,Rupam KumariDAO",Dhananjay Kalah,02-Apr-2025 12:43 PM,finsummary_519821.pdf (864.88 KB),CE and BM Brahmani Basin Samal||APD cum CCE RIP Samal||Rourkela Irrigation Division Rourkela,2024_CEBBS_108043_4,SERID-RKL-09-2024-25,Renovation of Inspection Bungalow (IB) at Kansbahal Dam site and Rest shed for night watchman of the Kansbahal Irrigation Project for the year 2024-25,DHANANJAY KALAH,Internal,DHANANJAY KALAH,Dhananjay Kalah,03-Jan-2025 06:45 PM,techsummary_519821.pdf (1534.09 KB),AOC
,,,,,,,,,,,,,,,,.pdf,"Affidavit,No Relation Certificate,other related documents as per DTCN",,,,,,,,,,,,,,,2.0,ICICI NEFT/RTGS,,,,,,,,,,,,,,,,,,,,,,,,,AOC,,,,,,,,,,,,,2,2703575,BRAHMANAND SAMASI,19-Dec-2024 02:16 PM,Rejected-AOC,He has not won the transparent lottery,02-Apr-2025 12:55 PM,,,,,,,,,,,,,,,,,,,,,,,AOC
,,,,,,,,,,,,,,,,.xls,Bill of Quantity,,,,,,,,,,,,,,,,,,,,,,,,,,,,,,,,,,,,,,,,,AOC,,,,,,,,,,,,,3,2703669,DAUD MINZ,19-Dec-2024 03:27 PM,Rejected-AOC,He has not won the transparent lottery,02-Apr-2025 12:55 PM,,,,,,,,,,,,,,,,,,,,,,,AOC
,,,,,,,,,,,,,,,,,,,,,,,,,,,,,,,,,,,,,,,,,,,,,,,,,,,,,,,,,,AOC,,,,,,,,,,,,,4,2703622,MOLLI KUJUR,19-Dec-2024 02:46 PM,Rejected-AOC,He has not won the transparent lottery,02-Apr-2025 12:55 PM,,,,,,,,,,,,,,,,,,,,,,,AOC
,,,,,,,,,,,,,,,,,,,,,,,,,,,,,,,,,,,,,,,,,,,,,,,,,,,,,,,,,,AOC,,,,,,,,,,,,,5,2702961,REKHA DAS,18-Dec-2024 09:29 PM,Rejected-AOC,She has not won the transparent lottery,02-Apr-2025 12:55 PM,,,,,,,,,,,,,,,,,,,,,,,AOC
,,,,,,,,,,,,,,,,,,,,,,,,,,,,,,,,,,,,,,,,,,,,,,,,,,,,,,,,,,AOC,,,,,,,,,,,,,6,2696224,SRUTI LAKRA,19-Dec-2024 07:17 AM,Rejected-AOC,She has not won the transparent lottery,02-Apr-2025 12:55 PM,,,,,,,,,,,,,,,,,,,,,,,AOC
,,,,,,,,,,,,,,,,,,,,,,,,,,,,,,,,,,,,,,,,,,,,,,,,,,,,,,,,,,AOC,,,,,,,,,,,,,7,2703135,SULENDA RRAJAK,19-Dec-2024 09:25 AM,Rejected-AOC,He has not won the transparent lottery,02-Apr-2025 12:55 PM,,,,,,,,,,,,,,,,,,,,,,,AOC
,,,,,,,,,,,,,,,,,,,,,,,,,,,,,,,,,,,,,,,,,,,,,,,,,,,,,,,,,,AOC,,,,,,,,,,,,,8,2703504,SUMAN TANTY (S.C.),19-Dec-2024 01:43 PM,Accepted-AOC,She has won the transparent lottery,02-Apr-2025 12:55 PM,,,,,,,,,,,,,,,,,,,,,,,AOC
