Organisation Chain,Tender Reference Number,Tender ID,Withdrawal Allowed,Tender Type,Form of contract,Tender Category,No. of Covers,General Technical Evaluation Allowed,ItemWise Technical Evaluation Allowed,Payment Mode,Is Multi Currency Allowed For BOQ,Is Multi Currency Allowed For Fee,Allow Two Stage Bidding,Cover No,Cover,Document Type,Description,Publish Date,Bid Opening Date,Document Download / Sale Start Date,Document Download / Sale End Date,Clarification Start Date,Clarification End Date,Bid Submission Start Date,Bid Submission End Date,EMD Amount in ₹,EMD Exemption Allowed,EMD Fee Type,EMD Percentage,EMD Payable To,EMD Payable At,S.No,Bank Name,Tender Fee in ₹,Fee Payable To,Fee Payable At,Tender Fee Exemption Allowed,Name,Address,Title,Work Description,Pre Qualification Details,Independent External Monitor/Remarks,Tender Value in ₹,Product Category,Sub category,Contract Type,Bid Validity(Days),Period Of Work(Days),Location,Pincode,Pre Bid Meeting Place,Pre Bid Meeting Address,Pre Bid Meeting Date,Bid Opening Place,Should Allow NDA Tender,Allow Preferential Bidder,Tender Stage,Contract Date :,Contract Value :,Work Completion Period in days :,Updated By :,Updated on :,AOC document :,AOC Description :,S.No,Bid Number,Bidder Name,Awarded Currency,Awarded Value,S.No.1,Bid Number.1,Bidder Name.1,Submitted Date,Status,Remarks,Status Updated On,Type :,Summary :,Updated By :.1,Updated On :,Document :,BOQ Comparative Chart :,Committee Chairperson/Co-ordinator Name :,Committee Chairperson/Co-ordinator Type :,Committee Members :,Updated By :.2,Updated on :.1,Document :.1,Organisation Chain :,Tender ID :,Tender Ref No :,Tender Title :,Committee Chairperson/Co-ordinator Name :.1,Committee Chairperson/Co-ordinator Type :.1,Committee Members :.1,Updated By :.3,Updated On :.1,Document :.2,Tender Stage
CE AND BM MBBS CHANDIKOLE||EASTERN CIRCLE II CHANDIKOLE||Jajpur Irrigation Division,e-Procurement Notice No.13/ 2023-24,2024_CDJID_100726_40,Yes,Open Tender,Percentage,Works,1.0,No,No,Online,No,No,No,1.0,Fee/PreQual/Technical/Finance,.pdf,"GSTIN, PAN, Contractor Registration Certificate",07-Feb-2024 06:00 PM,16-Feb-2024 11:30 AM,07-Feb-2024 06:00 PM,15-Feb-2024 06:00 PM,07-Feb-2024 06:00 PM ,13-Feb-2024 06:00 PM ,07-Feb-2024 06:00 PM,15-Feb-2024 06:00 PM,"21,000",Yes,fixed,,Nil,Nil,1.0,ICICI BANK,"6,000",Nil,Nil,No,Superintending Engineer,"O/o the SE, Jajpur Irrigation Division, Jajpur",JJPR-45/23-24 Raising and strengthening of minor and construction of VRB on Ditsy No-5 at Korua.,Raising and strengthening of canal,Please refer Tender documents. ,NA ,"21,00,629",Civil Works - Canal,NA ,Tender,90.0,180.0,Jajpur,755001.0,NA ,NA ,NA ,"O/o the SE, Jajpur Irrigation Division, Jajpur",No ,No,AOC,23-Apr-2025,"INR 1,785,744.72",180.0,Ratnakar Dalai,23-Apr-2025 03:56 PM,45.pdf (435.00 KB),Contract Awarded,1.0,2438916.0,RAKESH KUMAR SAHOO,INR,"1,785,744.72",1,2443581,Dhirendra Kumar Samal,15-Feb-2024 04:47 PM,Rejected-Technical,Did not satisfies as per DTCN,08-Apr-2024 03:48 PM,Finance,Bidders Uploaded documents of all the participated bidders have been downloaded successfully.,Sarat Chandra Ghadei,17-Feb-2024 04:03 PM,finance_491092.pdf,BOQ Comparative Chart,"Superintending Engineer, Jajpur Irrigation Division",Internal,"Estimator and DAO, Jajpur Irrigation Division",Ratnakar Dalai,23-Apr-2025 03:55 PM,finsummary_491092.pdf (435.17 KB),CE AND BM MBBS CHANDIKOLE||EASTERN CIRCLE II CHANDIKOLE||Jajpur Irrigation Division,2024_CDJID_100726_40,e-Procurement Notice No.13/ 2023-24,JJPR-45/23-24 Raising and strengthening of minor and construction of VRB on Ditsy No-5 at Korua.,"Superintending Engineer, Jajpur Irrigation Division",Internal,"Estimator and DAO, Jajpur Irrigation Division",Sarat Chandra Ghadei,08-Apr-2024 03:48 PM,techsummary_491092.pdf (246.88 KB),AOC
,,,,,,,,,,,,,,,,.pdf,"Affidavits, No Relation Certificate, undertakings and any other documents as per SBD/DTCN",,,,,,,,,,,,,,,2.0,ICICI NEFT/RTGS,,,,,,,,,,,,,,,,,,,,,,,,,AOC,,,,,,,,,,,,,2,2443450,Dibyasingha Majhi,15-Feb-2024 04:26 PM,Rejected-Technical,Did not satisfies as per DTCN,08-Apr-2024 03:48 PM,,,,,,,,,,,,,,,,,,,,,,,AOC
,,,,,,,,,,,,,,,,.xls,Bill of Quantity,,,,,,,,,,,,,,,,,,,,,,,,,,,,,,,,,,,,,,,,,AOC,,,,,,,,,,,,,3,2438916,RAKESH KUMAR SAHOO,13-Feb-2024 07:26 PM,Accepted-AOC,Won the lottery,23-Apr-2025 03:56 PM,,,,,,,,,,,,,,,,,,,,,,,AOC
,,,,,,,,,,,,,,,,,,,,,,,,,,,,,,,,,,,,,,,,,,,,,,,,,,,,,,,,,,AOC,,,,,,,,,,,,,4,2438000,SANJAYA KUMAR GHOSH,13-Feb-2024 01:07 PM,Rejected-Technical,Did not satisfies as per DTCN,08-Apr-2024 03:48 PM,,,,,,,,,,,,,,,,,,,,,,,AOC
,,,,,,,,,,,,,,,,,,,,,,,,,,,,,,,,,,,,,,,,,,,,,,,,,,,,,,,,,,AOC,,,,,,,,,,,,,5,2443091,Satyabrata Sahoo,15-Feb-2024 03:07 PM,Rejected-Technical,Did not satisfies as per DTCN,08-Apr-2024 03:48 PM,,,,,,,,,,,,,,,,,,,,,,,AOC
,,,,,,,,,,,,,,,,,,,,,,,,,,,,,,,,,,,,,,,,,,,,,,,,,,,,,,,,,,AOC,,,,,,,,,,,,,6,2443442,Saumitra Ranjan Nayak,15-Feb-2024 04:11 PM,Rejected-Technical,Did not satisfies as per DTCN,08-Apr-2024 03:48 PM,,,,,,,,,,,,,,,,,,,,,,,AOC
