Organisation Chain,Tender Reference Number,Tender ID,Withdrawal Allowed,Tender Type,Form of contract,Tender Category,No. of Covers,General Technical Evaluation Allowed,ItemWise Technical Evaluation Allowed,Payment Mode,Is Multi Currency Allowed For BOQ,Is Multi Currency Allowed For Fee,Allow Two Stage Bidding,Cover No,Cover,Document Type,Description,Publish Date,Bid Opening Date,Document Download / Sale Start Date,Document Download / Sale End Date,Clarification Start Date,Clarification End Date,Bid Submission Start Date,Bid Submission End Date,EMD Amount in ₹,EMD Exemption Allowed,EMD Fee Type,EMD Percentage,EMD Payable To,EMD Payable At,S.No,Bank Name,Tender Fee in ₹,VAT Charges in ₹,Fee Payable To,Fee Payable At,Tender Fee Exemption Allowed,Name,Address,Title,Work Description,Pre Qualification Details,Independent External Monitor/Remarks,Tender Value in ₹,Product Category,Sub category,Contract Type,Bid Validity(Days),Period Of Work(Days),Location,Pincode,Pre Bid Meeting Place,Pre Bid Meeting Address,Pre Bid Meeting Date,Bid Opening Place,Should Allow NDA Tender,Allow Preferential Bidder,Tender Stage,Contract Date :,Contract Value :,Work Completion Period in days :,Updated By :,Updated on :,AOC document :,AOC Description :,S.No,Bid Number,Bidder Name,Awarded Currency,Awarded Value,S.No.1,Bid Number.1,Bidder Name.1,Submitted Date,Status,Remarks,Status Updated On,Type :,Summary :,Updated By :.1,Updated On :,Document :,BOQ Comparative Chart :,Committee Chairperson/Co-ordinator Name :,Committee Chairperson/Co-ordinator Type :,Committee Members :,Updated By :.2,Updated on :.1,Document :.1,Organisation Chain :,Tender ID :,Tender Ref No :,Tender Title :,Committee Chairperson/Co-ordinator Name :.1,Committee Chairperson/Co-ordinator Type :.1,Committee Members :.1,Updated By :.3,Updated On :.1,Document :.2,Tender Stage
Municipal Bodies||Chandbali NAC,CNB NAC/10,2024_ORULB_108861_8,Yes,Open Tender,Percentage,Works,1.0,No,No,Online,No,No,No,1.0,Fee/PreQual/Technical/Finance,.pdf,"Pan Card, GST, Paper Cost, Valid RC, Labour License Affidavit, Bid Security Declaration",31-Dec-2024 01:00 PM,13-Jan-2025 11:30 AM,31-Dec-2024 01:00 PM,10-Jan-2025 05:00 PM,NA ,NA ,31-Dec-2024 01:00 PM,10-Jan-2025 05:00 PM,"5,560",Yes,percentage,1.0%,Nil,Nil,1.0,ICICI BANK,"4,000",0.0,Nil,Nil,No,"Executive Officer, Chandabali NAC","Executive Officer, Chandabali NAC, Chandabali","Installation of 63 KVA DTR Pole Mounted under 6 percentage supervision and Service Connection of 40 KW GP Load for NAC Office, Chandbali","Installation of 63 KVA DTR Pole Mounted under 6 percentage supervision and Service Connection of 40 KW GP Load for NAC Office, Chandbali",Please refer Tender documents. ,NA ,"5,56,008",Civil Works - Others,NA ,Tender,60.0,60.0,Chandabali NAC,756133.0,NA ,NA ,NA ,Chandabali NAC,No ,No,AOC,08-Apr-2025,"INR 472,662.55",60.0,Prabhat Kumar Sahoo,08-Apr-2025 09:31 AM,123EMDC.pdf (261.00 KB),DUE TO L1 IN LOTTERY,1.0,2742067.0,DEBABRATA MISHRA,INR,"472,662.55",1,2736769,Ambika Prasad Samal,08-Jan-2025 11:38 AM,Rejected-Finance,DISQUALIFY IN LOTTERY,08-Apr-2025 09:29 AM,Finance,OPENING SUCCESSFULLY,Santanu Kumar Sahoo,14-Jan-2025 10:55 AM,,BOQ Comparative Chart,EO,Internal,"EO, ME,AEE AND OTHERS",Prabhat Kumar Sahoo,08-Apr-2025 09:29 AM,finsummary_522722.pdf (261.10 KB),Municipal Bodies||Chandbali NAC,2024_ORULB_108861_8,CNB NAC/10,"Installation of 63 KVA DTR Pole Mounted under 6 percentage supervision and Service Connection of 40 KW GP Load for NAC Office, Chandbali",EO,Internal,"EO, ME,AEE AND OTHERS",Prabhat Kumar Sahoo,08-Apr-2025 09:24 AM,techsummary_522722.pdf (261.10 KB),AOC
,,,,,,,,,,,,,,,,.xls,BOQ,,,,,,,,,,,,,,,2.0,ICICI NEFT/RTGS,,,,,,,,,,,,,,,,,,,,,,,,,,AOC,,,,,,,,,,,,,2,2742067,DEBABRATA MISHRA,10-Jan-2025 11:45 AM,Accepted-AOC,DUE TO L1 IN LOTTERY,08-Apr-2025 09:32 AM,,,,,,,,,,,,,,,,,,,,,,,AOC
,,,,,,,,,,,,,,,,,,,,,,,,,,,,,,,,,,,,,,,,,,,,,,,,,,,,,,,,,,,AOC,,,,,,,,,,,,,3,2742512,M/S. BALIYARSINGH ELECTRICAL ENGINEERING & CONSTRUCTION,10-Jan-2025 02:13 PM,Rejected-Finance,DISQUALIFY IN LOTTERY,08-Apr-2025 09:29 AM,,,,,,,,,,,,,,,,,,,,,,,AOC
,,,,,,,,,,,,,,,,,,,,,,,,,,,,,,,,,,,,,,,,,,,,,,,,,,,,,,,,,,,AOC,,,,,,,,,,,,,4,2735389,"M/S KK ENTERPRISES,PROPRIETOR-KABERI MOHANTY",10-Jan-2025 10:43 AM,Rejected-Finance,DISQUALIFY IN LOTTERY,08-Apr-2025 09:29 AM,,,,,,,,,,,,,,,,,,,,,,,AOC
,,,,,,,,,,,,,,,,,,,,,,,,,,,,,,,,,,,,,,,,,,,,,,,,,,,,,,,,,,,AOC,,,,,,,,,,,,,5,2740544,POWERTECH ENGINEERING.TAPAS RANJAN PATI,09-Jan-2025 05:13 PM,Rejected-Finance,DUE TO L2 IN LOTTERY,08-Apr-2025 09:29 AM,,,,,,,,,,,,,,,,,,,,,,,AOC
,,,,,,,,,,,,,,,,,,,,,,,,,,,,,,,,,,,,,,,,,,,,,,,,,,,,,,,,,,,AOC,,,,,,,,,,,,,6,2735696,Santosh Kumar Parida,07-Jan-2025 07:22 PM,Rejected-Finance,DISQUALIFY IN LOTTERY,08-Apr-2025 09:29 AM,,,,,,,,,,,,,,,,,,,,,,,AOC
,,,,,,,,,,,,,,,,,,,,,,,,,,,,,,,,,,,,,,,,,,,,,,,,,,,,,,,,,,,AOC,,,,,,,,,,,,,7,2742733,SARITA DAS,10-Jan-2025 03:51 PM,Rejected-Finance,DISQUALIFY IN LOTTERY,08-Apr-2025 09:29 AM,,,,,,,,,,,,,,,,,,,,,,,AOC
,,,,,,,,,,,,,,,,,,,,,,,,,,,,,,,,,,,,,,,,,,,,,,,,,,,,,,,,,,,AOC,,,,,,,,,,,,,8,2729364,SHANKAR GOURI INDUSTRIES PRIVATE LIMITED,04-Jan-2025 06:01 PM,Rejected-Finance,DISQUALIFY IN LOTTERY,08-Apr-2025 09:29 AM,,,,,,,,,,,,,,,,,,,,,,,AOC
