Organisation Chain,Tender Reference Number,Tender ID,Withdrawal Allowed,Tender Type,Form of contract,Tender Category,No. of Covers,General Technical Evaluation Allowed,ItemWise Technical Evaluation Allowed,Payment Mode,Is Multi Currency Allowed For BOQ,Is Multi Currency Allowed For Fee,Allow Two Stage Bidding,Cover No,Cover,Document Type,Description,Publish Date,Bid Opening Date,Document Download / Sale Start Date,Document Download / Sale End Date,Clarification Start Date,Clarification End Date,Bid Submission Start Date,Bid Submission End Date,Financial Bid Opening Date,EMD Amount in ₹,EMD Exemption Allowed,EMD Fee Type,EMD Percentage,EMD Payable To,EMD Payable At,S.No,Bank Name,Tender Fee in ₹,VAT Charges in ₹,Fee Payable To,Fee Payable At,Tender Fee Exemption Allowed,Name,Address,Title,Work Description,Pre Qualification Details,Independent External Monitor/Remarks,Tender Value in ₹,Product Category,Sub category,Contract Type,Bid Validity(Days),Period Of Work(Days),Location,Pincode,Pre Bid Meeting Place,Pre Bid Meeting Address,Pre Bid Meeting Date,Bid Opening Place,Should Allow NDA Tender,Allow Preferential Bidder,Tender Stage,Contract Date :,Contract Value :,Work Completion Period in days :,Updated By :,Updated on :,AOC document :,AOC Description :,S.No,Bid Number,Bidder Name,Awarded Currency,Awarded Value,S.No.1,Bid Number.1,Bidder Name.1,Submitted Date,Status,Remarks,Status Updated On,Type :,Summary :,Updated By :.1,Updated On :,Document :,BOQ Comparative Chart :,Committee Chairperson/Co-ordinator Name :,Committee Chairperson/Co-ordinator Type :,Committee Members :,Updated By :.2,Updated on :.1,Document :.1,Organisation Chain :,Tender ID :,Tender Ref No :,Tender Title :,Type :.1,Summary :.1,Updated By :.3,Updated On :.1,Document :.2,Committee Chairperson/Co-ordinator Name :.1,Committee Chairperson/Co-ordinator Type :.1,Committee Members :.1,Updated By :.4,Updated On :.2,Financial Bid Opening Date:,Document :.3,Tender Stage
EIC-CIVIL,CE-ROADS-I-12/2024-25,2024_EICCL_106726_2,Yes,Open Tender,Percentage,Works,2.0,No,No,Online,No,No,No,1.0,Fee/PreQual/Technical,.pdf,"Online proof copy of Tender Cost and EMD, GSTIN, PAN, RC and Affidavit",11-Nov-2024 06:00 PM,29-Nov-2024 11:30 AM,11-Nov-2024 06:00 PM,28-Nov-2024 05:30 PM,NA ,NA ,11-Nov-2024 06:00 PM,28-Nov-2024 05:30 PM,30-Dec-2024 11:45 AM,"24,68,000",Yes,fixed,,Nil,Nil,1.0,ICICI BANK,"10,000",0.0,Nil,Nil,No,"Chief Engineer, Roads-I, Odisha","O/o the E.I.C (Civil-Cum-Roads), Odisha, Nirman Soudha, New Building, Unit-V, Bhubaneswar.",Improvement of Berhampur-Tamana-Chikiti- Surangi-Mandarada road from 10/000 km to 49/000 km( except 23/730 km to 24/900km) in the district of Ganjam under State Plan,Improvement of Berhampur-Tamana- Chikiti-Surangi-Mandarada road from 10/000 km to 49/000 km( except 23/730 km to 24/900km) in the district of Ganjam under State Plan,Please refer Tender documents. ,NA ,"24,68,14,138",Civil Works - Roads,NA ,Tender,90.0,300.0,Ganjam-I,751001.0,NA ,NA ,NA ,"O/o the E.I.C (Civil-Cum-Roads), Odisha",No ,No,AOC,11-Apr-2025,"INR 209,816,699",300.0,Pradipta Kumar Nayak,11-Apr-2025 01:21 PM,Berhampur_Tama_AOC2.pdf (208.00 KB),1244 P1 of 2024-25,1.0,2647211.0,Simanchal Patra,INR,"209,816,699",1,2669162,Ashirbad Eng & Construction Private Limited,28-Nov-2024 09:56 AM,Rejected-AOC,L1 bidder,11-Apr-2025 01:21 PM,Finance,Finance opening,Pradipta Kumar Nayak,30-Dec-2024 12:09 PM,,BOQ Comparative Chart,CE Roads-I,Internal,,Pradipta Kumar Nayak,11-Apr-2025 01:16 PM,finsummary_515438.pdf (208.37 KB),EIC-CIVIL,2024_EICCL_106726_2,CE-ROADS-I-12/2024-25,Improvement of Berhampur-Tamana-Chikiti- Surangi-Mandarada road from 10/000 km to 49/000 km( except 23/730 km to 24/900km) in the district of Ganjam under State Plan,Technical,Opening,Pradipta Kumar Nayak,29-Nov-2024 12:56 PM,,EIC-cum-Roads Odisha,Internal,,Pradipta Kumar Nayak,27-Dec-2024 11:41 AM,30-Dec-2024 11:45 AM,techsummary_515438.pdf (286.00 KB),AOC
,,,,,,,,,,,,,,,,.pdf,Machineries and work experience,,,,,,,,,,,,,,,,2.0,ICICI NEFT/RTGS,,,,,,,,,,,,,,,,,,,,,,,,,,AOC,,,,,,,,,,,,,2,2670681,B Manoj Kumar Rao,27-Nov-2024 11:44 PM,Rejected-AOC,L1 bidder,11-Apr-2025 01:21 PM,,,,,,,,,,,,,,,,,,,,,,,,,,,,,AOC
,,,,,,,,,,,,,,,,.pdf,Other documents as per DTCN,,,,,,,,,,,,,,,,,,,,,,,,,,,,,,,,,,,,,,,,,,,AOC,,,,,,,,,,,,,3,2663795,KAPILASH INFRASOL PROJECTS PRIVATE LIMITED,28-Nov-2024 11:13 AM,Rejected-Finance,Other than L1 and L2 bidder,11-Apr-2025 01:16 PM,,,,,,,,,,,,,,,,,,,,,,,,,,,,,AOC
,,,,,,,,,,,,,,2.0,Finance,.xls,Bill of quantities,,,,,,,,,,,,,,,,,,,,,,,,,,,,,,,,,,,,,,,,,,,AOC,,,,,,,,,,,,,4,2659075,M/s Bajarangi Construction,27-Nov-2024 08:17 PM,Rejected-AOC,L2 bidder,11-Apr-2025 01:21 PM,,,,,,,,,,,,,,,,,,,,,,,,,,,,,AOC
,,,,,,,,,,,,,,,,,,,,,,,,,,,,,,,,,,,,,,,,,,,,,,,,,,,,,,,,,,,,AOC,,,,,,,,,,,,,5,2670447,M/S PANIGRAHI CONSTRUCTION,27-Nov-2024 08:30 PM,Rejected-AOC,L1 bidder,11-Apr-2025 01:21 PM,,,,,,,,,,,,,,,,,,,,,,,,,,,,,AOC
,,,,,,,,,,,,,,,,,,,,,,,,,,,,,,,,,,,,,,,,,,,,,,,,,,,,,,,,,,,,AOC,,,,,,,,,,,,,6,2666006,SAPNESWAR PROJECTS PRIVATE LIMITED,26-Nov-2024 11:00 AM,Rejected-AOC,L1 bidder,11-Apr-2025 01:21 PM,,,,,,,,,,,,,,,,,,,,,,,,,,,,,AOC
,,,,,,,,,,,,,,,,,,,,,,,,,,,,,,,,,,,,,,,,,,,,,,,,,,,,,,,,,,,,AOC,,,,,,,,,,,,,7,2647211,Simanchal Patra,26-Nov-2024 10:39 PM,Accepted-AOC,Selected as L1 bidder,11-Apr-2025 01:21 PM,,,,,,,,,,,,,,,,,,,,,,,,,,,,,AOC
