Organisation Chain,Tender Reference Number,Tender ID,Withdrawal Allowed,Tender Type,Form of contract,Tender Category,No. of Covers,General Technical Evaluation Allowed,ItemWise Technical Evaluation Allowed,Payment Mode,Is Multi Currency Allowed For BOQ,Is Multi Currency Allowed For Fee,Allow Two Stage Bidding,Cover No,Cover,Document Type,Description,Publish Date,Bid Opening Date,Document Download / Sale Start Date,Document Download / Sale End Date,Clarification Start Date,Clarification End Date,Bid Submission Start Date,Bid Submission End Date,EMD Amount in ₹,EMD Exemption Allowed,EMD Fee Type,EMD Percentage,EMD Payable To,EMD Payable At,S.No,Bank Name,Tender Fee in ₹,VAT Charges in ₹,Fee Payable To,Fee Payable At,Tender Fee Exemption Allowed,Name,Address,Title,Work Description,Pre Qualification Details,Independent External Monitor/Remarks,Tender Value in ₹,Product Category,Sub category,Contract Type,Bid Validity(Days),Period Of Work(Days),Location,Pincode,Pre Bid Meeting Place,Pre Bid Meeting Address,Pre Bid Meeting Date,Bid Opening Place,Should Allow NDA Tender,Allow Preferential Bidder,Tender Stage,Contract Date :,Contract Value :,Work Completion Period in days :,Updated By :,Updated on :,AOC document :,AOC Description :,S.No,Bid Number,Bidder Name,Awarded Currency,Awarded Value,S.No.1,Bid Number.1,Bidder Name.1,Submitted Date,Status,Remarks,Status Updated On,Type :,Summary :,Updated By :.1,Updated On :,Document :,BOQ Comparative Chart :,Committee Chairperson/Co-ordinator Name :,Committee Chairperson/Co-ordinator Type :,Committee Members :,Updated By :.2,Updated on :.1,Document :.1,Organisation Chain :,Tender ID :,Tender Ref No :,Tender Title :,Committee Chairperson/Co-ordinator Name :.1,Committee Chairperson/Co-ordinator Type :.1,Committee Members :.1,Updated By :.3,Updated On :.1,Document :.2,Tender Stage
CE RW I||RWCIRCLE-BERHAMPUR||EE RW Divn. Baliguda,Online Tender/01/EERWD/BLG-2024-25,2024_CERWI_106315_22,Yes,National Competitive Bid,Percentage,Works,1.0,No,No,Online,No,No,No,1.0,Fee/PreQual/Technical/Finance,.pdf,NIT,04-Nov-2024 04:30 PM,13-Nov-2024 11:00 AM,04-Nov-2024 04:30 PM,11-Nov-2024 04:00 PM,04-Nov-2024 04:30 PM ,08-Nov-2024 05:00 PM ,04-Nov-2024 04:30 PM,11-Nov-2024 04:00 PM,"9,070",Yes,fixed,,Nil,Nil,1.0,ICICI BANK,"4,000",0.0,Nil,Nil,No,Executive Engineer RWD Balliguda,Executive Engineer RWD Balliguda,S/R to Boxcell culvert on Local nallah on PWD Road (Jidingipeta Chhak) to - Sikabadi in the District of Kandhamal for the year 2024-25.,S/R to Boxcell culvert on Local nallah on PWD Road (Jidingipeta Chhak) to - Sikabadi in the District of Kandhamal for the year 2024-25.,Please refer Tender Document ,NA ,"9,06,937",Civil Works - Roads,NA ,Tender,90.0,30.0,Balliguda/Kandhamal,762103.0,NA ,NA ,NA ,Executive Engineer RWD Balliguda,No ,No,AOC,17-Apr-2025,"INR 770,987",30.0,Srikrushna Sabar,17-Apr-2025 10:57 AM,Work.pdf (840.00 KB),"Successful bidder Sri Hadu Nayak, C Class Contractor declared as winner in lottery",1.0,2636430.0,HADU NAIK,INR,"770,987",1.0,2636430.0,HADU NAIK,10-Nov-2024 06:37 PM,Accepted-AOC,"Successful bidder Sri Hadu Nayak, C Class Contractor declared as winner in lottery",17-Apr-2025 10:58 AM,Finance,"Successful bidder Sri Hadu Nayik, C Class Contractor declared as winner in lottery.",Dusmanta Kumar Dehury,15-Apr-2025 11:40 AM,finance_514301.pdf,BOQ Comparative Chart,EE/DAO,Internal,EE/DAO,Dusmanta Kumar Dehury,15-Apr-2025 12:01 PM,finsummary_514301.pdf (840.32 KB),CE RW I||RWCIRCLE-BERHAMPUR||EE RW Divn. Baliguda,2024_CERWI_106315_22,Online Tender/01/EERWD/BLG-2024-25,S/R to Boxcell culvert on Local nallah on PWD Road (Jidingipeta Chhak) to - Sikabadi in the District of Kandhamal for the year 2024-25.,EE/DAO,Internal,EE/DAO,Dusmanta Kumar Dehury,15-Apr-2025 11:53 AM,techsummary_514301.pdf (840.32 KB),AOC
,,,,,,,,,,,,,,,,.pdf,DTCN,,,,,,,,,,,,,,,2.0,ICICI NEFT/RTGS,,,,,,,,,,,,,,,,,,,,,,,,,,AOC,,,,,,,,,,,,,2.0,2636418.0,SIBA NAYAK,11-Nov-2024 02:28 PM,Rejected-Finance,Unsuccessful bidder,15-Apr-2025 12:01 PM,,,,,,,,,,,,,,,,,,,,,,,AOC
,,,,,,,,,,,,,,,,.pdf,"Valid Contract RC, GSTIN, PAN CARD, Affidavit, Cost of Tender Paper and cost of EMD through online",,,,,,,,,,,,,,,,,,,,,,,,,,,,,,,,,,,,,,,,,,AOC,,,,,,,,,,,,,,,,,,,,,,,,,,,,,,,,,,,,,,,,,,AOC
,,,,,,,,,,,,,,,,.pdf,"Valid Mail lD, Mobile No, Whatsapp No.",,,,,,,,,,,,,,,,,,,,,,,,,,,,,,,,,,,,,,,,,,AOC,,,,,,,,,,,,,,,,,,,,,,,,,,,,,,,,,,,,,,,,,,AOC
,,,,,,,,,,,,,,,,.xls,BoQ,,,,,,,,,,,,,,,,,,,,,,,,,,,,,,,,,,,,,,,,,,AOC,,,,,,,,,,,,,,,,,,,,,,,,,,,,,,,,,,,,,,,,,,AOC
,,,,,,,,,,,,,,,,.pdf,Affidavit for Claiming Price Preface in Respect of SC/ST Contactor,,,,,,,,,,,,,,,,,,,,,,,,,,,,,,,,,,,,,,,,,,AOC,,,,,,,,,,,,,,,,,,,,,,,,,,,,,,,,,,,,,,,,,,AOC
,,,,,,,,,,,,,,,,.pdf,Affidavit regarding no relation certificate with department officers,,,,,,,,,,,,,,,,,,,,,,,,,,,,,,,,,,,,,,,,,,AOC,,,,,,,,,,,,,,,,,,,,,,,,,,,,,,,,,,,,,,,,,,AOC
