Organisation Chain,Tender Reference Number,Tender ID,Withdrawal Allowed,Tender Type,Form of contract,Tender Category,No. of Covers,General Technical Evaluation Allowed,ItemWise Technical Evaluation Allowed,Payment Mode,Is Multi Currency Allowed For BOQ,Is Multi Currency Allowed For Fee,Allow Two Stage Bidding,Cover No,Cover,Document Type,Description,Publish Date,Bid Opening Date,Document Download / Sale Start Date,Document Download / Sale End Date,Clarification Start Date,Clarification End Date,Bid Submission Start Date,Bid Submission End Date,EMD Amount in ₹,EMD Exemption Allowed,EMD Fee Type,EMD Percentage,EMD Payable To,EMD Payable At,S.No,Bank Name,Tender Fee in ₹,VAT Charges in ₹,Fee Payable To,Fee Payable At,Tender Fee Exemption Allowed,Name,Address,Title,Work Description,Pre Qualification Details,Independent External Monitor/Remarks,Tender Value in ₹,Product Category,Sub category,Contract Type,Bid Validity(Days),Period Of Work(Days),Location,Pincode,Pre Bid Meeting Place,Pre Bid Meeting Address,Pre Bid Meeting Date,Bid Opening Place,Should Allow NDA Tender,Allow Preferential Bidder,Tender Stage,Contract Date :,Contract Value :,Work Completion Period in days :,Updated By :,Updated on :,AOC document :,AOC Description :,S.No,Bid Number,Bidder Name,Awarded Currency,Awarded Value,S.No.1,Bid Number.1,Bidder Name.1,Submitted Date,Status,Remarks,Status Updated On,Type :,Summary :,Updated By :.1,Updated On :,Document :,BOQ Comparative Chart :,Committee Chairperson/Co-ordinator Name :,Committee Chairperson/Co-ordinator Type :,Committee Members :,Updated By :.2,Updated on :.1,Document :.1,Organisation Chain :,Tender ID :,Tender Ref No :,Tender Title :,Committee Chairperson/Co-ordinator Name :.1,Committee Chairperson/Co-ordinator Type :.1,Committee Members :.1,Updated By :.3,Updated On :.1,Document :.2,Tender Stage
EIC-CIVIL||SERNB-CIRCLE-KHURDA||EERNB DIVN KHURDA,Notice -01-24-25,2024_EICCL_104243_6,Yes,Open Tender,Percentage,Works,1.0,No,No,Online,No,No,No,1.0,Fee/PreQual/Technical/Finance,.pdf,"Online proof copy Tender cost, EMD, GSTIN, PAN, Contractor RC and Affidavit",13-Aug-2024 06:00 PM,23-Aug-2024 11:30 AM,13-Aug-2024 06:00 PM,22-Aug-2024 05:00 PM,NA ,NA ,13-Aug-2024 06:00 PM,22-Aug-2024 05:00 PM,"21,400",Yes,fixed,,Nil,Nil,1.0,ICICI BANK,"6,000",0.0,Nil,Nil,No,SE RANDB KHURDA,"O/o the SUPERINTENDING Engineer R and B Division, Khurda","Supply, Installation, Testing and commission of 125 KVA Diesel Generating Set at Rand B Division office, Khordha for the year 2024-25","Supply, Installation, Testing and commission of 125 KVA Diesel Generating Set at Rand B Division office, Khordha for the year 2024-25",Please refer Tender documents. ,NA ,"21,39,967",Electrical Works,NA ,Tender,90.0,60.0,khordha,752055.0,NA ,NA ,NA ,O/O SE RANDB KHURDA,No ,No,AOC,10-Jan-2025,"INR 1,819,186",60.0,Shibalal Sahoo,09-Apr-2025 05:28 PM,194.pdf (956.00 KB),Agrt. done,1.0,2533053.0,Fusion Power,INR,"1,819,186",1,2533020,ABC CONSTRUCTIONS,21-Aug-2024 08:49 PM,Rejected-AOC,Not successful in transparent lottery,09-Apr-2025 05:29 PM,Finance,9 nos bidders are admitted,Ch Akshaya Kumar Subudhi,28-Aug-2024 12:43 PM,finance_504868.pdf,BOQ Comparative Chart,"EE, Khordha (RB) Division",Internal,"Estimator, DAO",Shibalal Sahoo,19-Dec-2024 11:23 AM,finsummary_504868.pdf (450.44 KB),EIC-CIVIL||SERNB-CIRCLE-KHURDA||EERNB DIVN KHURDA,2024_EICCL_104243_6,Notice -01-24-25,"Supply, Installation, Testing and commission of 125 KVA Diesel Generating Set at Rand B Division office, Khordha for the year 2024-25","EE, Khordha (RB) Division",Internal,"Estimator, DAO",Shibalal Sahoo,03-Oct-2024 05:30 PM,techsummary_504868.pdf (187.41 KB),AOC
,,,,,,,,,,,,,,,,.pdf,Other Documents as per DTCN,,,,,,,,,,,,,,,2.0,ICICI NEFT/RTGS,,,,,,,,,,,,,,,,,,,,,,,,,,AOC,,,,,,,,,,,,,2,2533053,Fusion Power,21-Aug-2024 09:27 PM,Accepted-AOC,successful in transparent lottery,09-Apr-2025 05:29 PM,,,,,,,,,,,,,,,,,,,,,,,AOC
,,,,,,,,,,,,,,,,.xls,Bill of Quantity,,,,,,,,,,,,,,,,,,,,,,,,,,,,,,,,,,,,,,,,,,AOC,,,,,,,,,,,,,3,2533393,INDIA ELECTRICAL HOUSE,22-Aug-2024 02:20 PM,Rejected-AOC,Not successful in transparent lottery,09-Apr-2025 05:29 PM,,,,,,,,,,,,,,,,,,,,,,,AOC
,,,,,,,,,,,,,,,,,,,,,,,,,,,,,,,,,,,,,,,,,,,,,,,,,,,,,,,,,,,AOC,,,,,,,,,,,,,4,2533129,MAHIMA ENTERPRISES,22-Aug-2024 04:10 PM,Rejected-AOC,Not successful in transparent lottery,09-Apr-2025 05:29 PM,,,,,,,,,,,,,,,,,,,,,,,AOC
,,,,,,,,,,,,,,,,,,,,,,,,,,,,,,,,,,,,,,,,,,,,,,,,,,,,,,,,,,,AOC,,,,,,,,,,,,,5,2531972,M/S Mahaveer Electricals,20-Aug-2024 03:25 PM,Rejected-AOC,Not successful in transparent lottery,09-Apr-2025 05:29 PM,,,,,,,,,,,,,,,,,,,,,,,AOC
,,,,,,,,,,,,,,,,,,,,,,,,,,,,,,,,,,,,,,,,,,,,,,,,,,,,,,,,,,,AOC,,,,,,,,,,,,,6,2533006,"M/s Ramchandi Construction, Nayagargh",22-Aug-2024 12:14 PM,Rejected-Technical,Not given any DG work experience,03-Oct-2024 05:30 PM,,,,,,,,,,,,,,,,,,,,,,,AOC
,,,,,,,,,,,,,,,,,,,,,,,,,,,,,,,,,,,,,,,,,,,,,,,,,,,,,,,,,,,AOC,,,,,,,,,,,,,7,2532728,M/S S. R. ENGINEERS AND CONSTRUCTION,22-Aug-2024 01:17 PM,Rejected-Technical,Not allowed EMD exemption as Engineering contractor,03-Oct-2024 05:30 PM,,,,,,,,,,,,,,,,,,,,,,,AOC
,,,,,,,,,,,,,,,,,,,,,,,,,,,,,,,,,,,,,,,,,,,,,,,,,,,,,,,,,,,AOC,,,,,,,,,,,,,8,2532170,ONE STEP SOLUTIONS,20-Aug-2024 05:40 PM,Rejected-Technical,Not given any DG work experience,03-Oct-2024 05:30 PM,,,,,,,,,,,,,,,,,,,,,,,AOC
,,,,,,,,,,,,,,,,,,,,,,,,,,,,,,,,,,,,,,,,,,,,,,,,,,,,,,,,,,,AOC,,,,,,,,,,,,,9,2533447,SABITA ENTERPRISES PROP. BISMAYA RANJAN SAMANTASINGHAR,22-Aug-2024 02:38 PM,Rejected-Technical,Not given any DG work experience,03-Oct-2024 05:30 PM,,,,,,,,,,,,,,,,,,,,,,,AOC
