Organisation Chain,Tender Reference Number,Tender ID,Withdrawal Allowed,Tender Type,Form of contract,Tender Category,No. of Covers,General Technical Evaluation Allowed,ItemWise Technical Evaluation Allowed,Payment Mode,Is Multi Currency Allowed For BOQ,Is Multi Currency Allowed For Fee,Allow Two Stage Bidding,Cover No,Cover,Document Type,Description,Publish Date,Bid Opening Date,Document Download / Sale Start Date,Document Download / Sale End Date,Clarification Start Date,Clarification End Date,Bid Submission Start Date,Bid Submission End Date,Financial Bid Opening Date,EMD Amount in ₹,EMD Exemption Allowed,EMD Fee Type,EMD Percentage,EMD Payable To,EMD Payable At,S.No,Bank Name,Tender Fee in ₹,VAT Charges in ₹,Fee Payable To,Fee Payable At,Tender Fee Exemption Allowed,Name,Address,Title,Work Description,Pre Qualification Details,Independent External Monitor/Remarks,Tender Value in ₹,Product Category,Sub category,Contract Type,Bid Validity(Days),Period Of Work(Days),Location,Pincode,Pre Bid Meeting Place,Pre Bid Meeting Address,Pre Bid Meeting Date,Bid Opening Place,Should Allow NDA Tender,Allow Preferential Bidder,Tender Stage,Contract Date :,Contract Value :,Work Completion Period in days :,Updated By :,Updated on :,AOC document :,AOC Description :,S.No,Bid Number,Bidder Name,Awarded Currency,Awarded Value,S.No.1,Bid Number.1,Bidder Name.1,Submitted Date,Status,Remarks,Status Updated On,Type :,Summary :,Updated By :.1,Updated On :,Document :,BOQ Comparative Chart :,Committee Chairperson/Co-ordinator Name :,Committee Chairperson/Co-ordinator Type :,Committee Members :,Updated By :.2,Updated on :.1,Document :.1,Organisation Chain :,Tender ID :,Tender Ref No :,Tender Title :,Type :.1,Summary :.1,Updated By :.3,Updated On :.1,Document :.2,Committee Chairperson/Co-ordinator Name :.1,Committee Chairperson/Co-ordinator Type :.1,Committee Members :.1,Updated By :.4,Updated On :.2,Financial Bid Opening Date:,Document :.3,Tender Stage
EIC-CIVIL,CE-ROADS-I-10/2024-25,2024_EICCL_106289_2,Yes,Open Tender,Percentage,Works,2.0,No,No,Online,No,No,No,1.0,Fee/PreQual/Technical,.pdf,"Online proof copy of Tender Cost and EMD, GSTIN, PAN, RC and Affidavit",02-Nov-2024 06:55 PM,20-Nov-2024 11:30 AM,02-Nov-2024 06:55 PM,19-Nov-2024 05:30 PM,NA ,NA ,02-Nov-2024 06:55 PM,19-Nov-2024 05:30 PM,30-Dec-2024 12:45 PM,"26,14,000",Yes,fixed,,Nil,Nil,1.0,ICICI BANK,"10,000",0.0,Nil,Nil,No,"Chief Engineer, Roads-I, Odisha","O/o the E.I.C (Civil-Cum-Roads), Odisha, Nirman Soudha, New Building, Unit-V, Bhubaneswar",Improvement such as widening and strengthening of Panchada-Dasmantpur-Girliguma road from 19/000 km to 37/799 km in the district of Koraput under State Plan,Improvement such as widening and strengthening of Panchada-Dasmantpur-Girliguma road from 19/000 km to 37/799 km in the district of Koraput under State Plan,Please refer Tender documents. ,NA ,"26,13,64,751",Civil Works - Roads,NA ,Tender,90.0,540.0,Koraput,751001.0,NA ,NA ,NA ,"O/o the E.I.C (Civil-Cum-Roads), Odisha",No ,No,AOC,07-Apr-2025,"INR 222,186,175",540.0,Pradipta Kumar Nayak,07-Apr-2025 02:00 PM,PanchadaDasmatpur-Girligumma.pdf (950.00 KB),851 P1 of 2024-25,1.0,2653401.0,M/S Saroj Kumar Sharma,INR,"222,186,175",1,2650075,AMARDEEP CONSTRUCTIONS,19-Nov-2024 12:38 AM,Rejected-AOC,L2 bidder,07-Apr-2025 02:00 PM,Finance,Finance opening,Lipsa Mallick,30-Dec-2024 01:26 PM,,BOQ Comparative Chart,CE Roads-I,Internal,,Pradipta Kumar Nayak,07-Apr-2025 01:56 PM,finsummary_513947.pdf (950.06 KB),EIC-CIVIL,2024_EICCL_106289_2,CE-ROADS-I-10/2024-25,Improvement such as widening and strengthening of Panchada-Dasmantpur-Girliguma road from 19/000 km to 37/799 km in the district of Koraput under State Plan,Technical,Opening,Lipsa Mallick,20-Nov-2024 11:45 AM,,EIC Civil cum Roads,Internal,,Pradipta Kumar Nayak,26-Dec-2024 06:29 PM,30-Dec-2024 12:45 PM,techsummary_513947.pdf (287.02 KB),AOC
,,,,,,,,,,,,,,,,.pdf,Machineries and work experience,,,,,,,,,,,,,,,,2.0,ICICI NEFT/RTGS,,,,,,,,,,,,,,,,,,,,,,,,,,AOC,,,,,,,,,,,,,2,2652250,BMS PROJECTS,19-Nov-2024 12:24 PM,Rejected-Technical,Non-responsive,26-Dec-2024 06:29 PM,,,,,,,,,,,,,,,,,,,,,,,,,,,,,AOC
,,,,,,,,,,,,,,,,.pdf,Other documents as per DTCN,,,,,,,,,,,,,,,,,,,,,,,,,,,,,,,,,,,,,,,,,,,AOC,,,,,,,,,,,,,3,2654051,JMBG CONSTRUCTION,19-Nov-2024 03:15 PM,Rejected-AOC,L2 bidder,07-Apr-2025 02:00 PM,,,,,,,,,,,,,,,,,,,,,,,,,,,,,AOC
,,,,,,,,,,,,,,2.0,Finance,.xls,Bill of quantities,,,,,,,,,,,,,,,,,,,,,,,,,,,,,,,,,,,,,,,,,,,AOC,,,,,,,,,,,,,4,2641184,MESSERS BIRAJA CONSTRUCTION,19-Nov-2024 11:00 AM,Rejected-Technical,Non-responsive,26-Dec-2024 06:29 PM,,,,,,,,,,,,,,,,,,,,,,,,,,,,,AOC
,,,,,,,,,,,,,,,,,,,,,,,,,,,,,,,,,,,,,,,,,,,,,,,,,,,,,,,,,,,,AOC,,,,,,,,,,,,,5,2644959,M/S GUPTESWAR CONSTRUCTION,17-Nov-2024 10:49 AM,Rejected-Finance,Other than L1 and L2 bidder,07-Apr-2025 01:56 PM,,,,,,,,,,,,,,,,,,,,,,,,,,,,,AOC
,,,,,,,,,,,,,,,,,,,,,,,,,,,,,,,,,,,,,,,,,,,,,,,,,,,,,,,,,,,,AOC,,,,,,,,,,,,,6,2653401,M/S Saroj Kumar Sharma,19-Nov-2024 05:22 PM,Accepted-AOC,L1 bidder,07-Apr-2025 02:00 PM,,,,,,,,,,,,,,,,,,,,,,,,,,,,,AOC
