Organisation Chain,Tender Reference Number,Tender ID,Withdrawal Allowed,Tender Type,Form of contract,Tender Category,No. of Covers,General Technical Evaluation Allowed,ItemWise Technical Evaluation Allowed,Payment Mode,Is Multi Currency Allowed For BOQ,Is Multi Currency Allowed For Fee,Allow Two Stage Bidding,Cover No,Cover,Document Type,Description,Publish Date,Bid Opening Date,Document Download / Sale Start Date,Document Download / Sale End Date,Clarification Start Date,Clarification End Date,Bid Submission Start Date,Bid Submission End Date,EMD Amount in ₹,EMD Exemption Allowed,EMD Fee Type,EMD Percentage,EMD Payable To,EMD Payable At,S.No,Bank Name,Tender Fee in ₹,VAT Charges in ₹,Fee Payable To,Fee Payable At,Tender Fee Exemption Allowed,Name,Address,Title,Work Description,Pre Qualification Details,Independent External Monitor/Remarks,Tender Value in ₹,Product Category,Sub category,Contract Type,Bid Validity(Days),Period Of Work(Days),Location,Pincode,Pre Bid Meeting Place,Pre Bid Meeting Address,Pre Bid Meeting Date,Bid Opening Place,Should Allow NDA Tender,Allow Preferential Bidder,Tender Stage,Contract Date :,Contract Value :,Work Completion Period in days :,Updated By :,Updated on :,AOC document :,AOC Description :,S.No,Bid Number,Bidder Name,Awarded Currency,Awarded Value,S.No.1,Bid Number.1,Bidder Name.1,Submitted Date,Status,Remarks,Status Updated On,Type :,Summary :,Updated By :.1,Updated On :,Document :,BOQ Comparative Chart :,Committee Chairperson/Co-ordinator Name :,Committee Chairperson/Co-ordinator Type :,Committee Members :,Updated By :.2,Updated on :.1,Document :.1,Organisation Chain :,Tender ID :,Tender Ref No :,Tender Title :,Committee Chairperson/Co-ordinator Name :.1,Committee Chairperson/Co-ordinator Type :.1,Committee Members :.1,Updated By :.3,Updated On :.1,Document :.2,Tender Stage
EIC-CIVIL||SERNB-CIRCLE-KEONJHAR||EERNB-DIVN-ROURKELA,BID ID 43 of2024-25,2024_EICCL_105873_3,Yes,Open Tender,Percentage,Works,1.0,No,No,Online,No,No,No,1.0,Fee/PreQual/Technical/Finance,.pdf,"Registration certificate, Registration in CDMS, PAN Card, GSTIN Certificate, Affidavit etc",22-Oct-2024 05:00 PM,08-Nov-2024 11:00 AM,22-Oct-2024 05:00 PM,07-Nov-2024 05:00 PM,NA ,NA ,22-Oct-2024 05:00 PM,07-Nov-2024 05:00 PM,"10,500",Yes,fixed,,Nil,Nil,1.0,ICICI BANK,"6,000",0.0,Nil,Nil,No,Additional chie Engineer Rourkela R and B Division,Office of Superintending Engineer Rourkela R and B division,Construction of storage cum Equipment room at UPHC Sector-22 Rourkela in the district of sundargarh for the year 2024-25.,Construction of storage cum Equipment room at UPHC Sector-22 Rourkela in the district of sundargarh for the year 2024-25.,Please refer tender documnet ,NA ,"10,42,175",Civil Works - Buildings,NA ,Tender,90.0,90.0,Rourkela,769012.0,NA ,NA ,NA ,Office of Superintending Engineer Rourkela R and B,No ,No,AOC,08-Apr-2025,"INR 885,943",90.0,Prajna Prajwolita Parida,08-Apr-2025 12:45 PM,sector22workorder.pdf (1530.00 KB),Agmt drawn and Work order issued,1.0,2606018.0,SASMITA SAMAL,INR,"885,943",1.0,2606018.0,SASMITA SAMAL,02-Nov-2024 12:53 PM,Accepted-AOC,Qualified in the Lottery,08-Apr-2025 12:45 PM,Finance,02 no of bidder has been participated,Prajna Prajwolita Parida,08-Apr-2025 12:35 PM,finance_510826.pdf,BOQ Comparative Chart,Alok Naik SE rourkela r and b dvision,Internal,HS Meena SrDAO Rourkela R and B Division P p parida estimator Rourkela R and B Division,Prajna Prajwolita Parida,08-Apr-2025 12:39 PM,finsummary_510826.pdf (1530.07 KB),EIC-CIVIL||SERNB-CIRCLE-KEONJHAR||EERNB-DIVN-ROURKELA,2024_EICCL_105873_3,BID ID 43 of2024-25,Construction of storage cum Equipment room at UPHC Sector-22 Rourkela in the district of sundargarh for the year 2024-25.,Alok Naik SE rourkela r and b dvision,Internal,HS Meena SrDAO Rourkela R and B Division P p parida estimator Rourkela R and B Division,Prajna Prajwolita Parida,08-Apr-2025 12:36 PM,techsummary_510826.pdf (1530.07 KB),AOC
,,,,,,,,,,,,,,,,.pdf,"Financial instruments such as cost of tender paper, EMD, Affidavit etc",,,,,,,,,,,,,,,2.0,ICICI NEFT/RTGS,,,,,,,,,,,,,,,,,,,,,,,,,,AOC,,,,,,,,,,,,,2.0,2606200.0,VIVAAN AGENCY,02-Nov-2024 01:34 PM,Rejected-AOC,Not Qualified in the Lottery,08-Apr-2025 12:45 PM,,,,,,,,,,,,,,,,,,,,,,,AOC
,,,,,,,,,,,,,,,,.pdf,"Experience Certificate, List of Machinaries,Lease Deeds , MOU with electrical contractor Affidavit e",,,,,,,,,,,,,,,,,,,,,,,,,,,,,,,,,,,,,,,,,,AOC,,,,,,,,,,,,,,,,,,,,,,,,,,,,,,,,,,,,,,,,,,AOC
,,,,,,,,,,,,,,,,.pdf,"No Relation Certificate, Schedule-E, Schedule-F, Affidavit etc",,,,,,,,,,,,,,,,,,,,,,,,,,,,,,,,,,,,,,,,,,AOC,,,,,,,,,,,,,,,,,,,,,,,,,,,,,,,,,,,,,,,,,,AOC
,,,,,,,,,,,,,,,,.xls,BOQ,,,,,,,,,,,,,,,,,,,,,,,,,,,,,,,,,,,,,,,,,,AOC,,,,,,,,,,,,,,,,,,,,,,,,,,,,,,,,,,,,,,,,,,AOC
