Organisation Chain,Tender Reference Number,Tender ID,Withdrawal Allowed,Tender Type,Form of contract,Tender Category,No. of Covers,General Technical Evaluation Allowed,ItemWise Technical Evaluation Allowed,Payment Mode,Is Multi Currency Allowed For BOQ,Is Multi Currency Allowed For Fee,Allow Two Stage Bidding,Cover No,Cover,Document Type,Description,Publish Date,Bid Opening Date,Document Download / Sale Start Date,Document Download / Sale End Date,Clarification Start Date,Clarification End Date,Bid Submission Start Date,Bid Submission End Date,EMD Amount in ₹,EMD Exemption Allowed,EMD Fee Type,EMD Percentage,EMD Payable To,EMD Payable At,S.No,Bank Name,Tender Fee in ₹,VAT Charges in ₹,Fee Payable To,Fee Payable At,Tender Fee Exemption Allowed,Name,Address,Title,Work Description,Pre Qualification Details,Independent External Monitor/Remarks,Tender Value in ₹,Product Category,Sub category,Contract Type,Bid Validity(Days),Period Of Work(Days),Location,Pincode,Pre Bid Meeting Place,Pre Bid Meeting Address,Pre Bid Meeting Date,Bid Opening Place,Should Allow NDA Tender,Allow Preferential Bidder,Tender Stage,Contract Date :,Contract Value :,Work Completion Period in days :,Updated By :,Updated on :,AOC document :,AOC Description :,S.No,Bid Number,Bidder Name,Awarded Currency,Awarded Value,S.No.1,Bid Number.1,Bidder Name.1,Submitted Date,Status,Remarks,Status Updated On,Type :,Summary :,Updated By :.1,Updated On :,Document :,BOQ Comparative Chart :,Committee Chairperson/Co-ordinator Name :,Committee Chairperson/Co-ordinator Type :,Committee Members :,Updated By :.2,Updated on :.1,Document :.1,Organisation Chain :,Tender ID :,Tender Ref No :,Tender Title :,Committee Chairperson/Co-ordinator Name :.1,Committee Chairperson/Co-ordinator Type :.1,Committee Members :.1,Updated By :.3,Updated On :.1,Document :.2,Tender Stage
Rural Water Supply and Sanitation||RWSS Circle Bolangir||RWSS Division Bolangir,BID No 31 OF 2023 - 24,2024_RWSS_101797_15,Yes,National Competitive Bid,Percentage,Works,1.0,No,No,Online,No,No,No,1.0,Fee/PreQual/Technical/Finance,.pdf,"Tender paper cost, EMD, GST, PAN, Contractor Registration certificate, Experience Certificate etc",28-Feb-2024 03:00 PM,07-Mar-2024 11:00 AM,28-Feb-2024 03:00 PM,06-Mar-2024 05:00 PM,NA ,NA ,28-Feb-2024 03:00 PM,06-Mar-2024 05:00 PM,"30,868",Yes,percentage,1.0%,Nil,Nil,1.0,ICICI BANK,"6,000",0.0,Nil,Nil,Yes,Executive Engineer,O/o Superintending Engineer RWSS Division Balangir,Construction of 6.00mtr ID percolation well of RPWS to village Sanbichhilibahal under Patnagarh Block,Construction of 6.00mtr ID percolation well of RPWS to village Sanbichhilibahal under Patnagarh Block,PLEASE REFER DTCN ,NA ,"30,86,779",Civil Works - Water Works,WATER SUPPLY ,Tender,180.0,90.0,VILLAGE SANBICHHILIBAHAL UNDER PATNAGARH BLOCK,767025.0,NA ,NA ,NA ,O/o Superintending Engineer RWSS Division Balangir,No ,No,AOC,23-Apr-2025,"INR 3,086,779",90.0,Khagendra Barik,23-Apr-2025 01:09 PM,sanbichilibahal.pdf (1879.00 KB),L1 bidder has respond,1.0,2468309.0,MADHUSUDAN BARIHA,INR,"2,624,071",1,2469997,KAMALINI BEHERA,06-Mar-2024 02:50 PM,Rejected-Finance,AFTER TRANSPARENT LOTTERY,28-Nov-2024 01:34 PM,Finance,TENDER HAS BEEN OPENED,Roupya Ranjan Behera,08-Mar-2024 01:06 PM,finance_496617.pdf,BOQ Comparative Chart,ROUPYARANJAN_BEHERA,Internal,ARJUN_MATHO_ Khagendra_Barik,Khagendra Barik,28-Nov-2024 01:34 PM,finsummary_496617.pdf (872.16 KB),Rural Water Supply and Sanitation||RWSS Circle Bolangir||RWSS Division Bolangir,2024_RWSS_101797_15,BID No 31 OF 2023 - 24,Construction of 6.00mtr ID percolation well of RPWS to village Sanbichhilibahal under Patnagarh Block,ROUPYARANJAN_BEHERA,Internal,ARJUN_MATHO_ Khagendra_Barik,Khagendra Barik,28-Nov-2024 01:26 PM,techsummary_496617.pdf (872.16 KB),AOC
,,,,,,,,,,,,,,,,.pdf,Other Document as per DTCN,,,,,,,,,,,,,,,2.0,ICICI NEFT/RTGS,,,,,,,,,,,,,,,,,,,,,,,,,,AOC,,,,,,,,,,,,,2,2468564,KAMINI NANDA,04-Mar-2024 04:36 PM,Rejected-Finance,AFTER TRANSPARENT LOTTERY,28-Nov-2024 01:34 PM,,,,,,,,,,,,,,,,,,,,,,,AOC
,,,,,,,,,,,,,,,,.xls,BILL OF QUANTITY,,,,,,,,,,,,,,,,,,,,,,,,,,,,,,,,,,,,,,,,,,AOC,,,,,,,,,,,,,3,2468309,MADHUSUDAN BARIHA,04-Mar-2024 08:37 PM,Accepted-AOC,awarded as per opwd code,23-Apr-2025 01:09 PM,,,,,,,,,,,,,,,,,,,,,,,AOC
,,,,,,,,,,,,,,,,,,,,,,,,,,,,,,,,,,,,,,,,,,,,,,,,,,,,,,,,,,,AOC,,,,,,,,,,,,,4,2470317,PANU SETHI,06-Mar-2024 12:59 PM,Rejected-AOC,rejected as per opwd code,23-Apr-2025 01:09 PM,,,,,,,,,,,,,,,,,,,,,,,AOC
,,,,,,,,,,,,,,,,,,,,,,,,,,,,,,,,,,,,,,,,,,,,,,,,,,,,,,,,,,,AOC,,,,,,,,,,,,,5,2470478,ritarani meher,06-Mar-2024 01:57 PM,Rejected-Finance,AFTER TRANSPARENT LOTTERY,28-Nov-2024 01:34 PM,,,,,,,,,,,,,,,,,,,,,,,AOC
