Organisation Chain,Tender Reference Number,Tender ID,Withdrawal Allowed,Tender Type,Form of contract,Tender Category,No. of Covers,General Technical Evaluation Allowed,ItemWise Technical Evaluation Allowed,Payment Mode,Is Multi Currency Allowed For BOQ,Is Multi Currency Allowed For Fee,Allow Two Stage Bidding,Cover No,Cover,Document Type,Description,Publish Date,Bid Opening Date,Document Download / Sale Start Date,Document Download / Sale End Date,Clarification Start Date,Clarification End Date,Bid Submission Start Date,Bid Submission End Date,EMD Amount in ₹,EMD Exemption Allowed,EMD Fee Type,EMD Percentage,EMD Payable To,EMD Payable At,S.No,Bank Name,Tender Fee in ₹,VAT Charges in ₹,Fee Payable To,Fee Payable At,Tender Fee Exemption Allowed,Name,Address,Title,Work Description,Pre Qualification Details,Independent External Monitor/Remarks,Tender Value in ₹,Product Category,Sub category,Contract Type,Bid Validity(Days),Period Of Work(Days),Location,Pincode,Pre Bid Meeting Place,Pre Bid Meeting Address,Pre Bid Meeting Date,Bid Opening Place,Should Allow NDA Tender,Allow Preferential Bidder,Tender Stage,Contract Date :,Contract Value :,Work Completion Period in days :,Updated By :,Updated on :,AOC document :,AOC Description :,S.No,Bid Number,Bidder Name,Awarded Currency,Awarded Value,S.No.1,Bid Number.1,Bidder Name.1,Submitted Date,Status,Remarks,Status Updated On,Type :,Summary :,Updated By :.1,Updated On :,Document :,BOQ Comparative Chart :,Committee Chairperson/Co-ordinator Name :,Committee Chairperson/Co-ordinator Type :,Committee Members :,Updated By :.2,Updated on :.1,Document :.1,Organisation Chain :,Tender ID :,Tender Ref No :,Tender Title :,Committee Chairperson/Co-ordinator Name :.1,Committee Chairperson/Co-ordinator Type :.1,Committee Members :.1,Updated By :.3,Updated On :.1,Document :.2,Tender Stage
CE RW I||RWCIRCLE-BERHAMPUR||EE RW Divn. Baliguda,Online Tender/01/EERWD/BLG-2024-25,2024_CERWI_106315_2,Yes,National Competitive Bid,Percentage,Works,1.0,No,No,Online,No,No,No,1.0,Fee/PreQual/Technical/Finance,.pdf,NIT,04-Nov-2024 04:30 PM,13-Nov-2024 11:00 AM,04-Nov-2024 04:30 PM,11-Nov-2024 04:00 PM,04-Nov-2024 04:30 PM ,08-Nov-2024 05:00 PM ,04-Nov-2024 04:30 PM,11-Nov-2024 04:00 PM,"12,710",Yes,fixed,,Nil,Nil,1.0,ICICI BANK,"6,000",0.0,Nil,Nil,No,Executive Engineer RWD Balliguda,Executive Engineer RWD Balliguda,S/R to Pakari to Parigada road in the District of Kandhamal for the year 2024-25,S/R to Pakari to Parigada road in the District of Kandhamal for the year 2024-25,Please refer Tender Document ,NA ,"11,00,177",Civil Works - Roads,NA ,Tender,90.0,60.0,Balliguda/Kandhamal,762103.0,NA ,NA ,NA ,Executive Engineer RWD Balliguda,No ,No,AOC,19-Apr-2025,"INR 935,260",60.0,Srikrushna Sabar,19-Apr-2025 11:26 AM,Work.pdf (1179.00 KB),"Successful bidder Bilarsen Paraseth , C Class Contractor declared as winner in lottery",1.0,2635585.0,BILARSEN PARASETH,INR,"935,260",1,2635704,AKASH KUMAR NAYAK,10-Nov-2024 02:01 PM,Rejected-Finance,Unsuccessful bidder,19-Apr-2025 11:20 AM,Finance,"Successful bidder Bilarsen Paraseth , C Class Contractor declared as winner in lottery",Srikrushna Sabar,19-Apr-2025 10:56 AM,finance_514263.pdf,BOQ Comparative Chart,EE/DAO,Internal,"Successful bidder Bilarsen Paraseth , C Class Contractor declared as winner in lottery",Srikrushna Sabar,19-Apr-2025 11:20 AM,finsummary_514263.pdf (1179.30 KB),CE RW I||RWCIRCLE-BERHAMPUR||EE RW Divn. Baliguda,2024_CERWI_106315_2,Online Tender/01/EERWD/BLG-2024-25,S/R to Pakari to Parigada road in the District of Kandhamal for the year 2024-25,EE/DAO,Internal,EE/DAO,Srikrushna Sabar,19-Apr-2025 11:08 AM,techsummary_514263.pdf (1179.31 KB),AOC
,,,,,,,,,,,,,,,,.pdf,DTCN,,,,,,,,,,,,,,,2.0,ICICI NEFT/RTGS,,,,,,,,,,,,,,,,,,,,,,,,,,AOC,,,,,,,,,,,,,2,2639433,ANANDA KUMAR PANDA,11-Nov-2024 03:39 PM,Rejected-AOC,Unsuccessful bidder,19-Apr-2025 11:26 AM,,,,,,,,,,,,,,,,,,,,,,,AOC
,,,,,,,,,,,,,,,,.pdf,"Valid Contract RC, GSTIN, PAN CARD, Affidavit, Cost of Tender Paper and cost of EMD through online",,,,,,,,,,,,,,,,,,,,,,,,,,,,,,,,,,,,,,,,,,AOC,,,,,,,,,,,,,3,2635585,BILARSEN PARASETH,11-Nov-2024 01:40 PM,Accepted-AOC,"Successful bidder Bilarsen Paraseth , C Class Contractor declared as winner in lottery",19-Apr-2025 11:26 AM,,,,,,,,,,,,,,,,,,,,,,,AOC
,,,,,,,,,,,,,,,,.pdf,"Valid Mail lD, Mobile No, Whatsapp No.",,,,,,,,,,,,,,,,,,,,,,,,,,,,,,,,,,,,,,,,,,AOC,,,,,,,,,,,,,4,2633277,BINAYAK MAHAPATRA,09-Nov-2024 03:45 PM,Rejected-Finance,Unsuccessful bidder,19-Apr-2025 11:20 AM,,,,,,,,,,,,,,,,,,,,,,,AOC
,,,,,,,,,,,,,,,,.xls,BoQ,,,,,,,,,,,,,,,,,,,,,,,,,,,,,,,,,,,,,,,,,,AOC,,,,,,,,,,,,,5,2635320,CH MOHAN PRASAD SUBUDHI,11-Nov-2024 12:59 AM,Rejected-Finance,Unsuccessful bidder,19-Apr-2025 11:20 AM,,,,,,,,,,,,,,,,,,,,,,,AOC
,,,,,,,,,,,,,,,,.pdf,Affidavit for Claiming Price Preface in Respect of SC/ST Contactor,,,,,,,,,,,,,,,,,,,,,,,,,,,,,,,,,,,,,,,,,,AOC,,,,,,,,,,,,,6,2636754,M/S SUSANTA KUMAR SAHU,10-Nov-2024 09:06 PM,Rejected-Finance,Unsuccessful bidder,19-Apr-2025 11:20 AM,,,,,,,,,,,,,,,,,,,,,,,AOC
,,,,,,,,,,,,,,,,.pdf,Affidavit regarding no relation certificate with department officers,,,,,,,,,,,,,,,,,,,,,,,,,,,,,,,,,,,,,,,,,,AOC,,,,,,,,,,,,,7,2636003,Pitidenga Patamajhi,11-Nov-2024 09:38 AM,Rejected-Finance,Unsuccessful bidder,19-Apr-2025 11:20 AM,,,,,,,,,,,,,,,,,,,,,,,AOC
,,,,,,,,,,,,,,,,,,,,,,,,,,,,,,,,,,,,,,,,,,,,,,,,,,,,,,,,,,,AOC,,,,,,,,,,,,,8,2635265,PRAKASH CHANDRA NAYAK,11-Nov-2024 07:50 AM,Rejected-Finance,Unsuccessful bidder,19-Apr-2025 11:20 AM,,,,,,,,,,,,,,,,,,,,,,,AOC
,,,,,,,,,,,,,,,,,,,,,,,,,,,,,,,,,,,,,,,,,,,,,,,,,,,,,,,,,,,AOC,,,,,,,,,,,,,9,2636286,SIBA NAYAK,11-Nov-2024 12:51 PM,Rejected-Finance,Unsuccessful bidder,19-Apr-2025 11:20 AM,,,,,,,,,,,,,,,,,,,,,,,AOC
