Organisation Chain,Tender Reference Number,Tender ID,Withdrawal Allowed,Tender Type,Form of contract,Tender Category,No. of Covers,General Technical Evaluation Allowed,ItemWise Technical Evaluation Allowed,Payment Mode,Is Multi Currency Allowed For BOQ,Is Multi Currency Allowed For Fee,Allow Two Stage Bidding,Cover No,Cover,Document Type,Description,Publish Date,Bid Opening Date,Document Download / Sale Start Date,Document Download / Sale End Date,Clarification Start Date,Clarification End Date,Bid Submission Start Date,Bid Submission End Date,Financial Bid Opening Date,EMD Amount in ₹,EMD Exemption Allowed,EMD Fee Type,EMD Percentage,EMD Payable To,EMD Payable At,S.No,Bank Name,Tender Fee in ₹,VAT Charges in ₹,Fee Payable To,Fee Payable At,Tender Fee Exemption Allowed,Name,Address,Title,Work Description,Pre Qualification Details,Independent External Monitor/Remarks,Tender Value in ₹,Product Category,Sub category,Contract Type,Bid Validity(Days),Period Of Work(Days),Location,Pincode,Pre Bid Meeting Place,Pre Bid Meeting Address,Pre Bid Meeting Date,Bid Opening Place,Should Allow NDA Tender,Allow Preferential Bidder,Tender Stage,Contract Date :,Contract Value :,Work Completion Period in days :,Updated By :,Updated on :,AOC document :,AOC Description :,S.No,Bid Number,Bidder Name,Awarded Currency,Awarded Value,S.No.1,Bid Number.1,Bidder Name.1,Submitted Date,Status,Remarks,Status Updated On,Type :,Summary :,Updated By :.1,Updated On :,Document :,BOQ Comparative Chart :,Committee Chairperson/Co-ordinator Name :,Committee Chairperson/Co-ordinator Type :,Committee Members :,Updated By :.2,Updated on :.1,Document :.1,Organisation Chain :,Tender ID :,Tender Ref No :,Tender Title :,Type :.1,Summary :.1,Updated By :.3,Updated On :.1,Document :.2,Committee Chairperson/Co-ordinator Name :.1,Committee Chairperson/Co-ordinator Type :.1,Committee Members :.1,Updated By :.4,Updated On :.2,Financial Bid Opening Date:,Document :.3,Tender Stage
EIC-CIVIL,CE-ROADS-I-08/2024-25,2024_EICCL_105761_2,Yes,Open Tender,Percentage,Works,2.0,No,No,Online,No,No,No,1.0,Fee/PreQual/Technical,.pdf,"Online proof copy of Tender Cost and EMD, GSTIN, PAN, RC and Affidavit",18-Oct-2024 12:00 PM,05-Nov-2024 11:30 AM,18-Oct-2024 12:00 PM,04-Nov-2024 05:30 PM,NA ,NA ,18-Oct-2024 12:00 PM,04-Nov-2024 05:30 PM,01-Jan-2025 11:30 AM,"16,55,000",Yes,fixed,,Nil,Nil,1.0,ICICI BANK,"10,000",0.0,Nil,Nil,No,"Chief Engineer, Roads-I, Odisha","O/o the E.I.C (Civil-Cum-Roads), Odisha, Nirman Soudha, New Building, Unit-V, Bhubaneswar",Improvement of Padmapur-Gudari- Siriguda-Raibiji road from 21/500 km to 52/000 km in the district of Rayagada under State Plan,Improvement of Padmapur-Gudari-Siriguda- Raibiji road from 21/500 km to 52/000 km in the district of Rayagada under State Plan,Please refer Tender documents. ,NA ,"16,54,87,013",Civil Works - Roads,NA ,Tender,90.0,365.0,Rayagada-II,751001.0,NA ,NA ,NA ,"O/o the E.I.C (Civil-Cum-Roads), Odisha",No ,No,AOC,23-Apr-2025,"INR 140,680,510",365.0,Pradipta Kumar Nayak,23-Apr-2025 11:51 AM,Pdmapur_Gudari.pdf (690.00 KB),509P1 of 2024-25,1.0,2614956.0,M/S Saroj Kumar Sharma,INR,"140,680,510",1,2600220,AMRES SAI CONSTRUCTION PVT. LTD.,02-Nov-2024 05:11 PM,Rejected-AOC,L1 bidder,23-Apr-2025 11:51 AM,Finance,Finance opening,Pradipta Kumar Nayak,01-Jan-2025 11:49 AM,,BOQ Comparative Chart,CE Roads-I Odisha,Internal,,Pradipta Kumar Nayak,23-Apr-2025 11:44 AM,finsummary_510051.pdf (689.60 KB),EIC-CIVIL,2024_EICCL_105761_2,CE-ROADS-I-08/2024-25,Improvement of Padmapur-Gudari- Siriguda-Raibiji road from 21/500 km to 52/000 km in the district of Rayagada under State Plan,Technical,Opening,Pradipta Kumar Nayak,05-Nov-2024 12:00 PM,,EIC Civil cum Roads Odisha,Internal,,Pradipta Kumar Nayak,30-Dec-2024 05:47 PM,01-Jan-2025 11:30 AM,techsummary_510051.pdf (355.43 KB),AOC
,,,,,,,,,,,,,,,,.pdf,Machineries and work experience,,,,,,,,,,,,,,,,2.0,ICICI NEFT/RTGS,,,,,,,,,,,,,,,,,,,,,,,,,,AOC,,,,,,,,,,,,,2,2588886,BIJAYA KUMAR PRADHAN,04-Nov-2024 03:39 PM,Rejected-Technical,Disqualified,30-Dec-2024 05:47 PM,,,,,,,,,,,,,,,,,,,,,,,,,,,,,AOC
,,,,,,,,,,,,,,,,.pdf,Other documents as per DTCN,,,,,,,,,,,,,,,,,,,,,,,,,,,,,,,,,,,,,,,,,,,AOC,,,,,,,,,,,,,3,2615032,JAY PRAKASH SHARMA,04-Nov-2024 05:25 PM,Rejected-AOC,L1 bidder,23-Apr-2025 11:51 AM,,,,,,,,,,,,,,,,,,,,,,,,,,,,,AOC
,,,,,,,,,,,,,,2.0,Finance,.xls,Bill of quantities,,,,,,,,,,,,,,,,,,,,,,,,,,,,,,,,,,,,,,,,,,,AOC,,,,,,,,,,,,,4,2600306,M/s B.Ramanaiah Constructions,02-Nov-2024 06:53 PM,Rejected-AOC,L1 bidder,23-Apr-2025 11:51 AM,,,,,,,,,,,,,,,,,,,,,,,,,,,,,AOC
,,,,,,,,,,,,,,,,,,,,,,,,,,,,,,,,,,,,,,,,,,,,,,,,,,,,,,,,,,,,AOC,,,,,,,,,,,,,5,2614956,M/S Saroj Kumar Sharma,04-Nov-2024 05:14 PM,Accepted-AOC,Selected as L1 bidder,23-Apr-2025 11:51 AM,,,,,,,,,,,,,,,,,,,,,,,,,,,,,AOC
