Organisation Chain,Tender Reference Number,Tender ID,Withdrawal Allowed,Tender Type,Form of contract,Tender Category,No. of Covers,General Technical Evaluation Allowed,ItemWise Technical Evaluation Allowed,Payment Mode,Is Multi Currency Allowed For BOQ,Is Multi Currency Allowed For Fee,Allow Two Stage Bidding,Cover No,Cover,Document Type,Description,Publish Date,Bid Opening Date,Document Download / Sale Start Date,Document Download / Sale End Date,Clarification Start Date,Clarification End Date,Bid Submission Start Date,Bid Submission End Date,EMD Amount in ₹,EMD Exemption Allowed,EMD Fee Type,EMD Percentage,EMD Payable To,EMD Payable At,S.No,Corrigendum Title,Corrigendum Type,View,S.No.1,Bank Name,Tender Fee in ₹,VAT Charges in ₹,Fee Payable To,Fee Payable At,Tender Fee Exemption Allowed,Name,Address,Title,Work Description,Pre Qualification Details,Independent External Monitor/Remarks,Tender Value in ₹,Product Category,Sub category,Contract Type,Bid Validity(Days),Period Of Work(Days),Location,Pincode,Pre Bid Meeting Place,Pre Bid Meeting Address,Pre Bid Meeting Date,Bid Opening Place,Should Allow NDA Tender,Allow Preferential Bidder,Tender Stage,Contract Date :,Contract Value :,Work Completion Period in days :,Updated By :,Updated on :,AOC document :,AOC Description :,S.No,Bid Number,Bidder Name,Awarded Currency,Awarded Value,S.No.1,Bid Number.1,Bidder Name.1,Submitted Date,Status,Remarks,Status Updated On,Type :,Summary :,Updated By :.1,Updated On :,Document :,BOQ Comparative Chart :,Committee Chairperson/Co-ordinator Name :,Committee Chairperson/Co-ordinator Type :,Committee Members :,Updated By :.2,Updated on :.1,Document :.1,Organisation Chain :,Tender ID :,Tender Ref No :,Tender Title :,Committee Chairperson/Co-ordinator Name :.1,Committee Chairperson/Co-ordinator Type :.1,Committee Members :.1,Updated By :.3,Updated On :.1,Document :.2,Tender Stage
Rural Water Supply and Sanitation||RWSS Circle Bolangir||RWSS Division Bolangir,BID No 11 OF 2024 - 25,2024_RWSS_108552_2,Yes,National Competitive Bid,Percentage,Works,1.0,No,No,Online,No,No,No,1.0,Fee/PreQual/Technical/Finance,.pdf,Tender paper cost EMD GST PAN Contractor Registration Certificate Experience Certificate etc,20-Dec-2024 03:00 PM,04-Jan-2025 11:00 AM,20-Dec-2024 03:00 PM,03-Jan-2025 05:00 PM,NA ,NA ,20-Dec-2024 03:00 PM,03-Jan-2025 05:00 PM,"34,632",Yes,percentage,1.0%,Nil,Nil,1.0,Due Date Extended for tenders closing on 31-12-2024.,Admin Corrigendum Date Extend,,1.0,ICICI BANK,"6,000",0.0,Nil,Nil,Yes,Executive Engineer,O/o Superintending Engineer RWSS Division Balangir,Supply all materials labour T and P erection testing and commissioning of external power supply to village Guhuriapadar_UGR Ainlapali_UGR Fatamunda_Source Pandridunguri_Source under Agalpur Block,Supply all materials labour T and P erection testing and commissioning of external power supply to village Guhuriapadar_UGR Ainlapali_UGR Fatamunda_Source Pandridunguri_Source under Agalpur Block,PLEASE REFER DTCN ,NA ,"34,63,205",Electrical Works,Electrical Works ,Tender,90.0,45.0,Village Guhuriapadar under Agalpur Block,767022.0,NA ,NA ,NA ,O/o Superintending Engineer RWSS Division Balangir,No ,No,AOC,14-Apr-2025,"INR 3,463,205",45.0,Khagendra Barik,14-Apr-2025 01:11 PM,GUHURIAPADAR.pdf (1835.00 KB),L1 BIDDER HAS RESPOND,1.0,2717906.0,Arihant Electricals and Engineers,INR,"2,944,071",1,2717906,Arihant Electricals and Engineers,31-Dec-2024 11:42 AM,Accepted-AOC,AWARDED AS PER OPWD CODE,14-Apr-2025 01:11 PM,Finance,BID HAS BEEN OPENED,Khagendra Barik,04-Jan-2025 06:20 PM,finance_521310.pdf,BOQ Comparative Chart,ROUPYARANJAN_BEHERA,Internal,ARJUN_MATHO_ Khagendra_Barik,Khagendra Barik,14-Apr-2025 01:06 PM,finsummary_521310.pdf (1834.55 KB),Rural Water Supply and Sanitation||RWSS Circle Bolangir||RWSS Division Bolangir,2024_RWSS_108552_2,BID No 11 OF 2024 - 25,Supply all materials labour T and P erection testing and commissioning of external power supply to village Guhuriapadar_UGR Ainlapali_UGR Fatamunda_Source Pandridunguri_Source under Agalpur Block,ROUPYARANJAN_BEHERA,Internal,ARJUN_MATHO_ Khagendra_Barik,Khagendra Barik,14-Apr-2025 01:01 PM,techsummary_521310.pdf (1834.55 KB),AOC
,,,,,,,,,,,,,,,,.pdf,Other Document as per DTCN,,,,,,,,,,,,,,,,,,,2.0,ICICI NEFT/RTGS,,,,,,,,,,,,,,,,,,,,,,,,,,AOC,,,,,,,,,,,,,2,2714754,ASHOK CHANDRA PATRA,28-Dec-2024 01:15 PM,Rejected-Finance,AFTER TRANSPERENT LOTTERY,14-Apr-2025 01:06 PM,,,,,,,,,,,,,,,,,,,,,,,AOC
,,,,,,,,,,,,,,,,.xls,BILL OF QUANTITY,,,,,,,,,,,,,,,,,,,,,,,,,,,,,,,,,,,,,,,,,,,,,,AOC,,,,,,,,,,,,,3,2716679,MDSG CONSTRUCTION PRIVATE LIMITED,31-Dec-2024 12:19 AM,Rejected-Finance,AFTER TRANSPERENT LOTTERY,14-Apr-2025 01:06 PM,,,,,,,,,,,,,,,,,,,,,,,AOC
,,,,,,,,,,,,,,,,,,,,,,,,,,,,,,,,,,,,,,,,,,,,,,,,,,,,,,,,,,,,,,,AOC,,,,,,,,,,,,,4,2717219,PABITRA ELECTRICAL WORKSHOP,31-Dec-2024 02:43 PM,Rejected-AOC,REJECTED AS PER OPWD CODE,14-Apr-2025 01:11 PM,,,,,,,,,,,,,,,,,,,,,,,AOC
,,,,,,,,,,,,,,,,,,,,,,,,,,,,,,,,,,,,,,,,,,,,,,,,,,,,,,,,,,,,,,,AOC,,,,,,,,,,,,,5,2718116,SHREE SHYAM INFRASTRUCTURE,31-Dec-2024 12:13 AM,Rejected-Finance,AFTER TRANSPERENT LOTTERY,14-Apr-2025 01:06 PM,,,,,,,,,,,,,,,,,,,,,,,AOC
