Organisation Chain,Tender Reference Number,Tender ID,Withdrawal Allowed,Tender Type,Form of contract,Tender Category,No. of Covers,General Technical Evaluation Allowed,ItemWise Technical Evaluation Allowed,Payment Mode,Is Multi Currency Allowed For BOQ,Is Multi Currency Allowed For Fee,Allow Two Stage Bidding,Cover No,Cover,Document Type,Description,Publish Date,Bid Opening Date,Document Download / Sale Start Date,Document Download / Sale End Date,Clarification Start Date,Clarification End Date,Bid Submission Start Date,Bid Submission End Date,Financial Bid Opening Date,EMD Amount in ₹,EMD Exemption Allowed,EMD Fee Type,EMD Percentage,EMD Payable To,EMD Payable At,S.No,Bank Name,Tender Fee in ₹,VAT Charges in ₹,Fee Payable To,Fee Payable At,Tender Fee Exemption Allowed,Name,Address,Title,Work Description,Pre Qualification Details,Independent External Monitor/Remarks,Tender Value in ₹,Product Category,Sub category,Contract Type,Bid Validity(Days),Period Of Work(Days),Location,Pincode,Pre Bid Meeting Place,Pre Bid Meeting Address,Pre Bid Meeting Date,Bid Opening Place,Should Allow NDA Tender,Allow Preferential Bidder,Tender Stage,Contract Date :,Contract Value :,Work Completion Period in days :,Updated By :,Updated on :,AOC document :,AOC Description :,S.No,Bid Number,Bidder Name,Awarded Currency,Awarded Value,S.No.1,Bid Number.1,Bidder Name.1,Submitted Date,Status,Remarks,Status Updated On,Type :,Summary :,Updated By :.1,Updated On :,Document :,BOQ Comparative Chart :,Committee Chairperson/Co-ordinator Name :,Committee Chairperson/Co-ordinator Type :,Committee Members :,Updated By :.2,Updated on :.1,Document :.1,Organisation Chain :,Tender ID :,Tender Ref No :,Tender Title :,Type :.1,Summary :.1,Updated By :.3,Updated On :.1,Document :.2,Committee Chairperson/Co-ordinator Name :.1,Committee Chairperson/Co-ordinator Type :.1,Committee Members :.1,Updated By :.4,Updated On :.2,Financial Bid Opening Date:,Document :.3,S.No.2,Revocation Title,Revocation Description,Published Date,Document Name,Document Size(in KB),Revocated To,Tender Stage
EIC-CIVIL,CE-ROADS-I- 07/2024-25,2024_EICCL_105592_9,Yes,Open Tender,Percentage,Works,2.0,No,No,Online,No,No,No,1.0,Fee/PreQual/Technical,.pdf,"Online proof copy of Tender Cost and EMD, GSTIN, PAN, RC and Affidavit",09-Oct-2024 06:00 PM,29-Oct-2024 11:30 AM,09-Oct-2024 06:00 PM,28-Oct-2024 05:30 PM,NA ,NA ,09-Oct-2024 06:00 PM,28-Oct-2024 05:30 PM,26-Dec-2024 11:30 AM,"22,48,000",Yes,fixed,,Nil,Nil,1.0,ICICI BANK,"10,000",0.0,Nil,Nil,No,"Chief Engineer, Roads-I, Odisha","O/o the E.I.C (Civil-Cum-Roads), Odisha, Nirman Soudha, New Building, Unit-V, Bhubaneswar.","Improvement to Mandasa-Meliaputi- Paralakhemundi- Kashinagar-Gunupur (SH-4) road from 25/200 km to 40/200 km, 48/000 km to 51/623 km and 57/200 km to 100/716 km in the district of Gajapati under State Plan","Improvement to Mandasa-Meliaputi-Paralakhemundi-Kashinagar - Gunupur (SH-4) road from 25/200 km to 40/200 km, 48/000 km to 51/623 km and 57/200 km to 100/716 km in the district of Gajapati under State Plan",Please refer Tender documents. ,NA ,"22,48,49,252",Civil Works - Roads,NA ,Tender,90.0,210.0,Paralakhemundi Division,751001.0,NA ,NA ,NA ,"O/o the E.I.C (Civil-Cum-Roads), Odisha",No ,No,AOC,30-Apr-2025,"INR 191,144,349",210.0,Pradipta Kumar Nayak,30-Apr-2025 05:38 PM,MMPKGRoadgreement.pdf (1243.00 KB),01P1 of 2025-26,1.0,2591409.0,M/s B.Ramanaiah Constructions,INR,"191,144,349",1,2593707,ANAND SHREE INFRA REALITY PRIVATE LIMITED,26-Oct-2024 07:48 PM,Rejected-Technical,Disqualified,24-Dec-2024 05:24 PM,Finance,Finance,Pradipta Kumar Nayak,26-Dec-2024 11:57 AM,,BOQ Comparative Chart,CE Roads-I Odisha,Internal,,Pradipta Kumar Nayak,30-Apr-2025 05:34 PM,finsummary_509348.pdf (1243.06 KB),EIC-CIVIL,2024_EICCL_105592_9,CE-ROADS-I- 07/2024-25,"Improvement to Mandasa-Meliaputi- Paralakhemundi- Kashinagar-Gunupur (SH-4) road from 25/200 km to 40/200 km, 48/000 km to 51/623 km and 57/200 km to 100/716 km in the district of Gajapati under State Plan",Technical,Opening,Lipsa Mallick,24-Dec-2024 05:17 PM,,EIC-Civil-cum-Roads,Internal,,Lipsa Mallick,24-Dec-2024 05:24 PM,26-Dec-2024 11:30 AM,techsummary_509348.pdf (1904.05 KB),1.0,Tender Revocation,Tender Revocation,24-Dec-2024 04:58 PM,Mandasa_Meliaputi_Revocation.pdf ,387.18,Technical Opening,AOC
,,,,,,,,,,,,,,,,.pdf,Machineries and work experience,,,,,,,,,,,,,,,,2.0,ICICI NEFT/RTGS,,,,,,,,,,,,,,,,,,,,,,,,,,AOC,,,,,,,,,,,,,2,2595404,B Manoj Kumar Rao,27-Oct-2024 11:02 PM,Rejected-Finance,Other than L1 and L2 bidder,30-Apr-2025 05:34 PM,,,,,,,,,,,,,,,,,,,,,,,,,,,,,,,,,,,,AOC
,,,,,,,,,,,,,,,,.pdf,Other documents as per DTCN,,,,,,,,,,,,,,,,,,,,,,,,,,,,,,,,,,,,,,,,,,,AOC,,,,,,,,,,,,,3,2592987,KAPILASH INFRASOL PROJECTS PRIVATE LIMITED,28-Oct-2024 12:29 PM,Rejected-AOC,L2 bidder,30-Apr-2025 05:38 PM,,,,,,,,,,,,,,,,,,,,,,,,,,,,,,,,,,,,AOC
,,,,,,,,,,,,,,2.0,Finance,.xls,Bill of quantities,,,,,,,,,,,,,,,,,,,,,,,,,,,,,,,,,,,,,,,,,,,AOC,,,,,,,,,,,,,4,2591409,M/s B.Ramanaiah Constructions,26-Oct-2024 05:21 PM,Accepted-AOC,L1 bidder,30-Apr-2025 05:38 PM,,,,,,,,,,,,,,,,,,,,,,,,,,,,,,,,,,,,AOC
,,,,,,,,,,,,,,,,,,,,,,,,,,,,,,,,,,,,,,,,,,,,,,,,,,,,,,,,,,,,AOC,,,,,,,,,,,,,5,2594640,M/s Tara Tarini Constructions Pvt. Ltd.,28-Oct-2024 02:21 PM,Rejected-Technical,Disqualified,24-Dec-2024 05:24 PM,,,,,,,,,,,,,,,,,,,,,,,,,,,,,,,,,,,,AOC
