Organisation Chain,Tender Reference Number,Tender ID,Withdrawal Allowed,Tender Type,Form of contract,Tender Category,No. of Covers,General Technical Evaluation Allowed,ItemWise Technical Evaluation Allowed,Payment Mode,Is Multi Currency Allowed For BOQ,Is Multi Currency Allowed For Fee,Allow Two Stage Bidding,Cover No,Cover,Document Type,Description,Publish Date,Bid Opening Date,Document Download / Sale Start Date,Document Download / Sale End Date,Clarification Start Date,Clarification End Date,Bid Submission Start Date,Bid Submission End Date,Financial Bid Opening Date,EMD Amount in ₹,EMD Exemption Allowed,EMD Fee Type,EMD Percentage,EMD Payable To,EMD Payable At,S.No,Corrigendum Title,Corrigendum Type,View,S.No.1,Bank Name,Tender Fee in ₹,VAT Charges in ₹,Fee Payable To,Fee Payable At,Tender Fee Exemption Allowed,Name,Address,Title,Work Description,Pre Qualification Details,Independent External Monitor/Remarks,Tender Value in ₹,Product Category,Sub category,Contract Type,Bid Validity(Days),Period Of Work(Days),Location,Pincode,Pre Bid Meeting Place,Pre Bid Meeting Address,Pre Bid Meeting Date,Bid Opening Place,Should Allow NDA Tender,Allow Preferential Bidder,Tender Stage,Contract Date :,Contract Value :,Work Completion Period in days :,Updated By :,Updated on :,AOC document :,AOC Description :,S.No,Bid Number,Bidder Name,Awarded Currency,Awarded Value,S.No.1,Bid Number.1,Bidder Name.1,Submitted Date,Status,Remarks,Status Updated On,Type :,Summary :,Updated By :.1,Updated On :,Document :,BOQ Comparative Chart :,Committee Chairperson/Co-ordinator Name :,Committee Chairperson/Co-ordinator Type :,Committee Members :,Updated By :.2,Updated on :.1,Document :.1,Organisation Chain :,Tender ID :,Tender Ref No :,Tender Title :,Type :.1,Summary :.1,Updated By :.3,Updated On :.1,Document :.2,Committee Chairperson/Co-ordinator Name :.1,Committee Chairperson/Co-ordinator Type :.1,Committee Members :.1,Updated By :.4,Updated On :.2,Financial Bid Opening Date:,Document :.3,Tender Stage
Municipal Bodies||Cuttack Municipal Corporation,MCCMCCTC_Div-II/2024-25,2024_ORULB_107845_1,Yes,Open Tender,Percentage,Works,2.0,No,No,Online,No,No,No,1.0,Fee/PreQual/Technical,.pdf,"PAPER COST, EMD ONLINE,VAT, PAN, EPF REGISTRATION AND GST-IN CERTIFICATE OTHER DOCUMENTS AS PER DTCN",03-Dec-2024 05:30 PM,31-Dec-2024 11:00 AM,03-Dec-2024 05:30 PM,30-Dec-2024 05:00 PM,03-Dec-2024 05:30 PM ,23-Dec-2024 05:00 PM ,03-Dec-2024 05:30 PM,30-Dec-2024 05:00 PM,21-Jan-2025 01:00 PM,"5,00,000",Yes,fixed,,Nil,Nil,1.0,1st corrigendum,Date,,1.0,ICICI BANK,"11,800",0.0,Nil,Nil,No,Commissioner,"Biju Bhawan, Choudhury Bazar, Cuttack","Annual Rate Contract for Supply, Operation and Maintenance of diesel Operated Vehicle (DOV) on Hiring Basis in Cuttack Municipal Corporation.","Annual Rate Contract for Supply, Operation and Maintenance of diesel Operated Vehicle (DOV) on Hiring Basis in Cuttack Municipal Corporation.",Please refer Tender documents. ,NA ,"40,00,000",Civil Works - Others,NA ,Rate Contract,90.0,1095.0,CMC,753012.0,"Biju Bhawan, Choudhury Bazar, Cuttack ","Biju Bhawan, Choudhury Bazar, Cuttack ",11-Dec-2024 11:00 AM ,"Biju Bhawan, Choudhury Bazar, Cuttack",No ,No,AOC,11-Apr-2025,"INR 3,458,000",1095.0,Bharat Kumar Sethi,11-Apr-2025 05:23 PM,WODOV.pdf (708.00 KB),Work order,1.0,2708293.0,G.MANJU SERVICES PRIVATE LIMITED,INR,"3,458,000",1,2713753,ABC TRANSCARRIERS PRIVATE LIMITED,27-Dec-2024 02:56 PM,Rejected-AOC,Rejected,11-Apr-2025 05:24 PM,Finance,05 nos bidder qualified. BOQ Comparative Chart is enclosed for reference.,Bharat Kumar Sethi,21-Jan-2025 01:37 PM,finance_519132.pdf,BOQ Comparative Chart,Executive Engineer,Internal,Asst. Executive Engineer,Bharat Kumar Sethi,11-Apr-2025 05:19 PM,finsummary_519132.pdf (708.25 KB),Municipal Bodies||Cuttack Municipal Corporation,2024_ORULB_107845_1,MCCMCCTC_Div-II/2024-25,"Annual Rate Contract for Supply, Operation and Maintenance of diesel Operated Vehicle (DOV) on Hiring Basis in Cuttack Municipal Corporation.",Technical,Seven bidder participated.,Bharat Kumar Sethi,21-Jan-2025 12:43 PM,technical_519132.pdf,Executive Engineer,Internal,Committee Members,Bharat Kumar Sethi,21-Jan-2025 12:49 PM,21-Jan-2025 01:00 PM,techsummary_519132.pdf (512.96 KB),AOC
,,,,,,,,,,,,,,2.0,Finance,.xls,Bill of Quantity,,,,,,,,,,,,,,,,2.0,1st Corrigendum,Other,,2.0,ICICI NEFT/RTGS,,,,,,,,,,,,,,,,,,,,,,,,,,AOC,,,,,,,,,,,,,2,2708293,G.MANJU SERVICES PRIVATE LIMITED,30-Dec-2024 12:52 PM,Accepted-AOC,Accepted,11-Apr-2025 05:24 PM,,,,,,,,,,,,,,,,,,,,,,,,,,,,,AOC
,,,,,,,,,,,,,,,,,,,,,,,,,,,,,,,,,,,,,,,,,,,,,,,,,,,,,,,,,,,,,,,,AOC,,,,,,,,,,,,,3,2704997,Green Circle Environment Pvt. Ltd.,23-Dec-2024 03:51 PM,Rejected-AOC,Rejected,11-Apr-2025 05:24 PM,,,,,,,,,,,,,,,,,,,,,,,,,,,,,AOC
,,,,,,,,,,,,,,,,,,,,,,,,,,,,,,,,,,,,,,,,,,,,,,,,,,,,,,,,,,,,,,,,AOC,,,,,,,,,,,,,4,2707709,GREEN INNOVATIVE POWER PRIVATE LIMITED,23-Dec-2024 04:23 PM,Rejected-AOC,Rejected,11-Apr-2025 05:24 PM,,,,,,,,,,,,,,,,,,,,,,,,,,,,,AOC
,,,,,,,,,,,,,,,,,,,,,,,,,,,,,,,,,,,,,,,,,,,,,,,,,,,,,,,,,,,,,,,,AOC,,,,,,,,,,,,,5,2708507,M/s. KALINGA WARRIORS SECURITY SERVICES,23-Dec-2024 04:24 PM,Rejected-Technical,Not qualified,21-Jan-2025 12:49 PM,,,,,,,,,,,,,,,,,,,,,,,,,,,,,AOC
,,,,,,,,,,,,,,,,,,,,,,,,,,,,,,,,,,,,,,,,,,,,,,,,,,,,,,,,,,,,,,,,AOC,,,,,,,,,,,,,6,2706445,SWARNADEVI AGENCY,26-Dec-2024 12:06 PM,Rejected-AOC,Rejected,11-Apr-2025 05:24 PM,,,,,,,,,,,,,,,,,,,,,,,,,,,,,AOC
,,,,,,,,,,,,,,,,,,,,,,,,,,,,,,,,,,,,,,,,,,,,,,,,,,,,,,,,,,,,,,,,AOC,,,,,,,,,,,,,7,2707646,THE SANSKAR,23-Dec-2024 04:07 PM,Rejected-Technical,Not qualified,21-Jan-2025 12:49 PM,,,,,,,,,,,,,,,,,,,,,,,,,,,,,AOC
