Organisation Chain,Tender Reference Number,Tender ID,Withdrawal Allowed,Tender Type,Form of contract,Tender Category,No. of Covers,General Technical Evaluation Allowed,ItemWise Technical Evaluation Allowed,Payment Mode,Is Multi Currency Allowed For BOQ,Is Multi Currency Allowed For Fee,Allow Two Stage Bidding,Cover No,Cover,Document Type,Description,Publish Date,Bid Opening Date,Document Download / Sale Start Date,Document Download / Sale End Date,Clarification Start Date,Clarification End Date,Bid Submission Start Date,Bid Submission End Date,Financial Bid Opening Date,EMD Amount in ₹,EMD Exemption Allowed,EMD Fee Type,EMD Percentage,EMD Payable To,EMD Payable At,S.No,Bank Name,Tender Fee in ₹,VAT Charges in ₹,Fee Payable To,Fee Payable At,Tender Fee Exemption Allowed,Name,Address,Title,Work Description,Pre Qualification Details,Independent External Monitor/Remarks,Tender Value in ₹,Product Category,Sub category,Contract Type,Bid Validity(Days),Period Of Work(Days),Location,Pincode,Pre Bid Meeting Place,Pre Bid Meeting Address,Pre Bid Meeting Date,Bid Opening Place,Should Allow NDA Tender,Allow Preferential Bidder,Tender Stage,Contract Date :,Contract Value :,Work Completion Period in days :,Updated By :,Updated on :,AOC document :,AOC Description :,S.No,Bid Number,Bidder Name,Awarded Currency,Awarded Value,S.No.1,Bid Number.1,Bidder Name.1,Submitted Date,Status,Remarks,Status Updated On,Type :,Summary :,Updated By :.1,Updated On :,Document :,BOQ Comparative Chart :,Committee Chairperson/Co-ordinator Name :,Committee Chairperson/Co-ordinator Type :,Committee Members :,Updated By :.2,Updated on :.1,Document :.1,Organisation Chain :,Tender ID :,Tender Ref No :,Tender Title :,Type :.1,Summary :.1,Updated By :.3,Updated On :.1,Document :.2,Committee Chairperson/Co-ordinator Name :.1,Committee Chairperson/Co-ordinator Type :.1,Committee Members :.1,Updated By :.4,Updated On :.2,Financial Bid Opening Date:,Document :.3,Tender Stage
CE RW I||RWCIRCLE-ANGUL,Road Online-AGL-18/2024-25,2025_CERWI_109176_6,Yes,National Competitive Bid,Percentage,Works,2.0,No,No,Online,No,No,No,1.0,Fee/PreQual/Technical,.pdf,"Paper cost, EMD one percentage of the estimated cost,GST,PAN,RC,Affidavit regarding correctness",11-Jan-2025 05:30 PM,24-Jan-2025 11:00 AM,11-Jan-2025 05:30 PM,22-Jan-2025 05:00 PM,11-Jan-2025 05:30 PM ,21-Jan-2025 01:00 PM ,11-Jan-2025 05:30 PM,22-Jan-2025 05:00 PM,14-Feb-2025 11:00 AM,"3,40,650",Yes,percentage,1.0%,Nil,Nil,1.0,ICICI BANK,"10,000",0.0,Nil,Nil,No,"Chief Engineer,RWC,Angul",At-Hamikpada Po-Hakikmpada District- Angul Pin-759143,RD road Asurbandh to Chandipal via Kingol Harijansahi under MMSY CMRL,RD road Asurbandh to Chandipal via Kingol Harijansahi under MMSY CMRL,. ,NA ,"3,40,65,000",Civil Works - Roads,NA ,Tender,90.0,270.0,Kamakhyanagar,759018.0,NA ,NA ,NA ,"Office of the Chief Construction Engineer,RWC,Angu",No ,No,AOC,29-Apr-2025,"INR 28,958,085",270.0,Baikuntha Nath Sarangi,29-Apr-2025 09:43 AM,Asurabandha.pdf (396.00 KB),REFUND OF E.M.D,1.0,2764396.0,Tushar Kant Baral,INR,"28,958,085",1,2769182,BIRENDRA SAHOO,21-Jan-2025 04:54 PM,Rejected-Technical,Due to slow progress of work vide Agmt.No.240 P1 of 2023-24 (Jokapani to Keonjhar District via-Karandia Baliposi road under CMRL) of R.W.Divn.Angul i.e. up-to-date expr.20.77 percentage with date of commencement 09.02.24 and completion-08.08.24,11-Feb-2025 03:48 PM,Finance,Six Bidders found,Baikuntha Nath Sarangi,14-Feb-2025 12:55 PM,finance_525393.pdf,BOQ Comparative Chart,Chief Construction Engineer,Internal,E.E DAO ESTIMATOR,Baikuntha Nath Sarangi,29-Apr-2025 09:38 AM,finsummary_525393.pdf (395.55 KB),CE RW I||RWCIRCLE-ANGUL,2025_CERWI_109176_6,Road Online-AGL-18/2024-25,RD road Asurbandh to Chandipal via Kingol Harijansahi under MMSY CMRL,Technical,7nos bidder found,Baikuntha Nath Sarangi,28-Jan-2025 06:08 PM,technical_525393.pdf,Chief Engineer,Internal,E.E DAO ESTIMATOR,Baikuntha Nath Sarangi,11-Feb-2025 03:48 PM,14-Feb-2025 11:00 AM,techsummary_525393.pdf (513.51 KB),AOC
,,,,,,,,,,,,,,,,.pdf,"Labour licence,Similar nature of work ,Annual Turn Over,Work in hand ,No relation certificate,Litiga",,,,,,,,,,,,,,,,2.0,ICICI NEFT/RTGS,,,,,,,,,,,,,,,,,,,,,,,,,,AOC,,,,,,,,,,,,,2,2771275,DHANESWAR SAHU,22-Jan-2025 04:37 PM,Rejected-AOC,0,29-Apr-2025 09:43 AM,,,,,,,,,,,,,,,,,,,,,,,,,,,,,AOC
,,,,,,,,,,,,,,,,.pdf,"Machinery own obtained on hire, Balance sheet Bidder Contact address and other documents as per DTCN",,,,,,,,,,,,,,,,,,,,,,,,,,,,,,,,,,,,,,,,,,,AOC,,,,,,,,,,,,,3,2770789,Harekrushna Sahoo,22-Jan-2025 02:16 PM,Rejected-AOC,0,29-Apr-2025 09:43 AM,,,,,,,,,,,,,,,,,,,,,,,,,,,,,AOC
,,,,,,,,,,,,,,2.0,Finance,.xls,Bill of Quantities in xls sheet,,,,,,,,,,,,,,,,,,,,,,,,,,,,,,,,,,,,,,,,,,,AOC,,,,,,,,,,,,,4,2770663,MANAS RANJAN ROUT,22-Jan-2025 02:05 PM,Rejected-AOC,0,29-Apr-2025 09:43 AM,,,,,,,,,,,,,,,,,,,,,,,,,,,,,AOC
,,,,,,,,,,,,,,,,,,,,,,,,,,,,,,,,,,,,,,,,,,,,,,,,,,,,,,,,,,,,AOC,,,,,,,,,,,,,5,2763478,PRADEEP KUMAR PRADHAN,18-Jan-2025 04:10 PM,Rejected-AOC,0,29-Apr-2025 09:43 AM,,,,,,,,,,,,,,,,,,,,,,,,,,,,,AOC
,,,,,,,,,,,,,,,,,,,,,,,,,,,,,,,,,,,,,,,,,,,,,,,,,,,,,,,,,,,,AOC,,,,,,,,,,,,,6,2763641,PRIYA RANJAN BISWAL,18-Jan-2025 06:18 PM,Rejected-AOC,0,29-Apr-2025 09:43 AM,,,,,,,,,,,,,,,,,,,,,,,,,,,,,AOC
,,,,,,,,,,,,,,,,,,,,,,,,,,,,,,,,,,,,,,,,,,,,,,,,,,,,,,,,,,,,AOC,,,,,,,,,,,,,7,2764396,Tushar Kant Baral,20-Jan-2025 09:15 PM,Accepted-AOC,Winner of lottery among the 1st lowest bidders,29-Apr-2025 09:43 AM,,,,,,,,,,,,,,,,,,,,,,,,,,,,,AOC
