Organisation Chain,Tender Reference Number,Tender ID,Withdrawal Allowed,Tender Type,Form of contract,Tender Category,No. of Covers,General Technical Evaluation Allowed,ItemWise Technical Evaluation Allowed,Payment Mode,Is Multi Currency Allowed For BOQ,Is Multi Currency Allowed For Fee,Allow Two Stage Bidding,Cover No,Cover,Document Type,Description,Publish Date,Bid Opening Date,Document Download / Sale Start Date,Document Download / Sale End Date,Clarification Start Date,Clarification End Date,Bid Submission Start Date,Bid Submission End Date,Financial Bid Opening Date,EMD Amount in ₹,EMD Exemption Allowed,EMD Fee Type,EMD Percentage,EMD Payable To,EMD Payable At,S.No,Bank Name,Tender Fee in ₹,VAT Charges in ₹,Fee Payable To,Fee Payable At,Tender Fee Exemption Allowed,Name,Address,Title,Work Description,Pre Qualification Details,Independent External Monitor/Remarks,Tender Value in ₹,Product Category,Sub category,Contract Type,Bid Validity(Days),Period Of Work(Days),Location,Pincode,Pre Bid Meeting Place,Pre Bid Meeting Address,Pre Bid Meeting Date,Bid Opening Place,Should Allow NDA Tender,Allow Preferential Bidder,Tender Stage,Contract Date :,Contract Value :,Work Completion Period in days :,Updated By :,Updated on :,AOC document :,AOC Description :,S.No,Bid Number,Bidder Name,Awarded Currency,Awarded Value,S.No.1,Bid Number.1,Bidder Name.1,Submitted Date,Status,Remarks,Status Updated On,Type :,Summary :,Updated By :.1,Updated On :,Document :,BOQ Comparative Chart :,Committee Chairperson/Co-ordinator Name :,Committee Chairperson/Co-ordinator Type :,Committee Members :,Updated By :.2,Updated on :.1,Document :.1,Organisation Chain :,Tender ID :,Tender Ref No :,Tender Title :,Type :.1,Summary :.1,Updated By :.3,Updated On :.1,Document :.2,Committee Chairperson/Co-ordinator Name :.1,Committee Chairperson/Co-ordinator Type :.1,Committee Members :.1,Updated By :.4,Updated On :.2,Financial Bid Opening Date:,Document :.3,Tender Stage
PHEO||SEPH-CIRCLE-SAMBALPUR||EEPH-DIVN-SAMBALPUR,SEPHSBP-06/2023-24 Dt. 22.11.2023,2023_PHEO_97750_2,Yes,National Competitive Bid,Percentage,Works,2.0,No,No,Online,No,No,No,1.0,Fee/PreQual/Technical,.pdf,"Cost of Tender Paper, EMD, PAN, GST, Affidavits as per DTCN",02-Dec-2023 09:00 AM,15-Dec-2023 11:30 AM,02-Dec-2023 09:00 AM,14-Dec-2023 05:00 PM,02-Dec-2023 09:00 AM ,04-Dec-2023 05:00 PM ,02-Dec-2023 09:00 AM,14-Dec-2023 05:00 PM,18-Jan-2024 04:00 PM,"1,16,340",Yes,percentage,1.0%,Nil,Nil,1.0,ICICI BANK,"10,000",0.0,Nil,Nil,No,"Executive Engineer, P.H division, Sambalpur",Executive Engineer P H Division Sambalpur Brooks Hill Near Stadium At Po Motijharan Dist Sambalpur768 001,Improvement of water supply by developing the infrastructure to Rairakhol NAC,Improvement of water supply by developing the infrastructure to Rairakhol NAC,Please refer Tender documents. ,NA ,"1,16,34,000",Civil Works - Water Works,NA ,Tender,120.0,90.0,Redhakhol,768106.0,NA ,NA ,NA ,SAMBALPUR,No ,No,AOC,14-May-2024,"INR 10,456,195",90.0,Ramachandra Samantray,14-May-2024 01:48 PM,AOC.pdf (623.00 KB),AWARD OF CONTRACT,1.0,2355955.0,BAMADEB DUDUKA,INR,"10,804,850.643",1,2355955,BAMADEB DUDUKA,13-Dec-2023 05:32 PM,Accepted-AOC,OK,14-May-2024 01:48 PM,Finance,Bid opening Summary,Bramheswar Das,18-Jan-2024 05:21 PM,finance_477118.pdf,BOQ Comparative Chart,"Er Swagat Chandan Nayak, Superintending Engineer, P.H Division, Sambalpur",Internal,,Ramachandra Samantray,14-May-2024 01:41 PM,finsummary_477118.pdf (626.43 KB),PHEO||SEPH-CIRCLE-SAMBALPUR||EEPH-DIVN-SAMBALPUR,2023_PHEO_97750_2,SEPHSBP-06/2023-24 Dt. 22.11.2023,Improvement of water supply by developing the infrastructure to Rairakhol NAC,Technical,Bid opening Summary,Subrat Kumar Das,15-Dec-2023 05:07 PM,technical_477118.pdf,"Er Ramachandra Samantray, Ic Executive Engineer, P.H Division, Sambalpur",Internal,"Sri Birendra Kumar, DAO-I, P.H Division, Sambalpur, Er Dhananjay Parida,(Estr) Executive Engineer, P.H Division, Sambalpur",Ramachandra Samantray,16-Jan-2024 08:00 PM,18-Jan-2024 04:00 PM,techsummary_477118.pdf (956.25 KB),AOC
,,,,,,,,,,,,,,,,.pdf,"Certificates, Formats, Schedules and other documents if any as per DTCN",,,,,,,,,,,,,,,,2.0,ICICI NEFT/RTGS,,,,,,,,,,,,,,,,,,,,,,,,,,AOC,,,,,,,,,,,,,2,2356437,DILLIP KUMAR BEHERA,14-Dec-2023 04:22 PM,Rejected-AOC,NOT OK,14-May-2024 01:48 PM,,,,,,,,,,,,,,,,,,,,,,,,,,,,,AOC
,,,,,,,,,,,,,,2.0,Finance,.xls,Bill of Quantity,,,,,,,,,,,,,,,,,,,,,,,,,,,,,,,,,,,,,,,,,,,AOC,,,,,,,,,,,,,3,2356780,Drite Automation and Engineering,14-Dec-2023 04:41 PM,Rejected-Technical,Required Registration Certificate not furnished,16-Jan-2024 08:00 PM,,,,,,,,,,,,,,,,,,,,,,,,,,,,,AOC
,,,,,,,,,,,,,,,,,,,,,,,,,,,,,,,,,,,,,,,,,,,,,,,,,,,,,,,,,,,,AOC,,,,,,,,,,,,,4,2354422,MANAS KHUNTIA,14-Dec-2023 10:42 AM,Rejected-AOC,NOT OK,14-May-2024 01:48 PM,,,,,,,,,,,,,,,,,,,,,,,,,,,,,AOC
,,,,,,,,,,,,,,,,,,,,,,,,,,,,,,,,,,,,,,,,,,,,,,,,,,,,,,,,,,,,AOC,,,,,,,,,,,,,5,2356361,SUMIT KUMAR PUJAHARI,14-Dec-2023 01:00 PM,Rejected-AOC,NOT OK,14-May-2024 01:48 PM,,,,,,,,,,,,,,,,,,,,,,,,,,,,,AOC
