Organisation Chain,Tender Reference Number,Tender ID,Withdrawal Allowed,Tender Type,Form of contract,Tender Category,No. of Covers,General Technical Evaluation Allowed,ItemWise Technical Evaluation Allowed,Payment Mode,Is Multi Currency Allowed For BOQ,Is Multi Currency Allowed For Fee,Allow Two Stage Bidding,Cover No,Cover,Document Type,Description,Publish Date,Bid Opening Date,Document Download / Sale Start Date,Document Download / Sale End Date,Clarification Start Date,Clarification End Date,Bid Submission Start Date,Bid Submission End Date,Financial Bid Opening Date,EMD Amount in ₹,EMD Exemption Allowed,EMD Fee Type,EMD Percentage,EMD Payable To,EMD Payable At,S.No,Bank Name,Tender Fee in ₹,VAT Charges in ₹,Fee Payable To,Fee Payable At,Tender Fee Exemption Allowed,Name,Address,Title,Work Description,Pre Qualification Details,Independent External Monitor/Remarks,Tender Value in ₹,Product Category,Sub category,Contract Type,Bid Validity(Days),Period Of Work(Days),Location,Pincode,Pre Bid Meeting Place,Pre Bid Meeting Address,Pre Bid Meeting Date,Bid Opening Place,Should Allow NDA Tender,Allow Preferential Bidder,Tender Stage,Contract Date :,Contract Value :,Work Completion Period in days :,Updated By :,Updated on :,AOC document :,AOC Description :,S.No,Bid Number,Bidder Name,Awarded Currency,Awarded Value,S.No.1,Bid Number.1,Bidder Name.1,Submitted Date,Status,Remarks,Status Updated On,Type :,Summary :,Updated By :.1,Updated On :,Document :,BOQ Comparative Chart :,Committee Chairperson/Co-ordinator Name :,Committee Chairperson/Co-ordinator Type :,Committee Members :,Updated By :.2,Updated on :.1,Document :.1,Organisation Chain :,Tender ID :,Tender Ref No :,Tender Title :,Type :.1,Summary :.1,Updated By :.3,Updated On :.1,Document :.2,Committee Chairperson/Co-ordinator Name :.1,Committee Chairperson/Co-ordinator Type :.1,Committee Members :.1,Updated By :.4,Updated On :.2,Financial Bid Opening Date:,Document :.3,Tender Stage
CE RW I||RWCIRCLE-SUNABEDA,CCERWCSBD Online 47/2023-24,2023_CERWI_98788_3,Yes,National Competitive Bid,Percentage,Works,2.0,No,No,Online,No,No,No,1.0,Fee/PreQual/Technical,.pdf,"Bid Cost, EMD, RC,PAN, GST, Affidavit regarding correctness, No relation certificate",04-Jan-2024 11:00 AM,17-Jan-2024 11:00 AM,04-Jan-2024 11:00 AM,16-Jan-2024 05:00 PM,04-Jan-2024 11:00 AM ,12-Jan-2024 02:00 PM ,04-Jan-2024 11:00 AM,16-Jan-2024 05:00 PM,08-Feb-2024 11:00 AM,"5,05,000",Yes,fixed,,Nil,Nil,1.0,ICICI BANK,"10,000",0.0,Nil,Nil,No,"Chief Construction Engineer,R.W.Circle, Sunabeda","Rural Works Circle, Sunabeda-1, Near Jagannath Temple, PIN-763001, Dist-Koraput",Construction of Bridge over Local Nallah on Cheptiamba (Jharigaon Block) to Ladi (Papadahandi Block) road in the district of Nabarangpur under CUVDA for the year 2023-24,Construction of Bridge over Local Nallah on Cheptiamba (Jharigaon Block) to Ladi (Papadahandi Block) road in the district of Nabarangpur under CUVDA for the year 2023-24,N.A. ,NA ,"5,04,18,000",Civil Works - Bridges,NA ,Tender,90.0,542.0,UMERKOTE,764073.0,NA ,NA ,NA ,"C.C.E, Rural Works Circle, Sunabeda",No ,No,AOC,22-May-2024,"INR 50,417,696.378",542.0,Sridhara Nayak,22-May-2024 12:55 PM,AOC-CHEPTIAMBA.pdf (414.00 KB),Award of contract of Niranjan Swain,1.0,2391650.0,Niranjan Swain,INR,"47,140,546.113",1,2394086,M/S JAGADISH PRASAD AGRAWAL,16-Jan-2024 03:20 PM,Rejected-AOC,REJECT,22-May-2024 12:55 PM,Finance,cs,Sridhara Nayak,24-Feb-2024 07:01 PM,finance_482280.pdf,BOQ Comparative Chart,"Chief Construction Engineer, R.W. Circle, Sunabeda",Internal,"Executive Engineer, DAO, Estimator of Rural Works Division-II, Nabarangpur at Umerkote Estimator R.W. Circle Sunabeda",Sridhara Nayak,24-Feb-2024 07:06 PM,finsummary_482280.pdf (25.20 KB),CE RW I||RWCIRCLE-SUNABEDA,2023_CERWI_98788_3,CCERWCSBD Online 47/2023-24,Construction of Bridge over Local Nallah on Cheptiamba (Jharigaon Block) to Ladi (Papadahandi Block) road in the district of Nabarangpur under CUVDA for the year 2023-24,Technical,BIDDERS LIST,Chudamani Gouda,04-Feb-2024 09:41 PM,technical_482280.pdf,"Chief Construction Engineer, R.W. Circle, Sunabeda",Internal,"Executive Engineer, DAO, Estimator of Rural Works Division-II, Nabarangpur at Umerkote Estimator R.W. Circle Sunabeda",Chudamani Gouda,04-Feb-2024 09:42 PM,08-Feb-2024 11:00 AM,techsummary_482280.pdf (655.75 KB),AOC
,,,,,,,,,,,,,,,,.pdf,"Annual Turn over certificate from CA, Similar nature of Work Certificate",,,,,,,,,,,,,,,,2.0,ICICI NEFT/RTGS,,,,,,,,,,,,,,,,,,,,,,,,,,AOC,,,,,,,,,,,,,2,2391650,Niranjan Swain,15-Jan-2024 11:04 PM,Accepted-AOC,Award of contract of Niranjan Swain,22-May-2024 12:55 PM,,,,,,,,,,,,,,,,,,,,,,,,,,,,,AOC
,,,,,,,,,,,,,,,,.pdf,Machineries and other documents as per DTCN,,,,,,,,,,,,,,,,,,,,,,,,,,,,,,,,,,,,,,,,,,,AOC,,,,,,,,,,,,,3,2392798,PRABHAT KUMAR BISOYI,16-Jan-2024 11:01 AM,Rejected-Finance,reject,24-Feb-2024 07:06 PM,,,,,,,,,,,,,,,,,,,,,,,,,,,,,AOC
,,,,,,,,,,,,,,2.0,Finance,.xls,BOQ,,,,,,,,,,,,,,,,,,,,,,,,,,,,,,,,,,,,,,,,,,,AOC,,,,,,,,,,,,,4,2394420,RASMITA SWAIN,16-Jan-2024 04:20 PM,Rejected-Finance,reject,24-Feb-2024 07:06 PM,,,,,,,,,,,,,,,,,,,,,,,,,,,,,AOC
,,,,,,,,,,,,,,,,,,,,,,,,,,,,,,,,,,,,,,,,,,,,,,,,,,,,,,,,,,,,AOC,,,,,,,,,,,,,5,2392720,SOMANATH PANI,16-Jan-2024 03:07 PM,Rejected-Finance,reject,24-Feb-2024 07:06 PM,,,,,,,,,,,,,,,,,,,,,,,,,,,,,AOC
