Organisation Chain,Tender Reference Number,Tender ID,Withdrawal Allowed,Tender Type,Form of contract,Tender Category,No. of Covers,General Technical Evaluation Allowed,ItemWise Technical Evaluation Allowed,Payment Mode,Is Multi Currency Allowed For BOQ,Is Multi Currency Allowed For Fee,Allow Two Stage Bidding,Cover No,Cover,Document Type,Description,Publish Date,Bid Opening Date,Document Download / Sale Start Date,Document Download / Sale End Date,Clarification Start Date,Clarification End Date,Bid Submission Start Date,Bid Submission End Date,EMD Amount in ₹,EMD Exemption Allowed,EMD Fee Type,EMD Percentage,EMD Payable To,EMD Payable At,S.No,Bank Name,Tender Fee in ₹,VAT Charges in ₹,Fee Payable To,Fee Payable At,Tender Fee Exemption Allowed,Name,Address,Title,Work Description,Pre Qualification Details,Independent External Monitor/Remarks,Tender Value in ₹,Product Category,Sub category,Contract Type,Bid Validity(Days),Period Of Work(Days),Location,Pincode,Pre Bid Meeting Place,Pre Bid Meeting Address,Pre Bid Meeting Date,Bid Opening Place,Should Allow NDA Tender,Allow Preferential Bidder,Tender Stage,Contract Date :,Contract Value :,Work Completion Period in days :,Updated By :,Updated on :,AOC document :,S.No,Bid Number,Bidder Name,Awarded Currency,Awarded Value,S.No.1,Bid Number.1,Bidder Name.1,Submitted Date,Status,Remarks,Status Updated On,Type :,Summary :,Updated By :.1,Updated On :,Document :,BOQ Comparative Chart :,Committee Chairperson/Co-ordinator Name :,Committee Chairperson/Co-ordinator Type :,Committee Members :,Updated By :.2,Updated on :.1,Document :.1,Organisation Chain :,Tender ID :,Tender Ref No :,Tender Title :,Committee Chairperson/Co-ordinator Name :.1,Committee Chairperson/Co-ordinator Type :.1,Committee Members :.1,Updated By :.3,Updated On :.1,Document :.2,Tender Stage
Chief Engineer Mech - WR Bhubaneswar||SE Mechanical Circle Bhubaneswar,SEM/MDB-01(C)/2022-23,2022_CEMWR_76981_1,Yes,Open Tender,Percentage,Works,1.0,No,No,Online,No,No,No,1.0,Fee/PreQual/Technical/Finance,.pdf,"RC, PAN, GST, AFFIDAVIT AND ALL OTHER DOCUMENT AS PER DTCN",18-Apr-2022 10:00 AM,28-Apr-2022 04:00 PM,18-Apr-2022 10:00 AM,27-Apr-2022 05:30 PM,18-Apr-2022 10:00 AM ,27-Apr-2022 05:30 PM ,18-Apr-2022 10:00 AM,27-Apr-2022 05:30 PM,0.0,No,fixed,,Nil,Nil,1.0,ICICI BANK,"6,000",0.0,Nil,Nil,No,"SUPERINTENDING ENGINEER, MECHANICAL CIRCLE, BBSR","O/O THE SUPERINTENDING ENGINEER, MECHANICAL CIRCLE, BHUBANESWAR","Fabrication, supply, transportation and erection of Check dam-cum-sluice cum foot bridge over Kenduai drain near Kandisahi of Binjharpur under Drainage Division Jajpur.","Fabrication, supply, transportation and erection of Check dam-cum-sluice cum foot bridge over Kenduai drain near Kandisahi of Binjharpur under Drainage Division Jajpur.",Please refer Tender documents. ,NA ,,Mechanical Works,NA ,Tender,90.0,30.0,"KANDISAHI, BINJHARPUR, JAJPUR",755004.0,NA ,NA ,NA ,BHUBANESWAR,No ,No,AOC,17-May-2024,"INR 1,675,040",30.0,Niharkanti Mishra,17-May-2024 01:17 PM,1CAOC.pdf (729.00 KB),1.0,1833256.0,LAXMIDHRA BHUYAN,INR,"1,675,040",1,1833256,LAXMIDHRA BHUYAN,27-Apr-2022 12:41 PM,Accepted-AOC,LOTTERY WINNER AND SUCCESSFUL BIDDER,17-May-2024 01:17 PM,Finance,ALL BID DOCUMENTS ARE DOWNLOADED,Niharkanti Mishra,29-Apr-2022 04:40 PM,,BOQ Comparative Chart,SUPERINTENDING ENGINEER,Internal,"EXECUTIVE ENGINEER, PA TO SUPERINTENDING ENGINEER",Niharkanti Mishra,14-May-2024 06:25 PM,finsummary_396324.pdf (603.26 KB),Chief Engineer Mech - WR Bhubaneswar||SE Mechanical Circle Bhubaneswar,2022_CEMWR_76981_1,SEM/MDB-01(C)/2022-23,"Fabrication, supply, transportation and erection of Check dam-cum-sluice cum foot bridge over Kenduai drain near Kandisahi of Binjharpur under Drainage Division Jajpur.",Niharkanti Mishra,Internal,"Sri Bhakta Naik, Executive Engineer, Member, Sri Sunil Kumar Tudu, PA to SE, Member",Niharkanti Mishra,11-May-2022 04:49 PM,techsummary_396324.pdf (806.30 KB),AOC
,,,,,,,,,,,,,,,,.xls,BOQ,,,,,,,,,,,,,,,2.0,ICICI NEFT/RTGS,,,,,,,,,,,,,,,,,,,,,,,,,,AOC,,,,,,,,,,,,2,1832924,Md Yousuf Hussain,26-Apr-2022 10:58 PM,Rejected-Finance,LOOSER OF THE LOTTERY,14-May-2024 06:25 PM,,,,,,,,,,,,,,,,,,,,,,,AOC
,,,,,,,,,,,,,,,,,,,,,,,,,,,,,,,,,,,,,,,,,,,,,,,,,,,,,,,,,,,AOC,,,,,,,,,,,,3,1833529,M/S BISHNU CHARAN SENAPATI,27-Apr-2022 03:39 PM,Rejected-Finance,LOOSER OF THE LOTTERY,14-May-2024 06:25 PM,,,,,,,,,,,,,,,,,,,,,,,AOC
,,,,,,,,,,,,,,,,,,,,,,,,,,,,,,,,,,,,,,,,,,,,,,,,,,,,,,,,,,,AOC,,,,,,,,,,,,4,1833050,M/S KALINGA METAL PRODUCTS( PROPRIETOR TAPAN KUMAR MOHANTY),27-Apr-2022 07:59 AM,Rejected-Finance,LOOSER OF THE LOTTERY,14-May-2024 06:25 PM,,,,,,,,,,,,,,,,,,,,,,,AOC
,,,,,,,,,,,,,,,,,,,,,,,,,,,,,,,,,,,,,,,,,,,,,,,,,,,,,,,,,,,AOC,,,,,,,,,,,,5,1833010,"M/S MOHANTY INDUSTRIAL ENTERPRISERS -PROPRIETOR ,MALAYA KUMAR MOHANTY",27-Apr-2022 12:34 AM,Rejected-Finance,LOOSER OF THE LOTTERY,14-May-2024 06:25 PM,,,,,,,,,,,,,,,,,,,,,,,AOC
,,,,,,,,,,,,,,,,,,,,,,,,,,,,,,,,,,,,,,,,,,,,,,,,,,,,,,,,,,,AOC,,,,,,,,,,,,6,1832280,POOJARINI ENTERPRISERS,26-Apr-2022 12:22 PM,Rejected-Finance,LOOSER OF THE LOTTERY,14-May-2024 06:25 PM,,,,,,,,,,,,,,,,,,,,,,,AOC
,,,,,,,,,,,,,,,,,,,,,,,,,,,,,,,,,,,,,,,,,,,,,,,,,,,,,,,,,,,AOC,,,,,,,,,,,,7,1832440,SUSHIL KUMAR DAS,27-Apr-2022 01:15 PM,Rejected-Technical,Non Responsive,11-May-2022 04:50 PM,,,,,,,,,,,,,,,,,,,,,,,AOC
