Organisation Chain,Tender Reference Number,Tender ID,Withdrawal Allowed,Tender Type,Form of contract,Tender Category,No. of Covers,General Technical Evaluation Allowed,ItemWise Technical Evaluation Allowed,Payment Mode,Is Multi Currency Allowed For BOQ,Is Multi Currency Allowed For Fee,Allow Two Stage Bidding,Cover No,Cover,Document Type,Description,Publish Date,Bid Opening Date,Document Download / Sale Start Date,Document Download / Sale End Date,Clarification Start Date,Clarification End Date,Bid Submission Start Date,Bid Submission End Date,Financial Bid Opening Date,EMD Amount in ₹,EMD Exemption Allowed,EMD Fee Type,EMD Percentage,EMD Payable To,EMD Payable At,S.No,Bank Name,Tender Fee in ₹,VAT Charges in ₹,Fee Payable To,Fee Payable At,Tender Fee Exemption Allowed,Name,Address,Title,Work Description,Pre Qualification Details,Independent External Monitor/Remarks,Tender Value in ₹,Product Category,Sub category,Contract Type,Bid Validity(Days),Period Of Work(Days),Location,Pincode,Pre Bid Meeting Place,Pre Bid Meeting Address,Pre Bid Meeting Date,Bid Opening Place,Should Allow NDA Tender,Allow Preferential Bidder,Tender Stage,Contract Date :,Contract Value :,Work Completion Period in days :,Updated By :,Updated on :,AOC document :,AOC Description :,S.No,Bid Number,Bidder Name,Awarded Currency,Awarded Value,S.No.1,Bid Number.1,Bidder Name.1,Submitted Date,Status,Remarks,Status Updated On,Type :,Summary :,Updated By :.1,Updated On :,Document :,BOQ Comparative Chart :,Committee Chairperson/Co-ordinator Name :,Committee Chairperson/Co-ordinator Type :,Committee Members :,Updated By :.2,Updated on :.1,Document :.1,Organisation Chain :,Tender ID :,Tender Ref No :,Tender Title :,Type :.1,Summary :.1,Updated By :.3,Updated On :.1,Document :.2,Committee Chairperson/Co-ordinator Name :.1,Committee Chairperson/Co-ordinator Type :.1,Committee Members :.1,Updated By :.4,Updated On :.2,Financial Bid Opening Date:,Document :.3,Tender Stage
EIC-CIVIL||SERNB-CIRCLE-KEONJHAR||EERNB-DIVN-ROURKELA,BID ID 03 of 2022-23,2022_EICCL_76898_7,Yes,Open Tender,Percentage,Works,2.0,No,No,Online,No,No,No,1.0,Fee/PreQual/Technical,.pdf,"Registration certificate, Registration in CDMS, PAN Card, GSTIN Certificate, Affidavit etc",13-Apr-2022 05:00 PM,25-Apr-2022 11:30 AM,13-Apr-2022 05:00 PM,22-Apr-2022 05:00 PM,13-Apr-2022 05:00 PM ,19-Apr-2022 05:00 PM ,13-Apr-2022 05:00 PM,22-Apr-2022 05:00 PM,23-May-2022 12:45 PM,0.0,No,fixed,,Nil,Nil,1.0,ICICI BANK,"10,000",0.0,Nil,Nil,No,Superintending Engineer Rourkela R and B,Office of Superintending Engineer Rourkela R and B Division,Construction of first floor of computer block of Govt Auto College Rourkela for the year 2021-22,Construction of first floor of computer block of Govt Auto College Rourkela for the year 2021-22,Please refer the tender document ,NA ,"83,45,300",Civil Works - Buildings,NA ,Tender,90.0,150.0,Rourkela,769012.0,NA ,NA ,NA ,Office of Superintending Engineer Rourkela R and B,No ,No,AOC,07-May-2024,"INR 7,094,300",150.0,Manoj Kumar Mahananda,07-May-2024 11:22 AM,WorkorderGovtcollege.pdf (1391.00 KB),Agmt drawn and Work order issued,1.0,1829741.0,SUSHANTA KUMAR SUNA,INR,"7,094,300",1,1828925,GIRISH SAMAL,22-Apr-2022 10:24 AM,Rejected-Technical,rejected by Committee,23-May-2022 12:42 PM,Finance,All the six bidders qualified in the Technical Evaluation,Manoj Kumar Mahananda,07-May-2024 11:00 AM,finance_396025.pdf,BOQ Comparative Chart,M K Mahananda,Internal,HS Meena SrDAO Rourkela R and B Division P p parida estimator Rourkela R and B Division,Manoj Kumar Mahananda,07-May-2024 11:13 AM,finsummary_396025.pdf (1390.94 KB),EIC-CIVIL||SERNB-CIRCLE-KEONJHAR||EERNB-DIVN-ROURKELA,2022_EICCL_76898_7,BID ID 03 of 2022-23,Construction of first floor of computer block of Govt Auto College Rourkela for the year 2021-22,Technical,six bidders qualified in the Technical Evaluation out of 7bidder,Prajna Prajwolita Parida,23-May-2022 12:40 PM,technical_396025.pdf,M K Mahananda SE rourkela r and b division,Internal,BKumar SrDAO Rourkela R and B Division P p parida estimator Rourkela R and B Division,Prajna Prajwolita Parida,23-May-2022 12:42 PM,23-May-2022 12:45 PM,techsummary_396025.pdf (228.98 KB),AOC
,,,,,,,,,,,,,,,,.pdf,"Financial instruments such as cost of tender paper, EMD, Affidavit etc",,,,,,,,,,,,,,,,2.0,ICICI NEFT/RTGS,,,,,,,,,,,,,,,,,,,,,,,,,,AOC,,,,,,,,,,,,,2,1829439,KALANDI CHARAN SWAIN,21-Apr-2022 09:44 PM,Rejected-AOC,Not Qualified in the Lottery,07-May-2024 11:23 AM,,,,,,,,,,,,,,,,,,,,,,,,,,,,,AOC
,,,,,,,,,,,,,,,,.pdf,"Experience Certificate, List of Machinaries,Lease Deeds , MOU with electrical contractor Affidavit e",,,,,,,,,,,,,,,,,,,,,,,,,,,,,,,,,,,,,,,,,,,AOC,,,,,,,,,,,,,3,1829764,KRUSHNA CHANDRA MALLICK,22-Apr-2022 02:37 PM,Rejected-AOC,Not Qualified in the Lottery,07-May-2024 11:23 AM,,,,,,,,,,,,,,,,,,,,,,,,,,,,,AOC
,,,,,,,,,,,,,,,,.pdf,"No Relation Certificate, Schedule-E, Schedule-F, Affidavit etc",,,,,,,,,,,,,,,,,,,,,,,,,,,,,,,,,,,,,,,,,,,AOC,,,,,,,,,,,,,4,1828118,PRITI RANJAN SAMAL,20-Apr-2022 11:39 AM,Rejected-AOC,Not Qualified in the Lottery,07-May-2024 11:23 AM,,,,,,,,,,,,,,,,,,,,,,,,,,,,,AOC
,,,,,,,,,,,,,,2.0,Finance,.xls,BOQ,,,,,,,,,,,,,,,,,,,,,,,,,,,,,,,,,,,,,,,,,,,AOC,,,,,,,,,,,,,5,1828545,Sk Hasib Rahebar,20-Apr-2022 04:48 PM,Rejected-AOC,Not Qualified in the Lottery,07-May-2024 11:23 AM,,,,,,,,,,,,,,,,,,,,,,,,,,,,,AOC
,,,,,,,,,,,,,,,,,,,,,,,,,,,,,,,,,,,,,,,,,,,,,,,,,,,,,,,,,,,,AOC,,,,,,,,,,,,,6,1829744,SNEHALATA CONSTRUCTION AND INTERIOR,22-Apr-2022 01:47 PM,Rejected-AOC,Not Qualified in the Lottery,07-May-2024 11:23 AM,,,,,,,,,,,,,,,,,,,,,,,,,,,,,AOC
,,,,,,,,,,,,,,,,,,,,,,,,,,,,,,,,,,,,,,,,,,,,,,,,,,,,,,,,,,,,AOC,,,,,,,,,,,,,7,1829741,SUSHANTA KUMAR SUNA,22-Apr-2022 01:48 PM,Accepted-AOC,Qualified in the Lottary,07-May-2024 11:23 AM,,,,,,,,,,,,,,,,,,,,,,,,,,,,,AOC
