Organisation Chain,Tender Reference Number,Tender ID,Withdrawal Allowed,Tender Type,Form of contract,Tender Category,No. of Covers,General Technical Evaluation Allowed,ItemWise Technical Evaluation Allowed,Payment Mode,Is Multi Currency Allowed For BOQ,Is Multi Currency Allowed For Fee,Allow Two Stage Bidding,Cover No,Cover,Document Type,Description,Publish Date,Bid Opening Date,Document Download / Sale Start Date,Document Download / Sale End Date,Clarification Start Date,Clarification End Date,Bid Submission Start Date,Bid Submission End Date,EMD Amount in ₹,EMD Exemption Allowed,EMD Fee Type,EMD Percentage,EMD Payable To,EMD Payable At,S.No,Bank Name,Tender Fee in ₹,Fee Payable To,Fee Payable At,Tender Fee Exemption Allowed,Name,Address,Title,Work Description,Pre Qualification Details,Independent External Monitor/Remarks,Tender Value in ₹,Product Category,Sub category,Contract Type,Bid Validity(Days),Period Of Work(Days),Location,Pincode,Pre Bid Meeting Place,Pre Bid Meeting Address,Pre Bid Meeting Date,Bid Opening Place,Should Allow NDA Tender,Allow Preferential Bidder,Tender Stage,Contract Date :,Contract Value :,Work Completion Period in days :,Updated By :,Updated on :,AOC document :,AOC Description :,S.No,Bid Number,Bidder Name,Awarded Currency,Awarded Value,S.No.1,Bid Number.1,Bidder Name.1,Submitted Date,Status,Remarks,Status Updated On,Type :,Summary :,Updated By :.1,Updated On :,Document :,BOQ Comparative Chart :,Committee Chairperson/Co-ordinator Name :,Committee Chairperson/Co-ordinator Type :,Committee Members :,Updated By :.2,Updated on :.1,Document :.1,Organisation Chain :,Tender ID :,Tender Ref No :,Tender Title :,Committee Chairperson/Co-ordinator Name :.1,Committee Chairperson/Co-ordinator Type :.1,Committee Members :.1,Updated By :.3,Updated On :.1,Document :.2,Tender Stage
CE AND BM MBBS CHANDIKOLE||EASTERN CIRCLE II CHANDIKOLE,e-Procurement Notice No.KID-04 of 2023-24,2024_ECCHA_100349_28,Yes,Open Tender,Percentage,Works,1.0,No,No,Online,No,No,No,1.0,Fee/PreQual/Technical/Finance,.pdf,"GSTIN, PAN, Contractor Registration Certificate",01-Feb-2024 10:00 AM,13-Feb-2024 11:00 AM,01-Feb-2024 10:00 AM,12-Feb-2024 05:00 PM,01-Feb-2024 10:00 AM ,07-Feb-2024 05:00 PM ,01-Feb-2024 10:00 AM,12-Feb-2024 05:00 PM,"10,400",Yes,fixed,,Nil,Nil,1.0,ICICI BANK,"6,000",Nil,Nil,No,Superintending Engineer,"O/o the SE, Kendrapara Irr. Division, Kendrapara","KID-76 of 2023-24 Renovation of 49 R Patana Sub-Minor, Sabalakana Minor and 56 L Kurujanga Sub-Minor of disty.no.9 of Kendrapara Canal.",Renovation of canal,Please refer Tender documents. ,NA ,"10,31,403",Civil Works - Canal,NA ,Tender,90.0,90.0,Kendrapara,754211.0,NA ,NA ,NA ,"O/o the SE, Kendrapara Irr. Division, Kendrapara",No ,No,AOC,04-May-2024,"INR 1,034,619",90.0,Umesh Chandra Sethi,04-May-2024 01:39 PM,76..pdf (553.00 KB),Contract Awarded,1.0,2422168.0,somanath swain,INR,"1,034,619",1,2431575,jagannath sahoo,10-Feb-2024 12:27 AM,Rejected-Technical,Does not satisfy the criteria,19-Mar-2024 10:24 PM,Finance,Tender documents of all the bidders have been downloaded successfully.,Umesh Chandra Sethi,14-Feb-2024 06:57 PM,finance_488604.pdf,BOQ Comparative Chart,"Superintending Engineer, Kendrapara Irrigation Division",Internal,"Estimator and DAO, Kendrapara Irrigation Division",Umesh Chandra Sethi,04-May-2024 01:35 PM,finsummary_488604.pdf (553.12 KB),CE AND BM MBBS CHANDIKOLE||EASTERN CIRCLE II CHANDIKOLE,2024_ECCHA_100349_28,e-Procurement Notice No.KID-04 of 2023-24,"KID-76 of 2023-24 Renovation of 49 R Patana Sub-Minor, Sabalakana Minor and 56 L Kurujanga Sub-Minor of disty.no.9 of Kendrapara Canal.","SE, Kendrapara Irrigation Division",Internal,"Estimator and DAO O/o the SE, Kendrapara Irrigation Division",Umesh Chandra Sethi,19-Mar-2024 10:24 PM,techsummary_488604.pdf (433.82 KB),AOC
,,,,,,,,,,,,,,,,.pdf,"Affidavits, No Relation Certificate, undertakings and any other document as per SBD/DTCN",,,,,,,,,,,,,,,2.0,ICICI NEFT/RTGS,,,,,,,,,,,,,,,,,,,,,,,,,AOC,,,,,,,,,,,,,2,2434504,LIPU KUMAR MALL,12-Feb-2024 08:46 AM,Rejected-Technical,Does not satisfy the criteria,19-Mar-2024 10:24 PM,,,,,,,,,,,,,,,,,,,,,,,AOC
,,,,,,,,,,,,,,,,.xls,Bill of Quantity,,,,,,,,,,,,,,,,,,,,,,,,,,,,,,,,,,,,,,,,,AOC,,,,,,,,,,,,,3,2434444,M/S-AFIYA AND AAIRA CONSTRUCTION,12-Feb-2024 04:48 PM,Rejected-Technical,Does not satisfy the criteria,19-Mar-2024 10:24 PM,,,,,,,,,,,,,,,,,,,,,,,AOC
,,,,,,,,,,,,,,,,,,,,,,,,,,,,,,,,,,,,,,,,,,,,,,,,,,,,,,,,,,AOC,,,,,,,,,,,,,4,2429327,RAJ KISHORE DALAI,10-Feb-2024 02:50 PM,Rejected-Technical,Does not satisfy the criteria,19-Mar-2024 10:24 PM,,,,,,,,,,,,,,,,,,,,,,,AOC
,,,,,,,,,,,,,,,,,,,,,,,,,,,,,,,,,,,,,,,,,,,,,,,,,,,,,,,,,,AOC,,,,,,,,,,,,,5,2433398,RASHMI RANJAN DAS,11-Feb-2024 03:49 PM,Rejected-Technical,Does not satisfy the criteria,19-Mar-2024 10:24 PM,,,,,,,,,,,,,,,,,,,,,,,AOC
,,,,,,,,,,,,,,,,,,,,,,,,,,,,,,,,,,,,,,,,,,,,,,,,,,,,,,,,,,AOC,,,,,,,,,,,,,6,2431351,SANTOSH KUMAR SETHY,09-Feb-2024 09:28 PM,Rejected-Technical,Does not satisfy the criteria,19-Mar-2024 10:24 PM,,,,,,,,,,,,,,,,,,,,,,,AOC
,,,,,,,,,,,,,,,,,,,,,,,,,,,,,,,,,,,,,,,,,,,,,,,,,,,,,,,,,,AOC,,,,,,,,,,,,,7,2422168,somanath swain,09-Feb-2024 01:39 PM,Accepted-AOC,Won the lottery,04-May-2024 01:39 PM,,,,,,,,,,,,,,,,,,,,,,,AOC
