Organisation Chain,Tender Reference Number,Tender ID,Withdrawal Allowed,Tender Type,Form of contract,Tender Category,No. of Covers,General Technical Evaluation Allowed,ItemWise Technical Evaluation Allowed,Payment Mode,Is Multi Currency Allowed For BOQ,Is Multi Currency Allowed For Fee,Allow Two Stage Bidding,Cover No,Cover,Document Type,Description,Publish Date,Bid Opening Date,Document Download / Sale Start Date,Document Download / Sale End Date,Clarification Start Date,Clarification End Date,Bid Submission Start Date,Bid Submission End Date,EMD Amount in ₹,EMD Exemption Allowed,EMD Fee Type,EMD Percentage,EMD Payable To,EMD Payable At,S.No,Bank Name,Tender Fee in ₹,VAT Charges in ₹,Fee Payable To,Fee Payable At,Tender Fee Exemption Allowed,Name,Address,Title,Work Description,Pre Qualification Details,Independent External Monitor/Remarks,Tender Value in ₹,Product Category,Sub category,Contract Type,Bid Validity(Days),Period Of Work(Days),Location,Pincode,Pre Bid Meeting Place,Pre Bid Meeting Address,Pre Bid Meeting Date,Bid Opening Place,Should Allow NDA Tender,Allow Preferential Bidder,Tender Stage,Contract Date :,Contract Value :,Work Completion Period in days :,Updated By :,Updated on :,AOC document :,S.No,Bid Number,Bidder Name,Awarded Currency,Awarded Value,S.No.1,Bid Number.1,Bidder Name.1,Submitted Date,Status,Remarks,Status Updated On,Type :,Summary :,Updated By :.1,Updated On :,Document :,BOQ Comparative Chart :,Committee Chairperson/Co-ordinator Name :,Committee Chairperson/Co-ordinator Type :,Committee Members :,Updated By :.2,Updated on :.1,Document :.1,Organisation Chain :,Tender ID :,Tender Ref No :,Tender Title :,Committee Chairperson/Co-ordinator Name :.1,Committee Chairperson/Co-ordinator Type :.1,Committee Members :.1,Updated By :.3,Updated On :.1,Document :.2,Tender Stage
Chief Engineer Mech - WR Bhubaneswar||SE Mechanical Circle Bhubaneswar,SEM/MDBM-05(A)/2022-23,2022_CEMWR_79741_1,Yes,Open Tender,Percentage,Works,1.0,No,No,Online,No,No,No,1.0,Fee/PreQual/Technical/Finance,.pdf,"RC, GST, PAN, AFFIDAVIT AND ALL OTHER DOCUMENT AS PER DTCN",15-Jul-2022 10:00 AM,26-Jul-2022 04:00 PM,15-Jul-2022 10:00 AM,25-Jul-2022 05:30 PM,15-Jul-2022 10:00 AM ,25-Jul-2022 05:30 PM ,15-Jul-2022 10:00 AM,25-Jul-2022 05:30 PM,0.0,No,fixed,,Nil,Nil,1.0,ICICI BANK,"6,000",0.0,Nil,Nil,No,"SE, MECHANICAL CIRCLE, BHUBANESWAR","O/O THE SUPERINTENDING ENGINEER, MECHANICAL CIRCLE, BHUBANESWAR","Repair, maintenance, greasing to movable component, rubber seal changing and painting of 04 Four numbers of rope drum H.R. gates of Padma Barrage Project Bhanjanagar Irrigation Division, Bhanjanagar","Repair, maintenance, greasing to movable component, rubber seal changing and painting of 04 Four numbers of rope drum H.R. gates of Padma Barrage Project Bhanjanagar Irrigation Division, Bhanjanagar",Please refer Tender documents. ,NA ,,Mechanical Works,NA ,Tender,90.0,30.0,"PADMA BARRAGE, BHANJANAGAR",761126.0,NA ,NA ,NA ,BHUBANESWAR,No ,No,AOC,22-Nov-2022,"INR 1,031,497.18",30.0,Niharkanti Mishra,17-May-2024 12:50 PM,05BAOC.pdf (761.00 KB),1.0,1903557.0,LAXMIDHRA BHUYAN,INR,"1,031,497.18",1,1901846,"ACHYUTA NANDA SWAIN ,PROPRIETOR M/S. ADITYA ENTERPRISER.",21-Jul-2022 06:35 PM,Rejected-Technical,NON RESPONSIVE,18-Nov-2022 04:03 PM,Finance,ALL BID DOCUMENTS ARE DOWNLOADED,Niharkanti Mishra,26-Jul-2022 06:04 PM,,BOQ Comparative Chart,"Niharkanti Mishra SE MECHANICAL CIRCLE, BBSR",Internal,"Bibhuti Bhusan Bhuyan EE Salapada Sunil Kumar Tudu PA to SE Mechanical Circle, Bhubaneswar",SUNIL KUMAR TUDU,18-Nov-2022 04:24 PM,finsummary_405122.pdf (812.51 KB),Chief Engineer Mech - WR Bhubaneswar||SE Mechanical Circle Bhubaneswar,2022_CEMWR_79741_1,SEM/MDBM-05(A)/2022-23,"Repair, maintenance, greasing to movable component, rubber seal changing and painting of 04 Four numbers of rope drum H.R. gates of Padma Barrage Project Bhanjanagar Irrigation Division, Bhanjanagar","Niharkanti Mishra SE MECHANICAL CIRCLE, BBSR",Internal,BIBHUTI BHUSAN BHUYAN EXECUTIVE ENGINEER SALAPADA SUNIL KUMAR TUDU PA TO SUPERINTENDING ENGINEER MECHANICAL CIRCLE BHUBANESWAR,SUNIL KUMAR TUDU,18-Nov-2022 04:03 PM,techsummary_405122.pdf (849.00 KB),AOC
,,,,,,,,,,,,,,,,.xls,BOQ,,,,,,,,,,,,,,,2.0,ICICI NEFT/RTGS,,,,,,,,,,,,,,,,,,,,,,,,,,AOC,,,,,,,,,,,,2,1903557,LAXMIDHRA BHUYAN,25-Jul-2022 02:28 PM,Accepted-AOC,LOTTERY WINNER AND SUCCESSFUL BIDDER,17-May-2024 12:51 PM,,,,,,,,,,,,,,,,,,,,,,,AOC
,,,,,,,,,,,,,,,,,,,,,,,,,,,,,,,,,,,,,,,,,,,,,,,,,,,,,,,,,,,AOC,,,,,,,,,,,,3,1897511,M/S Abirvab Steel Product,23-Jul-2022 04:02 PM,Rejected-Finance,UNSUCCESSFUL BIDDER,18-Nov-2022 04:24 PM,,,,,,,,,,,,,,,,,,,,,,,AOC
,,,,,,,,,,,,,,,,,,,,,,,,,,,,,,,,,,,,,,,,,,,,,,,,,,,,,,,,,,,AOC,,,,,,,,,,,,4,1898520,M/s. BHAGABATI INDUSTRIES Prop. NIRANJAN PANDA,24-Jul-2022 07:56 PM,Rejected-Finance,UNSUCCESSFUL BIDDER,18-Nov-2022 04:24 PM,,,,,,,,,,,,,,,,,,,,,,,AOC
,,,,,,,,,,,,,,,,,,,,,,,,,,,,,,,,,,,,,,,,,,,,,,,,,,,,,,,,,,,AOC,,,,,,,,,,,,5,1903426,NEELAMADHAB ENGINEERING WORKS,25-Jul-2022 12:09 PM,Rejected-Technical,NON RESPONSIVE,18-Nov-2022 04:03 PM,,,,,,,,,,,,,,,,,,,,,,,AOC
,,,,,,,,,,,,,,,,,,,,,,,,,,,,,,,,,,,,,,,,,,,,,,,,,,,,,,,,,,,AOC,,,,,,,,,,,,6,1899641,SANJEEB ENTERPRISERS,21-Jul-2022 09:08 AM,Rejected-Finance,UNSUCCESSFUL BIDDER,18-Nov-2022 04:24 PM,,,,,,,,,,,,,,,,,,,,,,,AOC
,,,,,,,,,,,,,,,,,,,,,,,,,,,,,,,,,,,,,,,,,,,,,,,,,,,,,,,,,,,AOC,,,,,,,,,,,,7,1901762,"Shree Jagannath Steel Industries, Prop. KRUSHNA CHANDRA SASMAL",21-Jul-2022 04:24 PM,Rejected-Technical,NON RESPONSIVE,18-Nov-2022 04:03 PM,,,,,,,,,,,,,,,,,,,,,,,AOC
,,,,,,,,,,,,,,,,,,,,,,,,,,,,,,,,,,,,,,,,,,,,,,,,,,,,,,,,,,,AOC,,,,,,,,,,,,8,1903474,SUSHIL KUMAR DAS,25-Jul-2022 04:34 PM,Rejected-Finance,UNSUCCESSFUL BIDDER,18-Nov-2022 04:24 PM,,,,,,,,,,,,,,,,,,,,,,,AOC
