Organisation Chain,Tender Reference Number,Tender ID,Withdrawal Allowed,Tender Type,Form of contract,Tender Category,No. of Covers,General Technical Evaluation Allowed,ItemWise Technical Evaluation Allowed,Payment Mode,Is Multi Currency Allowed For BOQ,Is Multi Currency Allowed For Fee,Allow Two Stage Bidding,Cover No,Cover,Document Type,Description,Publish Date,Bid Opening Date,Document Download / Sale Start Date,Document Download / Sale End Date,Clarification Start Date,Clarification End Date,Bid Submission Start Date,Bid Submission End Date,Financial Bid Opening Date,EMD Amount in ₹,EMD Exemption Allowed,EMD Fee Type,EMD Percentage,EMD Payable To,EMD Payable At,S.No,Bank Name,Tender Fee in ₹,VAT Charges in ₹,Fee Payable To,Fee Payable At,Tender Fee Exemption Allowed,Name,Address,Title,Work Description,Pre Qualification Details,Independent External Monitor/Remarks,Tender Value in ₹,Product Category,Sub category,Contract Type,Bid Validity(Days),Period Of Work(Days),Location,Pincode,Pre Bid Meeting Place,Pre Bid Meeting Address,Pre Bid Meeting Date,Bid Opening Place,Should Allow NDA Tender,Allow Preferential Bidder,Tender Stage,Contract Date :,Contract Value :,Work Completion Period in days :,Updated By :,Updated on :,AOC document :,AOC Description :,S.No,Bid Number,Bidder Name,Awarded Currency,Awarded Value,S.No.1,Bid Number.1,Bidder Name.1,Submitted Date,Status,Remarks,Status Updated On,Type :,Summary :,Updated By :.1,Updated On :,Document :,BOQ Comparative Chart :,Committee Chairperson/Co-ordinator Name :,Committee Chairperson/Co-ordinator Type :,Committee Members :,Updated By :.2,Updated on :.1,Document :.1,Organisation Chain :,Tender ID :,Tender Ref No :,Tender Title :,Type :.1,Summary :.1,Updated By :.3,Updated On :.1,Document :.2,Committee Chairperson/Co-ordinator Name :.1,Committee Chairperson/Co-ordinator Type :.1,Committee Members :.1,Updated By :.4,Updated On :.2,Financial Bid Opening Date:,Document :.3,Tender Stage
EIC-CIVIL||SERNB-CIRCLE-KEONJHAR||EERNB-DIVN-ROURKELA,BID ID 10 of 2022-23,2022_EICCL_77796_2,Yes,Open Tender,Percentage,Works,2.0,No,No,Online,No,No,No,1.0,Fee/PreQual/Technical,.pdf,"Registration certificate, Registration in CDMS, PAN Card, GSTIN Certificate, Affidavit etc",19-May-2022 05:00 PM,31-May-2022 11:30 AM,19-May-2022 05:00 PM,27-May-2022 05:00 PM,19-May-2022 05:00 PM ,23-May-2022 05:00 PM ,19-May-2022 05:00 PM,27-May-2022 05:00 PM,06-Jul-2022 11:20 AM,0.0,No,fixed,,Nil,Nil,1.0,ICICI BANK,"10,000",0.0,Nil,Nil,No,Superintending Engineer Rourkela R and B,Office of Superintending Engineer Rourkela R and B Division,Modification and expansion of existing Odisha Adarsha Vidyalaya at Jhartoli of Nuagaon Block for the year 2021-22.,Modification and expansion of existing Odisha Adarsha Vidyalaya at Jhartoli of Nuagaon Block for the year 2021-22.,Please refer tender document ,NA ,"69,28,700",Civil Works - Buildings,NA ,Tender,90.0,120.0,Rourkela,769012.0,NA ,NA ,NA ,Office of Superintending Engineer Rourkela R and B,No ,No,AOC,02-May-2024,"INR 6,236,447",120.0,Manoj Kumar Mahananda,02-May-2024 11:55 AM,OAVJahartoli.pdf (1606.00 KB),Agmt drawn and Work order issued,1.0,1852552.0,M/S GODAVARI CONSTRUCTION,INR,"6,236,447",1.0,1852697.0,DEEPAK KUMAR ROUT,26-May-2022 06:32 PM,Rejected-AOC,Accepted by Committee,02-May-2024 11:55 AM,Finance,2 bidders Participated,Manoj Kumar Mahananda,02-May-2024 11:44 AM,finance_399186.pdf,BOQ Comparative Chart,M K Mahananda,Internal,HS Meena SrDAO Rourkela R and B Division P p parida estimator Rourkela R and B Division,Manoj Kumar Mahananda,02-May-2024 11:50 AM,finsummary_399186.pdf (1605.69 KB),EIC-CIVIL||SERNB-CIRCLE-KEONJHAR||EERNB-DIVN-ROURKELA,2022_EICCL_77796_2,BID ID 10 of 2022-23,Modification and expansion of existing Odisha Adarsha Vidyalaya at Jhartoli of Nuagaon Block for the year 2021-22.,Technical,all bidder qualified in technical evaluation,Manoj Kumar Mahananda,06-Jul-2022 11:14 AM,technical_399186.pdf,M K Mahananda SE rourkela r and b division,Internal,HS Meena DAO Rourkela R and B Division P p parida estimator Rourkela R and B Division,Manoj Kumar Mahananda,06-Jul-2022 11:17 AM,06-Jul-2022 11:20 AM,techsummary_399186.pdf (238.83 KB),AOC
,,,,,,,,,,,,,,,,.pdf,"Financial instruments such as cost of tender paper, EMD, Affidavit etc",,,,,,,,,,,,,,,,2.0,ICICI NEFT/RTGS,,,,,,,,,,,,,,,,,,,,,,,,,,AOC,,,,,,,,,,,,,2.0,1852552.0,M/S GODAVARI CONSTRUCTION,27-May-2022 01:45 PM,Accepted-AOC,Accepted by Committee,02-May-2024 11:55 AM,,,,,,,,,,,,,,,,,,,,,,,,,,,,,AOC
,,,,,,,,,,,,,,,,.pdf,"Experience Certificate, List of Machinaries,Lease Deeds , MOU with electrical contractor Affidavit e",,,,,,,,,,,,,,,,,,,,,,,,,,,,,,,,,,,,,,,,,,,AOC,,,,,,,,,,,,,,,,,,,,,,,,,,,,,,,,,,,,,,,,,,,,,,,,AOC
,,,,,,,,,,,,,,,,.pdf,"No Relation Certificate, Schedule-E, Schedule-F, Affidavit etc",,,,,,,,,,,,,,,,,,,,,,,,,,,,,,,,,,,,,,,,,,,AOC,,,,,,,,,,,,,,,,,,,,,,,,,,,,,,,,,,,,,,,,,,,,,,,,AOC
,,,,,,,,,,,,,,2.0,Finance,.xls,BOQ,,,,,,,,,,,,,,,,,,,,,,,,,,,,,,,,,,,,,,,,,,,AOC,,,,,,,,,,,,,,,,,,,,,,,,,,,,,,,,,,,,,,,,,,,,,,,,AOC
