Organisation Chain,Tender Reference Number,Tender ID,Withdrawal Allowed,Tender Type,Form of contract,Tender Category,No. of Covers,General Technical Evaluation Allowed,ItemWise Technical Evaluation Allowed,Payment Mode,Is Multi Currency Allowed For BOQ,Is Multi Currency Allowed For Fee,Allow Two Stage Bidding,Cover No,Cover,Document Type,Description,Publish Date,Bid Opening Date,Document Download / Sale Start Date,Document Download / Sale End Date,Clarification Start Date,Clarification End Date,Bid Submission Start Date,Bid Submission End Date,EMD Amount in ₹,EMD Exemption Allowed,EMD Fee Type,EMD Percentage,EMD Payable To,EMD Payable At,S.No,Bank Name,Tender Fee in ₹,Fee Payable To,Fee Payable At,Tender Fee Exemption Allowed,Name,Address,Title,Work Description,Pre Qualification Details,Independent External Monitor/Remarks,Tender Value in ₹,Product Category,Sub category,Contract Type,Bid Validity(Days),Period Of Work(Days),Location,Pincode,Pre Bid Meeting Place,Pre Bid Meeting Address,Pre Bid Meeting Date,Bid Opening Place,Should Allow NDA Tender,Allow Preferential Bidder,Tender Stage,Contract Date :,Contract Value :,Work Completion Period in days :,Updated By :,Updated on :,AOC document :,AOC Description :,S.No,Bid Number,Bidder Name,Awarded Currency,Awarded Value,S.No.1,Bid Number.1,Bidder Name.1,Submitted Date,Status,Remarks,Status Updated On,Type :,Summary :,Updated By :.1,Updated On :,Document :,BOQ Comparative Chart :,Committee Chairperson/Co-ordinator Name :,Committee Chairperson/Co-ordinator Type :,Committee Members :,Updated By :.2,Updated on :.1,Document :.1,Organisation Chain :,Tender ID :,Tender Ref No :,Tender Title :,Committee Chairperson/Co-ordinator Name :.1,Committee Chairperson/Co-ordinator Type :.1,Committee Members :.1,Updated By :.3,Updated On :.1,Document :.2,Tender Stage
CE AND BM MBBS CHANDIKOLE||EASTERN CIRCLE II CHANDIKOLE,e-Procurement Notice No.KID-04 of 2023-24,2024_ECCHA_100349_59,Yes,Open Tender,Percentage,Works,1.0,No,No,Online,No,No,No,1.0,Fee/PreQual/Technical/Finance,.pdf,"GSTIN, PAN, Contractor Registration Certificate",01-Feb-2024 10:00 AM,13-Feb-2024 11:00 AM,01-Feb-2024 10:00 AM,12-Feb-2024 05:00 PM,01-Feb-2024 10:00 AM ,07-Feb-2024 05:00 PM ,01-Feb-2024 10:00 AM,12-Feb-2024 05:00 PM,"20,000",Yes,fixed,,Nil,Nil,1.0,ICICI BANK,"6,000",Nil,Nil,No,Superintending Engineer,"O/o the SE, Kendrapara Irr. Division, Kendrapara","KID-107 of 2023-24 Construction of structure on left bank of Disty.no.12 from RD 2858M to 2896M, RD 3185M to 3245M and RD 4985M to 5015 M of Pattamundai Canal.",Canal improvement,Please refer Tender documents. ,NA ,"19,93,626",Civil Works - Canal,NA ,Tender,90.0,90.0,Kendrapara,754211.0,NA ,NA ,NA ,"O/o the SE, Kendrapara Irr. Division, Kendrapara",No ,No,AOC,03-May-2024,"INR 1,999,842",90.0,Umesh Chandra Sethi,03-May-2024 07:13 PM,107..pdf (545.00 KB),Contract Awarded,1.0,2435560.0,Sanjib Kumar Biswal,INR,"1,999,842",1,2428030,Anirudha Panda,09-Feb-2024 08:30 AM,Rejected-Technical,Does not satisfy the criteria,27-Mar-2024 01:55 PM,Finance,Tender documents of all the bidders have been downloaded successfully.,Umesh Chandra Sethi,13-Feb-2024 04:09 PM,finance_488800.pdf,BOQ Comparative Chart,"Superintending Engineer, Kendrapara Irrigation Division",Internal,"Estimator and DAO, Kendrapara Irrigation Division",Umesh Chandra Sethi,03-May-2024 07:12 PM,finsummary_488800.pdf (544.52 KB),CE AND BM MBBS CHANDIKOLE||EASTERN CIRCLE II CHANDIKOLE,2024_ECCHA_100349_59,e-Procurement Notice No.KID-04 of 2023-24,"KID-107 of 2023-24 Construction of structure on left bank of Disty.no.12 from RD 2858M to 2896M, RD 3185M to 3245M and RD 4985M to 5015 M of Pattamundai Canal.","SE, Kendrapara Irrigation",Internal,"Estimator and DAO O/o the SE, Kendrapara Irrigation Division, Kendrapara",Umesh Chandra Sethi,27-Mar-2024 01:55 PM,techsummary_488800.pdf (432.13 KB),AOC
,,,,,,,,,,,,,,,,.pdf,"Affidavits, No Relation Certificate, undertakings and any other document as per SBD/DTCN",,,,,,,,,,,,,,,2.0,ICICI NEFT/RTGS,,,,,,,,,,,,,,,,,,,,,,,,,AOC,,,,,,,,,,,,,2,2436774,M/S Sudhir Kumar Behera,12-Feb-2024 04:50 PM,Rejected-Technical,Does not satisfy the criteria,27-Mar-2024 01:55 PM,,,,,,,,,,,,,,,,,,,,,,,AOC
,,,,,,,,,,,,,,,,.xls,Bill of Quantity,,,,,,,,,,,,,,,,,,,,,,,,,,,,,,,,,,,,,,,,,AOC,,,,,,,,,,,,,3,2434029,Prasanta Baral,12-Feb-2024 03:34 PM,Rejected-Technical,Does not satisfy the criteria,27-Mar-2024 01:55 PM,,,,,,,,,,,,,,,,,,,,,,,AOC
,,,,,,,,,,,,,,,,,,,,,,,,,,,,,,,,,,,,,,,,,,,,,,,,,,,,,,,,,,AOC,,,,,,,,,,,,,4,2435560,Sanjib Kumar Biswal,12-Feb-2024 01:42 PM,Accepted-AOC,Won the lottery,03-May-2024 07:13 PM,,,,,,,,,,,,,,,,,,,,,,,AOC
,,,,,,,,,,,,,,,,,,,,,,,,,,,,,,,,,,,,,,,,,,,,,,,,,,,,,,,,,,AOC,,,,,,,,,,,,,5,2435882,SRI PRAKASH CHANDRA ROUT,12-Feb-2024 03:23 PM,Rejected-Technical,Does not satisfy the criteria,27-Mar-2024 01:55 PM,,,,,,,,,,,,,,,,,,,,,,,AOC
