Organisation Chain,Tender Reference Number,Tender ID,Withdrawal Allowed,Tender Type,Form of contract,Tender Category,No. of Covers,General Technical Evaluation Allowed,ItemWise Technical Evaluation Allowed,Payment Mode,Is Multi Currency Allowed For BOQ,Is Multi Currency Allowed For Fee,Allow Two Stage Bidding,Cover No,Cover,Document Type,Description,Publish Date,Bid Opening Date,Document Download / Sale Start Date,Document Download / Sale End Date,Clarification Start Date,Clarification End Date,Bid Submission Start Date,Bid Submission End Date,EMD Amount in ₹,EMD Exemption Allowed,EMD Fee Type,EMD Percentage,EMD Payable To,EMD Payable At,S.No,Bank Name,Tender Fee in ₹,Fee Payable To,Fee Payable At,Tender Fee Exemption Allowed,Name,Address,Title,Work Description,Pre Qualification Details,Independent External Monitor/Remarks,Tender Value in ₹,Product Category,Sub category,Contract Type,Bid Validity(Days),Period Of Work(Days),Location,Pincode,Pre Bid Meeting Place,Pre Bid Meeting Address,Pre Bid Meeting Date,Bid Opening Place,Should Allow NDA Tender,Allow Preferential Bidder,Tender Stage,Contract Date :,Contract Value :,Work Completion Period in days :,Updated By :,Updated on :,AOC document :,AOC Description :,S.No,Bid Number,Bidder Name,Awarded Currency,Awarded Value,S.No.1,Bid Number.1,Bidder Name.1,Submitted Date,Status,Remarks,Status Updated On,Type :,Summary :,Updated By :.1,Updated On :,Document :,BOQ Comparative Chart :,Committee Chairperson/Co-ordinator Name :,Committee Chairperson/Co-ordinator Type :,Committee Members :,Updated By :.2,Updated on :.1,Document :.1,Organisation Chain :,Tender ID :,Tender Ref No :,Tender Title :,Committee Chairperson/Co-ordinator Name :.1,Committee Chairperson/Co-ordinator Type :.1,Committee Members :.1,Updated By :.3,Updated On :.1,Document :.2,Tender Stage
CE AND BM MBBS CHANDIKOLE||EASTERN CIRCLE II CHANDIKOLE,e-Procurement Notice No.KID-04 of 2023-24,2024_ECCHA_100349_36,Yes,Open Tender,Percentage,Works,1.0,No,No,Online,No,No,No,1.0,Fee/PreQual/Technical/Finance,.pdf,"GSTIN, PAN, Contractor Registration Certificate",01-Feb-2024 10:00 AM,13-Feb-2024 11:00 AM,01-Feb-2024 10:00 AM,12-Feb-2024 05:00 PM,01-Feb-2024 10:00 AM ,07-Feb-2024 05:00 PM ,01-Feb-2024 10:00 AM,12-Feb-2024 05:00 PM,"10,000",Yes,fixed,,Nil,Nil,1.0,ICICI BANK,"4,000",Nil,Nil,No,Superintending Engineer,"O/o the SE, Kendrapara Irr. Division, Kendrapara",KID-84 of 2023-24 Improvement to Disty.no.7 of Pattamundai Canal and construction of VRB near Paramaniksahi.,Canal improvement,Please refer Tender documents. ,NA ,"9,88,342",Civil Works - Canal,NA ,Tender,90.0,90.0,Kendrapara,754211.0,NA ,NA ,NA ,"O/o the SE, Kendrapara Irr. Division, Kendrapara",No ,No,AOC,04-May-2024,"INR 991,423",90.0,Umesh Chandra Sethi,04-May-2024 01:14 PM,84..pdf (523.00 KB),Contract Awarded,1.0,2434349.0,JAYANTI SAHOO,INR,"991,423",1,2434349,JAYANTI SAHOO,12-Feb-2024 01:06 AM,Accepted-AOC,Won the lottery,04-May-2024 01:15 PM,Finance,Tender documents of all the bidders have been downloaded successfully.,Umesh Chandra Sethi,13-Feb-2024 06:27 PM,finance_488645.pdf,BOQ Comparative Chart,"Superintending Engineer, Kendrapara Irrigation Division",Internal,"Estimator and DAO, Kendrapara Irrigation Division",Umesh Chandra Sethi,04-May-2024 01:12 PM,finsummary_488645.pdf (522.70 KB),CE AND BM MBBS CHANDIKOLE||EASTERN CIRCLE II CHANDIKOLE,2024_ECCHA_100349_36,e-Procurement Notice No.KID-04 of 2023-24,KID-84 of 2023-24 Improvement to Disty.no.7 of Pattamundai Canal and construction of VRB near Paramaniksahi.,"SE, Kendrapara Irrigation Division",Internal,"Estimator and DAO O/o the SE, Kendrapara Irrigation Division, Kendrapara",Umesh Chandra Sethi,24-Mar-2024 01:50 PM,techsummary_488645.pdf (426.90 KB),AOC
,,,,,,,,,,,,,,,,.pdf,"Affidavits, No Relation Certificate, undertakings and any other document as per SBD/DTCN",,,,,,,,,,,,,,,2.0,ICICI NEFT/RTGS,,,,,,,,,,,,,,,,,,,,,,,,,AOC,,,,,,,,,,,,,2,2435419,MAA MANGALA CONSTRUCTION,12-Feb-2024 01:14 PM,Rejected-Technical,Does not satisfy the criteria,24-Mar-2024 01:50 PM,,,,,,,,,,,,,,,,,,,,,,,AOC
,,,,,,,,,,,,,,,,.xls,Bill of Quantity,,,,,,,,,,,,,,,,,,,,,,,,,,,,,,,,,,,,,,,,,AOC,,,,,,,,,,,,,3,2429223,Natabar Dalai,10-Feb-2024 11:07 AM,Rejected-Technical,Does not satisfy the criteria,24-Mar-2024 01:50 PM,,,,,,,,,,,,,,,,,,,,,,,AOC
,,,,,,,,,,,,,,,,,,,,,,,,,,,,,,,,,,,,,,,,,,,,,,,,,,,,,,,,,,AOC,,,,,,,,,,,,,4,2432981,P.N. CONSTRUCTION,11-Feb-2024 10:32 AM,Rejected-Technical,Does not satisfy the criteria,24-Mar-2024 01:50 PM,,,,,,,,,,,,,,,,,,,,,,,AOC
,,,,,,,,,,,,,,,,,,,,,,,,,,,,,,,,,,,,,,,,,,,,,,,,,,,,,,,,,,AOC,,,,,,,,,,,,,5,2430355,SAMARJEET SWAIN,09-Feb-2024 08:35 PM,Rejected-Technical,Does not satisfy the criteria,24-Mar-2024 01:50 PM,,,,,,,,,,,,,,,,,,,,,,,AOC
