Organisation Chain,Tender Reference Number,Tender ID,Withdrawal Allowed,Tender Type,Form of contract,Tender Category,No. of Covers,General Technical Evaluation Allowed,ItemWise Technical Evaluation Allowed,Payment Mode,Is Multi Currency Allowed For BOQ,Is Multi Currency Allowed For Fee,Allow Two Stage Bidding,Cover No,Cover,Document Type,Description,Publish Date,Bid Opening Date,Document Download / Sale Start Date,Document Download / Sale End Date,Clarification Start Date,Clarification End Date,Bid Submission Start Date,Bid Submission End Date,Financial Bid Opening Date,EMD Amount in ₹,EMD Exemption Allowed,EMD Fee Type,EMD Percentage,EMD Payable To,EMD Payable At,S.No,Bank Name,Tender Fee in ₹,VAT Charges in ₹,Fee Payable To,Fee Payable At,Tender Fee Exemption Allowed,Name,Address,Title,Work Description,Pre Qualification Details,Independent External Monitor/Remarks,Tender Value in ₹,Product Category,Sub category,Contract Type,Bid Validity(Days),Period Of Work(Days),Location,Pincode,Pre Bid Meeting Place,Pre Bid Meeting Address,Pre Bid Meeting Date,Bid Opening Place,Should Allow NDA Tender,Allow Preferential Bidder,Tender Stage,Contract Date :,Contract Value :,Work Completion Period in days :,Updated By :,Updated on :,AOC document :,S.No,Bid Number,Bidder Name,Awarded Currency,Awarded Value,S.No.1,Bid Number.1,Bidder Name.1,Submitted Date,Status,Remarks,Status Updated On,Type :,Summary :,Updated By :.1,Updated On :,Document :,BOQ Comparative Chart :,Committee Chairperson/Co-ordinator Name :,Committee Chairperson/Co-ordinator Type :,Committee Members :,Updated By :.2,Updated on :.1,Document :.1,Organisation Chain :,Tender ID :,Tender Ref No :,Tender Title :,Type :.1,Summary :.1,Updated By :.3,Updated On :.1,Document :.2,Committee Chairperson/Co-ordinator Name :.1,Committee Chairperson/Co-ordinator Type :.1,Committee Members :.1,Updated By :.4,Updated On :.2,Financial Bid Opening Date:,Document :.3,Tender Stage
CE RW I||RW-CIRCLE-SUNDARGARH,RWCCESNG- 52 Of 2023-24,2024_CERWI_100424_3,Yes,National Competitive Bid,Percentage,Works,2.0,No,No,Online,No,No,No,1.0,Fee/PreQual/Technical,.pdf,"Registration certificate,GSTIN,PAN,Affidavits etc",01-Feb-2024 06:00 PM,13-Feb-2024 11:00 AM,01-Feb-2024 06:00 PM,12-Feb-2024 05:00 PM,01-Feb-2024 06:00 PM ,09-Feb-2024 05:00 PM ,01-Feb-2024 06:00 PM,12-Feb-2024 05:00 PM,26-Feb-2024 11:00 AM,"1,11,440",Yes,percentage,1.0%,Nil,Nil,1.0,ICICI BANK,"10,000",0.0,Nil,Nil,No,"C.C.E.,R.W. Circle ,Sundargarh","Office of the C.C.E.,R.W. Circle ,Sundargarh",Construction of road from PWD road to Chhatishgarh boarder via Sidhapada Ramlal house under DMF Scheme in the Dist. of Sundargarh for the year 2023-24.,Construction of road from PWD road to Chhatishgarh boarder via Sidhapada Ramlal house under DMF Scheme in the Dist. of Sundargarh for the year 2023-24.,Please refer Tender documents. ,NA ,"1,11,43,990",Civil Works - Roads,NA ,Tender,90.0,180.0,Sundargarh,770020.0,NA ,NA ,NA ,"Office of the C.C.E.,R.W. Circle ,Sundargarh",No ,No,AOC,21-May-2024,"INR 11,143,989.69",180.0,Biswanath Sethy,21-May-2024 12:17 PM,3118.pdf (756.00 KB),1.0,2429704.0,M/s ANUP ROY,INR,"9,473,505.64",1,2432298,MESSERS MOHAN KUMAR PATEL,10-Feb-2024 05:23 PM,Rejected-AOC,Unsuccessful bidder,21-May-2024 12:17 PM,Finance,Four nos of bidder,Biswanath Sethy,26-Feb-2024 05:02 PM,finance_489093.pdf,BOQ Comparative Chart,B.Sethy,Internal,,Biswanath Sethy,21-May-2024 12:11 PM,finsummary_489093.pdf (21.83 KB),CE RW I||RW-CIRCLE-SUNDARGARH,2024_CERWI_100424_3,RWCCESNG- 52 Of 2023-24,Construction of road from PWD road to Chhatishgarh boarder via Sidhapada Ramlal house under DMF Scheme in the Dist. of Sundargarh for the year 2023-24.,Technical,Total five nos of bidder only.,Biswanath Sethy,13-Feb-2024 07:01 PM,,B.Sethy,Internal,,Biswanath Sethy,22-Feb-2024 01:50 PM,26-Feb-2024 11:00 AM,techsummary_489093.pdf (499.42 KB),AOC
,,,,,,,,,,,,,,,,.pdf,"Annual turnover, work experience, machinaries and other documents as per DTCN.",,,,,,,,,,,,,,,,2.0,ICICI NEFT/RTGS,,,,,,,,,,,,,,,,,,,,,,,,,,AOC,,,,,,,,,,,,2,2435876,MRUTUNJAYA MOHANTY,12-Feb-2024 02:16 PM,Rejected-AOC,Unsuccessful bidder,21-May-2024 12:17 PM,,,,,,,,,,,,,,,,,,,,,,,,,,,,,AOC
,,,,,,,,,,,,,,2.0,Finance,.xls,BOQ,,,,,,,,,,,,,,,,,,,,,,,,,,,,,,,,,,,,,,,,,,,AOC,,,,,,,,,,,,3,2429704,M/s ANUP ROY,11-Feb-2024 08:07 PM,Accepted-AOC,Successful bidder,21-May-2024 12:17 PM,,,,,,,,,,,,,,,,,,,,,,,,,,,,,AOC
,,,,,,,,,,,,,,,,,,,,,,,,,,,,,,,,,,,,,,,,,,,,,,,,,,,,,,,,,,,,AOC,,,,,,,,,,,,4,2429741,Roys infrastructure & Projects,12-Feb-2024 09:39 AM,Rejected-Technical,Annual financial turnover and similar nature of work not furnished,22-Feb-2024 01:50 PM,,,,,,,,,,,,,,,,,,,,,,,,,,,,,AOC
,,,,,,,,,,,,,,,,,,,,,,,,,,,,,,,,,,,,,,,,,,,,,,,,,,,,,,,,,,,,AOC,,,,,,,,,,,,5,2435969,SAMIR KUMAR MEHER,12-Feb-2024 02:43 PM,Rejected-AOC,Unsuccessful bidder,21-May-2024 12:17 PM,,,,,,,,,,,,,,,,,,,,,,,,,,,,,AOC
