Organisation Chain,Tender Reference Number,Tender ID,Withdrawal Allowed,Tender Type,Form of contract,Tender Category,No. of Covers,General Technical Evaluation Allowed,ItemWise Technical Evaluation Allowed,Payment Mode,Is Multi Currency Allowed For BOQ,Is Multi Currency Allowed For Fee,Allow Two Stage Bidding,Cover No,Cover,Document Type,Description,Publish Date,Bid Opening Date,Document Download / Sale Start Date,Document Download / Sale End Date,Clarification Start Date,Clarification End Date,Bid Submission Start Date,Bid Submission End Date,Financial Bid Opening Date,EMD Amount in ₹,EMD Exemption Allowed,EMD Fee Type,EMD Percentage,EMD Payable To,EMD Payable At,S.No,Corrigendum Title,Corrigendum Type,View,S.No.1,Bank Name,Tender Fee in ₹,VAT Charges in ₹,Fee Payable To,Fee Payable At,Tender Fee Exemption Allowed,Name,Address,Title,Work Description,Pre Qualification Details,Independent External Monitor/Remarks,Tender Value in ₹,Product Category,Sub category,Contract Type,Bid Validity(Days),Period Of Work(Days),Location,Pincode,Pre Bid Meeting Place,Pre Bid Meeting Address,Pre Bid Meeting Date,Bid Opening Place,Should Allow NDA Tender,Allow Preferential Bidder,Tender Stage,Contract Date :,Contract Value :,Work Completion Period in days :,Updated By :,Updated on :,AOC document :,AOC Description :,S.No,Bid Number,Bidder Name,Awarded Currency,Awarded Value,S.No.1,Bid Number.1,Bidder Name.1,Submitted Date,Status,Remarks,Status Updated On,Type :,Summary :,Updated By :.1,Updated On :,Document :,BOQ Comparative Chart :,Committee Chairperson/Co-ordinator Name :,Committee Chairperson/Co-ordinator Type :,Committee Members :,Updated By :.2,Updated on :.1,Document :.1,Organisation Chain :,Tender ID :,Tender Ref No :,Tender Title :,Type :.1,Summary :.1,Updated By :.3,Updated On :.1,Document :.2,Committee Chairperson/Co-ordinator Name :.1,Committee Chairperson/Co-ordinator Type :.1,Committee Members :.1,Updated By :.4,Updated On :.2,Financial Bid Opening Date:,Document :.3,Tender Stage
CE RW I||RWCIRCLE-BHUBANESWAR,Tender Online C.C-51 of 2023,2023_CERWI_98418_2,Yes,National Competitive Bid,Percentage,Works,2.0,No,No,Online,No,No,No,1.0,Fee/PreQual/Technical,.pdf,"Tender Paper Cost, EMD, GSTIN, PAN, Registration Certificate",02-Jan-2024 02:00 PM,17-Jan-2024 11:00 AM,02-Jan-2024 02:00 PM,16-Jan-2024 05:00 PM,NA ,NA ,02-Jan-2024 02:00 PM,16-Jan-2024 05:00 PM,03-Feb-2024 04:00 PM,"1,32,093",Yes,percentage,1.0%,Nil,Nil,1.0,Date Corrigendum,Date,,1.0,ICICI BANK,"10,000",0.0,Nil,Nil,No,ChiefConstructionEngineer,"O/o ChiefConstructionEngineer,CentralRWCircle,BBSR",Const. of R.l.Office-cum-Residence at Tamando under Bhubaneswar Tahasil for the year 2023-24,Const. of R.l.Office-cum-Residence at Tamando under Bhubaneswar Tahasil for the year 2023-24,Please refer Tender documents. ,NA ,"1,32,09,340",Civil Works - Buildings,NA ,Tender,90.0,330.0,Bhubaneswar,751022.0,NA ,NA ,NA ,"O/o ChiefConstructionEngineer,CentralRWCircle,BBSR",No ,No,AOC,04-May-2024,"INR 11,229,260",330.0,Priyadarshini Dalai,04-May-2024 12:24 PM,TamandoAgmtDetails.pdf (1443.00 KB),"Work order letter No.4231 dtd.04.03.2024 and Agmt No.633 P1 of 2023-24 dtd.04.03.2024 of Superintending Engineer, Rural Works Division, Bhubaneswar",1.0,2393210.0,SOUMYA RANJAN PRADHAN,INR,"11,229,260",1,2389661,ASHOK KUMAR SETHI,14-Jan-2024 05:46 PM,Rejected-Technical,As per Clause No.1(d) of the Eligibility Criteria of ITB of the DTCN,30-Jan-2024 08:10 PM,Finance,2 nos bidder qualified in the tender,Priyadarshini Dalai,06-Feb-2024 08:03 PM,,BOQ Comparative Chart,"Chief Construction Engineer CentralRWCircle,BBSR",Internal,SuperintendingEngineerRWDivision Nimapara SrDAORWDivision Bhubaneswar PAtoChiefConstructionEngineerCentralRuralWorksCircleBBSR,Priyadarshini Dalai,04-May-2024 12:21 PM,finsummary_479595.pdf (277.13 KB),CE RW I||RWCIRCLE-BHUBANESWAR,2023_CERWI_98418_2,Tender Online C.C-51 of 2023,Const. of R.l.Office-cum-Residence at Tamando under Bhubaneswar Tahasil for the year 2023-24,Technical,8 nos bidder participated in the tender,Priyadarshini Dalai,18-Jan-2024 05:49 PM,,"Chief Construction Engineer CentralRWCircle,BBSR",Internal,SuperintendingEngineerRWDivision Nimapara SrDAORWDivision Bhubaneswar PAtoChiefConstructionEngineerCentralRuralWorksCircleBBSR,Priyadarshini Dalai,30-Jan-2024 08:10 PM,03-Feb-2024 04:00 PM,techsummary_479595.pdf (1123.50 KB),AOC
,,,,,,,,,,,,,,,,.pdf,"Work in Hand, Machineries, Affidavit of Correctness Certificate",,,,,,,,,,,,,,,,,,,,2.0,ICICI NEFT/RTGS,,,,,,,,,,,,,,,,,,,,,,,,,,AOC,,,,,,,,,,,,,2,2393211,DAD CONSTRUCTION PRIVATE LIMITED,16-Jan-2024 03:42 PM,Rejected-Technical,As per Clause No.1(d) of the Eligibility Criteria of ITB of the DTCN,30-Jan-2024 08:10 PM,,,,,,,,,,,,,,,,,,,,,,,,,,,,,AOC
,,,,,,,,,,,,,,,,.pdf,"No Relationship Certificate, ATO, Work Experience and required documents as per DTCN",,,,,,,,,,,,,,,,,,,,,,,,,,,,,,,,,,,,,,,,,,,,,,,AOC,,,,,,,,,,,,,3,2393301,NIHAR RANJAN JATTA,16-Jan-2024 12:55 PM,Rejected-Technical,As per Clause No.1(d) of the Eligibility Criteria of ITB of the DTCN,30-Jan-2024 08:10 PM,,,,,,,,,,,,,,,,,,,,,,,,,,,,,AOC
,,,,,,,,,,,,,,2.0,Finance,.xls,BOQ,,,,,,,,,,,,,,,,,,,,,,,,,,,,,,,,,,,,,,,,,,,,,,,AOC,,,,,,,,,,,,,4,2394091,Noor_Amin_Al_azmi,16-Jan-2024 03:27 PM,Rejected-Technical,As per Clause No.1(d) of the Eligibility Criteria of ITB of the DTCN,30-Jan-2024 08:10 PM,,,,,,,,,,,,,,,,,,,,,,,,,,,,,AOC
,,,,,,,,,,,,,,,,,,,,,,,,,,,,,,,,,,,,,,,,,,,,,,,,,,,,,,,,,,,,,,,,AOC,,,,,,,,,,,,,5,2387529,PRAMOD KUMAR NAYAK,11-Jan-2024 01:37 PM,Rejected-Technical,As per Clause No.1(d) of the Eligibility Criteria of ITB of the DTCN,30-Jan-2024 08:10 PM,,,,,,,,,,,,,,,,,,,,,,,,,,,,,AOC
,,,,,,,,,,,,,,,,,,,,,,,,,,,,,,,,,,,,,,,,,,,,,,,,,,,,,,,,,,,,,,,,AOC,,,,,,,,,,,,,6,2386505,SIDDHARTH SATPATHY,10-Jan-2024 10:00 PM,Rejected-Finance,Other than L1,04-May-2024 12:21 PM,,,,,,,,,,,,,,,,,,,,,,,,,,,,,AOC
,,,,,,,,,,,,,,,,,,,,,,,,,,,,,,,,,,,,,,,,,,,,,,,,,,,,,,,,,,,,,,,,AOC,,,,,,,,,,,,,7,2394665,SMRUTI DHAR BEHERA,16-Jan-2024 04:52 PM,Rejected-Technical,As per Clause No.1(d) of the Eligibility Criteria of ITB of the DTCN,30-Jan-2024 08:10 PM,,,,,,,,,,,,,,,,,,,,,,,,,,,,,AOC
,,,,,,,,,,,,,,,,,,,,,,,,,,,,,,,,,,,,,,,,,,,,,,,,,,,,,,,,,,,,,,,,AOC,,,,,,,,,,,,,8,2393210,SOUMYA RANJAN PRADHAN,16-Jan-2024 12:54 PM,Accepted-AOC,Accepted,04-May-2024 12:25 PM,,,,,,,,,,,,,,,,,,,,,,,,,,,,,AOC
