Organisation Chain,Tender Reference Number,Tender ID,Withdrawal Allowed,Tender Type,Form of contract,Tender Category,No. of Covers,General Technical Evaluation Allowed,ItemWise Technical Evaluation Allowed,Payment Mode,Is Multi Currency Allowed For BOQ,Is Multi Currency Allowed For Fee,Allow Two Stage Bidding,Cover No,Cover,Document Type,Description,Publish Date,Bid Opening Date,Document Download / Sale Start Date,Document Download / Sale End Date,Clarification Start Date,Clarification End Date,Bid Submission Start Date,Bid Submission End Date,Financial Bid Opening Date,EMD Amount in ₹,EMD Exemption Allowed,EMD Fee Type,EMD Percentage,EMD Payable To,EMD Payable At,S.No,Bank Name,Tender Fee in ₹,VAT Charges in ₹,Fee Payable To,Fee Payable At,Tender Fee Exemption Allowed,Name,Address,Title,Work Description,Pre Qualification Details,Independent External Monitor/Remarks,Tender Value in ₹,Product Category,Sub category,Contract Type,Bid Validity(Days),Period Of Work(Days),Location,Pincode,Pre Bid Meeting Place,Pre Bid Meeting Address,Pre Bid Meeting Date,Bid Opening Place,Should Allow NDA Tender,Allow Preferential Bidder,Tender Stage,Contract Date :,Contract Value :,Work Completion Period in days :,Updated By :,Updated on :,AOC document :,AOC Description :,S.No,Bid Number,Bidder Name,Awarded Currency,Awarded Value,S.No.1,Bid Number.1,Bidder Name.1,Submitted Date,Status,Remarks,Status Updated On,Type :,Summary :,Updated By :.1,Updated On :,Document :,BOQ Comparative Chart :,Committee Chairperson/Co-ordinator Name :,Committee Chairperson/Co-ordinator Type :,Committee Members :,Updated By :.2,Updated on :.1,Document :.1,Organisation Chain :,Tender ID :,Tender Ref No :,Tender Title :,Type :.1,Summary :.1,Updated By :.3,Updated On :.1,Document :.2,Committee Chairperson/Co-ordinator Name :.1,Committee Chairperson/Co-ordinator Type :.1,Committee Members :.1,Updated By :.4,Updated On :.2,Financial Bid Opening Date:,Document :.3,Tender Stage
CE RW I||RWCIRCLE-BHUBANESWAR,Tender Online C.C-19 of 2023,2023_CERWI_90854_19,Yes,National Competitive Bid,Percentage,Works,2.0,No,No,Online,No,No,No,1.0,Fee/PreQual/Technical,.pdf,"Tender Paper Cost, EMD, GSTIN, PAN, Registration Certificate",29-Jul-2023 09:00 AM,10-Aug-2023 11:00 AM,29-Jul-2023 09:00 AM,09-Aug-2023 05:00 PM,29-Jul-2023 09:00 AM ,07-Aug-2023 05:00 PM ,29-Jul-2023 09:00 AM,09-Aug-2023 05:00 PM,25-Aug-2023 04:00 PM,"1,05,725",Yes,percentage,1.0%,Nil,Nil,1.0,ICICI BANK,"10,000",0.0,Nil,Nil,No,Chief Construction Engineer,"O/o ChiefConstructionEngineer,CentralRWCircle,BBSR","Periodical renewal work of 5 years post DLP PMGSY roads such as (a) Mahura to Alikia, (b) Gabakunda to Nuabudhakera, (c ) Ketakipatana to Alanda, (d) Mohantysahi To Morada and (e) M.B road to Gadajanga under Package No. PM/NIMAPARA/04","Periodical renewal work of 5 years post DLP PMGSY roads such as (a) Mahura to Alikia, (b) Gabakunda to Nuabudhakera, (c ) Ketakipatana to Alanda, (d) Mohantysahi To Morada and (e) M.B road to Gadajanga under Package No. PM/NIMAPARA/04",Please refer Tender documents. ,NA ,"1,05,72,491",Civil Works - Roads,NA ,Tender,90.0,180.0,Nimapara,752106.0,NA ,NA ,NA ,"O/o ChiefConstructionEngineer,CentralRWCircle,BBSR",No ,No,AOC,02-May-2024,"INR 8,987,674",180.0,Priyadarshini Dalai,02-May-2024 12:18 PM,PMNIMAPARA04AgmtDetails.pdf (769.00 KB),"Work order letter No.3293 dtd.05.10.2023 and Agmt No.03 PM of 2023-24 dtd.05.10.2023 of Superintending Engineer, Rural Works Division, Nimapara",1.0,2198175.0,PRAFULLA KUMAR MISHRA,INR,"8,987,674",1,2195561,HARISANKAR PRADHAN,07-Aug-2023 05:32 PM,Rejected-Finance,Other than winner of the transparent lottery system,02-May-2024 12:14 PM,Finance,Prafulla Kumar Mishra found successful in the transparent lottery system,Priyadarshini Dalai,02-May-2024 12:10 PM,finance_444682.pdf,BOQ Comparative Chart,"Chief Construction Engineer CentralRWCircle,BBSR",Internal,SuperintendingEngineerRWDivision Puri SrDAORWDivision Nimapara PAtoChiefConstructionEngineerCentralRuralWorksCircleBBSR,Priyadarshini Dalai,02-May-2024 12:14 PM,finsummary_444682.pdf (280.64 KB),CE RW I||RWCIRCLE-BHUBANESWAR,2023_CERWI_90854_19,Tender Online C.C-19 of 2023,"Periodical renewal work of 5 years post DLP PMGSY roads such as (a) Mahura to Alikia, (b) Gabakunda to Nuabudhakera, (c ) Ketakipatana to Alanda, (d) Mohantysahi To Morada and (e) M.B road to Gadajanga under Package No. PM/NIMAPARA/04",Technical,QUALIFIED AND DISQUALIFIED LIST,Priyadarshini Dalai,23-Aug-2023 12:35 PM,technical_444682.pdf,"Chief Construction Engineer CentralRWCircle,BBSR",Internal,SuperintendingEngineerRWDivision Puri SrDAORWDivision Nimapara PAtoChiefConstructionEngineerCentralRuralWorksCircleBBSR,Priyadarshini Dalai,23-Aug-2023 12:36 PM,25-Aug-2023 04:00 PM,techsummary_444682.pdf (276.22 KB),AOC
,,,,,,,,,,,,,,,,.pdf,"Work in Hand, Machineries, Affidavit of Correctness Certificate",,,,,,,,,,,,,,,,2.0,ICICI NEFT/RTGS,,,,,,,,,,,,,,,,,,,,,,,,,,AOC,,,,,,,,,,,,,2,2198339,JITENDRA PRASAD BEHERA,09-Aug-2023 04:02 PM,Rejected-Finance,Other than winner of the transparent lottery system,02-May-2024 12:14 PM,,,,,,,,,,,,,,,,,,,,,,,,,,,,,AOC
,,,,,,,,,,,,,,,,.pdf,"No Relationship Certificate, ATO, Work Experience and required documents as per DTCN",,,,,,,,,,,,,,,,,,,,,,,,,,,,,,,,,,,,,,,,,,,AOC,,,,,,,,,,,,,3,2198001,NARAYAN BHOI,09-Aug-2023 12:34 PM,Rejected-Finance,Other than winner of the transparent lottery system,02-May-2024 12:14 PM,,,,,,,,,,,,,,,,,,,,,,,,,,,,,AOC
,,,,,,,,,,,,,,2.0,Finance,.xls,BOQ,,,,,,,,,,,,,,,,,,,,,,,,,,,,,,,,,,,,,,,,,,,AOC,,,,,,,,,,,,,4,2198175,PRAFULLA KUMAR MISHRA,09-Aug-2023 02:12 PM,Accepted-AOC,Accepted,02-May-2024 12:19 PM,,,,,,,,,,,,,,,,,,,,,,,,,,,,,AOC
,,,,,,,,,,,,,,,,,,,,,,,,,,,,,,,,,,,,,,,,,,,,,,,,,,,,,,,,,,,,AOC,,,,,,,,,,,,,5,2194164,RAMACHANDRA SAMANTA SINGHAR,04-Aug-2023 08:40 AM,Rejected-Finance,Other than winner of the transparent lottery system,02-May-2024 12:14 PM,,,,,,,,,,,,,,,,,,,,,,,,,,,,,AOC
