Organisation Chain,Tender Reference Number,Tender ID,Withdrawal Allowed,Tender Type,Form of contract,Tender Category,No. of Covers,General Technical Evaluation Allowed,ItemWise Technical Evaluation Allowed,Payment Mode,Is Multi Currency Allowed For BOQ,Is Multi Currency Allowed For Fee,Allow Two Stage Bidding,Cover No,Cover,Document Type,Description,Publish Date,Bid Opening Date,Document Download / Sale Start Date,Document Download / Sale End Date,Clarification Start Date,Clarification End Date,Bid Submission Start Date,Bid Submission End Date,Financial Bid Opening Date,EMD Amount in ₹,EMD Exemption Allowed,EMD Fee Type,EMD Percentage,EMD Payable To,EMD Payable At,S.No,Bank Name,Tender Fee in ₹,VAT Charges in ₹,Fee Payable To,Fee Payable At,Tender Fee Exemption Allowed,Name,Address,Title,Work Description,Pre Qualification Details,Independent External Monitor/Remarks,Tender Value in ₹,Product Category,Sub category,Contract Type,Bid Validity(Days),Period Of Work(Days),Location,Pincode,Pre Bid Meeting Place,Pre Bid Meeting Address,Pre Bid Meeting Date,Bid Opening Place,Should Allow NDA Tender,Allow Preferential Bidder,Tender Stage,Contract Date :,Contract Value :,Work Completion Period in days :,Updated By :,Updated on :,AOC document :,AOC Description :,S.No,Bid Number,Bidder Name,Awarded Currency,Awarded Value,S.No.1,Bid Number.1,Bidder Name.1,Submitted Date,Status,Remarks,Status Updated On,Type :,Summary :,Updated By :.1,Updated On :,Document :,BOQ Comparative Chart :,Committee Chairperson/Co-ordinator Name :,Committee Chairperson/Co-ordinator Type :,Committee Members :,Updated By :.2,Updated on :.1,Document :.1,Organisation Chain :,Tender ID :,Tender Ref No :,Tender Title :,Type :.1,Summary :.1,Updated By :.3,Updated On :.1,Document :.2,Committee Chairperson/Co-ordinator Name :.1,Committee Chairperson/Co-ordinator Type :.1,Committee Members :.1,Updated By :.4,Updated On :.2,Financial Bid Opening Date:,Document :.3,Tender Stage
EIC-CIVIL||SERNB-CIRCLE-KEONJHAR||EERNB-DIVN-ROURKELA,Bid ID 47 of 2022-23,2022_EICCL_83262_2,Yes,Open Tender,Percentage,Works,2.0,No,No,Online,No,No,No,1.0,Fee/PreQual/Technical,.pdf,"Registration certificate, Registration in CDMS, PAN Card, GSTIN Certificate, Affidavit etc",16-Nov-2022 05:20 PM,28-Nov-2022 11:30 AM,16-Nov-2022 05:20 PM,25-Nov-2022 05:00 PM,16-Nov-2022 05:20 PM ,21-Nov-2022 05:00 PM ,16-Nov-2022 05:20 PM,25-Nov-2022 05:00 PM,26-Dec-2022 11:20 AM,0.0,No,fixed,,Nil,Nil,1.0,ICICI BANK,"10,000",0.0,Nil,Nil,No,Office of Superintending Engineer Rourkela R and B,Office of Superintending Engineer Rourkela R and B division rourkela,"Construction RI-Office cum residence at Rourkela Town unit No-19, Steel township-I, in the district of Sundargarh for the year 2022-23.","Construction RI-Office cum residence at Rourkela Town unit No-19, Steel township-I, in the district of Sundargarh for the year 2022-23.",Please refer tender document ,NA ,"85,13,600",Civil Works - Buildings,NA ,Tender,90.0,180.0,Rourkela,769012.0,NA ,NA ,NA ,Office of Superintending Engineer Rourkela R and B,No ,No,AOC,18-May-2024,"INR 6,326,977",180.0,Manoj Kumar Mahananda,18-May-2024 12:59 PM,RIunit19workorder.pdf (1473.00 KB),Agmt drawn and Work order issued,1.0,1992796.0,KANHU CHHACHHAN,INR,"6,326,977",1,1992796,KANHU CHHACHHAN,25-Nov-2022 12:25 PM,Accepted-AOC,Qualified in the Lottery,18-May-2024 01:00 PM,Finance,All the Four bidders qualified in the Technical Evaluation,Manoj Kumar Mahananda,18-May-2024 12:48 PM,finance_417229.pdf,BOQ Comparative Chart,M K Mahananda,Internal,HS Meena SrDAO Rourkela R and B Division P p parida estimator Rourkela R and B Division,Manoj Kumar Mahananda,18-May-2024 12:55 PM,finsummary_417229.pdf (1473.26 KB),EIC-CIVIL||SERNB-CIRCLE-KEONJHAR||EERNB-DIVN-ROURKELA,2022_EICCL_83262_2,Bid ID 47 of 2022-23,"Construction RI-Office cum residence at Rourkela Town unit No-19, Steel township-I, in the district of Sundargarh for the year 2022-23.",Technical,5 bidders has been participated,Prajna Prajwolita Parida,26-Dec-2022 11:16 AM,technical_417229.pdf,M K Mahananda SE rourkela r and b division,Internal,HS Meena DAO Rourkela R and B Division P p parida estimator Rourkela R and B Division,Prajna Prajwolita Parida,26-Dec-2022 11:18 AM,26-Dec-2022 11:20 AM,techsummary_417229.pdf (612.25 KB),AOC
,,,,,,,,,,,,,,,,.pdf,"Financial instruments such as cost of tender paper, EMD, Affidavit etc",,,,,,,,,,,,,,,,2.0,ICICI NEFT/RTGS,,,,,,,,,,,,,,,,,,,,,,,,,,AOC,,,,,,,,,,,,,2,1992788,M/S DURGAMADHAB CONSTRUCTION AND INTERIOR,25-Nov-2022 02:37 PM,Rejected-AOC,Not Qualified in the Lottery,18-May-2024 01:00 PM,,,,,,,,,,,,,,,,,,,,,,,,,,,,,AOC
,,,,,,,,,,,,,,,,.pdf,"Experience Certificate, List of Machinaries,Lease Deeds , MOU with electrical contractor Affidavit e",,,,,,,,,,,,,,,,,,,,,,,,,,,,,,,,,,,,,,,,,,,AOC,,,,,,,,,,,,,3,1993142,SABITA SWAIN,25-Nov-2022 03:29 PM,Rejected-AOC,Not Qualified in the Lottery,18-May-2024 01:00 PM,,,,,,,,,,,,,,,,,,,,,,,,,,,,,AOC
,,,,,,,,,,,,,,,,.pdf,"No Relation Certificate, Schedule-E, Schedule-F, Affidavit etc",,,,,,,,,,,,,,,,,,,,,,,,,,,,,,,,,,,,,,,,,,,AOC,,,,,,,,,,,,,4,1993090,SUSANTA KUMAR SETHI,25-Nov-2022 02:49 PM,Rejected-Technical,by Committee,26-Dec-2022 11:18 AM,,,,,,,,,,,,,,,,,,,,,,,,,,,,,AOC
,,,,,,,,,,,,,,2.0,Finance,.xls,BOQ,,,,,,,,,,,,,,,,,,,,,,,,,,,,,,,,,,,,,,,,,,,AOC,,,,,,,,,,,,,5,1988228,SWASTIK CONSTRUCTION,22-Nov-2022 01:14 PM,Rejected-AOC,Not Qualified in the Lottery,18-May-2024 01:00 PM,,,,,,,,,,,,,,,,,,,,,,,,,,,,,AOC
