Organisation Chain,Tender Reference Number,Tender ID,Withdrawal Allowed,Tender Type,Form of contract,Tender Category,No. of Covers,General Technical Evaluation Allowed,ItemWise Technical Evaluation Allowed,Payment Mode,Is Multi Currency Allowed For BOQ,Is Multi Currency Allowed For Fee,Allow Two Stage Bidding,Cover No,Cover,Document Type,Description,Publish Date,Bid Opening Date,Document Download / Sale Start Date,Document Download / Sale End Date,Clarification Start Date,Clarification End Date,Bid Submission Start Date,Bid Submission End Date,Financial Bid Opening Date,EMD Amount in ₹,EMD Exemption Allowed,EMD Fee Type,EMD Percentage,EMD Payable To,EMD Payable At,S.No,Bank Name,Tender Fee in ₹,VAT Charges in ₹,Fee Payable To,Fee Payable At,Tender Fee Exemption Allowed,Name,Address,Title,Work Description,Pre Qualification Details,Independent External Monitor/Remarks,Tender Value in ₹,Product Category,Sub category,Contract Type,Bid Validity(Days),Period Of Work(Days),Location,Pincode,Pre Bid Meeting Place,Pre Bid Meeting Address,Pre Bid Meeting Date,Bid Opening Place,Should Allow NDA Tender,Allow Preferential Bidder,Tender Stage,Contract Date :,Contract Value :,Work Completion Period in days :,Updated By :,Updated on :,AOC document :,AOC Description :,S.No,Bid Number,Bidder Name,Awarded Currency,Awarded Value,S.No.1,Bid Number.1,Bidder Name.1,Submitted Date,Status,Remarks,Status Updated On,Type :,Summary :,Updated By :.1,Updated On :,Document :,BOQ Comparative Chart :,Committee Chairperson/Co-ordinator Name :,Committee Chairperson/Co-ordinator Type :,Committee Members :,Updated By :.2,Updated on :.1,Document :.1,Organisation Chain :,Tender ID :,Tender Ref No :,Tender Title :,Type :.1,Summary :.1,Updated By :.3,Updated On :.1,Document :.2,Committee Chairperson/Co-ordinator Name :.1,Committee Chairperson/Co-ordinator Type :.1,Committee Members :.1,Updated By :.4,Updated On :.2,Financial Bid Opening Date:,Document :.3,Tender Stage
EIC-CIVIL||SERNB-CIRCLE-KEONJHAR||EERNB-DIVN-ROURKELA,BID ID 03 of 2022-23,2022_EICCL_76898_6,Yes,Open Tender,Percentage,Works,2.0,No,No,Online,No,No,No,1.0,Fee/PreQual/Technical,.pdf,"Registration certificate, Registration in CDMS, PAN Card, GSTIN Certificate, Affidavit etc",13-Apr-2022 05:00 PM,25-Apr-2022 11:30 AM,13-Apr-2022 05:00 PM,22-Apr-2022 05:00 PM,13-Apr-2022 05:00 PM ,19-Apr-2022 05:00 PM ,13-Apr-2022 05:00 PM,22-Apr-2022 05:00 PM,20-May-2022 10:35 AM,0.0,No,fixed,,Nil,Nil,1.0,ICICI BANK,"10,000",0.0,Nil,Nil,No,Superintending Engineer Rourkela R and B,Office of Superintending Engineer Rourkela R and B Division,"Construction of Excise station, Malkhana, Hazat and Boundary wall for Biramitrapur Excise station for the year 2021-22","Construction of Excise station, Malkhana, Hazat and Boundary wall for Biramitrapur Excise station for the year 2021-22",Please refer tender document ,NA ,"98,23,900",Civil Works - Buildings,NA ,Tender,90.0,240.0,Rourkela,769012.0,NA ,NA ,NA ,Office of Superintending Engineer Rourkela R and B,No ,No,AOC,17-May-2024,"INR 8,998,749",240.0,Manoj Kumar Mahananda,17-May-2024 12:26 PM,WORKordermalkhana.pdf (1448.00 KB),Agmt drawn and Work order issued,1.0,1829640.0,M/S GODAVARI CONSTRUCTION,INR,"8,998,749",1,1829610,DEEPAK KUMAR ROUT,22-Apr-2022 11:29 AM,Rejected-AOC,Not Qualified in the Lottery,17-May-2024 12:26 PM,Finance,All the Five bidders qualified in the Technical Evaluation,Manoj Kumar Mahananda,17-May-2024 12:12 PM,finance_396022.pdf,BOQ Comparative Chart,M K Mahananda,Internal,HS Meena SrDAO Rourkela R and B Division P p parida estimator Rourkela R and B Division,Manoj Kumar Mahananda,17-May-2024 12:21 PM,finsummary_396022.pdf (1448.33 KB),EIC-CIVIL||SERNB-CIRCLE-KEONJHAR||EERNB-DIVN-ROURKELA,2022_EICCL_76898_6,BID ID 03 of 2022-23,"Construction of Excise station, Malkhana, Hazat and Boundary wall for Biramitrapur Excise station for the year 2021-22",Technical,All bidder qualified in technical evaluation,Prajna Prajwolita Parida,20-May-2022 10:28 AM,technical_396022.pdf,M K Mahananda SE rourkela r and b division,Internal,BKumar SrDAO Rourkela R and B Division P p parida estimator Rourkela R and B Division,Prajna Prajwolita Parida,20-May-2022 10:30 AM,20-May-2022 10:35 AM,techsummary_396022.pdf (230.85 KB),AOC
,,,,,,,,,,,,,,,,.pdf,"Financial instruments such as cost of tender paper, EMD, Affidavit etc",,,,,,,,,,,,,,,,2.0,ICICI NEFT/RTGS,,,,,,,,,,,,,,,,,,,,,,,,,,AOC,,,,,,,,,,,,,2,1829762,KRUSHNA CHANDRA MALLICK,22-Apr-2022 02:31 PM,Rejected-AOC,Not Qualified in the Lottery,17-May-2024 12:26 PM,,,,,,,,,,,,,,,,,,,,,,,,,,,,,AOC
,,,,,,,,,,,,,,,,.pdf,"Experience Certificate, List of Machinaries,Lease Deeds , MOU with electrical contractor Affidavit e",,,,,,,,,,,,,,,,,,,,,,,,,,,,,,,,,,,,,,,,,,,AOC,,,,,,,,,,,,,3,1829640,M/S GODAVARI CONSTRUCTION,22-Apr-2022 12:18 PM,Accepted-AOC,Qualified in the Lottery,17-May-2024 12:26 PM,,,,,,,,,,,,,,,,,,,,,,,,,,,,,AOC
,,,,,,,,,,,,,,,,.pdf,"No Relation Certificate, Schedule-E, Schedule-F, Affidavit etc",,,,,,,,,,,,,,,,,,,,,,,,,,,,,,,,,,,,,,,,,,,AOC,,,,,,,,,,,,,4,1829796,NARESH KUMAR SETHI,22-Apr-2022 02:53 PM,Rejected-AOC,Not Qualified in the Lottery,17-May-2024 12:26 PM,,,,,,,,,,,,,,,,,,,,,,,,,,,,,AOC
,,,,,,,,,,,,,,2.0,Finance,.xls,BOQ,,,,,,,,,,,,,,,,,,,,,,,,,,,,,,,,,,,,,,,,,,,AOC,,,,,,,,,,,,,5,1828551,Sk Hasib Rahebar,20-Apr-2022 05:01 PM,Rejected-AOC,Not Qualified in the Lottery,17-May-2024 12:26 PM,,,,,,,,,,,,,,,,,,,,,,,,,,,,,AOC
