Organisation Chain,Tender Reference Number,Tender ID,Withdrawal Allowed,Tender Type,Form of contract,Tender Category,No. of Covers,General Technical Evaluation Allowed,ItemWise Technical Evaluation Allowed,Payment Mode,Is Multi Currency Allowed For BOQ,Is Multi Currency Allowed For Fee,Allow Two Stage Bidding,Cover No,Cover,Document Type,Description,Publish Date,Bid Opening Date,Document Download / Sale Start Date,Document Download / Sale End Date,Clarification Start Date,Clarification End Date,Bid Submission Start Date,Bid Submission End Date,EMD Amount in ₹,EMD Exemption Allowed,EMD Fee Type,EMD Percentage,EMD Payable To,EMD Payable At,S.No,Bank Name,Tender Fee in ₹,VAT Charges in ₹,Fee Payable To,Fee Payable At,Tender Fee Exemption Allowed,Name,Address,Title,Work Description,Pre Qualification Details,Independent External Monitor/Remarks,Tender Value in ₹,Product Category,Sub category,Contract Type,Bid Validity(Days),Period Of Work(Days),Location,Pincode,Pre Bid Meeting Place,Pre Bid Meeting Address,Pre Bid Meeting Date,Bid Opening Place,Should Allow NDA Tender,Allow Preferential Bidder,Tender Stage,Contract Date :,Contract Value :,Work Completion Period in days :,Updated By :,Updated on :,AOC document :,AOC Description :,S.No,Bid Number,Bidder Name,Awarded Currency,Awarded Value,S.No.1,Bid Number.1,Bidder Name.1,Submitted Date,Status,Remarks,Status Updated On,Type :,Summary :,Updated By :.1,Updated On :,Document :,BOQ Comparative Chart :,Committee Chairperson/Co-ordinator Name :,Committee Chairperson/Co-ordinator Type :,Committee Members :,Updated By :.2,Updated on :.1,Document :.1,Organisation Chain :,Tender ID :,Tender Ref No :,Tender Title :,Committee Chairperson/Co-ordinator Name :.1,Committee Chairperson/Co-ordinator Type :.1,Committee Members :.1,Updated By :.3,Updated On :.1,Document :.2,Tender Stage
EIC-CIVIL||SERNB-CIRCLE-KEONJHAR||EERNB-DIVN-ROURKELA,BID ID 172 of 2023-24,2024_EICCL_102083_4,Yes,Open Tender,Percentage,Works,1.0,No,No,Online,No,No,No,1.0,Fee/PreQual/Technical/Finance,.pdf,"Registration certificate, Registration in ELBO, PAN Card, GSTIN Certificate, Affidavit etc",06-Mar-2024 01:00 PM,14-Mar-2024 11:00 AM,06-Mar-2024 01:00 PM,13-Mar-2024 05:00 PM,NA ,NA ,06-Mar-2024 01:00 PM,13-Mar-2024 05:00 PM,"11,300",Yes,fixed,,Nil,Nil,1.0,ICICI BANK,"6,000",0.0,Nil,Nil,No,Superintending Engineer Rourkela R and B Division,Office of Superintending Engineer Rourkela R and B division,"Power supply to New Academic Building (Vidya Bhawan) at Govt. Autonomous College , Rourkela","Power supply to New Academic Building (Vidya Bhawan) at Govt. Autonomous College , Rourkela",Please refer tender document ,NA ,"11,23,097",Electrical Works,NA ,Tender,90.0,30.0,Rourkela,769012.0,NA ,NA ,NA ,Office of Superintending Engineer Rourkela R and B,No ,No,AOC,10-May-2024,"INR 954,745",30.0,Manoj Kumar Mahananda,10-May-2024 12:47 PM,workorderAcademicbuilding.pdf (1443.00 KB),Agmt drawn and Work order issued,1.0,2474258.0,POWERTECH ENGINEERING.TAPAS RANJAN PATI,INR,"954,745",1,2476401,M/S SAHOO ENTERPRISES,13-Mar-2024 02:04 PM,Rejected-AOC,Not Qualified in the Lottery,10-May-2024 12:47 PM,Finance,Five Bidders Participated,Manoj Kumar Mahananda,10-May-2024 12:31 PM,finance_497748.pdf,BOQ Comparative Chart,M K Mahananda,Internal,HS Meena SrDAO Rourkela R and B Division P p parida estimator Rourkela R and B Division,Manoj Kumar Mahananda,10-May-2024 12:41 PM,finsummary_497748.pdf (1442.60 KB),EIC-CIVIL||SERNB-CIRCLE-KEONJHAR||EERNB-DIVN-ROURKELA,2024_EICCL_102083_4,BID ID 172 of 2023-24,"Power supply to New Academic Building (Vidya Bhawan) at Govt. Autonomous College , Rourkela",M K Mahananda,Internal,HS Meena SrDAO Rourkela R and B Division P p parida estimator Rourkela R and B Division,Manoj Kumar Mahananda,10-May-2024 12:34 PM,techsummary_497748.pdf (1442.60 KB),AOC
,,,,,,,,,,,,,,,,.pdf,"Financial instruments such as cost of tender paper, EMD, Affidavit etc",,,,,,,,,,,,,,,2.0,ICICI NEFT/RTGS,,,,,,,,,,,,,,,,,,,,,,,,,,AOC,,,,,,,,,,,,,2,2475720,MS SHREEMAA ELECTRICAL CONSTRUCTION,12-Mar-2024 06:51 PM,Rejected-AOC,Not Qualified in the Lottery,10-May-2024 12:47 PM,,,,,,,,,,,,,,,,,,,,,,,AOC
,,,,,,,,,,,,,,,,.pdf,"Experience Certificate, List of Machinaries,Lease Deeds , MOU with electrical contractor Affidavit e",,,,,,,,,,,,,,,,,,,,,,,,,,,,,,,,,,,,,,,,,,AOC,,,,,,,,,,,,,3,2474258,POWERTECH ENGINEERING.TAPAS RANJAN PATI,11-Mar-2024 04:59 PM,Accepted-AOC,Qualified in the Lottery,10-May-2024 12:47 PM,,,,,,,,,,,,,,,,,,,,,,,AOC
,,,,,,,,,,,,,,,,.pdf,"No Relation Certificate, Schedule-E, Schedule-F, Affidavit etc",,,,,,,,,,,,,,,,,,,,,,,,,,,,,,,,,,,,,,,,,,AOC,,,,,,,,,,,,,4,2475748,SARADA TECHNO SERVICES,12-Mar-2024 07:29 PM,Rejected-AOC,Not Qualified in the Lottery,10-May-2024 12:47 PM,,,,,,,,,,,,,,,,,,,,,,,AOC
,,,,,,,,,,,,,,,,.xls,BOQ,,,,,,,,,,,,,,,,,,,,,,,,,,,,,,,,,,,,,,,,,,AOC,,,,,,,,,,,,,5,2474197,UNITED POWER,13-Mar-2024 01:23 PM,Rejected-AOC,Not Qualified in the Lottery,10-May-2024 12:47 PM,,,,,,,,,,,,,,,,,,,,,,,AOC
