Organisation Chain,Tender Reference Number,Tender ID,Withdrawal Allowed,Tender Type,Form of contract,Tender Category,No. of Covers,General Technical Evaluation Allowed,ItemWise Technical Evaluation Allowed,Payment Mode,Is Multi Currency Allowed For BOQ,Is Multi Currency Allowed For Fee,Allow Two Stage Bidding,Cover No,Cover,Document Type,Description,Publish Date,Bid Opening Date,Document Download / Sale Start Date,Document Download / Sale End Date,Clarification Start Date,Clarification End Date,Bid Submission Start Date,Bid Submission End Date,EMD Amount in ₹,EMD Exemption Allowed,EMD Fee Type,EMD Percentage,EMD Payable To,EMD Payable At,S.No,Bank Name,Tender Fee in ₹,VAT Charges in ₹,Fee Payable To,Fee Payable At,Tender Fee Exemption Allowed,Name,Address,Title,Work Description,Pre Qualification Details,Independent External Monitor/Remarks,Tender Value in ₹,Product Category,Sub category,Contract Type,Bid Validity(Days),Period Of Work(Days),Location,Pincode,Pre Bid Meeting Place,Pre Bid Meeting Address,Pre Bid Meeting Date,Bid Opening Place,Should Allow NDA Tender,Allow Preferential Bidder,Tender Stage,Contract Date :,Contract Value :,Work Completion Period in days :,Updated By :,Updated on :,AOC document :,S.No,Bid Number,Bidder Name,Awarded Currency,Awarded Value,S.No.1,Bid Number.1,Bidder Name.1,Submitted Date,Status,Remarks,Status Updated On,Type :,Summary :,Updated By :.1,Updated On :,Document :,BOQ Comparative Chart :,Committee Chairperson/Co-ordinator Name :,Committee Chairperson/Co-ordinator Type :,Committee Members :,Updated By :.2,Updated on :.1,Document :.1,Organisation Chain :,Tender ID :,Tender Ref No :,Tender Title :,Committee Chairperson/Co-ordinator Name :.1,Committee Chairperson/Co-ordinator Type :.1,Committee Members :.1,Updated By :.3,Updated On :.1,Document :.2,Tender Stage
"CE,Minor Irrigation,BBSR||SESMIC-BERHAMPUR||GANJAM I",Online Tender/11/GMID-I/2023-24,2024_CEMIB_101389_20,Yes,Open Tender,Percentage,Works,1.0,No,No,Online,No,No,No,1.0,Fee/PreQual/Technical/Finance,.pdf,"GSTN,PAN,RC,Affidavit for authenticity,Other documents as per DTCN",21-Feb-2024 05:00 PM,28-Feb-2024 05:10 PM,21-Feb-2024 05:00 PM,28-Feb-2024 05:00 PM,NA ,NA ,21-Feb-2024 05:00 PM,28-Feb-2024 05:00 PM,"18,500",Yes,fixed,,Nil,Nil,1.0,ICICI BANK,"6,000",0.0,Nil,Nil,No,"SE, M.I. Division Ganjam-I, Brahmapur","O/O SE, M.I. Division Ganjam-I, Brahmapur, Engg. School Road, Brahmapur.","Imp. to Kumutibandha, Kerikerijhola under the scheme Imp. to Tanks and MIPs in Sheragada block","Imp. to Kumutibandha, Kerikerijhola under the scheme Imp. to Tanks and MIPs in Sheragada block in Ganjam District",Please refer Tender documents. ,NA ,"18,33,000",Civil Works - Others,NA ,Tender,90.0,180.0,Sheragada,761106.0,NA ,NA ,NA ,"O/O SE, M.I. Division Ganjam-I, Brahmapur",No ,No,AOC,23-Jul-2024,"INR 1,557,906.87",180.0,Laxmikanta Tripathy,23-Jul-2024 04:54 PM,12_workorder.pdf (374.00 KB),1.0,2463966.0,Simanchala Sahu,INR,"1,557,906.87",1,2464596,NANDANI MUNI,28-Feb-2024 02:19 PM,Rejected-AOC,looser of transparent lottery,23-Jul-2024 04:54 PM,Finance,5 nos bidder,Laxmikanta Tripathy,23-Jul-2024 04:49 PM,finance_495436.pdf,BOQ Comparative Chart,SE MI DIVISION GM-I,Internal,,Laxmikanta Tripathy,23-Jul-2024 04:51 PM,finsummary_495436.pdf (224.43 KB),"CE,Minor Irrigation,BBSR||SESMIC-BERHAMPUR||GANJAM I",2024_CEMIB_101389_20,Online Tender/11/GMID-I/2023-24,"Imp. to Kumutibandha, Kerikerijhola under the scheme Imp. to Tanks and MIPs in Sheragada block",SE MI DIVISION GM-I,Internal,,Laxmikanta Tripathy,23-Jul-2024 04:49 PM,techsummary_495436.pdf (470.25 KB),AOC
,,,,,,,,,,,,,,,,.xls,BOQ,,,,,,,,,,,,,,,2.0,ICICI NEFT/RTGS,,,,,,,,,,,,,,,,,,,,,,,,,,AOC,,,,,,,,,,,,2,2464170,PANADAB GOUDA,28-Feb-2024 01:20 PM,Rejected-AOC,looser of transparent lottery,23-Jul-2024 04:54 PM,,,,,,,,,,,,,,,,,,,,,,,AOC
,,,,,,,,,,,,,,,,,,,,,,,,,,,,,,,,,,,,,,,,,,,,,,,,,,,,,,,,,,,AOC,,,,,,,,,,,,3,2464307,Sanjaya Kumar Pradhan,28-Feb-2024 12:58 PM,Rejected-AOC,looser of transparent lottery,23-Jul-2024 04:54 PM,,,,,,,,,,,,,,,,,,,,,,,AOC
,,,,,,,,,,,,,,,,,,,,,,,,,,,,,,,,,,,,,,,,,,,,,,,,,,,,,,,,,,,AOC,,,,,,,,,,,,4,2461719,SANJAYA PATRO,27-Feb-2024 10:24 AM,Rejected-AOC,looser of transparent lottery,23-Jul-2024 04:54 PM,,,,,,,,,,,,,,,,,,,,,,,AOC
,,,,,,,,,,,,,,,,,,,,,,,,,,,,,,,,,,,,,,,,,,,,,,,,,,,,,,,,,,,AOC,,,,,,,,,,,,5,2463966,Simanchala Sahu,28-Feb-2024 11:17 AM,Accepted-AOC,Winner of transparent lottery,23-Jul-2024 04:54 PM,,,,,,,,,,,,,,,,,,,,,,,AOC
