Organisation Chain,Tender Reference Number,Tender ID,Withdrawal Allowed,Tender Type,Form of contract,Tender Category,No. of Covers,General Technical Evaluation Allowed,ItemWise Technical Evaluation Allowed,Payment Mode,Is Multi Currency Allowed For BOQ,Is Multi Currency Allowed For Fee,Allow Two Stage Bidding,Cover No,Cover,Document Type,Description,Publish Date,Bid Opening Date,Document Download / Sale Start Date,Document Download / Sale End Date,Clarification Start Date,Clarification End Date,Bid Submission Start Date,Bid Submission End Date,EMD Amount in ₹,EMD Exemption Allowed,EMD Fee Type,EMD Percentage,EMD Payable To,EMD Payable At,S.No,Bank Name,Tender Fee in ₹,VAT Charges in ₹,Fee Payable To,Fee Payable At,Tender Fee Exemption Allowed,Name,Address,Title,Work Description,Pre Qualification Details,Independent External Monitor/Remarks,Tender Value in ₹,Product Category,Sub category,Contract Type,Bid Validity(Days),Period Of Work(Days),Location,Pincode,Pre Bid Meeting Place,Pre Bid Meeting Address,Pre Bid Meeting Date,Bid Opening Place,Should Allow NDA Tender,Allow Preferential Bidder,Tender Stage,Contract Date :,Contract Value :,Work Completion Period in days :,Updated By :,Updated on :,AOC document :,AOC Description :,S.No,Bid Number,Bidder Name,Awarded Currency,Awarded Value,S.No.1,Bid Number.1,Bidder Name.1,Submitted Date,Status,Remarks,Status Updated On,Type :,Summary :,Updated By :.1,Updated On :,Document :,BOQ Comparative Chart :,Committee Chairperson/Co-ordinator Name :,Committee Chairperson/Co-ordinator Type :,Committee Members :,Updated By :.2,Updated on :.1,Document :.1,Organisation Chain :,Tender ID :,Tender Ref No :,Tender Title :,Committee Chairperson/Co-ordinator Name :.1,Committee Chairperson/Co-ordinator Type :.1,Committee Members :.1,Updated By :.3,Updated On :.1,Document :.2,Tender Stage
Orissa Lift Irrigation Corporation||LI Western Circle Bhawanipatna||LI Division Bolangir,OLIC-BLGR-07/2023-24,2024_OLIC_102451_58,Yes,Open Tender,Percentage,Works,1.0,No,No,Online,No,No,No,1.0,Fee/PreQual/Technical/Finance,.pdf,"RC, PAN, GSTIN, AFFIDAVIT, EMD, PAPER COST, NO RELATION CERTIFICATE AND OTHER DOCUMENTS AS PER DTCN",12-Mar-2024 11:00 AM,20-Mar-2024 11:00 AM,12-Mar-2024 11:00 AM,19-Mar-2024 05:00 PM,12-Mar-2024 11:00 AM ,18-Mar-2024 05:00 PM ,12-Mar-2024 11:00 AM,19-Mar-2024 05:00 PM,"31,287",Yes,percentage,1.0%,Nil,Nil,1.0,ICICI BANK,"6,000",0.0,Nil,Nil,No,"Executive Engineer, L.I. Division, Balangir","O/o. Executive Engineer, L.I. Division, Balangir",Installation and energisation of Pudapali-III L.I.Project under Muribahal Block (BKVY RIDF-XXIX),Installation and energisation of Pudapali-III L.I.Project under Muribahal Block (BKVY RIDF-XXIX),Please refer Tender documents. ,NA ,"31,28,734",Civil Works - Lift Irrigation Schemes,NA ,Tender,90.0,120.0,Balangir,767001.0,NA ,NA ,NA ,"O/o. Executive Engineer, L.I. Division, Balangir",No ,No,AOC,27-Jul-2024,"INR 3,128,734.02",120.0,Satchidananda Dalai,27-Jul-2024 11:52 AM,58.pdf (858.00 KB),Success on Lottery System,1.0,2479259.0,NILESH KUMAR JAIN,INR,"2,659,737",1,2480780,Ankit Sharma,19-Mar-2024 12:50 PM,Rejected-Finance,1st Lowest Bidder,27-Jul-2024 11:47 AM,Finance,5 Nos. Bidders Opened,AMRUTA KUMAR BAGH,13-May-2024 07:32 AM,finance_499366.pdf,BOQ Comparative Chart,EE,Internal,,Satchidananda Dalai,27-Jul-2024 11:47 AM,finsummary_499366.pdf (316.01 KB),Orissa Lift Irrigation Corporation||LI Western Circle Bhawanipatna||LI Division Bolangir,2024_OLIC_102451_58,OLIC-BLGR-07/2023-24,Installation and energisation of Pudapali-III L.I.Project under Muribahal Block (BKVY RIDF-XXIX),EE,Internal,EE and others,Satchidananda Dalai,27-Jul-2024 10:48 AM,techsummary_499366.pdf (316.01 KB),AOC
,,,,,,,,,,,,,,,,.xls,Bill of Quantity,,,,,,,,,,,,,,,2.0,ICICI NEFT/RTGS,,,,,,,,,,,,,,,,,,,,,,,,,,AOC,,,,,,,,,,,,,2,2479187,BANCHHA SETH,17-Mar-2024 12:00 PM,Rejected-Finance,2ns Lowest Bidder,27-Jul-2024 11:47 AM,,,,,,,,,,,,,,,,,,,,,,,AOC
,,,,,,,,,,,,,,,,,,,,,,,,,,,,,,,,,,,,,,,,,,,,,,,,,,,,,,,,,,,AOC,,,,,,,,,,,,,3,2480734,BIJAYA KUMAR JAIN,19-Mar-2024 02:39 PM,Rejected-Finance,1st Lowest Bidder,27-Jul-2024 11:47 AM,,,,,,,,,,,,,,,,,,,,,,,AOC
,,,,,,,,,,,,,,,,,,,,,,,,,,,,,,,,,,,,,,,,,,,,,,,,,,,,,,,,,,,AOC,,,,,,,,,,,,,4,2479085,MS Shree Shyam and Co,18-Mar-2024 11:46 AM,Rejected-Finance,1st Lowest Bidder,27-Jul-2024 11:47 AM,,,,,,,,,,,,,,,,,,,,,,,AOC
,,,,,,,,,,,,,,,,,,,,,,,,,,,,,,,,,,,,,,,,,,,,,,,,,,,,,,,,,,,AOC,,,,,,,,,,,,,5,2479259,NILESH KUMAR JAIN,19-Mar-2024 11:30 AM,Accepted-AOC,Success on Lottery System,27-Jul-2024 11:54 AM,,,,,,,,,,,,,,,,,,,,,,,AOC
