Organisation Chain,Tender Reference Number,Tender ID,Withdrawal Allowed,Tender Type,Form of contract,Tender Category,No. of Covers,General Technical Evaluation Allowed,ItemWise Technical Evaluation Allowed,Payment Mode,Is Multi Currency Allowed For BOQ,Is Multi Currency Allowed For Fee,Allow Two Stage Bidding,Cover No,Cover,Document Type,Description,Publish Date,Bid Opening Date,Document Download / Sale Start Date,Document Download / Sale End Date,Clarification Start Date,Clarification End Date,Bid Submission Start Date,Bid Submission End Date,EMD Amount in ₹,EMD Exemption Allowed,EMD Fee Type,EMD Percentage,EMD Payable To,EMD Payable At,S.No,Corrigendum Title,Corrigendum Type,View,S.No.1,Bank Name,Tender Fee in ₹,VAT Charges in ₹,Fee Payable To,Fee Payable At,Tender Fee Exemption Allowed,Name,Address,Title,Work Description,Pre Qualification Details,Independent External Monitor/Remarks,Tender Value in ₹,Product Category,Sub category,Contract Type,Bid Validity(Days),Period Of Work(Days),Location,Pincode,Pre Bid Meeting Place,Pre Bid Meeting Address,Pre Bid Meeting Date,Bid Opening Place,Should Allow NDA Tender,Allow Preferential Bidder,Tender Stage,Contract Date :,Contract Value :,Work Completion Period in days :,Updated By :,Updated on :,AOC document :,AOC Description :,S.No,Bid Number,Bidder Name,Awarded Currency,Awarded Value,S.No.1,Bid Number.1,Bidder Name.1,Submitted Date,Status,Remarks,Status Updated On,Type :,Summary :,Updated By :.1,Updated On :,Document :,BOQ Comparative Chart :,Committee Chairperson/Co-ordinator Name :,Committee Chairperson/Co-ordinator Type :,Committee Members :,Updated By :.2,Updated on :.1,Document :.1,Organisation Chain :,Tender ID :,Tender Ref No :,Tender Title :,Committee Chairperson/Co-ordinator Name :.1,Committee Chairperson/Co-ordinator Type :.1,Committee Members :.1,Updated By :.3,Updated On :.1,Document :.2,Tender Stage
Orissa Lift Irrigation Corporation||LI KORAPUT||LI Division Gunupur,04/2023-24,2023_OLIC_96764_59,Yes,Open Tender,Percentage,Works,1.0,No,No,Online,No,No,No,1.0,Fee/PreQual/Technical/Finance,.pdf,DTCN,16-Nov-2023 10:00 AM,24-Nov-2023 03:00 PM,16-Nov-2023 10:00 AM,23-Nov-2023 05:30 PM,16-Nov-2023 10:00 AM ,22-Nov-2023 05:30 PM ,16-Nov-2023 10:00 AM,23-Nov-2023 05:30 PM,"26,324",Yes,percentage,1.0%,Nil,Nil,1.0,The Block of Nuagaon_III RL read as Kashipur instead of K_Singpur,Other,,1.0,ICICI BANK,"6,000",0.0,Nil,Nil,No,"Executive Enginer, L.I. Division, Gunupur","Executive Enginer, L.I. Division, Gunupur",Installation and energisation of Nuagaon_III RL under K_Singpur Block of Rayagada District,Installation and energisation of Nuagaon_III RL under K_Singpur Block of Rayagada District,Please refer Tender documents. ,NA ,"26,32,386",Civil Works - Lift Irrigation Schemes,NA ,Tender,90.0,90.0,"Executive Enginer, L.I. Division, Gunupur",765022.0,NA ,NA ,NA ,"Executive Enginer, L.I. Division, Gunupur",No ,No,AOC,14-Jul-2024,"INR 2,792,488",90.0,BINOD CHANDRA DASH,14-Jul-2024 10:34 AM,Nuagaon_III.pdf (1403.00 KB),Agreement made successfully.,1.0,2325304.0,BHRAMARLAL SAHU,INR,"2,792,488",1,2331144,BADAL PATTNAIK,23-Nov-2023 03:30 PM,Rejected-Technical,"Unsuccessful tender. Hence, the tender bid rejected",20-Apr-2024 04:15 PM,Finance,"Tender bid accepted. Hence, the bid successfully opened.",BINOD CHANDRA DASH,27-Nov-2023 08:16 AM,finance_472509.pdf,BOQ Comparative Chart,"Executive Engineer, L.I. Division, Gunupur.",Internal,"Assistant Executive Engineer (Estr.), Divisional Accountant, L.I. Division, Gunupur.",BINOD CHANDRA DASH,14-Jul-2024 09:28 AM,finsummary_472509.pdf (304.71 KB),Orissa Lift Irrigation Corporation||LI KORAPUT||LI Division Gunupur,2023_OLIC_96764_59,04/2023-24,Installation and energisation of Nuagaon_III RL under K_Singpur Block of Rayagada District,"Executive Engineer, L.I. Division, Gunupur",Internal,"Assistant Executive Engineer (Estr.), L.I. Division, Gunupur and Divisional Accountant, L.I. Division, Gunupur",BINOD CHANDRA DASH,20-Apr-2024 04:15 PM,techsummary_472509.pdf (304.71 KB),AOC
,,,,,,,,,,,,,,,,.pdf,NIT,,,,,,,,,,,,,,,,,,,2.0,ICICI NEFT/RTGS,,,,,,,,,,,,,,,,,,,,,,,,,,AOC,,,,,,,,,,,,,2,2325304,BHRAMARLAL SAHU,21-Nov-2023 12:31 PM,Accepted-AOC,Tender bid accepted,14-Jul-2024 10:34 AM,,,,,,,,,,,,,,,,,,,,,,,AOC
,,,,,,,,,,,,,,,,.xls,BOQ,,,,,,,,,,,,,,,,,,,,,,,,,,,,,,,,,,,,,,,,,,,,,,AOC,,,,,,,,,,,,,3,2327771,KUMAR MAJHI,22-Nov-2023 07:43 PM,Rejected-Technical,"Unsuccessful tender. Hence, the tender bid rejected",20-Apr-2024 04:15 PM,,,,,,,,,,,,,,,,,,,,,,,AOC
,,,,,,,,,,,,,,,,,,,,,,,,,,,,,,,,,,,,,,,,,,,,,,,,,,,,,,,,,,,,,,,AOC,,,,,,,,,,,,,4,2321605,M/S SHANTI POWER AND CONSTRUCTION,23-Nov-2023 01:17 PM,Rejected-Technical,"Unsuccessful tender. Hence, the tender bid rejected",20-Apr-2024 04:15 PM,,,,,,,,,,,,,,,,,,,,,,,AOC
,,,,,,,,,,,,,,,,,,,,,,,,,,,,,,,,,,,,,,,,,,,,,,,,,,,,,,,,,,,,,,,AOC,,,,,,,,,,,,,5,2330869,SUDARSHAN HIKAKA,23-Nov-2023 02:00 PM,Rejected-Technical,"Unsuccessful tender. Hence, the tender bid rejected",20-Apr-2024 04:15 PM,,,,,,,,,,,,,,,,,,,,,,,AOC
