Organisation Chain,Tender Reference Number,Tender ID,Withdrawal Allowed,Tender Type,Form of contract,Tender Category,No. of Covers,General Technical Evaluation Allowed,ItemWise Technical Evaluation Allowed,Payment Mode,Is Multi Currency Allowed For BOQ,Is Multi Currency Allowed For Fee,Allow Two Stage Bidding,Cover No,Cover,Document Type,Description,Publish Date,Bid Opening Date,Document Download / Sale Start Date,Document Download / Sale End Date,Clarification Start Date,Clarification End Date,Bid Submission Start Date,Bid Submission End Date,Financial Bid Opening Date,EMD Amount in ₹,EMD Exemption Allowed,EMD Fee Type,EMD Percentage,EMD Payable To,EMD Payable At,S.No,Bank Name,Tender Fee in ₹,VAT Charges in ₹,Fee Payable To,Fee Payable At,Tender Fee Exemption Allowed,Name,Address,Title,Work Description,Pre Qualification Details,Independent External Monitor/Remarks,Tender Value in ₹,Product Category,Sub category,Contract Type,Bid Validity(Days),Period Of Work(Days),Location,Pincode,Pre Bid Meeting Place,Pre Bid Meeting Address,Pre Bid Meeting Date,Bid Opening Place,Should Allow NDA Tender,Allow Preferential Bidder,Tender Stage,Contract Date :,Contract Value :,Work Completion Period in days :,Updated By :,Updated on :,AOC document :,S.No,Bid Number,Bidder Name,Awarded Currency,Awarded Value,S.No.1,Bid Number.1,Bidder Name.1,Submitted Date,Status,Remarks,Status Updated On,Type :,Summary :,Updated By :.1,Updated On :,Document :,BOQ Comparative Chart :,Committee Chairperson/Co-ordinator Name :,Committee Chairperson/Co-ordinator Type :,Committee Members :,Updated By :.2,Updated on :.1,Document :.1,Organisation Chain :,Tender ID :,Tender Ref No :,Tender Title :,Type :.1,Summary :.1,Updated By :.3,Updated On :.1,Document :.2,Committee Chairperson/Co-ordinator Name :.1,Committee Chairperson/Co-ordinator Type :.1,Committee Members :.1,Updated By :.4,Updated On :.2,Financial Bid Opening Date:,Document :.3,Tender Stage
CE RW I||RW-CIRCLE-SUNDARGARH,RWCCESNG- 51 Of 2023-24,2024_CERWI_100506_2,Yes,National Competitive Bid,Percentage,Works,2.0,No,No,Online,No,No,No,1.0,Fee/PreQual/Technical,.pdf,"Registration certificate,GSTIN,PAN,Affidavits etc",03-Feb-2024 09:00 AM,15-Feb-2024 11:00 AM,03-Feb-2024 09:00 AM,13-Feb-2024 05:00 PM,03-Feb-2024 09:00 AM ,12-Feb-2024 05:00 PM ,03-Feb-2024 09:00 AM,13-Feb-2024 05:00 PM,26-Feb-2024 11:00 AM,"1,33,329",Yes,percentage,1.0%,Nil,Nil,1.0,ICICI BANK,"10,000",0.0,Nil,Nil,No,"C.C.E.,R.W. Circle ,Sundargarh","Office of the C.C.E.,R.W. Circle ,Sundargarh",Construction of CC road from Hudkudihi village to Dharuadihi village under Babuchipidihi GP of Laikera Block under DMF Scheme in the Dist. of Jharsuguda for the year 2023-24.,Construction of CC road from Hudkudihi village to Dharuadihi village under Babuchipidihi GP of Laikera Block under DMF Scheme in the Dist. of Jharsuguda for the year 2023-24.,Please refer Tender documents. ,NA ,"1,33,32,915",Civil Works - Roads,NA ,Tender,90.0,180.0,Jharsuguda,768203.0,NA ,NA ,NA ,"Office of the C.C.E.,R.W. Circle ,Sundargarh",No ,No,AOC,18-Jul-2024,"INR 13,332,914.57",180.0,Biswanath Sethy,18-Jul-2024 01:57 PM,1252.pdf (992.00 KB),1.0,2438121.0,PRAHALLAD MAJHI,INR,"11,334,310.68",1,2438471,AMAN BADHAN,13-Feb-2024 04:00 PM,Rejected-AOC,Unsuccessful bidder,18-Jul-2024 01:57 PM,Finance,Six nos of bidder only.,Biswanath Sethy,26-Feb-2024 01:46 PM,finance_489456.pdf,BOQ Comparative Chart,B.Sethy,Internal,,Biswanath Sethy,18-Jul-2024 01:53 PM,finsummary_489456.pdf (22.30 KB),CE RW I||RW-CIRCLE-SUNDARGARH,2024_CERWI_100506_2,RWCCESNG- 51 Of 2023-24,Construction of CC road from Hudkudihi village to Dharuadihi village under Babuchipidihi GP of Laikera Block under DMF Scheme in the Dist. of Jharsuguda for the year 2023-24.,Technical,7 Nos. of Bidders,Biswanath Sethy,15-Feb-2024 05:54 PM,,B.Sethy,Internal,,Biswanath Sethy,21-Feb-2024 08:28 PM,26-Feb-2024 11:00 AM,techsummary_489456.pdf (301.04 KB),AOC
,,,,,,,,,,,,,,,,.pdf,"Annual turnover, work experience, machinaries and other documents as per DTCN.",,,,,,,,,,,,,,,,2.0,ICICI NEFT/RTGS,,,,,,,,,,,,,,,,,,,,,,,,,,AOC,,,,,,,,,,,,2,2438012,BIJAY KUMAR AGARWAL,13-Feb-2024 01:12 PM,Rejected-AOC,Unsuccessful bidder,18-Jul-2024 01:57 PM,,,,,,,,,,,,,,,,,,,,,,,,,,,,,AOC
,,,,,,,,,,,,,,2.0,Finance,.xls,BOQ,,,,,,,,,,,,,,,,,,,,,,,,,,,,,,,,,,,,,,,,,,,AOC,,,,,,,,,,,,3,2438086,BIJAY KUMAR JENA,13-Feb-2024 01:32 PM,Rejected-Technical,Inadequate of similar nature of work,21-Feb-2024 08:28 PM,,,,,,,,,,,,,,,,,,,,,,,,,,,,,AOC
,,,,,,,,,,,,,,,,,,,,,,,,,,,,,,,,,,,,,,,,,,,,,,,,,,,,,,,,,,,,AOC,,,,,,,,,,,,4,2434316,JIBAN BUDULA,12-Feb-2024 12:38 AM,Rejected-Finance,Not Qualified,18-Jul-2024 01:53 PM,,,,,,,,,,,,,,,,,,,,,,,,,,,,,AOC
,,,,,,,,,,,,,,,,,,,,,,,,,,,,,,,,,,,,,,,,,,,,,,,,,,,,,,,,,,,,AOC,,,,,,,,,,,,5,2438413,JIBAN JYOTI PARIDA,13-Feb-2024 04:51 PM,Rejected-Finance,Not Qualified,18-Jul-2024 01:53 PM,,,,,,,,,,,,,,,,,,,,,,,,,,,,,AOC
,,,,,,,,,,,,,,,,,,,,,,,,,,,,,,,,,,,,,,,,,,,,,,,,,,,,,,,,,,,,AOC,,,,,,,,,,,,6,2438187,MS SHREE SHARDA CONSTRUCTIONS,13-Feb-2024 03:14 PM,Rejected-AOC,Unsuccessful bidder,18-Jul-2024 01:57 PM,,,,,,,,,,,,,,,,,,,,,,,,,,,,,AOC
,,,,,,,,,,,,,,,,,,,,,,,,,,,,,,,,,,,,,,,,,,,,,,,,,,,,,,,,,,,,AOC,,,,,,,,,,,,7,2438121,PRAHALLAD MAJHI,13-Feb-2024 01:40 PM,Accepted-AOC,Successful bidder by lottery,18-Jul-2024 01:57 PM,,,,,,,,,,,,,,,,,,,,,,,,,,,,,AOC
