Organisation Chain,Tender Reference Number,Tender ID,Withdrawal Allowed,Tender Type,Form of contract,Tender Category,No. of Covers,General Technical Evaluation Allowed,ItemWise Technical Evaluation Allowed,Payment Mode,Is Multi Currency Allowed For BOQ,Is Multi Currency Allowed For Fee,Allow Two Stage Bidding,Cover No,Cover,Document Type,Description,Publish Date,Bid Opening Date,Document Download / Sale Start Date,Document Download / Sale End Date,Clarification Start Date,Clarification End Date,Bid Submission Start Date,Bid Submission End Date,Financial Bid Opening Date,EMD Amount in ₹,EMD Exemption Allowed,EMD Fee Type,EMD Percentage,EMD Payable To,EMD Payable At,S.No,Corrigendum Title,Corrigendum Type,View,S.No.1,Bank Name,Tender Fee in ₹,VAT Charges in ₹,Fee Payable To,Fee Payable At,Tender Fee Exemption Allowed,Name,Address,Title,Work Description,Pre Qualification Details,Independent External Monitor/Remarks,Tender Value in ₹,Product Category,Sub category,Contract Type,Bid Validity(Days),Period Of Work(Days),Location,Pincode,Pre Bid Meeting Place,Pre Bid Meeting Address,Pre Bid Meeting Date,Bid Opening Place,Should Allow NDA Tender,Allow Preferential Bidder,Tender Stage,Contract Date :,Contract Value :,Work Completion Period in days :,Updated By :,Updated on :,AOC document :,AOC Description :,S.No,Bid Number,Bidder Name,Awarded Currency,Awarded Value,S.No.1,Bid Number.1,Bidder Name.1,Submitted Date,Status,Remarks,Status Updated On,Type :,Summary :,Updated By :.1,Updated On :,Document :,BOQ Comparative Chart :,Committee Chairperson/Co-ordinator Name :,Committee Chairperson/Co-ordinator Type :,Committee Members :,Updated By :.2,Updated on :.1,Document :.1,Organisation Chain :,Tender ID :,Tender Ref No :,Tender Title :,Type :.1,Summary :.1,Updated By :.3,Updated On :.1,Document :.2,Committee Chairperson/Co-ordinator Name :.1,Committee Chairperson/Co-ordinator Type :.1,Committee Members :.1,Updated By :.4,Updated On :.2,Financial Bid Opening Date:,Document :.3,Tender Stage
"Orissa Lift Irrigation Corporation||LI,Central Circle, Cuttack||LI Division Jajpur Road",4557_06_08_09_2023,2023_OLIC_94538_26,Yes,Open Tender,Percentage,Works,2.0,No,No,Online,No,No,No,1.0,Fee/PreQual/Technical,.pdf,"Pepercost,EMD,Affidavit,RC,PAN,GST,GSTR3Bor1A,Jointventure,HTlicense",18-Sep-2023 10:00 AM,27-Sep-2023 11:00 AM,18-Sep-2023 10:00 AM,26-Sep-2023 05:00 PM,18-Sep-2023 10:00 AM ,25-Sep-2023 05:00 PM ,18-Sep-2023 10:00 AM,26-Sep-2023 05:00 PM,01-Dec-2023 10:20 AM,"29,657",Yes,percentage,1.0%,Nil,Nil,1.0,Correction on DTCN due to Printing Mistakes,Other,,1.0,ICICI BANK,"6,000",0.0,Nil,Nil,No,"Executive Engineer,L.I.Division, Jajpur Road","Executive Engineer,L.I.Division, Jajpur Road",Pkg26,Revival and restoration of Baliposi and Kantira I RLProjects,Please refer to the Tender Documents ,NA ,"29,65,677",Civil Works - Lift Irrigation Schemes,Electrical Works ,Tender,180.0,60.0,Jajpur Road,755019.0,NA ,NA ,NA ,"O/o Executive Engineer,L.I.Division, Jajpur Road",No ,No,AOC,26-Dec-2023,"INR 2,974,924",60.0,AJAYA KUMAR MISHRA,04-Jul-2024 01:23 PM,PKG26.pdf (6136.00 KB),Work order for revival and restoration of Baliposi RL and kantara I RL project under sukinda block out of State plan 2023-24,1.0,2270789.0,ANUP ANURAG SATYAPRAKASH BHUYAN,INR,"2,974,924",1,2270789,ANUP ANURAG SATYAPRAKASH BHUYAN,25-Sep-2023 07:38 PM,Accepted-AOC,Executed the Agreement,04-Jul-2024 01:23 PM,Finance,Opened successfully,BHANJA KISHOR PRADHAN,01-Dec-2023 03:42 PM,finance_462651.pdf,BOQ Comparative Chart,Ajaya Kumar Mishra,Internal,Bhanja Kishor Pradhan and Lakshmi Narayan Das,AJAYA KUMAR MISHRA,20-Dec-2023 12:52 PM,finsummary_462651.pdf (200.27 KB),"Orissa Lift Irrigation Corporation||LI,Central Circle, Cuttack||LI Division Jajpur Road",2023_OLIC_94538_26,4557_06_08_09_2023,Pkg26,Technical,Opened Successfully,AJAYA KUMAR MISHRA,04-Oct-2023 10:55 AM,technical_462651.pdf,Ajaya Kumar Mishra,Internal,Bhanja Kishor Pradhan and Lakshmi Narayan Das,AJAYA KUMAR MISHRA,01-Dec-2023 10:17 AM,01-Dec-2023 10:20 AM,techsummary_462651.pdf (265.24 KB),AOC
,,,,,,,,,,,,,,,,.pdf,DTCN Documents,,,,,,,,,,,,,,,,,,,,2.0,ICICI NEFT/RTGS,,,,,,,,,,,,,,,,,,,,,,,,,,AOC,,,,,,,,,,,,,2,2272071,AVIRAM DAS,26-Sep-2023 04:58 PM,Rejected-Finance,Being L1 accept the Bid,20-Dec-2023 12:51 PM,,,,,,,,,,,,,,,,,,,,,,,,,,,,,AOC
,,,,,,,,,,,,,,2.0,Finance,.xls,Bills of Quantirty,,,,,,,,,,,,,,,,,,,,,,,,,,,,,,,,,,,,,,,,,,,,,,,AOC,,,,,,,,,,,,,3,2268916,GIRISH DWIBEDY,24-Sep-2023 10:14 PM,Rejected-Finance,Loss of the Lottery,20-Dec-2023 12:51 PM,,,,,,,,,,,,,,,,,,,,,,,,,,,,,AOC
,,,,,,,,,,,,,,,,,,,,,,,,,,,,,,,,,,,,,,,,,,,,,,,,,,,,,,,,,,,,,,,,AOC,,,,,,,,,,,,,4,2268618,ICON BUILDERS,24-Sep-2023 07:17 PM,Rejected-Finance,Loss of the Lottery,20-Dec-2023 12:51 PM,,,,,,,,,,,,,,,,,,,,,,,,,,,,,AOC
,,,,,,,,,,,,,,,,,,,,,,,,,,,,,,,,,,,,,,,,,,,,,,,,,,,,,,,,,,,,,,,,AOC,,,,,,,,,,,,,5,2270806,RANJAN KUMAR PANDA,25-Sep-2023 09:02 PM,Rejected-Finance,Loss of the Lottery,20-Dec-2023 12:51 PM,,,,,,,,,,,,,,,,,,,,,,,,,,,,,AOC
,,,,,,,,,,,,,,,,,,,,,,,,,,,,,,,,,,,,,,,,,,,,,,,,,,,,,,,,,,,,,,,,AOC,,,,,,,,,,,,,6,2271129,VISHNU ENTERPRISE PROP. SHAKTI PRASAD SWAIN,26-Sep-2023 07:52 AM,Rejected-Finance,Loss of the Lottery,20-Dec-2023 12:51 PM,,,,,,,,,,,,,,,,,,,,,,,,,,,,,AOC
