Organisation Chain,Tender Reference Number,Tender ID,Withdrawal Allowed,Tender Type,Form of contract,Tender Category,No. of Covers,General Technical Evaluation Allowed,ItemWise Technical Evaluation Allowed,Payment Mode,Is Multi Currency Allowed For BOQ,Is Multi Currency Allowed For Fee,Allow Two Stage Bidding,Cover No,Cover,Document Type,Description,Publish Date,Bid Opening Date,Document Download / Sale Start Date,Document Download / Sale End Date,Clarification Start Date,Clarification End Date,Bid Submission Start Date,Bid Submission End Date,Financial Bid Opening Date,EMD Amount in ₹,EMD Exemption Allowed,EMD Fee Type,EMD Percentage,EMD Payable To,EMD Payable At,S.No,Bank Name,Tender Fee in ₹,VAT Charges in ₹,Fee Payable To,Fee Payable At,Tender Fee Exemption Allowed,Name,Address,Title,Work Description,Pre Qualification Details,Independent External Monitor/Remarks,Tender Value in ₹,Product Category,Sub category,Contract Type,Bid Validity(Days),Period Of Work(Days),Location,Pincode,Pre Bid Meeting Place,Pre Bid Meeting Address,Pre Bid Meeting Date,Bid Opening Place,Should Allow NDA Tender,Allow Preferential Bidder,Tender Stage,Contract Date :,Contract Value :,Work Completion Period in days :,Updated By :,Updated on :,AOC document :,AOC Description :,S.No,Bid Number,Bidder Name,Awarded Currency,Awarded Value,S.No.1,Bid Number.1,Bidder Name.1,Submitted Date,Status,Remarks,Status Updated On,Type :,Summary :,Updated By :.1,Updated On :,Document :,BOQ Comparative Chart :,Committee Chairperson/Co-ordinator Name :,Committee Chairperson/Co-ordinator Type :,Committee Members :,Updated By :.2,Updated on :.1,Document :.1,Organisation Chain :,Tender ID :,Tender Ref No :,Tender Title :,Type :.1,Summary :.1,Updated By :.3,Updated On :.1,Document :.2,Committee Chairperson/Co-ordinator Name :.1,Committee Chairperson/Co-ordinator Type :.1,Committee Members :.1,Updated By :.4,Updated On :.2,Financial Bid Opening Date:,Document :.3,Tender Stage
"Orissa Lift Irrigation Corporation||LI,Central Circle, Cuttack||LI,Division, Bhubaneswar",BID NO-1313/2023-24 DT.02.03.2024,2024_OLIC_102491_7,Yes,Open Tender,Percentage,Works,2.0,No,No,Online,No,No,No,1.0,Fee/PreQual/Technical,.pdf,"TENDER PAPER COST, EMD AND ALL OTHER DOCUMENTS AS PER DTCN",13-Mar-2024 10:00 AM,22-Mar-2024 11:00 AM,13-Mar-2024 10:00 AM,21-Mar-2024 05:00 PM,13-Mar-2024 10:00 AM ,20-Mar-2024 05:00 PM ,13-Mar-2024 10:00 AM,21-Mar-2024 05:00 PM,05-Jun-2024 06:15 PM,"97,303",Yes,percentage,1.0%,Nil,Nil,1.0,ICICI BANK,"10,000",0.0,Nil,Nil,Yes,EE LI DIVISION BHUBANESWAR,EE LI DIVISION BHUBANESWAR,INSTALLATION AND ENERGISATION OF KRUSHNASARANPUR-II AND III LIP IN BRAHMAGIRI BLOCK OF PURI DISTRICT UNDER BKVY XXIX 2023-24,INSTALLATION AND ENERGISATION OF KRUSHNASARANPUR-II AND III LIP IN BRAHMAGIRI BLOCK OF PURI DISTRICT UNDER BKVY XXIX 2023-24,PLEASE REFER TENDER DOCUMENTS ,NA ,"97,30,332",Civil Works - Lift Irrigation Schemes,NA ,Tender,120.0,120.0,BRAHMAGIRI,752001.0,NA ,NA ,NA ,EE L I DIVISION BHUBANESWAR,No ,No,AOC,25-Jul-2024,"INR 9,244,788",90.0,SUJIT KUMAR MOHANTY,25-Jul-2024 04:12 PM,Krushnasaranpur.pdf (1542.00 KB),Work order and agreement Completed,1.0,2479962.0,MAMATA ACHARYA,INR,"9,244,788",1,2483423,BIKRAM KESHARI PATTANAIK,21-Mar-2024 02:54 PM,Rejected-Finance,Rejected,25-Jul-2024 04:10 PM,Finance,TENDER OPENED,SUJIT KUMAR MOHANTY,05-Jun-2024 07:42 PM,finance_499490.pdf,BOQ Comparative Chart,Sujit Kumar Mohanty,Internal,"EE,DA,ESTR",SUJIT KUMAR MOHANTY,25-Jul-2024 04:10 PM,finsummary_499490.pdf (1541.84 KB),"Orissa Lift Irrigation Corporation||LI,Central Circle, Cuttack||LI,Division, Bhubaneswar",2024_OLIC_102491_7,BID NO-1313/2023-24 DT.02.03.2024,INSTALLATION AND ENERGISATION OF KRUSHNASARANPUR-II AND III LIP IN BRAHMAGIRI BLOCK OF PURI DISTRICT UNDER BKVY XXIX 2023-24,Technical,TECHNICAL TENDER OPENED,SUJIT KUMAR MOHANTY,22-Mar-2024 05:41 PM,technical_499490.pdf,Sujit Kumar Mohanty,Internal,"ESTR,A.E(C),DA",SUJIT KUMAR MOHANTY,05-Jun-2024 06:04 PM,05-Jun-2024 06:15 PM,techsummary_499490.pdf (2000.66 KB),AOC
,,,,,,,,,,,,,,2.0,Finance,.xls,BOQ,,,,,,,,,,,,,,,,2.0,ICICI NEFT/RTGS,,,,,,,,,,,,,,,,,,,,,,,,,,AOC,,,,,,,,,,,,,2,2482998,GITANJALI SARANGI PROPRIETOR- GITANJALI ENTERPRISES,20-Mar-2024 11:26 PM,Rejected-Finance,Rejected,25-Jul-2024 04:10 PM,,,,,,,,,,,,,,,,,,,,,,,,,,,,,AOC
,,,,,,,,,,,,,,,,,,,,,,,,,,,,,,,,,,,,,,,,,,,,,,,,,,,,,,,,,,,,AOC,,,,,,,,,,,,,3,2479962,MAMATA ACHARYA,21-Mar-2024 12:02 PM,Accepted-AOC,Work order and agreement Completed,25-Jul-2024 04:13 PM,,,,,,,,,,,,,,,,,,,,,,,,,,,,,AOC
,,,,,,,,,,,,,,,,,,,,,,,,,,,,,,,,,,,,,,,,,,,,,,,,,,,,,,,,,,,,AOC,,,,,,,,,,,,,4,2482770,M/S DILIP KUMAR SAHOO,20-Mar-2024 07:46 PM,Rejected-Finance,Rejected,25-Jul-2024 04:10 PM,,,,,,,,,,,,,,,,,,,,,,,,,,,,,AOC
,,,,,,,,,,,,,,,,,,,,,,,,,,,,,,,,,,,,,,,,,,,,,,,,,,,,,,,,,,,,AOC,,,,,,,,,,,,,5,2480579,M/S. M.C.C. ASSOCIATES,21-Mar-2024 03:15 PM,Rejected-Finance,Rejected,25-Jul-2024 04:10 PM,,,,,,,,,,,,,,,,,,,,,,,,,,,,,AOC
,,,,,,,,,,,,,,,,,,,,,,,,,,,,,,,,,,,,,,,,,,,,,,,,,,,,,,,,,,,,AOC,,,,,,,,,,,,,6,2482645,M/s SHIVOM ELECTRICALS AND ENGINEERING,20-Mar-2024 11:45 PM,Rejected-Finance,Rejected,25-Jul-2024 04:10 PM,,,,,,,,,,,,,,,,,,,,,,,,,,,,,AOC
,,,,,,,,,,,,,,,,,,,,,,,,,,,,,,,,,,,,,,,,,,,,,,,,,,,,,,,,,,,,AOC,,,,,,,,,,,,,7,2482397,M/S SHREELAXMI ENTERPRISERS,20-Mar-2024 04:18 PM,Rejected-Finance,Rejected,25-Jul-2024 04:10 PM,,,,,,,,,,,,,,,,,,,,,,,,,,,,,AOC
,,,,,,,,,,,,,,,,,,,,,,,,,,,,,,,,,,,,,,,,,,,,,,,,,,,,,,,,,,,,AOC,,,,,,,,,,,,,8,2483854,PRADEEP KUMAR AGRAWALLA,21-Mar-2024 02:20 PM,Rejected-Finance,Rejected,25-Jul-2024 04:10 PM,,,,,,,,,,,,,,,,,,,,,,,,,,,,,AOC
