Organisation Chain,Tender Reference Number,Tender ID,Withdrawal Allowed,Tender Type,Form of contract,Tender Category,No. of Covers,General Technical Evaluation Allowed,ItemWise Technical Evaluation Allowed,Payment Mode,Is Multi Currency Allowed For BOQ,Is Multi Currency Allowed For Fee,Allow Two Stage Bidding,Cover No,Cover,Document Type,Description,Publish Date,Bid Opening Date,Document Download / Sale Start Date,Document Download / Sale End Date,Clarification Start Date,Clarification End Date,Bid Submission Start Date,Bid Submission End Date,EMD Amount in ₹,EMD Exemption Allowed,EMD Fee Type,EMD Percentage,EMD Payable To,EMD Payable At,S.No,Bank Name,Tender Fee in ₹,VAT Charges in ₹,Fee Payable To,Fee Payable At,Tender Fee Exemption Allowed,Name,Address,Title,Work Description,Pre Qualification Details,Independent External Monitor/Remarks,Tender Value in ₹,Product Category,Sub category,Contract Type,Bid Validity(Days),Period Of Work(Days),Location,Pincode,Pre Bid Meeting Place,Pre Bid Meeting Address,Pre Bid Meeting Date,Bid Opening Place,Should Allow NDA Tender,Allow Preferential Bidder,Tender Stage,Contract Date :,Contract Value :,Work Completion Period in days :,Updated By :,Updated on :,AOC document :,AOC Description :,S.No,Bid Number,Bidder Name,Awarded Currency,Awarded Value,S.No.1,Bid Number.1,Bidder Name.1,Submitted Date,Status,Remarks,Status Updated On,Type :,Summary :,Updated By :.1,Updated On :,Document :,BOQ Comparative Chart :,Committee Chairperson/Co-ordinator Name :,Committee Chairperson/Co-ordinator Type :,Committee Members :,Updated By :.2,Updated on :.1,Document :.1,Organisation Chain :,Tender ID :,Tender Ref No :,Tender Title :,Committee Chairperson/Co-ordinator Name :.1,Committee Chairperson/Co-ordinator Type :.1,Committee Members :.1,Updated By :.3,Updated On :.1,Document :.2,Tender Stage
Orissa Lift Irrigation Corporation||LI KORAPUT||LI Division Gunupur,04/2023-24,2023_OLIC_96764_66,Yes,Open Tender,Percentage,Works,1.0,No,No,Online,No,No,No,1.0,Fee/PreQual/Technical/Finance,.pdf,DTCN,16-Nov-2023 10:00 AM,24-Nov-2023 03:00 PM,16-Nov-2023 10:00 AM,23-Nov-2023 05:30 PM,16-Nov-2023 10:00 AM ,22-Nov-2023 05:30 PM ,16-Nov-2023 10:00 AM,23-Nov-2023 05:30 PM,"26,740",Yes,percentage,1.0%,Nil,Nil,1.0,ICICI BANK,"6,000",0.0,Nil,Nil,No,"Executive Enginer, L.I. Division, Gunupur","Executive Enginer, L.I. Division, Gunupur",Installation and energisation of Khajuriguda_I RL under Kashipur Block of Rayagada District,Installation and energisation of Khajuriguda_I RL under Kashipur Block of Rayagada District,Please refer Tender documents. ,NA ,"26,74,038",Civil Works - Lift Irrigation Schemes,NA ,Tender,90.0,90.0,"Executive Enginer, L.I. Division, Gunupur",765022.0,NA ,NA ,NA ,"Executive Enginer, L.I. Division, Gunupur",No ,No,AOC,15-Jul-2024,"INR 2,830,362",90.0,BINOD CHANDRA DASH,15-Jul-2024 07:38 AM,Khajuriguda_I.pdf (1214.00 KB),Agreement made successfully,1.0,2326373.0,BHRAMARLAL SAHU,INR,"2,830,362",1,2331374,ASISH KUMAR PATTNAIK,23-Nov-2023 04:52 PM,Rejected-Technical,The tender bid rejecteed.,07-Feb-2024 08:44 AM,Finance,Tender bid accepted. Hence the tender bid opened successfully.,BINOD CHANDRA DASH,27-Nov-2023 03:01 PM,finance_472535.pdf,BOQ Comparative Chart,"Executive Engineer, L.I. Division, Gunupur",Internal,"Assistant Executive Engineer (Estr.), Divisional Accountant, L.I. Division, Gunupur.",BINOD CHANDRA DASH,14-Jul-2024 10:11 AM,finsummary_472535.pdf (304.71 KB),Orissa Lift Irrigation Corporation||LI KORAPUT||LI Division Gunupur,2023_OLIC_96764_66,04/2023-24,Installation and energisation of Khajuriguda_I RL under Kashipur Block of Rayagada District,"Executive Engineer, L.I. Division, Gunupur",Internal,"Assistant Executive Engineer, Estimator, Divisional Accountant, L.I. Division, Gunupur.",BINOD CHANDRA DASH,07-Feb-2024 08:44 AM,techsummary_472535.pdf (96.99 KB),AOC
,,,,,,,,,,,,,,,,.pdf,NIT,,,,,,,,,,,,,,,2.0,ICICI NEFT/RTGS,,,,,,,,,,,,,,,,,,,,,,,,,,AOC,,,,,,,,,,,,,2,2331201,BADAL PATTNAIK,23-Nov-2023 03:41 PM,Rejected-Technical,The tender bid rejecteed.,07-Feb-2024 08:44 AM,,,,,,,,,,,,,,,,,,,,,,,AOC
,,,,,,,,,,,,,,,,.xls,BOQ,,,,,,,,,,,,,,,,,,,,,,,,,,,,,,,,,,,,,,,,,,AOC,,,,,,,,,,,,,3,2326373,BHRAMARLAL SAHU,21-Nov-2023 05:13 PM,Accepted-AOC,Tender bid accepted successfully.,15-Jul-2024 07:38 AM,,,,,,,,,,,,,,,,,,,,,,,AOC
,,,,,,,,,,,,,,,,,,,,,,,,,,,,,,,,,,,,,,,,,,,,,,,,,,,,,,,,,,,AOC,,,,,,,,,,,,,4,2328040,KUMAR MAJHI,23-Nov-2023 10:56 AM,Rejected-Technical,The tender bid rejecteed.,07-Feb-2024 08:44 AM,,,,,,,,,,,,,,,,,,,,,,,AOC
,,,,,,,,,,,,,,,,,,,,,,,,,,,,,,,,,,,,,,,,,,,,,,,,,,,,,,,,,,,AOC,,,,,,,,,,,,,5,2321613,M/S SHANTI POWER AND CONSTRUCTION,23-Nov-2023 01:36 PM,Rejected-Technical,The tender bid rejecteed.,07-Feb-2024 08:44 AM,,,,,,,,,,,,,,,,,,,,,,,AOC
