Organisation Chain,Tender Reference Number,Tender ID,Withdrawal Allowed,Tender Type,Form of contract,Tender Category,No. of Covers,General Technical Evaluation Allowed,ItemWise Technical Evaluation Allowed,Payment Mode,Is Multi Currency Allowed For BOQ,Is Multi Currency Allowed For Fee,Allow Two Stage Bidding,Cover No,Cover,Document Type,Description,Publish Date,Bid Opening Date,Document Download / Sale Start Date,Document Download / Sale End Date,Clarification Start Date,Clarification End Date,Bid Submission Start Date,Bid Submission End Date,Financial Bid Opening Date,EMD Amount in ₹,EMD Exemption Allowed,EMD Fee Type,EMD Percentage,EMD Payable To,EMD Payable At,S.No,Bank Name,Tender Fee in ₹,VAT Charges in ₹,Fee Payable To,Fee Payable At,Tender Fee Exemption Allowed,Name,Address,Title,Work Description,Pre Qualification Details,Independent External Monitor/Remarks,Tender Value in ₹,Product Category,Sub category,Contract Type,Bid Validity(Days),Period Of Work(Days),Location,Pincode,Pre Bid Meeting Place,Pre Bid Meeting Address,Pre Bid Meeting Date,Bid Opening Place,Should Allow NDA Tender,Allow Preferential Bidder,Tender Stage,Contract Date :,Contract Value :,Work Completion Period in days :,Updated By :,Updated on :,AOC document :,AOC Description :,S.No,Bid Number,Bidder Name,Awarded Currency,Awarded Value,S.No.1,Bid Number.1,Bidder Name.1,Submitted Date,Status,Remarks,Status Updated On,Type :,Summary :,Updated By :.1,Updated On :,Document :,BOQ Comparative Chart :,Committee Chairperson/Co-ordinator Name :,Committee Chairperson/Co-ordinator Type :,Committee Members :,Updated By :.2,Updated on :.1,Document :.1,Organisation Chain :,Tender ID :,Tender Ref No :,Tender Title :,Type :.1,Summary :.1,Updated By :.3,Updated On :.1,Document :.2,Committee Chairperson/Co-ordinator Name :.1,Committee Chairperson/Co-ordinator Type :.1,Committee Members :.1,Updated By :.4,Updated On :.2,Financial Bid Opening Date:,Document :.3,Tender Stage
EIC-CIVIL||SERNB-CIRCLE-NORTHERN,CCENC (R AND B) /35/ 2023-24,2024_EICCL_101510_1,Yes,National Competitive Bid,Percentage,Works,2.0,No,No,Online,No,No,No,1.0,Fee/PreQual/Technical,.pdf,"Online Proof Copy of Tender Cost, Bid Security, GSTIN, PAN, R.C and Affidavit",22-Feb-2024 12:00 PM,07-Mar-2024 06:00 PM,22-Feb-2024 12:00 PM,07-Mar-2024 05:00 PM,22-Feb-2024 12:00 PM ,29-Feb-2024 05:00 PM ,22-Feb-2024 12:00 PM,07-Mar-2024 05:00 PM,15-Mar-2024 10:30 AM,"1,06,400",Yes,fixed,,Nil,Nil,1.0,ICICI BANK,"10,000",0.0,Nil,Nil,No,"C.C.E, Northern R AND B Circle, SAMBALPUR","O/O THE C.C.E, Northern R AND B Circle, SAMBALPUR",Repair of Runway of Jamadarpali Airstrip with DBM in patches and BC for normal operation.,ROAD WORK,Please refer Tender documents. ,NA ,"1,06,37,853",Civil Works - Roads,NA ,Tender,90.0,30.0,SAMBALPUR,768200.0,NA ,NA ,NA ,"O/O THE C.C.E, Northern R AND B Circle, SAMBALPUR",No ,No,AOC,06-Jul-2024,"INR 9,043,239",30.0,Rama Chandra Sethi,06-Jul-2024 06:03 PM,AGTJAMADAR.pdf (285.00 KB),AGT DRAWN,1.0,2469056.0,NIRMAN BUILDERS,INR,"9,043,239",1,2468168,ABHI MAHANANDA,04-Mar-2024 02:33 PM,Rejected-Finance,UNSUCCESSFUL BIDDER,06-Jul-2024 06:01 PM,Finance,FINANCIAL BID OPENED,Anam Charan Sahoo,15-Mar-2024 10:58 AM,,BOQ Comparative Chart,A K PATTNAIK,Internal,"M.R. Sethy, A.K.Singh,D Behera",Rama Chandra Sethi,06-Jul-2024 06:01 PM,finsummary_495070.pdf (421.68 KB),EIC-CIVIL||SERNB-CIRCLE-NORTHERN,2024_EICCL_101510_1,CCENC (R AND B) /35/ 2023-24,Repair of Runway of Jamadarpali Airstrip with DBM in patches and BC for normal operation.,Technical,TECHNICAL BID ( COVER-I) OPENED,Anam Charan Sahoo,07-Mar-2024 06:55 PM,,ARUN KU PATTNAIK,Internal,"M.R. Sethy, A.K.Singh,D Behera",Anam Charan Sahoo,14-Mar-2024 01:15 PM,15-Mar-2024 10:30 AM,techsummary_495070.pdf (330.47 KB),AOC
,,,,,,,,,,,,,,,,.pdf,"Ownership of machineries, work experience and MOU for composite Building work etc",,,,,,,,,,,,,,,,2.0,ICICI NEFT/RTGS,,,,,,,,,,,,,,,,,,,,,,,,,,AOC,,,,,,,,,,,,,2,2471575,BHAGIRATHI SWAIN,07-Mar-2024 02:21 PM,Rejected-Technical,As per the decision of Tender Evaluation Committee,14-Mar-2024 01:15 PM,,,,,,,,,,,,,,,,,,,,,,,,,,,,,AOC
,,,,,,,,,,,,,,,,.pdf,Work experience certificate and other related documents as per DTCN,,,,,,,,,,,,,,,,,,,,,,,,,,,,,,,,,,,,,,,,,,,AOC,,,,,,,,,,,,,3,2471393,BISWAKARMAA SUBHANSU CHANDRASEKHAR,07-Mar-2024 11:29 AM,Rejected-Finance,UNSUCCESSFUL BIDDER,06-Jul-2024 06:01 PM,,,,,,,,,,,,,,,,,,,,,,,,,,,,,AOC
,,,,,,,,,,,,,,2.0,Finance,.xls,BILL OF QUANTITY (BOQ),,,,,,,,,,,,,,,,,,,,,,,,,,,,,,,,,,,,,,,,,,,AOC,,,,,,,,,,,,,4,2471533,MD ZAHIRUDDIN,07-Mar-2024 03:06 PM,Rejected-Technical,As per the decision of Tender Evaluation Committee,14-Mar-2024 01:15 PM,,,,,,,,,,,,,,,,,,,,,,,,,,,,,AOC
,,,,,,,,,,,,,,,,,,,,,,,,,,,,,,,,,,,,,,,,,,,,,,,,,,,,,,,,,,,,AOC,,,,,,,,,,,,,5,2469056,NIRMAN BUILDERS,06-Mar-2024 08:04 PM,Accepted-AOC,AGT DRAWN,06-Jul-2024 06:04 PM,,,,,,,,,,,,,,,,,,,,,,,,,,,,,AOC
,,,,,,,,,,,,,,,,,,,,,,,,,,,,,,,,,,,,,,,,,,,,,,,,,,,,,,,,,,,,AOC,,,,,,,,,,,,,6,2470209,SANDIP SHARMA,07-Mar-2024 03:54 PM,Rejected-Technical,As per the decision of Tender Evaluation Committee,14-Mar-2024 01:15 PM,,,,,,,,,,,,,,,,,,,,,,,,,,,,,AOC
,,,,,,,,,,,,,,,,,,,,,,,,,,,,,,,,,,,,,,,,,,,,,,,,,,,,,,,,,,,,AOC,,,,,,,,,,,,,7,2469085,SAYED ABDUL SIRAJ,06-Mar-2024 01:59 PM,Rejected-Finance,UNSUCCESSFUL THROUGH TRANSPARENT LOTTERY SYSTEM,06-Jul-2024 06:01 PM,,,,,,,,,,,,,,,,,,,,,,,,,,,,,AOC
,,,,,,,,,,,,,,,,,,,,,,,,,,,,,,,,,,,,,,,,,,,,,,,,,,,,,,,,,,,,AOC,,,,,,,,,,,,,8,2469144,SUSHANTA MISHRA,06-Mar-2024 07:08 PM,Rejected-Finance,UNSUCCESSFUL THROUGH TRANSPARENT LOTTERY SYSTEM,06-Jul-2024 06:01 PM,,,,,,,,,,,,,,,,,,,,,,,,,,,,,AOC
