Organisation Chain,Tender Reference Number,Tender ID,Withdrawal Allowed,Tender Type,Form of contract,Tender Category,No. of Covers,General Technical Evaluation Allowed,ItemWise Technical Evaluation Allowed,Payment Mode,Is Multi Currency Allowed For BOQ,Is Multi Currency Allowed For Fee,Allow Two Stage Bidding,Cover No,Cover,Document Type,Description,Publish Date,Bid Opening Date,Document Download / Sale Start Date,Document Download / Sale End Date,Clarification Start Date,Clarification End Date,Bid Submission Start Date,Bid Submission End Date,Financial Bid Opening Date,EMD Amount in ₹,EMD Exemption Allowed,EMD Fee Type,EMD Percentage,EMD Payable To,EMD Payable At,S.No,Corrigendum Title,Corrigendum Type,View,S.No.1,Bank Name,Tender Fee in ₹,VAT Charges in ₹,Fee Payable To,Fee Payable At,Tender Fee Exemption Allowed,Name,Address,Title,Work Description,Pre Qualification Details,Independent External Monitor/Remarks,Tender Value in ₹,Product Category,Sub category,Contract Type,Bid Validity(Days),Period Of Work(Days),Location,Pincode,Pre Bid Meeting Place,Pre Bid Meeting Address,Pre Bid Meeting Date,Bid Opening Place,Should Allow NDA Tender,Allow Preferential Bidder,Tender Stage,Contract Date :,Contract Value :,Work Completion Period in days :,Updated By :,Updated on :,AOC document :,AOC Description :,S.No,Bid Number,Bidder Name,Awarded Currency,Awarded Value,S.No.1,Bid Number.1,Bidder Name.1,Submitted Date,Status,Remarks,Status Updated On,Type :,Summary :,Updated By :.1,Updated On :,Document :,BOQ Comparative Chart :,Committee Chairperson/Co-ordinator Name :,Committee Chairperson/Co-ordinator Type :,Committee Members :,Updated By :.2,Updated on :.1,Document :.1,Organisation Chain :,Tender ID :,Tender Ref No :,Tender Title :,Type :.1,Summary :.1,Updated By :.3,Updated On :.1,Document :.2,Committee Chairperson/Co-ordinator Name :.1,Committee Chairperson/Co-ordinator Type :.1,Committee Members :.1,Updated By :.4,Updated On :.2,Financial Bid Opening Date:,Document :.3,Tender Stage
CE RW I||RWCIRCLE-BALASORE,CCE-BLS-NCB-83 OF 2023-24,2024_CERWI_102261_4,Yes,National Competitive Bid,Percentage,Works,2.0,No,No,Online,No,No,No,1.0,Fee/PreQual/Technical,.pdf,"P.cost. EMD, R.C, PAN, GSTIN,Affidavit, etc.",06-Mar-2024 03:00 PM,28-Mar-2024 11:00 AM,06-Mar-2024 03:00 PM,27-Mar-2024 05:00 PM,06-Mar-2024 03:00 PM ,27-Mar-2024 01:00 PM ,06-Mar-2024 03:00 PM,27-Mar-2024 05:00 PM,05-Jun-2024 11:00 AM,"1,04,030",Yes,percentage,1.0%,Nil,Nil,1.0,2nd corrigendum,Date,,1.0,ICICI BANK,"10,000",0.0,Nil,Nil,No,"CCE, R.W.CIRCLE, BALASORE","O/o the Chief Construction Engineer, Rural Works Circle, Balasore",Construction of New PHC Building at Maharajpur under Remuna Block in the District of Balasore for 2023-24.,Construction of New PHC Building at Maharajpur under Remuna Block in the District of Balasore for 2023-24.,Please refer the DTCN ,NA ,"1,04,03,000",Civil Works - Bridges,NA ,Tender,90.0,360.0,Balasore,756001.0,NA ,NA ,NA ,"CCE, R.W.CIRCLE, BALASORE",No ,No,AOC,04-Dec-2024,"INR 10,435,653",360.0,Tapan Kumar Behera,04-Dec-2024 06:45 PM,Maharajpur.pdf (47.00 KB),Work awarded to 1st lowest bidder,1.0,2479884.0,AMARJIT MAHAPATRA,INR,"10,435,653",1,2471638,Ajaya Kanta Mishra,07-Mar-2024 04:10 PM,Rejected-Technical,E.I. License not furnished,31-May-2024 12:23 PM,Finance,4 Numbers bidder admitted,Saibalini Singh,04-Dec-2024 06:00 PM,finance_498450.pdf,BOQ Comparative Chart,CCE RW CIRCLE BALASORE,Internal,PA TO RW CIRCLE BALASORE AND ESTIMATOR RW CIRCLE BALASORE,Saibalini Singh,04-Dec-2024 06:05 PM,finsummary_498450.pdf (47.41 KB),CE RW I||RWCIRCLE-BALASORE,2024_CERWI_102261_4,CCE-BLS-NCB-83 OF 2023-24,Construction of New PHC Building at Maharajpur under Remuna Block in the District of Balasore for 2023-24.,Technical,6 numbers bidder admitted,N V Harihar Rao,04-Apr-2024 08:21 PM,,"CCE RW CIRCLE, BALASORE",Internal,"PA TO CCE RW CIRCLE, BALASORE AND ESTIMATOR RW CIRCLE, BALASORE",N V Harihar Rao,31-May-2024 12:23 PM,05-Jun-2024 11:00 AM,techsummary_498450.pdf (2535.67 KB),AOC
,,,,,,,,,,,,,,,,.pdf,"Similar nature of work, ATO, Proffit and Loss Statement, Work in Hand, Machineries, etc.",,,,,,,,,,,,,,,,,,,,2.0,ICICI NEFT/RTGS,,,,,,,,,,,,,,,,,,,,,,,,,,AOC,,,,,,,,,,,,,2,2479884,AMARJIT MAHAPATRA,18-Mar-2024 03:42 PM,Accepted-AOC,L1,04-Dec-2024 06:45 PM,,,,,,,,,,,,,,,,,,,,,,,,,,,,,AOC
,,,,,,,,,,,,,,,,.pdf,Other documents as per DTCN,,,,,,,,,,,,,,,,,,,,,,,,,,,,,,,,,,,,,,,,,,,,,,,AOC,,,,,,,,,,,,,3,2473406,Bhabani Sankar Satapathy,15-Mar-2024 08:02 PM,Rejected-AOC,L1,04-Dec-2024 06:45 PM,,,,,,,,,,,,,,,,,,,,,,,,,,,,,AOC
,,,,,,,,,,,,,,2.0,Finance,.xls,BILL OF QUANTITY,,,,,,,,,,,,,,,,,,,,,,,,,,,,,,,,,,,,,,,,,,,,,,,AOC,,,,,,,,,,,,,4,2473722,BIKRAMANANDA MOHANTY,11-Mar-2024 02:04 PM,Rejected-AOC,L1,04-Dec-2024 06:45 PM,,,,,,,,,,,,,,,,,,,,,,,,,,,,,AOC
,,,,,,,,,,,,,,,,,,,,,,,,,,,,,,,,,,,,,,,,,,,,,,,,,,,,,,,,,,,,,,,,AOC,,,,,,,,,,,,,5,2474032,Dinesh Kumar Nayak,11-Mar-2024 04:21 PM,Rejected-AOC,L2,04-Dec-2024 06:45 PM,,,,,,,,,,,,,,,,,,,,,,,,,,,,,AOC
,,,,,,,,,,,,,,,,,,,,,,,,,,,,,,,,,,,,,,,,,,,,,,,,,,,,,,,,,,,,,,,,AOC,,,,,,,,,,,,,6,2474020,Leaptree Engineers Pvt. Ltd.,18-Mar-2024 04:55 PM,Rejected-Technical,EMD not furnished,31-May-2024 12:23 PM,,,,,,,,,,,,,,,,,,,,,,,,,,,,,AOC
