Organisation Chain,Tender Reference Number,Tender ID,Withdrawal Allowed,Tender Type,Form of contract,Tender Category,No. of Covers,General Technical Evaluation Allowed,ItemWise Technical Evaluation Allowed,Payment Mode,Is Multi Currency Allowed For BOQ,Is Multi Currency Allowed For Fee,Allow Two Stage Bidding,Cover No,Cover,Document Type,Description,Publish Date,Bid Opening Date,Document Download / Sale Start Date,Document Download / Sale End Date,Clarification Start Date,Clarification End Date,Bid Submission Start Date,Bid Submission End Date,Financial Bid Opening Date,EMD Amount in ₹,EMD Exemption Allowed,EMD Fee Type,EMD Percentage,EMD Payable To,EMD Payable At,S.No,Corrigendum Title,Corrigendum Type,View,S.No.1,Bank Name,Tender Fee in ₹,Fee Payable To,Fee Payable At,Tender Fee Exemption Allowed,Name,Address,Title,Work Description,Pre Qualification Details,Independent External Monitor/Remarks,Tender Value in ₹,Product Category,Sub category,Contract Type,Bid Validity(Days),Period Of Work(Days),Location,Pincode,Pre Bid Meeting Place,Pre Bid Meeting Address,Pre Bid Meeting Date,Bid Opening Place,Should Allow NDA Tender,Allow Preferential Bidder,Tender Stage,Contract Date :,Contract Value :,Work Completion Period in days :,Updated By :,Updated on :,AOC document :,AOC Description :,S.No,Bid Number,Bidder Name,Awarded Currency,Awarded Value,S.No.1,Bid Number.1,Bidder Name.1,Submitted Date,Status,Remarks,Status Updated On,Type :,Summary :,Updated By :.1,Updated On :,Document :,BOQ Comparative Chart :,Committee Chairperson/Co-ordinator Name :,Committee Chairperson/Co-ordinator Type :,Committee Members :,Updated By :.2,Updated on :.1,Document :.1,Organisation Chain :,Tender ID :,Tender Ref No :,Tender Title :,Type :.1,Summary :.1,Updated By :.3,Updated On :.1,Document :.2,Committee Chairperson/Co-ordinator Name :.1,Committee Chairperson/Co-ordinator Type :.1,Committee Members :.1,Updated By :.4,Updated On :.2,Financial Bid Opening Date:,Document :.3,Tender Stage
WATCO Bhubaneswar||Director (Operation) Watco||WATCO Division Puri,GMWATCOPURI/15/2024-25,2024_WPURI_106523_1,Yes,National Competitive Bid,Percentage,Works,2.0,No,No,Online,No,No,No,1.0,Fee/PreQual/Technical,.pdf,"Cost of Tender Paper, EMD, PAN, GST, Affidavits as per DTCN",08-Nov-2024 11:00 AM,22-Nov-2024 12:30 PM,08-Nov-2024 11:00 AM,21-Nov-2024 05:00 PM,08-Nov-2024 11:00 AM ,13-Nov-2024 05:00 PM ,08-Nov-2024 11:00 AM,21-Nov-2024 05:00 PM,29-Nov-2024 12:30 PM,"79,682",Yes,percentage,1.0%,Nil,Nil,1.0,Tender Value,Other,,1.0,ICICI BANK,"11,800",Nil,Nil,No,"General Manager, WATCO Division, Puri","General Manager, WATCO Division, Puri, Odisha, Phone-06752-223447","Operation and maintenance of STP , P7 and Septage Treatment Plant under WATCO Sub-Division,Puri","Operation and maintenance of STP , P7 and Septage Treatment Plant under WATCO Sub-Division,Puri",Please refer to tender documents ,NA ,"79,68,240",Civil Works - Water Works,NA ,Tender,120.0,365.0,Puri,752002.0,NA ,NA ,NA ,Puri,No ,No,AOC,21-Dec-2024,"INR 6,773,801",365.0,Parikshita prasad Khandual,21-Dec-2024 01:43 PM,7494.pdf (409.00 KB),Ist Lowest bidder,1.0,2653176.0,Pooja Construction Co.,INR,"6,773,801",1,2657234,ACE DYNAMICS,21-Nov-2024 02:06 PM,Rejected-Technical,Not Satisfied as per DTCN,28-Nov-2024 07:10 PM,Finance,2 bidders qualified for opening of financial bid,Parikshita prasad Khandual,29-Nov-2024 01:27 PM,,BOQ Comparative Chart,"GM, DAO, Manager,Puri, JE Estr",Internal,"GM, DAO, Manager,Puri, JE Estr",Parikshita prasad Khandual,21-Dec-2024 01:37 PM,finsummary_514781.pdf (338.41 KB),WATCO Bhubaneswar||Director (Operation) Watco||WATCO Division Puri,2024_WPURI_106523_1,GMWATCOPURI/15/2024-25,"Operation and maintenance of STP , P7 and Septage Treatment Plant under WATCO Sub-Division,Puri",Technical,5 nos of bidders are participated and qualified for opening of the technical bid,Parikshita prasad Khandual,22-Nov-2024 01:43 PM,,"G.M, WATCO",Internal,"Manager, DAO, JE Estr",Sudhakar Naik,28-Nov-2024 07:10 PM,29-Nov-2024 12:30 PM,techsummary_514781.pdf (699.01 KB),AOC
,,,,,,,,,,,,,,,,.pdf,"Certificates, Formats, Schedules and other documents if any as per DTCN",,,,,,,,,,,,,,,,,,,,2.0,ICICI NEFT/RTGS,,,,,,,,,,,,,,,,,,,,,,,,,AOC,,,,,,,,,,,,,2,2655373,Dhal Engineering Private Limited,21-Nov-2024 03:14 PM,Rejected-Technical,Not Satisfied as per DTCN,28-Nov-2024 07:10 PM,,,,,,,,,,,,,,,,,,,,,,,,,,,,,AOC
,,,,,,,,,,,,,,2.0,Finance,.xls,Bill of Quantity,,,,,,,,,,,,,,,,,,,,,,,,,,,,,,,,,,,,,,,,,,,,,,AOC,,,,,,,,,,,,,3,2651808,EUREKA TRADERS BUREAU,19-Nov-2024 03:22 PM,Rejected-Finance,Clause No-6.26 of the DTCN,21-Dec-2024 01:37 PM,,,,,,,,,,,,,,,,,,,,,,,,,,,,,AOC
,,,,,,,,,,,,,,,,,,,,,,,,,,,,,,,,,,,,,,,,,,,,,,,,,,,,,,,,,,,,,,,AOC,,,,,,,,,,,,,4,2653176,Pooja Construction Co.,20-Nov-2024 08:06 PM,Accepted-AOC,Ist Lowest,21-Dec-2024 01:43 PM,,,,,,,,,,,,,,,,,,,,,,,,,,,,,AOC
,,,,,,,,,,,,,,,,,,,,,,,,,,,,,,,,,,,,,,,,,,,,,,,,,,,,,,,,,,,,,,,AOC,,,,,,,,,,,,,5,2655388,Swach Environment Private Limited,21-Nov-2024 04:37 PM,Rejected-Technical,Not Satisfied as per DTCN,28-Nov-2024 07:10 PM,,,,,,,,,,,,,,,,,,,,,,,,,,,,,AOC
