Organisation Chain,Tender Reference Number,Tender ID,Withdrawal Allowed,Tender Type,Form of contract,Tender Category,No. of Covers,General Technical Evaluation Allowed,ItemWise Technical Evaluation Allowed,Payment Mode,Is Multi Currency Allowed For BOQ,Is Multi Currency Allowed For Fee,Allow Two Stage Bidding,Cover No,Cover,Document Type,Description,Publish Date,Bid Opening Date,Document Download / Sale Start Date,Document Download / Sale End Date,Clarification Start Date,Clarification End Date,Bid Submission Start Date,Bid Submission End Date,EMD Amount in ₹,EMD Exemption Allowed,EMD Fee Type,EMD Percentage,EMD Payable To,EMD Payable At,S.No,Bank Name,Tender Fee in ₹,VAT Charges in ₹,Fee Payable To,Fee Payable At,Tender Fee Exemption Allowed,Name,Address,Title,Work Description,Pre Qualification Details,Independent External Monitor/Remarks,Tender Value in ₹,Product Category,Sub category,Contract Type,Bid Validity(Days),Period Of Work(Days),Location,Pincode,Pre Bid Meeting Place,Pre Bid Meeting Address,Pre Bid Meeting Date,Bid Opening Place,Should Allow NDA Tender,Allow Preferential Bidder,Tender Stage,Contract Date :,Contract Value :,Work Completion Period in days :,Updated By :,Updated on :,AOC document :,AOC Description :,S.No,Bid Number,Bidder Name,Awarded Currency,Awarded Value,S.No.1,Bid Number.1,Bidder Name.1,Submitted Date,Status,Remarks,Status Updated On,Type :,Summary :,Updated By :.1,Updated On :,Document :,BOQ Comparative Chart :,Committee Chairperson/Co-ordinator Name :,Committee Chairperson/Co-ordinator Type :,Committee Members :,Updated By :.2,Updated on :.1,Document :.1,Organisation Chain :,Tender ID :,Tender Ref No :,Tender Title :,Committee Chairperson/Co-ordinator Name :.1,Committee Chairperson/Co-ordinator Type :.1,Committee Members :.1,Updated By :.3,Updated On :.1,Document :.2,Tender Stage
CE RW I||RW-CIRCLE-SUNDARGARH||RW-Division-Sundargarh II,Online -SERKL-09 of 2024-25,2024_CERWI_106027_18,Yes,Open Tender,Percentage,Works,1.0,No,No,Online,No,No,No,1.0,Fee/PreQual/Technical/Finance,.pdf,Affidavit Towards Authenticity of Documents,29-Oct-2024 09:00 AM,11-Nov-2024 09:00 AM,29-Oct-2024 09:00 AM,08-Nov-2024 06:00 PM,29-Oct-2024 09:00 AM ,07-Nov-2024 06:00 PM ,29-Oct-2024 09:00 AM,08-Nov-2024 06:00 PM,"7,840",Yes,fixed,,Nil,Nil,1.0,ICICI BANK,"4,000",0.0,Nil,Nil,No,"Ececutive Engineer, RW Division,Rourkela","Office of the Executive Engineer,RW Division,Rourk",S/R to MDR-26 to Rukhatoli road for the year 2024-25,S/R to MDR-26 to Rukhatoli road for the year 2024-25,Please refer Tender documents. ,NA ,"7,84,406",Civil Works - Roads,NA ,Tender,90.0,30.0,ROURKELA,769004.0,NA ,NA ,NA ,"Office of the Executive Engineer,RW Division,Rourk",No ,No,AOC,20-Dec-2024,"INR 666,824",30.0,Kishore Chandra Khatua,20-Dec-2024 05:06 PM,25.pdf (657.00 KB),Awarded Cost,1.0,2623713.0,BALARAM KISPOTTA,INR,"666,824",1.0,2623713.0,BALARAM KISPOTTA,06-Nov-2024 01:22 PM,Accepted-AOC,Awarded,20-Dec-2024 05:06 PM,Finance,3 Bidders Applied,Kishore Chandra Khatua,20-Dec-2024 04:57 PM,,BOQ Comparative Chart,"AE Estt, DAO, SE",Internal,"AE Estt, DAO, SE",Kishore Chandra Khatua,20-Dec-2024 05:03 PM,finsummary_512052.pdf (657.39 KB),CE RW I||RW-CIRCLE-SUNDARGARH||RW-Division-Sundargarh II,2024_CERWI_106027_18,Online -SERKL-09 of 2024-25,S/R to MDR-26 to Rukhatoli road for the year 2024-25,"AE Estt, DAO, SE",Internal,"AE Estt, DAO, SE",Kishore Chandra Khatua,20-Dec-2024 04:59 PM,techsummary_512052.pdf (657.39 KB),AOC
,,,,,,,,,,,,,,,,.pdf,"PAN Card, GSTN, Regestration Certificate another as per DTCN, Contact No if any",,,,,,,,,,,,,,,2.0,ICICI NEFT/RTGS,,,,,,,,,,,,,,,,,,,,,,,,,,AOC,,,,,,,,,,,,,2.0,2620256.0,BHUGLU TOPPO,05-Nov-2024 07:03 PM,Rejected-AOC,Rejected by the Committee Members,20-Dec-2024 05:06 PM,,,,,,,,,,,,,,,,,,,,,,,AOC
,,,,,,,,,,,,,,,,.pdf,Affidavit Regarding norelation certificate,,,,,,,,,,,,,,,,,,,,,,,,,,,,,,,,,,,,,,,,,,AOC,,,,,,,,,,,,,3.0,2630065.0,Manoj Gadhei,07-Nov-2024 09:19 PM,Rejected-AOC,Rejected by the Committee Members,20-Dec-2024 05:06 PM,,,,,,,,,,,,,,,,,,,,,,,AOC
,,,,,,,,,,,,,,,,.pdf,Affidavit Regarding correctness of information,,,,,,,,,,,,,,,,,,,,,,,,,,,,,,,,,,,,,,,,,,AOC,,,,,,,,,,,,,,,,,,,,,,,,,,,,,,,,,,,,,,,,,,AOC
,,,,,,,,,,,,,,,,.xls,BOQ,,,,,,,,,,,,,,,,,,,,,,,,,,,,,,,,,,,,,,,,,,AOC,,,,,,,,,,,,,,,,,,,,,,,,,,,,,,,,,,,,,,,,,,AOC
