Organisation Chain,Tender Reference Number,Tender ID,Withdrawal Allowed,Tender Type,Form of contract,Tender Category,No. of Covers,General Technical Evaluation Allowed,ItemWise Technical Evaluation Allowed,Payment Mode,Is Multi Currency Allowed For BOQ,Is Multi Currency Allowed For Fee,Allow Two Stage Bidding,Cover No,Cover,Document Type,Description,Publish Date,Bid Opening Date,Document Download / Sale Start Date,Document Download / Sale End Date,Clarification Start Date,Clarification End Date,Bid Submission Start Date,Bid Submission End Date,Financial Bid Opening Date,EMD Amount in ₹,EMD Exemption Allowed,EMD Fee Type,EMD Percentage,EMD Payable To,EMD Payable At,S.No,Bank Name,Tender Fee in ₹,VAT Charges in ₹,Fee Payable To,Fee Payable At,Tender Fee Exemption Allowed,Name,Address,Title,Work Description,Pre Qualification Details,Independent External Monitor/Remarks,Tender Value in ₹,Product Category,Sub category,Contract Type,Bid Validity(Days),Period Of Work(Days),Location,Pincode,Pre Bid Meeting Place,Pre Bid Meeting Address,Pre Bid Meeting Date,Bid Opening Place,Should Allow NDA Tender,Allow Preferential Bidder,Tender Stage,Contract Date :,Contract Value :,Work Completion Period in days :,Updated By :,Updated on :,AOC document :,AOC Description :,S.No,Bid Number,Bidder Name,Awarded Currency,Awarded Value,S.No.1,Bid Number.1,Bidder Name.1,Submitted Date,Status,Remarks,Status Updated On,Type :,Summary :,Updated By :.1,Updated On :,Document :,BOQ Comparative Chart :,Committee Chairperson/Co-ordinator Name :,Committee Chairperson/Co-ordinator Type :,Committee Members :,Updated By :.2,Updated on :.1,Document :.1,Organisation Chain :,Tender ID :,Tender Ref No :,Tender Title :,Type :.1,Summary :.1,Updated By :.3,Updated On :.1,Document :.2,Committee Chairperson/Co-ordinator Name :.1,Committee Chairperson/Co-ordinator Type :.1,Committee Members :.1,Updated By :.4,Updated On :.2,Financial Bid Opening Date:,Document :.3,Tender Stage
CE RW I||RWCIRCLE-KENDRAPARA||RWDIVISION-KENDRAPARA,RWD /KPD-04 OF 2024-25,2024_CERWI_106621_1,Yes,Open Tender,Percentage,Works,2.0,No,No,Online,No,No,No,1.0,Fee/PreQual/Technical,.pdf,"NIT, DTCN",08-Nov-2024 06:00 PM,21-Nov-2024 11:00 AM,08-Nov-2024 06:00 PM,20-Nov-2024 05:00 PM,08-Nov-2024 06:00 PM ,19-Nov-2024 05:00 PM ,08-Nov-2024 06:00 PM,20-Nov-2024 05:00 PM,27-Nov-2024 04:00 PM,"51,800",Yes,fixed,,Nil,Nil,1.0,ICICI BANK,"10,000",0.0,Nil,Nil,No,Executive Engineer,"RURAL WORKS DIVISION, KENDRAPARA",Construction of Compound wall in the premises of JMFC Building Mahakalapra at-Gahama in the District of Kendrapara for the year -2024-25,Construction of Compound wall in the premises of JMFC Building Mahakalapra at-Gahama in the District of Kendrapara for the year -2024-25,NA ,NA ,"51,79,851",Civil Works - Buildings,NA ,Tender,90.0,180.0,Kendrapara,754212.0,NA ,NA ,NA ,"RURAL WORKS DIVISION, KENDRAPARA",No ,No,AOC,11-Dec-2024,"INR 4,403,392",180.0,Rajesh Pradhan,11-Dec-2024 12:15 PM,5214.pdf (317.00 KB),Successful Qualify Bidder,1.0,2639342.0,ASHISH KUMAR SETHY,INR,"4,403,392",1,2639342,ASHISH KUMAR SETHY,11-Nov-2024 03:09 PM,Accepted-AOC,Successful Qualify Bidder,11-Dec-2024 12:15 PM,Finance,Five Numbers of Bidder Participated,Rajesh Pradhan,27-Nov-2024 04:59 PM,,BOQ Comparative Chart,"Executive Engineer R.W.Division, Kendrapara",Internal,"D.A.O, Junior Engineer(Estimator)",Rajesh Pradhan,11-Dec-2024 12:03 PM,finsummary_515045.pdf (306.36 KB),CE RW I||RWCIRCLE-KENDRAPARA||RWDIVISION-KENDRAPARA,2024_CERWI_106621_1,RWD /KPD-04 OF 2024-25,Construction of Compound wall in the premises of JMFC Building Mahakalapra at-Gahama in the District of Kendrapara for the year -2024-25,Technical,Five Numbers of Bidder Participated,Rajesh Pradhan,21-Nov-2024 11:15 AM,,"Executive Engineer R.W.Division, Kendrapara",Internal,"D.A.O, Junior Engineer(Estimator)",Rajesh Pradhan,27-Nov-2024 01:31 PM,27-Nov-2024 04:00 PM,techsummary_515045.pdf (315.35 KB),AOC
,,,,,,,,,,,,,,2.0,Finance,.xls,BOQ,,,,,,,,,,,,,,,,2.0,ICICI NEFT/RTGS,,,,,,,,,,,,,,,,,,,,,,,,,,AOC,,,,,,,,,,,,,2,2654296,PRATAP KUMAR ROUT,19-Nov-2024 04:12 PM,Rejected-Finance,Did not Win the Lottery,11-Dec-2024 12:03 PM,,,,,,,,,,,,,,,,,,,,,,,,,,,,,AOC
,,,,,,,,,,,,,,,,,,,,,,,,,,,,,,,,,,,,,,,,,,,,,,,,,,,,,,,,,,,,AOC,,,,,,,,,,,,,3,2651538,SARBSHREE ENGINEERING AND CONSTRUCTIONS PVT LTD,18-Nov-2024 01:02 PM,Rejected-Finance,Did not Win the Lottery,11-Dec-2024 12:03 PM,,,,,,,,,,,,,,,,,,,,,,,,,,,,,AOC
,,,,,,,,,,,,,,,,,,,,,,,,,,,,,,,,,,,,,,,,,,,,,,,,,,,,,,,,,,,,AOC,,,,,,,,,,,,,4,2655687,SAROJA KUMAR PRADHAN,20-Nov-2024 12:56 PM,Rejected-Finance,Did not Win the Lottery,11-Dec-2024 12:03 PM,,,,,,,,,,,,,,,,,,,,,,,,,,,,,AOC
,,,,,,,,,,,,,,,,,,,,,,,,,,,,,,,,,,,,,,,,,,,,,,,,,,,,,,,,,,,,AOC,,,,,,,,,,,,,5,2652555,SATYA RANJAN BEURA,19-Nov-2024 05:47 PM,Rejected-Finance,Did not Win the Lottery,11-Dec-2024 12:03 PM,,,,,,,,,,,,,,,,,,,,,,,,,,,,,AOC
