Organisation Chain,Tender Reference Number,Tender ID,Withdrawal Allowed,Tender Type,Form of contract,Tender Category,No. of Covers,General Technical Evaluation Allowed,ItemWise Technical Evaluation Allowed,Payment Mode,Is Multi Currency Allowed For BOQ,Is Multi Currency Allowed For Fee,Allow Two Stage Bidding,Cover No,Cover,Document Type,Description,Publish Date,Bid Opening Date,Document Download / Sale Start Date,Document Download / Sale End Date,Clarification Start Date,Clarification End Date,Bid Submission Start Date,Bid Submission End Date,EMD Amount in ₹,EMD Exemption Allowed,EMD Fee Type,EMD Percentage,EMD Payable To,EMD Payable At,S.No,Corrigendum Title,Corrigendum Type,View,S.No.1,Bank Name,Tender Fee in ₹,VAT Charges in ₹,Fee Payable To,Fee Payable At,Tender Fee Exemption Allowed,Name,Address,Title,Work Description,Pre Qualification Details,Independent External Monitor/Remarks,Tender Value in ₹,Product Category,Sub category,Contract Type,Bid Validity(Days),Period Of Work(Days),Location,Pincode,Pre Bid Meeting Place,Pre Bid Meeting Address,Pre Bid Meeting Date,Bid Opening Place,Should Allow NDA Tender,Allow Preferential Bidder,Tender Stage,Contract Date :,Contract Value :,Work Completion Period in days :,Updated By :,Updated on :,AOC document :,AOC Description :,S.No,Bid Number,Bidder Name,Awarded Currency,Awarded Value,S.No.1,Bid Number.1,Bidder Name.1,Submitted Date,Status,Remarks,Status Updated On,Type :,Summary :,Updated By :.1,Updated On :,Document :,BOQ Comparative Chart :,Committee Chairperson/Co-ordinator Name :,Committee Chairperson/Co-ordinator Type :,Committee Members :,Updated By :.2,Updated on :.1,Document :.1,Organisation Chain :,Tender ID :,Tender Ref No :,Tender Title :,Committee Chairperson/Co-ordinator Name :.1,Committee Chairperson/Co-ordinator Type :.1,Committee Members :.1,Updated By :.3,Updated On :.1,Document :.2,S.No.2,Revocation Title,Revocation Description,Published Date,Document Name,Document Size(in KB),Revocated To,Tender Stage
EIC-CIVIL||SERNB-CIRCLE-NORTHERN||EERNB-DIVN-BOLANGIR,BGR (R and B)-07 of 2024-25,2024_EICCL_105140_4,Yes,National Competitive Bid,Percentage,Works,1.0,No,No,Online,No,No,No,1.0,Fee/PreQual/Technical/Finance,.pdf,"Online proof Copy Tender cost and EMD, Registration Certificate, PAN, GSTIN,etc.",24-Sep-2024 05:00 PM,01-Oct-2024 11:30 AM,24-Sep-2024 05:00 PM,30-Sep-2024 05:00 PM,24-Sep-2024 05:00 PM ,27-Sep-2024 05:00 PM ,24-Sep-2024 05:00 PM,30-Sep-2024 05:00 PM,"11,600",Yes,fixed,,Nil,Nil,1.0,Technical Bid,Technical Bid,,1.0,ICICI BANK,"6,000",0.0,Nil,Nil,No,"S.E,Balangir (R and B) Division,Balangir","O/O S.E,Balangir (R and B) Division,Balangir","Special Repair to Atgaon-Deogaon Road (ODR) such as patch renewal coat From Ch. 0/0 to 0/050 KM, 6/220 to 6/850 KM and From 11/950 to 12/050 KM",Road work,Please refer tender document ,NA ,"11,57,062",Civil Works - Roads,NA ,Tender,90.0,30.0,Balangir,767001.0,NA ,NA ,NA ,"O/O S.E,Balangir (R and B) Division,Balangir",No ,No,AOC,28-Nov-2024,"INR 983,618",30.0,Prabhasini Sarangi,27-Dec-2024 12:39 PM,AOCofSRtoADroadpatchnewewalcoat.pdf (291.00 KB),"The work is awarded to Sri Arman Ku. Acharya, C Class contractor",1.0,2563610.0,ARMAN KUMAR ACHARYA,INR,"983,618",1,2562242,ANKIT AGRAWAL,29-Sep-2024 01:19 PM,Rejected-Technical,As per Schedule-C of DTCN,22-Oct-2024 05:42 PM,Finance,Total 6 (Six) Nos. bidders were participated and their documents are opened for further evaluation.,Prabhasini Sarangi,22-Oct-2024 05:38 PM,,BOQ Comparative Chart,N.K.Ghadai,Internal,,Roshan Tigga,25-Oct-2024 12:01 PM,finsummary_507608.pdf (231.46 KB),EIC-CIVIL||SERNB-CIRCLE-NORTHERN||EERNB-DIVN-BOLANGIR,2024_EICCL_105140_4,BGR (R and B)-07 of 2024-25,"Special Repair to Atgaon-Deogaon Road (ODR) such as patch renewal coat From Ch. 0/0 to 0/050 KM, 6/220 to 6/850 KM and From 11/950 to 12/050 KM",N.K Ghadai,Internal,,Prabhasini Sarangi,22-Oct-2024 05:42 PM,techsummary_507608.pdf (468.51 KB),1.0,Tender Revocation,Tender Revocation,22-Oct-2024 05:17 PM,p.pdf ,452.97,Technical Opening,AOC
,,,,,,,,,,,,,,,,.pdf,"No relationship Certificate, affidavit, etc.",,,,,,,,,,,,,,,,,,,2.0,ICICI NEFT/RTGS,,,,,,,,,,,,,,,,,,,,,,,,,,AOC,,,,,,,,,,,,,2,2563610,ARMAN KUMAR ACHARYA,30-Sep-2024 03:46 PM,Accepted-AOC,"1st lowest percentage rate bidder, won the transparent lottery system",27-Dec-2024 12:39 PM,,,,,,,,,,,,,,,,,,,,,,,,,,,,,,AOC
,,,,,,,,,,,,,,,,.pdf,Others document as per DTCN,,,,,,,,,,,,,,,,,,,,,,,,,,,,,,,,,,,,,,,,,,,,,,AOC,,,,,,,,,,,,,3,2563472,BIKRAM TRIPATHY,30-Sep-2024 02:43 PM,Rejected-Finance,Loose in transparent lottery system,25-Oct-2024 12:01 PM,,,,,,,,,,,,,,,,,,,,,,,,,,,,,,AOC
,,,,,,,,,,,,,,,,.xls,Bill of Quantity,,,,,,,,,,,,,,,,,,,,,,,,,,,,,,,,,,,,,,,,,,,,,,AOC,,,,,,,,,,,,,4,2562898,GOPAL PRASAD DANI,30-Sep-2024 11:59 AM,Rejected-Finance,Loose in transparent lottery system,25-Oct-2024 12:01 PM,,,,,,,,,,,,,,,,,,,,,,,,,,,,,,AOC
,,,,,,,,,,,,,,,,,,,,,,,,,,,,,,,,,,,,,,,,,,,,,,,,,,,,,,,,,,,,,,,AOC,,,,,,,,,,,,,5,2563774,PRADEEP DAS,30-Sep-2024 04:55 PM,Rejected-Technical,As per Schedule-C of DTCN,22-Oct-2024 05:42 PM,,,,,,,,,,,,,,,,,,,,,,,,,,,,,,AOC
,,,,,,,,,,,,,,,,,,,,,,,,,,,,,,,,,,,,,,,,,,,,,,,,,,,,,,,,,,,,,,,AOC,,,,,,,,,,,,,6,2563385,RAHUL TRIPATHY,30-Sep-2024 02:22 PM,Rejected-Finance,Loose in transparent lottery system,25-Oct-2024 12:01 PM,,,,,,,,,,,,,,,,,,,,,,,,,,,,,,AOC
