Organisation Chain,Tender Reference Number,Tender ID,Withdrawal Allowed,Tender Type,Form of contract,Tender Category,No. of Covers,General Technical Evaluation Allowed,ItemWise Technical Evaluation Allowed,Payment Mode,Is Multi Currency Allowed For BOQ,Is Multi Currency Allowed For Fee,Allow Two Stage Bidding,Cover No,Cover,Document Type,Description,Publish Date,Bid Opening Date,Document Download / Sale Start Date,Document Download / Sale End Date,Clarification Start Date,Clarification End Date,Bid Submission Start Date,Bid Submission End Date,EMD Amount in ₹,EMD Exemption Allowed,EMD Fee Type,EMD Percentage,EMD Payable To,EMD Payable At,S.No,Bank Name,Tender Fee in ₹,VAT Charges in ₹,Fee Payable To,Fee Payable At,Tender Fee Exemption Allowed,Name,Address,Title,Work Description,Pre Qualification Details,Independent External Monitor/Remarks,Tender Value in ₹,Product Category,Sub category,Contract Type,Bid Validity(Days),Period Of Work(Days),Location,Pincode,Pre Bid Meeting Place,Pre Bid Meeting Address,Pre Bid Meeting Date,Bid Opening Place,Should Allow NDA Tender,Allow Preferential Bidder,Tender Stage,Contract Date :,Contract Value :,Work Completion Period in days :,Updated By :,Updated on :,AOC document :,AOC Description :,S.No,Bid Number,Bidder Name,Awarded Currency,Awarded Value,S.No.1,Bid Number.1,Bidder Name.1,Submitted Date,Status,Remarks,Status Updated On,Type :,Summary :,Updated By :.1,Updated On :,Document :,BOQ Comparative Chart :,Committee Chairperson/Co-ordinator Name :,Committee Chairperson/Co-ordinator Type :,Committee Members :,Updated By :.2,Updated on :.1,Document :.1,Organisation Chain :,Tender ID :,Tender Ref No :,Tender Title :,Committee Chairperson/Co-ordinator Name :.1,Committee Chairperson/Co-ordinator Type :.1,Committee Members :.1,Updated By :.3,Updated On :.1,Document :.2,Tender Stage
CE RW I||RW-CIRCLE-SUNDARGARH||RW-Division-Sundargarh II,Online -EERKL-08 of 2024-25,2024_CERWI_105745_1,Yes,Open Tender,Percentage,Works,1.0,No,No,Online,No,No,No,1.0,Fee/PreQual/Technical/Finance,.pdf,Affidavit Towards Authenticity of Documents,17-Oct-2024 12:00 PM,25-Oct-2024 09:00 AM,17-Oct-2024 12:00 PM,24-Oct-2024 06:00 PM,17-Oct-2024 12:00 PM ,23-Oct-2024 06:00 PM ,17-Oct-2024 12:00 PM,24-Oct-2024 06:00 PM,"7,700",Yes,fixed,,Nil,Nil,1.0,ICICI BANK,"4,000",0.0,Nil,Nil,No,"Ececutive Engineer, RW Division,Rourkela","Office of the Executive Engineer,RW Division,Rourk","Construction of Additional class room at Ispat Higher Secondary School, Rourkela for the year 2024-25","Construction of Additional class room at Ispat Higher Secondary School, Rourkela for the year 2024-25",Please refer Tender documents. ,NA ,"7,64,393",Civil Works - Buildings,NA ,Tender,90.0,120.0,ROURKELA,769004.0,NA ,NA ,NA ,"Office of the Executive Engineer,RW Division,Rourk",No ,No,AOC,13-Dec-2024,"INR 649,810",120.0,Kishore Chandra Khatua,13-Dec-2024 02:26 PM,01.pdf (500.00 KB),Rs. 649810/- Awarded Cost,1.0,2591740.0,MANORANJAN JENA,INR,"649,810",1,2584141,MAA SAMALEI TRADERS,19-Oct-2024 12:03 PM,Rejected-AOC,Rejected,13-Dec-2024 02:26 PM,Finance,6 bidders Applied,Kishore Chandra Khatua,13-Dec-2024 02:13 PM,,BOQ Comparative Chart,"AE Estt, DAO, SE",Internal,"AE Estt, DAO, SE",Kishore Chandra Khatua,13-Dec-2024 02:21 PM,finsummary_509941.pdf (499.94 KB),CE RW I||RW-CIRCLE-SUNDARGARH||RW-Division-Sundargarh II,2024_CERWI_105745_1,Online -EERKL-08 of 2024-25,"Construction of Additional class room at Ispat Higher Secondary School, Rourkela for the year 2024-25","AE Estt, DAO, SE",Internal,"AE Estt, DAO, SE",Kishore Chandra Khatua,13-Dec-2024 02:18 PM,techsummary_509941.pdf (499.94 KB),AOC
,,,,,,,,,,,,,,,,.pdf,"PAN Card, GSTN, Regestration Certificate another as per DTCN, Contact No.",,,,,,,,,,,,,,,2.0,ICICI NEFT/RTGS,,,,,,,,,,,,,,,,,,,,,,,,,,AOC,,,,,,,,,,,,,2,2591740,MANORANJAN JENA,23-Oct-2024 09:07 PM,Accepted-AOC,Awarded,13-Dec-2024 02:26 PM,,,,,,,,,,,,,,,,,,,,,,,AOC
,,,,,,,,,,,,,,,,.pdf,Affidavit Regarding norelation certificate,,,,,,,,,,,,,,,,,,,,,,,,,,,,,,,,,,,,,,,,,,AOC,,,,,,,,,,,,,3,2592337,SANGHAMITRA MISHRA,24-Oct-2024 01:41 PM,Rejected-AOC,Rejected,13-Dec-2024 02:26 PM,,,,,,,,,,,,,,,,,,,,,,,AOC
,,,,,,,,,,,,,,,,.pdf,Affidavit Regarding correctness of information,,,,,,,,,,,,,,,,,,,,,,,,,,,,,,,,,,,,,,,,,,AOC,,,,,,,,,,,,,4,2592052,SUJATA TRIPATHY,24-Oct-2024 11:17 AM,Rejected-AOC,Rejected,13-Dec-2024 02:26 PM,,,,,,,,,,,,,,,,,,,,,,,AOC
,,,,,,,,,,,,,,,,.xls,BOQ,,,,,,,,,,,,,,,,,,,,,,,,,,,,,,,,,,,,,,,,,,AOC,,,,,,,,,,,,,5,2583143,SUKADEV SAHOO,18-Oct-2024 12:51 PM,Rejected-AOC,Rejected,13-Dec-2024 02:26 PM,,,,,,,,,,,,,,,,,,,,,,,AOC
,,,,,,,,,,,,,,,,,,,,,,,,,,,,,,,,,,,,,,,,,,,,,,,,,,,,,,,,,,,AOC,,,,,,,,,,,,,6,2592403,VIVAAN AGENCY,24-Oct-2024 01:54 PM,Rejected-AOC,Rejected,13-Dec-2024 02:26 PM,,,,,,,,,,,,,,,,,,,,,,,AOC
