Organisation Chain,Tender Reference Number,Tender ID,Withdrawal Allowed,Tender Type,Form of contract,Tender Category,No. of Covers,General Technical Evaluation Allowed,ItemWise Technical Evaluation Allowed,Payment Mode,Is Multi Currency Allowed For BOQ,Is Multi Currency Allowed For Fee,Allow Two Stage Bidding,Cover No,Cover,Document Type,Description,Publish Date,Bid Opening Date,Document Download / Sale Start Date,Document Download / Sale End Date,Clarification Start Date,Clarification End Date,Bid Submission Start Date,Bid Submission End Date,EMD Amount in ₹,EMD Exemption Allowed,EMD Fee Type,EMD Percentage,EMD Payable To,EMD Payable At,S.No,Bank Name,Tender Fee in ₹,VAT Charges in ₹,Fee Payable To,Fee Payable At,Tender Fee Exemption Allowed,Name,Address,Title,Work Description,Pre Qualification Details,Independent External Monitor/Remarks,Tender Value in ₹,Product Category,Sub category,Contract Type,Bid Validity(Days),Period Of Work(Days),Location,Pincode,Pre Bid Meeting Place,Pre Bid Meeting Address,Pre Bid Meeting Date,Bid Opening Place,Should Allow NDA Tender,Allow Preferential Bidder,Tender Stage,Contract Date :,Contract Value :,Work Completion Period in days :,Updated By :,Updated on :,AOC document :,AOC Description :,S.No,Bid Number,Bidder Name,Awarded Currency,Awarded Value,S.No.1,Bid Number.1,Bidder Name.1,Submitted Date,Status,Remarks,Status Updated On,Type :,Summary :,Updated By :.1,Updated On :,Document :,BOQ Comparative Chart :,Committee Chairperson/Co-ordinator Name :,Committee Chairperson/Co-ordinator Type :,Committee Members :,Updated By :.2,Updated on :.1,Document :.1,Organisation Chain :,Tender ID :,Tender Ref No :,Tender Title :,Committee Chairperson/Co-ordinator Name :.1,Committee Chairperson/Co-ordinator Type :.1,Committee Members :.1,Updated By :.3,Updated On :.1,Document :.2,Tender Stage
EIC-CIVIL||SERNB-CIRCLE-NORTHERN||EERNB-DIVN-BOLANGIR,BGR (R and B)-02 of 2024-25,2024_EICCL_104114_1,Yes,National Competitive Bid,Percentage,Works,1.0,No,No,Online,No,No,No,1.0,Fee/PreQual/Technical/Finance,.pdf,"Online proof Copy Tender cost and EMD, Registration Certificate, PAN, GSTIN,etc.",05-Aug-2024 06:00 PM,13-Aug-2024 11:00 AM,05-Aug-2024 06:00 PM,12-Aug-2024 05:00 PM,05-Aug-2024 06:00 PM ,08-Aug-2024 05:00 PM ,05-Aug-2024 06:00 PM,12-Aug-2024 05:00 PM,"15,700",Yes,fixed,,Nil,Nil,1.0,ICICI BANK,"6,000",0.0,Nil,Nil,No,"S.E,Balangir (R and B) Division,Balangir","O/O S.E,Balangir (R and B) Division,Balangir","Supply, Installation ,Testing and Commissioning of 1x100 KVA DG Set with AMF Control Panel at Circuit House,Balangir",Electrical Work,Please refer tender document ,NA ,"15,62,137",Electrical Works,NA ,Tender,90.0,30.0,Balangir,767001.0,NA ,NA ,NA ,"O/O S.E,Balangir (R and B) Division,Balangir",No ,No,AOC,04-Oct-2024,"INR 1,475,282",30.0,Prabhasini Sarangi,27-Dec-2024 11:21 AM,AOCof1x100kvadgsetcircuithouse.pdf (282.00 KB),"Work is awarded to India Electrical House, MV class contractor",1.0,2527122.0,INDIA ELECTRICAL HOUSE,INR,"1,475,282",1,2526728,AKARSHAN JHA,11-Aug-2024 10:23 PM,Rejected-Finance,Not Accepted under para 6.3.15 Note-III of OPWD code vol.I,21-Sep-2024 05:51 PM,Finance,Total 5 (Five) Nos. bidders were participated and their documents are opened for further evaluation,Prabhasini Sarangi,13-Aug-2024 01:12 PM,finance_504335.pdf,BOQ Comparative Chart,N.K.Ghadai,Internal,,Roshan Tigga,21-Sep-2024 05:51 PM,finsummary_504335.pdf (492.92 KB),EIC-CIVIL||SERNB-CIRCLE-NORTHERN||EERNB-DIVN-BOLANGIR,2024_EICCL_104114_1,BGR (R and B)-02 of 2024-25,"Supply, Installation ,Testing and Commissioning of 1x100 KVA DG Set with AMF Control Panel at Circuit House,Balangir",N.K.Ghadai,Internal,,Roshan Tigga,21-Sep-2024 05:37 PM,techsummary_504335.pdf (740.57 KB),AOC
,,,,,,,,,,,,,,,,.pdf,"No relationship Certificate, affidavit, Work experience certificate etc.",,,,,,,,,,,,,,,2.0,ICICI NEFT/RTGS,,,,,,,,,,,,,,,,,,,,,,,,,,AOC,,,,,,,,,,,,,2,2527122,INDIA ELECTRICAL HOUSE,12-Aug-2024 01:39 PM,Accepted-AOC,The India Electrical House stood as L1 bidder which is 5.5 percent less than the tender amount,27-Dec-2024 11:21 AM,,,,,,,,,,,,,,,,,,,,,,,AOC
,,,,,,,,,,,,,,,,.pdf,Others document as per DTCN,,,,,,,,,,,,,,,,,,,,,,,,,,,,,,,,,,,,,,,,,,AOC,,,,,,,,,,,,,3,2527039,MINATI MAHARANA,12-Aug-2024 01:16 PM,Rejected-Finance,Not Accepted under para 6.3.15 Note-III of OPWD code vol.I,21-Sep-2024 05:51 PM,,,,,,,,,,,,,,,,,,,,,,,AOC
,,,,,,,,,,,,,,,,.xls,BOQ,,,,,,,,,,,,,,,,,,,,,,,,,,,,,,,,,,,,,,,,,,AOC,,,,,,,,,,,,,4,2526519,RAKESH PATTANAYAK,11-Aug-2024 01:18 PM,Rejected-Finance,Not Accepted under para 6.3.15 Note-III of OPWD code vol.I,21-Sep-2024 05:51 PM,,,,,,,,,,,,,,,,,,,,,,,AOC
,,,,,,,,,,,,,,,,,,,,,,,,,,,,,,,,,,,,,,,,,,,,,,,,,,,,,,,,,,,AOC,,,,,,,,,,,,,5,2525633,RM ENTERPRISES,12-Aug-2024 11:12 AM,Rejected-Finance,Not Accepted under para 6.3.15 Note-III of OPWD code vol.I,21-Sep-2024 05:51 PM,,,,,,,,,,,,,,,,,,,,,,,AOC
