Organisation Chain,Tender Reference Number,Tender ID,Withdrawal Allowed,Tender Type,Form of contract,Tender Category,No. of Covers,General Technical Evaluation Allowed,ItemWise Technical Evaluation Allowed,Payment Mode,Is Multi Currency Allowed For BOQ,Is Multi Currency Allowed For Fee,Allow Two Stage Bidding,Cover No,Cover,Document Type,Description,Publish Date,Bid Opening Date,Document Download / Sale Start Date,Document Download / Sale End Date,Clarification Start Date,Clarification End Date,Bid Submission Start Date,Bid Submission End Date,EMD Amount in ₹,EMD Exemption Allowed,EMD Fee Type,EMD Percentage,EMD Payable To,EMD Payable At,S.No,Bank Name,Tender Fee in ₹,VAT Charges in ₹,Fee Payable To,Fee Payable At,Tender Fee Exemption Allowed,Name,Address,Title,Work Description,Pre Qualification Details,Independent External Monitor/Remarks,Tender Value in ₹,Product Category,Sub category,Contract Type,Bid Validity(Days),Period Of Work(Days),Location,Pincode,Pre Bid Meeting Place,Pre Bid Meeting Address,Pre Bid Meeting Date,Bid Opening Place,Should Allow NDA Tender,Allow Preferential Bidder,Tender Stage,Contract Date :,Contract Value :,Work Completion Period in days :,Updated By :,Updated on :,AOC document :,S.No,Bid Number,Bidder Name,Awarded Currency,Awarded Value,S.No.1,Bid Number.1,Bidder Name.1,Submitted Date,Status,Remarks,Status Updated On,Type :,Summary :,Updated By :.1,Updated On :,Document :,BOQ Comparative Chart :,Committee Chairperson/Co-ordinator Name :,Committee Chairperson/Co-ordinator Type :,Committee Members :,Updated By :.2,Updated on :.1,Document :.1,Organisation Chain :,Tender ID :,Tender Ref No :,Tender Title :,Committee Chairperson/Co-ordinator Name :.1,Committee Chairperson/Co-ordinator Type :.1,Committee Members :.1,Updated By :.3,Updated On :.1,Document :.2,Tender Stage
Municipal Bodies||Belpahar Municipal Council,EO/BPHM/01/24-25,2024_ORULB_106388_12,Yes,Open Tender,Percentage,Works,1.0,No,No,Online,No,No,No,1.0,Fee/PreQual/Technical/Finance,.pdf,Scanned copies of required documents as per DTCN,06-Nov-2024 10:00 AM,21-Nov-2024 11:00 AM,06-Nov-2024 10:00 AM,20-Nov-2024 05:00 PM,NA ,NA ,06-Nov-2024 10:00 AM,20-Nov-2024 05:00 PM,"16,300",Yes,fixed,,Nil,Nil,1.0,ICICI BANK,"6,000",0.0,Nil,Nil,No,"Executive Officer,Belpahar Municipality",At/Po-Belpahar Dist-Jharsuguda Odisha-768218,"Construction of Addl. Class Room at Thungiadera Primary School, Belpahar","Construction of Addl. Class Room at Thungiadera Primary School, Belpahar in W.No.02",Please refer Tender documents. ,NA ,,Civil Works - Buildings,NA ,Tender,90.0,120.0,Belpahar Municipality,768218.0,NA ,NA ,NA ,Belpahar Municipality Office,No ,No,AOC,23-Dec-2024,"INR 1,345,468.68",120.0,Nilakantha Kisan,23-Dec-2024 01:21 PM,12.pdf (242.00 KB),1.0,2646656.0,J N R Dora,INR,"1,630,000",1,2656303,BIBHUTI PRASAD RANA,20-Nov-2024 04:03 PM,Rejected-AOC,Not win the lottery,23-Dec-2024 01:22 PM,Finance,ok,Nilakantha Kisan,02-Dec-2024 12:02 PM,finance_514540.pdf,BOQ Comparative Chart,Nimai Charan Panda,Internal,,Nilakantha Kisan,19-Dec-2024 05:13 PM,finsummary_514540.pdf (256.49 KB),Municipal Bodies||Belpahar Municipal Council,2024_ORULB_106388_12,EO/BPHM/01/24-25,"Construction of Addl. Class Room at Thungiadera Primary School, Belpahar",Nimai Charan Panda,Internal,,Nilakantha Kisan,02-Dec-2024 12:42 PM,techsummary_514540.pdf (256.49 KB),AOC
,,,,,,,,,,,,,,,,.pdf,Scanned copies of Online deposit receipt of EMD and Cost of bid document,,,,,,,,,,,,,,,2.0,ICICI NEFT/RTGS,,,,,,,,,,,,,,,,,,,,,,,,,,AOC,,,,,,,,,,,,2,2655441,Bigyan Ranjan Swain,20-Nov-2024 11:45 AM,Rejected-AOC,Not win the lottery,23-Dec-2024 01:22 PM,,,,,,,,,,,,,,,,,,,,,,,AOC
,,,,,,,,,,,,,,,,.xls,BOQ,,,,,,,,,,,,,,,,,,,,,,,,,,,,,,,,,,,,,,,,,,AOC,,,,,,,,,,,,3,2646656,J N R Dora,20-Nov-2024 04:22 PM,Accepted-AOC,Tender finalised through transparent lottery system drawn among L1 bidders and winner of lottery,23-Dec-2024 01:22 PM,,,,,,,,,,,,,,,,,,,,,,,AOC
,,,,,,,,,,,,,,,,,,,,,,,,,,,,,,,,,,,,,,,,,,,,,,,,,,,,,,,,,,,AOC,,,,,,,,,,,,4,2635587,J. Rajendra Dora,20-Nov-2024 04:28 PM,Not Admitted-Fee/PreQual/Technical/Finance,Others-Required works experience not submitted as per DTCN,02-Dec-2024 12:02 PM,,,,,,,,,,,,,,,,,,,,,,,AOC
,,,,,,,,,,,,,,,,,,,,,,,,,,,,,,,,,,,,,,,,,,,,,,,,,,,,,,,,,,,AOC,,,,,,,,,,,,5,2655380,lalu kishan,20-Nov-2024 11:01 AM,Rejected-AOC,Not win the lottery,23-Dec-2024 01:22 PM,,,,,,,,,,,,,,,,,,,,,,,AOC
,,,,,,,,,,,,,,,,,,,,,,,,,,,,,,,,,,,,,,,,,,,,,,,,,,,,,,,,,,,AOC,,,,,,,,,,,,6,2656056,M/S SASWAT ENTERPRISES,20-Nov-2024 02:32 PM,Rejected-AOC,Not win the lottery,23-Dec-2024 01:22 PM,,,,,,,,,,,,,,,,,,,,,,,AOC
,,,,,,,,,,,,,,,,,,,,,,,,,,,,,,,,,,,,,,,,,,,,,,,,,,,,,,,,,,,AOC,,,,,,,,,,,,7,2656200,SUBASH CHANDRA MEHER PROP. RAJBIR CONSTRUCTION,20-Nov-2024 03:33 PM,Rejected-AOC,Not win the lottery,23-Dec-2024 01:22 PM,,,,,,,,,,,,,,,,,,,,,,,AOC
,,,,,,,,,,,,,,,,,,,,,,,,,,,,,,,,,,,,,,,,,,,,,,,,,,,,,,,,,,,AOC,,,,,,,,,,,,8,2655247,SUJIT KUMAR PRADHAN,20-Nov-2024 09:47 AM,Rejected-AOC,Not win the lottery,23-Dec-2024 01:22 PM,,,,,,,,,,,,,,,,,,,,,,,AOC
,,,,,,,,,,,,,,,,,,,,,,,,,,,,,,,,,,,,,,,,,,,,,,,,,,,,,,,,,,,AOC,,,,,,,,,,,,9,2655779,TANKADHAR KHAMARI,20-Nov-2024 01:49 PM,Rejected-AOC,Not win the lottery,23-Dec-2024 01:22 PM,,,,,,,,,,,,,,,,,,,,,,,AOC
