Organisation Chain,Tender Reference Number,Tender ID,Withdrawal Allowed,Tender Type,Form of contract,Tender Category,No. of Covers,General Technical Evaluation Allowed,ItemWise Technical Evaluation Allowed,Payment Mode,Is Multi Currency Allowed For BOQ,Is Multi Currency Allowed For Fee,Allow Two Stage Bidding,Cover No,Cover,Document Type,Description,Publish Date,Bid Opening Date,Document Download / Sale Start Date,Document Download / Sale End Date,Clarification Start Date,Clarification End Date,Bid Submission Start Date,Bid Submission End Date,EMD Amount in ₹,EMD Exemption Allowed,EMD Fee Type,EMD Percentage,EMD Payable To,EMD Payable At,S.No,Bank Name,Tender Fee in ₹,VAT Charges in ₹,Fee Payable To,Fee Payable At,Tender Fee Exemption Allowed,Name,Address,Title,Work Description,Pre Qualification Details,Independent External Monitor/Remarks,Tender Value in ₹,Product Category,Sub category,Contract Type,Bid Validity(Days),Period Of Work(Days),Location,Pincode,Pre Bid Meeting Place,Pre Bid Meeting Address,Pre Bid Meeting Date,Bid Opening Place,Should Allow NDA Tender,Allow Preferential Bidder,Tender Stage,Contract Date :,Contract Value :,Work Completion Period in days :,Updated By :,Updated on :,AOC document :,AOC Description :,S.No,Bid Number,Bidder Name,Awarded Currency,Awarded Value,S.No.1,Bid Number.1,Bidder Name.1,Submitted Date,Status,Remarks,Status Updated On,Type :,Summary :,Updated By :.1,Updated On :,Document :,BOQ Comparative Chart :,Committee Chairperson/Co-ordinator Name :,Committee Chairperson/Co-ordinator Type :,Committee Members :,Updated By :.2,Updated on :.1,Document :.1,Organisation Chain :,Tender ID :,Tender Ref No :,Tender Title :,Committee Chairperson/Co-ordinator Name :.1,Committee Chairperson/Co-ordinator Type :.1,Committee Members :.1,Updated By :.3,Updated On :.1,Document :.2,Tender Stage
EIC-CIVIL||SERNB-CIRCLE-KHURDA||EERNB DIVN KHURDA,NIT-45-23-24,2024_EICCL_99533_1,Yes,Open Tender,Percentage,Works,1.0,No,No,Online,No,No,No,1.0,Fee/PreQual/Technical/Finance,.pdf,"Online proof copy Tender cost, EMD, GSTIN, PAN, Contractor RC and Affidavit",10-Jan-2024 03:00 PM,19-Jan-2024 11:30 AM,10-Jan-2024 03:00 PM,18-Jan-2024 05:00 PM,NA ,NA ,10-Jan-2024 03:00 PM,18-Jan-2024 05:00 PM,"33,747",Yes,fixed,,Nil,Nil,1.0,ICICI BANK,"6,000",0.0,Nil,Nil,No,SE RANDB KHURDA,"O/o the SUPERINTENDING Engineer R and B Division, Khurda","Supply, Installation, testing commissioning of the CCTVs (IP Camera) with audio and storage facility for 90 days at Banapur Court for the year 2023-24","Supply, Installation, testing commissioning of the CCTVs (IP Camera) with audio and storage facility for 90 days at Banapur Court for the year 2023-24",Please refer Tender documents. ,NA ,"33,74,675",Electrical Works,NA ,Tender,90.0,30.0,khordha,752055.0,NA ,NA ,NA ,O/O SE RANDB KHURDA,No ,No,AOC,22-Jul-2024,"INR 2,868,811",30.0,Shibalal Sahoo,18-Dec-2024 05:03 PM,2.pdf (200.00 KB),Agreement done,1.0,2397515.0,MARUTI CONSTRUCTIONS,INR,"2,868,811.25",1,2397846,AJANTA ENTERPRISES,18-Jan-2024 03:34 PM,Rejected-AOC,Not successful in transparent lottery,18-Dec-2024 05:03 PM,Finance,5 nos bidders are admitted,Shibalal Sahoo,21-Feb-2024 03:59 PM,finance_484081.pdf,BOQ Comparative Chart,"EE, Khordha (RB) Division",Internal,"DAO, Estimator",Shibalal Sahoo,02-Mar-2024 01:45 PM,finsummary_484081.pdf (482.41 KB),EIC-CIVIL||SERNB-CIRCLE-KHURDA||EERNB DIVN KHURDA,2024_EICCL_99533_1,NIT-45-23-24,"Supply, Installation, testing commissioning of the CCTVs (IP Camera) with audio and storage facility for 90 days at Banapur Court for the year 2023-24","EE, Khordha (RB) Division",Internal,"DAO, Estimator",Shibalal Sahoo,21-Feb-2024 04:01 PM,techsummary_484081.pdf (30.12 KB),AOC
,,,,,,,,,,,,,,,,.pdf,Other Documents as per DTCN,,,,,,,,,,,,,,,2.0,ICICI NEFT/RTGS,,,,,,,,,,,,,,,,,,,,,,,,,,AOC,,,,,,,,,,,,,2,2397515,MARUTI CONSTRUCTIONS,18-Jan-2024 01:14 PM,Accepted-AOC,successful in transparent lottery,18-Dec-2024 05:03 PM,,,,,,,,,,,,,,,,,,,,,,,AOC
,,,,,,,,,,,,,,,,.xls,Bill of Quantity,,,,,,,,,,,,,,,,,,,,,,,,,,,,,,,,,,,,,,,,,,AOC,,,,,,,,,,,,,3,2397698,MESSERS OMM SAI ELECTRICALS,18-Jan-2024 02:48 PM,Rejected-AOC,Not successful in transparent lottery,18-Dec-2024 05:03 PM,,,,,,,,,,,,,,,,,,,,,,,AOC
,,,,,,,,,,,,,,,,,,,,,,,,,,,,,,,,,,,,,,,,,,,,,,,,,,,,,,,,,,,AOC,,,,,,,,,,,,,4,2397633,SANSKRUTI ASSOCIATES PRIVATE LIMITED,18-Jan-2024 03:17 PM,Rejected-AOC,Not successful in transparent lottery,18-Dec-2024 05:03 PM,,,,,,,,,,,,,,,,,,,,,,,AOC
,,,,,,,,,,,,,,,,,,,,,,,,,,,,,,,,,,,,,,,,,,,,,,,,,,,,,,,,,,,AOC,,,,,,,,,,,,,5,2397621,SMART I TECHNOLOGIES,18-Jan-2024 03:18 PM,Rejected-AOC,Not successful in transparent lottery,18-Dec-2024 05:03 PM,,,,,,,,,,,,,,,,,,,,,,,AOC
