Organisation Chain,Tender Reference Number,Tender ID,Withdrawal Allowed,Tender Type,Form of contract,Tender Category,No. of Covers,General Technical Evaluation Allowed,ItemWise Technical Evaluation Allowed,Payment Mode,Is Multi Currency Allowed For BOQ,Is Multi Currency Allowed For Fee,Allow Two Stage Bidding,Cover No,Cover,Document Type,Description,Publish Date,Bid Opening Date,Document Download / Sale Start Date,Document Download / Sale End Date,Clarification Start Date,Clarification End Date,Bid Submission Start Date,Bid Submission End Date,EMD Amount in ₹,EMD Exemption Allowed,EMD Fee Type,EMD Percentage,EMD Payable To,EMD Payable At,S.No,Bank Name,Tender Fee in ₹,VAT Charges in ₹,Fee Payable To,Fee Payable At,Tender Fee Exemption Allowed,Name,Address,Title,Work Description,Pre Qualification Details,Independent External Monitor/Remarks,Tender Value in ₹,Product Category,Sub category,Contract Type,Bid Validity(Days),Period Of Work(Days),Location,Pincode,Pre Bid Meeting Place,Pre Bid Meeting Address,Pre Bid Meeting Date,Bid Opening Place,Should Allow NDA Tender,Allow Preferential Bidder,Tender Stage,Contract Date :,Contract Value :,Work Completion Period in days :,Updated By :,Updated on :,AOC document :,AOC Description :,S.No,Bid Number,Bidder Name,Awarded Currency,Awarded Value,S.No.1,Bid Number.1,Bidder Name.1,Submitted Date,Status,Remarks,Status Updated On,Type :,Summary :,Updated By :.1,Updated On :,Document :,BOQ Comparative Chart :,Committee Chairperson/Co-ordinator Name :,Committee Chairperson/Co-ordinator Type :,Committee Members :,Updated By :.2,Updated on :.1,Document :.1,Organisation Chain :,Tender ID :,Tender Ref No :,Tender Title :,Committee Chairperson/Co-ordinator Name :.1,Committee Chairperson/Co-ordinator Type :.1,Committee Members :.1,Updated By :.3,Updated On :.1,Document :.2,Tender Stage
Orissa Lift Irrigation Corporation||LI KORAPUT||LI Division Nawarangpur,1159 dated 21.09.2022,2022_OLIC_81899_7,Yes,Open Tender,Percentage,Works,1.0,No,No,Online,No,No,No,1.0,Fee/PreQual/Technical/Finance,.pdf,"Valid License, PAN, GST challan,Affidavit, JV, Similar work experience",07-Oct-2022 10:00 AM,18-Oct-2022 11:00 AM,07-Oct-2022 10:00 AM,17-Oct-2022 05:00 PM,07-Oct-2022 10:00 AM ,13-Oct-2022 01:00 PM ,07-Oct-2022 10:00 AM,17-Oct-2022 05:00 PM,"14,120",Yes,percentage,1.0%,Nil,Nil,1.0,ICICI BANK,"6,000",0.0,Nil,Nil,No,"Executive Engineer, Lift irrigation Division, Naba","Office of the Executive Engineer, Lift Irrigation Division, Nabarangpur-764059",Kaliaguda-I,"Re-installation, electrification and energisation of Kaliaguda -I L.I.P under Papadahandi Block",As per DTCN ,NA ,"14,12,000",Civil Works - Lift Irrigation Schemes,Electrification ,Tender,180.0,90.0,Nabarangpur,764059.0,NA ,NA ,NA ,"Office of the Executive Engineer, Lift Irrigation",No ,No,AOC,24-Nov-2022,"INR 1,416,403",90.0,Dillip Kumar Das,24-Dec-2024 11:49 AM,kaliaguda-I.pdf (941.00 KB),"Execution of work for re-installation, commissioning and energisation of Kaliaguda-I L.I Project under Papadahandi Block in Nabarangpur District under State Plan 2022-23",1.0,1952593.0,M/S U.S. QUALITY ENGINEERING WORKS,INR,"1,416,403",1,1950390,CHANDAN NAYAK,14-Oct-2022 11:58 AM,Rejected-AOC,Lost in Lottery,24-Dec-2024 11:50 AM,Finance,Opened successfully,Dillip Kumar Das,19-Oct-2022 03:55 PM,finance_412150.pdf,BOQ Comparative Chart,"Executive Engineer, L.I.Division, Nabarangpur",Internal,"Executive Engineer, Divisional Accountant, Estimator",Dillip Kumar Das,16-Nov-2022 11:41 AM,finsummary_412150.pdf (280.58 KB),Orissa Lift Irrigation Corporation||LI KORAPUT||LI Division Nawarangpur,2022_OLIC_81899_7,1159 dated 21.09.2022,Kaliaguda-I,"Executive Engineer, L.I.Division, Nabarangpur",Internal,"Executive Engineer, Divisional Accountant, Estimator",Dillip Kumar Das,19-Oct-2022 04:34 PM,techsummary_412150.pdf (27.98 KB),AOC
,,,,,,,,,,,,,,,,.pdf,TCN Documents,,,,,,,,,,,,,,,2.0,ICICI NEFT/RTGS,,,,,,,,,,,,,,,,,,,,,,,,,,AOC,,,,,,,,,,,,,2,1952869,HARA PRASAD NAYAK,17-Oct-2022 01:58 PM,Rejected-AOC,Lost in Lottery,24-Dec-2024 11:50 AM,,,,,,,,,,,,,,,,,,,,,,,AOC
,,,,,,,,,,,,,,,,.xls,Bill of Quantities,,,,,,,,,,,,,,,,,,,,,,,,,,,,,,,,,,,,,,,,,,AOC,,,,,,,,,,,,,3,1952945,HEMANT KUMAR NAYAK,17-Oct-2022 12:00 PM,Rejected-Technical,Disqualified for not submitting electrical experience certificate,19-Oct-2022 04:34 PM,,,,,,,,,,,,,,,,,,,,,,,AOC
,,,,,,,,,,,,,,,,,,,,,,,,,,,,,,,,,,,,,,,,,,,,,,,,,,,,,,,,,,,AOC,,,,,,,,,,,,,4,1953041,JAGADISH ENTERPRISES,17-Oct-2022 01:01 PM,Rejected-Technical,Disqualified for similar work exprience certificate not submitted,19-Oct-2022 04:34 PM,,,,,,,,,,,,,,,,,,,,,,,AOC
,,,,,,,,,,,,,,,,,,,,,,,,,,,,,,,,,,,,,,,,,,,,,,,,,,,,,,,,,,,AOC,,,,,,,,,,,,,5,1951691,M/S MAHAMAYEE ENTERPRISES,15-Oct-2022 11:23 PM,Rejected-Technical,Disqualified for similar work exprience certificate not submitted,19-Oct-2022 04:34 PM,,,,,,,,,,,,,,,,,,,,,,,AOC
,,,,,,,,,,,,,,,,,,,,,,,,,,,,,,,,,,,,,,,,,,,,,,,,,,,,,,,,,,,AOC,,,,,,,,,,,,,6,1952593,M/S U.S. QUALITY ENGINEERING WORKS,16-Oct-2022 12:39 PM,Accepted-AOC,Won the Lottery,24-Dec-2024 11:50 AM,,,,,,,,,,,,,,,,,,,,,,,AOC
,,,,,,,,,,,,,,,,,,,,,,,,,,,,,,,,,,,,,,,,,,,,,,,,,,,,,,,,,,,AOC,,,,,,,,,,,,,7,1952697,Sambit Kumar Dash,16-Oct-2022 05:17 PM,Rejected-AOC,Lost in Lottery,24-Dec-2024 11:50 AM,,,,,,,,,,,,,,,,,,,,,,,AOC
