Organisation Chain,Tender Reference Number,Tender ID,Withdrawal Allowed,Tender Type,Form of contract,Tender Category,No. of Covers,General Technical Evaluation Allowed,ItemWise Technical Evaluation Allowed,Payment Mode,Is Multi Currency Allowed For BOQ,Is Multi Currency Allowed For Fee,Allow Two Stage Bidding,Cover No,Cover,Document Type,Description,Publish Date,Bid Opening Date,Document Download / Sale Start Date,Document Download / Sale End Date,Clarification Start Date,Clarification End Date,Bid Submission Start Date,Bid Submission End Date,Financial Bid Opening Date,EMD Amount in ₹,EMD Exemption Allowed,EMD Fee Type,EMD Percentage,EMD Payable To,EMD Payable At,S.No,Bank Name,Tender Fee in ₹,VAT Charges in ₹,Fee Payable To,Fee Payable At,Tender Fee Exemption Allowed,Name,Address,Title,Work Description,Pre Qualification Details,Independent External Monitor/Remarks,Tender Value in ₹,Product Category,Sub category,Contract Type,Bid Validity(Days),Period Of Work(Days),Location,Pincode,Pre Bid Meeting Place,Pre Bid Meeting Address,Pre Bid Meeting Date,Bid Opening Place,Should Allow NDA Tender,Allow Preferential Bidder,Tender Stage,Contract Date :,Contract Value :,Work Completion Period in days :,Updated By :,Updated on :,AOC document :,AOC Description :,S.No,Bid Number,Bidder Name,Awarded Currency,Awarded Value,S.No.1,Bid Number.1,Bidder Name.1,Submitted Date,Status,Remarks,Status Updated On,Type :,Summary :,Updated By :.1,Updated On :,Document :,BOQ Comparative Chart :,Committee Chairperson/Co-ordinator Name :,Committee Chairperson/Co-ordinator Type :,Committee Members :,Updated By :.2,Updated on :.1,Document :.1,Organisation Chain :,Tender ID :,Tender Ref No :,Tender Title :,Type :.1,Summary :.1,Updated By :.3,Updated On :.1,Document :.2,Committee Chairperson/Co-ordinator Name :.1,Committee Chairperson/Co-ordinator Type :.1,Committee Members :.1,Updated By :.4,Updated On :.2,Financial Bid Opening Date:,Document :.3,Tender Stage
"CE-BM,RVN Basin,Berhampur||S.E. Southern Irr. Circle I Berhampur","ACE,RBB-13/2023-24",2023_CEBMB_98703_1,Yes,National Competitive Bid,Percentage,Works,2.0,No,No,Online,No,No,No,1.0,Fee/PreQual/Technical,.pdf,"Tender Cost, EMD, GSTIN, PAN, Contractor RC,",26-Dec-2023 10:00 AM,10-Jan-2024 11:30 AM,26-Dec-2023 10:00 AM,09-Jan-2024 05:00 PM,26-Dec-2023 10:00 AM ,03-Jan-2024 05:00 PM ,26-Dec-2023 10:00 AM,09-Jan-2024 05:00 PM,19-Jan-2024 11:30 AM,"2,91,000",Yes,fixed,,Nil,Nil,1.0,ICICI BANK,"10,000",0.0,Nil,Nil,No,"Additional CE, RB Basin, Berhampur","Office of the Additional CE, RB Basin, Berhampur PIN 760004",Improvement to left flood bank of river Loharakhandi from Gamundi Bridge to Baranga Nallah Confluence point,Improvement to left flood bank of river Loharakhandi from Gamundi Bridge to Baranga Nallah Confluence point,Please refer Tender documents. ,NA ,"2,90,47,342",Civil Works - Roads,NA ,Tender,90.0,330.0,Bhanjanagar,761126.0,NA ,NA ,NA ,"O/o the Additional CE, RB Basin, Berhampur",No ,No,AOC,26-Dec-2024,"INR 24,693,146",330.0,Rajib Kumar Pandit,26-Dec-2024 12:51 PM,AOC.pdf (1314.00 KB),"Awarded to Sri Rajendra Kumar Giri""A"" Class Engg. Contractor vide Agt No. 40P1 of 2024-25 of Bhanjanagar Irrigation Division, Bhanjanagar.",1.0,2377382.0,RAJESH KUMAR GIRI,INR,"24,693,146",1,2380321,Ganesh Sahu,07-Jan-2024 08:11 PM,Rejected-Finance,Responsive but not eligible for lottery,26-Dec-2024 12:42 PM,Finance,Downloaded successfully.,Sucharita Panda,19-Jan-2024 12:16 PM,,BOQ Comparative Chart,"Rajib Kumar Pandit, Addl.CE",Internal,,Rajib Kumar Pandit,26-Dec-2024 12:42 PM,finsummary_480711.pdf (353.86 KB),"CE-BM,RVN Basin,Berhampur||S.E. Southern Irr. Circle I Berhampur",2023_CEBMB_98703_1,"ACE,RBB-13/2023-24",Improvement to left flood bank of river Loharakhandi from Gamundi Bridge to Baranga Nallah Confluence point,Technical,Downloaded successfully.,Sucharita Panda,18-Jan-2024 06:34 PM,,"Jagannath Pani, ACE",Internal,,JAGANNATH PANI,18-Jan-2024 06:41 PM,19-Jan-2024 11:30 AM,techsummary_480711.pdf (5822.73 KB),AOC
,,,,,,,,,,,,,,,,.pdf,"Affidavits, NRC, undertakings and any other document as per SBD/DTCN.",,,,,,,,,,,,,,,,2.0,ICICI NEFT/RTGS,,,,,,,,,,,,,,,,,,,,,,,,,,AOC,,,,,,,,,,,,,2,2380335,Kartikeswar Sahu,07-Jan-2024 07:36 PM,Rejected-Finance,Responsive but not eligible for lottery,26-Dec-2024 12:42 PM,,,,,,,,,,,,,,,,,,,,,,,,,,,,,AOC
,,,,,,,,,,,,,,2.0,Finance,.xls,BOQ,,,,,,,,,,,,,,,,,,,,,,,,,,,,,,,,,,,,,,,,,,,AOC,,,,,,,,,,,,,3,2382886,PRADYUMNA KUMAR MISHRA,09-Jan-2024 12:49 PM,Rejected-Finance,Looser of the lottery,26-Dec-2024 12:42 PM,,,,,,,,,,,,,,,,,,,,,,,,,,,,,AOC
,,,,,,,,,,,,,,,,,,,,,,,,,,,,,,,,,,,,,,,,,,,,,,,,,,,,,,,,,,,,AOC,,,,,,,,,,,,,4,2377382,RAJESH KUMAR GIRI,04-Jan-2024 07:48 PM,Accepted-AOC,Winner of the lottery,26-Dec-2024 12:51 PM,,,,,,,,,,,,,,,,,,,,,,,,,,,,,AOC
,,,,,,,,,,,,,,,,,,,,,,,,,,,,,,,,,,,,,,,,,,,,,,,,,,,,,,,,,,,,AOC,,,,,,,,,,,,,5,2375939,RAJESH PRADHAN,03-Jan-2024 01:36 PM,Rejected-Finance,Looser of the lottery,26-Dec-2024 12:42 PM,,,,,,,,,,,,,,,,,,,,,,,,,,,,,AOC
,,,,,,,,,,,,,,,,,,,,,,,,,,,,,,,,,,,,,,,,,,,,,,,,,,,,,,,,,,,,AOC,,,,,,,,,,,,,6,2383571,SHANKARA PRADHAN,09-Jan-2024 01:00 PM,Rejected-Finance,Looser of the lottery,26-Dec-2024 12:42 PM,,,,,,,,,,,,,,,,,,,,,,,,,,,,,AOC
