Organisation Chain,Tender Reference Number,Tender ID,Withdrawal Allowed,Tender Type,Form of contract,Tender Category,No. of Covers,General Technical Evaluation Allowed,ItemWise Technical Evaluation Allowed,Payment Mode,Is Multi Currency Allowed For BOQ,Is Multi Currency Allowed For Fee,Allow Two Stage Bidding,Cover No,Cover,Document Type,Description,Publish Date,Bid Opening Date,Document Download / Sale Start Date,Document Download / Sale End Date,Clarification Start Date,Clarification End Date,Bid Submission Start Date,Bid Submission End Date,EMD Amount in ₹,EMD Exemption Allowed,EMD Fee Type,EMD Percentage,EMD Payable To,EMD Payable At,S.No,Bank Name,Tender Fee in ₹,VAT Charges in ₹,Fee Payable To,Fee Payable At,Tender Fee Exemption Allowed,Name,Address,Title,Work Description,Pre Qualification Details,Independent External Monitor/Remarks,Tender Value in ₹,Product Category,Sub category,Contract Type,Bid Validity(Days),Period Of Work(Days),Location,Pincode,Pre Bid Meeting Place,Pre Bid Meeting Address,Pre Bid Meeting Date,Bid Opening Place,Should Allow NDA Tender,Allow Preferential Bidder,Tender Stage,Contract Date :,Contract Value :,Work Completion Period in days :,Updated By :,Updated on :,AOC document :,AOC Description :,S.No,Bid Number,Bidder Name,Awarded Currency,Awarded Value,S.No.1,Bid Number.1,Bidder Name.1,Submitted Date,Status,Remarks,Status Updated On,Type :,Summary :,Updated By :.1,Updated On :,Document :,BOQ Comparative Chart :,Committee Chairperson/Co-ordinator Name :,Committee Chairperson/Co-ordinator Type :,Committee Members :,Updated By :.2,Updated on :.1,Document :.1,Organisation Chain :,Tender ID :,Tender Ref No :,Tender Title :,Committee Chairperson/Co-ordinator Name :.1,Committee Chairperson/Co-ordinator Type :.1,Committee Members :.1,Updated By :.3,Updated On :.1,Document :.2,Tender Stage
Orissa Lift Irrigation Corporation||LI Western Circle Bhawanipatna||LI Division Subarnapur,OLIC-SNP-03-2023-24,2024_OLIC_102389_13,Yes,Open Tender,Percentage,Works,1.0,No,No,Online,No,No,No,1.0,Fee/PreQual/Technical/Finance,.pdf,"RC,GST Cert,GST Challan,Tender Cost, EMD Challan, Affidavits, Exp Cert and Joint venture As per DTCN",12-Mar-2024 11:00 AM,22-Mar-2024 11:00 AM,12-Mar-2024 11:00 AM,21-Mar-2024 05:00 PM,12-Mar-2024 11:00 AM ,20-Mar-2024 05:00 PM ,12-Mar-2024 11:00 AM,21-Mar-2024 05:00 PM,"26,844",Yes,fixed,,Nil,Nil,1.0,ICICI BANK,"6,000",0.0,Nil,Nil,No,Executive Engineer,O/o the Executive Engineer L.I Division Subarnapur,Installation and energisation of JAYAPUR-IV New LIPs under ULLUNDA Block in Subarnapur District (RIDF-XXIX-23-24),Installation and energisation of JAYAPUR-IV New LIPs under ULLUNDA Block in Subarnapur District (RIDF-XXIX-23-24),Please refer to the DTCN. ,NA ,"26,84,436",Civil Works - Others,River Lift Project (Revival) ,Tender,60.0,90.0,Sonepur,767017.0,NA ,NA ,NA ,Sonepur,No ,No,AOC,31-Dec-2024,"INR 2,684,436",90.0,Dilip Kar,31-Dec-2024 11:47 PM,DOCUMENTS.pdf (3491.00 KB),Success on Lottery System,1.0,2481591.0,MOHAMMED SALMAN,INR,"2,281,852",1,2482560,DINESH KUMAR KARNA,20-Mar-2024 06:10 PM,Rejected-Finance,Unsuccess on Lottery System,31-Dec-2024 11:42 PM,Finance,9 Nos. Bidders Opened,Dilip Kar,23-Nov-2024 07:53 AM,finance_499044.pdf,BOQ Comparative Chart,EE,Internal,,Dilip Kar,31-Dec-2024 11:42 PM,finsummary_499044.pdf (3491.37 KB),Orissa Lift Irrigation Corporation||LI Western Circle Bhawanipatna||LI Division Subarnapur,2024_OLIC_102389_13,OLIC-SNP-03-2023-24,Installation and energisation of JAYAPUR-IV New LIPs under ULLUNDA Block in Subarnapur District (RIDF-XXIX-23-24),EE,Internal,EE and others,Dilip Kar,31-Dec-2024 08:22 AM,techsummary_499044.pdf (198.70 KB),AOC
,,,,,,,,,,,,,,,,.xls,BOQ,,,,,,,,,,,,,,,2.0,ICICI NEFT/RTGS,,,,,,,,,,,,,,,,,,,,,,,,,,AOC,,,,,,,,,,,,,2,2478402,GHANASHYAM BAGH,21-Mar-2024 12:26 PM,Rejected-Finance,Unsuccess on Lottery System,31-Dec-2024 11:42 PM,,,,,,,,,,,,,,,,,,,,,,,AOC
,,,,,,,,,,,,,,,,,,,,,,,,,,,,,,,,,,,,,,,,,,,,,,,,,,,,,,,,,,,AOC,,,,,,,,,,,,,3,2481591,MOHAMMED SALMAN,20-Mar-2024 09:27 PM,Accepted-AOC,Success on Lottery System,31-Dec-2024 11:47 PM,,,,,,,,,,,,,,,,,,,,,,,AOC
,,,,,,,,,,,,,,,,,,,,,,,,,,,,,,,,,,,,,,,,,,,,,,,,,,,,,,,,,,,AOC,,,,,,,,,,,,,4,2481675,M/S PRADHAN CONSTRUCTION PROP SASMITA PRADHAN,21-Mar-2024 03:54 PM,Rejected-Finance,Unsuccess on Lottery System,31-Dec-2024 11:42 PM,,,,,,,,,,,,,,,,,,,,,,,AOC
,,,,,,,,,,,,,,,,,,,,,,,,,,,,,,,,,,,,,,,,,,,,,,,,,,,,,,,,,,,AOC,,,,,,,,,,,,,5,2481701,MS Shree Shyam and Co,20-Mar-2024 09:59 PM,Rejected-Finance,Unsuccess on Lottery System,31-Dec-2024 11:42 PM,,,,,,,,,,,,,,,,,,,,,,,AOC
,,,,,,,,,,,,,,,,,,,,,,,,,,,,,,,,,,,,,,,,,,,,,,,,,,,,,,,,,,,AOC,,,,,,,,,,,,,6,2482696,MUNITA MAHAKUD,21-Mar-2024 12:48 PM,Rejected-Finance,Unsuccess on Lottery System,31-Dec-2024 11:42 PM,,,,,,,,,,,,,,,,,,,,,,,AOC
,,,,,,,,,,,,,,,,,,,,,,,,,,,,,,,,,,,,,,,,,,,,,,,,,,,,,,,,,,,AOC,,,,,,,,,,,,,7,2483683,NANDI KISHOR BARIK,21-Mar-2024 03:01 PM,Rejected-Finance,Unsuccess on Lottery System,31-Dec-2024 11:42 PM,,,,,,,,,,,,,,,,,,,,,,,AOC
,,,,,,,,,,,,,,,,,,,,,,,,,,,,,,,,,,,,,,,,,,,,,,,,,,,,,,,,,,,AOC,,,,,,,,,,,,,8,2481897,PABITRA ELECTRICAL WORKSHOP,21-Mar-2024 11:32 AM,Not Admitted-Fee/PreQual/Technical/Finance,Others-Invalid Joint Venture,23-Nov-2024 07:53 AM,,,,,,,,,,,,,,,,,,,,,,,AOC
,,,,,,,,,,,,,,,,,,,,,,,,,,,,,,,,,,,,,,,,,,,,,,,,,,,,,,,,,,,AOC,,,,,,,,,,,,,9,2484164,SARAT CHANDRA MAHAPATRA,21-Mar-2024 04:03 PM,Rejected-Finance,Unsuccess on Lottery System,31-Dec-2024 11:42 PM,,,,,,,,,,,,,,,,,,,,,,,AOC
