Organisation Chain,Tender Reference Number,Tender ID,Withdrawal Allowed,Tender Type,Form of contract,Tender Category,No. of Covers,General Technical Evaluation Allowed,ItemWise Technical Evaluation Allowed,Payment Mode,Is Multi Currency Allowed For BOQ,Is Multi Currency Allowed For Fee,Allow Two Stage Bidding,Cover No,Cover,Document Type,Description,Publish Date,Bid Opening Date,Document Download / Sale Start Date,Document Download / Sale End Date,Clarification Start Date,Clarification End Date,Bid Submission Start Date,Bid Submission End Date,Financial Bid Opening Date,EMD Amount in ₹,EMD Exemption Allowed,EMD Fee Type,EMD Percentage,EMD Payable To,EMD Payable At,S.No,Bank Name,Tender Fee in ₹,VAT Charges in ₹,Fee Payable To,Fee Payable At,Tender Fee Exemption Allowed,Name,Address,Title,Work Description,Pre Qualification Details,Independent External Monitor/Remarks,Tender Value in ₹,Product Category,Sub category,Contract Type,Bid Validity(Days),Period Of Work(Days),Location,Pincode,Pre Bid Meeting Place,Pre Bid Meeting Address,Pre Bid Meeting Date,Bid Opening Place,Should Allow NDA Tender,Allow Preferential Bidder,Tender Stage,Contract Date :,Contract Value :,Work Completion Period in days :,Updated By :,Updated on :,AOC document :,AOC Description :,S.No,Bid Number,Bidder Name,Awarded Currency,Awarded Value,S.No.1,Bid Number.1,Bidder Name.1,Submitted Date,Status,Remarks,Status Updated On,Type :,Summary :,Updated By :.1,Updated On :,Document :,BOQ Comparative Chart :,Committee Chairperson/Co-ordinator Name :,Committee Chairperson/Co-ordinator Type :,Committee Members :,Updated By :.2,Updated on :.1,Document :.1,Organisation Chain :,Tender ID :,Tender Ref No :,Tender Title :,Type :.1,Summary :.1,Updated By :.3,Updated On :.1,Document :.2,Committee Chairperson/Co-ordinator Name :.1,Committee Chairperson/Co-ordinator Type :.1,Committee Members :.1,Updated By :.4,Updated On :.2,Financial Bid Opening Date:,Document :.3,Tender Stage
"CE,Minor Irrigation,BBSR||SECMIC-BHUBANESWAR||KHURDA",TCN-05-24-25,2024_CEMIB_105651_3,Yes,Open Tender,Percentage,Works,2.0,No,No,Online,No,No,No,1.0,Fee/PreQual/Technical,.pdf,"Online proof copy Tender cost, EMD, GSTIN, PAN, Contractor RC and Affidavi",18-Oct-2024 10:00 AM,02-Nov-2024 11:00 AM,18-Oct-2024 10:00 AM,01-Nov-2024 05:00 PM,NA ,NA ,18-Oct-2024 10:00 AM,01-Nov-2024 05:00 PM,06-Nov-2024 03:55 PM,"72,300",Yes,fixed,,Nil,Nil,1.0,ICICI BANK,"10,000",0.0,Nil,Nil,No,SE MID Khordha,O/O SE MID Khordha,Improvement to canal lining from RD 100m to 1500 m at Mahula Branch at Kajalaganda MIP in Jatani block of Khordha district under CAPEX Scheme for the year 2024-25,Improvement to canal lining from RD 100m to 1500 m at Mahula Branch at Kajalaganda MIP in Jatani block of Khordha district under CAPEX Scheme for the year 2024-25,Please refer Tender documents. ,NA ,"72,26,682",Civil Works - Canal,NA ,Tender,90.0,180.0,khordha,752056.0,NA ,NA ,NA ,SE MID Khordha,No ,No,AOC,11-Dec-2024,"INR 6,143,402.14",180.0,PRAVASH DHAL,11-Dec-2024 04:23 PM,kajalgandaeva.pdf (229.00 KB),L1 bidder Sri Ramakanta Dalai being 14.99% less than the amount put to tender and winner of transparent lottery,1.0,2597949.0,RAMAKANT DALAI,INR,"6,143,402.14",1,2603546,BALABHADRA ROUT,01-Nov-2024 01:52 PM,Rejected-Finance,Rejected,11-Dec-2024 02:34 PM,Finance,5nosbidderqualified,PRAVASH DHAL,11-Dec-2024 02:15 PM,finance_509583.pdf,BOQ Comparative Chart,SEMIDKHORDHA,Internal,daoseaee,PRAVASH DHAL,11-Dec-2024 02:34 PM,finsummary_509583.pdf (228.72 KB),"CE,Minor Irrigation,BBSR||SECMIC-BHUBANESWAR||KHURDA",2024_CEMIB_105651_3,TCN-05-24-25,Improvement to canal lining from RD 100m to 1500 m at Mahula Branch at Kajalaganda MIP in Jatani block of Khordha district under CAPEX Scheme for the year 2024-25,Technical,5nosbidder qualified,PRAVASH DHAL,06-Nov-2024 03:05 PM,technical_509583.pdf,SE,Internal,sedaoaee,PRAVASH DHAL,06-Nov-2024 03:51 PM,06-Nov-2024 03:55 PM,techsummary_509583.pdf (175.75 KB),AOC
,,,,,,,,,,,,,,,,.pdf,Other Documents as per DTCN,,,,,,,,,,,,,,,,2.0,ICICI NEFT/RTGS,,,,,,,,,,,,,,,,,,,,,,,,,,AOC,,,,,,,,,,,,,2,2598835,BIBHU PRASAD BEHERA,29-Oct-2024 04:07 PM,Rejected-Finance,Rejected,11-Dec-2024 02:34 PM,,,,,,,,,,,,,,,,,,,,,,,,,,,,,AOC
,,,,,,,,,,,,,,2.0,Finance,.xls,Bill of Quantity,,,,,,,,,,,,,,,,,,,,,,,,,,,,,,,,,,,,,,,,,,,AOC,,,,,,,,,,,,,3,2597949,RAMAKANT DALAI,29-Oct-2024 11:39 AM,Accepted-AOC,winner in transparent lottery,11-Dec-2024 04:23 PM,,,,,,,,,,,,,,,,,,,,,,,,,,,,,AOC
,,,,,,,,,,,,,,,,,,,,,,,,,,,,,,,,,,,,,,,,,,,,,,,,,,,,,,,,,,,,AOC,,,,,,,,,,,,,4,2593298,SAMARESH CHHOTARAY,25-Oct-2024 05:34 PM,Rejected-Finance,Rejected,11-Dec-2024 02:34 PM,,,,,,,,,,,,,,,,,,,,,,,,,,,,,AOC
,,,,,,,,,,,,,,,,,,,,,,,,,,,,,,,,,,,,,,,,,,,,,,,,,,,,,,,,,,,,AOC,,,,,,,,,,,,,5,2603510,SANJIB PARIDA,01-Nov-2024 01:56 PM,Rejected-Finance,Rejected,11-Dec-2024 02:34 PM,,,,,,,,,,,,,,,,,,,,,,,,,,,,,AOC
