Organisation Chain,Tender Reference Number,Tender ID,Withdrawal Allowed,Tender Type,Form of contract,Tender Category,No. of Covers,General Technical Evaluation Allowed,ItemWise Technical Evaluation Allowed,Payment Mode,Is Multi Currency Allowed For BOQ,Is Multi Currency Allowed For Fee,Allow Two Stage Bidding,Cover No,Cover,Document Type,Description,Publish Date,Bid Opening Date,Document Download / Sale Start Date,Document Download / Sale End Date,Clarification Start Date,Clarification End Date,Bid Submission Start Date,Bid Submission End Date,Financial Bid Opening Date,EMD Amount in ₹,EMD Exemption Allowed,EMD Fee Type,EMD Percentage,EMD Payable To,EMD Payable At,S.No,Corrigendum Title,Corrigendum Type,View,S.No.1,Bank Name,Tender Fee in ₹,VAT Charges in ₹,Fee Payable To,Fee Payable At,Tender Fee Exemption Allowed,Name,Address,Title,Work Description,Pre Qualification Details,Independent External Monitor/Remarks,Tender Value in ₹,Product Category,Sub category,Contract Type,Bid Validity(Days),Period Of Work(Days),Location,Pincode,Pre Bid Meeting Place,Pre Bid Meeting Address,Pre Bid Meeting Date,Bid Opening Place,Should Allow NDA Tender,Allow Preferential Bidder,Tender Stage,Contract Date :,Contract Value :,Work Completion Period in days :,Updated By :,Updated on :,AOC document :,AOC Description :,S.No,Bid Number,Bidder Name,Awarded Currency,Awarded Value,S.No.1,Bid Number.1,Bidder Name.1,Submitted Date,Status,Remarks,Status Updated On,Type :,Summary :,Updated By :.1,Updated On :,Document :,BOQ Comparative Chart :,Committee Chairperson/Co-ordinator Name :,Committee Chairperson/Co-ordinator Type :,Committee Members :,Updated By :.2,Updated on :.1,Document :.1,Organisation Chain :,Tender ID :,Tender Ref No :,Tender Title :,Type :.1,Summary :.1,Updated By :.3,Updated On :.1,Document :.2,Committee Chairperson/Co-ordinator Name :.1,Committee Chairperson/Co-ordinator Type :.1,Committee Members :.1,Updated By :.4,Updated On :.2,Financial Bid Opening Date:,Document :.3,Tender Stage
CE RW I||RWCIRCLE-BHUBANESWAR,Tender Online C.C-03 of 2024,2024_CERWI_100319_20,Yes,National Competitive Bid,Percentage,Works,2.0,No,No,Online,No,No,No,1.0,Fee/PreQual/Technical,.pdf,"Tender Paper Cost, EMD, GSTIN, PAN, Registration Certificate",08-Feb-2024 06:55 PM,20-Feb-2024 11:00 AM,08-Feb-2024 06:55 PM,19-Feb-2024 05:00 PM,NA ,NA ,08-Feb-2024 06:55 PM,19-Feb-2024 05:00 PM,04-Mar-2024 05:00 PM,"1,03,305",Yes,percentage,1.0%,Nil,Nil,1.0,Date Corrigendum,Date,,1.0,ICICI BANK,"10,000",0.0,Nil,Nil,No,Chief Construction Engineer,"O/o ChiefConstructionEngineer,CentralRWCircle,BBSR",Construction of Day Care PHC building at Kamakantia under Pipili block in the district of Puri for the year 2022-23 under NHM,Construction of Day Care PHC building at Kamakantia under Pipili block in the district of Puri for the year 2022-23 under NHM,Please refer Tender documents. ,NA ,"1,03,30,472",Civil Works - Buildings,NA ,Tender,90.0,365.0,Puri,752001.0,NA ,NA ,NA ,"O/o ChiefConstructionEngineer,CentralRWCircle,BBSR",No ,No,AOC,14-Aug-2024,"INR 9,267,467",365.0,Priyadarshini Dalai,14-Aug-2024 12:58 PM,KamakantiaAgmtDetails.PDF (1867.00 KB),"Work order letter No.4315 dtd.16.03.2024 and Agmt No.436 P1 of 2023-24 dtd.15.03.2024 of Executive Engineer, Rural Works Division, Puri",1.0,2447386.0,ASHOK KUMAR SETHI,INR,"9,267,467",1,2447386,ASHOK KUMAR SETHI,18-Feb-2024 09:10 AM,Accepted-AOC,Accepted,14-Aug-2024 12:58 PM,Finance,4 nos bidder qualified in the tender,Priyadarshini Dalai,05-Mar-2024 07:32 PM,,BOQ Comparative Chart,"Chief Engineer CentralRWCircle,BBSR",Internal,SuperintendingEngineerRWDivision Bhubaneswar SrDAORWDivision Puri PAtoChiefConstructionEngineerCentralRuralWorksCircleBBSR,Priyadarshini Dalai,14-Aug-2024 12:54 PM,finsummary_488297.pdf (276.26 KB),CE RW I||RWCIRCLE-BHUBANESWAR,2024_CERWI_100319_20,Tender Online C.C-03 of 2024,Construction of Day Care PHC building at Kamakantia under Pipili block in the district of Puri for the year 2022-23 under NHM,Technical,5 nos bidder qualified in the tender,Priyadarshini Dalai,20-Feb-2024 07:59 PM,,"Chief Construction Engineer CentralRWCircle,BBSR",Internal,SuperintendingEngineerRWDivision Bhubaneswar SrDAORWDivision Puri PAtoChiefConstructionEngineerCentralRuralWorksCircleBBSR,Priyadarshini Dalai,01-Mar-2024 02:19 PM,04-Mar-2024 05:00 PM,techsummary_488297.pdf (1214.18 KB),AOC
,,,,,,,,,,,,,,,,.pdf,"Work in Hand, Machineries, Affidavit of Correctness Certificate",,,,,,,,,,,,,,,,2.0,Other Corrigendum,Other,,2.0,ICICI NEFT/RTGS,,,,,,,,,,,,,,,,,,,,,,,,,,AOC,,,,,,,,,,,,,2,2450382,BHAJAMAN SAHOO,19-Feb-2024 04:46 PM,Rejected-Finance,Other than L1,14-Aug-2024 12:54 PM,,,,,,,,,,,,,,,,,,,,,,,,,,,,,AOC
,,,,,,,,,,,,,,,,.pdf,"No Relationship Certificate, ATO, Work Experience and required documents as per DTCN",,,,,,,,,,,,,,,,,,,,,,,,,,,,,,,,,,,,,,,,,,,,,,,AOC,,,,,,,,,,,,,3,2450273,PRAMESH KUMAR SWAIN,19-Feb-2024 04:21 PM,Rejected-Finance,After giving price preference to SC Contractor L1 becomes L2,14-Aug-2024 12:54 PM,,,,,,,,,,,,,,,,,,,,,,,,,,,,,AOC
,,,,,,,,,,,,,,2.0,Finance,.xls,BOQ,,,,,,,,,,,,,,,,,,,,,,,,,,,,,,,,,,,,,,,,,,,,,,,AOC,,,,,,,,,,,,,4,2447108,RAMACHANDRA SAMANTA SINGHAR,19-Feb-2024 04:37 PM,Rejected-Technical,As per Clause No. 1.4 of the DTCN (3 EMD exemption already availed),01-Mar-2024 02:19 PM,,,,,,,,,,,,,,,,,,,,,,,,,,,,,AOC
,,,,,,,,,,,,,,,,,,,,,,,,,,,,,,,,,,,,,,,,,,,,,,,,,,,,,,,,,,,,,,,,AOC,,,,,,,,,,,,,5,2450266,SATYA RANJAN PRADHAN,19-Feb-2024 04:16 PM,Rejected-Finance,After giving price preference to SC Contractor L1 becomes L2,14-Aug-2024 12:54 PM,,,,,,,,,,,,,,,,,,,,,,,,,,,,,AOC
