Organisation Chain,Tender Reference Number,Tender ID,Withdrawal Allowed,Tender Type,Form of contract,Tender Category,No. of Covers,General Technical Evaluation Allowed,ItemWise Technical Evaluation Allowed,Payment Mode,Is Multi Currency Allowed For BOQ,Is Multi Currency Allowed For Fee,Allow Two Stage Bidding,Cover No,Cover,Document Type,Description,Publish Date,Bid Opening Date,Document Download / Sale Start Date,Document Download / Sale End Date,Clarification Start Date,Clarification End Date,Bid Submission Start Date,Bid Submission End Date,Financial Bid Opening Date,EMD Amount in ₹,EMD Exemption Allowed,EMD Fee Type,EMD Percentage,EMD Payable To,EMD Payable At,S.No,Bank Name,Tender Fee in ₹,VAT Charges in ₹,Fee Payable To,Fee Payable At,Tender Fee Exemption Allowed,Name,Address,Title,Work Description,Pre Qualification Details,Independent External Monitor/Remarks,Tender Value in ₹,Product Category,Sub category,Contract Type,Bid Validity(Days),Period Of Work(Days),Location,Pincode,Pre Bid Meeting Place,Pre Bid Meeting Address,Pre Bid Meeting Date,Bid Opening Place,Should Allow NDA Tender,Allow Preferential Bidder,Tender Stage,Contract Date :,Contract Value :,Work Completion Period in days :,Updated By :,Updated on :,AOC document :,AOC Description :,S.No,Bid Number,Bidder Name,Awarded Currency,Awarded Value,S.No.1,Bid Number.1,Bidder Name.1,Submitted Date,Status,Remarks,Status Updated On,Type :,Summary :,Updated By :.1,Updated On :,Document :,BOQ Comparative Chart :,Committee Chairperson/Co-ordinator Name :,Committee Chairperson/Co-ordinator Type :,Committee Members :,Updated By :.2,Updated on :.1,Document :.1,Organisation Chain :,Tender ID :,Tender Ref No :,Tender Title :,Type :.1,Summary :.1,Updated By :.3,Updated On :.1,Document :.2,Committee Chairperson/Co-ordinator Name :.1,Committee Chairperson/Co-ordinator Type :.1,Committee Members :.1,Updated By :.4,Updated On :.2,Financial Bid Opening Date:,Document :.3,Tender Stage
EIC-CIVIL||SERNB-CIRCLE-DHENKANAL,CCE DKL R and B/32-2023-24,2024_EICCL_100312_8,Yes,Open Tender,Percentage,Works,2.0,No,No,Online,No,No,No,1.0,Fee/PreQual/Technical,.pdf,"GSTIN, EMD, PAN, Valid RC",30-Jan-2024 05:30 PM,13-Feb-2024 05:30 PM,30-Jan-2024 05:30 PM,13-Feb-2024 05:00 PM,NA ,NA ,30-Jan-2024 05:30 PM,13-Feb-2024 05:00 PM,23-Feb-2024 09:00 AM,"1,22,000",Yes,fixed,,Nil,Nil,1.0,ICICI BANK,"10,000",0.0,Nil,Nil,No,CCE Dhenkanal R and B Circle Dhenkanal,CCE Dhenkanal R and B Circle Dhenkanal,"Construction of 04 Nos. E Type quarters at CHC,Baramba in the district Cuttack under State plan for the year 2023-24","Construction of 04 Nos. E Type quarters at CHC,Baramba in the district Cuttack under State plan for the year 2023-24",Please refer Tender documents ,NA ,"1,22,38,553",Civil Works - Buildings,NA ,Tender,90.0,210.0,Choudwar,754025.0,NA ,NA ,NA ,CCE Dhenkanal R and B Circle Dhenkanal,No ,No,AOC,31-Aug-2024,"INR 12,238,552.78",210.0,Ashok Kumar Giri,31-Aug-2024 07:14 PM,E_Baramba.pdf (926.00 KB),Agreement on dt.03.07.2024,1.0,2438385.0,SANOJ KUMAR SAHOO,INR,"10,403,994",1,2437645,AJAYA KUMAR PATTNAIK,13-Feb-2024 10:48 AM,Rejected-AOC,Quoted rate is in higher side,31-Aug-2024 07:14 PM,Finance,Opened,Ashok Kumar Giri,23-Feb-2024 10:56 AM,finance_488234.pdf,BOQ Comparative Chart,CCE Dhenkanal Circle,Internal,SE Charbatia DAO Charbatia AEE Estr Charbatia PA to CCE Dhenkanal Circle Estr Dhenkanal Circle,Ashok Kumar Giri,31-Aug-2024 06:59 PM,finsummary_488234.pdf (158.13 KB),EIC-CIVIL||SERNB-CIRCLE-DHENKANAL,2024_EICCL_100312_8,CCE DKL R and B/32-2023-24,"Construction of 04 Nos. E Type quarters at CHC,Baramba in the district Cuttack under State plan for the year 2023-24",Technical,opened,Ashok Kumar Giri,13-Feb-2024 11:24 PM,technical_488234.pdf,CE Dhenkanal Circle,Internal,SE Charbatia Sr DAO Charbatia Estr Charbatia PA to CCE Dhenkanal Circle Estr Dhenkanal Circle,Ashok Kumar Giri,22-Feb-2024 08:39 AM,23-Feb-2024 09:00 AM,techsummary_488234.pdf (971.82 KB),AOC
,,,,,,,,,,,,,,,,.pdf,"Affidavit, Machineries and other documents as per DTCN",,,,,,,,,,,,,,,,2.0,ICICI NEFT/RTGS,,,,,,,,,,,,,,,,,,,,,,,,,,AOC,,,,,,,,,,,,,2,2436397,A.K.P CONFRA PRIVATE LIMITED,13-Feb-2024 03:21 PM,Rejected-AOC,Quoted rate is in higher side,31-Aug-2024 07:14 PM,,,,,,,,,,,,,,,,,,,,,,,,,,,,,AOC
,,,,,,,,,,,,,,2.0,Finance,.xls,Bill of Quantity,,,,,,,,,,,,,,,,,,,,,,,,,,,,,,,,,,,,,,,,,,,AOC,,,,,,,,,,,,,3,2438282,DIPTIREKHA BEHERA,13-Feb-2024 03:42 PM,Rejected-AOC,Quoted rate is in higher side,31-Aug-2024 07:14 PM,,,,,,,,,,,,,,,,,,,,,,,,,,,,,AOC
,,,,,,,,,,,,,,,,,,,,,,,,,,,,,,,,,,,,,,,,,,,,,,,,,,,,,,,,,,,,AOC,,,,,,,,,,,,,4,2437495,SANJAY KUMAR SWAIN,13-Feb-2024 12:43 PM,Rejected-Technical,Disqualified as per clause No 7 and 112 e of DTCN,22-Feb-2024 08:39 AM,,,,,,,,,,,,,,,,,,,,,,,,,,,,,AOC
,,,,,,,,,,,,,,,,,,,,,,,,,,,,,,,,,,,,,,,,,,,,,,,,,,,,,,,,,,,,AOC,,,,,,,,,,,,,5,2438385,SANOJ KUMAR SAHOO,13-Feb-2024 03:31 PM,Accepted-AOC,1st lowest and work has been awarded,31-Aug-2024 07:14 PM,,,,,,,,,,,,,,,,,,,,,,,,,,,,,AOC
,,,,,,,,,,,,,,,,,,,,,,,,,,,,,,,,,,,,,,,,,,,,,,,,,,,,,,,,,,,,AOC,,,,,,,,,,,,,6,2437808,SURESH NAIK,13-Feb-2024 11:55 AM,Rejected-Technical,Disqualified as per DTCN clause No 35,22-Feb-2024 08:39 AM,,,,,,,,,,,,,,,,,,,,,,,,,,,,,AOC
