Organisation Chain,Tender Reference Number,Tender ID,Withdrawal Allowed,Tender Type,Form of contract,Tender Category,No. of Covers,General Technical Evaluation Allowed,ItemWise Technical Evaluation Allowed,Payment Mode,Is Multi Currency Allowed For BOQ,Is Multi Currency Allowed For Fee,Allow Two Stage Bidding,Cover No,Cover,Document Type,Description,Publish Date,Bid Opening Date,Document Download / Sale Start Date,Document Download / Sale End Date,Clarification Start Date,Clarification End Date,Bid Submission Start Date,Bid Submission End Date,Financial Bid Opening Date,EMD Amount in ₹,EMD Exemption Allowed,EMD Fee Type,EMD Percentage,EMD Payable To,EMD Payable At,S.No,Bank Name,Tender Fee in ₹,Fee Payable To,Fee Payable At,Tender Fee Exemption Allowed,Name,Address,Title,Work Description,Pre Qualification Details,Independent External Monitor/Remarks,Tender Value in ₹,Product Category,Sub category,Contract Type,Bid Validity(Days),Period Of Work(Days),Location,Pincode,Pre Bid Meeting Place,Pre Bid Meeting Address,Pre Bid Meeting Date,Bid Opening Place,Should Allow NDA Tender,Allow Preferential Bidder,Tender Stage,Contract Date :,Contract Value :,Work Completion Period in days :,Updated By :,Updated on :,AOC document :,AOC Description :,S.No,Bid Number,Bidder Name,Awarded Currency,Awarded Value,S.No.1,Bid Number.1,Bidder Name.1,Submitted Date,Status,Remarks,Status Updated On,Type :,Summary :,Updated By :.1,Updated On :,Document :,BOQ Comparative Chart :,Committee Chairperson/Co-ordinator Name :,Committee Chairperson/Co-ordinator Type :,Committee Members :,Updated By :.2,Updated on :.1,Document :.1,Organisation Chain :,Tender ID :,Tender Ref No :,Tender Title :,Type :.1,Summary :.1,Updated By :.3,Updated On :.1,Document :.2,Committee Chairperson/Co-ordinator Name :.1,Committee Chairperson/Co-ordinator Type :.1,Committee Members :.1,Updated By :.4,Updated On :.2,Financial Bid Opening Date:,Document :.3,Tender Stage
Odisha State Agricultural Marketing Board||Regulated Market Committee Sambalpur,01/Sambalpur 2023-24,2024_OSAMB_102630_1,Yes,Open Tender,Percentage,Works,2.0,No,No,Online,No,No,No,1.0,Fee/PreQual/Technical,.pdf,"License, pan, GST, Affidavit",15-Mar-2024 03:00 PM,02-Apr-2024 11:00 AM,15-Mar-2024 03:00 PM,30-Mar-2024 05:00 PM,15-Mar-2024 03:00 PM ,30-Mar-2024 05:00 PM ,15-Mar-2024 03:00 PM,30-Mar-2024 05:00 PM,06-May-2024 11:30 AM,"1,42,937",Yes,percentage,1.0%,Nil,Nil,1.0,ICICI BANK,"10,000",Nil,Nil,No,"Sub-Collector Sambalpur-cum-Chairman RMC, Sambalpu",O/O of Sub-Collector Sambalpur,Construction of different Agricultural Marketing Infrastructures at Bisalkhinda and Sasan Sub Market Yard of RMC Sambalpur,Construction of different Agricultural Marketing Infrastructures at Bisalkhinda and Sasan Sub Market Yard of RMC Sambalpur,Please refer Tender documents. ,NA ,"1,42,93,701",Civil Works - Others,NA ,Rate Contract,90.0,180.0,"RMC, Sambalpur",768006.0,NA ,NA ,NA ,"RMC, Sambalpur",No ,No,AOC,03-Aug-2024,"INR 12,151,075",180.0,Subash Chandra Panda,03-Aug-2024 03:12 PM,Bisilkhindaandsasan.pdf (106.00 KB),Award of Contract,1.0,2488205.0,ABAKASH MISHRA,INR,"12,151,075",1,2488205,ABAKASH MISHRA,29-Mar-2024 10:31 AM,Accepted-AOC,Award of Contract,03-Aug-2024 03:13 PM,Finance,ok,Subash Chandra Panda,01-Jul-2024 12:06 PM,,BOQ Comparative Chart,Sub Collector Sambalpur Cum Chairman RMC Sambalpur,Internal,"Junior Engineer OSAM Board, Secretary RMC Sambalpur, Accountant RMC, Sambalpur",Subash Chandra Panda,03-Jul-2024 05:54 PM,finsummary_499992.pdf (130.85 KB),Odisha State Agricultural Marketing Board||Regulated Market Committee Sambalpur,2024_OSAMB_102630_1,01/Sambalpur 2023-24,Construction of different Agricultural Marketing Infrastructures at Bisalkhinda and Sasan Sub Market Yard of RMC Sambalpur,Technical,5 Nos of Bidders are Participated,Subash Chandra Panda,02-Apr-2024 11:40 AM,,"Sub-Collector Sambalpur-cum-Chairman RMC,Sambalpur",Internal,"Executive Engineer, OSAM Board, Assistant Engineer,OSAM Board, Junior Engineer, OSAM Board, Secretary RMC, Sambalpur, Accountant RMC,Sambalpur",Subash Chandra Panda,04-May-2024 04:34 PM,06-May-2024 11:30 AM,techsummary_499992.pdf (347.19 KB),AOC
,,,,,,,,,,,,,,,,.pdf,Other documents as per DTCN,,,,,,,,,,,,,,,,2.0,ICICI NEFT/RTGS,,,,,,,,,,,,,,,,,,,,,,,,,AOC,,,,,,,,,,,,,2,2488722,MANOJ KUMAR BEHERA,30-Mar-2024 02:37 PM,Rejected-Technical,He has not submitted required annual turnover with audited balance sheet in conformity with DTCN,04-May-2024 04:34 PM,,,,,,,,,,,,,,,,,,,,,,,,,,,,,AOC
,,,,,,,,,,,,,,2.0,Finance,.xls,BOQ,,,,,,,,,,,,,,,,,,,,,,,,,,,,,,,,,,,,,,,,,,AOC,,,,,,,,,,,,,3,2486288,Rajesh Kumar Panda,29-Mar-2024 11:33 PM,Rejected-Finance,Quoted Rate 9.99 percent,03-Jul-2024 05:54 PM,,,,,,,,,,,,,,,,,,,,,,,,,,,,,AOC
,,,,,,,,,,,,,,,,,,,,,,,,,,,,,,,,,,,,,,,,,,,,,,,,,,,,,,,,,,,AOC,,,,,,,,,,,,,4,2488390,SATYA PRAKASH AGRAWAL,30-Mar-2024 03:38 PM,Rejected-Finance,Rejected As per Lottery,03-Jul-2024 05:54 PM,,,,,,,,,,,,,,,,,,,,,,,,,,,,,AOC
,,,,,,,,,,,,,,,,,,,,,,,,,,,,,,,,,,,,,,,,,,,,,,,,,,,,,,,,,,,AOC,,,,,,,,,,,,,5,2488799,toshabantadash,30-Mar-2024 04:38 PM,Rejected-Technical,He has not submitted required upto date EPF Challan. Fabrication License of Bidder/Firm name and experience certificate of Godown construction in conformity with the DTCN,04-May-2024 04:34 PM,,,,,,,,,,,,,,,,,,,,,,,,,,,,,AOC
