Organisation Chain,Tender Reference Number,Tender ID,Withdrawal Allowed,Tender Type,Form of contract,Tender Category,No. of Covers,General Technical Evaluation Allowed,ItemWise Technical Evaluation Allowed,Payment Mode,Is Multi Currency Allowed For BOQ,Is Multi Currency Allowed For Fee,Allow Two Stage Bidding,Cover No,Cover,Document Type,Description,Publish Date,Bid Opening Date,Document Download / Sale Start Date,Document Download / Sale End Date,Clarification Start Date,Clarification End Date,Bid Submission Start Date,Bid Submission End Date,Financial Bid Opening Date,EMD Amount in ₹,EMD Exemption Allowed,EMD Fee Type,EMD Percentage,EMD Payable To,EMD Payable At,S.No,Bank Name,Tender Fee in ₹,VAT Charges in ₹,Fee Payable To,Fee Payable At,Tender Fee Exemption Allowed,Name,Address,Title,Work Description,Pre Qualification Details,Independent External Monitor/Remarks,Tender Value in ₹,Product Category,Sub category,Contract Type,Bid Validity(Days),Period Of Work(Days),Location,Pincode,Pre Bid Meeting Place,Pre Bid Meeting Address,Pre Bid Meeting Date,Bid Opening Place,Should Allow NDA Tender,Allow Preferential Bidder,Tender Stage,Contract Date :,Contract Value :,Work Completion Period in days :,Updated By :,Updated on :,AOC document :,AOC Description :,S.No,Bid Number,Bidder Name,Awarded Currency,Awarded Value,S.No.1,Bid Number.1,Bidder Name.1,Submitted Date,Status,Remarks,Status Updated On,Type :,Summary :,Updated By :.1,Updated On :,Document :,BOQ Comparative Chart :,Committee Chairperson/Co-ordinator Name :,Committee Chairperson/Co-ordinator Type :,Committee Members :,Updated By :.2,Updated on :.1,Document :.1,Organisation Chain :,Tender ID :,Tender Ref No :,Tender Title :,Type :.1,Summary :.1,Updated By :.3,Updated On :.1,Document :.2,Committee Chairperson/Co-ordinator Name :.1,Committee Chairperson/Co-ordinator Type :.1,Committee Members :.1,Updated By :.4,Updated On :.2,Financial Bid Opening Date:,Document :.3,Tender Stage
PHEO,EICPH-17/2023-24 Dtd.07.02.2024,2024_PHEO_101114_1,Yes,National Competitive Bid,Percentage,Works,2.0,No,No,Online,No,No,No,1.0,Fee/PreQual/Technical,.pdf,"Copy of PAN, GSTIN, Affidavits as per DTCN",15-Feb-2024 04:00 PM,07-Mar-2024 11:00 AM,15-Feb-2024 04:00 PM,06-Mar-2024 05:00 PM,15-Feb-2024 04:00 PM ,22-Feb-2024 05:00 PM ,15-Feb-2024 04:00 PM,06-Mar-2024 05:00 PM,09-Apr-2024 11:45 AM,"17,75,000",Yes,fixed,,Nil,Nil,1.0,ICICI BANK,"10,000",0.0,Nil,Nil,Yes,"Engineer-in-Chief, P.H., Odisha, Bhubaneswar","Office of the Engineer-in-Chief (PH), Odisha, 1st Floor, Unnati Bhawan, Satyanagar, Bhubaneswar 751007, Phone (0674) 2575309.",Augmentation of Water Supply System for Bhuban NAC including all other Ancillary Works including O and M for 5 Years under AMRUT 2.0 SWAP-II,"Construction of Intake Well, Pump House, Walk Way, Substation Building, 7 MLD WTP, ESR, UGR, Approach Road, Boundary Wall Pumping Arrangement, External Electrification, DG Set, Laying of DI Raw Water and Clear Water Rising Main, Distribution Network",Please refer Tender documents. ,NA ,"17,75,25,000",Civil Works - Water Works,NA ,Tender,120.0,540.0,Bhuban NAC,759017.0,Bhubaneswar ,"Office of the Engineer-in-Chief (PH), Odisha, 1st Floor, Unnati Bhawan, Satyanagar, Bhubaneswar 751007, Phone (0674) 2575309. ",23-Feb-2024 11:30 AM ,Bhubaneswar,No ,No,AOC,29-Aug-2024,"INR 154,943,912",540.0,Ratindra Nayaran Mallik,29-Aug-2024 06:57 PM,AoCBhuban.pdf (2334.00 KB),"LOA issued on 05.08.2024. WO issued and Agreement signed on 20.08.2024. However, for website compulsion Contract Date written as 29.08.2024.",1.0,2469455.0,M A CONSTRUCTION,INR,"154,943,912",1,2470564,ASHISH MOHANTY,06-Mar-2024 02:42 PM,Rejected-Finance,Rejected as stood L3,26-Jul-2024 05:23 PM,Finance,Eight (8) Nos. Financial Bid opened and to be evaluated.,Ratindra Nayaran Mallik,09-Apr-2024 12:35 PM,finance_493116.pdf,BOQ Comparative Chart,"Er RN Mallik, EIC, PH, Odisha, Bhubaneswar",Internal,"Er K Kohli, MS, OWSSB, Bhubaneswar, Er KC Rout, ACE (Designs), Er A Jena, ACE (Planning), Er P Jena, ACE, PH Circle, Cuttack, Er P Behera, SE, PH Division, Angul, Sri DK Mohapatra, AOPH",Ratindra Nayaran Mallik,26-Jul-2024 05:23 PM,finsummary_493116.pdf (1078.31 KB),PHEO,2024_PHEO_101114_1,EICPH-17/2023-24 Dtd.07.02.2024,Augmentation of Water Supply System for Bhuban NAC including all other Ancillary Works including O and M for 5 Years under AMRUT 2.0 SWAP-II,Technical,Eight (8) No. Technical Bids opened and to be evaluated.,Laxmi Narayan Khandual,07-Mar-2024 11:23 AM,technical_493116.pdf,"Er RN Mallik, EIC, PH, Odisha, Bhubaneswar",Internal,"Er K Kohli, MS, OWSSB, Bhubaneswar, Er KC Rout, ACE (Desings), Er A Jena, ACE (Planning), Er P Jena, ACE, PH Circle, Cuttack, Sri DK Mohapatra, AOPH",Ratindra Nayaran Mallik,08-Apr-2024 07:28 PM,09-Apr-2024 11:45 AM,techsummary_493116.pdf (853.84 KB),AOC
,,,,,,,,,,,,,,,,.pdf,"Certificates, Formats, Schedules and other documents if any as per DTCN",,,,,,,,,,,,,,,,2.0,ICICI NEFT/RTGS,,,,,,,,,,,,,,,,,,,,,,,,,,AOC,,,,,,,,,,,,,2,2470026,BENUDHARA SETHI,06-Mar-2024 10:36 AM,Rejected-Finance,Rejected as stood L3,26-Jul-2024 05:23 PM,,,,,,,,,,,,,,,,,,,,,,,,,,,,,AOC
,,,,,,,,,,,,,,2.0,Finance,.xls,BoQ,,,,,,,,,,,,,,,,,,,,,,,,,,,,,,,,,,,,,,,,,,,AOC,,,,,,,,,,,,,3,2468591,GYANENDRA KUMAR ROUTRAY,06-Mar-2024 03:22 PM,Rejected-Finance,Rejected as stood L4,26-Jul-2024 05:23 PM,,,,,,,,,,,,,,,,,,,,,,,,,,,,,AOC
,,,,,,,,,,,,,,,,,,,,,,,,,,,,,,,,,,,,,,,,,,,,,,,,,,,,,,,,,,,,AOC,,,,,,,,,,,,,4,2469966,JRC Infra,06-Mar-2024 03:36 PM,Rejected-Finance,Rejected as stood L3,26-Jul-2024 05:23 PM,,,,,,,,,,,,,,,,,,,,,,,,,,,,,AOC
,,,,,,,,,,,,,,,,,,,,,,,,,,,,,,,,,,,,,,,,,,,,,,,,,,,,,,,,,,,,AOC,,,,,,,,,,,,,5,2453175,KSHIROD CHANDRA PRADHAN,06-Mar-2024 03:11 PM,Rejected-AOC,Rejected as stood L2,29-Aug-2024 06:58 PM,,,,,,,,,,,,,,,,,,,,,,,,,,,,,AOC
,,,,,,,,,,,,,,,,,,,,,,,,,,,,,,,,,,,,,,,,,,,,,,,,,,,,,,,,,,,,AOC,,,,,,,,,,,,,6,2469455,M A CONSTRUCTION,06-Mar-2024 01:38 PM,Accepted-AOC,Accepted as stood L1,29-Aug-2024 06:58 PM,,,,,,,,,,,,,,,,,,,,,,,,,,,,,AOC
,,,,,,,,,,,,,,,,,,,,,,,,,,,,,,,,,,,,,,,,,,,,,,,,,,,,,,,,,,,,AOC,,,,,,,,,,,,,7,2466326,M/S NCP CONSTRUCTION,05-Mar-2024 07:02 PM,Rejected-Finance,Rejected as stood L3,26-Jul-2024 05:23 PM,,,,,,,,,,,,,,,,,,,,,,,,,,,,,AOC
,,,,,,,,,,,,,,,,,,,,,,,,,,,,,,,,,,,,,,,,,,,,,,,,,,,,,,,,,,,,AOC,,,,,,,,,,,,,8,2469245,PRAFULLA KUMAR PRADHAN,06-Mar-2024 02:17 PM,Rejected-Finance,Rejected as stood L3,26-Jul-2024 05:23 PM,,,,,,,,,,,,,,,,,,,,,,,,,,,,,AOC
