Organisation Chain,Tender Reference Number,Tender ID,Withdrawal Allowed,Tender Type,Form of contract,Tender Category,No. of Covers,General Technical Evaluation Allowed,ItemWise Technical Evaluation Allowed,Payment Mode,Is Multi Currency Allowed For BOQ,Is Multi Currency Allowed For Fee,Allow Two Stage Bidding,Cover No,Cover,Document Type,Description,Publish Date,Bid Opening Date,Document Download / Sale Start Date,Document Download / Sale End Date,Clarification Start Date,Clarification End Date,Bid Submission Start Date,Bid Submission End Date,EMD Amount in ₹,EMD Exemption Allowed,EMD Fee Type,EMD Percentage,EMD Payable To,EMD Payable At,S.No,Bank Name,Tender Fee in ₹,Fee Payable To,Fee Payable At,Tender Fee Exemption Allowed,Name,Address,Title,Work Description,Pre Qualification Details,Independent External Monitor/Remarks,Tender Value in ₹,Product Category,Sub category,Contract Type,Bid Validity(Days),Period Of Work(Days),Location,Pincode,Pre Bid Meeting Place,Pre Bid Meeting Address,Pre Bid Meeting Date,Bid Opening Place,Should Allow NDA Tender,Allow Preferential Bidder,Tender Stage,Contract Date :,Contract Value :,Work Completion Period in days :,Updated By :,Updated on :,AOC document :,AOC Description :,S.No,Bid Number,Bidder Name,Awarded Currency,Awarded Value,S.No.1,Bid Number.1,Bidder Name.1,Submitted Date,Status,Remarks,Status Updated On,Type :,Summary :,Updated By :.1,Updated On :,Document :,BOQ Comparative Chart :,Committee Chairperson/Co-ordinator Name :,Committee Chairperson/Co-ordinator Type :,Committee Members :,Updated By :.2,Updated on :.1,Document :.1,Organisation Chain :,Tender ID :,Tender Ref No :,Tender Title :,Committee Chairperson/Co-ordinator Name :.1,Committee Chairperson/Co-ordinator Type :.1,Committee Members :.1,Updated By :.3,Updated On :.1,Document :.2,Tender Stage
Command Area Development-CAD (DOWR)||Jt. Director Survey and Planning,JDSP-02/2024-25,2024_CADSP_103563_2,Yes,Open Tender,Percentage,Works,1.0,No,No,Online,No,No,No,1.0,Fee/PreQual/Technical/Finance,.pdf,"Valid Regd. Cert, GSTIN, PAN card, NRC, EMD, affidavit and other Document.",08-Jul-2024 11:00 AM,19-Jul-2024 11:00 AM,08-Jul-2024 11:00 AM,18-Jul-2024 05:00 PM,08-Jul-2024 11:00 AM ,13-Jul-2024 05:00 PM ,08-Jul-2024 11:00 AM,18-Jul-2024 05:00 PM,"10,000",Yes,fixed,,Nil,Nil,1.0,ICICI BANK,"4,000",Nil,Nil,No,Deputy Director,"O/o the Joint Director, Survey and Planning, OFMRDC Campus, Satyanagar, Bhubaneswar-7, Odisha",Survey and Planning for Command Area Development and water management in Nayarangmatia (D/W) MIP of Block- Udala in Mayurbhanj District.,Survey and Planning for Command Area Development and water management.,Please refer Tender documents. ,NA ,"9,91,520",Civil Works - Others,NA ,Tender,90.0,120.0,Udala,757041.0,NA ,NA ,NA ,"O/O JD,Survey and Planning,S atyanagar, BBSR",No ,No,AOC,17-Aug-2024,"INR 842,891",120.0,Manoranjan Behera,28-Aug-2024 05:33 PM,DN30.pdf (365.00 KB),Through transparent lottery.,1.0,2514545.0,D N CONSULTANT,INR,"842,891",1,2514559,ASIAN GEOTECH RESEARCH SERVICES,18-Jul-2024 12:15 PM,Rejected-AOC,Through transparent lottery.,28-Aug-2024 05:33 PM,Finance,Eight(08) nos of bidders have participated.,Rajendra Kumar Behera,19-Jul-2024 07:38 PM,,BOQ Comparative Chart,Sri Biswaranjan Sethy JD,Internal,Sri M R Behera DD Sri D K Pujhari EE Sri S K Panda AEE,Manoranjan Behera,01-Aug-2024 08:28 PM,finsummary_502677.pdf (655.50 KB),Command Area Development-CAD (DOWR)||Jt. Director Survey and Planning,2024_CADSP_103563_2,JDSP-02/2024-25,Survey and Planning for Command Area Development and water management in Nayarangmatia (D/W) MIP of Block- Udala in Mayurbhanj District.,Sri Biswaranjan Sethy JD,Internal,Sri M R Behera DD Sri D K Pujhari EE Sri S K Panda AEE,Manoranjan Behera,01-Aug-2024 05:05 PM,techsummary_502677.pdf (532.06 KB),AOC
,,,,,,,,,,,,,,,,.xls,Bill of Quantities.,,,,,,,,,,,,,,,2.0,ICICI NEFT/RTGS,,,,,,,,,,,,,,,,,,,,,,,,,AOC,,,,,,,,,,,,,2,2514545,D N CONSULTANT,18-Jul-2024 11:46 AM,Accepted-AOC,Through transparent lottery.,28-Aug-2024 05:33 PM,,,,,,,,,,,,,,,,,,,,,,,AOC
,,,,,,,,,,,,,,,,,,,,,,,,,,,,,,,,,,,,,,,,,,,,,,,,,,,,,,,,,,AOC,,,,,,,,,,,,,3,2514612,M/s M K CONSULTANCY,18-Jul-2024 01:22 PM,Rejected-AOC,Through transparent lottery.,28-Aug-2024 05:33 PM,,,,,,,,,,,,,,,,,,,,,,,AOC
,,,,,,,,,,,,,,,,,,,,,,,,,,,,,,,,,,,,,,,,,,,,,,,,,,,,,,,,,,AOC,,,,,,,,,,,,,4,2514543,NIRAJ BHARAT VANKUDRE,18-Jul-2024 12:38 PM,Rejected-AOC,Through transparent lottery.,28-Aug-2024 05:33 PM,,,,,,,,,,,,,,,,,,,,,,,AOC
,,,,,,,,,,,,,,,,,,,,,,,,,,,,,,,,,,,,,,,,,,,,,,,,,,,,,,,,,,AOC,,,,,,,,,,,,,5,2514609,Subudhi Technoengineers Pvt Ltd,18-Jul-2024 02:59 PM,Rejected-AOC,Through transparent lottery.,28-Aug-2024 05:33 PM,,,,,,,,,,,,,,,,,,,,,,,AOC
,,,,,,,,,,,,,,,,,,,,,,,,,,,,,,,,,,,,,,,,,,,,,,,,,,,,,,,,,,AOC,,,,,,,,,,,,,6,2514708,Sujal Associates,18-Jul-2024 01:47 PM,Rejected-AOC,Through transparent lottery.,28-Aug-2024 05:33 PM,,,,,,,,,,,,,,,,,,,,,,,AOC
,,,,,,,,,,,,,,,,,,,,,,,,,,,,,,,,,,,,,,,,,,,,,,,,,,,,,,,,,,AOC,,,,,,,,,,,,,7,2510474,Visiontek Consultancy Services Pvt. Ltd.,18-Jul-2024 12:55 PM,Rejected-AOC,Through transparent lottery.,28-Aug-2024 05:33 PM,,,,,,,,,,,,,,,,,,,,,,,AOC
,,,,,,,,,,,,,,,,,,,,,,,,,,,,,,,,,,,,,,,,,,,,,,,,,,,,,,,,,,AOC,,,,,,,,,,,,,8,2514298,Water Power Consultants india Pvt Ltd,18-Jul-2024 09:53 AM,Rejected-AOC,Through transparent lottery.,28-Aug-2024 05:33 PM,,,,,,,,,,,,,,,,,,,,,,,AOC
