Organisation Chain,Tender Reference Number,Tender ID,Withdrawal Allowed,Tender Type,Form of contract,Tender Category,No. of Covers,General Technical Evaluation Allowed,ItemWise Technical Evaluation Allowed,Payment Mode,Is Multi Currency Allowed For BOQ,Is Multi Currency Allowed For Fee,Allow Two Stage Bidding,Cover No,Cover,Document Type,Description,Publish Date,Bid Opening Date,Document Download / Sale Start Date,Document Download / Sale End Date,Clarification Start Date,Clarification End Date,Bid Submission Start Date,Bid Submission End Date,EMD Amount in ₹,EMD Exemption Allowed,EMD Fee Type,EMD Percentage,EMD Payable To,EMD Payable At,S.No,Bank Name,Tender Fee in ₹,VAT Charges in ₹,Fee Payable To,Fee Payable At,Tender Fee Exemption Allowed,Name,Address,Title,Work Description,Pre Qualification Details,Independent External Monitor/Remarks,Tender Value in ₹,Product Category,Sub category,Contract Type,Bid Validity(Days),Period Of Work(Days),Location,Pincode,Pre Bid Meeting Place,Pre Bid Meeting Address,Pre Bid Meeting Date,Bid Opening Place,Should Allow NDA Tender,Allow Preferential Bidder,Tender Stage,Contract Date :,Contract Value :,Work Completion Period in days :,Updated By :,Updated on :,AOC document :,AOC Description :,S.No,Bid Number,Bidder Name,Awarded Currency,Awarded Value,S.No.1,Bid Number.1,Bidder Name.1,Submitted Date,Status,Remarks,Status Updated On,Type :,Summary :,Updated By :.1,Updated On :,Document :,BOQ Comparative Chart :,Committee Chairperson/Co-ordinator Name :,Committee Chairperson/Co-ordinator Type :,Committee Members :,Updated By :.2,Updated on :.1,Document :.1,Organisation Chain :,Tender ID :,Tender Ref No :,Tender Title :,Committee Chairperson/Co-ordinator Name :.1,Committee Chairperson/Co-ordinator Type :.1,Committee Members :.1,Updated By :.3,Updated On :.1,Document :.2,Tender Stage
EIC-CIVIL||SERNB-CIRCLE-EASTERN||EERNB-DIVN-BHADRAK,SE RandB BDK-43/2023-24-11,2024_EICCL_101413_1,Yes,Open Tender,Percentage,Works,1.0,No,No,Online,No,No,No,1.0,Fee/PreQual/Technical/Finance,.pdf,"Online payment receipt of Paper cost, Bid Security, GSTIN, PAN, Registration Certificates",19-Feb-2024 06:20 PM,27-Feb-2024 11:30 AM,19-Feb-2024 06:20 PM,26-Feb-2024 05:00 PM,NA ,NA ,19-Feb-2024 06:20 PM,26-Feb-2024 05:00 PM,"17,661",Yes,fixed,,Nil,Nil,1.0,ICICI BANK,"6,000",0.0,Nil,Nil,No,"Superitending Engineer (RnB) Division , Bhadrak","O/O the Superitending Engineer (RnB) Division , Bhadrak",Shifting for 33KV / 11KV / LT line and distribution transformer for the road widening of Aruha Road from Jhuli Chakka to Mohapatra Sahi Chhaka in the district Bhadrak.,Shifting for 33KV / 11KV / LT line and distribution transformer for the road widening of Aruha Road from Jhuli Chakka to Mohapatra Sahi Chhaka in the district Bhadrak.,Please refer Tender documents. ,NA ,,Electrical Works,NA ,Tender,30.0,30.0,Bhadrak,756100.0,NA ,NA ,NA ,"O/O the Superitending Engineer (RnB) Division , Bh",No ,No,AOC,28-Aug-2024,"INR 1,501,385.41",30.0,Deepak Kumar Panigrahi,28-Aug-2024 11:53 AM,julichhaka.pdf (244.00 KB),"Er Deepak Kumar Panigrahi,Upendra Kumar,Biswajit Behera,Sushree sangita Nayak",1.0,2459653.0,DEBABRATA MISHRA,INR,"1,501,385.41",1,2455968,Ambika Prasad Samal,23-Feb-2024 02:11 PM,Rejected-Finance,Looser of the transparent lottery system.,28-Aug-2024 11:47 AM,Finance,Technically Submitted,Deepak Kumar Panigrahi,28-Aug-2024 11:41 AM,finance_494677.pdf,BOQ Comparative Chart,Er Deepak Kumar Panigrahi,Internal,"Er Deepak Kumar Panigrahi,Upendra Kumar,Biswajit Behera,Sushree sangita Nayak",Deepak Kumar Panigrahi,28-Aug-2024 11:47 AM,finsummary_494677.pdf (243.81 KB),EIC-CIVIL||SERNB-CIRCLE-EASTERN||EERNB-DIVN-BHADRAK,2024_EICCL_101413_1,SE RandB BDK-43/2023-24-11,Shifting for 33KV / 11KV / LT line and distribution transformer for the road widening of Aruha Road from Jhuli Chakka to Mohapatra Sahi Chhaka in the district Bhadrak.,Er Deepak Kumar Panigrahi,Internal,"Er Deepak Kumar Panigrahi,Upendra Kumar,Biswajit Behera,Sushree sangita Nayak",Deepak Kumar Panigrahi,28-Aug-2024 11:45 AM,techsummary_494677.pdf (243.81 KB),AOC
,,,,,,,,,,,,,,,,.xls,Bill of Quantity,,,,,,,,,,,,,,,2.0,ICICI NEFT/RTGS,,,,,,,,,,,,,,,,,,,,,,,,,,AOC,,,,,,,,,,,,,2,2459653,DEBABRATA MISHRA,26-Feb-2024 01:59 PM,Accepted-AOC,Winner of the transparent lottery system.,28-Aug-2024 11:53 AM,,,,,,,,,,,,,,,,,,,,,,,AOC
,,,,,,,,,,,,,,,,,,,,,,,,,,,,,,,,,,,,,,,,,,,,,,,,,,,,,,,,,,,AOC,,,,,,,,,,,,,3,2455446,M/S ANJANA INFRASTRUCTURE,23-Feb-2024 08:34 AM,Rejected-Technical,Technically disqualified,28-Aug-2024 11:45 AM,,,,,,,,,,,,,,,,,,,,,,,AOC
,,,,,,,,,,,,,,,,,,,,,,,,,,,,,,,,,,,,,,,,,,,,,,,,,,,,,,,,,,,AOC,,,,,,,,,,,,,4,2460468,M/S GOURISHANKAR ENTERPRISES.RAMAKANTA MAHANI,26-Feb-2024 04:09 PM,Rejected-Technical,Technically Disqualified,28-Aug-2024 11:45 AM,,,,,,,,,,,,,,,,,,,,,,,AOC
,,,,,,,,,,,,,,,,,,,,,,,,,,,,,,,,,,,,,,,,,,,,,,,,,,,,,,,,,,,AOC,,,,,,,,,,,,,5,2457018,POWERTECH ENGINEERING.TAPAS RANJAN PATI,24-Feb-2024 03:39 PM,Rejected-Finance,Looser of the transparent lottery system.,28-Aug-2024 11:47 AM,,,,,,,,,,,,,,,,,,,,,,,AOC
,,,,,,,,,,,,,,,,,,,,,,,,,,,,,,,,,,,,,,,,,,,,,,,,,,,,,,,,,,,AOC,,,,,,,,,,,,,6,2455735,Transpower,23-Feb-2024 01:45 PM,Rejected-Technical,Technically disqualified,28-Aug-2024 11:45 AM,,,,,,,,,,,,,,,,,,,,,,,AOC
,,,,,,,,,,,,,,,,,,,,,,,,,,,,,,,,,,,,,,,,,,,,,,,,,,,,,,,,,,,AOC,,,,,,,,,,,,,7,2456203,UNITED POWER,23-Feb-2024 03:54 PM,Rejected-Finance,Looser of the transparent lottery system.,28-Aug-2024 11:47 AM,,,,,,,,,,,,,,,,,,,,,,,AOC
