Organisation Chain,Tender Reference Number,Tender ID,Withdrawal Allowed,Tender Type,Form of contract,Tender Category,No. of Covers,General Technical Evaluation Allowed,ItemWise Technical Evaluation Allowed,Payment Mode,Is Multi Currency Allowed For BOQ,Is Multi Currency Allowed For Fee,Allow Two Stage Bidding,Cover No,Cover,Document Type,Description,Publish Date,Bid Opening Date,Document Download / Sale Start Date,Document Download / Sale End Date,Clarification Start Date,Clarification End Date,Bid Submission Start Date,Bid Submission End Date,Financial Bid Opening Date,EMD Amount in ₹,EMD Exemption Allowed,EMD Fee Type,EMD Percentage,EMD Payable To,EMD Payable At,S.No,Bank Name,Tender Fee in ₹,Fee Payable To,Fee Payable At,Tender Fee Exemption Allowed,Name,Address,Title,Work Description,Pre Qualification Details,Independent External Monitor/Remarks,Tender Value in ₹,Product Category,Sub category,Contract Type,Bid Validity(Days),Period Of Work(Days),Location,Pincode,Pre Bid Meeting Place,Pre Bid Meeting Address,Pre Bid Meeting Date,Bid Opening Place,Should Allow NDA Tender,Allow Preferential Bidder,Tender Stage,Contract Date :,Contract Value :,Work Completion Period in days :,Updated By :,Updated on :,AOC document :,S.No,Bid Number,Bidder Name,Awarded Currency,Awarded Value,S.No.1,Bid Number.1,Bidder Name.1,Submitted Date,Status,Remarks,Status Updated On,Type :,Summary :,Updated By :.1,Updated On :,Document :,BOQ Comparative Chart :,Committee Chairperson/Co-ordinator Name :,Committee Chairperson/Co-ordinator Type :,Committee Members :,Updated By :.2,Updated on :.1,Document :.1,Organisation Chain :,Tender ID :,Tender Ref No :,Tender Title :,Type :.1,Summary :.1,Updated By :.3,Updated On :.1,Document :.2,Committee Chairperson/Co-ordinator Name :.1,Committee Chairperson/Co-ordinator Type :.1,Committee Members :.1,Updated By :.4,Updated On :.2,Financial Bid Opening Date:,Document :.3,Tender Stage
WATCO Bhubaneswar||Director (Operation) Watco||GM WATCO DIVISION-II BBSR,GMWATCO-II/ 09 /2024-25 Dt.29.06.2024,2024_GWCDI_103435_1,Yes,National Competitive Bid,Percentage,Works,2.0,No,No,Online,No,No,No,1.0,Fee/PreQual/Technical,.pdf,"Copy of PAN, GST, Affidavits as per DTCN",03-Jul-2024 11:00 AM,19-Jul-2024 12:30 PM,03-Jul-2024 11:00 AM,18-Jul-2024 05:00 PM,03-Jul-2024 11:00 AM ,09-Jul-2024 05:00 PM ,03-Jul-2024 11:00 AM,18-Jul-2024 05:00 PM,29-Jul-2024 12:30 PM,"95,420",Yes,fixed,,Nil,Nil,1.0,ICICI BANK,"11,800",Nil,Nil,No,General Manager,"General Manager, WATCO Division-II, Unit-V, Bhubaneswar-751001, Odisha, Phone (0674) 2390322",Improvement of water supply inside SC.ST and RTI campus through DI and MS pipe line and S/D system at CRP Square Unit-VIII Bhubaneswar,Improvement of water supply inside SC.ST and RTI campus through DI and MS pipe line and S/D system at CRP Square Unit-VIII Bhubaneswar,Please refer Tender documents. ,NA ,"95,42,000",Civil Works - Water Works,NA ,Tender,120.0,60.0,"Unit-VIII,Bhubaneswar",751012.0,NA ,NA ,NA ,Bhubaneswar,No ,No,AOC,14-Aug-2024,"INR 8,112,289",60.0,Guru Charan Das,14-Aug-2024 10:38 AM,AOC.pdf (146.00 KB),1.0,2512234.0,SAROJINI MOHANTY,INR,"8,112,289",1,2514192,ASCENSOR LIFTS AND AUTOMATION PRIVATE LIMITED,17-Jul-2024 04:31 PM,Rejected-AOC,Not a lowest bidder,14-Aug-2024 10:38 AM,Finance,Six no financial bids are received online and the bid is admitted subject to detail scrutiny after downloading the bid documents and after which the bid will be finally determined as valid or invalid,Guru Charan Das,29-Jul-2024 12:41 PM,,BOQ Comparative Chart,General Manager,Internal,,Guru Charan Das,14-Aug-2024 10:36 AM,finsummary_502341.pdf (197.92 KB),WATCO Bhubaneswar||Director (Operation) Watco||GM WATCO DIVISION-II BBSR,2024_GWCDI_103435_1,GMWATCO-II/ 09 /2024-25 Dt.29.06.2024,Improvement of water supply inside SC.ST and RTI campus through DI and MS pipe line and S/D system at CRP Square Unit-VIII Bhubaneswar,Technical,Six no technical bids are received online and the bid is admitted subject to detail scrutiny after downloading the bid documents and after which the bid will be finally determined as valid or invalid,Guru Charan Das,19-Jul-2024 12:49 PM,,General Manager,Internal,,Guru Charan Das,29-Jul-2024 10:53 AM,29-Jul-2024 12:30 PM,techsummary_502341.pdf (385.07 KB),AOC
,,,,,,,,,,,,,,,,.pdf,"Certificates, Formats, Schedules and other documents if any as per DTCN",,,,,,,,,,,,,,,,2.0,ICICI NEFT/RTGS,,,,,,,,,,,,,,,,,,,,,,,,,AOC,,,,,,,,,,,,2,2510332,MANMATH KUMAR BEHURA,11-Jul-2024 03:55 PM,Rejected-AOC,Not a lowest bidder,14-Aug-2024 10:38 AM,,,,,,,,,,,,,,,,,,,,,,,,,,,,,AOC
,,,,,,,,,,,,,,2.0,Finance,.xls,Bill of Quantity,,,,,,,,,,,,,,,,,,,,,,,,,,,,,,,,,,,,,,,,,,AOC,,,,,,,,,,,,3,2513175,Rakesh Kumar Jena,15-Jul-2024 04:54 PM,Rejected-AOC,Not a lowest bidder,14-Aug-2024 10:38 AM,,,,,,,,,,,,,,,,,,,,,,,,,,,,,AOC
,,,,,,,,,,,,,,,,,,,,,,,,,,,,,,,,,,,,,,,,,,,,,,,,,,,,,,,,,,,AOC,,,,,,,,,,,,4,2512234,SAROJINI MOHANTY,14-Jul-2024 02:38 PM,Accepted-AOC,Lowest bidder,14-Aug-2024 10:38 AM,,,,,,,,,,,,,,,,,,,,,,,,,,,,,AOC
,,,,,,,,,,,,,,,,,,,,,,,,,,,,,,,,,,,,,,,,,,,,,,,,,,,,,,,,,,,AOC,,,,,,,,,,,,5,2514489,SRABANI KAR,18-Jul-2024 09:40 AM,Rejected-AOC,Not a lowest bidder,14-Aug-2024 10:38 AM,,,,,,,,,,,,,,,,,,,,,,,,,,,,,AOC
,,,,,,,,,,,,,,,,,,,,,,,,,,,,,,,,,,,,,,,,,,,,,,,,,,,,,,,,,,,AOC,,,,,,,,,,,,6,2514555,Sujata Mohapatra,18-Jul-2024 12:21 PM,Rejected-AOC,Not a lowest bidder,14-Aug-2024 10:38 AM,,,,,,,,,,,,,,,,,,,,,,,,,,,,,AOC
