Organisation Chain,Tender Reference Number,Tender ID,Withdrawal Allowed,Tender Type,Form of contract,Tender Category,No. of Covers,General Technical Evaluation Allowed,ItemWise Technical Evaluation Allowed,Payment Mode,Is Multi Currency Allowed For BOQ,Is Multi Currency Allowed For Fee,Allow Two Stage Bidding,Cover No,Cover,Document Type,Description,Publish Date,Bid Opening Date,Document Download / Sale Start Date,Document Download / Sale End Date,Clarification Start Date,Clarification End Date,Bid Submission Start Date,Bid Submission End Date,Financial Bid Opening Date,EMD Amount in ₹,EMD Exemption Allowed,EMD Fee Type,EMD Percentage,EMD Payable To,EMD Payable At,S.No,Corrigendum Title,Corrigendum Type,View,S.No.1,Bank Name,Tender Fee in ₹,VAT Charges in ₹,Fee Payable To,Fee Payable At,Tender Fee Exemption Allowed,Name,Address,Title,Work Description,Pre Qualification Details,Independent External Monitor/Remarks,Tender Value in ₹,Product Category,Sub category,Contract Type,Bid Validity(Days),Period Of Work(Days),Location,Pincode,Pre Bid Meeting Place,Pre Bid Meeting Address,Pre Bid Meeting Date,Bid Opening Place,Should Allow NDA Tender,Allow Preferential Bidder,Tender Stage,Contract Date :,Contract Value :,Work Completion Period in days :,Updated By :,Updated on :,AOC document :,AOC Description :,S.No,Bid Number,Bidder Name,Awarded Currency,Awarded Value,S.No.1,Bid Number.1,Bidder Name.1,Submitted Date,Status,Remarks,Status Updated On,Type :,Summary :,Updated By :.1,Updated On :,Document :,BOQ Comparative Chart :,Committee Chairperson/Co-ordinator Name :,Committee Chairperson/Co-ordinator Type :,Committee Members :,Updated By :.2,Updated on :.1,Document :.1,Organisation Chain :,Tender ID :,Tender Ref No :,Tender Title :,Type :.1,Summary :.1,Updated By :.3,Updated On :.1,Document :.2,Committee Chairperson/Co-ordinator Name :.1,Committee Chairperson/Co-ordinator Type :.1,Committee Members :.1,Updated By :.4,Updated On :.2,Financial Bid Opening Date:,Document :.3,Tender Stage
CE RW I||RWCIRCLE-BHUBANESWAR,Tender Online CC-27 of 2022,2022_CERWI_81981_1,Yes,National Competitive Bid,Percentage,Works,2.0,No,No,Online,No,No,No,1.0,Fee/PreQual/Technical,.pdf,"Tender Paper Cost, Bid Security Declaration form, GSTIN, PAN, Registration Certificate",01-Oct-2022 06:55 PM,15-Oct-2022 11:00 AM,01-Oct-2022 06:55 PM,14-Oct-2022 05:00 PM,NA ,NA ,01-Oct-2022 06:55 PM,14-Oct-2022 05:00 PM,01-Nov-2022 11:00 AM,0.0,No,fixed,,Nil,Nil,1.0,Corrigendum1,Other,,1.0,ICICI BANK,"10,000",0.0,Nil,Nil,No,Chief Construction Engineer,"O/o ChiefConstructionEngineer,CentralRWCircle,BBSR",Const. of Deuli bazar to Begunia via. Kadab road in the Dist. of Khordha under Special Central Assistance to States Capital Expenditure(CAPEX) for the year 2022-23,Const. of Deuli bazar to Begunia via. Kadab road in the Dist. of Khordha under Special Central Assistance to States Capital Expenditure(CAPEX) for the year 2022-23,Please refer Tender documents. ,NA ,"6,16,79,355",Civil Works - Roads,NA ,Tender,90.0,330.0,Bhubaneswar,751001.0,NA ,NA ,NA ,"O/o ChiefConstructionEngineer,CentralRWCircle,BBSR",No ,No,AOC,06-Aug-2024,"INR 52,433,620",330.0,Priyadarshini Dalai,06-Aug-2024 01:39 PM,DeuliBazarAgmtDetails.pdf (1542.00 KB),"Work order letter No.1612 dtd.22.02.2023 and Agmt No.276 P1 of 2022-23 dtd.22.02.2023 of Superintending Engineer, Rural Works Divsion, Bhubaneswar",1.0,1950519.0,ABHISEK SINGH SAMANTA,INR,"52,433,620",1,1950519,ABHISEK SINGH SAMANTA,13-Oct-2022 10:23 PM,Accepted-AOC,Accepted,06-Aug-2024 01:39 PM,Finance,7 nos bidder qualified in the tender,Priyadarshini Dalai,06-Aug-2024 01:31 PM,,BOQ Comparative Chart,"Chief Construction Engineer CentralRWCircle,BBSR",Internal,SuperintendingEngineerRWDivision Nimapara SrDAORWDivision Bhubaneswar PAtoChiefConstructionEngineerCentralRuralWorksCircleBBSR,Priyadarshini Dalai,06-Aug-2024 01:34 PM,finsummary_412421.pdf (117.85 KB),CE RW I||RWCIRCLE-BHUBANESWAR,2022_CERWI_81981_1,Tender Online CC-27 of 2022,Const. of Deuli bazar to Begunia via. Kadab road in the Dist. of Khordha under Special Central Assistance to States Capital Expenditure(CAPEX) for the year 2022-23,Technical,QUALIFIED AND DISQUALIFIED LIST,Priyadarshini Dalai,27-Oct-2022 12:54 PM,technical_412421.pdf,"Chief Construction Engineer CentralRWCircle,BBSR",Internal,SuperintendingEngineerRWDivision Nimapara SrDAORWDivision Bhubaneswar,Priyadarshini Dalai,27-Oct-2022 01:00 PM,01-Nov-2022 11:00 AM,techsummary_412421.pdf (113.43 KB),AOC
,,,,,,,,,,,,,,,,.pdf,"Work in Hand, Machineries, Affidavit of Correctness Certificate",,,,,,,,,,,,,,,,,,,,2.0,ICICI NEFT/RTGS,,,,,,,,,,,,,,,,,,,,,,,,,,AOC,,,,,,,,,,,,,2,1950796,AD CONSTRUCTION,14-Oct-2022 12:21 PM,Rejected-Technical,Due to Non submission of undertaking as per Note of Format-III of ITB of DTCN,27-Oct-2022 01:00 PM,,,,,,,,,,,,,,,,,,,,,,,,,,,,,AOC
,,,,,,,,,,,,,,,,.pdf,"No Relationship Certificate, ATO, Work Experience and required documents as per DTCN",,,,,,,,,,,,,,,,,,,,,,,,,,,,,,,,,,,,,,,,,,,,,,,AOC,,,,,,,,,,,,,3,1947810,AMRIT BARAL,11-Oct-2022 07:48 PM,Rejected-Finance,Other than L1,06-Aug-2024 01:34 PM,,,,,,,,,,,,,,,,,,,,,,,,,,,,,AOC
,,,,,,,,,,,,,,2.0,Finance,.xls,BOQ,,,,,,,,,,,,,,,,,,,,,,,,,,,,,,,,,,,,,,,,,,,,,,,AOC,,,,,,,,,,,,,4,1951129,BABULI DAS,14-Oct-2022 02:53 PM,Rejected-Finance,Other than L1,06-Aug-2024 01:34 PM,,,,,,,,,,,,,,,,,,,,,,,,,,,,,AOC
,,,,,,,,,,,,,,,,,,,,,,,,,,,,,,,,,,,,,,,,,,,,,,,,,,,,,,,,,,,,,,,,AOC,,,,,,,,,,,,,5,1949719,MANORANJAN SWAIN,14-Oct-2022 03:49 PM,Rejected-Finance,Other than L1,06-Aug-2024 01:34 PM,,,,,,,,,,,,,,,,,,,,,,,,,,,,,AOC
,,,,,,,,,,,,,,,,,,,,,,,,,,,,,,,,,,,,,,,,,,,,,,,,,,,,,,,,,,,,,,,,AOC,,,,,,,,,,,,,6,1950901,M/S P B CONSTRUCTION,14-Oct-2022 12:35 PM,Rejected-Finance,Other than L1,06-Aug-2024 01:34 PM,,,,,,,,,,,,,,,,,,,,,,,,,,,,,AOC
,,,,,,,,,,,,,,,,,,,,,,,,,,,,,,,,,,,,,,,,,,,,,,,,,,,,,,,,,,,,,,,,AOC,,,,,,,,,,,,,7,1951072,R K ROUT AND PARTNERS,14-Oct-2022 01:54 PM,Rejected-Finance,Other than L1,06-Aug-2024 01:34 PM,,,,,,,,,,,,,,,,,,,,,,,,,,,,,AOC
,,,,,,,,,,,,,,,,,,,,,,,,,,,,,,,,,,,,,,,,,,,,,,,,,,,,,,,,,,,,,,,,AOC,,,,,,,,,,,,,8,1950737,Subash Chandra Mohanty,14-Oct-2022 03:13 PM,Rejected-Finance,Other than L1,06-Aug-2024 01:34 PM,,,,,,,,,,,,,,,,,,,,,,,,,,,,,AOC
