Organisation Chain,Tender Reference Number,Tender ID,Withdrawal Allowed,Tender Type,Form of contract,Tender Category,No. of Covers,General Technical Evaluation Allowed,ItemWise Technical Evaluation Allowed,Payment Mode,Is Multi Currency Allowed For BOQ,Is Multi Currency Allowed For Fee,Allow Two Stage Bidding,Cover No,Cover,Document Type,Description,Publish Date,Bid Opening Date,Document Download / Sale Start Date,Document Download / Sale End Date,Clarification Start Date,Clarification End Date,Bid Submission Start Date,Bid Submission End Date,EMD Amount in ₹,EMD Exemption Allowed,EMD Fee Type,EMD Percentage,EMD Payable To,EMD Payable At,S.No,Corrigendum Title,Corrigendum Type,View,S.No.1,Bank Name,Tender Fee in ₹,Fee Payable To,Fee Payable At,Tender Fee Exemption Allowed,Name,Address,Title,Work Description,Pre Qualification Details,Independent External Monitor/Remarks,Tender Value in ₹,Product Category,Sub category,Contract Type,Bid Validity(Days),Period Of Work(Days),Location,Pincode,Pre Bid Meeting Place,Pre Bid Meeting Address,Pre Bid Meeting Date,Bid Opening Place,Should Allow NDA Tender,Allow Preferential Bidder,Tender Stage,Contract Date :,Contract Value :,Work Completion Period in days :,Updated By :,Updated on :,AOC document :,S.No,Bid Number,Bidder Name,Awarded Currency,Awarded Value,S.No.1,Bid Number.1,Bidder Name.1,Submitted Date,Status,Remarks,Status Updated On,Type :,Summary :,Updated By :.1,Updated On :,Document :,BOQ Comparative Chart :,Committee Chairperson/Co-ordinator Name :,Committee Chairperson/Co-ordinator Type :,Committee Members :,Updated By :.2,Updated on :.1,Document :.1,Organisation Chain :,Tender ID :,Tender Ref No :,Tender Title :,Committee Chairperson/Co-ordinator Name :.1,Committee Chairperson/Co-ordinator Type :.1,Committee Members :.1,Updated By :.3,Updated On :.1,Document :.2,Tender Stage
WATCO Bhubaneswar||Director (Projects) Watco||GM WATCO PROJECT DIVISION BBSR,06(1)/ Project-I/WATCO/ 2024-25 Dtd.18.07.2024,2024_GWCII_103769_1,Yes,National Competitive Bid,Percentage,Works,1.0,No,No,Online,No,No,No,1.0,Fee/PreQual/Technical/Finance,.pdf,"Copy of PAN, GST, Affidavits as per DTCN",22-Jul-2024 11:00 AM,01-Aug-2024 12:30 PM,22-Jul-2024 11:00 AM,31-Jul-2024 05:00 PM,NA ,NA ,22-Jul-2024 11:00 AM,31-Jul-2024 05:00 PM,"9,000",Yes,fixed,,Nil,Nil,1.0,Corrigendum,Other,,1.0,ICICI BANK,"4,720",Nil,Nil,No,General Manager,"General Manager, WATCO Project Division-I, Ground Floor, Unnati Bhawan, Satya Nagar Bhubaneswar-751007, Odisha, Phone (0674) 2571444","Supply, Installation, Testing and Commissioning of Chlorination system for provision of Drink from Taps and 24x7 Water Supply to Ward No-01,02,03,20,21 and 22 of Jemadei and its adjoining areas of Khordha Town","Supply, Installation, Testing and Commissioning of Chlorination system for provision of Drink from Taps and 24x7 Water Supply to Ward No-01,02,03,20,21 and 22 of Jemadei and its adjoining areas of Khordha Town",Please refer Tender documents. ,NA ,"8,58,000",Civil Works - Water Works,NA ,Tender,120.0,60.0,Khordha Town,752050.0,NA ,NA ,NA ,Bhubaneswar,No ,No,AOC,28-Aug-2024,"INR 729,386",60.0,SARADA PRASANNA NAYAK,28-Aug-2024 11:03 AM,AOC1.pdf (314.00 KB),1.0,2520288.0,BITHIKA GANGULY,INR,"729,386",1,2521825,ASCENSOR LIFTS AND AUTOMATION PRIVATE LIMITED,31-Jul-2024 03:05 PM,Rejected-AOC,Not a lowest bidder,28-Aug-2024 11:04 AM,Finance,Eight no bids are received online and the bid is admitted subject to detail scrutiny after downloading the bid documents and after which the bid will be finally determined as valid or invalid,SARADA PRASANNA NAYAK,01-Aug-2024 01:44 PM,,BOQ Comparative Chart,General Manager,Internal,,SARADA PRASANNA NAYAK,28-Aug-2024 11:00 AM,finsummary_503242.pdf (585.89 KB),WATCO Bhubaneswar||Director (Projects) Watco||GM WATCO PROJECT DIVISION BBSR,2024_GWCII_103769_1,06(1)/ Project-I/WATCO/ 2024-25 Dtd.18.07.2024,"Supply, Installation, Testing and Commissioning of Chlorination system for provision of Drink from Taps and 24x7 Water Supply to Ward No-01,02,03,20,21 and 22 of Jemadei and its adjoining areas of Khordha Town",General Manager,Internal,,SARADA PRASANNA NAYAK,28-Aug-2024 10:52 AM,techsummary_503242.pdf (585.89 KB),AOC
,,,,,,,,,,,,,,,,.pdf,"Certificates, Formats, Schedules and other documents if any as per DTCN",,,,,,,,,,,,,,,,,,,2.0,ICICI NEFT/RTGS,,,,,,,,,,,,,,,,,,,,,,,,,AOC,,,,,,,,,,,,2,2520288,BITHIKA GANGULY,30-Jul-2024 10:33 AM,Accepted-AOC,Lowest bidder,28-Aug-2024 11:04 AM,,,,,,,,,,,,,,,,,,,,,,,AOC
,,,,,,,,,,,,,,,,.xls,Bill of Quantity,,,,,,,,,,,,,,,,,,,,,,,,,,,,,,,,,,,,,,,,,,,,,AOC,,,,,,,,,,,,3,2521839,DEEPAK BARLA(S.T),31-Jul-2024 03:53 PM,Rejected-AOC,Not a lowest bidder,28-Aug-2024 11:04 AM,,,,,,,,,,,,,,,,,,,,,,,AOC
,,,,,,,,,,,,,,,,,,,,,,,,,,,,,,,,,,,,,,,,,,,,,,,,,,,,,,,,,,,,,,AOC,,,,,,,,,,,,4,2517159,Drite Automation and Engineering,23-Jul-2024 04:21 PM,Rejected-AOC,Not a lowest bidder,28-Aug-2024 11:04 AM,,,,,,,,,,,,,,,,,,,,,,,AOC
,,,,,,,,,,,,,,,,,,,,,,,,,,,,,,,,,,,,,,,,,,,,,,,,,,,,,,,,,,,,,,AOC,,,,,,,,,,,,5,2521581,LIGHTNING ENGINEERING CONSTRUCTIONS AND CONSULTANTS,31-Jul-2024 02:32 PM,Rejected-AOC,Not a lowest bidder,28-Aug-2024 11:04 AM,,,,,,,,,,,,,,,,,,,,,,,AOC
,,,,,,,,,,,,,,,,,,,,,,,,,,,,,,,,,,,,,,,,,,,,,,,,,,,,,,,,,,,,,,AOC,,,,,,,,,,,,6,2520442,M/s WATCO,30-Jul-2024 05:44 PM,Rejected-AOC,Not a lowest bidder,28-Aug-2024 11:04 AM,,,,,,,,,,,,,,,,,,,,,,,AOC
,,,,,,,,,,,,,,,,,,,,,,,,,,,,,,,,,,,,,,,,,,,,,,,,,,,,,,,,,,,,,,AOC,,,,,,,,,,,,7,2521864,SAMIM SAHADAT,31-Jul-2024 04:33 PM,Rejected-AOC,Not a lowest bidder,28-Aug-2024 11:04 AM,,,,,,,,,,,,,,,,,,,,,,,AOC
,,,,,,,,,,,,,,,,,,,,,,,,,,,,,,,,,,,,,,,,,,,,,,,,,,,,,,,,,,,,,,AOC,,,,,,,,,,,,8,2521128,SRI TRUPTI RANJAN BALABNATARAY,30-Jul-2024 10:39 PM,Rejected-AOC,Not a lowest bidder,28-Aug-2024 11:04 AM,,,,,,,,,,,,,,,,,,,,,,,AOC
