Organisation Chain,Tender Reference Number,Tender ID,Withdrawal Allowed,Tender Type,Form of contract,Tender Category,No. of Covers,General Technical Evaluation Allowed,ItemWise Technical Evaluation Allowed,Payment Mode,Is Multi Currency Allowed For BOQ,Is Multi Currency Allowed For Fee,Allow Two Stage Bidding,Cover No,Cover,Document Type,Description,Publish Date,Bid Opening Date,Document Download / Sale Start Date,Document Download / Sale End Date,Clarification Start Date,Clarification End Date,Bid Submission Start Date,Bid Submission End Date,EMD Amount in ₹,EMD Exemption Allowed,EMD Fee Type,EMD Percentage,EMD Payable To,EMD Payable At,S.No,Bank Name,Tender Fee in ₹,VAT Charges in ₹,Fee Payable To,Fee Payable At,Tender Fee Exemption Allowed,Name,Address,Title,Work Description,Pre Qualification Details,Independent External Monitor/Remarks,Tender Value in ₹,Product Category,Sub category,Contract Type,Bid Validity(Days),Period Of Work(Days),Location,Pincode,Pre Bid Meeting Place,Pre Bid Meeting Address,Pre Bid Meeting Date,Bid Opening Place,Should Allow NDA Tender,Allow Preferential Bidder,Tender Stage,Contract Date :,Contract Value :,Work Completion Period in days :,Updated By :,Updated on :,AOC document :,AOC Description :,S.No,Bid Number,Bidder Name,Awarded Currency,Awarded Value,S.No.1,Bid Number.1,Bidder Name.1,Submitted Date,Status,Remarks,Status Updated On,Type :,Summary :,Updated By :.1,Updated On :,Document :,BOQ Comparative Chart :,Committee Chairperson/Co-ordinator Name :,Committee Chairperson/Co-ordinator Type :,Committee Members :,Updated By :.2,Updated on :.1,Document :.1,Organisation Chain :,Tender ID :,Tender Ref No :,Tender Title :,Committee Chairperson/Co-ordinator Name :.1,Committee Chairperson/Co-ordinator Type :.1,Committee Members :.1,Updated By :.3,Updated On :.1,Document :.2,Tender Stage
EIC-CIVIL||SERNB-CIRCLE-DHENKANAL||EERNB-DIVN-DHENKANAL,SE DKL (R and B) 58/ 2023-24,2024_EICCL_101108_1,Yes,Open Tender,Percentage,Works,1.0,No,No,Online,No,No,No,1.0,Fee/PreQual/Technical/Finance,.pdf,RC PAN GST Affidavit as per DTCN,15-Feb-2024 11:00 AM,01-Mar-2024 11:00 AM,15-Feb-2024 11:00 AM,29-Feb-2024 05:00 PM,NA ,NA ,15-Feb-2024 11:00 AM,29-Feb-2024 05:00 PM,"10,000",Yes,fixed,,Nil,Nil,1.0,ICICI BANK,"4,000",0.0,Nil,Nil,No,SE Dhenkanal R and B Division Dhenkanal,SE Dhenkanal R and B Division Dhenkanal,Construction of Security room of Odisha Adarsha Vidyalaya at Biswanathpur in the district of Dhenkanal for the year 2023-24,Construction of Security room of Odisha Adarsha Vidyalaya at Biswanathpur in the district of Dhenkanal for the year 2023-24,Please refer Tender documents ,NA ,"9,86,405",Civil Works - Buildings,NA ,Tender,90.0,120.0,Dhenkanal,759001.0,NA ,NA ,NA ,SE Dhenkanal R and B Division Dhenkanal,No ,No,AOC,06-Aug-2024,"INR 986,405.18",120.0,JAYANTA PRASAD NAIK,06-Aug-2024 08:53 PM,Security.pdf (286.00 KB),Agreement on dt.26.06.2024,1.0,2465433.0,Sandip Kumar Dash,INR,"838,543",1,2456641,ANIL KUMAR BHOI,23-Feb-2024 10:52 PM,Rejected-AOC,Disqualify in transparent lottery,06-Aug-2024 08:53 PM,Finance,bid are open,Suchismita Satapathy,01-Mar-2024 06:58 PM,finance_493041.pdf,BOQ Comparative Chart,SE Rand B Division Dhenkanal,Internal,Sr DAO AEE Estr JE Estr,Suchismita Satapathy,06-Aug-2024 08:15 PM,finsummary_493041.pdf (23.63 KB),EIC-CIVIL||SERNB-CIRCLE-DHENKANAL||EERNB-DIVN-DHENKANAL,2024_EICCL_101108_1,SE DKL (R and B) 58/ 2023-24,Construction of Security room of Odisha Adarsha Vidyalaya at Biswanathpur in the district of Dhenkanal for the year 2023-24,SE Rand B Division Dhenkanal,Internal,Sr DAO AEE Estimator JEE Estimator,JAYANTA PRASAD NAIK,06-Mar-2024 08:12 AM,techsummary_493041.pdf (527.01 KB),AOC
,,,,,,,,,,,,,,,,.xls,Bill of Quantity,,,,,,,,,,,,,,,2.0,ICICI NEFT/RTGS,,,,,,,,,,,,,,,,,,,,,,,,,,AOC,,,,,,,,,,,,,2,2455374,BODHINATH JAGADISH CHANDRA,22-Feb-2024 10:40 PM,Rejected-AOC,Disqualify in transparent lottery,06-Aug-2024 08:53 PM,,,,,,,,,,,,,,,,,,,,,,,AOC
,,,,,,,,,,,,,,,,,,,,,,,,,,,,,,,,,,,,,,,,,,,,,,,,,,,,,,,,,,,AOC,,,,,,,,,,,,,3,2465433,Sandip Kumar Dash,28-Feb-2024 09:14 PM,Accepted-AOC,"Winner of the transparent lottery, work has been awarded",06-Aug-2024 08:53 PM,,,,,,,,,,,,,,,,,,,,,,,AOC
,,,,,,,,,,,,,,,,,,,,,,,,,,,,,,,,,,,,,,,,,,,,,,,,,,,,,,,,,,,AOC,,,,,,,,,,,,,4,2465452,Sanjit Kumar Rout,29-Feb-2024 10:47 AM,Rejected-AOC,Disqualify in transparent lottery,06-Aug-2024 08:53 PM,,,,,,,,,,,,,,,,,,,,,,,AOC
,,,,,,,,,,,,,,,,,,,,,,,,,,,,,,,,,,,,,,,,,,,,,,,,,,,,,,,,,,,AOC,,,,,,,,,,,,,5,2458597,SARAT MAHANTY,26-Feb-2024 12:44 PM,Rejected-AOC,Disqualify in transparent lottery,06-Aug-2024 08:53 PM,,,,,,,,,,,,,,,,,,,,,,,AOC
