Organisation Chain,Tender Reference Number,Tender ID,Withdrawal Allowed,Tender Type,Form of contract,Tender Category,No. of Covers,General Technical Evaluation Allowed,ItemWise Technical Evaluation Allowed,Payment Mode,Is Multi Currency Allowed For BOQ,Is Multi Currency Allowed For Fee,Allow Two Stage Bidding,Cover No,Cover,Document Type,Description,Publish Date,Bid Opening Date,Document Download / Sale Start Date,Document Download / Sale End Date,Clarification Start Date,Clarification End Date,Bid Submission Start Date,Bid Submission End Date,Financial Bid Opening Date,EMD Amount in ₹,EMD Exemption Allowed,EMD Fee Type,EMD Percentage,EMD Payable To,EMD Payable At,S.No,Corrigendum Title,Corrigendum Type,View,S.No.1,Bank Name,Tender Fee in ₹,VAT Charges in ₹,Fee Payable To,Fee Payable At,Tender Fee Exemption Allowed,Name,Address,Title,Work Description,Pre Qualification Details,Independent External Monitor/Remarks,Tender Value in ₹,Product Category,Sub category,Contract Type,Bid Validity(Days),Period Of Work(Days),Location,Pincode,Pre Bid Meeting Place,Pre Bid Meeting Address,Pre Bid Meeting Date,Bid Opening Place,Should Allow NDA Tender,Allow Preferential Bidder,Tender Stage,Contract Date :,Contract Value :,Work Completion Period in days :,Updated By :,Updated on :,AOC document :,AOC Description :,S.No,Bid Number,Bidder Name,Awarded Currency,Awarded Value,S.No.1,Bid Number.1,Bidder Name.1,Submitted Date,Status,Remarks,Status Updated On,Type :,Summary :,Updated By :.1,Updated On :,Document :,BOQ Comparative Chart :,Committee Chairperson/Co-ordinator Name :,Committee Chairperson/Co-ordinator Type :,Committee Members :,Updated By :.2,Updated on :.1,Document :.1,Organisation Chain :,Tender ID :,Tender Ref No :,Tender Title :,Type :.1,Summary :.1,Updated By :.3,Updated On :.1,Document :.2,Committee Chairperson/Co-ordinator Name :.1,Committee Chairperson/Co-ordinator Type :.1,Committee Members :.1,Updated By :.4,Updated On :.2,Financial Bid Opening Date:,Document :.3,Tender Stage
Orissa State Police Housing and Welfare Corporation Ltd,11/OPHWC/2021-22,2021_OSPHW_70012_2,Yes,National Competitive Bid,Percentage,Works,2.0,No,No,Online,No,No,No,1.0,Fee/PreQual/Technical,.pdf,"GST, PAN, Contractor Registration Certificate and Affidavit",28-Jul-2021 06:55 PM,14-Aug-2021 11:30 AM,28-Jul-2021 06:55 PM,13-Aug-2021 05:00 PM,28-Jul-2021 06:55 PM ,30-Jul-2021 06:55 PM ,28-Jul-2021 06:55 PM,13-Aug-2021 05:00 PM,27-Aug-2021 11:00 AM,0.0,No,fixed,,Nil,Nil,1.0,CORRIGENDUM,Other,,1.0,ICICI BANK,"11,800",0.0,Nil,Nil,No,CHIEF ENGINEER OPHWC,OPHWC BHUBANESWAR,"CONSTRUCTION OF 12 NOS. F TYPE QTRS. AT BERHAMPUR UNIVERSITY, BHANJA BIHAR, BERHAMPUR",Building Work,Please refer Tender documents  ,NA ,"1,61,63,560",Civil Works - Buildings,NA ,Tender,90.0,360.0,BERHAMPUR,751022.0,NA ,NA ,NA ,OPHWC BHUBANESWAR,No ,No,AOC,31-Aug-2024,"INR 13,740,642",360.0,Bikram Keshari Malla,31-Aug-2024 12:05 PM,WORKLJH.pdf (438.00 KB),AWARDED AS L1 TENDERER AND AWARDED ON DATE 16.10.2021,1.0,1617975.0,Sriram Dash,INR,"13,740,642",1,1617393,ASHIM KUMAR SARKAR,12-Aug-2021 12:39 PM,Rejected-Finance,DUE TO L2 BIDDER,31-Aug-2024 12:03 PM,Finance,THE PRICE BIDS OF 07 NOS. OF BIDDER HAVE BEEN OPENED AND COMPARATIVE STATEMENT HAS BEEN GENERATED.,BIDYUT RANJAN BHOLA,08-Oct-2021 11:38 AM,,BOQ Comparative Chart,AS PER AS ACCEPTANCE LETTER,Internal,AS PER AS ACCEPTANCE LETTER,Bikram Keshari Malla,31-Aug-2024 12:03 PM,finsummary_361567.pdf (377.85 KB),Orissa State Police Housing and Welfare Corporation Ltd,2021_OSPHW_70012_2,11/OPHWC/2021-22,"CONSTRUCTION OF 12 NOS. F TYPE QTRS. AT BERHAMPUR UNIVERSITY, BHANJA BIHAR, BERHAMPUR",Technical,7 NOS. OF BIDDERS HAS BEEN PARTICIPATED,BIDYUT RANJAN BHOLA,23-Aug-2021 04:11 PM,,AS PER TC SUMMARY,Internal,AS PER TC SUMMARY,BIDYUT RANJAN BHOLA,26-Aug-2021 04:21 PM,27-Aug-2021 11:00 AM,techsummary_361567.pdf (107.78 KB),AOC
,,,,,,,,,,,,,,,,.pdf,Other Document as per DTCN,,,,,,,,,,,,,,,,,,,,2.0,ICICI NEFT/RTGS,,,,,,,,,,,,,,,,,,,,,,,,,,AOC,,,,,,,,,,,,,2,1617895,ASHOK KUMAR SETHI,13-Aug-2021 01:21 PM,Rejected-Finance,DUE TO L4 BIDDER,31-Aug-2024 12:03 PM,,,,,,,,,,,,,,,,,,,,,,,,,,,,,AOC
,,,,,,,,,,,,,,2.0,Finance,.xls,Bill of Quantity,,,,,,,,,,,,,,,,,,,,,,,,,,,,,,,,,,,,,,,,,,,,,,,AOC,,,,,,,,,,,,,3,1618182,BIPIN BIHARI BEHERA,13-Aug-2021 03:15 PM,Rejected-Finance,DUE TO L3 BIDDER,31-Aug-2024 12:03 PM,,,,,,,,,,,,,,,,,,,,,,,,,,,,,AOC
,,,,,,,,,,,,,,,,,,,,,,,,,,,,,,,,,,,,,,,,,,,,,,,,,,,,,,,,,,,,,,,,AOC,,,,,,,,,,,,,4,1610198,KAILASH CHANDRA LENKA,30-Jul-2021 04:44 PM,Rejected-Finance,DUE TO L2 BIDDER,31-Aug-2024 12:03 PM,,,,,,,,,,,,,,,,,,,,,,,,,,,,,AOC
,,,,,,,,,,,,,,,,,,,,,,,,,,,,,,,,,,,,,,,,,,,,,,,,,,,,,,,,,,,,,,,,AOC,,,,,,,,,,,,,5,1616922,K.Rabinarayan Das,11-Aug-2021 08:09 PM,Rejected-Finance,DUE TO L2 BIDDER,31-Aug-2024 12:03 PM,,,,,,,,,,,,,,,,,,,,,,,,,,,,,AOC
,,,,,,,,,,,,,,,,,,,,,,,,,,,,,,,,,,,,,,,,,,,,,,,,,,,,,,,,,,,,,,,,AOC,,,,,,,,,,,,,6,1617613,N. NARASINGHA REDDY,12-Aug-2021 03:01 PM,Rejected-Finance,DUE TO L4 BIDDER,31-Aug-2024 12:03 PM,,,,,,,,,,,,,,,,,,,,,,,,,,,,,AOC
,,,,,,,,,,,,,,,,,,,,,,,,,,,,,,,,,,,,,,,,,,,,,,,,,,,,,,,,,,,,,,,,AOC,,,,,,,,,,,,,7,1617975,Sriram Dash,13-Aug-2021 02:44 PM,Accepted-AOC,QUALIFIED BIDDER,31-Aug-2024 12:06 PM,,,,,,,,,,,,,,,,,,,,,,,,,,,,,AOC
