Organisation Chain,Tender Reference Number,Tender ID,Withdrawal Allowed,Tender Type,Form of contract,Tender Category,No. of Covers,General Technical Evaluation Allowed,ItemWise Technical Evaluation Allowed,Payment Mode,Is Multi Currency Allowed For BOQ,Is Multi Currency Allowed For Fee,Allow Two Stage Bidding,Cover No,Cover,Document Type,Description,Publish Date,Bid Opening Date,Document Download / Sale Start Date,Document Download / Sale End Date,Clarification Start Date,Clarification End Date,Bid Submission Start Date,Bid Submission End Date,EMD Amount in ₹,EMD Exemption Allowed,EMD Fee Type,EMD Percentage,EMD Payable To,EMD Payable At,S.No,Bank Name,Tender Fee in ₹,VAT Charges in ₹,Fee Payable To,Fee Payable At,Tender Fee Exemption Allowed,Name,Address,Title,Work Description,Pre Qualification Details,Independent External Monitor/Remarks,Tender Value in ₹,Product Category,Sub category,Contract Type,Bid Validity(Days),Period Of Work(Days),Location,Pincode,Pre Bid Meeting Place,Pre Bid Meeting Address,Pre Bid Meeting Date,Bid Opening Place,Should Allow NDA Tender,Allow Preferential Bidder,Tender Stage,Contract Date :,Contract Value :,Work Completion Period in days :,Updated By :,Updated on :,AOC document :,AOC Description :,S.No,Bid Number,Bidder Name,Awarded Currency,Awarded Value,S.No.1,Bid Number.1,Bidder Name.1,Submitted Date,Status,Remarks,Status Updated On,Type :,Summary :,Updated By :.1,Updated On :,Document :,BOQ Comparative Chart :,Committee Chairperson/Co-ordinator Name :,Committee Chairperson/Co-ordinator Type :,Committee Members :,Updated By :.2,Updated on :.1,Document :.1,Organisation Chain :,Tender ID :,Tender Ref No :,Tender Title :,Committee Chairperson/Co-ordinator Name :.1,Committee Chairperson/Co-ordinator Type :.1,Committee Members :.1,Updated By :.3,Updated On :.1,Document :.2,Tender Stage
EIC-CIVIL||SERNB-CIRCLE-DHENKANAL||EERNB-DIVN-DHENKANAL,SE DKL (R and B) 45/ 2023-24,2024_EICCL_99311_1,Yes,Open Tender,Percentage,Works,1.0,No,No,Online,No,No,No,1.0,Fee/PreQual/Technical/Finance,.pdf,PAN GST Affidavit RC as per DTCN,06-Jan-2024 10:00 AM,22-Jan-2024 11:00 AM,06-Jan-2024 10:00 AM,20-Jan-2024 05:00 PM,NA ,NA ,06-Jan-2024 10:00 AM,20-Jan-2024 05:00 PM,"21,000",Yes,fixed,,Nil,Nil,1.0,ICICI BANK,"6,000",0.0,Nil,Nil,No,SE Dhenkanal R and B Division Dhenkanal,SE Dhenkanal R and B Division Dhenkanal,Construction of RCC Roof Cycle stand for 200 cycles inside campus of OAV at Kandhara in the district of Dhenkanal for the year 2023-24 under OMBADC Fund,Construction of RCC Roof Cycle stand for 200 cycles inside campus of OAV at Kandhara in the district of Dhenkanal for the year 2023-24 under OMBADC Fund,Please refer tender documents ,NA ,"20,53,007",Civil Works - Buildings,NA ,Tender,90.0,120.0,Dhenkanal,759001.0,NA ,NA ,NA ,SE Dhenkanal R and B Division Dhenkanal,No ,No,AOC,16-Aug-2024,"INR 2,053,007",120.0,JAYANTA PRASAD NAIK,16-Aug-2024 02:08 PM,Cycle_Stand_Kandhara.pdf (370.00 KB),Agreement on Dtd.12.02.2024,1.0,2400035.0,PRAMOD KUMAR BEHERA,INR,"1,745,261",1,2398538,CHHEDILAL KATARUKA,18-Jan-2024 10:30 PM,Rejected-AOC,Disqualified in transparent lottery,16-Aug-2024 02:09 PM,Finance,bids are opened,JAYANTA PRASAD NAIK,22-Jan-2024 06:43 PM,finance_482852.pdf,BOQ Comparative Chart,Superintending Engineer Dhenkanal R and B Division,Internal,Superintending Engineer Sr DAO AEE Estimator JE Estimator,JAYANTA PRASAD NAIK,16-Aug-2024 01:41 PM,finsummary_482852.pdf (418.53 KB),EIC-CIVIL||SERNB-CIRCLE-DHENKANAL||EERNB-DIVN-DHENKANAL,2024_EICCL_99311_1,SE DKL (R and B) 45/ 2023-24,Construction of RCC Roof Cycle stand for 200 cycles inside campus of OAV at Kandhara in the district of Dhenkanal for the year 2023-24 under OMBADC Fund,Superintending Engineer Dhenkanal R and B Division,Internal,Superintending Engineer Sr DAO AEE Estimator JE Estimator,JAYANTA PRASAD NAIK,16-Aug-2024 01:21 PM,techsummary_482852.pdf (25.12 KB),AOC
,,,,,,,,,,,,,,,,.xls,BOQ,,,,,,,,,,,,,,,2.0,ICICI NEFT/RTGS,,,,,,,,,,,,,,,,,,,,,,,,,,AOC,,,,,,,,,,,,,2,2397881,JNANA RANJAN PANDA,18-Jan-2024 04:11 PM,Rejected-AOC,Disqualified in transparent lottery,16-Aug-2024 02:09 PM,,,,,,,,,,,,,,,,,,,,,,,AOC
,,,,,,,,,,,,,,,,,,,,,,,,,,,,,,,,,,,,,,,,,,,,,,,,,,,,,,,,,,,AOC,,,,,,,,,,,,,3,2400035,PRAMOD KUMAR BEHERA,19-Jan-2024 10:33 PM,Accepted-AOC,Winner of the transparent lottery and work has been awarded,16-Aug-2024 02:09 PM,,,,,,,,,,,,,,,,,,,,,,,AOC
,,,,,,,,,,,,,,,,,,,,,,,,,,,,,,,,,,,,,,,,,,,,,,,,,,,,,,,,,,,AOC,,,,,,,,,,,,,4,2400281,SAMBIT KUMAR SWAIN,20-Jan-2024 11:56 AM,Rejected-AOC,Disqualified in transparent lottery,16-Aug-2024 02:09 PM,,,,,,,,,,,,,,,,,,,,,,,AOC
,,,,,,,,,,,,,,,,,,,,,,,,,,,,,,,,,,,,,,,,,,,,,,,,,,,,,,,,,,,AOC,,,,,,,,,,,,,5,2400017,SAROJ KUMAR SAHOO,19-Jan-2024 09:48 PM,Rejected-AOC,Disqualified in transparent lottery,16-Aug-2024 02:09 PM,,,,,,,,,,,,,,,,,,,,,,,AOC
