Organisation Chain,Tender Reference Number,Tender ID,Withdrawal Allowed,Tender Type,Form of contract,Tender Category,No. of Covers,General Technical Evaluation Allowed,ItemWise Technical Evaluation Allowed,Payment Mode,Is Multi Currency Allowed For BOQ,Is Multi Currency Allowed For Fee,Allow Two Stage Bidding,Cover No,Cover,Document Type,Description,Publish Date,Bid Opening Date,Document Download / Sale Start Date,Document Download / Sale End Date,Clarification Start Date,Clarification End Date,Bid Submission Start Date,Bid Submission End Date,Financial Bid Opening Date,EMD Amount in ₹,EMD Exemption Allowed,EMD Fee Type,EMD Percentage,EMD Payable To,EMD Payable At,S.No,Bank Name,Tender Fee in ₹,VAT Charges in ₹,Fee Payable To,Fee Payable At,Tender Fee Exemption Allowed,Name,Address,Title,Work Description,Pre Qualification Details,Independent External Monitor/Remarks,Tender Value in ₹,Product Category,Sub category,Contract Type,Bid Validity(Days),Period Of Work(Days),Location,Pincode,Pre Bid Meeting Place,Pre Bid Meeting Address,Pre Bid Meeting Date,Bid Opening Place,Should Allow NDA Tender,Allow Preferential Bidder,Tender Stage,Contract Date :,Contract Value :,Work Completion Period in days :,Updated By :,Updated on :,AOC document :,AOC Description :,S.No,Bid Number,Bidder Name,Awarded Currency,Awarded Value,S.No.1,Bid Number.1,Bidder Name.1,Submitted Date,Status,Remarks,Status Updated On,Type :,Summary :,Updated By :.1,Updated On :,Document :,BOQ Comparative Chart :,Committee Chairperson/Co-ordinator Name :,Committee Chairperson/Co-ordinator Type :,Committee Members :,Updated By :.2,Updated on :.1,Document :.1,Organisation Chain :,Tender ID :,Tender Ref No :,Tender Title :,Type :.1,Summary :.1,Updated By :.3,Updated On :.1,Document :.2,Committee Chairperson/Co-ordinator Name :.1,Committee Chairperson/Co-ordinator Type :.1,Committee Members :.1,Updated By :.4,Updated On :.2,Financial Bid Opening Date:,Document :.3,Tender Stage
Orissa State Police Housing and Welfare Corporation Ltd,39/OPHWC/2021-22,2022_OSPHW_76032_1,Yes,National Competitive Bid,Percentage,Works,2.0,No,No,Online,No,No,No,1.0,Fee/PreQual/Technical,.pdf,"GST, GSTR-1, PAN, Contractor Registration Certificate and Affidavit",14-Feb-2022 06:30 PM,02-Mar-2022 11:30 AM,14-Feb-2022 06:30 PM,28-Feb-2022 05:00 PM,14-Feb-2022 06:30 PM ,18-Feb-2022 05:00 PM ,14-Feb-2022 06:30 PM,28-Feb-2022 05:00 PM,09-Mar-2022 11:00 AM,0.0,No,fixed,,Nil,Nil,1.0,ICICI BANK,"11,800",0.0,Nil,Nil,No,CHIEF ENGINEER,OPHWC,"RENOVATION OF ADTS TRACK AT RTO, BHUSUNDPUR, CHANDIKHOLE, JAJPUR",Building Work,Please refer Tender documents  ,NA ,"75,83,360",Civil Works - Buildings,NA ,Tender,90.0,150.0,JAJPUR,751022.0,NA ,NA ,NA ,OPHWC,No ,No,AOC,22-Aug-2024,"INR 6,446,614",150.0,Bikram Keshari Malla,22-Aug-2024 04:23 PM,WOOKLP.pdf (765.00 KB),AWARDED AS L1 TENDERER AND AWARDED ON DATE 30.03.2022,1.0,1807565.0,PRADIP KUMAR PANI,INR,"6,446,614",1,1807622,DEEPAK KUMAR JENA,23-Feb-2022 01:21 PM,Rejected-Finance,DUE TO L3 BIDDER,22-Aug-2024 04:10 PM,Finance,FINANCE BID OPENED,Bikram Keshari Malla,09-Mar-2022 12:05 PM,,BOQ Comparative Chart,AS PER AS ACCEPTANCE LETTER,Internal,AS PER AS ACCEPTANCE LETTER,Bikram Keshari Malla,22-Aug-2024 04:10 PM,finsummary_393031.pdf (472.79 KB),Orissa State Police Housing and Welfare Corporation Ltd,2022_OSPHW_76032_1,39/OPHWC/2021-22,"RENOVATION OF ADTS TRACK AT RTO, BHUSUNDPUR, CHANDIKHOLE, JAJPUR",Technical,5 NOS. OF BIDDERS PARTICIPATED,Bikram Keshari Malla,02-Mar-2022 12:08 PM,,AS PER TC MINUTES,Internal,AS PER TC MINUTES,Bikram Keshari Malla,08-Mar-2022 05:42 PM,09-Mar-2022 11:00 AM,techsummary_393031.pdf (980.66 KB),AOC
,,,,,,,,,,,,,,,,.pdf,Other Document as per DTCN,,,,,,,,,,,,,,,,2.0,ICICI NEFT/RTGS,,,,,,,,,,,,,,,,,,,,,,,,,,AOC,,,,,,,,,,,,,2,1807764,DILIP KUMAR SAMAL,27-Feb-2022 10:04 PM,Rejected-Technical,Has not submitted GSTR-1 Certificate as per DTCN Cl. No-110(c).,08-Mar-2022 05:42 PM,,,,,,,,,,,,,,,,,,,,,,,,,,,,,AOC
,,,,,,,,,,,,,,2.0,Finance,.xls,Bill of Quantity,,,,,,,,,,,,,,,,,,,,,,,,,,,,,,,,,,,,,,,,,,,AOC,,,,,,,,,,,,,3,1807565,PRADIP KUMAR PANI,22-Feb-2022 01:57 PM,Accepted-AOC,QUALIFIED BIDDER,22-Aug-2024 04:23 PM,,,,,,,,,,,,,,,,,,,,,,,,,,,,,AOC
,,,,,,,,,,,,,,,,,,,,,,,,,,,,,,,,,,,,,,,,,,,,,,,,,,,,,,,,,,,,AOC,,,,,,,,,,,,,4,1807907,Pritiranjan Behera,28-Feb-2022 03:01 PM,Rejected-Finance,DUE TO L2 BIDDER,22-Aug-2024 04:10 PM,,,,,,,,,,,,,,,,,,,,,,,,,,,,,AOC
,,,,,,,,,,,,,,,,,,,,,,,,,,,,,,,,,,,,,,,,,,,,,,,,,,,,,,,,,,,,AOC,,,,,,,,,,,,,5,1807768,SAI KRISHNA CONSTRUCTION,27-Feb-2022 09:58 PM,Rejected-Technical,Has not submitted GSTR-1 Certificate as per DTCN Cl. No-110(c).,08-Mar-2022 05:42 PM,,,,,,,,,,,,,,,,,,,,,,,,,,,,,AOC
