Organisation Chain,Tender Reference Number,Tender ID,Withdrawal Allowed,Tender Type,Form of contract,Tender Category,No. of Covers,General Technical Evaluation Allowed,ItemWise Technical Evaluation Allowed,Payment Mode,Is Multi Currency Allowed For BOQ,Is Multi Currency Allowed For Fee,Allow Two Stage Bidding,Cover No,Cover,Document Type,Description,Publish Date,Bid Opening Date,Document Download / Sale Start Date,Document Download / Sale End Date,Clarification Start Date,Clarification End Date,Bid Submission Start Date,Bid Submission End Date,Financial Bid Opening Date,EMD Amount in ₹,EMD Exemption Allowed,EMD Fee Type,EMD Percentage,EMD Payable To,EMD Payable At,S.No,Bank Name,Tender Fee in ₹,Fee Payable To,Fee Payable At,Tender Fee Exemption Allowed,Name,Address,Title,Work Description,Pre Qualification Details,Independent External Monitor/Remarks,Tender Value in ₹,Product Category,Sub category,Contract Type,Bid Validity(Days),Period Of Work(Days),Location,Pincode,Pre Bid Meeting Place,Pre Bid Meeting Address,Pre Bid Meeting Date,Bid Opening Place,Should Allow NDA Tender,Allow Preferential Bidder,Tender Stage,Contract Date :,Contract Value :,Work Completion Period in days :,Updated By :,Updated on :,AOC document :,AOC Description :,S.No,Bid Number,Bidder Name,Awarded Currency,Awarded Value,S.No.1,Bid Number.1,Bidder Name.1,Submitted Date,Status,Remarks,Status Updated On,Type :,Summary :,Updated By :.1,Updated On :,Document :,BOQ Comparative Chart :,Committee Chairperson/Co-ordinator Name :,Committee Chairperson/Co-ordinator Type :,Committee Members :,Updated By :.2,Updated on :.1,Document :.1,Organisation Chain :,Tender ID :,Tender Ref No :,Tender Title :,Type :.1,Summary :.1,Updated By :.3,Updated On :.1,Document :.2,Committee Chairperson/Co-ordinator Name :.1,Committee Chairperson/Co-ordinator Type :.1,Committee Members :.1,Updated By :.4,Updated On :.2,Financial Bid Opening Date:,Document :.3,Tender Stage
Housing and Urban Development Department||Sanitation Branch,RFP No. 10 - HUD (SAN),2023_HUDD_89752_1,Yes,Open Tender,Item Rate,Works,2.0,No,No,Online,No,No,No,1.0,Fee/PreQual/Technical,.pdf,Technical / Tender Fee / Pre-qualification and Eligibility Criteria,13-Jun-2023 11:00 AM,25-Jul-2023 03:00 PM,13-Jun-2023 11:00 AM,24-Jul-2023 05:00 PM,13-Jun-2023 11:00 AM ,22-Jun-2023 05:00 PM ,13-Jun-2023 11:00 AM,24-Jul-2023 05:00 PM,10-Oct-2023 12:00 PM,"3,00,000",Yes,fixed,,Nil,Nil,1.0,ICICI BANK,"10,000",Nil,Nil,No,Engineer-in-Chief and Special Secretary,"Dr. Bhakta Kabi Das. Engineer-in- Chief, Special Secretary to Govt., Housing Urban Development Deptt. Third Floor, Kharavel Bhavan, Keshari Nagar, Bhubaneswar, Dist. Khurda, PIN -751001.",Bailing Machines with AMC,"Supply, Installation and Commissioning of Bailing Machines with AMC for four years at MRF / MCC locations of 115 ULBs in the State of Odisha.",As Detailed in RFP Documents ,NA ,,Civil Works - Others,Urban Sanitation ,Tender,120.0,30.0,Bhubaneswar,751001.0,Bhubaneswar ,"HUD Deptt. Third Floor, Kharavel Bhavan, Keshari Nagar, Bhubaneswar, Dist. Khurda, PIN -751001 ",23-Jun-2023 04:00 PM ,Bhubaneswar,No ,No,AOC,13-Aug-2024,"INR 735,000",30.0,Dipankar Biswas,13-Aug-2024 11:15 PM,23479_4.items.pdf (233.00 KB),1. Advik Energy Solution Pvt. Ltd. - 29 Units 2. Meera Steel Fabrication and Fibers - 20 Units,1.0,2181749.0,ADVIK ENERGY SOLUTION PVT. LTD,INR,"735,000",1,2181749,ADVIK ENERGY SOLUTION PVT. LTD,24-Jul-2023 12:41 PM,Accepted-AOC,29 Units,13-Aug-2024 11:16 PM,Finance,Financial Bid Opened on dt.10-10-2023 at 12.00 Noon.,Bhakta Kabi Das,10-Oct-2023 09:28 PM,finance_440801.pdf,BOQ Comparative Chart,"DMA, HUDD Odisha-cum-Mission Director, SBM",Internal,"Addl. Secretary HUDD, CE-cum-Addl. Secretary HUDD, Procurement Specialist HUDD, Odisha",Dipankar Biswas,24-Nov-2023 11:18 PM,finsummary_440801.pdf (401.17 KB),Housing and Urban Development Department||Sanitation Branch,2023_HUDD_89752_1,RFP No. 10 - HUD (SAN),Bailing Machines with AMC,Technical,Technical Bid opened on 25-Jul-2023 03.00 PM,Durgesh Nandini Sahoo,16-Sep-2023 02:28 PM,,"DMA-State Mission Director,(SBM-U) HUDD, Govt.of Odisha",Internal,"1.OSD-cum-Special Secy,HUDD 2.Engineer-in-Chief,OWSSB 3.Addl.Secy-AMD,(SBM-U)HUDD 4.FA-cum-Addl.Secy,HUDD 5.Chief Engineer-cum-Addl.Secy, HUDD 6.Jt.Secy-Pr.Director,SUDA 7.Procurement Specialist,HUDD",Bhakta Kabi Das,07-Oct-2023 11:43 PM,10-Oct-2023 12:00 PM,techsummary_440801.pdf (3986.47 KB),AOC
,,,,,,,,,,,,,,2.0,Finance,.xls,Financial,,,,,,,,,,,,,,,,2.0,ICICI NEFT/RTGS,,,,,,,,,,,,,,,,,,,,,,,,,AOC,,,,,,,,2.0,2184225.0,Meera Steel Fabrication and Fibers,INR,"735,000",2,2183258,CHAUHAN CONSTRUCTION,24-Jul-2023 02:29 PM,Rejected-Technical,Technically Ineligible,07-Oct-2023 11:43 PM,,,,,,,,,,,,,,,,,,,,,,,,,,,,,AOC
,,,,,,,,,,,,,,,,,,,,,,,,,,,,,,,,,,,,,,,,,,,,,,,,,,,,,,,,,,,AOC,,,,,,,,,,,,,3,2182938,GLOBAL,24-Jul-2023 12:20 AM,Rejected-Technical,Technically Ineligible,07-Oct-2023 11:43 PM,,,,,,,,,,,,,,,,,,,,,,,,,,,,,AOC
,,,,,,,,,,,,,,,,,,,,,,,,,,,,,,,,,,,,,,,,,,,,,,,,,,,,,,,,,,,AOC,,,,,,,,,,,,,4,2183296,LECTRONICS(PROPERIETOR- SANJAY KUMAR PATEL),24-Jul-2023 11:08 AM,Rejected-Technical,Technically Ineligible,07-Oct-2023 11:43 PM,,,,,,,,,,,,,,,,,,,,,,,,,,,,,AOC
,,,,,,,,,,,,,,,,,,,,,,,,,,,,,,,,,,,,,,,,,,,,,,,,,,,,,,,,,,,AOC,,,,,,,,,,,,,5,2184225,Meera Steel Fabrication and Fibers,24-Jul-2023 02:00 PM,Accepted-AOC,20 Units,13-Aug-2024 11:16 PM,,,,,,,,,,,,,,,,,,,,,,,,,,,,,AOC
