Organisation Chain,Tender Reference Number,Tender ID,Withdrawal Allowed,Tender Type,Form of contract,Tender Category,No. of Covers,General Technical Evaluation Allowed,ItemWise Technical Evaluation Allowed,Payment Mode,Is Multi Currency Allowed For BOQ,Is Multi Currency Allowed For Fee,Allow Two Stage Bidding,Cover No,Cover,Document Type,Description,Publish Date,Bid Opening Date,Document Download / Sale Start Date,Document Download / Sale End Date,Clarification Start Date,Clarification End Date,Bid Submission Start Date,Bid Submission End Date,Financial Bid Opening Date,EMD Amount in ₹,EMD Exemption Allowed,EMD Fee Type,EMD Percentage,EMD Payable To,EMD Payable At,S.No,Bank Name,Tender Fee in ₹,VAT Charges in ₹,Fee Payable To,Fee Payable At,Tender Fee Exemption Allowed,Name,Address,Title,Work Description,Pre Qualification Details,Independent External Monitor/Remarks,Tender Value in ₹,Product Category,Sub category,Contract Type,Bid Validity(Days),Period Of Work(Days),Location,Pincode,Pre Bid Meeting Place,Pre Bid Meeting Address,Pre Bid Meeting Date,Bid Opening Place,Should Allow NDA Tender,Allow Preferential Bidder,Tender Stage,Contract Date :,Contract Value :,Work Completion Period in days :,Updated By :,Updated on :,AOC document :,AOC Description :,S.No,Bid Number,Bidder Name,Awarded Currency,Awarded Value,S.No.1,Bid Number.1,Bidder Name.1,Submitted Date,Status,Remarks,Status Updated On,Type :,Summary :,Updated By :.1,Updated On :,Document :,BOQ Comparative Chart :,Committee Chairperson/Co-ordinator Name :,Committee Chairperson/Co-ordinator Type :,Committee Members :,Updated By :.2,Updated on :.1,Document :.1,Organisation Chain :,Tender ID :,Tender Ref No :,Tender Title :,Type :.1,Summary :.1,Updated By :.3,Updated On :.1,Document :.2,Committee Chairperson/Co-ordinator Name :.1,Committee Chairperson/Co-ordinator Type :.1,Committee Members :.1,Updated By :.4,Updated On :.2,Financial Bid Opening Date:,Document :.3,Tender Stage
EIC-CIVIL||SERNB-CIRCLE-KEONJHAR,"C.C.E.K.C., Keonjhar No. 38/ 2023-24",2023_EICCL_96664_1,Yes,Open Tender,Percentage,Works,2.0,No,No,Online,No,No,No,1.0,Fee/PreQual/Technical,.pdf,"Online proof copy of Tender paper Cost and EMD,PAN,GSTIN,Contractor RC,Affidavit.",09-Nov-2023 12:00 PM,17-Nov-2023 11:30 AM,09-Nov-2023 12:00 PM,16-Nov-2023 04:00 PM,NA ,NA ,09-Nov-2023 12:00 PM,16-Nov-2023 04:00 PM,30-Nov-2023 11:30 AM,"3,16,300",Yes,fixed,,Nil,Nil,1.0,ICICI BANK,"10,000",0.0,Nil,Nil,No,CCE Keonjhar (R and B) Circle,"O/o the CCE Keonjhar (R and B) Circle, Keonjhar-758001",Improvement of road from Kalunga High School Chowk to SH-10 at Beldhi from 0/000 to 1/672 (except 1/100 km to 1/390km) in the district of Sundargarh under State Plan for the year 2023-24,Improvement of road from Kalunga High School Chowk to SH-10 at Beldhi from 0/000 to 1/672 (except 1/100 km to 1/390km) in the district of Sundargarh under State Plan for the year 2023-24,Please refer Tender Documents ,NA ,"3,16,30,000",Civil Works - Roads,NA ,Tender,90.0,90.0,Rourkela,769012.0,NA ,NA ,NA ,O/o the CCE Keonjhar (R and B) Circle,No ,No,AOC,25-Apr-2024,"INR 26,888,706.3",90.0,Manoranjan Biswal,25-Apr-2024 10:50 AM,AOC.pdf (510.00 KB),1st Lowest Bidder Winner of Lottery,1.0,2316947.0,NAROTTAM SAMAL,INR,"26,888,706.3",1,2314430,AJAY TIWARI,14-Nov-2023 02:06 PM,Rejected-Finance,1st Lowest Bidder,25-Apr-2024 10:46 AM,Finance,Bid opening summary,Manoranjan Biswal,30-Nov-2023 12:44 PM,finance_471793.pdf,BOQ Comparative Chart,Manoranjan Biswal,Internal,SE Rourkela R and B Division Sr DAO Rourkela R and B Division PA to CCE Keonjhar R and B Circle,Manoranjan Biswal,25-Apr-2024 10:46 AM,finsummary_471793.pdf (1082.41 KB),EIC-CIVIL||SERNB-CIRCLE-KEONJHAR,2023_EICCL_96664_1,"C.C.E.K.C., Keonjhar No. 38/ 2023-24",Improvement of road from Kalunga High School Chowk to SH-10 at Beldhi from 0/000 to 1/672 (except 1/100 km to 1/390km) in the district of Sundargarh under State Plan for the year 2023-24,Technical,Bid opening summary,Manoranjan Biswal,17-Nov-2023 01:28 PM,technical_471793.pdf,Manoranjan Biswal,Internal,SE Rourkela R and B Division Sr DAO Rourkela R and B Division PA to CCE Keonjhar R and B Circle,Manoranjan Biswal,29-Nov-2023 07:22 PM,30-Nov-2023 11:30 AM,techsummary_471793.pdf (1082.41 KB),AOC
,,,,,,,,,,,,,,,,.pdf,"Machineries, work in hand, work experience",,,,,,,,,,,,,,,,2.0,ICICI NEFT/RTGS,,,,,,,,,,,,,,,,,,,,,,,,,,AOC,,,,,,,,,,,,,2,2316255,M/S UNISON INFRACON,16-Nov-2023 01:07 PM,Rejected-Finance,1st Lowest Bidder,25-Apr-2024 10:46 AM,,,,,,,,,,,,,,,,,,,,,,,,,,,,,AOC
,,,,,,,,,,,,,,,,.pdf,Other documents as per DTCN,,,,,,,,,,,,,,,,,,,,,,,,,,,,,,,,,,,,,,,,,,,AOC,,,,,,,,,,,,,3,2316947,NAROTTAM SAMAL,16-Nov-2023 02:10 PM,Accepted-AOC,1st Lowest Bidder Winner of Lottery,25-Apr-2024 10:50 AM,,,,,,,,,,,,,,,,,,,,,,,,,,,,,AOC
,,,,,,,,,,,,,,2.0,Finance,.xls,Bill of Quantity,,,,,,,,,,,,,,,,,,,,,,,,,,,,,,,,,,,,,,,,,,,AOC,,,,,,,,,,,,,4,2316595,SAPNESWAR CONSTRUCTION PRIVATE LIMITED,16-Nov-2023 12:52 PM,Rejected-Finance,1st Lowest Bidder,25-Apr-2024 10:46 AM,,,,,,,,,,,,,,,,,,,,,,,,,,,,,AOC
,,,,,,,,,,,,,,,,,,,,,,,,,,,,,,,,,,,,,,,,,,,,,,,,,,,,,,,,,,,,AOC,,,,,,,,,,,,,5,2316814,SOURAV SAMAL,16-Nov-2023 03:17 PM,Rejected-Technical,As per decision of technical evaluation committee,29-Nov-2023 07:22 PM,,,,,,,,,,,,,,,,,,,,,,,,,,,,,AOC
