Organisation Chain,Tender Reference Number,Tender ID,Withdrawal Allowed,Tender Type,Form of contract,Tender Category,No. of Covers,General Technical Evaluation Allowed,ItemWise Technical Evaluation Allowed,Payment Mode,Is Multi Currency Allowed For BOQ,Is Multi Currency Allowed For Fee,Allow Two Stage Bidding,Cover No,Cover,Document Type,Description,Publish Date,Bid Opening Date,Document Download / Sale Start Date,Document Download / Sale End Date,Clarification Start Date,Clarification End Date,Bid Submission Start Date,Bid Submission End Date,EMD Amount in ₹,EMD Exemption Allowed,EMD Fee Type,EMD Percentage,EMD Payable To,EMD Payable At,S.No,Bank Name,Tender Fee in ₹,VAT Charges in ₹,Fee Payable To,Fee Payable At,Tender Fee Exemption Allowed,Name,Address,Title,Work Description,Pre Qualification Details,Independent External Monitor/Remarks,Tender Value in ₹,Product Category,Sub category,Contract Type,Bid Validity(Days),Period Of Work(Days),Location,Pincode,Pre Bid Meeting Place,Pre Bid Meeting Address,Pre Bid Meeting Date,Bid Opening Place,Should Allow NDA Tender,Allow Preferential Bidder,Tender Stage,Contract Date :,Contract Value :,Work Completion Period in days :,Updated By :,Updated on :,AOC document :,S.No,Bid Number,Bidder Name,Awarded Currency,Awarded Value,S.No.1,Bid Number.1,Bidder Name.1,Submitted Date,Status,Remarks,Status Updated On,Type :,Summary :,Updated By :.1,Updated On :,Document :,BOQ Comparative Chart :,Committee Chairperson/Co-ordinator Name :,Committee Chairperson/Co-ordinator Type :,Committee Members :,Updated By :.2,Updated on :.1,Document :.1,Organisation Chain :,Tender ID :,Tender Ref No :,Tender Title :,Committee Chairperson/Co-ordinator Name :.1,Committee Chairperson/Co-ordinator Type :.1,Committee Members :.1,Updated By :.3,Updated On :.1,Document :.2,Tender Stage
CE RW I||RWCIRCLE-BHUBANESWAR||RWDIVISION-PURI,Online-11 Dt. 18.01.2024,2024_CERWI_100504_31,Yes,National Competitive Bid,Percentage,Works,1.0,No,No,Online,No,No,No,1.0,Fee/PreQual/Technical/Finance,.pdf,"Cost of tender paper, EMD, APS, PAN, GSTIN, Registration Certificate and other documents as per DTCN",03-Feb-2024 06:00 PM,13-Feb-2024 11:00 AM,03-Feb-2024 06:00 PM,12-Feb-2024 03:00 PM,03-Feb-2024 06:00 PM ,09-Feb-2024 01:00 PM ,03-Feb-2024 06:00 PM,12-Feb-2024 03:00 PM,"49,150",Yes,fixed,,Nil,Nil,1.0,ICICI BANK,"6,000",0.0,Nil,Nil,No,"Executive Engineer,R.W.Division,Puri","O/o Superintending Engineer,R.W.Division,Puri",Construction of Sub Centre building at Dugal under Satyabadi Block (PM- ABHIM) for the 2022-23.,Construction of Sub Centre building at Dugal under Satyabadi Block (PM- ABHIM) for the 2022-23.,Please refer DTCN ,NA ,"49,15,000",Civil Works - Buildings,NA ,Tender,90.0,180.0,Puri,752001.0,NA ,NA ,NA ,"O/o Superintending Engineer,R.W.Division,Puri",No ,No,AOC,29-Apr-2024,"INR 4,130,333",180.0,Jyoti Prakash Samal,29-Apr-2024 05:51 PM,Dugal.pdf (886.00 KB),1.0,2434836.0,KARTIKA MALLICK,INR,"3,923,404",1,2428215,ANIL KUMAR SAHOO,08-Feb-2024 10:08 AM,Rejected-Finance,As L1 Bidders rate is accepted hence L4 bidders rate is considered as rejected.,29-Apr-2024 05:42 PM,Finance,7 nos bidder are submitted for finalisation.Sri Pramod Kumar nayak found not qualified due to Mismatch name in affidavit.,Rina Kumari Sasmal,04-Mar-2024 05:37 PM,,BOQ Comparative Chart,"Er. Jyoti Prakash Samal,EE",Internal,"Sri Rabindra Nath Saha, ,Smt. Rina Kumari Sasmal",Jyoti Prakash Samal,29-Apr-2024 05:42 PM,finsummary_489567.pdf (519.64 KB),CE RW I||RWCIRCLE-BHUBANESWAR||RWDIVISION-PURI,2024_CERWI_100504_31,Online-11 Dt. 18.01.2024,Construction of Sub Centre building at Dugal under Satyabadi Block (PM- ABHIM) for the 2022-23.,"Er. Jyoti Prakash Samal,EE",Internal,"Sri Rabindra Nath Saha, ,Smt. Rina Kumari Sasmal",Jyoti Prakash Samal,29-Apr-2024 05:35 PM,techsummary_489567.pdf (519.64 KB),AOC
,,,,,,,,,,,,,,,,.xls,Bill of Quantity,,,,,,,,,,,,,,,2.0,ICICI NEFT/RTGS,,,,,,,,,,,,,,,,,,,,,,,,,,AOC,,,,,,,,,,,,2,2435065,GURU PRASAD MOHARANA,12-Feb-2024 12:07 PM,Rejected-Finance,As L1 Bidders rate is accepted hence L4 bidders rate is considered as rejected.,29-Apr-2024 05:42 PM,,,,,,,,,,,,,,,,,,,,,,,AOC
,,,,,,,,,,,,,,,,,,,,,,,,,,,,,,,,,,,,,,,,,,,,,,,,,,,,,,,,,,,AOC,,,,,,,,,,,,3,2434836,KARTIKA MALLICK,12-Feb-2024 11:12 AM,Accepted-AOC,"As S.C. bidder, the rate of L1 bidder is accepted after negotiation and he is awarded.",29-Apr-2024 05:51 PM,,,,,,,,,,,,,,,,,,,,,,,AOC
,,,,,,,,,,,,,,,,,,,,,,,,,,,,,,,,,,,,,,,,,,,,,,,,,,,,,,,,,,,AOC,,,,,,,,,,,,4,2434608,MANAS RANJAN RAUT,12-Feb-2024 10:04 AM,Rejected-Finance,As L1 Bidders rate is accepted hence L3 bidders rate is considered as rejected,29-Apr-2024 05:42 PM,,,,,,,,,,,,,,,,,,,,,,,AOC
,,,,,,,,,,,,,,,,,,,,,,,,,,,,,,,,,,,,,,,,,,,,,,,,,,,,,,,,,,,AOC,,,,,,,,,,,,5,2433563,PRADEEPTA BADAJENA,11-Feb-2024 05:12 PM,Rejected-Finance,As L1 Bidders rate is accepted hence L2 bidders rate is considered as rejected.,29-Apr-2024 05:42 PM,,,,,,,,,,,,,,,,,,,,,,,AOC
,,,,,,,,,,,,,,,,,,,,,,,,,,,,,,,,,,,,,,,,,,,,,,,,,,,,,,,,,,,AOC,,,,,,,,,,,,6,2433906,PRAMOD KUMAR NAYAK,12-Feb-2024 10:33 AM,Not Admitted-Fee/PreQual/Technical/Finance,Others-mismatch name in affidavit,04-Mar-2024 05:37 PM,,,,,,,,,,,,,,,,,,,,,,,AOC
,,,,,,,,,,,,,,,,,,,,,,,,,,,,,,,,,,,,,,,,,,,,,,,,,,,,,,,,,,,AOC,,,,,,,,,,,,7,2435619,SAMBIT KUMAR DAS,12-Feb-2024 01:41 PM,Rejected-Finance,As L1 Bidders rate is accepted hence L2 bidders rate is considered as rejected.,29-Apr-2024 05:42 PM,,,,,,,,,,,,,,,,,,,,,,,AOC
,,,,,,,,,,,,,,,,,,,,,,,,,,,,,,,,,,,,,,,,,,,,,,,,,,,,,,,,,,,AOC,,,,,,,,,,,,8,2435340,SK SAFIQ UDDIN,12-Feb-2024 12:51 PM,Rejected-Finance,As L1 Bidders rate is accepted hence L2 bidders rate is considered as rejected.,29-Apr-2024 05:42 PM,,,,,,,,,,,,,,,,,,,,,,,AOC
