Organisation Chain,Tender Reference Number,Tender ID,Withdrawal Allowed,Tender Type,Form of contract,Tender Category,No. of Covers,General Technical Evaluation Allowed,ItemWise Technical Evaluation Allowed,Payment Mode,Is Multi Currency Allowed For BOQ,Is Multi Currency Allowed For Fee,Allow Two Stage Bidding,Cover No,Cover,Document Type,Description,Publish Date,Bid Opening Date,Document Download / Sale Start Date,Document Download / Sale End Date,Clarification Start Date,Clarification End Date,Bid Submission Start Date,Bid Submission End Date,Financial Bid Opening Date,EMD Amount in ₹,EMD Exemption Allowed,EMD Fee Type,EMD Percentage,EMD Payable To,EMD Payable At,S.No,Bank Name,Tender Fee in ₹,VAT Charges in ₹,Fee Payable To,Fee Payable At,Tender Fee Exemption Allowed,Name,Address,Title,Work Description,Pre Qualification Details,Independent External Monitor/Remarks,Tender Value in ₹,Product Category,Sub category,Contract Type,Bid Validity(Days),Period Of Work(Days),Location,Pincode,Pre Bid Meeting Place,Pre Bid Meeting Address,Pre Bid Meeting Date,Bid Opening Place,Should Allow NDA Tender,Allow Preferential Bidder,Tender Stage,Contract Date :,Contract Value :,Work Completion Period in days :,Updated By :,Updated on :,AOC document :,AOC Description :,S.No,Bid Number,Bidder Name,Awarded Currency,Awarded Value,S.No.1,Bid Number.1,Bidder Name.1,Submitted Date,Status,Remarks,Status Updated On,Type :,Summary :,Updated By :.1,Updated On :,Document :,BOQ Comparative Chart :,Committee Chairperson/Co-ordinator Name :,Committee Chairperson/Co-ordinator Type :,Committee Members :,Updated By :.2,Updated on :.1,Document :.1,Organisation Chain :,Tender ID :,Tender Ref No :,Tender Title :,Type :.1,Summary :.1,Updated By :.3,Updated On :.1,Document :.2,Committee Chairperson/Co-ordinator Name :.1,Committee Chairperson/Co-ordinator Type :.1,Committee Members :.1,Updated By :.4,Updated On :.2,Financial Bid Opening Date:,Document :.3,Tender Stage
EIC-CIVIL||SERNB-CIRCLE-NORTHERN,CCENC (R AND B) /20/ 2023-24,2023_EICCL_95681_2,Yes,National Competitive Bid,Percentage,Works,2.0,No,No,Online,No,No,No,1.0,Fee/PreQual/Technical,.pdf,"Online Proof Copy of Tender Cost, Bid Security, GSTIN, PAN, R.C and Affidavit",16-Oct-2023 10:00 AM,30-Oct-2023 06:00 PM,16-Oct-2023 10:00 AM,30-Oct-2023 05:00 PM,16-Oct-2023 10:00 AM ,25-Oct-2023 05:00 PM ,16-Oct-2023 10:00 AM,30-Oct-2023 05:00 PM,21-Nov-2023 04:00 PM,"1,57,800",Yes,fixed,,Nil,Nil,1.0,ICICI BANK,"10,000",0.0,Nil,Nil,No,CCENC (R and B) Sambalpur,O/o THE CCENC (R and B) Sambalpur,"Improvement such as widening and strengthening of internal road of VIMSAR, Burla from 0/000 Km to 1/142 Km in the District of Sambalpur under State Plan for the year 2023-24",ROAD WORK,Please refer Tender documents. ,NA ,"1,57,64,355",Civil Works - Roads,NA ,Tender,90.0,120.0,"VIMSAR, BURLA",768017.0,NA ,NA ,NA ,O/o THE CCENC (R and B) Sambalpur,No ,No,AOC,19-Apr-2024,"INR 13,401,278",120.0,Arun Kumar Pattnaik,01-May-2024 07:09 PM,AGTVIMSAR.pdf (445.00 KB),AGT DRAWN,1.0,2297366.0,SYED AHESANULLAH,INR,"13,401,278",1,2300854,BISWAKARMAA SUBHANSU CHANDRASEKHAR,30-Oct-2023 02:57 PM,Rejected-Finance,UNSUCCESSFUL BIDDER,01-Mar-2024 08:25 PM,Finance,FINANCIAL BID OPENED,Anam Charan Sahoo,21-Nov-2023 09:41 PM,,BOQ Comparative Chart,ARUN KU PATTNAIK,Internal,A.K.LENKA ANIL MISHRA D.BEHERA S.K JENA,Arun Kumar Pattnaik,01-Mar-2024 08:25 PM,finsummary_467601.pdf (46.95 KB),EIC-CIVIL||SERNB-CIRCLE-NORTHERN,2023_EICCL_95681_2,CCENC (R AND B) /20/ 2023-24,"Improvement such as widening and strengthening of internal road of VIMSAR, Burla from 0/000 Km to 1/142 Km in the District of Sambalpur under State Plan for the year 2023-24",Technical,TECHNICAL BIDS OPENED,Arun Kumar Pattnaik,01-Nov-2023 06:53 PM,,ARUN PATTNAIK,Internal,A.K.LENKA ANIL MISHRA D.BEHERA S.K JENA,Anam Charan Sahoo,21-Nov-2023 12:00 PM,21-Nov-2023 04:00 PM,techsummary_467601.pdf (421.38 KB),AOC
,,,,,,,,,,,,,,,,.pdf,"Ownership of machineries, work experience and MOU for composite Building work etc",,,,,,,,,,,,,,,,2.0,ICICI NEFT/RTGS,,,,,,,,,,,,,,,,,,,,,,,,,,AOC,,,,,,,,,,,,,2,2298783,KSHIROD CHANDRA PRADHAN,27-Oct-2023 06:34 PM,Rejected-AOC,Unsuccessful Bidder,01-May-2024 07:09 PM,,,,,,,,,,,,,,,,,,,,,,,,,,,,,AOC
,,,,,,,,,,,,,,,,.pdf,Work experience certificate and other related documents as per DTCN,,,,,,,,,,,,,,,,,,,,,,,,,,,,,,,,,,,,,,,,,,,AOC,,,,,,,,,,,,,3,2298940,MD ZAHIRUDDIN,27-Oct-2023 09:51 PM,Rejected-Finance,UNSUCCESSFUL BIDDER,01-Mar-2024 08:25 PM,,,,,,,,,,,,,,,,,,,,,,,,,,,,,AOC
,,,,,,,,,,,,,,2.0,Finance,.xls,BILL OF QUANTITY (BOQ),,,,,,,,,,,,,,,,,,,,,,,,,,,,,,,,,,,,,,,,,,,AOC,,,,,,,,,,,,,4,2299844,PRIYADARSINI MEHER,29-Oct-2023 06:09 PM,Rejected-AOC,Unsuccessful Bidder,01-May-2024 07:09 PM,,,,,,,,,,,,,,,,,,,,,,,,,,,,,AOC
,,,,,,,,,,,,,,,,,,,,,,,,,,,,,,,,,,,,,,,,,,,,,,,,,,,,,,,,,,,,AOC,,,,,,,,,,,,,5,2301008,PYARIMOHAN PRADHAN,30-Oct-2023 04:49 PM,Rejected-Finance,UNSUCCESSFUL BIDDER,01-Mar-2024 08:25 PM,,,,,,,,,,,,,,,,,,,,,,,,,,,,,AOC
,,,,,,,,,,,,,,,,,,,,,,,,,,,,,,,,,,,,,,,,,,,,,,,,,,,,,,,,,,,,AOC,,,,,,,,,,,,,6,2297366,SYED AHESANULLAH,28-Oct-2023 02:11 PM,Accepted-AOC,Agreement drawn by L2 bidder consequent upon his willingness to execute the contract at L1 rate as the L1 Bidder has failed to draw the agreement.,01-May-2024 07:09 PM,,,,,,,,,,,,,,,,,,,,,,,,,,,,,AOC
