Organisation Chain,Tender Reference Number,Tender ID,Withdrawal Allowed,Tender Type,Form of contract,Tender Category,No. of Covers,General Technical Evaluation Allowed,ItemWise Technical Evaluation Allowed,Payment Mode,Is Multi Currency Allowed For BOQ,Is Multi Currency Allowed For Fee,Allow Two Stage Bidding,Cover No,Cover,Document Type,Description,Publish Date,Bid Opening Date,Document Download / Sale Start Date,Document Download / Sale End Date,Clarification Start Date,Clarification End Date,Bid Submission Start Date,Bid Submission End Date,Financial Bid Opening Date,EMD Amount in ₹,EMD Exemption Allowed,EMD Fee Type,EMD Percentage,EMD Payable To,EMD Payable At,S.No,Corrigendum Title,Corrigendum Type,View,S.No.1,Bank Name,Tender Fee in ₹,VAT Charges in ₹,Fee Payable To,Fee Payable At,Tender Fee Exemption Allowed,Name,Address,Title,Work Description,Pre Qualification Details,Independent External Monitor/Remarks,Tender Value in ₹,Product Category,Sub category,Contract Type,Bid Validity(Days),Period Of Work(Days),Location,Pincode,Pre Bid Meeting Place,Pre Bid Meeting Address,Pre Bid Meeting Date,Bid Opening Place,Should Allow NDA Tender,Allow Preferential Bidder,Tender Stage,Contract Date :,Contract Value :,Work Completion Period in days :,Updated By :,Updated on :,AOC document :,AOC Description :,S.No,Bid Number,Bidder Name,Awarded Currency,Awarded Value,S.No.1,Bid Number.1,Bidder Name.1,Submitted Date,Status,Remarks,Status Updated On,Type :,Summary :,Updated By :.1,Updated On :,Document :,BOQ Comparative Chart :,Committee Chairperson/Co-ordinator Name :,Committee Chairperson/Co-ordinator Type :,Committee Members :,Updated By :.2,Updated on :.1,Document :.1,Organisation Chain :,Tender ID :,Tender Ref No :,Tender Title :,Type :.1,Summary :.1,Updated By :.3,Updated On :.1,Document :.2,Committee Chairperson/Co-ordinator Name :.1,Committee Chairperson/Co-ordinator Type :.1,Committee Members :.1,Updated By :.4,Updated On :.2,Financial Bid Opening Date:,Document :.3,Tender Stage
EIC-CIVIL,C.E. (B) - 49 / 2023-24,2023_EICCL_99001_1,Yes,Open Tender,Lump-sum,Works,2.0,No,No,Online,No,No,No,1.0,Fee/PreQual/Technical,.pdf,Bid Security and cost of Bid documents online mode.,30-Dec-2023 10:00 AM,13-Feb-2024 11:30 AM,30-Dec-2023 10:00 AM,08-Feb-2024 05:30 PM,NA ,NA ,30-Dec-2023 10:00 AM,08-Feb-2024 05:30 PM,04-Mar-2024 11:00 AM,"33,00,000",Yes,fixed,,Nil,Nil,1.0,5TH CORRIGENDUM,Date,,1.0,ICICI BANK,"10,000",0.0,Nil,Nil,No,"Chief Engineer, Buildings(IC), Odisha, Bhubaneswar","O/o. the E.I.C. (Civil), Odisha, Unit-V, Nirman Soudha, Bhubaneswar.","Establishment of Modular OTs at SLN MCH, Koraput and B.B. MCH, Balangir on Turnkey Basis in the state of Odisha.","Establishment of Modular OTs at SLN MCH, Koraput and B.B. MCH, Balangir on Turnkey Basis in the state of Odisha.",Please refer Tender documents. ,NA ,,Civil Works - Buildings,NA ,Tender,120.0,182.0,KORAPUT / BALANGIR,764020.0,"O/o. the E.I.C. (Civil), Odisha, Bhubaneswar ","O/o. the E.I.C. (Civil), Odisha, Bhubaneswar. ",05-Jan-2024 11:00 AM ,"O/o. the E.I.C. (Civil), Odisha, Bhubaneswar.",No ,No,AOC,18-Apr-2024,"INR 321,256,762",182.0,Bijaya Kumar Nayak,18-Apr-2024 06:47 PM,AOC_Balangir.pdf (962.00 KB),AOC,1.0,2420890.0,Malani Construction Co.,INR,"321,256,762",1.0,2419912.0,JP STRUCTURES PRIVATE LIMITED,05-Feb-2024 04:04 PM,Rejected-AOC,L2,18-Apr-2024 06:51 PM,Finance,Opening,Dukhabandhu Behera,04-Mar-2024 11:52 AM,,BOQ Comparative Chart,Sri V V Yadav Principal Secretary Works Dept Odisha,Internal,Sri M R Misra EIC Civil Odisha Sri D Behera CE Building IC Odisha Sri S Dhal FA cum Special Secretary Works Dept Odisha,Bijaya Kumar Nayak,18-Apr-2024 05:58 PM,finsummary_481762.pdf (358.50 KB),EIC-CIVIL,2023_EICCL_99001_1,C.E. (B) - 49 / 2023-24,"Establishment of Modular OTs at SLN MCH, Koraput and B.B. MCH, Balangir on Turnkey Basis in the state of Odisha.",Technical,3 Nos. Bidder Received,Dukhabandhu Behera,13-Feb-2024 12:27 PM,,Sri M R Misra EIC Civil Odisha,Internal,Sri D Behera CE Buildings IC Odisha Dr S R Ransingh MD OSMCL Sr R Rattan Jt DMET Odisha Dr J B Sarangi Nodal Officer Sunetra Sri B K Nayak Addl CE Civil Mrs P Samal FA,Dukhabandhu Behera,02-Mar-2024 08:01 PM,04-Mar-2024 11:00 AM,techsummary_481762.pdf (489.52 KB),AOC
,,,,,,,,,,,,,,,,.pdf,Other Documents as per Bid Document.,,,,,,,,,,,,,,,,2.0,2nd Corrignedum,Other,,2.0,ICICI NEFT/RTGS,,,,,,,,,,,,,,,,,,,,,,,,,,AOC,,,,,,,,,,,,,2.0,2420890.0,Malani Construction Co.,05-Feb-2024 03:41 PM,Accepted-AOC,L1,18-Apr-2024 06:51 PM,,,,,,,,,,,,,,,,,,,,,,,,,,,,,AOC
,,,,,,,,,,,,,,,,.pdf,Technical Bid as indicated as Section-2.,,,,,,,,,,,,,,,,,,,,,,,,,,,,,,,,,,,,,,,,,,,,,,,AOC,,,,,,,,,,,,,3.0,2424273.0,MDD MEDICAL SYSTEMS (INDIA) PVT LTD,08-Feb-2024 01:52 PM,Rejected-Technical,Diqualified,02-Mar-2024 08:01 PM,,,,,,,,,,,,,,,,,,,,,,,,,,,,,AOC
,,,,,,,,,,,,,,,,.pdf,Qualification Information and supporting documents as per Section-2.,,,,,,,,,,,,,,,,,,,,,,,,,,,,,,,,,,,,,,,,,,,,,,,AOC,,,,,,,,,,,,,,,,,,,,,,,,,,,,,,,,,,,,,,,,,,,,,,,,AOC
,,,,,,,,,,,,,,,,.pdf,Scope of Work as Section-8.,,,,,,,,,,,,,,,,,,,,,,,,,,,,,,,,,,,,,,,,,,,,,,,AOC,,,,,,,,,,,,,,,,,,,,,,,,,,,,,,,,,,,,,,,,,,,,,,,,AOC
,,,,,,,,,,,,,,,,.pdf,"Certificates Undertakings, Affidavit as per Section-2.",,,,,,,,,,,,,,,,,,,,,,,,,,,,,,,,,,,,,,,,,,,,,,,AOC,,,,,,,,,,,,,,,,,,,,,,,,,,,,,,,,,,,,,,,,,,,,,,,,AOC
,,,,,,,,,,,,,,2.0,Finance,.xls,Quoted Lump-sum Price BOQ with Bidder Name.,,,,,,,,,,,,,,,,,,,,,,,,,,,,,,,,,,,,,,,,,,,,,,,AOC,,,,,,,,,,,,,,,,,,,,,,,,,,,,,,,,,,,,,,,,,,,,,,,,AOC
