Organisation Chain,Tender Reference Number,Tender ID,Withdrawal Allowed,Tender Type,Form of contract,Tender Category,No. of Covers,General Technical Evaluation Allowed,ItemWise Technical Evaluation Allowed,Payment Mode,Is Multi Currency Allowed For BOQ,Is Multi Currency Allowed For Fee,Allow Two Stage Bidding,Cover No,Cover,Document Type,Description,Publish Date,Bid Opening Date,Document Download / Sale Start Date,Document Download / Sale End Date,Clarification Start Date,Clarification End Date,Bid Submission Start Date,Bid Submission End Date,EMD Amount in ₹,EMD Exemption Allowed,EMD Fee Type,EMD Percentage,EMD Payable To,EMD Payable At,S.No,Bank Name,Tender Fee in ₹,VAT Charges in ₹,Fee Payable To,Fee Payable At,Tender Fee Exemption Allowed,Name,Address,Title,Work Description,Pre Qualification Details,Independent External Monitor/Remarks,Tender Value in ₹,Product Category,Sub category,Contract Type,Bid Validity(Days),Period Of Work(Days),Location,Pincode,Pre Bid Meeting Place,Pre Bid Meeting Address,Pre Bid Meeting Date,Bid Opening Place,Should Allow NDA Tender,Allow Preferential Bidder,Tender Stage,Contract Date :,Contract Value :,Work Completion Period in days :,Updated By :,Updated on :,AOC document :,AOC Description :,S.No,Bid Number,Bidder Name,Awarded Currency,Awarded Value,S.No.1,Bid Number.1,Bidder Name.1,Submitted Date,Status,Remarks,Status Updated On,Type :,Summary :,Updated By :.1,Updated On :,Document :,BOQ Comparative Chart :,Committee Chairperson/Co-ordinator Name :,Committee Chairperson/Co-ordinator Type :,Committee Members :,Updated By :.2,Updated on :.1,Document :.1,Organisation Chain :,Tender ID :,Tender Ref No :,Tender Title :,Committee Chairperson/Co-ordinator Name :.1,Committee Chairperson/Co-ordinator Type :.1,Committee Members :.1,Updated By :.3,Updated On :.1,Document :.2,Tender Stage
EIC-CIVIL||SERNB-CIRCLE-KHURDA||EERNB-DIVN-PURI,TCN NO 27 OF 2023-24,2023_EICCL_93350_1,Yes,National Competitive Bid,Percentage,Works,1.0,No,No,Online,No,No,No,1.0,Fee/PreQual/Technical/Finance,.pdf,"RC,PAN,GSTN,EMD,COST OF TENDER PAPER,AFFIDAVIT,ALL SCHEDULE AS PER APPROVED DTCN",28-Aug-2023 10:00 AM,08-Sep-2023 11:30 AM,28-Aug-2023 10:00 AM,07-Sep-2023 05:00 PM,NA ,NA ,28-Aug-2023 10:00 AM,07-Sep-2023 05:00 PM,"12,981",Yes,percentage,1.0%,Nil,Nil,1.0,ICICI BANK,"6,000",0.0,Nil,Nil,No,Er. Rashmi Ranjan Sahoo,"O/o the S.E. R and B Division, Puri",Construction of Fixed Vision Centre (FVC) for CHC Sakhigopal of Puri District under SUNETRA during the year 2023-24,Construction of Fixed Vision Centre (FVC) for CHC Sakhigopal of Puri District under SUNETRA during the year 2023-24,Please refer Tender documents. ,NA ,"12,98,051",Civil Works - Buildings,NA ,Tender,90.0,90.0,Puri,752001.0,NA ,NA ,NA ,"O/o the S.E. R and B Division, Puri",No ,No,AOC,26-Apr-2024,"INR 1,103,473",90.0,Rasmi Ranjan Sahoo,26-Apr-2024 11:46 AM,AOC.pdf (400.00 KB),The bidder won the transparency lottery among the participated bidder so that the work has been awarded to him,1.0,2235037.0,SANTOSH KUMAR MISHRA,INR,"1,103,473",1,2241724,BAIDHAR NAYAK,07-Sep-2023 11:37 AM,Rejected-Finance,Unsuccessful bidder after transparency lottery,26-Oct-2023 08:31 PM,Finance,Total 6 Nos bidder are participated in the online tender,Rasmi Ranjan Sahoo,08-Sep-2023 05:33 PM,,BOQ Comparative Chart,Er. Rashmi Ranjan Sahoo,Internal,Sri Bikram Keshari Pattanaik Smt Smita Pal,Rasmi Ranjan Sahoo,26-Oct-2023 08:31 PM,finsummary_455203.pdf (511.78 KB),EIC-CIVIL||SERNB-CIRCLE-KHURDA||EERNB-DIVN-PURI,2023_EICCL_93350_1,TCN NO 27 OF 2023-24,Construction of Fixed Vision Centre (FVC) for CHC Sakhigopal of Puri District under SUNETRA during the year 2023-24,Er. Rashmi Ranjan Sahoo,Internal,Sri Bikram Keshari Pattanaik Smt Smita Pal,Rasmi Ranjan Sahoo,26-Oct-2023 08:24 PM,techsummary_455203.pdf (250.03 KB),AOC
,,,,,,,,,,,,,,,,.xls,BILL OF QUANTITY,,,,,,,,,,,,,,,2.0,ICICI NEFT/RTGS,,,,,,,,,,,,,,,,,,,,,,,,,,AOC,,,,,,,,,,,,,2,2239186,JAGANATH SAHOO,06-Sep-2023 01:34 PM,Rejected-Finance,Unsuccessful bidder after transparency lottery,26-Oct-2023 08:31 PM,,,,,,,,,,,,,,,,,,,,,,,AOC
,,,,,,,,,,,,,,,,,,,,,,,,,,,,,,,,,,,,,,,,,,,,,,,,,,,,,,,,,,,AOC,,,,,,,,,,,,,3,2242873,MANGARAJ BARIK,07-Sep-2023 03:04 PM,Rejected-Finance,Unsuccessful bidder after transparency lottery,26-Oct-2023 08:31 PM,,,,,,,,,,,,,,,,,,,,,,,AOC
,,,,,,,,,,,,,,,,,,,,,,,,,,,,,,,,,,,,,,,,,,,,,,,,,,,,,,,,,,,AOC,,,,,,,,,,,,,4,2235037,SANTOSH KUMAR MISHRA,07-Sep-2023 04:32 PM,Accepted-AOC,The bidder won the transparency lottery among the participated bidder so that the work has been awarded to him,26-Apr-2024 11:46 AM,,,,,,,,,,,,,,,,,,,,,,,AOC
,,,,,,,,,,,,,,,,,,,,,,,,,,,,,,,,,,,,,,,,,,,,,,,,,,,,,,,,,,,AOC,,,,,,,,,,,,,5,2240154,Shankar Pujari,07-Sep-2023 01:46 PM,Rejected-AOC,Rejected,26-Apr-2024 11:46 AM,,,,,,,,,,,,,,,,,,,,,,,AOC
,,,,,,,,,,,,,,,,,,,,,,,,,,,,,,,,,,,,,,,,,,,,,,,,,,,,,,,,,,,AOC,,,,,,,,,,,,,6,2242745,SUSANT KUMAR MALLIK,07-Sep-2023 02:44 PM,Rejected-Finance,Unsuccessful bidder after transparency lottery,26-Oct-2023 08:31 PM,,,,,,,,,,,,,,,,,,,,,,,AOC
