Organisation Chain,Tender Reference Number,Tender ID,Withdrawal Allowed,Tender Type,Form of contract,Tender Category,No. of Covers,General Technical Evaluation Allowed,ItemWise Technical Evaluation Allowed,Payment Mode,Is Multi Currency Allowed For BOQ,Is Multi Currency Allowed For Fee,Allow Two Stage Bidding,Cover No,Cover,Document Type,Description,Publish Date,Bid Opening Date,Document Download / Sale Start Date,Document Download / Sale End Date,Clarification Start Date,Clarification End Date,Bid Submission Start Date,Bid Submission End Date,EMD Amount in ₹,EMD Exemption Allowed,EMD Fee Type,EMD Percentage,EMD Payable To,EMD Payable At,S.No,Bank Name,Tender Fee in ₹,VAT Charges in ₹,Fee Payable To,Fee Payable At,Tender Fee Exemption Allowed,Name,Address,Title,Work Description,Pre Qualification Details,Independent External Monitor/Remarks,Tender Value in ₹,Product Category,Sub category,Contract Type,Bid Validity(Days),Period Of Work(Days),Location,Pincode,Pre Bid Meeting Place,Pre Bid Meeting Address,Pre Bid Meeting Date,Bid Opening Place,Should Allow NDA Tender,Allow Preferential Bidder,Tender Stage,Contract Date :,Contract Value :,Work Completion Period in days :,Updated By :,Updated on :,AOC document :,AOC Description :,S.No,Bid Number,Bidder Name,Awarded Currency,Awarded Value,S.No.1,Bid Number.1,Bidder Name.1,Submitted Date,Status,Remarks,Status Updated On,Type :,Summary :,Updated By :.1,Updated On :,Document :,BOQ Comparative Chart :,Committee Chairperson/Co-ordinator Name :,Committee Chairperson/Co-ordinator Type :,Committee Members :,Updated By :.2,Updated on :.1,Document :.1,Organisation Chain :,Tender ID :,Tender Ref No :,Tender Title :,Committee Chairperson/Co-ordinator Name :.1,Committee Chairperson/Co-ordinator Type :.1,Committee Members :.1,Updated By :.3,Updated On :.1,Document :.2,Tender Stage
EIC-CIVIL||SERNB-CIRCLE-BOLANGIR||EERNB-DIVISION-SONEPUR,SE/R AND B/ SNPR / 20 / 2023-24,2023_EICCL_98711_6,Yes,National Competitive Bid,Percentage,Works,1.0,No,No,Online,No,No,No,1.0,Fee/PreQual/Technical/Finance,.pdf,"Tender cost (Online), EMD (online), GST Certificate, PAN Contractor RC",22-Dec-2023 10:00 AM,05-Jan-2024 11:30 AM,22-Dec-2023 10:00 AM,04-Jan-2024 05:00 PM,22-Dec-2023 10:00 AM ,30-Dec-2023 05:00 PM ,22-Dec-2023 10:00 AM,04-Jan-2024 05:00 PM,"15,900",Yes,fixed,,Nil,Nil,1.0,ICICI BANK,"6,000",0.0,Nil,Nil,No,Superintending Engineer,"O/O SE (RandB) Division, Sonepur",SITC of IP Address CCTV Camera with Audio and Storage Facility for Sub-Judge and SDJM Court at Birmaharajpur in the District of Subarnapur for the year 2023-24,SITC of IP Address CCTV Camera with Audio and Storage Facility for Sub-Judge and SDJM Court at Birmaharajpur in the District of Subarnapur for the year 2023-24,Please refer Tender documents. ,NA ,,Electrical Works,NA ,Tender,90.0,60.0,Sonepur,767017.0,"O/O SE (RandB) Division, Sonepur ","O/O SE (RandB) Division, Sonepur ",03-Jan-2024 09:00 AM ,"O/O SE (RandB) Division, Sonepur",No ,No,AOC,09-Apr-2024,"INR 1,344,416.15",60.0,Bishwojit Das,09-Apr-2024 06:51 PM,w.pdf (269.00 KB),Work Order,1.0,2376686.0,BALBIR SINGH GOG,INR,"1,344,416.15",1,2376686,BALBIR SINGH GOG,04-Jan-2024 11:49 AM,Accepted-AOC,Awarded for lottery system,09-Apr-2024 06:51 PM,Finance,6 nos. bidders are participate and all are admitted,Manjit Singh,05-Jan-2024 06:26 PM,finance_480779.pdf,BOQ Comparative Chart,"D. Kaibartta, SE",Internal,"M. Singh, DAO, B. Das, AE (Estimator)",Bishwojit Das,09-Apr-2024 06:48 PM,finsummary_480779.pdf (36.76 KB),EIC-CIVIL||SERNB-CIRCLE-BOLANGIR||EERNB-DIVISION-SONEPUR,2023_EICCL_98711_6,SE/R AND B/ SNPR / 20 / 2023-24,SITC of IP Address CCTV Camera with Audio and Storage Facility for Sub-Judge and SDJM Court at Birmaharajpur in the District of Subarnapur for the year 2023-24,"D. Kaibartta, SE",Internal,"M. Singh, DAO, B. Das, AE (Estimator)",Bishwojit Das,09-Apr-2024 06:45 PM,techsummary_480779.pdf (36.76 KB),AOC
,,,,,,,,,,,,,,,,.pdf,"Affidavits, undertakings and any other document as per SBD / DTCN",,,,,,,,,,,,,,,2.0,ICICI NEFT/RTGS,,,,,,,,,,,,,,,,,,,,,,,,,,AOC,,,,,,,,,,,,,2,2369208,DIVINE ENTERPRISES,27-Dec-2023 12:32 PM,Rejected-AOC,Rejected for lottery system,09-Apr-2024 06:51 PM,,,,,,,,,,,,,,,,,,,,,,,AOC
,,,,,,,,,,,,,,,,.xls,Boq,,,,,,,,,,,,,,,,,,,,,,,,,,,,,,,,,,,,,,,,,,AOC,,,,,,,,,,,,,3,2372221,INDIA ELECTRICAL HOUSE,29-Dec-2023 08:20 PM,Rejected-AOC,Rejected for lottery system,09-Apr-2024 06:51 PM,,,,,,,,,,,,,,,,,,,,,,,AOC
,,,,,,,,,,,,,,,,,,,,,,,,,,,,,,,,,,,,,,,,,,,,,,,,,,,,,,,,,,,AOC,,,,,,,,,,,,,4,2377101,MARUTI CONSTRUCTIONS,04-Jan-2024 03:05 PM,Rejected-AOC,Rejected for lottery system,09-Apr-2024 06:51 PM,,,,,,,,,,,,,,,,,,,,,,,AOC
,,,,,,,,,,,,,,,,,,,,,,,,,,,,,,,,,,,,,,,,,,,,,,,,,,,,,,,,,,,AOC,,,,,,,,,,,,,5,2376624,M/S GIRISH CHANDRA PATRA,04-Jan-2024 10:34 AM,Rejected-AOC,Rejected for lottery system,09-Apr-2024 06:51 PM,,,,,,,,,,,,,,,,,,,,,,,AOC
,,,,,,,,,,,,,,,,,,,,,,,,,,,,,,,,,,,,,,,,,,,,,,,,,,,,,,,,,,,AOC,,,,,,,,,,,,,6,2373735,SMART I TECHNOLOGIES,01-Jan-2024 06:41 PM,Rejected-AOC,Rejected for lottery system,09-Apr-2024 06:51 PM,,,,,,,,,,,,,,,,,,,,,,,AOC
