Organisation Chain,Tender Reference Number,Tender ID,Withdrawal Allowed,Tender Type,Form of contract,Tender Category,No. of Covers,General Technical Evaluation Allowed,ItemWise Technical Evaluation Allowed,Payment Mode,Is Multi Currency Allowed For BOQ,Is Multi Currency Allowed For Fee,Allow Two Stage Bidding,Cover No,Cover,Document Type,Description,Publish Date,Bid Opening Date,Document Download / Sale Start Date,Document Download / Sale End Date,Clarification Start Date,Clarification End Date,Bid Submission Start Date,Bid Submission End Date,Financial Bid Opening Date,EMD Amount in ₹,EMD Exemption Allowed,EMD Fee Type,EMD Percentage,EMD Payable To,EMD Payable At,S.No,Corrigendum Title,Corrigendum Type,View,S.No.1,Bank Name,Tender Fee in ₹,VAT Charges in ₹,Fee Payable To,Fee Payable At,Tender Fee Exemption Allowed,Name,Address,Title,Work Description,Pre Qualification Details,Independent External Monitor/Remarks,Tender Value in ₹,Product Category,Sub category,Contract Type,Bid Validity(Days),Period Of Work(Days),Location,Pincode,Pre Bid Meeting Place,Pre Bid Meeting Address,Pre Bid Meeting Date,Bid Opening Place,Should Allow NDA Tender,Allow Preferential Bidder,Tender Stage,Contract Date :,Contract Value :,Work Completion Period in days :,Updated By :,Updated on :,AOC document :,AOC Description :,S.No,Bid Number,Bidder Name,Awarded Currency,Awarded Value,S.No.1,Bid Number.1,Bidder Name.1,Submitted Date,Status,Remarks,Status Updated On,Type :,Summary :,Updated By :.1,Updated On :,Document :,BOQ Comparative Chart :,Committee Chairperson/Co-ordinator Name :,Committee Chairperson/Co-ordinator Type :,Committee Members :,Updated By :.2,Updated on :.1,Document :.1,Organisation Chain :,Tender ID :,Tender Ref No :,Tender Title :,Type :.1,Summary :.1,Updated By :.3,Updated On :.1,Document :.2,Committee Chairperson/Co-ordinator Name :.1,Committee Chairperson/Co-ordinator Type :.1,Committee Members :.1,Updated By :.4,Updated On :.2,Financial Bid Opening Date:,Document :.3,S.No.2,Revocation Title,Revocation Description,Published Date,Document Name,Document Size(in KB),Revocated To,Tender Stage
CE RW I||RWCIRCLE-BHUBANESWAR,Tender Online C.C-32 of 2023,2023_CERWI_93868_25,Yes,National Competitive Bid,Percentage,Works,2.0,No,No,Online,No,No,No,1.0,Fee/PreQual/Technical,.pdf,"Tender Paper Cost, EMD, GSTIN, PAN, Registration Certificate",06-Sep-2023 12:00 PM,16-Sep-2023 11:00 AM,06-Sep-2023 12:00 PM,15-Sep-2023 05:00 PM,NA ,NA ,06-Sep-2023 12:00 PM,15-Sep-2023 05:00 PM,02-Jan-2024 06:05 PM,"5,48,843",Yes,percentage,1.0%,Nil,Nil,1.0,Corrigendum,Other,,1.0,ICICI BANK,"10,000",0.0,Nil,Nil,No,ChiefConstructionEngineer,"O/o ChiefConstructionEngineer,CentralRWCircle,BBSR",Construction of road from Dhuanali to Raipada in the Dist. of Khordha under CMRL for the year 2023-24,Construction of road from Dhuanali to Raipada in the Dist. of Khordha under CMRL for the year 2023-24,Please refer Tender documents. ,NA ,"5,48,84,270",Civil Works - Roads,NA ,Tender,90.0,270.0,Bhubaneswar,751022.0,NA ,NA ,NA ,"O/o ChiefConstructionEngineer,CentralRWCircle,BBSR",No ,No,AOC,29-Apr-2024,"INR 52,145,545",270.0,Priyadarshini Dalai,29-Apr-2024 06:47 PM,DhuanaliAgmtDetails.pdf (2366.00 KB),"Work order letter No.4162 dtd.04.03.2024 and Agmt no.625 P1 of 2023-24 dtd.04.03.2024 of Superintending Engineer, Rural Works Division, Bhubaneswar",1.0,2256971.0,TUSHARKANT SAMANTARAY,INR,"52,145,545",1,2257128,DILIP KUMAR SAMAL,15-Sep-2023 03:12 PM,Rejected-Technical,As per Clause No.2.1(1) of the Eligibility Criteria of General Instructions To the Tenderers of the DTCN,02-Jan-2024 06:04 PM,Finance,2 nos bidder qualified in the tender,Priyadarshini Dalai,02-Jan-2024 07:17 PM,finance_458831.pdf,BOQ Comparative Chart,"Chief Construction Engineer CentralRWCircle,BBSR",Internal,SuperintendingEngineerRWDivision Nimapara SrDAORWDivision Bhubaneswar PAtoChiefConstructionEngineerCentralRuralWorksCircleBBSR,Priyadarshini Dalai,29-Apr-2024 06:44 PM,finsummary_458831.pdf (130.64 KB),CE RW I||RWCIRCLE-BHUBANESWAR,2023_CERWI_93868_25,Tender Online C.C-32 of 2023,Construction of road from Dhuanali to Raipada in the Dist. of Khordha under CMRL for the year 2023-24,Technical,QUALIFIED AND DISQUALIFIED LIST,Priyadarshini Dalai,02-Jan-2024 06:02 PM,technical_458831.pdf,"Chief Construction Engineer CentralRWCircle,BBSR",Internal,SuperintendingEngineerRWDivision Nimapara SrDAORWDivision Bhubaneswar PAtoChiefConstructionEngineerCentralRuralWorksCircleBBSR,Priyadarshini Dalai,02-Jan-2024 06:04 PM,02-Jan-2024 06:05 PM,techsummary_458831.pdf (130.64 KB),1.0,Tender Revocation,Tender Revocation,02-Jan-2024 05:16 PM,13.pdf ,196.25,Technical Opening,AOC
,,,,,,,,,,,,,,,,.pdf,"Work in Hand, Machineries, Affidavit of Correctness Certificate",,,,,,,,,,,,,,,,,,,,2.0,ICICI NEFT/RTGS,,,,,,,,,,,,,,,,,,,,,,,,,,AOC,,,,,,,,,,,,,2,2255930,G.B.S CONSTRUCTIONS,15-Sep-2023 01:10 PM,Rejected-Technical,As per Clause No.2.1(1) of the Eligibility Criteria of General Instructions To the Tenderers of the DTCN,02-Jan-2024 06:04 PM,,,,,,,,,,,,,,,,,,,,,,,,,,,,,,,,,,,,AOC
,,,,,,,,,,,,,,,,.pdf,"No Relationship Certificate, ATO, Work Experience and required documents as per DTCN",,,,,,,,,,,,,,,,,,,,,,,,,,,,,,,,,,,,,,,,,,,,,,,AOC,,,,,,,,,,,,,3,2256926,Nitish Biswal,15-Sep-2023 02:03 PM,Rejected-Technical,As per Clause No.2.1(1) of the Eligibility Criteria of General Instructions To the Tenderers of the DTCN,02-Jan-2024 06:04 PM,,,,,,,,,,,,,,,,,,,,,,,,,,,,,,,,,,,,AOC
,,,,,,,,,,,,,,2.0,Finance,.xls,BOQ,,,,,,,,,,,,,,,,,,,,,,,,,,,,,,,,,,,,,,,,,,,,,,,AOC,,,,,,,,,,,,,4,2255715,Subash Chandra Mohanty,15-Sep-2023 03:35 PM,Rejected-Finance,"During combined evaluation,it is found that agency has not meet the qualifying criteria",29-Apr-2024 06:44 PM,,,,,,,,,,,,,,,,,,,,,,,,,,,,,,,,,,,,AOC
,,,,,,,,,,,,,,,,,,,,,,,,,,,,,,,,,,,,,,,,,,,,,,,,,,,,,,,,,,,,,,,,AOC,,,,,,,,,,,,,5,2256971,TUSHARKANT SAMANTARAY,15-Sep-2023 02:13 PM,Accepted-AOC,Accepted,29-Apr-2024 06:48 PM,,,,,,,,,,,,,,,,,,,,,,,,,,,,,,,,,,,,AOC
