Organisation Chain,Tender Reference Number,Tender ID,Withdrawal Allowed,Tender Type,Form of contract,Tender Category,No. of Covers,General Technical Evaluation Allowed,ItemWise Technical Evaluation Allowed,Payment Mode,Is Multi Currency Allowed For BOQ,Is Multi Currency Allowed For Fee,Allow Two Stage Bidding,Cover No,Cover,Document Type,Description,Publish Date,Bid Opening Date,Document Download / Sale Start Date,Document Download / Sale End Date,Clarification Start Date,Clarification End Date,Bid Submission Start Date,Bid Submission End Date,EMD Amount in ₹,EMD Exemption Allowed,EMD Fee Type,EMD Percentage,EMD Payable To,EMD Payable At,S.No,Bank Name,Tender Fee in ₹,VAT Charges in ₹,Fee Payable To,Fee Payable At,Tender Fee Exemption Allowed,Name,Address,Title,Work Description,Pre Qualification Details,Independent External Monitor/Remarks,Tender Value in ₹,Product Category,Sub category,Contract Type,Bid Validity(Days),Period Of Work(Days),Location,Pincode,Pre Bid Meeting Place,Pre Bid Meeting Address,Pre Bid Meeting Date,Bid Opening Place,Should Allow NDA Tender,Allow Preferential Bidder,Tender Stage,Contract Date :,Contract Value :,Work Completion Period in days :,Updated By :,Updated on :,AOC document :,S.No,Bid Number,Bidder Name,Awarded Currency,Awarded Value,S.No.1,Bid Number.1,Bidder Name.1,Submitted Date,Status,Remarks,Status Updated On,Type :,Summary :,Updated By :.1,Updated On :,Document :,BOQ Comparative Chart :,Committee Chairperson/Co-ordinator Name :,Committee Chairperson/Co-ordinator Type :,Committee Members :,Updated By :.2,Updated on :.1,Document :.1,Organisation Chain :,Tender ID :,Tender Ref No :,Tender Title :,Committee Chairperson/Co-ordinator Name :.1,Committee Chairperson/Co-ordinator Type :.1,Committee Members :.1,Updated By :.3,Updated On :.1,Document :.2,Tender Stage
EIC-CIVIL||SERNB-CIRCLE-EASTERN||EERNB-DIVN-BALASORE,SE(RandB)BLS-Divn-1-74/2023-24,2024_EICCL_100220_1,Yes,Open Tender,Percentage,Works,1.0,No,No,Online,No,No,No,1.0,Fee/PreQual/Technical/Finance,.pdf,"EMD, GSTIN, Valid RC, Affidavit and other connected documents as per DTCN",30-Jan-2024 10:00 AM,09-Feb-2024 11:00 AM,30-Jan-2024 10:00 AM,08-Feb-2024 04:00 PM,NA ,NA ,30-Jan-2024 10:00 AM,08-Feb-2024 04:00 PM,"8,000",Yes,fixed,,Nil,Nil,1.0,ICICI BANK,"4,000",0.0,Nil,Nil,No,Superintending Engineer,"At-Padhuanpada,Dist-Balasore",Construction of Civil Infrastructure for Installation of Biomedical Waste Management Equipment at Khantapada CHC in the District of Balasore for the year 2023-24,Construction of Civil Infrastructure for Installation of Biomedical Waste Management Equipment at Khantapada CHC in the District of Balasore for the year 2023-24,Please refer Tender documents. ,NA ,,Civil Works - Buildings,NA ,Tender,90.0,60.0,Balasore,756001.0,NA ,NA ,NA ,"Superintending Engineer, Balasore(R and B)Divisio",No ,No,AOC,16-Apr-2024,"INR 793,614.07",60.0,Jyotiprakash Panda,15-Apr-2024 09:16 AM,AOC.pdf (171.00 KB),1.0,2426592.0,MANAS RANJAN BARIK,INR,"674,651.32",1,2426566,HARISH CHANDRA DAS,07-Feb-2024 01:36 PM,Rejected-AOC,Not qualified Lucky draw,15-Apr-2024 09:17 AM,Finance,CS,Jyotiprakash Panda,15-Apr-2024 09:06 AM,finance_487941.pdf,BOQ Comparative Chart,"SE,DAO,AEE",Internal,,Jyotiprakash Panda,15-Apr-2024 09:14 AM,finsummary_487941.pdf (301.20 KB),EIC-CIVIL||SERNB-CIRCLE-EASTERN||EERNB-DIVN-BALASORE,2024_EICCL_100220_1,SE(RandB)BLS-Divn-1-74/2023-24,Construction of Civil Infrastructure for Installation of Biomedical Waste Management Equipment at Khantapada CHC in the District of Balasore for the year 2023-24,"SE,DAO,AEE",Internal,,Jyotiprakash Panda,15-Apr-2024 09:12 AM,techsummary_487941.pdf (301.20 KB),AOC
,,,,,,,,,,,,,,,,.xls,BOQ,,,,,,,,,,,,,,,2.0,ICICI NEFT/RTGS,,,,,,,,,,,,,,,,,,,,,,,,,,AOC,,,,,,,,,,,,2,2428656,LIPSA PRAVA SHAW,08-Feb-2024 01:06 PM,Rejected-AOC,Not qualified Lucky draw,15-Apr-2024 09:17 AM,,,,,,,,,,,,,,,,,,,,,,,AOC
,,,,,,,,,,,,,,,,,,,,,,,,,,,,,,,,,,,,,,,,,,,,,,,,,,,,,,,,,,,AOC,,,,,,,,,,,,3,2426592,MANAS RANJAN BARIK,07-Feb-2024 01:21 PM,Accepted-AOC,Lucky draw winner,15-Apr-2024 09:17 AM,,,,,,,,,,,,,,,,,,,,,,,AOC
,,,,,,,,,,,,,,,,,,,,,,,,,,,,,,,,,,,,,,,,,,,,,,,,,,,,,,,,,,,AOC,,,,,,,,,,,,4,2428119,MANORANJAN NAYAK,08-Feb-2024 08:30 AM,Rejected-AOC,Not qualified Lucky draw,15-Apr-2024 09:17 AM,,,,,,,,,,,,,,,,,,,,,,,AOC
,,,,,,,,,,,,,,,,,,,,,,,,,,,,,,,,,,,,,,,,,,,,,,,,,,,,,,,,,,,AOC,,,,,,,,,,,,5,2422088,"M/S Jagannath Construction, Prop-Prasanta Nayak",07-Feb-2024 01:52 PM,Rejected-AOC,Not qualified Lucky draw,15-Apr-2024 09:17 AM,,,,,,,,,,,,,,,,,,,,,,,AOC
,,,,,,,,,,,,,,,,,,,,,,,,,,,,,,,,,,,,,,,,,,,,,,,,,,,,,,,,,,,AOC,,,,,,,,,,,,6,2428897,Sumitra Maharana,08-Feb-2024 02:06 PM,Rejected-AOC,Not qualified Lucky draw,15-Apr-2024 09:17 AM,,,,,,,,,,,,,,,,,,,,,,,AOC
