Organisation Chain,Tender Reference Number,Tender ID,Withdrawal Allowed,Tender Type,Form of contract,Tender Category,No. of Covers,General Technical Evaluation Allowed,ItemWise Technical Evaluation Allowed,Payment Mode,Is Multi Currency Allowed For BOQ,Is Multi Currency Allowed For Fee,Allow Two Stage Bidding,Cover No,Cover,Document Type,Description,Publish Date,Bid Opening Date,Document Download / Sale Start Date,Document Download / Sale End Date,Clarification Start Date,Clarification End Date,Bid Submission Start Date,Bid Submission End Date,Financial Bid Opening Date,EMD Amount in ₹,EMD Exemption Allowed,EMD Fee Type,EMD Percentage,EMD Payable To,EMD Payable At,S.No,Corrigendum Title,Corrigendum Type,View,S.No.1,Bank Name,Tender Fee in ₹,VAT Charges in ₹,Fee Payable To,Fee Payable At,Tender Fee Exemption Allowed,Name,Address,Title,Work Description,Pre Qualification Details,Independent External Monitor/Remarks,Tender Value in ₹,Product Category,Sub category,Contract Type,Bid Validity(Days),Period Of Work(Days),Location,Pincode,Pre Bid Meeting Place,Pre Bid Meeting Address,Pre Bid Meeting Date,Bid Opening Place,Should Allow NDA Tender,Allow Preferential Bidder,Tender Stage,Contract Date :,Contract Value :,Work Completion Period in days :,Updated By :,Updated on :,AOC document :,AOC Description :,S.No,Bid Number,Bidder Name,Awarded Currency,Awarded Value,S.No.1,Bid Number.1,Bidder Name.1,Submitted Date,Status,Remarks,Status Updated On,Type :,Summary :,Updated By :.1,Updated On :,Document :,BOQ Comparative Chart :,Committee Chairperson/Co-ordinator Name :,Committee Chairperson/Co-ordinator Type :,Committee Members :,Updated By :.2,Updated on :.1,Document :.1,Organisation Chain :,Tender ID :,Tender Ref No :,Tender Title :,Type :.1,Summary :.1,Updated By :.3,Updated On :.1,Document :.2,Committee Chairperson/Co-ordinator Name :.1,Committee Chairperson/Co-ordinator Type :.1,Committee Members :.1,Updated By :.4,Updated On :.2,Financial Bid Opening Date:,Document :.3,Tender Stage
CE RW I||RWCIRCLE-BALASORE,CCE-BLS-NCB-48 OF 2023-24,2023_CERWI_96859_1,Yes,National Competitive Bid,Percentage,Works,2.0,No,No,Online,No,No,No,1.0,Fee/PreQual/Technical,.pdf,"P.cost. EMD, R.C, PAN, GSTIN,Affidavit, etc.",13-Nov-2023 11:30 AM,22-Nov-2023 11:00 AM,13-Nov-2023 11:30 AM,21-Nov-2023 05:00 PM,13-Nov-2023 11:30 AM ,20-Nov-2023 05:00 PM ,13-Nov-2023 11:30 AM,21-Nov-2023 05:00 PM,08-Dec-2023 04:00 PM,"6,35,740",Yes,percentage,1.0%,Nil,Nil,1.0,2nd corrigendum,Other,,1.0,ICICI BANK,"10,000",0.0,Nil,Nil,No,"CCE, R.W.CIRCLE, BALASORE","O/o the Chief Construction Engineer, Rural Works Circle, Balasore",Construction of New JMFC Court building at Basta for 2023-24.,Construction of New JMFC Court building at Basta for 2023-24.,Please refer the DTCN ,NA ,"6,35,74,000",Civil Works - Buildings,NA ,Tender,90.0,360.0,Balasore,756001.0,NA ,NA ,NA ,"CCE, R.W.CIRCLE, BALASORE",No ,No,AOC,05-Apr-2024,"INR 68,978,672",360.0,N V Harihar Rao,05-Apr-2024 07:33 PM,JMFCBASTA.pdf (12218.00 KB),8.05 percent excess over the amount put to tender including GST,1.0,2325157.0,SANJEEB KUMAR NAYAK,INR,"68,978,672",1,2326079,P S CONSTRUCTION,21-Nov-2023 04:37 PM,Rejected-Technical,Inadequate machinery,05-Dec-2023 01:57 PM,Finance,2 numbers bidders,N V Harihar Rao,05-Apr-2024 07:13 PM,,BOQ Comparative Chart,CCE RW CIRCLE BALASORE,Internal,"PA to CCE and AE Estimator, R.W.Circle, Balasore",N V Harihar Rao,05-Apr-2024 07:21 PM,finsummary_472868.pdf (395.66 KB),CE RW I||RWCIRCLE-BALASORE,2023_CERWI_96859_1,CCE-BLS-NCB-48 OF 2023-24,Construction of New JMFC Court building at Basta for 2023-24.,Technical,5 numbers bidder admitted,Chandana Behera,23-Nov-2023 06:44 PM,technical_472868.pdf,"CCERW CIRCLE, BALASORE",Internal,"PA to CCE R.W. Circle, Balasore, JE R. W. Circle, Balasore",N V Harihar Rao,05-Dec-2023 01:57 PM,08-Dec-2023 04:00 PM,techsummary_472868.pdf (1089.36 KB),AOC
,,,,,,,,,,,,,,,,.pdf,"Similar nature of work, ATO, Proffit and Loss Statement, Work in Hand, Machineries, etc.",,,,,,,,,,,,,,,,,,,,2.0,ICICI NEFT/RTGS,,,,,,,,,,,,,,,,,,,,,,,,,,AOC,,,,,,,,,,,,,2,2325277,RAMA CHANDRA MAHAKUD,21-Nov-2023 03:24 PM,Rejected-AOC,L2,05-Apr-2024 07:34 PM,,,,,,,,,,,,,,,,,,,,,,,,,,,,,AOC
,,,,,,,,,,,,,,,,.pdf,Other documents as per DTCN,,,,,,,,,,,,,,,,,,,,,,,,,,,,,,,,,,,,,,,,,,,,,,,AOC,,,,,,,,,,,,,3,2325144,Ranjit Kumar Behera,21-Nov-2023 02:00 PM,Rejected-Technical,Disqualified as per clause 3.4 (a) of DTCN (Suppression of work in hand),05-Dec-2023 01:57 PM,,,,,,,,,,,,,,,,,,,,,,,,,,,,,AOC
,,,,,,,,,,,,,,2.0,Finance,.xls,BILL OF QUANTITY,,,,,,,,,,,,,,,,,,,,,,,,,,,,,,,,,,,,,,,,,,,,,,,AOC,,,,,,,,,,,,,4,2325157,SANJEEB KUMAR NAYAK,21-Nov-2023 04:20 PM,Accepted-AOC,L1,05-Apr-2024 07:34 PM,,,,,,,,,,,,,,,,,,,,,,,,,,,,,AOC
,,,,,,,,,,,,,,,,,,,,,,,,,,,,,,,,,,,,,,,,,,,,,,,,,,,,,,,,,,,,,,,,AOC,,,,,,,,,,,,,5,2326067,sumanta kumar saw,21-Nov-2023 04:50 PM,Rejected-Technical,Insufficient Similar nature of work experience,05-Dec-2023 01:57 PM,,,,,,,,,,,,,,,,,,,,,,,,,,,,,AOC
