Organisation Chain,Tender Reference Number,Tender ID,Withdrawal Allowed,Tender Type,Form of contract,Tender Category,No. of Covers,General Technical Evaluation Allowed,ItemWise Technical Evaluation Allowed,Payment Mode,Is Multi Currency Allowed For BOQ,Is Multi Currency Allowed For Fee,Allow Two Stage Bidding,Cover No,Cover,Document Type,Description,Publish Date,Bid Opening Date,Document Download / Sale Start Date,Document Download / Sale End Date,Clarification Start Date,Clarification End Date,Bid Submission Start Date,Bid Submission End Date,Financial Bid Opening Date,EMD Amount in ₹,EMD Exemption Allowed,EMD Fee Type,EMD Percentage,EMD Payable To,EMD Payable At,S.No,Corrigendum Title,Corrigendum Type,View,S.No.1,Bank Name,Tender Fee in ₹,VAT Charges in ₹,Fee Payable To,Fee Payable At,Tender Fee Exemption Allowed,Name,Address,Title,Work Description,Pre Qualification Details,Independent External Monitor/Remarks,Tender Value in ₹,Product Category,Sub category,Contract Type,Bid Validity(Days),Period Of Work(Days),Location,Pincode,Pre Bid Meeting Place,Pre Bid Meeting Address,Pre Bid Meeting Date,Bid Opening Place,Should Allow NDA Tender,Allow Preferential Bidder,Tender Stage,Contract Date :,Contract Value :,Work Completion Period in days :,Updated By :,Updated on :,AOC document :,AOC Description :,S.No,Bid Number,Bidder Name,Awarded Currency,Awarded Value,S.No.1,Bid Number.1,Bidder Name.1,Submitted Date,Status,Remarks,Status Updated On,Type :,Summary :,Updated By :.1,Updated On :,Document :,BOQ Comparative Chart :,Committee Chairperson/Co-ordinator Name :,Committee Chairperson/Co-ordinator Type :,Committee Members :,Updated By :.2,Updated on :.1,Document :.1,Organisation Chain :,Tender ID :,Tender Ref No :,Tender Title :,Type :.1,Summary :.1,Updated By :.3,Updated On :.1,Document :.2,Committee Chairperson/Co-ordinator Name :.1,Committee Chairperson/Co-ordinator Type :.1,Committee Members :.1,Updated By :.4,Updated On :.2,Financial Bid Opening Date:,Document :.3,Tender Stage
EIC-CIVIL||SERNB-CIRCLE-NORTHERN,CCENC (R AND B) /20/ 2023-24,2023_EICCL_97233_1,Yes,National Competitive Bid,Percentage,Works,2.0,No,No,Online,No,No,No,1.0,Fee/PreQual/Technical,.pdf,"Online Proof Copy of Tender Cost, Bid Security, GSTIN, PAN, R.C and Affidavit",20-Nov-2023 09:00 AM,06-Dec-2023 12:00 PM,20-Nov-2023 09:00 AM,06-Dec-2023 11:00 AM,20-Nov-2023 09:00 AM ,30-Nov-2023 05:00 PM ,20-Nov-2023 09:00 AM,06-Dec-2023 11:00 AM,06-Jan-2024 11:00 AM,"7,44,800",Yes,fixed,,Nil,Nil,1.0,EXTENSION OF BID PERIOD,Date,,1.0,ICICI BANK,"10,000",0.0,Nil,Nil,No,"C.C.E, Northern R AND B Circle, SAMBALPUR","O/O THE C.C.E, Northern R AND B Circle, SAMBALPUR",Construction of HL Bridge at 4-663 Km on Saiberni to Badmal road via Budhikhamar Road in the District of Sambalpur for the year 2023-24,BRIDGE WORK,Please refer Tender documents. ,NA ,"7,44,73,610",Civil Works - Bridges,NA ,Tender,90.0,720.0,SAMBALPUR,768001.0,NA ,NA ,NA ,"O/O THE C.C.E, Northern R AND B Circle, SAMBALPUR",No ,No,AOC,05-Apr-2024,"INR 65,953,829",720.0,Arun Kumar Pattnaik,05-Apr-2024 04:55 PM,AGTSAIB.pdf (1194.00 KB),AGT DRAWN,1.0,2342365.0,LAXMAN PRADHAN,INR,"65,953,829",1,2342685,DHANESWAR SAHU,04-Dec-2023 12:56 PM,Rejected-Finance,UNSUCCESSFUL BIDDER,05-Apr-2024 04:52 PM,Finance,FINANCIAL BID OPENED,Arun Kumar Pattnaik,06-Jan-2024 01:55 PM,,BOQ Comparative Chart,ARUN KU PATTNAIK,Internal,"M.R. Sethy, A.K.Singh,D Behera",Arun Kumar Pattnaik,05-Apr-2024 04:52 PM,finsummary_474920.pdf (47.09 KB),EIC-CIVIL||SERNB-CIRCLE-NORTHERN,2023_EICCL_97233_1,CCENC (R AND B) /20/ 2023-24,Construction of HL Bridge at 4-663 Km on Saiberni to Badmal road via Budhikhamar Road in the District of Sambalpur for the year 2023-24,Technical,TECHNICAL BID ( COVER-I) OPENED,Arun Kumar Pattnaik,08-Dec-2023 08:36 AM,,cce,Internal,"M.R. Sethy, A.K.Singh,D Behera",Anam Charan Sahoo,05-Jan-2024 11:47 AM,06-Jan-2024 11:00 AM,techsummary_474920.pdf (65.33 KB),AOC
,,,,,,,,,,,,,,,,.pdf,"Ownership of machineries, work experience and MOU for composite Building work etc",,,,,,,,,,,,,,,,,,,,2.0,ICICI NEFT/RTGS,,,,,,,,,,,,,,,,,,,,,,,,,,AOC,,,,,,,,,,,,,2,2342365,LAXMAN PRADHAN,03-Dec-2023 09:39 AM,Accepted-AOC,AGT DRAWN,05-Apr-2024 04:56 PM,,,,,,,,,,,,,,,,,,,,,,,,,,,,,AOC
,,,,,,,,,,,,,,,,.pdf,Work experience certificate and other related documents as per DTCN,,,,,,,,,,,,,,,,,,,,,,,,,,,,,,,,,,,,,,,,,,,,,,,AOC,,,,,,,,,,,,,3,2345113,Paban Kumar Agrawal,05-Dec-2023 04:30 PM,Rejected-Finance,UNSUCCESSFUL BIDDER,05-Apr-2024 04:52 PM,,,,,,,,,,,,,,,,,,,,,,,,,,,,,AOC
,,,,,,,,,,,,,,2.0,Finance,.xls,BILL OF QUANTITY (BOQ),,,,,,,,,,,,,,,,,,,,,,,,,,,,,,,,,,,,,,,,,,,,,,,AOC,,,,,,,,,,,,,4,2334394,Santosh Kumar Mishra,27-Nov-2023 07:32 PM,Rejected-Finance,UNSUCCESSFUL BIDDER,05-Apr-2024 04:52 PM,,,,,,,,,,,,,,,,,,,,,,,,,,,,,AOC
,,,,,,,,,,,,,,,,,,,,,,,,,,,,,,,,,,,,,,,,,,,,,,,,,,,,,,,,,,,,,,,,AOC,,,,,,,,,,,,,5,2340764,SBM NIRMAAN CONSTRUCTION PRIVATE LIMITED,03-Dec-2023 12:59 PM,Rejected-Finance,UNSUCCESSFUL BIDDER,05-Apr-2024 04:52 PM,,,,,,,,,,,,,,,,,,,,,,,,,,,,,AOC
