Organisation Chain,Tender Reference Number,Tender ID,Withdrawal Allowed,Tender Type,Form of contract,Tender Category,No. of Covers,General Technical Evaluation Allowed,ItemWise Technical Evaluation Allowed,Payment Mode,Is Multi Currency Allowed For BOQ,Is Multi Currency Allowed For Fee,Allow Two Stage Bidding,Cover No,Cover,Document Type,Description,Publish Date,Bid Opening Date,Document Download / Sale Start Date,Document Download / Sale End Date,Clarification Start Date,Clarification End Date,Bid Submission Start Date,Bid Submission End Date,Financial Bid Opening Date,EMD Amount in ₹,EMD Exemption Allowed,EMD Fee Type,EMD Percentage,EMD Payable To,EMD Payable At,S.No,Bank Name,Tender Fee in ₹,VAT Charges in ₹,Fee Payable To,Fee Payable At,Tender Fee Exemption Allowed,Name,Address,Title,Work Description,Pre Qualification Details,Independent External Monitor/Remarks,Tender Value in ₹,Product Category,Sub category,Contract Type,Bid Validity(Days),Period Of Work(Days),Location,Pincode,Pre Bid Meeting Place,Pre Bid Meeting Address,Pre Bid Meeting Date,Bid Opening Place,Should Allow NDA Tender,Allow Preferential Bidder,Tender Stage,Contract Date :,Contract Value :,Work Completion Period in days :,Updated By :,Updated on :,AOC document :,AOC Description :,S.No,Bid Number,Bidder Name,Awarded Currency,Awarded Value,S.No.1,Bid Number.1,Bidder Name.1,Submitted Date,Status,Remarks,Status Updated On,Type :,Summary :,Updated By :.1,Updated On :,Document :,BOQ Comparative Chart :,Committee Chairperson/Co-ordinator Name :,Committee Chairperson/Co-ordinator Type :,Committee Members :,Updated By :.2,Updated on :.1,Document :.1,Organisation Chain :,Tender ID :,Tender Ref No :,Tender Title :,Type :.1,Summary :.1,Updated By :.3,Updated On :.1,Document :.2,Committee Chairperson/Co-ordinator Name :.1,Committee Chairperson/Co-ordinator Type :.1,Committee Members :.1,Updated By :.4,Updated On :.2,Financial Bid Opening Date:,Document :.3,Tender Stage
CE RW I||RWCIRCLE-CUTTACK,Tender Online RWC -18/23,2023_CERWI_93908_6,Yes,National Competitive Bid,Percentage,Works,2.0,No,No,Online,No,No,No,1.0,Fee/PreQual/Technical,.pdf,"Tender Paper Cost, EMD, GSTIN, RC, PAN, Registration Certificate, Labor License, No Relationship",07-Sep-2023 05:00 PM,16-Sep-2023 05:30 PM,07-Sep-2023 05:00 PM,15-Sep-2023 05:00 PM,07-Sep-2023 05:00 PM ,14-Sep-2023 02:00 PM ,07-Sep-2023 05:00 PM,15-Sep-2023 05:00 PM,05-Oct-2023 05:30 PM,"6,19,558",Yes,percentage,1.0%,Nil,Nil,1.0,ICICI BANK,"10,000",0.0,Nil,Nil,No,CCERW Circle Cuttack,CCERW Circle Cuttack,Construction of Manijanga to dharabil road under SACI in the dist of Cuttack for the year 2023-24,Road works,Please refer Tender documents. ,NA ,"6,19,55,800",Civil Works - Roads,NA ,Tender,90.0,270.0,Cuttack,753004.0,NA ,NA ,NA ,CCERW Circle Cuttack,No ,No,AOC,03-Apr-2024,"INR 58,864,152",270.0,Ajay Kumar Behera,03-Apr-2024 05:42 PM,agmt.pdf (140.00 KB),Agmt drawn,1.0,2256227.0,TAPAN KUMAR SAMAL,INR,"58,864,152",1,2246028,Kamal Lochan Das,13-Sep-2023 06:18 PM,Rejected-Technical,Disqualified due to Made misleading or false representations in the forms statements as Per DTCN clause no 21(i),04-Oct-2023 11:33 AM,Finance,TOTAL 2 NOS DOCUMENT DOWNLOADED,Ajay Kumar Behera,05-Oct-2023 06:19 PM,,BOQ Comparative Chart,C.C.E RW Circle Cuttack,Internal,EE RW Division-II Cuttack DAO RW Division Cuttack PA to CCE,Ajay Kumar Behera,03-Apr-2024 05:38 PM,finsummary_459541.pdf (362.32 KB),CE RW I||RWCIRCLE-CUTTACK,2023_CERWI_93908_6,Tender Online RWC -18/23,Construction of Manijanga to dharabil road under SACI in the dist of Cuttack for the year 2023-24,Technical,Total 5 nos document downloaded,Ajay Kumar Behera,16-Sep-2023 06:01 PM,,C.C.E RW Circle Cuttack,Internal,EE RW Division-II Cuttack DAO RW Division Cuttack PA to CCE,Usharani Behera,04-Oct-2023 11:33 AM,05-Oct-2023 05:30 PM,techsummary_459541.pdf (2053.70 KB),AOC
,,,,,,,,,,,,,,,,.pdf,"A.T.O from CA, Similar Nature of Work Experience Certificate, Work in Hand, Affidavit of Correctness",,,,,,,,,,,,,,,,2.0,ICICI NEFT/RTGS,,,,,,,,,,,,,,,,,,,,,,,,,,AOC,,,,,,,,,,,,,2,2253209,MESSERS DAKSHYA CONSTRUCTION,15-Sep-2023 04:44 PM,Rejected-Finance,Unsuccessful bidder,03-Apr-2024 05:38 PM,,,,,,,,,,,,,,,,,,,,,,,,,,,,,AOC
,,,,,,,,,,,,,,,,.pdf,Machineries followed by checklist machineries as per DTCN,,,,,,,,,,,,,,,,,,,,,,,,,,,,,,,,,,,,,,,,,,,AOC,,,,,,,,,,,,,3,2256489,PRADYUMNA KUMAR DAS,15-Sep-2023 12:05 PM,Rejected-Technical,Disqualified due to Made misleading or false representations in the forms statements as Per DTCN clause no 21(i),04-Oct-2023 11:33 AM,,,,,,,,,,,,,,,,,,,,,,,,,,,,,AOC
,,,,,,,,,,,,,,2.0,Finance,.xls,Bill of Quantity,,,,,,,,,,,,,,,,,,,,,,,,,,,,,,,,,,,,,,,,,,,AOC,,,,,,,,,,,,,4,2255474,SRI RABINDRA KUMAR SAHOO,14-Sep-2023 05:05 PM,Rejected-Technical,Disqualified due to Made misleading or false representations in the forms statements as Per DTCN clause no 21(i),04-Oct-2023 11:33 AM,,,,,,,,,,,,,,,,,,,,,,,,,,,,,AOC
,,,,,,,,,,,,,,,,,,,,,,,,,,,,,,,,,,,,,,,,,,,,,,,,,,,,,,,,,,,,AOC,,,,,,,,,,,,,5,2256227,TAPAN KUMAR SAMAL,15-Sep-2023 04:16 PM,Accepted-AOC,Agmt drawn,03-Apr-2024 05:42 PM,,,,,,,,,,,,,,,,,,,,,,,,,,,,,AOC
