Organisation Chain,Tender Reference Number,Tender ID,Withdrawal Allowed,Tender Type,Form of contract,Tender Category,No. of Covers,General Technical Evaluation Allowed,ItemWise Technical Evaluation Allowed,Payment Mode,Is Multi Currency Allowed For BOQ,Is Multi Currency Allowed For Fee,Allow Two Stage Bidding,Cover No,Cover,Document Type,Description,Publish Date,Bid Opening Date,Document Download / Sale Start Date,Document Download / Sale End Date,Clarification Start Date,Clarification End Date,Bid Submission Start Date,Bid Submission End Date,Financial Bid Opening Date,EMD Amount in ₹,EMD Exemption Allowed,EMD Fee Type,EMD Percentage,EMD Payable To,EMD Payable At,S.No,Bank Name,Tender Fee in ₹,VAT Charges in ₹,Fee Payable To,Fee Payable At,Tender Fee Exemption Allowed,Name,Address,Title,Work Description,Pre Qualification Details,Independent External Monitor/Remarks,Tender Value in ₹,Product Category,Sub category,Contract Type,Bid Validity(Days),Period Of Work(Days),Location,Pincode,Pre Bid Meeting Place,Pre Bid Meeting Address,Pre Bid Meeting Date,Bid Opening Place,Should Allow NDA Tender,Allow Preferential Bidder,Tender Stage,Contract Date :,Contract Value :,Work Completion Period in days :,Updated By :,Updated on :,AOC document :,S.No,Bid Number,Bidder Name,Awarded Currency,Awarded Value,S.No.1,Bid Number.1,Bidder Name.1,Submitted Date,Status,Remarks,Status Updated On,Type :,Summary :,Updated By :.1,Updated On :,Document :,BOQ Comparative Chart :,Committee Chairperson/Co-ordinator Name :,Committee Chairperson/Co-ordinator Type :,Committee Members :,Updated By :.2,Updated on :.1,Document :.1,Organisation Chain :,Tender ID :,Tender Ref No :,Tender Title :,Type :.1,Summary :.1,Updated By :.3,Updated On :.1,Document :.2,Committee Chairperson/Co-ordinator Name :.1,Committee Chairperson/Co-ordinator Type :.1,Committee Members :.1,Updated By :.4,Updated On :.2,Financial Bid Opening Date:,Document :.3,Tender Stage
EIC-CIVIL||SERNB-CIRCLE-BOLANGIR,CCE (R and B) BGR-45-2023-24,2024_EICCL_99644_4,Yes,National Competitive Bid,Percentage,Works,2.0,No,No,Online,No,No,No,1.0,Fee/PreQual/Technical,.pdf,"Online proof copy of tender paper cost and EMD, GSTIN, PAN, RC and Affidavit",12-Jan-2024 04:30 PM,30-Jan-2024 11:00 AM,12-Jan-2024 04:30 PM,29-Jan-2024 05:00 PM,12-Jan-2024 04:30 PM ,18-Jan-2024 05:00 PM ,12-Jan-2024 04:30 PM,29-Jan-2024 05:00 PM,09-Feb-2024 11:00 AM,"1,48,000",Yes,fixed,,Nil,Nil,1.0,ICICI BANK,"10,000",0.0,Nil,Nil,No,"CCE, Balangir (R and B) Circle, Balangir","O/o CCE, Balangir (R and B) Circle, Balangir","Construction of 6nos F type staff quarter at New CHC, Jamgaon in the District of Balangir.",Building work,Please refer tender documents ,NA ,"1,47,97,408",Civil Works - Buildings,NA ,Tender,90.0,240.0,Balangir,767001.0,NA ,NA ,NA ,"O/o CCE, Balangir (R and B) Circle, Balangir",No ,No,AOC,01-Apr-2024,"INR 13,319,147",240.0,Basistha Kumar Pattanaik,18-Apr-2024 05:29 PM,agrmt.pdf (112.00 KB),1.0,2409457.0,M/S BRILLIANT DEVELOPERS,INR,"13,319,147",1,2410562,ABHISEK PANIGRAHI,29-Jan-2024 04:37 PM,Rejected-Finance,Lost by lottery system,22-Mar-2024 12:31 PM,Finance,The Financial bids of 05 (Five) Nos. of bidders are opened for further consideration.,Basistha Kumar Pattanaik,09-Feb-2024 12:34 PM,finance_484612.pdf,BOQ Comparative Chart,B K Pattanaik,Internal,,Basistha Kumar Pattanaik,22-Mar-2024 12:31 PM,finsummary_484612.pdf (599.04 KB),EIC-CIVIL||SERNB-CIRCLE-BOLANGIR,2024_EICCL_99644_4,CCE (R and B) BGR-45-2023-24,"Construction of 6nos F type staff quarter at New CHC, Jamgaon in the District of Balangir.",Technical,The Technical bids of 06 (Six) Nos. of bidders are opened for further consideration.,Basistha Kumar Pattanaik,30-Jan-2024 01:15 PM,technical_484612.pdf,B K Pattanaik,Internal,,Basistha Kumar Pattanaik,08-Feb-2024 01:38 PM,09-Feb-2024 11:00 AM,techsummary_484612.pdf (679.38 KB),AOC
,,,,,,,,,,,,,,,,.pdf,Machineries and work Experience.,,,,,,,,,,,,,,,,2.0,ICICI NEFT/RTGS,,,,,,,,,,,,,,,,,,,,,,,,,,AOC,,,,,,,,,,,,2,2408441,BAC CONSTRUCTION AND ENGINEERING PVT LTD,28-Jan-2024 08:12 PM,Rejected-Technical,As per DTCN,08-Feb-2024 01:38 PM,,,,,,,,,,,,,,,,,,,,,,,,,,,,,AOC
,,,,,,,,,,,,,,,,.pdf,Other documents as per DTCN.,,,,,,,,,,,,,,,,,,,,,,,,,,,,,,,,,,,,,,,,,,,AOC,,,,,,,,,,,,3,2409457,M/S BRILLIANT DEVELOPERS,29-Jan-2024 02:24 PM,Accepted-AOC,as per dtcn,18-Apr-2024 05:29 PM,,,,,,,,,,,,,,,,,,,,,,,,,,,,,AOC
,,,,,,,,,,,,,,2.0,Finance,.xls,Bill of Quantity.,,,,,,,,,,,,,,,,,,,,,,,,,,,,,,,,,,,,,,,,,,,AOC,,,,,,,,,,,,4,2401094,Sanjaya Kumar Agrawal,28-Jan-2024 07:19 PM,Rejected-Finance,Lost by lottery system,22-Mar-2024 12:31 PM,,,,,,,,,,,,,,,,,,,,,,,,,,,,,AOC
,,,,,,,,,,,,,,,,,,,,,,,,,,,,,,,,,,,,,,,,,,,,,,,,,,,,,,,,,,,,AOC,,,,,,,,,,,,5,2409762,Satyabrata Mishra,29-Jan-2024 01:57 PM,Rejected-Finance,As per DTCN,22-Mar-2024 12:31 PM,,,,,,,,,,,,,,,,,,,,,,,,,,,,,AOC
,,,,,,,,,,,,,,,,,,,,,,,,,,,,,,,,,,,,,,,,,,,,,,,,,,,,,,,,,,,,AOC,,,,,,,,,,,,6,2408005,SUJIT KU DANG,28-Jan-2024 01:52 PM,Rejected-Finance,Lost by lottery system,22-Mar-2024 12:31 PM,,,,,,,,,,,,,,,,,,,,,,,,,,,,,AOC
