Organisation Chain,Tender Reference Number,Tender ID,Withdrawal Allowed,Tender Type,Form of contract,Tender Category,No. of Covers,General Technical Evaluation Allowed,ItemWise Technical Evaluation Allowed,Payment Mode,Is Multi Currency Allowed For BOQ,Is Multi Currency Allowed For Fee,Allow Two Stage Bidding,Cover No,Cover,Document Type,Description,Publish Date,Bid Opening Date,Document Download / Sale Start Date,Document Download / Sale End Date,Clarification Start Date,Clarification End Date,Bid Submission Start Date,Bid Submission End Date,Financial Bid Opening Date,EMD Amount in ₹,EMD Exemption Allowed,EMD Fee Type,EMD Percentage,EMD Payable To,EMD Payable At,S.No,Bank Name,Tender Fee in ₹,VAT Charges in ₹,Fee Payable To,Fee Payable At,Tender Fee Exemption Allowed,Name,Address,Title,Work Description,Pre Qualification Details,Independent External Monitor/Remarks,Tender Value in ₹,Product Category,Sub category,Contract Type,Bid Validity(Days),Period Of Work(Days),Location,Pincode,Pre Bid Meeting Place,Pre Bid Meeting Address,Pre Bid Meeting Date,Bid Opening Place,Should Allow NDA Tender,Allow Preferential Bidder,Tender Stage,Contract Date :,Contract Value :,Work Completion Period in days :,Updated By :,Updated on :,AOC document :,AOC Description :,S.No,Bid Number,Bidder Name,Awarded Currency,Awarded Value,S.No.1,Bid Number.1,Bidder Name.1,Submitted Date,Status,Remarks,Status Updated On,Type :,Summary :,Updated By :.1,Updated On :,Document :,BOQ Comparative Chart :,Committee Chairperson/Co-ordinator Name :,Committee Chairperson/Co-ordinator Type :,Committee Members :,Updated By :.2,Updated on :.1,Document :.1,Organisation Chain :,Tender ID :,Tender Ref No :,Tender Title :,Type :.1,Summary :.1,Updated By :.3,Updated On :.1,Document :.2,Committee Chairperson/Co-ordinator Name :.1,Committee Chairperson/Co-ordinator Type :.1,Committee Members :.1,Updated By :.4,Updated On :.2,Financial Bid Opening Date:,Document :.3,Tender Stage
EIC-CIVIL||SERNB-CIRCLE-KEONJHAR||EERNB-DIVN-ROURKELA,BID ID 03 of 2022-23,2022_EICCL_76898_4,Yes,Open Tender,Percentage,Works,2.0,No,No,Online,No,No,No,1.0,Fee/PreQual/Technical,.pdf,"Registration certificate, Registration in CDMS, PAN Card, GSTIN Certificate, Affidavit etc",13-Apr-2022 05:00 PM,25-Apr-2022 11:30 AM,13-Apr-2022 05:00 PM,22-Apr-2022 05:00 PM,13-Apr-2022 05:00 PM ,19-Apr-2022 05:00 PM ,13-Apr-2022 05:00 PM,22-Apr-2022 05:00 PM,20-May-2022 10:45 AM,0.0,No,fixed,,Nil,Nil,1.0,ICICI BANK,"10,000",0.0,Nil,Nil,No,Superintending Engineer Rourkela R and B,Office of Superintending Engineer Rourkela R and B Division,Development of B.M.A Girls High school under Rourkela municipality corporation in Sundargarh district for the year 2021-22,Development of B.M.A Girls High school under Rourkela municipality corporation in Sundargarh district for the year 2021-22,Please refer tender document ,NA ,"76,00,500",Civil Works - Buildings,NA ,Tender,90.0,90.0,Rourkela,769012.0,NA ,NA ,NA ,Office of Superintending Engineer Rourkela R and B,No ,No,AOC,09-Apr-2024,"INR 6,461,166",90.0,Manoj Kumar Mahananda,09-Apr-2024 05:44 PM,RMCgirlsschool.pdf (1264.00 KB),stood 1st lowest. Agmt drawn and Work order issued,1.0,1828738.0,M/s EASTERN INFRASTRUCTURES PRIVATE LIMITED,INR,"6,461,166",1.0,1828738.0,M/s EASTERN INFRASTRUCTURES PRIVATE LIMITED,20-Apr-2022 09:57 PM,Accepted-AOC,stood 1st lowest,09-Apr-2024 05:44 PM,Finance,4 bidder has been participated,Manoj Kumar Mahananda,09-Apr-2024 05:38 PM,finance_396020.pdf,BOQ Comparative Chart,M K Mahananda SE rourkela r and b division,Internal,HS Meena DAO Rourkela R and B Division P p parida estimator Rourkela R and B Division,Manoj Kumar Mahananda,09-Apr-2024 05:41 PM,finsummary_396020.pdf (1263.94 KB),EIC-CIVIL||SERNB-CIRCLE-KEONJHAR||EERNB-DIVN-ROURKELA,2022_EICCL_76898_4,BID ID 03 of 2022-23,Development of B.M.A Girls High school under Rourkela municipality corporation in Sundargarh district for the year 2021-22,Technical,All thebidders qualified in the Technical Evaluation,Prajna Prajwolita Parida,20-May-2022 10:42 AM,technical_396020.pdf,M K Mahananda SE rourkela r and b division,Internal,BKumar SrDAO Rourkela R and B Division P p parida estimator Rourkela R and B Division,Prajna Prajwolita Parida,20-May-2022 10:43 AM,20-May-2022 10:45 AM,techsummary_396020.pdf (270.19 KB),AOC
,,,,,,,,,,,,,,,,.pdf,"Financial instruments such as cost of tender paper, EMD, Affidavit etc",,,,,,,,,,,,,,,,2.0,ICICI NEFT/RTGS,,,,,,,,,,,,,,,,,,,,,,,,,,AOC,,,,,,,,,,,,,2.0,1829791.0,NARESH KUMAR SETHI,22-Apr-2022 02:50 PM,Rejected-AOC,stood 3rd lowest,09-Apr-2024 05:44 PM,,,,,,,,,,,,,,,,,,,,,,,,,,,,,AOC
,,,,,,,,,,,,,,,,.pdf,"Experience Certificate, List of Machinaries,Lease Deeds , MOU with electrical contractor Affidavit e",,,,,,,,,,,,,,,,,,,,,,,,,,,,,,,,,,,,,,,,,,,AOC,,,,,,,,,,,,,3.0,1828559.0,Sk Hasib Rahebar,20-Apr-2022 05:09 PM,Rejected-AOC,stood 2nd lowest,09-Apr-2024 05:44 PM,,,,,,,,,,,,,,,,,,,,,,,,,,,,,AOC
,,,,,,,,,,,,,,,,.pdf,"No Relation Certificate, Schedule-E, Schedule-F, Affidavit etc",,,,,,,,,,,,,,,,,,,,,,,,,,,,,,,,,,,,,,,,,,,AOC,,,,,,,,,,,,,4.0,1829742.0,SNEHALATA CONSTRUCTION AND INTERIOR,22-Apr-2022 01:42 PM,Rejected-AOC,stood 2nd lowest,09-Apr-2024 05:44 PM,,,,,,,,,,,,,,,,,,,,,,,,,,,,,AOC
,,,,,,,,,,,,,,2.0,Finance,.xls,BOQ,,,,,,,,,,,,,,,,,,,,,,,,,,,,,,,,,,,,,,,,,,,AOC,,,,,,,,,,,,,,,,,,,,,,,,,,,,,,,,,,,,,,,,,,,,,,,,AOC
