Organisation Chain,Tender Reference Number,Tender ID,Withdrawal Allowed,Tender Type,Form of contract,Tender Category,No. of Covers,General Technical Evaluation Allowed,ItemWise Technical Evaluation Allowed,Payment Mode,Is Multi Currency Allowed For BOQ,Is Multi Currency Allowed For Fee,Allow Two Stage Bidding,Cover No,Cover,Document Type,Description,Publish Date,Bid Opening Date,Document Download / Sale Start Date,Document Download / Sale End Date,Clarification Start Date,Clarification End Date,Bid Submission Start Date,Bid Submission End Date,Financial Bid Opening Date,EMD Amount in ₹,EMD Exemption Allowed,EMD Fee Type,EMD Percentage,EMD Payable To,EMD Payable At,S.No,Bank Name,Tender Fee in ₹,VAT Charges in ₹,Fee Payable To,Fee Payable At,Tender Fee Exemption Allowed,Name,Address,Title,Work Description,Pre Qualification Details,Independent External Monitor/Remarks,Tender Value in ₹,Product Category,Sub category,Contract Type,Bid Validity(Days),Period Of Work(Days),Location,Pincode,Pre Bid Meeting Place,Pre Bid Meeting Address,Pre Bid Meeting Date,Bid Opening Place,Should Allow NDA Tender,Allow Preferential Bidder,Tender Stage,Contract Date :,Contract Value :,Work Completion Period in days :,Updated By :,Updated on :,AOC document :,AOC Description :,S.No,Bid Number,Bidder Name,Awarded Currency,Awarded Value,S.No.1,Bid Number.1,Bidder Name.1,Submitted Date,Status,Remarks,Status Updated On,Type :,Summary :,Updated By :.1,Updated On :,Document :,BOQ Comparative Chart :,Committee Chairperson/Co-ordinator Name :,Committee Chairperson/Co-ordinator Type :,Committee Members :,Updated By :.2,Updated on :.1,Document :.1,Organisation Chain :,Tender ID :,Tender Ref No :,Tender Title :,Type :.1,Summary :.1,Updated By :.3,Updated On :.1,Document :.2,Committee Chairperson/Co-ordinator Name :.1,Committee Chairperson/Co-ordinator Type :.1,Committee Members :.1,Updated By :.4,Updated On :.2,Financial Bid Opening Date:,Document :.3,Tender Stage
CE RW I||RWCIRCLE-BALASORE,CCE-BLS-NCB-69 OF 2023-24,2024_CERWI_100241_1,Yes,National Competitive Bid,Percentage,Works,2.0,No,No,Online,No,No,No,1.0,Fee/PreQual/Technical,.pdf,"P.cost. EMD, R.C, PAN, GSTIN,Affidavit, etc.",29-Jan-2024 02:00 PM,07-Feb-2024 11:00 AM,29-Jan-2024 02:00 PM,06-Feb-2024 05:00 PM,29-Jan-2024 02:00 PM ,05-Feb-2024 05:00 PM ,29-Jan-2024 02:00 PM,06-Feb-2024 05:00 PM,20-Feb-2024 05:00 PM,"4,00,620",Yes,percentage,1.0%,Nil,Nil,1.0,ICICI BANK,"10,000",0.0,Nil,Nil,No,"CCE, R.W.CIRCLE, BALASORE","O/o the Chief Construction Engineer, Rural Works Circle, Balasore",Construction of Bridge over Abhira Kund nallah at 1st Km on Sindhu RD road to Saralia Bhalukundia road in the District of Balasore under BSY for 2023-24.,Construction of Bridge over Abhira Kund nallah at 1st Km on Sindhu RD road to Saralia Bhalukundia road in the District of Balasore under BSY for 2023-24.,Please refer the DTCN ,NA ,"4,00,62,000",Civil Works - Bridges,NA ,Tender,90.0,360.0,Balasore,756001.0,NA ,NA ,NA ,"CCE, R.W.CIRCLE, BALASORE",No ,No,AOC,20-Apr-2024,"INR 36,049,240",360.0,N V Harihar Rao,20-Apr-2024 12:31 PM,1931.pdf (685.00 KB),Work awarded to 1st lowest bidder,1.0,2424947.0,GOUTAMI PRIYADARSANI,INR,"36,049,240",1,2423781,BASUDEV PANIGRAHI,06-Feb-2024 12:24 PM,Rejected-Technical,Insufficient Similar Nature of work experience,17-Feb-2024 08:44 PM,Finance,3 numbers bidder admitted,N V Harihar Rao,20-Apr-2024 12:25 PM,,BOQ Comparative Chart,"CCE RW CIRCLE, BALASORE",Internal,"PA TO CCE RW CIRCLE, BALASORE AND ESTIMATOR RW CIRCLE, BALASORE",N V Harihar Rao,20-Apr-2024 12:28 PM,finsummary_487980.pdf (45.92 KB),CE RW I||RWCIRCLE-BALASORE,2024_CERWI_100241_1,CCE-BLS-NCB-69 OF 2023-24,Construction of Bridge over Abhira Kund nallah at 1st Km on Sindhu RD road to Saralia Bhalukundia road in the District of Balasore under BSY for 2023-24.,Technical,5 Numbers bidder admitted,N V Harihar Rao,17-Feb-2024 08:35 PM,,"CCE RW CIRCLE, BALASORE",Internal,"PA TO CCE RW CIRCLE, BALASORE AND JE ESTIMATOR RW CIRCLE, BALASORE",N V Harihar Rao,17-Feb-2024 08:44 PM,20-Feb-2024 05:00 PM,techsummary_487980.pdf (1052.40 KB),AOC
,,,,,,,,,,,,,,,,.pdf,"Similar nature of work, ATO, Proffit and Loss Statement, Work in Hand, Machineries, etc.",,,,,,,,,,,,,,,,2.0,ICICI NEFT/RTGS,,,,,,,,,,,,,,,,,,,,,,,,,,AOC,,,,,,,,,,,,,2,2424009,Durga Shankar Mohapatra,06-Feb-2024 02:38 PM,Rejected-Technical,Insufficient Similar Nature of work experience,17-Feb-2024 08:44 PM,,,,,,,,,,,,,,,,,,,,,,,,,,,,,AOC
,,,,,,,,,,,,,,,,.pdf,Other documents as per DTCN,,,,,,,,,,,,,,,,,,,,,,,,,,,,,,,,,,,,,,,,,,,AOC,,,,,,,,,,,,,3,2424947,GOUTAMI PRIYADARSANI,06-Feb-2024 04:40 PM,Accepted-AOC,L1,20-Apr-2024 12:31 PM,,,,,,,,,,,,,,,,,,,,,,,,,,,,,AOC
,,,,,,,,,,,,,,2.0,Finance,.xls,BILL OF QUANTITY,,,,,,,,,,,,,,,,,,,,,,,,,,,,,,,,,,,,,,,,,,,AOC,,,,,,,,,,,,,4,2418386,Krutibash Behera,06-Feb-2024 02:21 PM,Rejected-AOC,L3,20-Apr-2024 12:31 PM,,,,,,,,,,,,,,,,,,,,,,,,,,,,,AOC
,,,,,,,,,,,,,,,,,,,,,,,,,,,,,,,,,,,,,,,,,,,,,,,,,,,,,,,,,,,,AOC,,,,,,,,,,,,,5,2422040,Nihar Ranjan Upadhyaya,05-Feb-2024 04:13 PM,Rejected-AOC,L2,20-Apr-2024 12:31 PM,,,,,,,,,,,,,,,,,,,,,,,,,,,,,AOC
