Organisation Chain,Tender Reference Number,Tender ID,Withdrawal Allowed,Tender Type,Form of contract,Tender Category,No. of Covers,General Technical Evaluation Allowed,ItemWise Technical Evaluation Allowed,Payment Mode,Is Multi Currency Allowed For BOQ,Is Multi Currency Allowed For Fee,Allow Two Stage Bidding,Cover No,Cover,Document Type,Description,Publish Date,Bid Opening Date,Document Download / Sale Start Date,Document Download / Sale End Date,Clarification Start Date,Clarification End Date,Bid Submission Start Date,Bid Submission End Date,Financial Bid Opening Date,EMD Amount in ₹,EMD Exemption Allowed,EMD Fee Type,EMD Percentage,EMD Payable To,EMD Payable At,S.No,Bank Name,Tender Fee in ₹,VAT Charges in ₹,Fee Payable To,Fee Payable At,Tender Fee Exemption Allowed,Name,Address,Title,Work Description,Pre Qualification Details,Independent External Monitor/Remarks,Tender Value in ₹,Product Category,Sub category,Contract Type,Bid Validity(Days),Period Of Work(Days),Location,Pincode,Pre Bid Meeting Place,Pre Bid Meeting Address,Pre Bid Meeting Date,Bid Opening Place,Should Allow NDA Tender,Allow Preferential Bidder,Tender Stage,Contract Date :,Contract Value :,Work Completion Period in days :,Updated By :,Updated on :,AOC document :,S.No,Bid Number,Bidder Name,Awarded Currency,Awarded Value,S.No.1,Bid Number.1,Bidder Name.1,Submitted Date,Status,Remarks,Status Updated On,Type :,Summary :,Updated By :.1,Updated On :,Document :,BOQ Comparative Chart :,Committee Chairperson/Co-ordinator Name :,Committee Chairperson/Co-ordinator Type :,Committee Members :,Updated By :.2,Updated on :.1,Document :.1,Organisation Chain :,Tender ID :,Tender Ref No :,Tender Title :,Type :.1,Summary :.1,Updated By :.3,Updated On :.1,Document :.2,Committee Chairperson/Co-ordinator Name :.1,Committee Chairperson/Co-ordinator Type :.1,Committee Members :.1,Updated By :.4,Updated On :.2,Financial Bid Opening Date:,Document :.3,Tender Stage
CE RW I||RWCIRCLE-BARIPADA,Road Online N.C.B. No-344,2024_CERWI_100178_1,Yes,National Competitive Bid,Percentage,Works,2.0,No,No,Online,No,No,No,1.0,Fee/PreQual/Technical,.pdf,"Paper cost, RC, PAN, GSTIN and EMD etc as per DTCN",26-Jan-2024 11:00 AM,09-Feb-2024 11:00 AM,26-Jan-2024 11:00 AM,08-Feb-2024 05:00 PM,26-Jan-2024 11:00 AM ,07-Feb-2024 05:00 PM ,26-Jan-2024 11:00 AM,08-Feb-2024 05:00 PM,16-Feb-2024 03:00 PM,"9,67,400",Yes,percentage,1.0%,Nil,Nil,1.0,ICICI BANK,"10,000",0.0,Nil,Nil,No,CCE RWC Baripada,CCE RWC Baripada,Construction of Road from Jatipur to Itamundia Road (Including Barajore Khala Bridge) under MMSY-CMRL in the District of Mayurbhanj for the year 2023-24.,Construction of Road from Jatipur to Itamundia Road (Including Barajore Khala Bridge) under MMSY-CMRL in the District of Mayurbhanj for the year 2023-24.,Please refer Tender documents. ,NA ,"9,67,40,000",Civil Works - Roads,NA ,Tender,90.0,455.0,SE RWD Baripada,757105.0,NA ,NA ,NA ,CCE RWC Baripada,No ,No,AOC,14-Mar-2024,"INR 82,238,408.75",455.0,Ashwani Pradhan,20-Apr-2024 01:25 PM,Itamundia.pdf (117.00 KB),1.0,2421388.0,M/S BIG BUILD INFRASTRUCTURE & CO,INR,"82,238,408.75",1,2426035,Kartick Chandra Sahani,07-Feb-2024 10:47 AM,Rejected-AOC,L3,20-Apr-2024 01:25 PM,Finance,04 Nos of bidders admitted,Ashwani Pradhan,17-Feb-2024 04:49 PM,,BOQ Comparative Chart,CCE RWC Baripada,Internal,,Ashwani Pradhan,20-Feb-2024 05:23 PM,finsummary_487748.pdf (260.45 KB),CE RW I||RWCIRCLE-BARIPADA,2024_CERWI_100178_1,Road Online N.C.B. No-344,Construction of Road from Jatipur to Itamundia Road (Including Barajore Khala Bridge) under MMSY-CMRL in the District of Mayurbhanj for the year 2023-24.,Technical,05 Nos of bidders participated,Ashwani Pradhan,13-Feb-2024 01:06 PM,,"CCE RW Circle, Baripada",Internal,,Ashwani Pradhan,13-Feb-2024 01:15 PM,16-Feb-2024 03:00 PM,techsummary_487748.pdf (257.42 KB),AOC
,,,,,,,,,,,,,,,,.pdf,"ATO, similar nature of work experience etc as per DTCN",,,,,,,,,,,,,,,,2.0,ICICI NEFT/RTGS,,,,,,,,,,,,,,,,,,,,,,,,,,AOC,,,,,,,,,,,,2,2426814,LALIT KUMAR MOHANTY,08-Feb-2024 02:07 PM,Rejected-AOC,L3,20-Apr-2024 01:25 PM,,,,,,,,,,,,,,,,,,,,,,,,,,,,,AOC
,,,,,,,,,,,,,,,,.pdf,"Machineries, Affidavit etc as per DTCN",,,,,,,,,,,,,,,,,,,,,,,,,,,,,,,,,,,,,,,,,,,AOC,,,,,,,,,,,,3,2421388,M/S BIG BUILD INFRASTRUCTURE & CO,08-Feb-2024 11:03 AM,Accepted-AOC,L1,20-Apr-2024 01:25 PM,,,,,,,,,,,,,,,,,,,,,,,,,,,,,AOC
,,,,,,,,,,,,,,2.0,Finance,.xls,Bill of Quantity,,,,,,,,,,,,,,,,,,,,,,,,,,,,,,,,,,,,,,,,,,,AOC,,,,,,,,,,,,4,2421681,M/S SAHU CONSTRUCTION,07-Feb-2024 10:49 PM,Rejected-AOC,L2,20-Apr-2024 01:25 PM,,,,,,,,,,,,,,,,,,,,,,,,,,,,,AOC
,,,,,,,,,,,,,,,,,,,,,,,,,,,,,,,,,,,,,,,,,,,,,,,,,,,,,,,,,,,,AOC,,,,,,,,,,,,5,2428366,SUMAN KUMAR SAHU,08-Feb-2024 11:45 AM,Rejected-Technical,Insufficient Similar Nature of work experience,13-Feb-2024 01:15 PM,,,,,,,,,,,,,,,,,,,,,,,,,,,,,AOC
