Organisation Chain,Tender Reference Number,Tender ID,Withdrawal Allowed,Tender Type,Form of contract,Tender Category,No. of Covers,General Technical Evaluation Allowed,ItemWise Technical Evaluation Allowed,Payment Mode,Is Multi Currency Allowed For BOQ,Is Multi Currency Allowed For Fee,Allow Two Stage Bidding,Cover No,Cover,Document Type,Description,Publish Date,Bid Opening Date,Document Download / Sale Start Date,Document Download / Sale End Date,Clarification Start Date,Clarification End Date,Bid Submission Start Date,Bid Submission End Date,Financial Bid Opening Date,EMD Amount in ₹,EMD Exemption Allowed,EMD Fee Type,EMD Percentage,EMD Payable To,EMD Payable At,S.No,Corrigendum Title,Corrigendum Type,View,S.No.1,Bank Name,Tender Fee in ₹,VAT Charges in ₹,Fee Payable To,Fee Payable At,Tender Fee Exemption Allowed,Name,Address,Title,Work Description,Pre Qualification Details,Independent External Monitor/Remarks,Tender Value in ₹,Product Category,Sub category,Contract Type,Bid Validity(Days),Period Of Work(Days),Location,Pincode,Pre Bid Meeting Place,Pre Bid Meeting Address,Pre Bid Meeting Date,Bid Opening Place,Should Allow NDA Tender,Allow Preferential Bidder,Tender Stage,Contract Date :,Contract Value :,Work Completion Period in days :,Updated By :,Updated on :,AOC document :,AOC Description :,S.No,Bid Number,Bidder Name,Awarded Currency,Awarded Value,S.No.1,Bid Number.1,Bidder Name.1,Submitted Date,Status,Remarks,Status Updated On,Type :,Summary :,Updated By :.1,Updated On :,Document :,BOQ Comparative Chart :,Committee Chairperson/Co-ordinator Name :,Committee Chairperson/Co-ordinator Type :,Committee Members :,Updated By :.2,Updated on :.1,Document :.1,Organisation Chain :,Tender ID :,Tender Ref No :,Tender Title :,Type :.1,Summary :.1,Updated By :.3,Updated On :.1,Document :.2,Committee Chairperson/Co-ordinator Name :.1,Committee Chairperson/Co-ordinator Type :.1,Committee Members :.1,Updated By :.4,Updated On :.2,Financial Bid Opening Date:,Document :.3,Tender Stage
CE RW I||RWCIRCLE-BHUBANESWAR,Tender Online C.C-32 of 2023,2023_CERWI_93868_14,Yes,National Competitive Bid,Percentage,Works,2.0,No,No,Online,No,No,No,1.0,Fee/PreQual/Technical,.pdf,"Tender Paper Cost, EMD, GSTIN, PAN, Registration Certificate",06-Sep-2023 06:55 PM,16-Sep-2023 11:00 AM,06-Sep-2023 06:55 PM,15-Sep-2023 05:00 PM,NA ,NA ,06-Sep-2023 06:55 PM,15-Sep-2023 05:00 PM,12-Dec-2023 11:00 AM,"1,75,796",Yes,percentage,1.0%,Nil,Nil,1.0,Corrigendum,Other,,1.0,ICICI BANK,"10,000",0.0,Nil,Nil,No,ChiefConstructionEngineer,"O/o ChiefConstructionEngineer,CentralRWCircle,BBSR",Construction of road from FNM road to Kanti under SACI in the Dist. of Puri for the year 2023-24,Construction of road from FNM road to Kanti under SACI in the Dist. of Puri for the year 2023-24,Please refer Tender documents. ,NA ,"1,75,79,553",Civil Works - Roads,NA ,Tender,90.0,120.0,Nimapara,752106.0,NA ,NA ,NA ,"O/o ChiefConstructionEngineer,CentralRWCircle,BBSR",No ,No,AOC,30-Apr-2024,"INR 14,944,378",120.0,Priyadarshini Dalai,30-Apr-2024 05:08 PM,KantiAgmtDetails.pdf (950.00 KB),"Work order letter No.826 dtd.19.02.2024 and Agmt No.151 P1 of 2023-24 dtd.19.02.2024 of Suprintending Engineer, Rural works Division, Nimapara",1.0,2256670.0,JITENDRA PRASAD BEHERA,INR,"14,944,378",1,2255564,HARISANKAR PRADHAN,14-Sep-2023 05:52 PM,Rejected-Finance,Other than winner of the transparent lottery system,30-Apr-2024 05:00 PM,Finance,5 nos bidder qualified in the tender,Priyadarshini Dalai,01-Jan-2024 07:23 PM,finance_458816.pdf,BOQ Comparative Chart,"Chief Construction Engineer CentralRWCircle,BBSR",Internal,SuperintendingEngineerRWDivision Puri SrDAORWDivision Nimapara PAtoChiefConstructionEngineerCentralRuralWorksCircleBBSR,Priyadarshini Dalai,30-Apr-2024 05:00 PM,finsummary_458816.pdf (130.64 KB),CE RW I||RWCIRCLE-BHUBANESWAR,2023_CERWI_93868_14,Tender Online C.C-32 of 2023,Construction of road from FNM road to Kanti under SACI in the Dist. of Puri for the year 2023-24,Technical,5 nos bidder participated in the tender,Priyadarshini Dalai,08-Oct-2023 05:18 PM,,"Chief Construction Engineer CentralRWCircle,BBSR",Internal,SuperintendingEngineerRWDivision Puri SrDAORWDivision Nimapara PAtoChiefConstructionEngineerCentralRuralWorksCircleBBSR,Priyadarshini Dalai,08-Dec-2023 03:49 PM,12-Dec-2023 11:00 AM,techsummary_458816.pdf (1106.32 KB),AOC
,,,,,,,,,,,,,,,,.pdf,"Work in Hand, Machineries, Affidavit of Correctness Certificate",,,,,,,,,,,,,,,,,,,,2.0,ICICI NEFT/RTGS,,,,,,,,,,,,,,,,,,,,,,,,,,AOC,,,,,,,,,,,,,2,2256670,JITENDRA PRASAD BEHERA,15-Sep-2023 12:59 PM,Accepted-AOC,Accepted,30-Apr-2024 05:08 PM,,,,,,,,,,,,,,,,,,,,,,,,,,,,,AOC
,,,,,,,,,,,,,,,,.pdf,"No Relationship Certificate, ATO, Work Experience and required documents as per DTCN",,,,,,,,,,,,,,,,,,,,,,,,,,,,,,,,,,,,,,,,,,,,,,,AOC,,,,,,,,,,,,,3,2246501,NARAYAN BHOI,09-Sep-2023 06:52 PM,Rejected-AOC,Rejected,30-Apr-2024 05:08 PM,,,,,,,,,,,,,,,,,,,,,,,,,,,,,AOC
,,,,,,,,,,,,,,2.0,Finance,.xls,BOQ,,,,,,,,,,,,,,,,,,,,,,,,,,,,,,,,,,,,,,,,,,,,,,,AOC,,,,,,,,,,,,,4,2255457,SANGRAM KESHARI NAYAK,15-Sep-2023 02:14 PM,Rejected-Finance,Other than L1,30-Apr-2024 05:00 PM,,,,,,,,,,,,,,,,,,,,,,,,,,,,,AOC
,,,,,,,,,,,,,,,,,,,,,,,,,,,,,,,,,,,,,,,,,,,,,,,,,,,,,,,,,,,,,,,,AOC,,,,,,,,,,,,,5,2257006,SANJEEB PUJARI,15-Sep-2023 02:26 PM,Rejected-Finance,Other than L1 and L2,30-Apr-2024 05:00 PM,,,,,,,,,,,,,,,,,,,,,,,,,,,,,AOC
