Organisation Chain,Tender Reference Number,Tender ID,Withdrawal Allowed,Tender Type,Form of contract,Tender Category,No. of Covers,General Technical Evaluation Allowed,ItemWise Technical Evaluation Allowed,Payment Mode,Is Multi Currency Allowed For BOQ,Is Multi Currency Allowed For Fee,Allow Two Stage Bidding,Cover No,Cover,Document Type,Description,Publish Date,Bid Opening Date,Document Download / Sale Start Date,Document Download / Sale End Date,Clarification Start Date,Clarification End Date,Bid Submission Start Date,Bid Submission End Date,Financial Bid Opening Date,EMD Amount in ₹,EMD Exemption Allowed,EMD Fee Type,EMD Percentage,EMD Payable To,EMD Payable At,S.No,Bank Name,Tender Fee in ₹,VAT Charges in ₹,Fee Payable To,Fee Payable At,Tender Fee Exemption Allowed,Name,Address,Title,Work Description,Pre Qualification Details,Independent External Monitor/Remarks,Tender Value in ₹,Product Category,Sub category,Contract Type,Bid Validity(Days),Period Of Work(Days),Location,Pincode,Pre Bid Meeting Place,Pre Bid Meeting Address,Pre Bid Meeting Date,Bid Opening Place,Should Allow NDA Tender,Allow Preferential Bidder,Tender Stage,Contract Date :,Contract Value :,Work Completion Period in days :,Updated By :,Updated on :,AOC document :,S.No,Bid Number,Bidder Name,Awarded Currency,Awarded Value,S.No.1,Bid Number.1,Bidder Name.1,Submitted Date,Status,Remarks,Status Updated On,Type :,Summary :,Updated By :.1,Updated On :,Document :,BOQ Comparative Chart :,Committee Chairperson/Co-ordinator Name :,Committee Chairperson/Co-ordinator Type :,Committee Members :,Updated By :.2,Updated on :.1,Document :.1,Organisation Chain :,Tender ID :,Tender Ref No :,Tender Title :,Type :.1,Summary :.1,Updated By :.3,Updated On :.1,Document :.2,Committee Chairperson/Co-ordinator Name :.1,Committee Chairperson/Co-ordinator Type :.1,Committee Members :.1,Updated By :.4,Updated On :.2,Financial Bid Opening Date:,Document :.3,Tender Stage
Rural Water Supply and Sanitation||RWSS Circle Koraput||RWSS Division Koraput,13/EE/RWSS/KPT/23-24/22.11.23,2023_RWSS_97700_4,Yes,National Competitive Bid,Percentage,Works,2.0,No,No,Online,No,No,No,1.0,Fee/PreQual/Technical,.pdf,"DD, EMD ,SOLVENCY CERTIFICATE,GST,PANCARD,TURNOVER CERTIFICATE ETC AS PER DTCN",01-Dec-2023 05:00 PM,12-Dec-2023 11:00 AM,01-Dec-2023 05:00 PM,11-Dec-2023 05:00 PM,01-Dec-2023 05:00 PM ,08-Dec-2023 05:00 PM ,01-Dec-2023 05:00 PM,11-Dec-2023 05:00 PM,07-Feb-2024 11:00 AM,"1,30,000",Yes,fixed,,Nil,Nil,1.0,ICICI BANK,"10,000",0.0,Nil,Nil,No,EXECUTIVE ENGINEER RWSS DIVISION KORAPUT,EXECUTIVE ENGINEER RWSS DIVISION KORAPUT,"Rural PWS to 4 nos of clubbed up PWS Schemes i.e Kechela, Narjiput, Surgunaput and Haladiput under Koraput block.","Rural PWS to 4 nos of clubbed up PWS Schemes i.e Kechela, Narjiput, Surgunaput and Haladiput under Koraput block.",Please refer Tender documents. ,NA ,"1,29,98,965",Civil Works - Water Works,NA ,Tender,180.0,365.0,Koraput,764020.0,NA ,NA ,NA ,EXECUTIVE ENGINEER RWSS DIVISION KORAPUT,No ,No,AOC,16-Apr-2024,"INR 11,050,420.44",300.0,Jagabandhu Chaudhury,16-Apr-2024 12:53 PM,4.pdf (900.00 KB),1.0,2351638.0,Mahendra Pradhan,INR,"11,050,420.44",1,2353517,DEBASIS BEHURA,11-Dec-2023 03:44 PM,Rejected-AOC,third Lowest amount quoted by the Bidder and he did not Qualified,16-Apr-2024 12:53 PM,Finance,"Lowest Amount Quoted BY PRABHAKAR PUROHITA,SANJAYA KUMAR PANIGRAHI",Jagabandhu Chaudhury,07-Feb-2024 12:34 PM,,BOQ Comparative Chart,JAGABANDHU CHAUDHURY,External,"SE, DAO GR-II, AEE (ESTIMATOR), RWSS DIVISION KORAPUT AND AEE (ESTIMATOR), AE (ESTIMATOR) RWSS CIRCLE KORAPUT",Jagabandhu Chaudhury,16-Apr-2024 12:44 PM,finsummary_476927.pdf (1087.66 KB),Rural Water Supply and Sanitation||RWSS Circle Koraput||RWSS Division Koraput,2023_RWSS_97700_4,13/EE/RWSS/KPT/23-24/22.11.23,"Rural PWS to 4 nos of clubbed up PWS Schemes i.e Kechela, Narjiput, Surgunaput and Haladiput under Koraput block.",Technical,Technical Documents are under verification.,Jagabandhu Chaudhury,13-Dec-2023 11:52 AM,,JAGABANDHU CHAUDHURY,External,"SE, DAO GR-I, AEE (ESTIMATOR), JE (ESTIMATOR) RWSS DIVISION KORAPUT AND AEE (ESTIMATOR) RWSS CIRCLE KORAPUT.",Jagabandhu Chaudhury,06-Feb-2024 12:13 PM,07-Feb-2024 11:00 AM,techsummary_476927.pdf (1432.27 KB),AOC
,,,,,,,,,,,,,,,,.pdf,"EPF, B-VALUE, EXPERIENCE CERTIFICATE, AFFIDAVITE ETC AS PER DTCN.",,,,,,,,,,,,,,,,2.0,ICICI NEFT/RTGS,,,,,,,,,,,,,,,,,,,,,,,,,,AOC,,,,,,,,,,,,2,2352117,JAIRAM SAHOO,11-Dec-2023 01:00 PM,Rejected-AOC,Second Lowest amount quoted by the Bidder and he did not Qualified,16-Apr-2024 12:53 PM,,,,,,,,,,,,,,,,,,,,,,,,,,,,,AOC
,,,,,,,,,,,,,,2.0,Finance,.xls,boq,,,,,,,,,,,,,,,,,,,,,,,,,,,,,,,,,,,,,,,,,,,AOC,,,,,,,,,,,,3,2351638,Mahendra Pradhan,08-Dec-2023 05:38 PM,Accepted-AOC,Third Lowest amount quoted by the Bidder and he had Selected through Lottery System.,16-Apr-2024 12:53 PM,,,,,,,,,,,,,,,,,,,,,,,,,,,,,AOC
,,,,,,,,,,,,,,,,,,,,,,,,,,,,,,,,,,,,,,,,,,,,,,,,,,,,,,,,,,,,AOC,,,,,,,,,,,,4,2352232,PRABHAKAR PUROHITA,10-Dec-2023 01:28 PM,Rejected-AOC,First Lowest amount quoted by the Bidder and he did not Qualified in Lottery System.,16-Apr-2024 12:53 PM,,,,,,,,,,,,,,,,,,,,,,,,,,,,,AOC
,,,,,,,,,,,,,,,,,,,,,,,,,,,,,,,,,,,,,,,,,,,,,,,,,,,,,,,,,,,,AOC,,,,,,,,,,,,5,2352854,RATNAKAR SAHOO,11-Dec-2023 12:30 PM,Rejected-AOC,Fourth Lowest amount quoted by the Bidder and he did not Qualified,16-Apr-2024 12:53 PM,,,,,,,,,,,,,,,,,,,,,,,,,,,,,AOC
,,,,,,,,,,,,,,,,,,,,,,,,,,,,,,,,,,,,,,,,,,,,,,,,,,,,,,,,,,,,AOC,,,,,,,,,,,,6,2352564,SANJAYA KUMAR PANIGRAHI,10-Dec-2023 08:47 PM,Rejected-AOC,First Lowest amount quoted by the Bidder and he did not Qualified in Lottery System.,16-Apr-2024 12:53 PM,,,,,,,,,,,,,,,,,,,,,,,,,,,,,AOC
,,,,,,,,,,,,,,,,,,,,,,,,,,,,,,,,,,,,,,,,,,,,,,,,,,,,,,,,,,,,AOC,,,,,,,,,,,,7,2346437,SHARAD MUDULI,07-Dec-2023 12:31 PM,Rejected-AOC,third Lowest amount quoted by the Bidder and he did not Qualified,16-Apr-2024 12:53 PM,,,,,,,,,,,,,,,,,,,,,,,,,,,,,AOC
