Organisation Chain,Tender Reference Number,Tender ID,Withdrawal Allowed,Tender Type,Form of contract,Tender Category,No. of Covers,General Technical Evaluation Allowed,ItemWise Technical Evaluation Allowed,Payment Mode,Is Multi Currency Allowed For BOQ,Is Multi Currency Allowed For Fee,Allow Two Stage Bidding,Cover No,Cover,Document Type,Description,Publish Date,Bid Opening Date,Document Download / Sale Start Date,Document Download / Sale End Date,Clarification Start Date,Clarification End Date,Bid Submission Start Date,Bid Submission End Date,EMD Amount in ₹,EMD Exemption Allowed,EMD Fee Type,EMD Percentage,EMD Payable To,EMD Payable At,S.No,Bank Name,Tender Fee in ₹,VAT Charges in ₹,Fee Payable To,Fee Payable At,Tender Fee Exemption Allowed,Name,Address,Title,Work Description,Pre Qualification Details,Independent External Monitor/Remarks,Tender Value in ₹,Product Category,Sub category,Contract Type,Bid Validity(Days),Period Of Work(Days),Location,Pincode,Pre Bid Meeting Place,Pre Bid Meeting Address,Pre Bid Meeting Date,Bid Opening Place,Should Allow NDA Tender,Allow Preferential Bidder,Tender Stage,Contract Date :,Contract Value :,Work Completion Period in days :,Updated By :,Updated on :,AOC document :,AOC Description :,S.No,Bid Number,Bidder Name,Awarded Currency,Awarded Value,S.No.1,Bid Number.1,Bidder Name.1,Submitted Date,Status,Remarks,Status Updated On,Type :,Summary :,Updated By :.1,Updated On :,Document :,BOQ Comparative Chart :,Committee Chairperson/Co-ordinator Name :,Committee Chairperson/Co-ordinator Type :,Committee Members :,Updated By :.2,Updated on :.1,Document :.1,Organisation Chain :,Tender ID :,Tender Ref No :,Tender Title :,Committee Chairperson/Co-ordinator Name :.1,Committee Chairperson/Co-ordinator Type :.1,Committee Members :.1,Updated By :.3,Updated On :.1,Document :.2,Tender Stage
"CE-BM,BSB Basin,Laxmiposi||SE,Baripada Irr.Circle,Takatpur||EE Rairangpur Irr. Divn. Rairangpur",e-Procurement Notice No.03 RID/2023-24,2024_CEBML_100005_8,Yes,Open Tender,Percentage,Works,1.0,No,No,Online,No,No,No,1.0,Fee/PreQual/Technical/Finance,.pdf,"GSTIN, PAN, Contractor Registration Certificate",22-Jan-2024 10:00 AM,06-Feb-2024 11:00 AM,22-Jan-2024 10:00 AM,05-Feb-2024 05:00 PM,22-Jan-2024 10:00 AM ,29-Jan-2024 05:00 PM ,22-Jan-2024 10:00 AM,05-Feb-2024 05:00 PM,"15,200",Yes,fixed,,Nil,Nil,1.0,ICICI BANK,"6,000",0.0,Nil,Nil,No,Superintending Engineer,"O/o the SE, Rairangpur Irr. Division, Rairangpur",SERID-10 of 2023-24 Improvement to Chhanpal Minor in between RD 4765m to 6150m ( Construction of CC Lining and repair of Structures with resectioning of Left main Disty.) of B.I.P. for 2024-2025.,Canal work,Please refer Tender documents. ,NA ,"15,13,668",Civil Works - Canal,NA ,Tender,90.0,180.0,Rairangpur,757043.0,NA ,NA ,NA ,"O/o the SE, Rairangpur Irr. Division, Rairangpur",No ,No,AOC,05-Apr-2024,"INR 1,286,769",180.0,Dileswar Kisan,05-Apr-2024 04:46 PM,03-10.pdf (875.00 KB),Contract Awarded,1.0,2421912.0,JAGANNATH HEMBRAM,INR,"1,286,769",1,2416386,BIKASH MOHAKUD,01-Feb-2024 01:33 PM,Rejected-Technical,Did not satisfy as per DTCN,27-Mar-2024 02:48 PM,Finance,Tender documents of all the bidders have been downloaded successfully.,Parameswar Patra,06-Feb-2024 09:28 PM,finance_486439.pdf,BOQ Comparative Chart,"Superintending Engineer, Rairangpur Irrigation Division",Internal,"Estimator and DAO, Rairangpur Irrigation Division",Dileswar Kisan,05-Apr-2024 04:15 PM,finsummary_486439.pdf (473.71 KB),"CE-BM,BSB Basin,Laxmiposi||SE,Baripada Irr.Circle,Takatpur||EE Rairangpur Irr. Divn. Rairangpur",2024_CEBML_100005_8,e-Procurement Notice No.03 RID/2023-24,SERID-10 of 2023-24 Improvement to Chhanpal Minor in between RD 4765m to 6150m ( Construction of CC Lining and repair of Structures with resectioning of Left main Disty.) of B.I.P. for 2024-2025.,"Superintending Engineer, Rairangpur Irrigation Division",Internal,"Estimator and DAO, Rairangpur Irrigation Division",Parameswar Patra,27-Mar-2024 02:48 PM,techsummary_486439.pdf (473.71 KB),AOC
,,,,,,,,,,,,,,,,.pdf,"Affidavits, No Relation Certificate, undertakings and any other document as per SBD/DTCN",,,,,,,,,,,,,,,2.0,ICICI NEFT/RTGS,,,,,,,,,,,,,,,,,,,,,,,,,,AOC,,,,,,,,,,,,,2,2421912,JAGANNATH HEMBRAM,05-Feb-2024 12:13 PM,Accepted-AOC,Won the lottery,05-Apr-2024 04:46 PM,,,,,,,,,,,,,,,,,,,,,,,AOC
,,,,,,,,,,,,,,,,.xls,Bill of Quantity,,,,,,,,,,,,,,,,,,,,,,,,,,,,,,,,,,,,,,,,,,AOC,,,,,,,,,,,,,3,2417451,JAY GOPAL GIRI,02-Feb-2024 07:54 PM,Rejected-Technical,Did not satisfy as per DTCN,27-Mar-2024 02:48 PM,,,,,,,,,,,,,,,,,,,,,,,AOC
,,,,,,,,,,,,,,,,,,,,,,,,,,,,,,,,,,,,,,,,,,,,,,,,,,,,,,,,,,,AOC,,,,,,,,,,,,,4,2410771,SANTANU KUMAR GIRI,29-Jan-2024 05:05 PM,Rejected-Technical,Did not satisfy as per DTCN,27-Mar-2024 02:48 PM,,,,,,,,,,,,,,,,,,,,,,,AOC
,,,,,,,,,,,,,,,,,,,,,,,,,,,,,,,,,,,,,,,,,,,,,,,,,,,,,,,,,,,AOC,,,,,,,,,,,,,5,2420975,SASMITA RAM,05-Feb-2024 09:15 AM,Rejected-Technical,Did not satisfy as per DTCN,27-Mar-2024 02:48 PM,,,,,,,,,,,,,,,,,,,,,,,AOC
