Organisation Chain,Tender Reference Number,Tender ID,Withdrawal Allowed,Tender Type,Form of contract,Tender Category,No. of Covers,General Technical Evaluation Allowed,ItemWise Technical Evaluation Allowed,Payment Mode,Is Multi Currency Allowed For BOQ,Is Multi Currency Allowed For Fee,Allow Two Stage Bidding,Cover No,Cover,Document Type,Description,Publish Date,Bid Opening Date,Document Download / Sale Start Date,Document Download / Sale End Date,Clarification Start Date,Clarification End Date,Bid Submission Start Date,Bid Submission End Date,Financial Bid Opening Date,EMD Amount in ₹,EMD Exemption Allowed,EMD Fee Type,EMD Percentage,EMD Payable To,EMD Payable At,S.No,Bank Name,Tender Fee in ₹,VAT Charges in ₹,Fee Payable To,Fee Payable At,Tender Fee Exemption Allowed,Name,Address,Title,Work Description,Pre Qualification Details,Independent External Monitor/Remarks,Tender Value in ₹,Product Category,Sub category,Contract Type,Bid Validity(Days),Period Of Work(Days),Location,Pincode,Pre Bid Meeting Place,Pre Bid Meeting Address,Pre Bid Meeting Date,Bid Opening Place,Should Allow NDA Tender,Allow Preferential Bidder,Tender Stage,Contract Date :,Contract Value :,Work Completion Period in days :,Updated By :,Updated on :,AOC document :,AOC Description :,S.No,Bid Number,Bidder Name,Awarded Currency,Awarded Value,S.No.1,Bid Number.1,Bidder Name.1,Submitted Date,Status,Remarks,Status Updated On,Type :,Summary :,Updated By :.1,Updated On :,Document :,BOQ Comparative Chart :,Committee Chairperson/Co-ordinator Name :,Committee Chairperson/Co-ordinator Type :,Committee Members :,Updated By :.2,Updated on :.1,Document :.1,Organisation Chain :,Tender ID :,Tender Ref No :,Tender Title :,Type :.1,Summary :.1,Updated By :.3,Updated On :.1,Document :.2,Committee Chairperson/Co-ordinator Name :.1,Committee Chairperson/Co-ordinator Type :.1,Committee Members :.1,Updated By :.4,Updated On :.2,Financial Bid Opening Date:,Document :.3,Tender Stage
EIC-CIVIL||SERNB-CIRCLE-PHULBANI,CCE_R and B_PLB_21 of 2023_24,2023_EICCL_98866_2,Yes,Open Tender,Percentage,Works,2.0,No,No,Online,No,No,No,1.0,Fee/PreQual/Technical,.pdf,"Online Bid Cost, EMD as per clause 6 of DTCN, affidavit, RC, PAN,GST",01-Jan-2024 10:00 AM,17-Jan-2024 11:00 AM,01-Jan-2024 10:00 AM,16-Jan-2024 05:00 PM,01-Jan-2024 10:00 AM ,12-Jan-2024 05:00 PM ,01-Jan-2024 10:00 AM,16-Jan-2024 05:00 PM,29-Jan-2024 11:00 AM,"6,13,000",Yes,fixed,,Nil,Nil,1.0,ICICI BANK,"10,000",0.0,Nil,Nil,No,CCE Phulbani RandB Circle Phulbani,Office of the CCE Phulbani RandB Circle Phulbani District Kandhamal PIN 762001,Construction of HL Bridge over River LOCAL Nallah at Ch 26_955 km on Manamunda_Sagada_Gundulia Road in the District of Boudh under State Plan,Construction of HL Bridge over River LOCAL Nallah at Ch 26_955 km on Manamunda_Sagada_Gundulia Road in the District of Boudh under State Plan,Please Refer Tender Documents ,NA ,"6,12,92,956",Civil Works - Bridges,NA ,Tender,90.0,180.0,Boudh,762014.0,NA ,NA ,NA ,Office of the CCE Phulbani RandB Circle Phulbani,No ,No,AOC,03-Apr-2024,"INR 55,169,790",180.0,Sudhanshu Ranjan Nayak,03-Apr-2024 01:02 PM,LocalNallah26_955_AOC.pdf (649.00 KB),Awarded being L1 bidder selected through transparent lottery system,1.0,2389355.0,MISHRA INFRA PROJECTS,INR,"55,169,790",1,2393556,Anil Kumar Mishra,16-Jan-2024 01:34 PM,Rejected-Finance,Rejected being not selected through transparent lottery system,03-Apr-2024 12:50 PM,Finance,All document are received and under scrutiny,Sudhanshu Ranjan Nayak,29-Jan-2024 11:14 AM,,BOQ Comparative Chart,CCE Phulbani RandB Circle Phulbani,Internal,CCE Phulbani RandB Circle Phulbani SE Boudh RandB Division Boudh DAO Boudh RandB Division Boudh PA to CCE Phulbani RandB Circle Phulbani,Sudhanshu Ranjan Nayak,03-Apr-2024 12:50 PM,finsummary_481255.pdf (376.34 KB),EIC-CIVIL||SERNB-CIRCLE-PHULBANI,2023_EICCL_98866_2,CCE_R and B_PLB_21 of 2023_24,Construction of HL Bridge over River LOCAL Nallah at Ch 26_955 km on Manamunda_Sagada_Gundulia Road in the District of Boudh under State Plan,Technical,All document are received and under scrutiny,Sudhanshu Ranjan Nayak,18-Jan-2024 11:42 AM,,CCE Phulbani RandB Circle Phulbani,Internal,CCE Phulbani RandB Circle Phulbani SE Boudh RandB Division Boudh DAO Boudh RandB Division Boudh PA to CCE Phulbani RandB Circle Phulbani,Kruttika Kumari Panda,25-Jan-2024 05:36 PM,29-Jan-2024 11:00 AM,techsummary_481255.pdf (380.47 KB),AOC
,,,,,,,,,,,,,,,,.pdf,"Work Experience, Machineries and other documents as per DTCN",,,,,,,,,,,,,,,,2.0,ICICI NEFT/RTGS,,,,,,,,,,,,,,,,,,,,,,,,,,AOC,,,,,,,,,,,,,2,2389355,MISHRA INFRA PROJECTS,13-Jan-2024 06:35 PM,Accepted-AOC,Awarded being L1 bidder selected through transparent lottery system,03-Apr-2024 01:03 PM,,,,,,,,,,,,,,,,,,,,,,,,,,,,,AOC
,,,,,,,,,,,,,,2.0,Finance,.xls,BOQ,,,,,,,,,,,,,,,,,,,,,,,,,,,,,,,,,,,,,,,,,,,AOC,,,,,,,,,,,,,3,2393875,M/S JRP CONSTRUCTION,16-Jan-2024 02:41 PM,Rejected-Finance,Rejected being not selected through transparent lottery system,03-Apr-2024 12:50 PM,,,,,,,,,,,,,,,,,,,,,,,,,,,,,AOC
,,,,,,,,,,,,,,,,,,,,,,,,,,,,,,,,,,,,,,,,,,,,,,,,,,,,,,,,,,,,AOC,,,,,,,,,,,,,4,2391536,M/S SUMEET & ASSOCIATES,16-Jan-2024 01:35 PM,Rejected-Finance,Rejected being L3 bidder,03-Apr-2024 12:50 PM,,,,,,,,,,,,,,,,,,,,,,,,,,,,,AOC
,,,,,,,,,,,,,,,,,,,,,,,,,,,,,,,,,,,,,,,,,,,,,,,,,,,,,,,,,,,,AOC,,,,,,,,,,,,,5,2392722,Swadhin Kumar sahu,16-Jan-2024 10:36 AM,Rejected-Finance,Rejected being L2 bidder,03-Apr-2024 12:50 PM,,,,,,,,,,,,,,,,,,,,,,,,,,,,,AOC
