Organisation Chain,Tender Reference Number,Tender ID,Withdrawal Allowed,Tender Type,Form of contract,Tender Category,No. of Covers,General Technical Evaluation Allowed,ItemWise Technical Evaluation Allowed,Payment Mode,Is Multi Currency Allowed For BOQ,Is Multi Currency Allowed For Fee,Allow Two Stage Bidding,Cover No,Cover,Document Type,Description,Publish Date,Bid Opening Date,Document Download / Sale Start Date,Document Download / Sale End Date,Clarification Start Date,Clarification End Date,Bid Submission Start Date,Bid Submission End Date,Financial Bid Opening Date,EMD Amount in ₹,EMD Exemption Allowed,EMD Fee Type,EMD Percentage,EMD Payable To,EMD Payable At,S.No,Corrigendum Title,Corrigendum Type,View,S.No.1,Bank Name,Tender Fee in ₹,VAT Charges in ₹,Fee Payable To,Fee Payable At,Tender Fee Exemption Allowed,Name,Address,Title,Work Description,Pre Qualification Details,Independent External Monitor/Remarks,Tender Value in ₹,Product Category,Sub category,Contract Type,Bid Validity(Days),Period Of Work(Days),Location,Pincode,Pre Bid Meeting Place,Pre Bid Meeting Address,Pre Bid Meeting Date,Bid Opening Place,Should Allow NDA Tender,Allow Preferential Bidder,Tender Stage,Contract Date :,Contract Value :,Work Completion Period in days :,Updated By :,Updated on :,AOC document :,AOC Description :,S.No,Bid Number,Bidder Name,Awarded Currency,Awarded Value,S.No.1,Bid Number.1,Bidder Name.1,Submitted Date,Status,Remarks,Status Updated On,Type :,Summary :,Updated By :.1,Updated On :,Document :,BOQ Comparative Chart :,Committee Chairperson/Co-ordinator Name :,Committee Chairperson/Co-ordinator Type :,Committee Members :,Updated By :.2,Updated on :.1,Document :.1,Organisation Chain :,Tender ID :,Tender Ref No :,Tender Title :,Type :.1,Summary :.1,Updated By :.3,Updated On :.1,Document :.2,Committee Chairperson/Co-ordinator Name :.1,Committee Chairperson/Co-ordinator Type :.1,Committee Members :.1,Updated By :.4,Updated On :.2,Financial Bid Opening Date:,Document :.3,Tender Stage
CE RW I||RWCIRCLE-BHUBANESWAR,Tender Online C.C-32 of 2023,2023_CERWI_93868_22,Yes,National Competitive Bid,Percentage,Works,2.0,No,No,Online,No,No,No,1.0,Fee/PreQual/Technical,.pdf,"Tender Paper Cost, EMD, GSTIN, PAN, Registration Certificate",06-Sep-2023 12:00 PM,16-Sep-2023 11:00 AM,06-Sep-2023 12:00 PM,15-Sep-2023 05:00 PM,NA ,NA ,06-Sep-2023 12:00 PM,15-Sep-2023 05:00 PM,12-Dec-2023 11:00 AM,"6,98,747",Yes,percentage,1.0%,Nil,Nil,1.0,Corrigendum,Other,,1.0,ICICI BANK,"10,000",0.0,Nil,Nil,No,ChiefConstructionEngineer,"O/o ChiefConO/o ChiefConstructionEngineer,CentralRWCircle,BBSR",Impvt. of road from RD road to Dethiapada in the Dist. of Puri under SDMF for the year 2023-24,Impvt. of road from RD road to Dethiapada in the Dist. of Puri under SDMF for the year 2023-24,Please refer Tender documents. ,NA ,"6,98,74,749",Civil Works - Roads,NA ,Tender,90.0,270.0,Puri,752001.0,NA ,NA ,NA ,"O/o ChiefConstructionEngineer,CentralRWCircle,BBSR",No ,No,AOC,18-Apr-2024,"INR 62,656,687",270.0,Priyadarshini Dalai,18-Apr-2024 11:48 AM,RDroadDethiapadaAgmtDetails.PDF (1936.00 KB),"Work order letter No.3992 dtd.13.03.2024 and Agmt No.420 P1 of 2023-24 dtd.13.03.2024 of Executive Engineer, Rural Works Division, Puri",1.0,2256420.0,PRADOSH KUMAR SWAIN,INR,"62,656,687",1,2256485,BIBHUTI BHUSAN SWAIN,15-Sep-2023 12:03 PM,Rejected-Finance,Other than L1,18-Apr-2024 11:45 AM,Finance,5 nos bidder qualified in the tender,Priyadarshini Dalai,01-Jan-2024 07:55 PM,finance_458827.pdf,BOQ Comparative Chart,"Chief Construction Engineer CentralRWCircle,BBSR",Internal,SuperintendingEngineerRWDivision Bhubaneswar SrDAORWDivision Puri PAtoChiefConstructionEngineerCentralRuralWorksCircleBBSR,Priyadarshini Dalai,18-Apr-2024 11:45 AM,finsummary_458827.pdf (130.64 KB),CE RW I||RWCIRCLE-BHUBANESWAR,2023_CERWI_93868_22,Tender Online C.C-32 of 2023,Impvt. of road from RD road to Dethiapada in the Dist. of Puri under SDMF for the year 2023-24,Technical,7 nos bidder participated in the tender,Priyadarshini Dalai,08-Oct-2023 05:21 PM,,"Chief Construction Engineer CentralRWCircle,BBSR",Internal,SuperintendingEngineerRWDivision Bhubaneswar SrDAORWDivision Puri PAtoChiefConstructionEngineerCentralRuralWorksCircleBBSR,Priyadarshini Dalai,08-Dec-2023 04:21 PM,12-Dec-2023 11:00 AM,techsummary_458827.pdf (1106.32 KB),AOC
,,,,,,,,,,,,,,,,.pdf,"Work in Hand, Machineries, Affidavit of Correctness Certificate",,,,,,,,,,,,,,,,,,,,2.0,ICICI NEFT/RTGS,,,,,,,,,,,,,,,,,,,,,,,,,,AOC,,,,,,,,,,,,,2,2257212,BISWOJIT PANDA,15-Sep-2023 04:08 PM,Rejected-Finance,Other than L1 and L2,18-Apr-2024 11:45 AM,,,,,,,,,,,,,,,,,,,,,,,,,,,,,AOC
,,,,,,,,,,,,,,,,.pdf,"No Relationship Certificate, ATO, Work Experience and required documents as per DTCN",,,,,,,,,,,,,,,,,,,,,,,,,,,,,,,,,,,,,,,,,,,,,,,AOC,,,,,,,,,,,,,3,2256186,NIRANJAN ROUT,15-Sep-2023 04:28 PM,Rejected-Finance,Other than L1,18-Apr-2024 11:45 AM,,,,,,,,,,,,,,,,,,,,,,,,,,,,,AOC
,,,,,,,,,,,,,,2.0,Finance,.xls,BOQ,,,,,,,,,,,,,,,,,,,,,,,,,,,,,,,,,,,,,,,,,,,,,,,AOC,,,,,,,,,,,,,4,2256420,PRADOSH KUMAR SWAIN,15-Sep-2023 02:56 PM,Accepted-AOC,Accepted,18-Apr-2024 11:48 AM,,,,,,,,,,,,,,,,,,,,,,,,,,,,,AOC
,,,,,,,,,,,,,,,,,,,,,,,,,,,,,,,,,,,,,,,,,,,,,,,,,,,,,,,,,,,,,,,,AOC,,,,,,,,,,,,,5,2255776,PRAFULLA KUMAR MISHRA,14-Sep-2023 08:31 PM,Rejected-Finance,Other than L1,18-Apr-2024 11:45 AM,,,,,,,,,,,,,,,,,,,,,,,,,,,,,AOC
,,,,,,,,,,,,,,,,,,,,,,,,,,,,,,,,,,,,,,,,,,,,,,,,,,,,,,,,,,,,,,,,AOC,,,,,,,,,,,,,6,2256517,SUMANTA KUMAR SAHOO,15-Sep-2023 12:10 PM,Rejected-Technical,As per Clause No.2.6 (b) of the Eligibility Criteria of General Instructions To the Tenderers of the DTCN,08-Dec-2023 04:21 PM,,,,,,,,,,,,,,,,,,,,,,,,,,,,,AOC
,,,,,,,,,,,,,,,,,,,,,,,,,,,,,,,,,,,,,,,,,,,,,,,,,,,,,,,,,,,,,,,,AOC,,,,,,,,,,,,,7,2253419,SUSIL KUMAR BALABANTARAY,13-Sep-2023 03:07 PM,Rejected-Technical,As per Clause No.2.1(5) and 2.1(7) of the Eligibility Criteria of General Instructions To the Tenderers of the DTCN,08-Dec-2023 04:21 PM,,,,,,,,,,,,,,,,,,,,,,,,,,,,,AOC
