Organisation Chain,Tender Reference Number,Tender ID,Withdrawal Allowed,Tender Type,Form of contract,Tender Category,No. of Covers,General Technical Evaluation Allowed,ItemWise Technical Evaluation Allowed,Payment Mode,Is Multi Currency Allowed For BOQ,Is Multi Currency Allowed For Fee,Allow Two Stage Bidding,Cover No,Cover,Document Type,Description,Publish Date,Bid Opening Date,Document Download / Sale Start Date,Document Download / Sale End Date,Clarification Start Date,Clarification End Date,Bid Submission Start Date,Bid Submission End Date,Financial Bid Opening Date,EMD Amount in ₹,EMD Exemption Allowed,EMD Fee Type,EMD Percentage,EMD Payable To,EMD Payable At,S.No,Bank Name,Tender Fee in ₹,VAT Charges in ₹,Fee Payable To,Fee Payable At,Tender Fee Exemption Allowed,Name,Address,Title,Work Description,Pre Qualification Details,Independent External Monitor/Remarks,Tender Value in ₹,Product Category,Sub category,Contract Type,Bid Validity(Days),Period Of Work(Days),Location,Pincode,Pre Bid Meeting Place,Pre Bid Meeting Address,Pre Bid Meeting Date,Bid Opening Place,Should Allow NDA Tender,Allow Preferential Bidder,Tender Stage,Contract Date :,Contract Value :,Work Completion Period in days :,Updated By :,Updated on :,AOC document :,AOC Description :,S.No,Bid Number,Bidder Name,Awarded Currency,Awarded Value,S.No.1,Bid Number.1,Bidder Name.1,Submitted Date,Status,Remarks,Status Updated On,Type :,Summary :,Updated By :.1,Updated On :,Document :,BOQ Comparative Chart :,Committee Chairperson/Co-ordinator Name :,Committee Chairperson/Co-ordinator Type :,Committee Members :,Updated By :.2,Updated on :.1,Document :.1,Organisation Chain :,Tender ID :,Tender Ref No :,Tender Title :,Type :.1,Summary :.1,Updated By :.3,Updated On :.1,Document :.2,Committee Chairperson/Co-ordinator Name :.1,Committee Chairperson/Co-ordinator Type :.1,Committee Members :.1,Updated By :.4,Updated On :.2,Financial Bid Opening Date:,Document :.3,Tender Stage
EIC-CIVIL,CE-DPI AND R- 32/2023-24,2024_EICCL_99252_2,Yes,Open Tender,Percentage,Works,2.0,No,No,Online,No,No,No,1.0,Fee/PreQual/Technical,.pdf,"Online proof copy of Tender Cost and EMD, GSTIN, PAN, RC and Affidavit",05-Jan-2024 06:00 PM,22-Jan-2024 11:00 AM,05-Jan-2024 06:00 PM,20-Jan-2024 05:30 PM,NA ,NA ,05-Jan-2024 06:00 PM,20-Jan-2024 05:30 PM,15-Feb-2024 11:30 AM,"16,84,000",Yes,fixed,,Nil,Nil,1.0,ICICI BANK,"10,000",0.0,Nil,Nil,No,"Chief Engineer, DPI and Roads, Odisha","Office of the E.I.C. Civil, Odisha, Nirman Soudha, New Building, Unit-V, Bhubaneswar",Improvement such as widening and strengthening of Sanahula- Paikasahi via Mindol road from 0/000 km to 11/519 km in the district of Angul under State Plan,Improvement such as widening and strengthening of Sanahula- Paikasahi via Mindol road from 0/000 km to 11/519 km in the district of Angul under State Plan,Please refer Tender documents. ,NA ,"16,84,15,653",Civil Works - Roads,NA ,Tender,90.0,420.0,In Angul Dist,751001.0,NA ,NA ,NA ,"O/o the E.I.C. Civil, Odisha, Bhubaneswar",No ,No,AOC,20-Apr-2024,"INR 151,590,929",420.0,Pradipta Kumar Nayak,20-Apr-2024 01:06 PM,Sanahula_Paikasahi.pdf (369.00 KB),1693P1 of 2023-24,1.0,2398237.0,M/S RAJ CONSTRUCTION,INR,"151,590,929",1,2400040,Abani kumar mahapatra,20-Jan-2024 04:22 PM,Rejected-Technical,Disqualified,12-Feb-2024 06:38 PM,Finance,Finance opening,Siba Prasad Panigrahy,15-Feb-2024 01:03 PM,,BOQ Comparative Chart,CE DPI and Roads,Internal,,Pradipta Kumar Nayak,20-Apr-2024 01:03 PM,finsummary_482581.pdf (368.99 KB),EIC-CIVIL,2024_EICCL_99252_2,CE-DPI AND R- 32/2023-24,Improvement such as widening and strengthening of Sanahula- Paikasahi via Mindol road from 0/000 km to 11/519 km in the district of Angul under State Plan,Technical,Opening of tender,Pradipta Kumar Nayak,22-Jan-2024 02:45 PM,,EIC Civil Odisha,Internal,,Pradipta Kumar Nayak,12-Feb-2024 06:38 PM,15-Feb-2024 11:30 AM,techsummary_482581.pdf (180.66 KB),AOC
,,,,,,,,,,,,,,,,.pdf,Machineries and work experience,,,,,,,,,,,,,,,,2.0,ICICI NEFT/RTGS,,,,,,,,,,,,,,,,,,,,,,,,,,AOC,,,,,,,,,,,,,2,2399613,M/S JRP CONSTRUCTION,19-Jan-2024 04:46 PM,Rejected-Finance,Other than L1 and L2 bidder,20-Apr-2024 01:03 PM,,,,,,,,,,,,,,,,,,,,,,,,,,,,,AOC
,,,,,,,,,,,,,,,,.pdf,Other documents as per DTCN,,,,,,,,,,,,,,,,,,,,,,,,,,,,,,,,,,,,,,,,,,,AOC,,,,,,,,,,,,,3,2398237,M/S RAJ CONSTRUCTION,19-Jan-2024 05:39 PM,Accepted-AOC,L1 bidder,20-Apr-2024 01:06 PM,,,,,,,,,,,,,,,,,,,,,,,,,,,,,AOC
,,,,,,,,,,,,,,2.0,Finance,.xls,Bill of quantities,,,,,,,,,,,,,,,,,,,,,,,,,,,,,,,,,,,,,,,,,,,AOC,,,,,,,,,,,,,4,2400158,OM MAA CONSTRUCTION,20-Jan-2024 02:26 PM,Rejected-AOC,L2 bidder,20-Apr-2024 01:06 PM,,,,,,,,,,,,,,,,,,,,,,,,,,,,,AOC
,,,,,,,,,,,,,,,,,,,,,,,,,,,,,,,,,,,,,,,,,,,,,,,,,,,,,,,,,,,,AOC,,,,,,,,,,,,,5,2399922,Santosh Kumar Mishra,19-Jan-2024 08:50 PM,Rejected-Finance,Other than L1 and L2 bidder,20-Apr-2024 01:03 PM,,,,,,,,,,,,,,,,,,,,,,,,,,,,,AOC
