Organisation Chain,Tender Reference Number,Tender ID,Withdrawal Allowed,Tender Type,Form of contract,Tender Category,No. of Covers,General Technical Evaluation Allowed,ItemWise Technical Evaluation Allowed,Payment Mode,Is Multi Currency Allowed For BOQ,Is Multi Currency Allowed For Fee,Allow Two Stage Bidding,Cover No,Cover,Document Type,Description,Publish Date,Bid Opening Date,Document Download / Sale Start Date,Document Download / Sale End Date,Clarification Start Date,Clarification End Date,Bid Submission Start Date,Bid Submission End Date,EMD Amount in ₹,EMD Exemption Allowed,EMD Fee Type,EMD Percentage,EMD Payable To,EMD Payable At,S.No,Bank Name,Tender Fee in ₹,VAT Charges in ₹,Fee Payable To,Fee Payable At,Tender Fee Exemption Allowed,Name,Address,Title,Work Description,Pre Qualification Details,Independent External Monitor/Remarks,Tender Value in ₹,Product Category,Sub category,Contract Type,Bid Validity(Days),Period Of Work(Days),Location,Pincode,Pre Bid Meeting Place,Pre Bid Meeting Address,Pre Bid Meeting Date,Bid Opening Place,Should Allow NDA Tender,Allow Preferential Bidder,Tender Stage,Contract Date :,Contract Value :,Work Completion Period in days :,Updated By :,Updated on :,AOC document :,AOC Description :,S.No,Bid Number,Bidder Name,Awarded Currency,Awarded Value,S.No.1,Bid Number.1,Bidder Name.1,Submitted Date,Status,Remarks,Status Updated On,Type :,Summary :,Updated By :.1,Updated On :,Document :,BOQ Comparative Chart :,Committee Chairperson/Co-ordinator Name :,Committee Chairperson/Co-ordinator Type :,Committee Members :,Updated By :.2,Updated on :.1,Document :.1,Organisation Chain :,Tender ID :,Tender Ref No :,Tender Title :,Committee Chairperson/Co-ordinator Name :.1,Committee Chairperson/Co-ordinator Type :.1,Committee Members :.1,Updated By :.3,Updated On :.1,Document :.2,Tender Stage
EIC-CIVIL||SERNB-CIRCLE-EASTERN||EERNB-DIVN-BHADRAK,SE RandB BDK-33/2023-24,2024_EICCL_99557_1,Yes,Open Tender,Percentage,Works,1.0,No,No,Online,No,No,No,1.0,Fee/PreQual/Technical/Finance,.pdf,"PAN , GSTIN , Contractor Registration Certificate , Affidavit as per DTCN",10-Jan-2024 06:55 PM,17-Jan-2024 11:30 AM,10-Jan-2024 06:55 PM,16-Jan-2024 05:00 PM,NA ,NA ,10-Jan-2024 06:55 PM,16-Jan-2024 05:00 PM,"8,785",Yes,fixed,,Nil,Nil,1.0,ICICI BANK,"4,000",0.0,Nil,Nil,No,"Superitending Engineer (RnB) Division , Bh","O/O the Superitending Engineer (RnB) Division , Bh","New Service connection for new Circuit House Building with installation of new 100 KVA 11/0.43 KV S/S pole Mounted under 6percentage deposit scheme at Gelpur,Bhadrak","New Service connection for new Circuit House Building with installation of new 100 KVA 11/0.43 KV S/S pole Mounted under 6percentage deposit scheme at Gelpur,Bhadrak",Please refer Tender documents. ,NA ,,Electrical Works,NA ,Tender,90.0,30.0,Bhadrak,756100.0,NA ,NA ,NA ,"O/O the Superitending Engineer (RnB) Division , Bh",No ,No,AOC,24-Apr-2024,"INR 746,831",30.0,Sushree Sangita Nayak,24-Apr-2024 12:46 PM,602.pdf (264.00 KB),Winner of the transparent lottery system.,1.0,2394173.0,SARITA DAS,INR,"746,831",1,2393839,ICON BUILDERS,16-Jan-2024 02:22 PM,Rejected-Finance,Looser of the transparent lottery system.,24-Apr-2024 12:44 PM,Finance,Admitted for technical evaluation,Sushree Sangita Nayak,24-Apr-2024 12:09 PM,finance_484230.pdf,BOQ Comparative Chart,Er Deepak Kumar Panigrahi,Internal,"Er Deepak Kumar Panigrahi,Sajal Das,Biswajit Behera,Sushree sangita Nayak",Sushree Sangita Nayak,24-Apr-2024 12:44 PM,finsummary_484230.pdf (263.73 KB),EIC-CIVIL||SERNB-CIRCLE-EASTERN||EERNB-DIVN-BHADRAK,2024_EICCL_99557_1,SE RandB BDK-33/2023-24,"New Service connection for new Circuit House Building with installation of new 100 KVA 11/0.43 KV S/S pole Mounted under 6percentage deposit scheme at Gelpur,Bhadrak",Er Deepak Kumar Panigrahi,Internal,"Er Deepak Kumar Panigrahi,Sajal Das,Biswajit Behera,Sushree sangita Nayak",Sushree Sangita Nayak,24-Apr-2024 12:39 PM,techsummary_484230.pdf (263.73 KB),AOC
,,,,,,,,,,,,,,,,.xls,Bill of quantity,,,,,,,,,,,,,,,2.0,ICICI NEFT/RTGS,,,,,,,,,,,,,,,,,,,,,,,,,,AOC,,,,,,,,,,,,,2,2389131,M/S GOURISHANKAR ENTERPRISES.RAMAKANTA MAHANI,13-Jan-2024 01:20 PM,Rejected-Finance,Looser of the transparent lottery system.,24-Apr-2024 12:44 PM,,,,,,,,,,,,,,,,,,,,,,,AOC
,,,,,,,,,,,,,,,,,,,,,,,,,,,,,,,,,,,,,,,,,,,,,,,,,,,,,,,,,,,AOC,,,,,,,,,,,,,3,2393116,M/S UNITED ENGINEERING,16-Jan-2024 04:47 PM,Rejected-Finance,Looser of the transparent lottery system.,24-Apr-2024 12:44 PM,,,,,,,,,,,,,,,,,,,,,,,AOC
,,,,,,,,,,,,,,,,,,,,,,,,,,,,,,,,,,,,,,,,,,,,,,,,,,,,,,,,,,,AOC,,,,,,,,,,,,,4,2391349,POWERTECH ENGINEERING.TAPAS RANJAN PATI,15-Jan-2024 04:59 PM,Rejected-Finance,Looser of the transparent lottery system.,24-Apr-2024 12:44 PM,,,,,,,,,,,,,,,,,,,,,,,AOC
,,,,,,,,,,,,,,,,,,,,,,,,,,,,,,,,,,,,,,,,,,,,,,,,,,,,,,,,,,,AOC,,,,,,,,,,,,,5,2394519,PRADIP KUMAR JENA,16-Jan-2024 04:40 PM,Rejected-Finance,Looser of the transparent lottery system.,24-Apr-2024 12:44 PM,,,,,,,,,,,,,,,,,,,,,,,AOC
,,,,,,,,,,,,,,,,,,,,,,,,,,,,,,,,,,,,,,,,,,,,,,,,,,,,,,,,,,,AOC,,,,,,,,,,,,,6,2392442,SANJAY KUMAR PATRA,16-Jan-2024 07:56 AM,Rejected-Finance,Looser of the transparent lottery system.,24-Apr-2024 12:44 PM,,,,,,,,,,,,,,,,,,,,,,,AOC
,,,,,,,,,,,,,,,,,,,,,,,,,,,,,,,,,,,,,,,,,,,,,,,,,,,,,,,,,,,AOC,,,,,,,,,,,,,7,2394173,SARITA DAS,16-Jan-2024 04:02 PM,Accepted-AOC,Winner of the transparent lottery system.,24-Apr-2024 12:46 PM,,,,,,,,,,,,,,,,,,,,,,,AOC
,,,,,,,,,,,,,,,,,,,,,,,,,,,,,,,,,,,,,,,,,,,,,,,,,,,,,,,,,,,AOC,,,,,,,,,,,,,8,2388326,Transpower,12-Jan-2024 11:51 AM,Rejected-Finance,Looser of the transparent lottery system.,24-Apr-2024 12:44 PM,,,,,,,,,,,,,,,,,,,,,,,AOC
