Organisation Chain,Tender Reference Number,Tender ID,Withdrawal Allowed,Tender Type,Form of contract,Tender Category,No. of Covers,General Technical Evaluation Allowed,ItemWise Technical Evaluation Allowed,Payment Mode,Is Multi Currency Allowed For BOQ,Is Multi Currency Allowed For Fee,Allow Two Stage Bidding,Cover No,Cover,Document Type,Description,Publish Date,Bid Opening Date,Document Download / Sale Start Date,Document Download / Sale End Date,Clarification Start Date,Clarification End Date,Bid Submission Start Date,Bid Submission End Date,Financial Bid Opening Date,EMD Amount in ₹,EMD Exemption Allowed,EMD Fee Type,EMD Percentage,EMD Payable To,EMD Payable At,S.No,Bank Name,Tender Fee in ₹,VAT Charges in ₹,Fee Payable To,Fee Payable At,Tender Fee Exemption Allowed,Name,Address,Title,Work Description,Pre Qualification Details,Independent External Monitor/Remarks,Tender Value in ₹,Product Category,Sub category,Contract Type,Bid Validity(Days),Period Of Work(Days),Location,Pincode,Pre Bid Meeting Place,Pre Bid Meeting Address,Pre Bid Meeting Date,Bid Opening Place,Should Allow NDA Tender,Allow Preferential Bidder,Tender Stage,Contract Date :,Contract Value :,Work Completion Period in days :,Updated By :,Updated on :,AOC document :,AOC Description :,S.No,Bid Number,Bidder Name,Awarded Currency,Awarded Value,S.No.1,Bid Number.1,Bidder Name.1,Submitted Date,Status,Remarks,Status Updated On,Type :,Summary :,Updated By :.1,Updated On :,Document :,BOQ Comparative Chart :,Committee Chairperson/Co-ordinator Name :,Committee Chairperson/Co-ordinator Type :,Committee Members :,Updated By :.2,Updated on :.1,Document :.1,Organisation Chain :,Tender ID :,Tender Ref No :,Tender Title :,Type :.1,Summary :.1,Updated By :.3,Updated On :.1,Document :.2,Committee Chairperson/Co-ordinator Name :.1,Committee Chairperson/Co-ordinator Type :.1,Committee Members :.1,Updated By :.4,Updated On :.2,Financial Bid Opening Date:,Document :.3,Tender Stage
IDCO||IDCO||IDCO,Civil/Est/39/2023-24,2024_IDCO_100034_1,Yes,Open Tender,Percentage,Works,2.0,No,No,Online,No,No,No,1.0,Fee/PreQual/Technical,.pdf,"Tender fee, EMD, Valid License, PAN, GST,EPF,EPF Challan, Profit Loss Statement, Experience Certific",23-Jan-2024 05:00 PM,06-Feb-2024 04:00 PM,23-Jan-2024 05:00 PM,06-Feb-2024 03:00 PM,23-Jan-2024 05:00 PM ,29-Jan-2024 11:00 AM ,23-Jan-2024 05:00 PM,06-Feb-2024 03:00 PM,01-Mar-2024 11:00 AM,"34,22,000",Yes,fixed,,Nil,Nil,1.0,ICICI BANK,"11,800",0.0,Nil,Nil,No,CGM CIVIL,"IDCO TOWERS, JANPATH,BHUBANESWAR",Construction of 3rd Boys Hostel of OUTR Bhubaneswar,Construction of 3rd Boys Hostel of OUTR Bhubaneswar,As per DTCN ,NA ,,Civil Works - Buildings,HOSTEL BUILDING ,Rate Contract,90.0,540.0,OUTR CAMPUS,751003.0,IDCO TOWER ,"IDCO BOARD ROOM, IDCO TOWERS, JANPATH,BHUBANESWAR ",29-Jan-2024 11:00 AM ,IDCO TOWERS,No ,No,AOC,08-Apr-2024,"INR 307,509,771.41",540.0,Kalpana Parida,08-Apr-2024 02:09 PM,BH.pdf (169.00 KB),As Lowest bidder,1.0,2417203.0,DIVERSIFIED ENERGY SOLUTIONS PRIVATE LIMITED,INR,"307,509,771.41",1,2421174,B.C.BHUYAN CONSTRUCTION PVT LTD,06-Feb-2024 02:02 PM,Rejected-AOC,L2,08-Apr-2024 02:09 PM,Finance,Financial bid opened of 6(Six) technically qualified bidders,Kalpana Parida,01-Mar-2024 12:16 PM,,BOQ Comparative Chart,CGM CIVIL,Internal,CGM PC CGM FINANCE,Kalpana Parida,08-Apr-2024 02:00 PM,finsummary_486589.pdf (168.89 KB),IDCO||IDCO||IDCO,2024_IDCO_100034_1,Civil/Est/39/2023-24,Construction of 3rd Boys Hostel of OUTR Bhubaneswar,Technical,Technical bid opened of 08 Participants,Kalpana Parida,06-Feb-2024 05:37 PM,,CGM CIVIL,Internal,SE CIVIL DH BCD-II,Kalpana Parida,29-Feb-2024 07:06 PM,01-Mar-2024 11:00 AM,techsummary_486589.pdf (653.75 KB),AOC
,,,,,,,,,,,,,,,,.pdf,Affidavit and other required Document as per DTCN,,,,,,,,,,,,,,,,2.0,ICICI NEFT/RTGS,,,,,,,,,,,,,,,,,,,,,,,,,,AOC,,,,,,,,,,,,,2,2420193,DILLIP CONSTRUCTIONS PRIVATE LIMITED,06-Feb-2024 01:48 PM,Rejected-AOC,L2,08-Apr-2024 02:09 PM,,,,,,,,,,,,,,,,,,,,,,,,,,,,,AOC
,,,,,,,,,,,,,,2.0,Finance,.xls,BOQ,,,,,,,,,,,,,,,,,,,,,,,,,,,,,,,,,,,,,,,,,,,AOC,,,,,,,,,,,,,3,2417203,DIVERSIFIED ENERGY SOLUTIONS PRIVATE LIMITED,06-Feb-2024 02:15 PM,Accepted-AOC,L1,08-Apr-2024 02:09 PM,,,,,,,,,,,,,,,,,,,,,,,,,,,,,AOC
,,,,,,,,,,,,,,,,,,,,,,,,,,,,,,,,,,,,,,,,,,,,,,,,,,,,,,,,,,,,AOC,,,,,,,,,,,,,4,2420107,M/S DIVINE CONSTRUCTIONS,05-Feb-2024 07:39 PM,Rejected-AOC,L2,08-Apr-2024 02:09 PM,,,,,,,,,,,,,,,,,,,,,,,,,,,,,AOC
,,,,,,,,,,,,,,,,,,,,,,,,,,,,,,,,,,,,,,,,,,,,,,,,,,,,,,,,,,,,AOC,,,,,,,,,,,,,5,2422318,PKP BUILDCON PRIVATE LIMITED,06-Feb-2024 01:23 PM,Rejected-Technical,As recomended by TEC,29-Feb-2024 07:06 PM,,,,,,,,,,,,,,,,,,,,,,,,,,,,,AOC
,,,,,,,,,,,,,,,,,,,,,,,,,,,,,,,,,,,,,,,,,,,,,,,,,,,,,,,,,,,,AOC,,,,,,,,,,,,,6,2415871,SAI SMRUTI INFRASTRUCTURE PVT. LTD.,06-Feb-2024 02:40 PM,Rejected-AOC,L2,08-Apr-2024 02:09 PM,,,,,,,,,,,,,,,,,,,,,,,,,,,,,AOC
,,,,,,,,,,,,,,,,,,,,,,,,,,,,,,,,,,,,,,,,,,,,,,,,,,,,,,,,,,,,AOC,,,,,,,,,,,,,7,2423835,Shree Balaji Engicons Limited,06-Feb-2024 01:41 PM,Rejected-AOC,L2,08-Apr-2024 02:09 PM,,,,,,,,,,,,,,,,,,,,,,,,,,,,,AOC
,,,,,,,,,,,,,,,,,,,,,,,,,,,,,,,,,,,,,,,,,,,,,,,,,,,,,,,,,,,,AOC,,,,,,,,,,,,,8,2423740,Shyam Indus Power Solutions Private Limited,06-Feb-2024 02:38 PM,Rejected-Technical,As recomended by TEC,29-Feb-2024 07:06 PM,,,,,,,,,,,,,,,,,,,,,,,,,,,,,AOC
