Organisation Chain,Tender Reference Number,Tender ID,Withdrawal Allowed,Tender Type,Form of contract,Tender Category,No. of Covers,General Technical Evaluation Allowed,ItemWise Technical Evaluation Allowed,Payment Mode,Is Multi Currency Allowed For BOQ,Is Multi Currency Allowed For Fee,Allow Two Stage Bidding,Cover No,Cover,Document Type,Description,Publish Date,Bid Opening Date,Document Download / Sale Start Date,Document Download / Sale End Date,Clarification Start Date,Clarification End Date,Bid Submission Start Date,Bid Submission End Date,Financial Bid Opening Date,EMD Amount in ₹,EMD Exemption Allowed,EMD Fee Type,EMD Percentage,EMD Payable To,EMD Payable At,S.No,Bank Name,Tender Fee in ₹,VAT Charges in ₹,Fee Payable To,Fee Payable At,Tender Fee Exemption Allowed,Name,Address,Title,Work Description,Pre Qualification Details,Independent External Monitor/Remarks,Tender Value in ₹,Product Category,Sub category,Contract Type,Bid Validity(Days),Period Of Work(Days),Location,Pincode,Pre Bid Meeting Place,Pre Bid Meeting Address,Pre Bid Meeting Date,Bid Opening Place,Should Allow NDA Tender,Allow Preferential Bidder,Tender Stage,Contract Date :,Contract Value :,Work Completion Period in days :,Updated By :,Updated on :,AOC document :,AOC Description :,S.No,Bid Number,Bidder Name,Awarded Currency,Awarded Value,S.No.1,Bid Number.1,Bidder Name.1,Submitted Date,Status,Remarks,Status Updated On,Type :,Summary :,Updated By :.1,Updated On :,Document :,BOQ Comparative Chart :,Committee Chairperson/Co-ordinator Name :,Committee Chairperson/Co-ordinator Type :,Committee Members :,Updated By :.2,Updated on :.1,Document :.1,Organisation Chain :,Tender ID :,Tender Ref No :,Tender Title :,Type :.1,Summary :.1,Updated By :.3,Updated On :.1,Document :.2,Committee Chairperson/Co-ordinator Name :.1,Committee Chairperson/Co-ordinator Type :.1,Committee Members :.1,Updated By :.4,Updated On :.2,Financial Bid Opening Date:,Document :.3,Tender Stage
EIC-CIVIL,CE-DPI AND R-18 / 2023-24,2023_EICCL_92458_11,Yes,Open Tender,Percentage,Works,2.0,No,No,Online,No,No,No,1.0,Fee/PreQual/Technical,.pdf,"Online proof copy of Tender Cost, Bid Security, GSTIN, PAN, RC and Affidavit",17-Aug-2023 12:30 PM,01-Sep-2023 11:00 AM,17-Aug-2023 12:30 PM,31-Aug-2023 05:30 PM,NA ,NA ,17-Aug-2023 12:30 PM,31-Aug-2023 05:30 PM,22-Dec-2023 11:30 AM,"22,21,000",Yes,fixed,,Nil,Nil,1.0,ICICI BANK,"10,000",0.0,Nil,Nil,No,"Chief Engineer, DPI and Roads, Odisha","Office of the E.I.C. Civil, Odisha, Nirman Soudha, New Building, Unit-V, Bhubaneswar.","Improvement of Manamunda- Kantamal- Ghantapada- Sindhiguda road (SH-41) from Ch.0/000 km to 0/900 km, 5/650 km to 36/280 km, 41/600 km to 55/670 Km (except 19/650 km to 24/480 km, 30/200 km to 36/280 km, 49/000 km to 51/420 km) in the district of Bou","Improvement of Manamunda- Kantamal- Ghantapada- Sindhiguda road (SH-41) from Ch.0/000 km to 0/900 km, 5/650 km to 36/280 km, 41/600 km to 55/670 Km (except 19/650 km to 24/480 km, 30/200 km to 36/280 km, 49/000 km to 51/420 km) in the district of Bou",Please refer Tender documents. ,NA ,"22,21,26,668",Civil Works - Roads,NA ,Tender,90.0,480.0,Boudh Dist,751001.0,NA ,NA ,NA ,"O/o the E.I.C. Civil, Odisha, Bhubaneswar",No ,No,AOC,20-Apr-2024,"INR 188,829,880",480.0,Pradipta Kumar Nayak,20-Apr-2024 01:54 PM,Manamunda_Kantamal.pdf (263.00 KB),841P1 of 2023-24,1.0,2220938.0,SRINIBASH MISHRA,INR,"188,829,880",1,2223760,BKD INFRASTRUCTURE PRIVATE LIMITED,30-Aug-2023 06:47 PM,Rejected-AOC,L2 bidder,20-Apr-2024 01:54 PM,Finance,Finance opening,Pradipta Kumar Nayak,22-Dec-2023 12:13 PM,,BOQ Comparative Chart,CE DPI and R Odisha,Internal,,Pradipta Kumar Nayak,20-Apr-2024 01:50 PM,finsummary_448953.pdf (262.99 KB),EIC-CIVIL,2023_EICCL_92458_11,CE-DPI AND R-18 / 2023-24,"Improvement of Manamunda- Kantamal- Ghantapada- Sindhiguda road (SH-41) from Ch.0/000 km to 0/900 km, 5/650 km to 36/280 km, 41/600 km to 55/670 Km (except 19/650 km to 24/480 km, 30/200 km to 36/280 km, 49/000 km to 51/420 km) in the district of Bou",Technical,Technical Bid Opened,Siba Prasad Panigrahy,01-Sep-2023 01:12 PM,,EIC Civil Odisha,Internal,,Pradipta Kumar Nayak,19-Dec-2023 12:32 PM,22-Dec-2023 11:30 AM,techsummary_448953.pdf (1214.39 KB),AOC
,,,,,,,,,,,,,,,,.pdf,Machineries and work experience,,,,,,,,,,,,,,,,2.0,ICICI NEFT/RTGS,,,,,,,,,,,,,,,,,,,,,,,,,,AOC,,,,,,,,,,,,,2,2218421,Orient Constructions Pvt. Ltd.,30-Aug-2023 07:15 PM,Rejected-Technical,Non-responsive,19-Dec-2023 12:32 PM,,,,,,,,,,,,,,,,,,,,,,,,,,,,,AOC
,,,,,,,,,,,,,,,,.pdf,Other related documents as per DTCN,,,,,,,,,,,,,,,,,,,,,,,,,,,,,,,,,,,,,,,,,,,AOC,,,,,,,,,,,,,3,2219658,R S Infrastructure,31-Aug-2023 06:39 AM,Rejected-Technical,Non-responsive,19-Dec-2023 12:32 PM,,,,,,,,,,,,,,,,,,,,,,,,,,,,,AOC
,,,,,,,,,,,,,,2.0,Finance,.xls,Bill of quantities,,,,,,,,,,,,,,,,,,,,,,,,,,,,,,,,,,,,,,,,,,,AOC,,,,,,,,,,,,,4,2217132,Sribanta Kumar Mishra,30-Aug-2023 06:29 AM,Rejected-Technical,Non-responsive,19-Dec-2023 12:32 PM,,,,,,,,,,,,,,,,,,,,,,,,,,,,,AOC
,,,,,,,,,,,,,,,,,,,,,,,,,,,,,,,,,,,,,,,,,,,,,,,,,,,,,,,,,,,,AOC,,,,,,,,,,,,,5,2220938,SRINIBASH MISHRA,31-Aug-2023 12:35 PM,Accepted-AOC,L1 bidder,20-Apr-2024 01:54 PM,,,,,,,,,,,,,,,,,,,,,,,,,,,,,AOC
