Organisation Chain,Tender Reference Number,Tender ID,Withdrawal Allowed,Tender Type,Form of contract,Tender Category,No. of Covers,General Technical Evaluation Allowed,ItemWise Technical Evaluation Allowed,Payment Mode,Is Multi Currency Allowed For BOQ,Is Multi Currency Allowed For Fee,Allow Two Stage Bidding,Cover No,Cover,Document Type,Description,Publish Date,Bid Opening Date,Document Download / Sale Start Date,Document Download / Sale End Date,Clarification Start Date,Clarification End Date,Bid Submission Start Date,Bid Submission End Date,Financial Bid Opening Date,EMD Amount in ₹,EMD Exemption Allowed,EMD Fee Type,EMD Percentage,EMD Payable To,EMD Payable At,S.No,Bank Name,Tender Fee in ₹,VAT Charges in ₹,Fee Payable To,Fee Payable At,Tender Fee Exemption Allowed,Name,Address,Title,Work Description,Pre Qualification Details,Independent External Monitor/Remarks,Tender Value in ₹,Product Category,Sub category,Contract Type,Bid Validity(Days),Period Of Work(Days),Location,Pincode,Pre Bid Meeting Place,Pre Bid Meeting Address,Pre Bid Meeting Date,Bid Opening Place,Should Allow NDA Tender,Allow Preferential Bidder,Tender Stage,Contract Date :,Contract Value :,Work Completion Period in days :,Updated By :,Updated on :,AOC document :,AOC Description :,S.No,Bid Number,Bidder Name,Awarded Currency,Awarded Value,S.No.1,Bid Number.1,Bidder Name.1,Submitted Date,Status,Remarks,Status Updated On,Type :,Summary :,Updated By :.1,Updated On :,Document :,BOQ Comparative Chart :,Committee Chairperson/Co-ordinator Name :,Committee Chairperson/Co-ordinator Type :,Committee Members :,Updated By :.2,Updated on :.1,Document :.1,Organisation Chain :,Tender ID :,Tender Ref No :,Tender Title :,Type :.1,Summary :.1,Updated By :.3,Updated On :.1,Document :.2,Committee Chairperson/Co-ordinator Name :.1,Committee Chairperson/Co-ordinator Type :.1,Committee Members :.1,Updated By :.4,Updated On :.2,Financial Bid Opening Date:,Document :.3,Tender Stage
EIC-CIVIL||EIC-CIVIL,CE-WBP(O)-53/2023-24,2024_EICCL_100684_2,Yes,Open Tender,Percentage,Works,2.0,No,No,Online,No,No,No,1.0,Fee/PreQual/Technical,.pdf,"Online proof copy of Tender Cost, Bid Security, GSTIN, PAN, RC and Affidavit",08-Feb-2024 10:00 AM,23-Feb-2024 11:30 AM,08-Feb-2024 10:00 AM,22-Feb-2024 05:00 PM,08-Feb-2024 10:00 AM ,20-Feb-2024 05:00 PM ,08-Feb-2024 10:00 AM,22-Feb-2024 05:00 PM,07-Mar-2024 04:00 PM,"28,78,800",Yes,fixed,,Nil,Nil,1.0,ICICI BANK,"10,000",0.0,Nil,Nil,No,"Chief Engineer (Bridges)World Bank Project, Odisha","Nirman Soudha, O/o EIC (Civil), Odisha, Bhubaneswar",Construction of ROB in Lieu of LC No.274 at Rly km 55/5-7 in between Stations Rambha Humma on Khurdha Palasa Main line in the District of Ganjam under State Plan,Construction of ROB in Lieu of LC No.274 at Rly km 55/5-7 in between Stations Rambha Humma on Khurdha Palasa Main line in the District of Ganjam under State Plan,Please refer Tender documents. ,NA ,"28,78,72,357",Civil Works - Bridges,NA ,Tender,90.0,915.0,In the District of Ganjam,751001.0,NA ,NA ,NA ,"Nirman Soudha, O/o EIC (Civil), Odisha, Bhubaneswa",No ,No,AOC,23-Sep-2024,"INR 259,113,909",915.0,Mamatamayee Pradhan,23-Sep-2024 04:19 PM,AOC_LC_274.pdf (18597.00 KB),"Agreement No.23 P1 of 2024-25 of SE, Ganjam R and B Division No.II, Berhampur",1.0,2453462.0,C P MOHANTY AND ASSOCIATES,INR,"259,113,909",1,2453689,Akshya Kumar Dash,22-Feb-2024 01:58 PM,Rejected-Technical,Disqualified,06-Mar-2024 08:05 PM,Finance,Two bidders quoted 9.99 percent less,Mamatamayee Pradhan,07-Mar-2024 04:38 PM,,BOQ Comparative Chart,"The Commissioner-cum-Secretary to Government, WD",Internal,"The CE, WBP, Odisha, FA-cum-Special Secretary to Government, WD",Prafulla Kumar Pradhan,05-Apr-2024 01:58 PM,finsummary_490721.pdf (847.93 KB),EIC-CIVIL||EIC-CIVIL,2024_EICCL_100684_2,CE-WBP(O)-53/2023-24,Construction of ROB in Lieu of LC No.274 at Rly km 55/5-7 in between Stations Rambha Humma on Khurdha Palasa Main line in the District of Ganjam under State Plan,Technical,Five bidders participated in this tender,Mamatamayee Pradhan,23-Feb-2024 03:07 PM,,"Er. M. R. Misra, EIC (Civil), Odisha",Internal,"Er. A.N Das, EIC, (I/C) CE, Bridges, WBP, Odisha, Er. P. K. Pradhan, CE (I/C) ACE, NABARD, Smt. Anita Samal, A.O",Prafulla Kumar Pradhan,06-Mar-2024 08:05 PM,07-Mar-2024 04:00 PM,techsummary_490721.pdf (10275.48 KB),AOC
,,,,,,,,,,,,,,,,.pdf,Machineries and work experience,,,,,,,,,,,,,,,,2.0,ICICI NEFT/RTGS,,,,,,,,,,,,,,,,,,,,,,,,,,AOC,,,,,,,,,,,,,2,2453256,CMRGS INFRASTRUCTURE PROJECTS LIMITED,22-Feb-2024 03:11 PM,Rejected-Finance,2nd lowest bidder,05-Apr-2024 01:58 PM,,,,,,,,,,,,,,,,,,,,,,,,,,,,,AOC
,,,,,,,,,,,,,,,,.pdf,Other related documents as per DTCN,,,,,,,,,,,,,,,,,,,,,,,,,,,,,,,,,,,,,,,,,,,AOC,,,,,,,,,,,,,3,2453462,C P MOHANTY AND ASSOCIATES,22-Feb-2024 03:55 PM,Accepted-AOC,1st lowest through transparent lottery system,23-Sep-2024 04:19 PM,,,,,,,,,,,,,,,,,,,,,,,,,,,,,AOC
,,,,,,,,,,,,,,2.0,Finance,.xls,Bill of quantities,,,,,,,,,,,,,,,,,,,,,,,,,,,,,,,,,,,,,,,,,,,AOC,,,,,,,,,,,,,4,2450472,M/s. fortune group,22-Feb-2024 03:15 PM,Rejected-Technical,Disqualified,06-Mar-2024 08:05 PM,,,,,,,,,,,,,,,,,,,,,,,,,,,,,AOC
,,,,,,,,,,,,,,,,,,,,,,,,,,,,,,,,,,,,,,,,,,,,,,,,,,,,,,,,,,,,AOC,,,,,,,,,,,,,5,2440148,RAJLAXMI CONSTRUCTIONS LIMITED,21-Feb-2024 07:26 PM,Rejected-AOC,1stlowest,23-Sep-2024 04:19 PM,,,,,,,,,,,,,,,,,,,,,,,,,,,,,AOC
