Organisation Chain,Tender Reference Number,Tender ID,Withdrawal Allowed,Tender Type,Form of contract,Tender Category,No. of Covers,General Technical Evaluation Allowed,ItemWise Technical Evaluation Allowed,Payment Mode,Is Multi Currency Allowed For BOQ,Is Multi Currency Allowed For Fee,Allow Two Stage Bidding,Cover No,Cover,Document Type,Description,Publish Date,Bid Opening Date,Document Download / Sale Start Date,Document Download / Sale End Date,Clarification Start Date,Clarification End Date,Bid Submission Start Date,Bid Submission End Date,EMD Amount in ₹,EMD Exemption Allowed,EMD Fee Type,EMD Percentage,EMD Payable To,EMD Payable At,S.No,Bank Name,Tender Fee in ₹,Fee Payable To,Fee Payable At,Tender Fee Exemption Allowed,Name,Address,Title,Work Description,Pre Qualification Details,Independent External Monitor/Remarks,Tender Value in ₹,Product Category,Sub category,Contract Type,Bid Validity(Days),Period Of Work(Days),Location,Pincode,Pre Bid Meeting Place,Pre Bid Meeting Address,Pre Bid Meeting Date,Bid Opening Place,Should Allow NDA Tender,Allow Preferential Bidder,Tender Stage,Contract Date :,Contract Value :,Work Completion Period in days :,Updated By :,Updated on :,AOC document :,AOC Description :,S.No,Bid Number,Bidder Name,Awarded Currency,Awarded Value,S.No.1,Bid Number.1,Bidder Name.1,Submitted Date,Status,Remarks,Status Updated On,Type :,Summary :,Updated By :.1,Updated On :,Document :,BOQ Comparative Chart :,Committee Chairperson/Co-ordinator Name :,Committee Chairperson/Co-ordinator Type :,Committee Members :,Updated By :.2,Updated on :.1,Document :.1,Organisation Chain :,Tender ID :,Tender Ref No :,Tender Title :,Committee Chairperson/Co-ordinator Name :.1,Committee Chairperson/Co-ordinator Type :.1,Committee Members :.1,Updated By :.3,Updated On :.1,Document :.2,Tender Stage
CE AND BM MBBS CHANDIKOLE||EASTERN CIRCLE II CHANDIKOLE,e-Procurement Notice No.KID-04 of 2023-24,2024_ECCHA_100349_65,Yes,Open Tender,Percentage,Works,1.0,No,No,Online,No,No,No,1.0,Fee/PreQual/Technical/Finance,.pdf,"GSTIN, PAN, Contractor Registration Certificate",01-Feb-2024 10:00 AM,13-Feb-2024 11:00 AM,01-Feb-2024 10:00 AM,12-Feb-2024 05:00 PM,01-Feb-2024 10:00 AM ,07-Feb-2024 05:00 PM ,01-Feb-2024 10:00 AM,12-Feb-2024 05:00 PM,"8,500",Yes,fixed,,Nil,Nil,1.0,ICICI BANK,"4,000",Nil,Nil,No,Superintending Engineer,"O/o the SE, Kendrapara Irr. Division, Kendrapara",KID-113 of 2023-24 Improvement to service road on right bank of disty.no.11 D from RD 00 to 500 M and disty.no.11 from RD 11.60 to 11.650 Km of K.Canal.,Improvement to service road,Please refer Tender documents. ,NA ,"8,47,551",Civil Works - Roads,NA ,Tender,90.0,90.0,Kendrapara,754211.0,NA ,NA ,NA ,"O/o the SE, Kendrapara Irr. Division, Kendrapara",No ,No,AOC,25-Sep-2024,"INR 841,194",90.0,Umesh Chandra Sethi,25-Sep-2024 04:50 PM,113.pdf (538.00 KB),Contract Awarded,1.0,2434745.0,NALINI KANTA SETHY,INR,"841,194",1,2433257,Ashis Kumar Shome,11-Feb-2024 07:22 PM,Rejected-Technical,Does not satisfy the criteria,27-Mar-2024 02:25 PM,Finance,Tender documents of all the bidders have been downloaded successfully.,Umesh Chandra Sethi,13-Feb-2024 02:23 PM,finance_488814.pdf,BOQ Comparative Chart,"Superintending Engineer, Kendrapara Irrigation Division",Internal,"Estimator and DAO, Kendrapara Irrigation Division",Umesh Chandra Sethi,25-Sep-2024 04:46 PM,finsummary_488814.pdf (537.99 KB),CE AND BM MBBS CHANDIKOLE||EASTERN CIRCLE II CHANDIKOLE,2024_ECCHA_100349_65,e-Procurement Notice No.KID-04 of 2023-24,KID-113 of 2023-24 Improvement to service road on right bank of disty.no.11 D from RD 00 to 500 M and disty.no.11 from RD 11.60 to 11.650 Km of K.Canal.,"SE, Kendrapara Irrigation",Internal,"Estimator and DAO O/o the SE, Kendrapara Irrigation Division, Kendrapara",Umesh Chandra Sethi,27-Mar-2024 02:25 PM,techsummary_488814.pdf (426.49 KB),AOC
,,,,,,,,,,,,,,,,.pdf,"Affidavits, No Relation Certificate, undertakings and any other document as per SBD/DTCN",,,,,,,,,,,,,,,2.0,ICICI NEFT/RTGS,,,,,,,,,,,,,,,,,,,,,,,,,AOC,,,,,,,,,,,,,2,2434745,NALINI KANTA SETHY,12-Feb-2024 01:47 PM,Accepted-AOC,Won the lottery,25-Sep-2024 04:50 PM,,,,,,,,,,,,,,,,,,,,,,,AOC
,,,,,,,,,,,,,,,,.xls,Bill of Quantity,,,,,,,,,,,,,,,,,,,,,,,,,,,,,,,,,,,,,,,,,AOC,,,,,,,,,,,,,3,2429338,RAJ KISHORE DALAI,10-Feb-2024 02:56 PM,Rejected-Technical,Does not satisfy the criteria,27-Mar-2024 02:25 PM,,,,,,,,,,,,,,,,,,,,,,,AOC
,,,,,,,,,,,,,,,,,,,,,,,,,,,,,,,,,,,,,,,,,,,,,,,,,,,,,,,,,,AOC,,,,,,,,,,,,,4,2433914,RATIP KUMAR BHADRA,11-Feb-2024 08:09 PM,Rejected-Technical,Does not satisfy the criteria,27-Mar-2024 02:25 PM,,,,,,,,,,,,,,,,,,,,,,,AOC
,,,,,,,,,,,,,,,,,,,,,,,,,,,,,,,,,,,,,,,,,,,,,,,,,,,,,,,,,,AOC,,,,,,,,,,,,,5,2435007,SHIBANI BEHERA,12-Feb-2024 11:49 AM,Rejected-Technical,Does not satisfy the criteria,27-Mar-2024 02:25 PM,,,,,,,,,,,,,,,,,,,,,,,AOC
