Organisation Chain,Tender Reference Number,Tender ID,Withdrawal Allowed,Tender Type,Form of contract,Tender Category,No. of Covers,General Technical Evaluation Allowed,ItemWise Technical Evaluation Allowed,Payment Mode,Is Multi Currency Allowed For BOQ,Is Multi Currency Allowed For Fee,Allow Two Stage Bidding,Cover No,Cover,Document Type,Description,Publish Date,Bid Opening Date,Document Download / Sale Start Date,Document Download / Sale End Date,Clarification Start Date,Clarification End Date,Bid Submission Start Date,Bid Submission End Date,Financial Bid Opening Date,EMD Amount in ₹,EMD Exemption Allowed,EMD Fee Type,EMD Percentage,EMD Payable To,EMD Payable At,S.No,Bank Name,Tender Fee in ₹,VAT Charges in ₹,Fee Payable To,Fee Payable At,Tender Fee Exemption Allowed,Name,Address,Title,Work Description,Pre Qualification Details,Independent External Monitor/Remarks,Tender Value in ₹,Product Category,Sub category,Contract Type,Bid Validity(Days),Period Of Work(Days),Location,Pincode,Pre Bid Meeting Place,Pre Bid Meeting Address,Pre Bid Meeting Date,Bid Opening Place,Should Allow NDA Tender,Allow Preferential Bidder,Tender Stage,Contract Date :,Contract Value :,Work Completion Period in days :,Updated By :,Updated on :,AOC document :,AOC Description :,S.No,Bid Number,Bidder Name,Awarded Currency,Awarded Value,S.No.1,Bid Number.1,Bidder Name.1,Submitted Date,Status,Remarks,Status Updated On,Type :,Summary :,Updated By :.1,Updated On :,Document :,BOQ Comparative Chart :,Committee Chairperson/Co-ordinator Name :,Committee Chairperson/Co-ordinator Type :,Committee Members :,Updated By :.2,Updated on :.1,Document :.1,Organisation Chain :,Tender ID :,Tender Ref No :,Tender Title :,Type :.1,Summary :.1,Updated By :.3,Updated On :.1,Document :.2,Committee Chairperson/Co-ordinator Name :.1,Committee Chairperson/Co-ordinator Type :.1,Committee Members :.1,Updated By :.4,Updated On :.2,Financial Bid Opening Date:,Document :.3,Tender Stage
EIC-CIVIL||SERNB-CIRCLE-KEONJHAR||EERNB-DIVN-ROURKELA,Bid Id 38 of 2021-22,2021_EICCL_72936_2,Yes,Open Tender,Percentage,Works,2.0,No,No,Online,No,No,No,1.0,Fee/PreQual/Technical,.pdf,"Registration certificate, Registration in CDMS, PAN Card, GSTIN Certificate, Affidavit etc",26-Nov-2021 05:00 PM,04-Dec-2021 11:30 AM,26-Nov-2021 05:00 PM,03-Dec-2021 05:00 PM,26-Nov-2021 05:00 PM ,02-Dec-2021 05:00 PM ,26-Nov-2021 05:00 PM,03-Dec-2021 05:00 PM,28-Dec-2021 12:00 PM,0.0,No,fixed,,Nil,Nil,1.0,ICICI BANK,"10,000",0.0,Nil,Nil,No,SuperintendingEngineer Rourkela RandBDivision,OfficeofSuperintendingEngineer Rourkela RandBDivision,"Development of Govt high school, Panposh under Rourkela municipality corporation in Sundargarh district for the year 2021-22","Development of Govt high school, Panposh under Rourkela municipality corporation in Sundargarh district for the year 2021-22",Please refer Tender documents. ,NA ,"87,52,300",Civil Works - Buildings,NA ,Tender,90.0,90.0,Rourkela,769012.0,NA ,NA ,NA ,OfficeofSuperintendingEngineer Rourkela RandBDivis,No ,No,AOC,20-Sep-2024,"INR 7,877,873",90.0,Manoj Kumar Mahananda,20-Sep-2024 01:54 PM,RMCPanposh.pdf (1258.00 KB),Agmt drawn and Work order issued,1.0,1721038.0,PURNIMA ROUT,INR,"7,877,873",1.0,1721038.0,PURNIMA ROUT,03-Dec-2021 02:16 PM,Accepted-AOC,Qualified in the Lottery,20-Sep-2024 01:54 PM,Finance,All the two bidders qualified in the Technical Evaluation,Manoj Kumar Mahananda,20-Sep-2024 01:45 PM,finance_375416.pdf,BOQ Comparative Chart,M K Mahananda,Internal,HS Meena SrDAO Rourkela R and B Division P p parida estimator Rourkela R and B Division,Manoj Kumar Mahananda,20-Sep-2024 01:49 PM,finsummary_375416.pdf (1258.41 KB),EIC-CIVIL||SERNB-CIRCLE-KEONJHAR||EERNB-DIVN-ROURKELA,2021_EICCL_72936_2,Bid Id 38 of 2021-22,"Development of Govt high school, Panposh under Rourkela municipality corporation in Sundargarh district for the year 2021-22",Technical,All bidder are qualified in technical evaluation,Manoj Kumar Mahananda,27-Dec-2021 06:52 PM,technical_375416.pdf,M K Mahananda SE rourkela r and b division,Internal,BKumar SrDAO Rourkela R and B Division P p parida estimator Rourkela R and B Division,Manoj Kumar Mahananda,27-Dec-2021 06:54 PM,28-Dec-2021 12:00 PM,techsummary_375416.pdf (193.39 KB),AOC
,,,,,,,,,,,,,,,,.pdf,"Financial instruments such as cost of tender paper, EMD, Affidavit etc",,,,,,,,,,,,,,,,2.0,ICICI NEFT/RTGS,,,,,,,,,,,,,,,,,,,,,,,,,,AOC,,,,,,,,,,,,,2.0,1720294.0,S SUVENDU,03-Dec-2021 01:29 AM,Rejected-AOC,Not Qualified in the Lottery,20-Sep-2024 01:54 PM,,,,,,,,,,,,,,,,,,,,,,,,,,,,,AOC
,,,,,,,,,,,,,,,,.pdf,"Experience Certificate, List of Machinaries,Lease Deeds , MOU with electrical contractor Affidavit e",,,,,,,,,,,,,,,,,,,,,,,,,,,,,,,,,,,,,,,,,,,AOC,,,,,,,,,,,,,,,,,,,,,,,,,,,,,,,,,,,,,,,,,,,,,,,,AOC
,,,,,,,,,,,,,,,,.pdf,"No Relation Certificate, Schedule-E, Schedule-F, Affidavit etc",,,,,,,,,,,,,,,,,,,,,,,,,,,,,,,,,,,,,,,,,,,AOC,,,,,,,,,,,,,,,,,,,,,,,,,,,,,,,,,,,,,,,,,,,,,,,,AOC
,,,,,,,,,,,,,,2.0,Finance,.xls,BOQ,,,,,,,,,,,,,,,,,,,,,,,,,,,,,,,,,,,,,,,,,,,AOC,,,,,,,,,,,,,,,,,,,,,,,,,,,,,,,,,,,,,,,,,,,,,,,,AOC
