Organisation Chain,Tender Reference Number,Tender ID,Withdrawal Allowed,Tender Type,Form of contract,Tender Category,No. of Covers,General Technical Evaluation Allowed,ItemWise Technical Evaluation Allowed,Payment Mode,Is Multi Currency Allowed For BOQ,Is Multi Currency Allowed For Fee,Allow Two Stage Bidding,Cover No,Cover,Document Type,Description,Publish Date,Bid Opening Date,Document Download / Sale Start Date,Document Download / Sale End Date,Clarification Start Date,Clarification End Date,Bid Submission Start Date,Bid Submission End Date,Financial Bid Opening Date,EMD Amount in ₹,EMD Exemption Allowed,EMD Fee Type,EMD Percentage,EMD Payable To,EMD Payable At,S.No,Bank Name,Tender Fee in ₹,VAT Charges in ₹,Fee Payable To,Fee Payable At,Tender Fee Exemption Allowed,Name,Address,Title,Work Description,Pre Qualification Details,Independent External Monitor/Remarks,Tender Value in ₹,Product Category,Sub category,Contract Type,Bid Validity(Days),Period Of Work(Days),Location,Pincode,Pre Bid Meeting Place,Pre Bid Meeting Address,Pre Bid Meeting Date,Bid Opening Place,Should Allow NDA Tender,Allow Preferential Bidder,Tender Stage,Contract Date :,Contract Value :,Work Completion Period in days :,Updated By :,Updated on :,AOC document :,AOC Description :,S.No,Bid Number,Bidder Name,Awarded Currency,Awarded Value,S.No.1,Bid Number.1,Bidder Name.1,Submitted Date,Status,Remarks,Status Updated On,Type :,Summary :,Updated By :.1,Updated On :,Document :,BOQ Comparative Chart :,Committee Chairperson/Co-ordinator Name :,Committee Chairperson/Co-ordinator Type :,Committee Members :,Updated By :.2,Updated on :.1,Document :.1,Organisation Chain :,Tender ID :,Tender Ref No :,Tender Title :,Type :.1,Summary :.1,Updated By :.3,Updated On :.1,Document :.2,Committee Chairperson/Co-ordinator Name :.1,Committee Chairperson/Co-ordinator Type :.1,Committee Members :.1,Updated By :.4,Updated On :.2,Financial Bid Opening Date:,Document :.3,Tender Stage
CE RW I||RWCIRCLE-CUTTACK,Tender Online RWC - 09/24,2024_CERWI_102990_5,Yes,National Competitive Bid,Percentage,Works,2.0,No,No,Online,No,No,No,1.0,Fee/PreQual/Technical,.pdf,"TenderPaperCost,EMD,GSTIN,RC,PAN,RegistrationCertificate,LaborLicense,No Relationship,Electrical lic",04-Apr-2024 06:55 PM,20-Apr-2024 11:00 AM,04-Apr-2024 06:55 PM,19-Apr-2024 05:00 PM,04-Apr-2024 06:55 PM ,19-Apr-2024 03:00 PM ,04-Apr-2024 06:55 PM,19-Apr-2024 05:00 PM,18-Jun-2024 05:30 PM,"3,04,829",Yes,percentage,1.0%,Nil,Nil,1.0,ICICI BANK,"10,000",0.0,Nil,Nil,No,CCERW Circle Cuttack,CCERW Circle Cuttack,Construction of Multipurpose Cyclone Shelter MCS at Khurantutha Kalikuda Kunjakothi G.P. Erasama block in the dist of Jagatsinghpur for the year 2023-24,Building works,Please refer Tender documents. ,NA ,"3,04,82,900",Civil Works - Buildings,NA ,Tender,90.0,450.0,JAGATSINGHPUR,754104.0,NA ,NA ,NA ,CCERW Circle Cuttack,No ,No,AOC,23-Sep-2024,"INR 27,437,627.6",450.0,Ajay Kumar Behera,23-Sep-2024 12:44 PM,6545.pdf (971.00 KB),Agmt drawn,1.0,2491572.0,TAPAS KUMAR JENA,INR,"27,437,627.6",1,2491797,BICHITRA KUMAR JENA,18-Apr-2024 07:46 PM,Rejected-Finance,Unsuccessful bidder,05-Aug-2024 02:10 PM,Finance,total 4 nos document downloaded,SOMANATHA PARIDA,18-Jun-2024 06:33 PM,,BOQ Comparative Chart,"C.C.E.R.W. Circle, Cuttack",Internal,"SERWDIVISION, CUTTACK DAO RW DIVISION JAGATSINGHPUR PA TO CCE",Ajay Kumar Behera,05-Aug-2024 02:10 PM,finsummary_500891.pdf (364.21 KB),CE RW I||RWCIRCLE-CUTTACK,2024_CERWI_102990_5,Tender Online RWC - 09/24,Construction of Multipurpose Cyclone Shelter MCS at Khurantutha Kalikuda Kunjakothi G.P. Erasama block in the dist of Jagatsinghpur for the year 2023-24,Technical,total 5 nos document downloaded,SOMANATHA PARIDA,20-Apr-2024 01:36 PM,,"C.C.E.R.W. Circle, Cuttack",Internal,"SERWDIVISION, CUTTACK DAO RW DIVISION JAGATSINGHPUR PA TO CCE",Ajay Kumar Behera,12-Jun-2024 01:05 PM,18-Jun-2024 05:30 PM,techsummary_500891.pdf (2359.92 KB),AOC
,,,,,,,,,,,,,,,,.pdf,"Affidavit of Correctness Certificate undertaking duly filled, all affidavits",,,,,,,,,,,,,,,,2.0,ICICI NEFT/RTGS,,,,,,,,,,,,,,,,,,,,,,,,,,AOC,,,,,,,,2.0,2492051.0,SAMRAT KALINGA KESHARI SWAIN,INR,"31,680,842.54",2,2492121,KULAMANI NAYAK,19-Apr-2024 03:20 PM,Rejected-Technical,Disqualified as per Clause no. 1 (c) eligibility criteria of the DTCN,12-Jun-2024 01:05 PM,,,,,,,,,,,,,,,,,,,,,,,,,,,,,AOC
,,,,,,,,,,,,,,,,.pdf,"A.T.O from CA, Similar Nature of Work Experience Certificate, Work in Hand as per DTCN",,,,,,,,,,,,,,,,,,,,,,,,,,,,,,,,,,,,,,,,,,,AOC,,,,,,,,3.0,2492070.0,M/S TARACHANDA MOHANTY,INR,"31,851,546.59",3,2492070,M/S TARACHANDA MOHANTY,19-Apr-2024 10:12 AM,Accepted-AOC,Unsuccessful bidder,23-Sep-2024 12:44 PM,,,,,,,,,,,,,,,,,,,,,,,,,,,,,AOC
,,,,,,,,,,,,,,2.0,Finance,.xls,Bill of Quantity,,,,,,,,,,,,,,,,,,,,,,,,,,,,,,,,,,,,,,,,,,,AOC,,,,,,,,,,,,,4,2492051,SAMRAT KALINGA KESHARI SWAIN,19-Apr-2024 09:51 AM,Accepted-AOC,Unsuccessful bidder,23-Sep-2024 12:44 PM,,,,,,,,,,,,,,,,,,,,,,,,,,,,,AOC
,,,,,,,,,,,,,,,,,,,,,,,,,,,,,,,,,,,,,,,,,,,,,,,,,,,,,,,,,,,,AOC,,,,,,,,,,,,,5,2491572,TAPAS KUMAR JENA,15-Apr-2024 12:58 PM,Accepted-AOC,Successful bidder,23-Sep-2024 12:44 PM,,,,,,,,,,,,,,,,,,,,,,,,,,,,,AOC
