Organisation Chain,Tender Reference Number,Tender ID,Withdrawal Allowed,Tender Type,Form of contract,Tender Category,No. of Covers,General Technical Evaluation Allowed,ItemWise Technical Evaluation Allowed,Payment Mode,Is Multi Currency Allowed For BOQ,Is Multi Currency Allowed For Fee,Allow Two Stage Bidding,Cover No,Cover,Document Type,Description,Publish Date,Bid Opening Date,Document Download / Sale Start Date,Document Download / Sale End Date,Clarification Start Date,Clarification End Date,Bid Submission Start Date,Bid Submission End Date,Financial Bid Opening Date,EMD Amount in ₹,EMD Exemption Allowed,EMD Fee Type,EMD Percentage,EMD Payable To,EMD Payable At,S.No,Bank Name,Tender Fee in ₹,VAT Charges in ₹,Fee Payable To,Fee Payable At,Tender Fee Exemption Allowed,Name,Address,Title,Work Description,Pre Qualification Details,Independent External Monitor/Remarks,Tender Value in ₹,Product Category,Sub category,Contract Type,Bid Validity(Days),Period Of Work(Days),Location,Pincode,Pre Bid Meeting Place,Pre Bid Meeting Address,Pre Bid Meeting Date,Bid Opening Place,Should Allow NDA Tender,Allow Preferential Bidder,Tender Stage,Contract Date :,Contract Value :,Work Completion Period in days :,Updated By :,Updated on :,AOC document :,S.No,Bid Number,Bidder Name,Awarded Currency,Awarded Value,S.No.1,Bid Number.1,Bidder Name.1,Submitted Date,Status,Remarks,Status Updated On,Type :,Summary :,Updated By :.1,Updated On :,Document :,BOQ Comparative Chart :,Committee Chairperson/Co-ordinator Name :,Committee Chairperson/Co-ordinator Type :,Committee Members :,Updated By :.2,Updated on :.1,Document :.1,Organisation Chain :,Tender ID :,Tender Ref No :,Tender Title :,Type :.1,Summary :.1,Updated By :.3,Updated On :.1,Document :.2,Committee Chairperson/Co-ordinator Name :.1,Committee Chairperson/Co-ordinator Type :.1,Committee Members :.1,Updated By :.4,Updated On :.2,Financial Bid Opening Date:,Document :.3,Tender Stage
Municipal Bodies||Remuna NAC,RN_05_2023-24,2023_ORULB_97230_1,Yes,Open Tender,Percentage,Works,2.0,No,No,Online,No,No,No,1.0,Fee/PreQual/Technical,.pdf,dtcn,20-Nov-2023 10:00 AM,30-Nov-2023 03:00 PM,20-Nov-2023 10:00 AM,29-Nov-2023 05:00 PM,20-Nov-2023 10:00 AM ,29-Nov-2023 05:00 PM ,20-Nov-2023 10:00 AM,29-Nov-2023 05:00 PM,27-Dec-2023 11:00 AM,"67,547",Yes,percentage,1.0%,Nil,Nil,1.0,ICICI BANK,"10,000",0.0,Nil,Nil,No,EXECUTIVE OFFICER,REMUNA NAC,Construction of 5TPD Capacity of Micro Composting Center at Naraharipur near SeTP in ward no-8 under Remuna NAC,Construction of 5TPD Capacity of Micro Composting Center at Naraharipur near SeTP in ward no-8 under Remuna NAC,building  ,NA ,"67,54,738",Civil Works - Buildings,NA ,Tender,90.0,3.0,REMUNA NAC,756019.0,NA ,NA ,NA ,REMUNA NAC,No ,No,AOC,11-Sep-2024,"INR 6,753,883",90.0,Siva Sankar Giri,11-Sep-2024 11:02 AM,workordermcc.pdf (462.00 KB),1.0,2334707.0,SUDHIR KUMAR MOHALIK,INR,"6,079,170",1,2336616,ARATIMANI DAS,29-Nov-2023 04:10 PM,Not Admitted-Fee/PreQual/Technical,Others-Not obtained the qualification marks (minimum 80 marks) for plants and equipments,26-Dec-2023 03:41 PM,Finance,there are three bidders admitted comparing the quoted by bidder Kartika Chandra pusti is lowest one .,Siva Sankar Giri,10-Sep-2024 11:04 AM,finance_474916.pdf,BOQ Comparative Chart,Tanuja Giri /Executive Officer,Internal,,Siva Sankar Giri,11-Sep-2024 10:26 AM,finsummary_474916.pdf (2563.07 KB),Municipal Bodies||Remuna NAC,2023_ORULB_97230_1,RN_05_2023-24,Construction of 5TPD Capacity of Micro Composting Center at Naraharipur near SeTP in ward no-8 under Remuna NAC,Technical,Total 6 bids are submitted and 3 bids are accepted,Siva Sankar Giri,26-Dec-2023 03:41 PM,technical_474916.pdf,Tanuja Giri,Internal,,Siva Sankar Giri,26-Dec-2023 04:36 PM,27-Dec-2023 11:00 AM,techsummary_474916.pdf (641.98 KB),AOC
,,,,,,,,,,,,,,,,.pdf,nit,,,,,,,,,,,,,,,,2.0,ICICI NEFT/RTGS,,,,,,,,,,,,,,,,,,,,,,,,,,AOC,,,,,,,,,,,,2,2339151,Bhaskar Karan,29-Nov-2023 03:57 PM,Not Admitted-Fee/PreQual/Technical,Others-Not obtained the qualified marks( minimum 80 marks) for plants and equipments,26-Dec-2023 03:41 PM,,,,,,,,,,,,,,,,,,,,,,,,,,,,,AOC
,,,,,,,,,,,,,,2.0,Finance,.xls,boq,,,,,,,,,,,,,,,,,,,,,,,,,,,,,,,,,,,,,,,,,,,AOC,,,,,,,,,,,,3,2338605,KAMALAKANTA DAS,29-Nov-2023 01:07 PM,Rejected-Finance,kamalakanta das sc contractor denied to execute the work at kartik chandra pusti quoted rate,11-Sep-2024 10:26 AM,,,,,,,,,,,,,,,,,,,,,,,,,,,,,AOC
,,,,,,,,,,,,,,,,,,,,,,,,,,,,,,,,,,,,,,,,,,,,,,,,,,,,,,,,,,,,AOC,,,,,,,,,,,,4,2336275,KARTIKA CHANDRA PUSTI,29-Nov-2023 12:38 PM,Rejected-Finance,kartik chandra pusti is L3 for general,11-Sep-2024 10:26 AM,,,,,,,,,,,,,,,,,,,,,,,,,,,,,AOC
,,,,,,,,,,,,,,,,,,,,,,,,,,,,,,,,,,,,,,,,,,,,,,,,,,,,,,,,,,,,AOC,,,,,,,,,,,,5,2336471,RABINDRA NATH TUDU,28-Nov-2023 05:22 PM,Not Admitted-Fee/PreQual/Technical,Others-Not obtained the qualification marks (minimum 80 marks) for plants and equipments,26-Dec-2023 03:41 PM,,,,,,,,,,,,,,,,,,,,,,,,,,,,,AOC
,,,,,,,,,,,,,,,,,,,,,,,,,,,,,,,,,,,,,,,,,,,,,,,,,,,,,,,,,,,,AOC,,,,,,,,,,,,6,2334707,SUDHIR KUMAR MOHALIK,29-Nov-2023 11:21 AM,Accepted-AOC,Agree to execute quoted rate of Kartik Chandra pusti,11-Sep-2024 11:03 AM,,,,,,,,,,,,,,,,,,,,,,,,,,,,,AOC
