Organisation Chain,Tender Reference Number,Tender ID,Withdrawal Allowed,Tender Type,Form of contract,Tender Category,No. of Covers,General Technical Evaluation Allowed,ItemWise Technical Evaluation Allowed,Payment Mode,Is Multi Currency Allowed For BOQ,Is Multi Currency Allowed For Fee,Allow Two Stage Bidding,Cover No,Cover,Document Type,Description,Publish Date,Bid Opening Date,Document Download / Sale Start Date,Document Download / Sale End Date,Clarification Start Date,Clarification End Date,Bid Submission Start Date,Bid Submission End Date,Financial Bid Opening Date,EMD Amount in ₹,EMD Exemption Allowed,EMD Fee Type,EMD Percentage,EMD Payable To,EMD Payable At,S.No,Bank Name,Tender Fee in ₹,VAT Charges in ₹,Fee Payable To,Fee Payable At,Tender Fee Exemption Allowed,Name,Address,Title,Work Description,Pre Qualification Details,Independent External Monitor/Remarks,Tender Value in ₹,Product Category,Sub category,Contract Type,Bid Validity(Days),Period Of Work(Days),Location,Pincode,Pre Bid Meeting Place,Pre Bid Meeting Address,Pre Bid Meeting Date,Bid Opening Place,Should Allow NDA Tender,Allow Preferential Bidder,Tender Stage,Contract Date :,Contract Value :,Work Completion Period in days :,Updated By :,Updated on :,AOC document :,AOC Description :,S.No,Bid Number,Bidder Name,Awarded Currency,Awarded Value,S.No.1,Bid Number.1,Bidder Name.1,Submitted Date,Status,Remarks,Status Updated On,Type :,Summary :,Updated By :.1,Updated On :,Document :,BOQ Comparative Chart :,Committee Chairperson/Co-ordinator Name :,Committee Chairperson/Co-ordinator Type :,Committee Members :,Updated By :.2,Updated on :.1,Document :.1,Organisation Chain :,Tender ID :,Tender Ref No :,Tender Title :,Type :.1,Summary :.1,Updated By :.3,Updated On :.1,Document :.2,Committee Chairperson/Co-ordinator Name :.1,Committee Chairperson/Co-ordinator Type :.1,Committee Members :.1,Updated By :.4,Updated On :.2,Financial Bid Opening Date:,Document :.3,Tender Stage
EIC-CIVIL||SERNB-CIRCLE-DHENKANAL,CCE DKL R and B/20-2021-22,2022_EICCL_76297_4,Yes,Open Tender,Percentage,Works,2.0,No,No,Online,No,No,No,1.0,Fee/PreQual/Technical,.pdf,"GSTIN, EMD Declaration, PAN, Valid RC",11-Mar-2022 06:00 PM,28-Mar-2022 11:30 AM,11-Mar-2022 06:00 PM,25-Mar-2022 05:30 PM,11-Mar-2022 06:00 PM ,25-Mar-2022 05:30 PM ,11-Mar-2022 06:00 PM,25-Mar-2022 05:30 PM,11-Apr-2022 11:00 AM,0.0,No,fixed,,Nil,Nil,1.0,ICICI BANK,"10,000",0.0,Nil,Nil,No,CCE Dhenkanal R and B Circle Dhenkanal,CCE Dhenkanal R and B Circle Dhenkanal,Construction of 1st floor of Hostel Building of HMV driving training institute at chhatia for the year 2021-22,Construction of 1st floor of Hostel Building of HMV driving training institute at chhatia for the year 2021-22,Please refer Tender documents ,NA ,"1,62,57,239",Civil Works - Buildings,NA ,Tender,90.0,180.0,Choudwar,754025.0,NA ,NA ,NA ,CCE Dhenkanal R and B Circle Dhenkanal,No ,No,AOC,15-Sep-2024,"INR 16,257,238.82",180.0,Ashok Kumar Giri,15-Sep-2024 09:21 PM,HMV_Driving_Testing.pdf (257.00 KB),Agreement on dt. 20.08.2022,1.0,1815890.0,PREMSAI CONSTRUCTION,INR,"15,280,179",1,1816261,ANIL KUMAR DAS,25-Mar-2022 04:43 PM,Rejected-AOC,"Premsai Construction, being as ST bidder negotiate his quoted rate and stand 1st lowest",15-Sep-2024 09:21 PM,Finance,Opened,Ashok Kumar Giri,11-Apr-2022 11:56 AM,finance_393867.pdf,BOQ Comparative Chart,CCE Dhenkanal Circle,Internal,SE Charbatia Sr DAO Charbatia Estr Charbatia Division PA to CCE Dhenkanal Circle Estr Dhenkanal Circle,Ashok Kumar Giri,15-Sep-2024 09:12 PM,finsummary_393867.pdf (158.13 KB),EIC-CIVIL||SERNB-CIRCLE-DHENKANAL,2022_EICCL_76297_4,CCE DKL R and B/20-2021-22,Construction of 1st floor of Hostel Building of HMV driving training institute at chhatia for the year 2021-22,Technical,Opened,Lopamudra Priyadarsini,28-Mar-2022 09:35 PM,technical_393867.pdf,Ashok Kumar Giri,Internal,PK Mohanty MR Bal S Singh HK Rout,Ashok Kumar Giri,08-Apr-2022 01:49 PM,11-Apr-2022 11:00 AM,techsummary_393867.pdf (978.47 KB),AOC
,,,,,,,,,,,,,,,,.pdf,"Affidavit, Machineries and other documents as per DTCN",,,,,,,,,,,,,,,,2.0,ICICI NEFT/RTGS,,,,,,,,,,,,,,,,,,,,,,,,,,AOC,,,,,,,,,,,,,2,1815684,HARA GOPAL PATRO,24-Mar-2022 05:34 PM,Rejected-AOC,"Premsai Construction, being as ST bidder negotiate his quoted rate and stand 1st lowest",15-Sep-2024 09:21 PM,,,,,,,,,,,,,,,,,,,,,,,,,,,,,AOC
,,,,,,,,,,,,,,2.0,Finance,.xls,Bill of Quantity,,,,,,,,,,,,,,,,,,,,,,,,,,,,,,,,,,,,,,,,,,,AOC,,,,,,,,,,,,,3,1815890,PREMSAI CONSTRUCTION,24-Mar-2022 09:05 PM,Accepted-AOC,"Being as ST bidder he availed price preference, stand 1st lowest and work has been awarded",15-Sep-2024 09:21 PM,,,,,,,,,,,,,,,,,,,,,,,,,,,,,AOC
,,,,,,,,,,,,,,,,,,,,,,,,,,,,,,,,,,,,,,,,,,,,,,,,,,,,,,,,,,,,AOC,,,,,,,,,,,,,4,1815994,SHAMIMA KHATUN,25-Mar-2022 12:04 PM,Rejected-AOC,"Premsai Construction, being as ST bidder negotiate his quoted rate and stand 1st lowest",15-Sep-2024 09:21 PM,,,,,,,,,,,,,,,,,,,,,,,,,,,,,AOC
,,,,,,,,,,,,,,,,,,,,,,,,,,,,,,,,,,,,,,,,,,,,,,,,,,,,,,,,,,,,AOC,,,,,,,,,,,,,5,1815902,SUSANTA SETHY,24-Mar-2022 11:01 PM,Rejected-AOC,"Premsai Construction, being as ST bidder negotiate his quoted rate and stand 1st lowest",15-Sep-2024 09:21 PM,,,,,,,,,,,,,,,,,,,,,,,,,,,,,AOC
,,,,,,,,,,,,,,,,,,,,,,,,,,,,,,,,,,,,,,,,,,,,,,,,,,,,,,,,,,,,AOC,,,,,,,,,,,,,6,1816280,TANULATA SETHY,25-Mar-2022 05:14 PM,Rejected-Technical,Not secure qualifying mark in respect of T and P,08-Apr-2022 01:49 PM,,,,,,,,,,,,,,,,,,,,,,,,,,,,,AOC
