Organisation Chain,Tender Reference Number,Tender ID,Withdrawal Allowed,Tender Type,Form of contract,Tender Category,No. of Covers,General Technical Evaluation Allowed,ItemWise Technical Evaluation Allowed,Payment Mode,Is Multi Currency Allowed For BOQ,Is Multi Currency Allowed For Fee,Allow Two Stage Bidding,Cover No,Cover,Document Type,Description,Publish Date,Bid Opening Date,Document Download / Sale Start Date,Document Download / Sale End Date,Clarification Start Date,Clarification End Date,Bid Submission Start Date,Bid Submission End Date,Financial Bid Opening Date,EMD Amount in ₹,EMD Exemption Allowed,EMD Fee Type,EMD Percentage,EMD Payable To,EMD Payable At,S.No,Bank Name,Tender Fee in ₹,VAT Charges in ₹,Fee Payable To,Fee Payable At,Tender Fee Exemption Allowed,Name,Address,Title,Work Description,Pre Qualification Details,Independent External Monitor/Remarks,Tender Value in ₹,Product Category,Sub category,Contract Type,Bid Validity(Days),Period Of Work(Days),Location,Pincode,Pre Bid Meeting Place,Pre Bid Meeting Address,Pre Bid Meeting Date,Bid Opening Place,Should Allow NDA Tender,Allow Preferential Bidder,Tender Stage,Contract Date :,Contract Value :,Work Completion Period in days :,Updated By :,Updated on :,AOC document :,AOC Description :,S.No,Bid Number,Bidder Name,Awarded Currency,Awarded Value,S.No.1,Bid Number.1,Bidder Name.1,Submitted Date,Status,Remarks,Status Updated On,Type :,Summary :,Updated By :.1,Updated On :,Document :,BOQ Comparative Chart :,Committee Chairperson/Co-ordinator Name :,Committee Chairperson/Co-ordinator Type :,Committee Members :,Updated By :.2,Updated on :.1,Document :.1,Organisation Chain :,Tender ID :,Tender Ref No :,Tender Title :,Type :.1,Summary :.1,Updated By :.3,Updated On :.1,Document :.2,Committee Chairperson/Co-ordinator Name :.1,Committee Chairperson/Co-ordinator Type :.1,Committee Members :.1,Updated By :.4,Updated On :.2,Financial Bid Opening Date:,Document :.3,Tender Stage
CE RW I||RWCIRCLE-KENDRAPARA,Tender Online RCK-12/24,2024_CERWI_102754_3,Yes,National Competitive Bid,Percentage,Works,2.0,No,No,Online,No,No,No,1.0,Fee/PreQual/Technical,.pdf,"Tender Paper Cost, EMD, GSTIN, PAN, Registration Certificate, Labor License",21-Mar-2024 04:20 PM,28-Mar-2024 11:30 AM,21-Mar-2024 04:20 PM,27-Mar-2024 05:00 PM,21-Mar-2024 04:20 PM ,22-Mar-2024 02:00 PM ,21-Mar-2024 04:20 PM,27-Mar-2024 05:00 PM,18-Jun-2024 01:30 PM,"1,00,419",Yes,percentage,1.0%,Nil,Nil,1.0,ICICI BANK,"10,000",0.0,Nil,Nil,No,"Chief Construction Engineer,R.W Circle KPD-JJP","O/o CCE,R.W Circle,Kendrapara-Jajpur","Construction of 4 Nos E type Quarter at R.W Sub division , Chandikhole in the dist of jajpur for the year 2023-24.",Construction of Building work,Please refer tender documents ,NA ,"1,00,41,877",Civil Works - Buildings,NA ,Tender,90.0,365.0,Jajpur,755001.0,NA ,NA ,NA ,"O/o CCE,R.W Circle,Kendrapara-Jajpur",No ,No,AOC,10-Sep-2024,"INR 8,536,599",365.0,Puspanjali Behera,24-Sep-2024 02:08 PM,workorder4noqtr.pdf (74.00 KB),The work has been awarded to Chitrasen Das.,1.0,2487009.0,CHITRASEN DAS,INR,"8,536,599",1,2485928,ASHUTOSH MOHAPATRA,25-Mar-2024 09:04 PM,Rejected-Finance,L2 bidder,13-Aug-2024 01:56 PM,Finance,06 no of bidders have participated,Puspanjali Behera,18-Jun-2024 02:17 PM,,BOQ Comparative Chart,CCE,Internal,,Nibedita Nayak,13-Aug-2024 01:56 PM,finsummary_500661.pdf (116.82 KB),CE RW I||RWCIRCLE-KENDRAPARA,2024_CERWI_102754_3,Tender Online RCK-12/24,"Construction of 4 Nos E type Quarter at R.W Sub division , Chandikhole in the dist of jajpur for the year 2023-24.",Technical,06 no of bidders have participated,Nibedita Nayak,28-Mar-2024 01:35 PM,,CCE,Internal,CCE,Puspanjali Behera,12-Jun-2024 01:14 PM,18-Jun-2024 01:30 PM,techsummary_500661.pdf (620.08 KB),AOC
,,,,,,,,,,,,,,,,.pdf,"No Relationship , Affidavit of Correctness Certificate undertaking duly filled, all affidavits",,,,,,,,,,,,,,,,2.0,ICICI NEFT/RTGS,,,,,,,,,,,,,,,,,,,,,,,,,,AOC,,,,,,,,,,,,,2,2487009,CHITRASEN DAS,27-Mar-2024 01:40 PM,Accepted-AOC,The work has been awarded to Chitrasen Das.,24-Sep-2024 02:08 PM,,,,,,,,,,,,,,,,,,,,,,,,,,,,,AOC
,,,,,,,,,,,,,,,,.pdf,"ATO , Work Experience Work in Hand, Machineries and required document as per DTCN",,,,,,,,,,,,,,,,,,,,,,,,,,,,,,,,,,,,,,,,,,,AOC,,,,,,,,,,,,,3,2487292,MAHABINAYAK CONSTRUCTIONS PVT LTD,27-Mar-2024 03:30 PM,Rejected-Finance,L3 bidder,13-Aug-2024 01:56 PM,,,,,,,,,,,,,,,,,,,,,,,,,,,,,AOC
,,,,,,,,,,,,,,2.0,Finance,.xls,BOQ,,,,,,,,,,,,,,,,,,,,,,,,,,,,,,,,,,,,,,,,,,,AOC,,,,,,,,,,,,,4,2487055,PRASANNA KUMAR ROUT,27-Mar-2024 01:57 PM,Rejected-Finance,Unsuccessful bidder in lottery,13-Aug-2024 01:56 PM,,,,,,,,,,,,,,,,,,,,,,,,,,,,,AOC
,,,,,,,,,,,,,,,,,,,,,,,,,,,,,,,,,,,,,,,,,,,,,,,,,,,,,,,,,,,,AOC,,,,,,,,,,,,,5,2485937,SUDAM CHARAN SETHY,25-Mar-2024 09:22 PM,Rejected-Finance,Unsuccessful bidder in lottery,13-Aug-2024 01:56 PM,,,,,,,,,,,,,,,,,,,,,,,,,,,,,AOC
,,,,,,,,,,,,,,,,,,,,,,,,,,,,,,,,,,,,,,,,,,,,,,,,,,,,,,,,,,,,AOC,,,,,,,,,,,,,6,2487308,YASHOBANTA NAYAK,27-Mar-2024 03:48 PM,Rejected-Finance,L3 bidder,13-Aug-2024 01:56 PM,,,,,,,,,,,,,,,,,,,,,,,,,,,,,AOC
