Organisation Chain,Tender Reference Number,Tender ID,Withdrawal Allowed,Tender Type,Form of contract,Tender Category,No. of Covers,General Technical Evaluation Allowed,ItemWise Technical Evaluation Allowed,Payment Mode,Is Multi Currency Allowed For BOQ,Is Multi Currency Allowed For Fee,Allow Two Stage Bidding,Cover No,Cover,Document Type,Description,Publish Date,Bid Opening Date,Document Download / Sale Start Date,Document Download / Sale End Date,Clarification Start Date,Clarification End Date,Bid Submission Start Date,Bid Submission End Date,Financial Bid Opening Date,EMD Amount in ₹,EMD Exemption Allowed,EMD Fee Type,EMD Percentage,EMD Payable To,EMD Payable At,S.No,Corrigendum Title,Corrigendum Type,View,S.No.1,Bank Name,Tender Fee in ₹,VAT Charges in ₹,Fee Payable To,Fee Payable At,Tender Fee Exemption Allowed,Name,Address,Title,Work Description,Pre Qualification Details,Independent External Monitor/Remarks,Tender Value in ₹,Product Category,Sub category,Contract Type,Bid Validity(Days),Period Of Work(Days),Location,Pincode,Pre Bid Meeting Place,Pre Bid Meeting Address,Pre Bid Meeting Date,Bid Opening Place,Should Allow NDA Tender,Allow Preferential Bidder,Tender Stage,Contract Date :,Contract Value :,Work Completion Period in days :,Updated By :,Updated on :,AOC document :,AOC Description :,S.No,Bid Number,Bidder Name,Awarded Currency,Awarded Value,S.No.1,Bid Number.1,Bidder Name.1,Submitted Date,Status,Remarks,Status Updated On,Type :,Summary :,Updated By :.1,Updated On :,Document :,BOQ Comparative Chart :,Committee Chairperson/Co-ordinator Name :,Committee Chairperson/Co-ordinator Type :,Committee Members :,Updated By :.2,Updated on :.1,Document :.1,Organisation Chain :,Tender ID :,Tender Ref No :,Tender Title :,Type :.1,Summary :.1,Updated By :.3,Updated On :.1,Document :.2,Committee Chairperson/Co-ordinator Name :.1,Committee Chairperson/Co-ordinator Type :.1,Committee Members :.1,Updated By :.4,Updated On :.2,Financial Bid Opening Date:,Document :.3,Tender Stage
EIC-CIVIL||SERNB-CIRCLE-PHULBANI,CCE_R and B_PLB_25 of 2023_24,2024_EICCL_102812_2,Yes,Open Tender,Percentage,Works,2.0,No,No,Online,No,No,No,1.0,Fee/PreQual/Technical,.pdf,"Online Bid Cost, EMD as per clause 6 and 20 of DTCN, affidavit, RC, PAN,GST",22-Mar-2024 10:00 AM,10-Jun-2024 11:00 AM,22-Mar-2024 10:00 AM,07-Jun-2024 05:00 PM,22-Mar-2024 10:00 AM ,05-Jun-2024 05:00 PM ,22-Mar-2024 10:00 AM,07-Jun-2024 05:00 PM,15-Jul-2024 11:00 AM,"1,27,300",Yes,fixed,,Nil,Nil,1.0,1st Corrigendum to bid ID No CCE_R and B_PLB_25 of 2023_24,Date,,1.0,ICICI BANK,"10,000",0.0,Nil,Nil,No,CCE Phulbani RandB Circle Phulbani,Office of the CCE Phulbani RandB Circle Phulbani District Kandhamal PIN 762001,Construction of Proposed Multipurpose Auditorium for DIET Kandhamal at Tikabali,Construction of Proposed Multipurpose Auditorium for DIET Kandhamal at Tikabali,Please Refer Tender Documents ,NA ,"1,27,21,145",Civil Works - Buildings,EI and PH ,Tender,90.0,180.0,Phulbani,762001.0,NA ,NA ,NA ,Office of the CCE Phulbani RandB Circle Phulbani,No ,No,AOC,18-Sep-2024,"INR 11,450,303",180.0,Pravat Kumar Das,18-Sep-2024 12:39 PM,AgreementNo_02_P1_2024_25.pdf (351.00 KB),Awarded being L1 bidder selected through transparent lottery system,1.0,2493546.0,SUSANTA KUMAR SAHOO,INR,"11,450,303",1,2493681,PRIYADARSHANEE ANUSHMITA PANDA,07-Jun-2024 02:48 PM,Rejected-Finance,Rejected being L3 bidder,18-Sep-2024 12:28 PM,Finance,All document are received and under scrutiny,Sudhanshu Ranjan Nayak,15-Jul-2024 11:25 AM,,BOQ Comparative Chart,CCE Phulbani RandB Circle Phulbani,Internal,CCE Phulbani RandB Circle Phulbani SE Phulbani RandB Division Phulbani DAO Phulbani RandB Division Phulbani PA to CCE Phulbani RandB Circle Phulbani,Pravat Kumar Das,18-Sep-2024 12:28 PM,finsummary_500323.pdf (367.35 KB),EIC-CIVIL||SERNB-CIRCLE-PHULBANI,2024_EICCL_102812_2,CCE_R and B_PLB_25 of 2023_24,Construction of Proposed Multipurpose Auditorium for DIET Kandhamal at Tikabali,Technical,All document are received and under scrutiny,Sudhanshu Ranjan Nayak,10-Jun-2024 12:48 PM,,CCE Phulbani RandB Circle Phulbani,Internal,CCE Phulbani RandB Circle Phulbani SE Phulbani RandB Division Phulbani DAO Phulbani RandB Division Phulbani PA to CCE Phulbani RandB Circle Phulbani,Kruttika Kumari Panda,10-Jul-2024 06:45 PM,15-Jul-2024 11:00 AM,techsummary_500323.pdf (521.02 KB),AOC
,,,,,,,,,,,,,,,,.pdf,"Work Experience, Machineries and other documents as per DTCN",,,,,,,,,,,,,,,,2.0,2nd Corrigendum to bid ID No CCE_R and B_PLB_25 of 2023_24,Other,,2.0,ICICI NEFT/RTGS,,,,,,,,,,,,,,,,,,,,,,,,,,AOC,,,,,,,,,,,,,2,2493609,Rajendra Kumar Panda,07-Jun-2024 12:46 PM,Rejected-Finance,Rejected being L2 bidder,18-Sep-2024 12:28 PM,,,,,,,,,,,,,,,,,,,,,,,,,,,,,AOC
,,,,,,,,,,,,,,2.0,Finance,.xls,BOQ,,,,,,,,,,,,,,,,,,,,,,,,,,,,,,,,,,,,,,,,,,,,,,,AOC,,,,,,,,,,,,,3,2493740,RANJAN NAIK,07-Jun-2024 04:42 PM,Rejected-Finance,Rejected being L4 bidder,18-Sep-2024 12:28 PM,,,,,,,,,,,,,,,,,,,,,,,,,,,,,AOC
,,,,,,,,,,,,,,,,,,,,,,,,,,,,,,,,,,,,,,,,,,,,,,,,,,,,,,,,,,,,,,,,AOC,,,,,,,,,,,,,4,2490191,SAMEER PATTANAIK,06-Jun-2024 08:14 PM,Rejected-Technical,The documents towards work experience ie execution of similar nature of work as per clause 111 not furnished at least 1 no of building work costing not less than 51 lakhs Hence rejectedasperClause111 of DTCN,10-Jul-2024 06:45 PM,,,,,,,,,,,,,,,,,,,,,,,,,,,,,AOC
,,,,,,,,,,,,,,,,,,,,,,,,,,,,,,,,,,,,,,,,,,,,,,,,,,,,,,,,,,,,,,,,AOC,,,,,,,,,,,,,5,2493405,SASMITA SWAIN,07-Jun-2024 07:20 AM,Rejected-Technical,Disqualified as per clause 7 and 111 of DTCN,10-Jul-2024 06:45 PM,,,,,,,,,,,,,,,,,,,,,,,,,,,,,AOC
,,,,,,,,,,,,,,,,,,,,,,,,,,,,,,,,,,,,,,,,,,,,,,,,,,,,,,,,,,,,,,,,AOC,,,,,,,,,,,,,6,2493703,Subrata Kumar Mohanty,07-Jun-2024 03:18 PM,Rejected-Finance,Rejected being not selected through transparent lottery system,18-Sep-2024 12:28 PM,,,,,,,,,,,,,,,,,,,,,,,,,,,,,AOC
,,,,,,,,,,,,,,,,,,,,,,,,,,,,,,,,,,,,,,,,,,,,,,,,,,,,,,,,,,,,,,,,AOC,,,,,,,,,,,,,7,2493546,SUSANTA KUMAR SAHOO,06-Jun-2024 09:48 PM,Accepted-AOC,Awarded being L1 bidder selected through transparent lottery system,18-Sep-2024 12:39 PM,,,,,,,,,,,,,,,,,,,,,,,,,,,,,AOC
