Organisation Chain,Tender Reference Number,Tender ID,Withdrawal Allowed,Tender Type,Form of contract,Tender Category,No. of Covers,General Technical Evaluation Allowed,ItemWise Technical Evaluation Allowed,Payment Mode,Is Multi Currency Allowed For BOQ,Is Multi Currency Allowed For Fee,Allow Two Stage Bidding,Cover No,Cover,Document Type,Description,Publish Date,Bid Opening Date,Document Download / Sale Start Date,Document Download / Sale End Date,Clarification Start Date,Clarification End Date,Bid Submission Start Date,Bid Submission End Date,Financial Bid Opening Date,EMD Amount in ₹,EMD Exemption Allowed,EMD Fee Type,EMD Percentage,EMD Payable To,EMD Payable At,S.No,Bank Name,Tender Fee in ₹,VAT Charges in ₹,Fee Payable To,Fee Payable At,Tender Fee Exemption Allowed,Name,Address,Title,Work Description,Pre Qualification Details,Independent External Monitor/Remarks,Tender Value in ₹,Product Category,Sub category,Contract Type,Bid Validity(Days),Period Of Work(Days),Location,Pincode,Pre Bid Meeting Place,Pre Bid Meeting Address,Pre Bid Meeting Date,Bid Opening Place,Should Allow NDA Tender,Allow Preferential Bidder,Tender Stage,Contract Date :,Contract Value :,Work Completion Period in days :,Updated By :,Updated on :,AOC document :,AOC Description :,S.No,Bid Number,Bidder Name,Awarded Currency,Awarded Value,S.No.1,Bid Number.1,Bidder Name.1,Submitted Date,Status,Remarks,Status Updated On,Type :,Summary :,Updated By :.1,Updated On :,Document :,BOQ Comparative Chart :,Committee Chairperson/Co-ordinator Name :,Committee Chairperson/Co-ordinator Type :,Committee Members :,Updated By :.2,Updated on :.1,Document :.1,Organisation Chain :,Tender ID :,Tender Ref No :,Tender Title :,Type :.1,Summary :.1,Updated By :.3,Updated On :.1,Document :.2,Committee Chairperson/Co-ordinator Name :.1,Committee Chairperson/Co-ordinator Type :.1,Committee Members :.1,Updated By :.4,Updated On :.2,Financial Bid Opening Date:,Document :.3,Tender Stage
EIC-CIVIL||SERNB-CIRCLE-DHENKANAL,CCE DKL R and B/21-2021-22,2022_EICCL_76566_1,Yes,Open Tender,Percentage,Works,2.0,No,No,Online,No,No,No,1.0,Fee/PreQual/Technical,.pdf,"GSTIN, EMD Declaration, PAN, Valid RC",29-Mar-2022 02:00 PM,13-Apr-2022 11:30 AM,29-Mar-2022 02:00 PM,12-Apr-2022 05:30 PM,29-Mar-2022 02:00 PM ,12-Apr-2022 05:30 PM ,29-Mar-2022 02:00 PM,12-Apr-2022 05:30 PM,28-Apr-2022 12:40 PM,0.0,No,fixed,,Nil,Nil,1.0,ICICI BANK,"10,000",0.0,Nil,Nil,No,CCE Dhenkanal R and B Circle Dhenkanal,CCE Dhenkanal R and B Circle Dhenkanal,Improvement to Kaintragarh to Doruha road (ODR) from 17/00 km to 22/760 km under state plan for the year 2021-22,Improvement to Kaintragarh to Doruha road (ODR) from 17/00 km to 22/760 km under state plan for the year 2021-22,Please refer Tender documents ,NA ,"7,09,90,514",Civil Works - Roads,NA ,Tender,90.0,330.0,Angul,759122.0,NA ,NA ,NA ,CCE Dhenkanal R and B Circle Dhenkanal,No ,No,AOC,16-Sep-2024,"INR 70,990,513.72",330.0,Ashok Kumar Giri,16-Sep-2024 06:58 PM,Kainthragarh_Doruha.pdf (296.00 KB),Agreement on dt. 05.08.2022,1.0,1824090.0,MONALISA ENGICONS,INR,"62,507,147.33",1,1824232,Anil Kumar Mishra,12-Apr-2022 02:51 PM,Rejected-AOC,Quoted rate is in higher side,16-Sep-2024 06:58 PM,Finance,Opened,Ashok Kumar Giri,28-Apr-2022 12:51 PM,finance_394923.pdf,BOQ Comparative Chart,CCE Dhenkanal Circle,Internal,SE Angul Sr DAO Angul Estr Angul Division PA to CCE Dhenkanal Circle Estr Dhenkanal Circle,Ashok Kumar Giri,16-Sep-2024 06:56 PM,finsummary_394923.pdf (158.13 KB),EIC-CIVIL||SERNB-CIRCLE-DHENKANAL,2022_EICCL_76566_1,CCE DKL R and B/21-2021-22,Improvement to Kaintragarh to Doruha road (ODR) from 17/00 km to 22/760 km under state plan for the year 2021-22,Technical,Opened,Ashok Kumar Giri,13-Apr-2022 01:45 PM,technical_394923.pdf,Ashok Kumar Giri,Internal,SR Nayak D Datta SK Majhi HK Rout,Ashok Kumar Giri,27-Apr-2022 12:31 PM,28-Apr-2022 12:40 PM,techsummary_394923.pdf (969.64 KB),AOC
,,,,,,,,,,,,,,,,.pdf,"Affidavit, Machineries and other documents as per DTCN",,,,,,,,,,,,,,,,2.0,ICICI NEFT/RTGS,,,,,,,,,,,,,,,,,,,,,,,,,,AOC,,,,,,,,,,,,,2,1824090,MONALISA ENGICONS,12-Apr-2022 02:08 PM,Accepted-AOC,Work has been awarded,16-Sep-2024 06:58 PM,,,,,,,,,,,,,,,,,,,,,,,,,,,,,AOC
,,,,,,,,,,,,,,2.0,Finance,.xls,Bill of Quantity,,,,,,,,,,,,,,,,,,,,,,,,,,,,,,,,,,,,,,,,,,,AOC,,,,,,,,,,,,,3,1824145,MONALISHA CONSTRUCTION,12-Apr-2022 02:10 PM,Rejected-AOC,Quoted rate is in higher side,16-Sep-2024 06:58 PM,,,,,,,,,,,,,,,,,,,,,,,,,,,,,AOC
,,,,,,,,,,,,,,,,,,,,,,,,,,,,,,,,,,,,,,,,,,,,,,,,,,,,,,,,,,,,AOC,,,,,,,,,,,,,4,1823709,PRASANTA KUMAR SAMANTRAY,10-Apr-2022 07:49 PM,Rejected-AOC,Quoted rate is in higher side,16-Sep-2024 06:58 PM,,,,,,,,,,,,,,,,,,,,,,,,,,,,,AOC
,,,,,,,,,,,,,,,,,,,,,,,,,,,,,,,,,,,,,,,,,,,,,,,,,,,,,,,,,,,,AOC,,,,,,,,,,,,,5,1823758,R K STONE CRUSHER,11-Apr-2022 05:59 PM,Rejected-Technical,Disqualified as per clause No 14 of DTCN,27-Apr-2022 12:31 PM,,,,,,,,,,,,,,,,,,,,,,,,,,,,,AOC
,,,,,,,,,,,,,,,,,,,,,,,,,,,,,,,,,,,,,,,,,,,,,,,,,,,,,,,,,,,,AOC,,,,,,,,,,,,,6,1823719,Santosh Kumar Mishra,11-Apr-2022 06:16 PM,Rejected-AOC,Quoted rate is in higher side,16-Sep-2024 06:58 PM,,,,,,,,,,,,,,,,,,,,,,,,,,,,,AOC
