Organisation Chain,Tender Reference Number,Tender ID,Withdrawal Allowed,Tender Type,Form of contract,Tender Category,No. of Covers,General Technical Evaluation Allowed,ItemWise Technical Evaluation Allowed,Payment Mode,Is Multi Currency Allowed For BOQ,Is Multi Currency Allowed For Fee,Allow Two Stage Bidding,Cover No,Cover,Document Type,Description,Publish Date,Bid Opening Date,Document Download / Sale Start Date,Document Download / Sale End Date,Clarification Start Date,Clarification End Date,Bid Submission Start Date,Bid Submission End Date,Financial Bid Opening Date,EMD Amount in ₹,EMD Exemption Allowed,EMD Fee Type,EMD Percentage,EMD Payable To,EMD Payable At,S.No,Bank Name,Tender Fee in ₹,VAT Charges in ₹,Fee Payable To,Fee Payable At,Tender Fee Exemption Allowed,Name,Address,Title,Work Description,Pre Qualification Details,Independent External Monitor/Remarks,Tender Value in ₹,Product Category,Sub category,Contract Type,Bid Validity(Days),Period Of Work(Days),Location,Pincode,Pre Bid Meeting Place,Pre Bid Meeting Address,Pre Bid Meeting Date,Bid Opening Place,Should Allow NDA Tender,Allow Preferential Bidder,Tender Stage,Contract Date :,Contract Value :,Work Completion Period in days :,Updated By :,Updated on :,AOC document :,AOC Description :,S.No,Bid Number,Bidder Name,Awarded Currency,Awarded Value,S.No.1,Bid Number.1,Bidder Name.1,Submitted Date,Status,Remarks,Status Updated On,Type :,Summary :,Updated By :.1,Updated On :,Document :,BOQ Comparative Chart :,Committee Chairperson/Co-ordinator Name :,Committee Chairperson/Co-ordinator Type :,Committee Members :,Updated By :.2,Updated on :.1,Document :.1,Organisation Chain :,Tender ID :,Tender Ref No :,Tender Title :,Type :.1,Summary :.1,Updated By :.3,Updated On :.1,Document :.2,Committee Chairperson/Co-ordinator Name :.1,Committee Chairperson/Co-ordinator Type :.1,Committee Members :.1,Updated By :.4,Updated On :.2,Financial Bid Opening Date:,Document :.3,Tender Stage
CE RW I||RWCIRCLE-KENDRAPARA,Tender Online RCK-14/24,2024_CERWI_102979_3,Yes,National Competitive Bid,Percentage,Works,2.0,No,No,Online,No,No,No,1.0,Fee/PreQual/Technical,.pdf,"Tender Paper Cost, EMD, GSTIN, PAN, Registration Certificate, Labor License , Electrical License",02-Apr-2024 05:30 PM,18-Apr-2024 11:30 AM,02-Apr-2024 05:30 PM,16-Apr-2024 05:00 PM,02-Apr-2024 05:30 PM ,16-Apr-2024 02:00 PM ,02-Apr-2024 05:30 PM,16-Apr-2024 05:00 PM,18-Jun-2024 03:30 PM,"1,19,254",Yes,percentage,1.0%,Nil,Nil,1.0,ICICI BANK,"10,000",0.0,Nil,Nil,No,"Chief Construction Engineer,R.W Circle KPD-JJP","O/o CCE,R.W Circle,Kendrapara-Jajpu",Construction of Day-care PHC N Building at Biranilakanthapur of Derabish Block in the Dist. of Kendrapara for the year 2023-24.,Construction of Building work,Please refer tender documents ,NA ,"1,19,25,414",Civil Works - Buildings,NA ,Tender,90.0,365.0,Kendrapara,754211.0,NA ,NA ,NA ,"O/o CCE,R.W Circle,Kendrapara-Jajpur",No ,No,AOC,24-Sep-2024,"INR 10,137,794.33",365.0,Puspanjali Behera,24-Sep-2024 02:17 PM,biranilakanthapur.pdf (137.00 KB),The work has been awarded to Soumya Kanta Panda,1.0,2490574.0,SOUMYA KANTA PANDA,INR,"10,137,794.33",1,2490230,BALADEVJEW CONSTRUCTIONS PRIVATE LIMITED,06-Apr-2024 04:56 PM,Rejected-Finance,L3 bidder,24-Sep-2024 02:14 PM,Finance,07 no of bidders have participated,Nibedita Nayak,19-Jun-2024 01:56 PM,,BOQ Comparative Chart,CCE,Internal,,Puspanjali Behera,24-Sep-2024 02:14 PM,finsummary_500843.pdf (132.64 KB),CE RW I||RWCIRCLE-KENDRAPARA,2024_CERWI_102979_3,Tender Online RCK-14/24,Construction of Day-care PHC N Building at Biranilakanthapur of Derabish Block in the Dist. of Kendrapara for the year 2023-24.,Technical,07 no of bidders have submitted,Puspanjali Behera,18-Apr-2024 03:58 PM,,CCE,Internal,"CCE,DAO,EE",Puspanjali Behera,12-Jun-2024 12:42 PM,18-Jun-2024 03:30 PM,techsummary_500843.pdf (1377.84 KB),AOC
,,,,,,,,,,,,,,,,.pdf,"No Relationship , Affidavit of Correctness Certificate undertaking duly filled, all affidavits",,,,,,,,,,,,,,,,2.0,ICICI NEFT/RTGS,,,,,,,,,,,,,,,,,,,,,,,,,,AOC,,,,,,,,,,,,,2,2491695,DIBYA LOCHAN NAYAK,15-Apr-2024 11:26 PM,Rejected-Finance,L3 bidder,24-Sep-2024 02:14 PM,,,,,,,,,,,,,,,,,,,,,,,,,,,,,AOC
,,,,,,,,,,,,,,,,.pdf,"ATO , Work Experience Work in Hand, Machineries and required document as per DTCN",,,,,,,,,,,,,,,,,,,,,,,,,,,,,,,,,,,,,,,,,,,AOC,,,,,,,,,,,,,3,2491657,madhab charan sethy,16-Apr-2024 02:32 PM,Rejected-Finance,L3 bidder,24-Sep-2024 02:14 PM,,,,,,,,,,,,,,,,,,,,,,,,,,,,,AOC
,,,,,,,,,,,,,,2.0,Finance,.xls,BOQ,,,,,,,,,,,,,,,,,,,,,,,,,,,,,,,,,,,,,,,,,,,AOC,,,,,,,,,,,,,4,2490384,rabindra kumar sethy,16-Apr-2024 04:23 PM,Rejected-Finance,L2 bidder,24-Sep-2024 02:14 PM,,,,,,,,,,,,,,,,,,,,,,,,,,,,,AOC
,,,,,,,,,,,,,,,,,,,,,,,,,,,,,,,,,,,,,,,,,,,,,,,,,,,,,,,,,,,,AOC,,,,,,,,,,,,,5,2490574,SOUMYA KANTA PANDA,10-Apr-2024 08:27 PM,Accepted-AOC,The work has been awarded to Soumya Kanta Panda,24-Sep-2024 02:17 PM,,,,,,,,,,,,,,,,,,,,,,,,,,,,,AOC
,,,,,,,,,,,,,,,,,,,,,,,,,,,,,,,,,,,,,,,,,,,,,,,,,,,,,,,,,,,,AOC,,,,,,,,,,,,,6,2491547,SWAPNA SUDESHNA SAMAL,14-Apr-2024 11:53 PM,Rejected-Finance,Unsuccessful bidder in lottery,24-Sep-2024 02:14 PM,,,,,,,,,,,,,,,,,,,,,,,,,,,,,AOC
,,,,,,,,,,,,,,,,,,,,,,,,,,,,,,,,,,,,,,,,,,,,,,,,,,,,,,,,,,,,AOC,,,,,,,,,,,,,7,2491522,TRUPTIRANJAN SAMAL,14-Apr-2024 11:45 AM,Rejected-Finance,Unsuccessful bidder in lottery,24-Sep-2024 02:14 PM,,,,,,,,,,,,,,,,,,,,,,,,,,,,,AOC
