Organisation Chain,Tender Reference Number,Tender ID,Withdrawal Allowed,Tender Type,Form of contract,Tender Category,No. of Covers,General Technical Evaluation Allowed,ItemWise Technical Evaluation Allowed,Payment Mode,Is Multi Currency Allowed For BOQ,Is Multi Currency Allowed For Fee,Allow Two Stage Bidding,Cover No,Cover,Document Type,Description,Publish Date,Bid Opening Date,Document Download / Sale Start Date,Document Download / Sale End Date,Clarification Start Date,Clarification End Date,Bid Submission Start Date,Bid Submission End Date,Financial Bid Opening Date,EMD Amount in ₹,EMD Exemption Allowed,EMD Fee Type,EMD Percentage,EMD Payable To,EMD Payable At,S.No,Bank Name,Tender Fee in ₹,VAT Charges in ₹,Fee Payable To,Fee Payable At,Tender Fee Exemption Allowed,Name,Address,Title,Work Description,Pre Qualification Details,Independent External Monitor/Remarks,Tender Value in ₹,Product Category,Sub category,Contract Type,Bid Validity(Days),Period Of Work(Days),Location,Pincode,Pre Bid Meeting Place,Pre Bid Meeting Address,Pre Bid Meeting Date,Bid Opening Place,Should Allow NDA Tender,Allow Preferential Bidder,Tender Stage,Contract Date :,Contract Value :,Work Completion Period in days :,Updated By :,Updated on :,AOC document :,AOC Description :,S.No,Bid Number,Bidder Name,Awarded Currency,Awarded Value,S.No.1,Bid Number.1,Bidder Name.1,Submitted Date,Status,Remarks,Status Updated On,Type :,Summary :,Updated By :.1,Updated On :,Document :,BOQ Comparative Chart :,Committee Chairperson/Co-ordinator Name :,Committee Chairperson/Co-ordinator Type :,Committee Members :,Updated By :.2,Updated on :.1,Document :.1,Organisation Chain :,Tender ID :,Tender Ref No :,Tender Title :,Type :.1,Summary :.1,Updated By :.3,Updated On :.1,Document :.2,Committee Chairperson/Co-ordinator Name :.1,Committee Chairperson/Co-ordinator Type :.1,Committee Members :.1,Updated By :.4,Updated On :.2,Financial Bid Opening Date:,Document :.3,Tender Stage
EIC-CIVIL||SERNB-CIRCLE-DHENKANAL,CCE DKL R and B/10-2022-23,2022_EICCL_80660_3,Yes,Open Tender,Percentage,Works,2.0,No,No,Online,No,No,No,1.0,Fee/PreQual/Technical,.pdf,"GSTIN, EMD Declaration, PAN, Valid RC",22-Aug-2022 09:00 AM,06-Sep-2022 11:30 AM,22-Aug-2022 09:00 AM,05-Sep-2022 05:30 PM,22-Aug-2022 09:00 AM ,05-Sep-2022 05:30 PM ,22-Aug-2022 09:00 AM,05-Sep-2022 05:30 PM,16-Sep-2022 11:00 AM,0.0,No,fixed,,Nil,Nil,1.0,ICICI BANK,"10,000",0.0,Nil,Nil,No,CCE Dhenkanal R and B Circle Dhenkanal,CCE Dhenkanal R and B Circle Dhenkanal,"Construction of proposed Modification, Repair and Renovation of Odisha Adarsha Vidyalaya at Paikapadapatna under Narasinghpur Block in Cuttack District","Construction of proposed Modification, Repair and Renovation of Odisha Adarsha Vidyalaya at Paikapadapatna under Narasinghpur Block in Cuttack District",Please refer Tender documents ,NA ,"1,21,01,255",Civil Works - Buildings,NA ,Tender,90.0,210.0,Choudwar,754025.0,NA ,NA ,NA ,CCE Dhenkanal R and B Circle Dhenkanal,No ,No,AOC,16-Sep-2024,"INR 12,101,255.35",210.0,Ashok Kumar Giri,16-Sep-2024 09:20 PM,OAV_Modofication_Paikapadapatana.pdf (261.00 KB),Agreement on dt. 04.11.2022,1.0,1925566.0,SOUMYA RANJAN ROUT,INR,"10,287,277",1,1926635,Binod Behera,05-Sep-2022 01:30 PM,Rejected-AOC,Quoted rate is in higher side,16-Sep-2024 09:20 PM,Finance,Opened,Ashok Kumar Giri,16-Sep-2022 12:05 PM,finance_408378.pdf,BOQ Comparative Chart,CCE Dhenkanal Circle,Internal,SE Charbatia Sr DAO Charbatia Estr Charbatia Division PA to CCE Dhenkanal Circle Estr Dhenkanal Circle,Ashok Kumar Giri,16-Sep-2024 09:17 PM,finsummary_408378.pdf (158.13 KB),EIC-CIVIL||SERNB-CIRCLE-DHENKANAL,2022_EICCL_80660_3,CCE DKL R and B/10-2022-23,"Construction of proposed Modification, Repair and Renovation of Odisha Adarsha Vidyalaya at Paikapadapatna under Narasinghpur Block in Cuttack District",Technical,Opened,Ashok Kumar Giri,06-Sep-2022 05:56 PM,technical_408378.pdf,Ashok Kumar Giri,Internal,PK Mohanty MR Bal S Singh JR Pati,Ashok Kumar Giri,14-Sep-2022 09:53 PM,16-Sep-2022 11:00 AM,techsummary_408378.pdf (834.83 KB),AOC
,,,,,,,,,,,,,,,,.pdf,"Affidavit, Machineries and other documents as per DTCN",,,,,,,,,,,,,,,,2.0,ICICI NEFT/RTGS,,,,,,,,,,,,,,,,,,,,,,,,,,AOC,,,,,,,,,,,,,2,1926675,MANOJ KUMAR PRUSTY,05-Sep-2022 01:39 PM,Rejected-AOC,Quoted rate is in higher side,16-Sep-2024 09:20 PM,,,,,,,,,,,,,,,,,,,,,,,,,,,,,AOC
,,,,,,,,,,,,,,2.0,Finance,.xls,Bill of Quantity,,,,,,,,,,,,,,,,,,,,,,,,,,,,,,,,,,,,,,,,,,,AOC,,,,,,,,,,,,,3,1925566,SOUMYA RANJAN ROUT,03-Sep-2022 10:46 AM,Accepted-AOC,Work has been awarded,16-Sep-2024 09:20 PM,,,,,,,,,,,,,,,,,,,,,,,,,,,,,AOC
,,,,,,,,,,,,,,,,,,,,,,,,,,,,,,,,,,,,,,,,,,,,,,,,,,,,,,,,,,,,AOC,,,,,,,,,,,,,4,1926146,Sri Priyabrata Panda,04-Sep-2022 01:34 PM,Rejected-Technical,Disqualified as per clause no 7 and 112 e of DTCN,14-Sep-2022 09:53 PM,,,,,,,,,,,,,,,,,,,,,,,,,,,,,AOC
,,,,,,,,,,,,,,,,,,,,,,,,,,,,,,,,,,,,,,,,,,,,,,,,,,,,,,,,,,,,AOC,,,,,,,,,,,,,5,1926691,SURESH NAIK,05-Sep-2022 01:45 PM,Rejected-Technical,Disqualified as per clause no 8 of DTCN,14-Sep-2022 09:53 PM,,,,,,,,,,,,,,,,,,,,,,,,,,,,,AOC
