Organisation Chain,Tender Reference Number,Tender ID,Withdrawal Allowed,Tender Type,Form of contract,Tender Category,No. of Covers,General Technical Evaluation Allowed,ItemWise Technical Evaluation Allowed,Payment Mode,Is Multi Currency Allowed For BOQ,Is Multi Currency Allowed For Fee,Allow Two Stage Bidding,Cover No,Cover,Document Type,Description,Publish Date,Bid Opening Date,Document Download / Sale Start Date,Document Download / Sale End Date,Clarification Start Date,Clarification End Date,Bid Submission Start Date,Bid Submission End Date,Financial Bid Opening Date,EMD Amount in ₹,EMD Exemption Allowed,EMD Fee Type,EMD Percentage,EMD Payable To,EMD Payable At,S.No,Corrigendum Title,Corrigendum Type,View,S.No.1,Bank Name,Tender Fee in ₹,VAT Charges in ₹,Fee Payable To,Fee Payable At,Tender Fee Exemption Allowed,Name,Address,Title,Work Description,Pre Qualification Details,Independent External Monitor/Remarks,Tender Value in ₹,Product Category,Sub category,Contract Type,Bid Validity(Days),Period Of Work(Days),Location,Pincode,Pre Bid Meeting Place,Pre Bid Meeting Address,Pre Bid Meeting Date,Bid Opening Place,Should Allow NDA Tender,Allow Preferential Bidder,Tender Stage,Contract Date :,Contract Value :,Work Completion Period in days :,Updated By :,Updated on :,AOC document :,AOC Description :,S.No,Bid Number,Bidder Name,Awarded Currency,Awarded Value,S.No.1,Bid Number.1,Bidder Name.1,Submitted Date,Status,Remarks,Status Updated On,Type :,Summary :,Updated By :.1,Updated On :,Document :,BOQ Comparative Chart :,Committee Chairperson/Co-ordinator Name :,Committee Chairperson/Co-ordinator Type :,Committee Members :,Updated By :.2,Updated on :.1,Document :.1,Organisation Chain :,Tender ID :,Tender Ref No :,Tender Title :,Type :.1,Summary :.1,Updated By :.3,Updated On :.1,Document :.2,Committee Chairperson/Co-ordinator Name :.1,Committee Chairperson/Co-ordinator Type :.1,Committee Members :.1,Updated By :.4,Updated On :.2,Financial Bid Opening Date:,Document :.3,Tender Stage
CE Megalift Projects Bhubaneswar,20ML/2023-24,2023_CEMLP_98681_1,Yes,Open Tender,Lump-sum,Services,2.0,No,No,Online,No,No,No,1.0,Fee/PreQual/Technical,.pdf,"As stipulated under Section-II/Clause-5/Page-11,12/Cover-I/Technical Proposal/File-I of RFP",22-Dec-2023 10:00 AM,22-Jan-2024 11:00 AM,22-Dec-2023 10:00 AM,20-Jan-2024 05:00 PM,22-Dec-2023 10:00 AM ,02-Jan-2024 05:00 PM ,22-Dec-2023 10:00 AM,20-Jan-2024 05:00 PM,15-Mar-2024 11:15 AM,"7,11,000",No,fixed,,Nil,Nil,1.0,1ST CORRIGENDUM,Technical Bid,,1.0,ICICI BANK,"10,000",0.0,Nil,Nil,No,"CHIEF ENGINEER, MEGALIFT","PLOT NO. A-8/2, BHOI NAGAR, BHUBANESWAR-751022",APPOINTMENT OF PROJECT MANAGEMENT CONSULTANT(PMC) FOR IMPLEMENTATION OF MEGALIFT PROJECTS IN CLUSTER-XXIII,CONSULTANCY SERVICE,Please refer Tender documents. ,NA ,,Miscellaneous Services,NA ,Tender,180.0,1080.0,"MAYURBHANJ,KEONJHAR",757034.0,"O/o CHIEF ENGINEER, MEGALIFT,BHUBANESWAR ","PLOT NO. A-8/2, BHOI NAGAR, BHUBANESWAR-751022 ",04-Jan-2024 11:00 AM ,"O/o CHIEF ENGINEER, MEGALIFT,BHUBANESWAR",No ,No,AOC,21-Sep-2024,"INR 24,289,920",1080.0,Chinmoy Ranjan Rout,27-Sep-2024 05:13 PM,aoc.pdf (59.00 KB),Agreement drawn on dt.21.09.2024 with date of commencement and completion being 21.09.2024 and 20.09.2027 respectively.,1.0,2400168.0,mars planning & engineering services pvt ltd,INR,"24,289,920",1,2388109,Aarvee Associates Architects Engineers and Consultants Private Limited,20-Jan-2024 04:05 PM,Rejected-Finance,Not approved by Government,18-Sep-2024 04:57 PM,Finance,Price proposal opened in scheduled date and time and downloaded.,Chinmoy Ranjan Rout,15-Mar-2024 07:10 PM,finance_480652.pdf,BOQ Comparative Chart,DC-cum-ACS to Govt.,External,,Chinmoy Ranjan Rout,18-Sep-2024 04:57 PM,finsummary_480652.pdf (114.40 KB),CE Megalift Projects Bhubaneswar,2023_CEMLP_98681_1,20ML/2023-24,APPOINTMENT OF PROJECT MANAGEMENT CONSULTANT(PMC) FOR IMPLEMENTATION OF MEGALIFT PROJECTS IN CLUSTER-XXIII,Technical,Technical proposal opened in scheduled date and downloaded.,Chinmoy Ranjan Rout,22-Jan-2024 06:38 PM,technical_480652.pdf,DC-cum-ACS to Govt.,External,,Chinmoy Ranjan Rout,14-Mar-2024 07:05 PM,15-Mar-2024 11:15 AM,techsummary_480652.pdf (119.86 KB),AOC
,,,,,,,,,,,,,,,,.pdf,As stipulated under Section-II/Clause-5/Page-12/Cover-I/Technical Proposal/File-II of RFP,,,,,,,,,,,,,,,,,,,,2.0,ICICI NEFT/RTGS,,,,,,,,,,,,,,,,,,,,,,,,,,AOC,,,,,,,,,,,,,2,2400168,mars planning & engineering services pvt ltd,20-Jan-2024 02:55 PM,Accepted-AOC,Approved by Government,27-Sep-2024 05:14 PM,,,,,,,,,,,,,,,,,,,,,,,,,,,,,AOC
,,,,,,,,,,,,,,2.0,Finance,.xls,PRICE PROPOSAL,,,,,,,,,,,,,,,,,,,,,,,,,,,,,,,,,,,,,,,,,,,,,,,AOC,,,,,,,,,,,,,3,2397843,MECON LIMITED,20-Jan-2024 03:23 PM,Rejected-Technical,Not approved by Govt. being non responsive bid,14-Mar-2024 07:05 PM,,,,,,,,,,,,,,,,,,,,,,,,,,,,,AOC
,,,,,,,,,,,,,,,,.pdf,Forwarding letter(FORM-F1) as stipulated under Price proposal in Section-VI (B) of RFP,,,,,,,,,,,,,,,,,,,,,,,,,,,,,,,,,,,,,,,,,,,,,,,AOC,,,,,,,,,,,,,4,2369135,Multi Mantech International Pvt. Ltd.,20-Jan-2024 01:54 PM,Rejected-Finance,Not approved by Government,18-Sep-2024 04:57 PM,,,,,,,,,,,,,,,,,,,,,,,,,,,,,AOC
,,,,,,,,,,,,,,,,,,,,,,,,,,,,,,,,,,,,,,,,,,,,,,,,,,,,,,,,,,,,,,,,AOC,,,,,,,,,,,,,5,2377741,TUV SUD South Asia Pvt. Ltd.,20-Jan-2024 04:22 PM,Rejected-Finance,Not approved by Government,18-Sep-2024 04:57 PM,,,,,,,,,,,,,,,,,,,,,,,,,,,,,AOC
,,,,,,,,,,,,,,,,,,,,,,,,,,,,,,,,,,,,,,,,,,,,,,,,,,,,,,,,,,,,,,,,AOC,,,,,,,,,,,,,6,2399689,WAPCOS LIMITED,20-Jan-2024 04:30 PM,Rejected-Finance,Not approved by Government,18-Sep-2024 04:57 PM,,,,,,,,,,,,,,,,,,,,,,,,,,,,,AOC
