Organisation Chain,Tender Reference Number,Tender ID,Withdrawal Allowed,Tender Type,Form of contract,Tender Category,No. of Covers,General Technical Evaluation Allowed,ItemWise Technical Evaluation Allowed,Payment Mode,Is Multi Currency Allowed For BOQ,Is Multi Currency Allowed For Fee,Allow Two Stage Bidding,Cover No,Cover,Document Type,Description,Publish Date,Bid Opening Date,Document Download / Sale Start Date,Document Download / Sale End Date,Clarification Start Date,Clarification End Date,Bid Submission Start Date,Bid Submission End Date,Financial Bid Opening Date,EMD Amount in ₹,EMD Exemption Allowed,EMD Fee Type,EMD Percentage,EMD Payable To,EMD Payable At,S.No,Bank Name,Tender Fee in ₹,Fee Payable To,Fee Payable At,Tender Fee Exemption Allowed,Name,Address,Title,Work Description,Pre Qualification Details,Independent External Monitor/Remarks,Tender Value in ₹,Product Category,Sub category,Contract Type,Bid Validity(Days),Period Of Work(Days),Location,Pincode,Pre Bid Meeting Place,Pre Bid Meeting Address,Pre Bid Meeting Date,Bid Opening Place,Should Allow NDA Tender,Allow Preferential Bidder,Tender Stage,Contract Date :,Contract Value :,Work Completion Period in days :,Updated By :,Updated on :,AOC document :,AOC Description :,S.No,Bid Number,Bidder Name,Awarded Currency,Awarded Value,S.No.1,Bid Number.1,Bidder Name.1,Submitted Date,Status,Remarks,Status Updated On,Type :,Summary :,Updated By :.1,Updated On :,Document :,BOQ Comparative Chart :,Committee Chairperson/Co-ordinator Name :,Committee Chairperson/Co-ordinator Type :,Committee Members :,Updated By :.2,Updated on :.1,Document :.1,Organisation Chain :,Tender ID :,Tender Ref No :,Tender Title :,Type :.1,Summary :.1,Updated By :.3,Updated On :.1,Document :.2,Committee Chairperson/Co-ordinator Name :.1,Committee Chairperson/Co-ordinator Type :.1,Committee Members :.1,Updated By :.4,Updated On :.2,Financial Bid Opening Date:,Document :.3,Tender Stage
Housing and Urban Development Department||Directorate of Town Planning,"RFP-01-DTP-HUDD, Dated-08-11-2023",2023_HUDD_96846_1,Yes,Open Tender,Percentage,Services,2.0,No,No,Online,No,No,No,1.0,Fee/PreQual/Technical,.pdf,"Tender Fee / Pre-qualification / Technical Eligibility, as detailed in RFP Documents",13-Nov-2023 10:00 AM,15-Dec-2023 04:00 PM,13-Nov-2023 10:00 AM,14-Dec-2023 05:00 PM,13-Nov-2023 10:00 AM ,18-Nov-2023 05:00 PM ,13-Nov-2023 10:00 AM,14-Dec-2023 05:00 PM,29-Jan-2024 02:00 PM,"5,00,000",No,fixed,,Nil,Nil,1.0,ICICI BANK,"10,000",Nil,Nil,No,"Director, Directorate of Town Planning, Bhubaneswa","Director, Directorate of Town Planning, Housing Urban Development Deptt. Govt. of Odisha.","RFP-01-DTP-HUDD, Dated-08-11-2023","Selection of Consultant for Establishment and Operationalization of State Level Programme Management Unit (PMU) for Directorate of Town Planning, Odisha.",As detailed in RFP Document ,NA ,"2,77,92,000",Human Resources Supply,Urban Related ,Tender,180.0,730.0,Bhubaneswar,751001.0,Bhubaneswar ,"Directorate of Town Planning, Bhubaneswar, Odisha ",20-Nov-2023 04:00 PM ,Bhubaneswar,No ,No,AOC,20-Jun-2024,"INR 29,181,600",730.0,Sanjukta Mohanty,20-Jun-2024 11:37 AM,AOC.pdf (897.00 KB),AOC,1.0,2341411.0,Voyants Solutions Private Limited,INR,"29,181,600",1,2325396,Centre for Environment and Development,14-Dec-2023 04:22 PM,Rejected-Finance,Rejected,23-Feb-2024 04:19 PM,Finance,Financial Bid Opened on 29-01-2024 at 14.00 hrs IST,Sanjukta Mohanty,29-Jan-2024 02:35 PM,,BOQ Comparative Chart,Director Town Planning Odisha,Mixed,Director Town Planning Odisha Procurement Specialist H and UD CE cum Addl Secretary H and UD AFA cum Deputy Secretary H and UD Planning Member BDA BBSR Town Planner cum OSD H and UD,Sanjukta Mohanty,23-Feb-2024 04:19 PM,finsummary_472565.pdf (2906.90 KB),Housing and Urban Development Department||Directorate of Town Planning,2023_HUDD_96846_1,"RFP-01-DTP-HUDD, Dated-08-11-2023","RFP-01-DTP-HUDD, Dated-08-11-2023",Technical,Tech Bid Opened,Chandi Prasad Biswal,15-Dec-2023 04:24 PM,,Director Town Planning,Internal,"CE-AS HUDD, Procurement Specialist HUDD, AFA-DS HUDD, Planning Member BDA, Town Planner DTP",Santanu Kumar Ray,29-Jan-2024 01:43 PM,29-Jan-2024 02:00 PM,techsummary_472565.pdf (353.80 KB),AOC
,,,,,,,,,,,,,,2.0,Finance,.xls,Finance Bid (BoQ),,,,,,,,,,,,,,,,2.0,ICICI NEFT/RTGS,,,,,,,,,,,,,,,,,,,,,,,,,AOC,,,,,,,,,,,,,2,2355165,Choice Consultancy Services Private Limited,14-Dec-2023 04:02 PM,Rejected-Finance,Rejected,23-Feb-2024 04:19 PM,,,,,,,,,,,,,,,,,,,,,,,,,,,,,AOC
,,,,,,,,,,,,,,,,,,,,,,,,,,,,,,,,,,,,,,,,,,,,,,,,,,,,,,,,,,,AOC,,,,,,,,,,,,,3,2354918,mars planning & engineering services pvt ltd,14-Dec-2023 04:47 PM,Rejected-Finance,Rejected,23-Feb-2024 04:19 PM,,,,,,,,,,,,,,,,,,,,,,,,,,,,,AOC
,,,,,,,,,,,,,,,,,,,,,,,,,,,,,,,,,,,,,,,,,,,,,,,,,,,,,,,,,,,AOC,,,,,,,,,,,,,4,2353523,RAJHANS CONSULTANTS AND TECHNOCRATS PRIVATE LIMTED,13-Dec-2023 03:16 PM,Rejected-Finance,Rejected,23-Feb-2024 04:19 PM,,,,,,,,,,,,,,,,,,,,,,,,,,,,,AOC
,,,,,,,,,,,,,,,,,,,,,,,,,,,,,,,,,,,,,,,,,,,,,,,,,,,,,,,,,,,AOC,,,,,,,,,,,,,5,2341411,Voyants Solutions Private Limited,14-Dec-2023 11:14 AM,Accepted-AOC,Awarded L1,20-Jun-2024 11:37 AM,,,,,,,,,,,,,,,,,,,,,,,,,,,,,AOC
