Organisation Chain,Tender Reference Number,Tender ID,Withdrawal Allowed,Tender Type,Form of contract,Tender Category,No. of Covers,General Technical Evaluation Allowed,ItemWise Technical Evaluation Allowed,Payment Mode,Is Multi Currency Allowed For BOQ,Is Multi Currency Allowed For Fee,Allow Two Stage Bidding,Cover No,Cover,Document Type,Description,Publish Date,Bid Opening Date,Document Download / Sale Start Date,Document Download / Sale End Date,Clarification Start Date,Clarification End Date,Bid Submission Start Date,Bid Submission End Date,Financial Bid Opening Date,EMD Amount in ₹,EMD Exemption Allowed,EMD Fee Type,EMD Percentage,EMD Payable To,EMD Payable At,S.No,Bank Name,Tender Fee in ₹,VAT Charges in ₹,Fee Payable To,Fee Payable At,Tender Fee Exemption Allowed,Name,Address,Title,Work Description,Pre Qualification Details,Independent External Monitor/Remarks,Tender Value in ₹,Product Category,Sub category,Contract Type,Bid Validity(Days),Period Of Work(Days),Location,Pincode,Pre Bid Meeting Place,Pre Bid Meeting Address,Pre Bid Meeting Date,Bid Opening Place,Should Allow NDA Tender,Allow Preferential Bidder,Tender Stage,Contract Date :,Contract Value :,Work Completion Period in days :,Updated By :,Updated on :,AOC document :,AOC Description :,S.No,Bid Number,Bidder Name,Awarded Currency,Awarded Value,S.No.1,Bid Number.1,Bidder Name.1,Submitted Date,Status,Remarks,Status Updated On,Type :,Summary :,Updated By :.1,Updated On :,Document :,BOQ Comparative Chart :,Committee Chairperson/Co-ordinator Name :,Committee Chairperson/Co-ordinator Type :,Committee Members :,Updated By :.2,Updated on :.1,Document :.1,Organisation Chain :,Tender ID :,Tender Ref No :,Tender Title :,Type :.1,Summary :.1,Updated By :.3,Updated On :.1,Document :.2,Committee Chairperson/Co-ordinator Name :.1,Committee Chairperson/Co-ordinator Type :.1,Committee Members :.1,Updated By :.4,Updated On :.2,Financial Bid Opening Date:,Document :.3,Tender Stage
"CE-BM,RVN Basin,Berhampur||SE Southern Irr Circle II Paralakhemundi","ACE,VNB-08/2023-24",2024_CEBMB_100751_4,Yes,National Competitive Bid,Percentage,Works,2.0,No,No,Online,No,No,No,1.0,Fee/PreQual/Technical,.pdf,"GSTIN, PAN, REGISTRATION CERTIFICATE, AFFIDAVIT, EMD, COST OF BID, NO RELATION CERTIFICATE",08-Feb-2024 11:00 AM,23-Feb-2024 11:00 AM,08-Feb-2024 11:00 AM,22-Feb-2024 05:00 PM,08-Feb-2024 11:00 AM ,16-Feb-2024 05:00 PM ,08-Feb-2024 11:00 AM,22-Feb-2024 05:00 PM,28-Feb-2024 03:30 PM,"2,10,900",Yes,fixed,,Nil,Nil,1.0,ICICI BANK,"10,000",0.0,Nil,Nil,No,"Additional Chief Enginee, VNB, PKD","O/O ADDITIONAL CHIEF ENGINEER,VN BASIN, PARALAKHEMUNDI, JALASAMPAD BHAWAN, GAJAPATI PIN- 761200",Providing river bank protection in the downstream of Dam axis in Badjore river near Mahendragada K.G. High school of Chheligada Irrigation Project,Providing river bank protectionl in the downstream of Dam axis in Badjore river near Mahendragada K.G. High school of Chheligada Irrigation Project,Please refer Tender documents. ,NA ,"2,10,88,600",Civil Works - Others,NA ,Tender,90.0,270.0,MAHENDRAGADA,761017.0,NA ,NA ,NA ,"O/O ACE, VN BASIN, PARALAKHEMUNDI",No ,No,AOC,20-Jun-2024,"INR 17,927,419",270.0,Roja Rani Pattanaik,20-Jun-2024 01:53 PM,BADAJHOREWORKORDER.pdf (604.00 KB),Agt. No. 56P1/23-24 Agreement Date- 16.03.2024 Date of commencement-16.03.24 Date of completion- 15.12.2024,1.0,2452636.0,TOFAN KUMAR SAHU,INR,"17,927,419",1,2454296,BURADA DINESH,22-Feb-2024 01:17 PM,Rejected-Finance,Non Responsive and looser of lottery,20-Mar-2024 04:21 PM,Finance,Financial bid submitted.,Roja Rani Pattanaik,05-Mar-2024 07:45 PM,,BOQ Comparative Chart,N.Maharana,Internal,,Roja Rani Pattanaik,20-Mar-2024 04:21 PM,finsummary_490853.pdf (772.28 KB),"CE-BM,RVN Basin,Berhampur||SE Southern Irr Circle II Paralakhemundi",2024_CEBMB_100751_4,"ACE,VNB-08/2023-24",Providing river bank protection in the downstream of Dam axis in Badjore river near Mahendragada K.G. High school of Chheligada Irrigation Project,Technical,Technical bid submitted.,Nagendranath Maharana,28-Feb-2024 10:30 AM,,N.Maharana,Internal,,Nagendranath Maharana,28-Feb-2024 10:41 AM,28-Feb-2024 03:30 PM,techsummary_490853.pdf (438.09 KB),AOC
,,,,,,,,,,,,,,,,.pdf,AND ANY OTHER DOCUMENTS AS PER SBD AND DTCN,,,,,,,,,,,,,,,,2.0,ICICI NEFT/RTGS,,,,,,,,,,,,,,,,,,,,,,,,,,AOC,,,,,,,,,,,,,2,2452657,MUKESH PRADHAN,21-Feb-2024 02:27 PM,Rejected-Finance,Non Responsive and looser of lottery,20-Mar-2024 04:21 PM,,,,,,,,,,,,,,,,,,,,,,,,,,,,,AOC
,,,,,,,,,,,,,,2.0,Finance,.xls,BILL OF QUANTITY,,,,,,,,,,,,,,,,,,,,,,,,,,,,,,,,,,,,,,,,,,,AOC,,,,,,,,,,,,,3,2454638,ROUTHU SUNIL KUMAR,22-Feb-2024 02:50 PM,Rejected-Finance,Non Responsive and looser of lottery,20-Mar-2024 04:21 PM,,,,,,,,,,,,,,,,,,,,,,,,,,,,,AOC
,,,,,,,,,,,,,,,,,,,,,,,,,,,,,,,,,,,,,,,,,,,,,,,,,,,,,,,,,,,,AOC,,,,,,,,,,,,,4,2453779,SIVALA PHALGUNA RAO,22-Feb-2024 01:39 PM,Rejected-Finance,Non Responsive and looser of lottery,20-Mar-2024 04:21 PM,,,,,,,,,,,,,,,,,,,,,,,,,,,,,AOC
,,,,,,,,,,,,,,,,,,,,,,,,,,,,,,,,,,,,,,,,,,,,,,,,,,,,,,,,,,,,AOC,,,,,,,,,,,,,5,2453806,SUBHASHREE RATHA,22-Feb-2024 11:01 AM,Rejected-Finance,Non Responsive and disqualified,20-Mar-2024 04:21 PM,,,,,,,,,,,,,,,,,,,,,,,,,,,,,AOC
,,,,,,,,,,,,,,,,,,,,,,,,,,,,,,,,,,,,,,,,,,,,,,,,,,,,,,,,,,,,AOC,,,,,,,,,,,,,6,2452636,TOFAN KUMAR SAHU,21-Feb-2024 02:19 PM,Accepted-AOC,Winner of lottery,20-Jun-2024 01:54 PM,,,,,,,,,,,,,,,,,,,,,,,,,,,,,AOC
