Organisation Chain,Tender Reference Number,Tender ID,Withdrawal Allowed,Tender Type,Form of contract,Tender Category,No. of Covers,General Technical Evaluation Allowed,ItemWise Technical Evaluation Allowed,Payment Mode,Is Multi Currency Allowed For BOQ,Is Multi Currency Allowed For Fee,Allow Two Stage Bidding,Cover No,Cover,Document Type,Description,Publish Date,Bid Opening Date,Document Download / Sale Start Date,Document Download / Sale End Date,Clarification Start Date,Clarification End Date,Bid Submission Start Date,Bid Submission End Date,Financial Bid Opening Date,EMD Amount in ₹,EMD Exemption Allowed,EMD Fee Type,EMD Percentage,EMD Payable To,EMD Payable At,S.No,Bank Name,Tender Fee in ₹,VAT Charges in ₹,Fee Payable To,Fee Payable At,Tender Fee Exemption Allowed,Name,Address,Title,Work Description,Pre Qualification Details,Independent External Monitor/Remarks,Tender Value in ₹,Product Category,Sub category,Contract Type,Bid Validity(Days),Period Of Work(Days),Location,Pincode,Pre Bid Meeting Place,Pre Bid Meeting Address,Pre Bid Meeting Date,Bid Opening Place,Should Allow NDA Tender,Allow Preferential Bidder,Tender Stage,Contract Date :,Contract Value :,Work Completion Period in days :,Updated By :,Updated on :,AOC document :,AOC Description :,S.No,Bid Number,Bidder Name,Awarded Currency,Awarded Value,S.No.1,Bid Number.1,Bidder Name.1,Submitted Date,Status,Remarks,Status Updated On,Type :,Summary :,Updated By :.1,Updated On :,Document :,BOQ Comparative Chart :,Committee Chairperson/Co-ordinator Name :,Committee Chairperson/Co-ordinator Type :,Committee Members :,Updated By :.2,Updated on :.1,Document :.1,Organisation Chain :,Tender ID :,Tender Ref No :,Tender Title :,Type :.1,Summary :.1,Updated By :.3,Updated On :.1,Document :.2,Committee Chairperson/Co-ordinator Name :.1,Committee Chairperson/Co-ordinator Type :.1,Committee Members :.1,Updated By :.4,Updated On :.2,Financial Bid Opening Date:,Document :.3,Tender Stage
EIC-CIVIL||SERNB-CIRCLE-BOLANGIR||EERNB-DIVISION-KANTABANJI,09/KBJ/2022-23,2022_EICCL_84374_6,Yes,National Competitive Bid,Percentage,Works,2.0,No,No,Online,No,No,No,1.0,Fee/PreQual/Technical,.pdf,"Contractor Registration Certificate, CDMS Certificate, GST Registration Certificate, GSTIN, PAN",19-Dec-2022 11:00 AM,31-Dec-2022 11:30 AM,19-Dec-2022 11:00 AM,30-Dec-2022 05:00 PM,19-Dec-2022 11:00 AM ,21-Dec-2022 05:00 PM ,19-Dec-2022 11:00 AM,30-Dec-2022 05:00 PM,20-Jan-2023 12:30 PM,0.0,No,fixed,,Nil,Nil,1.0,ICICI BANK,"10,000",0.0,Nil,Nil,No,Superintending Engineer Kantabanji(RandB)Division,O/O the Superintending Engineer Kantabanji (RandB) Division,Construction of New Building for Day Care PHC (N) at Bhainsa under Patnagarh Block,Construction of New Building for Day Care PHC (N) at Bhainsa under Patnagarh Block,Please refer tender documents ,NA ,"70,93,087",Civil Works - Buildings,NA ,Tender,90.0,180.0,KANTABANJI,767039.0,NA ,NA ,NA ,O/O the S.E. Kantabanji (RandB) Division,No ,No,AOC,23-Jun-2024,"INR 6,029,833",180.0,Arjuna Behera,23-Jun-2024 08:48 PM,865.pdf (1953.00 KB),Agreement drawn and work order issued on 01.03.2023,1.0,2035677.0,PRABHASH KUMAR JAIN,INR,"6,029,833",1,2035956,JAYANTA MEHER,30-Dec-2022 04:26 PM,Rejected-Technical,"Rejected, due to not uploded documents in support of machineries and Schedule-C as per Clause No.7 and 114(e) of DTCN",20-Jan-2023 11:27 AM,Finance,Financial Bid (Cover-II) opened on 20.01.2023,Arjuna Behera,21-Jan-2023 07:00 PM,finance_421351.pdf,BOQ Comparative Chart,Arjuna Behera,Internal,Sitesh Kumar Sidhartha Das,Arjuna Behera,23-Jun-2024 08:45 PM,finsummary_421351.pdf (1663.31 KB),EIC-CIVIL||SERNB-CIRCLE-BOLANGIR||EERNB-DIVISION-KANTABANJI,2022_EICCL_84374_6,09/KBJ/2022-23,Construction of New Building for Day Care PHC (N) at Bhainsa under Patnagarh Block,Technical,Technical Bid opened on 31.12.2022,Arjuna Behera,03-Jan-2023 06:18 PM,technical_421351.pdf,Arjuna Behera,Internal,Anil Kumar Sidhartha Das,Arjuna Behera,20-Jan-2023 11:27 AM,20-Jan-2023 12:30 PM,techsummary_421351.pdf (300.02 KB),AOC
,,,,,,,,,,,,,,,,.pdf,"Affidavit of correctness of documents, No Relationship Certificate, Other documents as per DTCN",,,,,,,,,,,,,,,,2.0,ICICI NEFT/RTGS,,,,,,,,,,,,,,,,,,,,,,,,,,AOC,,,,,,,,,,,,,2,2034925,MAHAMMED RIZWAN,30-Dec-2022 10:28 AM,Rejected-AOC,Selected as L2 through transparent lottery,23-Jun-2024 08:48 PM,,,,,,,,,,,,,,,,,,,,,,,,,,,,,AOC
,,,,,,,,,,,,,,2.0,Finance,.xls,BoQ,,,,,,,,,,,,,,,,,,,,,,,,,,,,,,,,,,,,,,,,,,,AOC,,,,,,,,,,,,,3,2026948,M/S AYAAN VENTURES,24-Dec-2022 05:45 PM,Rejected-AOC,OK,23-Jun-2024 08:48 PM,,,,,,,,,,,,,,,,,,,,,,,,,,,,,AOC
,,,,,,,,,,,,,,,,,,,,,,,,,,,,,,,,,,,,,,,,,,,,,,,,,,,,,,,,,,,,AOC,,,,,,,,,,,,,4,2035677,PRABHASH KUMAR JAIN,30-Dec-2022 01:29 PM,Accepted-AOC,Selected as L1 through transparent lottery,23-Jun-2024 08:48 PM,,,,,,,,,,,,,,,,,,,,,,,,,,,,,AOC
,,,,,,,,,,,,,,,,,,,,,,,,,,,,,,,,,,,,,,,,,,,,,,,,,,,,,,,,,,,,AOC,,,,,,,,,,,,,5,2035256,PRITAM KUMAR PATRA,29-Dec-2022 11:21 PM,Rejected-AOC,OK,23-Jun-2024 08:48 PM,,,,,,,,,,,,,,,,,,,,,,,,,,,,,AOC
