Organisation Chain,Tender Reference Number,Tender ID,Withdrawal Allowed,Tender Type,Form of contract,Tender Category,No. of Covers,General Technical Evaluation Allowed,ItemWise Technical Evaluation Allowed,Payment Mode,Is Multi Currency Allowed For BOQ,Is Multi Currency Allowed For Fee,Allow Two Stage Bidding,Cover No,Cover,Document Type,Description,Publish Date,Bid Opening Date,Document Download / Sale Start Date,Document Download / Sale End Date,Clarification Start Date,Clarification End Date,Bid Submission Start Date,Bid Submission End Date,EMD Amount in ₹,EMD Exemption Allowed,EMD Fee Type,EMD Percentage,EMD Payable To,EMD Payable At,S.No,Bank Name,Tender Fee in ₹,VAT Charges in ₹,Fee Payable To,Fee Payable At,Tender Fee Exemption Allowed,Name,Address,Title,Work Description,Pre Qualification Details,Independent External Monitor/Remarks,Tender Value in ₹,Product Category,Sub category,Contract Type,Bid Validity(Days),Period Of Work(Days),Location,Pincode,Pre Bid Meeting Place,Pre Bid Meeting Address,Pre Bid Meeting Date,Bid Opening Place,Should Allow NDA Tender,Allow Preferential Bidder,Tender Stage,Contract Date :,Contract Value :,Work Completion Period in days :,Updated By :,Updated on :,AOC document :,AOC Description :,S.No,Bid Number,Bidder Name,Awarded Currency,Awarded Value,S.No.1,Bid Number.1,Bidder Name.1,Submitted Date,Status,Remarks,Status Updated On,Type :,Summary :,Updated By :.1,Updated On :,Document :,BOQ Comparative Chart :,Committee Chairperson/Co-ordinator Name :,Committee Chairperson/Co-ordinator Type :,Committee Members :,Updated By :.2,Updated on :.1,Document :.1,Organisation Chain :,Tender ID :,Tender Ref No :,Tender Title :,Committee Chairperson/Co-ordinator Name :.1,Committee Chairperson/Co-ordinator Type :.1,Committee Members :.1,Updated By :.3,Updated On :.1,Document :.2,Tender Stage
EIC-CIVIL||SERNB-CIRCLE-BOLANGIR||EERNB-DIVISION-KANTABANJI,03/KBJ/2022-23,2022_EICCL_80245_3,Yes,National Competitive Bid,Percentage,Works,1.0,No,No,Online,No,No,No,1.0,Fee/PreQual/Technical/Finance,.pdf,"Contractor Registration Certificate, CDMS Certificate GST Registration Certificate, GSTIN, PAN",03-Aug-2022 11:00 AM,22-Aug-2022 10:30 AM,03-Aug-2022 11:00 AM,20-Aug-2022 05:00 PM,03-Aug-2022 11:00 AM ,06-Aug-2022 05:00 PM ,03-Aug-2022 11:00 AM,20-Aug-2022 05:00 PM,0.0,No,fixed,,Nil,Nil,1.0,ICICI BANK,"6,000",0.0,Nil,Nil,No,Superintending Engineer Kantabanji (RandB) Divn.,O/O the Superintending Engineer Kantabanji (RandB) Division,Construction of 3 Nos. F type Quarter at CHC Kantabanji in Balangir District under Mo Sarkar,Construction of 3 Nos. F type Quarter at CHC Kantabanji in Balangir District under Mo Sarkar,Please refer tender documents ,NA ,"49,86,006",Civil Works - Buildings,NA ,Tender,90.0,180.0,KANTABANJI,767039.0,NA ,NA ,NA ,O/O the S.E. Kantabanji (RandB) Division,No ,No,AOC,21-Jun-2024,"INR 4,238,604",180.0,Arjuna Behera,21-Jun-2024 01:09 PM,2827.pdf (751.00 KB),Agreement drawn and work order issued on 02.11.2022,1.0,1919088.0,SHAILESH PRASADGOEL,INR,"4,238,604",1,1916400,Gokul Pradhan,15-Aug-2022 05:05 PM,Rejected-Technical,Rejected due to not uploaded of HT/LT Electrical License as per Clause No.08 of DTCN,22-Sep-2022 08:20 PM,Finance,Technical Bid opened on 06.09.2022,Arjuna Behera,15-Sep-2022 11:03 AM,finance_407019.pdf,BOQ Comparative Chart,Arjuna Behera,Internal,Sidhartha Das Anil Kumar,Arjuna Behera,29-Sep-2022 06:39 PM,finsummary_407019.pdf (535.70 KB),EIC-CIVIL||SERNB-CIRCLE-BOLANGIR||EERNB-DIVISION-KANTABANJI,2022_EICCL_80245_3,03/KBJ/2022-23,Construction of 3 Nos. F type Quarter at CHC Kantabanji in Balangir District under Mo Sarkar,Arjuna Behera,Internal,Anil Kumar Sidhartha Das,Arjuna Behera,22-Sep-2022 08:20 PM,techsummary_407019.pdf (320.72 KB),AOC
,,,,,,,,,,,,,,,,.pdf,"Affidavit of correctness of documents, No Relationship Certificate, Other documents as per DTCN",,,,,,,,,,,,,,,2.0,ICICI NEFT/RTGS,,,,,,,,,,,,,,,,,,,,,,,,,,AOC,,,,,,,,,,,,,2,1917698,Hemraj Jain,18-Aug-2022 11:13 AM,Rejected-AOC,Selected L2 through transparent lottery,21-Jun-2024 01:09 PM,,,,,,,,,,,,,,,,,,,,,,,AOC
,,,,,,,,,,,,,,,,.xls,BoQ,,,,,,,,,,,,,,,,,,,,,,,,,,,,,,,,,,,,,,,,,,AOC,,,,,,,,,,,,,3,1917895,PRATIK ARYA,18-Aug-2022 04:52 PM,Rejected-AOC,OK,21-Jun-2024 01:09 PM,,,,,,,,,,,,,,,,,,,,,,,AOC
,,,,,,,,,,,,,,,,,,,,,,,,,,,,,,,,,,,,,,,,,,,,,,,,,,,,,,,,,,,AOC,,,,,,,,,,,,,4,1918906,PRITAM KUMAR PATRA,20-Aug-2022 10:40 AM,Rejected-Technical,Rejected due to not uploaded of HT/LT Electrical License as per Clause No.08 of DTCN,22-Sep-2022 08:20 PM,,,,,,,,,,,,,,,,,,,,,,,AOC
,,,,,,,,,,,,,,,,,,,,,,,,,,,,,,,,,,,,,,,,,,,,,,,,,,,,,,,,,,,AOC,,,,,,,,,,,,,5,1919088,SHAILESH PRASADGOEL,20-Aug-2022 02:52 PM,Accepted-AOC,Selected L1 through transparent lottery,21-Jun-2024 01:09 PM,,,,,,,,,,,,,,,,,,,,,,,AOC
