Organisation Chain,Tender Reference Number,Tender ID,Withdrawal Allowed,Tender Type,Form of contract,Tender Category,No. of Covers,General Technical Evaluation Allowed,ItemWise Technical Evaluation Allowed,Payment Mode,Is Multi Currency Allowed For BOQ,Is Multi Currency Allowed For Fee,Allow Two Stage Bidding,Cover No,Cover,Document Type,Description,Publish Date,Bid Opening Date,Document Download / Sale Start Date,Document Download / Sale End Date,Clarification Start Date,Clarification End Date,Bid Submission Start Date,Bid Submission End Date,EMD Amount in ₹,EMD Exemption Allowed,EMD Fee Type,EMD Percentage,EMD Payable To,EMD Payable At,S.No,Bank Name,Tender Fee in ₹,VAT Charges in ₹,Fee Payable To,Fee Payable At,Tender Fee Exemption Allowed,Name,Address,Title,Work Description,Pre Qualification Details,Independent External Monitor/Remarks,Tender Value in ₹,Product Category,Sub category,Contract Type,Bid Validity(Days),Period Of Work(Days),Location,Pincode,Pre Bid Meeting Place,Pre Bid Meeting Address,Pre Bid Meeting Date,Bid Opening Place,Should Allow NDA Tender,Allow Preferential Bidder,Tender Stage,Contract Date :,Contract Value :,Work Completion Period in days :,Updated By :,Updated on :,AOC document :,AOC Description :,S.No,Bid Number,Bidder Name,Awarded Currency,Awarded Value,S.No.1,Bid Number.1,Bidder Name.1,Submitted Date,Status,Remarks,Status Updated On,Type :,Summary :,Updated By :.1,Updated On :,Document :,BOQ Comparative Chart :,Committee Chairperson/Co-ordinator Name :,Committee Chairperson/Co-ordinator Type :,Committee Members :,Updated By :.2,Updated on :.1,Document :.1,Organisation Chain :,Tender ID :,Tender Ref No :,Tender Title :,Committee Chairperson/Co-ordinator Name :.1,Committee Chairperson/Co-ordinator Type :.1,Committee Members :.1,Updated By :.3,Updated On :.1,Document :.2,Tender Stage
CE RW I||RWCIRCLE-BERHAMPUR||RWDIVISION-BOUDH,Online Tender05/EERW Boudh/2023-24,2024_CERWI_100074_1,Yes,National Competitive Bid,Percentage,Works,1.0,No,No,Online,No,No,No,1.0,Fee/PreQual/Technical/Finance,.pdf,"Registration certificate,PAN,GSTIN towards paper cost EMD and affidavit other documents as per DTCN",24-Jan-2024 03:00 PM,01-Feb-2024 11:00 AM,24-Jan-2024 03:00 PM,30-Jan-2024 05:00 PM,24-Jan-2024 03:00 PM ,29-Jan-2024 05:00 PM ,24-Jan-2024 03:00 PM,30-Jan-2024 05:00 PM,"20,000",Yes,fixed,,Nil,Nil,1.0,ICICI BANK,"6,000",0.0,Nil,Nil,No,Executive Engineer,O/o EERW Division Boudh,Construction of E type quarter of RW Section I at Boudh for the year 2023-24,Construction of E type quarter of RW Section I at Boudh for the year 2023-24,Please refer DTCN ,NA ,"19,99,928",Civil Works - Buildings,NA ,Tender,90.0,180.0,O/o SERW Division Boudh,762014.0,NA ,NA ,NA ,O/o SERW Division Boudh,No ,No,AOC,19-Jun-2024,"INR 1,700,139",180.0,Sudhakar Naik,19-Jun-2024 11:26 AM,818.pdf (648.00 KB),He is submitted EMD at the time of agreement,1.0,2407716.0,BIJAYA KUMAR PRUSTY,INR,"1,700,139",1,2408841,BALGOPAL PRADHAN,29-Jan-2024 09:54 AM,Rejected-Finance,Disqualified the lottary system,17-Feb-2024 12:07 PM,Finance,All Bidder acctpted,Sudhakar Naik,17-Feb-2024 12:02 PM,finance_487183.pdf,BOQ Comparative Chart,EE,Internal,EE DAO Estimator,Sudhakar Naik,17-Feb-2024 12:07 PM,finsummary_487183.pdf (631.51 KB),CE RW I||RWCIRCLE-BERHAMPUR||RWDIVISION-BOUDH,2024_CERWI_100074_1,Online Tender05/EERW Boudh/2023-24,Construction of E type quarter of RW Section I at Boudh for the year 2023-24,EE,Internal,EE DAO Estimator,Sudhakar Naik,17-Feb-2024 12:03 PM,techsummary_487183.pdf (631.51 KB),AOC
,,,,,,,,,,,,,,,,.pdf,NIT,,,,,,,,,,,,,,,2.0,ICICI NEFT/RTGS,,,,,,,,,,,,,,,,,,,,,,,,,,AOC,,,,,,,,,,,,,2,2407716,BIJAYA KUMAR PRUSTY,28-Jan-2024 10:54 AM,Accepted-AOC,He is submitted EMD at the time of agreement,19-Jun-2024 11:27 AM,,,,,,,,,,,,,,,,,,,,,,,AOC
,,,,,,,,,,,,,,,,.pdf,DTCN,,,,,,,,,,,,,,,,,,,,,,,,,,,,,,,,,,,,,,,,,,AOC,,,,,,,,,,,,,3,2407007,Dhukhi Shyam Sethi,27-Jan-2024 01:34 PM,Rejected-Finance,Disqualified the lottary system,17-Feb-2024 12:07 PM,,,,,,,,,,,,,,,,,,,,,,,AOC
,,,,,,,,,,,,,,,,.pdf,Valid phone number and e mail ID are mandatory,,,,,,,,,,,,,,,,,,,,,,,,,,,,,,,,,,,,,,,,,,AOC,,,,,,,,,,,,,4,2407794,RAKESH KUMAR KUDEI,28-Jan-2024 11:41 AM,Rejected-Finance,Disqualified the lottary system,17-Feb-2024 12:07 PM,,,,,,,,,,,,,,,,,,,,,,,AOC
,,,,,,,,,,,,,,,,.xls,BOQ,,,,,,,,,,,,,,,,,,,,,,,,,,,,,,,,,,,,,,,,,,AOC,,,,,,,,,,,,,5,2408003,RINARANI MEHER,28-Jan-2024 01:45 PM,Rejected-Finance,Disqualified the lottary system,17-Feb-2024 12:07 PM,,,,,,,,,,,,,,,,,,,,,,,AOC
,,,,,,,,,,,,,,,,,,,,,,,,,,,,,,,,,,,,,,,,,,,,,,,,,,,,,,,,,,,AOC,,,,,,,,,,,,,6,2407924,SAMUKA MEHER,28-Jan-2024 01:39 PM,Rejected-Finance,Disqualified the lottary system,17-Feb-2024 12:07 PM,,,,,,,,,,,,,,,,,,,,,,,AOC
