Organisation Chain,Tender Reference Number,Tender ID,Withdrawal Allowed,Tender Type,Form of contract,Tender Category,No. of Covers,General Technical Evaluation Allowed,ItemWise Technical Evaluation Allowed,Payment Mode,Is Multi Currency Allowed For BOQ,Is Multi Currency Allowed For Fee,Allow Two Stage Bidding,Cover No,Cover,Document Type,Description,Publish Date,Bid Opening Date,Document Download / Sale Start Date,Document Download / Sale End Date,Clarification Start Date,Clarification End Date,Bid Submission Start Date,Bid Submission End Date,EMD Amount in ₹,EMD Exemption Allowed,EMD Fee Type,EMD Percentage,EMD Payable To,EMD Payable At,S.No,Bank Name,Tender Fee in ₹,VAT Charges in ₹,Fee Payable To,Fee Payable At,Tender Fee Exemption Allowed,Name,Address,Title,Work Description,Pre Qualification Details,Independent External Monitor/Remarks,Tender Value in ₹,Product Category,Sub category,Contract Type,Bid Validity(Days),Period Of Work(Days),Location,Pincode,Pre Bid Meeting Place,Pre Bid Meeting Address,Pre Bid Meeting Date,Bid Opening Place,Should Allow NDA Tender,Allow Preferential Bidder,Tender Stage,Contract Date :,Contract Value :,Work Completion Period in days :,Updated By :,Updated on :,AOC document :,AOC Description :,S.No,Bid Number,Bidder Name,Awarded Currency,Awarded Value,S.No.1,Bid Number.1,Bidder Name.1,Submitted Date,Status,Remarks,Status Updated On,Type :,Summary :,Updated By :.1,Updated On :,Document :,BOQ Comparative Chart :,Committee Chairperson/Co-ordinator Name :,Committee Chairperson/Co-ordinator Type :,Committee Members :,Updated By :.2,Updated on :.1,Document :.1,Organisation Chain :,Tender ID :,Tender Ref No :,Tender Title :,Committee Chairperson/Co-ordinator Name :.1,Committee Chairperson/Co-ordinator Type :.1,Committee Members :.1,Updated By :.3,Updated On :.1,Document :.2,Tender Stage
EIC-CIVIL||SERNB-CIRCLE-KEONJHAR||EERNB-DIVN-ROURKELA,Bid ID 27 of 2022-23,2022_EICCL_80561_6,Yes,Open Tender,Percentage,Works,1.0,No,No,Online,No,No,No,1.0,Fee/PreQual/Technical/Finance,.pdf,"Registration certificate, Registration in CDMS, PAN Card, GSTIN Certificate, Affidavit etc",19-Aug-2022 06:00 PM,30-Aug-2022 11:40 AM,19-Aug-2022 06:00 PM,29-Aug-2022 05:00 PM,19-Aug-2022 06:00 PM ,23-Aug-2022 05:00 PM ,19-Aug-2022 06:00 PM,29-Aug-2022 05:00 PM,0.0,No,fixed,,Nil,Nil,1.0,ICICI BANK,"6,000",0.0,Nil,Nil,No,Office of Superintending Engineer Rourkela R and B,Office of Superintending Engineer Rourkela R and B,Construction of 2 Nos D type quarter G Plus 1 at kioda CHC under OMBADC of Sundargarh district for 2021-22,Construction of 2 Nos D type quarter G Plus 1 at kioda CHC under OMBADC of Sundargarh district for 2021-22,PLease refer tender document ,NA ,"41,52,300",Civil Works - Buildings,NA ,Tender,90.0,180.0,Rourkela,769012.0,NA ,NA ,NA ,Office of Superintending Engineer Rourkela R and B,No ,No,AOC,27-Jun-2024,"INR 4,152,265",180.0,Manoj Kumar Mahananda,27-Jun-2024 12:13 PM,DtypeworkorderKoida.pdf (1604.00 KB),Agmt drawn and Work order issued,1.0,1923481.0,TRILOCHAN SAHOO,INR,"4,152,265",1.0,1922378.0,M/S INDIAN INFRA,25-Aug-2022 05:55 PM,Rejected-Technical,Accepted by Committee,27-Jun-2024 12:06 PM,Finance,Three Bidders Participated,Manoj Kumar Mahananda,27-Jun-2024 12:03 PM,finance_407890.pdf,BOQ Comparative Chart,M K Mahananda,Internal,HS Meena SrDAO Rourkela R and B Division P p parida estimator Rourkela R and B Division,Manoj Kumar Mahananda,27-Jun-2024 12:10 PM,finsummary_407890.pdf (1604.15 KB),EIC-CIVIL||SERNB-CIRCLE-KEONJHAR||EERNB-DIVN-ROURKELA,2022_EICCL_80561_6,Bid ID 27 of 2022-23,Construction of 2 Nos D type quarter G Plus 1 at kioda CHC under OMBADC of Sundargarh district for 2021-22,M K Mahananda,Internal,HS Meena SrDAO Rourkela R and B Division P p parida estimator Rourkela R and B Division,Manoj Kumar Mahananda,27-Jun-2024 12:06 PM,techsummary_407890.pdf (1604.15 KB),AOC
,,,,,,,,,,,,,,,,.pdf,"Financial instruments such as cost of tender paper, EMD, Affidavit etc",,,,,,,,,,,,,,,2.0,ICICI NEFT/RTGS,,,,,,,,,,,,,,,,,,,,,,,,,,AOC,,,,,,,,,,,,,2.0,1923635.0,PRECOCIOUS ENGINEERING WORKS,29-Aug-2022 04:25 PM,Rejected-Technical,Accepted by Committee,27-Jun-2024 12:06 PM,,,,,,,,,,,,,,,,,,,,,,,AOC
,,,,,,,,,,,,,,,,.pdf,"Experience Certificate, List of Machinaries,Lease Deeds , MOU with electrical contractor Affidavit e",,,,,,,,,,,,,,,,,,,,,,,,,,,,,,,,,,,,,,,,,,AOC,,,,,,,,,,,,,3.0,1923481.0,TRILOCHAN SAHOO,29-Aug-2022 01:45 PM,Accepted-AOC,Qualified in the Lottery,27-Jun-2024 12:13 PM,,,,,,,,,,,,,,,,,,,,,,,AOC
,,,,,,,,,,,,,,,,.pdf,"No Relation Certificate, Schedule-E, Schedule-F, Affidavit etc",,,,,,,,,,,,,,,,,,,,,,,,,,,,,,,,,,,,,,,,,,AOC,,,,,,,,,,,,,,,,,,,,,,,,,,,,,,,,,,,,,,,,,,AOC
,,,,,,,,,,,,,,,,.xls,BOQ,,,,,,,,,,,,,,,,,,,,,,,,,,,,,,,,,,,,,,,,,,AOC,,,,,,,,,,,,,,,,,,,,,,,,,,,,,,,,,,,,,,,,,,AOC
