Organisation Chain,Tender Reference Number,Tender ID,Withdrawal Allowed,Tender Type,Form of contract,Tender Category,No. of Covers,General Technical Evaluation Allowed,ItemWise Technical Evaluation Allowed,Payment Mode,Is Multi Currency Allowed For BOQ,Is Multi Currency Allowed For Fee,Allow Two Stage Bidding,Cover No,Cover,Document Type,Description,Publish Date,Bid Opening Date,Document Download / Sale Start Date,Document Download / Sale End Date,Clarification Start Date,Clarification End Date,Bid Submission Start Date,Bid Submission End Date,EMD Amount in ₹,EMD Exemption Allowed,EMD Fee Type,EMD Percentage,EMD Payable To,EMD Payable At,S.No,Bank Name,Tender Fee in ₹,VAT Charges in ₹,Fee Payable To,Fee Payable At,Tender Fee Exemption Allowed,Name,Address,Title,Work Description,Pre Qualification Details,Independent External Monitor/Remarks,Tender Value in ₹,Product Category,Sub category,Contract Type,Bid Validity(Days),Period Of Work(Days),Location,Pincode,Pre Bid Meeting Place,Pre Bid Meeting Address,Pre Bid Meeting Date,Bid Opening Place,Should Allow NDA Tender,Allow Preferential Bidder,Tender Stage,Contract Date :,Contract Value :,Work Completion Period in days :,Updated By :,Updated on :,AOC document :,S.No,Bid Number,Bidder Name,Awarded Currency,Awarded Value,S.No.1,Bid Number.1,Bidder Name.1,Submitted Date,Status,Remarks,Status Updated On,Type :,Summary :,Updated By :.1,Updated On :,Document :,BOQ Comparative Chart :,Committee Chairperson/Co-ordinator Name :,Committee Chairperson/Co-ordinator Type :,Committee Members :,Updated By :.2,Updated on :.1,Document :.1,Organisation Chain :,Tender ID :,Tender Ref No :,Tender Title :,Committee Chairperson/Co-ordinator Name :.1,Committee Chairperson/Co-ordinator Type :.1,Committee Members :.1,Updated By :.3,Updated On :.1,Document :.2,Tender Stage
CE RW I||SE RW PH CIRCLE BBSR||EE RW PH DIVN. BBSR,SERWPH-12/2024-25,2024_CERWI_106421_7,Yes,Open Tender,Percentage,Works,1.0,No,No,Online,No,No,No,1.0,Fee/PreQual/Technical/Finance,.pdf,"Valid License Document as per tender class of contractor in NIT, GST, Certificate, PAN Card",08-Nov-2024 11:00 AM,19-Nov-2024 11:00 AM,08-Nov-2024 11:00 AM,18-Nov-2024 05:00 PM,NA ,NA ,08-Nov-2024 11:00 AM,18-Nov-2024 05:00 PM,"3,000",Yes,fixed,,Nil,Nil,1.0,ICICI BANK,"2,000",0.0,Nil,Nil,No,"Superintending Engineer,RW (PH) Division, BBSR","SE RW (PH) DIVISION, BBSR Behind Esplande mall, Bomikhal, rsulgarh,751010","Construction of P.H. work ( WS, SI AND SD) for AWC at KUNDANALI (3) in the district of Angul.","Construction of P.H. work ( WS, SI AND SD) for AWC at KUNDANALI (3) in the district of Angul.",Please refer Tender documents. ,NA ,"2,96,501",Civil Works - Buildings,NA ,Tender,90.0,90.0,KUNDANALI,759122.0,NA ,NA ,NA ,"O/O THE SE RW (PH) DIVISION,BHUBANESWAR",No ,No,AOC,10-Feb-2025,"INR 252,055",90.0,Anil Kumar Das,11-Feb-2025 09:46 AM,431.pdf (246.00 KB),1.0,2650129.0,SANDHYA RANI NAYAK,INR,"252,055",1,2649487,AMIT KUMAR SAHOO,16-Nov-2024 03:43 PM,Rejected-Finance,Not Qualified in Transparency lottery,10-Feb-2025 05:53 PM,Finance,Document downloaded and process for scrutiny.,Bindusmita Tripathy,19-Nov-2024 12:43 PM,finance_514559.pdf,BOQ Comparative Chart,Supeintending Engineer,Internal,"Sr. DAO, Divisional Estimator",Anil Kumar Das,10-Feb-2025 05:53 PM,finsummary_514559.pdf (59.29 KB),CE RW I||SE RW PH CIRCLE BBSR||EE RW PH DIVN. BBSR,2024_CERWI_106421_7,SERWPH-12/2024-25,"Construction of P.H. work ( WS, SI AND SD) for AWC at KUNDANALI (3) in the district of Angul.",Supeintending Engineer,Internal,"Sr. DAO, Divisional Estimator",Anil Kumar Das,06-Dec-2024 02:27 PM,techsummary_514559.pdf (297.59 KB),AOC
,,,,,,,,,,,,,,,,.pdf,"EMD, Tender paper cost, Affidavit for correctness and No Relation Certificate",,,,,,,,,,,,,,,2.0,ICICI NEFT/RTGS,,,,,,,,,,,,,,,,,,,,,,,,,,AOC,,,,,,,,,,,,2,2649836,NISHITA SWAIN,16-Nov-2024 06:35 PM,Rejected-Finance,Not Qualified in Transparency lottery,10-Feb-2025 05:53 PM,,,,,,,,,,,,,,,,,,,,,,,AOC
,,,,,,,,,,,,,,,,.xls,BOQ,,,,,,,,,,,,,,,,,,,,,,,,,,,,,,,,,,,,,,,,,,AOC,,,,,,,,,,,,3,2647859,PRADIP KUMAR SAMAL,16-Nov-2024 03:37 PM,Rejected-Finance,Not Qualified in Transparency lottery,10-Feb-2025 05:53 PM,,,,,,,,,,,,,,,,,,,,,,,AOC
,,,,,,,,,,,,,,,,,,,,,,,,,,,,,,,,,,,,,,,,,,,,,,,,,,,,,,,,,,,AOC,,,,,,,,,,,,4,2647822,SAMBHU DANGA,15-Nov-2024 07:46 PM,Rejected-Finance,Not Qualified in Transparency lottery,10-Feb-2025 05:53 PM,,,,,,,,,,,,,,,,,,,,,,,AOC
,,,,,,,,,,,,,,,,,,,,,,,,,,,,,,,,,,,,,,,,,,,,,,,,,,,,,,,,,,,AOC,,,,,,,,,,,,5,2650129,SANDHYA RANI NAYAK,17-Nov-2024 10:59 AM,Accepted-AOC,Qualified in Transparency lottery,11-Feb-2025 09:46 AM,,,,,,,,,,,,,,,,,,,,,,,AOC
,,,,,,,,,,,,,,,,,,,,,,,,,,,,,,,,,,,,,,,,,,,,,,,,,,,,,,,,,,,AOC,,,,,,,,,,,,6,2647100,SWAGAT PATTNAIK,15-Nov-2024 02:11 PM,Rejected-Finance,Not Qualified in Transparency lottery,10-Feb-2025 05:53 PM,,,,,,,,,,,,,,,,,,,,,,,AOC
