Organisation Chain,Tender Reference Number,Tender ID,Withdrawal Allowed,Tender Type,Form of contract,Tender Category,No. of Covers,General Technical Evaluation Allowed,ItemWise Technical Evaluation Allowed,Payment Mode,Is Multi Currency Allowed For BOQ,Is Multi Currency Allowed For Fee,Allow Two Stage Bidding,Cover No,Cover,Document Type,Description,Publish Date,Bid Opening Date,Document Download / Sale Start Date,Document Download / Sale End Date,Clarification Start Date,Clarification End Date,Bid Submission Start Date,Bid Submission End Date,Financial Bid Opening Date,EMD Amount in ₹,EMD Exemption Allowed,EMD Fee Type,EMD Percentage,EMD Payable To,EMD Payable At,S.No,Corrigendum Title,Corrigendum Type,View,S.No.1,Bank Name,Tender Fee in ₹,VAT Charges in ₹,Fee Payable To,Fee Payable At,Tender Fee Exemption Allowed,Name,Address,Title,Work Description,Pre Qualification Details,Independent External Monitor/Remarks,Tender Value in ₹,Product Category,Sub category,Contract Type,Bid Validity(Days),Period Of Work(Days),Location,Pincode,Pre Bid Meeting Place,Pre Bid Meeting Address,Pre Bid Meeting Date,Bid Opening Place,Should Allow NDA Tender,Allow Preferential Bidder,Tender Stage,S.No,Bid Number,Bidder Name,Submitted Date,Status,Remarks,Status Updated On,Organisation Chain :,Tender ID :,Tender Ref No :,Tender Title :,Type :,Summary :,Updated By :,Updated On :,Document :,Tender Stage
CE RW I,Tender Online-13/2023-24 (Bridges),2024_CERWI_100910_16,Yes,National Competitive Bid,Percentage,Works,2.0,No,No,Online,No,No,No,1.0,Fee/PreQual/Technical,.pdf,"Paper cost, EMD, GST, PAN, RC, Affidavit correctness certificate and no relation certificate",13-Feb-2024 06:55 PM,23-Feb-2024 11:00 AM,13-Feb-2024 06:55 PM,22-Feb-2024 05:00 PM,13-Feb-2024 06:55 PM ,21-Feb-2024 02:00 PM ,13-Feb-2024 06:55 PM,22-Feb-2024 05:00 PM,11-Sep-2024 11:30 AM,"48,77,298",Yes,percentage,1.0%,Nil,Nil,1.0,1st Corrigendum,Date,,1.0,ICICI BANK,"10,000",0.0,Nil,Nil,No,Chief Engineer Buildings and Bridges,Office of EIC RW Odisha Bhubaneswar,Construction of bridge over river Budhabalanga on Baghuapal to Singhtia under Badasahi Block in the district of Mayurbhanj,Construction of bridge over river Budhabalanga on Baghuapal to Singhtia under Badasahi Block in the district of Mayurbhanj under BSY for the year 2023-24,Please refer Tender documents. ,NA ,"48,77,29,834",Civil Works - Bridges,NA ,Tender,90.0,912.0,Baripada,751001.0,NA ,NA ,NA ,Office of EIC RW Odisha Bhubaneswar,No ,No,AOC,1,2446863,Ashirbad Eng & Construction Private Limited,19-Feb-2024 01:14 PM,Rejected-Finance,Reject,27-Feb-2025 08:19 PM,CE RW I,2024_CERWI_100910_16,Tender Online-13/2023-24 (Bridges),Construction of bridge over river Budhabalanga on Baghuapal to Singhtia under Badasahi Block in the district of Mayurbhanj,Technical,Six bidders participated,Kishor kumar Mishra,23-Feb-2024 01:06 PM,,AOC
,,,,,,,,,,,,,,,,.pdf,"Labour licence, Work experience, Work in hand, ATO, Similar nature of work",,,,,,,,,,,,,,,,,,,,2.0,ICICI NEFT/RTGS,,,,,,,,,,,,,,,,,,,,,,,,,,AOC,2,2453767,GVV CONSTRUCTIONS PRIVATE LIMITED,22-Feb-2024 02:26 PM,Rejected-Finance,Reject,27-Feb-2025 08:19 PM,,,,,,,,,,AOC
,,,,,,,,,,,,,,,,.pdf,Machineries owned obtained on hire and other documents as per DTCN,,,,,,,,,,,,,,,,,,,,,,,,,,,,,,,,,,,,,,,,,,,,,,,AOC,3,2449062,MESSERS BIRAJA CONSTRUCTION,22-Feb-2024 11:17 AM,Rejected-Finance,2nd lowest,27-Feb-2025 08:19 PM,,,,,,,,,,AOC
,,,,,,,,,,,,,,2.0,Finance,.xls,BOQ,,,,,,,,,,,,,,,,,,,,,,,,,,,,,,,,,,,,,,,,,,,,,,,AOC,4,2453711,M/S ARYA CONSTRUCTION,22-Feb-2024 10:53 AM,Accepted-AOC,Agreement no 136P1 of 2024-25,27-Feb-2025 08:25 PM,,,,,,,,,,AOC
,,,,,,,,,,,,,,,,,,,,,,,,,,,,,,,,,,,,,,,,,,,,,,,,,,,,,,,,,,,,,,,,AOC,5,2445403,Naraindas Construction Pvt. Ltd.,22-Feb-2024 01:02 PM,Rejected-Finance,3rd lowest,27-Feb-2025 08:19 PM,,,,,,,,,,AOC
,,,,,,,,,,,,,,,,,,,,,,,,,,,,,,,,,,,,,,,,,,,,,,,,,,,,,,,,,,,,,,,,AOC,6,2451112,SAILABALA INFRASTRUCTURE PRIVATE LIMITED,22-Feb-2024 11:04 AM,Rejected-Finance,Reject,27-Feb-2025 08:19 PM,,,,,,,,,,AOC
