Organisation Chain,Tender Reference Number,Tender ID,Withdrawal Allowed,Tender Type,Form of contract,Tender Category,No. of Covers,General Technical Evaluation Allowed,ItemWise Technical Evaluation Allowed,Payment Mode,Is Multi Currency Allowed For BOQ,Is Multi Currency Allowed For Fee,Allow Two Stage Bidding,Cover No,Cover,Document Type,Description,Publish Date,Bid Opening Date,Document Download / Sale Start Date,Document Download / Sale End Date,Clarification Start Date,Clarification End Date,Bid Submission Start Date,Bid Submission End Date,Financial Bid Opening Date,EMD Amount in ₹,EMD Exemption Allowed,EMD Fee Type,EMD Percentage,EMD Payable To,EMD Payable At,S.No,Bank Name,Tender Fee in ₹,VAT Charges in ₹,Fee Payable To,Fee Payable At,Tender Fee Exemption Allowed,Name,Address,Title,Work Description,Pre Qualification Details,Independent External Monitor/Remarks,Tender Value in ₹,Product Category,Sub category,Contract Type,Bid Validity(Days),Period Of Work(Days),Location,Pincode,Pre Bid Meeting Place,Pre Bid Meeting Address,Pre Bid Meeting Date,Bid Opening Place,Should Allow NDA Tender,Allow Preferential Bidder,Tender Stage,Contract Date :,Contract Value :,Work Completion Period in days :,Updated By :,Updated on :,AOC document :,AOC Description :,S.No,Bid Number,Bidder Name,Awarded Currency,Awarded Value,S.No.1,Bid Number.1,Bidder Name.1,Submitted Date,Status,Remarks,Status Updated On,Type :,Summary :,Updated By :.1,Updated On :,Document :,BOQ Comparative Chart :,Committee Chairperson/Co-ordinator Name :,Committee Chairperson/Co-ordinator Type :,Committee Members :,Updated By :.2,Updated on :.1,Document :.1,Organisation Chain :,Tender ID :,Tender Ref No :,Tender Title :,Type :.1,Summary :.1,Updated By :.3,Updated On :.1,Document :.2,Committee Chairperson/Co-ordinator Name :.1,Committee Chairperson/Co-ordinator Type :.1,Committee Members :.1,Updated By :.4,Updated On :.2,Financial Bid Opening Date:,Document :.3,Tender Stage
EIC-CIVIL||SERNB-CIRCLE-KEONJHAR||EERNB-DIVN-ROURKELA,BID ID 10 of2024-25,2024_EICCL_104003_1,Yes,Open Tender,Percentage,Works,2.0,No,No,Online,No,No,No,1.0,Fee/PreQual/Technical,.pdf,"Registration certificate, Registration in CDMS, PAN Card, GSTIN Certificate, Affidavit etc",01-Aug-2024 10:00 AM,21-Aug-2024 11:00 AM,01-Aug-2024 10:00 AM,20-Aug-2024 05:00 PM,NA ,NA ,01-Aug-2024 10:00 AM,20-Aug-2024 05:00 PM,30-Sep-2024 04:00 PM,"70,800",Yes,fixed,,Nil,Nil,1.0,ICICI BANK,"10,000",0.0,Nil,Nil,No,Additional chie Engineer Rourkela R and B Division,Office of Superintending Engineer Rourkela R and B division,Construction of 1 no twins E type staff quater for CHC lahunipada at lahunipada the year 2024-25,Construction of 1 no twins E type staff quater for CHC lahunipada at lahunipada the year 2024-25,Please refer tender document ,NA ,"70,76,210",Civil Works - Buildings,NA ,Tender,90.0,180.0,Rourkela,769012.0,NA ,NA ,NA ,Office of Superintending Engineer Rourkela R and B,No ,No,AOC,11-Feb-2025,"INR 6,015,487",180.0,Manoj Kumar Mahananda,11-Feb-2025 05:19 PM,Bidyadharwork.pdf (1524.00 KB),Agmt drawn and Work order issued,1.0,2531422.0,BIDYADHAR DAS,INR,"6,015,487",1,2531560,"A R INFRA ,PROP-NELSAN KANDULNA",20-Aug-2024 11:25 AM,Rejected-AOC,Not Qualified in the Lottery,11-Feb-2025 05:19 PM,Finance,6 no of bidder has been participated,Manoj Kumar Mahananda,11-Feb-2025 05:09 PM,finance_504030.pdf,BOQ Comparative Chart,M K Mahananda,Internal,HS Meena SrDAO Rourkela R and B Division P p parida estimator Rourkela R and B Division,Manoj Kumar Mahananda,11-Feb-2025 05:15 PM,finsummary_504030.pdf (1524.28 KB),EIC-CIVIL||SERNB-CIRCLE-KEONJHAR||EERNB-DIVN-ROURKELA,2024_EICCL_104003_1,BID ID 10 of2024-25,Construction of 1 no twins E type staff quater for CHC lahunipada at lahunipada the year 2024-25,Technical,6 bidder has been participated,Manoj Kumar Mahananda,30-Sep-2024 01:03 PM,technical_504030.pdf,M K Mahananda SE rourkela r and b division,Internal,HS Meena DAO Rourkela R and B Division P p parida estimator Rourkela R and B Division,Manoj Kumar Mahananda,30-Sep-2024 01:05 PM,30-Sep-2024 04:00 PM,techsummary_504030.pdf (568.57 KB),AOC
,,,,,,,,,,,,,,,,.pdf,"Financial instruments such as cost of tender paper, EMD, Affidavit etc",,,,,,,,,,,,,,,,2.0,ICICI NEFT/RTGS,,,,,,,,,,,,,,,,,,,,,,,,,,AOC,,,,,,,,,,,,,2,2531422,BIDYADHAR DAS,20-Aug-2024 10:12 AM,Accepted-AOC,Qualified in the Lottery,11-Feb-2025 05:19 PM,,,,,,,,,,,,,,,,,,,,,,,,,,,,,AOC
,,,,,,,,,,,,,,,,.pdf,"Experience Certificate, List of Machinaries,Lease Deeds , MOU with electrical contractor Affidavit e",,,,,,,,,,,,,,,,,,,,,,,,,,,,,,,,,,,,,,,,,,,AOC,,,,,,,,,,,,,3,2530019,BIJAY KUMAR PARIDA,16-Aug-2024 01:01 PM,Rejected-AOC,Not Qualified in the Lottery,11-Feb-2025 05:19 PM,,,,,,,,,,,,,,,,,,,,,,,,,,,,,AOC
,,,,,,,,,,,,,,,,.pdf,"No Relation Certificate, Schedule-E, Schedule-F, Affidavit etc",,,,,,,,,,,,,,,,,,,,,,,,,,,,,,,,,,,,,,,,,,,AOC,,,,,,,,,,,,,4,2531835,BUDHILAL GANJHU,20-Aug-2024 02:18 PM,Rejected-AOC,Not Qualified in the Lottery,11-Feb-2025 05:19 PM,,,,,,,,,,,,,,,,,,,,,,,,,,,,,AOC
,,,,,,,,,,,,,,2.0,Finance,.xls,BOQ,,,,,,,,,,,,,,,,,,,,,,,,,,,,,,,,,,,,,,,,,,,AOC,,,,,,,,,,,,,5,2532073,DEBASISH DANDSENA,20-Aug-2024 04:30 PM,Rejected-AOC,Not Qualified in the Lottery,11-Feb-2025 05:19 PM,,,,,,,,,,,,,,,,,,,,,,,,,,,,,AOC
,,,,,,,,,,,,,,,,,,,,,,,,,,,,,,,,,,,,,,,,,,,,,,,,,,,,,,,,,,,,AOC,,,,,,,,,,,,,6,2527881,SAMIR NAYAK,13-Aug-2024 11:17 AM,Rejected-AOC,Not Qualified in the Lottery,11-Feb-2025 05:19 PM,,,,,,,,,,,,,,,,,,,,,,,,,,,,,AOC
