Organisation Chain,Tender Reference Number,Tender ID,Withdrawal Allowed,Tender Type,Form of contract,Tender Category,No. of Covers,General Technical Evaluation Allowed,ItemWise Technical Evaluation Allowed,Payment Mode,Is Multi Currency Allowed For BOQ,Is Multi Currency Allowed For Fee,Allow Two Stage Bidding,Cover No,Cover,Document Type,Description,Publish Date,Bid Opening Date,Document Download / Sale Start Date,Document Download / Sale End Date,Clarification Start Date,Clarification End Date,Bid Submission Start Date,Bid Submission End Date,Financial Bid Opening Date,EMD Amount in ₹,EMD Exemption Allowed,EMD Fee Type,EMD Percentage,EMD Payable To,EMD Payable At,S.No,Bank Name,Tender Fee in ₹,Fee Payable To,Fee Payable At,Tender Fee Exemption Allowed,Name,Address,Title,Work Description,Pre Qualification Details,Independent External Monitor/Remarks,Tender Value in ₹,Product Category,Sub category,Contract Type,Bid Validity(Days),Period Of Work(Days),Location,Pincode,Pre Bid Meeting Place,Pre Bid Meeting Address,Pre Bid Meeting Date,Bid Opening Place,Should Allow NDA Tender,Allow Preferential Bidder,Tender Stage,Contract Date :,Contract Value :,Work Completion Period in days :,Updated By :,Updated on :,AOC document :,S.No,Bid Number,Bidder Name,Awarded Currency,Awarded Value,S.No.1,Bid Number.1,Bidder Name.1,Submitted Date,Status,Remarks,Status Updated On,Type :,Summary :,Updated By :.1,Updated On :,Document :,BOQ Comparative Chart :,Committee Chairperson/Co-ordinator Name :,Committee Chairperson/Co-ordinator Type :,Committee Members :,Updated By :.2,Updated on :.1,Document :.1,Organisation Chain :,Tender ID :,Tender Ref No :,Tender Title :,Type :.1,Summary :.1,Updated By :.3,Updated On :.1,Document :.2,Committee Chairperson/Co-ordinator Name :.1,Committee Chairperson/Co-ordinator Type :.1,Committee Members :.1,Updated By :.4,Updated On :.2,Financial Bid Opening Date:,Document :.3,Tender Stage
WATCO Bhubaneswar||Director (Operation) Watco||GM WATCO DIVISION-II BBSR,GMWATCO-II/ 44(02)/2024-25 Dt.30.11.2024,2024_GWCDI_107801_1,Yes,National Competitive Bid,Percentage,Works,2.0,No,No,Online,No,No,No,1.0,Fee/PreQual/Technical,.pdf,"Copy of PAN, GST, Affidavits as per DTCN",05-Dec-2024 11:00 AM,21-Dec-2024 12:30 PM,05-Dec-2024 11:00 AM,20-Dec-2024 05:00 PM,05-Dec-2024 11:00 AM ,10-Dec-2024 05:00 PM ,05-Dec-2024 11:00 AM,20-Dec-2024 05:00 PM,02-Jan-2025 04:00 PM,"68,150",Yes,fixed,,Nil,Nil,1.0,ICICI BANK,"11,800",Nil,Nil,No,General Manager,"General Manager, WATCO Division-II, Unit-V, Bhubaneswar-751001, Odisha, Phone (0674) 2390322","Provision of sewerage line at lane No.6 to lane No.12 Bhimeswar marg, Bhimatangi alongwith upgradation of early sewerage, Bhimatangi, BBSR","Provision of sewerage line at lane No.6 to lane No.12 Bhimeswar marg, Bhimatangi alongwith upgradation of early sewerage, Bhimatangi, BBSR",Please refer Tender documents. ,NA ,"68,15,000",Civil Works - Water Works,NA ,Tender,120.0,60.0,"Bhimatangi, BBSR",751002.0,NA ,NA ,NA ,Bhubaneswar,No ,No,AOC,01-Feb-2025,"INR 5,793,421",60.0,Rajendra Nath Nayak,01-Feb-2025 11:50 AM,AOC.pdf (203.00 KB),1.0,2688547.0,SRABANI KAR,INR,"5,793,421",1,2692105,AQUA SERVICES,17-Dec-2024 07:04 PM,Rejected-AOC,Not a lowest bidder,01-Feb-2025 11:50 AM,Finance,Five no financial bids are received online and the bid is admitted subject to detail scrutiny after downloading the bid documents and after which the bid will be finally determined as valid or invalid,Rajendra Nath Nayak,02-Jan-2025 04:15 PM,,BOQ Comparative Chart,General Manager,Internal,,Rajendra Nath Nayak,01-Feb-2025 11:39 AM,finsummary_518936.pdf (205.49 KB),WATCO Bhubaneswar||Director (Operation) Watco||GM WATCO DIVISION-II BBSR,2024_GWCDI_107801_1,GMWATCO-II/ 44(02)/2024-25 Dt.30.11.2024,"Provision of sewerage line at lane No.6 to lane No.12 Bhimeswar marg, Bhimatangi alongwith upgradation of early sewerage, Bhimatangi, BBSR",Technical,Five no technical bids are received online and the bid is admitted subject to detail scrutiny after downloading the bid documents and after which the bid will be finally determined as valid or invalid,Rajendra Nath Nayak,21-Dec-2024 01:19 PM,,General Manager,Internal,,Rajendra Nath Nayak,02-Jan-2025 11:51 AM,02-Jan-2025 04:00 PM,techsummary_518936.pdf (303.57 KB),AOC
,,,,,,,,,,,,,,,,.pdf,"Certificates, Formats, Schedules and other documents if any as per DTCN",,,,,,,,,,,,,,,,2.0,ICICI NEFT/RTGS,,,,,,,,,,,,,,,,,,,,,,,,,AOC,,,,,,,,,,,,2,2691380,MAMATA BARAL,16-Dec-2024 04:51 PM,Rejected-AOC,Not a lowest bidder,01-Feb-2025 11:50 AM,,,,,,,,,,,,,,,,,,,,,,,,,,,,,AOC
,,,,,,,,,,,,,,2.0,Finance,.xls,Bill of Quantity,,,,,,,,,,,,,,,,,,,,,,,,,,,,,,,,,,,,,,,,,,AOC,,,,,,,,,,,,3,2688547,SRABANI KAR,09-Dec-2024 10:34 AM,Accepted-AOC,Lowest bidder,01-Feb-2025 11:50 AM,,,,,,,,,,,,,,,,,,,,,,,,,,,,,AOC
,,,,,,,,,,,,,,,,,,,,,,,,,,,,,,,,,,,,,,,,,,,,,,,,,,,,,,,,,,,AOC,,,,,,,,,,,,4,2700331,SUDARSAN DAS,17-Dec-2024 12:49 PM,Rejected-AOC,Not a lowest bidder,01-Feb-2025 11:50 AM,,,,,,,,,,,,,,,,,,,,,,,,,,,,,AOC
,,,,,,,,,,,,,,,,,,,,,,,,,,,,,,,,,,,,,,,,,,,,,,,,,,,,,,,,,,,AOC,,,,,,,,,,,,5,2690580,SUSANTA NAYAK,15-Dec-2024 02:03 PM,Rejected-AOC,Not a lowest bidder,01-Feb-2025 11:50 AM,,,,,,,,,,,,,,,,,,,,,,,,,,,,,AOC
