Organisation Chain,Tender Reference Number,Tender ID,Withdrawal Allowed,Tender Type,Form of contract,Tender Category,No. of Covers,General Technical Evaluation Allowed,ItemWise Technical Evaluation Allowed,Payment Mode,Is Multi Currency Allowed For BOQ,Is Multi Currency Allowed For Fee,Allow Two Stage Bidding,Cover No,Cover,Document Type,Description,Publish Date,Bid Opening Date,Document Download / Sale Start Date,Document Download / Sale End Date,Clarification Start Date,Clarification End Date,Bid Submission Start Date,Bid Submission End Date,Financial Bid Opening Date,EMD Amount in ₹,EMD Exemption Allowed,EMD Fee Type,EMD Percentage,EMD Payable To,EMD Payable At,S.No,Bank Name,Tender Fee in ₹,VAT Charges in ₹,Fee Payable To,Fee Payable At,Tender Fee Exemption Allowed,Name,Address,Title,Work Description,Pre Qualification Details,Independent External Monitor/Remarks,Tender Value in ₹,Product Category,Sub category,Contract Type,Bid Validity(Days),Period Of Work(Days),Location,Pincode,Pre Bid Meeting Place,Pre Bid Meeting Address,Pre Bid Meeting Date,Bid Opening Place,Should Allow NDA Tender,Allow Preferential Bidder,Tender Stage,Contract Date :,Contract Value :,Work Completion Period in days :,Updated By :,Updated on :,AOC document :,AOC Description :,S.No,Bid Number,Bidder Name,Awarded Currency,Awarded Value,S.No.1,Bid Number.1,Bidder Name.1,Submitted Date,Status,Remarks,Status Updated On,Type :,Summary :,Updated By :.1,Updated On :,Document :,BOQ Comparative Chart :,Committee Chairperson/Co-ordinator Name :,Committee Chairperson/Co-ordinator Type :,Committee Members :,Updated By :.2,Updated on :.1,Document :.1,Organisation Chain :,Tender ID :,Tender Ref No :,Tender Title :,Type :.1,Summary :.1,Updated By :.3,Updated On :.1,Document :.2,Committee Chairperson/Co-ordinator Name :.1,Committee Chairperson/Co-ordinator Type :.1,Committee Members :.1,Updated By :.4,Updated On :.2,Financial Bid Opening Date:,Document :.3,Tender Stage
EIC-CIVIL||SERNB-CIRCLE-KEONJHAR||EERNB-DIVN-ROURKELA,Bid Id 61 of 2024-25,2024_EICCL_107160_1,Yes,Open Tender,Percentage,Works,2.0,No,No,Online,No,No,No,1.0,Fee/PreQual/Technical,.pdf,"Registration certificate, Registration in CDMS, PAN Card, GSTIN Certificate, Affidavit etc",19-Nov-2024 11:00 AM,30-Nov-2024 01:00 PM,19-Nov-2024 11:00 AM,29-Nov-2024 05:00 PM,19-Nov-2024 11:00 AM ,28-Nov-2024 05:00 PM ,19-Nov-2024 11:00 AM,29-Nov-2024 05:00 PM,18-Dec-2024 02:30 PM,"86,800",Yes,fixed,,Nil,Nil,1.0,ICICI BANK,"10,000",0.0,Nil,Nil,No,Additional Chief Engineer,OfficeofSuperintendingEngineer Rourkela RandBDivision,Rehabilitation of ROB at LC -212 on Panposh-Uditnagar Road with Improvement of approach road in the dist. of Sundaragrh under State Plan for the year 2024-25,Rehabilitation of ROB at LC -212 on Panposh-Uditnagar Road with Improvement of approach road in the dist. of Sundaragrh under State Plan for the year 2024-25,Please refer Tender documents. ,NA ,"86,76,348",Civil Works - Roads,NA ,Tender,90.0,90.0,Rourkela,769012.0,NA ,NA ,NA ,OfficeofSuperintendingEngineer Rourkela RandBDivis,No ,No,AOC,20-Feb-2025,"INR 7,875,763",90.0,Manoj Kumar Mahananda,20-Feb-2025 06:06 PM,Rob212workorder.pdf (390.00 KB),stood1stlowestintransparentlottery. Agmt drawn and Work order issued,1.0,2672174.0,DEEPAK KUMAR ROUT,INR,"7,375,763",1,2669502,CHITA RANJAN SWAIN,27-Nov-2024 03:28 PM,Rejected-AOC,2nd lowest,20-Feb-2025 06:06 PM,Finance,Allthe6nosbiddershavefurnishedminimumrequisitedocuments,Manoj Kumar Mahananda,20-Feb-2025 12:52 PM,finance_516595.pdf,BOQ Comparative Chart,SERandbdivisionRourkelaDAORourkelaRandBDivisionAEstimatorRourkelaRandB Division,Internal,SERandbdivisionRourkelaDAORourkelaRandBDivisionAEstimatorRourkelaRandB Division,Manoj Kumar Mahananda,20-Feb-2025 04:15 PM,finsummary_516595.pdf (360.72 KB),EIC-CIVIL||SERNB-CIRCLE-KEONJHAR||EERNB-DIVN-ROURKELA,2024_EICCL_107160_1,Bid Id 61 of 2024-25,Rehabilitation of ROB at LC -212 on Panposh-Uditnagar Road with Improvement of approach road in the dist. of Sundaragrh under State Plan for the year 2024-25,Technical,All the bidders have furnished minimum requisite documents,Manoj Kumar Mahananda,18-Dec-2024 01:26 PM,technical_516595.pdf,M K Mahananda ACE Rourkela R and B Division,Internal,HS Meena DAO Rourkela R and B Division J A Rath AEE Rourkela R and B Division,Manoj Kumar Mahananda,18-Dec-2024 01:40 PM,18-Dec-2024 02:30 PM,techsummary_516595.pdf (403.76 KB),AOC
,,,,,,,,,,,,,,,,.pdf,"Financial instruments such as cost of tender paper, Bid Security, Affidavit etc",,,,,,,,,,,,,,,,2.0,ICICI NEFT/RTGS,,,,,,,,,,,,,,,,,,,,,,,,,,AOC,,,,,,,,,,,,,2,2672174,DEEPAK KUMAR ROUT,28-Nov-2024 07:17 PM,Accepted-AOC,stood1stlowestintransparentlottery. Agmt drawn and Work order issued,20-Feb-2025 06:06 PM,,,,,,,,,,,,,,,,,,,,,,,,,,,,,AOC
,,,,,,,,,,,,,,,,.pdf,"ExperienceCertificate,List of Machinaries,Lease Deeds, Affidavit etc",,,,,,,,,,,,,,,,,,,,,,,,,,,,,,,,,,,,,,,,,,,AOC,,,,,,,,,,,,,3,2672961,KUNTALA MOHAPATRA,29-Nov-2024 01:10 PM,Rejected-AOC,2nd lowest,20-Feb-2025 06:06 PM,,,,,,,,,,,,,,,,,,,,,,,,,,,,,AOC
,,,,,,,,,,,,,,,,.pdf,"No Relation Certificate, Schedule-E, Schedule-F, Affidavit etc",,,,,,,,,,,,,,,,,,,,,,,,,,,,,,,,,,,,,,,,,,,AOC,,,,,,,,,,,,,4,2670889,M/S P M CONSTRUCTIONS,29-Nov-2024 01:02 PM,Rejected-AOC,2nd lowest,20-Feb-2025 06:06 PM,,,,,,,,,,,,,,,,,,,,,,,,,,,,,AOC
,,,,,,,,,,,,,,2.0,Finance,.xls,Boq,,,,,,,,,,,,,,,,,,,,,,,,,,,,,,,,,,,,,,,,,,,AOC,,,,,,,,,,,,,5,2672510,SUBASHIS SAHOO,29-Nov-2024 10:58 AM,Rejected-AOC,2nd lowest,20-Feb-2025 06:06 PM,,,,,,,,,,,,,,,,,,,,,,,,,,,,,AOC
,,,,,,,,,,,,,,,,,,,,,,,,,,,,,,,,,,,,,,,,,,,,,,,,,,,,,,,,,,,,AOC,,,,,,,,,,,,,6,2670817,SUBHASIS JENA,29-Nov-2024 01:18 PM,Rejected-AOC,2nd lowest,20-Feb-2025 06:06 PM,,,,,,,,,,,,,,,,,,,,,,,,,,,,,AOC
