Organisation Chain,Tender Reference Number,Tender ID,Withdrawal Allowed,Tender Type,Form of contract,Tender Category,No. of Covers,General Technical Evaluation Allowed,ItemWise Technical Evaluation Allowed,Payment Mode,Is Multi Currency Allowed For BOQ,Is Multi Currency Allowed For Fee,Allow Two Stage Bidding,Cover No,Cover,Document Type,Description,Publish Date,Bid Opening Date,Document Download / Sale Start Date,Document Download / Sale End Date,Clarification Start Date,Clarification End Date,Bid Submission Start Date,Bid Submission End Date,Financial Bid Opening Date,EMD Amount in ₹,EMD Exemption Allowed,EMD Fee Type,EMD Percentage,EMD Payable To,EMD Payable At,S.No,Corrigendum Title,Corrigendum Type,View,S.No.1,Bank Name,Tender Fee in ₹,VAT Charges in ₹,Fee Payable To,Fee Payable At,Tender Fee Exemption Allowed,Name,Address,Title,Work Description,Pre Qualification Details,Independent External Monitor/Remarks,Tender Value in ₹,Product Category,Sub category,Contract Type,Bid Validity(Days),Period Of Work(Days),Location,Pincode,Pre Bid Meeting Place,Pre Bid Meeting Address,Pre Bid Meeting Date,Bid Opening Place,Should Allow NDA Tender,Allow Preferential Bidder,Tender Stage,Contract Date :,Contract Value :,Work Completion Period in days :,Updated By :,Updated on :,AOC document :,AOC Description :,S.No,Bid Number,Bidder Name,Awarded Currency,Awarded Value,S.No.1,Bid Number.1,Bidder Name.1,Submitted Date,Status,Remarks,Status Updated On,Type :,Summary :,Updated By :.1,Updated On :,Document :,BOQ Comparative Chart :,Committee Chairperson/Co-ordinator Name :,Committee Chairperson/Co-ordinator Type :,Committee Members :,Updated By :.2,Updated on :.1,Document :.1,Organisation Chain :,Tender ID :,Tender Ref No :,Tender Title :,Type :.1,Summary :.1,Updated By :.3,Updated On :.1,Document :.2,Committee Chairperson/Co-ordinator Name :.1,Committee Chairperson/Co-ordinator Type :.1,Committee Members :.1,Updated By :.4,Updated On :.2,Financial Bid Opening Date:,Document :.3,Tender Stage
Orissa Mining Corporation,OMC/e-PROC/CMC/151/2023-24 dated 15.03.2024,2024_OMC_102757_1,Yes,Open Tender,Item Rate,Services,2.0,No,No,Online,No,No,No,1.0,Fee/PreQual/Technical,.pdf,"PAN,GSTIN AND OTHER DOCUMENTS AS PER DTCN",16-Mar-2024 04:40 PM,15-May-2024 05:00 PM,16-Mar-2024 04:40 PM,15-May-2024 03:00 PM,16-Mar-2024 04:40 PM ,15-Apr-2024 05:00 PM ,25-Apr-2024 11:00 AM,15-May-2024 03:00 PM,22-Aug-2024 12:00 PM,"1,74,000",Yes,fixed,,Nil,Nil,1.0,Corrigendum 2,Date,,1.0,ICICI BANK,"5,900",0.0,Nil,Nil,Yes,Head(Contract and Procurement),"OMC Ltd., OMC House, Bhubaneswar",Operation and Comprehensive Maintenance of Real-Time EQMS (5 nos.) installed at ETPs of South-Kaliapani Chromite Mines and MIP of Damsala Nallah located in Jajpur District along with uninterrupted data transmission to SPCB/CPCB server,Operation and Comprehensive Maintenance of Real-Time EQMS (5 nos.) installed at ETPs of South-Kaliapani Chromite Mines and MIP of Damsala Nallah located in Jajpur District along with uninterrupted data transmission to SPCB/CPCB server,Please refer Tender documents. ,NA ,,Miscellaneous Services,NA ,Tender,180.0,1825.0,South Kaliapani,755028.0,Through VC ,Through VC ,19-Apr-2024 03:30 PM ,"OMC Ltd., OMC House, Bhubaneswar",No ,No,AOC,04-Feb-2025,"INR 35,895,600",1825.0,Nandini Nibedita Pal,04-Feb-2025 03:57 PM,AOC.pdf (1029.00 KB),Awarded for the work,1.0,2492540.0,Swan Environmental Pvt. Ltd,INR,"35,895,600",1,2492614,Analyser Instrument Co Pvt Ltd,15-May-2024 02:41 PM,Rejected-Technical,Techno commercially Disqualified,21-Aug-2024 02:17 PM,Finance,Financial opening summary,Nandini Nibedita Pal,23-Aug-2024 12:38 PM,finance_500193.pdf,BOQ Comparative Chart,Director(HR),Internal,"CGM(Finance),GM(CP),Advisor(Legal), GM(FE)",Nandini Nibedita Pal,04-Feb-2025 03:50 PM,finsummary_500193.pdf (958.83 KB),Orissa Mining Corporation,2024_OMC_102757_1,OMC/e-PROC/CMC/151/2023-24 dated 15.03.2024,Operation and Comprehensive Maintenance of Real-Time EQMS (5 nos.) installed at ETPs of South-Kaliapani Chromite Mines and MIP of Damsala Nallah located in Jajpur District along with uninterrupted data transmission to SPCB/CPCB server,Technical,Technical opening summary,Nandini Nibedita Pal,17-May-2024 01:50 PM,technical_500193.pdf,Director(HR),Internal,"GM(FE),CGM(Fin),GM(CP),Advisor(Legal)",Nandini Nibedita Pal,21-Aug-2024 02:17 PM,22-Aug-2024 12:00 PM,techsummary_500193.pdf (866.05 KB),AOC
,,,,,,,,,,,,,,,,.pdf,ANY OTHER DOCUMENTS AS PER DTCN,,,,,,,,,,,,,,,,2.0,Corrigendum 2,Technical Bid,,2.0,ICICI NEFT/RTGS,,,,,,,,,,,,,,,,,,,,,,,,,,AOC,,,,,,,,,,,,,2,2492602,EECG Industrial Soluitions Private Limited,15-May-2024 02:31 PM,Rejected-Technical,Techno commercially Disqualified,21-Aug-2024 02:17 PM,,,,,,,,,,,,,,,,,,,,,,,,,,,,,AOC
,,,,,,,,,,,,,,2.0,Finance,.xls,PRICE BID,,,,,,,,,,,,,,,,,,,,,,,,,,,,,,,,,,,,,,,,,,,,,,,AOC,,,,,,,,,,,,,3,2492576,Endress Hauser India Pvt. Ltd,07-May-2024 06:17 PM,Rejected-Finance,Other than L1,04-Feb-2025 03:50 PM,,,,,,,,,,,,,,,,,,,,,,,,,,,,,AOC
,,,,,,,,,,,,,,,,.pdf,RATE OF GST,,,,,,,,,,,,,,,,,,,,,,,,,,,,,,,,,,,,,,,,,,,,,,,AOC,,,,,,,,,,,,,4,2492764,FLOWTECH AUTOMATION PRIVATE LIMITED,15-May-2024 02:57 PM,Rejected-Finance,Other than L1,04-Feb-2025 03:50 PM,,,,,,,,,,,,,,,,,,,,,,,,,,,,,AOC
,,,,,,,,,,,,,,,,,,,,,,,,,,,,,,,,,,,,,,,,,,,,,,,,,,,,,,,,,,,,,,,,AOC,,,,,,,,,,,,,5,2492615,INTRA PROJECT CONSULTANTS,15-May-2024 11:09 AM,Rejected-Technical,Techno commercially Disqualified,21-Aug-2024 02:17 PM,,,,,,,,,,,,,,,,,,,,,,,,,,,,,AOC
,,,,,,,,,,,,,,,,,,,,,,,,,,,,,,,,,,,,,,,,,,,,,,,,,,,,,,,,,,,,,,,,AOC,,,,,,,,,,,,,6,2492540,Swan Environmental Pvt. Ltd,08-May-2024 12:18 PM,Accepted-AOC,Awarded for the work including GST for 5 years,04-Feb-2025 03:57 PM,,,,,,,,,,,,,,,,,,,,,,,,,,,,,AOC
