Organisation Chain,Tender Reference Number,Tender ID,Withdrawal Allowed,Tender Type,Form of contract,Tender Category,No. of Covers,General Technical Evaluation Allowed,ItemWise Technical Evaluation Allowed,Payment Mode,Is Multi Currency Allowed For BOQ,Is Multi Currency Allowed For Fee,Allow Two Stage Bidding,Cover No,Cover,Document Type,Description,Publish Date,Bid Opening Date,Document Download / Sale Start Date,Document Download / Sale End Date,Clarification Start Date,Clarification End Date,Bid Submission Start Date,Bid Submission End Date,EMD Amount in ₹,EMD Exemption Allowed,EMD Fee Type,EMD Percentage,EMD Payable To,EMD Payable At,S.No,Bank Name,Tender Fee in ₹,VAT Charges in ₹,Fee Payable To,Fee Payable At,Tender Fee Exemption Allowed,Name,Address,Title,Work Description,Pre Qualification Details,Independent External Monitor/Remarks,Tender Value in ₹,Product Category,Sub category,Contract Type,Bid Validity(Days),Period Of Work(Days),Location,Pincode,Pre Bid Meeting Place,Pre Bid Meeting Address,Pre Bid Meeting Date,Bid Opening Place,Should Allow NDA Tender,Allow Preferential Bidder,Tender Stage,Contract Date :,Contract Value :,Work Completion Period in days :,Updated By :,Updated on :,AOC document :,AOC Description :,S.No,Bid Number,Bidder Name,Awarded Currency,Awarded Value,S.No.1,Bid Number.1,Bidder Name.1,Submitted Date,Status,Remarks,Status Updated On,Type :,Summary :,Updated By :.1,Updated On :,Document :,BOQ Comparative Chart :,Committee Chairperson/Co-ordinator Name :,Committee Chairperson/Co-ordinator Type :,Committee Members :,Updated By :.2,Updated on :.1,Document :.1,Organisation Chain :,Tender ID :,Tender Ref No :,Tender Title :,Committee Chairperson/Co-ordinator Name :.1,Committee Chairperson/Co-ordinator Type :.1,Committee Members :.1,Updated By :.3,Updated On :.1,Document :.2,Tender Stage
CE-NH||NHCIRCLE-SAMBALPUR||EENH-DIVN-BOLANGIR,04 / EE NH (BGR) of 2024-25,2024_CENH_108086_2,Yes,Open Tender,Percentage,Works,1.0,No,No,Online,No,No,No,1.0,Fee/PreQual/Technical/Finance,.pdf,"Online proof copy of tender cost and EMD, Registration Certificate, PAN, GSTIN, Etc.",13-Dec-2024 11:00 AM,24-Dec-2024 11:30 AM,13-Dec-2024 11:00 AM,23-Dec-2024 05:00 PM,NA ,NA ,13-Dec-2024 11:00 AM,23-Dec-2024 05:00 PM,"15,900",Yes,fixed,,Nil,Nil,1.0,ICICI BANK,"6,000",0.0,Nil,Nil,No,"SE, NH Division, Bolangir","O/o EE, NH Division, Bolangir, Gandhinagarpada, Bolangir-767001",Construction of R.C.C. drain along NH-57 from Km. 49/820 to Km. 50/000 (RHS) for the year 2024-25,Road Work,Please refer tender documents. ,NA ,"15,87,935",Civil Works - Roads,NA ,Tender,90.0,30.0,Sonepur Town,767017.0,NA ,NA ,NA ,"O/o EE, NH Division, Bolangir",No ,No,AOC,01-Feb-2025,"INR 1,349,903.14",30.0,Md Shahbaz,01-Feb-2025 06:48 PM,WoT4S2.pdf (956.00 KB),Notice to proceed with the work,1.0,2706144.0,SARMISTHA BISHI,INR,"1,349,903.14",1,2705045,Namita Mishra,21-Dec-2024 10:17 PM,Rejected-AOC,Not Selected through Transparent Lottery System,01-Feb-2025 06:48 PM,Finance,06 (Six) nos of bidders participated in the tender invited for the work. Their documents are opened for further evaluation.,Md Shahbaz,24-Dec-2024 03:00 PM,finance_519980.pdf,BOQ Comparative Chart,"SE, NH Division, Bolangir",Internal,"AEE Estimator I/c and DA, NH Division, Bolangir",Md Shahbaz,18-Jan-2025 02:33 PM,finsummary_519980.pdf (2158.13 KB),CE-NH||NHCIRCLE-SAMBALPUR||EENH-DIVN-BOLANGIR,2024_CENH_108086_2,04 / EE NH (BGR) of 2024-25,Construction of R.C.C. drain along NH-57 from Km. 49/820 to Km. 50/000 (RHS) for the year 2024-25,"SE, NH Division, Bolangir",Internal,"AEE, (I/c Estimator) and DA, NH Division, Bolangir",Md Shahbaz,10-Jan-2025 07:29 PM,techsummary_519980.pdf (2158.13 KB),AOC
,,,,,,,,,,,,,,,,.pdf,"No relation certificate, affidavit, No litigation.",,,,,,,,,,,,,,,2.0,ICICI NEFT/RTGS,,,,,,,,,,,,,,,,,,,,,,,,,,AOC,,,,,,,,,,,,,2,2708134,RAHUL KUMAR SAHU,23-Dec-2024 02:19 PM,Rejected-AOC,Not Selected through Transparent Lottery System,01-Feb-2025 06:48 PM,,,,,,,,,,,,,,,,,,,,,,,AOC
,,,,,,,,,,,,,,,,.pdf,Other documents as per DTCN,,,,,,,,,,,,,,,,,,,,,,,,,,,,,,,,,,,,,,,,,,AOC,,,,,,,,,,,,,3,2707800,Ramshankar Satpathy,23-Dec-2024 02:27 PM,Rejected-AOC,Not Selected through Transparent Lottery System,01-Feb-2025 06:48 PM,,,,,,,,,,,,,,,,,,,,,,,AOC
,,,,,,,,,,,,,,,,.xls,Bill of quantity,,,,,,,,,,,,,,,,,,,,,,,,,,,,,,,,,,,,,,,,,,AOC,,,,,,,,,,,,,4,2701431,SANJIB KUMAR BEDBAK,20-Dec-2024 08:49 PM,Rejected-AOC,Not Selected through Transparent Lottery System,01-Feb-2025 06:48 PM,,,,,,,,,,,,,,,,,,,,,,,AOC
,,,,,,,,,,,,,,,,,,,,,,,,,,,,,,,,,,,,,,,,,,,,,,,,,,,,,,,,,,,AOC,,,,,,,,,,,,,5,2705594,Sanjit Seth,23-Dec-2024 02:33 PM,Rejected-AOC,Not Selected through Transparent Lottery System,01-Feb-2025 06:48 PM,,,,,,,,,,,,,,,,,,,,,,,AOC
,,,,,,,,,,,,,,,,,,,,,,,,,,,,,,,,,,,,,,,,,,,,,,,,,,,,,,,,,,,AOC,,,,,,,,,,,,,6,2706144,SARMISTHA BISHI,22-Dec-2024 12:39 PM,Accepted-AOC,Selected through Transparent Lottery System,01-Feb-2025 06:48 PM,,,,,,,,,,,,,,,,,,,,,,,AOC
