Organisation Chain,Tender Reference Number,Tender ID,Withdrawal Allowed,Tender Type,Form of contract,Tender Category,No. of Covers,General Technical Evaluation Allowed,ItemWise Technical Evaluation Allowed,Payment Mode,Is Multi Currency Allowed For BOQ,Is Multi Currency Allowed For Fee,Allow Two Stage Bidding,Cover No,Cover,Document Type,Description,Publish Date,Bid Opening Date,Document Download / Sale Start Date,Document Download / Sale End Date,Clarification Start Date,Clarification End Date,Bid Submission Start Date,Bid Submission End Date,EMD Amount in ₹,EMD Exemption Allowed,EMD Fee Type,EMD Percentage,EMD Payable To,EMD Payable At,S.No,Bank Name,Tender Fee in ₹,VAT Charges in ₹,Fee Payable To,Fee Payable At,Tender Fee Exemption Allowed,Name,Address,Title,Work Description,Pre Qualification Details,Independent External Monitor/Remarks,Tender Value in ₹,Product Category,Sub category,Contract Type,Bid Validity(Days),Period Of Work(Days),Location,Pincode,Pre Bid Meeting Place,Pre Bid Meeting Address,Pre Bid Meeting Date,Bid Opening Place,Should Allow NDA Tender,Allow Preferential Bidder,Tender Stage,Contract Date :,Contract Value :,Work Completion Period in days :,Updated By :,Updated on :,AOC document :,AOC Description :,S.No,Bid Number,Bidder Name,Awarded Currency,Awarded Value,S.No.1,Bid Number.1,Bidder Name.1,Submitted Date,Status,Remarks,Status Updated On,Type :,Summary :,Updated By :.1,Updated On :,Document :,BOQ Comparative Chart :,Committee Chairperson/Co-ordinator Name :,Committee Chairperson/Co-ordinator Type :,Committee Members :,Updated By :.2,Updated on :.1,Document :.1,Organisation Chain :,Tender ID :,Tender Ref No :,Tender Title :,Committee Chairperson/Co-ordinator Name :.1,Committee Chairperson/Co-ordinator Type :.1,Committee Members :.1,Updated By :.3,Updated On :.1,Document :.2,Tender Stage
CE RW I||RW-CIRCLE-SUNDARGARH||RW-Division-Sundargarh II,Online -EERKL-23 of 2024-25,2025_CERWI_109300_5,Yes,Open Tender,Percentage,Works,1.0,No,No,Online,No,No,No,1.0,Fee/PreQual/Technical/Finance,.pdf,Affidavit Towards Authenticity of Documents,10-Jan-2025 05:00 PM,20-Jan-2025 09:00 AM,10-Jan-2025 05:00 PM,18-Jan-2025 05:00 PM,10-Jan-2025 05:00 PM ,17-Jan-2025 05:00 PM ,10-Jan-2025 05:00 PM,18-Jan-2025 05:00 PM,"2,330",Yes,fixed,,Nil,Nil,1.0,ICICI BANK,"2,000",0.0,Nil,Nil,No,"Ececutive Engineer, RW Division,Rourkela","Office of the Executive Engineer,RW Division,Rourk",Maintenance and Repair of JE Qtr at Koira,Maintenance and Repair of JE Qtr at Koira,Please refer Tender documents. ,NA ,"2,33,019",Civil Works - Buildings,NA ,Tender,90.0,30.0,ROURKELA,769004.0,NA ,NA ,NA ,"Office of the Executive Engineer,RW Division,Rourk",No ,No,AOC,28-Feb-2025,"INR 198,089",30.0,Kishore Chandra Khatua,28-Feb-2025 05:42 PM,16.pdf (466.00 KB),Awarded Cost,1.0,2762316.0,SUDHAKAR MALLICK,INR,"198,089",1,2762344,AMIT BIKRAM KHUNTIA,18-Jan-2025 02:53 PM,Rejected-AOC,Rejected by the Committee,28-Feb-2025 05:42 PM,Finance,8 bidders applied,Kishore Chandra Khatua,28-Feb-2025 05:32 PM,,BOQ Comparative Chart,"AE Estt, DAO, SE",Internal,"AE Estt, DAO, SE",Kishore Chandra Khatua,28-Feb-2025 05:39 PM,finsummary_525201.pdf (465.77 KB),CE RW I||RW-CIRCLE-SUNDARGARH||RW-Division-Sundargarh II,2025_CERWI_109300_5,Online -EERKL-23 of 2024-25,Maintenance and Repair of JE Qtr at Koira,"AE Estt, DAO, SE",Internal,"AE Estt, DAO, SE",Kishore Chandra Khatua,28-Feb-2025 05:36 PM,techsummary_525201.pdf (465.77 KB),AOC
,,,,,,,,,,,,,,,,.pdf,"PAN Card, GSTN, Regestration Certificate another as per DTCN, Mobile No.",,,,,,,,,,,,,,,2.0,ICICI NEFT/RTGS,,,,,,,,,,,,,,,,,,,,,,,,,,AOC,,,,,,,,,,,,,2,2762821,MUKESH KUMAR JAISWAL,18-Jan-2025 01:49 PM,Rejected-AOC,Rejected by the Committee,28-Feb-2025 05:42 PM,,,,,,,,,,,,,,,,,,,,,,,AOC
,,,,,,,,,,,,,,,,.pdf,Affidavit Regarding norelation certificate,,,,,,,,,,,,,,,,,,,,,,,,,,,,,,,,,,,,,,,,,,AOC,,,,,,,,,,,,,3,2762669,PRADEEP RAY,18-Jan-2025 01:25 PM,Rejected-AOC,Rejected by the Committee,28-Feb-2025 05:42 PM,,,,,,,,,,,,,,,,,,,,,,,AOC
,,,,,,,,,,,,,,,,.pdf,Affidavit Regarding correctness of information,,,,,,,,,,,,,,,,,,,,,,,,,,,,,,,,,,,,,,,,,,AOC,,,,,,,,,,,,,4,2760725,ROJARANI PRADHAN,17-Jan-2025 06:47 PM,Rejected-AOC,Rejected by the Committee,28-Feb-2025 05:42 PM,,,,,,,,,,,,,,,,,,,,,,,AOC
,,,,,,,,,,,,,,,,.xls,BOQ,,,,,,,,,,,,,,,,,,,,,,,,,,,,,,,,,,,,,,,,,,AOC,,,,,,,,,,,,,5,2756513,SADIYA CONSTRUCTION AND SOPPLIERS,16-Jan-2025 06:57 PM,Rejected-AOC,Rejected by the Committee,28-Feb-2025 05:42 PM,,,,,,,,,,,,,,,,,,,,,,,AOC
,,,,,,,,,,,,,,,,,,,,,,,,,,,,,,,,,,,,,,,,,,,,,,,,,,,,,,,,,,,AOC,,,,,,,,,,,,,6,2763035,SAROJINI DUNGDUNG,18-Jan-2025 02:38 PM,Rejected-AOC,Rejected by the Committee,28-Feb-2025 05:42 PM,,,,,,,,,,,,,,,,,,,,,,,AOC
,,,,,,,,,,,,,,,,,,,,,,,,,,,,,,,,,,,,,,,,,,,,,,,,,,,,,,,,,,,AOC,,,,,,,,,,,,,7,2762316,SUDHAKAR MALLICK,18-Jan-2025 12:17 PM,Accepted-AOC,Awarded,28-Feb-2025 05:42 PM,,,,,,,,,,,,,,,,,,,,,,,AOC
,,,,,,,,,,,,,,,,,,,,,,,,,,,,,,,,,,,,,,,,,,,,,,,,,,,,,,,,,,,AOC,,,,,,,,,,,,,8,2762173,SUMAN JAISWAL,18-Jan-2025 11:45 AM,Rejected-AOC,Rejected by the Committee,28-Feb-2025 05:42 PM,,,,,,,,,,,,,,,,,,,,,,,AOC
