Organisation Chain,Tender Reference Number,Tender ID,Withdrawal Allowed,Tender Type,Form of contract,Tender Category,No. of Covers,General Technical Evaluation Allowed,ItemWise Technical Evaluation Allowed,Payment Mode,Is Multi Currency Allowed For BOQ,Is Multi Currency Allowed For Fee,Allow Two Stage Bidding,Cover No,Cover,Document Type,Description,Publish Date,Bid Opening Date,Document Download / Sale Start Date,Document Download / Sale End Date,Clarification Start Date,Clarification End Date,Bid Submission Start Date,Bid Submission End Date,Financial Bid Opening Date,EMD Amount in ₹,EMD Exemption Allowed,EMD Fee Type,EMD Percentage,EMD Payable To,EMD Payable At,S.No,Bank Name,Tender Fee in ₹,VAT Charges in ₹,Fee Payable To,Fee Payable At,Tender Fee Exemption Allowed,Name,Address,Title,Work Description,Pre Qualification Details,Independent External Monitor/Remarks,Tender Value in ₹,Product Category,Sub category,Contract Type,Bid Validity(Days),Period Of Work(Days),Location,Pincode,Pre Bid Meeting Place,Pre Bid Meeting Address,Pre Bid Meeting Date,Bid Opening Place,Should Allow NDA Tender,Allow Preferential Bidder,Tender Stage,Contract Date :,Contract Value :,Work Completion Period in days :,Updated By :,Updated on :,AOC document :,AOC Description :,S.No,Bid Number,Bidder Name,Awarded Currency,Awarded Value,S.No.1,Bid Number.1,Bidder Name.1,Submitted Date,Status,Remarks,Status Updated On,Type :,Summary :,Updated By :.1,Updated On :,Document :,BOQ Comparative Chart :,Committee Chairperson/Co-ordinator Name :,Committee Chairperson/Co-ordinator Type :,Committee Members :,Updated By :.2,Updated on :.1,Document :.1,Organisation Chain :,Tender ID :,Tender Ref No :,Tender Title :,Type :.1,Summary :.1,Updated By :.3,Updated On :.1,Document :.2,Committee Chairperson/Co-ordinator Name :.1,Committee Chairperson/Co-ordinator Type :.1,Committee Members :.1,Updated By :.4,Updated On :.2,Financial Bid Opening Date:,Document :.3,Tender Stage
EIC-CIVIL||SERNB-CIRCLE-NORTHERN,CCENC (R AND B) /04/ 2024-25,2024_EICCL_104115_3,Yes,National Competitive Bid,Percentage,Works,2.0,No,No,Online,No,No,No,1.0,Fee/PreQual/Technical,.pdf,"Online Proof Copy of Tender Cost, Bid Security, GSTIN, PAN, R.C and Affidavit",06-Aug-2024 05:00 PM,21-Aug-2024 11:00 AM,06-Aug-2024 05:00 PM,20-Aug-2024 05:00 PM,06-Aug-2024 05:00 PM ,13-Aug-2024 05:00 PM ,06-Aug-2024 05:00 PM,20-Aug-2024 05:00 PM,27-Sep-2024 04:00 PM,"6,92,200",Yes,fixed,,Nil,Nil,1.0,ICICI BANK,"10,000",0.0,Nil,Nil,No,"C.C.E, Northern R AND B Circle, SAMBALPUR","O/O THE C.C.E, Northern R AND B Circle, SAMBALPUR",Construction of H.L. Bridge over Local Nallah at 1-900 Km on Sahaspur to Malidihi road in the District of Jharsuguda under State Plan for the year 2023-24.,BRIDGE WORK,Please refer Tender documents. ,NA ,"6,92,16,734",Civil Works - Bridges,NA ,Tender,90.0,450.0,JHARSUGUDA,768201.0,NA ,NA ,NA ,"O/O THE C.C.E, Northern R AND B Circle, SAMBALPUR",No ,No,AOC,22-Feb-2025,"INR 62,301,982",450.0,Rama Chandra Sethi,22-Feb-2025 02:36 PM,AGTSAHAS.pdf (2403.00 KB),AGT DRAWN,1.0,2531675.0,MOHIT AGRAWAL,INR,"62,301,982",1,2531675,MOHIT AGRAWAL,20-Aug-2024 12:26 PM,Accepted-AOC,AGT DRAWN,22-Feb-2025 02:36 PM,Finance,FINANCIAL BID OPENED,Rama Chandra Sethi,27-Sep-2024 05:54 PM,,BOQ Comparative Chart,CCE,Internal,,Rama Chandra Sethi,22-Feb-2025 02:31 PM,finsummary_504345.pdf (2083.80 KB),EIC-CIVIL||SERNB-CIRCLE-NORTHERN,2024_EICCL_104115_3,CCENC (R AND B) /04/ 2024-25,Construction of H.L. Bridge over Local Nallah at 1-900 Km on Sahaspur to Malidihi road in the District of Jharsuguda under State Plan for the year 2023-24.,Technical,TECHNICAL BID ( COVER-I) OPENED,Anam Charan Sahoo,22-Aug-2024 07:23 PM,,RAMA CH SETHI,Internal,"S.Panigrahi, A.K.SINGH,D BEHERA, D.PRUSTY,A.LENKA",Rama Chandra Sethi,25-Sep-2024 12:56 PM,27-Sep-2024 04:00 PM,techsummary_504345.pdf (303.74 KB),AOC
,,,,,,,,,,,,,,,,.pdf,"Ownership of machineries, work experience and MOU for composite Building work etc",,,,,,,,,,,,,,,,2.0,ICICI NEFT/RTGS,,,,,,,,,,,,,,,,,,,,,,,,,,AOC,,,,,,,,,,,,,2,2531693,MS SHREE SHARDA CONSTRUCTIONS,20-Aug-2024 03:53 PM,Rejected-Finance,UNSUCCESSFUL BIDDER,22-Feb-2025 02:31 PM,,,,,,,,,,,,,,,,,,,,,,,,,,,,,AOC
,,,,,,,,,,,,,,,,.pdf,Work experience certificate and other related documents as per DTCN,,,,,,,,,,,,,,,,,,,,,,,,,,,,,,,,,,,,,,,,,,,AOC,,,,,,,,,,,,,3,2530353,Orient Constructions Pvt. Ltd.,19-Aug-2024 06:19 PM,Rejected-Finance,UNSUCCESSFUL THROUGH TRANSPARENT LOTTERY SYSTEM,22-Feb-2025 02:31 PM,,,,,,,,,,,,,,,,,,,,,,,,,,,,,AOC
,,,,,,,,,,,,,,2.0,Finance,.xls,BILL OF QUANTITY (BOQ),,,,,,,,,,,,,,,,,,,,,,,,,,,,,,,,,,,,,,,,,,,AOC,,,,,,,,,,,,,4,2530926,ROOPESH GUPTA,18-Aug-2024 01:16 PM,Rejected-Finance,UNSUCCESSFUL THROUGH TRANSPARENT LOTTERY SYSTEM,22-Feb-2025 02:31 PM,,,,,,,,,,,,,,,,,,,,,,,,,,,,,AOC
,,,,,,,,,,,,,,,,,,,,,,,,,,,,,,,,,,,,,,,,,,,,,,,,,,,,,,,,,,,,AOC,,,,,,,,,,,,,5,2532034,Trinath Engineers,20-Aug-2024 04:00 PM,Rejected-Finance,UNSUCCESSFUL BIDDER,22-Feb-2025 02:31 PM,,,,,,,,,,,,,,,,,,,,,,,,,,,,,AOC
