Organisation Chain,Tender Reference Number,Tender ID,Withdrawal Allowed,Tender Type,Form of contract,Tender Category,No. of Covers,General Technical Evaluation Allowed,ItemWise Technical Evaluation Allowed,Payment Mode,Is Multi Currency Allowed For BOQ,Is Multi Currency Allowed For Fee,Allow Two Stage Bidding,Cover No,Cover,Document Type,Description,Publish Date,Bid Opening Date,Document Download / Sale Start Date,Document Download / Sale End Date,Clarification Start Date,Clarification End Date,Bid Submission Start Date,Bid Submission End Date,Financial Bid Opening Date,EMD Amount in ₹,EMD Exemption Allowed,EMD Fee Type,EMD Percentage,EMD Payable To,EMD Payable At,S.No,Corrigendum Title,Corrigendum Type,View,S.No.1,Bank Name,Tender Fee in ₹,VAT Charges in ₹,Fee Payable To,Fee Payable At,Tender Fee Exemption Allowed,Name,Address,Title,Work Description,Pre Qualification Details,Independent External Monitor/Remarks,Tender Value in ₹,Product Category,Sub category,Contract Type,Bid Validity(Days),Period Of Work(Days),Location,Pincode,Pre Bid Meeting Place,Pre Bid Meeting Address,Pre Bid Meeting Date,Bid Opening Place,Should Allow NDA Tender,Allow Preferential Bidder,Tender Stage,Contract Date :,Contract Value :,Work Completion Period in days :,Updated By :,Updated on :,AOC document :,S.No,Bid Number,Bidder Name,Awarded Currency,Awarded Value,S.No.1,Bid Number.1,Bidder Name.1,Submitted Date,Status,Remarks,Status Updated On,Type :,Summary :,Updated By :.1,Updated On :,Document :,BOQ Comparative Chart :,Committee Chairperson/Co-ordinator Name :,Committee Chairperson/Co-ordinator Type :,Committee Members :,Updated By :.2,Updated on :.1,Document :.1,Organisation Chain :,Tender ID :,Tender Ref No :,Tender Title :,Type :.1,Summary :.1,Updated By :.3,Updated On :.1,Document :.2,Committee Chairperson/Co-ordinator Name :.1,Committee Chairperson/Co-ordinator Type :.1,Committee Members :.1,Updated By :.4,Updated On :.2,Financial Bid Opening Date:,Document :.3,Tender Stage
EIC-CIVIL||SERNB-CIRCLE-NORTHERN||EERNB-DIVN-BARGARH,IFB-SE PWD-16 OF 2024-25,2024_EICCL_107593_2,Yes,Open Tender,Percentage,Works,2.0,No,No,Online,No,No,No,1.0,Fee/PreQual/Technical,.pdf,"Tender Cost, EMD, Bid Declaration Form, GSTIN, PAN, EPF, ESI, Affidavit and other DOC as per DTCN",27-Nov-2024 01:00 PM,10-Dec-2024 11:30 AM,27-Nov-2024 01:00 PM,09-Dec-2024 05:00 PM,27-Nov-2024 01:00 PM ,09-Dec-2024 05:00 PM ,27-Nov-2024 01:00 PM,09-Dec-2024 05:00 PM,20-Dec-2024 09:00 AM,"81,262",Yes,fixed,,Nil,Nil,1.0,1ST CORRIGENDUM,Date,,1.0,ICICI BANK,"10,000",0.0,Nil,Nil,No,O/O THE SUPERINTENDING ENGINEER (R AND B) DIVISION,"O/O THE SUPERINTENDING ENGINEER (R AND B) DIVISION BARGARH, AT-NEAR GOVT BUS STAND INFRONT OF WOMENS COLLEGE BARGARH",S/R to U.L.B. Road of Sweeper Colony to Reserve Police road from Ch.0/00 km to Ch.1/500 km such as providing renewal coat with S.D.B.C. and construction of Toe wall for the year of 2024-25,ROAD WORK (CIVIL),PLEASE REFER THE TENDER DOCUMENTS ,NA ,"81,26,183",Civil Works - Roads,NA ,Tender,90.0,60.0,BARGARH,768028.0,NA ,NA ,NA ,O/O THE SUPERINTENDING ENGINEER (R AND B) DIVISION,No ,No,AOC,01-Feb-2025,"INR 8,125,370.8",60.0,Arun Kumar Pandey,01-Feb-2025 02:15 PM,AOCSeeperColony.pdf (331.00 KB),1.0,2689790.0,AKASH PANSARI,INR,"8,125,370.8",1,2689790,AKASH PANSARI,09-Dec-2024 01:22 PM,Accepted-AOC,L-1,01-Feb-2025 02:15 PM,Finance,Total No. of 3 nos bidder accepted for financial evaluation process.,Umesh Chandra Bhoi,20-Dec-2024 11:06 AM,,BOQ Comparative Chart,ARUN KUMAR PANDEY,Internal,1-VINIT KUMAR 2-BASANTA KUMAR DEHURY 3-UMESH CHANDRA BHOI,Arun Kumar Pandey,01-Feb-2025 02:12 PM,finsummary_517975.pdf (331.06 KB),EIC-CIVIL||SERNB-CIRCLE-NORTHERN||EERNB-DIVN-BARGARH,2024_EICCL_107593_2,IFB-SE PWD-16 OF 2024-25,S/R to U.L.B. Road of Sweeper Colony to Reserve Police road from Ch.0/00 km to Ch.1/500 km such as providing renewal coat with S.D.B.C. and construction of Toe wall for the year of 2024-25,Technical,Total No. of 5 nos bidder accepted for technical evaluation process.,Arun Kumar Pandey,10-Dec-2024 08:24 PM,,ARUN KUMAR PANDEY,Internal,1-VINIT KUMAR 2-BASANTA KUMAR DEHURY 3-UMESH CHANDRA BHOI,Arun Kumar Pandey,18-Dec-2024 10:59 AM,20-Dec-2024 09:00 AM,techsummary_517975.pdf (276.30 KB),AOC
,,,,,,,,,,,,,,2.0,Finance,.xls,BILL OF QUANTITY,,,,,,,,,,,,,,,,,,,,2.0,ICICI NEFT/RTGS,,,,,,,,,,,,,,,,,,,,,,,,,,AOC,,,,,,,,,,,,2,2689485,DEBASHIS RAUL,09-Dec-2024 10:55 AM,Rejected-AOC,L-3,01-Feb-2025 02:15 PM,,,,,,,,,,,,,,,,,,,,,,,,,,,,,AOC
,,,,,,,,,,,,,,,,,,,,,,,,,,,,,,,,,,,,,,,,,,,,,,,,,,,,,,,,,,,,,,,,AOC,,,,,,,,,,,,3,2675148,RAMESH KUMAR AGRAWAL,09-Dec-2024 12:30 PM,Rejected-Technical,Not submitted Schedule-A and Litigation as per DTCN,18-Dec-2024 10:58 AM,,,,,,,,,,,,,,,,,,,,,,,,,,,,,AOC
,,,,,,,,,,,,,,,,,,,,,,,,,,,,,,,,,,,,,,,,,,,,,,,,,,,,,,,,,,,,,,,,AOC,,,,,,,,,,,,4,2688980,SANJAY KUMAR AGRAWAL,09-Dec-2024 11:25 AM,Rejected-Technical,Not submitted Schedule-A and Litigation as per DTCN,18-Dec-2024 10:58 AM,,,,,,,,,,,,,,,,,,,,,,,,,,,,,AOC
,,,,,,,,,,,,,,,,,,,,,,,,,,,,,,,,,,,,,,,,,,,,,,,,,,,,,,,,,,,,,,,,AOC,,,,,,,,,,,,5,2674029,Susama Dash,08-Dec-2024 07:09 PM,Rejected-AOC,L-2,01-Feb-2025 02:15 PM,,,,,,,,,,,,,,,,,,,,,,,,,,,,,AOC
