Organisation Chain,Tender Reference Number,Tender ID,Withdrawal Allowed,Tender Type,Form of contract,Tender Category,No. of Covers,General Technical Evaluation Allowed,ItemWise Technical Evaluation Allowed,Payment Mode,Is Multi Currency Allowed For BOQ,Is Multi Currency Allowed For Fee,Allow Two Stage Bidding,Cover No,Cover,Document Type,Description,Publish Date,Bid Opening Date,Document Download / Sale Start Date,Document Download / Sale End Date,Clarification Start Date,Clarification End Date,Bid Submission Start Date,Bid Submission End Date,EMD Amount in ₹,EMD Exemption Allowed,EMD Fee Type,EMD Percentage,EMD Payable To,EMD Payable At,S.No,Bank Name,Tender Fee in ₹,VAT Charges in ₹,Fee Payable To,Fee Payable At,Tender Fee Exemption Allowed,Name,Address,Title,Work Description,Pre Qualification Details,Independent External Monitor/Remarks,Tender Value in ₹,Product Category,Sub category,Contract Type,Bid Validity(Days),Period Of Work(Days),Location,Pincode,Pre Bid Meeting Place,Pre Bid Meeting Address,Pre Bid Meeting Date,Bid Opening Place,Should Allow NDA Tender,Allow Preferential Bidder,Tender Stage,Contract Date :,Contract Value :,Work Completion Period in days :,Updated By :,Updated on :,AOC document :,AOC Description :,S.No,Bid Number,Bidder Name,Awarded Currency,Awarded Value,S.No.1,Bid Number.1,Bidder Name.1,Submitted Date,Status,Remarks,Status Updated On,Type :,Summary :,Updated By :.1,Updated On :,Document :,BOQ Comparative Chart :,Committee Chairperson/Co-ordinator Name :,Committee Chairperson/Co-ordinator Type :,Committee Members :,Updated By :.2,Updated on :.1,Document :.1,Organisation Chain :,Tender ID :,Tender Ref No :,Tender Title :,Committee Chairperson/Co-ordinator Name :.1,Committee Chairperson/Co-ordinator Type :.1,Committee Members :.1,Updated By :.3,Updated On :.1,Document :.2,Tender Stage
CE RW I||RW-CIRCLE-SUNDARGARH||RW-Division-Sundargarh II,Online -SERKL-27 of 2024-25,2024_CERWI_108863_5,Yes,Open Tender,Percentage,Works,1.0,No,No,Online,No,No,No,1.0,Fee/PreQual/Technical/Finance,.pdf,Affidavit Towards Authenticity of Documents,30-Dec-2024 05:00 PM,08-Jan-2025 09:00 AM,30-Dec-2024 05:00 PM,07-Jan-2025 06:00 PM,30-Dec-2024 05:00 PM ,06-Jan-2025 06:00 PM ,30-Dec-2024 05:00 PM,07-Jan-2025 06:00 PM,"27,960",Yes,fixed,,Nil,Nil,1.0,ICICI BANK,"6,000",0.0,Nil,Nil,No,"Ececutive Engineer, RW Division,Rourkela","Office of the Executive Engineer,RW Division,Rourk",S/R to RD Road to Uparginia Road for the year 2024-25,S/R to RD Road to Uparginia Road for the year 2024-25,Please refer Tender documents. ,NA ,"27,95,956",Civil Works - Roads,NA ,Tender,90.0,30.0,ROURKELA,769004.0,NA ,NA ,NA ,"Office of the Executive Engineer,RW Division,Rourk",No ,No,AOC,25-Feb-2025,"INR 2,376,842",30.0,Kishore Chandra Khatua,25-Feb-2025 12:29 PM,06.pdf (371.00 KB),Awarded Cost,1.0,2734856.0,SUSMITA ACHARYA,INR,"2,376,842",1,2733599,ASIT KUMAR LENKA,06-Jan-2025 10:13 PM,Rejected-AOC,Rejected by the committee,25-Feb-2025 12:29 PM,Finance,9 bidders applied,Kishore Chandra Khatua,25-Feb-2025 12:09 PM,,BOQ Comparative Chart,"AE Estt, DAO, SE",Internal,"AE Estt, DAO, SE",Kishore Chandra Khatua,25-Feb-2025 12:25 PM,finsummary_522591.pdf (370.63 KB),CE RW I||RW-CIRCLE-SUNDARGARH||RW-Division-Sundargarh II,2024_CERWI_108863_5,Online -SERKL-27 of 2024-25,S/R to RD Road to Uparginia Road for the year 2024-25,"AE Estt, DAO, SE",Internal,"AE Estt, DAO, SE",Kishore Chandra Khatua,25-Feb-2025 12:23 PM,techsummary_522591.pdf (370.63 KB),AOC
,,,,,,,,,,,,,,,,.pdf,"PAN Card, GSTN, Regestration Certificate another as per DTCN, Contact No",,,,,,,,,,,,,,,2.0,ICICI NEFT/RTGS,,,,,,,,,,,,,,,,,,,,,,,,,,AOC,,,,,,,,,,,,,2,2735228,BHAVESH JAISWAL,07-Jan-2025 04:36 PM,Rejected-AOC,Rejected by the committee,25-Feb-2025 12:29 PM,,,,,,,,,,,,,,,,,,,,,,,AOC
,,,,,,,,,,,,,,,,.pdf,Affidavit Regarding norelation certificate,,,,,,,,,,,,,,,,,,,,,,,,,,,,,,,,,,,,,,,,,,AOC,,,,,,,,,,,,,3,2734630,DM Constructions,07-Jan-2025 02:11 PM,Rejected-AOC,Rejected by the committee,25-Feb-2025 12:29 PM,,,,,,,,,,,,,,,,,,,,,,,AOC
,,,,,,,,,,,,,,,,.pdf,Affidavit Regarding correctness of information,,,,,,,,,,,,,,,,,,,,,,,,,,,,,,,,,,,,,,,,,,AOC,,,,,,,,,,,,,4,2734916,KESHAB CHANDRA PATRA,07-Jan-2025 02:57 PM,Rejected-AOC,Rejected by the committee,25-Feb-2025 12:29 PM,,,,,,,,,,,,,,,,,,,,,,,AOC
,,,,,,,,,,,,,,,,.xls,BOQ,,,,,,,,,,,,,,,,,,,,,,,,,,,,,,,,,,,,,,,,,,AOC,,,,,,,,,,,,,5,2730836,Manoj Gadhei,05-Jan-2025 06:59 PM,Rejected-AOC,Rejected by the committee,25-Feb-2025 12:29 PM,,,,,,,,,,,,,,,,,,,,,,,AOC
,,,,,,,,,,,,,,,,,,,,,,,,,,,,,,,,,,,,,,,,,,,,,,,,,,,,,,,,,,,AOC,,,,,,,,,,,,,6,2734186,PIRU CHARAN MURMU,07-Jan-2025 01:43 PM,Rejected-AOC,Rejected by the committee,25-Feb-2025 12:29 PM,,,,,,,,,,,,,,,,,,,,,,,AOC
,,,,,,,,,,,,,,,,,,,,,,,,,,,,,,,,,,,,,,,,,,,,,,,,,,,,,,,,,,,AOC,,,,,,,,,,,,,7,2735002,SUMAN JAISWAL,07-Jan-2025 03:34 PM,Rejected-AOC,Rejected by the committee,25-Feb-2025 12:29 PM,,,,,,,,,,,,,,,,,,,,,,,AOC
,,,,,,,,,,,,,,,,,,,,,,,,,,,,,,,,,,,,,,,,,,,,,,,,,,,,,,,,,,,AOC,,,,,,,,,,,,,8,2734856,SUSMITA ACHARYA,07-Jan-2025 02:34 PM,Accepted-AOC,Awarded,25-Feb-2025 12:29 PM,,,,,,,,,,,,,,,,,,,,,,,AOC
,,,,,,,,,,,,,,,,,,,,,,,,,,,,,,,,,,,,,,,,,,,,,,,,,,,,,,,,,,,AOC,,,,,,,,,,,,,9,2734371,UDIT NARAYAN MOHANTY,07-Jan-2025 12:21 PM,Rejected-AOC,Rejected by the committee,25-Feb-2025 12:29 PM,,,,,,,,,,,,,,,,,,,,,,,AOC
