Organisation Chain,Tender Reference Number,Tender ID,Withdrawal Allowed,Tender Type,Form of contract,Tender Category,No. of Covers,General Technical Evaluation Allowed,ItemWise Technical Evaluation Allowed,Payment Mode,Is Multi Currency Allowed For BOQ,Is Multi Currency Allowed For Fee,Allow Two Stage Bidding,Cover No,Cover,Document Type,Description,Publish Date,Bid Opening Date,Document Download / Sale Start Date,Document Download / Sale End Date,Clarification Start Date,Clarification End Date,Bid Submission Start Date,Bid Submission End Date,Financial Bid Opening Date,EMD Amount in ₹,EMD Exemption Allowed,EMD Fee Type,EMD Percentage,EMD Payable To,EMD Payable At,S.No,Bank Name,Tender Fee in ₹,VAT Charges in ₹,Fee Payable To,Fee Payable At,Tender Fee Exemption Allowed,Name,Address,Title,Work Description,Pre Qualification Details,Independent External Monitor/Remarks,Tender Value in ₹,Product Category,Sub category,Contract Type,Bid Validity(Days),Period Of Work(Days),Location,Pincode,Pre Bid Meeting Place,Pre Bid Meeting Address,Pre Bid Meeting Date,Bid Opening Place,Should Allow NDA Tender,Allow Preferential Bidder,Tender Stage,Contract Date :,Contract Value :,Work Completion Period in days :,Updated By :,Updated on :,AOC document :,AOC Description :,S.No,Bid Number,Bidder Name,Awarded Currency,Awarded Value,S.No.1,Bid Number.1,Bidder Name.1,Submitted Date,Status,Remarks,Status Updated On,Type :,Summary :,Updated By :.1,Updated On :,Document :,BOQ Comparative Chart :,Committee Chairperson/Co-ordinator Name :,Committee Chairperson/Co-ordinator Type :,Committee Members :,Updated By :.2,Updated on :.1,Document :.1,Organisation Chain :,Tender ID :,Tender Ref No :,Tender Title :,Type :.1,Summary :.1,Updated By :.3,Updated On :.1,Document :.2,Committee Chairperson/Co-ordinator Name :.1,Committee Chairperson/Co-ordinator Type :.1,Committee Members :.1,Updated By :.4,Updated On :.2,Financial Bid Opening Date:,Document :.3,Tender Stage
PHEO||PH Circle Bhawanipatna||PH Division Koraput,NIT No.3 of 2024-25 (2),2024_PHEO_106573_1,Yes,National Competitive Bid,Percentage,Works,2.0,No,No,Online,No,No,No,1.0,Fee/PreQual/Technical,.pdf,"Registration Certificate- EMD- Paper cost- GSTIN- PAN- Affidavit, Experience cert. etc. as per DTCN",12-Nov-2024 05:30 PM,28-Nov-2024 11:00 AM,12-Nov-2024 05:30 PM,27-Nov-2024 05:00 PM,12-Nov-2024 05:30 PM ,26-Nov-2024 05:00 PM ,12-Nov-2024 05:30 PM,27-Nov-2024 05:00 PM,13-Dec-2024 12:35 PM,"83,220",Yes,percentage,1.0%,Nil,Nil,1.0,ICICI BANK,"10,000",0.0,Nil,Nil,No,"SE, PH Division, Koraput","SE, PH Division, Koraput",Installation of bulk meter in different zonal pump house in Koraput Municipality under D.No.13/4215 for the year 2024-25,Installation of bulk meter in different zonal pump house in Koraput Municipality,Please refer Tender documents. ,NA ,"83,21,987",Civil Works - Water Works,NA ,Rate Contract,120.0,90.0,Koraput,764020.0,NA ,NA ,NA ,"SE, PH Division, Koraput",No ,No,AOC,03-Feb-2025,"INR 8,321,986",90.0,Chiranjibi Mahali,03-Feb-2025 12:52 PM,AOC.pdf (2145.00 KB),AOC,1.0,2669159.0,Drite Automation and Engineering,INR,"7,074,520",1,2643804,Automatech Electric Co,27-Nov-2024 03:18 PM,Rejected-Technical,Work experpeice not furnished,13-Dec-2024 12:29 PM,Finance,3nos bidders qualified and 2nos bidders disqualified,Chiranjibi Mahali,13-Dec-2024 04:59 PM,finance_514910.pdf,BOQ Comparative Chart,SE PHD Koraput,Internal,"EE, AEE, DAO and Estimator under this division",Chiranjibi Mahali,03-Feb-2025 12:51 PM,finsummary_514910.pdf (411.56 KB),PHEO||PH Circle Bhawanipatna||PH Division Koraput,2024_PHEO_106573_1,NIT No.3 of 2024-25 (2),Installation of bulk meter in different zonal pump house in Koraput Municipality under D.No.13/4215 for the year 2024-25,Technical,Tender opened and all documents downloaded,Chiranjibi Mahali,13-Dec-2024 12:25 PM,technical_514910.pdf,SE PHD Koraput,Internal,"EE, AEE, DAO and Estimator under this divisoion",Chiranjibi Mahali,13-Dec-2024 12:29 PM,13-Dec-2024 12:35 PM,techsummary_514910.pdf (1192.57 KB),AOC
,,,,,,,,,,,,,,2.0,Finance,.xls,BOQ,,,,,,,,,,,,,,,,2.0,ICICI NEFT/RTGS,,,,,,,,,,,,,,,,,,,,,,,,,,AOC,,,,,,,,,,,,,2,2669159,Drite Automation and Engineering,27-Nov-2024 01:49 PM,Accepted-AOC,AOC,03-Feb-2025 12:52 PM,,,,,,,,,,,,,,,,,,,,,,,,,,,,,AOC
,,,,,,,,,,,,,,,,,,,,,,,,,,,,,,,,,,,,,,,,,,,,,,,,,,,,,,,,,,,,AOC,,,,,,,,,,,,,3,2669281,FLOWTECH AUTOMATION PRIVATE LIMITED,27-Nov-2024 02:05 PM,Rejected-Finance,Not qualified,03-Feb-2025 12:51 PM,,,,,,,,,,,,,,,,,,,,,,,,,,,,,AOC
,,,,,,,,,,,,,,,,,,,,,,,,,,,,,,,,,,,,,,,,,,,,,,,,,,,,,,,,,,,,AOC,,,,,,,,,,,,,4,2661051,M/s WATCO,27-Nov-2024 01:47 PM,Rejected-Finance,Not qualified,03-Feb-2025 12:51 PM,,,,,,,,,,,,,,,,,,,,,,,,,,,,,AOC
,,,,,,,,,,,,,,,,,,,,,,,,,,,,,,,,,,,,,,,,,,,,,,,,,,,,,,,,,,,,AOC,,,,,,,,,,,,,5,2669220,SABITA JENA,27-Nov-2024 01:55 PM,Rejected-Technical,Work experience not furnished,13-Dec-2024 12:29 PM,,,,,,,,,,,,,,,,,,,,,,,,,,,,,AOC
