Organisation Chain,Tender Reference Number,Tender ID,Withdrawal Allowed,Tender Type,Form of contract,Tender Category,No. of Covers,General Technical Evaluation Allowed,ItemWise Technical Evaluation Allowed,Payment Mode,Is Multi Currency Allowed For BOQ,Is Multi Currency Allowed For Fee,Allow Two Stage Bidding,Cover No,Cover,Document Type,Description,Publish Date,Bid Opening Date,Document Download / Sale Start Date,Document Download / Sale End Date,Clarification Start Date,Clarification End Date,Bid Submission Start Date,Bid Submission End Date,Financial Bid Opening Date,EMD Amount in ₹,EMD Exemption Allowed,EMD Fee Type,EMD Percentage,EMD Payable To,EMD Payable At,S.No,Bank Name,Tender Fee in ₹,VAT Charges in ₹,Fee Payable To,Fee Payable At,Tender Fee Exemption Allowed,Name,Address,Title,Work Description,Pre Qualification Details,Independent External Monitor/Remarks,Tender Value in ₹,Product Category,Sub category,Contract Type,Bid Validity(Days),Period Of Work(Days),Location,Pincode,Pre Bid Meeting Place,Pre Bid Meeting Address,Pre Bid Meeting Date,Bid Opening Place,Should Allow NDA Tender,Allow Preferential Bidder,Tender Stage,Contract Date :,Contract Value :,Work Completion Period in days :,Updated By :,Updated on :,AOC document :,AOC Description :,S.No,Bid Number,Bidder Name,Awarded Currency,Awarded Value,S.No.1,Bid Number.1,Bidder Name.1,Submitted Date,Status,Remarks,Status Updated On,Type :,Summary :,Updated By :.1,Updated On :,Document :,BOQ Comparative Chart :,Committee Chairperson/Co-ordinator Name :,Committee Chairperson/Co-ordinator Type :,Committee Members :,Updated By :.2,Updated on :.1,Document :.1,Organisation Chain :,Tender ID :,Tender Ref No :,Tender Title :,Type :.1,Summary :.1,Updated By :.3,Updated On :.1,Document :.2,Committee Chairperson/Co-ordinator Name :.1,Committee Chairperson/Co-ordinator Type :.1,Committee Members :.1,Updated By :.4,Updated On :.2,Financial Bid Opening Date:,Document :.3,Tender Stage
EIC-CIVIL||SERNB-CIRCLE-PHULBANI,CCE_R and B_PLB_03 of 2024_25,2024_EICCL_105083_1,Yes,Open Tender,Percentage,Works,2.0,No,No,Online,No,No,No,1.0,Fee/PreQual/Technical,.pdf,"Online Bid Cost, EMD as per clause 06 of DTCN, affidavit, RC, PAN,GST",30-Sep-2024 10:00 AM,17-Oct-2024 11:00 AM,30-Sep-2024 10:00 AM,15-Oct-2024 05:00 PM,30-Sep-2024 10:00 AM ,14-Oct-2024 05:00 PM ,30-Sep-2024 10:00 AM,15-Oct-2024 05:00 PM,05-Nov-2024 11:00 AM,"2,61,900",Yes,fixed,,Nil,Nil,1.0,ICICI BANK,"10,000",0.0,Nil,Nil,No,CCE Phulbani RandB Circle Phulbani,Office of the CCE Phulbani RandB Circle Phulbani District Kandhamal PIN 762001,Construction of Boxcell Culvert over Gandasila Nallah at 4th KM on Raikia-Gandasila Nallah-Mediakia-Sarangada Road,Construction of Boxcell Culvert over Gandasila Nallah at 4th KM on Raikia-Gandasila Nallah-Mediakia-Sarangada Road,Please Refer Tender Documents ,NA ,"2,61,85,244",Civil Works - Bridges,NA ,Tender,90.0,90.0,Phulbani,762001.0,NA ,NA ,NA ,Office of the CCE Phulbani RandB Circle Phulbani,No ,No,AOC,04-Feb-2025,"INR 22,260,076",90.0,Pravat Kumar Das,04-Feb-2025 02:51 PM,374P1_GandasilaNallah.pdf (364.00 KB),Awarded being L1 bidder,1.0,2578009.0,JAYANTA KUMAR PARIDA,INR,"22,260,076",1,2577608,G. Sravan Kumar Achari,15-Oct-2024 01:46 PM,Rejected-Finance,Rejected being L2 bidder,04-Feb-2025 02:40 PM,Finance,All document are received and under scrutiny,Pravat Kumar Das,05-Nov-2024 01:03 PM,,BOQ Comparative Chart,CCE Phulbani RandB Circle Phulbani,Internal,CCE Phulbani RandB Circle Phulbani SE Phulbani RandB Division Phulbani DAO Phulbani RandB Division Phulbani PA to CCE Phulbani RandB Circle Phulbani,Pravat Kumar Das,04-Feb-2025 02:40 PM,finsummary_507345.pdf (129.74 KB),EIC-CIVIL||SERNB-CIRCLE-PHULBANI,2024_EICCL_105083_1,CCE_R and B_PLB_03 of 2024_25,Construction of Boxcell Culvert over Gandasila Nallah at 4th KM on Raikia-Gandasila Nallah-Mediakia-Sarangada Road,Technical,All document are received and under scrutiny,Pravat Kumar Das,17-Oct-2024 12:00 PM,,CCE Phulbani RandB Circle Phulbani,Internal,CCE Phulbani RandB Circle Phulbani SE Phulbani RandB Division Phulbani DAO Phulbani RandB Division Phulbani PA to CCE Phulbani RandB Circle Phulbani,Kruttika Kumari Panda,29-Oct-2024 05:52 PM,05-Nov-2024 11:00 AM,techsummary_507345.pdf (861.28 KB),AOC
,,,,,,,,,,,,,,,,.pdf,"Work Experience, Machineries and other documents as per DTCN",,,,,,,,,,,,,,,,2.0,ICICI NEFT/RTGS,,,,,,,,,,,,,,,,,,,,,,,,,,AOC,,,,,,,,,,,,,2,2572458,Jayadeep Kumar Gouda,08-Oct-2024 08:38 PM,Rejected-Technical,Rejected due to not furnished of a single RCC BoxCulvert costing not less than Rs 1point83 Crore or 2Nos Not less than Rs 0point92 crore Hence rejectedasperClause122 of DTCN,29-Oct-2024 05:52 PM,,,,,,,,,,,,,,,,,,,,,,,,,,,,,AOC
,,,,,,,,,,,,,,2.0,Finance,.xls,BOQ,,,,,,,,,,,,,,,,,,,,,,,,,,,,,,,,,,,,,,,,,,,AOC,,,,,,,,,,,,,3,2578009,JAYANTA KUMAR PARIDA,15-Oct-2024 03:32 PM,Accepted-AOC,Awarded being L1 bidder,04-Feb-2025 02:51 PM,,,,,,,,,,,,,,,,,,,,,,,,,,,,,AOC
,,,,,,,,,,,,,,,,,,,,,,,,,,,,,,,,,,,,,,,,,,,,,,,,,,,,,,,,,,,,AOC,,,,,,,,,,,,,4,2571485,NARAYAN PRADHAN,15-Oct-2024 04:25 PM,Rejected-Finance,Rejected being L5 bidder,04-Feb-2025 02:40 PM,,,,,,,,,,,,,,,,,,,,,,,,,,,,,AOC
,,,,,,,,,,,,,,,,,,,,,,,,,,,,,,,,,,,,,,,,,,,,,,,,,,,,,,,,,,,,AOC,,,,,,,,,,,,,5,2575586,PRASANTA PADAMBUJA SAMAL,14-Oct-2024 12:24 PM,Rejected-Technical,Rejected due to not furnished of a single RCC BoxCulvert costing not less than Rs 1point83 Crore or 2Nos Not less than Rs 0point92 crore Hence rejectedasperClause122 of DTCN,29-Oct-2024 05:52 PM,,,,,,,,,,,,,,,,,,,,,,,,,,,,,AOC
,,,,,,,,,,,,,,,,,,,,,,,,,,,,,,,,,,,,,,,,,,,,,,,,,,,,,,,,,,,,AOC,,,,,,,,,,,,,6,2574407,PURUSOTTAM BEHERA,14-Oct-2024 11:24 AM,Rejected-Finance,Rejected being L4 bidder,04-Feb-2025 02:40 PM,,,,,,,,,,,,,,,,,,,,,,,,,,,,,AOC
,,,,,,,,,,,,,,,,,,,,,,,,,,,,,,,,,,,,,,,,,,,,,,,,,,,,,,,,,,,,AOC,,,,,,,,,,,,,7,2577479,SUBHASHKUMAR S JENA,15-Oct-2024 12:24 PM,Rejected-Finance,Rejected being L3 bidder,04-Feb-2025 02:40 PM,,,,,,,,,,,,,,,,,,,,,,,,,,,,,AOC
,,,,,,,,,,,,,,,,,,,,,,,,,,,,,,,,,,,,,,,,,,,,,,,,,,,,,,,,,,,,AOC,,,,,,,,,,,,,8,2577649,Swadhin Kumar sahu,15-Oct-2024 12:54 PM,Rejected-Finance,Rejected being L2 bidder,04-Feb-2025 02:40 PM,,,,,,,,,,,,,,,,,,,,,,,,,,,,,AOC
,,,,,,,,,,,,,,,,,,,,,,,,,,,,,,,,,,,,,,,,,,,,,,,,,,,,,,,,,,,,AOC,,,,,,,,,,,,,9,2577640,Umakanta Sahu,15-Oct-2024 04:19 PM,Rejected-Finance,Rejected being L2 bidder,04-Feb-2025 02:40 PM,,,,,,,,,,,,,,,,,,,,,,,,,,,,,AOC
