Organisation Chain,Tender Reference Number,Tender ID,Withdrawal Allowed,Tender Type,Form of contract,Tender Category,No. of Covers,General Technical Evaluation Allowed,ItemWise Technical Evaluation Allowed,Payment Mode,Is Multi Currency Allowed For BOQ,Is Multi Currency Allowed For Fee,Allow Two Stage Bidding,Cover No,Cover,Document Type,Description,Publish Date,Bid Opening Date,Document Download / Sale Start Date,Document Download / Sale End Date,Clarification Start Date,Clarification End Date,Bid Submission Start Date,Bid Submission End Date,Financial Bid Opening Date,EMD Amount in ₹,EMD Exemption Allowed,EMD Fee Type,EMD Percentage,EMD Payable To,EMD Payable At,S.No,Corrigendum Title,Corrigendum Type,View,S.No.1,Bank Name,Tender Fee in ₹,VAT Charges in ₹,Fee Payable To,Fee Payable At,Tender Fee Exemption Allowed,Name,Address,Title,Work Description,Pre Qualification Details,Independent External Monitor/Remarks,Tender Value in ₹,Product Category,Sub category,Contract Type,Bid Validity(Days),Period Of Work(Days),Location,Pincode,Pre Bid Meeting Place,Pre Bid Meeting Address,Pre Bid Meeting Date,Bid Opening Place,Should Allow NDA Tender,Allow Preferential Bidder,Tender Stage,Contract Date :,Contract Value :,Work Completion Period in days :,Updated By :,Updated on :,AOC document :,S.No,Bid Number,Bidder Name,Awarded Currency,Awarded Value,S.No.1,Bid Number.1,Bidder Name.1,Submitted Date,Status,Remarks,Status Updated On,Type :,Summary :,Updated By :.1,Updated On :,Document :,BOQ Comparative Chart :,Committee Chairperson/Co-ordinator Name :,Committee Chairperson/Co-ordinator Type :,Committee Members :,Updated By :.2,Updated on :.1,Document :.1,Organisation Chain :,Tender ID :,Tender Ref No :,Tender Title :,Type :.1,Summary :.1,Updated By :.3,Updated On :.1,Document :.2,Committee Chairperson/Co-ordinator Name :.1,Committee Chairperson/Co-ordinator Type :.1,Committee Members :.1,Updated By :.4,Updated On :.2,Financial Bid Opening Date:,Document :.3,Tender Stage
"CE-BM, Tel Basin,Bhawanipatna||SE Balangir Irr Circle Balangir||EE Kandhamal Irr Division Phulbani","EE,KID-02/2023-24",2024_CEBMT_99792_3,Yes,Open Tender,Percentage,Works,2.0,No,No,Online,No,No,No,1.0,Fee/PreQual/Technical,.pdf,"Tender Cost, GST, PAN, Contractor RC, NRC, Affidavits",18-Jan-2024 10:00 AM,02-Feb-2024 11:00 AM,18-Jan-2024 10:00 AM,01-Feb-2024 05:30 PM,18-Jan-2024 10:00 AM ,25-Jan-2024 05:30 PM ,18-Jan-2024 10:00 AM,01-Feb-2024 05:30 PM,02-Feb-2024 05:30 PM,"63,644",Yes,fixed,,Nil,Nil,1.0,1st corrigendum,Technical Bid,,1.0,ICICI BANK,"10,000",0.0,Nil,Nil,Yes,"Executive Engineer, KID, Phulbani","o/o the EE, KID, Phulbani",Improvement to Pillasalki Dam approach road and Road from Spill way to Left HR of Pillasalki Dam for the year 2023-24,Road works,Please refer Tender documents. ,NA ,"63,64,367",Civil Works - Roads,NA ,Tender,90.0,45.0,Pillasalki Dam Phulbani,762001.0,NA ,NA ,NA ,"o/o the EE, KID, Phulbani",No ,No,AOC,16-Feb-2024,"INR 5,410,348.36",90.0,Kuturu Kisan,19-Feb-2024 04:16 PM,PDF.pdf (1030.00 KB),1.0,2406441.0,ABINASH MISHRA,INR,"5,410,348.36",1,2406441,ABINASH MISHRA,26-Jan-2024 05:01 PM,Accepted-AOC,Selected as L1 Through Transparent Lottery,19-Feb-2024 04:16 PM,Finance,Out of 5 nos. of bidders only 2 nos. of bidder have qualified to enter into the lottery system having quoted 14.99 percentage less than the tender amount.,Kuturu Kisan,02-Feb-2024 08:05 PM,finance_485333.pdf,BOQ Comparative Chart,Executive Engineer,Internal,,Kuturu Kisan,02-Feb-2024 08:29 PM,finsummary_485333.pdf (506.68 KB),"CE-BM, Tel Basin,Bhawanipatna||SE Balangir Irr Circle Balangir||EE Kandhamal Irr Division Phulbani",2024_CEBMT_99792_3,"EE,KID-02/2023-24",Improvement to Pillasalki Dam approach road and Road from Spill way to Left HR of Pillasalki Dam for the year 2023-24,Technical,Total 5 nos. bid submitted and all 5 nos. of bid are admitted.,Kuturu Kisan,02-Feb-2024 11:12 AM,,Executive Engineer,Internal,,Kuturu Kisan,02-Feb-2024 05:15 PM,02-Feb-2024 05:30 PM,techsummary_485333.pdf (447.50 KB),AOC
,,,,,,,,,,,,,,2.0,Finance,.xls,Financial,,,,,,,,,,,,,,,,,,,,2.0,ICICI NEFT/RTGS,,,,,,,,,,,,,,,,,,,,,,,,,,AOC,,,,,,,,,,,,2,2416070,Mukesh Kumar Kudei,01-Feb-2024 12:04 PM,Rejected-Finance,Quoted 3 rd lowest value,02-Feb-2024 08:29 PM,,,,,,,,,,,,,,,,,,,,,,,,,,,,,AOC
,,,,,,,,,,,,,,,,,,,,,,,,,,,,,,,,,,,,,,,,,,,,,,,,,,,,,,,,,,,,,,,,AOC,,,,,,,,,,,,3,2415722,RAMA KRUSHNA PATTNAYAK,01-Feb-2024 08:30 AM,Rejected-Finance,Quoted 2nd lowest value,02-Feb-2024 08:29 PM,,,,,,,,,,,,,,,,,,,,,,,,,,,,,AOC
,,,,,,,,,,,,,,,,,,,,,,,,,,,,,,,,,,,,,,,,,,,,,,,,,,,,,,,,,,,,,,,,AOC,,,,,,,,,,,,4,2406770,Sri Bijaya Kumar Bhatta,31-Jan-2024 10:03 PM,Rejected-Finance,Quoted 3rd lowest value,02-Feb-2024 08:29 PM,,,,,,,,,,,,,,,,,,,,,,,,,,,,,AOC
,,,,,,,,,,,,,,,,,,,,,,,,,,,,,,,,,,,,,,,,,,,,,,,,,,,,,,,,,,,,,,,,AOC,,,,,,,,,,,,5,2415917,SRIKANTA KUMAR GURU,01-Feb-2024 11:13 AM,Rejected-AOC,Not Selected Through Transparent Lottery,19-Feb-2024 04:16 PM,,,,,,,,,,,,,,,,,,,,,,,,,,,,,AOC
