Organisation Chain,Tender Reference Number,Tender ID,Withdrawal Allowed,Tender Type,Form of contract,Tender Category,No. of Covers,General Technical Evaluation Allowed,ItemWise Technical Evaluation Allowed,Payment Mode,Is Multi Currency Allowed For BOQ,Is Multi Currency Allowed For Fee,Allow Two Stage Bidding,Cover No,Cover,Document Type,Description,Publish Date,Bid Opening Date,Document Download / Sale Start Date,Document Download / Sale End Date,Clarification Start Date,Clarification End Date,Bid Submission Start Date,Bid Submission End Date,Financial Bid Opening Date,EMD Amount in ₹,EMD Exemption Allowed,EMD Fee Type,EMD Percentage,EMD Payable To,EMD Payable At,S.No,Corrigendum Title,Corrigendum Type,View,S.No.1,Bank Name,Tender Fee in ₹,VAT Charges in ₹,Fee Payable To,Fee Payable At,Tender Fee Exemption Allowed,Name,Address,Title,Work Description,Pre Qualification Details,Independent External Monitor/Remarks,Tender Value in ₹,Product Category,Sub category,Contract Type,Bid Validity(Days),Period Of Work(Days),Location,Pincode,Pre Bid Meeting Place,Pre Bid Meeting Address,Pre Bid Meeting Date,Bid Opening Place,Should Allow NDA Tender,Allow Preferential Bidder,Tender Stage,Contract Date :,Contract Value :,Work Completion Period in days :,Updated By :,Updated on :,AOC document :,AOC Description :,S.No,Bid Number,Bidder Name,Awarded Currency,Awarded Value,S.No.1,Bid Number.1,Bidder Name.1,Submitted Date,Status,Remarks,Status Updated On,Type :,Summary :,Updated By :.1,Updated On :,Document :,BOQ Comparative Chart :,Committee Chairperson/Co-ordinator Name :,Committee Chairperson/Co-ordinator Type :,Committee Members :,Updated By :.2,Updated on :.1,Document :.1,Organisation Chain :,Tender ID :,Tender Ref No :,Tender Title :,Type :.1,Summary :.1,Updated By :.3,Updated On :.1,Document :.2,Committee Chairperson/Co-ordinator Name :.1,Committee Chairperson/Co-ordinator Type :.1,Committee Members :.1,Updated By :.4,Updated On :.2,Financial Bid Opening Date:,Document :.3,Tender Stage
Orissa State Police Housing and Welfare Corporation Ltd,29/OPHWC/2023-24,2024_OSPHW_99651_1,Yes,National Competitive Bid,Percentage,Works,2.0,No,No,Online,No,No,No,1.0,Fee/PreQual/Technical,.pdf,"GST, GSTR-1, PAN, Contractor Registration Certificate and Affidavit",12-Jan-2024 06:00 PM,31-Jan-2024 11:00 AM,12-Jan-2024 06:00 PM,30-Jan-2024 05:00 PM,12-Jan-2024 06:00 PM ,17-Jan-2024 05:00 PM ,12-Jan-2024 06:00 PM,30-Jan-2024 05:00 PM,08-Feb-2024 10:30 AM,"8,82,000",Yes,fixed,,Nil,Nil,1.0,CORRIGENDUM FOR E-BG FORMAT,Other,,1.0,ICICI BANK,"11,800",0.0,Nil,Nil,No,CHIEF ENGINEER OPHWC,OPHWC BHUBANESWAR,"Cluster of 1.Const. of Academic Bldg. with 15 Class Room for 128 Student , 2. Constn. of 50 Seated Boys Hostel, 3. Constn. of Entrance Gate, 4. Repair and Renovation work of existing bldg. at Kantabanji Vocational College, Kantabanji, Bolangir",Building Work,Please refer Tender documents  ,NA ,"8,82,02,872",Civil Works - Buildings,NA ,Tender,90.0,450.0,Bolangir,751022.0,NA ,NA ,NA ,OPHWC BHUBANESWAR,No ,No,AOC,28-Feb-2024,"INR 79,391,405",450.0,DURGA CHARANA MISHRA,28-Feb-2024 03:42 PM,WORKH.pdf (134.00 KB),AWARDED AS L1 TENDERER AND AWARDED ON DATE 27.02.2024,1.0,2411403.0,YUBRAJ JAIN,INR,"79,391,405",1,2411897,AVR INFRATECH PVT LTD,30-Jan-2024 03:23 PM,Rejected-Technical,Due to non-securing qualifying marks in Point of Presentation as per DTCN Cl.110(m),07-Feb-2024 07:23 PM,Finance,FINANCIAL BID OPEN AND COMPARATIVE GENERATED,Bikram Keshari Malla,08-Feb-2024 10:49 AM,,BOQ Comparative Chart,AS PER ACCEPTANCE LETTER,Internal,AS PER ACCEPTANCE LETTER,DURGA CHARANA MISHRA,28-Feb-2024 03:39 PM,finsummary_484613.pdf (101.65 KB),Orissa State Police Housing and Welfare Corporation Ltd,2024_OSPHW_99651_1,29/OPHWC/2023-24,"Cluster of 1.Const. of Academic Bldg. with 15 Class Room for 128 Student , 2. Constn. of 50 Seated Boys Hostel, 3. Constn. of Entrance Gate, 4. Repair and Renovation work of existing bldg. at Kantabanji Vocational College, Kantabanji, Bolangir",Technical,TECHNICAL BID OPEN AND FIVE BIDDER HAVE PARTICIPATE,DURGA CHARANA MISHRA,31-Jan-2024 11:50 AM,,AS PER TC MINUTES,Internal,AS PER TC MINUTES,Laxmi Kanta Padhi,07-Feb-2024 07:23 PM,08-Feb-2024 10:30 AM,techsummary_484613.pdf (388.38 KB),AOC
,,,,,,,,,,,,,,,,.pdf,Other Document as per DTCN,,,,,,,,,,,,,,,,,,,,2.0,ICICI NEFT/RTGS,,,,,,,,,,,,,,,,,,,,,,,,,,AOC,,,,,,,,,,,,,2,2410242,NAGEN KUMAR BISWAL,29-Jan-2024 04:47 PM,Rejected-Finance,DUE TO L2 BIDDER,28-Feb-2024 03:39 PM,,,,,,,,,,,,,,,,,,,,,,,,,,,,,AOC
,,,,,,,,,,,,,,2.0,Finance,.xls,Bill of Quantity,,,,,,,,,,,,,,,,,,,,,,,,,,,,,,,,,,,,,,,,,,,,,,,AOC,,,,,,,,,,,,,3,2412297,Ravi Realcons Private Limited,30-Jan-2024 03:14 PM,Rejected-Technical,Due to non-securing qualifying marks in Point of Presentation as per DTCN Cl.110(m),07-Feb-2024 07:23 PM,,,,,,,,,,,,,,,,,,,,,,,,,,,,,AOC
,,,,,,,,,,,,,,,,,,,,,,,,,,,,,,,,,,,,,,,,,,,,,,,,,,,,,,,,,,,,,,,,AOC,,,,,,,,,,,,,4,2412334,R K BUILDER,30-Jan-2024 01:54 PM,Rejected-Finance,DUE TO L3 BIDDER,28-Feb-2024 03:39 PM,,,,,,,,,,,,,,,,,,,,,,,,,,,,,AOC
,,,,,,,,,,,,,,,,,,,,,,,,,,,,,,,,,,,,,,,,,,,,,,,,,,,,,,,,,,,,,,,,AOC,,,,,,,,,,,,,5,2411403,YUBRAJ JAIN,30-Jan-2024 12:08 PM,Accepted-AOC,QUALIFIED BIDDER,28-Feb-2024 03:42 PM,,,,,,,,,,,,,,,,,,,,,,,,,,,,,AOC
