Organisation Chain,Tender Reference Number,Tender ID,Withdrawal Allowed,Tender Type,Form of contract,Tender Category,No. of Covers,General Technical Evaluation Allowed,ItemWise Technical Evaluation Allowed,Payment Mode,Is Multi Currency Allowed For BOQ,Is Multi Currency Allowed For Fee,Allow Two Stage Bidding,Cover No,Cover,Document Type,Description,Publish Date,Bid Opening Date,Document Download / Sale Start Date,Document Download / Sale End Date,Clarification Start Date,Clarification End Date,Bid Submission Start Date,Bid Submission End Date,EMD Amount in ₹,EMD Exemption Allowed,EMD Fee Type,EMD Percentage,EMD Payable To,EMD Payable At,S.No,Bank Name,Tender Fee in ₹,Fee Payable To,Fee Payable At,Tender Fee Exemption Allowed,Name,Address,Title,Work Description,Pre Qualification Details,Independent External Monitor/Remarks,Tender Value in ₹,Product Category,Sub category,Contract Type,Bid Validity(Days),Period Of Work(Days),Location,Pincode,Pre Bid Meeting Place,Pre Bid Meeting Address,Pre Bid Meeting Date,Bid Opening Place,Should Allow NDA Tender,Allow Preferential Bidder,Tender Stage,Contract Date :,Contract Value :,Work Completion Period in days :,Updated By :,Updated on :,AOC document :,AOC Description :,S.No,Bid Number,Bidder Name,Awarded Currency,Awarded Value,S.No.1,Bid Number.1,Bidder Name.1,Submitted Date,Status,Remarks,Status Updated On,Type :,Summary :,Updated By :.1,Updated On :,Document :,BOQ Comparative Chart :,Committee Chairperson/Co-ordinator Name :,Committee Chairperson/Co-ordinator Type :,Committee Members :,Updated By :.2,Updated on :.1,Document :.1,Organisation Chain :,Tender ID :,Tender Ref No :,Tender Title :,Committee Chairperson/Co-ordinator Name :.1,Committee Chairperson/Co-ordinator Type :.1,Committee Members :.1,Updated By :.3,Updated On :.1,Document :.2,Tender Stage
CE AND BM IK BASIN BARINIPUT JEYPORE||Upper Indravati Dam Circle Khatiguda||Podgada Dam Division Khatiguda,EEPDD-01-SINGLE,2023_PGDDK_96182_2,Yes,Open Tender,Percentage,Works,1.0,No,No,Online,No,No,No,1.0,Fee/PreQual/Technical/Finance,.pdf,Scanned copy of Tender Fee and EMD,01-Nov-2023 11:00 AM,17-Nov-2023 11:30 AM,01-Nov-2023 11:00 AM,14-Nov-2023 05:00 PM,NA ,NA ,01-Nov-2023 11:00 AM,14-Nov-2023 05:00 PM,"43,100",Yes,fixed,,Nil,Nil,1.0,ICICI BANK,"6,000",Nil,Nil,Yes,"Executive Engineer, Podagada Dam Division","O/o The Executive Engineer, Podagada Dam Division, Khatiguda, Nabarangpur, Odisha, 764085","Improvement to the road from TSP junction (near Praja Deopali School) to Indravati Dam from RD 0.00 km to RD 2.10 km. UIDC, Khatiguda.","Improvement to the road from TSP junction (near Praja Deopali School) to Indravati Dam from RD 0.00 km to RD 2.10 km. UIDC, Khatiguda.",Please refer Tender documents. ,NA ,"43,04,428",Civil Works - Others,NA ,Tender,90.0,180.0,Khatiguda,764085.0,NA ,NA ,NA ,"O/o The Executive Engineer, Podagada Dam Division,",No ,No,AOC,17-Feb-2024,"INR 3,659,194",180.0,JANARDHAN TAHASILDAR,17-Feb-2024 04:56 PM,WorkOrder.pdf (784.00 KB),The work has awarded in favour of Sahil Khan B Class Diploma Engineering Contractor,1.0,2314823.0,SAHIL KHAN,INR,"3,659,194",1.0,2313785.0,BAMADEV DALAI,13-Nov-2023 09:02 PM,Rejected-Finance,OK,17-Feb-2024 04:45 PM,Finance,Three bids submitted and all three bids are admitted,JANARDHAN TAHASILDAR,17-Nov-2023 02:07 PM,finance_469963.pdf,BOQ Comparative Chart,JANARDHAN TAHASILDAR EE,Internal,BUDHURAI SOREN AEE SAROJA KANTA DAS AEE NARASINGHA SAHU DAO,JANARDHAN TAHASILDAR,17-Feb-2024 04:45 PM,finsummary_469963.pdf (379.77 KB),CE AND BM IK BASIN BARINIPUT JEYPORE||Upper Indravati Dam Circle Khatiguda||Podgada Dam Division Khatiguda,2023_PGDDK_96182_2,EEPDD-01-SINGLE,"Improvement to the road from TSP junction (near Praja Deopali School) to Indravati Dam from RD 0.00 km to RD 2.10 km. UIDC, Khatiguda.",Janardhan Tahasildar EE,Internal,Budhurai Soren AEE Saroja Kanta Das AEE Narasingha Sahu DAO,JANARDHAN TAHASILDAR,02-Dec-2023 01:20 PM,techsummary_469963.pdf (736.94 KB),AOC
,,,,,,,,,,,,,,,,.pdf,"PAN, GST, CONTRACTOR REGISTRATION CERTIFICATE",,,,,,,,,,,,,,,2.0,ICICI NEFT/RTGS,,,,,,,,,,,,,,,,,,,,,,,,,AOC,,,,,,,,,,,,,2.0,2313739.0,KISTO HARIJAN,13-Nov-2023 08:07 PM,Rejected-Technical,Not Submitted Required Documents,02-Dec-2023 01:20 PM,,,,,,,,,,,,,,,,,,,,,,,AOC
,,,,,,,,,,,,,,,,.pdf,Affidavit of Authentication of Documents,,,,,,,,,,,,,,,,,,,,,,,,,,,,,,,,,,,,,,,,,AOC,,,,,,,,,,,,,3.0,2314823.0,SAHIL KHAN,14-Nov-2023 04:47 PM,Accepted-AOC,The work has awarded in favour of Sahil Khan B Class Diploma Engineering Contractor,17-Feb-2024 04:56 PM,,,,,,,,,,,,,,,,,,,,,,,AOC
,,,,,,,,,,,,,,,,.pdf,Affidavit towards exemption of EMD incase of Engineer Contractors,,,,,,,,,,,,,,,,,,,,,,,,,,,,,,,,,,,,,,,,,AOC,,,,,,,,,,,,,,,,,,,,,,,,,,,,,,,,,,,,,,,,,,AOC
,,,,,,,,,,,,,,,,.pdf,Affidavit towards Price Preference in case of SC and ST Contractors,,,,,,,,,,,,,,,,,,,,,,,,,,,,,,,,,,,,,,,,,AOC,,,,,,,,,,,,,,,,,,,,,,,,,,,,,,,,,,,,,,,,,,AOC
,,,,,,,,,,,,,,,,.pdf,No Relation Certificate and Other Required documents as per DTCN,,,,,,,,,,,,,,,,,,,,,,,,,,,,,,,,,,,,,,,,,AOC,,,,,,,,,,,,,,,,,,,,,,,,,,,,,,,,,,,,,,,,,,AOC
,,,,,,,,,,,,,,,,.xls,Price BID (BoQ),,,,,,,,,,,,,,,,,,,,,,,,,,,,,,,,,,,,,,,,,AOC,,,,,,,,,,,,,,,,,,,,,,,,,,,,,,,,,,,,,,,,,,AOC
