Organisation Chain,Tender Reference Number,Tender ID,Withdrawal Allowed,Tender Type,Form of contract,Tender Category,No. of Covers,General Technical Evaluation Allowed,ItemWise Technical Evaluation Allowed,Payment Mode,Is Multi Currency Allowed For BOQ,Is Multi Currency Allowed For Fee,Allow Two Stage Bidding,Cover No,Cover,Document Type,Description,Publish Date,Bid Opening Date,Document Download / Sale Start Date,Document Download / Sale End Date,Clarification Start Date,Clarification End Date,Bid Submission Start Date,Bid Submission End Date,Financial Bid Opening Date,EMD Amount in ₹,EMD Exemption Allowed,EMD Fee Type,EMD Percentage,EMD Payable To,EMD Payable At,S.No,Bank Name,Tender Fee in ₹,Fee Payable To,Fee Payable At,Tender Fee Exemption Allowed,Name,Address,Title,Work Description,Pre Qualification Details,Independent External Monitor/Remarks,Tender Value in ₹,Product Category,Sub category,Contract Type,Bid Validity(Days),Period Of Work(Days),Location,Pincode,Pre Bid Meeting Place,Pre Bid Meeting Address,Pre Bid Meeting Date,Bid Opening Place,Should Allow NDA Tender,Allow Preferential Bidder,Tender Stage,Contract Date :,Contract Value :,Work Completion Period in days :,Updated By :,Updated on :,AOC document :,AOC Description :,S.No,Bid Number,Bidder Name,Awarded Currency,Awarded Value,S.No.1,Bid Number.1,Bidder Name.1,Submitted Date,Status,Remarks,Status Updated On,Type :,Summary :,Updated By :.1,Updated On :,Document :,BOQ Comparative Chart :,Committee Chairperson/Co-ordinator Name :,Committee Chairperson/Co-ordinator Type :,Committee Members :,Updated By :.2,Updated on :.1,Document :.1,Organisation Chain :,Tender ID :,Tender Ref No :,Tender Title :,Type :.1,Summary :.1,Updated By :.3,Updated On :.1,Document :.2,Committee Chairperson/Co-ordinator Name :.1,Committee Chairperson/Co-ordinator Type :.1,Committee Members :.1,Updated By :.4,Updated On :.2,Financial Bid Opening Date:,Document :.3,Tender Stage
CE AND BM IK BASIN BARINIPUT JEYPORE||Upper Indravati Dam Circle Khatiguda||Podgada Dam Division Khatiguda,EEPDD-01-DOUBLE,2023_PGDDK_96188_1,Yes,Open Tender,Percentage,Works,2.0,No,No,Online,No,No,No,1.0,Fee/PreQual/Technical,.pdf,Scanned copy of Tender Fee and EMD,01-Nov-2023 11:00 AM,21-Nov-2023 11:30 AM,01-Nov-2023 11:00 AM,18-Nov-2023 05:00 PM,NA ,NA ,01-Nov-2023 11:00 AM,18-Nov-2023 05:00 PM,06-Dec-2023 12:00 PM,"83,000",Yes,fixed,,Nil,Nil,1.0,ICICI BANK,"10,000",Nil,Nil,No,"Executive Engineer, Podagada Dam Division","O/o The Executive Engineer, Podagada Dam Division, Khatiguda, Nabarangpur, Odisha, 764085",IMPROVEMENT TO BLACK TOPPING SERVICE ROAD NEAR OCC BRIDGE CHOWK TO PODAGADA EARTH DAM THROUGH RIGHT SIDE ENTRANCE GATE TO DAM TOP FROM RD 0.00 TO RD 2389.8 MTR WITH OTHER ADJOINING LINK ROAD TO PODAGADA EARTH DAM.,IMPROVEMENT TO BLACK TOPPING SERVICE ROAD NEAR OCC BRIDGE CHOWK TO PODAGADA EARTH DAM THROUGH RIGHT SIDE ENTRANCE GATE TO DAM TOP FROM RD 0.00 TO RD 2389.8 MTR WITH OTHER ADJOINING LINK ROAD TO PODAGADA EARTH DAM.,Please refer Tender documents. ,NA ,"82,90,645",Civil Works - Others,NA ,Tender,90.0,180.0,Khatiguda,764085.0,NA ,NA ,NA ,"O/o The Executive Engineer, Podagada Dam Division,",No ,No,AOC,17-Feb-2024,"INR 7,047,877",180.0,JANARDHAN TAHASILDAR,17-Feb-2024 04:53 PM,WorkOrder.pdf (774.00 KB),The work has awarded in favour of Sri Kisto Harijan B Class Diploma Engineering Contractor,1.0,2313734.0,KISTO HARIJAN,INR,"7,047,877",1,2314310,ASUTOSH PATRA,16-Nov-2023 08:35 PM,Rejected-Finance,OK,17-Feb-2024 04:48 PM,Finance,Seven nos. bidders have participated and all the bids are admitted.,JANARDHAN TAHASILDAR,06-Dec-2023 07:48 PM,finance_469964.pdf,BOQ Comparative Chart,JANARDHAN TAHASILDAR EE,Internal,BUDHURAI SOREN AEE SAROJA KANTA DAS AEE NARASINGHA SAHU DAO,JANARDHAN TAHASILDAR,17-Feb-2024 04:48 PM,finsummary_469964.pdf (401.34 KB),CE AND BM IK BASIN BARINIPUT JEYPORE||Upper Indravati Dam Circle Khatiguda||Podgada Dam Division Khatiguda,2023_PGDDK_96188_1,EEPDD-01-DOUBLE,IMPROVEMENT TO BLACK TOPPING SERVICE ROAD NEAR OCC BRIDGE CHOWK TO PODAGADA EARTH DAM THROUGH RIGHT SIDE ENTRANCE GATE TO DAM TOP FROM RD 0.00 TO RD 2389.8 MTR WITH OTHER ADJOINING LINK ROAD TO PODAGADA EARTH DAM.,Technical,Seven bids submitted and all seven bids are admitted,JANARDHAN TAHASILDAR,21-Nov-2023 01:21 PM,technical_469964.pdf,Janardhan Tahasildar EE,Internal,Budhurai Soren AEE Saroja Kanta Das AEE Narasingha Sahu DAO,JANARDHAN TAHASILDAR,02-Dec-2023 01:25 PM,06-Dec-2023 12:00 PM,techsummary_469964.pdf (605.83 KB),AOC
,,,,,,,,,,,,,,,,.pdf,"PAN, GST, CONTRACTOR REGISTRATION CERTIFICATE",,,,,,,,,,,,,,,,2.0,ICICI NEFT/RTGS,,,,,,,,,,,,,,,,,,,,,,,,,AOC,,,,,,,,,,,,,2,2313814,Banoj kumar patra,16-Nov-2023 07:42 PM,Rejected-Finance,OK,17-Feb-2024 04:48 PM,,,,,,,,,,,,,,,,,,,,,,,,,,,,,AOC
,,,,,,,,,,,,,,,,.pdf,Affidavit of Authentication of Documents,,,,,,,,,,,,,,,,,,,,,,,,,,,,,,,,,,,,,,,,,,AOC,,,,,,,,,,,,,3,2318396,BINAY KUMAR BEHERA,17-Nov-2023 11:22 AM,Rejected-Finance,OK,17-Feb-2024 04:48 PM,,,,,,,,,,,,,,,,,,,,,,,,,,,,,AOC
,,,,,,,,,,,,,,,,.pdf,Affidavit towards exemption of EMD incase of Engineer Contractors,,,,,,,,,,,,,,,,,,,,,,,,,,,,,,,,,,,,,,,,,,AOC,,,,,,,,,,,,,4,2313734,KISTO HARIJAN,13-Nov-2023 08:11 PM,Accepted-AOC,The work has awarded in favour of Sri Kisto Harijan B Class Diploma Engineering Contractor,17-Feb-2024 04:53 PM,,,,,,,,,,,,,,,,,,,,,,,,,,,,,AOC
,,,,,,,,,,,,,,,,.pdf,Affidavit towards Price Preference in case of SC and ST Contractors,,,,,,,,,,,,,,,,,,,,,,,,,,,,,,,,,,,,,,,,,,AOC,,,,,,,,,,,,,5,2314960,RITESH BHANJA,14-Nov-2023 06:45 PM,Rejected-Finance,OK,17-Feb-2024 04:48 PM,,,,,,,,,,,,,,,,,,,,,,,,,,,,,AOC
,,,,,,,,,,,,,,,,.pdf,No Relation Certificate and Other Required documents as per DTCN,,,,,,,,,,,,,,,,,,,,,,,,,,,,,,,,,,,,,,,,,,AOC,,,,,,,,,,,,,6,2316520,SAHIL KHAN,16-Nov-2023 09:42 AM,Rejected-Finance,OK,17-Feb-2024 04:48 PM,,,,,,,,,,,,,,,,,,,,,,,,,,,,,AOC
,,,,,,,,,,,,,,2.0,Finance,.xls,Price BID (BoQ),,,,,,,,,,,,,,,,,,,,,,,,,,,,,,,,,,,,,,,,,,AOC,,,,,,,,,,,,,7,2313053,SARTAZ AHAMAD KHAN,14-Nov-2023 11:59 PM,Rejected-Finance,OK,17-Feb-2024 04:48 PM,,,,,,,,,,,,,,,,,,,,,,,,,,,,,AOC
