Organisation Chain,Tender Reference Number,Tender ID,Withdrawal Allowed,Tender Type,Form of contract,Tender Category,No. of Covers,General Technical Evaluation Allowed,ItemWise Technical Evaluation Allowed,Payment Mode,Is Multi Currency Allowed For BOQ,Is Multi Currency Allowed For Fee,Allow Two Stage Bidding,Cover No,Cover,Document Type,Description,Publish Date,Bid Opening Date,Document Download / Sale Start Date,Document Download / Sale End Date,Clarification Start Date,Clarification End Date,Bid Submission Start Date,Bid Submission End Date,EMD Amount in ₹,EMD Exemption Allowed,EMD Fee Type,EMD Percentage,EMD Payable To,EMD Payable At,S.No,Bank Name,Tender Fee in ₹,VAT Charges in ₹,Fee Payable To,Fee Payable At,Tender Fee Exemption Allowed,Name,Address,Title,Work Description,Pre Qualification Details,Independent External Monitor/Remarks,Tender Value in ₹,Product Category,Sub category,Contract Type,Bid Validity(Days),Period Of Work(Days),Location,Pincode,Pre Bid Meeting Place,Pre Bid Meeting Address,Pre Bid Meeting Date,Bid Opening Place,Should Allow NDA Tender,Allow Preferential Bidder,Tender Stage,Contract Date :,Contract Value :,Work Completion Period in days :,Updated By :,Updated on :,AOC document :,S.No,Bid Number,Bidder Name,Awarded Currency,Awarded Value,S.No.1,Bid Number.1,Bidder Name.1,Submitted Date,Status,Remarks,Status Updated On,Type :,Summary :,Updated By :.1,Updated On :,Document :,BOQ Comparative Chart :,Committee Chairperson/Co-ordinator Name :,Committee Chairperson/Co-ordinator Type :,Committee Members :,Updated By :.2,Updated on :.1,Document :.1,Organisation Chain :,Tender ID :,Tender Ref No :,Tender Title :,Committee Chairperson/Co-ordinator Name :.1,Committee Chairperson/Co-ordinator Type :.1,Committee Members :.1,Updated By :.3,Updated On :.1,Document :.2,Tender Stage
Orissa Lift Irrigation Corporation||LI KORAPUT||LI Division Nawarangpur,2892 / 02.11.2023,2023_OLIC_96645_41,Yes,Open Tender,Percentage,Works,1.0,No,No,Online,No,No,No,1.0,Fee/PreQual/Technical/Finance,.pdf,"Valid Civil and Electrical License, PAN, GST, Labour License, Affidavit Joint Venture, Experience",16-Nov-2023 10:00 AM,23-Nov-2023 11:00 AM,16-Nov-2023 10:00 AM,22-Nov-2023 05:00 PM,16-Nov-2023 10:00 AM ,18-Nov-2023 01:00 PM ,16-Nov-2023 10:00 AM,22-Nov-2023 05:00 PM,"24,940",No,percentage,1.0%,Nil,Nil,1.0,ICICI BANK,"6,000",0.0,Nil,Nil,No,"E.E, L.I.Division, Nabarangpur","E.E, L.I.Division, Nabarangpur, Pin 764059",Ambadola-VI L.I.P,"Installation, electrification and energisation of Ambadola-VI L.I.P under Nabarangpur Block of Nabarangpur District",As per DTCN ,NA ,"24,94,000",Civil Works - Lift Irrigation Schemes,Electrical ,Tender,180.0,90.0,"E.E, L.I Division, Nabarangpur",764059.0,NA ,NA ,NA ,"Office of the E.E, L.I.Division,Nabarangpur",No ,No,AOC,09-Feb-2024,"INR 2,613,019",90.0,Dillip Kumar Das,09-Feb-2024 02:00 PM,Ambadola-VI.pdf (2925.00 KB),1.0,2326949.0,CHANDAN NAYAK,INR,"2,613,019",1,2326949,CHANDAN NAYAK,22-Nov-2023 12:55 PM,Accepted-AOC,Accepted,14-Feb-2024 06:55 PM,Finance,Opened successfully,Jayaram Behera,29-Nov-2023 01:05 PM,finance_472306.pdf,BOQ Comparative Chart,"Executive Engineer, L.I.Division, Nabarangpur",Internal,"Executive Engineer, Divisional Accountant, Estimator",Dillip Kumar Das,09-Feb-2024 01:57 PM,finsummary_472306.pdf (161.34 KB),Orissa Lift Irrigation Corporation||LI KORAPUT||LI Division Nawarangpur,2023_OLIC_96645_41,2892 / 02.11.2023,Ambadola-VI L.I.P,"Executive Engineer, L.I. Division, Nabarangpur",Internal,"Executive Engineer, Divisional Accountant, Estimator",Dillip Kumar Das,20-Dec-2023 11:15 AM,techsummary_472306.pdf (27.98 KB),AOC
,,,,,,,,,,,,,,,,.pdf,TCN documents,,,,,,,,,,,,,,,2.0,ICICI NEFT/RTGS,,,,,,,,,,,,,,,,,,,,,,,,,,AOC,,,,,,,,,,,,2,2325792,HARA PRASAD NAYAK,21-Nov-2023 01:39 PM,Rejected-Finance,Being Chandan Nayak Accepted The Bid,09-Feb-2024 01:57 PM,,,,,,,,,,,,,,,,,,,,,,,AOC
,,,,,,,,,,,,,,,,.xls,Bill of Quantities,,,,,,,,,,,,,,,,,,,,,,,,,,,,,,,,,,,,,,,,,,AOC,,,,,,,,,,,,3,2328069,LINGARAJ ACHARYA,22-Nov-2023 12:43 PM,Not Admitted-Fee/PreQual/Technical/Finance,Others-GST on tender paper cost not deposited,29-Nov-2023 01:05 PM,,,,,,,,,,,,,,,,,,,,,,,AOC
,,,,,,,,,,,,,,,,,,,,,,,,,,,,,,,,,,,,,,,,,,,,,,,,,,,,,,,,,,,AOC,,,,,,,,,,,,4,2322999,M/S SHANTI POWER AND CONSTRUCTION,21-Nov-2023 11:44 AM,Rejected-Finance,Being Chandan Nayak Accepted The Bid,09-Feb-2024 01:57 PM,,,,,,,,,,,,,,,,,,,,,,,AOC
,,,,,,,,,,,,,,,,,,,,,,,,,,,,,,,,,,,,,,,,,,,,,,,,,,,,,,,,,,,AOC,,,,,,,,,,,,5,2328590,SRI. KAMADEV NAYAK,22-Nov-2023 03:00 PM,Rejected-Finance,Being Chandan Nayak Accepted The Bid,09-Feb-2024 01:57 PM,,,,,,,,,,,,,,,,,,,,,,,AOC
