Organisation Chain,Tender Reference Number,Tender ID,Withdrawal Allowed,Tender Type,Form of contract,Tender Category,No. of Covers,General Technical Evaluation Allowed,ItemWise Technical Evaluation Allowed,Payment Mode,Is Multi Currency Allowed For BOQ,Is Multi Currency Allowed For Fee,Allow Two Stage Bidding,Cover No,Cover,Document Type,Description,Publish Date,Bid Opening Date,Document Download / Sale Start Date,Document Download / Sale End Date,Clarification Start Date,Clarification End Date,Bid Submission Start Date,Bid Submission End Date,EMD Amount in ₹,EMD Exemption Allowed,EMD Fee Type,EMD Percentage,EMD Payable To,EMD Payable At,S.No,Bank Name,Tender Fee in ₹,VAT Charges in ₹,Fee Payable To,Fee Payable At,Tender Fee Exemption Allowed,Name,Address,Title,Work Description,Pre Qualification Details,Independent External Monitor/Remarks,Tender Value in ₹,Product Category,Sub category,Contract Type,Bid Validity(Days),Period Of Work(Days),Location,Pincode,Pre Bid Meeting Place,Pre Bid Meeting Address,Pre Bid Meeting Date,Bid Opening Place,Should Allow NDA Tender,Allow Preferential Bidder,Tender Stage,Contract Date :,Contract Value :,Work Completion Period in days :,Updated By :,Updated on :,AOC document :,AOC Description :,S.No,Bid Number,Bidder Name,Awarded Currency,Awarded Value,S.No.1,Bid Number.1,Bidder Name.1,Submitted Date,Status,Remarks,Status Updated On,Type :,Summary :,Updated By :.1,Updated On :,Document :,BOQ Comparative Chart :,Committee Chairperson/Co-ordinator Name :,Committee Chairperson/Co-ordinator Type :,Committee Members :,Updated By :.2,Updated on :.1,Document :.1,Organisation Chain :,Tender ID :,Tender Ref No :,Tender Title :,Committee Chairperson/Co-ordinator Name :.1,Committee Chairperson/Co-ordinator Type :.1,Committee Members :.1,Updated By :.3,Updated On :.1,Document :.2,Tender Stage
Orissa State Police Housing and Welfare Corporation Ltd,60/OPHWC/2022-23,2023_OSPHW_87330_23,Yes,National Competitive Bid,Percentage,Works,1.0,No,No,Online,No,No,No,1.0,Fee/PreQual/Technical/Finance,.pdf,"GST, GSTR-1, PAN, Contractor Registration Certificate and Affidavit",28-Mar-2023 06:55 PM,10-Apr-2023 11:00 AM,28-Mar-2023 06:55 PM,06-Apr-2023 05:00 PM,28-Mar-2023 06:55 PM ,31-Mar-2023 05:00 PM ,28-Mar-2023 06:55 PM,06-Apr-2023 05:00 PM,"24,100",Yes,fixed,,Nil,Nil,1.0,ICICI BANK,"7,080",0.0,Nil,Nil,No,CHIEF ENGINEER OPHWC,OPHWC BHUBANESWAR,"Construction of Boundary Wall at Gaisilet F.S, Bargarh",Building Work,Please refer Tender documents  ,NA ,"24,12,197",Civil Works - Buildings,NA ,Tender,90.0,60.0,Bargarh,751022.0,NA ,NA ,NA ,OPHWC BHUBANESWAR,No ,No,AOC,03-Feb-2024,"INR 2,171,218",60.0,Bikram Keshari Malla,03-Feb-2024 01:59 PM,WOUK.pdf (2385.00 KB),AWARDED AS L1 TENDERER AND AWARDED ON DATE 27.01.2024,1.0,2109895.0,DIBYA KUMAR MAJHI,INR,"2,171,218",1,2110169,abhaya kumar parida,06-Apr-2023 03:15 PM,Rejected-Technical,DUE TO L2 BIDDER,03-Feb-2024 01:52 PM,Finance,five numbers of bidder have participate,DURGA CHARANA MISHRA,10-Apr-2023 04:55 PM,,BOQ Comparative Chart,AS PER ACCEPTANC LETTER,Internal,AS PER ACCEPTANC LETTER,Bikram Keshari Malla,03-Feb-2024 01:56 PM,finsummary_432655.pdf (488.63 KB),Orissa State Police Housing and Welfare Corporation Ltd,2023_OSPHW_87330_23,60/OPHWC/2022-23,"Construction of Boundary Wall at Gaisilet F.S, Bargarh",AS PER TC MINUTES,Internal,AS PER TC MINUTES,Bikram Keshari Malla,03-Feb-2024 01:52 PM,techsummary_432655.pdf (340.13 KB),AOC
,,,,,,,,,,,,,,,,.pdf,Other Document as per DTCN,,,,,,,,,,,,,,,2.0,ICICI NEFT/RTGS,,,,,,,,,,,,,,,,,,,,,,,,,,AOC,,,,,,,,,,,,,2,2109399,Ashok Kumar Sahoo,04-Apr-2023 02:10 PM,Rejected-Technical,DUE TO L5 BIDDER,03-Feb-2024 01:52 PM,,,,,,,,,,,,,,,,,,,,,,,AOC
,,,,,,,,,,,,,,,,.xls,Bill of Quantity,,,,,,,,,,,,,,,,,,,,,,,,,,,,,,,,,,,,,,,,,,AOC,,,,,,,,,,,,,3,2109896,BALARAM BARIHA,06-Apr-2023 02:40 AM,Rejected-Technical,DUE TO L4 BIDDER,03-Feb-2024 01:52 PM,,,,,,,,,,,,,,,,,,,,,,,AOC
,,,,,,,,,,,,,,,,,,,,,,,,,,,,,,,,,,,,,,,,,,,,,,,,,,,,,,,,,,,AOC,,,,,,,,,,,,,4,2109895,DIBYA KUMAR MAJHI,06-Apr-2023 01:52 AM,Accepted-AOC,QUALIFIED BIDDER,03-Feb-2024 07:42 PM,,,,,,,,,,,,,,,,,,,,,,,AOC
,,,,,,,,,,,,,,,,,,,,,,,,,,,,,,,,,,,,,,,,,,,,,,,,,,,,,,,,,,,AOC,,,,,,,,,,,,,5,2109949,ROHIT KUMAR TRIVEDI,06-Apr-2023 12:37 PM,Rejected-Technical,DUE TO L1 BIDDER BUT NON SEQURING QUALIFING MARKS,03-Feb-2024 01:52 PM,,,,,,,,,,,,,,,,,,,,,,,AOC
