Organisation Chain,Tender Reference Number,Tender ID,Withdrawal Allowed,Tender Type,Form of contract,Tender Category,No. of Covers,General Technical Evaluation Allowed,ItemWise Technical Evaluation Allowed,Payment Mode,Is Multi Currency Allowed For BOQ,Is Multi Currency Allowed For Fee,Allow Two Stage Bidding,Cover No,Cover,Document Type,Description,Publish Date,Bid Opening Date,Document Download / Sale Start Date,Document Download / Sale End Date,Clarification Start Date,Clarification End Date,Bid Submission Start Date,Bid Submission End Date,EMD Amount in ₹,EMD Exemption Allowed,EMD Fee Type,EMD Percentage,EMD Payable To,EMD Payable At,S.No,Bank Name,Tender Fee in ₹,VAT Charges in ₹,Fee Payable To,Fee Payable At,Tender Fee Exemption Allowed,Name,Address,Title,Work Description,Pre Qualification Details,Independent External Monitor/Remarks,Tender Value in ₹,Product Category,Sub category,Contract Type,Bid Validity(Days),Period Of Work(Days),Location,Pincode,Pre Bid Meeting Place,Pre Bid Meeting Address,Pre Bid Meeting Date,Bid Opening Place,Should Allow NDA Tender,Allow Preferential Bidder,Tender Stage,Contract Date :,Contract Value :,Work Completion Period in days :,Updated By :,Updated on :,AOC document :,AOC Description :,S.No,Bid Number,Bidder Name,Awarded Currency,Awarded Value,S.No.1,Bid Number.1,Bidder Name.1,Submitted Date,Status,Remarks,Status Updated On,Type :,Summary :,Updated By :.1,Updated On :,Document :,BOQ Comparative Chart :,Committee Chairperson/Co-ordinator Name :,Committee Chairperson/Co-ordinator Type :,Committee Members :,Updated By :.2,Updated on :.1,Document :.1,Organisation Chain :,Tender ID :,Tender Ref No :,Tender Title :,Committee Chairperson/Co-ordinator Name :.1,Committee Chairperson/Co-ordinator Type :.1,Committee Members :.1,Updated By :.3,Updated On :.1,Document :.2,Tender Stage
Orissa Lift Irrigation Corporation||LI KORAPUT||LI Division Nawarangpur,2892 / 02.11.2023,2023_OLIC_96645_16,Yes,Open Tender,Percentage,Works,1.0,No,No,Online,No,No,No,1.0,Fee/PreQual/Technical/Finance,.pdf,"Valid Civil and Electrical License, PAN, GST, Labour License, Affidavit Joint Venture, Experience",16-Nov-2023 10:00 AM,23-Nov-2023 11:00 AM,16-Nov-2023 10:00 AM,22-Nov-2023 05:00 PM,16-Nov-2023 10:00 AM ,18-Nov-2023 01:00 PM ,16-Nov-2023 10:00 AM,22-Nov-2023 05:00 PM,"23,670",No,percentage,1.0%,Nil,Nil,1.0,ICICI BANK,"6,000",0.0,Nil,Nil,No,"E.E, L.I.Division, Nabarangpur","E.E, L.I.Division, Nabarangpur, Pin 764059",Mendriguda-IV L.I.P,"Installation, electrification and energisation of Mendriguda-IV L.I.P under Dabugam Block of Nabarangpur District",As per DTCN ,NA ,"23,67,000",Civil Works - Lift Irrigation Schemes,Electrical ,Tender,180.0,90.0,"E.E, L.I Division, Nabarangpur",764059.0,NA ,NA ,NA ,"Office of the E.E, L.I.Division,Nabarangpur",No ,No,AOC,08-Feb-2024,"INR 2,514,033",90.0,Dillip Kumar Das,08-Feb-2024 01:21 PM,Mendriguda-IV.pdf (2521.00 KB),Execution of Mendriguda-IV L.I.P,1.0,2327356.0,BADAL PATTNAIK,INR,"2,514,033",1,2327356,BADAL PATTNAIK,22-Nov-2023 08:44 AM,Accepted-AOC,Accepted,14-Feb-2024 07:20 PM,Finance,Opened Successfully,Jayaram Behera,29-Nov-2023 11:07 AM,finance_471955.pdf,BOQ Comparative Chart,"Executive Engineer, L.I.Division, Nabarangpur",Internal,"Executive Engineer, Divisional Accountant, Estimator",Dillip Kumar Das,08-Feb-2024 01:16 PM,finsummary_471955.pdf (161.34 KB),Orissa Lift Irrigation Corporation||LI KORAPUT||LI Division Nawarangpur,2023_OLIC_96645_16,2892 / 02.11.2023,Mendriguda-IV L.I.P,"Executive Engineer, L.I. Division, Nabarangpur",Internal,"Executive Engineer, L.I. Division, Nabarangpur",Dillip Kumar Das,20-Dec-2023 12:19 PM,techsummary_471955.pdf (27.98 KB),AOC
,,,,,,,,,,,,,,,,.pdf,TCN documents,,,,,,,,,,,,,,,2.0,ICICI NEFT/RTGS,,,,,,,,,,,,,,,,,,,,,,,,,,AOC,,,,,,,,,,,,,2,2326575,DAITARI SIA,22-Nov-2023 10:57 AM,Rejected-Finance,Being Badal Pattnaik Accepted The Bid,08-Feb-2024 01:16 PM,,,,,,,,,,,,,,,,,,,,,,,AOC
,,,,,,,,,,,,,,,,.xls,Bill of Quantities,,,,,,,,,,,,,,,,,,,,,,,,,,,,,,,,,,,,,,,,,,AOC,,,,,,,,,,,,,3,2328104,M/S SHREELAXMI ENTERPRISERS,22-Nov-2023 12:55 PM,Rejected-Finance,Being Badal Pattnaik Accepted The Bid,08-Feb-2024 01:16 PM,,,,,,,,,,,,,,,,,,,,,,,AOC
,,,,,,,,,,,,,,,,,,,,,,,,,,,,,,,,,,,,,,,,,,,,,,,,,,,,,,,,,,,AOC,,,,,,,,,,,,,4,2328668,M/S U.S. QUALITY ENGINEERING WORKS,22-Nov-2023 03:54 PM,Rejected-Finance,Being Badal Pattnaik Accepted The Bid,08-Feb-2024 01:16 PM,,,,,,,,,,,,,,,,,,,,,,,AOC
,,,,,,,,,,,,,,,,,,,,,,,,,,,,,,,,,,,,,,,,,,,,,,,,,,,,,,,,,,,AOC,,,,,,,,,,,,,5,2327402,SAMEER PATTNAIK,22-Nov-2023 09:26 AM,Rejected-Finance,Being Badal Pattnaik Accepted The Bid,08-Feb-2024 01:16 PM,,,,,,,,,,,,,,,,,,,,,,,AOC
