Organisation Chain,Tender Reference Number,Tender ID,Withdrawal Allowed,Tender Type,Form of contract,Tender Category,No. of Covers,General Technical Evaluation Allowed,ItemWise Technical Evaluation Allowed,Payment Mode,Is Multi Currency Allowed For BOQ,Is Multi Currency Allowed For Fee,Allow Two Stage Bidding,Cover No,Cover,Document Type,Description,Publish Date,Bid Opening Date,Document Download / Sale Start Date,Document Download / Sale End Date,Clarification Start Date,Clarification End Date,Bid Submission Start Date,Bid Submission End Date,EMD Amount in ₹,EMD Exemption Allowed,EMD Fee Type,EMD Percentage,EMD Payable To,EMD Payable At,S.No,Bank Name,Tender Fee in ₹,VAT Charges in ₹,Fee Payable To,Fee Payable At,Tender Fee Exemption Allowed,Name,Address,Title,Work Description,Pre Qualification Details,Independent External Monitor/Remarks,Tender Value in ₹,Product Category,Sub category,Contract Type,Bid Validity(Days),Period Of Work(Days),Location,Pincode,Pre Bid Meeting Place,Pre Bid Meeting Address,Pre Bid Meeting Date,Bid Opening Place,Should Allow NDA Tender,Allow Preferential Bidder,Tender Stage,Contract Date :,Contract Value :,Work Completion Period in days :,Updated By :,Updated on :,AOC document :,AOC Description :,S.No,Bid Number,Bidder Name,Awarded Currency,Awarded Value,S.No.1,Bid Number.1,Bidder Name.1,Submitted Date,Status,Remarks,Status Updated On,Type :,Summary :,Updated By :.1,Updated On :,Document :,BOQ Comparative Chart :,Committee Chairperson/Co-ordinator Name :,Committee Chairperson/Co-ordinator Type :,Committee Members :,Updated By :.2,Updated on :.1,Document :.1,Organisation Chain :,Tender ID :,Tender Ref No :,Tender Title :,Committee Chairperson/Co-ordinator Name :.1,Committee Chairperson/Co-ordinator Type :.1,Committee Members :.1,Updated By :.3,Updated On :.1,Document :.2,Tender Stage
"CE,Minor Irrigation,BBSR||Baripada Minor Irrigation Circle Baripada||MI Division Balasore",SEMIDBLS-03(6)-2023-24,2024_CEMIB_99711_1,Yes,Open Tender,Percentage,Works,1.0,No,No,Online,No,No,No,1.0,Fee/PreQual/Technical/Finance,.pdf,"Tender Cost, EMD, PAN, GSTIN, Valid RC, Affidavits, NRC if any and other doc as per DTCN",18-Jan-2024 10:00 AM,30-Jan-2024 11:00 AM,18-Jan-2024 10:00 AM,29-Jan-2024 05:00 PM,NA ,NA ,18-Jan-2024 10:00 AM,29-Jan-2024 05:00 PM,"42,300",Yes,fixed,,Nil,Nil,1.0,ICICI BANK,"6,000",0.0,Nil,Nil,No,"Superintending Engineer,M.I Division, Balasore",Office of the Superintending Engineer Minor Irrigation Division Balasore near Fandi Chhaka,Construction of Niankhia Check Dam over Chhatara Nalla near village Chhatara in Soro Block of Balasore District under MATY Scheme for the year 2023-24,Construction of Niankhia Check Dam over Chhatara Nalla near village Chhatara in Soro Block of Balasore District under MATY Scheme for the year 2023-24,Please refer Tender documents ,NA ,,Civil Works - Others,NA ,Tender,90.0,180.0,Soro Block,756045.0,NA ,NA ,NA ,Office of the Superintending Engineer Minor Irrig,No ,No,AOC,17-Feb-2024,"INR 3,594,236",180.0,ELEENA MISHRA,17-Feb-2024 01:20 PM,AOCNiankhia.pdf (201.00 KB),Agreement drawn in favour of Ratikanta Das B (Diploma Engg) Contractor,1.0,2410441.0,RATIKANTA DAS,INR,"3,594,236",1,2408389,ANKITA MOHANTY,29-Jan-2024 10:01 AM,Rejected-Technical,1st lowest tenderer is not winner the transparent lottery,17-Feb-2024 01:14 PM,Finance,"In the presence of Superintending Engineer, Divisional Accounts Officer, Assistant Executive Engineer and Assistant Engineer, the bidders are qualified",ELEENA MISHRA,17-Feb-2024 01:11 PM,finance_484995.pdf,BOQ Comparative Chart,Superintending Engineer,Internal,"Superintending Engineer, Divisional Accounts Officer, Assistant Executive Engineer and Assistant Engineer",ELEENA MISHRA,17-Feb-2024 01:17 PM,finsummary_484995.pdf (197.93 KB),"CE,Minor Irrigation,BBSR||Baripada Minor Irrigation Circle Baripada||MI Division Balasore",2024_CEMIB_99711_1,SEMIDBLS-03(6)-2023-24,Construction of Niankhia Check Dam over Chhatara Nalla near village Chhatara in Soro Block of Balasore District under MATY Scheme for the year 2023-24,Superintending Engineer,Internal,"Superintending Engineer, Divisional Accounts Officer, Assistant Executive Engineer and Assistant Engineer.",ELEENA MISHRA,17-Feb-2024 01:14 PM,techsummary_484995.pdf (197.93 KB),AOC
,,,,,,,,,,,,,,,,.pdf,"Certificates, Formats, Schedules and other documents if any as per DTCN",,,,,,,,,,,,,,,2.0,ICICI NEFT/RTGS,,,,,,,,,,,,,,,,,,,,,,,,,,AOC,,,,,,,,,,,,,2,2408620,MANAS RANJAN SAHOO,28-Jan-2024 10:11 PM,Rejected-Technical,1st lowest tenderer is not winner the transparent lottery,17-Feb-2024 01:14 PM,,,,,,,,,,,,,,,,,,,,,,,AOC
,,,,,,,,,,,,,,,,.xls,Bill of Quantity,,,,,,,,,,,,,,,,,,,,,,,,,,,,,,,,,,,,,,,,,,AOC,,,,,,,,,,,,,3,2405971,MANORAMA PANDA,29-Jan-2024 12:59 AM,Rejected-Technical,1st lowest tenderer is not winner the transparent lottery,17-Feb-2024 01:14 PM,,,,,,,,,,,,,,,,,,,,,,,AOC
,,,,,,,,,,,,,,,,,,,,,,,,,,,,,,,,,,,,,,,,,,,,,,,,,,,,,,,,,,,AOC,,,,,,,,,,,,,4,2410441,RATIKANTA DAS,29-Jan-2024 04:09 PM,Accepted-AOC,Agreement drawn in favour of Ratikanta Das B (Diploma Engg) Contractor,17-Feb-2024 01:20 PM,,,,,,,,,,,,,,,,,,,,,,,AOC
,,,,,,,,,,,,,,,,,,,,,,,,,,,,,,,,,,,,,,,,,,,,,,,,,,,,,,,,,,,AOC,,,,,,,,,,,,,5,2408501,SANTHA SANAT KUMAR ROUT,29-Jan-2024 09:35 AM,Rejected-Technical,1st lowest tenderer is not winner the transparent lottery,17-Feb-2024 01:14 PM,,,,,,,,,,,,,,,,,,,,,,,AOC
