Organisation Chain,Tender Reference Number,Tender ID,Withdrawal Allowed,Tender Type,Form of contract,Tender Category,No. of Covers,General Technical Evaluation Allowed,ItemWise Technical Evaluation Allowed,Payment Mode,Is Multi Currency Allowed For BOQ,Is Multi Currency Allowed For Fee,Allow Two Stage Bidding,Cover No,Cover,Document Type,Description,Publish Date,Bid Opening Date,Document Download / Sale Start Date,Document Download / Sale End Date,Clarification Start Date,Clarification End Date,Bid Submission Start Date,Bid Submission End Date,EMD Amount in ₹,EMD Exemption Allowed,EMD Fee Type,EMD Percentage,EMD Payable To,EMD Payable At,S.No,Corrigendum Title,Corrigendum Type,View,S.No.1,Bank Name,Tender Fee in ₹,VAT Charges in ₹,Fee Payable To,Fee Payable At,Tender Fee Exemption Allowed,Name,Address,Title,Work Description,Pre Qualification Details,Independent External Monitor/Remarks,Tender Value in ₹,Product Category,Sub category,Contract Type,Bid Validity(Days),Period Of Work(Days),Location,Pincode,Pre Bid Meeting Place,Pre Bid Meeting Address,Pre Bid Meeting Date,Bid Opening Place,Should Allow NDA Tender,Allow Preferential Bidder,Tender Stage,Contract Date :,Contract Value :,Work Completion Period in days :,Updated By :,Updated on :,AOC document :,AOC Description :,S.No,Bid Number,Bidder Name,Awarded Currency,Awarded Value,S.No.1,Bid Number.1,Bidder Name.1,Submitted Date,Status,Remarks,Status Updated On,Type :,Summary :,Updated By :.1,Updated On :,Document :,BOQ Comparative Chart :,Committee Chairperson/Co-ordinator Name :,Committee Chairperson/Co-ordinator Type :,Committee Members :,Updated By :.2,Updated on :.1,Document :.1,Organisation Chain :,Tender ID :,Tender Ref No :,Tender Title :,Committee Chairperson/Co-ordinator Name :.1,Committee Chairperson/Co-ordinator Type :.1,Committee Members :.1,Updated By :.3,Updated On :.1,Document :.2,S.No.2,Revocation Title,Revocation Description,Published Date,Document Name,Document Size(in KB),Revocated To,Tender Stage
Orissa Lift Irrigation Corporation||LI Northern Circle Sambalpur||LI Division Dhenkanal,EEOLICSNGH-02/2023-2024,2023_OLIC_96624_42,Yes,Open Tender,Percentage,Works,1.0,No,No,Online,No,No,No,1.0,Fee/PreQual/Technical/Finance,.pdf,"TENDER PAPER COST,LICENSE,GST,PAN AFFIDAVIT,EXPRIENCE CERTIFICATE,MOU WITH ELECTRICAL CONTRACTOR",15-Nov-2023 10:00 AM,30-Nov-2023 11:00 AM,15-Nov-2023 10:00 AM,28-Nov-2023 05:00 PM,15-Nov-2023 10:00 AM ,22-Nov-2023 05:00 PM ,15-Nov-2023 10:15 PM,28-Nov-2023 05:00 PM,"25,640",Yes,percentage,1.0%,Nil,Nil,1.0,CHANGE IN CLASS OF CONTRACTOR LICENSE,Other,,1.0,ICICI BANK,"6,000",0.0,Nil,Nil,No,EXECUTIVE ENGINEER,"O/O THE EXECUTIVE ENGINEER L.I.DIVISION,SUNDARGARH",INSTALLATION AND ENERGISATION OF LIFT IRRIGATION PROJECT AT-TUMLIA-V UNDER SUBDEGA BLOCK,INSTALLATION AND ENERGISATION OF LIFT IRRIGATION PROJECT AT-TUMLIA-V UNDER SUBDEGA BLOCK,Please refer Tender documents. ,NA ,"25,64,048",Civil Works - Lift Irrigation Schemes,NA ,Tender,90.0,90.0,SUNDARGARH,770001.0,NA ,NA ,NA ,"O/O THE EXECUTIVE ENGINEER L.I.DIVISION,SUNDARGARH",No ,No,AOC,12-Feb-2024,"INR 2,572,043",90.0,Girish Chandra Behera,12-Feb-2024 01:14 PM,tumlia5.pdf (1036.00 KB),Contract Awarded to M/s Mogal Chandra Pradhan,1.0,2333108.0,MOGALCHANDRAPRADHAN,INR,"2,572,043",1,2334445,BIBHUTI BHUSAN NAIK,26-Nov-2023 07:16 PM,Rejected-Finance,REJECT,08-Feb-2024 12:12 PM,Finance,TENDER TO BE OPEN,SILARANI NAYAK,30-Dec-2023 04:13 PM,,BOQ Comparative Chart,Executive Engineer,Internal,E.E/ESTR/D.A,Girish Chandra Behera,08-Feb-2024 12:12 PM,finsummary_471949.pdf (516.63 KB),Orissa Lift Irrigation Corporation||LI Northern Circle Sambalpur||LI Division Dhenkanal,2023_OLIC_96624_42,EEOLICSNGH-02/2023-2024,INSTALLATION AND ENERGISATION OF LIFT IRRIGATION PROJECT AT-TUMLIA-V UNDER SUBDEGA BLOCK,EXECUTIVE ENGINEER,Internal,E.E/ESTR/D.A,Girish Chandra Behera,02-Jan-2024 05:28 PM,techsummary_471949.pdf (504.54 KB),1.0,ERROR IN OPENING,ERROR IN OPENING,30-Dec-2023 12:03 PM,TENDERCOMMITTE75.pdf ,499.73,Technical Opening,AOC
,,,,,,,,,,,,,,,,.pdf,"NO RELATION CERTIFICATE,AND OTHER DOCUMENTS AS PER DTCN",,,,,,,,,,,,,,,,,,,2.0,ICICI NEFT/RTGS,,,,,,,,,,,,,,,,,,,,,,,,,,AOC,,,,,,,,,,,,,2,2333817,GOMATI TANTY,27-Nov-2023 09:43 PM,Rejected-Technical,DOCUMENT NOT DEPOSITED AS PER DTCN,02-Jan-2024 05:28 PM,,,,,,,,,,,,,,,,,,,,,,,,,,,,,,AOC
,,,,,,,,,,,,,,,,.xls,BOQ,,,,,,,,,,,,,,,,,,,,,,,,,,,,,,,,,,,,,,,,,,,,,,AOC,,,,,,,,,,,,,3,2330604,JUPITER ENGINEERS,24-Nov-2023 02:18 PM,Rejected-Technical,EXPERIENCE CERTIFICATE NOT SATISFACTORY,02-Jan-2024 05:28 PM,,,,,,,,,,,,,,,,,,,,,,,,,,,,,,AOC
,,,,,,,,,,,,,,,,,,,,,,,,,,,,,,,,,,,,,,,,,,,,,,,,,,,,,,,,,,,,,,,AOC,,,,,,,,,,,,,4,2332240,MANOJ KUMAR NAIK,28-Nov-2023 12:30 PM,Rejected-Finance,REJECT,08-Feb-2024 12:12 PM,,,,,,,,,,,,,,,,,,,,,,,,,,,,,,AOC
,,,,,,,,,,,,,,,,,,,,,,,,,,,,,,,,,,,,,,,,,,,,,,,,,,,,,,,,,,,,,,,AOC,,,,,,,,,,,,,5,2333108,MOGALCHANDRAPRADHAN,25-Nov-2023 01:43 PM,Accepted-AOC,Accept,14-Feb-2024 07:20 PM,,,,,,,,,,,,,,,,,,,,,,,,,,,,,,AOC
,,,,,,,,,,,,,,,,,,,,,,,,,,,,,,,,,,,,,,,,,,,,,,,,,,,,,,,,,,,,,,,AOC,,,,,,,,,,,,,6,2327042,SAROJ KUMAR TOPPO,21-Nov-2023 10:29 PM,Rejected-Technical,INVALID MSME REGISTRATION CERTIFICATE,02-Jan-2024 05:28 PM,,,,,,,,,,,,,,,,,,,,,,,,,,,,,,AOC
