Organisation Chain,Tender Reference Number,Tender ID,Withdrawal Allowed,Tender Type,Form of contract,Tender Category,No. of Covers,General Technical Evaluation Allowed,ItemWise Technical Evaluation Allowed,Payment Mode,Is Multi Currency Allowed For BOQ,Is Multi Currency Allowed For Fee,Allow Two Stage Bidding,Cover No,Cover,Document Type,Description,Publish Date,Bid Opening Date,Document Download / Sale Start Date,Document Download / Sale End Date,Clarification Start Date,Clarification End Date,Bid Submission Start Date,Bid Submission End Date,EMD Amount in ₹,EMD Exemption Allowed,EMD Fee Type,EMD Percentage,EMD Payable To,EMD Payable At,S.No,Corrigendum Title,Corrigendum Type,View,S.No.1,Bank Name,Tender Fee in ₹,VAT Charges in ₹,Fee Payable To,Fee Payable At,Tender Fee Exemption Allowed,Name,Address,Title,Work Description,Pre Qualification Details,Independent External Monitor/Remarks,Tender Value in ₹,Product Category,Sub category,Contract Type,Bid Validity(Days),Period Of Work(Days),Location,Pincode,Pre Bid Meeting Place,Pre Bid Meeting Address,Pre Bid Meeting Date,Bid Opening Place,Should Allow NDA Tender,Allow Preferential Bidder,Tender Stage,Contract Date :,Contract Value :,Work Completion Period in days :,Updated By :,Updated on :,AOC document :,AOC Description :,S.No,Bid Number,Bidder Name,Awarded Currency,Awarded Value,S.No.1,Bid Number.1,Bidder Name.1,Submitted Date,Status,Remarks,Status Updated On,Type :,Summary :,Updated By :.1,Updated On :,Document :,BOQ Comparative Chart :,Committee Chairperson/Co-ordinator Name :,Committee Chairperson/Co-ordinator Type :,Committee Members :,Updated By :.2,Updated on :.1,Document :.1,Organisation Chain :,Tender ID :,Tender Ref No :,Tender Title :,Committee Chairperson/Co-ordinator Name :.1,Committee Chairperson/Co-ordinator Type :.1,Committee Members :.1,Updated By :.3,Updated On :.1,Document :.2,Tender Stage
"Orissa Lift Irrigation Corporation||LI,Central Circle, Cuttack||LI,Division, Bhubaneswar",BID NO-3500/2023-24 DT.13.11.2023,2023_OLIC_97619_18,Yes,Open Tender,Percentage,Works,1.0,No,No,Online,No,No,No,1.0,Fee/PreQual/Technical/Finance,.pdf,"PAPER COST, EMD AND ALL OTHER DOCUMENT AS PER DTCN",29-Nov-2023 04:00 PM,06-Dec-2023 11:00 AM,29-Nov-2023 04:00 PM,05-Dec-2023 05:00 PM,29-Nov-2023 04:00 PM ,04-Dec-2023 05:00 PM ,29-Nov-2023 04:00 PM,05-Dec-2023 05:00 PM,"24,135",Yes,percentage,1.0%,Nil,Nil,1.0,Extension of date,Date,,1.0,ICICI BANK,"6,000",0.0,Nil,Nil,No,EE LI DIVISION BHUBANESWAR,EE LI DIVISION BHUBANESWAR,INSTALLATION AND ENERGISATION OF GUALIPARI-II LIP IN SATYABADI BLOCK OF PURI DISTRICT UNDER BKVY XXIX 2023-24,INSTALLATION AND ENERGISATION OF GUALIPARI-II LIP IN SATYABADI BLOCK OF PURI DISTRICT UNDER BKVY XXIX 2023-24,Please refer tender documents ,NA ,"24,13,515",Civil Works - Lift Irrigation Schemes,NA ,Tender,90.0,90.0,SATYABADI,752001.0,NA ,NA ,NA ,EE L I DIVISION BHUBANESWAR,No ,No,AOC,27-Feb-2024,"INR 2,232,502",90.0,SUJIT KUMAR MOHANTY,27-Feb-2024 11:38 AM,Gautam-3500-18.pdf (1523.00 KB),Work order and agreement Completed,1.0,2343427.0,GAUTAM BEHERA,INR,"2,232,502",1,2342952,AGRAWALLA POWER INFRASTRUCTURE,04-Dec-2023 10:43 AM,Rejected-Technical,Rejected,27-Feb-2024 11:35 AM,Finance,TENDER OPENED,SUJIT KUMAR MOHANTY,06-Dec-2023 12:53 PM,finance_476732.pdf,BOQ Comparative Chart,Sujit Kumar Mohanty,Internal,"EE,ESTR,DA",SUJIT KUMAR MOHANTY,27-Feb-2024 11:37 AM,finsummary_476732.pdf (1522.97 KB),"Orissa Lift Irrigation Corporation||LI,Central Circle, Cuttack||LI,Division, Bhubaneswar",2023_OLIC_97619_18,BID NO-3500/2023-24 DT.13.11.2023,INSTALLATION AND ENERGISATION OF GUALIPARI-II LIP IN SATYABADI BLOCK OF PURI DISTRICT UNDER BKVY XXIX 2023-24,Sujit Kumar Mohanty,Internal,"EE,ETSR,DA",SUJIT KUMAR MOHANTY,27-Feb-2024 11:35 AM,techsummary_476732.pdf (1522.97 KB),AOC
,,,,,,,,,,,,,,,,.xls,BOQ,,,,,,,,,,,,,,,,,,,2.0,ICICI NEFT/RTGS,,,,,,,,,,,,,,,,,,,,,,,,,,AOC,,,,,,,,,,,,,2,2343427,GAUTAM BEHERA,04-Dec-2023 02:17 PM,Accepted-AOC,Work order and agreement Completed,27-Feb-2024 11:38 AM,,,,,,,,,,,,,,,,,,,,,,,AOC
,,,,,,,,,,,,,,,,,,,,,,,,,,,,,,,,,,,,,,,,,,,,,,,,,,,,,,,,,,,,,,,AOC,,,,,,,,,,,,,3,2341666,GITANJALI SARANGI PROPRIETOR- GITANJALI ENTERPRISES,01-Dec-2023 11:57 PM,Rejected-Technical,Rejected,27-Feb-2024 11:35 AM,,,,,,,,,,,,,,,,,,,,,,,AOC
,,,,,,,,,,,,,,,,,,,,,,,,,,,,,,,,,,,,,,,,,,,,,,,,,,,,,,,,,,,,,,,AOC,,,,,,,,,,,,,4,2342245,MODERN WINDING AND ELECTRICALS,02-Dec-2023 05:34 PM,Rejected-Technical,Rejected,27-Feb-2024 11:35 AM,,,,,,,,,,,,,,,,,,,,,,,AOC
,,,,,,,,,,,,,,,,,,,,,,,,,,,,,,,,,,,,,,,,,,,,,,,,,,,,,,,,,,,,,,,AOC,,,,,,,,,,,,,5,2343493,M/S. BALIYARSINGH ELECTRICAL ENGINEERING & CONSTRUCTION,04-Dec-2023 02:20 PM,Rejected-Technical,Rejected,27-Feb-2024 11:35 AM,,,,,,,,,,,,,,,,,,,,,,,AOC
,,,,,,,,,,,,,,,,,,,,,,,,,,,,,,,,,,,,,,,,,,,,,,,,,,,,,,,,,,,,,,,AOC,,,,,,,,,,,,,6,2342510,M/S. M.C.C. ASSOCIATES,03-Dec-2023 02:24 PM,Rejected-Technical,Rejected,27-Feb-2024 11:35 AM,,,,,,,,,,,,,,,,,,,,,,,AOC
,,,,,,,,,,,,,,,,,,,,,,,,,,,,,,,,,,,,,,,,,,,,,,,,,,,,,,,,,,,,,,,AOC,,,,,,,,,,,,,7,2342776,PRAMOD PRADHAN,03-Dec-2023 08:52 PM,Rejected-Technical,Rejected,27-Feb-2024 11:35 AM,,,,,,,,,,,,,,,,,,,,,,,AOC
