Organisation Chain,Tender Reference Number,Tender ID,Withdrawal Allowed,Tender Type,Form of contract,Tender Category,No. of Covers,General Technical Evaluation Allowed,ItemWise Technical Evaluation Allowed,Payment Mode,Is Multi Currency Allowed For BOQ,Is Multi Currency Allowed For Fee,Allow Two Stage Bidding,Cover No,Cover,Document Type,Description,Publish Date,Bid Opening Date,Document Download / Sale Start Date,Document Download / Sale End Date,Clarification Start Date,Clarification End Date,Bid Submission Start Date,Bid Submission End Date,EMD Amount in ₹,EMD Exemption Allowed,EMD Fee Type,EMD Percentage,EMD Payable To,EMD Payable At,S.No,Bank Name,Tender Fee in ₹,VAT Charges in ₹,Fee Payable To,Fee Payable At,Tender Fee Exemption Allowed,Name,Address,Title,Work Description,Pre Qualification Details,Independent External Monitor/Remarks,Tender Value in ₹,Product Category,Sub category,Contract Type,Bid Validity(Days),Period Of Work(Days),Location,Pincode,Pre Bid Meeting Place,Pre Bid Meeting Address,Pre Bid Meeting Date,Bid Opening Place,Should Allow NDA Tender,Allow Preferential Bidder,Tender Stage,Contract Date :,Contract Value :,Work Completion Period in days :,Updated By :,Updated on :,AOC document :,AOC Description :,S.No,Bid Number,Bidder Name,Awarded Currency,Awarded Value,S.No.1,Bid Number.1,Bidder Name.1,Submitted Date,Status,Remarks,Status Updated On,Type :,Summary :,Updated By :.1,Updated On :,Document :,BOQ Comparative Chart :,Committee Chairperson/Co-ordinator Name :,Committee Chairperson/Co-ordinator Type :,Committee Members :,Updated By :.2,Updated on :.1,Document :.1,Organisation Chain :,Tender ID :,Tender Ref No :,Tender Title :,Committee Chairperson/Co-ordinator Name :.1,Committee Chairperson/Co-ordinator Type :.1,Committee Members :.1,Updated By :.3,Updated On :.1,Document :.2,Tender Stage
CE RW I||RWCIRCLE-BERHAMPUR||RWDIVISION-BOUDH,Online Tender13/EERW Boudh/2023-24,2024_CERWI_99800_18,Yes,National Competitive Bid,Percentage,Works,1.0,No,No,Online,No,No,No,1.0,Fee/PreQual/Technical/Finance,.pdf,"Registration certificate,PAN,GSTIN towards paper cost EMD and affidavit other documents as per DTCN",18-Jan-2024 02:00 PM,25-Jan-2024 11:00 AM,18-Jan-2024 02:00 PM,24-Jan-2024 05:00 PM,18-Jan-2024 02:00 PM ,22-Jan-2024 05:00 PM ,18-Jan-2024 02:00 PM,24-Jan-2024 05:00 PM,"5,100",Yes,fixed,,Nil,Nil,1.0,ICICI BANK,"4,000",0.0,Nil,Nil,No,Executive Engineer,O/o SERW Division Boudh,S/R to Barapadar- Khamanmunda via Deuli road for the year 2023-24,S/R to Barapadar- Khamanmunda via Deuli road for the year 2023-24,Please refer DTCN ,NA ,"5,04,155",Civil Works - Roads,NA ,Tender,90.0,30.0,O/o SERW Division Boudh,762014.0,NA ,NA ,NA ,O/o SERW Division Boudh,No ,No,AOC,16-Feb-2024,"INR 428,582",30.0,Sudhakar Naik,16-Feb-2024 04:16 PM,625.pdf (653.00 KB),He is submitted EMD at the time of agreement,1.0,2402490.0,SANJEEB KUMAR SAHU,INR,"428,582",1.0,2402490.0,SANJEEB KUMAR SAHU,23-Jan-2024 12:54 PM,Accepted-AOC,He is submitted EMD at the time of agreement,16-Feb-2024 04:16 PM,Finance,Sanjeeb Ku Sahu qualified the lottary,Sudhakar Naik,16-Feb-2024 04:11 PM,finance_485416.pdf,BOQ Comparative Chart,EE,Internal,EE DAO estimator,Sudhakar Naik,16-Feb-2024 04:14 PM,finsummary_485416.pdf (652.97 KB),CE RW I||RWCIRCLE-BERHAMPUR||RWDIVISION-BOUDH,2024_CERWI_99800_18,Online Tender13/EERW Boudh/2023-24,S/R to Barapadar- Khamanmunda via Deuli road for the year 2023-24,EE,Internal,EE DAO estimator,Sudhakar Naik,16-Feb-2024 04:12 PM,techsummary_485416.pdf (652.97 KB),AOC
,,,,,,,,,,,,,,,,.pdf,NIT,,,,,,,,,,,,,,,2.0,ICICI NEFT/RTGS,,,,,,,,,,,,,,,,,,,,,,,,,,AOC,,,,,,,,,,,,,2.0,2403352.0,SASMITARANI GEJO,24-Jan-2024 12:46 PM,Rejected-Technical,Sanjeeb Ku Sahu qualified the lottary,16-Feb-2024 04:12 PM,,,,,,,,,,,,,,,,,,,,,,,AOC
,,,,,,,,,,,,,,,,.pdf,DTCN,,,,,,,,,,,,,,,,,,,,,,,,,,,,,,,,,,,,,,,,,,AOC,,,,,,,,,,,,,,,,,,,,,,,,,,,,,,,,,,,,,,,,,,AOC
,,,,,,,,,,,,,,,,.pdf,Valid phone number and e mail ID are mandatory,,,,,,,,,,,,,,,,,,,,,,,,,,,,,,,,,,,,,,,,,,AOC,,,,,,,,,,,,,,,,,,,,,,,,,,,,,,,,,,,,,,,,,,AOC
,,,,,,,,,,,,,,,,.xls,BOQ,,,,,,,,,,,,,,,,,,,,,,,,,,,,,,,,,,,,,,,,,,AOC,,,,,,,,,,,,,,,,,,,,,,,,,,,,,,,,,,,,,,,,,,AOC
