Organisation Chain,Tender Reference Number,Tender ID,Withdrawal Allowed,Tender Type,Form of contract,Tender Category,No. of Covers,General Technical Evaluation Allowed,ItemWise Technical Evaluation Allowed,Payment Mode,Is Multi Currency Allowed For BOQ,Is Multi Currency Allowed For Fee,Allow Two Stage Bidding,Cover No,Cover,Document Type,Description,Publish Date,Bid Opening Date,Document Download / Sale Start Date,Document Download / Sale End Date,Clarification Start Date,Clarification End Date,Bid Submission Start Date,Bid Submission End Date,Financial Bid Opening Date,EMD Amount in ₹,EMD Exemption Allowed,EMD Fee Type,EMD Percentage,EMD Payable To,EMD Payable At,S.No,Corrigendum Title,Corrigendum Type,View,S.No.1,Bank Name,Tender Fee in ₹,VAT Charges in ₹,Fee Payable To,Fee Payable At,Tender Fee Exemption Allowed,Name,Address,Title,Work Description,Pre Qualification Details,Independent External Monitor/Remarks,Tender Value in ₹,Product Category,Sub category,Contract Type,Bid Validity(Days),Period Of Work(Days),Location,Pincode,Pre Bid Meeting Place,Pre Bid Meeting Address,Pre Bid Meeting Date,Bid Opening Place,Should Allow NDA Tender,Allow Preferential Bidder,Tender Stage,Contract Date :,Contract Value :,Work Completion Period in days :,Updated By :,Updated on :,AOC document :,S.No,Bid Number,Bidder Name,Awarded Currency,Awarded Value,S.No.1,Bid Number.1,Bidder Name.1,Submitted Date,Status,Remarks,Status Updated On,Type :,Summary :,Updated By :.1,Updated On :,Document :,BOQ Comparative Chart :,Committee Chairperson/Co-ordinator Name :,Committee Chairperson/Co-ordinator Type :,Committee Members :,Updated By :.2,Updated on :.1,Document :.1,Organisation Chain :,Tender ID :,Tender Ref No :,Tender Title :,Type :.1,Summary :.1,Updated By :.3,Updated On :.1,Document :.2,Committee Chairperson/Co-ordinator Name :.1,Committee Chairperson/Co-ordinator Type :.1,Committee Members :.1,Updated By :.4,Updated On :.2,Financial Bid Opening Date:,Document :.3,Tender Stage
Orissa Lift Irrigation Corporation||LI BALASORE||LI Division Karanjia,BID ID NO.20 EELID (KJA/2023-24) DATE. 01.11.2023,2023_OLIC_96854_21,Yes,National Competitive Bid,Percentage,Works,2.0,No,No,Online,No,No,No,1.0,Fee/PreQual/Technical,.pdf,Tender Paper cost EMD GST Challan PAN GST HT Civil Licence Affidavit JV Experience as per DTCN,14-Nov-2023 11:00 AM,30-Nov-2023 11:00 AM,14-Nov-2023 11:00 AM,29-Nov-2023 05:00 PM,14-Nov-2023 11:00 AM ,24-Nov-2023 05:00 PM ,14-Nov-2023 11:00 AM,29-Nov-2023 05:00 PM,18-Dec-2023 11:00 AM,"29,708",Yes,percentage,1.0%,Nil,Nil,1.0,Corrigendum,Other,,1.0,ICICI BANK,"6,000",0.0,Nil,Nil,No,"EE, LI Division Karanjia","EE, LI Division Karanjia Near BSNL Office Ankura Karanjia 757037",Installation and Energisation of Laxmiposi III LIP under Jamda Block in Mayurbhanj District,Installation and Energisation of Laxmiposi III LIP under Jamda Block in Mayurbhanj District,Please refer Tender documents. ,NA ,"29,70,775",Civil Works - Lift Irrigation Schemes,NA ,Tender,365.0,90.0,Karanjia,757037.0,NA ,NA ,NA ,"EE, LI Division Karanjia",No ,No,AOC,05-Feb-2024,"INR 2,970,775",90.0,BIKRAMADITYA PANIGRAHY,05-Feb-2024 07:57 PM,PKG_21_Laxmiposi_III.pdf (401.00 KB),1.0,2334089.0,SASMITA RAM,INR,"2,980,038",1,2333959,BALARAM SENAPATI,26-Nov-2023 11:10 AM,Rejected-AOC,DUE TO NOT QUALIFY TO AOC,07-Feb-2024 06:45 PM,Finance,Accepted,BIKRAMADITYA PANIGRAHY,01-Feb-2024 09:15 AM,finance_473115.pdf,BOQ Comparative Chart,BIKRAMADITYA PANIGRAHY,Internal,,BIKRAMADITYA PANIGRAHY,05-Feb-2024 07:05 PM,finsummary_473115.pdf (2327.72 KB),Orissa Lift Irrigation Corporation||LI BALASORE||LI Division Karanjia,2023_OLIC_96854_21,BID ID NO.20 EELID (KJA/2023-24) DATE. 01.11.2023,Installation and Energisation of Laxmiposi III LIP under Jamda Block in Mayurbhanj District,Technical,Accepted,BIKRAMADITYA PANIGRAHY,16-Dec-2023 06:29 PM,technical_473115.pdf,Bikramaditya Panigrahy,Internal,,BIKRAMADITYA PANIGRAHY,16-Dec-2023 07:22 PM,18-Dec-2023 11:00 AM,techsummary_473115.pdf (8546.78 KB),AOC
,,,,,,,,,,,,,,2.0,Finance,.xls,BOQ,,,,,,,,,,,,,,,,,,,,2.0,ICICI NEFT/RTGS,,,,,,,,,,,,,,,,,,,,,,,,,,AOC,,,,,,,,,,,,2,2338799,GIRIDHARI JENA,29-Nov-2023 01:18 PM,Rejected-AOC,DUE TO NOT QUALIFY TO AOC,07-Feb-2024 06:45 PM,,,,,,,,,,,,,,,,,,,,,,,,,,,,,AOC
,,,,,,,,,,,,,,,,,,,,,,,,,,,,,,,,,,,,,,,,,,,,,,,,,,,,,,,,,,,,,,,,AOC,,,,,,,,,,,,3,2338971,M/s Maa Subarnmukhi Engineering,29-Nov-2023 02:20 PM,Rejected-AOC,DUE TO NOT QUALIFY TO AOC,07-Feb-2024 06:45 PM,,,,,,,,,,,,,,,,,,,,,,,,,,,,,AOC
,,,,,,,,,,,,,,,,,,,,,,,,,,,,,,,,,,,,,,,,,,,,,,,,,,,,,,,,,,,,,,,,AOC,,,,,,,,,,,,4,2336082,ODISHA ELECTRICAL AND CONSTRUCTIONS.,27-Nov-2023 11:07 PM,Rejected-AOC,DUE TO NOT QUALIFY TO AOC,07-Feb-2024 06:45 PM,,,,,,,,,,,,,,,,,,,,,,,,,,,,,AOC
,,,,,,,,,,,,,,,,,,,,,,,,,,,,,,,,,,,,,,,,,,,,,,,,,,,,,,,,,,,,,,,,AOC,,,,,,,,,,,,5,2335869,SAGARIKA GIRI,27-Nov-2023 07:28 PM,Rejected-AOC,DUE TO NOT QUALIFY TO AOC,07-Feb-2024 06:45 PM,,,,,,,,,,,,,,,,,,,,,,,,,,,,,AOC
,,,,,,,,,,,,,,,,,,,,,,,,,,,,,,,,,,,,,,,,,,,,,,,,,,,,,,,,,,,,,,,,AOC,,,,,,,,,,,,6,2334089,SASMITA RAM,29-Nov-2023 09:16 AM,Accepted-AOC,DUE TO QUALIFY TO AOC,07-Feb-2024 06:45 PM,,,,,,,,,,,,,,,,,,,,,,,,,,,,,AOC
,,,,,,,,,,,,,,,,,,,,,,,,,,,,,,,,,,,,,,,,,,,,,,,,,,,,,,,,,,,,,,,,AOC,,,,,,,,,,,,7,2339075,SATYAJIT BEHERA,29-Nov-2023 04:08 PM,Rejected-Finance,DUE TO L2,05-Feb-2024 07:05 PM,,,,,,,,,,,,,,,,,,,,,,,,,,,,,AOC
