Organisation Chain,Tender Reference Number,Tender ID,Withdrawal Allowed,Tender Type,Form of contract,Tender Category,No. of Covers,General Technical Evaluation Allowed,ItemWise Technical Evaluation Allowed,Payment Mode,Is Multi Currency Allowed For BOQ,Is Multi Currency Allowed For Fee,Allow Two Stage Bidding,Cover No,Cover,Document Type,Description,Publish Date,Bid Opening Date,Document Download / Sale Start Date,Document Download / Sale End Date,Clarification Start Date,Clarification End Date,Bid Submission Start Date,Bid Submission End Date,EMD Amount in ₹,EMD Exemption Allowed,EMD Fee Type,EMD Percentage,EMD Payable To,EMD Payable At,S.No,Bank Name,Tender Fee in ₹,VAT Charges in ₹,Fee Payable To,Fee Payable At,Tender Fee Exemption Allowed,Name,Address,Title,Work Description,Pre Qualification Details,Independent External Monitor/Remarks,Tender Value in ₹,Product Category,Sub category,Contract Type,Bid Validity(Days),Period Of Work(Days),Location,Pincode,Pre Bid Meeting Place,Pre Bid Meeting Address,Pre Bid Meeting Date,Bid Opening Place,Should Allow NDA Tender,Allow Preferential Bidder,Tender Stage,Contract Date :,Contract Value :,Work Completion Period in days :,Updated By :,Updated on :,AOC document :,AOC Description :,S.No,Bid Number,Bidder Name,Awarded Currency,Awarded Value,S.No.1,Bid Number.1,Bidder Name.1,Submitted Date,Status,Remarks,Status Updated On,Type :,Summary :,Updated By :.1,Updated On :,Document :,BOQ Comparative Chart :,Committee Chairperson/Co-ordinator Name :,Committee Chairperson/Co-ordinator Type :,Committee Members :,Updated By :.2,Updated on :.1,Document :.1,Organisation Chain :,Tender ID :,Tender Ref No :,Tender Title :,Committee Chairperson/Co-ordinator Name :.1,Committee Chairperson/Co-ordinator Type :.1,Committee Members :.1,Updated By :.3,Updated On :.1,Document :.2,Tender Stage
Orissa Lift Irrigation Corporation||LI Western Circle Bhawanipatna||LI Division Bhawanipatna,OLIC-BPT-03/2023-24 Dt.04.11.2023,2023_OLIC_96604_73,Yes,National Competitive Bid,Percentage,Works,1.0,No,No,Online,No,No,No,1.0,Fee/PreQual/Technical/Finance,.pdf,"Tender paper Cost,EMD,GST Challan,GSTIN,PAN, Affidavit,Civil and HT License, Joint Venture Agreement",10-Nov-2023 11:00 AM,24-Nov-2023 11:00 AM,10-Nov-2023 11:00 AM,23-Nov-2023 05:00 PM,10-Nov-2023 11:00 AM ,20-Nov-2023 05:00 PM ,10-Nov-2023 11:00 AM,23-Nov-2023 05:00 PM,"32,837",Yes,fixed,,Nil,Nil,1.0,ICICI BANK,"6,000",0.0,Nil,Nil,No,"Executive Engineer L.I.Division, Bhawanipatna",At - Infront of GOVT. ITI Po - Bhawanipatna,INSTALLATION AND ENERGISATION OF MADHUPUR-IV L.I. PROJECT UNDER LANJIGARH BLOCK IN KALAHANDI DISTRICT,INSTALLATION AND ENERGISATION OF MADHUPUR-IV L.I. PROJECT UNDER LANJIGARH BLOCK IN KALAHANDI DISTRICT,Please refer to Tender Documents ,NA ,"32,83,726",Civil Works - Lift Irrigation Schemes,NA ,Tender,90.0,90.0,LANJIGARH,766027.0,NA ,NA ,NA ,"O/O The Executive Engineer L.I.Division, Bhawanipa",No ,No,AOC,13-Feb-2024,"INR 2,791,496",90.0,BENU CHARAN BEHERA,26-Feb-2024 08:19 PM,AOCBID03.pdf (2253.00 KB),Award of Contract,1.0,2326711.0,Sanjaya Kumar Padhi,INR,"2,791,496",1,2330196,JANAKI PUJHARI,23-Nov-2023 03:25 PM,Rejected-Technical,Rejected due to Joint Venture Document not tally to original,23-Jan-2024 06:12 PM,Finance,Bid Opening summary uploaded as per bidding. The L1 bidder will be accepted after Technical evaluation,BENU CHARAN BEHERA,29-Dec-2023 05:57 PM,finance_472023.pdf,BOQ Comparative Chart,BenuCharanBehera,Internal,BenuCharanBehera KrushnaChandraSahu SudhirKumarBagh HimanshuSekharHarichandan,BENU CHARAN BEHERA,12-Feb-2024 07:32 PM,finsummary_472023.pdf (2166.15 KB),Orissa Lift Irrigation Corporation||LI Western Circle Bhawanipatna||LI Division Bhawanipatna,2023_OLIC_96604_73,OLIC-BPT-03/2023-24 Dt.04.11.2023,INSTALLATION AND ENERGISATION OF MADHUPUR-IV L.I. PROJECT UNDER LANJIGARH BLOCK IN KALAHANDI DISTRICT,BenuCharanBehera,Internal,BenuCharanBehera KrushnaChandraSahu SudhirKumarBagh HimanshuSekharHarichandan,BENU CHARAN BEHERA,23-Jan-2024 06:12 PM,techsummary_472023.pdf (3529.31 KB),AOC
,,,,,,,,,,,,,,,,.pdf,DTCN,,,,,,,,,,,,,,,2.0,ICICI NEFT/RTGS,,,,,,,,,,,,,,,,,,,,,,,,,,AOC,,,,,,,,,,,,,2,2329577,MANOJ KUMAR SAHU,23-Nov-2023 09:50 AM,Rejected-Finance,L3 not Selected,12-Feb-2024 07:32 PM,,,,,,,,,,,,,,,,,,,,,,,AOC
,,,,,,,,,,,,,,,,.xls,Bill of Quantities,,,,,,,,,,,,,,,,,,,,,,,,,,,,,,,,,,,,,,,,,,AOC,,,,,,,,,,,,,3,2324716,M/S ADARSH AGENCY (PROP. ADARSH PRATAP SINGH),21-Nov-2023 05:03 PM,Rejected-Finance,L3 not Selected,12-Feb-2024 07:32 PM,,,,,,,,,,,,,,,,,,,,,,,AOC
,,,,,,,,,,,,,,,,,,,,,,,,,,,,,,,,,,,,,,,,,,,,,,,,,,,,,,,,,,,AOC,,,,,,,,,,,,,4,2322392,"M/S SHIVANI INFRASTRUCTURE AND SUPPLIERS, PROP. YASH AGRAWAL",23-Nov-2023 01:16 PM,Rejected-AOC,L2 not Selected,26-Feb-2024 08:20 PM,,,,,,,,,,,,,,,,,,,,,,,AOC
,,,,,,,,,,,,,,,,,,,,,,,,,,,,,,,,,,,,,,,,,,,,,,,,,,,,,,,,,,,AOC,,,,,,,,,,,,,5,2326711,Sanjaya Kumar Padhi,23-Nov-2023 03:42 AM,Accepted-AOC,L1 and Accepted,26-Feb-2024 08:20 PM,,,,,,,,,,,,,,,,,,,,,,,AOC
