Organisation Chain,Tender Reference Number,Tender ID,Withdrawal Allowed,Tender Type,Form of contract,Tender Category,No. of Covers,General Technical Evaluation Allowed,ItemWise Technical Evaluation Allowed,Payment Mode,Is Multi Currency Allowed For BOQ,Is Multi Currency Allowed For Fee,Allow Two Stage Bidding,Cover No,Cover,Document Type,Description,Publish Date,Bid Opening Date,Document Download / Sale Start Date,Document Download / Sale End Date,Clarification Start Date,Clarification End Date,Bid Submission Start Date,Bid Submission End Date,EMD Amount in ₹,EMD Exemption Allowed,EMD Fee Type,EMD Percentage,EMD Payable To,EMD Payable At,S.No,Bank Name,Tender Fee in ₹,VAT Charges in ₹,Fee Payable To,Fee Payable At,Tender Fee Exemption Allowed,Name,Address,Title,Work Description,Pre Qualification Details,Independent External Monitor/Remarks,Tender Value in ₹,Product Category,Sub category,Contract Type,Bid Validity(Days),Period Of Work(Days),Location,Pincode,Pre Bid Meeting Place,Pre Bid Meeting Address,Pre Bid Meeting Date,Bid Opening Place,Should Allow NDA Tender,Allow Preferential Bidder,Tender Stage,Contract Date :,Contract Value :,Work Completion Period in days :,Updated By :,Updated on :,AOC document :,AOC Description :,S.No,Bid Number,Bidder Name,Awarded Currency,Awarded Value,S.No.1,Bid Number.1,Bidder Name.1,Submitted Date,Status,Remarks,Status Updated On,Type :,Summary :,Updated By :.1,Updated On :,Document :,BOQ Comparative Chart :,Committee Chairperson/Co-ordinator Name :,Committee Chairperson/Co-ordinator Type :,Committee Members :,Updated By :.2,Updated on :.1,Document :.1,Organisation Chain :,Tender ID :,Tender Ref No :,Tender Title :,Committee Chairperson/Co-ordinator Name :.1,Committee Chairperson/Co-ordinator Type :.1,Committee Members :.1,Updated By :.3,Updated On :.1,Document :.2,Tender Stage
Orissa Lift Irrigation Corporation||LI KORAPUT||LI Division Nawarangpur,2892 / 02.11.2023,2023_OLIC_96645_10,Yes,Open Tender,Percentage,Works,1.0,No,No,Online,No,No,No,1.0,Fee/PreQual/Technical/Finance,.pdf,"Valid Civil and Electrical License, PAN, GST, Labour License, Affidavit Joint Venture, Experience",16-Nov-2023 10:00 AM,23-Nov-2023 11:00 AM,16-Nov-2023 10:00 AM,22-Nov-2023 05:00 PM,16-Nov-2023 10:00 AM ,18-Nov-2023 01:00 PM ,16-Nov-2023 10:00 AM,22-Nov-2023 05:00 PM,"24,060",No,percentage,1.0%,Nil,Nil,1.0,ICICI BANK,"6,000",0.0,Nil,Nil,No,"E.E, L.I.Division, Nabarangpur","E.E, L.I.Division, Nabarangpur, Pin 764059",Dhupakote-II L.I.P,"Installation, electrification and energisation of Dhupakote-II L.I.P under Chandahandi Block of Nabarangpur District",As per DTCN ,NA ,"24,06,000",Civil Works - Lift Irrigation Schemes,Electrical ,Tender,180.0,90.0,"E.E, L.I Division, Nabarangpur",764059.0,NA ,NA ,NA ,"Office of the E.E, L.I.Division,Nabarangpur",No ,No,AOC,07-Feb-2024,"INR 2,413,502",90.0,Dillip Kumar Das,07-Feb-2024 04:15 PM,Dhupakote-II.pdf (2880.00 KB),Execution of Dhupakote-II L.I.P,1.0,2325987.0,HARA PRASAD NAYAK,INR,"2,413,502",1,2326589,DAITARI SIA,22-Nov-2023 10:51 AM,Rejected-Finance,Being Hara Prasad Nayak Accepted the bid,07-Feb-2024 04:11 PM,Finance,Opened Successfully,Jayaram Behera,28-Nov-2023 05:48 PM,finance_471836.pdf,BOQ Comparative Chart,"Executive Engineer, L.I.Division, Nabarangpur",Internal,"Executive Engineer, Divisional Accountant, Estimator",Dillip Kumar Das,07-Feb-2024 04:11 PM,finsummary_471836.pdf (161.34 KB),Orissa Lift Irrigation Corporation||LI KORAPUT||LI Division Nawarangpur,2023_OLIC_96645_10,2892 / 02.11.2023,Dhupakote-II L.I.P,"Executive Engineer, L.I. Division, Nabarangpur",Internal,"Executive Engineer, L.I. Division, Nabarangpur",Dillip Kumar Das,20-Dec-2023 12:34 PM,techsummary_471836.pdf (27.98 KB),AOC
,,,,,,,,,,,,,,,,.pdf,TCN documents,,,,,,,,,,,,,,,2.0,ICICI NEFT/RTGS,,,,,,,,,,,,,,,,,,,,,,,,,,AOC,,,,,,,,,,,,,2,2325987,HARA PRASAD NAYAK,21-Nov-2023 02:34 PM,Accepted-AOC,Accepted,07-Feb-2024 06:45 PM,,,,,,,,,,,,,,,,,,,,,,,AOC
,,,,,,,,,,,,,,,,.xls,Bill of Quantities,,,,,,,,,,,,,,,,,,,,,,,,,,,,,,,,,,,,,,,,,,AOC,,,,,,,,,,,,,3,2327120,M/S Maa Durga Agancy,22-Nov-2023 02:18 AM,Rejected-Finance,Not accepted the bid,07-Feb-2024 04:11 PM,,,,,,,,,,,,,,,,,,,,,,,AOC
,,,,,,,,,,,,,,,,,,,,,,,,,,,,,,,,,,,,,,,,,,,,,,,,,,,,,,,,,,,AOC,,,,,,,,,,,,,4,2322959,M/S SHANTI POWER AND CONSTRUCTION,21-Nov-2023 11:16 AM,Rejected-Finance,Being Hara Prasad Nayak Accepted the bid,07-Feb-2024 04:11 PM,,,,,,,,,,,,,,,,,,,,,,,AOC
,,,,,,,,,,,,,,,,,,,,,,,,,,,,,,,,,,,,,,,,,,,,,,,,,,,,,,,,,,,AOC,,,,,,,,,,,,,5,2328064,SUBHAM ELECTRICALS,22-Nov-2023 12:53 PM,Rejected-Finance,Being Hara Prasad Nayak Accepted the bid,07-Feb-2024 04:11 PM,,,,,,,,,,,,,,,,,,,,,,,AOC
