Organisation Chain,Tender Reference Number,Tender ID,Withdrawal Allowed,Tender Type,Form of contract,Tender Category,No. of Covers,General Technical Evaluation Allowed,ItemWise Technical Evaluation Allowed,Payment Mode,Is Multi Currency Allowed For BOQ,Is Multi Currency Allowed For Fee,Allow Two Stage Bidding,Cover No,Cover,Document Type,Description,Publish Date,Bid Opening Date,Document Download / Sale Start Date,Document Download / Sale End Date,Clarification Start Date,Clarification End Date,Bid Submission Start Date,Bid Submission End Date,EMD Amount in ₹,EMD Exemption Allowed,EMD Fee Type,EMD Percentage,EMD Payable To,EMD Payable At,S.No,Bank Name,Tender Fee in ₹,VAT Charges in ₹,Fee Payable To,Fee Payable At,Tender Fee Exemption Allowed,Name,Address,Title,Work Description,Pre Qualification Details,Independent External Monitor/Remarks,Tender Value in ₹,Product Category,Sub category,Contract Type,Bid Validity(Days),Period Of Work(Days),Location,Pincode,Pre Bid Meeting Place,Pre Bid Meeting Address,Pre Bid Meeting Date,Bid Opening Place,Should Allow NDA Tender,Allow Preferential Bidder,Tender Stage,Contract Date :,Contract Value :,Work Completion Period in days :,Updated By :,Updated on :,AOC document :,AOC Description :,S.No,Bid Number,Bidder Name,Awarded Currency,Awarded Value,S.No.1,Bid Number.1,Bidder Name.1,Submitted Date,Status,Remarks,Status Updated On,Type :,Summary :,Updated By :.1,Updated On :,Document :,BOQ Comparative Chart :,Committee Chairperson/Co-ordinator Name :,Committee Chairperson/Co-ordinator Type :,Committee Members :,Updated By :.2,Updated on :.1,Document :.1,Organisation Chain :,Tender ID :,Tender Ref No :,Tender Title :,Committee Chairperson/Co-ordinator Name :.1,Committee Chairperson/Co-ordinator Type :.1,Committee Members :.1,Updated By :.3,Updated On :.1,Document :.2,Tender Stage
Orissa Lift Irrigation Corporation||LI Western Circle Bhawanipatna||LI Division Bhawanipatna,OLIC-BPT-03/2023-24 Dt.04.11.2023,2023_OLIC_96604_10,Yes,National Competitive Bid,Percentage,Works,1.0,No,No,Online,No,No,No,1.0,Fee/PreQual/Technical/Finance,.pdf,"Tender paper Cost,EMD,GST Challan,GSTIN,PAN, Affidavit,Civil and HT License, Joint Venture Agreement",10-Nov-2023 11:00 AM,24-Nov-2023 11:00 AM,10-Nov-2023 11:00 AM,23-Nov-2023 05:00 PM,10-Nov-2023 11:00 AM ,20-Nov-2023 05:00 PM ,10-Nov-2023 11:00 AM,23-Nov-2023 05:00 PM,"27,106",Yes,fixed,,Nil,Nil,1.0,ICICI BANK,"6,000",0.0,Nil,Nil,No,"Executive Engineer L.I.Division, Bhawanipatna",At - Infront of GOVT. ITI Po - Bhawanipatna,INSTALLATION AND ENERGISATION OF SIKUAN-II L.I. PROJECT UNDER BHAWANIPATNA BLOCK IN KALAHANDI DISTRICT,INSTALLATION AND ENERGISATION OF SIKUAN-II L.I. PROJECT UNDER BHAWANIPATNA BLOCK IN KALAHANDI DISTRICT,Please refer to Tender Documents ,NA ,"27,10,555",Civil Works - Lift Irrigation Schemes,NA ,Tender,90.0,90.0,BHAWANIPATNA,766001.0,NA ,NA ,NA ,"O/O The Executive Engineer L.I.Division, Bhawanipa",No ,No,AOC,13-Feb-2024,"INR 2,304,243",90.0,BENU CHARAN BEHERA,17-Feb-2024 12:05 PM,Pkg.10.Sikuan-II.pdf (4555.00 KB),Award of Contract,1.0,2324667.0,M/S ADARSH AGENCY (PROP. ADARSH PRATAP SINGH),INR,"2,304,243",1,2330838,AGRAWALLA POWER INFRASTRUCTURE,23-Nov-2023 01:53 PM,Rejected-Technical,Not selected for lottery,08-Feb-2024 06:56 PM,Finance,Bid Opening summary uploaded as per bidding. The L1 bidder will be accepted after Technical evaluation,BENU CHARAN BEHERA,22-Dec-2023 05:24 PM,finance_471539.pdf,BOQ Comparative Chart,BenuCharanBehera,Internal,BenuCharanBehera KrushnaChandraSahu SudhirKumarBagh HimanshuSekharHarichandan,BENU CHARAN BEHERA,12-Feb-2024 05:50 PM,finsummary_471539.pdf (2166.15 KB),Orissa Lift Irrigation Corporation||LI Western Circle Bhawanipatna||LI Division Bhawanipatna,2023_OLIC_96604_10,OLIC-BPT-03/2023-24 Dt.04.11.2023,INSTALLATION AND ENERGISATION OF SIKUAN-II L.I. PROJECT UNDER BHAWANIPATNA BLOCK IN KALAHANDI DISTRICT,BenuCharanBehera,Internal,BenuCharanBehera KrushnaChandraSahu SudhirKumarBagh HimanshuSekharHarichandan,BENU CHARAN BEHERA,08-Feb-2024 06:56 PM,techsummary_471539.pdf (3529.31 KB),AOC
,,,,,,,,,,,,,,,,.pdf,DTCN,,,,,,,,,,,,,,,2.0,ICICI NEFT/RTGS,,,,,,,,,,,,,,,,,,,,,,,,,,AOC,,,,,,,,,,,,,2,2329805,GITANJALI SARANGI PROPRIETOR- GITANJALI ENTERPRISES,23-Nov-2023 10:10 AM,Rejected-Technical,Not selected for lottery,08-Feb-2024 06:56 PM,,,,,,,,,,,,,,,,,,,,,,,AOC
,,,,,,,,,,,,,,,,.xls,Bill of Quantities,,,,,,,,,,,,,,,,,,,,,,,,,,,,,,,,,,,,,,,,,,AOC,,,,,,,,,,,,,3,2329558,MANOJ KUMAR SAHU,23-Nov-2023 09:48 AM,Rejected-Finance,L3 not Selected,12-Feb-2024 05:50 PM,,,,,,,,,,,,,,,,,,,,,,,AOC
,,,,,,,,,,,,,,,,,,,,,,,,,,,,,,,,,,,,,,,,,,,,,,,,,,,,,,,,,,,AOC,,,,,,,,,,,,,4,2324667,M/S ADARSH AGENCY (PROP. ADARSH PRATAP SINGH),21-Nov-2023 04:48 PM,Accepted-AOC,L1 and Accepted,17-Feb-2024 12:05 PM,,,,,,,,,,,,,,,,,,,,,,,AOC
,,,,,,,,,,,,,,,,,,,,,,,,,,,,,,,,,,,,,,,,,,,,,,,,,,,,,,,,,,,AOC,,,,,,,,,,,,,5,2322063,"M/S SHIVANI INFRASTRUCTURE AND SUPPLIERS, PROP. YASH AGRAWAL",22-Nov-2023 10:53 PM,Rejected-AOC,L2 not Selected,17-Feb-2024 12:05 PM,,,,,,,,,,,,,,,,,,,,,,,AOC
,,,,,,,,,,,,,,,,,,,,,,,,,,,,,,,,,,,,,,,,,,,,,,,,,,,,,,,,,,,AOC,,,,,,,,,,,,,6,2330731,SAMBIT BISOYI,23-Nov-2023 01:26 PM,Rejected-Technical,Not selected for lottery,08-Feb-2024 06:56 PM,,,,,,,,,,,,,,,,,,,,,,,AOC
,,,,,,,,,,,,,,,,,,,,,,,,,,,,,,,,,,,,,,,,,,,,,,,,,,,,,,,,,,,AOC,,,,,,,,,,,,,7,2325553,SHAIKH ABDUL JAHIR,21-Nov-2023 12:48 PM,Rejected-Technical,Not selected for lottery,08-Feb-2024 06:56 PM,,,,,,,,,,,,,,,,,,,,,,,AOC
,,,,,,,,,,,,,,,,,,,,,,,,,,,,,,,,,,,,,,,,,,,,,,,,,,,,,,,,,,,AOC,,,,,,,,,,,,,8,2326412,TEJESWAR RANA,23-Nov-2023 01:11 AM,Rejected-Technical,Not selected for lottery,08-Feb-2024 06:56 PM,,,,,,,,,,,,,,,,,,,,,,,AOC
