Organisation Chain,Tender Reference Number,Tender ID,Withdrawal Allowed,Tender Type,Form of contract,Tender Category,No. of Covers,General Technical Evaluation Allowed,ItemWise Technical Evaluation Allowed,Payment Mode,Is Multi Currency Allowed For BOQ,Is Multi Currency Allowed For Fee,Allow Two Stage Bidding,Cover No,Cover,Document Type,Description,Publish Date,Bid Opening Date,Document Download / Sale Start Date,Document Download / Sale End Date,Clarification Start Date,Clarification End Date,Bid Submission Start Date,Bid Submission End Date,Financial Bid Opening Date,EMD Amount in ₹,EMD Exemption Allowed,EMD Fee Type,EMD Percentage,EMD Payable To,EMD Payable At,S.No,Bank Name,Tender Fee in ₹,VAT Charges in ₹,Fee Payable To,Fee Payable At,Tender Fee Exemption Allowed,Name,Address,Title,Work Description,Pre Qualification Details,Independent External Monitor/Remarks,Tender Value in ₹,Product Category,Sub category,Contract Type,Bid Validity(Days),Period Of Work(Days),Location,Pincode,Pre Bid Meeting Place,Pre Bid Meeting Address,Pre Bid Meeting Date,Bid Opening Place,Should Allow NDA Tender,Allow Preferential Bidder,Tender Stage,Contract Date :,Contract Value :,Work Completion Period in days :,Updated By :,Updated on :,AOC document :,AOC Description :,S.No,Bid Number,Bidder Name,Awarded Currency,Awarded Value,S.No.1,Bid Number.1,Bidder Name.1,Submitted Date,Status,Remarks,Status Updated On,Type :,Summary :,Updated By :.1,Updated On :,Document :,BOQ Comparative Chart :,Committee Chairperson/Co-ordinator Name :,Committee Chairperson/Co-ordinator Type :,Committee Members :,Updated By :.2,Updated on :.1,Document :.1,Organisation Chain :,Tender ID :,Tender Ref No :,Tender Title :,Type :.1,Summary :.1,Updated By :.3,Updated On :.1,Document :.2,Committee Chairperson/Co-ordinator Name :.1,Committee Chairperson/Co-ordinator Type :.1,Committee Members :.1,Updated By :.4,Updated On :.2,Financial Bid Opening Date:,Document :.3,Tender Stage
Orissa State Police Housing and Welfare Corporation Ltd,10/OPHWC/2024-25,2024_OSPHW_107722_9,Yes,National Competitive Bid,Percentage,Works,2.0,No,No,Online,No,No,No,1.0,Fee/PreQual/Technical,.pdf,"GST, GSTR-1, PAN, Contractor Registration Certificate and Affidavit",29-Nov-2024 06:00 PM,16-Dec-2024 10:30 AM,29-Nov-2024 06:00 PM,13-Dec-2024 05:00 PM,NA ,NA ,29-Nov-2024 06:00 PM,13-Dec-2024 05:00 PM,03-Feb-2025 10:30 AM,"1,85,100",Yes,fixed,,Nil,Nil,1.0,ICICI BANK,"11,800",0.0,Nil,Nil,No,CHIEF ENGINEER OPHWC,OPHWC BHUBANESWAR,"Constn. of 6 Nos. E type Qtrs. at Bantala PS, Angul.",Building Work,Please refer Tender documents  ,NA ,"1,85,12,697",Civil Works - Buildings,NA ,Tender,90.0,365.0,Angul.,751022.0,NA ,NA ,NA ,OPHWC BHUBANESWAR,No ,No,AOC,27-Mar-2025,"INR 16,663,278",365.0,Bikram Keshari Malla,27-Mar-2025 05:47 PM,ACCPJHK.pdf (459.00 KB),AWARDED AS L1 TENDERER AND AWARDED ON DATE 04.03.2025,1.0,2690834.0,DIPAK KUMAR NAYAK,INR,"16,663,278",1,2694963,AJAYA KUMAR PATTNAIK,13-Dec-2024 02:20 PM,Rejected-Technical,Non submission of EMD in online mode as per DTCN Cl.06.,01-Feb-2025 06:32 PM,Finance,FINANCIAL BID OPEN AND COMPARATIVE GENERATED,Bikram Keshari Malla,03-Feb-2025 11:25 AM,,BOQ Comparative Chart,AS PER AS ACCEPTANCE LETTER,Internal,AS PER AS ACCEPTANCE LETTER,Bikram Keshari Malla,27-Mar-2025 05:44 PM,finsummary_518622.pdf (459.33 KB),Orissa State Police Housing and Welfare Corporation Ltd,2024_OSPHW_107722_9,10/OPHWC/2024-25,"Constn. of 6 Nos. E type Qtrs. at Bantala PS, Angul.",Technical,five bidder have participated,Bikram Keshari Malla,16-Dec-2024 12:29 PM,,AS PER TC MINUTES,Internal,AS PER TC MINUTES,BIBHUTI BHUSHAN NAIK,01-Feb-2025 06:32 PM,03-Feb-2025 10:30 AM,techsummary_518622.pdf (328.45 KB),AOC
,,,,,,,,,,,,,,,,.pdf,Other Document as per DTCN,,,,,,,,,,,,,,,,2.0,ICICI NEFT/RTGS,,,,,,,,,,,,,,,,,,,,,,,,,,AOC,,,,,,,,,,,,,2,2684911,DILIP KUMAR PRADHAN,11-Dec-2024 11:00 AM,Rejected-Finance,DUE TO L1 BIDDER,27-Mar-2025 05:44 PM,,,,,,,,,,,,,,,,,,,,,,,,,,,,,AOC
,,,,,,,,,,,,,,2.0,Finance,.xls,Bill of Quantity,,,,,,,,,,,,,,,,,,,,,,,,,,,,,,,,,,,,,,,,,,,AOC,,,,,,,,,,,,,3,2690834,DIPAK KUMAR NAYAK,12-Dec-2024 11:25 AM,Accepted-AOC,QUALIFIED BIDDER,27-Mar-2025 05:47 PM,,,,,,,,,,,,,,,,,,,,,,,,,,,,,AOC
,,,,,,,,,,,,,,,,,,,,,,,,,,,,,,,,,,,,,,,,,,,,,,,,,,,,,,,,,,,,AOC,,,,,,,,,,,,,4,2693528,LALIT MOHAN PAL,13-Dec-2024 11:38 AM,Rejected-Finance,DUE TO L1 BIDDER,27-Mar-2025 05:44 PM,,,,,,,,,,,,,,,,,,,,,,,,,,,,,AOC
,,,,,,,,,,,,,,,,,,,,,,,,,,,,,,,,,,,,,,,,,,,,,,,,,,,,,,,,,,,,AOC,,,,,,,,,,,,,5,2694425,PRAMOD KUMAR NAYAK,13-Dec-2024 10:12 AM,Rejected-Finance,DUE TO L1 BIDDER,27-Mar-2025 05:44 PM,,,,,,,,,,,,,,,,,,,,,,,,,,,,,AOC
