Organisation Chain,Tender Reference Number,Tender ID,Withdrawal Allowed,Tender Type,Form of contract,Tender Category,No. of Covers,General Technical Evaluation Allowed,ItemWise Technical Evaluation Allowed,Payment Mode,Is Multi Currency Allowed For BOQ,Is Multi Currency Allowed For Fee,Allow Two Stage Bidding,Cover No,Cover,Document Type,Description,Publish Date,Bid Opening Date,Document Download / Sale Start Date,Document Download / Sale End Date,Clarification Start Date,Clarification End Date,Bid Submission Start Date,Bid Submission End Date,Financial Bid Opening Date,EMD Amount in ₹,EMD Exemption Allowed,EMD Fee Type,EMD Percentage,EMD Payable To,EMD Payable At,S.No,Bank Name,Tender Fee in ₹,VAT Charges in ₹,Fee Payable To,Fee Payable At,Tender Fee Exemption Allowed,Name,Address,Title,Work Description,Pre Qualification Details,Independent External Monitor/Remarks,Tender Value in ₹,Product Category,Sub category,Contract Type,Bid Validity(Days),Period Of Work(Days),Location,Pincode,Pre Bid Meeting Place,Pre Bid Meeting Address,Pre Bid Meeting Date,Bid Opening Place,Should Allow NDA Tender,Allow Preferential Bidder,Tender Stage,Contract Date :,Contract Value :,Work Completion Period in days :,Updated By :,Updated on :,AOC document :,AOC Description :,S.No,Bid Number,Bidder Name,Awarded Currency,Awarded Value,S.No.1,Bid Number.1,Bidder Name.1,Submitted Date,Status,Remarks,Status Updated On,Type :,Summary :,Updated By :.1,Updated On :,Document :,BOQ Comparative Chart :,Committee Chairperson/Co-ordinator Name :,Committee Chairperson/Co-ordinator Type :,Committee Members :,Updated By :.2,Updated on :.1,Document :.1,Organisation Chain :,Tender ID :,Tender Ref No :,Tender Title :,Type :.1,Summary :.1,Updated By :.3,Updated On :.1,Document :.2,Committee Chairperson/Co-ordinator Name :.1,Committee Chairperson/Co-ordinator Type :.1,Committee Members :.1,Updated By :.4,Updated On :.2,Financial Bid Opening Date:,Document :.3,Tender Stage
EIC-CIVIL||SERNB-CIRCLE-KEONJHAR,CCEKC - 29 / 2024-25,2024_EICCL_108254_3,Yes,Open Tender,Percentage,Works,2.0,No,No,Online,No,No,No,1.0,Fee/PreQual/Technical,.pdf,"Online proof copy of Tender paper Cost and EMD,PAN,GSTIN,Contractor RC,Affidavit",16-Dec-2024 09:00 AM,27-Dec-2024 11:30 AM,16-Dec-2024 09:00 AM,26-Dec-2024 04:00 PM,NA ,NA ,16-Dec-2024 09:00 AM,26-Dec-2024 04:00 PM,28-Jan-2025 11:30 AM,"1,81,100",Yes,fixed,,Nil,Nil,1.0,ICICI BANK,"10,000",0.0,Nil,Nil,No,CCE Keonjhar (R and B) Circle,"O/o the CCE Keonjhar (R and B) Circle, Keonjhar-758001",Construction of 04 Nos. of F-Type Judicial Staff qrs. (S plus 1) at Barbil in the district of Keonjhar for the year 2024-25,Construction of 04 Nos. of F-Type Judicial Staff qrs. (S plus 1) at Barbil in the district of Keonjhar for the year 2024-25,Please refer Tender Documents ,NA ,"1,81,05,952",Civil Works - Buildings,NA ,Tender,90.0,270.0,Keonjhar,758001.0,NA ,NA ,NA ,O/o the CCE Keonjhar (R and B) Circle,No ,No,AOC,20-Mar-2025,"INR 15,391,870",270.0,Santosh Kumar Behera,20-Mar-2025 07:28 PM,AOC_04NOSFTYPEJUDICIALSTAFF.pdf (1018.00 KB),1st Lowest Bidder,1.0,2711308.0,LAGNAJIT BISWAL,INR,"15,391,870",1,2707361,BHUYAN MAHAPRASAD,25-Dec-2024 10:05 AM,Rejected-Finance,3rd Lowest Bidder,20-Mar-2025 07:25 PM,Finance,Bid opening summary,Manoranjan Biswal,28-Jan-2025 11:53 AM,finance_520647.pdf,BOQ Comparative Chart,Santosh Kumar Behera,Internal,SE Keonjhar R and B Division DAO-I Keonjhar R and B Division PA to CCE Keonjhar R and B Circle,Santosh Kumar Behera,20-Mar-2025 07:25 PM,finsummary_520647.pdf (213.24 KB),EIC-CIVIL||SERNB-CIRCLE-KEONJHAR,2024_EICCL_108254_3,CCEKC - 29 / 2024-25,Construction of 04 Nos. of F-Type Judicial Staff qrs. (S plus 1) at Barbil in the district of Keonjhar for the year 2024-25,Technical,Bid opening summary,Manoranjan Biswal,27-Dec-2024 01:01 PM,technical_520647.pdf,Santosh Kumar Behera,Internal,SE Keonjhar R and B Division DAO-I Keonjhar R and B Division PA to CCE Keonjhar R and B Circle,Santosh Kumar Behera,21-Jan-2025 06:36 PM,28-Jan-2025 11:30 AM,techsummary_520647.pdf (1514.42 KB),AOC
,,,,,,,,,,,,,,,,.pdf,"Machineries, work in hand, work experience",,,,,,,,,,,,,,,,2.0,ICICI NEFT/RTGS,,,,,,,,,,,,,,,,,,,,,,,,,,AOC,,,,,,,,,,,,,2,2705908,HARI HAR SWAIN,21-Dec-2024 02:57 PM,Rejected-Finance,2nd Lowest Bidder,20-Mar-2025 07:25 PM,,,,,,,,,,,,,,,,,,,,,,,,,,,,,AOC
,,,,,,,,,,,,,,,,.pdf,Other documents as per DTCN,,,,,,,,,,,,,,,,,,,,,,,,,,,,,,,,,,,,,,,,,,,AOC,,,,,,,,,,,,,3,2711308,LAGNAJIT BISWAL,25-Dec-2024 08:59 PM,Accepted-AOC,1st Lowest Bidder,20-Mar-2025 07:29 PM,,,,,,,,,,,,,,,,,,,,,,,,,,,,,AOC
,,,,,,,,,,,,,,2.0,Finance,.xls,Bill of Quantity,,,,,,,,,,,,,,,,,,,,,,,,,,,,,,,,,,,,,,,,,,,AOC,,,,,,,,,,,,,4,2711354,MD ISHAQUE RAHMANI,26-Dec-2024 01:17 PM,Rejected-Finance,5th Lowest Bidder,20-Mar-2025 07:25 PM,,,,,,,,,,,,,,,,,,,,,,,,,,,,,AOC
,,,,,,,,,,,,,,,,,,,,,,,,,,,,,,,,,,,,,,,,,,,,,,,,,,,,,,,,,,,,AOC,,,,,,,,,,,,,5,2710735,MOTI RANJAN NAYAK,25-Dec-2024 01:08 PM,Rejected-Finance,4th Lowest Bidder,20-Mar-2025 07:25 PM,,,,,,,,,,,,,,,,,,,,,,,,,,,,,AOC
,,,,,,,,,,,,,,,,,,,,,,,,,,,,,,,,,,,,,,,,,,,,,,,,,,,,,,,,,,,,AOC,,,,,,,,,,,,,6,2711646,RAJNISH ENGICONS PVT. LTD,26-Dec-2024 11:56 AM,Rejected-Finance,7th Lowest Bidder,20-Mar-2025 07:25 PM,,,,,,,,,,,,,,,,,,,,,,,,,,,,,AOC
,,,,,,,,,,,,,,,,,,,,,,,,,,,,,,,,,,,,,,,,,,,,,,,,,,,,,,,,,,,,AOC,,,,,,,,,,,,,7,2709092,RATNAKAR NAIK,23-Dec-2024 09:20 PM,Rejected-Finance,6th Lowest Bidder,20-Mar-2025 07:25 PM,,,,,,,,,,,,,,,,,,,,,,,,,,,,,AOC
,,,,,,,,,,,,,,,,,,,,,,,,,,,,,,,,,,,,,,,,,,,,,,,,,,,,,,,,,,,,AOC,,,,,,,,,,,,,8,2712383,SANJAY NAIK,26-Dec-2024 03:55 PM,Rejected-Technical,As per decision of technical evaluation committee,21-Jan-2025 06:36 PM,,,,,,,,,,,,,,,,,,,,,,,,,,,,,AOC
