Organisation Chain,Tender Reference Number,Tender ID,Withdrawal Allowed,Tender Type,Form of contract,Tender Category,No. of Covers,General Technical Evaluation Allowed,ItemWise Technical Evaluation Allowed,Payment Mode,Is Multi Currency Allowed For BOQ,Is Multi Currency Allowed For Fee,Allow Two Stage Bidding,Cover No,Cover,Document Type,Description,Publish Date,Bid Opening Date,Document Download / Sale Start Date,Document Download / Sale End Date,Clarification Start Date,Clarification End Date,Bid Submission Start Date,Bid Submission End Date,Financial Bid Opening Date,EMD Amount in ₹,EMD Exemption Allowed,EMD Fee Type,EMD Percentage,EMD Payable To,EMD Payable At,S.No,Bank Name,Tender Fee in ₹,VAT Charges in ₹,Fee Payable To,Fee Payable At,Tender Fee Exemption Allowed,Name,Address,Title,Work Description,Pre Qualification Details,Independent External Monitor/Remarks,Tender Value in ₹,Product Category,Sub category,Contract Type,Bid Validity(Days),Period Of Work(Days),Location,Pincode,Pre Bid Meeting Place,Pre Bid Meeting Address,Pre Bid Meeting Date,Bid Opening Place,Should Allow NDA Tender,Allow Preferential Bidder,Tender Stage,Contract Date :,Contract Value :,Work Completion Period in days :,Updated By :,Updated on :,AOC document :,AOC Description :,S.No,Bid Number,Bidder Name,Awarded Currency,Awarded Value,S.No.1,Bid Number.1,Bidder Name.1,Submitted Date,Status,Remarks,Status Updated On,Type :,Summary :,Updated By :.1,Updated On :,Document :,BOQ Comparative Chart :,Committee Chairperson/Co-ordinator Name :,Committee Chairperson/Co-ordinator Type :,Committee Members :,Updated By :.2,Updated on :.1,Document :.1,Organisation Chain :,Tender ID :,Tender Ref No :,Tender Title :,Type :.1,Summary :.1,Updated By :.3,Updated On :.1,Document :.2,Committee Chairperson/Co-ordinator Name :.1,Committee Chairperson/Co-ordinator Type :.1,Committee Members :.1,Updated By :.4,Updated On :.2,Financial Bid Opening Date:,Document :.3,Tender Stage
Orissa State Police Housing and Welfare Corporation Ltd,10/OPHWC/2024-25,2024_OSPHW_107722_10,Yes,National Competitive Bid,Percentage,Works,2.0,No,No,Online,No,No,No,1.0,Fee/PreQual/Technical,.pdf,"GST, GSTR-1, PAN, Contractor Registration Certificate and Affidavit",29-Nov-2024 06:00 PM,16-Dec-2024 10:30 AM,29-Nov-2024 06:00 PM,13-Dec-2024 05:00 PM,NA ,NA ,29-Nov-2024 06:00 PM,13-Dec-2024 05:00 PM,03-Feb-2025 10:30 AM,"1,84,100",Yes,fixed,,Nil,Nil,1.0,ICICI BANK,"11,800",0.0,Nil,Nil,No,CHIEF ENGINEER OPHWC,OPHWC BHUBANESWAR,"Constn. of 6 Nos. E type Qtrs. at Golanthara P.S, Berhampur.",Building Work,Please refer Tender documents  ,NA ,"1,84,05,658",Civil Works - Buildings,NA ,Tender,90.0,365.0,Berhampur.,751022.0,NA ,NA ,NA ,OPHWC BHUBANESWAR,No ,No,AOC,21-Mar-2025,"INR 16,509,875.41",365.0,Bikram Keshari Malla,21-Mar-2025 12:19 PM,wokjkhn.pdf (508.00 KB),AWARDED AS L1 TENDERER AND AWARDED ON DATE 07.03.2025,1.0,2694361.0,BIKRAM SETHI,INR,"16,509,875.41",1,2694240,Anup Kumar Dash,13-Dec-2024 03:21 PM,Rejected-Finance,due to l1 bidder but l2 bidder is sc bidder,21-Mar-2025 12:16 PM,Finance,FINANCIAL BID OPEN AND COMPARATIVE GENERATED,Bikram Keshari Malla,03-Feb-2025 11:28 AM,,BOQ Comparative Chart,as per as acceptance letter,Internal,as per as acceptance letter,Bikram Keshari Malla,21-Mar-2025 12:16 PM,finsummary_518624.pdf (452.09 KB),Orissa State Police Housing and Welfare Corporation Ltd,2024_OSPHW_107722_10,10/OPHWC/2024-25,"Constn. of 6 Nos. E type Qtrs. at Golanthara P.S, Berhampur.",Technical,six bidder have participated,Bikram Keshari Malla,16-Dec-2024 12:43 PM,,AS PER TC MINUTES,Internal,AS PER TC MINUTES,BIBHUTI BHUSHAN NAIK,01-Feb-2025 06:45 PM,03-Feb-2025 10:30 AM,techsummary_518624.pdf (317.12 KB),AOC
,,,,,,,,,,,,,,,,.pdf,Other Document as per DTCN,,,,,,,,,,,,,,,,2.0,ICICI NEFT/RTGS,,,,,,,,,,,,,,,,,,,,,,,,,,AOC,,,,,,,,,,,,,2,2694361,BIKRAM SETHI,13-Dec-2024 05:46 AM,Accepted-AOC,qualified bidder,21-Mar-2025 12:19 PM,,,,,,,,,,,,,,,,,,,,,,,,,,,,,AOC
,,,,,,,,,,,,,,2.0,Finance,.xls,Bill of Quantity,,,,,,,,,,,,,,,,,,,,,,,,,,,,,,,,,,,,,,,,,,,AOC,,,,,,,,,,,,,3,2695229,K.Rabinarayan Das,13-Dec-2024 04:31 PM,Rejected-Finance,due to l2 bidder,21-Mar-2025 12:16 PM,,,,,,,,,,,,,,,,,,,,,,,,,,,,,AOC
,,,,,,,,,,,,,,,,,,,,,,,,,,,,,,,,,,,,,,,,,,,,,,,,,,,,,,,,,,,,AOC,,,,,,,,,,,,,4,2694566,PRABHAKAR GOUDA,13-Dec-2024 11:47 AM,Rejected-Finance,due to l2 bidder,21-Mar-2025 12:16 PM,,,,,,,,,,,,,,,,,,,,,,,,,,,,,AOC
,,,,,,,,,,,,,,,,,,,,,,,,,,,,,,,,,,,,,,,,,,,,,,,,,,,,,,,,,,,,AOC,,,,,,,,,,,,,5,2694427,PRAMOD KUMAR NAYAK,13-Dec-2024 10:14 AM,Rejected-Finance,due to l2 bidder,21-Mar-2025 12:16 PM,,,,,,,,,,,,,,,,,,,,,,,,,,,,,AOC
,,,,,,,,,,,,,,,,,,,,,,,,,,,,,,,,,,,,,,,,,,,,,,,,,,,,,,,,,,,,AOC,,,,,,,,,,,,,6,2694562,Sudhansu Padhy,13-Dec-2024 11:41 AM,Rejected-Finance,due to l3 bidder,21-Mar-2025 12:16 PM,,,,,,,,,,,,,,,,,,,,,,,,,,,,,AOC
