Organisation Chain,Tender Reference Number,Tender ID,Withdrawal Allowed,Tender Type,Form of contract,Tender Category,No. of Covers,General Technical Evaluation Allowed,ItemWise Technical Evaluation Allowed,Payment Mode,Is Multi Currency Allowed For BOQ,Is Multi Currency Allowed For Fee,Allow Two Stage Bidding,Cover No,Cover,Document Type,Description,Publish Date,Bid Opening Date,Document Download / Sale Start Date,Document Download / Sale End Date,Clarification Start Date,Clarification End Date,Bid Submission Start Date,Bid Submission End Date,EMD Amount in ₹,EMD Exemption Allowed,EMD Fee Type,EMD Percentage,EMD Payable To,EMD Payable At,S.No,Bank Name,Tender Fee in ₹,VAT Charges in ₹,Fee Payable To,Fee Payable At,Tender Fee Exemption Allowed,Name,Address,Title,Work Description,Pre Qualification Details,Independent External Monitor/Remarks,Tender Value in ₹,Product Category,Sub category,Contract Type,Bid Validity(Days),Period Of Work(Days),Location,Pincode,Pre Bid Meeting Place,Pre Bid Meeting Address,Pre Bid Meeting Date,Bid Opening Place,Should Allow NDA Tender,Allow Preferential Bidder,Tender Stage,Contract Date :,Contract Value :,Work Completion Period in days :,Updated By :,Updated on :,AOC document :,AOC Description :,S.No,Bid Number,Bidder Name,Awarded Currency,Awarded Value,S.No.1,Bid Number.1,Bidder Name.1,Submitted Date,Status,Remarks,Status Updated On,Type :,Summary :,Updated By :.1,Updated On :,Document :,BOQ Comparative Chart :,Committee Chairperson/Co-ordinator Name :,Committee Chairperson/Co-ordinator Type :,Committee Members :,Updated By :.2,Updated on :.1,Document :.1,Organisation Chain :,Tender ID :,Tender Ref No :,Tender Title :,Committee Chairperson/Co-ordinator Name :.1,Committee Chairperson/Co-ordinator Type :.1,Committee Members :.1,Updated By :.3,Updated On :.1,Document :.2,Tender Stage
Odisha State Co. Milk Producers Federation Ltd.,07 /MM/CFP/54/ 2024-2025/02,2024_OMFED_104557_4,Yes,Open Tender,Item Rate,Goods,1.0,No,No,Online,No,No,No,1.0,Fee/PreQual/Technical/Finance,.pdf,"Tender paper cost, EMD, Pan, GST etc",31-Aug-2024 06:55 PM,17-Sep-2024 03:00 PM,01-Sep-2024 10:00 AM,17-Sep-2024 01:00 PM,NA ,NA ,01-Sep-2024 10:00 AM,17-Sep-2024 01:00 PM,"2,00,000",Yes,fixed,,Nil,Nil,1.0,ICICI BANK,590.0,0.0,Nil,Nil,No,Managing Director OMFED,"OMFED Corporate Office, D2 , Sahid Nagar, BBSR",PURCHASE OF Distillers Dried Grain Solution RICE,PURCHASE OF CATTLE FEED RAW MATERIALS FOR THE CATTLE FEED PLANT LOCATED AT RADHADAMODARPUR AND JAGANNATHPUR,Please refer Tender documents. ,NA ,"11,40,68,070",Miscellaneous Goods,NA ,Tender,90.0,60.0,RADHADAMODARPUR AND JAGANNATHPUR,751007.0,NA ,NA ,NA ,"OMFED Corporate Office, D2 , Sahid Nagar, BBSR",No ,No,AOC,01-Mar-2025,"INR 18,150",60.0,Sudhir Ranjan Mallik,06-Mar-2025 03:56 PM,com.pdf (217.00 KB),Awarded to lowest bidder.,1.0,2547597.0,Boudh Distillery Pvt Ltd,INR,"18,150",1,2547597,Boudh Distillery Pvt Ltd,14-Sep-2024 02:28 PM,Accepted-AOC,l1,06-Mar-2025 03:56 PM,Finance,Tender is process for evaluation.,Jitendra Barada,28-Oct-2024 11:38 AM,,BOQ Comparative Chart,Dr. Biswaranjan Tripathy,Internal,"GM PROJ AND DO, GM FIN, DGM HR,P AND I, DY. MANAGER MM AND CSS, IN CHARGE MKTG.",Jitendra Barada,28-Oct-2024 12:01 PM,finsummary_505871.pdf (213.96 KB),Odisha State Co. Milk Producers Federation Ltd.,2024_OMFED_104557_4,07 /MM/CFP/54/ 2024-2025/02,PURCHASE OF Distillers Dried Grain Solution RICE,Dr. Biswaranjan Tripathy,Internal,"GM PROJ AND DO, GM FIN, DGM HR,P AND I, DY. MANAGER MM AND CSS, IN CHARGE MKTG.",Jitendra Barada,28-Oct-2024 11:40 AM,techsummary_505871.pdf (213.96 KB),AOC
,,,,,,,,,,,,,,,,.pdf,other document as per DTCN,,,,,,,,,,,,,,,2.0,ICICI NEFT/RTGS,,,,,,,,,,,,,,,,,,,,,,,,,,AOC,,,,,,,,,,,,,2,2549188,CHANDA FOOD & FEEDS,16-Sep-2024 07:17 PM,Rejected-Finance,not quoted lowest rate,28-Oct-2024 12:01 PM,,,,,,,,,,,,,,,,,,,,,,,AOC
,,,,,,,,,,,,,,,,.xls,Bill of quantity,,,,,,,,,,,,,,,,,,,,,,,,,,,,,,,,,,,,,,,,,,AOC,,,,,,,,,,,,,3,2549023,DURGADUTT FAKIRCHAND,16-Sep-2024 05:14 PM,Rejected-Finance,not quoted lowest rate,28-Oct-2024 12:01 PM,,,,,,,,,,,,,,,,,,,,,,,AOC
,,,,,,,,,,,,,,,,,,,,,,,,,,,,,,,,,,,,,,,,,,,,,,,,,,,,,,,,,,,AOC,,,,,,,,,,,,,4,2547893,M/S. MAMATA TRADERS,16-Sep-2024 06:42 PM,Rejected-Finance,not quoted lowest rate,28-Oct-2024 12:01 PM,,,,,,,,,,,,,,,,,,,,,,,AOC
,,,,,,,,,,,,,,,,,,,,,,,,,,,,,,,,,,,,,,,,,,,,,,,,,,,,,,,,,,,AOC,,,,,,,,,,,,,5,2548560,PRORICH AGRO PRIVATE LIMITED,17-Sep-2024 12:31 PM,Rejected-Finance,not quoted lowest rate,28-Oct-2024 12:01 PM,,,,,,,,,,,,,,,,,,,,,,,AOC
,,,,,,,,,,,,,,,,,,,,,,,,,,,,,,,,,,,,,,,,,,,,,,,,,,,,,,,,,,,AOC,,,,,,,,,,,,,6,2545500,Ricky Traders,13-Sep-2024 06:17 PM,Rejected-Finance,not quoted lowest rate,28-Oct-2024 12:01 PM,,,,,,,,,,,,,,,,,,,,,,,AOC
,,,,,,,,,,,,,,,,,,,,,,,,,,,,,,,,,,,,,,,,,,,,,,,,,,,,,,,,,,,AOC,,,,,,,,,,,,,7,2548042,SREE MEENAKSHI TEXTILES PRIVATE LIMITED,17-Sep-2024 12:36 PM,Rejected-Finance,not quoted lowest rate,28-Oct-2024 12:01 PM,,,,,,,,,,,,,,,,,,,,,,,AOC
,,,,,,,,,,,,,,,,,,,,,,,,,,,,,,,,,,,,,,,,,,,,,,,,,,,,,,,,,,,AOC,,,,,,,,,,,,,8,2548588,vikas trading company,16-Sep-2024 12:04 PM,Rejected-Finance,not quoted lowest rate,28-Oct-2024 12:01 PM,,,,,,,,,,,,,,,,,,,,,,,AOC
