Organisation Chain,Tender Reference Number,Tender ID,Withdrawal Allowed,Tender Type,Form of contract,Tender Category,No. of Covers,General Technical Evaluation Allowed,ItemWise Technical Evaluation Allowed,Payment Mode,Is Multi Currency Allowed For BOQ,Is Multi Currency Allowed For Fee,Allow Two Stage Bidding,Cover No,Cover,Document Type,Description,Publish Date,Bid Opening Date,Document Download / Sale Start Date,Document Download / Sale End Date,Clarification Start Date,Clarification End Date,Bid Submission Start Date,Bid Submission End Date,Financial Bid Opening Date,EMD Amount in ₹,EMD Exemption Allowed,EMD Fee Type,EMD Percentage,EMD Payable To,EMD Payable At,S.No,Bank Name,Tender Fee in ₹,VAT Charges in ₹,Fee Payable To,Fee Payable At,Tender Fee Exemption Allowed,Name,Address,Title,Work Description,Pre Qualification Details,Independent External Monitor/Remarks,Tender Value in ₹,Product Category,Sub category,Contract Type,Bid Validity(Days),Period Of Work(Days),Location,Pincode,Pre Bid Meeting Place,Pre Bid Meeting Address,Pre Bid Meeting Date,Bid Opening Place,Should Allow NDA Tender,Allow Preferential Bidder,Tender Stage,Contract Date :,Contract Value :,Work Completion Period in days :,Updated By :,Updated on :,AOC document :,AOC Description :,S.No,Bid Number,Bidder Name,Awarded Currency,Awarded Value,S.No.1,Bid Number.1,Bidder Name.1,Submitted Date,Status,Remarks,Status Updated On,Type :,Summary :,Updated By :.1,Updated On :,Document :,BOQ Comparative Chart :,Committee Chairperson/Co-ordinator Name :,Committee Chairperson/Co-ordinator Type :,Committee Members :,Updated By :.2,Updated on :.1,Document :.1,Organisation Chain :,Tender ID :,Tender Ref No :,Tender Title :,Type :.1,Summary :.1,Updated By :.3,Updated On :.1,Document :.2,Committee Chairperson/Co-ordinator Name :.1,Committee Chairperson/Co-ordinator Type :.1,Committee Members :.1,Updated By :.4,Updated On :.2,Financial Bid Opening Date:,Document :.3,Tender Stage
Orissa State Police Housing and Welfare Corporation Ltd,11/OPHWC/2024-25,2024_OSPHW_107837_9,Yes,National Competitive Bid,Percentage,Works,2.0,No,No,Online,No,No,No,1.0,Fee/PreQual/Technical,.pdf,"GST, GSTR-1, PAN, Contractor Registration Certificate and Affidavit",03-Dec-2024 06:55 PM,18-Dec-2024 10:30 AM,03-Dec-2024 06:55 PM,17-Dec-2024 05:00 PM,NA ,NA ,03-Dec-2024 06:55 PM,17-Dec-2024 05:00 PM,10-Feb-2025 10:30 AM,"3,08,800",Yes,fixed,,Nil,Nil,1.0,ICICI BANK,"11,800",0.0,Nil,Nil,No,CHIEF ENGINEER OPHWC,OPHWC BHUBANESWAR-22,"Cluster of Constn. of 6 nos. F type Qtrs. and 4 Nos. E type Qtrs. at Khunta P.S, Mayurbhanj.",Building Work,Please refer Tender documents  ,NA ,"3,08,75,380",Civil Works - Buildings,NA ,Tender,90.0,365.0,Mayurbhanj.,751022.0,NA ,NA ,NA ,OPHWC BHUBANESWAR,No ,No,AOC,04-Mar-2025,"INR 27,111,671.11",365.0,Bikram Keshari Malla,04-Mar-2025 04:03 PM,wwwnhj.pdf (266.00 KB),AWARDED AS L1 TENDERER AND AWARDED ON DATE 28.02.2025,1.0,2699328.0,SUDARSAN PUTHAL,INR,"27,111,671.11",1,2699696,BISWAJIT ROUT,16-Dec-2024 10:47 PM,Rejected-Technical,Non-securing qualifying marks in the Point of Presentation as per DTCN Cl.110(m).,07-Feb-2025 08:10 PM,Finance,financial bid open and comparative generated,Bikram Keshari Malla,10-Feb-2025 11:45 AM,,BOQ Comparative Chart,as per as acceptance letter,Internal,as per as acceptance letter,Bikram Keshari Malla,04-Mar-2025 04:00 PM,finsummary_519110.pdf (359.41 KB),Orissa State Police Housing and Welfare Corporation Ltd,2024_OSPHW_107837_9,11/OPHWC/2024-25,"Cluster of Constn. of 6 nos. F type Qtrs. and 4 Nos. E type Qtrs. at Khunta P.S, Mayurbhanj.",Technical,EIGHT BIDDER HAVE PARTICIPATED,Bikram Keshari Malla,18-Dec-2024 05:17 PM,,AS PER TC MINUTES,Internal,AS PER TC MINUTES,BIBHUTI BHUSHAN NAIK,07-Feb-2025 08:10 PM,10-Feb-2025 10:30 AM,techsummary_519110.pdf (1217.65 KB),AOC
,,,,,,,,,,,,,,,,.pdf,Other Document as per DTCN,,,,,,,,,,,,,,,,2.0,ICICI NEFT/RTGS,,,,,,,,,,,,,,,,,,,,,,,,,,AOC,,,,,,,,,,,,,2,2693657,LALIT KUMAR MOHANTY,17-Dec-2024 12:10 PM,Rejected-Finance,due to l2 bidder,04-Mar-2025 04:00 PM,,,,,,,,,,,,,,,,,,,,,,,,,,,,,AOC
,,,,,,,,,,,,,,2.0,Finance,.xls,Bill of Quantity,,,,,,,,,,,,,,,,,,,,,,,,,,,,,,,,,,,,,,,,,,,AOC,,,,,,,,,,,,,3,2700951,MS DIBYANSU CONSTRUCTION PVT. LTD.,17-Dec-2024 04:24 PM,Rejected-Technical,Non submission of EMD in online mode as per DTCN Cl.06.,07-Feb-2025 08:10 PM,,,,,,,,,,,,,,,,,,,,,,,,,,,,,AOC
,,,,,,,,,,,,,,,,,,,,,,,,,,,,,,,,,,,,,,,,,,,,,,,,,,,,,,,,,,,,AOC,,,,,,,,,,,,,4,2700688,NIRAKAR SAMAL,17-Dec-2024 03:11 PM,Rejected-Finance,due to l2 bidder,04-Mar-2025 04:00 PM,,,,,,,,,,,,,,,,,,,,,,,,,,,,,AOC
,,,,,,,,,,,,,,,,,,,,,,,,,,,,,,,,,,,,,,,,,,,,,,,,,,,,,,,,,,,,AOC,,,,,,,,,,,,,5,2699914,PRIYADARSHANEE ANUSHMITA PANDA,17-Dec-2024 09:01 AM,Rejected-Technical,Non submission adequate similar nature of work during the consideration period as per DTCN clause no-11 and 110 (J).,07-Feb-2025 08:10 PM,,,,,,,,,,,,,,,,,,,,,,,,,,,,,AOC
,,,,,,,,,,,,,,,,,,,,,,,,,,,,,,,,,,,,,,,,,,,,,,,,,,,,,,,,,,,,AOC,,,,,,,,,,,,,6,2694439,SRI PRADIP KUMAR BHUJABAL,16-Dec-2024 08:08 PM,Rejected-Finance,due to l2 bidder,04-Mar-2025 04:00 PM,,,,,,,,,,,,,,,,,,,,,,,,,,,,,AOC
,,,,,,,,,,,,,,,,,,,,,,,,,,,,,,,,,,,,,,,,,,,,,,,,,,,,,,,,,,,,AOC,,,,,,,,,,,,,7,2699328,SUDARSAN PUTHAL,17-Dec-2024 11:06 AM,Accepted-AOC,qualified bidder,04-Mar-2025 04:03 PM,,,,,,,,,,,,,,,,,,,,,,,,,,,,,AOC
,,,,,,,,,,,,,,,,,,,,,,,,,,,,,,,,,,,,,,,,,,,,,,,,,,,,,,,,,,,,AOC,,,,,,,,,,,,,8,2700567,SUMAN KUMAR SAHU,17-Dec-2024 03:01 PM,Rejected-Technical,Non submission of Sch-C i.e required Tools and Plant to secure qualifying marks as per DTCN clause no-13 and 110 (f).,07-Feb-2025 08:10 PM,,,,,,,,,,,,,,,,,,,,,,,,,,,,,AOC
