Organisation Chain,Tender Reference Number,Tender ID,Withdrawal Allowed,Tender Type,Form of contract,Tender Category,No. of Covers,General Technical Evaluation Allowed,ItemWise Technical Evaluation Allowed,Payment Mode,Is Multi Currency Allowed For BOQ,Is Multi Currency Allowed For Fee,Allow Two Stage Bidding,Cover No,Cover,Document Type,Description,Publish Date,Bid Opening Date,Document Download / Sale Start Date,Document Download / Sale End Date,Clarification Start Date,Clarification End Date,Bid Submission Start Date,Bid Submission End Date,EMD Amount in ₹,EMD Exemption Allowed,EMD Fee Type,EMD Percentage,EMD Payable To,EMD Payable At,S.No,Bank Name,Tender Fee in ₹,VAT Charges in ₹,Fee Payable To,Fee Payable At,Tender Fee Exemption Allowed,Name,Address,Title,Work Description,Pre Qualification Details,Independent External Monitor/Remarks,Tender Value in ₹,Product Category,Sub category,Contract Type,Bid Validity(Days),Period Of Work(Days),Location,Pincode,Pre Bid Meeting Place,Pre Bid Meeting Address,Pre Bid Meeting Date,Bid Opening Place,Should Allow NDA Tender,Allow Preferential Bidder,Tender Stage,Contract Date :,Contract Value :,Work Completion Period in days :,Updated By :,Updated on :,AOC document :,AOC Description :,S.No,Bid Number,Bidder Name,Awarded Currency,Awarded Value,S.No.1,Bid Number.1,Bidder Name.1,Submitted Date,Status,Remarks,Status Updated On,Type :,Summary :,Updated By :.1,Updated On :,Document :,BOQ Comparative Chart :,Committee Chairperson/Co-ordinator Name :,Committee Chairperson/Co-ordinator Type :,Committee Members :,Updated By :.2,Updated on :.1,Document :.1,Organisation Chain :,Tender ID :,Tender Ref No :,Tender Title :,Committee Chairperson/Co-ordinator Name :.1,Committee Chairperson/Co-ordinator Type :.1,Committee Members :.1,Updated By :.3,Updated On :.1,Document :.2,Tender Stage
"CE,Minor Irrigation,BBSR||SE,KBK Minor Irr.CircleII,Jeypore||EE M.I. Division Rayagada",14/MID RGD/2024-25,2025_CEMIB_110407_4,Yes,National Competitive Bid,Percentage,Works,1.0,No,No,Online,No,No,No,1.0,Fee/PreQual/Technical/Finance,.pdf,DTCN,10-Feb-2025 10:00 AM,20-Feb-2025 11:00 AM,10-Feb-2025 10:00 AM,19-Feb-2025 05:30 PM,10-Feb-2025 10:00 AM ,19-Feb-2025 05:30 PM ,10-Feb-2025 10:00 AM,19-Feb-2025 05:30 PM,"9,300",Yes,fixed,,Nil,Nil,1.0,ICICI BANK,"4,000",0.0,Nil,Nil,No,"S.E, M.I Division, Rayagada","O/o S.E, M.I Division, Rayagada","Improvement to A,Jagannathpur MIP in Kolnara Block of Rayagada District under ERM 2024-25","Improvement to A,Jagannathpur MIP in Kolnara Block of Rayagada District under ERM 2024-25",Please refer Tender documents. ,NA ,"9,22,037",Civil Works - Others,NA ,Tender,90.0,60.0,Kolnara,765017.0,NA ,NA ,NA ,"O/o S.E, M.I Division, Rayagada",No ,No,AOC,11-Mar-2025,"INR 783,823",60.0,Dusi Sudhakar Kumar,20-Mar-2025 01:15 PM,4_ajagannathpur.PDF (147.00 KB),"Successful bidder in the Transparent Lottery. Deposited APSD, ISD and EMD Amounts.",1.0,2819134.0,GOPAL KRUSHNA PANDA,INR,"783,823",1,2825972,DURJADHANA MAJHI,19-Feb-2025 04:50 PM,Rejected-AOC,Unsuccessful bidder in the Transparent Lottery,20-Mar-2025 01:15 PM,Finance,"The Tender has been opened for the tender ID 2025_CEMIB_110407_4. 06 Nos. of bidders found for the work. After verification of all Bids documents, qualified bidders moved to further tender process.",Dusi Sudhakar Kumar,20-Feb-2025 01:47 PM,finance_529432.pdf,BOQ Comparative Chart,Superintending Engineer,Internal,"Superintending Engineer, Asst. Executive Engineer (Estimator), Divisional Accounts Officer and Assistant Engineer (Estimator)",Dusi Sudhakar Kumar,08-Mar-2025 12:00 PM,finsummary_529432.pdf (170.15 KB),"CE,Minor Irrigation,BBSR||SE,KBK Minor Irr.CircleII,Jeypore||EE M.I. Division Rayagada",2025_CEMIB_110407_4,14/MID RGD/2024-25,"Improvement to A,Jagannathpur MIP in Kolnara Block of Rayagada District under ERM 2024-25",Superintending Engineer,Internal,"Superintending Engineer, Assistant Executive Engineer (Estimator), Divisional Accounts Officer and Assistant Engineer (Estimator)",Dusi Sudhakar Kumar,07-Mar-2025 08:09 PM,techsummary_529432.pdf (170.15 KB),AOC
,,,,,,,,,,,,,,,,.pdf,NIT,,,,,,,,,,,,,,,2.0,ICICI NEFT/RTGS,,,,,,,,,,,,,,,,,,,,,,,,,,AOC,,,,,,,,,,,,,2,2819134,GOPAL KRUSHNA PANDA,16-Feb-2025 05:55 PM,Accepted-AOC,"Successful bidder in the Transparent Lottery. Deposited APSD, ISD and EMD Amounts.",20-Mar-2025 01:15 PM,,,,,,,,,,,,,,,,,,,,,,,AOC
,,,,,,,,,,,,,,,,.pdf,RC PAN GSTIN Affidavit regarding Authenticity No Relation and litigation debarring certificate etc,,,,,,,,,,,,,,,,,,,,,,,,,,,,,,,,,,,,,,,,,,AOC,,,,,,,,,,,,,3,2825384,JAGANNATH SAHU,19-Feb-2025 11:15 AM,Rejected-AOC,Unsuccessful bidder in the Transparent Lottery,20-Mar-2025 01:15 PM,,,,,,,,,,,,,,,,,,,,,,,AOC
,,,,,,,,,,,,,,,,.xls,BOQ,,,,,,,,,,,,,,,,,,,,,,,,,,,,,,,,,,,,,,,,,,AOC,,,,,,,,,,,,,4,2817358,KODANDADHAR HIAL,19-Feb-2025 12:45 PM,Rejected-AOC,Unsuccessful bidder in the Transparent Lottery,20-Mar-2025 01:15 PM,,,,,,,,,,,,,,,,,,,,,,,AOC
,,,,,,,,,,,,,,,,,,,,,,,,,,,,,,,,,,,,,,,,,,,,,,,,,,,,,,,,,,,AOC,,,,,,,,,,,,,5,2825596,NARAYAN BHUYAN,19-Feb-2025 01:27 PM,Rejected-AOC,Unsuccessful bidder in the Transparent Lottery,20-Mar-2025 01:15 PM,,,,,,,,,,,,,,,,,,,,,,,AOC
,,,,,,,,,,,,,,,,,,,,,,,,,,,,,,,,,,,,,,,,,,,,,,,,,,,,,,,,,,,AOC,,,,,,,,,,,,,6,2825704,RASMITA SAHUKAR,19-Feb-2025 02:29 PM,Rejected-AOC,Unsuccessful bidder in the Transparent Lottery,20-Mar-2025 01:15 PM,,,,,,,,,,,,,,,,,,,,,,,AOC
