Organisation Chain,Tender Reference Number,Tender ID,Withdrawal Allowed,Tender Type,Form of contract,Tender Category,No. of Covers,General Technical Evaluation Allowed,ItemWise Technical Evaluation Allowed,Payment Mode,Is Multi Currency Allowed For BOQ,Is Multi Currency Allowed For Fee,Allow Two Stage Bidding,Cover No,Cover,Document Type,Description,Publish Date,Bid Opening Date,Document Download / Sale Start Date,Document Download / Sale End Date,Clarification Start Date,Clarification End Date,Bid Submission Start Date,Bid Submission End Date,Financial Bid Opening Date,EMD Amount in ₹,EMD Exemption Allowed,EMD Fee Type,EMD Percentage,EMD Payable To,EMD Payable At,S.No,Bank Name,Tender Fee in ₹,VAT Charges in ₹,Fee Payable To,Fee Payable At,Tender Fee Exemption Allowed,Name,Address,Title,Work Description,Pre Qualification Details,Independent External Monitor/Remarks,Tender Value in ₹,Product Category,Sub category,Contract Type,Bid Validity(Days),Period Of Work(Days),Location,Pincode,Pre Bid Meeting Place,Pre Bid Meeting Address,Pre Bid Meeting Date,Bid Opening Place,Should Allow NDA Tender,Allow Preferential Bidder,Tender Stage,Contract Date :,Contract Value :,Work Completion Period in days :,Updated By :,Updated on :,AOC document :,AOC Description :,S.No,Bid Number,Bidder Name,Awarded Currency,Awarded Value,S.No.1,Bid Number.1,Bidder Name.1,Submitted Date,Status,Remarks,Status Updated On,Type :,Summary :,Updated By :.1,Updated On :,Document :,BOQ Comparative Chart :,Committee Chairperson/Co-ordinator Name :,Committee Chairperson/Co-ordinator Type :,Committee Members :,Updated By :.2,Updated on :.1,Document :.1,Organisation Chain :,Tender ID :,Tender Ref No :,Tender Title :,Type :.1,Summary :.1,Updated By :.3,Updated On :.1,Document :.2,Committee Chairperson/Co-ordinator Name :.1,Committee Chairperson/Co-ordinator Type :.1,Committee Members :.1,Updated By :.4,Updated On :.2,Financial Bid Opening Date:,Document :.3,Tender Stage
Orissa State Police Housing and Welfare Corporation Ltd,10/OPHWC/2024-25,2024_OSPHW_107722_8,Yes,National Competitive Bid,Percentage,Works,2.0,No,No,Online,No,No,No,1.0,Fee/PreQual/Technical,.pdf,"GST, GSTR-1, PAN, Contractor Registration Certificate and Affidavit",29-Nov-2024 06:00 PM,16-Dec-2024 10:30 AM,29-Nov-2024 06:00 PM,13-Dec-2024 05:00 PM,NA ,NA ,29-Nov-2024 06:00 PM,13-Dec-2024 05:00 PM,03-Feb-2025 10:30 AM,"1,86,000",Yes,fixed,,Nil,Nil,1.0,ICICI BANK,"11,800",0.0,Nil,Nil,No,CHIEF ENGINEER OPHWC,OPHWC BHUBANESWAR,"Constn. of 6 Nos. E type Qtrs. at Dabugaon P.S, Nabarangpur.",Building Work,Please refer Tender documents  ,NA ,"1,86,04,810",Civil Works - Buildings,NA ,Tender,90.0,365.0,Nabarangpur.,751022.0,NA ,NA ,NA ,OPHWC BHUBANESWAR,No ,No,AOC,04-Mar-2025,"INR 16,746,189.85",365.0,Bikram Keshari Malla,04-Mar-2025 07:05 PM,workhjkl.pdf (507.00 KB),AWARDED AS L1 TENDERER AND AWARDED ON DATE 24.02.2025,1.0,2693001.0,SRI SADHU NIMIKA,INR,"16,746,189.85",1,2690676,ABHIMANYU NAIK,13-Dec-2024 02:20 PM,Rejected-Finance,due to l4 bidder,04-Mar-2025 07:01 PM,Finance,FINANCIAL BID OPEN AND COMPARATIVE STATEMENT,Bikram Keshari Malla,03-Feb-2025 11:21 AM,,BOQ Comparative Chart,as per as acceptance letter,Internal,as per as acceptance letter,Bikram Keshari Malla,04-Mar-2025 07:01 PM,finsummary_518621.pdf (366.53 KB),Orissa State Police Housing and Welfare Corporation Ltd,2024_OSPHW_107722_8,10/OPHWC/2024-25,"Constn. of 6 Nos. E type Qtrs. at Dabugaon P.S, Nabarangpur.",Technical,six bidder have participated,Bikram Keshari Malla,16-Dec-2024 12:21 PM,,AS PER TC MINUTES,Internal,AS PER TC MINUTES,BIBHUTI BHUSHAN NAIK,01-Feb-2025 07:02 PM,03-Feb-2025 10:30 AM,techsummary_518621.pdf (343.27 KB),AOC
,,,,,,,,,,,,,,,,.pdf,Other Document as per DTCN,,,,,,,,,,,,,,,,2.0,ICICI NEFT/RTGS,,,,,,,,,,,,,,,,,,,,,,,,,,AOC,,,,,,,,,,,,,2,2695081,JAGAJJIBAN SETH,13-Dec-2024 03:09 PM,Rejected-Technical,Non-securing qualifying marks in the Point of Presentation as per DTCN Cl.110(m).,01-Feb-2025 07:02 PM,,,,,,,,,,,,,,,,,,,,,,,,,,,,,AOC
,,,,,,,,,,,,,,2.0,Finance,.xls,Bill of Quantity,,,,,,,,,,,,,,,,,,,,,,,,,,,,,,,,,,,,,,,,,,,AOC,,,,,,,,,,,,,3,2695163,KAPILENDRA SAHOO,13-Dec-2024 04:00 PM,Rejected-Finance,due to l3 bidder,04-Mar-2025 07:01 PM,,,,,,,,,,,,,,,,,,,,,,,,,,,,,AOC
,,,,,,,,,,,,,,,,,,,,,,,,,,,,,,,,,,,,,,,,,,,,,,,,,,,,,,,,,,,,AOC,,,,,,,,,,,,,4,2695206,OM PRAKASH KARAMCHAND DAS,13-Dec-2024 04:17 PM,Rejected-Technical,Non-securing qualifying marks in the Point of Presentation as per DTCN Cl.110(m).,01-Feb-2025 07:02 PM,,,,,,,,,,,,,,,,,,,,,,,,,,,,,AOC
,,,,,,,,,,,,,,,,,,,,,,,,,,,,,,,,,,,,,,,,,,,,,,,,,,,,,,,,,,,,AOC,,,,,,,,,,,,,5,2693001,SRI SADHU NIMIKA,11-Dec-2024 08:37 PM,Accepted-AOC,qualified bidder,04-Mar-2025 07:05 PM,,,,,,,,,,,,,,,,,,,,,,,,,,,,,AOC
,,,,,,,,,,,,,,,,,,,,,,,,,,,,,,,,,,,,,,,,,,,,,,,,,,,,,,,,,,,,AOC,,,,,,,,,,,,,6,2690679,T. Srinivas Rao,09-Dec-2024 08:55 PM,Rejected-Finance,l1 bidder but l2 bidder is sc bidder,04-Mar-2025 07:01 PM,,,,,,,,,,,,,,,,,,,,,,,,,,,,,AOC
