Organisation Chain,Tender Reference Number,Tender ID,Withdrawal Allowed,Tender Type,Form of contract,Tender Category,No. of Covers,General Technical Evaluation Allowed,ItemWise Technical Evaluation Allowed,Payment Mode,Is Multi Currency Allowed For BOQ,Is Multi Currency Allowed For Fee,Allow Two Stage Bidding,Cover No,Cover,Document Type,Description,Publish Date,Bid Opening Date,Document Download / Sale Start Date,Document Download / Sale End Date,Clarification Start Date,Clarification End Date,Bid Submission Start Date,Bid Submission End Date,EMD Amount in ₹,EMD Exemption Allowed,EMD Fee Type,EMD Percentage,EMD Payable To,EMD Payable At,S.No,Bank Name,Tender Fee in ₹,Fee Payable To,Fee Payable At,Tender Fee Exemption Allowed,Name,Address,Title,Work Description,Pre Qualification Details,Independent External Monitor/Remarks,Tender Value in ₹,Product Category,Sub category,Contract Type,Bid Validity(Days),Period Of Work(Days),Location,Pincode,Pre Bid Meeting Place,Pre Bid Meeting Address,Pre Bid Meeting Date,Bid Opening Place,Should Allow NDA Tender,Allow Preferential Bidder,Tender Stage,Contract Date :,Contract Value :,Work Completion Period in days :,Updated By :,Updated on :,AOC document :,AOC Description :,S.No,Bid Number,Bidder Name,Awarded Currency,Awarded Value,S.No.1,Bid Number.1,Bidder Name.1,Submitted Date,Status,Remarks,Status Updated On,Type :,Summary :,Updated By :.1,Updated On :,Document :,BOQ Comparative Chart :,Committee Chairperson/Co-ordinator Name :,Committee Chairperson/Co-ordinator Type :,Committee Members :,Updated By :.2,Updated on :.1,Document :.1,Organisation Chain :,Tender ID :,Tender Ref No :,Tender Title :,Committee Chairperson/Co-ordinator Name :.1,Committee Chairperson/Co-ordinator Type :.1,Committee Members :.1,Updated By :.3,Updated On :.1,Document :.2,Tender Stage
Forest Environment and Climate Change Department||CCF T AND D CUTTACK||Sliviculturist Rayagada,SILVA-RGDA-02/2024-25,2024_SLRAY_108742_1,Yes,Open Tender,Percentage,Works,1.0,No,No,Online,No,No,No,1.0,Fee/PreQual/Technical/Finance,.pdf,DTCN,26-Dec-2024 11:00 AM,06-Jan-2025 11:00 AM,26-Dec-2024 11:00 AM,05-Jan-2025 05:00 PM,26-Dec-2024 11:00 AM ,05-Jan-2025 05:00 PM ,26-Dec-2024 11:00 AM,05-Jan-2025 05:00 PM,"17,085",Yes,percentage,1.0%,Nil,Nil,1.0,ICICI BANK,"6,000",Nil,Nil,No,"Silviculturist, Rayagada","Office of the Silviculturist, Silviculture Divison,Rayagada, Goutam Nagar 6th Lane, Raniguda Farm, Rayagada","Construction of Forester Quarter at Koraput Research Range, Koraput","Construction of Forester Quarter at Koraput Research Range, Koraput",Please refer DTCN  ,NA ,"17,08,480",Civil Works - Buildings,Forester Quarter ,Tender,90.0,90.0,Koraput,764020.0,NA ,NA ,NA ,"Oothe Silviculturist,Silviculture Divison,Rayagada",No ,No,AOC,13-Mar-2025,"INR 1,452,379",90.0,Arun Kumar Biswal,17-Mar-2025 10:43 AM,Workorder.pdf (967.00 KB),Award of contract,1.0,2730657.0,JAGYASENI TURUK,INR,"1,452,379",1,2726774,HEMANT KUMAR NAYAK,05-Jan-2025 02:59 PM,Rejected-Finance,Second lowest Bidder,23-Jan-2025 11:55 AM,Finance,Tender Openning,Arun Kumar Biswal,13-Jan-2025 03:32 PM,finance_521852.pdf,BOQ Comparative Chart,"Sri A.K. Biswal, Silva",Mixed,"Sri T.K. Behera, ACF, Executive Officer R and B, Sri P.C. Rath, Dy. Ranger,Sri S.C.Das, Sr. Assit",Arun Kumar Biswal,23-Jan-2025 11:55 AM,finsummary_521852.pdf (391.99 KB),Forest Environment and Climate Change Department||CCF T AND D CUTTACK||Sliviculturist Rayagada,2024_SLRAY_108742_1,SILVA-RGDA-02/2024-25,"Construction of Forester Quarter at Koraput Research Range, Koraput","Sri A.K Biswal,Silviculturist",Mixed,"Sri Tapas Kumar Behera,ACF, Executive Engineer, RandB, Sri P.C.Rath, Dy. Ranger, Sri S.C. Das,Sr. Assit",Arun Kumar Biswal,23-Jan-2025 11:47 AM,techsummary_521852.pdf (392.00 KB),AOC
,,,,,,,,,,,,,,,,.pdf,Drawing,,,,,,,,,,,,,,,2.0,ICICI NEFT/RTGS,,,,,,,,,,,,,,,,,,,,,,,,,AOC,,,,,,,,,,,,,2,2730657,JAGYASENI TURUK,05-Jan-2025 04:51 PM,Accepted-AOC,L1 by Lottery system,17-Mar-2025 10:43 AM,,,,,,,,,,,,,,,,,,,,,,,AOC
,,,,,,,,,,,,,,,,.xls,BoQ,,,,,,,,,,,,,,,,,,,,,,,,,,,,,,,,,,,,,,,,,AOC,,,,,,,,,,,,,3,2729686,LABANYA KUMAR MALICK,05-Jan-2025 04:54 PM,Rejected-Technical,Non submission of Lease Agreement,23-Jan-2025 11:47 AM,,,,,,,,,,,,,,,,,,,,,,,AOC
,,,,,,,,,,,,,,,,,,,,,,,,,,,,,,,,,,,,,,,,,,,,,,,,,,,,,,,,,,AOC,,,,,,,,,,,,,4,2727120,SUJATA PATNAIK,04-Jan-2025 08:34 AM,Rejected-AOC,L1,17-Mar-2025 10:43 AM,,,,,,,,,,,,,,,,,,,,,,,AOC
,,,,,,,,,,,,,,,,,,,,,,,,,,,,,,,,,,,,,,,,,,,,,,,,,,,,,,,,,,AOC,,,,,,,,,,,,,5,2730568,SURAMA ENTERPRISES,05-Jan-2025 04:01 PM,Rejected-AOC,L1,17-Mar-2025 10:43 AM,,,,,,,,,,,,,,,,,,,,,,,AOC
