Organisation Chain,Tender Reference Number,Tender ID,Withdrawal Allowed,Tender Type,Form of contract,Tender Category,No. of Covers,General Technical Evaluation Allowed,ItemWise Technical Evaluation Allowed,Payment Mode,Is Multi Currency Allowed For BOQ,Is Multi Currency Allowed For Fee,Allow Two Stage Bidding,Cover No,Cover,Document Type,Description,Publish Date,Bid Opening Date,Document Download / Sale Start Date,Document Download / Sale End Date,Clarification Start Date,Clarification End Date,Bid Submission Start Date,Bid Submission End Date,EMD Amount in ₹,EMD Exemption Allowed,EMD Fee Type,EMD Percentage,EMD Payable To,EMD Payable At,S.No,Bank Name,Tender Fee in ₹,VAT Charges in ₹,Fee Payable To,Fee Payable At,Tender Fee Exemption Allowed,Name,Address,Title,Work Description,Pre Qualification Details,Independent External Monitor/Remarks,Tender Value in ₹,Product Category,Sub category,Contract Type,Bid Validity(Days),Period Of Work(Days),Location,Pincode,Pre Bid Meeting Place,Pre Bid Meeting Address,Pre Bid Meeting Date,Bid Opening Place,Should Allow NDA Tender,Allow Preferential Bidder,Tender Stage,Contract Date :,Contract Value :,Work Completion Period in days :,Updated By :,Updated on :,AOC document :,AOC Description :,S.No,Bid Number,Bidder Name,Awarded Currency,Awarded Value,S.No.1,Bid Number.1,Bidder Name.1,Submitted Date,Status,Remarks,Status Updated On,Type :,Summary :,Updated By :.1,Updated On :,Document :,BOQ Comparative Chart :,Committee Chairperson/Co-ordinator Name :,Committee Chairperson/Co-ordinator Type :,Committee Members :,Updated By :.2,Updated on :.1,Document :.1,Organisation Chain :,Tender ID :,Tender Ref No :,Tender Title :,Tender Stage
"CE,Minor Irrigation,BBSR||SENMIC-SAMBALPUR||SAMBALPUR","SE,MID,SBP/12/2024-25",2025_CEMIB_110174_13,Yes,Open Tender,Percentage,Works,1.0,No,No,Online,No,No,No,1.0,Fee/PreQual/Technical/Finance,.pdf,"ScanCopy of Licence,GST PAN,BidCost,EMD,Afidavit,NoRelation other as per DTCN",05-Feb-2025 11:00 AM,14-Feb-2025 11:00 AM,05-Feb-2025 11:00 AM,13-Feb-2025 05:30 PM,NA ,NA ,05-Feb-2025 11:00 AM,13-Feb-2025 05:30 PM,"4,623",Yes,percentage,1.0%,Nil,Nil,1.0,ICICI BANK,"2,000",0.0,Nil,Nil,No,"SE, M.I.Division Sambalpur",At Motijharan PO B.S.S.Nagar Dist Sambalpur PIN 768001,Improvement to Balijori Check Dam in Rengali Block of Sambalpur District under Improvement to Check Dams for the year 2024-25.,Improvement to Balijori Check Dam in Rengali Block of Sambalpur District under Improvement to Check Dams for the year 2024-25.,"ScanCopy of Licence,GST PAN,BidCost,EMD,Afidavit,NoRelation other as per DTCN ",NA ,"4,62,261",Civil Works - Water Works,NA ,Tender,90.0,30.0,RENGALI,768212.0,NA ,NA ,NA ,"SE, M.I.Division Sambalpur",No ,No,AOC,04-Mar-2025,"INR 392,967.7",30.0,Kundan Singh Naik,25-Mar-2025 01:38 PM,13.pdf (417.00 KB),Work awarded to Sri Sandip Kumar Pattnaik C Class Contractor,1.0,2816167.0,SANDIP KUMAR PATTNAIK,INR,"392,967.7",1,2814109,CHANDRABHANU DASH,12-Feb-2025 06:40 PM,Rejected-AOC,Not Selected vide transparent lottery,25-Mar-2025 01:38 PM,Finance,Admitted,Kundan Singh Naik,20-Feb-2025 06:50 PM,finance_528505.pdf,BOQ Comparative Chart,SE,Internal,SONU KUMAR DAO ER P P SAHOO AE ESTIMATOR,Kundan Singh Naik,21-Feb-2025 12:40 PM,finsummary_528505.pdf (364.49 KB),"CE,Minor Irrigation,BBSR||SENMIC-SAMBALPUR||SAMBALPUR",2025_CEMIB_110174_13,"SE,MID,SBP/12/2024-25",Improvement to Balijori Check Dam in Rengali Block of Sambalpur District under Improvement to Check Dams for the year 2024-25.,AOC
,,,,,,,,,,,,,,,,.xls,BILL OF QUALITY,,,,,,,,,,,,,,,2.0,ICICI NEFT/RTGS,,,,,,,,,,,,,,,,,,,,,,,,,,AOC,,,,,,,,,,,,,2,2816038,PUSPANJALI DEHURI,13-Feb-2025 03:19 PM,Rejected-AOC,Not Selected vide transparent lottery,25-Mar-2025 01:38 PM,,,,,,,,,,,,,,,,,AOC
,,,,,,,,,,,,,,,,,,,,,,,,,,,,,,,,,,,,,,,,,,,,,,,,,,,,,,,,,,,AOC,,,,,,,,,,,,,3,2816205,SAMBIT KUMAR PATTNAIK,13-Feb-2025 04:43 PM,Rejected-AOC,Not Selected vide transparent lottery,25-Mar-2025 01:38 PM,,,,,,,,,,,,,,,,,AOC
,,,,,,,,,,,,,,,,,,,,,,,,,,,,,,,,,,,,,,,,,,,,,,,,,,,,,,,,,,,AOC,,,,,,,,,,,,,4,2808726,SANDHYARANI SAHU,12-Feb-2025 07:29 PM,Rejected-AOC,Not Selected vide transparent lottery,25-Mar-2025 01:38 PM,,,,,,,,,,,,,,,,,AOC
,,,,,,,,,,,,,,,,,,,,,,,,,,,,,,,,,,,,,,,,,,,,,,,,,,,,,,,,,,,AOC,,,,,,,,,,,,,5,2816167,SANDIP KUMAR PATTNAIK,13-Feb-2025 03:55 PM,Accepted-AOC,Selected vide transparent lottery,25-Mar-2025 01:38 PM,,,,,,,,,,,,,,,,,AOC
