Organisation Chain,Tender Reference Number,Tender ID,Withdrawal Allowed,Tender Type,Form of contract,Tender Category,No. of Covers,General Technical Evaluation Allowed,ItemWise Technical Evaluation Allowed,Payment Mode,Is Multi Currency Allowed For BOQ,Is Multi Currency Allowed For Fee,Allow Two Stage Bidding,Cover No,Cover,Document Type,Description,Publish Date,Bid Opening Date,Document Download / Sale Start Date,Document Download / Sale End Date,Clarification Start Date,Clarification End Date,Bid Submission Start Date,Bid Submission End Date,Financial Bid Opening Date,EMD Amount in ₹,EMD Exemption Allowed,EMD Fee Type,EMD Percentage,EMD Payable To,EMD Payable At,S.No,Instrument Type,Tender Fee in ₹,Fee Payable To,Fee Payable At,Tender Fee Exemption Allowed,Name,Address,Title,Work Description,Pre Qualification Details,Independent External Monitor/Remarks,Tender Value in ₹,Product Category,Sub category,Contract Type,Bid Validity(Days),Period Of Work(Days),Location,Pincode,Pre Bid Meeting Place,Pre Bid Meeting Address,Pre Bid Meeting Date,Bid Opening Place,Should Allow NDA Tender,Allow Preferential Bidder,Tender Stage,Contract Date :,Contract Value :,Work Completion Period in days :,Updated By :,Updated on :,AOC document :,AOC Description :,S.No,Bid Number,Bidder Name,Awarded Currency,Awarded Value,S.No.1,Bid Number.1,Bidder Name.1,Submitted Date,Status,Remarks,Status Updated On,Type :,Summary :,Updated By :.1,Updated On :,Document :,BOQ Comparative Chart :,Committee Chairperson/Co-ordinator Name :,Committee Chairperson/Co-ordinator Type :,Committee Members :,Updated By :.2,Updated on :.1,Document :.1,Organisation Chain :,Tender ID :,Tender Ref No :,Tender Title :,Type :.1,Summary :.1,Updated By :.3,Updated On :.1,Document :.2,Committee Chairperson/Co-ordinator Name :.1,Committee Chairperson/Co-ordinator Type :.1,Committee Members :.1,Updated By :.4,Updated On :.2,Financial Bid Opening Date:,Document :.3,Tender Stage
Odisha University of Technology and Research,OUTR/SES/2024-25/17,2024_OUTR_108076_1,Yes,Open Tender,Item Rate,Goods,2.0,No,No,Offline,No,No,No,1.0,Fee/PreQual/Technical,.pdf,Technical Bid-I. This document contains all the technical specification for evaluation on technical,09-Dec-2024 06:00 PM,31-Dec-2024 11:00 AM,10-Dec-2024 10:00 AM,30-Dec-2024 06:00 PM,10-Dec-2024 10:00 AM ,12-Dec-2024 06:00 PM ,12-Dec-2024 06:00 PM,30-Dec-2024 06:00 PM,03-Feb-2025 11:00 AM,"18,600",Yes,fixed,,DDO OUTR,Bhubaneswar,1.0,DD - Demand Draft,"1,000",DDO OUTR,Bhubaneswar,Yes,Registrar,"OUTR, Ghatikia, Kalinganagar, Bhubaneswar",Various equipments for Measurement Techniques Laboratory of School of Electrical Sciences,"Various equipments for Measurement Techniques Laboratory of School of Electrical Sciences at Odisha University of Technology and Research, Bhubaneswar",Please refer Tender documents. ,NA ,,Laboratory and scientific equipment,NA ,Tender,90.0,NA ,"OUTR, Bhubaneswar",751029.0,NA ,NA ,NA ,"OUTR, BBSR",No ,No,AOC,29-Mar-2025,"INR 432,588",45.0,ULLASH KUMAR ROUT,26-Mar-2025 04:45 PM,OUTR-SES-2024-25-17-WorkOrder.pdf (3939.00 KB),Different equipment has different bidders as L1. So the work order is issues on the basis of the same and uploaded.,1.0,2711819.0,UTKAL SCIENTIFIC INSTRUMENTS,INR,"432,588",1,2716944,ELCO SCIENTIFIC,30-Dec-2024 05:49 PM,Rejected-Finance,L2 status on itmes,26-Mar-2025 04:40 PM,Finance,The tender has been opened for technical evaluation.,ULLASH KUMAR ROUT,12-Feb-2025 03:47 PM,,BOQ Comparative Chart,ProfLNTripathy,Internal,"ProfLBMajhi,ProfSMishra,ProfUKRout,ProfAKBarisal",ULLASH KUMAR ROUT,26-Mar-2025 04:40 PM,finsummary_519955.pdf (845.97 KB),Odisha University of Technology and Research,2024_OUTR_108076_1,OUTR/SES/2024-25/17,Various equipments for Measurement Techniques Laboratory of School of Electrical Sciences,Technical,Document is attached,ULLASH KUMAR ROUT,03-Jan-2025 12:51 PM,technical_519955.pdf,Prof L N Tripathy,Internal,"DrAKBarisal,DrUKRout,MrsMMishra,MrLMajhi",ULLASH KUMAR ROUT,31-Jan-2025 01:05 PM,03-Feb-2025 11:00 AM,techsummary_519955.pdf (435.92 KB),AOC
,,,,,,,,,,,,,,,,.xls,Financial Bid-II. This document contains all the financial information for evaluation.,,,,,,,,,,,,,,,,2.0,BC - Bankers Cheque,,,,,,,,,,,,,,,,,,,,,,,,,AOC,,,,,,,,2.0,2712868.0,VI MICROSYSTEMS PVT LTD,INR,"18,939",2,2716659,RASHMITA TRADERS,30-Dec-2024 01:07 PM,Accepted-AOC,L1 for five items.,26-Mar-2025 04:45 PM,,,,,,,,,,,,,,,,,,,,,,,,,,,,,AOC
,,,,,,,,,,,,,,2.0,Finance,.xls,Financial data sheet,,,,,,,,,,,,,,,,,,,,,,,,,,,,,,,,,,,,,,,,,,AOC,,,,,,,,3.0,2716659.0,RASHMITA TRADERS,INR,"149,860",3,2717595,Tesca Technologies Pvt. Ltd.,30-Dec-2024 05:15 PM,Accepted-AOC,L1 for one item,26-Mar-2025 04:45 PM,,,,,,,,,,,,,,,,,,,,,,,,,,,,,AOC
,,,,,,,,,,,,,,,,,,,,,,,,,,,,,,,,,,,,,,,,,,,,,,,,,,,,,,,,,,,AOC,,,,,,,,4.0,2717595.0,Tesca Technologies Pvt. Ltd.,INR,"1,803",4,2711819,UTKAL SCIENTIFIC INSTRUMENTS,26-Dec-2024 06:09 PM,Accepted-AOC,L1 for 17 items,26-Mar-2025 04:45 PM,,,,,,,,,,,,,,,,,,,,,,,,,,,,,AOC
,,,,,,,,,,,,,,,,,,,,,,,,,,,,,,,,,,,,,,,,,,,,,,,,,,,,,,,,,,,AOC,,,,,,,,,,,,,5,2712868,VI MICROSYSTEMS PVT LTD,26-Dec-2024 07:13 PM,Accepted-AOC,L1 for one item,26-Mar-2025 04:45 PM,,,,,,,,,,,,,,,,,,,,,,,,,,,,,AOC
