Organisation Chain,Tender Reference Number,Tender ID,Withdrawal Allowed,Tender Type,Form of contract,Tender Category,No. of Covers,General Technical Evaluation Allowed,ItemWise Technical Evaluation Allowed,Payment Mode,Is Multi Currency Allowed For BOQ,Is Multi Currency Allowed For Fee,Allow Two Stage Bidding,Cover No,Cover,Document Type,Description,Publish Date,Bid Opening Date,Document Download / Sale Start Date,Document Download / Sale End Date,Clarification Start Date,Clarification End Date,Bid Submission Start Date,Bid Submission End Date,EMD Amount in ₹,EMD Exemption Allowed,EMD Fee Type,EMD Percentage,EMD Payable To,EMD Payable At,S.No,Bank Name,Tender Fee in ₹,VAT Charges in ₹,Fee Payable To,Fee Payable At,Tender Fee Exemption Allowed,Name,Address,Title,Work Description,Pre Qualification Details,Independent External Monitor/Remarks,Tender Value in ₹,Product Category,Sub category,Contract Type,Bid Validity(Days),Period Of Work(Days),Location,Pincode,Pre Bid Meeting Place,Pre Bid Meeting Address,Pre Bid Meeting Date,Bid Opening Place,Should Allow NDA Tender,Allow Preferential Bidder,Tender Stage,Contract Date :,Contract Value :,Work Completion Period in days :,Updated By :,Updated on :,AOC document :,AOC Description :,S.No,Bid Number,Bidder Name,Awarded Currency,Awarded Value,S.No.1,Bid Number.1,Bidder Name.1,Submitted Date,Status,Remarks,Status Updated On,Type :,Summary :,Updated By :.1,Updated On :,Document :,BOQ Comparative Chart :,Committee Chairperson/Co-ordinator Name :,Committee Chairperson/Co-ordinator Type :,Committee Members :,Updated By :.2,Updated on :.1,Document :.1,Organisation Chain :,Tender ID :,Tender Ref No :,Tender Title :,Committee Chairperson/Co-ordinator Name :.1,Committee Chairperson/Co-ordinator Type :.1,Committee Members :.1,Updated By :.3,Updated On :.1,Document :.2,Tender Stage
"CE,Minor Irrigation,BBSR||SE,Eastern Minor Irr.Circle,Keonjhar||MI Division Jajpur",DMID/08/2024-25,2025_CEMIB_109622_6,Yes,Open Tender,Percentage,Works,1.0,No,No,Online,No,No,No,1.0,Fee/PreQual/Technical/Finance,.pdf,"Tender cost, EMD in online valid RC Valid GSTIN and PAN NRC Affidavit",20-Jan-2025 10:00 AM,04-Feb-2025 11:00 AM,20-Jan-2025 10:00 AM,03-Feb-2025 05:00 PM,NA ,NA ,20-Jan-2025 10:00 AM,03-Feb-2025 05:00 PM,"40,600",Yes,fixed,,Nil,Nil,1.0,ICICI BANK,"6,000",0.0,Nil,Nil,No,"S.E, MI Division, Dhenkanal","S.E, MI Division, Dhenkanal",Construction of Nadhera-II Check Dam over Nadhera Nalla village Nadhera in Odapada Block of Dhenkanal District under MATY Scheme for the year 2024-25,Construction of Nadhera-II Check Dam over Nadhera Nalla village Nadhera in Odapada Block of Dhenkanal District under MATY Scheme for the year 2024-25,Please refer Tender documents ,NA ,"40,54,857",Civil Works - Others,NA ,Tender,90.0,180.0,Dhenkanal,759001.0,NA ,NA ,NA ,"S.E, MI Division, Dhenkanal",No ,No,AOC,25-Mar-2025,"INR 3,447,034",180.0,Sanjay Kumar Behera,25-Mar-2025 03:06 PM,nadheraII.pdf (769.00 KB),Agreement done on date 25.02.2025,1.0,2795199.0,Simran Mohanty,INR,"3,447,034",1,2793038,ANTARJYAMI DEBATA,01-Feb-2025 05:22 PM,Rejected-Finance,Unsuccessful through Transparent lottery system,25-Mar-2025 03:02 PM,Finance,Opened,Seema Mohanty,04-Feb-2025 08:01 PM,finance_526507.pdf,BOQ Comparative Chart,Sanjay Kumar Behera,Internal,"Aman Mishra D.A.O, , Babita Nayak A.E.E (Est.), Seema Mohanty, A.E Estr",Sanjay Kumar Behera,25-Mar-2025 03:02 PM,finsummary_526507.pdf (365.28 KB),"CE,Minor Irrigation,BBSR||SE,Eastern Minor Irr.Circle,Keonjhar||MI Division Jajpur",2025_CEMIB_109622_6,DMID/08/2024-25,Construction of Nadhera-II Check Dam over Nadhera Nalla village Nadhera in Odapada Block of Dhenkanal District under MATY Scheme for the year 2024-25,Sanjay Kumar Behera,Internal,"Aman Mishra D.A.O, , Babita Nayak A.E.E (Est.), Seema Mohanty, A.E Estr",Sanjay Kumar Behera,25-Mar-2025 02:57 PM,techsummary_526507.pdf (365.28 KB),AOC
,,,,,,,,,,,,,,,,.pdf,Any other documents as per DTCN,,,,,,,,,,,,,,,2.0,ICICI NEFT/RTGS,,,,,,,,,,,,,,,,,,,,,,,,,,AOC,,,,,,,,,,,,,2,2793738,MANOJ KUMAR JENA,02-Feb-2025 04:18 PM,Rejected-Finance,Unsuccessful through Transparent lottery system,25-Mar-2025 03:02 PM,,,,,,,,,,,,,,,,,,,,,,,AOC
,,,,,,,,,,,,,,,,.xls,BOQ,,,,,,,,,,,,,,,,,,,,,,,,,,,,,,,,,,,,,,,,,,AOC,,,,,,,,,,,,,3,2794114,M/S RAJ SOHELI CONSTRUCTIONS,02-Feb-2025 09:08 PM,Rejected-Finance,Unsuccessful through Transparent lottery system,25-Mar-2025 03:02 PM,,,,,,,,,,,,,,,,,,,,,,,AOC
,,,,,,,,,,,,,,,,,,,,,,,,,,,,,,,,,,,,,,,,,,,,,,,,,,,,,,,,,,,AOC,,,,,,,,,,,,,4,2793251,PRASANTA KUMAR NAIK,01-Feb-2025 09:47 PM,Rejected-Finance,Unsuccessful through Transparent lottery system,25-Mar-2025 03:02 PM,,,,,,,,,,,,,,,,,,,,,,,AOC
,,,,,,,,,,,,,,,,,,,,,,,,,,,,,,,,,,,,,,,,,,,,,,,,,,,,,,,,,,,AOC,,,,,,,,,,,,,5,2795276,Ramdev Buildcon Prop Manasi Manjari Rout,03-Feb-2025 04:47 PM,Rejected-Finance,Unsuccessful through Transparent lottery system,25-Mar-2025 03:02 PM,,,,,,,,,,,,,,,,,,,,,,,AOC
,,,,,,,,,,,,,,,,,,,,,,,,,,,,,,,,,,,,,,,,,,,,,,,,,,,,,,,,,,,AOC,,,,,,,,,,,,,6,2795267,RAMNATH JANI,03-Feb-2025 04:32 PM,Rejected-Finance,Unsuccessful through Transparent lottery system,25-Mar-2025 03:02 PM,,,,,,,,,,,,,,,,,,,,,,,AOC
,,,,,,,,,,,,,,,,,,,,,,,,,,,,,,,,,,,,,,,,,,,,,,,,,,,,,,,,,,,AOC,,,,,,,,,,,,,7,2785355,SANTOSH PATTANAIK,29-Jan-2025 12:05 AM,Rejected-Finance,Unsuccessful through Transparent lottery system,25-Mar-2025 03:02 PM,,,,,,,,,,,,,,,,,,,,,,,AOC
,,,,,,,,,,,,,,,,,,,,,,,,,,,,,,,,,,,,,,,,,,,,,,,,,,,,,,,,,,,AOC,,,,,,,,,,,,,8,2795199,Simran Mohanty,03-Feb-2025 04:15 PM,Accepted-AOC,winner through transparent lottery system and work has been awarded,25-Mar-2025 03:07 PM,,,,,,,,,,,,,,,,,,,,,,,AOC
,,,,,,,,,,,,,,,,,,,,,,,,,,,,,,,,,,,,,,,,,,,,,,,,,,,,,,,,,,,AOC,,,,,,,,,,,,,9,2794183,SUSHIL KUMAR ROUTRAY,02-Feb-2025 10:26 PM,Rejected-Finance,Unsuccessful through Transparent lottery system,25-Mar-2025 03:02 PM,,,,,,,,,,,,,,,,,,,,,,,AOC
