Organisation Chain,Tender Reference Number,Tender ID,Withdrawal Allowed,Tender Type,Form of contract,Tender Category,No. of Covers,General Technical Evaluation Allowed,ItemWise Technical Evaluation Allowed,Payment Mode,Is Multi Currency Allowed For BOQ,Is Multi Currency Allowed For Fee,Allow Two Stage Bidding,Cover No,Cover,Document Type,Description,Publish Date,Bid Opening Date,Document Download / Sale Start Date,Document Download / Sale End Date,Clarification Start Date,Clarification End Date,Bid Submission Start Date,Bid Submission End Date,EMD Amount in ₹,EMD Exemption Allowed,EMD Fee Type,EMD Percentage,EMD Payable To,EMD Payable At,S.No,Bank Name,Tender Fee in ₹,VAT Charges in ₹,Fee Payable To,Fee Payable At,Tender Fee Exemption Allowed,Name,Address,Title,Work Description,Pre Qualification Details,Independent External Monitor/Remarks,Tender Value in ₹,Product Category,Sub category,Contract Type,Bid Validity(Days),Period Of Work(Days),Location,Pincode,Pre Bid Meeting Place,Pre Bid Meeting Address,Pre Bid Meeting Date,Bid Opening Place,Should Allow NDA Tender,Allow Preferential Bidder,Tender Stage,Contract Date :,Contract Value :,Work Completion Period in days :,Updated By :,Updated on :,AOC document :,AOC Description :,S.No,Bid Number,Bidder Name,Awarded Currency,Awarded Value,S.No.1,Bid Number.1,Bidder Name.1,Submitted Date,Status,Remarks,Status Updated On,Type :,Summary :,Updated By :.1,Updated On :,Document :,BOQ Comparative Chart :,Committee Chairperson/Co-ordinator Name :,Committee Chairperson/Co-ordinator Type :,Committee Members :,Updated By :.2,Updated on :.1,Document :.1,Organisation Chain :,Tender ID :,Tender Ref No :,Tender Title :,Committee Chairperson/Co-ordinator Name :.1,Committee Chairperson/Co-ordinator Type :.1,Committee Members :.1,Updated By :.3,Updated On :.1,Document :.2,Tender Stage
CE RW I||RW-CIRCLE-SUNDARGARH||RW-Division-Sundargarh II,Online -EERKL-38 of 2024-25,2025_CERWI_110568_1,Yes,Open Tender,Percentage,Works,1.0,No,No,Online,No,No,No,1.0,Fee/PreQual/Technical/Finance,.pdf,Affidavit Towards Authenticity of Documents,13-Feb-2025 11:00 AM,20-Feb-2025 09:00 AM,13-Feb-2025 11:00 AM,18-Feb-2025 05:00 PM,13-Feb-2025 11:00 AM ,17-Feb-2025 05:00 PM ,13-Feb-2025 11:00 AM,18-Feb-2025 05:00 PM,"8,410",Yes,fixed,,Nil,Nil,1.0,ICICI BANK,"4,000",0.0,Nil,Nil,No,"Ececutive Engineer, RW Division,Rourkela","Office of the Executive Engineer,RW Division,Rourk","Construction of Cycle Stand at R.W Sub-Division, Bonai for the year 2024-25","Construction of Cycle Stand at R.W Sub-Division, Bonai for the year 2024-25",Please refer Tender documents. ,NA ,"8,43,925",Civil Works - Buildings,NA ,Tender,90.0,60.0,ROURKELA,769004.0,NA ,NA ,NA ,"Office of the Executive Engineer,RW Division,Rourk",No ,No,AOC,19-Mar-2025,"INR 714,870",60.0,Kishore Chandra Khatua,19-Mar-2025 04:48 PM,01.pdf (497.00 KB),Awarded Cost,1.0,2823535.0,DEBENDRA KISAN,INR,"714,870",1,2822195,BINAPANI PATEL,17-Feb-2025 01:45 PM,Rejected-AOC,Rejected by the committee,19-Mar-2025 04:48 PM,Finance,5 bidders applied,Kishore Chandra Khatua,19-Mar-2025 04:40 PM,,BOQ Comparative Chart,"AE Estt, DAO, SE",Internal,"AE Estt, DAO, SE",Kishore Chandra Khatua,19-Mar-2025 04:45 PM,finsummary_529925.pdf (496.57 KB),CE RW I||RW-CIRCLE-SUNDARGARH||RW-Division-Sundargarh II,2025_CERWI_110568_1,Online -EERKL-38 of 2024-25,"Construction of Cycle Stand at R.W Sub-Division, Bonai for the year 2024-25","AE Estt, DAO, SE",Internal,"AE Estt, DAO, SE",Kishore Chandra Khatua,19-Mar-2025 04:42 PM,techsummary_529925.pdf (496.57 KB),AOC
,,,,,,,,,,,,,,,,.pdf,"PAN Card, GSTN, Registration Certificate another as per DTCN, Contact No",,,,,,,,,,,,,,,2.0,ICICI NEFT/RTGS,,,,,,,,,,,,,,,,,,,,,,,,,,AOC,,,,,,,,,,,,,2,2823535,DEBENDRA KISAN,18-Feb-2025 04:30 PM,Accepted-AOC,Awarded,19-Mar-2025 04:48 PM,,,,,,,,,,,,,,,,,,,,,,,AOC
,,,,,,,,,,,,,,,,.pdf,Affidavit Regarding no-relation certificate,,,,,,,,,,,,,,,,,,,,,,,,,,,,,,,,,,,,,,,,,,AOC,,,,,,,,,,,,,3,2822357,GANESH CONSTRUCTION PROP. GANESH SAHOO,17-Feb-2025 02:05 PM,Rejected-AOC,Rejected by the committee,19-Mar-2025 04:48 PM,,,,,,,,,,,,,,,,,,,,,,,AOC
,,,,,,,,,,,,,,,,.pdf,Affidavit Regarding correctness of information,,,,,,,,,,,,,,,,,,,,,,,,,,,,,,,,,,,,,,,,,,AOC,,,,,,,,,,,,,4,2823798,SHRIJAN KISHAN,18-Feb-2025 10:53 AM,Rejected-AOC,Rejected by the committee,19-Mar-2025 04:48 PM,,,,,,,,,,,,,,,,,,,,,,,AOC
,,,,,,,,,,,,,,,,.xls,BOQ,,,,,,,,,,,,,,,,,,,,,,,,,,,,,,,,,,,,,,,,,,AOC,,,,,,,,,,,,,5,2824443,SUMAN JAISWAL,18-Feb-2025 04:07 PM,Rejected-AOC,Rejected by the committee,19-Mar-2025 04:48 PM,,,,,,,,,,,,,,,,,,,,,,,AOC
