Organisation Chain,Tender Reference Number,Tender ID,Withdrawal Allowed,Tender Type,Form of contract,Tender Category,No. of Covers,General Technical Evaluation Allowed,ItemWise Technical Evaluation Allowed,Payment Mode,Is Multi Currency Allowed For BOQ,Is Multi Currency Allowed For Fee,Allow Two Stage Bidding,Cover No,Cover,Document Type,Description,Publish Date,Bid Opening Date,Document Download / Sale Start Date,Document Download / Sale End Date,Clarification Start Date,Clarification End Date,Bid Submission Start Date,Bid Submission End Date,EMD Amount in ₹,EMD Exemption Allowed,EMD Fee Type,EMD Percentage,EMD Payable To,EMD Payable At,S.No,Bank Name,Tender Fee in ₹,Fee Payable To,Fee Payable At,Tender Fee Exemption Allowed,Name,Address,Title,Work Description,Pre Qualification Details,Independent External Monitor/Remarks,Tender Value in ₹,Product Category,Sub category,Contract Type,Bid Validity(Days),Period Of Work(Days),Location,Pincode,Pre Bid Meeting Place,Pre Bid Meeting Address,Pre Bid Meeting Date,Bid Opening Place,Should Allow NDA Tender,Allow Preferential Bidder,Tender Stage,Contract Date :,Contract Value :,Work Completion Period in days :,Updated By :,Updated on :,AOC document :,S.No,Bid Number,Bidder Name,Awarded Currency,Awarded Value,S.No.1,Bid Number.1,Bidder Name.1,Submitted Date,Status,Remarks,Status Updated On,Type :,Summary :,Updated By :.1,Updated On :,Document :,BOQ Comparative Chart :,Committee Chairperson/Co-ordinator Name :,Committee Chairperson/Co-ordinator Type :,Committee Members :,Updated By :.2,Updated on :.1,Document :.1,Organisation Chain :,Tender ID :,Tender Ref No :,Tender Title :,Committee Chairperson/Co-ordinator Name :.1,Committee Chairperson/Co-ordinator Type :.1,Committee Members :.1,Updated By :.3,Updated On :.1,Document :.2,Tender Stage
Panchayati Raj and Drinking Water Department Odisha||Zilla Parisad Puri||KANAS Block,02/2024-25/KANAS BLOCK,2025_ZPKAN_109225_7,Yes,Open Tender,Percentage,Works,1.0,No,No,Online,No,No,No,1.0,Fee/PreQual/Technical/Finance,.pdf,"GSTIN,PAN,CONTRACTOR RC",22-Jan-2025 01:00 PM,01-Feb-2025 12:00 PM,22-Jan-2025 01:00 PM,31-Jan-2025 05:00 PM,22-Jan-2025 01:00 PM ,31-Jan-2025 05:00 PM ,22-Jan-2025 01:00 PM,31-Jan-2025 05:00 PM,"9,387",Yes,fixed,,Nil,Nil,1.0,ICICI BANK,"4,720",Nil,Nil,No,BDO KANAS,PANCHAYAT SAMITI KANAS,CONSTRUCTION OF ADDITIONAL CLASS ROOM AT GADAMATIAPADA NUASAHI PROJECT PRY SCHOOL,CONSTRUCTION OF ADDITIONAL CLASS ROOM AT GADAMATIAPADA NUASAHI PROJECT PRY SCHOOL,Please refer Tender documents. ,NA ,"9,38,720",Civil Works - Buildings,NA ,Tender,120.0,60.0,PANCHAYAT SAMITI KANAS,752017.0,NA ,NA ,NA ,PANCHAYAT SAMITI KANAS,No ,No,AOC,14-Mar-2025,"INR 798,006",60.0,NARAYAN SAHU,13-Mar-2025 10:47 PM,gadamatiapadaacragreement.pdf (591.00 KB),1.0,2791713.0,M/S GANESWAR SENAPATI,INR,"798,006",1,2786035,Bajrangi Electrical Construction and Services,29-Jan-2025 07:48 PM,Rejected-AOC,LOST LOTTERY,13-Mar-2025 10:47 PM,Finance,BIDS ARE SENT FOR TECHNICAL BID EVALUATION AND FINANCIAL BID EVALUATION,SASWAT KUMAR SENAPATI,03-Feb-2025 10:24 PM,,BOQ Comparative Chart,BDO KANAS,Internal,,NARAYAN SAHU,13-Mar-2025 10:27 PM,finsummary_526927.pdf (2263.95 KB),Panchayati Raj and Drinking Water Department Odisha||Zilla Parisad Puri||KANAS Block,2025_ZPKAN_109225_7,02/2024-25/KANAS BLOCK,CONSTRUCTION OF ADDITIONAL CLASS ROOM AT GADAMATIAPADA NUASAHI PROJECT PRY SCHOOL,BDO KANAS,Internal,,NARAYAN SAHU,13-Mar-2025 09:16 PM,techsummary_526927.pdf (2263.95 KB),AOC
,,,,,,,,,,,,,,,,.pdf,"AFFIDAVIT,UNDERTAKINGS AND ANY OTHER DOCUMENT AS PER DTCN",,,,,,,,,,,,,,,2.0,ICICI NEFT/RTGS,,,,,,,,,,,,,,,,,,,,,,,,,AOC,,,,,,,,,,,,2,2787472,LIPUN TRADERS,29-Jan-2025 07:10 PM,Rejected-AOC,LOST LOTTERY,13-Mar-2025 10:47 PM,,,,,,,,,,,,,,,,,,,,,,,AOC
,,,,,,,,,,,,,,,,.xls,BOQ,,,,,,,,,,,,,,,,,,,,,,,,,,,,,,,,,,,,,,,,,AOC,,,,,,,,,,,,3,2791713,M/S GANESWAR SENAPATI,31-Jan-2025 03:37 PM,Accepted-AOC,WON LOTTERY,13-Mar-2025 10:47 PM,,,,,,,,,,,,,,,,,,,,,,,AOC
,,,,,,,,,,,,,,,,,,,,,,,,,,,,,,,,,,,,,,,,,,,,,,,,,,,,,,,,,,AOC,,,,,,,,,,,,4,2780771,M S SUBHALAXMI INFRASTRUCTURE,30-Jan-2025 06:43 PM,Rejected-AOC,LOST LOTTERY,13-Mar-2025 10:47 PM,,,,,,,,,,,,,,,,,,,,,,,AOC
,,,,,,,,,,,,,,,,,,,,,,,,,,,,,,,,,,,,,,,,,,,,,,,,,,,,,,,,,,AOC,,,,,,,,,,,,5,2782292,SOVALAXMI SAHOO,29-Jan-2025 06:21 AM,Rejected-AOC,LOST LOTTERY,13-Mar-2025 10:47 PM,,,,,,,,,,,,,,,,,,,,,,,AOC
