Organisation Chain,Tender Reference Number,Tender ID,Withdrawal Allowed,Tender Type,Form of contract,Tender Category,No. of Covers,General Technical Evaluation Allowed,ItemWise Technical Evaluation Allowed,Payment Mode,Is Multi Currency Allowed For BOQ,Is Multi Currency Allowed For Fee,Allow Two Stage Bidding,Cover No,Cover,Document Type,Description,Publish Date,Bid Opening Date,Document Download / Sale Start Date,Document Download / Sale End Date,Clarification Start Date,Clarification End Date,Bid Submission Start Date,Bid Submission End Date,Financial Bid Opening Date,EMD Amount in ₹,EMD Exemption Allowed,EMD Fee Type,EMD Percentage,EMD Payable To,EMD Payable At,S.No,Bank Name,Tender Fee in ₹,VAT Charges in ₹,Fee Payable To,Fee Payable At,Tender Fee Exemption Allowed,Name,Address,Title,Work Description,Pre Qualification Details,Independent External Monitor/Remarks,Tender Value in ₹,Product Category,Sub category,Contract Type,Bid Validity(Days),Period Of Work(Days),Location,Pincode,Pre Bid Meeting Place,Pre Bid Meeting Address,Pre Bid Meeting Date,Bid Opening Place,Should Allow NDA Tender,Allow Preferential Bidder,Tender Stage,Contract Date :,Contract Value :,Work Completion Period in days :,Updated By :,Updated on :,AOC document :,AOC Description :,S.No,Bid Number,Bidder Name,Awarded Currency,Awarded Value,S.No.1,Bid Number.1,Bidder Name.1,Submitted Date,Status,Remarks,Status Updated On,Type :,Summary :,Updated By :.1,Updated On :,Document :,BOQ Comparative Chart :,Committee Chairperson/Co-ordinator Name :,Committee Chairperson/Co-ordinator Type :,Committee Members :,Updated By :.2,Updated on :.1,Document :.1,Organisation Chain :,Tender ID :,Tender Ref No :,Tender Title :,Type :.1,Summary :.1,Updated By :.3,Updated On :.1,Document :.2,Committee Chairperson/Co-ordinator Name :.1,Committee Chairperson/Co-ordinator Type :.1,Committee Members :.1,Updated By :.4,Updated On :.2,Financial Bid Opening Date:,Document :.3,Tender Stage
Orissa State Police Housing and Welfare Corporation Ltd,01/OPHWC/2025-26,2025_OSPHW_112149_38,Yes,National Competitive Bid,Percentage,Works,2.0,No,No,Online,No,No,No,1.0,Fee/PreQual/Technical,.pdf,"GST, GSTR-1, PAN, Contractor Registration Certificate and Affidavit",05-Apr-2025 06:55 PM,21-Apr-2025 10:30 AM,05-Apr-2025 06:55 PM,19-Apr-2025 05:00 PM,NA ,NA ,05-Apr-2025 06:55 PM,19-Apr-2025 05:00 PM,09-Jun-2025 10:30 AM,"1,08,200",Yes,fixed,,Nil,Nil,1.0,ICICI BANK,"11,800",0.0,Nil,Nil,No,CHIEF ENGINEER OPHWC,OPHWC BHUBANESWAR,Constn. of 3 nos. F type staff quarters at Madanpur Rampur Fire Station in Kalahandi District,Building Work,Please refer Tender documents  ,NA ,"1,08,18,836",Civil Works - Buildings,NA ,Tender,90.0,240.0,Kalahandi,751022.0,NA ,NA ,NA ,OPHWC BHUBANESWAR,No ,No,AOC,03-Jul-2025,"INR 9,197,092.35",240.0,Bikram Keshari Malla,03-Jul-2025 07:35 PM,ACCCCEPPTY.pdf (419.00 KB),AWARDED AS L1 TENDERER AND AWARDED ON DATE 24.06.2025,1.0,2888542.0,Prakash Chandra Panda,INR,"9,197,092.35",1,2884352,DEBASISH MOHANTY,17-Apr-2025 02:20 PM,Rejected-Finance,DUE TO L3 BIDDER,03-Jul-2025 07:30 PM,Finance,FINANCIAL BID OPENED,Bikram Keshari Malla,09-Jun-2025 11:51 AM,,BOQ Comparative Chart,AS PER AS ACCEPTANCE LETTER,Internal,AS PER AS ACCEPTANCE LETTER,Bikram Keshari Malla,03-Jul-2025 07:30 PM,finsummary_535356.pdf (418.80 KB),Orissa State Police Housing and Welfare Corporation Ltd,2025_OSPHW_112149_38,01/OPHWC/2025-26,Constn. of 3 nos. F type staff quarters at Madanpur Rampur Fire Station in Kalahandi District,Technical,seven bidder have participated,Bikram Keshari Malla,25-Apr-2025 11:03 AM,,AS PER TC MINUTES,Internal,AS PER TC MINUTES,BIBHUTI BHUSHAN NAIK,06-Jun-2025 07:24 PM,09-Jun-2025 10:30 AM,techsummary_535356.pdf (191.68 KB),AOC
,,,,,,,,,,,,,,,,.pdf,Other Document as per DTCN,,,,,,,,,,,,,,,,2.0,ICICI NEFT/RTGS,,,,,,,,,,,,,,,,,,,,,,,,,,AOC,,,,,,,,,,,,,2,2888504,DILLIP KUMAR MISHRA,19-Apr-2025 12:07 PM,Rejected-Technical,Absent in the Point of Presentation as per DTCN Cl.110(m).,06-Jun-2025 07:24 PM,,,,,,,,,,,,,,,,,,,,,,,,,,,,,AOC
,,,,,,,,,,,,,,2.0,Finance,.xls,Bill of Quantity,,,,,,,,,,,,,,,,,,,,,,,,,,,,,,,,,,,,,,,,,,,AOC,,,,,,,,,,,,,3,2888849,GHANA SHYAMA PALEI,19-Apr-2025 03:56 PM,Rejected-Finance,DUE TO L4 BIDDER,03-Jul-2025 07:30 PM,,,,,,,,,,,,,,,,,,,,,,,,,,,,,AOC
,,,,,,,,,,,,,,,,,,,,,,,,,,,,,,,,,,,,,,,,,,,,,,,,,,,,,,,,,,,,AOC,,,,,,,,,,,,,4,2887847,JAI BAJRANGBALI INFRA,18-Apr-2025 12:39 PM,Rejected-Finance,DUE TO L4 BIDDER,03-Jul-2025 07:30 PM,,,,,,,,,,,,,,,,,,,,,,,,,,,,,AOC
,,,,,,,,,,,,,,,,,,,,,,,,,,,,,,,,,,,,,,,,,,,,,,,,,,,,,,,,,,,,AOC,,,,,,,,,,,,,5,2888542,Prakash Chandra Panda,19-Apr-2025 11:50 AM,Accepted-AOC,QUALIFIED BIDDER,03-Jul-2025 07:35 PM,,,,,,,,,,,,,,,,,,,,,,,,,,,,,AOC
,,,,,,,,,,,,,,,,,,,,,,,,,,,,,,,,,,,,,,,,,,,,,,,,,,,,,,,,,,,,AOC,,,,,,,,,,,,,6,2888683,SHASHIRAM MANGARAJ,19-Apr-2025 02:04 PM,Rejected-Technical,Non-securing qualifying marks in the Point of Presentation as per DTCN Cl.110(m).,06-Jun-2025 07:24 PM,,,,,,,,,,,,,,,,,,,,,,,,,,,,,AOC
,,,,,,,,,,,,,,,,,,,,,,,,,,,,,,,,,,,,,,,,,,,,,,,,,,,,,,,,,,,,AOC,,,,,,,,,,,,,7,2888219,T. Srinivas Rao,18-Apr-2025 07:49 PM,Rejected-Finance,DUE TO L2 BIDDER,03-Jul-2025 07:30 PM,,,,,,,,,,,,,,,,,,,,,,,,,,,,,AOC
