Organisation Chain,Tender Reference Number,Tender ID,Withdrawal Allowed,Tender Type,Form of contract,Tender Category,No. of Covers,General Technical Evaluation Allowed,ItemWise Technical Evaluation Allowed,Payment Mode,Is Multi Currency Allowed For BOQ,Is Multi Currency Allowed For Fee,Allow Two Stage Bidding,Cover No,Cover,Document Type,Description,Publish Date,Bid Opening Date,Document Download / Sale Start Date,Document Download / Sale End Date,Clarification Start Date,Clarification End Date,Bid Submission Start Date,Bid Submission End Date,Financial Bid Opening Date,EMD Amount in ₹,EMD Exemption Allowed,EMD Fee Type,EMD Percentage,EMD Payable To,EMD Payable At,S.No,Bank Name,Tender Fee in ₹,VAT Charges in ₹,Fee Payable To,Fee Payable At,Tender Fee Exemption Allowed,Name,Address,Title,Work Description,Pre Qualification Details,Independent External Monitor/Remarks,Tender Value in ₹,Product Category,Sub category,Contract Type,Bid Validity(Days),Period Of Work(Days),Location,Pincode,Pre Bid Meeting Place,Pre Bid Meeting Address,Pre Bid Meeting Date,Bid Opening Place,Should Allow NDA Tender,Allow Preferential Bidder,Tender Stage,Contract Date :,Contract Value :,Work Completion Period in days :,Updated By :,Updated on :,AOC document :,AOC Description :,S.No,Bid Number,Bidder Name,Awarded Currency,Awarded Value,S.No.1,Bid Number.1,Bidder Name.1,Submitted Date,Status,Remarks,Status Updated On,Type :,Summary :,Updated By :.1,Updated On :,Document :,BOQ Comparative Chart :,Committee Chairperson/Co-ordinator Name :,Committee Chairperson/Co-ordinator Type :,Committee Members :,Updated By :.2,Updated on :.1,Document :.1,Organisation Chain :,Tender ID :,Tender Ref No :,Tender Title :,Type :.1,Summary :.1,Updated By :.3,Updated On :.1,Document :.2,Committee Chairperson/Co-ordinator Name :.1,Committee Chairperson/Co-ordinator Type :.1,Committee Members :.1,Updated By :.4,Updated On :.2,Financial Bid Opening Date:,Document :.3,Tender Stage
CE RW I||RWCIRCLE-CUTTACK,Tender Online RWC - 23/24,2025_CERWI_109425_3,Yes,National Competitive Bid,Percentage,Works,2.0,No,No,Online,No,No,No,1.0,Fee/PreQual/Technical,.pdf,"Tender Paper Cost, EMD, GSTIN, RC, PAN, Registration Certificate, Labor License, No Relationship",15-Jan-2025 06:55 PM,28-Jan-2025 11:30 AM,15-Jan-2025 06:55 PM,27-Jan-2025 05:00 PM,15-Jan-2025 06:55 PM ,27-Jan-2025 02:00 PM ,15-Jan-2025 06:55 PM,27-Jan-2025 05:00 PM,25-Feb-2025 05:30 PM,"8,03,723",Yes,percentage,1.0%,Nil,Nil,1.0,ICICI BANK,"10,000",0.0,Nil,Nil,No,"C.C.E.R.W. Circle, Cuttack","C.C.E.R.W. Circle, Cuttack",Improvement to Baratha Kuanpala road under MMSY-Improvement to Existing RD Road in the dist of Cuttack for the year 2024-25,road works,Please refer Tender documents. ,NA ,"8,03,72,300",Civil Works - Roads,NA ,Tender,90.0,360.0,Cuttack,753004.0,NA ,NA ,NA ,"C.C.E.R.W. Circle, Cuttack",No ,No,AOC,28-Jul-2025,"INR 68,324,485",360.0,Ajay Kumar Behera,28-Jul-2025 12:58 PM,agmt.pdf (300.00 KB),Agmt drawn,1.0,2772873.0,Kamal Lochan Das,INR,"71,804,605.17",1,2780346,DPS CONSTRUCTION PRIVATE LIMITED,27-Jan-2025 01:05 PM,Accepted-AOC,Sucessful bidder,28-Jul-2025 12:58 PM,Finance,total 6 nos document downloaded,Ajay Kumar Behera,25-Feb-2025 06:10 PM,,BOQ Comparative Chart,C.C.E.R.W.Circle.Cuttack,Internal,EE RW Division-II Cuttack DAO RW Division Cuttack PA to CCE,Ajay Kumar Behera,13-Mar-2025 05:07 PM,finsummary_525788.pdf (80.76 KB),CE RW I||RWCIRCLE-CUTTACK,2025_CERWI_109425_3,Tender Online RWC - 23/24,Improvement to Baratha Kuanpala road under MMSY-Improvement to Existing RD Road in the dist of Cuttack for the year 2024-25,Technical,total 6 nos document downloaded,SOMANATHA PARIDA,05-Feb-2025 05:41 PM,,C.C.E.R.W.Circle Cuttack,Internal,EE RW Division-II Cuttack DAO RW Division Cuttack PA to CCE,Ajay Kumar Behera,22-Feb-2025 01:17 PM,25-Feb-2025 05:30 PM,techsummary_525788.pdf (1334.71 KB),AOC
,,,,,,,,,,,,,,,,.pdf,"Affidavit of Correctness Certificate undertaking duly filled, all affidavits",,,,,,,,,,,,,,,,2.0,ICICI NEFT/RTGS,,,,,,,,,,,,,,,,,,,,,,,,,,AOC,,,,,,,,2.0,2780346.0,DPS CONSTRUCTION PRIVATE LIMITED,INR,"68,324,485",2,2778784,HIMANSU SEKHAR SWAIN,27-Jan-2025 02:19 PM,Rejected-Finance,Unsuccessful bidder,13-Mar-2025 05:07 PM,,,,,,,,,,,,,,,,,,,,,,,,,,,,,AOC
,,,,,,,,,,,,,,,,.pdf,"A.T.O from CA, Similar Nature of Work Experience Certificate, Work in Hand Machineries followed by",,,,,,,,,,,,,,,,,,,,,,,,,,,,,,,,,,,,,,,,,,,AOC,,,,,,,,,,,,,3,2772873,Kamal Lochan Das,26-Jan-2025 06:36 AM,Accepted-AOC,Unsucessful bidder,28-Jul-2025 12:58 PM,,,,,,,,,,,,,,,,,,,,,,,,,,,,,AOC
,,,,,,,,,,,,,,2.0,Finance,.xls,Bill of Quantity,,,,,,,,,,,,,,,,,,,,,,,,,,,,,,,,,,,,,,,,,,,AOC,,,,,,,,,,,,,4,2764905,M/S GOURAV CONTRUCTION,26-Jan-2025 07:03 PM,Rejected-Finance,Unsuccessful bidder,13-Mar-2025 05:07 PM,,,,,,,,,,,,,,,,,,,,,,,,,,,,,AOC
,,,,,,,,,,,,,,,,,,,,,,,,,,,,,,,,,,,,,,,,,,,,,,,,,,,,,,,,,,,,AOC,,,,,,,,,,,,,5,2778098,SRI BANSHIDHAR PANDA,26-Jan-2025 10:17 PM,Rejected-Finance,Unsuccessful bidder,13-Mar-2025 05:07 PM,,,,,,,,,,,,,,,,,,,,,,,,,,,,,AOC
,,,,,,,,,,,,,,,,,,,,,,,,,,,,,,,,,,,,,,,,,,,,,,,,,,,,,,,,,,,,AOC,,,,,,,,,,,,,6,2770436,SRI RABINDRA KUMAR SAHOO,25-Jan-2025 12:59 PM,Rejected-Finance,Unsuccessful bidder,13-Mar-2025 05:07 PM,,,,,,,,,,,,,,,,,,,,,,,,,,,,,AOC
