Organisation Chain,Tender Reference Number,Tender ID,Withdrawal Allowed,Tender Type,Form of contract,Tender Category,No. of Covers,General Technical Evaluation Allowed,ItemWise Technical Evaluation Allowed,Payment Mode,Is Multi Currency Allowed For BOQ,Is Multi Currency Allowed For Fee,Allow Two Stage Bidding,Cover No,Cover,Document Type,Description,Publish Date,Bid Opening Date,Document Download / Sale Start Date,Document Download / Sale End Date,Clarification Start Date,Clarification End Date,Bid Submission Start Date,Bid Submission End Date,Financial Bid Opening Date,EMD Amount in ₹,EMD Exemption Allowed,EMD Fee Type,EMD Percentage,EMD Payable To,EMD Payable At,S.No,Corrigendum Title,Corrigendum Type,View,S.No.1,Bank Name,Tender Fee in ₹,Fee Payable To,Fee Payable At,Tender Fee Exemption Allowed,Name,Address,Title,Work Description,Pre Qualification Details,Independent External Monitor/Remarks,Tender Value in ₹,Product Category,Sub category,Contract Type,Bid Validity(Days),Period Of Work(Days),Location,Pincode,Pre Bid Meeting Place,Pre Bid Meeting Address,Pre Bid Meeting Date,Bid Opening Place,Should Allow NDA Tender,Allow Preferential Bidder,Tender Stage,Contract Date :,Contract Value :,Work Completion Period in days :,Updated By :,Updated on :,AOC document :,AOC Description :,S.No,Bid Number,Bidder Name,Awarded Currency,Awarded Value,S.No.1,Bid Number.1,Bidder Name.1,Submitted Date,Status,Remarks,Status Updated On,Type :,Summary :,Updated By :.1,Updated On :,Document :,BOQ Comparative Chart :,Committee Chairperson/Co-ordinator Name :,Committee Chairperson/Co-ordinator Type :,Committee Members :,Updated By :.2,Updated on :.1,Document :.1,Organisation Chain :,Tender ID :,Tender Ref No :,Tender Title :,Type :.1,Summary :.1,Updated By :.3,Updated On :.1,Document :.2,Committee Chairperson/Co-ordinator Name :.1,Committee Chairperson/Co-ordinator Type :.1,Committee Members :.1,Updated By :.4,Updated On :.2,Financial Bid Opening Date:,Document :.3,Tender Stage
ODISHA CONSTRUCTION CORPORATION LTD,Bid identification No. OCCL-CGP/12/2024-25,2024_OCCL_103351_1,Yes,Open Tender,Percentage,Works,2.0,No,No,Online,No,No,No,1.0,Fee/PreQual/Technical,.pdf,"GST,PAN,EPF registration certificate,Valid OCC Ltd enlistment certificate etc.",27-Jun-2024 06:00 PM,25-Jul-2024 12:00 PM,27-Jun-2024 06:00 PM,24-Jul-2024 05:30 PM,27-Jun-2024 06:00 PM ,02-Jul-2024 03:30 PM ,27-Jun-2024 06:00 PM,24-Jul-2024 05:30 PM,11-Sep-2024 11:30 AM,"2,30,000",Yes,fixed,,Nil,Nil,1.0,1st Corrigendum.,Date,,1.0,ICICI BANK,"11,800",Nil,Nil,No,MANAGING DIRECTOR OF OCC LTD.,"ODISHA CONSTRUCTION CORPORATION Ltd.,UNIT - VIII, GOPABANDHUNAGAR,BBSR-751012",E-procurement Notice No.05/OCCL/2024-25(on-line),Widening and Improvement of service road on left bank of Distributary No.05 from RD 38.0 M to RD 1485.00 M.,Please refer Tender documents. ,NA ,"2,29,58,396",Civil Works - Others,NA ,Tender,90.0,180.0,Jagatsinghpur Irrigation Division,754103.0,NA ,NA ,NA ,HEAD OFFICE OCCL,No ,No,AOC,17-Dec-2024,"INR 22,958,396.33",180.0,Pratap Chandra Chaudhury,28-Jul-2025 04:26 PM,CGP_12.pdf (510.00 KB),AOC,1.0,2510031.0,M/S. DEBI PRASAD TRIPATHY,INR,"19,516,933",1,2510482,ACP CONSTRUCTION,09-Jul-2024 04:33 PM,Rejected-Finance,UNSUCCESSFUL IN TRANSPARENT LOTTERY.,20-Nov-2024 11:49 PM,Finance,Opened Successfully.,Pratap Chandra Chaudhury,11-Sep-2024 12:46 PM,,BOQ Comparative Chart,MANAGING DIRECTOR OF OCC LTD.,Internal,,Pratap Chandra Chaudhury,20-Nov-2024 11:49 PM,finsummary_502083.pdf (406.10 KB),ODISHA CONSTRUCTION CORPORATION LTD,2024_OCCL_103351_1,Bid identification No. OCCL-CGP/12/2024-25,E-procurement Notice No.05/OCCL/2024-25(on-line),Technical,Opened Successfully.,Pratap Chandra Chaudhury,25-Jul-2024 01:01 PM,,MANAGING DIRECTOR OF OCC LTD.,Internal,,Pratap Chandra Chaudhury,10-Sep-2024 04:09 PM,11-Sep-2024 11:30 AM,techsummary_502083.pdf (1538.69 KB),AOC
,,,,,,,,,,,,,,,,.pdf,"Other documents as per DTCN. EMD is in BG Shape, Provide Original BG during technical bid opening.",,,,,,,,,,,,,,,,,,,,2.0,ICICI NEFT/RTGS,,,,,,,,,,,,,,,,,,,,,,,,,AOC,,,,,,,,,,,,,2,2510031,M/S. DEBI PRASAD TRIPATHY,24-Jul-2024 05:06 PM,Accepted-AOC,L1 SUCCESSFUL BIDDER.,28-Jul-2025 04:27 PM,,,,,,,,,,,,,,,,,,,,,,,,,,,,,AOC
,,,,,,,,,,,,,,2.0,Finance,.xls,BoQ,,,,,,,,,,,,,,,,,,,,,,,,,,,,,,,,,,,,,,,,,,,,,,AOC,,,,,,,,,,,,,3,2509925,ROUT INFRASTRUCTURE PRIVATE LIMITED,24-Jul-2024 11:18 AM,Rejected-Finance,UNSUCCESSFUL IN TRANSPARENT LOTTERY.,20-Nov-2024 11:49 PM,,,,,,,,,,,,,,,,,,,,,,,,,,,,,AOC
,,,,,,,,,,,,,,,,,,,,,,,,,,,,,,,,,,,,,,,,,,,,,,,,,,,,,,,,,,,,,,,AOC,,,,,,,,,,,,,4,2517863,SAMIR KUMAR SINGH,24-Jul-2024 02:25 PM,Rejected-Finance,UNSUCCESSFUL IN TRANSPARENT LOTTERY.,20-Nov-2024 11:49 PM,,,,,,,,,,,,,,,,,,,,,,,,,,,,,AOC
,,,,,,,,,,,,,,,,,,,,,,,,,,,,,,,,,,,,,,,,,,,,,,,,,,,,,,,,,,,,,,,AOC,,,,,,,,,,,,,5,2517144,SITAKANTA SUR,23-Jul-2024 03:59 PM,Rejected-Finance,L2 BIDDER.,20-Nov-2024 11:49 PM,,,,,,,,,,,,,,,,,,,,,,,,,,,,,AOC
