Organisation Chain,Tender Reference Number,Tender ID,Withdrawal Allowed,Tender Type,Form of contract,Tender Category,No. of Covers,General Technical Evaluation Allowed,ItemWise Technical Evaluation Allowed,Payment Mode,Is Multi Currency Allowed For BOQ,Is Multi Currency Allowed For Fee,Allow Two Stage Bidding,Cover No,Cover,Document Type,Description,Publish Date,Bid Opening Date,Document Download / Sale Start Date,Document Download / Sale End Date,Clarification Start Date,Clarification End Date,Bid Submission Start Date,Bid Submission End Date,Financial Bid Opening Date,EMD Amount in ₹,EMD Exemption Allowed,EMD Fee Type,EMD Percentage,EMD Payable To,EMD Payable At,S.No,Bank Name,Tender Fee in ₹,VAT Charges in ₹,Fee Payable To,Fee Payable At,Tender Fee Exemption Allowed,Name,Address,Title,Work Description,Pre Qualification Details,Independent External Monitor/Remarks,Tender Value in ₹,Product Category,Sub category,Contract Type,Bid Validity(Days),Period Of Work(Days),Location,Pincode,Pre Bid Meeting Place,Pre Bid Meeting Address,Pre Bid Meeting Date,Bid Opening Place,Should Allow NDA Tender,Allow Preferential Bidder,Tender Stage,Contract Date :,Contract Value :,Work Completion Period in days :,Updated By :,Updated on :,AOC document :,AOC Description :,S.No,Bid Number,Bidder Name,Awarded Currency,Awarded Value,S.No.1,Bid Number.1,Bidder Name.1,Submitted Date,Status,Remarks,Status Updated On,Type :,Summary :,Updated By :.1,Updated On :,Document :,BOQ Comparative Chart :,Committee Chairperson/Co-ordinator Name :,Committee Chairperson/Co-ordinator Type :,Committee Members :,Updated By :.2,Updated on :.1,Document :.1,Organisation Chain :,Tender ID :,Tender Ref No :,Tender Title :,Type :.1,Summary :.1,Updated By :.3,Updated On :.1,Document :.2,Committee Chairperson/Co-ordinator Name :.1,Committee Chairperson/Co-ordinator Type :.1,Committee Members :.1,Updated By :.4,Updated On :.2,Financial Bid Opening Date:,Document :.3,Tender Stage
EIC-CIVIL||SERNB-CIRCLE-DHENKANAL||EERNB-DIVN-DHENKANAL,SE DKL (R and B) 18/ 2024-25,2024_EICCL_106364_2,Yes,Open Tender,Percentage,Works,2.0,No,No,Online,No,No,No,1.0,Fee/PreQual/Technical,.pdf,"GSTIN, EMD, PAN, Valid RC",04-Nov-2024 10:00 AM,19-Nov-2024 11:00 AM,04-Nov-2024 10:00 AM,18-Nov-2024 05:00 PM,NA ,NA ,04-Nov-2024 10:00 AM,18-Nov-2024 05:00 PM,04-Dec-2024 09:00 AM,"56,000",Yes,fixed,,Nil,Nil,1.0,ICICI BANK,"10,000",0.0,Nil,Nil,No,SE Dhenkanal R and B Division Dhenkanal,SE Dhenkanal R and B Division Dhenkanal,Construction of Need Based Infrastructure in the PPC at Baunsapokhari PACS under Hindol Block in District of Dhenkanal for the year 2024-25,Construction of Need Based Infrastructure in the PPC at Baunsapokhari PACS under Hindol Block in District of Dhenkanal for the year 2024-25,Please refer tender documents ,NA ,"55,02,450",Civil Works - Buildings,NA ,Tender,90.0,120.0,Dhenkanal,759001.0,NA ,NA ,NA ,SE Dhenkanal R and B Division Dhenkanal,No ,No,AOC,22-Jul-2025,"INR 5,502,450",120.0,JAYANTA PRASAD NAIK,22-Jul-2025 07:05 PM,baunsapokhari_2.pdf (601.00 KB),Agreement as on dtd.30.04.2025,1.0,2651076.0,SUCHISMITA RATHA,INR,"4,677,633",1,2651511,JAGADISH NAYAK,18-Nov-2024 01:08 PM,Rejected-AOC,disqualified in transparent lottery,22-Jul-2025 07:05 PM,Finance,Bid are open,Suchismita Satapathy,04-Dec-2024 11:51 AM,finance_514199.pdf,BOQ Comparative Chart,Superintending Engineer,Internal,Sr DAO AEE Estimator JE Estimator,JAYANTA PRASAD NAIK,22-Jul-2025 07:00 PM,finsummary_514199.pdf (25.08 KB),EIC-CIVIL||SERNB-CIRCLE-DHENKANAL||EERNB-DIVN-DHENKANAL,2024_EICCL_106364_2,SE DKL (R and B) 18/ 2024-25,Construction of Need Based Infrastructure in the PPC at Baunsapokhari PACS under Hindol Block in District of Dhenkanal for the year 2024-25,Technical,bid are open,Suchismita Satapathy,19-Nov-2024 07:09 PM,technical_514199.pdf,SE Rand B Division Dhenkanal,Internal,Sr DAO AEE Estimator JE Estimator,JAYANTA PRASAD NAIK,03-Dec-2024 06:49 PM,04-Dec-2024 09:00 AM,techsummary_514199.pdf (106.31 KB),AOC
,,,,,,,,,,,,,,,,.pdf,"Affidavit, Machineries and other documents as per DTCN",,,,,,,,,,,,,,,,2.0,ICICI NEFT/RTGS,,,,,,,,,,,,,,,,,,,,,,,,,,AOC,,,,,,,,,,,,,2,2651654,SRI DEBADATTA SETHI,18-Nov-2024 02:19 PM,Rejected-AOC,disqualified in transparent lottery,22-Jul-2025 07:05 PM,,,,,,,,,,,,,,,,,,,,,,,,,,,,,AOC
,,,,,,,,,,,,,,2.0,Finance,.xls,Bill of Quantity,,,,,,,,,,,,,,,,,,,,,,,,,,,,,,,,,,,,,,,,,,,AOC,,,,,,,,,,,,,3,2651076,SUCHISMITA RATHA,18-Nov-2024 01:43 AM,Accepted-AOC,Work has been awarded,22-Jul-2025 07:05 PM,,,,,,,,,,,,,,,,,,,,,,,,,,,,,AOC
,,,,,,,,,,,,,,,,,,,,,,,,,,,,,,,,,,,,,,,,,,,,,,,,,,,,,,,,,,,,AOC,,,,,,,,,,,,,4,2646709,Sudhira Kumar Biswal,15-Nov-2024 11:55 AM,Rejected-AOC,disqualified in transparent lottery,22-Jul-2025 07:05 PM,,,,,,,,,,,,,,,,,,,,,,,,,,,,,AOC
,,,,,,,,,,,,,,,,,,,,,,,,,,,,,,,,,,,,,,,,,,,,,,,,,,,,,,,,,,,,AOC,,,,,,,,,,,,,5,2650328,SURJYAKANTA SAHOO,17-Nov-2024 12:56 PM,Rejected-AOC,disqualified in transparent lottery,22-Jul-2025 07:05 PM,,,,,,,,,,,,,,,,,,,,,,,,,,,,,AOC
