Organisation Chain,Tender Reference Number,Tender ID,Withdrawal Allowed,Tender Type,Form of contract,Tender Category,No. of Covers,General Technical Evaluation Allowed,ItemWise Technical Evaluation Allowed,Payment Mode,Is Multi Currency Allowed For BOQ,Is Multi Currency Allowed For Fee,Allow Two Stage Bidding,Cover No,Cover,Document Type,Description,Publish Date,Bid Opening Date,Document Download / Sale Start Date,Document Download / Sale End Date,Clarification Start Date,Clarification End Date,Bid Submission Start Date,Bid Submission End Date,Financial Bid Opening Date,EMD Amount in ₹,EMD Exemption Allowed,EMD Fee Type,EMD Percentage,EMD Payable To,EMD Payable At,S.No,Bank Name,Tender Fee in ₹,VAT Charges in ₹,Fee Payable To,Fee Payable At,Tender Fee Exemption Allowed,Name,Address,Title,Work Description,Pre Qualification Details,Independent External Monitor/Remarks,Tender Value in ₹,Product Category,Sub category,Contract Type,Bid Validity(Days),Period Of Work(Days),Location,Pincode,Pre Bid Meeting Place,Pre Bid Meeting Address,Pre Bid Meeting Date,Bid Opening Place,Should Allow NDA Tender,Allow Preferential Bidder,Tender Stage,Contract Date :,Contract Value :,Work Completion Period in days :,Updated By :,Updated on :,AOC document :,AOC Description :,S.No,Bid Number,Bidder Name,Awarded Currency,Awarded Value,S.No.1,Bid Number.1,Bidder Name.1,Submitted Date,Status,Remarks,Status Updated On,Type :,Summary :,Updated By :.1,Updated On :,Document :,BOQ Comparative Chart :,Committee Chairperson/Co-ordinator Name :,Committee Chairperson/Co-ordinator Type :,Committee Members :,Updated By :.2,Updated on :.1,Document :.1,Organisation Chain :,Tender ID :,Tender Ref No :,Tender Title :,Type :.1,Summary :.1,Updated By :.3,Updated On :.1,Document :.2,Committee Chairperson/Co-ordinator Name :.1,Committee Chairperson/Co-ordinator Type :.1,Committee Members :.1,Updated By :.4,Updated On :.2,Financial Bid Opening Date:,Document :.3,Tender Stage
Orissa State Police Housing and Welfare Corporation Ltd,01/OPHWC/2025-26,2025_OSPHW_112149_7,Yes,National Competitive Bid,Percentage,Works,2.0,No,No,Online,No,No,No,1.0,Fee/PreQual/Technical,.pdf,"GST, GSTR-1, PAN, Contractor Registration Certificate and Affidavit",05-Apr-2025 06:55 PM,21-Apr-2025 10:30 AM,05-Apr-2025 06:55 PM,19-Apr-2025 05:00 PM,NA ,NA ,05-Apr-2025 06:55 PM,19-Apr-2025 05:00 PM,09-Jun-2025 10:30 AM,"2,79,800",Yes,fixed,,Nil,Nil,1.0,ICICI BANK,"11,800",0.0,Nil,Nil,No,CHIEF ENGINEER OPHWC,OPHWC BHUBANESWAR,"Cluster of Constn. of 8 nos. F type staff quarters,1 nos. E type staff quarters at Buguda Fire Station in Ganjam District",Building Work,Please refer Tender documents  ,NA ,"2,79,82,602",Civil Works - Buildings,NA ,Tender,90.0,300.0,Ganjam,751022.0,NA ,NA ,NA ,OPHWC BHUBANESWAR,No ,No,AOC,08-Jul-2025,"INR 25,187,140.11",300.0,BIBHUTI BHUSHAN NAIK,08-Jul-2025 03:44 PM,WORKORDRER.pdf (658.00 KB),AWARDED AS L1 TENDERER AND AWARDED ON DATE 04.07.2025,1.0,2888751.0,PRAMOD KUMAR NAYAK,INR,"25,187,140.11",1,2888434,Anup Kumar Dash,19-Apr-2025 01:00 PM,Rejected-Technical,Non-securing qualifying marks in the Point of Presentation as per DTCN Cl.110(m).,06-Jun-2025 07:46 PM,Finance,FINANCIAL BID OPENED,Bikram Keshari Malla,09-Jun-2025 11:31 AM,,BOQ Comparative Chart,AS PER AS ACCEPTANCE LETTER,Internal,AS PER AS ACCEPTANCE LETTER,BIBHUTI BHUSHAN NAIK,08-Jul-2025 03:42 PM,finsummary_535225.pdf (392.82 KB),Orissa State Police Housing and Welfare Corporation Ltd,2025_OSPHW_112149_7,01/OPHWC/2025-26,"Cluster of Constn. of 8 nos. F type staff quarters,1 nos. E type staff quarters at Buguda Fire Station in Ganjam District",Technical,five bidder have particiapted,Bikram Keshari Malla,21-Apr-2025 02:17 PM,,AS PER TC MINUTES,Internal,AS PER TC MINUTES,BIBHUTI BHUSHAN NAIK,06-Jun-2025 07:46 PM,09-Jun-2025 10:30 AM,techsummary_535225.pdf (484.35 KB),AOC
,,,,,,,,,,,,,,,,.pdf,Other Document as per DTCN,,,,,,,,,,,,,,,,2.0,ICICI NEFT/RTGS,,,,,,,,,,,,,,,,,,,,,,,,,,AOC,,,,,,,,,,,,,2,2888516,ASHIM KUMAR SARKAR,19-Apr-2025 11:03 AM,Rejected-Technical,1. Non submission of adequate similar nature of work as per DTCN Cl. No. 11 and 110(j) 2. Non submission of valid adequate documents to secure qualifying marks in Sch. C i.e. Tools and Plants as per DTCN Cl. No. 13 and 110 (f),06-Jun-2025 07:46 PM,,,,,,,,,,,,,,,,,,,,,,,,,,,,,AOC
,,,,,,,,,,,,,,2.0,Finance,.xls,Bill of Quantity,,,,,,,,,,,,,,,,,,,,,,,,,,,,,,,,,,,,,,,,,,,AOC,,,,,,,,,,,,,3,2888447,Biswajit Panda,19-Apr-2025 03:25 PM,Rejected-Technical,Non-securing qualifying marks in the Point of Presentation as per DTCN Cl.110(m).,06-Jun-2025 07:46 PM,,,,,,,,,,,,,,,,,,,,,,,,,,,,,AOC
,,,,,,,,,,,,,,,,,,,,,,,,,,,,,,,,,,,,,,,,,,,,,,,,,,,,,,,,,,,,AOC,,,,,,,,,,,,,4,2888369,MS JAYARAM PRADHAN,19-Apr-2025 11:53 AM,Rejected-Finance,DUE TO L2 BIDDER,08-Jul-2025 03:42 PM,,,,,,,,,,,,,,,,,,,,,,,,,,,,,AOC
,,,,,,,,,,,,,,,,,,,,,,,,,,,,,,,,,,,,,,,,,,,,,,,,,,,,,,,,,,,,AOC,,,,,,,,,,,,,5,2888751,PRAMOD KUMAR NAYAK,19-Apr-2025 01:38 PM,Accepted-AOC,QUALIFIED BIDDER,08-Jul-2025 03:44 PM,,,,,,,,,,,,,,,,,,,,,,,,,,,,,AOC
