Organisation Chain,Tender Reference Number,Tender ID,Withdrawal Allowed,Tender Type,Form of contract,Tender Category,No. of Covers,General Technical Evaluation Allowed,ItemWise Technical Evaluation Allowed,Payment Mode,Is Multi Currency Allowed For BOQ,Is Multi Currency Allowed For Fee,Allow Two Stage Bidding,Cover No,Cover,Document Type,Description,Publish Date,Bid Opening Date,Document Download / Sale Start Date,Document Download / Sale End Date,Clarification Start Date,Clarification End Date,Bid Submission Start Date,Bid Submission End Date,Financial Bid Opening Date,EMD Amount in ₹,EMD Exemption Allowed,EMD Fee Type,EMD Percentage,EMD Payable To,EMD Payable At,S.No,Bank Name,Tender Fee in ₹,VAT Charges in ₹,Fee Payable To,Fee Payable At,Tender Fee Exemption Allowed,Name,Address,Title,Work Description,Pre Qualification Details,Independent External Monitor/Remarks,Tender Value in ₹,Product Category,Sub category,Contract Type,Bid Validity(Days),Period Of Work(Days),Location,Pincode,Pre Bid Meeting Place,Pre Bid Meeting Address,Pre Bid Meeting Date,Bid Opening Place,Should Allow NDA Tender,Allow Preferential Bidder,Tender Stage,Contract Date :,Contract Value :,Work Completion Period in days :,Updated By :,Updated on :,AOC document :,AOC Description :,S.No,Bid Number,Bidder Name,Awarded Currency,Awarded Value,S.No.1,Bid Number.1,Bidder Name.1,Submitted Date,Status,Remarks,Status Updated On,Type :,Summary :,Updated By :.1,Updated On :,Document :,BOQ Comparative Chart :,Committee Chairperson/Co-ordinator Name :,Committee Chairperson/Co-ordinator Type :,Committee Members :,Updated By :.2,Updated on :.1,Document :.1,Organisation Chain :,Tender ID :,Tender Ref No :,Tender Title :,Type :.1,Summary :.1,Updated By :.3,Updated On :.1,Document :.2,Committee Chairperson/Co-ordinator Name :.1,Committee Chairperson/Co-ordinator Type :.1,Committee Members :.1,Updated By :.4,Updated On :.2,Financial Bid Opening Date:,Document :.3,Tender Stage
EIC-CIVIL||SERNB-CIRCLE-RAYAGADA||EERNB DIVN RAYAGADA I,CCE R and B RGDA- 07/2024-25,2024_EICCL_107849_1,Yes,National Competitive Bid,Percentage,Works,2.0,No,No,Online,No,No,No,1.0,Fee/PreQual/Technical,.pdf,"Cost of tender paper, EMD,PAN,GSTRC,GSTIN,Labour License,Regd Certificate,Affidavit",03-Dec-2024 05:30 PM,19-Dec-2024 11:00 AM,03-Dec-2024 05:30 PM,18-Dec-2024 05:00 PM,03-Dec-2024 05:30 PM ,16-Dec-2024 05:00 PM ,03-Dec-2024 05:30 PM,18-Dec-2024 05:00 PM,07-Feb-2025 05:00 PM,"9,42,000",Yes,fixed,,Nil,Nil,1.0,ICICI BANK,"10,000",0.0,Nil,Nil,No,CCE Rayagada R and B Circle,CCE Rayagada R and B Circle Rayagada PIN 765001,Improvement Such as Widening and Strengthening of the Road from Tumba to Koinpur from 13/704 km to 18/0 km in the District of Gajapati under state plan for the year 2024-25,Road Works,Please refer Tender documents. ,NA ,"9,41,91,283",Civil Works - Roads,NA ,Tender,90.0,240.0,Paralakhemundi,761200.0,NA ,NA ,NA ,CCE Rayagada R and B Circle,No ,No,AOC,08-Jul-2025,"INR 80,072,009",240.0,Ambikeya Mishra,08-Jul-2025 12:22 PM,Tumba_Koinpur_WO.pdf (1887.00 KB),Letter No. 3057 Dt. 02.06.2025 of SE Rgda Div No-I Rgada,1.0,2701800.0,B LAXMI NARYANA,INR,"80,072,009",1,2701800,B LAXMI NARYANA,18-Dec-2024 10:06 AM,Accepted-AOC,Selected through transparent lottery system,08-Jul-2025 12:22 PM,Finance,Financial Bid Opened,Sanjog Kumar Meher,07-Jul-2025 07:47 PM,finance_519141.pdf,BOQ Comparative Chart,CCE,Internal,SE DAO PA to CCE Estimator,Ambikeya Mishra,08-Jul-2025 12:17 PM,finsummary_519141.pdf (111.28 KB),EIC-CIVIL||SERNB-CIRCLE-RAYAGADA||EERNB DIVN RAYAGADA I,2024_EICCL_107849_1,CCE R and B RGDA- 07/2024-25,Improvement Such as Widening and Strengthening of the Road from Tumba to Koinpur from 13/704 km to 18/0 km in the District of Gajapati under state plan for the year 2024-25,Technical,Seven nos of bidders are participated and for technical evaluation,Ambikeya Mishra,04-Feb-2025 01:12 PM,technical_519141.pdf,CCE Rayagada,Internal,SE DAO PA to CCE Estimator,Ambikeya Mishra,04-Feb-2025 01:16 PM,07-Feb-2025 05:00 PM,techsummary_519141.pdf (672.00 KB),AOC
,,,,,,,,,,,,,,,,.pdf,Work Experience and Other Documents as per DTCN,,,,,,,,,,,,,,,,2.0,ICICI NEFT/RTGS,,,,,,,,,,,,,,,,,,,,,,,,,,AOC,,,,,,,,,,,,,2,2701805,BRUNDABAN SAHU,18-Dec-2024 09:50 AM,Rejected-AOC,Qualified,08-Jul-2025 12:22 PM,,,,,,,,,,,,,,,,,,,,,,,,,,,,,AOC
,,,,,,,,,,,,,,2.0,Finance,.xls,Bill of Quantity,,,,,,,,,,,,,,,,,,,,,,,,,,,,,,,,,,,,,,,,,,,AOC,,,,,,,,,,,,,3,2695118,KAPILASH INFRASOL PROJECTS PRIVATE LIMITED,18-Dec-2024 03:04 PM,Rejected-Technical,Disqualified as per Evaluation Sheet,04-Feb-2025 01:16 PM,,,,,,,,,,,,,,,,,,,,,,,,,,,,,AOC
,,,,,,,,,,,,,,,,,,,,,,,,,,,,,,,,,,,,,,,,,,,,,,,,,,,,,,,,,,,,AOC,,,,,,,,,,,,,4,2700000,MS AMEVA ASSOCIATES,17-Dec-2024 10:41 PM,Rejected-Technical,Disqualified as per proceeding of the Technical Evaluation Committee,04-Feb-2025 01:16 PM,,,,,,,,,,,,,,,,,,,,,,,,,,,,,AOC
,,,,,,,,,,,,,,,,,,,,,,,,,,,,,,,,,,,,,,,,,,,,,,,,,,,,,,,,,,,,AOC,,,,,,,,,,,,,5,2700136,M/S S. KARUNAKAR RAO,18-Dec-2024 02:37 PM,Rejected-AOC,Qualified,08-Jul-2025 12:22 PM,,,,,,,,,,,,,,,,,,,,,,,,,,,,,AOC
,,,,,,,,,,,,,,,,,,,,,,,,,,,,,,,,,,,,,,,,,,,,,,,,,,,,,,,,,,,,AOC,,,,,,,,,,,,,6,2701815,M/S SRI OMI INFRA,18-Dec-2024 10:17 AM,Rejected-Technical,Disqualified as per Evaluation Sheet,04-Feb-2025 01:16 PM,,,,,,,,,,,,,,,,,,,,,,,,,,,,,AOC
,,,,,,,,,,,,,,,,,,,,,,,,,,,,,,,,,,,,,,,,,,,,,,,,,,,,,,,,,,,,AOC,,,,,,,,,,,,,7,2702533,P VARA PRASAD,18-Dec-2024 04:29 PM,Rejected-Technical,Disqualified as per Evaluation Sheet,04-Feb-2025 01:16 PM,,,,,,,,,,,,,,,,,,,,,,,,,,,,,AOC
