Organisation Chain,Tender Reference Number,Tender ID,Withdrawal Allowed,Tender Type,Form of contract,Tender Category,No. of Covers,General Technical Evaluation Allowed,ItemWise Technical Evaluation Allowed,Payment Mode,Is Multi Currency Allowed For BOQ,Is Multi Currency Allowed For Fee,Allow Two Stage Bidding,Cover No,Cover,Document Type,Description,Publish Date,Bid Opening Date,Document Download / Sale Start Date,Document Download / Sale End Date,Clarification Start Date,Clarification End Date,Bid Submission Start Date,Bid Submission End Date,Financial Bid Opening Date,EMD Amount in ₹,EMD Exemption Allowed,EMD Fee Type,EMD Percentage,EMD Payable To,EMD Payable At,S.No,Bank Name,Tender Fee in ₹,VAT Charges in ₹,Fee Payable To,Fee Payable At,Tender Fee Exemption Allowed,Name,Address,Title,Work Description,Pre Qualification Details,Independent External Monitor/Remarks,Tender Value in ₹,Product Category,Sub category,Contract Type,Bid Validity(Days),Period Of Work(Days),Location,Pincode,Pre Bid Meeting Place,Pre Bid Meeting Address,Pre Bid Meeting Date,Bid Opening Place,Should Allow NDA Tender,Allow Preferential Bidder,Tender Stage,Contract Date :,Contract Value :,Work Completion Period in days :,Updated By :,Updated on :,AOC document :,AOC Description :,S.No,Bid Number,Bidder Name,Awarded Currency,Awarded Value,S.No.1,Bid Number.1,Bidder Name.1,Submitted Date,Status,Remarks,Status Updated On,Type :,Summary :,Updated By :.1,Updated On :,Document :,BOQ Comparative Chart :,Committee Chairperson/Co-ordinator Name :,Committee Chairperson/Co-ordinator Type :,Committee Members :,Updated By :.2,Updated on :.1,Document :.1,Organisation Chain :,Tender ID :,Tender Ref No :,Tender Title :,Type :.1,Summary :.1,Updated By :.3,Updated On :.1,Document :.2,Committee Chairperson/Co-ordinator Name :.1,Committee Chairperson/Co-ordinator Type :.1,Committee Members :.1,Updated By :.4,Updated On :.2,Financial Bid Opening Date:,Document :.3,Tender Stage
Orissa State Police Housing and Welfare Corporation Ltd,01/OPHWC/2025-26,2025_OSPHW_112149_12,Yes,National Competitive Bid,Percentage,Works,2.0,No,No,Online,No,No,No,1.0,Fee/PreQual/Technical,.pdf,"GST, GSTR-1, PAN, Contractor Registration Certificate and Affidavit",05-Apr-2025 06:55 PM,21-Apr-2025 10:30 AM,05-Apr-2025 06:55 PM,19-Apr-2025 05:00 PM,NA ,NA ,05-Apr-2025 06:55 PM,19-Apr-2025 05:00 PM,12-Jun-2025 10:30 AM,"2,43,400",Yes,fixed,,Nil,Nil,1.0,ICICI BANK,"11,800",0.0,Nil,Nil,No,CHIEF ENGINEER OPHWC,OPHWC BHUBANESWAR,Constn. of 8 nos. F type staff quarters at Purushottampur Fire Station in Ganjam District,Building Work,Please refer Tender documents  ,NA ,"2,43,38,599",Civil Works - Buildings,NA ,Tender,90.0,300.0,Ganjam,751022.0,NA ,NA ,NA ,OPHWC BHUBANESWAR,No ,No,AOC,11-Jul-2025,"INR 21,907,173.3",300.0,BIBHUTI BHUSHAN NAIK,11-Jul-2025 12:10 PM,WORKORDERR.pdf (114.00 KB),AWARDED AS L1 TENDERER AND AWARDED ON DATE 08.07.2025,1.0,2878251.0,Satya Brata Pattnaik,INR,"21,907,173.3",1,2888436,Anup Kumar Dash,19-Apr-2025 01:08 PM,Rejected-Finance,DUE TO L2 BIDDER,11-Jul-2025 12:08 PM,Finance,financial bid open and comparative generated,Bikram Keshari Malla,12-Jun-2025 12:35 PM,,BOQ Comparative Chart,AS PER AS ACCEPTANCE LETTER,Internal,AS PER AS ACCEPTANCE LETTER,BIBHUTI BHUSHAN NAIK,11-Jul-2025 12:08 PM,finsummary_535239.pdf (406.59 KB),Orissa State Police Housing and Welfare Corporation Ltd,2025_OSPHW_112149_12,01/OPHWC/2025-26,Constn. of 8 nos. F type staff quarters at Purushottampur Fire Station in Ganjam District,Technical,FIVE BIDDER HAVE PARTICIPATED,Bikram Keshari Malla,22-Apr-2025 04:59 PM,,AS PER TC MINUTES,Internal,AS PER TC MINUTES,BIBHUTI BHUSHAN NAIK,11-Jun-2025 07:20 PM,12-Jun-2025 10:30 AM,techsummary_535239.pdf (404.19 KB),AOC
,,,,,,,,,,,,,,,,.pdf,Other Document as per DTCN,,,,,,,,,,,,,,,,2.0,ICICI NEFT/RTGS,,,,,,,,,,,,,,,,,,,,,,,,,,AOC,,,,,,,,,,,,,2,2888545,ASHIM KUMAR SARKAR,19-Apr-2025 11:12 AM,Rejected-Technical,Non submission of valid adequate documents to secure qualifying marks in Sch. C as per DTCN Cl. No. 13 and 110 (f).,11-Jun-2025 07:20 PM,,,,,,,,,,,,,,,,,,,,,,,,,,,,,AOC
,,,,,,,,,,,,,,2.0,Finance,.xls,Bill of Quantity,,,,,,,,,,,,,,,,,,,,,,,,,,,,,,,,,,,,,,,,,,,AOC,,,,,,,,,,,,,3,2888450,Biswajit Panda,19-Apr-2025 03:28 PM,Rejected-Technical,Absent in the Point of Presentation as per DTCN Cl.110(m).,11-Jun-2025 07:20 PM,,,,,,,,,,,,,,,,,,,,,,,,,,,,,AOC
,,,,,,,,,,,,,,,,,,,,,,,,,,,,,,,,,,,,,,,,,,,,,,,,,,,,,,,,,,,,AOC,,,,,,,,,,,,,4,2887676,K.Rabinarayan Das,18-Apr-2025 03:37 PM,Rejected-Technical,Absent in the Point of Presentation as per DTCN Cl.110(m).,11-Jun-2025 07:20 PM,,,,,,,,,,,,,,,,,,,,,,,,,,,,,AOC
,,,,,,,,,,,,,,,,,,,,,,,,,,,,,,,,,,,,,,,,,,,,,,,,,,,,,,,,,,,,AOC,,,,,,,,,,,,,5,2878251,Satya Brata Pattnaik,19-Apr-2025 09:59 AM,Accepted-AOC,QUALIFIED BIDDER,11-Jul-2025 12:10 PM,,,,,,,,,,,,,,,,,,,,,,,,,,,,,AOC
