Organisation Chain,Tender Reference Number,Tender ID,Withdrawal Allowed,Tender Type,Form of contract,Tender Category,No. of Covers,General Technical Evaluation Allowed,ItemWise Technical Evaluation Allowed,Payment Mode,Is Multi Currency Allowed For BOQ,Is Multi Currency Allowed For Fee,Allow Two Stage Bidding,Cover No,Cover,Document Type,Description,Publish Date,Bid Opening Date,Document Download / Sale Start Date,Document Download / Sale End Date,Clarification Start Date,Clarification End Date,Bid Submission Start Date,Bid Submission End Date,EMD Amount in ₹,EMD Exemption Allowed,EMD Fee Type,EMD Percentage,EMD Payable To,EMD Payable At,S.No,Bank Name,Tender Fee in ₹,VAT Charges in ₹,Fee Payable To,Fee Payable At,Tender Fee Exemption Allowed,Name,Address,Title,Work Description,Pre Qualification Details,Independent External Monitor/Remarks,Tender Value in ₹,Product Category,Sub category,Contract Type,Bid Validity(Days),Period Of Work(Days),Location,Pincode,Pre Bid Meeting Place,Pre Bid Meeting Address,Pre Bid Meeting Date,Bid Opening Place,Should Allow NDA Tender,Allow Preferential Bidder,Tender Stage,Contract Date :,Contract Value :,Work Completion Period in days :,Updated By :,Updated on :,AOC document :,AOC Description :,S.No,Bid Number,Bidder Name,Awarded Currency,Awarded Value,S.No.1,Bid Number.1,Bidder Name.1,Submitted Date,Status,Remarks,Status Updated On,Type :,Summary :,Updated By :.1,Updated On :,Document :,BOQ Comparative Chart :,Committee Chairperson/Co-ordinator Name :,Committee Chairperson/Co-ordinator Type :,Committee Members :,Updated By :.2,Updated on :.1,Document :.1,Organisation Chain :,Tender ID :,Tender Ref No :,Tender Title :,Committee Chairperson/Co-ordinator Name :.1,Committee Chairperson/Co-ordinator Type :.1,Committee Members :.1,Updated By :.3,Updated On :.1,Document :.2,Tender Stage
Municipal Bodies||Kamakhyanagar NAC,KNR-NAC-01-2025-26,2025_ORULB_114236_4,Yes,Open Tender,Percentage,Works,1.0,No,No,Online,No,No,No,1.0,Fee/PreQual/Technical/Finance,.pdf,"Registration Certificate, GST Registration Certificate, PAN CARD and Other Documents",09-Jun-2025 10:00 AM,19-Jun-2025 10:00 AM,09-Jun-2025 10:00 AM,18-Jun-2025 05:00 PM,NA ,NA ,09-Jun-2025 10:00 AM,18-Jun-2025 05:00 PM,"6,780",Yes,percentage,1.0%,Nil,Nil,1.0,ICICI BANK,"4,000",0.0,Nil,Nil,No,"Executive Officer, Kamakhyanagar NAC","Executive Officer, Kamakhyanagar NAC",Improvement of Alatuma High School premises in Ward No-10 at Kamakhyanagar NAC.,Improvement of Alatuma High School premises in Ward No-10 at Kamakhyanagar NAC.,Please refer Tender documents. ,NA ,"6,77,957",Civil Works - Others,NA ,Tender,90.0,60.0,Kamakhyanagar NAC,759018.0,NA ,NA ,NA ,Kamakhyanagar NAC Office,No ,No,AOC,15-Jul-2025,"INR 677,957",60.0,Ranjulata Das,15-Jul-2025 04:04 PM,04.pdf (673.00 KB),DUE TO L1 IN LOTTERY,1.0,2967684.0,SUMITRA SAHOO,INR,"677,957",1,2971775,DILESWAR SASAMAL,18-Jun-2025 11:46 AM,Rejected-AOC,NOT L1 IN LOTTERY,15-Jul-2025 04:04 PM,Finance,OPENING SUCESSFULLY,Girish Bihari Das,19-Jun-2025 03:30 PM,,BOQ Comparative Chart,EO,Internal,"EO, ME, JE AND OTHER OFFICIAL STAFF",Ranjulata Das,15-Jul-2025 03:59 PM,finsummary_542315.pdf (672.91 KB),Municipal Bodies||Kamakhyanagar NAC,2025_ORULB_114236_4,KNR-NAC-01-2025-26,Improvement of Alatuma High School premises in Ward No-10 at Kamakhyanagar NAC.,EO,Internal,"EO, ME, JE AND OTHER OFFICIAL STAFF",Ranjulata Das,15-Jul-2025 03:51 PM,techsummary_542315.pdf (672.91 KB),AOC
,,,,,,,,,,,,,,,,.pdf,Affidavit and other documents as per DTCN,,,,,,,,,,,,,,,2.0,ICICI NEFT/RTGS,,,,,,,,,,,,,,,,,,,,,,,,,,AOC,,,,,,,,,,,,,2,2971287,M/S Bibhuti Bhusan Sethi,17-Jun-2025 08:24 PM,Rejected-AOC,NOT L1 IN LOTTERY,15-Jul-2025 04:04 PM,,,,,,,,,,,,,,,,,,,,,,,AOC
,,,,,,,,,,,,,,,,.xls,BOQ,,,,,,,,,,,,,,,,,,,,,,,,,,,,,,,,,,,,,,,,,,AOC,,,,,,,,,,,,,3,2971027,NIRUPAMA ROUL,17-Jun-2025 04:33 PM,Rejected-AOC,NOT L1 IN LOTTERY,15-Jul-2025 04:04 PM,,,,,,,,,,,,,,,,,,,,,,,AOC
,,,,,,,,,,,,,,,,,,,,,,,,,,,,,,,,,,,,,,,,,,,,,,,,,,,,,,,,,,,AOC,,,,,,,,,,,,,4,2971189,SIPRA SINGH,17-Jun-2025 07:30 PM,Rejected-AOC,NOT L1 IN LOTTERY,15-Jul-2025 04:04 PM,,,,,,,,,,,,,,,,,,,,,,,AOC
,,,,,,,,,,,,,,,,,,,,,,,,,,,,,,,,,,,,,,,,,,,,,,,,,,,,,,,,,,,AOC,,,,,,,,,,,,,5,2967684,SUMITRA SAHOO,18-Jun-2025 11:33 AM,Accepted-AOC,DUE TO L1 IN LOTTERY,15-Jul-2025 04:04 PM,,,,,,,,,,,,,,,,,,,,,,,AOC
