Organisation Chain,Tender Reference Number,Tender ID,Withdrawal Allowed,Tender Type,Form of contract,Tender Category,No. of Covers,General Technical Evaluation Allowed,ItemWise Technical Evaluation Allowed,Payment Mode,Is Multi Currency Allowed For BOQ,Is Multi Currency Allowed For Fee,Allow Two Stage Bidding,Cover No,Cover,Document Type,Description,Publish Date,Bid Opening Date,Document Download / Sale Start Date,Document Download / Sale End Date,Clarification Start Date,Clarification End Date,Bid Submission Start Date,Bid Submission End Date,Financial Bid Opening Date,EMD Amount in ₹,EMD Exemption Allowed,EMD Fee Type,EMD Percentage,EMD Payable To,EMD Payable At,S.No,Bank Name,Tender Fee in ₹,Fee Payable To,Fee Payable At,Tender Fee Exemption Allowed,Name,Address,Title,Work Description,Pre Qualification Details,Independent External Monitor/Remarks,Tender Value in ₹,Product Category,Sub category,Contract Type,Bid Validity(Days),Period Of Work(Days),Location,Pincode,Pre Bid Meeting Place,Pre Bid Meeting Address,Pre Bid Meeting Date,Bid Opening Place,Should Allow NDA Tender,Allow Preferential Bidder,Tender Stage,Contract Date :,Contract Value :,Work Completion Period in days :,Updated By :,Updated on :,AOC document :,AOC Description :,S.No,Bid Number,Bidder Name,Awarded Currency,Awarded Value,S.No.1,Bid Number.1,Bidder Name.1,Submitted Date,Status,Remarks,Status Updated On,Type :,Summary :,Updated By :.1,Updated On :,Document :,BOQ Comparative Chart :,Committee Chairperson/Co-ordinator Name :,Committee Chairperson/Co-ordinator Type :,Committee Members :,Updated By :.2,Updated on :.1,Document :.1,Organisation Chain :,Tender ID :,Tender Ref No :,Tender Title :,Type :.1,Summary :.1,Updated By :.3,Updated On :.1,Document :.2,Committee Chairperson/Co-ordinator Name :.1,Committee Chairperson/Co-ordinator Type :.1,Committee Members :.1,Updated By :.4,Updated On :.2,Financial Bid Opening Date:,Document :.3,Tender Stage
Odisha State Agricultural Marketing Board||RMC Narsinghpur,04 of 2024-25,2025_OSAMB_113291_1,Yes,Open Tender,Percentage,Works,2.0,No,No,Online,No,No,No,1.0,Fee/PreQual/Technical,.pdf,NIT,13-May-2025 10:00 AM,21-May-2025 11:00 AM,13-May-2025 10:00 AM,20-May-2025 05:00 PM,NA ,NA ,13-May-2025 10:00 AM,20-May-2025 05:00 PM,30-May-2025 11:30 AM,"2,65,931",Yes,percentage,1.0%,Nil,Nil,1.0,ICICI BANK,"10,000",Nil,Nil,No,"Sub-Collector,Athgarh-cum-Chairman,RMCNarasinghpur","At/PO.-Athagarh,Dist.-Cuttack",Construction of Office Building and 50MT Godowns at different PACS of Athgarh Block under RMC Narasinghpur,Construction of Office Building and 50MT Godowns at different PACS of Athgarh Block under RMC Narasinghpur,Please refer Tender documents. ,NA ,"2,65,93,130",Civil Works - Others,NA ,Tender,180.0,180.0,Athgarh Block,754029.0,NA ,NA ,NA ,Athgarh,No ,No,AOC,19-Jun-2025,"INR 25,266,132",180.0,PRAHLAD NARAYAN SHARMA,18-Jul-2025 03:50 PM,workorderathgarhblock.pdf (1143.00 KB),work order issued,1.0,2925852.0,JYOTI RANJAN BEHERA,INR,"25,266,132",1,2926070,BIJAY KETAN BHATTA,20-May-2025 12:21 PM,Not Admitted-Fee/PreQual/Technical,Not Complied with technical specification,28-May-2025 06:19 PM,Finance,two bidders are found valid,PRAHLAD NARAYAN SHARMA,19-Jun-2025 12:55 PM,finance_539041.pdf,BOQ Comparative Chart,subcollectorathgarh,Internal,clerk secretary je ae chairman,PRAHLAD NARAYAN SHARMA,19-Jun-2025 12:59 PM,finsummary_539041.pdf (1143.18 KB),Odisha State Agricultural Marketing Board||RMC Narsinghpur,2025_OSAMB_113291_1,04 of 2024-25,Construction of Office Building and 50MT Godowns at different PACS of Athgarh Block under RMC Narasinghpur,Technical,out of five nos of bidders two nos of biiders are qualified,PRAHLAD NARAYAN SHARMA,28-May-2025 06:19 PM,technical_539041.pdf,subcollectorathgarh,Internal,chairman secretary je aee sr arcs clerk,PRAHLAD NARAYAN SHARMA,28-May-2025 06:51 PM,30-May-2025 11:30 AM,techsummary_539041.pdf (1360.04 KB),AOC
,,,,,,,,,,,,,,,,.pdf,DTCN,,,,,,,,,,,,,,,,2.0,ICICI NEFT/RTGS,,,,,,,,,,,,,,,,,,,,,,,,,AOC,,,,,,,,,,,,,2,2925852,JYOTI RANJAN BEHERA,20-May-2025 08:58 AM,Accepted-AOC,L-2,18-Jul-2025 03:51 PM,,,,,,,,,,,,,,,,,,,,,,,,,,,,,AOC
,,,,,,,,,,,,,,2.0,Finance,.xls,BOQ,,,,,,,,,,,,,,,,,,,,,,,,,,,,,,,,,,,,,,,,,,AOC,,,,,,,,,,,,,3,2926110,MANOJ KUMAR BEHERA,20-May-2025 01:41 PM,Rejected-Finance,Accepted,19-Jun-2025 12:59 PM,,,,,,,,,,,,,,,,,,,,,,,,,,,,,AOC
,,,,,,,,,,,,,,,,,,,,,,,,,,,,,,,,,,,,,,,,,,,,,,,,,,,,,,,,,,,AOC,,,,,,,,,,,,,4,2925008,PRAKASH CHANDRA PARIDA,19-May-2025 02:22 PM,Not Admitted-Fee/PreQual/Technical,Not Complied with technical specification,28-May-2025 06:19 PM,,,,,,,,,,,,,,,,,,,,,,,,,,,,,AOC
,,,,,,,,,,,,,,,,,,,,,,,,,,,,,,,,,,,,,,,,,,,,,,,,,,,,,,,,,,,AOC,,,,,,,,,,,,,5,2926356,PURUSOTTAM BEHERA,20-May-2025 03:32 PM,Not Admitted-Fee/PreQual/Technical,Not Complied with technical specification,28-May-2025 06:19 PM,,,,,,,,,,,,,,,,,,,,,,,,,,,,,AOC
