Organisation Chain,Tender Reference Number,Tender ID,Withdrawal Allowed,Tender Type,Form of contract,Tender Category,No. of Covers,General Technical Evaluation Allowed,ItemWise Technical Evaluation Allowed,Payment Mode,Is Multi Currency Allowed For BOQ,Is Multi Currency Allowed For Fee,Allow Two Stage Bidding,Cover No,Cover,Document Type,Description,Publish Date,Bid Opening Date,Document Download / Sale Start Date,Document Download / Sale End Date,Clarification Start Date,Clarification End Date,Bid Submission Start Date,Bid Submission End Date,Financial Bid Opening Date,EMD Amount in ₹,EMD Exemption Allowed,EMD Fee Type,EMD Percentage,EMD Payable To,EMD Payable At,S.No,Bank Name,Tender Fee in ₹,VAT Charges in ₹,Fee Payable To,Fee Payable At,Tender Fee Exemption Allowed,Name,Address,Title,Work Description,Pre Qualification Details,Independent External Monitor/Remarks,Tender Value in ₹,Product Category,Sub category,Contract Type,Bid Validity(Days),Period Of Work(Days),Location,Pincode,Pre Bid Meeting Place,Pre Bid Meeting Address,Pre Bid Meeting Date,Bid Opening Place,Should Allow NDA Tender,Allow Preferential Bidder,Tender Stage,Contract Date :,Contract Value :,Work Completion Period in days :,Updated By :,Updated on :,AOC document :,AOC Description :,S.No,Bid Number,Bidder Name,Awarded Currency,Awarded Value,S.No.1,Bid Number.1,Bidder Name.1,Submitted Date,Status,Remarks,Status Updated On,Type :,Summary :,Updated By :.1,Updated On :,Document :,BOQ Comparative Chart :,Committee Chairperson/Co-ordinator Name :,Committee Chairperson/Co-ordinator Type :,Committee Members :,Updated By :.2,Updated on :.1,Document :.1,Organisation Chain :,Tender ID :,Tender Ref No :,Tender Title :,Type :.1,Summary :.1,Updated By :.3,Updated On :.1,Document :.2,Committee Chairperson/Co-ordinator Name :.1,Committee Chairperson/Co-ordinator Type :.1,Committee Members :.1,Updated By :.4,Updated On :.2,Financial Bid Opening Date:,Document :.3,Tender Stage
CE RW I||RWCIRCLE-SUNABEDA,CCERWCSBD Online - 23/2024-25,2025_CERWI_111742_8,Yes,National Competitive Bid,Percentage,Works,2.0,No,No,Online,No,No,No,1.0,Fee/PreQual/Technical,.pdf,"Bid Cost, EMD, RC,PAN, GST, Affidavit regarding correctness, No relation certificate",25-Mar-2025 03:00 PM,04-Apr-2025 11:00 AM,25-Mar-2025 03:00 PM,03-Apr-2025 05:00 PM,25-Mar-2025 03:00 PM ,02-Apr-2025 02:00 PM ,25-Mar-2025 03:00 PM,03-Apr-2025 05:00 PM,30-Apr-2025 11:00 AM,"77,000",Yes,fixed,,Nil,Nil,1.0,ICICI BANK,"10,000",0.0,Nil,Nil,No,Chief Construction Engineer,"Rural Works Circle, Sunabeda-1, Near Jagannath Temple, PIN-763001, Dist-Koraput","Construction of R and B Road to Ranginiguda GP. Guneipada, Block Lamtaput road in the District of Koraput under MMSY-Transferred Road Improvement Programme (MMSY-TRIP) for the year 2024-25","Construction of R and B Road to Ranginiguda GP. Guneipada, Block Lamtaput road in the District of Koraput under MMSY-Transferred Road Improvement Programme (MMSY-TRIP) for the year 2024-25",N.A. ,NA ,"76,38,000",Civil Works - Roads,NA ,Tender,90.0,182.0,SUNABEDA,763001.0,NA ,NA ,NA ,"Chief Construction Engineer, R.W.Circle, Sunabeda",No ,No,AOC,21-Jul-2025,"INR 7,638,219.188",182.0,Prabhakara Behera,21-Jul-2025 08:16 PM,AOCRANGINIGUDA.pdf (2016.00 KB),"Award of contract to Pratap Singh, B Class Contractor through transparency lottery system",1.0,2873521.0,PRATAP SINGH,INR,"6,493,250.13",1,2871556,ASUTOSH PATRA,29-Mar-2025 07:59 PM,Rejected-AOC,REJECT,21-Jul-2025 08:16 PM,Finance,cs,Prabhakara Behera,21-Jul-2025 08:06 PM,finance_534331.pdf,BOQ Comparative Chart,"Chief Construction Engineer, R.W. Circle, Sunabeda",Internal,"Superintending Engineer, DAO, Estimator of Rural Works Division, Sunabeda Estimator R.W. Circle Sunabeda",Prabhakara Behera,21-Jul-2025 08:10 PM,finsummary_534331.pdf (915.95 KB),CE RW I||RWCIRCLE-SUNABEDA,2025_CERWI_111742_8,CCERWCSBD Online - 23/2024-25,"Construction of R and B Road to Ranginiguda GP. Guneipada, Block Lamtaput road in the District of Koraput under MMSY-Transferred Road Improvement Programme (MMSY-TRIP) for the year 2024-25",Technical,Bid opening,Prabhakara Behera,24-Apr-2025 12:08 PM,technical_534331.pdf,"Chief Construction Engineer, R.W. Circle, Sunabeda",Internal,,Prabhakara Behera,24-Apr-2025 12:12 PM,30-Apr-2025 11:00 AM,techsummary_534331.pdf (905.19 KB),AOC
,,,,,,,,,,,,,,,,.pdf,"Annual Turn over certificate from CA, Similar nature of Work Certificate",,,,,,,,,,,,,,,,2.0,ICICI NEFT/RTGS,,,,,,,,,,,,,,,,,,,,,,,,,,AOC,,,,,,,,,,,,,2,2871532,Banoj kumar patra,30-Mar-2025 10:13 AM,Rejected-AOC,REJECT,21-Jul-2025 08:16 PM,,,,,,,,,,,,,,,,,,,,,,,,,,,,,AOC
,,,,,,,,,,,,,,,,.pdf,Machineries and other documents as per DTCN,,,,,,,,,,,,,,,,,,,,,,,,,,,,,,,,,,,,,,,,,,,AOC,,,,,,,,,,,,,3,2874964,Bhagaban Khora,02-Apr-2025 06:53 PM,Rejected-AOC,REJECT,21-Jul-2025 08:16 PM,,,,,,,,,,,,,,,,,,,,,,,,,,,,,AOC
,,,,,,,,,,,,,,2.0,Finance,.xls,BOQ,,,,,,,,,,,,,,,,,,,,,,,,,,,,,,,,,,,,,,,,,,,AOC,,,,,,,,,,,,,4,2873521,PRATAP SINGH,30-Mar-2025 05:18 PM,Accepted-AOC,"Award of contract to Pratap Singh, B Class Contractor through transparency lottery system",21-Jul-2025 08:16 PM,,,,,,,,,,,,,,,,,,,,,,,,,,,,,AOC
,,,,,,,,,,,,,,,,,,,,,,,,,,,,,,,,,,,,,,,,,,,,,,,,,,,,,,,,,,,,AOC,,,,,,,,,,,,,5,2874161,SAUMYA SHREE MISHRA,31-Mar-2025 09:57 PM,Rejected-AOC,REJECT,21-Jul-2025 08:16 PM,,,,,,,,,,,,,,,,,,,,,,,,,,,,,AOC
,,,,,,,,,,,,,,,,,,,,,,,,,,,,,,,,,,,,,,,,,,,,,,,,,,,,,,,,,,,,AOC,,,,,,,,,,,,,6,2875298,SHANTI HIAL,03-Apr-2025 04:04 PM,Rejected-Technical,DISQUALFIED,24-Apr-2025 12:12 PM,,,,,,,,,,,,,,,,,,,,,,,,,,,,,AOC
