Organisation Chain,Tender Reference Number,Tender ID,Withdrawal Allowed,Tender Type,Form of contract,Tender Category,No. of Covers,General Technical Evaluation Allowed,ItemWise Technical Evaluation Allowed,Payment Mode,Is Multi Currency Allowed For BOQ,Is Multi Currency Allowed For Fee,Allow Two Stage Bidding,Cover No,Cover,Document Type,Description,Publish Date,Bid Opening Date,Document Download / Sale Start Date,Document Download / Sale End Date,Clarification Start Date,Clarification End Date,Bid Submission Start Date,Bid Submission End Date,Financial Bid Opening Date,EMD Amount in ₹,EMD Exemption Allowed,EMD Fee Type,EMD Percentage,EMD Payable To,EMD Payable At,S.No,Corrigendum Title,Corrigendum Type,View,S.No.1,Bank Name,Tender Fee in ₹,VAT Charges in ₹,Fee Payable To,Fee Payable At,Tender Fee Exemption Allowed,Name,Address,Title,Work Description,Pre Qualification Details,Independent External Monitor/Remarks,Tender Value in ₹,Product Category,Sub category,Contract Type,Bid Validity(Days),Period Of Work(Days),Location,Pincode,Pre Bid Meeting Place,Pre Bid Meeting Address,Pre Bid Meeting Date,Bid Opening Place,Should Allow NDA Tender,Allow Preferential Bidder,Tender Stage,Contract Date :,Contract Value :,Work Completion Period in days :,Updated By :,Updated on :,AOC document :,AOC Description :,S.No,Bid Number,Bidder Name,Awarded Currency,Awarded Value,S.No.1,Bid Number.1,Bidder Name.1,Submitted Date,Status,Remarks,Status Updated On,Type :,Summary :,Updated By :.1,Updated On :,Document :,BOQ Comparative Chart :,Committee Chairperson/Co-ordinator Name :,Committee Chairperson/Co-ordinator Type :,Committee Members :,Updated By :.2,Updated on :.1,Document :.1,Organisation Chain :,Tender ID :,Tender Ref No :,Tender Title :,Type :.1,Summary :.1,Updated By :.3,Updated On :.1,Document :.2,Committee Chairperson/Co-ordinator Name :.1,Committee Chairperson/Co-ordinator Type :.1,Committee Members :.1,Updated By :.4,Updated On :.2,Financial Bid Opening Date:,Document :.3,S.No.2,Revocation Title,Revocation Description,Published Date,Document Name,Document Size(in KB),Revocated To,Tender Stage
CE RW I||RWCIRCLE-BHUBANESWAR,Tender Online C.C-25 of 2024,2025_CERWI_109057_21,Yes,National Competitive Bid,Percentage,Works,2.0,No,No,Online,No,No,No,1.0,Fee/PreQual/Technical,.pdf,"Tender Paper Cost, EMD, GSTIN, PAN, Registration Certificate",21-Jan-2025 02:00 PM,29-Jan-2025 11:00 AM,21-Jan-2025 02:00 PM,28-Jan-2025 05:00 PM,NA ,NA ,21-Jan-2025 02:00 PM,28-Jan-2025 05:00 PM,25-Apr-2025 09:00 AM,"4,14,707",Yes,percentage,1.0%,Nil,Nil,1.0,Other Corrigendum,Other,,1.0,ICICI BANK,"10,000",0.0,Nil,Nil,No,ChiefConstructionEngineer,"O/o ChiefConstructionEngineer,CentralRWCircle,BBSR","Construction of road from Gothachauka to Kanti R.D road to Chharichhaka- Gop PWD road via- Gadsitha, Harijana sahi, Nuasahi, Soerada,Palashree under MMSY-TRIP for the year 2024-25","Construction of road from Gothachauka to Kanti R.D road to Chharichhaka- Gop PWD road via- Gadsitha, Harijana sahi, Nuasahi, Soerada,Palashree under MMSY-TRIP for the year 2024-25",Please refer Tender documents. ,NA ,"4,14,70,681",Civil Works - Roads,NA ,Tender,90.0,240.0,Nimapara,752106.0,NA ,NA ,NA ,"O/o ChiefConstructionEngineer,CentralRWCircle,BBSR",No ,No,AOC,11-Jul-2025,"INR 35,254,226",240.0,Priyambada Swain,30-Jul-2025 11:20 AM,GothachaukaAgmtDetails.pdf (1036.00 KB),"Work order letterNo.2688 dtd.11.07.2025 and Agmt No.10 P1 of 2025-26 dtd.11.07.2025 of Superintending Engineer, Rural Works Division, Nimapara",1.0,2780737.0,BISWOJIT PANDA,INR,"35,254,226",1,2780737,BISWOJIT PANDA,28-Jan-2025 04:04 PM,Accepted-AOC,Accepted,30-Jul-2025 11:20 AM,Finance,5 nos bidder qualified in the tender,Mausumi Mishra,28-Apr-2025 12:07 PM,,BOQ Comparative Chart,Chief Construction Engineer,Internal,ExecutiveEngineerRWDivision Nayagarh SrDAORWDivision Nimapara PAtoChiefConstructionEngineerCentralRuralWorksCircleBBSR,Mausumi Mishra,17-Jun-2025 04:19 PM,finsummary_523751.pdf (253.50 KB),CE RW I||RWCIRCLE-BHUBANESWAR,2025_CERWI_109057_21,Tender Online C.C-25 of 2024,"Construction of road from Gothachauka to Kanti R.D road to Chharichhaka- Gop PWD road via- Gadsitha, Harijana sahi, Nuasahi, Soerada,Palashree under MMSY-TRIP for the year 2024-25",Technical,7 nos bidder participated in the tender,Mausumi Mishra,24-Apr-2025 08:11 PM,,Chief Construction Engineer,Internal,ExecutiveEngineerRWDivision Nayagarh SrDAORWDivision Nimapara PAtoChiefConstructionEngineerCentralRuralWorksCircleBBSR,Mausumi Mishra,24-Apr-2025 08:15 PM,25-Apr-2025 09:00 AM,techsummary_523751.pdf (1541.75 KB),1.0,Tender Revocation,Tender Revocation,24-Apr-2025 07:48 PM,2006.pdf ,2040.44,Technical Opening,AOC
,,,,,,,,,,,,,,,,.pdf,"Work in Hand, Machineries, Affidavit of Correctness Certificate",,,,,,,,,,,,,,,,,,,,2.0,ICICI NEFT/RTGS,,,,,,,,,,,,,,,,,,,,,,,,,,AOC,,,,,,,,,,,,,2,2783002,HARISANKAR PRADHAN,28-Jan-2025 11:45 AM,Rejected-Finance,Other than L1,17-Jun-2025 04:19 PM,,,,,,,,,,,,,,,,,,,,,,,,,,,,,,,,,,,,AOC
,,,,,,,,,,,,,,,,.pdf,"No Relationship Certificate, ATO, Work Experience and required documents as per DTCN",,,,,,,,,,,,,,,,,,,,,,,,,,,,,,,,,,,,,,,,,,,,,,,AOC,,,,,,,,,,,,,3,2784122,R K ROUT AND PARTNERS,28-Jan-2025 04:12 PM,Rejected-Finance,Other than L1 and L2,17-Jun-2025 04:19 PM,,,,,,,,,,,,,,,,,,,,,,,,,,,,,,,,,,,,AOC
,,,,,,,,,,,,,,2.0,Finance,.xls,BOQ,,,,,,,,,,,,,,,,,,,,,,,,,,,,,,,,,,,,,,,,,,,,,,,AOC,,,,,,,,,,,,,4,2783141,SRIKANTA KUMAR SAHOO,28-Jan-2025 12:32 PM,Rejected-Technical,As per Clause No.2.1(4) of the Eligibility Criteria of General Instructions To the Tenderers of the DTCN (Insuffucient Similar nature of work),24-Apr-2025 08:15 PM,,,,,,,,,,,,,,,,,,,,,,,,,,,,,,,,,,,,AOC
,,,,,,,,,,,,,,,,,,,,,,,,,,,,,,,,,,,,,,,,,,,,,,,,,,,,,,,,,,,,,,,,AOC,,,,,,,,,,,,,5,2783740,Subash Chandra Mohanty,28-Jan-2025 03:30 PM,Rejected-Finance,Other than L1 and L2,17-Jun-2025 04:19 PM,,,,,,,,,,,,,,,,,,,,,,,,,,,,,,,,,,,,AOC
,,,,,,,,,,,,,,,,,,,,,,,,,,,,,,,,,,,,,,,,,,,,,,,,,,,,,,,,,,,,,,,,AOC,,,,,,,,,,,,,6,2782179,SURESH KUMAR PANDA,28-Jan-2025 12:29 AM,Rejected-AOC,Rejected,30-Jul-2025 11:20 AM,,,,,,,,,,,,,,,,,,,,,,,,,,,,,,,,,,,,AOC
,,,,,,,,,,,,,,,,,,,,,,,,,,,,,,,,,,,,,,,,,,,,,,,,,,,,,,,,,,,,,,,,AOC,,,,,,,,,,,,,7,2783913,Tushar Kant Baral,28-Jan-2025 03:23 PM,Rejected-Technical,As per Clause No.2.1(1) of the Eligibility Criteria of General Instructions To the Tenderers of the DTCN (Suppression of facts),24-Apr-2025 08:15 PM,,,,,,,,,,,,,,,,,,,,,,,,,,,,,,,,,,,,AOC
