Organisation Chain,Tender Reference Number,Tender ID,Withdrawal Allowed,Tender Type,Form of contract,Tender Category,No. of Covers,General Technical Evaluation Allowed,ItemWise Technical Evaluation Allowed,Payment Mode,Is Multi Currency Allowed For BOQ,Is Multi Currency Allowed For Fee,Allow Two Stage Bidding,Cover No,Cover,Document Type,Description,Publish Date,Bid Opening Date,Document Download / Sale Start Date,Document Download / Sale End Date,Clarification Start Date,Clarification End Date,Bid Submission Start Date,Bid Submission End Date,Financial Bid Opening Date,EMD Amount in ₹,EMD Exemption Allowed,EMD Fee Type,EMD Percentage,EMD Payable To,EMD Payable At,S.No,Corrigendum Title,Corrigendum Type,View,S.No.1,Bank Name,Tender Fee in ₹,VAT Charges in ₹,Fee Payable To,Fee Payable At,Tender Fee Exemption Allowed,Name,Address,Title,Work Description,Pre Qualification Details,Independent External Monitor/Remarks,Tender Value in ₹,Product Category,Sub category,Contract Type,Bid Validity(Days),Period Of Work(Days),Location,Pincode,Pre Bid Meeting Place,Pre Bid Meeting Address,Pre Bid Meeting Date,Bid Opening Place,Should Allow NDA Tender,Allow Preferential Bidder,Tender Stage,Contract Date :,Contract Value :,Work Completion Period in days :,Updated By :,Updated on :,AOC document :,AOC Description :,S.No,Bid Number,Bidder Name,Awarded Currency,Awarded Value,S.No.1,Bid Number.1,Bidder Name.1,Submitted Date,Status,Remarks,Status Updated On,Type :,Summary :,Updated By :.1,Updated On :,Document :,BOQ Comparative Chart :,Committee Chairperson/Co-ordinator Name :,Committee Chairperson/Co-ordinator Type :,Committee Members :,Updated By :.2,Updated on :.1,Document :.1,Organisation Chain :,Tender ID :,Tender Ref No :,Tender Title :,Type :.1,Summary :.1,Updated By :.3,Updated On :.1,Document :.2,Committee Chairperson/Co-ordinator Name :.1,Committee Chairperson/Co-ordinator Type :.1,Committee Members :.1,Updated By :.4,Updated On :.2,Financial Bid Opening Date:,Document :.3,Tender Stage
CE RW I||RWCIRCLE-KENDRAPARA,Tender Online RCK-04/25,2025_CERWI_110365_1,Yes,National Competitive Bid,Percentage,Works,2.0,No,No,Online,No,No,No,1.0,Fee/PreQual/Technical,.pdf,"Paper cost, GST, EMD PAN,RC,Affidavit regarding correctness",07-Feb-2025 06:50 PM,25-Feb-2025 11:00 AM,07-Feb-2025 06:50 PM,24-Feb-2025 05:00 PM,07-Feb-2025 06:50 PM ,21-Feb-2025 02:00 PM ,07-Feb-2025 06:50 PM,24-Feb-2025 05:00 PM,17-Apr-2025 11:30 AM,"1,74,011",Yes,percentage,1.0%,Nil,Nil,1.0,Cancellation of Tender for the work Impvt to road and CD works of Bari to Binjharpur Road,Other,,1.0,ICICI BANK,"10,000",0.0,Nil,Nil,No,"Chief Construction Engineer,R.W Circle KPD-JJP","O/o CCE,R.W Circle,Kendrapara-Jajpur",Construction and Maintenance of NH16 Balibiri to HLC Range 1 R and B Road in the Dist of Jajpur under MMSY-TRIP for the year 2024-25.,Construction and Maintenance of for the year 2024-25.,Please refer tender documents ,NA ,"1,74,01,098",Civil Works - Roads,NA ,Tender,90.0,180.0,Jajpur,755001.0,NA ,NA ,NA ,"O/o CCE,R.W Circle,Kendrapara-Jajpur",No ,No,AOC,23-Jul-2025,"INR 15,662,728.44",180.0,Satyajit Dalai,23-Jul-2025 01:03 PM,wo17.pdf (73.00 KB),The work has been awarded to Diptirekha Behera,1.0,2824332.0,DIPTIREKHA BEHERA,INR,"15,662,728.44",1,2831266,DEO CONSTRUCTION,22-Feb-2025 07:50 PM,Rejected-Technical,Disqualified due to non submission of EMD as per clause no.06 of DTCN and ( As per office memorandum no.503 dtd 17.01.2022 of works deptt. Local MSME will be exempted from paying EMD. But the agency is registered as MSME outside odisha.),11-Apr-2025 02:02 PM,Finance,04 no of bidders have been participated,Nibedita Nayak,21-Apr-2025 03:16 PM,,BOQ Comparative Chart,CCE,Internal,,Nibedita Nayak,23-Jul-2025 12:50 PM,finsummary_529225.pdf (117.49 KB),CE RW I||RWCIRCLE-KENDRAPARA,2025_CERWI_110365_1,Tender Online RCK-04/25,Construction and Maintenance of NH16 Balibiri to HLC Range 1 R and B Road in the Dist of Jajpur under MMSY-TRIP for the year 2024-25.,Technical,05 no of bidders have been participated,Nibedita Nayak,25-Feb-2025 01:42 PM,,CCE,Internal,,Nibedita Nayak,11-Apr-2025 02:02 PM,17-Apr-2025 11:30 AM,techsummary_529225.pdf (3718.29 KB),AOC
,,,,,,,,,,,,,,,,.pdf,"Labour license, Similar nature of work, Work in hand, Annual Turn Over, No relation certificate,",,,,,,,,,,,,,,,,,,,,2.0,ICICI NEFT/RTGS,,,,,,,,,,,,,,,,,,,,,,,,,,AOC,,,,,,,,,,,,,2,2824332,DIPTIREKHA BEHERA,18-Feb-2025 03:04 PM,Accepted-AOC,The work has been awarded to Diptirekha Behera,23-Jul-2025 01:04 PM,,,,,,,,,,,,,,,,,,,,,,,,,,,,,AOC
,,,,,,,,,,,,,,,,.pdf,"Machinery own obtained on hireBalance sheet, Bidder Contact address and other documents as per DTCN",,,,,,,,,,,,,,,,,,,,,,,,,,,,,,,,,,,,,,,,,,,,,,,AOC,,,,,,,,,,,,,3,2831783,MS SAI PRACHYA CONSTRUCTIONS,24-Feb-2025 09:40 AM,Rejected-Finance,Rejected Bidder,23-Jul-2025 12:50 PM,,,,,,,,,,,,,,,,,,,,,,,,,,,,,AOC
,,,,,,,,,,,,,,2.0,Finance,.xls,BOQ,,,,,,,,,,,,,,,,,,,,,,,,,,,,,,,,,,,,,,,,,,,,,,,AOC,,,,,,,,,,,,,4,2835749,SAI KRISHNA CONSTRUCTION,24-Feb-2025 04:22 PM,Rejected-Finance,Rejected Bidder,23-Jul-2025 12:50 PM,,,,,,,,,,,,,,,,,,,,,,,,,,,,,AOC
,,,,,,,,,,,,,,,,,,,,,,,,,,,,,,,,,,,,,,,,,,,,,,,,,,,,,,,,,,,,,,,,AOC,,,,,,,,,,,,,5,2832000,YASHOBANTA NAYAK,23-Feb-2025 10:43 PM,Rejected-Finance,Rejected Bidder,23-Jul-2025 12:50 PM,,,,,,,,,,,,,,,,,,,,,,,,,,,,,AOC
