Organisation Chain,Tender Reference Number,Tender ID,Withdrawal Allowed,Tender Type,Form of contract,Tender Category,No. of Covers,General Technical Evaluation Allowed,ItemWise Technical Evaluation Allowed,Payment Mode,Is Multi Currency Allowed For BOQ,Is Multi Currency Allowed For Fee,Allow Two Stage Bidding,Cover No,Cover,Document Type,Description,Publish Date,Bid Opening Date,Document Download / Sale Start Date,Document Download / Sale End Date,Clarification Start Date,Clarification End Date,Bid Submission Start Date,Bid Submission End Date,EMD Amount in ₹,EMD Exemption Allowed,EMD Fee Type,EMD Percentage,EMD Payable To,EMD Payable At,S.No,Bank Name,Tender Fee in ₹,Fee Payable To,Fee Payable At,Tender Fee Exemption Allowed,Name,Address,Title,Work Description,Pre Qualification Details,Independent External Monitor/Remarks,Tender Value in ₹,Product Category,Sub category,Contract Type,Bid Validity(Days),Period Of Work(Days),Location,Pincode,Pre Bid Meeting Place,Pre Bid Meeting Address,Pre Bid Meeting Date,Bid Opening Place,Should Allow NDA Tender,Allow Preferential Bidder,Tender Stage,Contract Date :,Contract Value :,Work Completion Period in days :,Updated By :,Updated on :,AOC document :,S.No,Bid Number,Bidder Name,Awarded Currency,Awarded Value,S.No.1,Bid Number.1,Bidder Name.1,Submitted Date,Status,Remarks,Status Updated On,Type :,Summary :,Updated By :.1,Updated On :,Document :,BOQ Comparative Chart :,Committee Chairperson/Co-ordinator Name :,Committee Chairperson/Co-ordinator Type :,Committee Members :,Updated By :.2,Updated on :.1,Document :.1,Organisation Chain :,Tender ID :,Tender Ref No :,Tender Title :,Committee Chairperson/Co-ordinator Name :.1,Committee Chairperson/Co-ordinator Type :.1,Committee Members :.1,Updated By :.3,Updated On :.1,Document :.2,Tender Stage
CE AND BM IK BASIN BARINIPUT JEYPORE||Upper Indravati Dam Circle Khatiguda||Mechanical Division Khatiguda,EE-MDK-02/25-26,2025_MCHDK_113602_1,Yes,Open Tender,Percentage,Works,1.0,No,No,Online,No,No,No,1.0,Fee/PreQual/Technical/Finance,.pdf,"SCAN COPY OF TENDER FEE,EMD,GST,RC PAN,EPF,ESI, AFFIDAVIT AND OTHER RELEVANT DOCUMENTS AS PER DTCN",20-May-2025 10:00 AM,30-May-2025 12:00 PM,20-May-2025 10:00 AM,29-May-2025 05:00 PM,20-May-2025 10:00 AM ,29-May-2025 05:00 PM ,20-May-2025 10:00 AM,29-May-2025 05:00 PM,"21,000",No,fixed,,Nil,Nil,1.0,ICICI BANK,"6,000",Nil,Nil,No,"EE,Mechanical Division, Khatiguda","O/o the EE,Mechanical Division, Khatiguda, Nabrangpur",Painting of Upstream Side area of 04 nos. of Radial Crest Gates out of 07 nos of size 15.00 M x 12.50 M along with Rubber Seal Changing of Indravati Masonry Dam for the Financial Year 2025-26,Painting of Upstream Side area of 04 nos. of Radial Crest Gates out of 07 nos of size 15.00 M x 12.50 M along with Rubber Seal Changing of Indravati Masonry Dam for the Financial Year 2025-26,Please refer Tender documents. ,NA ,"20,88,190",Mechanical Works,NA ,Tender,90.0,30.0,Khatiguda,764085.0,NA ,NA ,NA ,"O/o the EE,Mechanical Division, Khatiguda",No ,No,AOC,04-Jul-2025,"INR 1,775,169.59",30.0,Shreekant Kumar Sahu,05-Jul-2025 10:56 AM,workorder.pdf (376.00 KB),1.0,2929544.0,M/S Ashreebad Fabricators,INR,"1,775,169.59",1,2940940,BALAJI DRILLERS AND ENGINEERS,29-May-2025 04:35 PM,Rejected-AOC,"After transparent Lottery, M/s Ashreebad Fabricators declared as L1 Bidder.",05-Jul-2025 10:56 AM,Finance,ok,Shreekant Kumar Sahu,04-Jul-2025 06:21 PM,finance_540160.pdf,BOQ Comparative Chart,"Er. Niroj Kumar Lohar, EE, Mechanical Division, Khatiguda",Internal,,Shreekant Kumar Sahu,04-Jul-2025 06:38 PM,finsummary_540160.pdf (486.45 KB),CE AND BM IK BASIN BARINIPUT JEYPORE||Upper Indravati Dam Circle Khatiguda||Mechanical Division Khatiguda,2025_MCHDK_113602_1,EE-MDK-02/25-26,Painting of Upstream Side area of 04 nos. of Radial Crest Gates out of 07 nos of size 15.00 M x 12.50 M along with Rubber Seal Changing of Indravati Masonry Dam for the Financial Year 2025-26,"Er. Niroj Kumar Lohar, EE, Mechanical Division, Khatiguda",Internal,,Shreekant Kumar Sahu,04-Jul-2025 06:30 PM,techsummary_540160.pdf (364.11 KB),AOC
,,,,,,,,,,,,,,,,.xls,BILL OF QUANTITY,,,,,,,,,,,,,,,2.0,ICICI NEFT/RTGS,,,,,,,,,,,,,,,,,,,,,,,,,AOC,,,,,,,,,,,,2,2926512,DASH ENTERPRISERS PROP.RAJEEB LOCHAN DASH,20-May-2025 06:00 PM,Rejected-AOC,"After transparent Lottery, M/s Ashreebad Fabricators declared as L1 Bidder.",05-Jul-2025 10:56 AM,,,,,,,,,,,,,,,,,,,,,,,AOC
,,,,,,,,,,,,,,,,,,,,,,,,,,,,,,,,,,,,,,,,,,,,,,,,,,,,,,,,,,AOC,,,,,,,,,,,,3,2937874,KAMAKSHI ENGINEERING WORKS,28-May-2025 01:59 PM,Rejected-AOC,"After transparent Lottery, M/s Ashreebad Fabricators declared as L1 Bidder.",05-Jul-2025 10:56 AM,,,,,,,,,,,,,,,,,,,,,,,AOC
,,,,,,,,,,,,,,,,,,,,,,,,,,,,,,,,,,,,,,,,,,,,,,,,,,,,,,,,,,AOC,,,,,,,,,,,,4,2929556,M/S Abirvab Steel Product,29-May-2025 11:32 AM,Rejected-AOC,"After transparent Lottery, M/s Ashreebad Fabricators declared as L1 Bidder.",05-Jul-2025 10:56 AM,,,,,,,,,,,,,,,,,,,,,,,AOC
,,,,,,,,,,,,,,,,,,,,,,,,,,,,,,,,,,,,,,,,,,,,,,,,,,,,,,,,,,AOC,,,,,,,,,,,,5,2929544,M/S Ashreebad Fabricators,29-May-2025 01:19 PM,Accepted-AOC,"After transparent Lottery, M/s Ashreebad Fabricators declared as L1 Bidder.",05-Jul-2025 10:56 AM,,,,,,,,,,,,,,,,,,,,,,,AOC
,,,,,,,,,,,,,,,,,,,,,,,,,,,,,,,,,,,,,,,,,,,,,,,,,,,,,,,,,,AOC,,,,,,,,,,,,6,2940175,RENUBALA DASH,29-May-2025 01:33 PM,Rejected-AOC,"After transparent Lottery, M/s Ashreebad Fabricators declared as L1 Bidder.",05-Jul-2025 10:56 AM,,,,,,,,,,,,,,,,,,,,,,,AOC
