Organisation Chain,Tender Reference Number,Tender ID,Withdrawal Allowed,Tender Type,Form of contract,Tender Category,No. of Covers,General Technical Evaluation Allowed,ItemWise Technical Evaluation Allowed,Payment Mode,Is Multi Currency Allowed For BOQ,Is Multi Currency Allowed For Fee,Allow Two Stage Bidding,Cover No,Cover,Document Type,Description,Publish Date,Bid Opening Date,Document Download / Sale Start Date,Document Download / Sale End Date,Clarification Start Date,Clarification End Date,Bid Submission Start Date,Bid Submission End Date,EMD Amount in ₹,EMD Exemption Allowed,EMD Fee Type,EMD Percentage,EMD Payable To,EMD Payable At,S.No,Bank Name,Tender Fee in ₹,VAT Charges in ₹,Fee Payable To,Fee Payable At,Tender Fee Exemption Allowed,Name,Address,Title,Work Description,Pre Qualification Details,Independent External Monitor/Remarks,Tender Value in ₹,Product Category,Sub category,Contract Type,Bid Validity(Days),Period Of Work(Days),Location,Pincode,Pre Bid Meeting Place,Pre Bid Meeting Address,Pre Bid Meeting Date,Bid Opening Place,Should Allow NDA Tender,Allow Preferential Bidder,Tender Stage,Contract Date :,Contract Value :,Work Completion Period in days :,Updated By :,Updated on :,AOC document :,AOC Description :,S.No,Bid Number,Bidder Name,Awarded Currency,Awarded Value,S.No.1,Bid Number.1,Bidder Name.1,Submitted Date,Status,Remarks,Status Updated On,Type :,Summary :,Updated By :.1,Updated On :,Document :,BOQ Comparative Chart :,Committee Chairperson/Co-ordinator Name :,Committee Chairperson/Co-ordinator Type :,Committee Members :,Updated By :.2,Updated on :.1,Document :.1,Organisation Chain :,Tender ID :,Tender Ref No :,Tender Title :,Committee Chairperson/Co-ordinator Name :.1,Committee Chairperson/Co-ordinator Type :.1,Committee Members :.1,Updated By :.3,Updated On :.1,Document :.2,Tender Stage
PHEO||PH Circle Bhawanipatna||PH Division Balangir,EEPH BGR 25 of 2018 - 19,2019_PHEO_53965_1,Yes,National Competitive Bid,Percentage,Works,1.0,No,No,Online,No,No,No,1.0,Fee/PreQual/Technical/Finance,.pdf,"Paper cost, EMD, PAN, GST ,Registration certificate, Experience Certificate etc.",21-Feb-2019 02:00 PM,01-Mar-2019 12:00 PM,21-Feb-2019 02:00 PM,27-Feb-2019 05:00 PM,NA ,NA ,21-Feb-2019 02:00 PM,27-Feb-2019 05:00 PM,"30,076",Yes,percentage,1.0%,"E E, PH division, Balangir",Balanir,1.0,ICICI BANK,"6,000",0.0,"E E, PH division, Balangir",Balangir,Yes,Executive Engineer,"Executive Engineer PH Division, Balangir",Shifting of public utilities drinking water pipeline from Butupalli Baghiapada Chakk towards Palas Boudh under R and B Deposit,Shifting of public utilities drinking water pipeline from Butupalli Baghiapada Chakk towards Palas Boudh under R and B Deposit,Please refer DTCN ,NA ,"30,07,637",Civil Works - Water Works,NA ,Tender,120.0,90.0,Boudh NAC,762014.0,NA ,NA ,NA ,"Executive Engineer PH Division, Balangir",No ,No,AOC,21-Jul-2025,"INR 2,797,103",90.0,Indrajit Sahu,21-Jul-2025 12:28 PM,wo.pdf (383.00 KB),L1 bidder has responded,1.0,1087561.0,Prativa Sahoo,INR,"2,797,102.76",1,1087238,ANSUMAN UDGATA,27-Feb-2019 11:39 AM,Rejected-AOC,Rejected as per OPWD code,21-Jul-2025 12:28 PM,Finance,OPENING SUMMERY,Parbati Mohan Parida,01-Mar-2019 03:34 PM,finance_291516.pdf,BOQ Comparative Chart,Patbati Mohan Parida,Internal,"ParbatimohanParida,ManojkumarChoudury,SubratkumarNayak,RajibKishan",Parbati Mohan Parida,01-Mar-2019 03:56 PM,finsummary_291516.pdf (92.92 KB),PHEO||PH Circle Bhawanipatna||PH Division Balangir,2019_PHEO_53965_1,EEPH BGR 25 of 2018 - 19,Shifting of public utilities drinking water pipeline from Butupalli Baghiapada Chakk towards Palas Boudh under R and B Deposit,Parbati Mohan Parida,Internal,"ParbatimohanParida,ManojkumarChoudhury,SubratkumarNayak,RajibKishan",Parbati Mohan Parida,01-Mar-2019 03:47 PM,techsummary_291516.pdf (92.92 KB),AOC
,,,,,,,,,,,,,,,,.pdf,Other document as per DTCN,,,,,,,,,,,,,,,2.0,ICICI NEFT/RTGS,,,,,,,,,,,,,,,,,,,,,,,,,,AOC,,,,,,,,,,,,,2,1087285,ASHIS KUMAR PATRA,27-Feb-2019 12:31 PM,Rejected-AOC,Rejected as per OPWD code,21-Jul-2025 12:28 PM,,,,,,,,,,,,,,,,,,,,,,,AOC
,,,,,,,,,,,,,,,,.xls,Bill of Quantity,,,,,,,,,,,,,,,,,,,,,,,,,,,,,,,,,,,,,,,,,,AOC,,,,,,,,,,,,,3,1083094,DHARMESH KUMAR NAYAK,26-Feb-2019 07:49 PM,Rejected-AOC,Rejected as per OPWD code,21-Jul-2025 12:28 PM,,,,,,,,,,,,,,,,,,,,,,,AOC
,,,,,,,,,,,,,,,,,,,,,,,,,,,,,,,,,,,,,,,,,,,,,,,,,,,,,,,,,,,AOC,,,,,,,,,,,,,4,1087369,MANAS KUMAR JENA,27-Feb-2019 01:54 PM,Rejected-AOC,Rejected as per OPWD code,21-Jul-2025 12:28 PM,,,,,,,,,,,,,,,,,,,,,,,AOC
,,,,,,,,,,,,,,,,,,,,,,,,,,,,,,,,,,,,,,,,,,,,,,,,,,,,,,,,,,,AOC,,,,,,,,,,,,,5,1087561,Prativa Sahoo,27-Feb-2019 04:42 PM,Accepted-AOC,Awarded as per OPWD code,21-Jul-2025 12:28 PM,,,,,,,,,,,,,,,,,,,,,,,AOC
