Organisation Chain,Tender Reference Number,Tender ID,Withdrawal Allowed,Tender Type,Form of contract,Tender Category,No. of Covers,General Technical Evaluation Allowed,ItemWise Technical Evaluation Allowed,Payment Mode,Is Multi Currency Allowed For BOQ,Is Multi Currency Allowed For Fee,Allow Two Stage Bidding,Cover No,Cover,Document Type,Description,Publish Date,Bid Opening Date,Document Download / Sale Start Date,Document Download / Sale End Date,Clarification Start Date,Clarification End Date,Bid Submission Start Date,Bid Submission End Date,Financial Bid Opening Date,EMD Amount in ₹,EMD Exemption Allowed,EMD Fee Type,EMD Percentage,EMD Payable To,EMD Payable At,S.No,Bank Name,Tender Fee in ₹,VAT Charges in ₹,Fee Payable To,Fee Payable At,Tender Fee Exemption Allowed,Name,Address,Title,Work Description,Pre Qualification Details,Independent External Monitor/Remarks,Tender Value in ₹,Product Category,Sub category,Contract Type,Bid Validity(Days),Period Of Work(Days),Location,Pincode,Pre Bid Meeting Place,Pre Bid Meeting Address,Pre Bid Meeting Date,Bid Opening Place,Should Allow NDA Tender,Allow Preferential Bidder,Tender Stage,Contract Date :,Contract Value :,Work Completion Period in days :,Updated By :,Updated on :,AOC document :,AOC Description :,S.No,Bid Number,Bidder Name,Awarded Currency,Awarded Value,S.No.1,Bid Number.1,Bidder Name.1,Submitted Date,Status,Remarks,Status Updated On,Type :,Summary :,Updated By :.1,Updated On :,Document :,BOQ Comparative Chart :,Committee Chairperson/Co-ordinator Name :,Committee Chairperson/Co-ordinator Type :,Committee Members :,Updated By :.2,Updated on :.1,Document :.1,Organisation Chain :,Tender ID :,Tender Ref No :,Tender Title :,Type :.1,Summary :.1,Updated By :.3,Updated On :.1,Document :.2,Committee Chairperson/Co-ordinator Name :.1,Committee Chairperson/Co-ordinator Type :.1,Committee Members :.1,Updated By :.4,Updated On :.2,Financial Bid Opening Date:,Document :.3,Tender Stage
Directorate of Ports and IWT||Directorate of Ports and IWT,DPIWT-14/2024-25,2025_PIWT_111784_1,Yes,Open Tender,Percentage,Works,2.0,No,No,Online,No,No,No,1.0,Fee/PreQual/Technical,.pdf,"GST, PAN, RC, Proof regarding payment of online tender paper cost and EMD",20-Mar-2025 11:00 AM,07-Apr-2025 11:30 AM,20-Mar-2025 11:00 AM,05-Apr-2025 05:00 PM,20-Mar-2025 11:00 AM ,27-Mar-2025 03:00 PM ,20-Mar-2025 11:00 AM,05-Apr-2025 05:00 PM,06-May-2025 12:00 PM,"1,92,000",Yes,fixed,,Nil,Nil,1.0,ICICI BANK,"10,000",0.0,Nil,Nil,No,"DIRECTOR, PORTS AND IWT, ODISHA, BHUBANESWAR","DIRECTORATE OF PORTS AND INLAND WATER TRANSPORT, GROUND FLOOR, ZONE-A, FORTUNE TOWERS, CHANDRASEKHARPUR, BHUBANESWAR-751023",Construction of Protection Wall to the Right Side of IWT Jetty at Chandbali in Bhadrak District,CIVIL CONSTRUCTION WORKS,Please refer Tender documents. ,NA ,"1,91,98,485",Civil Works - Others,NA ,Tender,90.0,150.0,CHANDABALI IN BHADRAK DISTRICT,756133.0,NA ,NA ,NA ,"DIRECTORATE OF PORTS AND IWT, ODISHA, BHUBANESWAR",No ,No,AOC,21-Jun-2025,"INR 16,320,631.55",150.0,SRADHANJALI SAHOO,15-Jul-2025 03:50 PM,AOC.pdf (599.00 KB),AOC,1.0,2876628.0,JAGANNATH ROUT,INR,"16,320,631.55",1,2876643,Abhimanyu Das,05-Apr-2025 02:16 PM,Rejected-Finance,"DUE TO SELECTION OF OF J ROUT, L1 BIDDER THROUGH TRANSPARENT LOTTERY SYSTEM",15-May-2025 03:54 PM,Finance,SIX NOS. BOQ DOWNLOADED,SRADHANJALI SAHOO,08-May-2025 04:35 PM,finance_533732.pdf,BOQ Comparative Chart,PADMALOCHAN ROUL,Internal,"B N MANSINGH, S MOHAPATRA, A RAJ, S SAHOO",SRADHANJALI SAHOO,15-May-2025 03:54 PM,finsummary_533732.pdf (747.63 KB),Directorate of Ports and IWT||Directorate of Ports and IWT,2025_PIWT_111784_1,DPIWT-14/2024-25,Construction of Protection Wall to the Right Side of IWT Jetty at Chandbali in Bhadrak District,Technical,08 (EIGHT) NOS. TENDER DOWNLOADED,SRADHANJALI SAHOO,21-Apr-2025 01:14 PM,technical_533732.pdf,PADMALOCHAN ROUL,Internal,"BAIKUNTHANATH MANSINGH, A RAJ, SS SAHOO",SRADHANJALI SAHOO,02-May-2025 04:41 PM,06-May-2025 12:00 PM,techsummary_533732.pdf (1049.24 KB),AOC
,,,,,,,,,,,,,,,,.pdf,"Affidavit, Machinery Details and other documents as per DTCN",,,,,,,,,,,,,,,,2.0,ICICI NEFT/RTGS,,,,,,,,,,,,,,,,,,,,,,,,,,AOC,,,,,,,,,,,,,2,2875259,Ananta Kumar Das,03-Apr-2025 01:56 PM,Rejected-Finance,"DUE TO SELECTION OF OF J ROUT, L1 BIDDER THROUGH TRANSPARENT LOTTERY SYSTEM",15-May-2025 03:54 PM,,,,,,,,,,,,,,,,,,,,,,,,,,,,,AOC
,,,,,,,,,,,,,,2.0,Finance,.xls,BILL OF QUANTITY,,,,,,,,,,,,,,,,,,,,,,,,,,,,,,,,,,,,,,,,,,,AOC,,,,,,,,,,,,,3,2876628,JAGANNATH ROUT,05-Apr-2025 03:04 PM,Accepted-AOC,OK,15-Jul-2025 03:50 PM,,,,,,,,,,,,,,,,,,,,,,,,,,,,,AOC
,,,,,,,,,,,,,,,,,,,,,,,,,,,,,,,,,,,,,,,,,,,,,,,,,,,,,,,,,,,,AOC,,,,,,,,,,,,,4,2876760,MANOJ KUMAR SAHOO,05-Apr-2025 04:53 PM,Rejected-Technical,DUE TO NON-FULFILMENT OF ELIGIBILITY CRITERIA,02-May-2025 04:41 PM,,,,,,,,,,,,,,,,,,,,,,,,,,,,,AOC
,,,,,,,,,,,,,,,,,,,,,,,,,,,,,,,,,,,,,,,,,,,,,,,,,,,,,,,,,,,,AOC,,,,,,,,,,,,,5,2876295,M/S CHIRANJIT SANTARA,04-Apr-2025 11:02 PM,Rejected-Technical,DUE TO NON-FULFILMENT OF ELIGIBILITY CRITERIA,02-May-2025 04:41 PM,,,,,,,,,,,,,,,,,,,,,,,,,,,,,AOC
,,,,,,,,,,,,,,,,,,,,,,,,,,,,,,,,,,,,,,,,,,,,,,,,,,,,,,,,,,,,AOC,,,,,,,,,,,,,6,2875923,Shyamsundar Realcon private limited,05-Apr-2025 03:54 PM,Rejected-Finance,"DUE TO SELECTION OF OF J ROUT, L1 BIDDER THROUGH TRANSPARENT LOTTERY SYSTEM",15-May-2025 03:54 PM,,,,,,,,,,,,,,,,,,,,,,,,,,,,,AOC
,,,,,,,,,,,,,,,,,,,,,,,,,,,,,,,,,,,,,,,,,,,,,,,,,,,,,,,,,,,,AOC,,,,,,,,,,,,,7,2876464,SMRUTI DHAR BEHERA,05-Apr-2025 12:03 PM,Rejected-Finance,"DUE TO SELECTION OF OF J ROUT, L1 BIDDER",15-May-2025 03:54 PM,,,,,,,,,,,,,,,,,,,,,,,,,,,,,AOC
,,,,,,,,,,,,,,,,,,,,,,,,,,,,,,,,,,,,,,,,,,,,,,,,,,,,,,,,,,,,AOC,,,,,,,,,,,,,8,2873744,Susanta Puhan,31-Mar-2025 10:33 AM,Rejected-Finance,"DUE TO SELECTION OF OF J ROUT, L1 BIDDER THROUGH TRANSPARENT LOTTERY SYSTEM",15-May-2025 03:54 PM,,,,,,,,,,,,,,,,,,,,,,,,,,,,,AOC
