Organisation Chain,Tender Reference Number,Tender ID,Withdrawal Allowed,Tender Type,Form of contract,Tender Category,No. of Covers,General Technical Evaluation Allowed,ItemWise Technical Evaluation Allowed,Payment Mode,Is Multi Currency Allowed For BOQ,Is Multi Currency Allowed For Fee,Allow Two Stage Bidding,Cover No,Cover,Document Type,Description,Publish Date,Bid Opening Date,Document Download / Sale Start Date,Document Download / Sale End Date,Clarification Start Date,Clarification End Date,Bid Submission Start Date,Bid Submission End Date,EMD Amount in ₹,EMD Exemption Allowed,EMD Fee Type,EMD Percentage,EMD Payable To,EMD Payable At,S.No,Bank Name,Tender Fee in ₹,VAT Charges in ₹,Fee Payable To,Fee Payable At,Tender Fee Exemption Allowed,Name,Address,Title,Work Description,Pre Qualification Details,Independent External Monitor/Remarks,Tender Value in ₹,Product Category,Sub category,Contract Type,Bid Validity(Days),Period Of Work(Days),Location,Pincode,Pre Bid Meeting Place,Pre Bid Meeting Address,Pre Bid Meeting Date,Bid Opening Place,Should Allow NDA Tender,Allow Preferential Bidder,Tender Stage,Contract Date :,Contract Value :,Work Completion Period in days :,Updated By :,Updated on :,AOC document :,AOC Description :,S.No,Bid Number,Bidder Name,Awarded Currency,Awarded Value,S.No.1,Bid Number.1,Bidder Name.1,Submitted Date,Status,Remarks,Status Updated On,Type :,Summary :,Updated By :.1,Updated On :,Document :,BOQ Comparative Chart :,Committee Chairperson/Co-ordinator Name :,Committee Chairperson/Co-ordinator Type :,Committee Members :,Updated By :.2,Updated on :.1,Document :.1,Organisation Chain :,Tender ID :,Tender Ref No :,Tender Title :,Committee Chairperson/Co-ordinator Name :.1,Committee Chairperson/Co-ordinator Type :.1,Committee Members :.1,Updated By :.3,Updated On :.1,Document :.2,Tender Stage
EIC-CIVIL||SERNB-CIRCLE-CUTTACK||EERNB-DIVN-CUTTACK,SE CTC (RandB)-57 of 2024-25,2025_EICCL_110455_2,Yes,National Competitive Bid,Percentage,Works,1.0,No,No,Online,No,No,No,1.0,Fee/PreQual/Technical/Finance,.pdf,"Regd Certificate, GSTIN, PAN, Affidavit, Undertaking and other mandatory documents as per DTCN",11-Feb-2025 02:00 PM,25-Feb-2025 11:00 AM,11-Feb-2025 02:00 PM,24-Feb-2025 05:00 PM,NA ,NA ,11-Feb-2025 02:00 PM,24-Feb-2025 05:00 PM,"27,680",Yes,fixed,,Nil,Nil,1.0,ICICI BANK,"6,000",0.0,Nil,Nil,No,SE Cuttack RandB Division No.I Cuttack,O/O SE Cuttack RandB Division No.I Cuttack,"Comprehensive Annual Maintenance of Fire Fighting and Alarm system at ACRC, Causality, Ward No.I, Ward No 2,Ward No3, Niramaya etc of Sishubhawan, Cuttack",Electrical works,As per DTCN ,NA ,"27,67,120",Electrical Works,NA ,Tender,90.0,365.0,Cuttack,753001.0,NA ,NA ,NA ,O/O SE Cuttack RandB Division No.I Cuttack,No ,No,AOC,01-Jul-2025,"INR 2,352,329",365.0,Debendra Kumar Behera,01-Jul-2025 06:29 PM,110455_2_A.PDF (121.00 KB),The agency has been finalised on transparent lottery system and the date of commencement may be treated as 30.05.2025 to complete the work by 29.05.2026 in all respect,1.0,2835544.0,TRANSTECH SOLUTION,INR,"2,352,329",1,2835691,ASCENSOR LIFTS AND AUTOMATION PRIVATE LIMITED,24-Feb-2025 03:54 PM,Rejected-AOC,Rejected,01-Jul-2025 06:29 PM,Finance,7nos bids received,Ashis Kumar Nayak,25-Feb-2025 02:15 PM,,BOQ Comparative Chart,Er Ashis Kumar Nayak SE,Internal,Er Jasmine Pradhan JE Estr Er Uma Sankar Bhuyan AEE Estr Mr Abadhut Das Sr DAO,Debendra Kumar Behera,01-Jul-2025 06:25 PM,finsummary_529621.pdf (166.12 KB),EIC-CIVIL||SERNB-CIRCLE-CUTTACK||EERNB-DIVN-CUTTACK,2025_EICCL_110455_2,SE CTC (RandB)-57 of 2024-25,"Comprehensive Annual Maintenance of Fire Fighting and Alarm system at ACRC, Causality, Ward No.I, Ward No 2,Ward No3, Niramaya etc of Sishubhawan, Cuttack",Er Ashis Kumar Nayak SE,Internal,Er Jasmine Pradhan JE Estr Er Nihar Ranjan Nayak AEE Estr Mr Abadhut Das Sr DAO,Ashis Kumar Nayak,15-Apr-2025 02:32 PM,techsummary_529621.pdf (102.59 KB),AOC
,,,,,,,,,,,,,,,,.xls,Bill of Quantities,,,,,,,,,,,,,,,2.0,ICICI NEFT/RTGS,,,,,,,,,,,,,,,,,,,,,,,,,,AOC,,,,,,,,,,,,,2,2831017,EQUIPMENT SALES AND SERVICES PVT LTD,22-Feb-2025 06:16 PM,Rejected-Technical,Disqualified,15-Apr-2025 02:32 PM,,,,,,,,,,,,,,,,,,,,,,,AOC
,,,,,,,,,,,,,,,,,,,,,,,,,,,,,,,,,,,,,,,,,,,,,,,,,,,,,,,,,,,AOC,,,,,,,,,,,,,3,2829002,M/S FIRESTOP SALES AND SERVICES,22-Feb-2025 05:08 PM,Rejected-AOC,Rejected,01-Jul-2025 06:29 PM,,,,,,,,,,,,,,,,,,,,,,,AOC
,,,,,,,,,,,,,,,,,,,,,,,,,,,,,,,,,,,,,,,,,,,,,,,,,,,,,,,,,,,AOC,,,,,,,,,,,,,4,2830399,M/S JAGANNATH FIRE SERVICES,22-Feb-2025 11:49 AM,Rejected-AOC,Rejected,01-Jul-2025 06:29 PM,,,,,,,,,,,,,,,,,,,,,,,AOC
,,,,,,,,,,,,,,,,,,,,,,,,,,,,,,,,,,,,,,,,,,,,,,,,,,,,,,,,,,,AOC,,,,,,,,,,,,,5,2830600,SMART I TECHNOLOGIES,22-Feb-2025 03:51 PM,Rejected-Technical,Disqualified,15-Apr-2025 02:32 PM,,,,,,,,,,,,,,,,,,,,,,,AOC
,,,,,,,,,,,,,,,,,,,,,,,,,,,,,,,,,,,,,,,,,,,,,,,,,,,,,,,,,,,AOC,,,,,,,,,,,,,6,2835544,TRANSTECH SOLUTION,24-Feb-2025 03:41 PM,Accepted-AOC,Accepted,01-Jul-2025 06:29 PM,,,,,,,,,,,,,,,,,,,,,,,AOC
,,,,,,,,,,,,,,,,,,,,,,,,,,,,,,,,,,,,,,,,,,,,,,,,,,,,,,,,,,,AOC,,,,,,,,,,,,,7,2834811,UMAFIRE SERVICES PVT. LTD,24-Feb-2025 12:58 PM,Rejected-AOC,Rejected,01-Jul-2025 06:29 PM,,,,,,,,,,,,,,,,,,,,,,,AOC
