Organisation Chain,Tender Reference Number,Tender ID,Withdrawal Allowed,Tender Type,Form of contract,Tender Category,No. of Covers,General Technical Evaluation Allowed,ItemWise Technical Evaluation Allowed,Payment Mode,Is Multi Currency Allowed For BOQ,Is Multi Currency Allowed For Fee,Allow Two Stage Bidding,Cover No,Cover,Document Type,Description,Publish Date,Bid Opening Date,Document Download / Sale Start Date,Document Download / Sale End Date,Clarification Start Date,Clarification End Date,Bid Submission Start Date,Bid Submission End Date,Financial Bid Opening Date,EMD Amount in ₹,EMD Exemption Allowed,EMD Fee Type,EMD Percentage,EMD Payable To,EMD Payable At,S.No,Corrigendum Title,Corrigendum Type,View,S.No.1,Bank Name,Tender Fee in ₹,VAT Charges in ₹,Fee Payable To,Fee Payable At,Tender Fee Exemption Allowed,Name,Address,Title,Work Description,Pre Qualification Details,Independent External Monitor/Remarks,Tender Value in ₹,Product Category,Sub category,Contract Type,Bid Validity(Days),Period Of Work(Days),Location,Pincode,Pre Bid Meeting Place,Pre Bid Meeting Address,Pre Bid Meeting Date,Bid Opening Place,Should Allow NDA Tender,Allow Preferential Bidder,Tender Stage,Contract Date :,Contract Value :,Work Completion Period in days :,Updated By :,Updated on :,AOC document :,AOC Description :,S.No,Bid Number,Bidder Name,Awarded Currency,Awarded Value,S.No.1,Bid Number.1,Bidder Name.1,Submitted Date,Status,Remarks,Status Updated On,Type :,Summary :,Updated By :.1,Updated On :,Document :,BOQ Comparative Chart :,Committee Chairperson/Co-ordinator Name :,Committee Chairperson/Co-ordinator Type :,Committee Members :,Updated By :.2,Updated on :.1,Document :.1,Organisation Chain :,Tender ID :,Tender Ref No :,Tender Title :,Type :.1,Summary :.1,Updated By :.3,Updated On :.1,Document :.2,Committee Chairperson/Co-ordinator Name :.1,Committee Chairperson/Co-ordinator Type :.1,Committee Members :.1,Updated By :.4,Updated On :.2,Financial Bid Opening Date:,Document :.3,Tender Stage
Bhubaneswar Development Authority||Bhubaneswar Development Authority||EE BDA Division V,"812/EM/BDA/2024-25, Dated-14/08/2024",2024_BDABU_104426_1,Yes,Open Tender,Percentage,Works,2.0,No,No,Online,No,No,No,1.0,Fee/PreQual/Technical,.pdf,"EMD, GST, PAN, EPF and ESI, RC and Tender Cost",23-Aug-2024 06:00 PM,05-Sep-2024 11:30 AM,23-Aug-2024 06:00 PM,04-Sep-2024 05:30 PM,NA ,NA ,23-Aug-2024 06:00 PM,04-Sep-2024 05:30 PM,23-Oct-2024 03:00 PM,"2,17,854",Yes,percentage,1.0%,Nil,Nil,1.0,Approximate value of the Project.,Other,,1.0,ICICI BANK,"11,800",0.0,Nil,Nil,No,"Engineer Member, BDA, Bhubaneswar.","Office of the Engineer Member, BDA, Bhubaneswar.","Redevelopment of Cremation Ground at Garabadu, Bhubaneswar","Redevelopment of Cremation Ground at Garabadu, Bhubaneswar",Please refer Tender documents. ,NA ,"2,17,85,446",Civil Works - Others,NA ,Tender,90.0,180.0,BHUBANESWAR,751001.0,NA ,NA ,NA ,"Engineer Member, BDA, Bhubaneswar.",No ,No,AOC,14-Jul-2025,"INR 18,519,808",180.0,Tenkala Venkata Rao Subudhi,14-Jul-2025 02:40 PM,AOCGadabadu.pdf (499.00 KB),Date of Commencement and Date of Completion 03/06/2025 and 02/12/2025 respectively.,1.0,2540772.0,Rohini Nandan Behera,INR,"18,519,808",1,2540564,ABHIMANYUPATI,04-Sep-2024 09:49 AM,Rejected-Finance,As per the rate quoted in the financial bid.,10-Jun-2025 05:36 PM,Finance,Financial Bid (Cover-II) downloaded and evaluation under process.,Tenkala Venkata Rao Subudhi,23-Oct-2024 03:26 PM,,BOQ Comparative Chart,Engineer Member,Internal,"DAO, Division No.V, EE-cum-T.A. to E.M., DAO, EM Office, EE-V, Manager Finance and Member Finance, BDA, Bhubaneswar",Tenkala Venkata Rao Subudhi,10-Jun-2025 05:36 PM,finsummary_505454.pdf (1321.54 KB),Bhubaneswar Development Authority||Bhubaneswar Development Authority||EE BDA Division V,2024_BDABU_104426_1,"812/EM/BDA/2024-25, Dated-14/08/2024","Redevelopment of Cremation Ground at Garabadu, Bhubaneswar",Technical,Technical Bid (Cover-I) downloaded and evaluation under process.,Himanshu Kumar Jena,06-Sep-2024 01:26 PM,,"ENGINEER MEMBER, BDA, BHUBANESWAR.",Internal,"DAO, Division No.V, E.E.-cum-T.A. to EM, DAO, EM Office, EE-V, Manager Finance and Member Finance, BDA, Bhubaneswar.",Tenkala Venkata Rao Subudhi,23-Oct-2024 02:04 PM,23-Oct-2024 03:00 PM,techsummary_505454.pdf (1044.04 KB),AOC
,,,,,,,,,,,,,,,,.pdf,All other documents as per DTCN,,,,,,,,,,,,,,,,,,,,2.0,ICICI NEFT/RTGS,,,,,,,,,,,,,,,,,,,,,,,,,,AOC,,,,,,,,,,,,,2,2540981,PRATAP CHANDRA MAHARANA,04-Sep-2024 02:37 PM,Rejected-Finance,As per transparent lottery system.,10-Jun-2025 05:36 PM,,,,,,,,,,,,,,,,,,,,,,,,,,,,,AOC
,,,,,,,,,,,,,,2.0,Finance,.xls,BoQ,,,,,,,,,,,,,,,,,,,,,,,,,,,,,,,,,,,,,,,,,,,,,,,AOC,,,,,,,,,,,,,3,2540267,PURUSOTTAM BEHERA,03-Sep-2024 01:52 PM,Rejected-Finance,As per the rate quoted in the financial bid.,10-Jun-2025 05:36 PM,,,,,,,,,,,,,,,,,,,,,,,,,,,,,AOC
,,,,,,,,,,,,,,,,,,,,,,,,,,,,,,,,,,,,,,,,,,,,,,,,,,,,,,,,,,,,,,,,AOC,,,,,,,,,,,,,4,2540775,RASHMIKANTA ROUT,04-Sep-2024 12:21 PM,Rejected-Technical,REJECTED,23-Oct-2024 02:04 PM,,,,,,,,,,,,,,,,,,,,,,,,,,,,,AOC
,,,,,,,,,,,,,,,,,,,,,,,,,,,,,,,,,,,,,,,,,,,,,,,,,,,,,,,,,,,,,,,,AOC,,,,,,,,,,,,,5,2540772,Rohini Nandan Behera,04-Sep-2024 01:58 PM,Accepted-AOC,As per transparent lottery system.,14-Jul-2025 02:40 PM,,,,,,,,,,,,,,,,,,,,,,,,,,,,,AOC
,,,,,,,,,,,,,,,,,,,,,,,,,,,,,,,,,,,,,,,,,,,,,,,,,,,,,,,,,,,,,,,,AOC,,,,,,,,,,,,,6,2541012,SHIVAJYOTI CONTECH PRIVATE LIMITED,04-Sep-2024 03:58 PM,Rejected-Finance,As per the rate quoted in the financial bid.,10-Jun-2025 05:36 PM,,,,,,,,,,,,,,,,,,,,,,,,,,,,,AOC
,,,,,,,,,,,,,,,,,,,,,,,,,,,,,,,,,,,,,,,,,,,,,,,,,,,,,,,,,,,,,,,,AOC,,,,,,,,,,,,,7,2539921,SUBASH CHANDRA BARIK,04-Sep-2024 02:45 PM,Rejected-Finance,As per transparent lottery system.,10-Jun-2025 05:36 PM,,,,,,,,,,,,,,,,,,,,,,,,,,,,,AOC
