Organisation Chain,Tender Reference Number,Tender ID,Withdrawal Allowed,Tender Type,Form of contract,Tender Category,No. of Covers,General Technical Evaluation Allowed,ItemWise Technical Evaluation Allowed,Payment Mode,Is Multi Currency Allowed For BOQ,Is Multi Currency Allowed For Fee,Allow Two Stage Bidding,Cover No,Cover,Document Type,Description,Publish Date,Bid Opening Date,Document Download / Sale Start Date,Document Download / Sale End Date,Clarification Start Date,Clarification End Date,Bid Submission Start Date,Bid Submission End Date,EMD Amount in ₹,EMD Exemption Allowed,EMD Fee Type,EMD Percentage,EMD Payable To,EMD Payable At,S.No,Bank Name,Tender Fee in ₹,VAT Charges in ₹,Fee Payable To,Fee Payable At,Tender Fee Exemption Allowed,Name,Address,Title,Work Description,Pre Qualification Details,Independent External Monitor/Remarks,Tender Value in ₹,Product Category,Sub category,Contract Type,Bid Validity(Days),Period Of Work(Days),Location,Pincode,Pre Bid Meeting Place,Pre Bid Meeting Address,Pre Bid Meeting Date,Bid Opening Place,Should Allow NDA Tender,Allow Preferential Bidder,Tender Stage,Contract Date :,Contract Value :,Work Completion Period in days :,Updated By :,Updated on :,AOC document :,S.No,Bid Number,Bidder Name,Awarded Currency,Awarded Value,S.No.1,Bid Number.1,Bidder Name.1,Submitted Date,Status,Remarks,Status Updated On,Type :,Summary :,Updated By :.1,Updated On :,Document :,BOQ Comparative Chart :,Committee Chairperson/Co-ordinator Name :,Committee Chairperson/Co-ordinator Type :,Committee Members :,Updated By :.2,Updated on :.1,Document :.1,Organisation Chain :,Tender ID :,Tender Ref No :,Tender Title :,Committee Chairperson/Co-ordinator Name :.1,Committee Chairperson/Co-ordinator Type :.1,Committee Members :.1,Updated By :.3,Updated On :.1,Document :.2,Tender Stage
"CE,Minor Irrigation,BBSR||SESMIC-BERHAMPUR||GANJAM II",Online Tender /18/ GMID-I/2024-25,2025_CEMIB_110940_8,Yes,Open Tender,Percentage,Works,1.0,No,No,Online,No,No,No,1.0,Fee/PreQual/Technical/Finance,.pdf,"Copy of License, Affidavit, GSTN, PAN, No relation certificate and other documents as per DTCN",20-Feb-2025 10:00 AM,01-Mar-2025 11:00 AM,20-Feb-2025 10:00 AM,28-Feb-2025 05:00 PM,20-Feb-2025 10:00 AM ,27-Feb-2025 05:00 PM ,20-Feb-2025 10:00 AM,28-Feb-2025 05:00 PM,"8,500",Yes,fixed,,Nil,Nil,1.0,ICICI BANK,"4,000",0.0,Nil,Nil,No,"SE, M.I. Division Ganjam-I","O/o the SE, M.I. Division Ganjam-I, Engineering School Road, Berhampur 10",Imp to Babulibandha MIP,Imp to Babulibandha MIP in Digapahandi Block under ERM scheme.,Please refer Tender documents. ,NA ,"8,40,000",Civil Works - Others,NA ,Tender,90.0,60.0,Digapahandi,761012.0,NA ,NA ,NA ,"O/o the SE, M.I. Division Ganjam-I, Engineering Sc",No ,No,AOC,06-May-2025,"INR 713,687.86",60.0,KIRAN KUMAR SUBUDHY,06-May-2025 05:22 PM,10_w.pdf (391.00 KB),1.0,2841353.0,KRUSHNA CHANDRA SETHI,INR,"713,687.86",1,2841407,ANIL KUMAR KABI,28-Feb-2025 01:37 PM,Rejected-AOC,Losser of transparent lottery,06-May-2025 05:22 PM,Finance,5 bidders,KIRAN KUMAR SUBUDHY,06-May-2025 05:13 PM,finance_530888.pdf,BOQ Comparative Chart,SE MI DIVISION GM-I,Internal,,KIRAN KUMAR SUBUDHY,06-May-2025 05:19 PM,finsummary_530888.pdf (289.97 KB),"CE,Minor Irrigation,BBSR||SESMIC-BERHAMPUR||GANJAM II",2025_CEMIB_110940_8,Online Tender /18/ GMID-I/2024-25,Imp to Babulibandha MIP,SE MI DIVISION GM-I,Internal,,KIRAN KUMAR SUBUDHY,06-May-2025 05:17 PM,techsummary_530888.pdf (289.97 KB),AOC
,,,,,,,,,,,,,,,,.xls,BOQ,,,,,,,,,,,,,,,2.0,ICICI NEFT/RTGS,,,,,,,,,,,,,,,,,,,,,,,,,,AOC,,,,,,,,,,,,2,2841353,KRUSHNA CHANDRA SETHI,28-Feb-2025 02:17 PM,Accepted-AOC,Winner of transparent lottery,06-May-2025 05:22 PM,,,,,,,,,,,,,,,,,,,,,,,AOC
,,,,,,,,,,,,,,,,,,,,,,,,,,,,,,,,,,,,,,,,,,,,,,,,,,,,,,,,,,,AOC,,,,,,,,,,,,3,2841722,PRASANTA KUMAR SAHU,28-Feb-2025 04:49 PM,Rejected-AOC,Losser of transparent lottery,06-May-2025 05:22 PM,,,,,,,,,,,,,,,,,,,,,,,AOC
,,,,,,,,,,,,,,,,,,,,,,,,,,,,,,,,,,,,,,,,,,,,,,,,,,,,,,,,,,,AOC,,,,,,,,,,,,4,2841156,RANJITA KUMARI SAHU,28-Feb-2025 03:40 PM,Rejected-AOC,Losser of transparent lottery,06-May-2025 05:22 PM,,,,,,,,,,,,,,,,,,,,,,,AOC
,,,,,,,,,,,,,,,,,,,,,,,,,,,,,,,,,,,,,,,,,,,,,,,,,,,,,,,,,,,AOC,,,,,,,,,,,,5,2841235,SUNIL KUMAR SAHU,28-Feb-2025 12:16 PM,Rejected-AOC,Losser of transparent lottery,06-May-2025 05:22 PM,,,,,,,,,,,,,,,,,,,,,,,AOC
