Organisation Chain,Tender Reference Number,Tender ID,Withdrawal Allowed,Tender Type,Form of contract,Tender Category,No. of Covers,General Technical Evaluation Allowed,ItemWise Technical Evaluation Allowed,Payment Mode,Is Multi Currency Allowed For BOQ,Is Multi Currency Allowed For Fee,Allow Two Stage Bidding,Cover No,Cover,Document Type,Description,Publish Date,Bid Opening Date,Document Download / Sale Start Date,Document Download / Sale End Date,Clarification Start Date,Clarification End Date,Bid Submission Start Date,Bid Submission End Date,Financial Bid Opening Date,EMD Amount in ₹,EMD Exemption Allowed,EMD Fee Type,EMD Percentage,EMD Payable To,EMD Payable At,S.No,Bank Name,Tender Fee in ₹,VAT Charges in ₹,Fee Payable To,Fee Payable At,Tender Fee Exemption Allowed,Name,Address,Title,Work Description,Pre Qualification Details,Independent External Monitor/Remarks,Tender Value in ₹,Product Category,Sub category,Contract Type,Bid Validity(Days),Period Of Work(Days),Location,Pincode,Pre Bid Meeting Place,Pre Bid Meeting Address,Pre Bid Meeting Date,Bid Opening Place,Should Allow NDA Tender,Allow Preferential Bidder,Tender Stage,Contract Date :,Contract Value :,Work Completion Period in days :,Updated By :,Updated on :,AOC document :,AOC Description :,S.No,Bid Number,Bidder Name,Awarded Currency,Awarded Value,S.No.1,Bid Number.1,Bidder Name.1,Submitted Date,Status,Remarks,Status Updated On,Type :,Summary :,Updated By :.1,Updated On :,Document :,BOQ Comparative Chart :,Committee Chairperson/Co-ordinator Name :,Committee Chairperson/Co-ordinator Type :,Committee Members :,Updated By :.2,Updated on :.1,Document :.1,Organisation Chain :,Tender ID :,Tender Ref No :,Tender Title :,Type :.1,Summary :.1,Updated By :.3,Updated On :.1,Document :.2,Committee Chairperson/Co-ordinator Name :.1,Committee Chairperson/Co-ordinator Type :.1,Committee Members :.1,Updated By :.4,Updated On :.2,Financial Bid Opening Date:,Document :.3,Tender Stage
EIC-CIVIL||SERNB-CIRCLE-CUTTACK||EERNB-DIVN-PANIKOILI,"Tender Call Notice No. SE, PKL (RandB)- 10/2024-25",2024_EICCL_106616_36,Yes,Open Tender,Percentage,Works,2.0,No,No,Online,No,No,No,1.0,Fee/PreQual/Technical,.pdf,"License, GSTIN, PAN, Affidavit,online Paper cost, EMD, Machineries and others Documents as per DTCN",08-Nov-2024 06:00 PM,22-Nov-2024 05:00 PM,08-Nov-2024 06:00 PM,22-Nov-2024 03:00 PM,08-Nov-2024 06:00 PM ,22-Nov-2024 03:00 PM ,08-Nov-2024 06:00 PM,22-Nov-2024 03:00 PM,30-Jan-2025 04:00 PM,"55,799",Yes,percentage,1.0%,Nil,Nil,1.0,ICICI BANK,"10,000",0.0,Nil,Nil,No,"SE, Pkl (Rand) Division","SE, Pkl (RandB) Division","Construction of Paddy Procurement Centre at Haldigadia Pacs, Korei in the District of Jajpur.","Construction of Paddy Procurement Centre at Haldigadia Pacs, Korei in the District of Jajpur.",Please refer tender Documents  ,NA ,"55,79,911",Civil Works - Buildings,NA ,Tender,90.0,120.0,"SE, Pkl (RandB) Division",755043.0,NA ,NA ,NA ,"SE, Pkl (RandB) Division",No ,No,AOC,19-May-2025,"INR 4,743,482.23",120.0,Komal Kumar Swain,19-May-2025 01:48 PM,06p1.pdf (2380.00 KB),AOC to be submitted,1.0,2647129.0,SATYABRATA PATI,INR,"4,743,482.23",1,2654588,ANIL KUMAR SETHY,21-Nov-2024 04:42 PM,Accepted-AOC,Unsuccessful bidder and participated in transparent lottery system,19-May-2025 01:49 PM,Finance,all bidders admitted,Subash Chandra Tarai,01-Feb-2025 06:41 PM,,BOQ Comparative Chart,Superintending Engineer,Internal,"SE, DAO and Estimator",Komal Kumar Swain,19-May-2025 01:42 PM,finsummary_515129.pdf (32.94 KB),EIC-CIVIL||SERNB-CIRCLE-CUTTACK||EERNB-DIVN-PANIKOILI,2024_EICCL_106616_36,"Tender Call Notice No. SE, PKL (RandB)- 10/2024-25","Construction of Paddy Procurement Centre at Haldigadia Pacs, Korei in the District of Jajpur.",Technical,All bidders are admitted,Purna Chandra Dalai,25-Nov-2024 07:10 PM,,Superintending Engineer,Internal,"SE, DAO and Estimator",Subash Chandra Tarai,30-Jan-2025 12:36 PM,30-Jan-2025 04:00 PM,techsummary_515129.pdf (32.50 KB),AOC
,,,,,,,,,,,,,,2.0,Finance,.xls,Bill of Quantity,,,,,,,,,,,,,,,,2.0,ICICI NEFT/RTGS,,,,,,,,,,,,,,,,,,,,,,,,,,AOC,,,,,,,,2.0,2654588.0,ANIL KUMAR SETHY,INR,"4,743,482.23",2,2656699,BIPIN MALIK,20-Nov-2024 07:14 PM,Accepted-AOC,Unsuccessful bidder and participated in transparent lottery system,19-May-2025 01:49 PM,,,,,,,,,,,,,,,,,,,,,,,,,,,,,AOC
,,,,,,,,,,,,,,,,,,,,,,,,,,,,,,,,,,,,,,,,,,,,,,,,,,,,,,,,,,,,AOC,,,,,,,,3.0,2656539.0,SURESH KUMAR SETHY,INR,"4,743,482.23",3,2659311,JITENDRA KUMAR SAMAL,22-Nov-2024 01:07 PM,Accepted-AOC,Unsuccessful bidder and participated in transparent lottery system,19-May-2025 01:49 PM,,,,,,,,,,,,,,,,,,,,,,,,,,,,,AOC
,,,,,,,,,,,,,,,,,,,,,,,,,,,,,,,,,,,,,,,,,,,,,,,,,,,,,,,,,,,,AOC,,,,,,,,4.0,2656699.0,BIPIN MALIK,INR,"4,743,482.23",4,2656548,NATRAJ GRAPHICS,20-Nov-2024 06:00 PM,Rejected-Technical,Disqualified due to non submission of machineries documents,30-Jan-2025 12:36 PM,,,,,,,,,,,,,,,,,,,,,,,,,,,,,AOC
,,,,,,,,,,,,,,,,,,,,,,,,,,,,,,,,,,,,,,,,,,,,,,,,,,,,,,,,,,,,AOC,,,,,,,,5.0,2659311.0,JITENDRA KUMAR SAMAL,INR,"4,743,482.23",5,2647129,SATYABRATA PATI,15-Nov-2024 02:01 PM,Accepted-AOC,Qualified and found successful L1 bidder through transparent lottery system and Agreement Drawn,19-May-2025 01:49 PM,,,,,,,,,,,,,,,,,,,,,,,,,,,,,AOC
,,,,,,,,,,,,,,,,,,,,,,,,,,,,,,,,,,,,,,,,,,,,,,,,,,,,,,,,,,,,AOC,,,,,,,,,,,,,6,2656539,SURESH KUMAR SETHY,20-Nov-2024 06:45 PM,Accepted-AOC,Unsuccessful bidder and participated in transparent lottery system,19-May-2025 01:49 PM,,,,,,,,,,,,,,,,,,,,,,,,,,,,,AOC
