Organisation Chain,Tender Reference Number,Tender ID,Withdrawal Allowed,Tender Type,Form of contract,Tender Category,No. of Covers,General Technical Evaluation Allowed,ItemWise Technical Evaluation Allowed,Payment Mode,Is Multi Currency Allowed For BOQ,Is Multi Currency Allowed For Fee,Allow Two Stage Bidding,Cover No,Cover,Document Type,Description,Publish Date,Bid Opening Date,Document Download / Sale Start Date,Document Download / Sale End Date,Clarification Start Date,Clarification End Date,Bid Submission Start Date,Bid Submission End Date,EMD Amount in ₹,EMD Exemption Allowed,EMD Fee Type,EMD Percentage,EMD Payable To,EMD Payable At,S.No,Bank Name,Tender Fee in ₹,VAT Charges in ₹,Fee Payable To,Fee Payable At,Tender Fee Exemption Allowed,Name,Address,Title,Work Description,Pre Qualification Details,Independent External Monitor/Remarks,Tender Value in ₹,Product Category,Sub category,Contract Type,Bid Validity(Days),Period Of Work(Days),Location,Pincode,Pre Bid Meeting Place,Pre Bid Meeting Address,Pre Bid Meeting Date,Bid Opening Place,Should Allow NDA Tender,Allow Preferential Bidder,Tender Stage,Contract Date :,Contract Value :,Work Completion Period in days :,Updated By :,Updated on :,AOC document :,S.No,Bid Number,Bidder Name,Awarded Currency,Awarded Value,S.No.1,Bid Number.1,Bidder Name.1,Submitted Date,Status,Remarks,Status Updated On,Type :,Summary :,Updated By :.1,Updated On :,Document :,BOQ Comparative Chart :,Committee Chairperson/Co-ordinator Name :,Committee Chairperson/Co-ordinator Type :,Committee Members :,Updated By :.2,Updated on :.1,Document :.1,Organisation Chain :,Tender ID :,Tender Ref No :,Tender Title :,Committee Chairperson/Co-ordinator Name :.1,Committee Chairperson/Co-ordinator Type :.1,Committee Members :.1,Updated By :.3,Updated On :.1,Document :.2,Tender Stage
Rural Water Supply and Sanitation||RWSS Circle Koraput||RWSS Division Koraput,10/SE/RWSS/KPT/24-25/18.01.25,2025_RWSS_109866_2,Yes,National Competitive Bid,Percentage,Works,1.0,No,No,Online,No,No,No,1.0,Fee/PreQual/Technical/Finance,.pdf,"Document as per DTCN (Tender cost, EMD, VAT, PAN, Contractor Registration Certificate, affidavit etc",28-Jan-2025 05:00 PM,07-Feb-2025 11:00 AM,28-Jan-2025 05:00 PM,06-Feb-2025 05:00 PM,28-Jan-2025 05:00 PM ,05-Feb-2025 05:00 PM ,28-Jan-2025 05:00 PM,06-Feb-2025 05:00 PM,"14,500",Yes,fixed,,Nil,Nil,1.0,ICICI BANK,"6,000",0.0,Nil,Nil,No,SE RWSS Division Koraput,Office of SE RWSS Division Koraput,Rrural piped water supply to Bhairabguda Village Bhairabguda GP M.Muthai under semiliguda Block under Basadhu Programme,Rrural piped water supply to Bhairabguda Village Bhairabguda GP M.Muthai under semiliguda Block under Basadhu Programme,Please refer Tender document ,NA ,"14,40,797",Civil Works - Water Works,NA ,Tender,180.0,90.0,Semiliguda,764036.0,NA ,NA ,NA ,Office of SE RWSS Division Koraput,No ,No,AOC,03-May-2025,"INR 1,224,821.9",90.0,Jagabandhu Chaudhury,03-May-2025 04:44 PM,109866AOC2.pdf (481.00 KB),1.0,2794288.0,B TEJASWAR RAO,INR,"1,224,821.9",1,2794288,B TEJASWAR RAO,03-Feb-2025 08:32 AM,Accepted-AOC,L1,03-May-2025 04:45 PM,Finance,5 out of 5 Bidder ADMITTED,Jagabandhu Chaudhury,07-Feb-2025 01:35 PM,,BOQ Comparative Chart,SE rwss Division Koraput,Internal,"DAO, JE ESTIMATOR RWSS DIVISION KORAPUT",Jagabandhu Chaudhury,03-May-2025 01:45 PM,finsummary_527467.pdf (492.86 KB),Rural Water Supply and Sanitation||RWSS Circle Koraput||RWSS Division Koraput,2025_RWSS_109866_2,10/SE/RWSS/KPT/24-25/18.01.25,Rrural piped water supply to Bhairabguda Village Bhairabguda GP M.Muthai under semiliguda Block under Basadhu Programme,SE RWSS DIVIDION KORAPUT,Internal,"DAO, JE ESTIMATOR RWSS DIVISION KORAPUT",Jagabandhu Chaudhury,03-May-2025 12:35 PM,techsummary_527467.pdf (406.77 KB),AOC
,,,,,,,,,,,,,,,,.pdf,SBD,,,,,,,,,,,,,,,2.0,ICICI NEFT/RTGS,,,,,,,,,,,,,,,,,,,,,,,,,,AOC,,,,,,,,,,,,2,2800832,HARIHARA PALIGUDIA,06-Feb-2025 03:37 PM,Rejected-Finance,REJECTED IN OPEN LOTTERY,03-May-2025 01:45 PM,,,,,,,,,,,,,,,,,,,,,,,AOC
,,,,,,,,,,,,,,,,.xls,BOQ,,,,,,,,,,,,,,,,,,,,,,,,,,,,,,,,,,,,,,,,,,AOC,,,,,,,,,,,,3,2800946,PADMAJA PATNAIK,06-Feb-2025 04:53 PM,Rejected-Technical,REJECTED,03-May-2025 12:35 PM,,,,,,,,,,,,,,,,,,,,,,,AOC
,,,,,,,,,,,,,,,,,,,,,,,,,,,,,,,,,,,,,,,,,,,,,,,,,,,,,,,,,,,AOC,,,,,,,,,,,,4,2799683,SANTOSH KUMAR PRADHAN,05-Feb-2025 08:39 PM,Rejected-AOC,L2,03-May-2025 04:45 PM,,,,,,,,,,,,,,,,,,,,,,,AOC
,,,,,,,,,,,,,,,,,,,,,,,,,,,,,,,,,,,,,,,,,,,,,,,,,,,,,,,,,,,AOC,,,,,,,,,,,,5,2793615,Santosh Kumar Sahu,02-Feb-2025 01:06 PM,Rejected-Finance,REJECTED IN OPEN LOTTERY,03-May-2025 01:45 PM,,,,,,,,,,,,,,,,,,,,,,,AOC
