Organisation Chain,Tender Reference Number,Tender ID,Withdrawal Allowed,Tender Type,Form of contract,Tender Category,No. of Covers,General Technical Evaluation Allowed,ItemWise Technical Evaluation Allowed,Payment Mode,Is Multi Currency Allowed For BOQ,Is Multi Currency Allowed For Fee,Allow Two Stage Bidding,Cover No,Cover,Document Type,Description,Publish Date,Bid Opening Date,Document Download / Sale Start Date,Document Download / Sale End Date,Clarification Start Date,Clarification End Date,Bid Submission Start Date,Bid Submission End Date,EMD Amount in ₹,EMD Exemption Allowed,EMD Fee Type,EMD Percentage,EMD Payable To,EMD Payable At,S.No,Bank Name,Tender Fee in ₹,VAT Charges in ₹,Fee Payable To,Fee Payable At,Tender Fee Exemption Allowed,Name,Address,Title,Work Description,Pre Qualification Details,Independent External Monitor/Remarks,Tender Value in ₹,Product Category,Sub category,Contract Type,Bid Validity(Days),Period Of Work(Days),Location,Pincode,Pre Bid Meeting Place,Pre Bid Meeting Address,Pre Bid Meeting Date,Bid Opening Place,Should Allow NDA Tender,Allow Preferential Bidder,Tender Stage,Contract Date :,Contract Value :,Work Completion Period in days :,Updated By :,Updated on :,AOC document :,AOC Description :,S.No,Bid Number,Bidder Name,Awarded Currency,Awarded Value,S.No.1,Bid Number.1,Bidder Name.1,Submitted Date,Status,Remarks,Status Updated On,Type :,Summary :,Updated By :.1,Updated On :,Document :,BOQ Comparative Chart :,Committee Chairperson/Co-ordinator Name :,Committee Chairperson/Co-ordinator Type :,Committee Members :,Updated By :.2,Updated on :.1,Document :.1,Organisation Chain :,Tender ID :,Tender Ref No :,Tender Title :,Committee Chairperson/Co-ordinator Name :.1,Committee Chairperson/Co-ordinator Type :.1,Committee Members :.1,Updated By :.3,Updated On :.1,Document :.2,Tender Stage
EIC-CIVIL||SERNB-CIRCLE-KEONJHAR||EERNB-DIVN-ROURKELA,Bid id 106 of 2024-25,2025_EICCL_111368_1,Yes,Open Tender,Percentage,Works,1.0,No,No,Online,No,No,No,1.0,Fee/PreQual/Technical/Finance,.pdf,"Registration certificate, Registration inELBO, PAN Card, GSTIN Certificate, Affidavit etc",05-Mar-2025 06:00 PM,18-Mar-2025 11:00 AM,05-Mar-2025 06:00 PM,17-Mar-2025 05:00 PM,NA ,NA ,05-Mar-2025 06:00 PM,17-Mar-2025 05:00 PM,"6,100",Yes,fixed,,Nil,Nil,1.0,ICICI BANK,"4,000",0.0,Nil,Nil,No,Superintending Engineer Rourkela R and B Division,Office of Superintending Engineer Rourkela R and B division,Provision of 1.5 Ton AC in and 2ton split AC in special Treasury Panposh Rourkela for the year 2024-25,Provision of 1.5 Ton AC in and 2ton split AC in special Treasury Panposh Rourkela for the year 2024-25,Please refer the tender document ,NA ,"6,08,753",Electrical Works,NA ,Tender,90.0,30.0,Rourkela,769012.0,NA ,NA ,NA ,Office of Superintending Engineer Rourkela R and B,No ,No,AOC,19-May-2025,"INR 517,526",30.0,Prajna Prajwolita Parida,19-May-2025 10:57 AM,provision1.5workorder.pdf (1355.00 KB),Agmt drawn and Work order issued,1.0,2851100.0,EDITION INTERNATIONAL,INR,"517,526",1,2856014,ECO ELECTRIC POWER SOLUTIONS,16-Mar-2025 10:49 PM,Rejected-AOC,Not Qualified in the Lottery,19-May-2025 10:57 AM,Finance,05 no of bidder has been participated,Prajna Prajwolita Parida,19-May-2025 10:30 AM,finance_532306.pdf,BOQ Comparative Chart,Alok Naik SE rourkela r and b dvision,Internal,HS Meena SrDAO Rourkela R and B Division P p parida estimator Rourkela R and B Division,Prajna Prajwolita Parida,19-May-2025 10:46 AM,finsummary_532306.pdf (1354.51 KB),EIC-CIVIL||SERNB-CIRCLE-KEONJHAR||EERNB-DIVN-ROURKELA,2025_EICCL_111368_1,Bid id 106 of 2024-25,Provision of 1.5 Ton AC in and 2ton split AC in special Treasury Panposh Rourkela for the year 2024-25,Alok Naik SE rourkela r and b dvision,Internal,HS Meena SrDAO Rourkela R and B Division P p parida estimator Rourkela R and B Division,Prajna Prajwolita Parida,19-May-2025 10:41 AM,techsummary_532306.pdf (1354.51 KB),AOC
,,,,,,,,,,,,,,,,.pdf,"Financial instruments such as cost of tender paper, EMD, Affidavit etc",,,,,,,,,,,,,,,2.0,ICICI NEFT/RTGS,,,,,,,,,,,,,,,,,,,,,,,,,,AOC,,,,,,,,,,,,,2,2851100,EDITION INTERNATIONAL,11-Mar-2025 07:33 PM,Accepted-AOC,Qualified in the Lottery,19-May-2025 10:57 AM,,,,,,,,,,,,,,,,,,,,,,,AOC
,,,,,,,,,,,,,,,,.pdf,"Experience Certificate, List of Machinaries,Lease Deeds , MOU with electrical contractor Affidavit e",,,,,,,,,,,,,,,,,,,,,,,,,,,,,,,,,,,,,,,,,,AOC,,,,,,,,,,,,,3,2858792,GOLAP KESHARI CHAINI,17-Mar-2025 01:51 PM,Rejected-AOC,Not Qualified in the Lottery,19-May-2025 10:57 AM,,,,,,,,,,,,,,,,,,,,,,,AOC
,,,,,,,,,,,,,,,,.pdf,"No Relation Certificate, Schedule-E, Schedule-F, Affidavit etc",,,,,,,,,,,,,,,,,,,,,,,,,,,,,,,,,,,,,,,,,,AOC,,,,,,,,,,,,,4,2851113,NARAYANI CONSTRUCTION,11-Mar-2025 07:41 PM,Rejected-AOC,Not Qualified in the Lottery,19-May-2025 10:57 AM,,,,,,,,,,,,,,,,,,,,,,,AOC
,,,,,,,,,,,,,,,,.xls,BOQ,,,,,,,,,,,,,,,,,,,,,,,,,,,,,,,,,,,,,,,,,,AOC,,,,,,,,,,,,,5,2851087,RAKESH PATTANAYAK,11-Mar-2025 07:23 PM,Rejected-AOC,Not Qualified in the Lottery,19-May-2025 10:57 AM,,,,,,,,,,,,,,,,,,,,,,,AOC
