Organisation Chain,Tender Reference Number,Tender ID,Withdrawal Allowed,Tender Type,Form of contract,Tender Category,No. of Covers,General Technical Evaluation Allowed,ItemWise Technical Evaluation Allowed,Payment Mode,Is Multi Currency Allowed For BOQ,Is Multi Currency Allowed For Fee,Allow Two Stage Bidding,Cover No,Cover,Document Type,Description,Publish Date,Bid Opening Date,Document Download / Sale Start Date,Document Download / Sale End Date,Clarification Start Date,Clarification End Date,Bid Submission Start Date,Bid Submission End Date,Financial Bid Opening Date,EMD Amount in ₹,EMD Exemption Allowed,EMD Fee Type,EMD Percentage,EMD Payable To,EMD Payable At,S.No,Corrigendum Title,Corrigendum Type,View,S.No.1,Bank Name,Tender Fee in ₹,VAT Charges in ₹,Fee Payable To,Fee Payable At,Tender Fee Exemption Allowed,Name,Address,Title,Work Description,Pre Qualification Details,Independent External Monitor/Remarks,Tender Value in ₹,Product Category,Sub category,Contract Type,Bid Validity(Days),Period Of Work(Days),Location,Pincode,Pre Bid Meeting Place,Pre Bid Meeting Address,Pre Bid Meeting Date,Bid Opening Place,Should Allow NDA Tender,Allow Preferential Bidder,Tender Stage,Contract Date :,Contract Value :,Work Completion Period in days :,Updated By :,Updated on :,AOC document :,AOC Description :,S.No,Bid Number,Bidder Name,Awarded Currency,Awarded Value,S.No.1,Bid Number.1,Bidder Name.1,Submitted Date,Status,Remarks,Status Updated On,Type :,Summary :,Updated By :.1,Updated On :,Document :,BOQ Comparative Chart :,Committee Chairperson/Co-ordinator Name :,Committee Chairperson/Co-ordinator Type :,Committee Members :,Updated By :.2,Updated on :.1,Document :.1,Organisation Chain :,Tender ID :,Tender Ref No :,Tender Title :,Type :.1,Summary :.1,Updated By :.3,Updated On :.1,Document :.2,Tender Stage
EIC-CIVIL||SERNB-CIRCLE-BOLANGIR||EERNB-DIVISION-SONEPUR,SE/R AND B/ SNPR / 07 / 2024-25,2024_EICCL_106054_13,Yes,National Competitive Bid,Percentage,Works,2.0,No,No,Online,No,No,No,1.0,Fee/PreQual/Technical,.pdf,"Tender cost (Online), EMD (online), GST Certificate, PAN Contractor RC",28-Oct-2024 10:00 AM,12-Nov-2024 11:00 AM,28-Oct-2024 10:00 AM,11-Nov-2024 05:00 PM,28-Oct-2024 10:00 AM ,05-Nov-2024 10:00 AM ,28-Oct-2024 10:00 AM,11-Nov-2024 05:00 PM,03-Apr-2025 04:40 PM,"55,700",Yes,fixed,,Nil,Nil,1.0,2nd Corridendum,Other,,1.0,ICICI BANK,"10,000",0.0,Nil,Nil,No,Superintending Engineer,"O/O SE (RandB) Division, Sonepur","Construction of Paddy Procurement Center at Sibtula, Tarbha Block in the District of Subarnapur for the year 2024-25","Construction of Paddy Procurement Center at Sibtula, Tarbha Block in the District of Subarnapur for the year 2024-25",Please refer Tender documents. ,NA ,,Civil Works - Buildings,NA ,Tender,90.0,120.0,Sonepur,767017.0,"O/O SE (RandB) Division, Sonepur ","O/O SE (RandB) Division, Sonepur ",08-Nov-2024 11:00 AM ,Sonepur,No ,No,AOC,09-May-2025,"INR 4,730,693.31",120.0,Rudra Narayan Behera,09-May-2025 07:18 PM,w.pdf (266.00 KB),Work Order,1.0,2636614.0,NIKHIL KUMAR JAIN,INR,"4,730,693.31",1,2637194,ABDUL WASIM RAJA KHAN,10-Nov-2024 10:55 PM,Rejected-AOC,Rejected for lottery system,09-May-2025 07:18 PM,Finance,6 nos. bidders are participate and all are admitted,Rudra Narayan Behera,03-Apr-2025 05:30 PM,finance_512350.pdf,BOQ Comparative Chart,"A. Sahoo, SE",Internal,"A. Kumar, DAO, B. Das, AE (Estimator)",Rudra Narayan Behera,09-May-2025 07:01 PM,finsummary_512350.pdf (140.36 KB),EIC-CIVIL||SERNB-CIRCLE-BOLANGIR||EERNB-DIVISION-SONEPUR,2024_EICCL_106054_13,SE/R AND B/ SNPR / 07 / 2024-25,"Construction of Paddy Procurement Center at Sibtula, Tarbha Block in the District of Subarnapur for the year 2024-25",Technical,7 nos. bidders are participate and all are admitted,Rudra Narayan Behera,13-Feb-2025 05:24 PM,technical_512350.pdf,AOC
,,,,,,,,,,,,,,,,.pdf,"Affidavits, undertakings and any other document as per SBD / DTCN",,,,,,,,,,,,,,,,,,,,2.0,ICICI NEFT/RTGS,,,,,,,,,,,,,,,,,,,,,,,,,,AOC,,,,,,,,,,,,,2,2637706,BINOD SAHU,11-Nov-2024 03:22 PM,Rejected-AOC,Rejected for lottery system,09-May-2025 07:18 PM,,,,,,,,,,,,,,,,,,,,,,AOC
,,,,,,,,,,,,,,2.0,Finance,.xls,Boq,,,,,,,,,,,,,,,,,,,,,,,,,,,,,,,,,,,,,,,,,,,,,,,AOC,,,,,,,,,,,,,3,2636614,NIKHIL KUMAR JAIN,10-Nov-2024 07:32 PM,Accepted-AOC,Awarded for lottery system,09-May-2025 07:18 PM,,,,,,,,,,,,,,,,,,,,,,AOC
,,,,,,,,,,,,,,,,,,,,,,,,,,,,,,,,,,,,,,,,,,,,,,,,,,,,,,,,,,,,,,,,AOC,,,,,,,,,,,,,4,2632906,RAKUN MISHRA,08-Nov-2024 10:01 PM,Rejected-AOC,Rejected for lottery system,09-May-2025 07:18 PM,,,,,,,,,,,,,,,,,,,,,,AOC
,,,,,,,,,,,,,,,,,,,,,,,,,,,,,,,,,,,,,,,,,,,,,,,,,,,,,,,,,,,,,,,,AOC,,,,,,,,,,,,,5,2635158,SANTOSH KUMAR MAHAPATRA,10-Nov-2024 11:03 AM,Rejected-Finance,Rejected L2 Bidder,09-May-2025 07:01 PM,,,,,,,,,,,,,,,,,,,,,,AOC
,,,,,,,,,,,,,,,,,,,,,,,,,,,,,,,,,,,,,,,,,,,,,,,,,,,,,,,,,,,,,,,,AOC,,,,,,,,,,,,,6,2633532,SHRADHANYA SAMANTARAY,09-Nov-2024 12:51 PM,Rejected-AOC,Rejected for lottery system,09-May-2025 07:18 PM,,,,,,,,,,,,,,,,,,,,,,AOC
,,,,,,,,,,,,,,,,,,,,,,,,,,,,,,,,,,,,,,,,,,,,,,,,,,,,,,,,,,,,,,,,AOC,,,,,,,,,,,,,7,2639337,SRIKANTA PRADHAN,11-Nov-2024 03:07 PM,Rejected-Technical,Not submitted working experiance,03-Apr-2025 04:37 PM,,,,,,,,,,,,,,,,,,,,,,AOC
