Organisation Chain,Tender Reference Number,Tender ID,Withdrawal Allowed,Tender Type,Form of contract,Tender Category,No. of Covers,General Technical Evaluation Allowed,ItemWise Technical Evaluation Allowed,Payment Mode,Is Multi Currency Allowed For BOQ,Is Multi Currency Allowed For Fee,Allow Two Stage Bidding,Cover No,Cover,Document Type,Description,Publish Date,Bid Opening Date,Document Download / Sale Start Date,Document Download / Sale End Date,Clarification Start Date,Clarification End Date,Bid Submission Start Date,Bid Submission End Date,Financial Bid Opening Date,EMD Amount in ₹,EMD Exemption Allowed,EMD Fee Type,EMD Percentage,EMD Payable To,EMD Payable At,S.No,Bank Name,Tender Fee in ₹,VAT Charges in ₹,Fee Payable To,Fee Payable At,Tender Fee Exemption Allowed,Name,Address,Title,Work Description,Pre Qualification Details,Independent External Monitor/Remarks,Tender Value in ₹,Product Category,Sub category,Contract Type,Bid Validity(Days),Period Of Work(Days),Location,Pincode,Pre Bid Meeting Place,Pre Bid Meeting Address,Pre Bid Meeting Date,Bid Opening Place,Should Allow NDA Tender,Allow Preferential Bidder,Tender Stage,Contract Date :,Contract Value :,Work Completion Period in days :,Updated By :,Updated on :,AOC document :,AOC Description :,S.No,Bid Number,Bidder Name,Awarded Currency,Awarded Value,S.No.1,Bid Number.1,Bidder Name.1,Submitted Date,Status,Remarks,Status Updated On,Type :,Summary :,Updated By :.1,Updated On :,Document :,BOQ Comparative Chart :,Committee Chairperson/Co-ordinator Name :,Committee Chairperson/Co-ordinator Type :,Committee Members :,Updated By :.2,Updated on :.1,Document :.1,Organisation Chain :,Tender ID :,Tender Ref No :,Tender Title :,Type :.1,Summary :.1,Updated By :.3,Updated On :.1,Document :.2,Committee Chairperson/Co-ordinator Name :.1,Committee Chairperson/Co-ordinator Type :.1,Committee Members :.1,Updated By :.4,Updated On :.2,Financial Bid Opening Date:,Document :.3,Tender Stage
Orissa State Police Housing and Welfare Corporation Ltd,13/OPHWC/2024-25,2025_OSPHW_109249_6,Yes,National Competitive Bid,Percentage,Works,2.0,No,No,Online,No,No,No,1.0,Fee/PreQual/Technical,.pdf,"GST, GSTR-1, PAN, Contractor Registration Certificate and Affidavit",09-Jan-2025 06:55 PM,27-Jan-2025 10:30 AM,09-Jan-2025 06:55 PM,24-Jan-2025 05:00 PM,NA ,NA ,09-Jan-2025 06:55 PM,24-Jan-2025 05:00 PM,04-Apr-2025 10:30 AM,"2,46,200",Yes,fixed,,Nil,Nil,1.0,ICICI BANK,"11,800",0.0,Nil,Nil,No,CHIEF ENGINEER OPHWC,OPHWC BHUBANESWAR,Cluster of Constn. of 6 Nos. F type Qtr. and 2 Nos. E type Qtr. at Chhatrapur F.S Ganjam.,Building Work,Please refer Tender documents  ,NA ,"2,46,15,701",Civil Works - Buildings,NA ,Tender,90.0,365.0,Ganjam.,751022.0,NA ,NA ,NA ,OPHWC BHUBANESWAR,No ,No,AOC,02-May-2025,"INR 21,341,812.52",365.0,Bikram Keshari Malla,02-May-2025 12:57 PM,WWWOR.pdf (621.00 KB),AWARDED AS L1 TENDERER AND AWARDED ON DATE 29.04.2025,1.0,2762297.0,MITALIKA SWAIN,INR,"21,341,812.52",1,2773237,Anup Kumar Dash,24-Jan-2025 07:00 AM,Rejected-Finance,DUE TO L2 BIDDER,02-May-2025 12:53 PM,Finance,FINANCIAL BID OPEN AND COMPARATIVE GENERATED,Bikram Keshari Malla,04-Apr-2025 11:45 AM,,BOQ Comparative Chart,AS PER AS ACCEPTANCE LETTER,Internal,AS PER AS ACCEPTANCE LETTER,Bikram Keshari Malla,02-May-2025 12:53 PM,finsummary_524890.pdf (371.74 KB),Orissa State Police Housing and Welfare Corporation Ltd,2025_OSPHW_109249_6,13/OPHWC/2024-25,Cluster of Constn. of 6 Nos. F type Qtr. and 2 Nos. E type Qtr. at Chhatrapur F.S Ganjam.,Technical,NINE BIDDER HAVE PARTCIPATED,Bikram Keshari Malla,27-Jan-2025 04:26 PM,,AS PER TC MINUTES,Internal,AS PER TC MINUTES,Mohan Kumar Ka,03-Apr-2025 05:33 PM,04-Apr-2025 10:30 AM,techsummary_524890.pdf (510.36 KB),AOC
,,,,,,,,,,,,,,,,.pdf,Other Document as per DTCN,,,,,,,,,,,,,,,,2.0,ICICI NEFT/RTGS,,,,,,,,,,,,,,,,,,,,,,,,,,AOC,,,,,,,,,,,,,2,2774730,CHANDRA SEKHAR PRADHAN,24-Jan-2025 03:42 PM,Rejected-Technical,Non-securing qualifying marks in the Point of Presentation as per DTCN Cl.110(m).,03-Apr-2025 05:33 PM,,,,,,,,,,,,,,,,,,,,,,,,,,,,,AOC
,,,,,,,,,,,,,,2.0,Finance,.xls,Bill of Quantity,,,,,,,,,,,,,,,,,,,,,,,,,,,,,,,,,,,,,,,,,,,AOC,,,,,,,,,,,,,3,2774763,DHRUTI CONSTRUCTION & DEVELOPMENT PVT. LTD.,24-Jan-2025 03:18 PM,Rejected-Technical,Non-securing qualifying marks in the Point of Presentation as per DTCN Cl.110(m).,03-Apr-2025 05:33 PM,,,,,,,,,,,,,,,,,,,,,,,,,,,,,AOC
,,,,,,,,,,,,,,,,,,,,,,,,,,,,,,,,,,,,,,,,,,,,,,,,,,,,,,,,,,,,AOC,,,,,,,,,,,,,4,2773231,K.Rabinarayan Das,23-Jan-2025 08:15 PM,Rejected-Technical,Non-securing qualifying marks in the Point of Presentation as per DTCN Cl.110(m).,03-Apr-2025 05:33 PM,,,,,,,,,,,,,,,,,,,,,,,,,,,,,AOC
,,,,,,,,,,,,,,,,,,,,,,,,,,,,,,,,,,,,,,,,,,,,,,,,,,,,,,,,,,,,AOC,,,,,,,,,,,,,5,2762297,MITALIKA SWAIN,23-Jan-2025 09:41 PM,Accepted-AOC,QUALIFIED BIDDER,02-May-2025 12:57 PM,,,,,,,,,,,,,,,,,,,,,,,,,,,,,AOC
,,,,,,,,,,,,,,,,,,,,,,,,,,,,,,,,,,,,,,,,,,,,,,,,,,,,,,,,,,,,AOC,,,,,,,,,,,,,6,2775076,NILACHAKRA CONSTRUCTIONS,24-Jan-2025 04:40 PM,Rejected-Technical,Non submission of EMD in online mode as per DTCN clause no.06.,03-Apr-2025 05:33 PM,,,,,,,,,,,,,,,,,,,,,,,,,,,,,AOC
,,,,,,,,,,,,,,,,,,,,,,,,,,,,,,,,,,,,,,,,,,,,,,,,,,,,,,,,,,,,AOC,,,,,,,,,,,,,7,2774931,PRABHAKAR GOUDA,24-Jan-2025 04:01 PM,Rejected-Technical,Non submission of adequate similar nature of works as per DTCN clause no-11 and 110(j).,03-Apr-2025 05:33 PM,,,,,,,,,,,,,,,,,,,,,,,,,,,,,AOC
,,,,,,,,,,,,,,,,,,,,,,,,,,,,,,,,,,,,,,,,,,,,,,,,,,,,,,,,,,,,AOC,,,,,,,,,,,,,8,2769286,Satya Brata Pattnaik,24-Jan-2025 09:19 AM,Rejected-Finance,DUE TO L3 BIDDER,02-May-2025 12:53 PM,,,,,,,,,,,,,,,,,,,,,,,,,,,,,AOC
,,,,,,,,,,,,,,,,,,,,,,,,,,,,,,,,,,,,,,,,,,,,,,,,,,,,,,,,,,,,AOC,,,,,,,,,,,,,9,2772395,Sudhansu Padhy,23-Jan-2025 02:08 PM,Rejected-Finance,DUE TO L4 BIDDER,02-May-2025 12:53 PM,,,,,,,,,,,,,,,,,,,,,,,,,,,,,AOC
