Organisation Chain,Tender Reference Number,Tender ID,Withdrawal Allowed,Tender Type,Form of contract,Tender Category,No. of Covers,General Technical Evaluation Allowed,ItemWise Technical Evaluation Allowed,Payment Mode,Is Multi Currency Allowed For BOQ,Is Multi Currency Allowed For Fee,Allow Two Stage Bidding,Cover No,Cover,Document Type,Description,Publish Date,Bid Opening Date,Document Download / Sale Start Date,Document Download / Sale End Date,Clarification Start Date,Clarification End Date,Bid Submission Start Date,Bid Submission End Date,EMD Amount in ₹,EMD Exemption Allowed,EMD Fee Type,EMD Percentage,EMD Payable To,EMD Payable At,S.No,Bank Name,Tender Fee in ₹,VAT Charges in ₹,Fee Payable To,Fee Payable At,Tender Fee Exemption Allowed,Name,Address,Title,Work Description,Pre Qualification Details,Independent External Monitor/Remarks,Tender Value in ₹,Product Category,Sub category,Contract Type,Bid Validity(Days),Period Of Work(Days),Location,Pincode,Pre Bid Meeting Place,Pre Bid Meeting Address,Pre Bid Meeting Date,Bid Opening Place,Should Allow NDA Tender,Allow Preferential Bidder,Tender Stage,Contract Date :,Contract Value :,Work Completion Period in days :,Updated By :,Updated on :,AOC document :,AOC Description :,S.No,Bid Number,Bidder Name,Awarded Currency,Awarded Value,S.No.1,Bid Number.1,Bidder Name.1,Submitted Date,Status,Remarks,Status Updated On,Type :,Summary :,Updated By :.1,Updated On :,Document :,BOQ Comparative Chart :,Committee Chairperson/Co-ordinator Name :,Committee Chairperson/Co-ordinator Type :,Committee Members :,Updated By :.2,Updated on :.1,Document :.1,Organisation Chain :,Tender ID :,Tender Ref No :,Tender Title :,Committee Chairperson/Co-ordinator Name :.1,Committee Chairperson/Co-ordinator Type :.1,Committee Members :.1,Updated By :.3,Updated On :.1,Document :.2,Tender Stage
EIC-CIVIL||SERNB-CIRCLE-DHENKANAL||EERNB Angul Division,SE (R and B) Angul-36/ 2024-25,2025_EICCL_110277_2,Yes,Open Tender,Percentage,Works,1.0,No,No,Online,No,No,No,1.0,Fee/PreQual/Technical/Finance,.pdf,"Bid Cost and EMD online, GSTIN, PAN, RC, Affidavit, and Other documents as per DTCN.",06-Feb-2025 05:30 PM,17-Feb-2025 11:00 AM,06-Feb-2025 05:30 PM,15-Feb-2025 05:00 PM,NA ,NA ,06-Feb-2025 05:30 PM,15-Feb-2025 05:00 PM,"47,200",Yes,fixed,,Nil,Nil,1.0,ICICI BANK,"6,000",0.0,Nil,Nil,No,Superintending Engineer Angul R and B Division,O/O the Superintending Engineer Angul RB Division,"P/R to road leading from Pabitra Mohan chhak to Dera chhak via Gandhi chhak such as providing SDBC from 0.800km to 1.0km, 3.500km to 4.500km and 5.100km to 5.300km for the year 2024-25.","P/R to road leading from Pabitra Mohan chhak to Dera chhak via Gandhi chhak such as providing SDBC from 0.800km to 1.0km, 3.500km to 4.500km and 5.100km to 5.300km for the year 2024-25.",Please refer Tender documents. ,NA ,"47,12,448",Civil Works - Roads,NA ,Tender,90.0,30.0,ANGUL,759122.0,NA ,NA ,NA ,O/O the Superintending Engineer Angul RB Division,No ,No,AOC,31-May-2025,"INR 4,006,052",30.0,Pratap Kumar Haripal,31-May-2025 01:08 PM,WO.pdf (80.00 KB),Agreement No. 1126 P1 of 2024-25 (Contract value excluding GST) Date of Commencement- 07.03.2025 Date of Completion- 06.04.2025,1.0,2817113.0,Ramdev Buildcon Prop Manasi Manjari Rout,INR,"4,006,052",1,2818983,ANSHUMAN DASH,15-Feb-2025 12:21 PM,Rejected-AOC,L2 Bidder,31-May-2025 01:08 PM,Finance,The validity of the tender is subject to the result of detail scrutiny of documents submitted by the bidder online.,Shasmita Parida,06-Mar-2025 12:10 PM,finance_528926.pdf,BOQ Comparative Chart,PK HARIPAL SE,Internal,K BEHERA Sr. DAO S PARIDA JE ESTIMATOR,Pratap Kumar Haripal,31-May-2025 01:03 PM,finsummary_528926.pdf (502.28 KB),EIC-CIVIL||SERNB-CIRCLE-DHENKANAL||EERNB Angul Division,2025_EICCL_110277_2,SE (R and B) Angul-36/ 2024-25,"P/R to road leading from Pabitra Mohan chhak to Dera chhak via Gandhi chhak such as providing SDBC from 0.800km to 1.0km, 3.500km to 4.500km and 5.100km to 5.300km for the year 2024-25.",PK HARIPAL SE,Internal,K BEHERA Sr. DAO S PARIDA JE ESTIMATOR,Pratap Kumar Haripal,31-May-2025 12:54 PM,techsummary_528926.pdf (539.40 KB),AOC
,,,,,,,,,,,,,,,,.xls,BOQ,,,,,,,,,,,,,,,2.0,ICICI NEFT/RTGS,,,,,,,,,,,,,,,,,,,,,,,,,,AOC,,,,,,,,,,,,,2,2819353,M/S SHREE MAA BRICKS,15-Feb-2025 03:01 PM,Rejected-AOC,Lottery looser,31-May-2025 01:08 PM,,,,,,,,,,,,,,,,,,,,,,,AOC
,,,,,,,,,,,,,,,,,,,,,,,,,,,,,,,,,,,,,,,,,,,,,,,,,,,,,,,,,,,AOC,,,,,,,,,,,,,3,2817113,Ramdev Buildcon Prop Manasi Manjari Rout,14-Feb-2025 11:24 AM,Accepted-AOC,Lottery winner,31-May-2025 01:08 PM,,,,,,,,,,,,,,,,,,,,,,,AOC
,,,,,,,,,,,,,,,,,,,,,,,,,,,,,,,,,,,,,,,,,,,,,,,,,,,,,,,,,,,AOC,,,,,,,,,,,,,4,2819430,RKU CONSTRUCTIONS PRIVATE LIMITED,15-Feb-2025 03:28 PM,Rejected-AOC,Lottery looser,31-May-2025 01:08 PM,,,,,,,,,,,,,,,,,,,,,,,AOC
,,,,,,,,,,,,,,,,,,,,,,,,,,,,,,,,,,,,,,,,,,,,,,,,,,,,,,,,,,,AOC,,,,,,,,,,,,,5,2817081,S T CONSTRUCTION PROPRITOR SRI SHANKAR PRASAD AGARWALLA,14-Feb-2025 12:04 AM,Rejected-AOC,Lottery looser,31-May-2025 01:08 PM,,,,,,,,,,,,,,,,,,,,,,,AOC
