Organisation Chain,Tender Reference Number,Tender ID,Withdrawal Allowed,Tender Type,Form of contract,Tender Category,No. of Covers,General Technical Evaluation Allowed,ItemWise Technical Evaluation Allowed,Payment Mode,Is Multi Currency Allowed For BOQ,Is Multi Currency Allowed For Fee,Allow Two Stage Bidding,Cover No,Cover,Document Type,Description,Publish Date,Bid Opening Date,Document Download / Sale Start Date,Document Download / Sale End Date,Clarification Start Date,Clarification End Date,Bid Submission Start Date,Bid Submission End Date,Financial Bid Opening Date,EMD Amount in ₹,EMD Exemption Allowed,EMD Fee Type,EMD Percentage,EMD Payable To,EMD Payable At,S.No,Bank Name,Tender Fee in ₹,VAT Charges in ₹,Fee Payable To,Fee Payable At,Tender Fee Exemption Allowed,Name,Address,Title,Work Description,Pre Qualification Details,Independent External Monitor/Remarks,Tender Value in ₹,Product Category,Sub category,Contract Type,Bid Validity(Days),Period Of Work(Days),Location,Pincode,Pre Bid Meeting Place,Pre Bid Meeting Address,Pre Bid Meeting Date,Bid Opening Place,Should Allow NDA Tender,Allow Preferential Bidder,Tender Stage,Contract Date :,Contract Value :,Work Completion Period in days :,Updated By :,Updated on :,AOC document :,AOC Description :,S.No,Bid Number,Bidder Name,Awarded Currency,Awarded Value,S.No.1,Bid Number.1,Bidder Name.1,Submitted Date,Status,Remarks,Status Updated On,Type :,Summary :,Updated By :.1,Updated On :,Document :,BOQ Comparative Chart :,Committee Chairperson/Co-ordinator Name :,Committee Chairperson/Co-ordinator Type :,Committee Members :,Updated By :.2,Updated on :.1,Document :.1,Organisation Chain :,Tender ID :,Tender Ref No :,Tender Title :,Type :.1,Summary :.1,Updated By :.3,Updated On :.1,Document :.2,Committee Chairperson/Co-ordinator Name :.1,Committee Chairperson/Co-ordinator Type :.1,Committee Members :.1,Updated By :.4,Updated On :.2,Financial Bid Opening Date:,Document :.3,Tender Stage
PHEO||PH Circle Bhawanipatna||PH Division Balangir,SEPHBGR 21/2024-25,2024_PHEO_107210_1,Yes,National Competitive Bid,Percentage,Works,2.0,No,No,Online,No,No,No,1.0,Fee/PreQual/Technical,.pdf,"Tender paper cost, EMD, PAN, GSTIN, Contractor registration certificate, Experience certificate, etc",19-Nov-2024 12:00 PM,06-Dec-2024 11:00 AM,19-Nov-2024 12:00 PM,05-Dec-2024 05:00 PM,19-Nov-2024 12:00 PM ,02-Dec-2024 05:00 PM ,19-Nov-2024 12:00 PM,05-Dec-2024 05:00 PM,07-Apr-2025 11:30 AM,"2,83,638",Yes,percentage,1.0%,Nil,Nil,1.0,ICICI BANK,"10,000",0.0,Nil,Nil,No,"Superintending Engineer, P.H. Division, Balangir","Superintending Engineer, P.H. Division, Balangir","Construction of ESRs, Pump houses with ancillary work in connection to the work Augmentation of water supply system along with ancillary work for Kantabanji Town","Construction of ESRs, Pump houses with ancillary work in connection to the work Augmentation of water supply system along with ancillary work for Kantabanji Town",Please refer DTCN ,NA ,"2,83,63,797",Civil Works - Water Works,NA ,Tender,120.0,365.0,Kantabanji NAC,767039.0,NA ,NA ,NA ,"Superintending Engineer, P.H. Division, Balangir",No ,No,AOC,27-May-2025,"INR 28,363,797.46",365.0,Indrajit Sahu,27-May-2025 10:25 AM,WO.pdf (826.00 KB),L1 bidder has respond,1.0,2660970.0,P. G. Construction,INR,"24,112,064",1,2683632,ABDUL RAFIK,05-Dec-2024 03:32 PM,Rejected-Technical,Work experience submitted by the agency dose not meet the criteria as per DTCN,27-Mar-2025 05:19 PM,Finance,Financial Bid opened,Indrajit Sahu,07-Apr-2025 07:06 PM,finance_516802.pdf,BOQ Comparative Chart,Superitendng Engineer,Internal,"Superintending Engineer, Divisional Accounts Officer, EE Estimator",Indrajit Sahu,27-May-2025 10:21 AM,finsummary_516802.pdf (826.22 KB),PHEO||PH Circle Bhawanipatna||PH Division Balangir,2024_PHEO_107210_1,SEPHBGR 21/2024-25,"Construction of ESRs, Pump houses with ancillary work in connection to the work Augmentation of water supply system along with ancillary work for Kantabanji Town",Technical,Opening summary,Indrajit Sahu,07-Dec-2024 05:01 PM,technical_516802.pdf,Superitendng Engineer,Internal,"Superintending Engineer, Divisional Accounts officer, EE Estimator",Indrajit Sahu,27-Mar-2025 05:19 PM,07-Apr-2025 11:30 AM,techsummary_516802.pdf (51.03 KB),AOC
,,,,,,,,,,,,,,,,.pdf,Other documents as per DTCN,,,,,,,,,,,,,,,,2.0,ICICI NEFT/RTGS,,,,,,,,,,,,,,,,,,,,,,,,,,AOC,,,,,,,,,,,,,2,2682094,BEDA BYASA NAG,05-Dec-2024 02:47 PM,Rejected-Technical,Work experience submitted by the agency dose not meet the criteria as per DTCN,27-Mar-2025 05:19 PM,,,,,,,,,,,,,,,,,,,,,,,,,,,,,AOC
,,,,,,,,,,,,,,2.0,Finance,.xls,BOQ,,,,,,,,,,,,,,,,,,,,,,,,,,,,,,,,,,,,,,,,,,,AOC,,,,,,,,,,,,,3,2679146,GOYAL CONSTRUCTIONS AND LAND SCAPPERS,05-Dec-2024 02:05 PM,Rejected-Finance,Due to transparent Lottery,27-May-2025 10:21 AM,,,,,,,,,,,,,,,,,,,,,,,,,,,,,AOC
,,,,,,,,,,,,,,,,,,,,,,,,,,,,,,,,,,,,,,,,,,,,,,,,,,,,,,,,,,,,AOC,,,,,,,,,,,,,4,2676194,JUBARAJ KUMBHAR,02-Dec-2024 04:15 PM,Rejected-Finance,Due to transparent Lottery,27-May-2025 10:21 AM,,,,,,,,,,,,,,,,,,,,,,,,,,,,,AOC
,,,,,,,,,,,,,,,,,,,,,,,,,,,,,,,,,,,,,,,,,,,,,,,,,,,,,,,,,,,,AOC,,,,,,,,,,,,,5,2683362,LOKANATH BARIK,05-Dec-2024 01:39 PM,Rejected-Technical,Work experience submitted by the agency dose not meet the criteria as per DTCN,27-Mar-2025 05:19 PM,,,,,,,,,,,,,,,,,,,,,,,,,,,,,AOC
,,,,,,,,,,,,,,,,,,,,,,,,,,,,,,,,,,,,,,,,,,,,,,,,,,,,,,,,,,,,AOC,,,,,,,,,,,,,6,2660970,P. G. Construction,05-Dec-2024 03:37 PM,Accepted-AOC,Awarded as per OPWD code,27-May-2025 10:25 AM,,,,,,,,,,,,,,,,,,,,,,,,,,,,,AOC
,,,,,,,,,,,,,,,,,,,,,,,,,,,,,,,,,,,,,,,,,,,,,,,,,,,,,,,,,,,,AOC,,,,,,,,,,,,,7,2680207,Sanjaya Kumar Agrawal,05-Dec-2024 11:11 AM,Rejected-Finance,Due to transparent Lottery,27-May-2025 10:21 AM,,,,,,,,,,,,,,,,,,,,,,,,,,,,,AOC
,,,,,,,,,,,,,,,,,,,,,,,,,,,,,,,,,,,,,,,,,,,,,,,,,,,,,,,,,,,,AOC,,,,,,,,,,,,,8,2681815,SANJEEB MOHANTY,04-Dec-2024 06:21 PM,Rejected-Finance,Due to transparent Lottery,27-May-2025 10:21 AM,,,,,,,,,,,,,,,,,,,,,,,,,,,,,AOC
