Organisation Chain,Tender Reference Number,Tender ID,Withdrawal Allowed,Tender Type,Form of contract,Tender Category,No. of Covers,General Technical Evaluation Allowed,ItemWise Technical Evaluation Allowed,Payment Mode,Is Multi Currency Allowed For BOQ,Is Multi Currency Allowed For Fee,Allow Two Stage Bidding,Cover No,Cover,Document Type,Description,Publish Date,Bid Opening Date,Document Download / Sale Start Date,Document Download / Sale End Date,Clarification Start Date,Clarification End Date,Bid Submission Start Date,Bid Submission End Date,Financial Bid Opening Date,EMD Amount in ₹,EMD Exemption Allowed,EMD Fee Type,EMD Percentage,EMD Payable To,EMD Payable At,S.No,Corrigendum Title,Corrigendum Type,View,S.No.1,Bank Name,Tender Fee in ₹,VAT Charges in ₹,Fee Payable To,Fee Payable At,Tender Fee Exemption Allowed,Name,Address,Title,Work Description,Pre Qualification Details,Independent External Monitor/Remarks,Tender Value in ₹,Product Category,Sub category,Contract Type,Bid Validity(Days),Period Of Work(Days),Location,Pincode,Pre Bid Meeting Place,Pre Bid Meeting Address,Pre Bid Meeting Date,Bid Opening Place,Should Allow NDA Tender,Allow Preferential Bidder,Tender Stage,Contract Date :,Contract Value :,Work Completion Period in days :,Updated By :,Updated on :,AOC document :,AOC Description :,S.No,Bid Number,Bidder Name,Awarded Currency,Awarded Value,S.No.1,Bid Number.1,Bidder Name.1,Submitted Date,Status,Remarks,Status Updated On,Type :,Summary :,Updated By :.1,Updated On :,Document :,BOQ Comparative Chart :,Committee Chairperson/Co-ordinator Name :,Committee Chairperson/Co-ordinator Type :,Committee Members :,Updated By :.2,Updated on :.1,Document :.1,Organisation Chain :,Tender ID :,Tender Ref No :,Tender Title :,Type :.1,Summary :.1,Updated By :.3,Updated On :.1,Document :.2,Committee Chairperson/Co-ordinator Name :.1,Committee Chairperson/Co-ordinator Type :.1,Committee Members :.1,Updated By :.4,Updated On :.2,Financial Bid Opening Date:,Document :.3,Tender Stage
CE RW I||RWCIRCLE-BHUBANESWAR,Tender Online C.C-23 of 2024,2024_CERWI_107600_3,Yes,National Competitive Bid,Percentage,Works,2.0,No,No,Online,No,No,No,1.0,Fee/PreQual/Technical,.pdf,"Tender Paper Cost, EMD, GSTIN, PAN, Registration Certificate",10-Dec-2024 06:55 PM,24-Dec-2024 11:00 AM,10-Dec-2024 06:55 PM,23-Dec-2024 05:00 PM,NA ,NA ,10-Dec-2024 06:55 PM,23-Dec-2024 05:00 PM,14-Feb-2025 11:00 AM,"51,937",Yes,percentage,1.0%,Nil,Nil,1.0,Date Corrigendum1,Date,,1.0,ICICI BANK,"10,000",0.0,Nil,Nil,No,ChiefConstructionEngineer,"O/o ChiefConstructionEngineer,CentralRWCircle,BBSR",Annual Maintenance Plan for 5 years Completed PMGSY (POST DLP) roads such as (a) PWD road to Karadapalli under Package No. PM / BBSR / 65,Annual Maintenance Plan for 5 years Completed PMGSY (POST DLP) roads such as (a) PWD road to Karadapalli under Package No. PM / BBSR / 65,Please refer Tender documents. ,NA ,"51,93,705",Civil Works - Roads,NA ,Tender,90.0,180.0,Bhubaneswar,751022.0,NA ,NA ,NA ,"O/o ChiefConstructionEngineer,CentralRWCircle,BBSR",No ,No,AOC,22-May-2025,"INR 4,415,169",180.0,Naran Murmu,22-May-2025 05:54 PM,PMBBSR65AgmtDetails.pdf (226.00 KB),"Work order letter No.4256 dtd.19.4.25 and Agmt No.03-Post DLP (State fund) of 2025-26 dtd.19.4.25 of Superintending Engineer, Rural Works Division, Bhubaneswar",1.0,2708184.0,ANIL KUMAR PRUSTY,INR,"4,415,169",1,2708581,ALOKNATH SATRUSALYA,23-Dec-2024 04:48 PM,Rejected-Finance,Other than winner of the transparent lottery system,22-May-2025 05:43 PM,Finance,5 nos bidder qualified in the tender,Mausumi Mishra,15-Feb-2025 01:06 PM,,BOQ Comparative Chart,Chief Construction Engineer,Internal,SuperintendingEngineerRWDivsion Puri SrDAORWDivision Bhubaneswar PAtoChiefConstructionEngineerCentralRuralWorksCircleBBSR,Naran Murmu,22-May-2025 05:43 PM,finsummary_518033.pdf (265.57 KB),CE RW I||RWCIRCLE-BHUBANESWAR,2024_CERWI_107600_3,Tender Online C.C-23 of 2024,Annual Maintenance Plan for 5 years Completed PMGSY (POST DLP) roads such as (a) PWD road to Karadapalli under Package No. PM / BBSR / 65,Technical,7 nos bidder participated in the tender,Kumari Suvalaxmi,31-Dec-2024 05:57 PM,,Chief Construction Engineer,Internal,SuperintendingEngineerRWDivsion Puri SrDAORWDivision Bhubaneswar PAtoChiefConstructionEngineerCentralRuralWorksCircleBBSR,Mausumi Mishra,11-Feb-2025 05:40 PM,14-Feb-2025 11:00 AM,techsummary_518033.pdf (1324.84 KB),AOC
,,,,,,,,,,,,,,,,.pdf,"Work in Hand, Machineries, Affidavit of Correctness Certificate",,,,,,,,,,,,,,,,,,,,2.0,ICICI NEFT/RTGS,,,,,,,,,,,,,,,,,,,,,,,,,,AOC,,,,,,,,,,,,,2,2708184,ANIL KUMAR PRUSTY,23-Dec-2024 02:43 PM,Accepted-AOC,Accepted,22-May-2025 05:54 PM,,,,,,,,,,,,,,,,,,,,,,,,,,,,,AOC
,,,,,,,,,,,,,,,,.pdf,"No Relationship Certificate, ATO, Work Experience and required documents as per DTCN",,,,,,,,,,,,,,,,,,,,,,,,,,,,,,,,,,,,,,,,,,,,,,,AOC,,,,,,,,,,,,,3,2700636,CHANDAN KUMAR PAIKARAY,23-Dec-2024 03:28 PM,Rejected-Technical,As per Clause No.104(c) of the Elegibility Criteria of the DTCN (Insufficient Machinery),11-Feb-2025 05:40 PM,,,,,,,,,,,,,,,,,,,,,,,,,,,,,AOC
,,,,,,,,,,,,,,2.0,Finance,.xls,BOQ,,,,,,,,,,,,,,,,,,,,,,,,,,,,,,,,,,,,,,,,,,,,,,,AOC,,,,,,,,,,,,,4,2707753,DEBASIS PATTANAIK,23-Dec-2024 02:55 PM,Rejected-Finance,Other than winner of the transparent lottery system,22-May-2025 05:43 PM,,,,,,,,,,,,,,,,,,,,,,,,,,,,,AOC
,,,,,,,,,,,,,,,,,,,,,,,,,,,,,,,,,,,,,,,,,,,,,,,,,,,,,,,,,,,,,,,,AOC,,,,,,,,,,,,,5,2696022,HRUSHIKESH BISWAL,16-Dec-2024 01:17 PM,Rejected-Technical,As per Clause No.104(c) of the Elegibility Criteria of the DTCN (Insufficient Machinery),11-Feb-2025 05:40 PM,,,,,,,,,,,,,,,,,,,,,,,,,,,,,AOC
,,,,,,,,,,,,,,,,,,,,,,,,,,,,,,,,,,,,,,,,,,,,,,,,,,,,,,,,,,,,,,,,AOC,,,,,,,,,,,,,6,2708609,M/s ULLASH CHANDRA TARAI,23-Dec-2024 04:53 PM,Rejected-Finance,Other than winner of the transparent lottery system,22-May-2025 05:43 PM,,,,,,,,,,,,,,,,,,,,,,,,,,,,,AOC
,,,,,,,,,,,,,,,,,,,,,,,,,,,,,,,,,,,,,,,,,,,,,,,,,,,,,,,,,,,,,,,,AOC,,,,,,,,,,,,,7,2704181,RAMACHANDRA SAMANTA SINGHAR,22-Dec-2024 01:21 PM,Rejected-Finance,Other than winner of the transparent lottery system,22-May-2025 05:43 PM,,,,,,,,,,,,,,,,,,,,,,,,,,,,,AOC
