Organisation Chain,Tender Reference Number,Tender ID,Withdrawal Allowed,Tender Type,Form of contract,Tender Category,No. of Covers,General Technical Evaluation Allowed,ItemWise Technical Evaluation Allowed,Payment Mode,Is Multi Currency Allowed For BOQ,Is Multi Currency Allowed For Fee,Allow Two Stage Bidding,Cover No,Cover,Document Type,Description,Publish Date,Bid Opening Date,Document Download / Sale Start Date,Document Download / Sale End Date,Clarification Start Date,Clarification End Date,Bid Submission Start Date,Bid Submission End Date,EMD Amount in ₹,EMD Exemption Allowed,EMD Fee Type,EMD Percentage,EMD Payable To,EMD Payable At,S.No,Bank Name,Tender Fee in ₹,VAT Charges in ₹,Fee Payable To,Fee Payable At,Tender Fee Exemption Allowed,Name,Address,Title,Work Description,Pre Qualification Details,Independent External Monitor/Remarks,Tender Value in ₹,Product Category,Sub category,Contract Type,Bid Validity(Days),Period Of Work(Days),Location,Pincode,Pre Bid Meeting Place,Pre Bid Meeting Address,Pre Bid Meeting Date,Bid Opening Place,Should Allow NDA Tender,Allow Preferential Bidder,Tender Stage,Contract Date :,Contract Value :,Work Completion Period in days :,Updated By :,Updated on :,AOC document :,AOC Description :,S.No,Bid Number,Bidder Name,Awarded Currency,Awarded Value,S.No.1,Bid Number.1,Bidder Name.1,Submitted Date,Status,Remarks,Status Updated On,Type :,Summary :,Updated By :.1,Updated On :,Document :,BOQ Comparative Chart :,Committee Chairperson/Co-ordinator Name :,Committee Chairperson/Co-ordinator Type :,Committee Members :,Updated By :.2,Updated on :.1,Document :.1,Organisation Chain :,Tender ID :,Tender Ref No :,Tender Title :,Committee Chairperson/Co-ordinator Name :.1,Committee Chairperson/Co-ordinator Type :.1,Committee Members :.1,Updated By :.3,Updated On :.1,Document :.2,Tender Stage
CE RW I||RWCIRCLE-BERHAMPUR||EE RW Divn. Baliguda,Online Tender- 15/ SERWDBLG/2023-24,2024_CERWI_99432_6,Yes,National Competitive Bid,Percentage,Works,1.0,No,No,Online,No,No,No,1.0,Fee/PreQual/Technical/Finance,.pdf,"Valid Contract Registration Certificate, GSTIN, PAN, Affidavit, cost of Tender Paper as per DTC",10-Jan-2024 10:00 AM,18-Jan-2024 11:00 AM,10-Jan-2024 10:00 AM,17-Jan-2024 05:00 PM,10-Jan-2024 10:00 AM ,16-Jan-2024 05:00 PM ,10-Jan-2024 10:00 AM,17-Jan-2024 05:00 PM,"5,040",Yes,fixed,,Nil,Nil,1.0,ICICI BANK,"4,000",0.0,Nil,Nil,No,"Superintending Engineer, Rural Works Division, Ba","Superintending Engineer, Rural Works Division, Balliguda",S/R to Sirtiguda to Gadrikia road for the year 2023-24,S/R to Sirtiguda to Gadrikia road for the year 2023-24,Please refer Tender Document ,NA ,"5,03,871",Civil Works - Roads,NA ,Tender,90.0,30.0,"Balliguda, Kandhamal",762103.0,NA ,NA ,NA ,"Superintending Engineer, Rural Works Division, Ba",No ,No,AOC,08-May-2025,"INR 428,341",30.0,Srikrushna Sabar,08-May-2025 12:14 PM,Work.pdf (719.00 KB),"Successful bidder Sujeet Dash , C Class Contractor declared as winner in lottery",1.0,2394481.0,M/S SUJEET DASH,INR,"428,341",1,2395354,BIJAYALAXMI MISHRA,17-Jan-2024 06:31 AM,Rejected-Finance,Unsuccessful bidder,06-May-2025 11:11 AM,Finance,"Successful bidder Sujeet Dash , C Class Contractor declared as winner in lottery",A Nageswar Patro,06-May-2025 10:28 AM,finance_483369.pdf,BOQ Comparative Chart,EE/DAO,Internal,EE/DAO,Dusmanta Kumar Dehury,06-May-2025 11:11 AM,finsummary_483369.pdf (718.87 KB),CE RW I||RWCIRCLE-BERHAMPUR||EE RW Divn. Baliguda,2024_CERWI_99432_6,Online Tender- 15/ SERWDBLG/2023-24,S/R to Sirtiguda to Gadrikia road for the year 2023-24,EE/DAO,Internal,EE/DAO,Dusmanta Kumar Dehury,06-May-2025 11:08 AM,techsummary_483369.pdf (718.87 KB),AOC
,,,,,,,,,,,,,,,,.pdf,Valid Email ID and Valid WhatsApp No. is Mandatory,,,,,,,,,,,,,,,2.0,ICICI NEFT/RTGS,,,,,,,,,,,,,,,,,,,,,,,,,,AOC,,,,,,,,,,,,,2,2394271,BINAYA KRISHNA SAHOO,16-Jan-2024 04:09 PM,Rejected-Finance,Unsuccessful bidder,06-May-2025 11:11 AM,,,,,,,,,,,,,,,,,,,,,,,AOC
,,,,,,,,,,,,,,,,.pdf,DTCN,,,,,,,,,,,,,,,,,,,,,,,,,,,,,,,,,,,,,,,,,,AOC,,,,,,,,,,,,,3,2389765,CH MOHAN PRASAD SUBUDHI,15-Jan-2024 10:10 AM,Rejected-Finance,Unsuccessful bidder,06-May-2025 11:11 AM,,,,,,,,,,,,,,,,,,,,,,,AOC
,,,,,,,,,,,,,,,,.pdf,NIT,,,,,,,,,,,,,,,,,,,,,,,,,,,,,,,,,,,,,,,,,,AOC,,,,,,,,,,,,,4,2394481,M/S SUJEET DASH,16-Jan-2024 07:43 PM,Accepted-AOC,"Successful bidder Sujeet Dash , C Class Contractor declared as winner in lottery",08-May-2025 12:14 PM,,,,,,,,,,,,,,,,,,,,,,,AOC
,,,,,,,,,,,,,,,,.xls,BoQ,,,,,,,,,,,,,,,,,,,,,,,,,,,,,,,,,,,,,,,,,,AOC,,,,,,,,,,,,,5,2395226,RAJASHREE CONSTRUCTION,17-Jan-2024 06:17 AM,Rejected-Finance,Unsuccessful bidder,06-May-2025 11:11 AM,,,,,,,,,,,,,,,,,,,,,,,AOC
