Organisation Chain,Tender Reference Number,Tender ID,Withdrawal Allowed,Tender Type,Form of contract,Tender Category,No. of Covers,General Technical Evaluation Allowed,ItemWise Technical Evaluation Allowed,Payment Mode,Is Multi Currency Allowed For BOQ,Is Multi Currency Allowed For Fee,Allow Two Stage Bidding,Cover No,Cover,Document Type,Description,Publish Date,Bid Opening Date,Document Download / Sale Start Date,Document Download / Sale End Date,Clarification Start Date,Clarification End Date,Bid Submission Start Date,Bid Submission End Date,Financial Bid Opening Date,EMD Amount in ₹,EMD Exemption Allowed,EMD Fee Type,EMD Percentage,EMD Payable To,EMD Payable At,S.No,Corrigendum Title,Corrigendum Type,View,S.No.1,Bank Name,Tender Fee in ₹,VAT Charges in ₹,Fee Payable To,Fee Payable At,Tender Fee Exemption Allowed,Name,Address,Title,Work Description,Pre Qualification Details,Independent External Monitor/Remarks,Tender Value in ₹,Product Category,Sub category,Contract Type,Bid Validity(Days),Period Of Work(Days),Location,Pincode,Pre Bid Meeting Place,Pre Bid Meeting Address,Pre Bid Meeting Date,Bid Opening Place,Should Allow NDA Tender,Allow Preferential Bidder,Tender Stage,Contract Date :,Contract Value :,Work Completion Period in days :,Updated By :,Updated on :,AOC document :,S.No,Bid Number,Bidder Name,Awarded Currency,Awarded Value,S.No.1,Bid Number.1,Bidder Name.1,Submitted Date,Status,Remarks,Status Updated On,Type :,Summary :,Updated By :.1,Updated On :,Document :,BOQ Comparative Chart :,Committee Chairperson/Co-ordinator Name :,Committee Chairperson/Co-ordinator Type :,Committee Members :,Updated By :.2,Updated on :.1,Document :.1,Organisation Chain :,Tender ID :,Tender Ref No :,Tender Title :,Type :.1,Summary :.1,Updated By :.3,Updated On :.1,Document :.2,Committee Chairperson/Co-ordinator Name :.1,Committee Chairperson/Co-ordinator Type :.1,Committee Members :.1,Updated By :.4,Updated On :.2,Financial Bid Opening Date:,Document :.3,Tender Stage
EIC-CIVIL||SERNB-CIRCLE-NORTHERN||EERNB-DIVN-BARGARH,IFB-SE PWD-21 OF 2024-25,2025_EICCL_109582_13,Yes,Open Tender,Percentage,Works,2.0,No,No,Online,No,No,No,1.0,Fee/PreQual/Technical,.pdf,"Tender Cost, EMD, Bid Declaration Form, GSTIN, PAN, EPF, ESI, Affidavit and other DOC as per DTCN",21-Jan-2025 11:00 AM,04-Feb-2025 11:30 AM,21-Jan-2025 11:00 AM,03-Feb-2025 05:00 PM,21-Jan-2025 11:00 AM ,03-Feb-2025 05:00 PM ,21-Jan-2025 11:00 AM,03-Feb-2025 05:00 PM,24-Mar-2025 09:00 AM,"32,218",Yes,fixed,,Nil,Nil,1.0,1ST CORRIGENDUM,Date,,1.0,ICICI BANK,"6,000",0.0,Nil,Nil,No,O/O THE SUPERINTENDING ENGINEER (R AND B) DIVISION,"O/O THE SUPERINTENDING ENGINEER (R AND B) DIVISION BARGARH, AT-NEAR GOVT BUS STAND INFRONT OF WOMENS COLLEGE BARGARH",Shifting of 11KV and LT line for road widening of Panichhatra to Sukutapali via Jamurda road in the dist. of Bargarh. (under ESO-Barhaguda),ELECTRICAL WORK,PLEASE REFER THE TENDER DOCUMENTS ,NA ,"32,21,788",Electrical Works,NA ,Tender,90.0,90.0,ATTABIRA,768028.0,NA ,NA ,NA ,O/O THE SUPERINTENDING ENGINEER (R AND B) DIVISION,No ,No,AOC,29-May-2025,"INR 3,218,244",90.0,Arun Kumar Pandey,29-May-2025 07:09 PM,AOCSUKTAPALIJAMURDA.pdf (333.00 KB),1.0,2794805.0,M/s ARS Infra Power,INR,"3,218,244",1,2794551,DEBANANDA BABU,03-Feb-2025 01:05 PM,Rejected-AOC,2nd lowest,29-May-2025 07:09 PM,Finance,Total No. of 3 nos bidder accepted for financial evaluation process.,Arun Kumar Pandey,24-Mar-2025 11:27 AM,,BOQ Comparative Chart,ARUN KUMAR PANDEY,Internal,1-VINIT KUMAR 2-BASANTA KUMAR DEHURY 3-UMESH CHANDRA BHOI,Arun Kumar Pandey,29-May-2025 07:06 PM,finsummary_526723.pdf (332.94 KB),EIC-CIVIL||SERNB-CIRCLE-NORTHERN||EERNB-DIVN-BARGARH,2025_EICCL_109582_13,IFB-SE PWD-21 OF 2024-25,Shifting of 11KV and LT line for road widening of Panichhatra to Sukutapali via Jamurda road in the dist. of Bargarh. (under ESO-Barhaguda),Technical,Total No. of 7 nos bidder accepted for technical evaluation process.,Umesh Chandra Bhoi,04-Feb-2025 12:13 PM,,ARUN KUMAR PANDEY,Internal,1-VINIT KUMAR 2-BASANTA KUMAR DEHURY 3-UMESH CHANDRA BHOI,Arun Kumar Pandey,20-Mar-2025 11:29 AM,24-Mar-2025 09:00 AM,techsummary_526723.pdf (341.24 KB),AOC
,,,,,,,,,,,,,,2.0,Finance,.xls,BILL OF QUANTITY,,,,,,,,,,,,,,,,,,,,2.0,ICICI NEFT/RTGS,,,,,,,,,,,,,,,,,,,,,,,,,,AOC,,,,,,,,,,,,2,2793242,HIMANSU PANDA,03-Feb-2025 02:17 PM,Rejected-Technical,Not submitted Experince Certificate as per DTCN,20-Mar-2025 11:29 AM,,,,,,,,,,,,,,,,,,,,,,,,,,,,,AOC
,,,,,,,,,,,,,,,,,,,,,,,,,,,,,,,,,,,,,,,,,,,,,,,,,,,,,,,,,,,,,,,,AOC,,,,,,,,,,,,3,2794805,M/s ARS Infra Power,03-Feb-2025 02:01 PM,Accepted-AOC,1st lowest,29-May-2025 07:09 PM,,,,,,,,,,,,,,,,,,,,,,,,,,,,,AOC
,,,,,,,,,,,,,,,,,,,,,,,,,,,,,,,,,,,,,,,,,,,,,,,,,,,,,,,,,,,,,,,,AOC,,,,,,,,,,,,4,2795041,M/S ORISSA ENTERPRISES,03-Feb-2025 03:16 PM,Rejected-AOC,3rd lowest,29-May-2025 07:09 PM,,,,,,,,,,,,,,,,,,,,,,,,,,,,,AOC
,,,,,,,,,,,,,,,,,,,,,,,,,,,,,,,,,,,,,,,,,,,,,,,,,,,,,,,,,,,,,,,,AOC,,,,,,,,,,,,5,2787264,M/S RAJENDRA SAHU,29-Jan-2025 06:31 PM,Rejected-Technical,Not submitted Experince Certificate as per DTCN,20-Mar-2025 11:29 AM,,,,,,,,,,,,,,,,,,,,,,,,,,,,,AOC
,,,,,,,,,,,,,,,,,,,,,,,,,,,,,,,,,,,,,,,,,,,,,,,,,,,,,,,,,,,,,,,,AOC,,,,,,,,,,,,6,2793706,saraswati telesolutions,02-Feb-2025 02:39 PM,Rejected-Technical,Not submitted Experince Certificate as per DTCN,20-Mar-2025 11:29 AM,,,,,,,,,,,,,,,,,,,,,,,,,,,,,AOC
,,,,,,,,,,,,,,,,,,,,,,,,,,,,,,,,,,,,,,,,,,,,,,,,,,,,,,,,,,,,,,,,AOC,,,,,,,,,,,,7,2788823,SITARAM INFRA AND ENERGY PVT LTD,02-Feb-2025 05:15 PM,Rejected-Technical,Not submitted Experince Certificate as per DTCN,20-Mar-2025 11:29 AM,,,,,,,,,,,,,,,,,,,,,,,,,,,,,AOC
