Organisation Chain,Tender Reference Number,Tender ID,Withdrawal Allowed,Tender Type,Form of contract,Tender Category,No. of Covers,General Technical Evaluation Allowed,ItemWise Technical Evaluation Allowed,Payment Mode,Is Multi Currency Allowed For BOQ,Is Multi Currency Allowed For Fee,Allow Two Stage Bidding,Cover No,Cover,Document Type,Description,Publish Date,Bid Opening Date,Document Download / Sale Start Date,Document Download / Sale End Date,Clarification Start Date,Clarification End Date,Bid Submission Start Date,Bid Submission End Date,Financial Bid Opening Date,EMD Amount in ₹,EMD Exemption Allowed,EMD Fee Type,EMD Percentage,EMD Payable To,EMD Payable At,S.No,Corrigendum Title,Corrigendum Type,View,S.No.1,Bank Name,Tender Fee in ₹,VAT Charges in ₹,Fee Payable To,Fee Payable At,Tender Fee Exemption Allowed,Name,Address,Title,Work Description,Pre Qualification Details,Independent External Monitor/Remarks,Tender Value in ₹,Product Category,Sub category,Contract Type,Bid Validity(Days),Period Of Work(Days),Location,Pincode,Pre Bid Meeting Place,Pre Bid Meeting Address,Pre Bid Meeting Date,Bid Opening Place,Should Allow NDA Tender,Allow Preferential Bidder,Tender Stage,Contract Date :,Contract Value :,Work Completion Period in days :,Updated By :,Updated on :,AOC document :,AOC Description :,S.No,Bid Number,Bidder Name,Awarded Currency,Awarded Value,S.No.1,Bid Number.1,Bidder Name.1,Submitted Date,Status,Remarks,Status Updated On,Type :,Summary :,Updated By :.1,Updated On :,Document :,BOQ Comparative Chart :,Committee Chairperson/Co-ordinator Name :,Committee Chairperson/Co-ordinator Type :,Committee Members :,Updated By :.2,Updated on :.1,Document :.1,Organisation Chain :,Tender ID :,Tender Ref No :,Tender Title :,Type :.1,Summary :.1,Updated By :.3,Updated On :.1,Document :.2,Committee Chairperson/Co-ordinator Name :.1,Committee Chairperson/Co-ordinator Type :.1,Committee Members :.1,Updated By :.4,Updated On :.2,Financial Bid Opening Date:,Document :.3,Tender Stage
Municipal Bodies||Cuttack Municipal Corporation,MCCMCCTC_Div-III_No11/2024-25,2024_ORULB_104850_1,Yes,Open Tender,EOI,Works,2.0,No,No,Online,No,No,No,1.0,Fee/PreQual/Technical,.pdf,"TENDER PAPER COST,EMD,GST,PAN,REGISTRATION CERTIFICATE,OTHER DOCUMENTS AS PER DTCN in online.",13-Sep-2024 03:00 PM,12-Nov-2024 05:00 PM,13-Sep-2024 03:00 PM,11-Nov-2024 05:00 PM,NA ,NA ,13-Sep-2024 03:00 PM,11-Nov-2024 05:00 PM,15-Jan-2025 04:40 PM,"6,00,000",Yes,fixed,,Nil,Nil,1.0,4th Corrigendum Notice,Date,,1.0,ICICI BANK,"11,800",0.0,Nil,Nil,No,"Executive Engineer,Div-III","Bikash Bhawan,Jagannath Lane,Badambadi-753012",Selection of Consultant for Preparation of Comprehensive Drainage Master Plan for Drainage Decongestion of Cuttack City under Cuttack Municipal Corporation,Selection of Consultant for Preparation of Comprehensive Drainage Master Plan for Drainage Decongestion of Cuttack City under Cuttack Municipal Corporation,Drainage Master Plan for Drainage Decongestion ,NA ,0.0,Civil Works - Others,NA ,Tender,195.0,180.0,CMC,753012.0,NA ,NA ,NA ,"Bikash Bhawan,Jagannath Lane,Badambadi-753012",No ,No,AOC,21-May-2025,"INR 14,950,000",180.0,Sanjukta Sa,21-May-2025 04:51 PM,wo.pdf (1245.00 KB),WO,1.0,2552811.0,Visiontek Consultancy Services Pvt. Ltd.,INR,"14,950,000",1,2582416,ALL INDIA INSTITUTE OF LOCAL SELF GOVERNMENT,21-Oct-2024 12:10 PM,Rejected-AOC,Rejected,21-May-2025 04:51 PM,Finance,Four bidders participated. BOQ Comparative Chart is enclosed for reference. The Original documents of bidders to be verified.,Sanjukta Sa,15-Jan-2025 04:48 PM,finance_506720.pdf,BOQ Comparative Chart,Deputy Executive Engineer,Internal,Executive Engineer,Sanjukta Sa,21-May-2025 04:48 PM,finsummary_506720.pdf (123.55 KB),Municipal Bodies||Cuttack Municipal Corporation,2024_ORULB_104850_1,MCCMCCTC_Div-III_No11/2024-25,Selection of Consultant for Preparation of Comprehensive Drainage Master Plan for Drainage Decongestion of Cuttack City under Cuttack Municipal Corporation,Technical,Five bidders participated.BOQ Comparative Chart is enclosed for reference. The Original documents of bidders to be verified. One Bid rejected due to non-submission of documents.,Antarjyamee Patra,15-Jan-2025 04:33 PM,technical_506720.pdf,Deputy Executive Engineer,Internal,Executive Engineer,Antarjyamee Patra,15-Jan-2025 04:36 PM,15-Jan-2025 04:40 PM,techsummary_506720.pdf (182.13 KB),AOC
,,,,,,,,,,,,,,2.0,Finance,.xls,Bill of Quantity,,,,,,,,,,,,,,,,2.0,5th Corrigendum Notice,Other,,2.0,ICICI NEFT/RTGS,,,,,,,,,,,,,,,,,,,,,,,,,,AOC,,,,,,,,,,,,,2,2637848,ARKITECHNO Consultants (India) Pvt. Ltd.,11-Nov-2024 04:52 PM,Rejected-AOC,Rejected,21-May-2025 04:51 PM,,,,,,,,,,,,,,,,,,,,,,,,,,,,,AOC
,,,,,,,,,,,,,,,,,,,,,,,,,,,,,,,,,,,,,,,,,,,,,,,,,,,,,,,,,,,,,,,,AOC,,,,,,,,,,,,,3,2634272,S.M. Consultants Pvt. Ltd.,11-Nov-2024 04:22 PM,Rejected-AOC,Rejected,21-May-2025 04:51 PM,,,,,,,,,,,,,,,,,,,,,,,,,,,,,AOC
,,,,,,,,,,,,,,,,,,,,,,,,,,,,,,,,,,,,,,,,,,,,,,,,,,,,,,,,,,,,,,,,AOC,,,,,,,,,,,,,4,2552811,Visiontek Consultancy Services Pvt. Ltd.,11-Nov-2024 04:43 PM,Accepted-AOC,Accepted,21-May-2025 04:51 PM,,,,,,,,,,,,,,,,,,,,,,,,,,,,,AOC
,,,,,,,,,,,,,,,,,,,,,,,,,,,,,,,,,,,,,,,,,,,,,,,,,,,,,,,,,,,,,,,,AOC,,,,,,,,,,,,,5,2571984,WAPCOS LIMITED,11-Nov-2024 12:30 PM,Not Admitted-Fee/PreQual/Technical,Not Complied with technical specification,15-Jan-2025 04:33 PM,,,,,,,,,,,,,,,,,,,,,,,,,,,,,AOC
