Organisation Chain,Tender Reference Number,Tender ID,Withdrawal Allowed,Tender Type,Form of contract,Tender Category,No. of Covers,General Technical Evaluation Allowed,ItemWise Technical Evaluation Allowed,Payment Mode,Is Multi Currency Allowed For BOQ,Is Multi Currency Allowed For Fee,Allow Two Stage Bidding,Cover No,Cover,Document Type,Description,Publish Date,Bid Opening Date,Document Download / Sale Start Date,Document Download / Sale End Date,Clarification Start Date,Clarification End Date,Bid Submission Start Date,Bid Submission End Date,Financial Bid Opening Date,EMD Amount in ₹,EMD Exemption Allowed,EMD Fee Type,EMD Percentage,EMD Payable To,EMD Payable At,S.No,Bank Name,Tender Fee in ₹,VAT Charges in ₹,Fee Payable To,Fee Payable At,Tender Fee Exemption Allowed,Name,Address,Title,Work Description,Pre Qualification Details,Independent External Monitor/Remarks,Tender Value in ₹,Product Category,Sub category,Contract Type,Bid Validity(Days),Period Of Work(Days),Location,Pincode,Pre Bid Meeting Place,Pre Bid Meeting Address,Pre Bid Meeting Date,Bid Opening Place,Should Allow NDA Tender,Allow Preferential Bidder,Tender Stage,Contract Date :,Contract Value :,Work Completion Period in days :,Updated By :,Updated on :,AOC document :,AOC Description :,S.No,Bid Number,Bidder Name,Awarded Currency,Awarded Value,S.No.1,Bid Number.1,Bidder Name.1,Submitted Date,Status,Remarks,Status Updated On,Type :,Summary :,Updated By :.1,Updated On :,Document :,BOQ Comparative Chart :,Committee Chairperson/Co-ordinator Name :,Committee Chairperson/Co-ordinator Type :,Committee Members :,Updated By :.2,Updated on :.1,Document :.1,Organisation Chain :,Tender ID :,Tender Ref No :,Tender Title :,Type :.1,Summary :.1,Updated By :.3,Updated On :.1,Document :.2,Committee Chairperson/Co-ordinator Name :.1,Committee Chairperson/Co-ordinator Type :.1,Committee Members :.1,Updated By :.4,Updated On :.2,Financial Bid Opening Date:,Document :.3,Tender Stage
EIC-CIVIL||SERNB-CIRCLE-KEONJHAR||EERNB-DIVN-KEONJHAR,Bid Identification No PWDK- 03 / 2024-25.,2024_EICCL_103387_2,Yes,Open Tender,Percentage,Works,2.0,No,No,Online,No,No,No,1.0,Fee/PreQual/Technical,.pdf,"Tender paper cost, EMD, PAN, GSTIN, Contractor registration Certificate, Affidavit, etc.",29-Jun-2024 05:00 PM,15-Jul-2024 11:30 AM,29-Jun-2024 05:00 PM,12-Jul-2024 05:00 PM,NA ,NA ,29-Jun-2024 05:00 PM,12-Jul-2024 05:00 PM,12-Aug-2024 11:00 AM,"68,600",Yes,fixed,,Nil,Nil,1.0,ICICI BANK,"10,000",0.0,Nil,Nil,No,"Superintending Engineer, Keonjhar(RandB) Division","O/o the Superintending Engineer, Keonjhar (R and B) Division, Keonjhar 758001","Construction of Boundary Wall with Gate and 2 Nos. Security Shed for proposed ATS site at Ramachandrapur, Keonjhar for the year 2024-25.","Construction of Boundary Wall with Gate and 2 Nos. Security Shed for proposed ATS site at Ramachandrapur, Keonjhar for the year 2024-25.",Please refer Tender documents. ,NA ,"68,56,655",Civil Works - Buildings,NA ,Tender,90.0,180.0,Keonjhar,758001.0,NA ,NA ,NA ,"O/o the SE, Keonjhar (R and B) Division",No ,No,AOC,18-Jul-2025,"INR 5,828,842.79",180.0,Sambit Mohanty,17-May-2025 11:20 AM,22_B_2024_Papu_Mohapatra.pdf (485.00 KB),Winner of lottery.,1.0,2512506.0,Papu Mohapatra,INR,"5,828,842.79",1,2512577,ABHILIPSA PRIYADARSINI JENA,12-Jul-2024 02:19 PM,Rejected-AOC,Loser of lottery.,17-May-2025 11:20 AM,Finance,Bid opening summary,Santosh kumar Behera,12-Aug-2024 01:26 PM,finance_502226.pdf,BOQ Comparative Chart,Er Sambit Mohanty,Internal,"Superintending Engineer, Divisional Accounts Officer No-I, Executive Engineer (Estimator) Keonjhar R and B Division Keonjhar",Sambit Mohanty,17-May-2025 11:14 AM,finsummary_502226.pdf (641.63 KB),EIC-CIVIL||SERNB-CIRCLE-KEONJHAR||EERNB-DIVN-KEONJHAR,2024_EICCL_103387_2,Bid Identification No PWDK- 03 / 2024-25.,"Construction of Boundary Wall with Gate and 2 Nos. Security Shed for proposed ATS site at Ramachandrapur, Keonjhar for the year 2024-25.",Technical,Bid opening summary,Santosh kumar Behera,15-Jul-2024 01:05 PM,technical_502226.pdf,Er Santosh Kumar Behera,Internal,"Additional Chief Engineer, (I/C) Superintending Engineer, Divisional Accounts Officer No-I, Assistant Executive Engineer Keonjhar R and B Division Keonjhar",Santosh kumar Behera,08-Aug-2024 01:02 PM,12-Aug-2024 11:00 AM,techsummary_502226.pdf (308.81 KB),AOC
,,,,,,,,,,,,,,,,.pdf,"Machineries, work in hand, work experience",,,,,,,,,,,,,,,,2.0,ICICI NEFT/RTGS,,,,,,,,,,,,,,,,,,,,,,,,,,AOC,,,,,,,,,,,,,2,2510267,BHUYAN MAHAPRASAD,09-Jul-2024 07:13 PM,Rejected-Finance,As per decision of Tender Evaluation Committee.,17-May-2025 11:14 AM,,,,,,,,,,,,,,,,,,,,,,,,,,,,,AOC
,,,,,,,,,,,,,,,,.pdf,Other documents as per DTCN,,,,,,,,,,,,,,,,,,,,,,,,,,,,,,,,,,,,,,,,,,,AOC,,,,,,,,,,,,,3,2510872,LALATENDU NAYAK,10-Jul-2024 09:51 AM,Rejected-AOC,Loser of lottery.,17-May-2025 11:20 AM,,,,,,,,,,,,,,,,,,,,,,,,,,,,,AOC
,,,,,,,,,,,,,,2.0,Finance,.xls,Bill of Quantity,,,,,,,,,,,,,,,,,,,,,,,,,,,,,,,,,,,,,,,,,,,AOC,,,,,,,,,,,,,4,2512506,Papu Mohapatra,12-Jul-2024 01:45 PM,Accepted-AOC,Winner of lottery.,17-May-2025 11:20 AM,,,,,,,,,,,,,,,,,,,,,,,,,,,,,AOC
,,,,,,,,,,,,,,,,,,,,,,,,,,,,,,,,,,,,,,,,,,,,,,,,,,,,,,,,,,,,AOC,,,,,,,,,,,,,5,2512504,SUSANTA KUMAR BAL,12-Jul-2024 01:37 PM,Rejected-AOC,Loser of lottery.,17-May-2025 11:20 AM,,,,,,,,,,,,,,,,,,,,,,,,,,,,,AOC
