Organisation Chain,Tender Reference Number,Tender ID,Withdrawal Allowed,Tender Type,Form of contract,Tender Category,No. of Covers,General Technical Evaluation Allowed,ItemWise Technical Evaluation Allowed,Payment Mode,Is Multi Currency Allowed For BOQ,Is Multi Currency Allowed For Fee,Allow Two Stage Bidding,Cover No,Cover,Document Type,Description,Publish Date,Bid Opening Date,Document Download / Sale Start Date,Document Download / Sale End Date,Clarification Start Date,Clarification End Date,Bid Submission Start Date,Bid Submission End Date,Financial Bid Opening Date,EMD Amount in ₹,EMD Exemption Allowed,EMD Fee Type,EMD Percentage,EMD Payable To,EMD Payable At,S.No,Corrigendum Title,Corrigendum Type,View,S.No.1,Bank Name,Tender Fee in ₹,VAT Charges in ₹,Fee Payable To,Fee Payable At,Tender Fee Exemption Allowed,Name,Address,Title,Work Description,Pre Qualification Details,Independent External Monitor/Remarks,Tender Value in ₹,Product Category,Sub category,Contract Type,Bid Validity(Days),Period Of Work(Days),Location,Pincode,Pre Bid Meeting Place,Pre Bid Meeting Address,Pre Bid Meeting Date,Bid Opening Place,Should Allow NDA Tender,Allow Preferential Bidder,Tender Stage,Contract Date :,Contract Value :,Work Completion Period in days :,Updated By :,Updated on :,AOC document :,AOC Description :,S.No,Bid Number,Bidder Name,Awarded Currency,Awarded Value,S.No.1,Bid Number.1,Bidder Name.1,Submitted Date,Status,Remarks,Status Updated On,Type :,Summary :,Updated By :.1,Updated On :,Document :,BOQ Comparative Chart :,Committee Chairperson/Co-ordinator Name :,Committee Chairperson/Co-ordinator Type :,Committee Members :,Updated By :.2,Updated on :.1,Document :.1,Organisation Chain :,Tender ID :,Tender Ref No :,Tender Title :,Type :.1,Summary :.1,Updated By :.3,Updated On :.1,Document :.2,Committee Chairperson/Co-ordinator Name :.1,Committee Chairperson/Co-ordinator Type :.1,Committee Members :.1,Updated By :.4,Updated On :.2,Financial Bid Opening Date:,Document :.3,Tender Stage
Odisha State Civil Supplies Corp. Ltd.,No.10335/OSCSC/GUNNY/003/2024 dt.28.08.2024,2024_OSCSC_104534_3,Yes,Open Tender,Item Rate,Services,2.0,No,No,Online,No,No,No,1.0,Fee/PreQual/Technical,.pdf,"Road transportation of new B-Twill gunny bales from different jute mills of AP, WB and Odisha",30-Aug-2024 06:00 PM,20-Sep-2024 11:00 AM,30-Aug-2024 06:00 PM,19-Sep-2024 05:00 PM,NA ,NA ,30-Aug-2024 06:00 PM,19-Sep-2024 05:00 PM,09-Oct-2024 03:30 PM,"7,00,000",No,fixed,,Nil,Nil,1.0,Corrigendum,Technical Bid,,1.0,ICICI BANK,"2,950",0.0,Nil,Nil,No,Managing Director,"OSCSC Ltd. C/2, Nayapalli, Bhubaneswar",Transportation of new B-Twill gunny bales,Selection and engagement of transport contractors for road transportation of new B-twill Gunny bales from different jute mills located in West Bengal to custom millers premises private hired godowns located in Odisha State (Zone-A),Please refer Tender documents. ,NA ,,Handling and Transportation,NA ,Tender,180.0,730.0,OSCSC Ltd. Bhubaneswar,751012.0,"Conference Hall, OSCSC Head Office ","OSCSC Ltd. C/2, Nayapalli, Bhubaneswar ",06-Sep-2024 04:00 PM ,"OSCSC Ltd. C/2, Nayapalli, Bhubaneswar",No ,No,AOC,16-Jan-2025,INR 849,730.0,Somen Nayak,09-May-2025 12:11 PM,AOC.pdf (249.00 KB),Rate quoted Rs.927.00 and negotiated to Rs.849.00,1.0,2552704.0,M/s M J ROAD LINES,INR,849.0,1,2551039,ALL INDIA CARRIERS,19-Sep-2024 03:15 PM,Rejected-Finance,Being the 4th lowest,16-Jan-2025 05:22 PM,Finance,All bidders are admitted for technical evaluation,Somen Nayak,16-Jan-2025 05:01 PM,,BOQ Comparative Chart,Managing Director,Internal,,Somen Nayak,16-Jan-2025 05:22 PM,finsummary_505759.pdf (1085.10 KB),Odisha State Civil Supplies Corp. Ltd.,2024_OSCSC_104534_3,No.10335/OSCSC/GUNNY/003/2024 dt.28.08.2024,Transportation of new B-Twill gunny bales,Technical,All bidders are admitted for Technical Evaluation,Somen Nayak,08-Oct-2024 06:49 PM,,Managing Director,Internal,,Somen Nayak,08-Oct-2024 06:53 PM,09-Oct-2024 03:30 PM,techsummary_505759.pdf (1640.18 KB),AOC
,,,,,,,,,,,,,,2.0,Finance,.xls,Financial Bid,,,,,,,,,,,,,,,,,,,,2.0,ICICI NEFT/RTGS,,,,,,,,,,,,,,,,,,,,,,,,,,AOC,,,,,,,,,,,,,2,2550708,BIBHU KALYAN SAHOO,19-Sep-2024 01:21 PM,Rejected-Finance,Being the 3rd lowest,16-Jan-2025 05:22 PM,,,,,,,,,,,,,,,,,,,,,,,,,,,,,AOC
,,,,,,,,,,,,,,,,,,,,,,,,,,,,,,,,,,,,,,,,,,,,,,,,,,,,,,,,,,,,,,,,AOC,,,,,,,,,,,,,3,2552704,M/s M J ROAD LINES,19-Sep-2024 04:41 PM,Accepted-AOC,Being the lowest bidder,09-May-2025 12:11 PM,,,,,,,,,,,,,,,,,,,,,,,,,,,,,AOC
,,,,,,,,,,,,,,,,,,,,,,,,,,,,,,,,,,,,,,,,,,,,,,,,,,,,,,,,,,,,,,,,AOC,,,,,,,,,,,,,4,2552591,M/S. SAHOO AND SAHOO TRANSPORT,19-Sep-2024 04:20 PM,Rejected-Technical,Technically Disqualified,08-Oct-2024 06:53 PM,,,,,,,,,,,,,,,,,,,,,,,,,,,,,AOC
,,,,,,,,,,,,,,,,,,,,,,,,,,,,,,,,,,,,,,,,,,,,,,,,,,,,,,,,,,,,,,,,AOC,,,,,,,,,,,,,5,2548177,S PRATIVA KUMARI PATRA,19-Sep-2024 04:39 PM,Rejected-Finance,Being the 2nd lowest,16-Jan-2025 05:22 PM,,,,,,,,,,,,,,,,,,,,,,,,,,,,,AOC
