Organisation Chain,Tender Reference Number,Tender ID,Withdrawal Allowed,Tender Type,Form of contract,Tender Category,No. of Covers,General Technical Evaluation Allowed,ItemWise Technical Evaluation Allowed,Payment Mode,Is Multi Currency Allowed For BOQ,Is Multi Currency Allowed For Fee,Allow Two Stage Bidding,Cover No,Cover,Document Type,Description,Publish Date,Bid Opening Date,Document Download / Sale Start Date,Document Download / Sale End Date,Clarification Start Date,Clarification End Date,Bid Submission Start Date,Bid Submission End Date,Financial Bid Opening Date,EMD Amount in ₹,EMD Exemption Allowed,EMD Fee Type,EMD Percentage,EMD Payable To,EMD Payable At,S.No,Bank Name,Tender Fee in ₹,VAT Charges in ₹,Fee Payable To,Fee Payable At,Tender Fee Exemption Allowed,Name,Address,Title,Work Description,Pre Qualification Details,Independent External Monitor/Remarks,Tender Value in ₹,Product Category,Sub category,Contract Type,Bid Validity(Days),Period Of Work(Days),Location,Pincode,Pre Bid Meeting Place,Pre Bid Meeting Address,Pre Bid Meeting Date,Bid Opening Place,Should Allow NDA Tender,Allow Preferential Bidder,Tender Stage,Contract Date :,Contract Value :,Work Completion Period in days :,Updated By :,Updated on :,AOC document :,S.No,Bid Number,Bidder Name,Awarded Currency,Awarded Value,S.No.1,Bid Number.1,Bidder Name.1,Submitted Date,Status,Remarks,Status Updated On,Type :,Summary :,Updated By :.1,Updated On :,Document :,BOQ Comparative Chart :,Committee Chairperson/Co-ordinator Name :,Committee Chairperson/Co-ordinator Type :,Committee Members :,Updated By :.2,Updated on :.1,Document :.1,Organisation Chain :,Tender ID :,Tender Ref No :,Tender Title :,Type :.1,Summary :.1,Updated By :.3,Updated On :.1,Document :.2,Committee Chairperson/Co-ordinator Name :.1,Committee Chairperson/Co-ordinator Type :.1,Committee Members :.1,Updated By :.4,Updated On :.2,Financial Bid Opening Date:,Document :.3,Tender Stage
Odisha Hydro Power Corporation Ltd||Corporate Office Bhubaneswar,OHPC/HQ/TECH/CW/01/2024-25,2024_OHPCL_107554_3,Yes,Open Tender,Percentage,Works,2.0,No,No,Online,No,No,No,1.0,Fee/PreQual/Technical,.pdf,Techno-commercial bid,28-Nov-2024 03:00 PM,18-Dec-2024 12:00 PM,28-Nov-2024 03:00 PM,17-Dec-2024 12:00 PM,28-Nov-2024 03:00 PM ,10-Dec-2024 12:00 PM ,28-Nov-2024 03:00 PM,17-Dec-2024 12:00 PM,04-Feb-2025 12:00 PM,"1,10,800",Yes,fixed,,Nil,Nil,1.0,ICICI BANK,"11,800",0.0,Nil,Nil,No,C and P Head,OHPC CO Bhubaneswar,"Civil, PH, Electrical, Interior Furnishing and Signage works of OHPC Corporate Office building at Bhoinagar, Bhubaneswar","Civil, PH, Electrical, Interior Furnishing and Signage works of OHPC Corporate Office building at Bhoinagar, Bhubaneswar",Please refer Tender documents. ,NA ,,Civil Works - Buildings,NA ,Tender,120.0,180.0,OHPC CO Bhubaneswar,751022.0,NA ,NA ,NA ,OHPC CO Bhubaneswar,No ,No,AOC,16-May-2025,"INR 9,411,739",180.0,Shraban Kumar Behera,16-May-2025 01:09 PM,Order.pdf (4353.00 KB),1.0,2699419.0,RABI NARAYAN BEHERA,INR,"9,411,738.759",1,2699656,BABU BIRAJA PRASAD,17-Dec-2024 10:15 AM,Rejected-AOC,L2,16-May-2025 01:09 PM,Finance,Financial bids of all the bids were opened and accepted,Nilakantha Srichandan,04-Feb-2025 12:37 PM,,BOQ Comparative Chart,C and P Head,Internal,,Shraban Kumar Behera,16-May-2025 12:51 PM,finsummary_518310.pdf (92.46 KB),Odisha Hydro Power Corporation Ltd||Corporate Office Bhubaneswar,2024_OHPCL_107554_3,OHPC/HQ/TECH/CW/01/2024-25,"Civil, PH, Electrical, Interior Furnishing and Signage works of OHPC Corporate Office building at Bhoinagar, Bhubaneswar",Technical,The techno-commercial bids were deliberated by the tender opening committee and a comparative statement was prepared.,Shraban Kumar Behera,29-Jan-2025 05:00 PM,technical_518310.pdf,B N MALLICK,Internal,S K DAS N SRICHANDAN G B MAHARANA,Shraban Kumar Behera,29-Jan-2025 05:10 PM,04-Feb-2025 12:00 PM,techsummary_518310.pdf (99.85 KB),AOC
,,,,,,,,,,,,,,2.0,Finance,.xls,financial,,,,,,,,,,,,,,,,2.0,ICICI NEFT/RTGS,,,,,,,,,,,,,,,,,,,,,,,,,,AOC,,,,,,,,,,,,2,2694808,M/S M S INTERIOR,16-Dec-2024 05:12 PM,Rejected-AOC,L4,16-May-2025 01:09 PM,,,,,,,,,,,,,,,,,,,,,,,,,,,,,AOC
,,,,,,,,,,,,,,,,,,,,,,,,,,,,,,,,,,,,,,,,,,,,,,,,,,,,,,,,,,,,AOC,,,,,,,,,,,,3,2694843,PRASANT KUMAR MOHAPATRA,16-Dec-2024 12:46 PM,Rejected-AOC,L2,16-May-2025 01:09 PM,,,,,,,,,,,,,,,,,,,,,,,,,,,,,AOC
,,,,,,,,,,,,,,,,,,,,,,,,,,,,,,,,,,,,,,,,,,,,,,,,,,,,,,,,,,,,AOC,,,,,,,,,,,,4,2699419,RABI NARAYAN BEHERA,16-Dec-2024 07:32 PM,Accepted-AOC,L1 Winner in transparent Lottery,16-May-2025 01:09 PM,,,,,,,,,,,,,,,,,,,,,,,,,,,,,AOC
,,,,,,,,,,,,,,,,,,,,,,,,,,,,,,,,,,,,,,,,,,,,,,,,,,,,,,,,,,,,AOC,,,,,,,,,,,,5,2700122,SWADHIN JENA,17-Dec-2024 11:29 AM,Rejected-AOC,L5,16-May-2025 01:09 PM,,,,,,,,,,,,,,,,,,,,,,,,,,,,,AOC
