Organisation Chain,Tender Reference Number,Tender ID,Withdrawal Allowed,Tender Type,Form of contract,Tender Category,No. of Covers,General Technical Evaluation Allowed,ItemWise Technical Evaluation Allowed,Payment Mode,Is Multi Currency Allowed For BOQ,Is Multi Currency Allowed For Fee,Allow Two Stage Bidding,Cover No,Cover,Document Type,Description,Publish Date,Bid Opening Date,Document Download / Sale Start Date,Document Download / Sale End Date,Clarification Start Date,Clarification End Date,Bid Submission Start Date,Bid Submission End Date,Financial Bid Opening Date,EMD Amount in ₹,EMD Exemption Allowed,EMD Fee Type,EMD Percentage,EMD Payable To,EMD Payable At,S.No,Bank Name,Tender Fee in ₹,VAT Charges in ₹,Fee Payable To,Fee Payable At,Tender Fee Exemption Allowed,Name,Address,Title,Work Description,Pre Qualification Details,Independent External Monitor/Remarks,Tender Value in ₹,Product Category,Sub category,Contract Type,Bid Validity(Days),Period Of Work(Days),Location,Pincode,Pre Bid Meeting Place,Pre Bid Meeting Address,Pre Bid Meeting Date,Bid Opening Place,Should Allow NDA Tender,Allow Preferential Bidder,Tender Stage,Contract Date :,Contract Value :,Work Completion Period in days :,Updated By :,Updated on :,AOC document :,S.No,Bid Number,Bidder Name,Awarded Currency,Awarded Value,S.No.1,Bid Number.1,Bidder Name.1,Submitted Date,Status,Remarks,Status Updated On,Type :,Summary :,Updated By :.1,Updated On :,Document :,BOQ Comparative Chart :,Committee Chairperson/Co-ordinator Name :,Committee Chairperson/Co-ordinator Type :,Committee Members :,Updated By :.2,Updated on :.1,Document :.1,Organisation Chain :,Tender ID :,Tender Ref No :,Tender Title :,Type :.1,Summary :.1,Updated By :.3,Updated On :.1,Document :.2,Committee Chairperson/Co-ordinator Name :.1,Committee Chairperson/Co-ordinator Type :.1,Committee Members :.1,Updated By :.4,Updated On :.2,Financial Bid Opening Date:,Document :.3,Tender Stage
EIC-CIVIL||SERNB-CIRCLE-NORTHERN,CCENC(RANDB) /09/ 2024-25,2024_EICCL_107358_2,Yes,National Competitive Bid,Percentage,Works,2.0,No,No,Online,No,No,No,1.0,Fee/PreQual/Technical,.pdf,"Online Proof Copy of Tender Cost, Bid Security, GSTIN, PAN, R.C and Affidavit",22-Nov-2024 10:00 AM,06-Dec-2024 11:00 AM,22-Nov-2024 10:00 AM,05-Dec-2024 05:00 PM,22-Nov-2024 10:00 AM ,27-Nov-2024 05:00 PM ,22-Nov-2024 10:00 AM,05-Dec-2024 05:00 PM,24-Jan-2025 11:00 AM,"5,90,500",Yes,fixed,,Nil,Nil,1.0,ICICI BANK,"10,000",0.0,Nil,Nil,No,"C.C.E, Northern R AND B Circle, SAMBALPUR","O/O THE C.C.E, Northern R AND B Circle, SAMBALPUR",Improvement such as widening and strengthening of road from NH-53 to Kailash- Goilo-Laimura road from from 0-00 km to 3-00 km (SL to DL) in the district of Deogarh for the year 2024-25.,ROAD WORK,Please refer Tender documents. ,NA ,"5,90,46,228",Civil Works - Roads,NA ,Tender,90.0,180.0,DEOGARH,768108.0,NA ,NA ,NA ,"O/O THE C.C.E, Northern R AND B Circle, SAMBALPUR",No ,No,AOC,24-May-2025,"INR 50,195,199",180.0,Rama Chandra Sethi,24-May-2025 11:22 AM,AGTGOILI.pdf (1670.00 KB),1.0,2675337.0,tapan kumar sahu,INR,"50,195,199",1,2683541,BISWAKARMAA SUBHANSU CHANDRASEKHAR,05-Dec-2024 03:21 PM,Rejected-Finance,UNSUCCESSFUL THROUGH TRANSPARENT LOTTERY SYSTEM,24-May-2025 11:18 AM,Finance,FINANCIAL BID OPENED,Anam Charan Sahoo,24-Jan-2025 07:01 PM,,BOQ Comparative Chart,CCE NC,Internal,,Rama Chandra Sethi,24-May-2025 11:18 AM,finsummary_517268.pdf (1997.65 KB),EIC-CIVIL||SERNB-CIRCLE-NORTHERN,2024_EICCL_107358_2,CCENC(RANDB) /09/ 2024-25,Improvement such as widening and strengthening of road from NH-53 to Kailash- Goilo-Laimura road from from 0-00 km to 3-00 km (SL to DL) in the district of Deogarh for the year 2024-25.,Technical,TECHNICAL BID OPENED,Rama Chandra Sethi,07-Dec-2024 08:34 PM,,"CCE,NORTHERN R AND B CIRCLE,SAMBALPUR",Internal,,Hemant Naik,21-Jan-2025 06:58 PM,24-Jan-2025 11:00 AM,techsummary_517268.pdf (506.35 KB),AOC
,,,,,,,,,,,,,,,,.pdf,"Ownership of machineries, work experience and MOU for composite Building work etc.",,,,,,,,,,,,,,,,2.0,ICICI NEFT/RTGS,,,,,,,,,,,,,,,,,,,,,,,,,,AOC,,,,,,,,,,,,2,2683586,BISWARANJAN SATAPATHY,05-Dec-2024 03:00 PM,Rejected-Finance,UNSUCCESSFUL BIDDER,24-May-2025 11:18 AM,,,,,,,,,,,,,,,,,,,,,,,,,,,,,AOC
,,,,,,,,,,,,,,,,.pdf,Work experience certificate and other related documents as per DTCN,,,,,,,,,,,,,,,,,,,,,,,,,,,,,,,,,,,,,,,,,,,AOC,,,,,,,,,,,,3,2683280,DHANESWAR SAHU,05-Dec-2024 04:18 PM,Rejected-Finance,UNSUCCESSFUL BIDDER,24-May-2025 11:18 AM,,,,,,,,,,,,,,,,,,,,,,,,,,,,,AOC
,,,,,,,,,,,,,,2.0,Finance,.xls,BILL OF QUANTITY (BOQ),,,,,,,,,,,,,,,,,,,,,,,,,,,,,,,,,,,,,,,,,,,AOC,,,,,,,,,,,,4,2675728,JYOTI MEHER,05-Dec-2024 11:32 AM,Rejected-Finance,UNSUCCESSFUL BIDDER,24-May-2025 11:18 AM,,,,,,,,,,,,,,,,,,,,,,,,,,,,,AOC
,,,,,,,,,,,,,,,,,,,,,,,,,,,,,,,,,,,,,,,,,,,,,,,,,,,,,,,,,,,,AOC,,,,,,,,,,,,5,2682594,MUKESH KUMAR,05-Dec-2024 03:04 PM,Rejected-Finance,UNSUCCESSFUL THROUGH TRANSPARENT LOTTERY SYSTEM,24-May-2025 11:18 AM,,,,,,,,,,,,,,,,,,,,,,,,,,,,,AOC
,,,,,,,,,,,,,,,,,,,,,,,,,,,,,,,,,,,,,,,,,,,,,,,,,,,,,,,,,,,,AOC,,,,,,,,,,,,6,2683087,SYED AHESANULLAH,05-Dec-2024 04:02 PM,Rejected-Technical,As per the decision of Tender Evaluation Committee,21-Jan-2025 06:58 PM,,,,,,,,,,,,,,,,,,,,,,,,,,,,,AOC
,,,,,,,,,,,,,,,,,,,,,,,,,,,,,,,,,,,,,,,,,,,,,,,,,,,,,,,,,,,,AOC,,,,,,,,,,,,7,2675337,tapan kumar sahu,05-Dec-2024 11:00 AM,Accepted-AOC,AGT DRAWN,24-May-2025 11:22 AM,,,,,,,,,,,,,,,,,,,,,,,,,,,,,AOC
