Organisation Chain,Tender Reference Number,Tender ID,Withdrawal Allowed,Tender Type,Form of contract,Tender Category,No. of Covers,General Technical Evaluation Allowed,ItemWise Technical Evaluation Allowed,Payment Mode,Is Multi Currency Allowed For BOQ,Is Multi Currency Allowed For Fee,Allow Two Stage Bidding,Cover No,Cover,Document Type,Description,Publish Date,Bid Opening Date,Document Download / Sale Start Date,Document Download / Sale End Date,Clarification Start Date,Clarification End Date,Bid Submission Start Date,Bid Submission End Date,EMD Amount in ₹,EMD Exemption Allowed,EMD Fee Type,EMD Percentage,EMD Payable To,EMD Payable At,S.No,Bank Name,Tender Fee in ₹,VAT Charges in ₹,Fee Payable To,Fee Payable At,Tender Fee Exemption Allowed,Name,Address,Title,Work Description,Pre Qualification Details,Independent External Monitor/Remarks,Tender Value in ₹,Product Category,Sub category,Contract Type,Bid Validity(Days),Period Of Work(Days),Location,Pincode,Pre Bid Meeting Place,Pre Bid Meeting Address,Pre Bid Meeting Date,Bid Opening Place,Should Allow NDA Tender,Allow Preferential Bidder,Tender Stage,Contract Date :,Contract Value :,Work Completion Period in days :,Updated By :,Updated on :,AOC document :,AOC Description :,S.No,Bid Number,Bidder Name,Awarded Currency,Awarded Value,S.No.1,Bid Number.1,Bidder Name.1,Submitted Date,Status,Remarks,Status Updated On,Type :,Summary :,Updated By :.1,Updated On :,Document :,BOQ Comparative Chart :,Committee Chairperson/Co-ordinator Name :,Committee Chairperson/Co-ordinator Type :,Committee Members :,Updated By :.2,Updated on :.1,Document :.1,Organisation Chain :,Tender ID :,Tender Ref No :,Tender Title :,Committee Chairperson/Co-ordinator Name :.1,Committee Chairperson/Co-ordinator Type :.1,Committee Members :.1,Updated By :.3,Updated On :.1,Document :.2,Tender Stage
EIC-CIVIL||SERNB-CIRCLE-KEONJHAR||EERNB-DIVN-ROURKELA,Bid id 109 of 2024-25,2025_EICCL_111325_1,Yes,Open Tender,Percentage,Works,1.0,No,No,Online,No,No,No,1.0,Fee/PreQual/Technical/Finance,.pdf,"Registration certificate, Registration in CDMS, PAN Card, GSTIN Certificate, Affidavit etc",04-Mar-2025 02:00 PM,13-Mar-2025 11:00 AM,04-Mar-2025 02:00 PM,12-Mar-2025 05:00 PM,NA ,NA ,04-Mar-2025 02:00 PM,12-Mar-2025 05:00 PM,"41,700",Yes,fixed,,Nil,Nil,1.0,ICICI BANK,"6,000",0.0,Nil,Nil,No,Superintending Engineer Rourkela R and B Division,Office of Superintending Engineer Rourkela R and B division,"Renovation of vedvyas house with Civil,EI and PH works of ground floor B wing for functioning of Therapeutic Service Centre Rourkela at vedvyas in the district of sundargarh for the year 2024-25","Renovation of vedvyas house with Civil,EI and PH works of ground floor B wing for functioning of Therapeutic Service Centre Rourkela at vedvyas in the district of sundargarh for the year 2024-25",Please refer the tender document ,NA ,"40,87,800",Civil Works - Buildings,NA ,Tender,90.0,30.0,Rourkela,769012.0,NA ,NA ,NA ,Office of Superintending Engineer Rourkela R and B,No ,No,AOC,08-May-2025,"INR 3,474,998",30.0,Prajna Prajwolita Parida,08-May-2025 11:46 AM,Vedvyasworkorderrout.pdf (1408.00 KB),Agmt drawn and Work order issued,1.0,2851315.0,DEEPAK KUMAR ROUT,INR,"3,474,998",1,2851315,DEEPAK KUMAR ROUT,11-Mar-2025 10:32 PM,Accepted-AOC,Qualified in the Lottery,08-May-2025 11:47 AM,Finance,8 no of bidder has been participated,Prajna Prajwolita Parida,08-May-2025 11:14 AM,finance_532201.pdf,BOQ Comparative Chart,Alok Naik SE rourkela r and b dvision,Internal,HS Meena SrDAO Rourkela R and B Division P p parida estimator Rourkela R and B Division,Prajna Prajwolita Parida,08-May-2025 11:27 AM,finsummary_532201.pdf (1407.61 KB),EIC-CIVIL||SERNB-CIRCLE-KEONJHAR||EERNB-DIVN-ROURKELA,2025_EICCL_111325_1,Bid id 109 of 2024-25,"Renovation of vedvyas house with Civil,EI and PH works of ground floor B wing for functioning of Therapeutic Service Centre Rourkela at vedvyas in the district of sundargarh for the year 2024-25",Alok Naik SE rourkela r and b dvision,Internal,HS Meena SrDAO Rourkela R and B Division P p parida estimator Rourkela R and B Division,Prajna Prajwolita Parida,08-May-2025 11:21 AM,techsummary_532201.pdf (1407.61 KB),AOC
,,,,,,,,,,,,,,,,.pdf,"Financial instruments such as cost of tender paper, EMD, Affidavit etc",,,,,,,,,,,,,,,2.0,ICICI NEFT/RTGS,,,,,,,,,,,,,,,,,,,,,,,,,,AOC,,,,,,,,,,,,,2,2851922,KALANDI CHARAN SWAIN,12-Mar-2025 01:11 PM,Rejected-AOC,Not Qualified in the Lottery,08-May-2025 11:47 AM,,,,,,,,,,,,,,,,,,,,,,,AOC
,,,,,,,,,,,,,,,,.pdf,"Experience Certificate, List of Machinaries,Lease Deeds , MOU with electrical contractor Affidavit e",,,,,,,,,,,,,,,,,,,,,,,,,,,,,,,,,,,,,,,,,,AOC,,,,,,,,,,,,,3,2849553,M/S M S INTERIOR,10-Mar-2025 05:55 PM,Rejected-AOC,Not Qualified in the Lottery,08-May-2025 11:47 AM,,,,,,,,,,,,,,,,,,,,,,,AOC
,,,,,,,,,,,,,,,,.pdf,"No Relation Certificate, Schedule-E, Schedule-F, Affidavit etc",,,,,,,,,,,,,,,,,,,,,,,,,,,,,,,,,,,,,,,,,,AOC,,,,,,,,,,,,,4,2852273,PRATIK BHUYAN,12-Mar-2025 03:36 PM,Rejected-AOC,Not Qualified in the Lottery,08-May-2025 11:47 AM,,,,,,,,,,,,,,,,,,,,,,,AOC
,,,,,,,,,,,,,,,,.xls,BOQ,,,,,,,,,,,,,,,,,,,,,,,,,,,,,,,,,,,,,,,,,,AOC,,,,,,,,,,,,,5,2850343,PRITI RANJAN SAMAL,12-Mar-2025 01:34 PM,Rejected-AOC,Not Qualified in the Lottery,08-May-2025 11:47 AM,,,,,,,,,,,,,,,,,,,,,,,AOC
,,,,,,,,,,,,,,,,,,,,,,,,,,,,,,,,,,,,,,,,,,,,,,,,,,,,,,,,,,,AOC,,,,,,,,,,,,,6,2852345,RASHMI ROY,12-Mar-2025 04:27 PM,Rejected-AOC,Not Qualified in the Lottery,08-May-2025 11:47 AM,,,,,,,,,,,,,,,,,,,,,,,AOC
,,,,,,,,,,,,,,,,,,,,,,,,,,,,,,,,,,,,,,,,,,,,,,,,,,,,,,,,,,,AOC,,,,,,,,,,,,,7,2850587,SASMITA SAMAL,12-Mar-2025 03:02 PM,Rejected-Technical,by Committee,08-May-2025 11:21 AM,,,,,,,,,,,,,,,,,,,,,,,AOC
,,,,,,,,,,,,,,,,,,,,,,,,,,,,,,,,,,,,,,,,,,,,,,,,,,,,,,,,,,,AOC,,,,,,,,,,,,,8,2851921,SWASTIK CONSTRUCTION,12-Mar-2025 01:26 PM,Rejected-AOC,Not Qualified in the Lottery,08-May-2025 11:47 AM,,,,,,,,,,,,,,,,,,,,,,,AOC
