Organisation Chain,Tender Reference Number,Tender ID,Withdrawal Allowed,Tender Type,Form of contract,Tender Category,No. of Covers,General Technical Evaluation Allowed,ItemWise Technical Evaluation Allowed,Payment Mode,Is Multi Currency Allowed For BOQ,Is Multi Currency Allowed For Fee,Allow Two Stage Bidding,Cover No,Cover,Document Type,Description,Publish Date,Bid Opening Date,Document Download / Sale Start Date,Document Download / Sale End Date,Clarification Start Date,Clarification End Date,Bid Submission Start Date,Bid Submission End Date,Financial Bid Opening Date,EMD Amount in ₹,EMD Exemption Allowed,EMD Fee Type,EMD Percentage,EMD Payable To,EMD Payable At,S.No,Corrigendum Title,Corrigendum Type,View,S.No.1,Bank Name,Tender Fee in ₹,VAT Charges in ₹,Fee Payable To,Fee Payable At,Tender Fee Exemption Allowed,Name,Address,Title,Work Description,Pre Qualification Details,Independent External Monitor/Remarks,Tender Value in ₹,Product Category,Sub category,Contract Type,Bid Validity(Days),Period Of Work(Days),Location,Pincode,Pre Bid Meeting Place,Pre Bid Meeting Address,Pre Bid Meeting Date,Bid Opening Place,Should Allow NDA Tender,Allow Preferential Bidder,Tender Stage,Contract Date :,Contract Value :,Work Completion Period in days :,Updated By :,Updated on :,AOC document :,AOC Description :,S.No,Bid Number,Bidder Name,Awarded Currency,Awarded Value,S.No.1,Bid Number.1,Bidder Name.1,Submitted Date,Status,Remarks,Status Updated On,Type :,Summary :,Updated By :.1,Updated On :,Document :,BOQ Comparative Chart :,Committee Chairperson/Co-ordinator Name :,Committee Chairperson/Co-ordinator Type :,Committee Members :,Updated By :.2,Updated on :.1,Document :.1,Organisation Chain :,Tender ID :,Tender Ref No :,Tender Title :,Type :.1,Summary :.1,Updated By :.3,Updated On :.1,Document :.2,Committee Chairperson/Co-ordinator Name :.1,Committee Chairperson/Co-ordinator Type :.1,Committee Members :.1,Updated By :.4,Updated On :.2,Financial Bid Opening Date:,Document :.3,Tender Stage
PHEO||PH Circle Bhawanipatna||PH Division Balangir,SEPHBGR 25/2024-25,2024_PHEO_107490_1,Yes,National Competitive Bid,Percentage,Works,2.0,No,No,Online,No,No,No,1.0,Fee/PreQual/Technical,.pdf,"Tender paper cost, EMD, PAN, GSTIN, Contractor registration certificate, Experience Certificate, etc",25-Nov-2024 01:10 PM,10-Dec-2024 11:00 AM,25-Nov-2024 01:10 PM,09-Dec-2024 05:00 PM,25-Nov-2024 01:10 PM ,04-Dec-2024 05:00 PM ,25-Nov-2024 01:10 PM,09-Dec-2024 05:00 PM,07-Apr-2025 11:30 AM,"4,23,406",Yes,percentage,1.0%,Nil,Nil,1.0,Date Change,Date,,1.0,ICICI BANK,"10,000",0.0,Nil,Nil,No,Laying of DI pipe from Dedgaon to Bangomunda in Co,Laying of DI pipe from Dedgaon to Bangomunda in Connection to the work Augmentation of water supply system along with Ancillary work for Kantabanji Town,Laying of DI pipe from Dedgaon to Bangomunda in Connection to the work Augmentation of water supply system along with Ancillary work for Kantabanji Town,Laying of DI pipe from Dedgaon to Bangomunda in Connection to the work Augmentation of water supply system along with Ancillary work for Kantabanji Town,Please refer DTCN ,NA ,"4,23,40,557",Civil Works - Water Works,NA ,Tender,120.0,180.0,Kantabanji NAC,767036.0,NA ,NA ,NA ,"Superintending Engineer, P.H. Division, Balangir",No ,No,AOC,27-May-2025,"INR 42,340,557.43",180.0,Indrajit Sahu,27-May-2025 10:02 AM,WO.pdf (853.00 KB),L1 bidder has respond,1.0,2688885.0,MITTAL INFRAPROJECTS,INR,"45,088,460",1,2682276,GADADHAR NAYAK,07-Dec-2024 02:33 PM,Rejected-Technical,Disqualified due to expaired solvency,27-Mar-2025 05:04 PM,Finance,Financial Bid Opened,Indrajit Sahu,07-Apr-2025 07:12 PM,finance_517668.pdf,BOQ Comparative Chart,Superitendng Engineer,Internal,"Superintending Engineer, Divisional Accounts Officer, EE Estimator",Indrajit Sahu,27-May-2025 09:59 AM,finsummary_517668.pdf (853.08 KB),PHEO||PH Circle Bhawanipatna||PH Division Balangir,2024_PHEO_107490_1,SEPHBGR 25/2024-25,Laying of DI pipe from Dedgaon to Bangomunda in Connection to the work Augmentation of water supply system along with Ancillary work for Kantabanji Town,Technical,Opening summary,Indrajit Sahu,10-Dec-2024 11:38 AM,technical_517668.pdf,Superitendng Engineer,Internal,"Superintending Engineer, Divisional Accounts officer, EE Estimator",Indrajit Sahu,27-Mar-2025 05:04 PM,07-Apr-2025 11:30 AM,techsummary_517668.pdf (626.32 KB),AOC
,,,,,,,,,,,,,,,,.pdf,Other documents as per DTCN,,,,,,,,,,,,,,,,2.0,Name and Address of Tender inviting Authority,Other,,2.0,ICICI NEFT/RTGS,,,,,,,,,,,,,,,,,,,,,,,,,,AOC,,,,,,,,,,,,,2,2690442,GIRIDHARI LAL AGRAWAL,09-Dec-2024 04:39 PM,Rejected-Finance,OK,27-May-2025 09:59 AM,,,,,,,,,,,,,,,,,,,,,,,,,,,,,AOC
,,,,,,,,,,,,,,2.0,Finance,.xls,BOQ,,,,,,,,,,,,,,,,,,,,,,,,,,,,,,,,,,,,,,,,,,,,,,,AOC,,,,,,,,,,,,,3,2688885,MITTAL INFRAPROJECTS,08-Dec-2024 08:33 PM,Accepted-AOC,Awarded as per OPWD code,27-May-2025 10:02 AM,,,,,,,,,,,,,,,,,,,,,,,,,,,,,AOC
,,,,,,,,,,,,,,,,,,,,,,,,,,,,,,,,,,,,,,,,,,,,,,,,,,,,,,,,,,,,,,,,AOC,,,,,,,,,,,,,4,2689896,NABIN KUMAR AGRAWAL,09-Dec-2024 01:14 PM,Rejected-Technical,Disqualified due to work experience does not match as per DTCN,27-Mar-2025 05:04 PM,,,,,,,,,,,,,,,,,,,,,,,,,,,,,AOC
,,,,,,,,,,,,,,,,,,,,,,,,,,,,,,,,,,,,,,,,,,,,,,,,,,,,,,,,,,,,,,,,AOC,,,,,,,,,,,,,5,2687050,Sanjaya Kumar Agrawal,09-Dec-2024 02:38 PM,Rejected-Technical,Disqualified,27-Mar-2025 05:04 PM,,,,,,,,,,,,,,,,,,,,,,,,,,,,,AOC
