Organisation Chain,Tender Reference Number,Tender ID,Withdrawal Allowed,Tender Type,Form of contract,Tender Category,No. of Covers,General Technical Evaluation Allowed,ItemWise Technical Evaluation Allowed,Payment Mode,Is Multi Currency Allowed For BOQ,Is Multi Currency Allowed For Fee,Allow Two Stage Bidding,Cover No,Cover,Document Type,Description,Publish Date,Bid Opening Date,Document Download / Sale Start Date,Document Download / Sale End Date,Clarification Start Date,Clarification End Date,Bid Submission Start Date,Bid Submission End Date,Financial Bid Opening Date,EMD Amount in ₹,EMD Exemption Allowed,EMD Fee Type,EMD Percentage,EMD Payable To,EMD Payable At,S.No,Bank Name,Tender Fee in ₹,VAT Charges in ₹,Fee Payable To,Fee Payable At,Tender Fee Exemption Allowed,Name,Address,Title,Work Description,Pre Qualification Details,Independent External Monitor/Remarks,Tender Value in ₹,Product Category,Sub category,Contract Type,Bid Validity(Days),Period Of Work(Days),Location,Pincode,Pre Bid Meeting Place,Pre Bid Meeting Address,Pre Bid Meeting Date,Bid Opening Place,Should Allow NDA Tender,Allow Preferential Bidder,Tender Stage,Contract Date :,Contract Value :,Work Completion Period in days :,Updated By :,Updated on :,AOC document :,AOC Description :,S.No,Bid Number,Bidder Name,Awarded Currency,Awarded Value,S.No.1,Bid Number.1,Bidder Name.1,Submitted Date,Status,Remarks,Status Updated On,Type :,Summary :,Updated By :.1,Updated On :,Document :,BOQ Comparative Chart :,Committee Chairperson/Co-ordinator Name :,Committee Chairperson/Co-ordinator Type :,Committee Members :,Updated By :.2,Updated on :.1,Document :.1,Organisation Chain :,Tender ID :,Tender Ref No :,Tender Title :,Type :.1,Summary :.1,Updated By :.3,Updated On :.1,Document :.2,Committee Chairperson/Co-ordinator Name :.1,Committee Chairperson/Co-ordinator Type :.1,Committee Members :.1,Updated By :.4,Updated On :.2,Financial Bid Opening Date:,Document :.3,Tender Stage
EIC-CIVIL||SERNB-CIRCLE-RAYAGADA||EERNB-DIVN-RAYAGADA NEW,RC R and B RGD No-II- 04/24-25,2024_EICCL_105614_2,Yes,National Competitive Bid,Percentage,Works,2.0,No,No,Online,No,No,No,1.0,Fee/PreQual/Technical,.pdf,"Cost of tender paper, EMD,PAN,GSTIN,GSTRC,Labour license, Regd Certificate, Affidavit",09-Oct-2024 11:00 AM,25-Oct-2024 11:00 AM,09-Oct-2024 11:00 AM,24-Oct-2024 05:00 PM,09-Oct-2024 11:00 AM ,17-Oct-2024 05:00 PM ,09-Oct-2024 11:00 AM,24-Oct-2024 05:00 PM,09-Dec-2024 11:00 AM,"76,900",Yes,fixed,,Nil,Nil,1.0,ICICI BANK,"10,000",0.0,Nil,Nil,No,Executive Engineer,"EE R and B Division No-II Rayagada,PIN 765017",S/R to K-M-T road from 44/500 to 49/500 Km such as repair of potholes by providing SDBC in patches,Road work,Please refer Tender documents. ,NA ,"76,86,863",Civil Works - Roads,NA ,Tender,90.0,60.0,Rayagada,765017.0,NA ,NA ,NA ,EE R and B Division No-II,No ,No,AOC,15-May-2025,"INR 6,534,602",60.0,Durga Madhaba Padhi,15-May-2025 12:15 PM,WO_KMT.pdf (377.00 KB),work is already awarded to Sri P. Mutti Raju vide Work order letter no.53 Dt. 06.01.2025 of Rayagada R and B Division No-II Rayagada,1.0,2574845.0,P MUTTI RAJU,INR,"6,534,602",1,2592688,NILAMBAR BIVAR,24-Oct-2024 04:26 PM,Rejected-AOC,First lowest,15-May-2025 12:15 PM,Finance,Financial Bid Downloaded,Durga Madhaba Padhi,15-May-2025 11:55 AM,finance_509408.pdf,BOQ Comparative Chart,SE No-II Rayagada,Internal,SE DAO Estimator,Durga Madhaba Padhi,15-May-2025 12:09 PM,finsummary_509408.pdf (180.64 KB),EIC-CIVIL||SERNB-CIRCLE-RAYAGADA||EERNB-DIVN-RAYAGADA NEW,2024_EICCL_105614_2,RC R and B RGD No-II- 04/24-25,S/R to K-M-T road from 44/500 to 49/500 Km such as repair of potholes by providing SDBC in patches,Technical,Technical Bid opened,Durga Madhaba Padhi,07-Dec-2024 04:49 PM,technical_509408.pdf,SE No-II Rayagada,Internal,EE DAO Estimator,Durga Madhaba Padhi,07-Dec-2024 05:32 PM,09-Dec-2024 11:00 AM,techsummary_509408.pdf (636.33 KB),AOC
,,,,,,,,,,,,,,2.0,Finance,.xls,Bill of Quantity,,,,,,,,,,,,,,,,2.0,ICICI NEFT/RTGS,,,,,,,,,,,,,,,,,,,,,,,,,,AOC,,,,,,,,,,,,,2,2574845,P MUTTI RAJU,13-Oct-2024 06:59 PM,Accepted-AOC,First lowest and selected through transparent lottery system,15-May-2025 12:15 PM,,,,,,,,,,,,,,,,,,,,,,,,,,,,,AOC
,,,,,,,,,,,,,,,,,,,,,,,,,,,,,,,,,,,,,,,,,,,,,,,,,,,,,,,,,,,,AOC,,,,,,,,,,,,,3,2592427,SIBANARAYANA SAHU,24-Oct-2024 02:15 PM,Rejected-AOC,First lowest,15-May-2025 12:15 PM,,,,,,,,,,,,,,,,,,,,,,,,,,,,,AOC
,,,,,,,,,,,,,,,,,,,,,,,,,,,,,,,,,,,,,,,,,,,,,,,,,,,,,,,,,,,,AOC,,,,,,,,,,,,,4,2592261,SRI BAIKUNTHA NAIK,24-Oct-2024 02:08 PM,Rejected-Technical,Disqualified as per proceeding of the Technical Evaluation Committee,07-Dec-2024 05:32 PM,,,,,,,,,,,,,,,,,,,,,,,,,,,,,AOC
,,,,,,,,,,,,,,,,,,,,,,,,,,,,,,,,,,,,,,,,,,,,,,,,,,,,,,,,,,,,AOC,,,,,,,,,,,,,5,2592343,TANGUDU KALYAN KUMAR,24-Oct-2024 01:49 PM,Rejected-AOC,Second lowest,15-May-2025 12:15 PM,,,,,,,,,,,,,,,,,,,,,,,,,,,,,AOC
