Organisation Chain,Tender Reference Number,Tender ID,Withdrawal Allowed,Tender Type,Form of contract,Tender Category,No. of Covers,General Technical Evaluation Allowed,ItemWise Technical Evaluation Allowed,Payment Mode,Is Multi Currency Allowed For BOQ,Is Multi Currency Allowed For Fee,Allow Two Stage Bidding,Cover No,Cover,Document Type,Description,Publish Date,Bid Opening Date,Document Download / Sale Start Date,Document Download / Sale End Date,Clarification Start Date,Clarification End Date,Bid Submission Start Date,Bid Submission End Date,EMD Amount in ₹,EMD Exemption Allowed,EMD Fee Type,EMD Percentage,EMD Payable To,EMD Payable At,S.No,Bank Name,Tender Fee in ₹,VAT Charges in ₹,Fee Payable To,Fee Payable At,Tender Fee Exemption Allowed,Name,Address,Title,Work Description,Pre Qualification Details,Independent External Monitor/Remarks,Tender Value in ₹,Product Category,Sub category,Contract Type,Bid Validity(Days),Period Of Work(Days),Location,Pincode,Pre Bid Meeting Place,Pre Bid Meeting Address,Pre Bid Meeting Date,Bid Opening Place,Should Allow NDA Tender,Allow Preferential Bidder,Tender Stage,Contract Date :,Contract Value :,Work Completion Period in days :,Updated By :,Updated on :,AOC document :,AOC Description :,S.No,Bid Number,Bidder Name,Awarded Currency,Awarded Value,S.No.1,Bid Number.1,Bidder Name.1,Submitted Date,Status,Remarks,Status Updated On,Type :,Summary :,Updated By :.1,Updated On :,Document :,BOQ Comparative Chart :,Committee Chairperson/Co-ordinator Name :,Committee Chairperson/Co-ordinator Type :,Committee Members :,Updated By :.2,Updated on :.1,Document :.1,Organisation Chain :,Tender ID :,Tender Ref No :,Tender Title :,Committee Chairperson/Co-ordinator Name :.1,Committee Chairperson/Co-ordinator Type :.1,Committee Members :.1,Updated By :.3,Updated On :.1,Document :.2,Tender Stage
EIC-CIVIL||SERNB-CIRCLE-KHURDA||EERNB-DIVN-PURI,TCN No 43 of 2024-25,2025_EICCL_109524_1,Yes,National Competitive Bid,Percentage,Works,1.0,No,No,Online,No,No,No,1.0,Fee/PreQual/Technical/Finance,.pdf,"RC,PAN,GST,EMD,COST OF TENDER PAPER,AFFIDAVIT,ALL OTHER DOCUMENTS AS PER APPROVED DTCN",18-Jan-2025 10:00 AM,24-Jan-2025 04:00 PM,18-Jan-2025 10:00 AM,24-Jan-2025 03:00 PM,NA ,NA ,18-Jan-2025 10:00 AM,24-Jan-2025 03:00 PM,"10,247",Yes,percentage,1.0%,Nil,Nil,1.0,ICICI BANK,"6,000",0.0,Nil,Nil,No,Er.Rashmi Ranjan Sahoo,"O/o the S.E (RnB) Division, Puri","3 phase power supply to Grama Nyayalaya at Brahmagiri in the District of Puri (Such as 63 KVA DSS, Shifting of existing utilites, 3 phase power supply","3 phase power supply to Grama Nyayalaya at Brahmagiri in the District of Puri (Such as 63 KVA DSS, Shifting of existing utilites, 3 phase power supply",Please refer Tender documents. ,NA ,"10,24,727",Electrical Works,NA ,Tender,90.0,30.0,Puri,752001.0,NA ,NA ,NA ,"O/o the S.E (RnB) Division, Puri",No ,No,AOC,16-May-2025,"INR 871,120",30.0,Smita Pal,16-May-2025 08:53 PM,AOC.pdf (2195.00 KB),The bidder won the transparency lottery among the qualified bidder so that the work has been awarded to him,1.0,2771579.0,MODERN WINDING AND ELECTRICALS,INR,"871,120",1,2772160,AD9 SYNTHETIC & SPORTS (P) LTD.,23-Jan-2025 11:54 AM,Rejected-Technical,The bidder has not fulfil the minimum eligibility criteria,16-May-2025 08:43 PM,Finance,Total 5 Nos Bidder are participated in the online tender,Smita Pal,24-Jan-2025 04:54 PM,,BOQ Comparative Chart,Er Soumya Ranjan Dwibedi,Internal,Sri Bikram Keshari Pattanaik Smt Smita Pal,Smita Pal,16-May-2025 08:48 PM,finsummary_526254.pdf (941.39 KB),EIC-CIVIL||SERNB-CIRCLE-KHURDA||EERNB-DIVN-PURI,2025_EICCL_109524_1,TCN No 43 of 2024-25,"3 phase power supply to Grama Nyayalaya at Brahmagiri in the District of Puri (Such as 63 KVA DSS, Shifting of existing utilites, 3 phase power supply",Er.Soumya Ranjan Dwibedi,Internal,Sri Bikram Keshari Pattanaik Smt Smita Pal,Smita Pal,16-May-2025 08:43 PM,techsummary_526254.pdf (599.75 KB),AOC
,,,,,,,,,,,,,,,,.xls,BILL OF QUANTITY,,,,,,,,,,,,,,,2.0,ICICI NEFT/RTGS,,,,,,,,,,,,,,,,,,,,,,,,,,AOC,,,,,,,,,,,,,2,2770936,BIKRAM KESHARI PATTANAIK,22-Jan-2025 02:40 PM,Rejected-AOC,Rejected,16-May-2025 08:53 PM,,,,,,,,,,,,,,,,,,,,,,,AOC
,,,,,,,,,,,,,,,,,,,,,,,,,,,,,,,,,,,,,,,,,,,,,,,,,,,,,,,,,,,AOC,,,,,,,,,,,,,3,2774576,MANGALA PRASANNA NAYAK,24-Jan-2025 01:59 PM,Rejected-AOC,Rejected,16-May-2025 08:53 PM,,,,,,,,,,,,,,,,,,,,,,,AOC
,,,,,,,,,,,,,,,,,,,,,,,,,,,,,,,,,,,,,,,,,,,,,,,,,,,,,,,,,,,AOC,,,,,,,,,,,,,4,2771579,MODERN WINDING AND ELECTRICALS,22-Jan-2025 06:49 PM,Accepted-AOC,The bidder won the transparency lottery among the qualified bidder so that the work has been awarded to him,16-May-2025 08:53 PM,,,,,,,,,,,,,,,,,,,,,,,AOC
,,,,,,,,,,,,,,,,,,,,,,,,,,,,,,,,,,,,,,,,,,,,,,,,,,,,,,,,,,,AOC,,,,,,,,,,,,,5,2774256,M/S. BALIYARSINGH ELECTRICAL ENGINEERING & CONSTRUCTION,24-Jan-2025 12:43 PM,Rejected-AOC,Rejected,16-May-2025 08:53 PM,,,,,,,,,,,,,,,,,,,,,,,AOC
