Organisation Chain,Tender Reference Number,Tender ID,Withdrawal Allowed,Tender Type,Form of contract,Tender Category,No. of Covers,General Technical Evaluation Allowed,ItemWise Technical Evaluation Allowed,Payment Mode,Is Multi Currency Allowed For BOQ,Is Multi Currency Allowed For Fee,Allow Two Stage Bidding,Cover No,Cover,Document Type,Description,Publish Date,Bid Opening Date,Document Download / Sale Start Date,Document Download / Sale End Date,Clarification Start Date,Clarification End Date,Bid Submission Start Date,Bid Submission End Date,Financial Bid Opening Date,EMD Amount in ₹,EMD Exemption Allowed,EMD Fee Type,EMD Percentage,EMD Payable To,EMD Payable At,S.No,Bank Name,Tender Fee in ₹,VAT Charges in ₹,Fee Payable To,Fee Payable At,Tender Fee Exemption Allowed,Name,Address,Title,Work Description,Pre Qualification Details,Independent External Monitor/Remarks,Tender Value in ₹,Product Category,Sub category,Contract Type,Bid Validity(Days),Period Of Work(Days),Location,Pincode,Pre Bid Meeting Place,Pre Bid Meeting Address,Pre Bid Meeting Date,Bid Opening Place,Should Allow NDA Tender,Allow Preferential Bidder,Tender Stage,Contract Date :,Contract Value :,Work Completion Period in days :,Updated By :,Updated on :,AOC document :,AOC Description :,S.No,Bid Number,Bidder Name,Awarded Currency,Awarded Value,S.No.1,Bid Number.1,Bidder Name.1,Submitted Date,Status,Remarks,Status Updated On,Type :,Summary :,Updated By :.1,Updated On :,Document :,BOQ Comparative Chart :,Committee Chairperson/Co-ordinator Name :,Committee Chairperson/Co-ordinator Type :,Committee Members :,Updated By :.2,Updated on :.1,Document :.1,Organisation Chain :,Tender ID :,Tender Ref No :,Tender Title :,Type :.1,Summary :.1,Updated By :.3,Updated On :.1,Document :.2,Committee Chairperson/Co-ordinator Name :.1,Committee Chairperson/Co-ordinator Type :.1,Committee Members :.1,Updated By :.4,Updated On :.2,Financial Bid Opening Date:,Document :.3,Tender Stage
EIC-CIVIL||SERNB-CIRCLE-CUTTACK||EERNB-DIVN-PANIKOILI,"Tender Call Notice No. SE, PKL (RandB)- 10/2024-25",2024_EICCL_106616_4,Yes,Open Tender,Percentage,Works,2.0,No,No,Online,No,No,No,1.0,Fee/PreQual/Technical,.pdf,"License, GSTIN, PAN, Affidavit,online Paper cost, EMD, Machineries and others Documents as per DTCN",08-Nov-2024 06:00 PM,22-Nov-2024 05:00 PM,08-Nov-2024 06:00 PM,22-Nov-2024 03:00 PM,08-Nov-2024 06:00 PM ,22-Nov-2024 03:00 PM ,08-Nov-2024 06:00 PM,22-Nov-2024 03:00 PM,17-Feb-2025 06:00 PM,"55,408",Yes,percentage,1.0%,Nil,Nil,1.0,ICICI BANK,"10,000",0.0,Nil,Nil,No,"SE, Pkl (Rand) Division","SE, Pkl (RandB) Division","Construction of Paddy Procurement Centre at Chashakhanda Pacs, Dasarathapur in the District of Jajpur.","Construction of Paddy Procurement Centre at Chashakhanda Pacs, Dasarathapur in the District of Jajpur.",Please refer tender Documents  ,NA ,"55,40,788",Civil Works - Buildings,NA ,Tender,90.0,120.0,"SE, Pkl (RandB) Division",755043.0,NA ,NA ,NA ,"SE, Pkl (RandB) Division",No ,No,AOC,15-May-2025,"INR 4,710,223.98",120.0,Komal Kumar Swain,15-May-2025 01:36 PM,15p1.pdf (2751.00 KB),AOC t be submitted,1.0,2655862.0,RASHMI ROY,INR,"4,710,223.98",1,2659254,BIJAY KUMAR MOHANTY,22-Nov-2024 12:39 PM,Accepted-AOC,Unsuccessful bidder and participated in transparent lottery system,15-May-2025 01:36 PM,Finance,All bidders are admitted,Subash Chandra Tarai,20-Feb-2025 12:03 PM,,BOQ Comparative Chart,Superintending Engineer,Internal,"SE, DAO and Estimator",Komal Kumar Swain,15-May-2025 01:25 PM,finsummary_515057.pdf (32.94 KB),EIC-CIVIL||SERNB-CIRCLE-CUTTACK||EERNB-DIVN-PANIKOILI,2024_EICCL_106616_4,"Tender Call Notice No. SE, PKL (RandB)- 10/2024-25","Construction of Paddy Procurement Centre at Chashakhanda Pacs, Dasarathapur in the District of Jajpur.",Technical,All Bidders are admitted,Purna Chandra Dalai,27-Nov-2024 12:54 PM,,Superintending Engineer,Internal,"SE, DAO and Estimator",Subash Chandra Tarai,17-Feb-2025 02:47 PM,17-Feb-2025 06:00 PM,techsummary_515057.pdf (32.50 KB),AOC
,,,,,,,,,,,,,,2.0,Finance,.xls,Bill of Quantity,,,,,,,,,,,,,,,,2.0,ICICI NEFT/RTGS,,,,,,,,,,,,,,,,,,,,,,,,,,AOC,,,,,,,,2.0,2657557.0,RAJ GOPAL BISWAL,INR,"4,710,223.98",2,2657790,BRAJA SUNDAR SAHOO,21-Nov-2024 06:21 PM,Accepted-AOC,Unsuccessful bidder and participated in transparent lottery system,15-May-2025 01:36 PM,,,,,,,,,,,,,,,,,,,,,,,,,,,,,AOC
,,,,,,,,,,,,,,,,,,,,,,,,,,,,,,,,,,,,,,,,,,,,,,,,,,,,,,,,,,,,AOC,,,,,,,,3.0,2657790.0,BRAJA SUNDAR SAHOO,INR,"4,710,223.98",3,2658783,M/S GUGUSYS SMART SOLUTIONS PRIVATE LIMITED,21-Nov-2024 08:58 PM,Rejected-Technical,Disqualified machineries criteria,17-Feb-2025 02:47 PM,,,,,,,,,,,,,,,,,,,,,,,,,,,,,AOC
,,,,,,,,,,,,,,,,,,,,,,,,,,,,,,,,,,,,,,,,,,,,,,,,,,,,,,,,,,,,AOC,,,,,,,,4.0,2658864.0,RAJESH KUMAR SAHU,INR,"4,710,223.98",4,2659448,M VENKET RAO,22-Nov-2024 02:34 PM,Rejected-Technical,MOU agreement not drain with electrical contractor,17-Feb-2025 02:47 PM,,,,,,,,,,,,,,,,,,,,,,,,,,,,,AOC
,,,,,,,,,,,,,,,,,,,,,,,,,,,,,,,,,,,,,,,,,,,,,,,,,,,,,,,,,,,,AOC,,,,,,,,5.0,2659254.0,BIJAY KUMAR MOHANTY,INR,"4,710,223.98",5,2658864,RAJESH KUMAR SAHU,21-Nov-2024 11:20 PM,Accepted-AOC,Unsuccessful bidder and participated in transparent lottery system,15-May-2025 01:36 PM,,,,,,,,,,,,,,,,,,,,,,,,,,,,,AOC
,,,,,,,,,,,,,,,,,,,,,,,,,,,,,,,,,,,,,,,,,,,,,,,,,,,,,,,,,,,,AOC,,,,,,,,,,,,,6,2657557,RAJ GOPAL BISWAL,22-Nov-2024 12:20 PM,Accepted-AOC,Unsuccessful bidder and participated in transparent lottery system,15-May-2025 01:36 PM,,,,,,,,,,,,,,,,,,,,,,,,,,,,,AOC
,,,,,,,,,,,,,,,,,,,,,,,,,,,,,,,,,,,,,,,,,,,,,,,,,,,,,,,,,,,,AOC,,,,,,,,,,,,,7,2655862,RASHMI ROY,20-Nov-2024 01:33 PM,Accepted-AOC,Qualified and found successful L1 bidder through transparent lottery system and Agreement Drawn,15-May-2025 01:36 PM,,,,,,,,,,,,,,,,,,,,,,,,,,,,,AOC
,,,,,,,,,,,,,,,,,,,,,,,,,,,,,,,,,,,,,,,,,,,,,,,,,,,,,,,,,,,,AOC,,,,,,,,,,,,,8,2659101,Shikshasarathi Beuria,22-Nov-2024 11:51 AM,Rejected-Finance,Disqualified,15-May-2025 01:25 PM,,,,,,,,,,,,,,,,,,,,,,,,,,,,,AOC
,,,,,,,,,,,,,,,,,,,,,,,,,,,,,,,,,,,,,,,,,,,,,,,,,,,,,,,,,,,,AOC,,,,,,,,,,,,,9,2659292,SUMIT SAURABHA JENA,22-Nov-2024 01:44 PM,Rejected-Technical,Disqualified machineries criteria,17-Feb-2025 02:47 PM,,,,,,,,,,,,,,,,,,,,,,,,,,,,,AOC
