Organisation Chain,Tender Reference Number,Tender ID,Withdrawal Allowed,Tender Type,Form of contract,Tender Category,No. of Covers,General Technical Evaluation Allowed,ItemWise Technical Evaluation Allowed,Payment Mode,Is Multi Currency Allowed For BOQ,Is Multi Currency Allowed For Fee,Allow Two Stage Bidding,Cover No,Cover,Document Type,Description,Publish Date,Bid Opening Date,Document Download / Sale Start Date,Document Download / Sale End Date,Clarification Start Date,Clarification End Date,Bid Submission Start Date,Bid Submission End Date,EMD Amount in ₹,EMD Exemption Allowed,EMD Fee Type,EMD Percentage,EMD Payable To,EMD Payable At,S.No,Bank Name,Tender Fee in ₹,VAT Charges in ₹,Fee Payable To,Fee Payable At,Tender Fee Exemption Allowed,Name,Address,Title,Work Description,Pre Qualification Details,Independent External Monitor/Remarks,Tender Value in ₹,Product Category,Sub category,Contract Type,Bid Validity(Days),Period Of Work(Days),Location,Pincode,Pre Bid Meeting Place,Pre Bid Meeting Address,Pre Bid Meeting Date,Bid Opening Place,Should Allow NDA Tender,Allow Preferential Bidder,Tender Stage,Contract Date :,Contract Value :,Work Completion Period in days :,Updated By :,Updated on :,AOC document :,AOC Description :,S.No,Bid Number,Bidder Name,Awarded Currency,Awarded Value,S.No.1,Bid Number.1,Bidder Name.1,Submitted Date,Status,Remarks,Status Updated On,Type :,Summary :,Updated By :.1,Updated On :,Document :,BOQ Comparative Chart :,Committee Chairperson/Co-ordinator Name :,Committee Chairperson/Co-ordinator Type :,Committee Members :,Updated By :.2,Updated on :.1,Document :.1,Organisation Chain :,Tender ID :,Tender Ref No :,Tender Title :,Committee Chairperson/Co-ordinator Name :.1,Committee Chairperson/Co-ordinator Type :.1,Committee Members :.1,Updated By :.3,Updated On :.1,Document :.2,Tender Stage
"Orissa Lift Irrigation Corporation||LI,Central Circle, Cuttack||LI,Division, Bhubaneswar",BID NO-740/2024-25 DT.02.04.2025,2025_OLIC_112212_22,Yes,Open Tender,Percentage,Works,1.0,No,No,Online,No,No,No,1.0,Fee/PreQual/Technical/Finance,.pdf,TENDER PAPER COST EMD AND ALL OTHER DOCUMENTS AS PER DTCN,07-Apr-2025 10:00 AM,17-Apr-2025 11:00 AM,07-Apr-2025 10:00 AM,16-Apr-2025 05:00 PM,07-Apr-2025 10:00 AM ,15-Apr-2025 05:00 PM ,07-Apr-2025 10:00 AM,16-Apr-2025 05:00 PM,"25,129",Yes,percentage,1.0%,Nil,Nil,1.0,ICICI BANK,"7,080",0.0,Nil,Nil,Yes,Executive Engineer,EE LI DIVISION BHUBANESWAR,REVIVAL AND RE-ENERGISATION OF JANKIA-I III AND IV KAYA AND PANDIABILI-III LIP UNDER KHORDHA AND JATNI BLOCK OF KHORDHA DISTRICT UNDER PLAN FUND 2024-25,REVIVAL AND RE-ENERGISATION OF JANKIA-I III AND IV KAYA AND PANDIABILI-III LIP UNDER KHORDHA AND JATNI BLOCK OF KHORDHA DISTRICT UNDER PLAN FUND 2024-25,Please refer Tender Documents ,NA ,"25,12,873",Civil Works - Lift Irrigation Schemes,NA ,Tender,90.0,90.0,KHORDHA,751012.0,NA ,NA ,NA ,EE LI DIVISION BHUBANESWAR,No ,No,AOC,19-May-2025,"INR 2,387,481",90.0,SUJIT KUMAR MOHANTY,19-May-2025 04:18 PM,Jankia-I.pdf (1340.00 KB),WORK ORDER AND AGREEMENT COMPLETED,1.0,2884239.0,PRADEEP KUMAR AGRAWALLA,INR,"2,387,481",1,2884212,AGRAWALLA POWER INFRASTRUCTURE,16-Apr-2025 11:02 AM,Rejected-Technical,Rejected,19-May-2025 04:13 PM,Finance,TENDER OPENED,SUJIT KUMAR MOHANTY,17-Apr-2025 05:52 PM,finance_535413.pdf,BOQ Comparative Chart,Sujit Kumar Mohanty,Internal,"EE,ESTR,DA",SUJIT KUMAR MOHANTY,19-May-2025 04:16 PM,finsummary_535413.pdf (1340.09 KB),"Orissa Lift Irrigation Corporation||LI,Central Circle, Cuttack||LI,Division, Bhubaneswar",2025_OLIC_112212_22,BID NO-740/2024-25 DT.02.04.2025,REVIVAL AND RE-ENERGISATION OF JANKIA-I III AND IV KAYA AND PANDIABILI-III LIP UNDER KHORDHA AND JATNI BLOCK OF KHORDHA DISTRICT UNDER PLAN FUND 2024-25,Sujit Kumar Mohanty,Internal,"EE,ESTR,DA",SUJIT KUMAR MOHANTY,19-May-2025 04:13 PM,techsummary_535413.pdf (1340.09 KB),AOC
,,,,,,,,,,,,,,,,.xls,BOQ,,,,,,,,,,,,,,,2.0,ICICI NEFT/RTGS,,,,,,,,,,,,,,,,,,,,,,,,,,AOC,,,,,,,,,,,,,2,2885434,GITANJALI SARANGI PROPRIETOR- GITANJALI ENTERPRISES,16-Apr-2025 12:48 PM,Rejected-Technical,Rejected,19-May-2025 04:13 PM,,,,,,,,,,,,,,,,,,,,,,,AOC
,,,,,,,,,,,,,,,,,,,,,,,,,,,,,,,,,,,,,,,,,,,,,,,,,,,,,,,,,,,AOC,,,,,,,,,,,,,3,2885332,MADAN MOHAN BASTIA,15-Apr-2025 08:47 PM,Rejected-Technical,Rejected,19-May-2025 04:13 PM,,,,,,,,,,,,,,,,,,,,,,,AOC
,,,,,,,,,,,,,,,,,,,,,,,,,,,,,,,,,,,,,,,,,,,,,,,,,,,,,,,,,,,AOC,,,,,,,,,,,,,4,2885292,MODERN WINDING AND ELECTRICALS,15-Apr-2025 08:01 PM,Rejected-Technical,Rejected,19-May-2025 04:13 PM,,,,,,,,,,,,,,,,,,,,,,,AOC
,,,,,,,,,,,,,,,,,,,,,,,,,,,,,,,,,,,,,,,,,,,,,,,,,,,,,,,,,,,AOC,,,,,,,,,,,,,5,2886002,M/S DILIP KUMAR SAHOO,16-Apr-2025 01:33 PM,Rejected-Technical,Rejected,19-May-2025 04:13 PM,,,,,,,,,,,,,,,,,,,,,,,AOC
,,,,,,,,,,,,,,,,,,,,,,,,,,,,,,,,,,,,,,,,,,,,,,,,,,,,,,,,,,,AOC,,,,,,,,,,,,,6,2882907,M/S. M.C.C. ASSOCIATES,12-Apr-2025 01:54 PM,Rejected-Technical,Rejected,19-May-2025 04:13 PM,,,,,,,,,,,,,,,,,,,,,,,AOC
,,,,,,,,,,,,,,,,,,,,,,,,,,,,,,,,,,,,,,,,,,,,,,,,,,,,,,,,,,,AOC,,,,,,,,,,,,,7,2884239,PRADEEP KUMAR AGRAWALLA,16-Apr-2025 02:00 PM,Accepted-AOC,WORK ORDER AND AGREEMENT COMPLETED,19-May-2025 04:18 PM,,,,,,,,,,,,,,,,,,,,,,,AOC
,,,,,,,,,,,,,,,,,,,,,,,,,,,,,,,,,,,,,,,,,,,,,,,,,,,,,,,,,,,AOC,,,,,,,,,,,,,8,2885481,RAJIBA LOCHAN BEHERA,16-Apr-2025 03:56 AM,Rejected-Technical,Rejected,19-May-2025 04:13 PM,,,,,,,,,,,,,,,,,,,,,,,AOC
