Organisation Chain,Tender Reference Number,Tender ID,Withdrawal Allowed,Tender Type,Form of contract,Tender Category,No. of Covers,General Technical Evaluation Allowed,ItemWise Technical Evaluation Allowed,Payment Mode,Is Multi Currency Allowed For BOQ,Is Multi Currency Allowed For Fee,Allow Two Stage Bidding,Cover No,Cover,Document Type,Description,Publish Date,Bid Opening Date,Document Download / Sale Start Date,Document Download / Sale End Date,Clarification Start Date,Clarification End Date,Bid Submission Start Date,Bid Submission End Date,EMD Amount in ₹,EMD Exemption Allowed,EMD Fee Type,EMD Percentage,EMD Payable To,EMD Payable At,S.No,Bank Name,Tender Fee in ₹,Fee Payable To,Fee Payable At,Tender Fee Exemption Allowed,Name,Address,Title,Work Description,Pre Qualification Details,Independent External Monitor/Remarks,Tender Value in ₹,Product Category,Sub category,Contract Type,Bid Validity(Days),Period Of Work(Days),Location,Pincode,Pre Bid Meeting Place,Pre Bid Meeting Address,Pre Bid Meeting Date,Bid Opening Place,Should Allow NDA Tender,Allow Preferential Bidder,Tender Stage,Contract Date :,Contract Value :,Work Completion Period in days :,Updated By :,Updated on :,AOC document :,AOC Description :,S.No,Bid Number,Bidder Name,Awarded Currency,Awarded Value,S.No.1,Bid Number.1,Bidder Name.1,Submitted Date,Status,Remarks,Status Updated On,Type :,Summary :,Updated By :.1,Updated On :,Document :,BOQ Comparative Chart :,Committee Chairperson/Co-ordinator Name :,Committee Chairperson/Co-ordinator Type :,Committee Members :,Updated By :.2,Updated on :.1,Document :.1,Organisation Chain :,Tender ID :,Tender Ref No :,Tender Title :,Committee Chairperson/Co-ordinator Name :.1,Committee Chairperson/Co-ordinator Type :.1,Committee Members :.1,Updated By :.3,Updated On :.1,Document :.2,Tender Stage
CE and BM Brahmani Basin Samal||APD cum CCE RIP Samal||Rourkela Irrigation Division Rourkela,SERID-RKL-10-2023-24,2023_CEBBS_97627_6,Yes,Open Tender,Percentage,Works,1.0,No,No,Online,No,No,No,1.0,Fee/PreQual/Technical/Finance,.pdf,"Tender Paper cost,EMD,Pan Card,GSTIN,Valid R.C,Certificate( CDMS Registration)",30-Nov-2023 10:00 AM,12-Dec-2023 11:30 AM,30-Nov-2023 10:00 AM,11-Dec-2023 05:00 PM,30-Nov-2023 10:00 AM ,08-Dec-2023 05:00 PM ,30-Nov-2023 10:00 AM,11-Dec-2023 05:00 PM,"26,200",Yes,fixed,,Nil,Nil,1.0,ICICI BANK,"6,000",Nil,Nil,No,Superintending Engineer,"Superintending Engineer,Rourkela Irrigation Division","Flood protection work of left bank on Brahmani River at Chhend Basti, Rourkela","Flood protection work of left bank on Brahmani River at Chhend Basti, Rourkela",Please refer Tender documents. ,NA ,"26,17,461",Civil Works - Others,NA ,Tender,90.0,90.0,Rourkela,769015.0,NA ,NA ,NA ,Rourkela Irrigation Division,No ,No,AOC,12-Jan-2024,"INR 2,225,104",90.0,Mousumi Mundary,28-Oct-2024 12:41 PM,chhend.pdf (569.00 KB),Sri Debashish Das won the transparent lottery,1.0,2353032.0,DEBASHISH DAS,INR,"2,225,104",1,2353351,BRAHMANAND SAMASI,11-Dec-2023 02:26 PM,Rejected-AOC,he do not won the transparent lottery,28-Oct-2024 12:41 PM,Finance,All bids were open as per schedule date and time.All the documents were downloaded successfully and all bids were accepted.,Mousumi Mundary,13-Dec-2023 06:22 PM,finance_476767.pdf,BOQ Comparative Chart,Er Dhananjay Kalah,Internal,"Er Dhananjay Kalah SE,Smt Mousumi Mundary AEE,Misss Rupam Kumari DA",Mousumi Mundary,03-Jan-2024 02:04 PM,finsummary_476767.pdf (680.62 KB),CE and BM Brahmani Basin Samal||APD cum CCE RIP Samal||Rourkela Irrigation Division Rourkela,2023_CEBBS_97627_6,SERID-RKL-10-2023-24,"Flood protection work of left bank on Brahmani River at Chhend Basti, Rourkela",Er Dhananjay Kalah,Internal,"Er Dhananjay Kalah SE,Smt Mousumi Mundary AEE,Miss Rupam Kumari DA",Mousumi Mundary,20-Dec-2023 12:53 PM,techsummary_476767.pdf (680.62 KB),AOC
,,,,,,,,,,,,,,,,.pdf,"Affidavit,No Relation Certificate and other documents as per DTCN",,,,,,,,,,,,,,,2.0,ICICI NEFT/RTGS,,,,,,,,,,,,,,,,,,,,,,,,,AOC,,,,,,,,,,,,,2,2353032,DEBASHISH DAS,11-Dec-2023 03:16 PM,Accepted-AOC,he won the transparent lottery,28-Oct-2024 12:41 PM,,,,,,,,,,,,,,,,,,,,,,,AOC
,,,,,,,,,,,,,,,,.xls,Bill of Quantity,,,,,,,,,,,,,,,,,,,,,,,,,,,,,,,,,,,,,,,,,AOC,,,,,,,,,,,,,3,2353725,GODBIN TOPPO,11-Dec-2023 04:48 PM,Rejected-AOC,he do not won the transparent lottery,28-Oct-2024 12:41 PM,,,,,,,,,,,,,,,,,,,,,,,AOC
,,,,,,,,,,,,,,,,,,,,,,,,,,,,,,,,,,,,,,,,,,,,,,,,,,,,,,,,,,AOC,,,,,,,,,,,,,4,2353284,PANKAJINI SAMAL,11-Dec-2023 02:08 PM,Rejected-AOC,he do not won the transparent lottery,28-Oct-2024 12:41 PM,,,,,,,,,,,,,,,,,,,,,,,AOC
,,,,,,,,,,,,,,,,,,,,,,,,,,,,,,,,,,,,,,,,,,,,,,,,,,,,,,,,,,AOC,,,,,,,,,,,,,5,2351655,SUMAN TANTY (S.C.),08-Dec-2023 06:01 PM,Rejected-AOC,he do not won the transparent lottery,28-Oct-2024 12:41 PM,,,,,,,,,,,,,,,,,,,,,,,AOC
