Organisation Chain,Tender Reference Number,Tender ID,Withdrawal Allowed,Tender Type,Form of contract,Tender Category,No. of Covers,General Technical Evaluation Allowed,ItemWise Technical Evaluation Allowed,Payment Mode,Is Multi Currency Allowed For BOQ,Is Multi Currency Allowed For Fee,Allow Two Stage Bidding,Cover No,Cover,Document Type,Description,Publish Date,Bid Opening Date,Document Download / Sale Start Date,Document Download / Sale End Date,Clarification Start Date,Clarification End Date,Bid Submission Start Date,Bid Submission End Date,Financial Bid Opening Date,EMD Amount in ₹,EMD Exemption Allowed,EMD Fee Type,EMD Percentage,EMD Payable To,EMD Payable At,S.No,Bank Name,Tender Fee in ₹,Fee Payable To,Fee Payable At,Tender Fee Exemption Allowed,Name,Address,Title,Work Description,Pre Qualification Details,Independent External Monitor/Remarks,Tender Value in ₹,Product Category,Sub category,Contract Type,Bid Validity(Days),Period Of Work(Days),Location,Pincode,Pre Bid Meeting Place,Pre Bid Meeting Address,Pre Bid Meeting Date,Bid Opening Place,Should Allow NDA Tender,Allow Preferential Bidder,Tender Stage,Contract Date :,Contract Value :,Work Completion Period in days :,Updated By :,Updated on :,AOC document :,S.No,Bid Number,Bidder Name,Awarded Currency,Awarded Value,S.No.1,Bid Number.1,Bidder Name.1,Submitted Date,Status,Remarks,Status Updated On,Type :,Summary :,Updated By :.1,Updated On :,Document :,BOQ Comparative Chart :,Committee Chairperson/Co-ordinator Name :,Committee Chairperson/Co-ordinator Type :,Committee Members :,Updated By :.2,Updated on :.1,Document :.1,Organisation Chain :,Tender ID :,Tender Ref No :,Tender Title :,Type :.1,Summary :.1,Updated By :.3,Updated On :.1,Document :.2,Committee Chairperson/Co-ordinator Name :.1,Committee Chairperson/Co-ordinator Type :.1,Committee Members :.1,Updated By :.4,Updated On :.2,Financial Bid Opening Date:,Document :.3,Tender Stage
WATCO Bhubaneswar,WATCO (W)-02(4)/2024-25 Dtd.05.07.2024,2024_WATCO_103552_1,Yes,National Competitive Bid,Percentage,Works,2.0,No,No,Online,No,No,No,1.0,Fee/PreQual/Technical,.pdf,"Copy of PAN, GST, Affidavits as per DTCN",10-Jul-2024 11:00 AM,20-Jul-2024 12:30 PM,10-Jul-2024 11:00 AM,19-Jul-2024 05:00 PM,NA ,NA ,10-Jul-2024 11:00 AM,19-Jul-2024 05:00 PM,08-Aug-2024 06:00 PM,"96,000",Yes,fixed,,Nil,Nil,1.0,ICICI BANK,"11,800",Nil,Nil,No,Chief Executive Officer,"The Chief Executive Officer, WATCO Ground Floor, Unnati Bhawan, Satyanagar, Bhubaneswar-751007, Odisha, India (0674) 2391444","Chlorination, Automation and Instrumentation work for Implementation of 24x7 water supply to Bhagabanpur, BMC Bhubaneswar under SUJAL","Chlorination, Automation and Instrumentation work for Implementation of 24x7 water supply to Bhagabanpur, BMC Bhubaneswar under SUJAL",Please refer Tender documents. ,NA ,"95,16,000",Civil Works - Water Works,NA ,Tender,120.0,30.0,"Bhagabanpur, Bhubaneswar",751019.0,NA ,NA ,NA ,Bhubaneswar,No ,No,AOC,22-Oct-2024,"INR 8,374,314",30.0,Guru Charan Das,22-Oct-2024 04:02 PM,AOC.pdf (401.00 KB),1.0,2515292.0,SABITA JENA,INR,"8,374,314",1,2515052,BIJAN ROUT,19-Jul-2024 10:28 AM,Rejected-Technical,Technically disqualified,08-Aug-2024 05:52 PM,Finance,Three no financial bids are received online and the bid is admitted subject to detail scrutiny after downloading the bid documents and after which the bid will be finally determined as valid or invalid,Rajendra Nath Nayak,08-Aug-2024 07:03 PM,,BOQ Comparative Chart,Chief Executive Officer,Internal,,Guru Charan Das,22-Oct-2024 04:00 PM,finsummary_502653.pdf (382.52 KB),WATCO Bhubaneswar,2024_WATCO_103552_1,WATCO (W)-02(4)/2024-25 Dtd.05.07.2024,"Chlorination, Automation and Instrumentation work for Implementation of 24x7 water supply to Bhagabanpur, BMC Bhubaneswar under SUJAL",Technical,Six no technical bids are received online and the bid is admitted subject to detail scrutiny after downloading the bid documents and after which the bid will be finally determined as valid or invalid,Rajendra Nath Nayak,20-Jul-2024 01:57 PM,,Chief Executive Officer,Internal,,Rajendra Nath Nayak,08-Aug-2024 05:52 PM,08-Aug-2024 06:00 PM,techsummary_502653.pdf (527.86 KB),AOC
,,,,,,,,,,,,,,,,.pdf,"Certificates, Formats, Schedules and other documents if any as per DTCN",,,,,,,,,,,,,,,,2.0,ICICI NEFT/RTGS,,,,,,,,,,,,,,,,,,,,,,,,,AOC,,,,,,,,,,,,2,2512796,CHINTAMANI KUNDA,19-Jul-2024 10:13 AM,Rejected-Technical,Technically disqualified,08-Aug-2024 05:52 PM,,,,,,,,,,,,,,,,,,,,,,,,,,,,,AOC
,,,,,,,,,,,,,,2.0,Finance,.xls,Bill of Quantity,,,,,,,,,,,,,,,,,,,,,,,,,,,,,,,,,,,,,,,,,,AOC,,,,,,,,,,,,3,2513962,Drite Automation and Engineering,16-Jul-2024 06:47 PM,Rejected-AOC,Not a lowest bidder,22-Oct-2024 04:03 PM,,,,,,,,,,,,,,,,,,,,,,,,,,,,,AOC
,,,,,,,,,,,,,,,,,,,,,,,,,,,,,,,,,,,,,,,,,,,,,,,,,,,,,,,,,,,AOC,,,,,,,,,,,,4,2515237,Instrument & Control,19-Jul-2024 03:07 PM,Rejected-AOC,Not a lowest bidder,22-Oct-2024 04:03 PM,,,,,,,,,,,,,,,,,,,,,,,,,,,,,AOC
,,,,,,,,,,,,,,,,,,,,,,,,,,,,,,,,,,,,,,,,,,,,,,,,,,,,,,,,,,,AOC,,,,,,,,,,,,5,2515067,PURUSOTTAM BEHERA,19-Jul-2024 04:23 PM,Rejected-Technical,Technically disqualified,08-Aug-2024 05:52 PM,,,,,,,,,,,,,,,,,,,,,,,,,,,,,AOC
,,,,,,,,,,,,,,,,,,,,,,,,,,,,,,,,,,,,,,,,,,,,,,,,,,,,,,,,,,,AOC,,,,,,,,,,,,6,2515292,SABITA JENA,19-Jul-2024 04:31 PM,Accepted-AOC,Lowest bidder,22-Oct-2024 04:03 PM,,,,,,,,,,,,,,,,,,,,,,,,,,,,,AOC
