Organisation Chain,Tender Reference Number,Tender ID,Withdrawal Allowed,Tender Type,Form of contract,Tender Category,No. of Covers,General Technical Evaluation Allowed,ItemWise Technical Evaluation Allowed,Payment Mode,Is Multi Currency Allowed For BOQ,Is Multi Currency Allowed For Fee,Allow Two Stage Bidding,Cover No,Cover,Document Type,Description,Publish Date,Bid Opening Date,Document Download / Sale Start Date,Document Download / Sale End Date,Clarification Start Date,Clarification End Date,Bid Submission Start Date,Bid Submission End Date,EMD Amount in ₹,EMD Exemption Allowed,EMD Fee Type,EMD Percentage,EMD Payable To,EMD Payable At,S.No,Corrigendum Title,Corrigendum Type,View,S.No.1,Bank Name,Tender Fee in ₹,Fee Payable To,Fee Payable At,Tender Fee Exemption Allowed,Name,Address,Title,Work Description,Pre Qualification Details,Independent External Monitor/Remarks,Tender Value in ₹,Product Category,Sub category,Contract Type,Bid Validity(Days),Period Of Work(Days),Location,Pincode,Pre Bid Meeting Place,Pre Bid Meeting Address,Pre Bid Meeting Date,Bid Opening Place,Should Allow NDA Tender,Allow Preferential Bidder,Tender Stage,Contract Date :,Contract Value :,Work Completion Period in days :,Updated By :,Updated on :,AOC document :,S.No,Bid Number,Bidder Name,Awarded Currency,Awarded Value,S.No.1,Bid Number.1,Bidder Name.1,Submitted Date,Status,Remarks,Status Updated On,Type :,Summary :,Updated By :.1,Updated On :,Document :,BOQ Comparative Chart :,Committee Chairperson/Co-ordinator Name :,Committee Chairperson/Co-ordinator Type :,Committee Members :,Updated By :.2,Updated on :.1,Document :.1,Organisation Chain :,Tender ID :,Tender Ref No :,Tender Title :,Committee Chairperson/Co-ordinator Name :.1,Committee Chairperson/Co-ordinator Type :.1,Committee Members :.1,Updated By :.3,Updated On :.1,Document :.2,Tender Stage
Panchayati Raj and Drinking Water Department Odisha||Zilla Parisad Balasore||SIMULIA Block,01 SIMULIA /2024-25,2024_PRBSU_103971_2,Yes,Open Tender,Percentage,Works,1.0,No,No,Online,No,No,No,1.0,Fee/PreQual/Technical/Finance,.pdf,"Registration Certificate, PAN, GST, Affidavit etc. as per DTCN",30-Jul-2024 01:45 PM,17-Aug-2024 11:00 AM,30-Jul-2024 01:45 PM,16-Aug-2024 05:00 PM,30-Jul-2024 01:45 PM ,16-Aug-2024 05:00 PM ,30-Jul-2024 01:45 PM,16-Aug-2024 05:00 PM,"12,900",Yes,fixed,,Nil,Nil,1.0,1st Corrigendum,Technical Bid,,1.0,ICICI BANK,"6,000",Nil,Nil,No,"Block Development Officer, Simulia","OFFICE OF THE PANCHAYAT SAMITI, SIMULIA","Construction Of Additional Class Room At Jagulai Nodal ps,Shyamsundaarpur Gp,Under Simulia Block",civil works,Please refer Tender documents. ,NA ,"12,87,059",Civil Works - Buildings,NA ,Tender,90.0,120.0,Simulia,756023.0,NA ,NA ,NA ,"OFFICE OF THE PANCHAYAT SAMITI, SIMULIA",No ,No,AOC,18-Oct-2024,"INR 1,094,130",90.0,Sambit Kumar Kar,18-Oct-2024 11:28 AM,workorder.pdf (526.00 KB),1.0,2523256.0,Golak Chandra Samal,INR,"1,094,130",1,2524119,BASANTA KUMAR SAHOO,06-Aug-2024 12:49 PM,Rejected-Finance,Loose in Lottery Process,18-Oct-2024 11:18 AM,Finance,Document verified and found ok,Sambit Kumar Kar,20-Aug-2024 01:13 PM,,BOQ Comparative Chart,"SAMBIT KUMAR KAR, BDO, SIMULIA",Internal,,Sambit Kumar Kar,18-Oct-2024 11:18 AM,finsummary_503864.pdf (260.13 KB),Panchayati Raj and Drinking Water Department Odisha||Zilla Parisad Balasore||SIMULIA Block,2024_PRBSU_103971_2,01 SIMULIA /2024-25,"Construction Of Additional Class Room At Jagulai Nodal ps,Shyamsundaarpur Gp,Under Simulia Block","SAMBIT KUMAR KAR, BDO, SIMULIA",Internal,,Sambit Kumar Kar,18-Oct-2024 11:06 AM,techsummary_503864.pdf (260.13 KB),AOC
,,,,,,,,,,,,,,,,.xls,BOQ,,,,,,,,,,,,,,,,,,,2.0,ICICI NEFT/RTGS,,,,,,,,,,,,,,,,,,,,,,,,,AOC,,,,,,,,,,,,2,2530303,BIKASH KUMAR SAMAL,16-Aug-2024 04:25 PM,Rejected-Finance,Loose in Lottery Process,18-Oct-2024 11:18 AM,,,,,,,,,,,,,,,,,,,,,,,AOC
,,,,,,,,,,,,,,,,,,,,,,,,,,,,,,,,,,,,,,,,,,,,,,,,,,,,,,,,,,,,,,AOC,,,,,,,,,,,,3,2523256,Golak Chandra Samal,03-Aug-2024 03:55 PM,Accepted-AOC,win in lottery process,18-Oct-2024 11:28 AM,,,,,,,,,,,,,,,,,,,,,,,AOC
,,,,,,,,,,,,,,,,,,,,,,,,,,,,,,,,,,,,,,,,,,,,,,,,,,,,,,,,,,,,,,AOC,,,,,,,,,,,,4,2523396,JADU SINGH,04-Aug-2024 03:35 PM,Rejected-Technical,mismatched name,18-Oct-2024 11:06 AM,,,,,,,,,,,,,,,,,,,,,,,AOC
,,,,,,,,,,,,,,,,,,,,,,,,,,,,,,,,,,,,,,,,,,,,,,,,,,,,,,,,,,,,,,AOC,,,,,,,,,,,,5,2529681,JAYADRATH SHIAL (SC),15-Aug-2024 09:30 PM,Rejected-Finance,Loose in Lottery Process,18-Oct-2024 11:18 AM,,,,,,,,,,,,,,,,,,,,,,,AOC
,,,,,,,,,,,,,,,,,,,,,,,,,,,,,,,,,,,,,,,,,,,,,,,,,,,,,,,,,,,,,,AOC,,,,,,,,,,,,6,2523021,RR ENTERPRISES,03-Aug-2024 08:39 PM,Not Admitted-Fee/PreQual/Technical/Finance,Others-Name miss matched as per document uploaded .,20-Aug-2024 01:13 PM,,,,,,,,,,,,,,,,,,,,,,,AOC
,,,,,,,,,,,,,,,,,,,,,,,,,,,,,,,,,,,,,,,,,,,,,,,,,,,,,,,,,,,,,,AOC,,,,,,,,,,,,7,2530066,SASMITA PANIGRAHI,16-Aug-2024 01:51 PM,Rejected-Finance,Loose in Lottery Process,18-Oct-2024 11:18 AM,,,,,,,,,,,,,,,,,,,,,,,AOC
