Organisation Chain,Tender Reference Number,Tender ID,Withdrawal Allowed,Tender Type,Form of contract,Tender Category,No. of Covers,General Technical Evaluation Allowed,ItemWise Technical Evaluation Allowed,Payment Mode,Is Multi Currency Allowed For BOQ,Is Multi Currency Allowed For Fee,Allow Two Stage Bidding,Cover No,Cover,Document Type,Description,Publish Date,Bid Opening Date,Document Download / Sale Start Date,Document Download / Sale End Date,Clarification Start Date,Clarification End Date,Bid Submission Start Date,Bid Submission End Date,Financial Bid Opening Date,EMD Amount in ₹,EMD Exemption Allowed,EMD Fee Type,EMD Percentage,EMD Payable To,EMD Payable At,S.No,Bank Name,Tender Fee in ₹,VAT Charges in ₹,Fee Payable To,Fee Payable At,Tender Fee Exemption Allowed,Name,Address,Title,Work Description,Pre Qualification Details,Independent External Monitor/Remarks,Tender Value in ₹,Product Category,Sub category,Contract Type,Bid Validity(Days),Period Of Work(Days),Location,Pincode,Pre Bid Meeting Place,Pre Bid Meeting Address,Pre Bid Meeting Date,Bid Opening Place,Should Allow NDA Tender,Allow Preferential Bidder,Tender Stage,Contract Date :,Contract Value :,Work Completion Period in days :,Updated By :,Updated on :,AOC document :,AOC Description :,S.No,Bid Number,Bidder Name,Awarded Currency,Awarded Value,S.No.1,Bid Number.1,Bidder Name.1,Submitted Date,Status,Remarks,Status Updated On,Type :,Summary :,Updated By :.1,Updated On :,Document :,BOQ Comparative Chart :,Committee Chairperson/Co-ordinator Name :,Committee Chairperson/Co-ordinator Type :,Committee Members :,Updated By :.2,Updated on :.1,Document :.1,Organisation Chain :,Tender ID :,Tender Ref No :,Tender Title :,Type :.1,Summary :.1,Updated By :.3,Updated On :.1,Document :.2,Committee Chairperson/Co-ordinator Name :.1,Committee Chairperson/Co-ordinator Type :.1,Committee Members :.1,Updated By :.4,Updated On :.2,Financial Bid Opening Date:,Document :.3,Tender Stage
EIC-CIVIL||SERNB-CIRCLE-JEYPORE,CCEJC R AND B 36/2023-24,2024_EICCL_100757_1,Yes,National Competitive Bid,Percentage,Works,2.0,No,No,Online,No,No,No,1.0,Fee/PreQual/Technical,.pdf,"Tender Cost, EMD, GST Registration Certificate and GSTIN, PAN, Contractor RC",08-Feb-2024 11:00 AM,23-Feb-2024 10:00 AM,08-Feb-2024 11:00 AM,22-Feb-2024 05:00 PM,NA ,NA ,08-Feb-2024 11:00 AM,22-Feb-2024 05:00 PM,28-Feb-2024 12:05 PM,"1,02,000",Yes,fixed,,Nil,Nil,1.0,ICICI BANK,"10,000",0.0,Nil,Nil,No,CHIEF CONSTRUCTION ENGINEER,Chief Construction Engineer Jeypore R and B circle Jeypore,Additioal modification Extension works of Odisha Adarsha Vidyalaya at Pottangi under Pottangi Block in the District of Koraput for the year 2023-24,CIVIL WORK,Please refer Tender documents. ,NA ,,Civil Works - Buildings,OAV BUILDING ,Tender,90.0,180.0,KORAPUT,764020.0,NA ,NA ,NA ,O/O C.C.E R and B Circle Jeypore,No ,No,AOC,22-Oct-2024,"INR 8,655,353",180.0,Nihar Ranjan behera,22-Oct-2024 12:35 PM,Pottangi-AOC.pdf (1461.00 KB),FIRST LOWEST BID OF SRI UTTKAL MAHAPATRA SELECTED THROUGH TRANSPARENT LOTTERY SYSTEM,1.0,2454504.0,UTTKAL MAHAPATRA,INR,"8,655,353",1,2454952,BISWOMBAR NATH BHUYAN,22-Feb-2024 04:52 PM,Rejected-Finance,SECOND LOWEST BIDDER,22-Oct-2024 12:21 PM,Finance,Price bid of the above bidders Downloaded.,Alok Mohanty,29-Feb-2024 01:54 PM,finance_490833.pdf,BOQ Comparative Chart,ALOK KUMAR MOHANTY,Internal,,Nihar Ranjan behera,22-Oct-2024 12:21 PM,finsummary_490833.pdf (1841.85 KB),EIC-CIVIL||SERNB-CIRCLE-JEYPORE,2024_EICCL_100757_1,CCEJC R AND B 36/2023-24,Additioal modification Extension works of Odisha Adarsha Vidyalaya at Pottangi under Pottangi Block in the District of Koraput for the year 2023-24,Technical,ABOVE BIDDERS ARE PROVISIONALLY QUALIFIED FOR TECHNICAL EVALUATION,Alok Mohanty,27-Feb-2024 04:38 PM,technical_490833.pdf,ALOK KUMAR MOHANTY,Internal,"Sri Satyanarayan Khura S.E Koraput R and B Division, DAO Koraput R and B Division Sri Akshaya kumar Rout A.E.E Jeypore R and B Circle",Alok Mohanty,28-Feb-2024 11:59 AM,28-Feb-2024 12:05 PM,techsummary_490833.pdf (269.40 KB),AOC
,,,,,,,,,,,,,,,,.pdf,Affidavit Undertakings and Other Documents as per SBD/DTCN,,,,,,,,,,,,,,,,2.0,ICICI NEFT/RTGS,,,,,,,,,,,,,,,,,,,,,,,,,,AOC,,,,,,,,,,,,,2,2453963,OM PRAKASH SINGH,22-Feb-2024 12:10 PM,Rejected-Finance,FOURTH LOWEST BIDDER,22-Oct-2024 12:21 PM,,,,,,,,,,,,,,,,,,,,,,,,,,,,,AOC
,,,,,,,,,,,,,,2.0,Finance,.xls,BOQ,,,,,,,,,,,,,,,,,,,,,,,,,,,,,,,,,,,,,,,,,,,AOC,,,,,,,,,,,,,3,2453691,PRATAP SINGH,22-Feb-2024 09:51 AM,Rejected-AOC,FIRST LOWEST BIDDER PARTICIPATED IN LOTTERY SYSTEM BUT DID NOT QUALIFY,22-Oct-2024 12:37 PM,,,,,,,,,,,,,,,,,,,,,,,,,,,,,AOC
,,,,,,,,,,,,,,,,,,,,,,,,,,,,,,,,,,,,,,,,,,,,,,,,,,,,,,,,,,,,AOC,,,,,,,,,,,,,4,2453359,RAMANATH ACHARYA,21-Feb-2024 10:17 PM,Rejected-Technical,10 i of DTCN,28-Feb-2024 11:59 AM,,,,,,,,,,,,,,,,,,,,,,,,,,,,,AOC
,,,,,,,,,,,,,,,,,,,,,,,,,,,,,,,,,,,,,,,,,,,,,,,,,,,,,,,,,,,,AOC,,,,,,,,,,,,,5,2453533,SUJIT KUMAR CHOUDHURY,22-Feb-2024 12:05 AM,Rejected-Finance,THIRD LOWEST BIDDER,22-Oct-2024 12:21 PM,,,,,,,,,,,,,,,,,,,,,,,,,,,,,AOC
,,,,,,,,,,,,,,,,,,,,,,,,,,,,,,,,,,,,,,,,,,,,,,,,,,,,,,,,,,,,AOC,,,,,,,,,,,,,6,2454504,UTTKAL MAHAPATRA,22-Feb-2024 02:08 PM,Accepted-AOC,FIRST LOWEST BIDDER PARTICIPATED IN LOTTERY SYSTEM AND QUALIFIED,22-Oct-2024 12:37 PM,,,,,,,,,,,,,,,,,,,,,,,,,,,,,AOC
