Organisation Chain,Tender Reference Number,Tender ID,Withdrawal Allowed,Tender Type,Form of contract,Tender Category,No. of Covers,General Technical Evaluation Allowed,ItemWise Technical Evaluation Allowed,Payment Mode,Is Multi Currency Allowed For BOQ,Is Multi Currency Allowed For Fee,Allow Two Stage Bidding,Cover No,Cover,Document Type,Description,Publish Date,Bid Opening Date,Document Download / Sale Start Date,Document Download / Sale End Date,Clarification Start Date,Clarification End Date,Bid Submission Start Date,Bid Submission End Date,EMD Amount in ₹,EMD Exemption Allowed,EMD Fee Type,EMD Percentage,EMD Payable To,EMD Payable At,S.No,Bank Name,Tender Fee in ₹,VAT Charges in ₹,Fee Payable To,Fee Payable At,Tender Fee Exemption Allowed,Name,Address,Title,Work Description,Pre Qualification Details,Independent External Monitor/Remarks,Tender Value in ₹,Product Category,Sub category,Contract Type,Bid Validity(Days),Period Of Work(Days),Location,Pincode,Pre Bid Meeting Place,Pre Bid Meeting Address,Pre Bid Meeting Date,Bid Opening Place,Should Allow NDA Tender,Allow Preferential Bidder,Tender Stage,Contract Date :,Contract Value :,Work Completion Period in days :,Updated By :,Updated on :,AOC document :,S.No,Bid Number,Bidder Name,Awarded Currency,Awarded Value,S.No.1,Bid Number.1,Bidder Name.1,Submitted Date,Status,Remarks,Status Updated On,Type :,Summary :,Updated By :.1,Updated On :,Document :,BOQ Comparative Chart :,Committee Chairperson/Co-ordinator Name :,Committee Chairperson/Co-ordinator Type :,Committee Members :,Updated By :.2,Updated on :.1,Document :.1,Organisation Chain :,Tender ID :,Tender Ref No :,Tender Title :,Committee Chairperson/Co-ordinator Name :.1,Committee Chairperson/Co-ordinator Type :.1,Committee Members :.1,Updated By :.3,Updated On :.1,Document :.2,Tender Stage
CE RW I||RWCIRCLE-SAMBALPUR||RWDIVISION-BARGARH,Online Tender-BGH-24,2024_CERWI_101763_17,Yes,Open Tender,Percentage,Works,1.0,No,No,Online,No,No,No,1.0,Fee/PreQual/Technical/Finance,.pdf,"Tender Cost, EMD, RC,PAN, GSTIN, Affidavit, No Relation, Others doc as per DTCN",26-Feb-2024 03:00 PM,07-Mar-2024 11:00 AM,26-Feb-2024 03:00 PM,06-Mar-2024 05:00 PM,26-Feb-2024 03:00 PM ,06-Mar-2024 04:00 PM ,26-Feb-2024 03:00 PM,06-Mar-2024 05:00 PM,"38,240",Yes,percentage,1.0%,Nil,Nil,1.0,ICICI BANK,"6,000",0.0,Nil,Nil,No,Executive Engineer Rural Works Division Bargarh,Executive Engineer Rural Works Division Bargarh,Construction of Sub-Centre Building at Gudesira for 2023-24.,Building Works,Please refer Tender documents. ,NA ,"38,24,000",Civil Works - Buildings,NA ,Tender,90.0,180.0,Bargarh,768028.0,NA ,NA ,NA ,Rural Works Division Bargarh,No ,No,AOC,21-Oct-2024,"INR 3,250,976",180.0,Sanjay Kumar Mishra,21-Oct-2024 06:20 PM,Gudesira.pdf (527.00 KB),1.0,2470279.0,KSHIRODRA SAHU,INR,"3,250,976",1,2469132,JAGABANDHU DASH,05-Mar-2024 12:00 PM,Rejected-AOC,Unsuccessful bidder in lottery process,21-Oct-2024 06:20 PM,Finance,OK,Debika Pradhan,07-Mar-2024 05:16 PM,,BOQ Comparative Chart,EXECUTIVE ENGINEER,Internal,"EE,DAO,AEE ESTIMATOR,AE ESTIMATOR",Sanjay Kumar Mishra,21-Oct-2024 06:07 PM,finsummary_496332.pdf (181.29 KB),CE RW I||RWCIRCLE-SAMBALPUR||RWDIVISION-BARGARH,2024_CERWI_101763_17,Online Tender-BGH-24,Construction of Sub-Centre Building at Gudesira for 2023-24.,EXECUTIVE ENGINEER,Internal,"EE,DAO,AEE ESTIMATOR,AE ESTIMATOR",Sanjay Kumar Mishra,21-Oct-2024 06:03 PM,techsummary_496332.pdf (181.29 KB),AOC
,,,,,,,,,,,,,,,,.xls,Bill of Quantity,,,,,,,,,,,,,,,2.0,ICICI NEFT/RTGS,,,,,,,,,,,,,,,,,,,,,,,,,,AOC,,,,,,,,,,,,2,2470327,KAMAL LOCHAN NAIK,06-Mar-2024 01:31 PM,Rejected-Technical,Provisional Submitted registration certificate,21-Oct-2024 06:03 PM,,,,,,,,,,,,,,,,,,,,,,,AOC
,,,,,,,,,,,,,,,,,,,,,,,,,,,,,,,,,,,,,,,,,,,,,,,,,,,,,,,,,,,AOC,,,,,,,,,,,,3,2470279,KSHIRODRA SAHU,06-Mar-2024 12:47 PM,Accepted-AOC,Successful bidder in lottery process,21-Oct-2024 06:20 PM,,,,,,,,,,,,,,,,,,,,,,,AOC
,,,,,,,,,,,,,,,,,,,,,,,,,,,,,,,,,,,,,,,,,,,,,,,,,,,,,,,,,,,AOC,,,,,,,,,,,,4,2470497,M/s SGSM Construction,06-Mar-2024 04:35 PM,Rejected-AOC,Unsuccessful bidder in lottery process,21-Oct-2024 06:20 PM,,,,,,,,,,,,,,,,,,,,,,,AOC
,,,,,,,,,,,,,,,,,,,,,,,,,,,,,,,,,,,,,,,,,,,,,,,,,,,,,,,,,,,AOC,,,,,,,,,,,,5,2470237,Padma Lochan Ratha,06-Mar-2024 12:31 PM,Rejected-AOC,Unsuccessful bidder in lottery process,21-Oct-2024 06:20 PM,,,,,,,,,,,,,,,,,,,,,,,AOC
