Organisation Chain,Tender Reference Number,Tender ID,Withdrawal Allowed,Tender Type,Form of contract,Tender Category,No. of Covers,General Technical Evaluation Allowed,ItemWise Technical Evaluation Allowed,Payment Mode,Is Multi Currency Allowed For BOQ,Is Multi Currency Allowed For Fee,Allow Two Stage Bidding,Cover No,Cover,Document Type,Description,Publish Date,Bid Opening Date,Document Download / Sale Start Date,Document Download / Sale End Date,Clarification Start Date,Clarification End Date,Bid Submission Start Date,Bid Submission End Date,Financial Bid Opening Date,EMD Amount in ₹,EMD Exemption Allowed,EMD Fee Type,EMD Percentage,EMD Payable To,EMD Payable At,S.No,Bank Name,Tender Fee in ₹,VAT Charges in ₹,Fee Payable To,Fee Payable At,Tender Fee Exemption Allowed,Name,Address,Title,Work Description,Pre Qualification Details,Independent External Monitor/Remarks,Tender Value in ₹,Product Category,Sub category,Contract Type,Bid Validity(Days),Period Of Work(Days),Location,Pincode,Pre Bid Meeting Place,Pre Bid Meeting Address,Pre Bid Meeting Date,Bid Opening Place,Should Allow NDA Tender,Allow Preferential Bidder,Tender Stage,Contract Date :,Contract Value :,Work Completion Period in days :,Updated By :,Updated on :,AOC document :,S.No,Bid Number,Bidder Name,Awarded Currency,Awarded Value,S.No.1,Bid Number.1,Bidder Name.1,Submitted Date,Status,Remarks,Status Updated On,Type :,Summary :,Updated By :.1,Updated On :,Document :,BOQ Comparative Chart :,Committee Chairperson/Co-ordinator Name :,Committee Chairperson/Co-ordinator Type :,Committee Members :,Updated By :.2,Updated on :.1,Document :.1,Organisation Chain :,Tender ID :,Tender Ref No :,Tender Title :,Type :.1,Summary :.1,Updated By :.3,Updated On :.1,Document :.2,Committee Chairperson/Co-ordinator Name :.1,Committee Chairperson/Co-ordinator Type :.1,Committee Members :.1,Updated By :.4,Updated On :.2,Financial Bid Opening Date:,Document :.3,Tender Stage
CE RW I||RWCIRCLE-BARIPADA,Road Online N.C.B. No-352,2024_CERWI_102813_1,Yes,National Competitive Bid,Percentage,Works,2.0,No,No,Online,No,No,No,1.0,Fee/PreQual/Technical,.pdf,"Paper cost, RC, PAN, GSTIN and EMD etc as per DTCN",18-Mar-2024 06:00 PM,04-Apr-2024 11:00 AM,18-Mar-2024 06:00 PM,03-Apr-2024 05:00 PM,18-Mar-2024 06:00 PM ,02-Apr-2024 05:00 PM ,18-Mar-2024 06:00 PM,03-Apr-2024 05:00 PM,12-Jun-2024 12:00 PM,"3,38,630",Yes,percentage,1.0%,Nil,Nil,1.0,ICICI BANK,"10,000",0.0,Nil,Nil,No,CCE RWC Baripada,CCE RWC Baripada,"Construction of Road Kathruma to Patharghara via Bijabani Srichandanpur, Digisinj road under SACI (Special Assistance to States for Capital Investment) in the District of Mayurbhanj for the Year 2023-24.","Construction of Road Kathruma to Patharghara via Bijabani Srichandanpur, Digisinj road under SACI (Special Assistance to States for Capital Investment) in the District of Mayurbhanj for the Year 2023-24.",Please refer Tender documents. ,NA ,"3,38,63,000",Civil Works - Roads,NA ,Tender,90.0,273.0,"SE RW Division, Baripada",757105.0,NA ,NA ,NA ,CCE RWC Baripada,No ,No,AOC,05-Oct-2024,"INR 28,786,648",273.0,Ashwani Pradhan,05-Oct-2024 12:39 PM,kathruma.pdf (1873.00 KB),1.0,2489567.0,KRUSHNA KUMAR KHANDELWAL,INR,"28,786,648",1,2489567,KRUSHNA KUMAR KHANDELWAL,03-Apr-2024 02:45 PM,Accepted-AOC,L1,05-Oct-2024 12:40 PM,Finance,04 nos of bidder admitted,Ashwani Pradhan,05-Oct-2024 12:32 PM,,BOQ Comparative Chart,CCE RWC Baripada,Internal,,Ashwani Pradhan,05-Oct-2024 12:36 PM,finsummary_500318.pdf (438.57 KB),CE RW I||RWCIRCLE-BARIPADA,2024_CERWI_102813_1,Road Online N.C.B. No-352,"Construction of Road Kathruma to Patharghara via Bijabani Srichandanpur, Digisinj road under SACI (Special Assistance to States for Capital Investment) in the District of Mayurbhanj for the Year 2023-24.",Technical,05 Nos of bidders participated,Ashwani Pradhan,07-Jun-2024 12:28 PM,,CCE RWC Baripada,Internal,,Ashwani Pradhan,07-Jun-2024 12:32 PM,12-Jun-2024 12:00 PM,techsummary_500318.pdf (304.98 KB),AOC
,,,,,,,,,,,,,,,,.pdf,"ATO, similar nature of work experience etc as per DTCN",,,,,,,,,,,,,,,,2.0,ICICI NEFT/RTGS,,,,,,,,,,,,,,,,,,,,,,,,,,AOC,,,,,,,,,,,,2,2481202,MAYADHAR RATH,01-Apr-2024 12:50 PM,Rejected-AOC,L1,05-Oct-2024 12:40 PM,,,,,,,,,,,,,,,,,,,,,,,,,,,,,AOC
,,,,,,,,,,,,,,,,.pdf,"Machineries, Affidavit etc as per DTCN",,,,,,,,,,,,,,,,,,,,,,,,,,,,,,,,,,,,,,,,,,,AOC,,,,,,,,,,,,3,2484830,M/S SAHU CONSTRUCTION,01-Apr-2024 10:52 AM,Rejected-Technical,Declaration for HMP with in 60 KM not furnished,07-Jun-2024 12:32 PM,,,,,,,,,,,,,,,,,,,,,,,,,,,,,AOC
,,,,,,,,,,,,,,2.0,Finance,.xls,Bill of Quantity,,,,,,,,,,,,,,,,,,,,,,,,,,,,,,,,,,,,,,,,,,,AOC,,,,,,,,,,,,4,2489508,SRI MANOJ KUMAR ROUT,02-Apr-2024 08:25 PM,Rejected-AOC,L1,05-Oct-2024 12:40 PM,,,,,,,,,,,,,,,,,,,,,,,,,,,,,AOC
,,,,,,,,,,,,,,,,,,,,,,,,,,,,,,,,,,,,,,,,,,,,,,,,,,,,,,,,,,,,AOC,,,,,,,,,,,,5,2489559,SUMAN KUMAR SAHU,03-Apr-2024 10:21 AM,Rejected-AOC,L1,05-Oct-2024 12:40 PM,,,,,,,,,,,,,,,,,,,,,,,,,,,,,AOC
