Organisation Chain,Tender Reference Number,Tender ID,Withdrawal Allowed,Tender Type,Form of contract,Tender Category,No. of Covers,General Technical Evaluation Allowed,ItemWise Technical Evaluation Allowed,Payment Mode,Is Multi Currency Allowed For BOQ,Is Multi Currency Allowed For Fee,Allow Two Stage Bidding,Cover No,Cover,Document Type,Description,Publish Date,Bid Opening Date,Document Download / Sale Start Date,Document Download / Sale End Date,Clarification Start Date,Clarification End Date,Bid Submission Start Date,Bid Submission End Date,Financial Bid Opening Date,EMD Amount in ₹,EMD Exemption Allowed,EMD Fee Type,EMD Percentage,EMD Payable To,EMD Payable At,S.No,Corrigendum Title,Corrigendum Type,View,S.No.1,Bank Name,Tender Fee in ₹,VAT Charges in ₹,Fee Payable To,Fee Payable At,Tender Fee Exemption Allowed,Name,Address,Title,Work Description,Pre Qualification Details,Independent External Monitor/Remarks,Tender Value in ₹,Product Category,Sub category,Contract Type,Bid Validity(Days),Period Of Work(Days),Location,Pincode,Pre Bid Meeting Place,Pre Bid Meeting Address,Pre Bid Meeting Date,Bid Opening Place,Should Allow NDA Tender,Allow Preferential Bidder,Tender Stage,Contract Date :,Contract Value :,Work Completion Period in days :,Updated By :,Updated on :,AOC document :,S.No,Bid Number,Bidder Name,Awarded Currency,Awarded Value,S.No.1,Bid Number.1,Bidder Name.1,Submitted Date,Status,Remarks,Status Updated On,Type :,Summary :,Updated By :.1,Updated On :,Document :,BOQ Comparative Chart :,Committee Chairperson/Co-ordinator Name :,Committee Chairperson/Co-ordinator Type :,Committee Members :,Updated By :.2,Updated on :.1,Document :.1,Organisation Chain :,Tender ID :,Tender Ref No :,Tender Title :,Type :.1,Summary :.1,Updated By :.3,Updated On :.1,Document :.2,Committee Chairperson/Co-ordinator Name :.1,Committee Chairperson/Co-ordinator Type :.1,Committee Members :.1,Updated By :.4,Updated On :.2,Financial Bid Opening Date:,Document :.3,Tender Stage
CE RW I||RWCIRCLE-BARIPADA,Road Online N.C.B. No-353,2024_CERWI_102829_2,Yes,National Competitive Bid,Percentage,Works,2.0,No,No,Online,No,No,No,1.0,Fee/PreQual/Technical,.pdf,"Paper cost, RC, PAN, GSTIN and EMD etc as per DTCN",19-Mar-2024 12:30 PM,04-Apr-2024 11:00 AM,19-Mar-2024 12:30 PM,03-Apr-2024 05:00 PM,19-Mar-2024 12:30 PM ,02-Apr-2024 05:00 PM ,19-Mar-2024 12:30 PM,03-Apr-2024 05:00 PM,12-Jun-2024 12:00 PM,"9,91,920",Yes,percentage,1.0%,Nil,Nil,1.0,Nomenclature of the Work changed,Other,,1.0,ICICI BANK,"10,000",0.0,Nil,Nil,No,CCE RWC Baripada,CCE RWC Baripada,Improvement to Bishipur approach road in the District of Mayurbhanj for the year 2023-24 under Improvement to Existing RD Road.,Improvement to Bishipur approach road in the District of Mayurbhanj for the year 2023-24 under Improvement to Existing RD Road.,Please refer Tender documents. ,NA ,"9,91,92,000",Civil Works - Roads,NA ,Tender,90.0,333.0,SERWDKARANJIA,757037.0,NA ,NA ,NA ,CCE RWC Baripada,No ,No,AOC,17-Oct-2024,"INR 84,322,456",333.0,Ashwani Pradhan,17-Oct-2024 11:36 AM,Bishipur-Approach.pdf (858.00 KB),1.0,2488368.0,Basanta Kumar Paibarty,INR,"84,322,456",1,2488368,Basanta Kumar Paibarty,02-Apr-2024 10:13 PM,Accepted-AOC,L1,17-Oct-2024 11:36 AM,Finance,05 Nos of bidders admitted,Ashwani Pradhan,17-Oct-2024 11:24 AM,,BOQ Comparative Chart,CCE RWC Baripada,Internal,,Ashwani Pradhan,17-Oct-2024 11:30 AM,finsummary_500367.pdf (441.09 KB),CE RW I||RWCIRCLE-BARIPADA,2024_CERWI_102829_2,Road Online N.C.B. No-353,Improvement to Bishipur approach road in the District of Mayurbhanj for the year 2023-24 under Improvement to Existing RD Road.,Technical,05 Nos of bidders participated,Ashwani Pradhan,07-Jun-2024 12:17 PM,,CCE RWC Baripada,Internal,,Ashwani Pradhan,07-Jun-2024 12:23 PM,12-Jun-2024 12:00 PM,techsummary_500367.pdf (291.59 KB),AOC
,,,,,,,,,,,,,,,,.pdf,"ATO, similar nature of work experience etc as per DTCN",,,,,,,,,,,,,,,,,,,,2.0,ICICI NEFT/RTGS,,,,,,,,,,,,,,,,,,,,,,,,,,AOC,,,,,,,,,,,,2,2489647,MANOJ KUMAR MOHANTY,03-Apr-2024 12:54 PM,Rejected-AOC,L4,17-Oct-2024 11:36 AM,,,,,,,,,,,,,,,,,,,,,,,,,,,,,AOC
,,,,,,,,,,,,,,,,.pdf,"Machineries, Affidavit etc as per DTCN",,,,,,,,,,,,,,,,,,,,,,,,,,,,,,,,,,,,,,,,,,,,,,,AOC,,,,,,,,,,,,3,2489599,PRADIPTA KUMAR RAY,03-Apr-2024 12:10 PM,Rejected-AOC,L3,17-Oct-2024 11:36 AM,,,,,,,,,,,,,,,,,,,,,,,,,,,,,AOC
,,,,,,,,,,,,,,2.0,Finance,.xls,Bill of Quantity,,,,,,,,,,,,,,,,,,,,,,,,,,,,,,,,,,,,,,,,,,,,,,,AOC,,,,,,,,,,,,4,2488946,SRI LINGARAJ PADHI,03-Apr-2024 03:51 PM,Rejected-AOC,L2,17-Oct-2024 11:36 AM,,,,,,,,,,,,,,,,,,,,,,,,,,,,,AOC
,,,,,,,,,,,,,,,,,,,,,,,,,,,,,,,,,,,,,,,,,,,,,,,,,,,,,,,,,,,,,,,,AOC,,,,,,,,,,,,5,2489137,TARUN MOHANTY,03-Apr-2024 04:56 PM,Rejected-AOC,L5,17-Oct-2024 11:36 AM,,,,,,,,,,,,,,,,,,,,,,,,,,,,,AOC
