Organisation Chain,Tender Reference Number,Tender ID,Withdrawal Allowed,Tender Type,Form of contract,Tender Category,No. of Covers,General Technical Evaluation Allowed,ItemWise Technical Evaluation Allowed,Payment Mode,Is Multi Currency Allowed For BOQ,Is Multi Currency Allowed For Fee,Allow Two Stage Bidding,Cover No,Cover,Document Type,Description,Publish Date,Bid Opening Date,Document Download / Sale Start Date,Document Download / Sale End Date,Clarification Start Date,Clarification End Date,Bid Submission Start Date,Bid Submission End Date,Financial Bid Opening Date,EMD Amount in ₹,EMD Exemption Allowed,EMD Fee Type,EMD Percentage,EMD Payable To,EMD Payable At,S.No,Bank Name,Tender Fee in ₹,Fee Payable To,Fee Payable At,Tender Fee Exemption Allowed,Name,Address,Title,Work Description,Pre Qualification Details,Independent External Monitor/Remarks,Tender Value in ₹,Product Category,Sub category,Contract Type,Bid Validity(Days),Period Of Work(Days),Location,Pincode,Pre Bid Meeting Place,Pre Bid Meeting Address,Pre Bid Meeting Date,Bid Opening Place,Should Allow NDA Tender,Allow Preferential Bidder,Tender Stage,Contract Date :,Contract Value :,Work Completion Period in days :,Updated By :,Updated on :,AOC document :,AOC Description :,S.No,Bid Number,Bidder Name,Awarded Currency,Awarded Value,S.No.1,Bid Number.1,Bidder Name.1,Submitted Date,Status,Remarks,Status Updated On,Type :,Summary :,Updated By :.1,Updated On :,Document :,BOQ Comparative Chart :,Committee Chairperson/Co-ordinator Name :,Committee Chairperson/Co-ordinator Type :,Committee Members :,Updated By :.2,Updated on :.1,Document :.1,Organisation Chain :,Tender ID :,Tender Ref No :,Tender Title :,Type :.1,Summary :.1,Updated By :.3,Updated On :.1,Document :.2,Committee Chairperson/Co-ordinator Name :.1,Committee Chairperson/Co-ordinator Type :.1,Committee Members :.1,Updated By :.4,Updated On :.2,Financial Bid Opening Date:,Document :.3,Tender Stage
Odisha State Agricultural Marketing Board||RMC Mukhiguda,001/RMC MUKHIGUDA/24-25,2024_OSAMB_103665_1,Yes,Open Tender,Percentage,Works,2.0,No,No,Online,No,No,No,1.0,Fee/PreQual/Technical,.pdf,AS PER DETAILS TENDER CALL NOTICE,18-Jul-2024 11:00 AM,02-Aug-2024 11:00 AM,18-Jul-2024 11:00 AM,01-Aug-2024 05:00 PM,18-Jul-2024 11:00 AM ,25-Jul-2024 05:00 PM ,18-Jul-2024 11:00 AM,01-Aug-2024 05:00 PM,09-Aug-2024 11:30 AM,"3,62,562",Yes,percentage,1.0%,Nil,Nil,1.0,ICICI BANK,"10,000",Nil,Nil,Yes,"SUB-COLLECTOR,DHARAMGARH",DHARAMGARH,Construction of Infrastructures and Developmental Works at Pandigaon and Kotagaon Market Yards under HI RMC Mukhigudada,Construction of Infrastructures and Developmental Works at Pandigaon and Kotagaon Market Yards under HI RMC Mukhigudada,Please refer Tender documents. ,NA ,"3,62,56,170",Civil Works - Others,NA ,Rate Contract,90.0,270.0,pandigaon-kotagaon,766013.0,NA ,NA ,NA ,MUKHIGUDA HIRMC,No ,No,AOC,31-Oct-2024,"INR 30,821,370.12",270.0,Dhiman Chakma,31-Oct-2024 12:07 PM,Work_Order.pdf (538.00 KB),AS Transparency lottery System,1.0,2522125.0,D. K. Engineering and Construction,INR,"30,821,370.12",1,2522125,D. K. Engineering and Construction,01-Aug-2024 03:53 PM,Accepted-AOC,As per Transparency lottery system,31-Oct-2024 12:08 PM,Finance,OK,Dhiman Chakma,09-Aug-2024 03:17 PM,,BOQ Comparative Chart,chairman,Internal,"Secretary, Accountant, JE, AE",Dhiman Chakma,31-Oct-2024 12:03 PM,finsummary_503037.pdf (538.12 KB),Odisha State Agricultural Marketing Board||RMC Mukhiguda,2024_OSAMB_103665_1,001/RMC MUKHIGUDA/24-25,Construction of Infrastructures and Developmental Works at Pandigaon and Kotagaon Market Yards under HI RMC Mukhigudada,Technical,OK,ABAKASH BEHERA,07-Aug-2024 06:26 PM,,Chirman,Internal,"Secretary, JE, AE,Accountant",ABAKASH BEHERA,07-Aug-2024 06:34 PM,09-Aug-2024 11:30 AM,techsummary_503037.pdf (647.81 KB),AOC
,,,,,,,,,,,,,,2.0,Finance,.xls,BOQ,,,,,,,,,,,,,,,,2.0,ICICI NEFT/RTGS,,,,,,,,,,,,,,,,,,,,,,,,,AOC,,,,,,,,,,,,,2,2521927,MANOJ KUMAR MOHANTY,31-Jul-2024 05:33 PM,Rejected-AOC,As per Transparency lottery system,31-Oct-2024 12:08 PM,,,,,,,,,,,,,,,,,,,,,,,,,,,,,AOC
,,,,,,,,,,,,,,,,,,,,,,,,,,,,,,,,,,,,,,,,,,,,,,,,,,,,,,,,,,,AOC,,,,,,,,,,,,,3,2522306,M/S HEMANTA KUMAR SHARMA,01-Aug-2024 04:53 PM,Rejected-AOC,As per Transparency lottery system,31-Oct-2024 12:08 PM,,,,,,,,,,,,,,,,,,,,,,,,,,,,,AOC
,,,,,,,,,,,,,,,,,,,,,,,,,,,,,,,,,,,,,,,,,,,,,,,,,,,,,,,,,,,AOC,,,,,,,,,,,,,4,2522219,Nikhil Agrawal,01-Aug-2024 04:04 PM,Rejected-Technical,Required Experience Certificate not submitted,07-Aug-2024 06:34 PM,,,,,,,,,,,,,,,,,,,,,,,,,,,,,AOC
,,,,,,,,,,,,,,,,,,,,,,,,,,,,,,,,,,,,,,,,,,,,,,,,,,,,,,,,,,,AOC,,,,,,,,,,,,,5,2521974,SRI ANNAN KUMAR VERMA,31-Jul-2024 06:42 PM,Rejected-Technical,Required Experience Certificate not submitted,07-Aug-2024 06:34 PM,,,,,,,,,,,,,,,,,,,,,,,,,,,,,AOC
