Organisation Chain,Tender Reference Number,Tender ID,Withdrawal Allowed,Tender Type,Form of contract,Tender Category,No. of Covers,General Technical Evaluation Allowed,ItemWise Technical Evaluation Allowed,Payment Mode,Is Multi Currency Allowed For BOQ,Is Multi Currency Allowed For Fee,Allow Two Stage Bidding,Cover No,Cover,Document Type,Description,Publish Date,Bid Opening Date,Document Download / Sale Start Date,Document Download / Sale End Date,Clarification Start Date,Clarification End Date,Bid Submission Start Date,Bid Submission End Date,EMD Amount in ₹,EMD Exemption Allowed,EMD Fee Type,EMD Percentage,EMD Payable To,EMD Payable At,S.No,Corrigendum Title,Corrigendum Type,View,S.No.1,Bank Name,Tender Fee in ₹,VAT Charges in ₹,Fee Payable To,Fee Payable At,Tender Fee Exemption Allowed,Name,Address,Title,Work Description,Pre Qualification Details,Independent External Monitor/Remarks,Tender Value in ₹,Product Category,Sub category,Contract Type,Bid Validity(Days),Period Of Work(Days),Location,Pincode,Pre Bid Meeting Place,Pre Bid Meeting Address,Pre Bid Meeting Date,Bid Opening Place,Should Allow NDA Tender,Allow Preferential Bidder,Tender Stage,Contract Date :,Contract Value :,Work Completion Period in days :,Updated By :,Updated on :,AOC document :,AOC Description :,S.No,Bid Number,Bidder Name,Awarded Currency,Awarded Value,S.No.1,Bid Number.1,Bidder Name.1,Submitted Date,Status,Remarks,Status Updated On,Type :,Summary :,Updated By :.1,Updated On :,Document :,BOQ Comparative Chart :,Committee Chairperson/Co-ordinator Name :,Committee Chairperson/Co-ordinator Type :,Committee Members :,Updated By :.2,Updated on :.1,Document :.1,Organisation Chain :,Tender ID :,Tender Ref No :,Tender Title :,Committee Chairperson/Co-ordinator Name :.1,Committee Chairperson/Co-ordinator Type :.1,Committee Members :.1,Updated By :.3,Updated On :.1,Document :.2,Tender Stage
EIC-CIVIL||SERNB-CIRCLE-CUTTACK||EERNB-DIVN-CUTTACK,SE CTC (RandB)-70 of 2023-24,2024_EICCL_102637_2,Yes,National Competitive Bid,Percentage,Works,1.0,No,No,Online,No,No,No,1.0,Fee/PreQual/Technical/Finance,.pdf,"Regd Certificate, GSTIN, PAN, Affidavit, Undertaking and other mandatory documents as per DTCN",15-Mar-2024 03:00 PM,22-May-2024 11:00 AM,15-Mar-2024 03:00 PM,27-Mar-2024 05:00 PM,NA ,NA ,15-Mar-2024 03:00 PM,27-Mar-2024 05:00 PM,"35,300",Yes,fixed,,Nil,Nil,1.0,Corregindum_extension date,Date,,1.0,ICICI BANK,"6,000",0.0,Nil,Nil,No,"S.E. Cuttack (RandB) Division No.I, Cuttack","O/O S.E. Cuttack (RandB) Division No.I, Cuttack","Fire Fighting and Alarm System at Pathology MicroBiology (G Plus 3) Building, SCBMCH, Cuttack",Fire Fighting work,As per DTCN ,NA ,"35,25,313",Fire & Safety,NA ,Tender,90.0,90.0,Cuttack,753001.0,NA ,NA ,NA ,"O/O S.E. Cuttack (RandB) Division No.I, Cuttack",No ,No,AOC,15-Oct-2024,"INR 2,996,869",90.0,Pravas Kumar Majhi,15-Oct-2024 02:15 PM,102637_2_A.pdf (660.00 KB),The agency has been finalised on transparent lottery system and the date of commencement may be treated as 07.06.2024 to complete the work by 06.09.2024 in all respect,1.0,2487481.0,TRANSTECH SOLUTION,INR,"2,996,869",1,2486279,DISCERN ENGINEERING PRIVATE LIMITED,26-Mar-2024 07:19 PM,Rejected-AOC,Rejected,15-Oct-2024 02:15 PM,Finance,6nos bids received,Pravas Kumar Majhi,22-May-2024 01:43 PM,,BOQ Comparative Chart,Er Pravash Kumar Majhi,Internal,Er Madhusmita Sahoo JE Estr Er Subhashree Subhasmita Das Mohapatra AEE Estr Mr Abadhut Das Sr DAO,Pravas Kumar Majhi,15-Oct-2024 02:12 PM,finsummary_499998.pdf (1493.35 KB),EIC-CIVIL||SERNB-CIRCLE-CUTTACK||EERNB-DIVN-CUTTACK,2024_EICCL_102637_2,SE CTC (RandB)-70 of 2023-24,"Fire Fighting and Alarm System at Pathology MicroBiology (G Plus 3) Building, SCBMCH, Cuttack",Er Pravash Kumar Majhi SE,Internal,Er Madhusmita Sahoo JE Estr Er Subhashree Subhasmita Das Mohapatra AEE Estr Mr Abadhut Das Sr DAO,Pravas Kumar Majhi,30-May-2024 07:18 PM,techsummary_499998.pdf (662.12 KB),AOC
,,,,,,,,,,,,,,,,.xls,Bill of Quantities,,,,,,,,,,,,,,,,,,,2.0,ICICI NEFT/RTGS,,,,,,,,,,,,,,,,,,,,,,,,,,AOC,,,,,,,,,,,,,2,2486298,EQUIPMENT SALES AND SERVICES PVT LTD,26-Mar-2024 07:48 PM,Rejected-AOC,Rejected,15-Oct-2024 02:15 PM,,,,,,,,,,,,,,,,,,,,,,,AOC
,,,,,,,,,,,,,,,,,,,,,,,,,,,,,,,,,,,,,,,,,,,,,,,,,,,,,,,,,,,,,,,AOC,,,,,,,,,,,,,3,2484813,M/S FIRESTOP SALES AND SERVICES,23-Mar-2024 01:55 PM,Rejected-AOC,Rejected,15-Oct-2024 02:15 PM,,,,,,,,,,,,,,,,,,,,,,,AOC
,,,,,,,,,,,,,,,,,,,,,,,,,,,,,,,,,,,,,,,,,,,,,,,,,,,,,,,,,,,,,,,AOC,,,,,,,,,,,,,4,2485766,M/S JAGANNATH FIRE SERVICES,25-Mar-2024 05:14 PM,Rejected-AOC,Rejected,15-Oct-2024 02:15 PM,,,,,,,,,,,,,,,,,,,,,,,AOC
,,,,,,,,,,,,,,,,,,,,,,,,,,,,,,,,,,,,,,,,,,,,,,,,,,,,,,,,,,,,,,,AOC,,,,,,,,,,,,,5,2487018,M/S MS FIRE SERVICE,27-Mar-2024 01:50 PM,Rejected-Technical,Disqualified due to non fulfillment the critrias as per DTCN clause No.2.1_i and 2_ii page No.7,30-May-2024 07:18 PM,,,,,,,,,,,,,,,,,,,,,,,AOC
,,,,,,,,,,,,,,,,,,,,,,,,,,,,,,,,,,,,,,,,,,,,,,,,,,,,,,,,,,,,,,,AOC,,,,,,,,,,,,,6,2487481,TRANSTECH SOLUTION,27-Mar-2024 04:43 PM,Accepted-AOC,Accepted,15-Oct-2024 02:15 PM,,,,,,,,,,,,,,,,,,,,,,,AOC
