Organisation Chain,Tender Reference Number,Tender ID,Withdrawal Allowed,Tender Type,Form of contract,Tender Category,No. of Covers,General Technical Evaluation Allowed,ItemWise Technical Evaluation Allowed,Payment Mode,Is Multi Currency Allowed For BOQ,Is Multi Currency Allowed For Fee,Allow Two Stage Bidding,Cover No,Cover,Document Type,Description,Publish Date,Bid Opening Date,Document Download / Sale Start Date,Document Download / Sale End Date,Clarification Start Date,Clarification End Date,Bid Submission Start Date,Bid Submission End Date,EMD Amount in ₹,EMD Exemption Allowed,EMD Fee Type,EMD Percentage,EMD Payable To,EMD Payable At,S.No,Bank Name,Tender Fee in ₹,VAT Charges in ₹,Fee Payable To,Fee Payable At,Tender Fee Exemption Allowed,Name,Address,Title,Work Description,Pre Qualification Details,Independent External Monitor/Remarks,Tender Value in ₹,Product Category,Sub category,Contract Type,Bid Validity(Days),Period Of Work(Days),Location,Pincode,Pre Bid Meeting Place,Pre Bid Meeting Address,Pre Bid Meeting Date,Bid Opening Place,Should Allow NDA Tender,Allow Preferential Bidder,Tender Stage,Contract Date :,Contract Value :,Work Completion Period in days :,Updated By :,Updated on :,AOC document :,AOC Description :,S.No,Bid Number,Bidder Name,Awarded Currency,Awarded Value,S.No.1,Bid Number.1,Bidder Name.1,Submitted Date,Status,Remarks,Status Updated On,Type :,Summary :,Updated By :.1,Updated On :,Document :,BOQ Comparative Chart :,Committee Chairperson/Co-ordinator Name :,Committee Chairperson/Co-ordinator Type :,Committee Members :,Updated By :.2,Updated on :.1,Document :.1,Organisation Chain :,Tender ID :,Tender Ref No :,Tender Title :,Committee Chairperson/Co-ordinator Name :.1,Committee Chairperson/Co-ordinator Type :.1,Committee Members :.1,Updated By :.3,Updated On :.1,Document :.2,Tender Stage
"CE,Minor Irrigation,BBSR||SENMIC-SAMBALPUR||PADAMPUR",SE-MID-PDP- 09/2023-24,2024_CEMIB_100361_4,Yes,Open Tender,Percentage,Works,1.0,No,No,Online,No,No,No,1.0,Fee/PreQual/Technical/Finance,.xls,BOQ,02-Feb-2024 10:00 AM,13-Feb-2024 10:00 AM,02-Feb-2024 10:00 AM,12-Feb-2024 05:00 PM,02-Feb-2024 10:00 AM ,12-Feb-2024 05:00 PM ,02-Feb-2024 10:00 AM,12-Feb-2024 05:00 PM,"2,980",Yes,fixed,,Nil,Nil,1.0,ICICI BANK,"2,000",0.0,Nil,Nil,No,"Superintending Engineer.M.I.Division,Padamp","O/O The Superintending Engineer.M.I.Division,Padampur.",Improvement to Godendarha Check Dam near village Kermeli of Chantipali G.P Gaisilet Block of Bargarh District Under Imp to Check Dam Scheme for the year of 2023-24.,Improvement to Godendarha Check Dam near village Kermeli of Chantipali G.P Gaisilet Block of Bargarh District Under Imp to Check Dam Scheme for the year of 2023-24.,Please Reference Tender Documents. ,NA ,"2,97,833",Civil Works - Water Works,NA ,Tender,90.0,30.0,G,768037.0,NA ,NA ,NA ,"O/O The Superintending Engineer.M.I.Division,Padam",No ,No,AOC,03-Oct-2024,"INR 253,188.29",30.0,Sandip Mohanty,03-Oct-2024 05:32 PM,4.pdf (1168.00 KB),AOC,1.0,2434739.0,DUSHMANTA PADHAN,INR,"253,188.29",1,2436177,chakradhar mishra,12-Feb-2024 03:15 PM,Not Admitted-Fee/PreQual/Technical/Finance,Not qualified for AOC,17-Feb-2024 05:27 PM,Finance,Only 4 bidders were found and accepted.,HEMANTA MARANDI,17-Feb-2024 05:27 PM,finance_488536.pdf,BOQ Comparative Chart,SKMOHANTY,Internal,"SKMOHANTY.A.MISHRA.H.MARANDI,SKBEHERA",Sandip Mohanty,19-Jul-2024 01:36 PM,finsummary_488536.pdf (71.43 KB),"CE,Minor Irrigation,BBSR||SENMIC-SAMBALPUR||PADAMPUR",2024_CEMIB_100361_4,SE-MID-PDP- 09/2023-24,Improvement to Godendarha Check Dam near village Kermeli of Chantipali G.P Gaisilet Block of Bargarh District Under Imp to Check Dam Scheme for the year of 2023-24.,SKMOHANTY,Internal,"SKMOHANTY.A.MISHRA.H.MARANDI,SKBEHERA",Sandip Mohanty,19-Jul-2024 11:54 AM,techsummary_488536.pdf (71.43 KB),AOC
,,,,,,,,,,,,,,,,.pdf,"Valid Licence CDMS,GSTN,affidavit,No relation, PAN,EMD ,Paper Cost, other as per DTCN.",,,,,,,,,,,,,,,2.0,ICICI NEFT/RTGS,,,,,,,,,,,,,,,,,,,,,,,,,,AOC,,,,,,,,,,,,,2,2431877,DILESWAR SAHU,10-Feb-2024 12:38 PM,Rejected-Finance,Not Qualified for Lottery.,19-Jul-2024 01:36 PM,,,,,,,,,,,,,,,,,,,,,,,AOC
,,,,,,,,,,,,,,,,,,,,,,,,,,,,,,,,,,,,,,,,,,,,,,,,,,,,,,,,,,,AOC,,,,,,,,,,,,,3,2434739,DUSHMANTA PADHAN,12-Feb-2024 11:15 AM,Accepted-AOC,ACCEPTED,03-Oct-2024 05:32 PM,,,,,,,,,,,,,,,,,,,,,,,AOC
,,,,,,,,,,,,,,,,,,,,,,,,,,,,,,,,,,,,,,,,,,,,,,,,,,,,,,,,,,,AOC,,,,,,,,,,,,,4,2433936,GUDIA RANI AGRAWAL,11-Feb-2024 08:04 PM,Rejected-Finance,Not Qualified for Lottery.,19-Jul-2024 01:36 PM,,,,,,,,,,,,,,,,,,,,,,,AOC
,,,,,,,,,,,,,,,,,,,,,,,,,,,,,,,,,,,,,,,,,,,,,,,,,,,,,,,,,,,AOC,,,,,,,,,,,,,5,2434584,SANTOSHINI DANSANA,12-Feb-2024 09:29 AM,Rejected-Finance,Not Qualified for Lottery.,19-Jul-2024 01:36 PM,,,,,,,,,,,,,,,,,,,,,,,AOC
