Organisation Chain,Tender Reference Number,Tender ID,Withdrawal Allowed,Tender Type,Form of contract,Tender Category,No. of Covers,General Technical Evaluation Allowed,ItemWise Technical Evaluation Allowed,Payment Mode,Is Multi Currency Allowed For BOQ,Is Multi Currency Allowed For Fee,Allow Two Stage Bidding,Cover No,Cover,Document Type,Description,Publish Date,Bid Opening Date,Document Download / Sale Start Date,Document Download / Sale End Date,Clarification Start Date,Clarification End Date,Bid Submission Start Date,Bid Submission End Date,Financial Bid Opening Date,EMD Amount in ₹,EMD Exemption Allowed,EMD Fee Type,EMD Percentage,EMD Payable To,EMD Payable At,S.No,Corrigendum Title,Corrigendum Type,View,S.No.1,Bank Name,Tender Fee in ₹,Fee Payable To,Fee Payable At,Tender Fee Exemption Allowed,Name,Address,Title,Work Description,Pre Qualification Details,Independent External Monitor/Remarks,Tender Value in ₹,Product Category,Sub category,Contract Type,Bid Validity(Days),Period Of Work(Days),Location,Pincode,Pre Bid Meeting Place,Pre Bid Meeting Address,Pre Bid Meeting Date,Bid Opening Place,Should Allow NDA Tender,Allow Preferential Bidder,Tender Stage,Contract Date :,Contract Value :,Work Completion Period in days :,Updated By :,Updated on :,AOC document :,AOC Description :,S.No,Bid Number,Bidder Name,Awarded Currency,Awarded Value,S.No.1,Bid Number.1,Bidder Name.1,Submitted Date,Status,Remarks,Status Updated On,Type :,Summary :,Updated By :.1,Updated On :,Document :,BOQ Comparative Chart :,Committee Chairperson/Co-ordinator Name :,Committee Chairperson/Co-ordinator Type :,Committee Members :,Updated By :.2,Updated on :.1,Document :.1,Organisation Chain :,Tender ID :,Tender Ref No :,Tender Title :,Type :.1,Summary :.1,Updated By :.3,Updated On :.1,Document :.2,Committee Chairperson/Co-ordinator Name :.1,Committee Chairperson/Co-ordinator Type :.1,Committee Members :.1,Updated By :.4,Updated On :.2,Financial Bid Opening Date:,Document :.3,Tender Stage
Panchayati Raj and Drinking Water Department Odisha||Zilla Parisad Kendrapara,ZP/ KDP-07 / 2023-24,2024_DZPKE_100117_2,Yes,Open Tender,Percentage,Works,2.0,No,No,Online,No,No,No,1.0,Fee/PreQual/Technical,.pdf,"RC, GST, PAN, Affidavit and other documents as per DTCN",25-Jan-2024 11:00 AM,09-Feb-2024 11:00 AM,25-Jan-2024 11:00 AM,08-Feb-2024 05:00 PM,25-Jan-2024 11:00 AM ,08-Feb-2024 05:00 PM ,25-Jan-2024 11:00 AM,08-Feb-2024 05:00 PM,26-Feb-2024 11:00 AM,"84,100",Yes,fixed,,Nil,Nil,1.0,Availing EMD Examination,Fee,,1.0,ICICI BANK,"10,000",Nil,Nil,No,Chief Development Officer Cum Executive Officer,Chief Development Officer Cum Executive Officer,"Upgradation to 8 nos smart Classrooms, e-Library,Science Lab, Drinking Water and Toilet Facilities of Kendrapara (Autonomous) College, Kendrapara",Building Work,Building Work ,NA ,"84,02,798",Civil Works - Buildings,NA ,Tender,90.0,120.0,Kendrapara,754211.0,NA ,NA ,NA ,Chief Development Officer Cum Executive Officer,No ,No,AOC,19-Oct-2024,"INR 7,563,358.97",120.0,Bichitra Mohan Jena,19-Oct-2024 06:52 PM,1558.pdf (1864.00 KB),Successful Qualify Bidder,1.0,2420886.0,SANJAYA KUMAR SETHY (S.C),INR,"7,563,358.97",1,2428527,AJAY KUMAR SETHI,08-Feb-2024 02:20 PM,Rejected-Finance,Did not Win the Lottery,19-Oct-2024 06:48 PM,Finance,Three Numbers of Bidder participated,Rajendra Kumar Panda,26-Feb-2024 01:55 PM,,BOQ Comparative Chart,"Chief Development officer-cum-Executive Officer, ZillaParishad, Kendrapara",Internal,"Assistant Engineer(Estimator), Junior Engineer(Estimator)",Bichitra Mohan Jena,19-Oct-2024 06:48 PM,finsummary_487501.pdf (867.89 KB),Panchayati Raj and Drinking Water Department Odisha||Zilla Parisad Kendrapara,2024_DZPKE_100117_2,ZP/ KDP-07 / 2023-24,"Upgradation to 8 nos smart Classrooms, e-Library,Science Lab, Drinking Water and Toilet Facilities of Kendrapara (Autonomous) College, Kendrapara",Technical,Five Numbers of Bidder Participated,Rajendra Kumar Panda,24-Feb-2024 01:32 PM,technical_487501.pdf,"Chief Development officer-cum-Executive Officer, ZillaParishad, Kendrapara",Internal,"Assistant Engineer(Estimator), Junior Engineer(Estimator)",Rajendra Kumar Panda,24-Feb-2024 01:47 PM,26-Feb-2024 11:00 AM,techsummary_487501.pdf (4785.89 KB),AOC
,,,,,,,,,,,,,,2.0,Finance,.xls,BOQ,,,,,,,,,,,,,,,,,,,,2.0,ICICI NEFT/RTGS,,,,,,,,,,,,,,,,,,,,,,,,,AOC,,,,,,,,,,,,,2,2429354,ANIL KUMAR SWAIN,08-Feb-2024 04:05 PM,Rejected-Technical,Not Qualified,24-Feb-2024 01:47 PM,,,,,,,,,,,,,,,,,,,,,,,,,,,,,AOC
,,,,,,,,,,,,,,,,,,,,,,,,,,,,,,,,,,,,,,,,,,,,,,,,,,,,,,,,,,,,,,,AOC,,,,,,,,,,,,,3,2428266,PRADEEPTA KUMAR MALLICK,08-Feb-2024 10:52 AM,Rejected-Technical,Not Qualified,24-Feb-2024 01:47 PM,,,,,,,,,,,,,,,,,,,,,,,,,,,,,AOC
,,,,,,,,,,,,,,,,,,,,,,,,,,,,,,,,,,,,,,,,,,,,,,,,,,,,,,,,,,,,,,,AOC,,,,,,,,,,,,,4,2420886,SANJAYA KUMAR SETHY (S.C),07-Feb-2024 01:10 PM,Accepted-AOC,Successful Qualify Bidder,19-Oct-2024 06:52 PM,,,,,,,,,,,,,,,,,,,,,,,,,,,,,AOC
,,,,,,,,,,,,,,,,,,,,,,,,,,,,,,,,,,,,,,,,,,,,,,,,,,,,,,,,,,,,,,,AOC,,,,,,,,,,,,,5,2428420,SARAT CHANDRA DASH,08-Feb-2024 03:22 PM,Rejected-Finance,Did not Win the Lottery,19-Oct-2024 06:48 PM,,,,,,,,,,,,,,,,,,,,,,,,,,,,,AOC
