Organisation Chain,Tender Reference Number,Tender ID,Withdrawal Allowed,Tender Type,Form of contract,Tender Category,No. of Covers,General Technical Evaluation Allowed,ItemWise Technical Evaluation Allowed,Payment Mode,Is Multi Currency Allowed For BOQ,Is Multi Currency Allowed For Fee,Allow Two Stage Bidding,Cover No,Cover,Document Type,Description,Publish Date,Bid Opening Date,Document Download / Sale Start Date,Document Download / Sale End Date,Clarification Start Date,Clarification End Date,Bid Submission Start Date,Bid Submission End Date,EMD Amount in ₹,EMD Exemption Allowed,EMD Fee Type,EMD Percentage,EMD Payable To,EMD Payable At,S.No,Bank Name,Tender Fee in ₹,Fee Payable To,Fee Payable At,Tender Fee Exemption Allowed,Name,Address,Title,Work Description,Pre Qualification Details,Independent External Monitor/Remarks,Tender Value in ₹,Product Category,Sub category,Contract Type,Bid Validity(Days),Period Of Work(Days),Location,Pincode,Pre Bid Meeting Place,Pre Bid Meeting Address,Pre Bid Meeting Date,Bid Opening Place,Should Allow NDA Tender,Allow Preferential Bidder,Tender Stage,Contract Date :,Contract Value :,Work Completion Period in days :,Updated By :,Updated on :,AOC document :,AOC Description :,S.No,Bid Number,Bidder Name,Awarded Currency,Awarded Value,S.No.1,Bid Number.1,Bidder Name.1,Submitted Date,Status,Remarks,Status Updated On,Type :,Summary :,Updated By :.1,Updated On :,Document :,BOQ Comparative Chart :,Committee Chairperson/Co-ordinator Name :,Committee Chairperson/Co-ordinator Type :,Committee Members :,Updated By :.2,Updated on :.1,Document :.1,Organisation Chain :,Tender ID :,Tender Ref No :,Tender Title :,Committee Chairperson/Co-ordinator Name :.1,Committee Chairperson/Co-ordinator Type :.1,Committee Members :.1,Updated By :.3,Updated On :.1,Document :.2,Tender Stage
Forest Environment and Climate Change Department||RCCF cum FD STR Baripada||DFO Baripada,DFO-BPD-01/2024-25,2024_DFOBP_104810_1,Yes,Open Tender,Percentage,Works,1.0,No,No,Online,No,No,No,1.0,Fee/PreQual/Technical/Finance,.pdf,"RC, GSTIN, PAN, AFFIDAVIT AND OTHER RELATED DOCUMENTS",13-Sep-2024 10:00 AM,24-Sep-2024 11:00 AM,13-Sep-2024 10:00 AM,23-Sep-2024 05:00 PM,13-Sep-2024 10:00 AM ,23-Sep-2024 05:00 PM ,13-Sep-2024 10:00 AM,23-Sep-2024 05:00 PM,"16,398",Yes,percentage,1.0%,Nil,Nil,1.0,ICICI BANK,"6,000",Nil,Nil,No,"Divisional Forest Officer,Baripada Forest Division","At/PO-Baripada, Dist-Mayurbhanj, Odisha, 757001",Construction of Forest Guard Quarters at Khunta Section campus in Udala Range under CAMPA APO 2024-25.,Construction of Forest Guard Quarters at Khunta Section campus in Udala Range under CAMPA APO 2024-25.,Please refer Tender documents. ,NA ,"16,39,751",Civil Works - Buildings,NA ,Tender,90.0,120.0,Khunta,757019.0,NA ,NA ,NA ,"DFO, Baripada Forest Division",No ,No,AOC,31-Oct-2024,"INR 1,393,952.17",120.0,A. Uma Mahesh,31-Oct-2024 01:01 PM,Work_order_FG_quarter_at_Khunta.pdf (196.00 KB),Being 14.99% less than the amount put to tender,1.0,2554324.0,NIHARIKA BARIK,INR,"1,393,952.17",1,2554222,ANTARYAMI SAHU,23-Sep-2024 02:23 PM,Rejected-AOC,Disqualified as per transparent lottery,31-Oct-2024 01:01 PM,Finance,5nos of bidder,Sumit Kumar Nayak,24-Sep-2024 12:55 PM,,BOQ Comparative Chart,"A Uma Mahesh, DFO",Internal,"Sri Arun Ku Biswal,ACF,Sri Hrudeswar Behera, Retd AEE",A. Uma Mahesh,31-Oct-2024 12:55 PM,finsummary_506557.pdf (1121.55 KB),Forest Environment and Climate Change Department||RCCF cum FD STR Baripada||DFO Baripada,2024_DFOBP_104810_1,DFO-BPD-01/2024-25,Construction of Forest Guard Quarters at Khunta Section campus in Udala Range under CAMPA APO 2024-25.,"A Uma Mahesh, DFO",Internal,"Sri Arun Ku Biswal,ACF,Sri Hrudeswar Behera, Retd AEE",A. Uma Mahesh,31-Oct-2024 12:49 PM,techsummary_506557.pdf (1121.55 KB),AOC
,,,,,,,,,,,,,,,,.xls,boq,,,,,,,,,,,,,,,2.0,ICICI NEFT/RTGS,,,,,,,,,,,,,,,,,,,,,,,,,AOC,,,,,,,,,,,,,2,2551035,DEEPAK PRATIHARI,20-Sep-2024 06:16 PM,Rejected-AOC,Disqualified as per transparent lottery,31-Oct-2024 01:01 PM,,,,,,,,,,,,,,,,,,,,,,,AOC
,,,,,,,,,,,,,,,,,,,,,,,,,,,,,,,,,,,,,,,,,,,,,,,,,,,,,,,,,,AOC,,,,,,,,,,,,,3,2549935,HARISH KUMAR BEHERA,19-Sep-2024 01:36 PM,Rejected-AOC,Disqualified as per transparent lottery,31-Oct-2024 01:01 PM,,,,,,,,,,,,,,,,,,,,,,,AOC
,,,,,,,,,,,,,,,,,,,,,,,,,,,,,,,,,,,,,,,,,,,,,,,,,,,,,,,,,,AOC,,,,,,,,,,,,,4,2554324,NIHARIKA BARIK,23-Sep-2024 12:48 PM,Accepted-AOC,Qualified as per transparent lottery,31-Oct-2024 01:01 PM,,,,,,,,,,,,,,,,,,,,,,,AOC
,,,,,,,,,,,,,,,,,,,,,,,,,,,,,,,,,,,,,,,,,,,,,,,,,,,,,,,,,,AOC,,,,,,,,,,,,,5,2552303,Satyaprakash Nayak,20-Sep-2024 11:05 AM,Rejected-AOC,Disqualified as per transparent lottery,31-Oct-2024 01:01 PM,,,,,,,,,,,,,,,,,,,,,,,AOC
