2022_CERWI_78349_1,01 2022-23,SR to Agrahat Bisinahakani Road in the District of Cuttack for the year 2022 23 RD 0 Km to 559 Km,SR to Agrahat Bisinahakani Road in the District of Cuttack for the year 2022 23 RD 0 Km to 559 Km,Works,Open Tender,Percentage,Civil Works - Roads,No,No,NA ,08-Jun-2022 02:00 PM,NA ,90.0,No ,No,Online,21-Jun-2022 11:00 AM,CE RW I||RWCIRCLE-CUTTACK||RWDIVISION-CUTTACK,"O/O THE S.E., R.W.DIVISION, CUTTACK",753004.0,1.0,"7,97,038",SURESH KUMAR BARIK,"677,562",Rejected-AOC,16-Sep-2022,CE RW I||RWCIRCLE-CUTTACK||RWDIVISION-CUTTACK
2022_CERWI_78352_1,01 2022-23,SR DIHASITHALO TO SASANAPADA ROAD FOR THE YEAR 2022 23,SR DIHASITHALO TO SASANAPADA ROAD FOR THE YEAR 2022 23,Works,Open Tender,Percentage,Civil Works - Roads,No,No,NA ,08-Jun-2022 02:00 PM,NA ,90.0,No ,No,Online,21-Jun-2022 11:00 AM,CE RW I||RWCIRCLE-CUTTACK||RWDIVISION-CUTTACK,"O/O THE S.E., R.W.DIVISION, CUTTACK",753004.0,1.0,"13,27,459",SRIKANTA SWAIN,"1,128,473",Rejected-AOC,05-Sep-2022,CE RW I||RWCIRCLE-CUTTACK||RWDIVISION-CUTTACK
2022_CERWI_78359_1,01/2022-23,SR to Chintamanipur to Mania Road in the District of Cuttack for the year 2022 23 RD 5244 Km to 5629 Km and 5635 Km to 5778 Km,SR to Chintamanipur to Mania Road in the District of Cuttack for the year 2022 23 RD 5244 Km to 5629 Km and 5635 Km to 5778 Km,Works,Open Tender,Percentage,Miscellaneous Works,No,No,NA ,08-Jun-2022 03:00 PM,NA ,90.0,No ,No,Online,21-Jun-2022 11:00 AM,CE RW I||RWCIRCLE-CUTTACK||RWDIVISION-CUTTACK,"O/O THE S.E., R.W.DIVISION, CUTTACK",753004.0,1.0,"6,18,903",SAMARJEET SWAIN,"526,129",Rejected-AOC,05-Sep-2022,CE RW I||RWCIRCLE-CUTTACK||RWDIVISION-CUTTACK
2022_CERWI_78363_1,01 2022-23,SR to NH 5 Champapur Anadabazar via Govindapur Road in the District of Cuttack for the year 2022 23,SR to NH 5 Champapur Anadabazar via Govindapur Road in the District of Cuttack for the year 2022 23,Works,Open Tender,Percentage,Civil Works - Roads,No,No,NA ,08-Jun-2022 06:00 PM,NA ,90.0,No ,No,Online,21-Jun-2022 11:00 AM,CE RW I||RWCIRCLE-CUTTACK||RWDIVISION-CUTTACK,"O/O THE S.E., R.W.DIVISION, CUTTACK",753004.0,1.0,"7,09,022",AMAR KUMAR MALLA,"602,740",Accepted-AOC,13-Sep-2022,CE RW I||RWCIRCLE-CUTTACK||RWDIVISION-CUTTACK
2022_CERWI_78367_1,01 2022-23,SR to Jhinkiria Sarichuan Road in the District of Cuttack for the year 2022 23 RD 2700 Km to 3430 Km,SR to Jhinkiria Sarichuan Road in the District of Cuttack for the year 2022 23 RD 2700 Km to 3430 Km,Works,Open Tender,Percentage,Civil Works - Roads,No,No,NA ,08-Jun-2022 06:00 PM,NA ,90.0,No ,No,Online,21-Jun-2022 11:00 AM,CE RW I||RWCIRCLE-CUTTACK||RWDIVISION-CUTTACK,"O/O THE S.E., R.W.DIVISION, CUTTACK",753004.0,1.0,"8,85,729",BHANU SHANKAR MALLICK,"752,958",Rejected-AOC,22-Sep-2022,CE RW I||RWCIRCLE-CUTTACK||RWDIVISION-CUTTACK
2022_CERWI_78370_1,NCB No 224,Kendujiani to Boring road for the year 2022 23,Kendujiani to Boring road for the year 2022 23,Works,Open Tender,Percentage,Civil Works - Roads,No,No,NA ,09-Jun-2022 09:00 AM,NA ,90.0,No ,No,Online,23-Jun-2022 11:00 AM,CE RW I||RWCIRCLE-BARIPADA,Mayurbhanj,757037.0,2.0,"1,06,20,405",Purna Chandra Behera,"9,028,406",Rejected-AOC,29-Sep-2022,CE RW I||RWCIRCLE-BARIPADA
2022_CERWI_78371_1,01 2022-23,SR to Salipur Chhatia PWD road Dharmagatpur road for the year 2022 23,SR to Salipur Chhatia PWD road Dharmagatpur road for the year 2022 23,Works,Open Tender,Percentage,Civil Works - Roads,No,No,NA ,08-Jun-2022 06:55 PM,NA ,90.0,No ,No,Online,21-Jun-2022 11:00 AM,CE RW I||RWCIRCLE-CUTTACK||RWDIVISION-CUTTACK,"O/O THE S.E., R.W.DIVISION, CUTTACK",753004.0,1.0,"10,61,005",ABHAY CHARAN SETHI,"901,960",Accepted-AOC,07-Sep-2022,CE RW I||RWCIRCLE-CUTTACK||RWDIVISION-CUTTACK
2022_CERWI_78372_1,01 2022-23,SR to Kasarda South Raniola Road in the District of Cuttack for the year 2022 23 RD 0800 Km to 1375 Km and 1400 Km to 1427 Km,SR to Kasarda South Raniola Road in the District of Cuttack for the year 2022 23 RD 0800 Km to 1375 Km and 1400 Km to 1427 Km,Works,Open Tender,Percentage,Civil Works - Roads,No,No,NA ,08-Jun-2022 06:55 PM,NA ,90.0,No ,No,Online,21-Jun-2022 11:00 AM,CE RW I||RWCIRCLE-CUTTACK||RWDIVISION-CUTTACK,"O/O THE S.E., R.W.DIVISION, CUTTACK",753004.0,1.0,"8,84,278",LINGARAJ SWAIN,"751,725",Rejected-AOC,05-Sep-2022,CE RW I||RWCIRCLE-CUTTACK||RWDIVISION-CUTTACK
2022_CERWI_78373_1,01 2022-23,SR to Kulia to Sunakhandi road for the year 2022 23,SR to Kulia to Sunakhandi road for the year 2022 23,Works,Open Tender,Percentage,Civil Works - Roads,No,No,NA ,08-Jun-2022 06:55 PM,NA ,90.0,No ,No,Online,21-Jun-2022 11:00 AM,CE RW I||RWCIRCLE-CUTTACK||RWDIVISION-CUTTACK,"O/O THE S.E., R.W.DIVISION, CUTTACK",753004.0,1.0,"13,26,960",RAKESH KUMAR SAHOO,"1,128,049",Rejected-AOC,14-Sep-2022,CE RW I||RWCIRCLE-CUTTACK||RWDIVISION-CUTTACK
2022_CERWI_78375_1,01 2022-23,SR to Lekhanpur Bazar to Mala via Haripur Road in the District of Cuttack for the year 2022 23,SR to Lekhanpur Bazar to Mala via Haripur Road in the District of Cuttack for the year 2022 23,Works,Open Tender,Percentage,Civil Works - Roads,No,No,NA ,08-Jun-2022 06:55 PM,NA ,90.0,No ,No,Online,21-Jun-2022 11:00 AM,CE RW I||RWCIRCLE-CUTTACK||RWDIVISION-CUTTACK,"O/O THE S.E., R.W.DIVISION, CUTTACK",753004.0,1.0,"8,84,653",SARAT CHANDRA MOHARANA,"752,044",Rejected-AOC,13-Sep-2022,CE RW I||RWCIRCLE-CUTTACK||RWDIVISION-CUTTACK
2022_CERWI_78376_1,01 2022-23,SR to Nandol Tentol Road in the District of Cuttack for the year 2022 23,SR to Nandol Tentol Road in the District of Cuttack for the year 2022 23,Works,Open Tender,Percentage,Civil Works - Roads,No,No,NA ,09-Jun-2022 09:00 AM,NA ,90.0,No ,No,Online,21-Jun-2022 11:00 AM,CE RW I||RWCIRCLE-CUTTACK||RWDIVISION-CUTTACK,"O/O THE S.E., R.W.DIVISION, CUTTACK",753004.0,1.0,"15,92,392",NITYANANDA SAHOO,"1,353,692",Rejected-AOC,08-Sep-2022,CE RW I||RWCIRCLE-CUTTACK||RWDIVISION-CUTTACK
2022_CERWI_78378_1,01 2022-23,SR to CC road to Atoda Road for the year 2022 23,SR to CC road to Atoda Road for the year 2022 23,Works,Open Tender,Percentage,Civil Works - Roads,No,No,NA ,09-Jun-2022 09:00 AM,NA ,90.0,No ,No,Online,21-Jun-2022 11:00 AM,CE RW I||RWCIRCLE-CUTTACK||RWDIVISION-CUTTACK,"O/O THE S.E., R.W.DIVISION, CUTTACK",753004.0,1.0,"8,85,897",JYOTI RANJAN DALAI,"753,101",Rejected-AOC,08-Sep-2022,CE RW I||RWCIRCLE-CUTTACK||RWDIVISION-CUTTACK
2022_CERWI_78383_1,01 2022-23,SR to Raisunguda to Bhimdaspur Road for the year 2022 23,SR to Raisunguda to Bhimdaspur Road for the year 2022 23,Works,Open Tender,Percentage,Civil Works - Roads,No,No,NA ,09-Jun-2022 09:00 AM,NA ,90.0,No ,No,Online,21-Jun-2022 11:00 AM,CE RW I||RWCIRCLE-CUTTACK||RWDIVISION-CUTTACK,"O/O THE S.E., R.W.DIVISION, CUTTACK",753004.0,1.0,"14,16,545",BIJAYA KAR,"1,204,205",Rejected-AOC,05-Sep-2022,CE RW I||RWCIRCLE-CUTTACK||RWDIVISION-CUTTACK
2022_CERWI_78384_1,01 2022-23,SR to Baradia to Jaleswarpur Road for the year 2022 23,SR to Baradia to Jaleswarpur Road for the year 2022 23,Works,Open Tender,Percentage,Civil Works - Roads,No,No,NA ,09-Jun-2022 09:00 AM,NA ,90.0,No ,No,Online,21-Jun-2022 11:00 AM,CE RW I||RWCIRCLE-CUTTACK||RWDIVISION-CUTTACK,"O/O THE S.E., R.W.DIVISION, CUTTACK",753004.0,1.0,"26,54,259",SARAT CHANDRA MOHARANA,"2,256,385",Rejected-AOC,13-Sep-2022,CE RW I||RWCIRCLE-CUTTACK||RWDIVISION-CUTTACK
2022_CERWI_78385_1,ONLINE-BGH-02,S/R to Bargarh main canal to Godgoddala road for the year 2022-23.,S/R to Bargarh main canal to Godgoddala road for the year 2022-23.,Works,Open Tender,Percentage,Miscellaneous Works,No,No,NA ,10-Jun-2022 11:00 AM,NA ,90.0,No ,No,Online,20-Jun-2022 11:00 AM,CE RW I||RWCIRCLE-SAMBALPUR||RWDIVISION-BARGARH,Bargarh,768028.0,1.0,"16,06,783",MANOJ KUMAR MEHER ST,"1,365,927",Rejected-Technical,14-Sep-2022,CE RW I||RWCIRCLE-SAMBALPUR||RWDIVISION-BARGARH
2022_CERWI_78386_1,01 2022-23,SR to Pattamundei Canal Embankment to Kuanrpur Road in the District of Cuttack for the year 2022 23 RD 0900 Km to 3060 Km,SR to Pattamundei Canal Embankment to Kuanrpur Road in the District of Cuttack for the year 2022 23 RD 0900 Km to 3060 Km,Works,Open Tender,Percentage,Civil Works - Roads,No,No,NA ,09-Jun-2022 09:00 AM,NA ,90.0,No ,No,Online,21-Jun-2022 11:00 AM,CE RW I||RWCIRCLE-CUTTACK||RWDIVISION-CUTTACK,"O/O THE S.E., R.W.DIVISION, CUTTACK",753004.0,1.0,"8,85,019",SARAT CHANDRA MOHARANA,"752,355",Rejected-AOC,16-Sep-2022,CE RW I||RWCIRCLE-CUTTACK||RWDIVISION-CUTTACK
2022_CERWI_78387_1,ONLINE-BGH-02,S/R to Sohela Barpali PWD road to Panimura road for the year 2022-23.,S/R to Sohela Barpali PWD road to Panimura road for the year 2022-23.,Works,Open Tender,Percentage,Miscellaneous Works,No,No,NA ,10-Jun-2022 11:00 AM,NA ,90.0,No ,No,Online,20-Jun-2022 11:00 AM,CE RW I||RWCIRCLE-SAMBALPUR||RWDIVISION-BARGARH,Bargarh,768028.0,1.0,"26,78,327",GITANJALI PRADHAN,"2,670,560",Accepted-AOC,08-Sep-2022,CE RW I||RWCIRCLE-SAMBALPUR||RWDIVISION-BARGARH
2022_CERWI_78388_1,ONLINE-BGH-02,S/R to Main Canal to Amlipali road for the year 2022-23.,S/R to Main Canal to Amlipali road for the year 2022-23.,Works,Open Tender,Percentage,Miscellaneous Works,No,No,NA ,10-Jun-2022 11:00 AM,NA ,90.0,No ,No,Online,20-Jun-2022 11:00 AM,CE RW I||RWCIRCLE-SAMBALPUR||RWDIVISION-BARGARH,Bargarh,768028.0,1.0,"26,78,706",Susama Dash,"2,277,168",Rejected-AOC,15-Sep-2022,CE RW I||RWCIRCLE-SAMBALPUR||RWDIVISION-BARGARH
2022_CERWI_78389_1,ONLINE-BGH-02,S/R to Hirlipali Chhak to Tangarpali road for the year 2022-23.,S/R to Hirlipali Chhak to Tangarpali road for the year 2022-23.,Works,Open Tender,Percentage,Miscellaneous Works,No,No,NA ,10-Jun-2022 11:00 AM,NA ,90.0,No ,No,Online,20-Jun-2022 11:00 AM,CE RW I||RWCIRCLE-SAMBALPUR||RWDIVISION-BARGARH,Bargarh,768028.0,1.0,"12,49,309",DEBASIS NANDA,"1,062,038",Accepted-AOC,14-Sep-2022,CE RW I||RWCIRCLE-SAMBALPUR||RWDIVISION-BARGARH
2022_CERWI_78396_1,ONLINE-BGH-02,S/R to Areigudi to Bargaon road for the year 2022-23.,S/R to Areigudi to Bargaon road for the year 2022-23.,Works,Open Tender,Percentage,Miscellaneous Works,No,No,NA ,10-Jun-2022 11:35 AM,NA ,90.0,No ,No,Online,20-Jun-2022 11:35 AM,CE RW I||RWCIRCLE-SAMBALPUR||RWDIVISION-BARGARH,Bargarh,768028.0,1.0,"47,31,703",ROHIT KUMAR AGRAWAL,"4,022,421",Rejected-AOC,15-Sep-2022,CE RW I||RWCIRCLE-SAMBALPUR||RWDIVISION-BARGARH
2022_CERWI_78397_1,ONLINE-BGH-02,S/R to Agalpur to Kebad road for the year 2022-23.,S/R to Agalpur to Kebad road for the year 2022-23.,Works,Open Tender,Percentage,Miscellaneous Works,No,No,NA ,10-Jun-2022 11:00 AM,NA ,90.0,No ,No,Online,20-Jun-2022 11:00 AM,CE RW I||RWCIRCLE-SAMBALPUR||RWDIVISION-BARGARH,Bargarh,768028.0,1.0,"21,48,849",Mrs. Janhabi Sahu,"1,826,736",Rejected-AOC,13-Sep-2022,CE RW I||RWCIRCLE-SAMBALPUR||RWDIVISION-BARGARH
2022_CERWI_78399_1,ONLINE-BGH-02,S/R to RD road to Sardhapali and Link road Jhulpiapali road for the year 2022-23.,S/R to RD road to Sardhapali and Link road Jhulpiapali road for the year 2022-23.,Works,Open Tender,Percentage,Miscellaneous Works,No,No,NA ,10-Jun-2022 11:00 AM,NA ,90.0,No ,No,Online,20-Jun-2022 11:00 AM,CE RW I||RWCIRCLE-SAMBALPUR||RWDIVISION-BARGARH,Bargarh,768028.0,1.0,"42,83,952",SUBHA SETH,"3,641,788",Rejected-Finance,14-Sep-2022,CE RW I||RWCIRCLE-SAMBALPUR||RWDIVISION-BARGARH
2022_CERWI_78401_1,ONLINE-BGH-02,S/R to Kumelsingha to PWD road,Road Works,Works,Open Tender,Percentage,Civil Works - Roads,No,No,NA ,10-Jun-2022 11:00 AM,NA ,90.0,No ,No,Online,20-Jun-2022 11:00 AM,CE RW I||RWCIRCLE-SAMBALPUR||RWDIVISION-BARGARH,Bargarh,768028.0,1.0,,Mrs. Janhabi Sahu,"1,516,650",Rejected-AOC,14-Sep-2022,CE RW I||RWCIRCLE-SAMBALPUR||RWDIVISION-BARGARH
2022_CERWI_78402_1,ONLINE-BGH-02,S/R to Nuagarh to Urduna via Hatisar road for the year 2022-23.,S/R to Nuagarh to Urduna via Hatisar road for the year 2022-23.,Works,Open Tender,Percentage,Civil Works - Roads,No,No,NA ,10-Jun-2022 11:00 AM,NA ,90.0,No ,No,Online,20-Jun-2022 11:00 AM,CE RW I||RWCIRCLE-SAMBALPUR||RWDIVISION-BARGARH,Bargarh,768028.0,1.0,"13,39,073",GITANJALI PRADHAN,"1,335,726",Accepted-AOC,08-Sep-2022,CE RW I||RWCIRCLE-SAMBALPUR||RWDIVISION-BARGARH
2022_CERWI_78403_1,ONLINE-BGH-02,S/R to Sarkanda to Karandola road via Dampali for the year 2022-23.,S/R to Sarkanda to Karandola road via Dampali for the year 2022-23.,Works,Open Tender,Percentage,Civil Works - Roads,No,No,NA ,10-Jun-2022 11:00 AM,NA ,90.0,No ,No,Online,20-Jun-2022 11:00 AM,CE RW I||RWCIRCLE-SAMBALPUR||RWDIVISION-BARGARH,Bargarh,768028.0,1.0,"28,52,172",GITANJALI PRADHAN,"2,845,897",Accepted-AOC,08-Sep-2022,CE RW I||RWCIRCLE-SAMBALPUR||RWDIVISION-BARGARH
2022_CERWI_78404_1,ONLINE-BGH-02,SR to Dhubenpali to Salepali road for the year 2022-23,SR to Dhubenpali to Salepali road for the year 2022-23,Works,Open Tender,Percentage,Civil Works - Roads,No,No,NA ,10-Jun-2022 11:00 AM,NA ,90.0,No ,No,Online,20-Jun-2022 11:00 AM,CE RW I||RWCIRCLE-SAMBALPUR||RWDIVISION-BARGARH,Bargarh,768028.0,1.0,"8,92,449",Pratima nandi,"758,671",Rejected-Technical,14-Sep-2022,CE RW I||RWCIRCLE-SAMBALPUR||RWDIVISION-BARGARH
2022_CERWI_78418_1,01 2022-23,SR to Gokan to Pallisahi road for the year 2022 23,SR to Gokan to Pallisahi road for the year 2022 23,Works,Open Tender,Percentage,Civil Works - Roads,No,No,NA ,09-Jun-2022 06:55 PM,NA ,90.0,No ,No,Online,21-Jun-2022 11:00 AM,CE RW I||RWCIRCLE-CUTTACK||RWDIVISION-CUTTACK,"O/O THE S.E., R.W.DIVISION, CUTTACK",753004.0,1.0,"8,84,752",MAHESWAR BEHURA,"752,127",Rejected-AOC,14-Sep-2022,CE RW I||RWCIRCLE-CUTTACK||RWDIVISION-CUTTACK
2022_CERWI_78420_1,ONLINE-BGH-02,S/R to Godbhaga Silet via Lahanda road for the year 2022-23.,ROAD WORK,Works,Open Tender,Percentage,Civil Works - Roads,No,No,NA ,10-Jun-2022 11:00 AM,NA ,90.0,No ,No,Online,20-Jun-2022 11:00 AM,CE RW I||RWCIRCLE-SAMBALPUR||RWDIVISION-BARGARH,Bargarh,768028.0,1.0,,BASANT AGRAWAL,"2,883,988",Rejected-Technical,13-Sep-2022,CE RW I||RWCIRCLE-SAMBALPUR||RWDIVISION-BARGARH
2022_CERWI_78423_1,01 2022-23,SR to Haladia- Sindhupur road for the year 2022 23,SR to Haladia- Sindhupur road for the year 2022 23,Works,Open Tender,Percentage,Civil Works - Roads,No,No,NA ,10-Jun-2022 09:00 AM,NA ,90.0,No ,No,Online,21-Jun-2022 11:00 AM,CE RW I||RWCIRCLE-CUTTACK||RWDIVISION-CUTTACK,"O/O THE S.E., R.W.DIVISION, CUTTACK",753004.0,1.0,"13,29,302",KAMALAKANTA ROUT,"1,130,040",Rejected-AOC,13-Sep-2022,CE RW I||RWCIRCLE-CUTTACK||RWDIVISION-CUTTACK
2022_CERWI_78435_1,ONLINE-BGH-07,S/R to Barpadar to Pankeldadar road for the year 2022-23.,S/R to Barpadar to Pankeldadar road for the year 2022-23.,Works,Open Tender,Percentage,Mechanical Works,No,No,NA ,10-Jun-2022 06:00 PM,NA ,90.0,No ,No,Online,20-Jun-2022 11:00 AM,CE RW I||RWCIRCLE-SAMBALPUR||RWDIVISION-BARGARH,Bargarh,768028.0,1.0,,KAMALINI BARIK,"1,365,466",Rejected-AOC,13-Sep-2022,CE RW I||RWCIRCLE-SAMBALPUR||RWDIVISION-BARGARH
2022_CERWI_78437_1,ONLINE BGH-07,S/R to Bugbuga to Jhilminda road for the year 2022-23.,S/R to Bugbuga to Jhilminda road for the year 2022-23.,Works,Open Tender,Percentage,Civil Works - Roads,No,No,NA ,10-Jun-2022 06:00 PM,NA ,90.0,No ,No,Online,20-Jun-2022 11:00 AM,CE RW I||RWCIRCLE-SAMBALPUR||RWDIVISION-BARGARH,Bargarh,768028.0,1.0,"6,70,649",Bikkina Narasimha murthy,"570,119",Accepted-AOC,14-Sep-2022,CE RW I||RWCIRCLE-SAMBALPUR||RWDIVISION-BARGARH
2022_CERWI_78438_1,ONLINE-BGH-07,S/R to Turunga to Launsara road for the year 2022-23.,S/R to Turunga to Launsara road for the year 2022-23.,Works,Open Tender,Percentage,Mechanical Works,No,No,NA ,10-Jun-2022 06:00 PM,NA ,90.0,No ,No,Online,20-Jun-2022 11:00 AM,CE RW I||RWCIRCLE-SAMBALPUR||RWDIVISION-BARGARH,Bargarh,768028.0,1.0,"3,12,726",Pratima nandi,"265,848",Rejected-AOC,14-Sep-2022,CE RW I||RWCIRCLE-SAMBALPUR||RWDIVISION-BARGARH
2022_CERWI_78440_1,ONLINE-BGH-07,S/R to Bhatli - Gopalpur to Kharmunda road for the year 2022-23.,S/R to Bhatli - Gopalpur to Kharmunda road for the year 2022-23.,Works,Open Tender,Percentage,Miscellaneous Works,No,No,NA ,10-Jun-2022 06:00 PM,NA ,90.0,No ,No,Online,20-Jun-2022 11:00 AM,CE RW I||RWCIRCLE-SAMBALPUR||RWDIVISION-BARGARH,Bargarh,768028.0,1.0,"10,70,136",Pratima nandi,"909,723",Rejected-Finance,14-Sep-2022,CE RW I||RWCIRCLE-SAMBALPUR||RWDIVISION-BARGARH
2022_CERWI_78440_2,ONLINE-BGH-07,S/R to Ghess to Badmal road for the year 2022-23.,Road Works,Works,Open Tender,Percentage,Miscellaneous Works,No,No,NA ,10-Jun-2022 06:00 PM,NA ,90.0,No ,No,Online,20-Jun-2022 11:00 AM,CE RW I||RWCIRCLE-SAMBALPUR||RWDIVISION-BARGARH,Bargarh,768028.0,1.0,"13,26,924",HAREKRUSHNA DEBATA,"1,311,001",Rejected-AOC,08-Sep-2022,CE RW I||RWCIRCLE-SAMBALPUR||RWDIVISION-BARGARH
2022_CERWI_78441_1,ONLINE-BGH-07,SR to Main Canal to Sodhapali Road for the year 2022-23,SR to Main Canal to Sodhapali Road for the year 2022-23,Works,Open Tender,Percentage,Mechanical Works,No,No,NA ,10-Jun-2022 06:00 PM,NA ,90.0,No ,No,Online,20-Jun-2022 11:00 AM,CE RW I||RWCIRCLE-SAMBALPUR||RWDIVISION-BARGARH,Bargarh,768028.0,1.0,"35,69,407",MUNA MEHER,"3,034,353",Rejected-AOC,13-Sep-2022,CE RW I||RWCIRCLE-SAMBALPUR||RWDIVISION-BARGARH
2022_CERWI_78442_1,ONLINE-BGH-07,S/R to NH-06 at Panichhatar to Bargarh main canal road via Nunia Jampali for the year 2022-23.,Road works,Works,Open Tender,Percentage,Miscellaneous Works,No,No,NA ,10-Jun-2022 06:00 PM,NA ,90.0,No ,No,Online,20-Jun-2022 11:00 AM,CE RW I||RWCIRCLE-SAMBALPUR||RWDIVISION-BARGARH,Bargarh,768028.0,1.0,"14,72,854",MANORANJAN SAHU,"1,252,073",Rejected-AOC,14-Sep-2022,CE RW I||RWCIRCLE-SAMBALPUR||RWDIVISION-BARGARH
2022_CERWI_78442_2,ONLINE-BGH-07,S/R to Tangarpali to Luisira road for the year 2022-2023,Road Works,Works,Open Tender,Percentage,Miscellaneous Works,No,No,NA ,10-Jun-2022 06:00 PM,NA ,90.0,No ,No,Online,20-Jun-2022 11:00 AM,CE RW I||RWCIRCLE-SAMBALPUR||RWDIVISION-BARGARH,Bargarh,768028.0,1.0,"8,92,478",Pratima nandi,"758,696",Rejected-AOC,14-Sep-2022,CE RW I||RWCIRCLE-SAMBALPUR||RWDIVISION-BARGARH
2022_CERWI_78442_3,ONLINE-BGH-07,S/R to Sastupali to Kalangapali road for the work 2022-23.,Road Works,Works,Open Tender,Percentage,Miscellaneous Works,No,No,NA ,10-Jun-2022 06:00 PM,NA ,90.0,No ,No,Online,20-Jun-2022 11:00 AM,CE RW I||RWCIRCLE-SAMBALPUR||RWDIVISION-BARGARH,Bargarh,768028.0,1.0,"13,83,634",PRAFULLA BARAI,"1,176,227",Rejected-AOC,13-Sep-2022,CE RW I||RWCIRCLE-SAMBALPUR||RWDIVISION-BARGARH
2022_CERWI_78442_4,ONLINE-BGH-07,"S/R to Khandatha to Talpali via Nuagard, Telitikra road for the year 2022-23.",Road Works,Works,Open Tender,Percentage,Miscellaneous Works,No,No,NA ,10-Jun-2022 06:00 PM,NA ,90.0,No ,No,Online,20-Jun-2022 11:00 AM,CE RW I||RWCIRCLE-SAMBALPUR||RWDIVISION-BARGARH,Bargarh,768028.0,1.0,"19,59,575",Mrs. Janhabi Sahu,"1,665,835",Rejected-AOC,14-Sep-2022,CE RW I||RWCIRCLE-SAMBALPUR||RWDIVISION-BARGARH
2022_CERWI_78442_5,ONLINE-BGH-07,S/R to Attabira to Paharsirgida road for the year 2022-23.,Road Works,Works,Open Tender,Percentage,Miscellaneous Works,No,No,NA ,10-Jun-2022 06:00 PM,NA ,90.0,No ,No,Online,20-Jun-2022 11:00 AM,CE RW I||RWCIRCLE-SAMBALPUR||RWDIVISION-BARGARH,Bargarh,768028.0,1.0,"17,85,131",Bikkina Narasimha murthy,"1,517,540",Accepted-AOC,14-Sep-2022,CE RW I||RWCIRCLE-SAMBALPUR||RWDIVISION-BARGARH
2022_CERWI_78452_1,01/GJP/2022-23,Gumma Block Board to S.Joduru road Ch 0/00 to 4/700 Km,Gumma Block Board to S.Joduru road Ch 0/00 to 4/700 Km,Works,National Competitive Bid,Percentage,Civil Works - Roads,No,No,NA ,11-Jun-2022 09:00 AM,NA ,90.0,No ,No,Online,18-Jun-2022 11:30 AM,CE RW I||RWCIRCLE-BERHAMPUR||RWDIVISION-GAJAPATI,Gajapati,761200.0,2.0,"50,10,551",RAMAKANTA NAIDU NAKA,"4,259,469.17",Rejected-AOC,02-Sep-2022,CE RW I||RWCIRCLE-BERHAMPUR||RWDIVISION-GAJAPATI
2022_CERWI_78468_1,ONLINE-BGH-07,-S/R to Kalapani to Kuruan road for the year 2022-23.,CD WORK,Works,Open Tender,Percentage,Miscellaneous Works,No,No,NA ,10-Jun-2022 06:55 PM,NA ,90.0,No ,No,Online,20-Jun-2022 11:00 AM,CE RW I||RWCIRCLE-SAMBALPUR||RWDIVISION-BARGARH,Bargarh,768028.0,1.0,,RASHMIRANJAN MUDULI,"2,277,246",Rejected-AOC,13-Sep-2022,CE RW I||RWCIRCLE-SAMBALPUR||RWDIVISION-BARGARH
2022_CERWI_78469_1,ONLINE-BGH-02,S/R to Sohela NH 6 to Tabda road via Banjari for the year 2022-23.,S/R to Sohela NH 6 to Tabda road via Banjari for the year 2022-23.,Works,Open Tender,Percentage,Miscellaneous Works,No,No,NA ,11-Jun-2022 11:00 AM,NA ,90.0,No ,No,Online,20-Jun-2022 11:00 AM,CE RW I||RWCIRCLE-SAMBALPUR||RWDIVISION-BARGARH,Bargarh,768028.0,1.0,,RISHAV AGRAWAL,"3,992,009",Rejected-AOC,08-Sep-2022,CE RW I||RWCIRCLE-SAMBALPUR||RWDIVISION-BARGARH
2022_CERWI_78509_1,02 of 2022-23,Improvement to RD Road from Raisuan to Marda under AMP in the district of Keonjhar for the year 2022 23,Improvement to RD Road from Raisuan to Marda under AMP in the district of Keonjhar for the year 2022 23,Works,National Competitive Bid,Percentage,Civil Works - Roads,No,No,NA ,13-Jun-2022 01:00 PM,NA ,90.0,No ,No,Online,22-Jun-2022 11:30 AM,CE RW I||RWCIRCLE-KEONJHAR||RWDIVISION-KEONJHAR - II,Kendujhar,758001.0,1.0,"26,51,255",SANTANU DAS,"2,253,832",Rejected-Finance,29-Sep-2022,CE RW I||RWCIRCLE-KEONJHAR||RWDIVISION-KEONJHAR - II
2022_CERWI_78557_1,01 of 2022-23,SR to RD Road Totabadi for the Year 2022 23,SR to RD Road Totabadi for the Year 2022 23,Works,Open Tender,Percentage,Miscellaneous Works,No,No,NA ,13-Jun-2022 06:55 PM,NA ,90.0,No ,No,Online,28-Jun-2022 11:30 AM,CE RW I||RWCIRCLE-CUTTACK||RWDIVISION-CUTTACK-II,Cuttack,753004.0,1.0,"5,35,550",ANIL KUMAR SAHOO,"455,271",Accepted-AOC,24-Sep-2022,CE RW I||RWCIRCLE-CUTTACK||RWDIVISION-CUTTACK-II
2022_CERWI_78571_1,01 of 2022 23,S R to Dadki to Lambrojhori road for the year 2022 23,S R to Dadki to Lambrojhori road for the year 2022 23,Works,Open Tender,Percentage,Civil Works - Roads,No,No,NA ,14-Jun-2022 10:00 AM,NA ,90.0,No ,No,Online,28-Jun-2022 11:30 AM,CE RW I||RWCIRCLE-BERHAMPUR||RWDIVISION-PHULBANI,"OO the SE, RWD Phulbani",762001.0,1.0,"8,84,955",M/S AJIT KUMAR MALLICK,"752,300",Rejected-Technical,09-Sep-2022,CE RW I||RWCIRCLE-BERHAMPUR||RWDIVISION-PHULBANI
2022_CERWI_78574_1,01 of 2022 23,S R to Bisipada to Katringia road for the year 2022 23,S R to Bisipada to Katringia road for the year 2022 23,Works,Open Tender,Percentage,Civil Works - Roads,No,No,NA ,14-Jun-2022 10:00 AM,NA ,90.0,No ,No,Online,28-Jun-2022 11:30 AM,CE RW I||RWCIRCLE-BERHAMPUR||RWDIVISION-PHULBANI,"OO the SE, RWD Phulbani",762001.0,1.0,"6,19,438",Sri Bibhisan Mallick,"526,584",Rejected-Technical,14-Sep-2022,CE RW I||RWCIRCLE-BERHAMPUR||RWDIVISION-PHULBANI
2022_CERWI_78581_2,Online Tender/01/SERWD PHULBANI/2022-23,S/R to Tikabali to Keutasahi road for the year 2022-23,S/R to Tikabali to Keutasahi road for the year 2022-23,Works,Open Tender,Percentage,Civil Works - Roads,No,No,NA ,14-Jun-2022 10:00 AM,NA ,90.0,No ,No,Online,28-Jun-2022 11:30 AM,CE RW I||RWCIRCLE-BERHAMPUR||RWDIVISION-PHULBANI,"OO the SE, RWD Phulbani",762001.0,1.0,"8,84,000",Saroj Kumar Nayak,"752,243",Rejected-Technical,29-Sep-2022,CE RW I||RWCIRCLE-BERHAMPUR||RWDIVISION-PHULBANI
2022_CERWI_78583_1,01/22-23,SR to Mahu to Koldhia road Renewal CC and Earthen Shoulder from 0000m to 0400km 1580m to 2544m for the year 2022 2023,SR to Mahu to Koldhia road Renewal CC and Earthen Shoulder from 0000m to 0400km 1580m to 2544m for the year 2022 2023,Works,Open Tender,Percentage,Civil Works - Roads,No,No,NA ,16-Jun-2022 11:00 AM,NA ,90.0,No ,No,Online,23-Jun-2022 11:00 AM,CE RW I||RWCIRCLE-KENDRAPARA||RWDIVISION II-KENDRAPARA,Kendrapara,754212.0,1.0,"26,51,996",SARAT KUMAR DAS,"2,254,461.81",Rejected-AOC,16-Sep-2022,CE RW I||RWCIRCLE-KENDRAPARA||RWDIVISION II-KENDRAPARA
2022_CERWI_78605_1,ONLINE 01,Special Repair to Ganiapali-Kunadakhai road via Madamada under Annual Maintenance Plan 2022-23,Special Repair to Ganiapali-Kunadakhai road via Madamada under Annual Maintenance Plan 2022-23,Works,Open Tender,Percentage,Civil Works - Roads,No,No,NA ,17-Jun-2022 10:00 AM,NA ,90.0,No ,No,Online,28-Jun-2022 11:00 AM,CE RW I||RWCIRCLE-SAMBALPUR||RWDIVISION-PADMAPUR,PADAMPUR,768036.0,1.0,"22,31,702",Sukanta Kumar Pati,"1,897,170",Rejected-Finance,20-Sep-2022,CE RW I||RWCIRCLE-SAMBALPUR||RWDIVISION-PADMAPUR
2022_CERWI_78606_1,01 of 2022-23,SR to PWD road to Sukhuakhala Road for the year 2022-23,SR to PWD road to Sukhuakhala Road for the year 2022-23,Works,Open Tender,Percentage,Civil Works - Roads,No,No,NA ,17-Jun-2022 11:00 AM,NA ,90.0,No ,No,Online,28-Jun-2022 11:30 AM,CE RW I||RWCIRCLE-CUTTACK||RWDIVISION-CUTTACK-II,Cuttack,753004.0,1.0,"8,92,805",SUCHISMITA SAHOO,"758,974",Rejected-Finance,02-Sep-2022,CE RW I||RWCIRCLE-CUTTACK||RWDIVISION-CUTTACK-II
2022_CERWI_78621_1,Tender online SBPR-01 of 22-23,PWD road to Haldi via Radhiapali road,PWD road to Haldi via Radhiapali road,Works,Open Tender,Percentage,Civil Works - Roads,No,No,NA ,17-Jun-2022 09:00 AM,NA ,90.0,No ,No,Online,28-Jun-2022 09:00 AM,CE RW I||RWCIRCLE-SAMBALPUR||RWDIVISION-SAMBALPUR,Sambalpur,768001.0,1.0,"8,85,000",BIMAL MAHAPATRA,"751,312",Accepted-AOC,27-Sep-2022,CE RW I||RWCIRCLE-SAMBALPUR||RWDIVISION-SAMBALPUR
2022_CERWI_78621_10,Tender online SBPR-01 of 22-23,PWD road to Gourgoth road for 22-23,PWD road to Gourgoth road for 22-23,Works,Open Tender,Percentage,Civil Works - Roads,No,No,NA ,17-Jun-2022 09:00 AM,NA ,90.0,No ,No,Online,28-Jun-2022 09:00 AM,CE RW I||RWCIRCLE-SAMBALPUR||RWDIVISION-SAMBALPUR,Sambalpur,768001.0,1.0,"14,34,000",NABIN KUMAR MISHRA,"1,220,735",Rejected-Finance,27-Sep-2022,CE RW I||RWCIRCLE-SAMBALPUR||RWDIVISION-SAMBALPUR
2022_CERWI_78621_11,Tender online SBPR-01 of 22-23,PWD road to Sankhala road for 22-23,PWD road to Sankhala road for 22-23,Works,Open Tender,Percentage,Civil Works - Roads,No,No,NA ,17-Jun-2022 09:00 AM,NA ,90.0,No ,No,Online,28-Jun-2022 09:00 AM,CE RW I||RWCIRCLE-SAMBALPUR||RWDIVISION-SAMBALPUR,Sambalpur,768001.0,1.0,"8,85,000",UMARANI MISHRA,"751,464",Rejected-Finance,27-Sep-2022,CE RW I||RWCIRCLE-SAMBALPUR||RWDIVISION-SAMBALPUR
