2022_CERWI_76726_1,RWDRRP-28 of 2021-22,"Construction of 4 nos F type quarter under R.W. Division, Rairangpur (New Colony) for the year 2021-22","Construction of 4 nos F type quarter under R.W. Division, Rairangpur (New Colony) for the year 2021-22",Works,Open Tender,Percentage,Civil Works - Buildings,No,No,NA ,06-Apr-2022 11:00 AM,NA ,90.0,No ,No,Online,21-Apr-2022 11:30 AM,CE RW I||RWCIRCLE-BARIPADA||RW Division Rairangpur,Rairangpur,757043.0,2.0,"64,87,499",KISHORE KUMAR RAJAK,"5,814,938.104",Rejected-Technical,18-Jun-2022,CE RW I||RWCIRCLE-BARIPADA||RW Division Rairangpur
2022_DFOBG_78109_1,DFO BGR-01 2022-23,Digging of Pits in Mamia Dangar Bald Hill Plantation of Bangomunda Range,Digging of Pits of Size 45 cm x 45 cm x 45 cm,Works,National Competitive Bid,Percentage,Civil Works - Others,No,No,NA ,01-Jun-2022 10:00 AM,NA ,30.0,No ,No,Online,10-Jun-2022 09:30 AM,Forest Environment and Climate Change Department||RCCF Bhawanipatna||DFO Balangir,Sindhekela Bangomunda,767040.0,1.0,"4,64,224",TAPAN SAHU,"394,636",Rejected-Finance,23-Jun-2022,Forest Environment and Climate Change Department||RCCF Bhawanipatna||DFO Balangir
2022_EICCL_75564_1,TCN NO 45 OF 2021-22,Construction of compound wall around the campus of Odisha Adarsha Vidyalaya at Sipasarubali (Brahmagiri Block) in Puri District,Construction of compound wall around the campus of Odisha Adarsha Vidyalaya at Sipasarubali (Brahmagiri Block) in Puri District,Works,National Competitive Bid,Percentage,Civil Works - Others,No,No,NA ,07-Jan-2022 10:00 AM,NA ,90.0,No ,No,Online,18-Jan-2022 11:30 AM,EIC-CIVIL||SERNB-CIRCLE-KHURDA||EERNB-DIVN-PURI,Puri,752001.0,2.0,"62,85,965",MAA GHANTESWARI PRECAST,"5,343,699",Rejected-AOC,27-Jun-2022,EIC-CIVIL||SERNB-CIRCLE-KHURDA||EERNB-DIVN-PURI
2022_EICCL_75623_1,EEGPH1BBSR-17(1)/2021-22 Dt.05.01.2022,Construction of 100 Seated Multi Storied Boys Hostel at Deogaon in Sukinda Block under DMF at Jajpur (P.H.Works),Construction of 100 Seated Multi Storied Boys Hostel at Deogaon in Sukinda Block under DMF at Jajpur (P.H.Works),Works,National Competitive Bid,Percentage,Civil Works - Water Works,No,No,NA ,10-Jan-2022 12:30 PM,NA ,120.0,No ,No,Online,21-Jan-2022 02:30 PM,EIC-CIVIL||SE PH (RnB) Circle BBSR||EE G.P.H Divn.-1 BBSR,Deogaon in Sukinda Block at Jajpur,755018.0,1.0,"19,15,600",MANAMOHAN PARIMANIK,"1,628,451.665",Rejected-Finance,20-Jun-2022,EIC-CIVIL||SE PH (RnB) Circle BBSR||EE G.P.H Divn.-1 BBSR
2022_EICCL_75624_1,EEGPH1BBSR-17(2)/2021-22 Dt.05.01.2022,Construction of 100 Seated Multi Storied Girls Hostel at Deogaon in Sukinda Block under DMF at Jajpur (P.H.Works),Construction of 100 Seated Multi Storied Girls Hostel at Deogaon in Sukinda Block under DMF at Jajpur (P.H.Works),Works,National Competitive Bid,Percentage,Civil Works - Water Works,No,No,NA ,10-Jan-2022 12:30 PM,NA ,120.0,No ,No,Online,21-Jan-2022 02:30 PM,EIC-CIVIL||SE PH (RnB) Circle BBSR||EE G.P.H Divn.-1 BBSR,Deogaon in Sukinda Block at Jajpur,755018.0,1.0,"19,15,680",GANESWAR SAMAL,"1,628,519.175",Rejected-Finance,20-Jun-2022,EIC-CIVIL||SE PH (RnB) Circle BBSR||EE G.P.H Divn.-1 BBSR
2022_EICCL_75950_1,TCN NO 49 OF 2021-22,Construction 4 Nos E type staff Quarter in LIC Colony for DRDA at Puri for 2021-22,Construction 4 Nos E type staff Quarter in LIC Colony for DRDA at Puri for 2021-22,Works,National Competitive Bid,Percentage,Civil Works - Buildings,No,No,NA ,28-Jan-2022 10:00 AM,NA ,90.0,No ,No,Online,09-Feb-2022 11:30 AM,EIC-CIVIL||SERNB-CIRCLE-KHURDA||EERNB-DIVN-PURI,Puri,752001.0,1.0,"46,09,770",BIMAN BEHERA,"3,918,765",Rejected-AOC,27-Jun-2022,EIC-CIVIL||SERNB-CIRCLE-KHURDA||EERNB-DIVN-PURI
2022_EICCL_76331_2,SE (R and B) Angul-32/ 2021-22,Construction of boxcell (2x6x4) at 8th km on Ogi Para Tainsi Jagannathpur road (ODR) from 0.0km to 21.120km in the district of Angul under NABARD Assistance RIDF-XXII (for road safety purpose),Construction of boxcell (2x6x4) at 8th km on Ogi Para Tainsi Jagannathpur road (ODR) from 0.0km to 21.120km in the district of Angul under NABARD Assistance RIDF-XXII (for road safety purpose),Works,Open Tender,Percentage,Civil Works - Roads,No,No,NA ,15-Mar-2022 10:00 AM,NA ,90.0,No ,No,Online,02-Apr-2022 11:00 AM,EIC-CIVIL||SERNB-CIRCLE-DHENKANAL||EERNB Angul Division,ANGUL,759122.0,2.0,"86,83,679",TITU SAMAL,"7,381,996",Rejected-AOC,30-Jun-2022,EIC-CIVIL||SERNB-CIRCLE-DHENKANAL||EERNB Angul Division
2022_EICCL_76332_2,SE (R and B) Angul-32/ 2021-22,Construction of Fixed Vision Centre at Kishorenagar CHC for the year 2021-22 under NHM,Construction of Fixed Vision Centre at Kishorenagar CHC for the year 2021-22 under NHM,Works,Open Tender,Percentage,Civil Works - Buildings,No,No,NA ,15-Mar-2022 10:00 AM,NA ,90.0,No ,No,Online,02-Apr-2022 11:00 AM,EIC-CIVIL||SERNB-CIRCLE-DHENKANAL||EERNB Angul Division,ANGUL,759122.0,1.0,"7,24,351",PRADEEP KUMAR SAHOO,"709,864",Accepted-AOC,30-Jun-2022,EIC-CIVIL||SERNB-CIRCLE-DHENKANAL||EERNB Angul Division
2022_EICCL_76381_1,RC (RANDB) RGD No-II 26/2021-22,Construction of Proposed modification of existing hexagonal structure of Odisha Adarsha Vidyalaya as per CBSE norms at Bissamcuttack in the district of Rayagada,Construction of Proposed modification of existing hexagonal structure of Odisha Adarsha Vidyalaya as per CBSE norms at Bissamcuttack in the district of Rayagada,Works,Open Tender,Percentage,Civil Works - Buildings,No,No,NA ,17-Mar-2022 11:00 AM,NA ,90.0,No ,No,Online,02-Apr-2022 11:00 AM,EIC-CIVIL||SERNB-CIRCLE-RAYAGADA||EERNB-DIVN-RAYAGADA NEW,BISSAMCUTTACK,765019.0,2.0,"54,75,146",T. Srinivas Rao,"5,201,936",Rejected-AOC,22-Jun-2022,EIC-CIVIL||SERNB-CIRCLE-RAYAGADA||EERNB-DIVN-RAYAGADA NEW
2022_EICCL_76708_1,IFB-EE PWD BGH No.01 OF 2022-23,Construction of Pre Cast Compound Wall for Odisha Adarsha Vidyalaya at Jharbandh (Balidhipa) under Jharbandh Block in Bargarh District for the year 2022-23.,BUILDING WORKS,Works,Open Tender,Percentage,Civil Works - Buildings,No,No,NA ,05-Apr-2022 11:00 AM,NA ,90.0,No ,No,Online,19-Apr-2022 11:30 AM,EIC-CIVIL||SERNB-CIRCLE-NORTHERN||EERNB-DIVN-BARGARH,Jharbandh,768042.0,2.0,"47,56,206",BINOD AGRAWAL,"4,043,251",Rejected-AOC,23-Jun-2022,EIC-CIVIL||SERNB-CIRCLE-NORTHERN||EERNB-DIVN-BARGARH
2022_EICCL_76708_2,IFB-EE PWD BGH No.01 OF 2022-23,Construction of Pre Cast Compound Wall for Odisha Adarsha Vidyalaya at Barpadar under Bheden Block in Bargarh District for the year 2022-23.,BUILDING WORKS,Works,Open Tender,Percentage,Civil Works - Buildings,No,No,NA ,05-Apr-2022 11:00 AM,NA ,90.0,No ,No,Online,19-Apr-2022 11:30 AM,EIC-CIVIL||SERNB-CIRCLE-NORTHERN||EERNB-DIVN-BARGARH,Bheden,768104.0,2.0,"57,84,586",M/S RAMESH KUMAR AGRAWAL,"4,917,476",Rejected-AOC,23-Jun-2022,EIC-CIVIL||SERNB-CIRCLE-NORTHERN||EERNB-DIVN-BARGARH
2022_EICCL_76708_3,IFB-EE PWD BGH No.01 OF 2022-23,Construction of Pre Cast Compound Wall for Odisha Adarsha Vidyalaya at Kesheipali under Bhatli Block in Bargarh District for the year 2022-23.,BUILDING WORKS,Works,Open Tender,Percentage,Civil Works - Buildings,No,No,NA ,05-Apr-2022 11:00 AM,NA ,90.0,No ,No,Online,19-Apr-2022 11:30 AM,EIC-CIVIL||SERNB-CIRCLE-NORTHERN||EERNB-DIVN-BARGARH,Bhatli,768030.0,2.0,"50,59,517",RATNAKAR BAG,"5,054,458",Rejected-Finance,23-Jun-2022,EIC-CIVIL||SERNB-CIRCLE-NORTHERN||EERNB-DIVN-BARGARH
2022_EICCL_76708_5,IFB-EE PWD BGH No.01 OF 2022-23,Construction of Pre Cast Compound Wall and for Odisha Adarsha Vidyalaya at Kangaon under Sohela Block in Bargarh District for the year 2022-23.,BUILDING WORK,Works,Open Tender,Percentage,Civil Works - Buildings,No,No,NA ,05-Apr-2022 11:00 AM,NA ,90.0,No ,No,Online,19-Apr-2022 11:30 AM,EIC-CIVIL||SERNB-CIRCLE-NORTHERN||EERNB-DIVN-BARGARH,SOHELA,768033.0,2.0,"77,97,050",NATHURAM AGRAWAL,"7,719,080",Rejected-Finance,23-Jun-2022,EIC-CIVIL||SERNB-CIRCLE-NORTHERN||EERNB-DIVN-BARGARH
2022_EICCL_76708_8,IFB-EE PWD BGH No.01 OF 2022-23,Construction of Pre Cast Compound Wall for Odisha Adarsha Vidyalaya at Ambabhona in Bargarh District for the year 2022-23.,BUILDING WORK,Works,Open Tender,Percentage,Civil Works - Buildings,No,No,NA ,05-Apr-2022 11:40 AM,NA ,90.0,No ,No,Online,19-Apr-2022 11:30 AM,EIC-CIVIL||SERNB-CIRCLE-NORTHERN||EERNB-DIVN-BARGARH,Ambabhona,768031.0,2.0,"50,59,517",JAYAKUMARI PADHAN,"5,033,714",Accepted-AOC,23-Jun-2022,EIC-CIVIL||SERNB-CIRCLE-NORTHERN||EERNB-DIVN-BARGARH
2022_EICCL_76778_1,CCE (R and B) BGR-12-2021-22,Construction of Tourism Infrastructure Development at Patali Srikshetra Subarnapur.,Building Work,Works,National Competitive Bid,Percentage,Civil Works - Buildings,No,No,NA ,07-Apr-2022 10:00 AM,NA ,90.0,No ,No,Online,22-Apr-2022 11:00 AM,EIC-CIVIL||SERNB-CIRCLE-BOLANGIR,Sonepur,767017.0,2.0,"1,63,92,186",NARASINGH CHARAN DASH,"13,934,997",Rejected-Finance,30-Jun-2022,EIC-CIVIL||SERNB-CIRCLE-BOLANGIR
2022_EICCL_76778_2,CCE (R and B) BGR-12-2021-22,Construction of 100 Beded Girls Hostel in Odisha Adarsha Vidyalaya (Dunguripali) At Fatamunda in the District of Subarnapur for the year 2021-22.,Building,Works,National Competitive Bid,Percentage,Civil Works - Buildings,No,No,NA ,07-Apr-2022 10:00 AM,NA ,90.0,No ,No,Online,22-Apr-2022 11:00 AM,EIC-CIVIL||SERNB-CIRCLE-BOLANGIR,sonepur,767017.0,2.0,"2,86,91,862",SAGAR CHAND KHEDIA,"24,390,951",Rejected-Technical,22-Jun-2022,EIC-CIVIL||SERNB-CIRCLE-BOLANGIR
2022_EICCL_77283_2,SC RandB GM-II-01/2022-23,Construction of Mission Shakti Bhawan (Block Level) for Ganjam Block in the District of Ganjam,Building work,Works,Open Tender,Percentage,Civil Works - Buildings,No,No,NA ,27-Apr-2022 12:00 PM,NA ,90.0,No ,No,Online,09-May-2022 11:30 AM,EIC-CIVIL||SERNB-CIRCLE-BERHAMPUR||EERNB-DIVN-GANJAM I,Ganjam,760009.0,1.0,"35,14,689",NARAYAN BEHERA,"3,479,542",Rejected-Finance,30-Jun-2022,EIC-CIVIL||SERNB-CIRCLE-BERHAMPUR||EERNB-DIVN-GANJAM I
2022_EICCL_77283_5,SC RandB GM-II-01/2022-23,Construction of compound wall of Odisha Adarsha Vidyalaya building at Karapalli of Rangailunda Block in Ganjam District,Building work,Works,Open Tender,Percentage,Civil Works - Buildings,No,No,NA ,27-Apr-2022 12:00 PM,NA ,90.0,No ,No,Online,09-May-2022 11:30 AM,EIC-CIVIL||SERNB-CIRCLE-BERHAMPUR||EERNB-DIVN-GANJAM I,Karapalli,760009.0,1.0,"28,25,500",Damodar Panigrahi,"2,401,958",Rejected-Finance,25-Jun-2022,EIC-CIVIL||SERNB-CIRCLE-BERHAMPUR||EERNB-DIVN-GANJAM I
2022_EICCL_77283_6,SC RandB GM-II-01/2022-23,Construction of compound wall of Odisha Adarsha Vidyalaya building at Chamakhandi of Chatrapur Block in Ganjam District,Building work,Works,Open Tender,Percentage,Civil Works - Buildings,No,No,NA ,27-Apr-2022 12:00 PM,NA ,90.0,No ,No,Online,09-May-2022 11:30 AM,EIC-CIVIL||SERNB-CIRCLE-BERHAMPUR||EERNB-DIVN-GANJAM I,Chamakhandi,760002.0,1.0,"21,19,125",Rajendra Kumar Pradhan,"1,801,468",Rejected-Technical,25-Jun-2022,EIC-CIVIL||SERNB-CIRCLE-BERHAMPUR||EERNB-DIVN-GANJAM I
2022_EICCL_77331_1,IFB-EE PWD BGH No.05 OF 2022-23,Construction of Mission Shakti Bhawan Block level under Bijepur Block in the district Bargarh for the year 2021-22,"BUILDING (CIVIL,EI,PH)",Works,Open Tender,Percentage,Civil Works - Buildings,No,No,NA ,29-Apr-2022 11:00 AM,NA ,90.0,No ,No,Online,10-May-2022 11:30 AM,EIC-CIVIL||SERNB-CIRCLE-NORTHERN||EERNB-DIVN-BARGARH,BIJEPUR,768032.0,2.0,"43,00,981",CHINTAMANI SAHU,"4,296,680",Accepted-AOC,23-Jun-2022,EIC-CIVIL||SERNB-CIRCLE-NORTHERN||EERNB-DIVN-BARGARH
2022_EICCL_77714_1,SE CTC (RandB)-06 of 2022-23,Development of Parking Area (P-1) in Lower Baliyatra ground (Left side of Entry gate-City side) for the year 2022-23 on the occasion of International T-20 Cricket Match at Barabati Stadium on Dt.12.6.2022,Road work,Works,National Competitive Bid,Percentage,Civil Works - Roads,No,No,NA ,14-May-2022 10:00 AM,NA ,90.0,No ,No,Online,24-May-2022 11:00 AM,EIC-CIVIL||SERNB-CIRCLE-CUTTACK||EERNB-DIVN-CUTTACK,Cuttack,753001.0,1.0,"44,59,920","SS INFRA, PROP.- SOUMITRA KUMAR LENKA","3,791,378",Rejected-AOC,09-Jun-2022,EIC-CIVIL||SERNB-CIRCLE-CUTTACK||EERNB-DIVN-CUTTACK
2022_EICCL_77714_2,SE CTC (RandB)-06 of 2022-23,Development of Parking Area(P-2) in Lower Baliyatra ground (Left side of Entry gate-River side) for the year 2022-23 on the occasion of International T-20 Cricket Match at Barabati Stadium on Dt.12.6.2022,Road works,Works,National Competitive Bid,Percentage,Civil Works - Roads,No,No,NA ,14-May-2022 10:00 AM,NA ,90.0,No ,No,Online,24-May-2022 11:00 AM,EIC-CIVIL||SERNB-CIRCLE-CUTTACK||EERNB-DIVN-CUTTACK,Cuttack,753001.0,1.0,"44,61,977","SS INFRA, PROP.- SOUMITRA KUMAR LENKA","3,793,127",Rejected-AOC,09-Jun-2022,EIC-CIVIL||SERNB-CIRCLE-CUTTACK||EERNB-DIVN-CUTTACK
2022_EICCL_77714_3,SE CTC (RandB)-06 of 2022-23,Development of Parking Area(P-3) in Lower Baliyatra ground (Right side of Entry gate-City side) for the year 2022-23 on the occasion of International T-20 Cricket Match at Barabati Stadium on Dt.12.6.2022,Road works,Works,National Competitive Bid,Percentage,Civil Works - Roads,No,No,NA ,14-May-2022 10:00 AM,NA ,90.0,No ,No,Online,24-May-2022 11:00 AM,EIC-CIVIL||SERNB-CIRCLE-CUTTACK||EERNB-DIVN-CUTTACK,Cuttack,753001.0,1.0,"44,56,884",ANITAMANJARI SWAIN,"3,788,797",Accepted-AOC,09-Jun-2022,EIC-CIVIL||SERNB-CIRCLE-CUTTACK||EERNB-DIVN-CUTTACK
2022_EICCL_77714_4,SE CTC (RandB)-06 of 2022-23,Development of Parking Area(P-4) in Lower Baliyatra ground (Right side of Entry gate-River side) for the year 2022-23 on the occasion of International T-20 Cricket Match at Barabati Stadium on Dt.12.6.2022,Road works,Works,National Competitive Bid,Percentage,Civil Works - Roads,No,No,NA ,14-May-2022 10:00 AM,NA ,90.0,No ,No,Online,24-May-2022 11:00 AM,EIC-CIVIL||SERNB-CIRCLE-CUTTACK||EERNB-DIVN-CUTTACK,Cuttack,753001.0,1.0,"43,11,353",K N MULTIPROJECTS,"3,665,081",Rejected-AOC,09-Jun-2022,EIC-CIVIL||SERNB-CIRCLE-CUTTACK||EERNB-DIVN-CUTTACK
2022_OBCC_77701_1,NO. 04 /TOLL/OBCC/2022-23,"Biraharekrushnapur Baliguali road toll gate,Puri.","Biraharekrushnapur Baliguali road toll gate,Puri.",Works,Open Tender,Lump-sum,Toll Gate,No,No,NA ,14-May-2022 05:00 PM,NA ,90.0,No ,No,Online,24-May-2022 11:30 AM,Orissa Bridge and Construction Corporation Ltd,Biraharekrishnapur,752002.0,2.0,"2,54,259",bhikari charan pradhan,"354,214",Accepted-AOC,09-Jun-2022,Orissa Bridge and Construction Corporation Ltd
2022_OBCC_77701_4,NO. 04 /TOLL/OBCC/2022-23,Badagenguti Bridge toll gate on Salepur Chhatia Road,Badagenguti Bridge toll gate on Salepur Chhatia Road,Works,Open Tender,Lump-sum,Toll Gate,No,No,NA ,14-May-2022 05:00 PM,NA ,90.0,No ,No,Online,24-May-2022 11:30 AM,Orissa Bridge and Construction Corporation Ltd,Kendrapada,754220.0,2.0,"21,89,267",Ashish Jaiswal,"2,413,567",Accepted-AOC,28-Jun-2022,Orissa Bridge and Construction Corporation Ltd
2022_OBCC_77701_6,NO. 04 /TOLL/OBCC/2022-23,Budhaambo-Buguda Road toll gate at 0.500 K.M. of the road near Budhaambo.,Budhaambo-Buguda Road toll gate at 0.500 K.M. of the road near Budhaambo.,Works,Open Tender,Lump-sum,Toll Gate,No,No,NA ,14-May-2022 05:00 PM,NA ,90.0,No ,No,Online,24-May-2022 11:30 AM,Orissa Bridge and Construction Corporation Ltd,Budhambo,761105.0,2.0,"28,09,000",M/S BANINDRA KUMAR SAHU,"2,851,551",Accepted-AOC,18-Jun-2022,Orissa Bridge and Construction Corporation Ltd
2022_OBCC_78026_1,NO. 07/TOLL/OBCC/2022-23,Bahuda Bridge toll gate at Paralakhemundi Berhampur Road.,Bahuda Bridge toll gate at Paralakhemundi Berhampur Road.,Works,Open Tender,Lump-sum,Toll Gate,No,No,NA ,28-May-2022 05:00 PM,NA ,90.0,No ,No,Online,09-Jun-2022 11:30 AM,Orissa Bridge and Construction Corporation Ltd,Paralakhemundi,761215.0,2.0,"12,37,676",AMARESH PARIJA,"1,250,099",Accepted-AOC,22-Jun-2022,Orissa Bridge and Construction Corporation Ltd
2022_OBCC_78026_2,NO. 07/TOLL/OBCC/2022-23,Onder Bridge toll gate on Bangamunda Chand Tora road.,Onder Bridge toll gate on Bangamunda Chand Tora road.,Works,Open Tender,Lump-sum,Toll Gate,No,No,NA ,28-May-2022 05:00 PM,NA ,90.0,No ,No,Online,09-Jun-2022 11:30 AM,Orissa Bridge and Construction Corporation Ltd,Bangamunda,767040.0,2.0,"66,67,204",Nruparaj Pradhan,"6,689,789",Accepted-AOC,28-Jun-2022,Orissa Bridge and Construction Corporation Ltd
2022_OHPCL_75792_1,BHEP/38/2021-22 DATED 10.01.2022,"Annual maintenance contract for up-keeping and sewerage cleaning of Residential and Non-Residential Buildings of BHEP, Balimela on Job Work basis","Annual maintenance contract for up-keeping and sewerage cleaning of Residential and Non-Residential Buildings of BHEP, Balimela on Job Work basis",Services,Open Tender,Percentage,Miscellaneous Services,No,No,NA ,15-Jan-2022 10:00 AM,NA ,120.0,No ,No,Online,31-Jan-2022 12:00 PM,Odisha Hydro Power Corporation Ltd||Balimela H.E. Project Balimela,"OHPC Colony, Balimela",764051.0,2.0,"22,54,312",M/SMANOJ KUMAR PATRA,"1,916,391",Accepted-AOC,07-Jun-2022,Odisha Hydro Power Corporation Ltd||Balimela H.E. Project Balimela
2022_OLIC_76827_10,Bid Identification No.01/2022-23 OLIC/ Dt. 8.04.20,INSTALLATION AND ENERGISATION OF KANTISALA-III L.I. PROJECT,INSTALLATION AND ENERGISATION OF KANTISALA-III L.I. PROJECT,Works,Open Tender,Percentage,Civil Works - Lift Irrigation Schemes,No,No,NA ,13-Apr-2022 11:00 AM,NA ,90.0,No ,No,Online,26-Apr-2022 10:00 AM,"Orissa Lift Irrigation Corporation||LI,Central Circle, Cuttack||LI Division Cuttack",NIALI BLOCK,754001.0,1.0,"13,61,907",MODERN WINDING AND ELECTRICALS,11.57,Rejected-Technical,08-Jun-2022,"Orissa Lift Irrigation Corporation||LI,Central Circle, Cuttack||LI Division Cuttack"
2022_OLIC_76827_15,Bid Identification No.01/2022-23 OLIC/ Dt. 8.04.20,INSTALLATION AND ENERGISATION OF BARAGUDIKUDA-IV L.I. PROJECT,INSTALLATION AND ENERGISATION OF BARAGUDIKUDA-IV L.I. PROJECT,Works,Open Tender,Percentage,Civil Works - Lift Irrigation Schemes,No,No,NA ,13-Apr-2022 11:00 AM,NA ,90.0,No ,No,Online,26-Apr-2022 10:00 AM,"Orissa Lift Irrigation Corporation||LI,Central Circle, Cuttack||LI Division Cuttack",NIALI BLOCK,754001.0,1.0,"13,44,215",SIVA SAMBHU ENGINEERING,"1,344,215",Rejected-Technical,03-Jun-2022,"Orissa Lift Irrigation Corporation||LI,Central Circle, Cuttack||LI Division Cuttack"
2022_OLIC_76827_17,Bid Identification No.01/2022-23 OLIC/ Dt. 8.04.20,INSTALLATION AND ENERGISATION OF TIHUDI PARIMALA L.I. PROJECT,INSTALLATION AND ENERGISATION OF TIHUDI PRIMALA L.I. PROJECT,Works,Open Tender,Percentage,Civil Works - Lift Irrigation Schemes,No,No,NA ,13-Apr-2022 11:00 AM,NA ,90.0,No ,No,Online,26-Apr-2022 10:00 AM,"Orissa Lift Irrigation Corporation||LI,Central Circle, Cuttack||LI Division Cuttack",NIALI BLOCK,754001.0,1.0,"13,46,401",MODERN WINDING AND ELECTRICALS,11.44,Rejected-Technical,08-Jun-2022,"Orissa Lift Irrigation Corporation||LI,Central Circle, Cuttack||LI Division Cuttack"
2022_OLIC_76827_18,Bid Identification No.01/2022-23 OLIC/ Dt. 8.04.20,INSTALLATION AND ENERGISATION OF OUWAPALLI-III L.I. PROJECT,INSTALLATION AND ENERGISATION OF OUWAPALLI-III L.I. PROJECT,Works,Open Tender,Percentage,Civil Works - Lift Irrigation Schemes,No,No,NA ,13-Apr-2022 11:00 AM,NA ,90.0,No ,No,Online,26-Apr-2022 10:00 AM,"Orissa Lift Irrigation Corporation||LI,Central Circle, Cuttack||LI Division Cuttack",NIALI BLOCK,754001.0,1.0,"13,34,404",MODERN WINDING AND ELECTRICALS,11.44,Rejected-Technical,08-Jun-2022,"Orissa Lift Irrigation Corporation||LI,Central Circle, Cuttack||LI Division Cuttack"
2022_OMC_75593_2,NIT No. 50 /OMC/CIVIL/2021,Construction of activity centre at OMC Colony Bhubaneswar in the dist of Khurda,Construction of activity centre at OMC Colony Bhubaneswar in the dist of Khurda,Works,Open Tender,Percentage,Civil Works - Others,No,No,NA ,07-Jan-2022 05:00 PM,NA ,180.0,No ,No,Online,18-Jan-2022 11:00 AM,Orissa Mining Corporation,BHUBANESWAR,751012.0,2.0,"21,73,000",HARASH KUMAR NAYAK,"1,846,819",Rejected-Finance,08-Jun-2022,Orissa Mining Corporation
2022_OMC_75683_1,OMC/e-Proc/CMC/59/2022 dated 10.01.2022,Selection of Agency to provide IT Management and Support Services at Directorate of Mines and its Circle Offices,Selection of Agency to provide IT Management and Support Services at Directorate of Mines and its Circle Offices,Services,Open Tender,Item Rate,Miscellaneous Services,No,No,NA ,10-Jan-2022 05:00 PM,19-Jan-2022 03:30 PM ,180.0,No ,No,Online,08-Feb-2022 05:00 PM,Orissa Mining Corporation,"OMC House, Bhubaneswar",751001.0,2.0,,Smart Planet IT Solutions PVT LTD,"25,408,026",Rejected-Technical,21-Jun-2022,Orissa Mining Corporation
2022_OMC_76059_1,OMC/EPROC/CnP/39/2022 dated 22/02/2022,"For Supply and Installation of Kitchen Appliances(Electrical) for H.O Canteen OMC, Bhubaneswar","For Supply and Installation of Kitchen Appliances(Electrical) for H.O Canteen OMC, Bhubaneswar",Goods,Limited,Item Rate,Miscellaneous Goods,No,No,NA ,22-Feb-2022 05:00 PM,NA ,180.0,No ,No,Online,08-Mar-2022 11:00 AM,Orissa Mining Corporation,"OMC House, Bhubaneswar",751001.0,2.0,,M/S SHREEJI ENTERPRISES,"705,409.2",Rejected-Finance,04-Jun-2022,Orissa Mining Corporation
2022_ORULB_76556_10,SNP-MUN-11/2021-22,Construction of Road and drain side of new town hall and smart park Ward No.12 in Sonepur Municipality,Construction of Road and drain side of new town hall and smart park Ward No.12 in Sonepur Municipality,Works,Open Tender,Percentage,Civil Works - Others,No,No,NA ,30-Mar-2022 11:00 AM,NA ,120.0,No ,No,Online,12-Apr-2022 11:00 AM,Municipal Bodies||Sonepur Municipal Council,SONEPUR MUNICIPALITY,767017.0,1.0,"6,18,811",NARADA DANDASENA,"587,932.5",Rejected-AOC,06-Jun-2022,Municipal Bodies||Sonepur Municipal Council
2022_ORULB_76556_11,SNP-MUN-11/2021-22,Construction of Road from Malipada towards Fishary Office Ward No.12 in Sonepur Municipality,Construction of Road from Malipada towards Fishary Office Ward No.12 in Sonepur Municipality,Works,Open Tender,Percentage,Civil Works - Others,No,No,NA ,30-Mar-2022 11:00 AM,NA ,120.0,No ,No,Online,12-Apr-2022 11:00 AM,Municipal Bodies||Sonepur Municipal Council,SONEPUR MUNICIPALITY,767017.0,1.0,"8,82,249",PRAMILA PUJAHARI,"749,999.91",Rejected-AOC,06-Jun-2022,Municipal Bodies||Sonepur Municipal Council
2022_ORULB_76556_13,SNP-MUN-11/2021-22,Completion of Kalyan Mandap at Ward No.3 in Sonepur Municipality,Completion of Kalyan Mandap at Ward No.3 in Sonepur Municipality,Works,Open Tender,Percentage,Civil Works - Buildings,No,No,NA ,30-Mar-2022 11:00 AM,NA ,120.0,No ,No,Online,12-Apr-2022 11:00 AM,Municipal Bodies||Sonepur Municipal Council,SONEPUR MUNICIPALITY,767017.0,1.0,"10,71,430",BENU NAIK,"965,358.59",Accepted-AOC,06-Jun-2022,Municipal Bodies||Sonepur Municipal Council
2022_ORULB_76556_4,SNP-MUN-11/2021-22,Construction of drain at malipada and Dhibarpada Ward No.12 in Sonepur Municipality,Construction of drain at malipada and Dhibarpada Ward No.12 in Sonepur Municipality,Works,Open Tender,Percentage,Civil Works - Others,No,No,NA ,30-Mar-2022 11:00 AM,NA ,120.0,No ,No,Online,12-Apr-2022 11:00 AM,Municipal Bodies||Sonepur Municipal Council,SONEPUR MUNICIPALITY,767017.0,1.0,"9,73,303",SOURABHA KUMAR KARNA,"827,404.56",Rejected-AOC,02-Jun-2022,Municipal Bodies||Sonepur Municipal Council
2022_ORULB_76556_5,SNP-MUN-11/2021-22,Development of Drain including cover plate at Hospital Chowk to Municipality Ward No.11 in Sonepur Municipality,Development of Drain including cover plate at Hospital Chowk to Municipality Ward No.11 in Sonepur Municipality,Works,Open Tender,Percentage,Civil Works - Others,No,No,NA ,30-Mar-2022 11:00 AM,NA ,120.0,No ,No,Online,12-Apr-2022 11:00 AM,Municipal Bodies||Sonepur Municipal Council,SONEPUR MUNICIPALITY,767017.0,1.0,"3,83,716",SOURAV KUMAR BEDBAK,"326,196.86",Rejected-AOC,03-Jun-2022,Municipal Bodies||Sonepur Municipal Council
2022_ORULB_76556_6,SNP-MUN-11/2021-22,Construction of drain from Rabi Karmakar house to Govind Agrawal house Ward No.7 in Sonepur Municipality,Construction of drain from Rabi Karmakar house to Govind Agrawal house Ward No.7 in Sonepur Municipality,Works,Open Tender,Percentage,Civil Works - Others,No,No,NA ,30-Mar-2022 11:00 AM,NA ,120.0,No ,No,Online,12-Apr-2022 11:00 AM,Municipal Bodies||Sonepur Municipal Council,SONEPUR MUNICIPALITY,767017.0,1.0,"67,201",RAKESH KUMAR SETH,"63,847.89",Rejected-AOC,09-Jun-2022,Municipal Bodies||Sonepur Municipal Council
2022_ORULB_76556_8,SNP-MUN-11/2021-22,Construction of Road and drain from side of moon hotel to Sandhya Tandi house Ward No.12 in Sonepur Municipality,Construction of Road and drain from side of moon hotel to Sandhya Tandi house Ward No.12 in Sonepur Municipality,Works,Open Tender,Percentage,Civil Works - Others,No,No,NA ,30-Mar-2022 11:00 AM,NA ,120.0,No ,No,Online,12-Apr-2022 11:00 AM,Municipal Bodies||Sonepur Municipal Council,SONEPUR MUNICIPALITY,767017.0,1.0,"1,76,806",RAKESH KUMAR SETH,"166,197.91",Rejected-AOC,06-Jun-2022,Municipal Bodies||Sonepur Municipal Council
2022_ORULB_76556_9,SNP-MUN-11/2021-22,Construction of Drain from Mahatma Gandhi School towards Bisagar bandha Ward No.11 in Sonepur Municipality,Construction of Drain from Mahatma Gandhi School towards Bisagar bandha Ward No.11 in Sonepur Municipality,Works,Open Tender,Percentage,Civil Works - Others,No,No,NA ,30-Mar-2022 11:00 AM,NA ,120.0,No ,No,Online,12-Apr-2022 11:00 AM,Municipal Bodies||Sonepur Municipal Council,SONEPUR MUNICIPALITY,767017.0,1.0,"2,65,256",MANAS RANJAN MISHRA,"225,494.54",Accepted-AOC,06-Jun-2022,Municipal Bodies||Sonepur Municipal Council
2022_ORULB_76587_1,SNP-MUN-12/2021-22,CONSTRUCTION OF SHELTER FOR URBAN HOMELESS (SUH) AT SONEPUR,CONSTRUCTION OF SHELTER FOR URBAN HOMELESS (SUH) AT SONEPUR,Works,Open Tender,Percentage,Civil Works - Buildings,No,No,NA ,30-Mar-2022 11:00 AM,NA ,270.0,No ,No,Online,16-Apr-2022 11:00 AM,Municipal Bodies||Sonepur Municipal Council,SONEPUR MUNICIPALITY,767017.0,2.0,"70,91,085",ABAKASH MISHRA,"6,341,556.76",Accepted-AOC,09-Jun-2022,Municipal Bodies||Sonepur Municipal Council
