2021_EICCL_72898_2,IFB SE 23 of 2021-22,S/R TO JASHIPUR RARUAN ROAD (ODR) SUCH AS PERIODICAL RENEWAL WITH 25MM THICK SDBC FROM 0/000 KM TO 21/068 KM IN STRETCHES FOR 2021-22,ROAD WORK,Works,Open Tender,Percentage,Civil Works - Roads,No,No,NA ,22-Nov-2021 10:00 AM,NA ,90.0,No ,No,Online,30-Nov-2021 11:00 AM,EIC-CIVIL||SERNB-CIRCLE-EASTERN||EERNB-DIVN-RAIRANGPUR,RAIRANGPUR,757043.0,2.0,"51,83,000",Sanjib Kumar Panda,"4,918,655",Rejected-AOC,08-Jun-2022,EIC-CIVIL||SERNB-CIRCLE-EASTERN||EERNB-DIVN-RAIRANGPUR
2021_EICCL_72903_10,IFB SE 24 OF 2021-22,"S/R to Suleipat -Badampahar -Jhaldungri Road (ODR) such as pothole with PMC and SC and tree painting, bush cutting, parapet repair, KM stone etc. From 0/00 km to 20/244 km in stretches for 20-21",ROAD WORK,Works,Open Tender,Percentage,Civil Works - Roads,No,No,NA ,22-Nov-2021 10:00 AM,NA ,90.0,No ,No,Online,30-Nov-2021 11:00 AM,EIC-CIVIL||SERNB-CIRCLE-EASTERN||EERNB-DIVN-RAIRANGPUR,RAIRANGPUR,757043.0,1.0,"11,57,000",M/S JAGANNATH MURMU,"983,569",Accepted-AOC,06-Jun-2022,EIC-CIVIL||SERNB-CIRCLE-EASTERN||EERNB-DIVN-RAIRANGPUR
2021_EICCL_72903_11,IFB SE 24 OF 2021-22,"S/R to Bahalda- Chaibasa Border Road ODR such providing RCC drain, cutting high flanks, tree painting, kilometre stone, culvert painting from 3/935 to 4/378 km, 4/813 to 5/00 km, 5/600 to 6/123 km, 5/667 to 7/450 km for 2021-22",ROAD WORK,Works,Open Tender,Percentage,Civil Works - Roads,No,No,NA ,22-Nov-2021 10:00 AM,NA ,90.0,No ,No,Online,30-Nov-2021 11:00 AM,EIC-CIVIL||SERNB-CIRCLE-EASTERN||EERNB-DIVN-RAIRANGPUR,RAIRANGPUR,757043.0,1.0,"15,45,300",NIBEDITA BEHERA,"1,313,656",Rejected-AOC,07-Jun-2022,EIC-CIVIL||SERNB-CIRCLE-EASTERN||EERNB-DIVN-RAIRANGPUR
2021_EICCL_72903_12,IFB SE 24 OF 2021-22,"S/R to Nuagaon ( Rairangpur College) to Dundu via Jamda Road ODR such as providing tree painting, kilometre stone, culvert painting high flank cutting , pothole repair with PMC and SC from 8/000 to 25/000 km for 2021-22",ROAD WORK,Works,Open Tender,Percentage,Civil Works - Roads,No,No,NA ,22-Nov-2021 10:00 AM,NA ,90.0,No ,No,Online,30-Nov-2021 11:00 AM,EIC-CIVIL||SERNB-CIRCLE-EASTERN||EERNB-DIVN-RAIRANGPUR,RAIRANGPUR,757043.0,1.0,"12,94,600",M/S JAGANNATH MURMU,"1,100,556",Accepted-AOC,06-Jun-2022,EIC-CIVIL||SERNB-CIRCLE-EASTERN||EERNB-DIVN-RAIRANGPUR
2021_EICCL_72903_13,IFB SE 24 OF 2021-22,"S/R to Nuagaon ( Rairangpur College) to Dundu via Jamda Road ODR such as fixing of kilometre stone and prolonged stone, bush cutting, flank dressing and paiting to trees, parapet of culvert from 25/100 to 32/526 km for 2021-22",ROAD WORK,Works,Open Tender,Percentage,Civil Works - Roads,No,No,NA ,22-Nov-2021 10:00 AM,NA ,90.0,No ,No,Online,30-Nov-2021 11:00 AM,EIC-CIVIL||SERNB-CIRCLE-EASTERN||EERNB-DIVN-RAIRANGPUR,RAIRANGPUR,757043.0,1.0,"8,92,900",JAGAT KUMAR SING,"759,066",Accepted-AOC,07-Jun-2022,EIC-CIVIL||SERNB-CIRCLE-EASTERN||EERNB-DIVN-RAIRANGPUR
2021_EICCL_72903_14,IFB SE 24 OF 2021-22,S/R to Kucheibudhi-Mohadev temple to old Dharamsala Road such as renewal coat with SDBC from 0/000 km to 0/300 km and 3/016 to 3/350 Km for 2021-22,ROAD WORK,Works,Open Tender,Percentage,Civil Works - Roads,No,No,NA ,22-Nov-2021 10:00 AM,NA ,90.0,No ,No,Online,30-Nov-2021 11:00 AM,EIC-CIVIL||SERNB-CIRCLE-EASTERN||EERNB-DIVN-RAIRANGPUR,RAIRANGPUR,757043.0,1.0,"11,60,700",NIBEDITA BEHERA,"986,744",Accepted-AOC,08-Jun-2022,EIC-CIVIL||SERNB-CIRCLE-EASTERN||EERNB-DIVN-RAIRANGPUR
2021_EICCL_72903_15,IFB SE 24 OF 2021-22,S/R to Nuagaon ( Rairangpur College) to Dundu via Jamda Road ODR such as renewal coat with BUSG and SDBC from 28/00 km to 29/500 km for 2021-22,ROAD WORK,Works,Open Tender,Percentage,Civil Works - Roads,No,No,NA ,22-Nov-2021 10:00 AM,NA ,90.0,No ,No,Online,30-Nov-2021 11:00 AM,EIC-CIVIL||SERNB-CIRCLE-EASTERN||EERNB-DIVN-RAIRANGPUR,RAIRANGPUR,757043.0,1.0,"15,17,900",NIBEDITA BEHERA,"1,290,360",Rejected-AOC,07-Jun-2022,EIC-CIVIL||SERNB-CIRCLE-EASTERN||EERNB-DIVN-RAIRANGPUR
2021_EICCL_72903_2,IFB SE 24 OF 2021-22,"S/R to Karanjia-Mohadevdeuli Road (ODR) such as renewal coat with SDBC at stretches from 5/150 to 5/550 km,6/600 to 7/100 km, 7/940 to 8/140 Km, 8/900 to 9/300 Km, 11/400 to 11/800 Km, 13/00 to 13/150 km, 13/550 to 13/950 km for 2021-22",ROAD WORK,Works,Open Tender,Percentage,Civil Works - Roads,No,No,NA ,22-Nov-2021 10:00 AM,NA ,90.0,No ,No,Online,30-Nov-2021 11:00 AM,EIC-CIVIL||SERNB-CIRCLE-EASTERN||EERNB-DIVN-RAIRANGPUR,RAIRANGPUR,757043.0,1.0,"39,48,000",HAREKRISHNA NAYAK,"3,750,986",Accepted-AOC,06-Jun-2022,EIC-CIVIL||SERNB-CIRCLE-EASTERN||EERNB-DIVN-RAIRANGPUR
2021_EICCL_72903_3,IFB SE 24 OF 2021-22,"S/R to Simila-Rajaloka Road such as pothole repair with BUSG,PMC and SC from 0/000 km to 9/011 Km for 2021-22",ROAD WORK,Works,Open Tender,Percentage,Civil Works - Roads,No,No,NA ,22-Nov-2021 10:00 AM,NA ,90.0,No ,No,Online,30-Nov-2021 11:00 AM,EIC-CIVIL||SERNB-CIRCLE-EASTERN||EERNB-DIVN-RAIRANGPUR,RAIRANGPUR,757043.0,1.0,"28,11,600",KUMUDA KUMAR MISHRA,"2,390,140",Rejected-AOC,07-Jun-2022,EIC-CIVIL||SERNB-CIRCLE-EASTERN||EERNB-DIVN-RAIRANGPUR
2021_EICCL_72903_4,IFB SE 24 OF 2021-22,"S/R to Bahalda-Station Approach Road such as providing BUSG and SDBC ,tree painting, kilometer stone, culvert painting and high flank cutting from 3/000 km to 5/000 Km for 2021-22",ROAD WORK,Works,Open Tender,Percentage,Civil Works - Roads,No,No,NA ,22-Nov-2021 10:00 AM,NA ,90.0,No ,No,Online,30-Nov-2021 11:00 AM,EIC-CIVIL||SERNB-CIRCLE-EASTERN||EERNB-DIVN-RAIRANGPUR,RAIRANGPUR,757043.0,1.0,"29,67,000",NIBEDITA BEHERA,"2,581,581",Rejected-Technical,07-Jun-2022,EIC-CIVIL||SERNB-CIRCLE-EASTERN||EERNB-DIVN-RAIRANGPUR
2021_EICCL_72903_5,IFB SE 24 OF 2021-22,"S/R to Rairangpur College to Suleipat via Shyamsundarpur such as construction of HPC at 12/383 km , 12/539 km, 12/790 km and 13/204 km for 2021-22",ROAD WORK,Works,Open Tender,Percentage,Civil Works - Roads,No,No,NA ,22-Nov-2021 10:00 AM,NA ,90.0,No ,No,Online,30-Nov-2021 11:00 AM,EIC-CIVIL||SERNB-CIRCLE-EASTERN||EERNB-DIVN-RAIRANGPUR,RAIRANGPUR,757043.0,1.0,"21,07,100",BRAJA KISHORE MOHANTA,"1,791,272",Accepted-AOC,08-Jun-2022,EIC-CIVIL||SERNB-CIRCLE-EASTERN||EERNB-DIVN-RAIRANGPUR
2021_EICCL_72903_6,IFB SE 24 OF 2021-22,S/R TO RAIRANGPUR - JASHIPUR - KARANJIA - DHENKIKOTE ROAD SUCH AS RENEWAL COAT WITH SDBC FROM 3/407 KM TO 3/660 KM AND 4/394 KM TO 4/900 KM FOR 2021-22,ROAD WORK,Works,Open Tender,Percentage,Civil Works - Roads,No,No,NA ,22-Nov-2021 10:00 AM,NA ,90.0,No ,No,Online,30-Nov-2021 11:00 AM,EIC-CIVIL||SERNB-CIRCLE-EASTERN||EERNB-DIVN-RAIRANGPUR,RAIRANGPUR,757043.0,1.0,"13,39,600",LAXMAN KUMAR NAIK,"1,386,437",Accepted-AOC,06-Jun-2022,EIC-CIVIL||SERNB-CIRCLE-EASTERN||EERNB-DIVN-RAIRANGPUR
2021_EICCL_72903_8,IFB SE 24 OF 2021-22,"S/R to TDPUMB Rupsa Road,MDR-70 such as renewal coat with SDBC at stretches from 16/800 to 17/500 km, 19/950 to 20/155 km, 20/200 to 20/621 km and 20/700 to 21/000 km for 2021-22",ROAD WORK,Works,Open Tender,Percentage,Civil Works - Roads,No,No,NA ,22-Nov-2021 10:00 AM,NA ,90.0,No ,No,Online,30-Nov-2021 11:00 AM,EIC-CIVIL||SERNB-CIRCLE-EASTERN||EERNB-DIVN-RAIRANGPUR,RAIRANGPUR,757043.0,1.0,"14,73,200",RANJAN KUMAR ROUTRAY,"1,539,545",Rejected-AOC,07-Jun-2022,EIC-CIVIL||SERNB-CIRCLE-EASTERN||EERNB-DIVN-RAIRANGPUR
2021_EICCL_73241_1,SE RANDB 05/2021-22,Construction of Market Complex at Sri Gupteswar Temple for the year 2021-22.,CIVIL,Works,National Competitive Bid,Percentage,Civil Works - Buildings,No,No,NA ,01-Dec-2021 04:00 PM,NA ,90.0,No ,No,Online,16-Dec-2021 11:00 AM,EIC-CIVIL||SERNB-CIRCLE-JEYPORE||EERNB-DIVN-JEYPORE,Gupterswar,764043.0,2.0,"80,48,000",SRI SADHU NIMIKA,"7,226,556",Rejected-AOC,24-Jun-2022,EIC-CIVIL||SERNB-CIRCLE-JEYPORE||EERNB-DIVN-JEYPORE
2021_EICCL_73241_2,SE RANDB 05/2021-22,S/R such as providing interlocking Cement Concrete pave block from 175/466Km to 175/900Km and Construction of RCC Drain from 175/430Km to 175/530Km of Vizag -Jeypore Road (SH) (Lamtaput Town Portion) during the year 2021-22,CIVIL,Works,National Competitive Bid,Percentage,Civil Works - Roads,No,No,NA ,01-Dec-2021 04:00 PM,NA ,90.0,No ,No,Online,16-Dec-2021 11:00 AM,EIC-CIVIL||SERNB-CIRCLE-JEYPORE||EERNB-DIVN-JEYPORE,Lamtaput,765013.0,2.0,"66,98,000",GOUTAMI PRIYADARSANI,"5,693,961",Accepted-AOC,24-Jun-2022,EIC-CIVIL||SERNB-CIRCLE-JEYPORE||EERNB-DIVN-JEYPORE
2021_EICCL_74091_1,SE (R and B) Angul-20/ 2021-22,Improvement to Tumurisingha Khamar road via Paikasahi from 2.340km to 2.740km for the year 2021-22,Improvement to Tumurisingha Khamar road via Paikasahi from 2.340km to 2.740km for the year 2021-22,Works,Open Tender,Percentage,Civil Works - Roads,No,No,NA ,13-Dec-2021 06:15 PM,NA ,90.0,No ,No,Online,29-Dec-2021 11:00 AM,EIC-CIVIL||SERNB-CIRCLE-DHENKANAL||EERNB Angul Division,ANGUL,759122.0,2.0,"93,11,007",SUNIL KUMAR SAHU,"7,915,287",Rejected-AOC,30-Jun-2022,EIC-CIVIL||SERNB-CIRCLE-DHENKANAL||EERNB Angul Division
2021_EICCL_74333_1,RC (RANDB) RGD No-II 15/2021-22,"Construction of proposed Block Level Mission Shakti Bhawan at Muniguda under Muniguda Block (Civil, EI and PH)","Construction of proposed Block Level Mission Shakti Bhawan at Muniguda under Muniguda Block (Civil, EI and PH)",Works,Open Tender,Percentage,Civil Works - Buildings,No,No,NA ,17-Dec-2021 11:00 AM,NA ,90.0,No ,No,Online,30-Dec-2021 11:00 AM,EIC-CIVIL||SERNB-CIRCLE-RAYAGADA||EERNB-DIVN-RAYAGADA NEW,MUNIGUDA,765020.0,1.0,"42,43,267",SUSHIL CHAND BEHERA,"3,607,201",Not Admitted-Fee/PreQual/Technical/Finance,07-Jun-2022,EIC-CIVIL||SERNB-CIRCLE-RAYAGADA||EERNB-DIVN-RAYAGADA NEW
2021_EICCL_74334_1,RC (RANDB) RGD No-II 16/2021-22,Construction of proposed Modification of existing Hexagonal Structure of Odisha Adarsha Vidyalaya as per CBSE norms at Chandrapur,Construction of proposed Modification of existing Hexagonal Structure of Odisha Adarsha Vidyalaya as per CBSE norms at Chandrapur,Works,Open Tender,Percentage,Civil Works - Buildings,No,No,NA ,17-Dec-2021 11:00 AM,NA ,90.0,No ,No,Online,30-Dec-2021 11:00 AM,EIC-CIVIL||SERNB-CIRCLE-RAYAGADA||EERNB-DIVN-RAYAGADA NEW,CHANDRAPUR,765020.0,2.0,"56,71,311",Purna Chndra Senapati,"4,821,181",Rejected-AOC,22-Jun-2022,EIC-CIVIL||SERNB-CIRCLE-RAYAGADA||EERNB-DIVN-RAYAGADA NEW
2021_EICCL_74334_4,RC (RANDB) RGD No-II 16/2021-22,Construction of proposed Modification of existing Hexagonal Structure of Odisha Adarsha Vidyalaya as per CBSE norms at Padmapur,Construction of proposed Modification of existing Hexagonal Structure of Odisha Adarsha Vidyalaya as per CBSE norms at Padmapur,Works,Open Tender,Percentage,Civil Works - Buildings,No,No,NA ,17-Dec-2021 11:00 AM,NA ,90.0,No ,No,Online,30-Dec-2021 11:00 AM,EIC-CIVIL||SERNB-CIRCLE-RAYAGADA||EERNB-DIVN-RAYAGADA NEW,PADAMPUR,765025.0,2.0,"54,17,939",RANJIT KUMAR PANIGRAHI,"4,605,790",Rejected-AOC,08-Jun-2022,EIC-CIVIL||SERNB-CIRCLE-RAYAGADA||EERNB-DIVN-RAYAGADA NEW
2021_EICCL_74334_5,RC (RANDB) RGD No-II 16/2021-22,Construction of proposed Modification of existing Hexagonal Structure of Odisha Adarsha Vidyalaya as per CBSE norms at Ramanaguda,Construction of proposed Modification of existing Hexagonal Structure of Odisha Adarsha Vidyalaya as per CBSE norms at Ramanaguda,Works,Open Tender,Percentage,Civil Works - Buildings,No,No,NA ,17-Dec-2021 11:00 AM,NA ,90.0,No ,No,Online,30-Dec-2021 11:00 AM,EIC-CIVIL||SERNB-CIRCLE-RAYAGADA||EERNB-DIVN-RAYAGADA NEW,RAMANAGUDA,765029.0,2.0,"53,99,230",RANJIT KUMAR PANIGRAHI,"4,589,886",Rejected-AOC,08-Jun-2022,EIC-CIVIL||SERNB-CIRCLE-RAYAGADA||EERNB-DIVN-RAYAGADA NEW
2021_EICCL_74334_6,RC (RANDB) RGD No-II 16/2021-22,Construction of proposed Modification of existing Hexagonal Structure of Odisha Adarsha Vidyalaya as per CBSE norms at Gunupur,Construction of proposed Modification of existing Hexagonal Structure of Odisha Adarsha Vidyalaya as per CBSE norms at Gunupur,Works,Open Tender,Percentage,Civil Works - Buildings,No,No,NA ,17-Dec-2021 11:00 AM,NA ,90.0,No ,No,Online,30-Dec-2021 11:00 AM,EIC-CIVIL||SERNB-CIRCLE-RAYAGADA||EERNB-DIVN-RAYAGADA NEW,GUNUPUR,765022.0,2.0,"53,39,862",Radha Kanta Panda,"4,539,416",Rejected-AOC,10-Jun-2022,EIC-CIVIL||SERNB-CIRCLE-RAYAGADA||EERNB-DIVN-RAYAGADA NEW
2021_EICCL_74334_7,RC (RANDB) RGD No-II 16/2021-22,Construction of proposed Modification of existing Hexagonal Structure of Odisha Adarsha Vidyalaya as per CBSE norms at Gudari,Construction of proposed Modification of existing Hexagonal Structure of Odisha Adarsha Vidyalaya as per CBSE norms at Gudari,Works,Open Tender,Percentage,Civil Works - Buildings,No,No,NA ,17-Dec-2021 11:00 AM,NA ,90.0,No ,No,Online,30-Dec-2021 11:00 AM,EIC-CIVIL||SERNB-CIRCLE-RAYAGADA||EERNB-DIVN-RAYAGADA NEW,GUNUPUR,765026.0,2.0,"54,10,366",JADUMANI BEHERA,"4,599,352",Rejected-AOC,08-Jun-2022,EIC-CIVIL||SERNB-CIRCLE-RAYAGADA||EERNB-DIVN-RAYAGADA NEW
2021_EICCL_74334_8,RC (RANDB) RGD No-II 16/2021-22,Construction of Urban PHC (Public Health Center) Building at Gunupur,Construction of Urban PHC (Public Health Center) Building at Gunupur,Works,Open Tender,Percentage,Civil Works - Buildings,No,No,NA ,17-Dec-2021 11:00 AM,NA ,90.0,No ,No,Online,30-Dec-2021 11:00 AM,EIC-CIVIL||SERNB-CIRCLE-RAYAGADA||EERNB-DIVN-RAYAGADA NEW,GUNUPUR,765022.0,2.0,"98,06,222",Radha Kanta Panda,"8,336,269",Not Admitted-Fee/PreQual/Technical,10-Jun-2022,EIC-CIVIL||SERNB-CIRCLE-RAYAGADA||EERNB-DIVN-RAYAGADA NEW
2021_EICCL_74495_1,SE (R and B) Angul-21/ 2021-22,Construction of bridge cum wire under bridge on Kankurpal Nallah at 13.500km of Kosala Chhendipada road ODR in the district of Angul,Construction of bridge cum wire under bridge on Kankurpal Nallah at 13.500km of Kosala Chhendipada road ODR in the district of Angul,Works,Open Tender,Percentage,Civil Works - Roads,No,No,NA ,18-Dec-2021 10:00 AM,NA ,90.0,No ,No,Online,04-Jan-2022 11:00 AM,EIC-CIVIL||SERNB-CIRCLE-DHENKANAL||EERNB Angul Division,ANGUL,759122.0,2.0,"92,60,164",MOTIRANJAN SAHOO,"7,872,065",Rejected-AOC,25-Jun-2022,EIC-CIVIL||SERNB-CIRCLE-DHENKANAL||EERNB Angul Division
2021_EICCL_74497_1,SE (R and B) Angul-23/ 2021-22,PR to Talcher Angul Border road from 0.0km to 3.100km for the year 2020-21,PR to Talcher Angul Border road from 0.0km to 3.100km for the year 2020-21,Works,Open Tender,Percentage,Civil Works - Roads,No,No,NA ,18-Dec-2021 10:00 AM,NA ,90.0,No ,No,Online,04-Jan-2022 11:00 AM,EIC-CIVIL||SERNB-CIRCLE-DHENKANAL||EERNB Angul Division,ANGUL,759122.0,2.0,"66,98,642",ARUN KUMAR PRADHAN,"5,694,516",Accepted-AOC,30-Jun-2022,EIC-CIVIL||SERNB-CIRCLE-DHENKANAL||EERNB Angul Division
2021_EICCL_74835_1,SE CTC (RandB)-14 of 2021-22,"S/R to Road from Fly over Bridge to Jail Road via Chhatrabazar, Mahatab road and Darghabazar, Cuttack for the year 2021-22 from Chainage 2.570km to 3.470km",Road work,Works,National Competitive Bid,Percentage,Civil Works - Roads,No,No,NA ,24-Dec-2021 01:00 PM,NA ,90.0,No ,No,Online,11-Jan-2022 11:00 AM,EIC-CIVIL||SERNB-CIRCLE-CUTTACK||EERNB-DIVN-CUTTACK,Cuttack,753001.0,1.0,"21,61,860",ABHIN KUMAR SAMANTARAYA,"1,837,797",Accepted-AOC,08-Jun-2022,EIC-CIVIL||SERNB-CIRCLE-CUTTACK||EERNB-DIVN-CUTTACK
2021_EICCL_74835_2,SE CTC (RandB)-14 of 2021-22,S/R to Road from Ranihat to High Court Square Cuttack for the year 2021-22 from Chainage 0.0km to 0.800km (Ranihat to Dolamundai),Road work,Works,National Competitive Bid,Percentage,Civil Works - Roads,No,No,NA ,24-Dec-2021 01:00 PM,NA ,90.0,No ,No,Online,11-Jan-2022 11:00 AM,EIC-CIVIL||SERNB-CIRCLE-CUTTACK||EERNB-DIVN-CUTTACK,Cuttack,753001.0,1.0,"27,89,891",BISWAJIT PANDA,"2,371,687",Rejected-AOC,08-Jun-2022,EIC-CIVIL||SERNB-CIRCLE-CUTTACK||EERNB-DIVN-CUTTACK
2021_EICCL_74836_1,SE CTC (RandB)-15 of 2021-22,"Construction of Malkhana for Excise Charge Offices of Cuttack District at Bidanasi, Cuttack (Civil, E.I. and PH)",Building works,Works,National Competitive Bid,Percentage,Civil Works - Buildings,No,No,NA ,24-Dec-2021 01:00 PM,NA ,90.0,No ,No,Online,11-Jan-2022 11:00 AM,EIC-CIVIL||SERNB-CIRCLE-CUTTACK||EERNB-DIVN-CUTTACK,Cuttack,753001.0,2.0,"59,76,279",AMULYA SAMANTARAY,"5,080,434",Accepted-AOC,08-Jun-2022,EIC-CIVIL||SERNB-CIRCLE-CUTTACK||EERNB-DIVN-CUTTACK
2021_EICCL_75256_1,IFB SE 36 OF 2021-22,CONSTRUCTION OF R I OFFICE CUM RESIDENCE AT KARANJIA FOR 2021-22,BUILDING WORK,Works,Open Tender,Percentage,Civil Works - Buildings,No,No,NA ,03-Jan-2022 10:00 AM,NA ,90.0,No ,No,Online,12-Jan-2022 11:00 AM,EIC-CIVIL||SERNB-CIRCLE-EASTERN||EERNB-DIVN-RAIRANGPUR,RAIRANGPUR,757043.0,2.0,"30,79,800",MOHAMMOD ANJAR,"2,618,138",Rejected-Technical,06-Jun-2022,EIC-CIVIL||SERNB-CIRCLE-EASTERN||EERNB-DIVN-RAIRANGPUR
2021_GOAA_66773_1,628 dt.26.2.21,PROVIDING CATERING SERVICES,"Registered caterers for food such as lunch, dinner, tea and snacks and breakfast",Services,Open Tender,EOI,Miscellaneous Services,No,No,NA ,27-Feb-2021 09:00 AM,NA ,90.0,No ,No,Online,12-Mar-2021 11:30 AM,Gopabandhu Academy of Administration,Bhubaneswar,751023.0,1.0,,SMART HOSPITALITY,440.0,Accepted-AOC,13-Jun-2022,Gopabandhu Academy of Administration
2021_OHPCL_68959_1,BHEP/03/2021-22 DATED 07.06.2021,"Replacement of old GCI sheet by new colour coated metal roofing sheet at Preservation Store and Cable Store inside Power House premises of BHEP, Balimela","Replacement of old GCI sheet by new colour coated metal roofing sheet at Preservation Store and Cable Store inside Power House premises of BHEP, Balimela",Works,Open Tender,Item Rate,Civil Works - Buildings,No,No,NA ,09-Jun-2021 11:00 AM,NA ,120.0,No ,No,Online,13-Jul-2021 12:30 PM,Odisha Hydro Power Corporation Ltd||Balimela H.E. Project Balimela,"Power House premises, BHEP, Balimela",764051.0,2.0,"20,36,379",SRI KESHAB NAYAK,"1,832,944",Accepted-AOC,09-Jun-2022,Odisha Hydro Power Corporation Ltd||Balimela H.E. Project Balimela
2021_OHPCL_70197_1,RHEP/TCN/13/2021-22,RHEP-TCN NO-13-2021/22,"Annual Maintenance Contract for Residential and Non-Residential Buildings under RHEPHD Colony, DPH Colony,12-D Colony,40-E Colony, Power House, Switchyard, Erectors Hostel Section No-I",Works,Open Tender,Percentage,Civil Works - Others,No,No,REFER TENDER SPECIFICATION ,10-Aug-2021 10:00 AM,NA ,120.0,No ,No,Online,24-Aug-2021 04:30 PM,Odisha Hydro Power Corporation Ltd||Rengali H.E. Project Rengali,"RHEP, Rengali",759105.0,2.0,,PARAMANANDA MOHANTY,"1,086,794",Rejected-AOC,28-Jun-2022,Odisha Hydro Power Corporation Ltd||Rengali H.E. Project Rengali
2021_OHPCL_70417_1,RHEP/TCN-06-2021-22,RHEP-TCN NO-06-2021/22,"Painting of Boundary wall of Administrative Building and Erectors Hostel, RHEP,Rengali",Works,Open Tender,Percentage,Civil Works - Others,No,No,REFER TENDER SPECIFICATION ,21-Aug-2021 10:00 AM,NA ,120.0,No ,No,Online,03-Sep-2021 04:30 PM,Odisha Hydro Power Corporation Ltd||Rengali H.E. Project Rengali,"RHEP, Rengali",759105.0,2.0,,SUKANTA CHARAN BEHERA,"639,269",Rejected-AOC,29-Jun-2022,Odisha Hydro Power Corporation Ltd||Rengali H.E. Project Rengali
2021_OHPCL_72241_1,BHEP/20/2021-22 DATED 02.11.2021,BHEP/20/2021-22 DATED 02.11.2021,"Metal gravelling over P.C.C with drain of Unit-1, Unit-2 and Sileru Feeder area inside 220 K.V Switchyard, BHEP, Balimela",Works,Open Tender,Percentage,Civil Works - Others,No,No,NA ,08-Nov-2021 11:00 AM,NA ,120.0,No ,No,Online,23-Nov-2021 12:00 PM,Odisha Hydro Power Corporation Ltd||Balimela H.E. Project Balimela,"Balimela Hydro Electric Project, Balimela",764051.0,2.0,"26,26,429",RAKESH KIRTANIA,"2,216,453",Rejected-AOC,10-Jun-2022,Odisha Hydro Power Corporation Ltd||Balimela H.E. Project Balimela
2021_OHPCL_72441_1,BHEP/21/2021-22 DATED 06.11.2021,BHEP/21/2021-22 DATED 06.11.2021,"Roof treatment of balance quarters in different colonies of BHEP, Balimela",Works,Open Tender,Percentage,Civil Works - Others,No,No,NA ,11-Nov-2021 11:00 AM,NA ,120.0,No ,No,Online,26-Nov-2021 12:00 PM,Odisha Hydro Power Corporation Ltd||Balimela H.E. Project Balimela,"OHPC Colony premises, Balimela",764051.0,2.0,"35,25,316",DIBYA RANJAN MOHANTY,"2,996,871",Rejected-AOC,03-Jun-2022,Odisha Hydro Power Corporation Ltd||Balimela H.E. Project Balimela
2021_OHPCL_72548_1,BHEP/22/2021-22 DATED 06.11.2021,BHEP/22/2021-22 DATED 06.11.2021,"Roof treatment of suit no. 01 to 20 of Erectors Hostel building, BHEP, Balimela",Works,Open Tender,Percentage,Civil Works - Others,No,No,NA ,12-Nov-2021 11:00 AM,NA ,120.0,No ,No,Online,26-Nov-2021 01:00 PM,Odisha Hydro Power Corporation Ltd||Balimela H.E. Project Balimela,"Balimela, Malkangiri",764051.0,2.0,"27,95,459",GOURANGA PANIGRAHI,"2,376,420",Rejected-AOC,30-Jun-2022,Odisha Hydro Power Corporation Ltd||Balimela H.E. Project Balimela
2021_OHPCL_72709_1,BHEP/24/2021-22 DATED 10.11.2021,BHEP/24/2021-22 DATED 10.11.2021,"Construction of new boundary wall at Qtr.No.3R-11,12,13,14,New officers Club and 3R-27 to 31 inside colony premises of BHEP, Balimela.",Works,Open Tender,Percentage,Civil Works - Others,No,No,NA ,18-Nov-2021 12:00 PM,NA ,120.0,No ,No,Online,09-Dec-2021 12:00 PM,Odisha Hydro Power Corporation Ltd||Balimela H.E. Project Balimela,"Colony Premises,BHEP,Balimela",764051.0,2.0,"52,99,980",KRISHNA CHANDRA SWAIN,"4,505,513",Rejected-AOC,30-Jun-2022,Odisha Hydro Power Corporation Ltd||Balimela H.E. Project Balimela
2021_OHPCL_73593_1,BHEP/28/2021-22 DATED 02.12.2021,"Repair and Renovation of 25 nos. of 3R-type Quarters at BHEP, Balimela","Repair and Renovation of 25 nos. of 3R-type Quarters at BHEP, Balimela",Works,Open Tender,Percentage,Civil Works - Buildings,No,No,NA ,07-Dec-2021 10:00 AM,NA ,120.0,No ,No,Online,28-Dec-2021 12:00 PM,Odisha Hydro Power Corporation Ltd||Balimela H.E. Project Balimela,"Officers colony, BHEP, Balimela",764051.0,2.0,"79,14,939",B. Arun Patra,"6,728,490",Accepted-AOC,30-Jun-2022,Odisha Hydro Power Corporation Ltd||Balimela H.E. Project Balimela
2021_OHPCL_73661_1,BHEP/29/2021-22 DATED 04.12.2021,"Construction of fire fighting pump house building, fire fighting water tank, boundary wall, cement concrete road and drain inside Pump House premises, BHEP, Balimela","Construction of fire fighting pump house building, fire fighting water tank, boundary wall, cement concrete road and drain inside Pump House premises, BHEP, Balimela",Works,National Competitive Bid,Percentage,Civil Works - Buildings,No,No,NA ,09-Dec-2021 10:00 AM,NA ,120.0,No ,No,Online,30-Dec-2021 12:00 PM,Odisha Hydro Power Corporation Ltd||Balimela H.E. Project Balimela,"Power House premises, BHEP, Balimela",764051.0,2.0,"1,39,10,814",B. Arun Patra,"11,825,583",Accepted-AOC,10-Jun-2022,Odisha Hydro Power Corporation Ltd||Balimela H.E. Project Balimela
2021_OHPCL_75297_1,BHEP/34/2021-22 DATED 22.12.2021,"Renovation and partition of suit nos. 15,16,19 and 20 of Erectors Hostel, BHEP, Balimela","Renovation and partition of suit nos. 15,16,19 and 20 of Erectors Hostel, BHEP, Balimela",Works,Open Tender,Percentage,Civil Works - Buildings,No,No,NA ,01-Jan-2022 10:00 AM,NA ,120.0,No ,No,Online,28-Jan-2022 12:00 PM,Odisha Hydro Power Corporation Ltd||Balimela H.E. Project Balimela,"Erectors Hostel, BHEP, Balimela",761045.0,2.0,"17,22,168",RAMA CHANDRA SAHU,"1,464,015",Accepted-AOC,07-Jun-2022,Odisha Hydro Power Corporation Ltd||Balimela H.E. Project Balimela
2021_OLIC_67654_4,"Bid Identification No.24 / 2020-21, OLIC (CTC) / D",INSTALLATION AND ENERGISATION OF KARAMANGA-I T/W LI PROJECT,INSTALLATION AND ENERGISATION OF KARAMANGA-I T/W LI PROJECT,Works,Open Tender,Percentage,Civil Works - Lift Irrigation Schemes,No,No,NA ,08-Apr-2021 10:00 AM,NA ,90.0,No ,No,Online,16-Apr-2021 10:00 AM,"Orissa Lift Irrigation Corporation||LI,Central Circle, Cuttack||LI Division Cuttack",BALIKUDA BLOCK,754001.0,1.0,,AVIJIT MOHANTY,18.7,Rejected-Technical,21-Jun-2022,"Orissa Lift Irrigation Corporation||LI,Central Circle, Cuttack||LI Division Cuttack"
2021_OMC_66750_1,RFP-02/OMC/Civil/2021,Selection of Consultant For Providing 3rd Party quality control of different infrastructure projects of Regions of OMC Ltd.,Selection of Consultant For Providing 3rd Party quality control of different infrastructure projects of Regions of OMC Ltd.,Services,Open Tender,Percentage,Miscellaneous Services,No,No,NA ,26-Feb-2021 05:00 PM,NA ,180.0,No ,No,Online,15-Mar-2021 11:00 AM,Orissa Mining Corporation,ALL REGIONS,751001.0,2.0,,S.M. Consultants,"3,840,000",Rejected-Finance,09-Jun-2022,Orissa Mining Corporation
2021_OMC_73701_1,OMC/e Proc/CMC/54/2021 Dated 04.12.2021,Agency to provide IT Management and Support Services at OMC,Agency to provide IT Management and Support Services at OMC,Services,Open Tender,Item Rate,Miscellaneous Services,No,No,NA ,07-Dec-2021 04:00 PM,17-Dec-2021 11:00 AM ,180.0,No ,No,Online,15-Jan-2022 05:00 PM,Orissa Mining Corporation,"OMC House, Bhubaneswar",751001.0,2.0,,Allied Digital Services Ltd,"87,038,668.33",Rejected-Technical,21-Jun-2022,Orissa Mining Corporation
2021_OMC_73779_1,OMC/E-PROC/CMC/55/2021 Dated 09.12.2021,"Configuration and Implementation of Human Resource Management System ,HRMS Software along with Annual Licensing Cost and Support for 5 Years","Configuration and Implementation of Human Resource Management System ,HRMS Software along with Annual Licensing Cost and Support for 5 Years",Services,Open Tender,Item Rate,Miscellaneous Services,No,No,NA ,09-Dec-2021 10:00 AM,22-Dec-2021 11:00 AM ,180.0,No ,No,Online,21-Jan-2022 05:00 PM,Orissa Mining Corporation,"OMC House, Bhubaneswar",751001.0,2.0,,Natural support consultancy services private limited,"22,000,000",Rejected-Technical,21-Jun-2022,Orissa Mining Corporation
2021_OMC_74157_1,OMC/E-PROC/CMC/57/2021 Dated 13.12.2021,Selection of agency for providing Safety Management System Software along with Annual Support,Selection of agency for providing Safety Management System Software along with Annual Support,Services,Open Tender,Item Rate,Miscellaneous Services,No,No,NA ,14-Dec-2021 06:00 PM,24-Dec-2021 03:00 PM ,180.0,No ,No,Online,04-Feb-2022 05:00 PM,Orissa Mining Corporation,"OMC House, Bhubaneswar",751001.0,2.0,,IENERGY INNOVATIONS PRIVATE LIMITED,"16,470,000",Rejected-Technical,08-Jun-2022,Orissa Mining Corporation
