2021_OLIC_75071_201,BID ID NO. 3764 (OLIC/2021-22) DATED 18.12.2021,Installation and Energisation of Badanachhana IX TW LIP under Suliapada Block in Mayurbhanj district.,Installation and Energisation of Badanachhana IX TW LIP under Suliapada Block in Mayurbhanj district.,Works,Open Tender,Percentage,Civil Works - Lift Irrigation Schemes,No,No,NA ,31-Dec-2021 10:00 AM,NA ,365.0,No ,No,Online,12-Jan-2022 11:00 AM,Orissa Lift Irrigation Corporation||LI BALASORE||LI Division Baripada,Baripada,757002.0,2.0,"19,15,033",M/S.BAISAKHI CONSTRUCTION PVT.LTD,"1,906,886",Accepted-AOC,01-Nov-2022,Orissa Lift Irrigation Corporation||LI BALASORE||LI Division Baripada
2021_OLIC_75071_202,BID ID NO. 3764 (OLIC/2021-22) DATED 18.12.2021,Installation and Energisation of Manikpur RL LIP under Udala Block in Mayurbhanj district.,Installation and Energisation of Manikpur RL LIP under Udala Block in Mayurbhanj district.,Works,Open Tender,Percentage,Civil Works - Lift Irrigation Schemes,No,No,NA ,31-Dec-2021 10:00 AM,NA ,365.0,No ,No,Online,12-Jan-2022 11:00 AM,Orissa Lift Irrigation Corporation||LI BALASORE||LI Division Baripada,Baripada,757002.0,2.0,"27,81,887",MS AYUSH ENGINEERING AND COMPANY,"2,806,386",Accepted-AOC,05-Nov-2022,Orissa Lift Irrigation Corporation||LI BALASORE||LI Division Baripada
2021_OLIC_75071_203,BID ID NO. 3764 (OLIC/2021-22) DATED 18.12.2021,Installation and Energisation of Naharpada RL LIP under Udala Block in Mayurbhanj district.,Installation and Energisation of Naharpada RL LIP under Udala Block in Mayurbhanj district.,Works,Open Tender,Percentage,Civil Works - Lift Irrigation Schemes,No,No,NA ,31-Dec-2021 10:00 AM,NA ,365.0,No ,No,Online,12-Jan-2022 11:00 AM,Orissa Lift Irrigation Corporation||LI BALASORE||LI Division Baripada,Baripada,757002.0,2.0,"24,90,108",KARTIKA CHANDRA PUSTI,"2,487,402",Rejected-AOC,05-Nov-2022,Orissa Lift Irrigation Corporation||LI BALASORE||LI Division Baripada
2021_OLIC_75071_204,BID ID NO. 3764 (OLIC/2021-22) DATED 18.12.2021,Installation and Energisation of Damusahi Dwarisahi RL LIP under Udala Block in Mayurbhanj district.,Installation and Energisation of Damusahi Dwarisahi RL LIP under Udala Block in Mayurbhanj district.,Works,Open Tender,Percentage,Civil Works - Lift Irrigation Schemes,No,No,NA ,31-Dec-2021 10:00 AM,NA ,365.0,No ,No,Online,12-Jan-2022 11:00 AM,Orissa Lift Irrigation Corporation||LI BALASORE||LI Division Baripada,Baripada,757002.0,2.0,"28,90,243",KARTIKA CHANDRA PUSTI,"2,846,022",Rejected-AOC,05-Nov-2022,Orissa Lift Irrigation Corporation||LI BALASORE||LI Division Baripada
2021_OLIC_75071_205,BID ID NO. 3764 (OLIC/2021-22) DATED 18.12.2021,Installation and Energisation of Baledihi Chandrapur RL LIP under Udala Block in Mayurbhanj district.,Installation and Energisation of Baledihi Chandrapur RL LIP under Udala Block in Mayurbhanj district.,Works,Open Tender,Percentage,Civil Works - Lift Irrigation Schemes,No,No,NA ,31-Dec-2021 10:00 AM,NA ,365.0,No ,No,Online,12-Jan-2022 11:00 AM,Orissa Lift Irrigation Corporation||LI BALASORE||LI Division Baripada,Baripada,757002.0,2.0,"30,41,910",AMALENDU NAYAK,"3,070,230",Accepted-AOC,05-Nov-2022,Orissa Lift Irrigation Corporation||LI BALASORE||LI Division Baripada
2021_OLIC_75071_206,BID ID NO. 3764 (OLIC/2021-22) DATED 18.12.2021,Installation and Energisation of NIzakainsari I RL LIP under Udala Block in Mayurbhanj district.,Installation and Energisation of NIzakainsari I RL LIP under Udala Block in Mayurbhanj district.,Works,Open Tender,Percentage,Civil Works - Lift Irrigation Schemes,No,No,NA ,31-Dec-2021 10:00 AM,NA ,365.0,No ,No,Online,12-Jan-2022 11:00 AM,Orissa Lift Irrigation Corporation||LI BALASORE||LI Division Baripada,Baripada,757002.0,2.0,"24,93,057",parbati electrical,"2,491,907",Rejected-AOC,05-Nov-2022,Orissa Lift Irrigation Corporation||LI BALASORE||LI Division Baripada
2021_OLIC_75071_207,BID ID NO. 3764 (OLIC/2021-22) DATED 18.12.2021,Installation and Energisation of NIzakainsari II RL LIP under Udala Block in Mayurbhanj district.,Installation and Energisation of NIzakainsari II RL LIP under Udala Block in Mayurbhanj district.,Works,Open Tender,Percentage,Civil Works - Lift Irrigation Schemes,No,No,NA ,31-Dec-2021 10:00 AM,NA ,365.0,No ,No,Online,12-Jan-2022 11:00 AM,Orissa Lift Irrigation Corporation||LI BALASORE||LI Division Baripada,Baripada,757002.0,2.0,"27,46,729",AMALENDU NAYAK,"2,710,472",Accepted-AOC,05-Nov-2022,Orissa Lift Irrigation Corporation||LI BALASORE||LI Division Baripada
2021_OLIC_75071_21,BID ID NO. 3764 (OLIC/2021-22) DATED 18.12.2021,Installation and Energisation of Kusumbandha II RL LIP under Bangriposi Block in Mayurbhanj district.,Installation and Energisation of Kusumbandha II RL LIP under Bangriposi Block in Mayurbhanj district.,Works,Open Tender,Percentage,Civil Works - Lift Irrigation Schemes,No,No,NA ,31-Dec-2021 10:00 AM,NA ,365.0,No ,No,Online,12-Jan-2022 11:00 AM,Orissa Lift Irrigation Corporation||LI BALASORE||LI Division Baripada,Baripada,757002.0,2.0,"23,82,449",Transpower,"2,379,641",Rejected-AOC,03-Nov-2022,Orissa Lift Irrigation Corporation||LI BALASORE||LI Division Baripada
2021_OLIC_75071_22,BID ID NO. 3764 (OLIC/2021-22) DATED 18.12.2021,Installation and Energisation of Bholagadia III RL LIP under Bangriposi Block in Mayurbhanj district.,Installation and Energisation of Bholagadia III RL LIP under Bangriposi Block in Mayurbhanj district.,Works,Open Tender,Percentage,Civil Works - Lift Irrigation Schemes,No,No,NA ,31-Dec-2021 10:00 AM,NA ,365.0,No ,No,Online,12-Jan-2022 11:00 AM,Orissa Lift Irrigation Corporation||LI BALASORE||LI Division Baripada,Baripada,757002.0,2.0,"23,22,404",AJAY KUMAR GIRI,"2,294,070",Accepted-AOC,03-Nov-2022,Orissa Lift Irrigation Corporation||LI BALASORE||LI Division Baripada
2021_OLIC_75071_23,BID ID NO. 3764 (OLIC/2021-22) DATED 18.12.2021,Installation and Energisation of Gohirapal III RL LIP under Bangriposi Block in Mayurbhanj district.,Installation and Energisation of Gohirapal III RL LIP under Bangriposi Block in Mayurbhanj district.,Works,Open Tender,Percentage,Civil Works - Lift Irrigation Schemes,No,No,NA ,31-Dec-2021 10:00 AM,NA ,365.0,No ,No,Online,12-Jan-2022 11:00 AM,Orissa Lift Irrigation Corporation||LI BALASORE||LI Division Baripada,Baripada,757002.0,2.0,"23,24,904",NABIN KUMAR PAL,"2,324,904",Accepted-AOC,03-Nov-2022,Orissa Lift Irrigation Corporation||LI BALASORE||LI Division Baripada
2021_OLIC_75071_24,BID ID NO. 3764 (OLIC/2021-22) DATED 18.12.2021,Installation and Energisation of Majhigaon Bidaghati RL LIP under Bangriposi Block in Mayurbhanj district.,Installation and Energisation of Majhigaon Bidaghati RL LIP under Bangriposi Block in Mayurbhanj district.,Works,Open Tender,Percentage,Civil Works - Lift Irrigation Schemes,No,No,NA ,31-Dec-2021 10:00 AM,NA ,365.0,No ,No,Online,12-Jan-2022 11:00 AM,Orissa Lift Irrigation Corporation||LI BALASORE||LI Division Baripada,Baripada,757002.0,2.0,"25,28,283",NABIN KUMAR PAL,"2,528,283",Accepted-AOC,03-Nov-2022,Orissa Lift Irrigation Corporation||LI BALASORE||LI Division Baripada
2021_OLIC_75071_25,BID ID NO. 3764 (OLIC/2021-22) DATED 18.12.2021,Installation and Energisation of Mohanpur RL LIP under Bangriposi Block in Mayurbhanj district.,Installation and Energisation of Mohanpur RL LIP under Bangriposi Block in Mayurbhanj district.,Works,Open Tender,Percentage,Civil Works - Lift Irrigation Schemes,No,No,NA ,31-Dec-2021 10:00 AM,NA ,365.0,No ,No,Online,12-Jan-2022 11:00 AM,Orissa Lift Irrigation Corporation||LI BALASORE||LI Division Baripada,Baripada,757002.0,2.0,"25,84,927",M/A OOMKAR TECNICAL SERVICE (P) LTD,"2,584,727",Accepted-AOC,03-Nov-2022,Orissa Lift Irrigation Corporation||LI BALASORE||LI Division Baripada
2021_OLIC_75071_26,BID ID NO. 3764 (OLIC/2021-22) DATED 18.12.2021,Installation and Energisation of Majhigaon Laldahar RL LIP under Bangriposi Block in Mayurbhanj district.,Installation and Energisation of Majhigaon Laldahar RL LIP under Bangriposi Block in Mayurbhanj district.,Works,Open Tender,Percentage,Civil Works - Lift Irrigation Schemes,No,No,NA ,31-Dec-2021 10:00 AM,NA ,365.0,No ,No,Online,12-Jan-2022 11:00 AM,Orissa Lift Irrigation Corporation||LI BALASORE||LI Division Baripada,Baripada,757002.0,2.0,"18,79,719",Transpower,"1,862,796",Rejected-AOC,03-Nov-2022,Orissa Lift Irrigation Corporation||LI BALASORE||LI Division Baripada
2021_OLIC_75071_27,BID ID NO. 3764 (OLIC/2021-22) DATED 18.12.2021,Installation and Energisation of Brahmangaon Papaldhar RL LIP under Bangriposi Block in Mayurbhanj district.,Installation and Energisation of Brahmangaon Papaldhar RL LIP under Bangriposi Block in Mayurbhanj district.,Works,Open Tender,Percentage,Civil Works - Lift Irrigation Schemes,No,No,NA ,31-Dec-2021 10:00 AM,NA ,365.0,No ,No,Online,12-Jan-2022 11:00 AM,Orissa Lift Irrigation Corporation||LI BALASORE||LI Division Baripada,Baripada,757002.0,2.0,"25,49,904",M/A OOMKAR TECNICAL SERVICE (P) LTD,"2,549,472",Accepted-AOC,03-Nov-2022,Orissa Lift Irrigation Corporation||LI BALASORE||LI Division Baripada
2021_OLIC_75071_28,BID ID NO. 3764 (OLIC/2021-22) DATED 18.12.2021,Installation and Energisation of Rengalbeda RL LIP under Bangriposi Block in Mayurbhanj district.,Installation and Energisation of Rengalbeda RL LIP under Bangriposi Block in Mayurbhanj district.,Works,Open Tender,Percentage,Civil Works - Lift Irrigation Schemes,No,No,NA ,31-Dec-2021 10:00 AM,NA ,365.0,No ,No,Online,12-Jan-2022 11:00 AM,Orissa Lift Irrigation Corporation||LI BALASORE||LI Division Baripada,Baripada,757002.0,2.0,"25,84,927",DINESH KUMAR AGARWALA,"2,580,914",Accepted-AOC,03-Nov-2022,Orissa Lift Irrigation Corporation||LI BALASORE||LI Division Baripada
2021_OLIC_75071_29,BID ID NO. 3764 (OLIC/2021-22) DATED 18.12.2021,Installation and Energisation of Baliadhipa RL LIP under Bangriposi Block in Mayurbhanj district.,Installation and Energisation of Baliadhipa RL LIP under Bangriposi Block in Mayurbhanj district.,Works,Open Tender,Percentage,Civil Works - Lift Irrigation Schemes,No,No,NA ,31-Dec-2021 10:00 AM,NA ,365.0,No ,No,Online,12-Jan-2022 11:00 AM,Orissa Lift Irrigation Corporation||LI BALASORE||LI Division Baripada,Baripada,757002.0,2.0,"26,05,265",M/A OOMKAR TECNICAL SERVICE (P) LTD,"2,605,247",Accepted-AOC,03-Nov-2022,Orissa Lift Irrigation Corporation||LI BALASORE||LI Division Baripada
2021_OLIC_75071_3,BID ID NO. 3764 (OLIC/2021-22) DATED 18.12.2021,Installation and Energisation of Malihati I TW LIP under Badasahi Block in Mayurbhanj district.,Installation and Energisation of Malihati I TW LIP under Badasahi Block in Mayurbhanj district.,Works,Open Tender,Percentage,Civil Works - Lift Irrigation Schemes,No,No,NA ,31-Dec-2021 10:00 AM,NA ,365.0,No ,No,Online,12-Jan-2022 11:00 AM,Orissa Lift Irrigation Corporation||LI BALASORE||LI Division Baripada,Baripada,757002.0,2.0,"20,07,424",RATIKANTA BISWAL,"1,806,882",Rejected-Finance,03-Nov-2022,Orissa Lift Irrigation Corporation||LI BALASORE||LI Division Baripada
2021_OLIC_75071_32,BID ID NO. 3764 (OLIC/2021-22) DATED 18.12.2021,Installation and Energisation of Nischinta IV RL LIP under Bangriposi Block in Mayurbhanj district.,Installation and Energisation of Nischinta IV RL LIP under Bangriposi Block in Mayurbhanj district.,Works,Open Tender,Percentage,Civil Works - Lift Irrigation Schemes,No,No,NA ,31-Dec-2021 10:00 AM,NA ,365.0,No ,No,Online,12-Jan-2022 11:00 AM,Orissa Lift Irrigation Corporation||LI BALASORE||LI Division Baripada,Baripada,757002.0,2.0,"25,27,382",Transpower,"2,537,382",Rejected-AOC,03-Nov-2022,Orissa Lift Irrigation Corporation||LI BALASORE||LI Division Baripada
2021_OLIC_75071_33,BID ID NO. 3764 (OLIC/2021-22) DATED 18.12.2021,Installation and Energisation of Sundhisahi Nischinta II RL LIP under Bangriposi Block in Mayurbhanj district.,Installation and Energisation of Sundhisahi Nischinta II RL LIP under Bangriposi Block in Mayurbhanj district.,Works,Open Tender,Percentage,Civil Works - Lift Irrigation Schemes,No,No,NA ,31-Dec-2021 10:00 AM,NA ,365.0,No ,No,Online,12-Jan-2022 11:00 AM,Orissa Lift Irrigation Corporation||LI BALASORE||LI Division Baripada,Baripada,757002.0,2.0,"27,04,184",Transpower,"2,702,877",Rejected-AOC,03-Nov-2022,Orissa Lift Irrigation Corporation||LI BALASORE||LI Division Baripada
2021_OLIC_75071_34,BID ID NO. 3764 (OLIC/2021-22) DATED 18.12.2021,Installation and Energisation of Bautia II RL LIP under Bangriposi Block in Mayurbhanj district.,Installation and Energisation of Bautia II RL LIP under Bangriposi Block in Mayurbhanj district.,Works,Open Tender,Percentage,Civil Works - Lift Irrigation Schemes,No,No,NA ,31-Dec-2021 10:00 AM,NA ,365.0,No ,No,Online,12-Jan-2022 11:00 AM,Orissa Lift Irrigation Corporation||LI BALASORE||LI Division Baripada,Baripada,757002.0,2.0,"23,80,760",Transpower,"2,380,631",Rejected-AOC,03-Nov-2022,Orissa Lift Irrigation Corporation||LI BALASORE||LI Division Baripada
2021_OLIC_75071_35,BID ID NO. 3764 (OLIC/2021-22) DATED 18.12.2021,Installation and Energisation of Kumbhardubi TW LIP under Baripada Block in Mayurbhanj district.,Installation and Energisation of Kumbhardubi TW LIP under Baripada Block in Mayurbhanj district.,Works,Open Tender,Percentage,Civil Works - Lift Irrigation Schemes,No,No,NA ,31-Dec-2021 10:00 AM,NA ,365.0,No ,No,Online,12-Jan-2022 11:00 AM,Orissa Lift Irrigation Corporation||LI BALASORE||LI Division Baripada,Baripada,757002.0,2.0,"18,55,011",Transpower,"1,864,142",Rejected-AOC,01-Nov-2022,Orissa Lift Irrigation Corporation||LI BALASORE||LI Division Baripada
2021_OLIC_75071_36,BID ID NO. 3764 (OLIC/2021-22) DATED 18.12.2021,Installation and Energisation of Bautisole TW LIP under Baripada Block in Mayurbhanj district.,Installation and Energisation of Bautisole TW LIP under Baripada Block in Mayurbhanj district.,Works,Open Tender,Percentage,Civil Works - Lift Irrigation Schemes,No,No,NA ,31-Dec-2021 10:00 AM,NA ,365.0,No ,No,Online,12-Jan-2022 11:00 AM,Orissa Lift Irrigation Corporation||LI BALASORE||LI Division Baripada,Baripada,757002.0,2.0,"19,67,511",Transpower,"1,967,511",Rejected-AOC,01-Nov-2022,Orissa Lift Irrigation Corporation||LI BALASORE||LI Division Baripada
2021_OLIC_75071_38,BID ID NO. 3764 (OLIC/2021-22) DATED 18.12.2021,Installation and Energisation of Badabrahmanamara II TW LIP under Baripada Block in Mayurbhanj district.,Installation and Energisation of Badabrahmanamara II TW LIP under Baripada Block in Mayurbhanj district.,Works,Open Tender,Percentage,Civil Works - Lift Irrigation Schemes,No,No,NA ,31-Dec-2021 10:00 AM,NA ,365.0,No ,No,Online,12-Jan-2022 11:00 AM,Orissa Lift Irrigation Corporation||LI BALASORE||LI Division Baripada,Baripada,757002.0,2.0,"18,72,443",Transpower,"1,870,971",Rejected-AOC,01-Nov-2022,Orissa Lift Irrigation Corporation||LI BALASORE||LI Division Baripada
2021_OLIC_75071_39,BID ID NO. 3764 (OLIC/2021-22) DATED 18.12.2021,Installation and Energisation of Patharchakadi II TW LIP under Baripada Block in Mayurbhanj district.,Installation and Energisation of Patharchakadi II TW LIP under Baripada Block in Mayurbhanj district.,Works,Open Tender,Percentage,Civil Works - Lift Irrigation Schemes,No,No,NA ,31-Dec-2021 10:00 AM,NA ,365.0,No ,No,Online,12-Jan-2022 11:00 AM,Orissa Lift Irrigation Corporation||LI BALASORE||LI Division Baripada,Baripada,757002.0,2.0,"18,99,965",Transpower,"1,880,503",Rejected-AOC,01-Nov-2022,Orissa Lift Irrigation Corporation||LI BALASORE||LI Division Baripada
2021_OLIC_75071_4,BID ID NO. 3764 (OLIC/2021-22) DATED 18.12.2021,Installation and Energisation of Jadida IV and Jadida V TW LIP under Badasahi Block in Mayurbhanj district.,Installation and Energisation of Jadida IV and Jadida V TW LIP under Badasahi Block in Mayurbhanj district.,Works,Open Tender,Percentage,Civil Works - Lift Irrigation Schemes,No,No,NA ,31-Dec-2021 10:00 AM,NA ,365.0,No ,No,Online,12-Jan-2022 11:00 AM,Orissa Lift Irrigation Corporation||LI BALASORE||LI Division Baripada,Baripada,757002.0,2.0,"38,50,590",ISHWAR CHANDRA NAYAK,"3,852,545",Accepted-AOC,03-Nov-2022,Orissa Lift Irrigation Corporation||LI BALASORE||LI Division Baripada
2021_OLIC_75071_40,BID ID NO. 3764 (OLIC/2021-22) DATED 18.12.2021,Installation and Energisation of Damadarpur I RL LIP under Baripada Block in Mayurbhanj district.,Installation and Energisation of Damadarpur I RL LIP under Baripada Block in Mayurbhanj district.,Works,Open Tender,Percentage,Civil Works - Lift Irrigation Schemes,No,No,NA ,31-Dec-2021 10:00 AM,NA ,365.0,No ,No,Online,12-Jan-2022 11:00 AM,Orissa Lift Irrigation Corporation||LI BALASORE||LI Division Baripada,Baripada,757002.0,2.0,"26,80,670",Transpower,"2,680,670",Rejected-AOC,01-Nov-2022,Orissa Lift Irrigation Corporation||LI BALASORE||LI Division Baripada
2021_OLIC_75071_41,BID ID NO. 3764 (OLIC/2021-22) DATED 18.12.2021,Installation and Energisation of Damadarpur II RL LIP under Baripada Block in Mayurbhanj district.,Installation and Energisation of Damadarpur II RL LIP under Baripada Block in Mayurbhanj district.,Works,Open Tender,Percentage,Civil Works - Lift Irrigation Schemes,No,No,NA ,31-Dec-2021 10:00 AM,NA ,365.0,No ,No,Online,12-Jan-2022 11:00 AM,Orissa Lift Irrigation Corporation||LI BALASORE||LI Division Baripada,Baripada,757002.0,2.0,"26,81,661",Transpower,"2,665,805",Rejected-AOC,01-Nov-2022,Orissa Lift Irrigation Corporation||LI BALASORE||LI Division Baripada
2021_OLIC_75071_42,BID ID NO. 3764 (OLIC/2021-22) DATED 18.12.2021,Installation and Energisation of Bhagabatpur I RL LIP under Baripada Block in Mayurbhanj district.,Installation and Energisation of Bhagabatpur I RL LIP under Baripada Block in Mayurbhanj district.,Works,Open Tender,Percentage,Civil Works - Lift Irrigation Schemes,No,No,NA ,31-Dec-2021 10:00 AM,NA ,365.0,No ,No,Online,12-Jan-2022 11:00 AM,Orissa Lift Irrigation Corporation||LI BALASORE||LI Division Baripada,Baripada,757002.0,2.0,"25,44,274",BIBEKANANDA PRADHAN,"2,544,399",Accepted-AOC,01-Nov-2022,Orissa Lift Irrigation Corporation||LI BALASORE||LI Division Baripada
2021_OLIC_75071_43,BID ID NO. 3764 (OLIC/2021-22) DATED 18.12.2021,Installation and Energisation of Bhagabatpur II RL LIP under Baripada Block in Mayurbhanj district.,Installation and Energisation of Bhagabatpur II RL LIP under Baripada Block in Mayurbhanj district.,Works,Open Tender,Percentage,Civil Works - Lift Irrigation Schemes,No,No,NA ,31-Dec-2021 10:00 AM,NA ,365.0,No ,No,Online,12-Jan-2022 11:00 AM,Orissa Lift Irrigation Corporation||LI BALASORE||LI Division Baripada,Baripada,757002.0,2.0,"25,44,274",BIBEKANANDA PRADHAN,"2,555,669",Accepted-AOC,01-Nov-2022,Orissa Lift Irrigation Corporation||LI BALASORE||LI Division Baripada
2021_OLIC_75071_44,BID ID NO. 3764 (OLIC/2021-22) DATED 18.12.2021,Installation and Energisation of Kainfulia and Bishnupur I TW LIP under Betnoti Block in Mayurbhanj district.,Installation and Energisation of Kainfulia and Bishnupur I TW LIP under Betnoti Block in Mayurbhanj district.,Works,Open Tender,Percentage,Civil Works - Lift Irrigation Schemes,No,No,NA ,31-Dec-2021 10:00 AM,NA ,365.0,No ,No,Online,12-Jan-2022 11:00 AM,Orissa Lift Irrigation Corporation||LI BALASORE||LI Division Baripada,Baripada,757002.0,2.0,"40,12,725",KARTIK CHANDRA BISWAL,"4,007,724",Accepted-AOC,03-Nov-2022,Orissa Lift Irrigation Corporation||LI BALASORE||LI Division Baripada
2021_OLIC_75071_45,BID ID NO. 3764 (OLIC/2021-22) DATED 18.12.2021,Installation and Energisation of Bishnupur II TW LIP under Betnoti Block in Mayurbhanj district.,Installation and Energisation of Bishnupur II TW LIP under Betnoti Block in Mayurbhanj district.,Works,Open Tender,Percentage,Civil Works - Lift Irrigation Schemes,No,No,NA ,31-Dec-2021 10:00 AM,NA ,365.0,No ,No,Online,12-Jan-2022 11:00 AM,Orissa Lift Irrigation Corporation||LI BALASORE||LI Division Baripada,Baripada,757002.0,2.0,"19,97,691",KARTIK CHANDRA BISWAL,"1,994,113",Accepted-AOC,03-Nov-2022,Orissa Lift Irrigation Corporation||LI BALASORE||LI Division Baripada
2021_OLIC_75071_46,BID ID NO. 3764 (OLIC/2021-22) DATED 18.12.2021,Installation and Energisation of Singhadiha I and Singhadiha II TW LIP under Betnoti Block in Mayurbhanj district.,Installation and Energisation of Singhadiha I and Singhadiha II TW LIP under Betnoti Block in Mayurbhanj district.,Works,Open Tender,Percentage,Civil Works - Lift Irrigation Schemes,No,No,NA ,31-Dec-2021 10:00 AM,NA ,365.0,No ,No,Online,12-Jan-2022 11:00 AM,Orissa Lift Irrigation Corporation||LI BALASORE||LI Division Baripada,Baripada,757002.0,2.0,"40,17,612",BRAJA MOHAN BEHERA,"4,006,876",Accepted-AOC,03-Nov-2022,Orissa Lift Irrigation Corporation||LI BALASORE||LI Division Baripada
2021_OLIC_75071_47,BID ID NO. 3764 (OLIC/2021-22) DATED 18.12.2021,Installation and Energisation of Purunianuagaon I and Purunianuagaon II TW LIP under Betnoti Block in Mayurbhanj district.,Installation and Energisation of Purunianuagaon I and Purunianuagaon II TW LIP under Betnoti Block in Mayurbhanj district.,Works,Open Tender,Percentage,Civil Works - Lift Irrigation Schemes,No,No,NA ,31-Dec-2021 10:00 AM,NA ,365.0,No ,No,Online,12-Jan-2022 11:00 AM,Orissa Lift Irrigation Corporation||LI BALASORE||LI Division Baripada,Baripada,757002.0,2.0,"41,58,400",BRAJA MOHAN BEHERA,"4,154,448",Accepted-AOC,03-Nov-2022,Orissa Lift Irrigation Corporation||LI BALASORE||LI Division Baripada
2021_OLIC_75071_48,BID ID NO. 3764 (OLIC/2021-22) DATED 18.12.2021,Installation and Energisation of Bainchamangalasahi I and Bainchamangalasahi II TW LIP under Betnoti Block in Mayurbhanj district.,Installation and Energisation of Bainchamangalasahi I and Bainchamangalasahi II TW LIP under Betnoti Block in Mayurbhanj district.,Works,Open Tender,Percentage,Civil Works - Lift Irrigation Schemes,No,No,NA ,31-Dec-2021 10:00 AM,NA ,365.0,No ,No,Online,12-Jan-2022 11:00 AM,Orissa Lift Irrigation Corporation||LI BALASORE||LI Division Baripada,Baripada,757002.0,2.0,"38,68,422",PRAKASH RANJAN BHADRA,"3,863,067",Rejected-AOC,03-Nov-2022,Orissa Lift Irrigation Corporation||LI BALASORE||LI Division Baripada
2021_OLIC_75071_49,BID ID NO. 3764 (OLIC/2021-22) DATED 18.12.2021,Installation and Energisation of Bainchapurunia TW LIP under Betnoti Block in Mayurbhanj district.,Installation and Energisation of Bainchapurunia TW LIP under Betnoti Block in Mayurbhanj district.,Works,Open Tender,Percentage,Civil Works - Lift Irrigation Schemes,No,No,NA ,31-Dec-2021 10:00 AM,NA ,365.0,No ,No,Online,12-Jan-2022 11:00 AM,Orissa Lift Irrigation Corporation||LI BALASORE||LI Division Baripada,Baripada,757002.0,2.0,"20,36,768",DINESH KUMAR AGARWALA,"2,035,408",Accepted-AOC,03-Nov-2022,Orissa Lift Irrigation Corporation||LI BALASORE||LI Division Baripada
2021_OLIC_75071_5,BID ID NO. 3764 (OLIC/2021-22) DATED 18.12.2021,Installation and Energisation of Manogobindpur IV TW LIP under Badasahi Block in Mayurbhanj district.,Installation and Energisation of Manogobindpur IV TW LIP under Badasahi Block in Mayurbhanj district.,Works,Open Tender,Percentage,Civil Works - Lift Irrigation Schemes,No,No,NA ,31-Dec-2021 10:00 AM,NA ,365.0,No ,No,Online,12-Jan-2022 11:00 AM,Orissa Lift Irrigation Corporation||LI BALASORE||LI Division Baripada,Baripada,757002.0,2.0,"17,25,576",BHAVANI SHANKAR SAHU,"1,725,576",Accepted-AOC,03-Nov-2022,Orissa Lift Irrigation Corporation||LI BALASORE||LI Division Baripada
2021_OLIC_75071_50,BID ID NO. 3764 (OLIC/2021-22) DATED 18.12.2021,Installation and Energisation of Bengachua TW LIP under Betnoti Block in Mayurbhanj district.,Installation and Energisation of Bengachua TW LIP under Betnoti Block in Mayurbhanj district.,Works,Open Tender,Percentage,Civil Works - Lift Irrigation Schemes,No,No,NA ,31-Dec-2021 10:00 AM,NA ,365.0,No ,No,Online,12-Jan-2022 11:00 AM,Orissa Lift Irrigation Corporation||LI BALASORE||LI Division Baripada,Baripada,757002.0,2.0,"20,25,821",DINESH KUMAR AGARWALA,"2,024,925",Accepted-AOC,03-Nov-2022,Orissa Lift Irrigation Corporation||LI BALASORE||LI Division Baripada
2021_OLIC_75071_51,BID ID NO. 3764 (OLIC/2021-22) DATED 18.12.2021,Installation and Energisation of Madhukhunta II RL LIP under Betnoti Block in Mayurbhanj district.,Installation and Energisation of Madhukhunta II RL LIP under Betnoti Block in Mayurbhanj district.,Works,Open Tender,Percentage,Civil Works - Lift Irrigation Schemes,No,No,NA ,31-Dec-2021 10:00 AM,NA ,365.0,No ,No,Online,12-Jan-2022 11:00 AM,Orissa Lift Irrigation Corporation||LI BALASORE||LI Division Baripada,Baripada,757002.0,2.0,"25,79,904",AJAY KUMAR GIRI,"2,577,993",Accepted-AOC,03-Nov-2022,Orissa Lift Irrigation Corporation||LI BALASORE||LI Division Baripada
2021_OLIC_75071_52,BID ID NO. 3764 (OLIC/2021-22) DATED 18.12.2021,Installation and Energisation of Haripur I TW LIP under Betnoti Block in Mayurbhanj district.,Installation and Energisation of Haripur I TW LIP under Betnoti Block in Mayurbhanj district.,Works,Open Tender,Percentage,Civil Works - Lift Irrigation Schemes,No,No,NA ,31-Dec-2021 10:00 AM,NA ,365.0,No ,No,Online,12-Jan-2022 11:00 AM,Orissa Lift Irrigation Corporation||LI BALASORE||LI Division Baripada,Baripada,757002.0,2.0,"19,19,087",DINESH KUMAR AGARWALA,"1,918,409",Accepted-AOC,03-Nov-2022,Orissa Lift Irrigation Corporation||LI BALASORE||LI Division Baripada
2021_OLIC_75071_53,BID ID NO. 3764 (OLIC/2021-22) DATED 18.12.2021,Installation and Energisation of Haripur Nuagaon and Krushnachandrapur TW LIP under Betnoti Block in Mayurbhanj district.,Installation and Energisation of Haripur Nuagaon and Krushnachandrapur TW LIP under Betnoti Block in Mayurbhanj district.,Works,Open Tender,Percentage,Civil Works - Lift Irrigation Schemes,No,No,NA ,31-Dec-2021 10:00 AM,NA ,365.0,No ,No,Online,12-Jan-2022 11:00 AM,Orissa Lift Irrigation Corporation||LI BALASORE||LI Division Baripada,Baripada,757002.0,2.0,"41,63,535",BRAJA MOHAN BEHERA,"4,160,857",Accepted-AOC,03-Nov-2022,Orissa Lift Irrigation Corporation||LI BALASORE||LI Division Baripada
