2022_CERWI_80359_1,ETCN02/22-23-3,42/5590-S/R to Sahukharada to Talapokhari Road for 2022-23,42/5590-S/R to Sahukharada to Talapokhari Road for 2022-23,Works,Open Tender,Percentage,Civil Works - Roads,No,No,NA ,06-Aug-2022 02:00 PM,NA ,90.0,No ,No,Online,17-Aug-2022 11:00 AM,CE RW I||RWCIRCLE-BALASORE||RWDIVISION-BALASORE-II,Balasore,756001.0,1.0,"5,30,202",TAPAS KUMAR NAYAK,"504,811",Rejected-AOC,23-Sep-2022,CE RW I||RWCIRCLE-BALASORE||RWDIVISION-BALASORE-II
2022_CERWI_80520_1,06/22-23,Special Repair to NH-217 to Gopinathpur Badakhandi road for the year 2022-23,Special Repair to NH-217 to Gopinathpur Badakhandi road for the year 2022-23,Works,National Competitive Bid,Percentage,Civil Works - Roads,No,No,NA ,16-Aug-2022 05:00 PM,NA ,90.0,No ,No,Online,22-Aug-2022 05:00 PM,CE RW I||RWCIRCLE-BERHAMPUR||RWDIVISION-GANJAM - II,Ganjam,760011.0,1.0,"16,81,000",SUBRAT KUMAR PANIGRAHY,"1,429,013",Rejected-AOC,22-Sep-2022,CE RW I||RWCIRCLE-BERHAMPUR||RWDIVISION-GANJAM - II
2022_CERWI_80521_1,06/22-23,Special Repair to NH 217 to Makarjhola Nuagam road for the year 2022 23,Special Repair to NH 217 to Makarjhola Nuagam road for the year 2022 23,Works,National Competitive Bid,Percentage,Civil Works - Roads,No,No,NA ,16-Aug-2022 05:00 PM,NA ,90.0,No ,No,Online,22-Aug-2022 05:00 PM,CE RW I||RWCIRCLE-BERHAMPUR||RWDIVISION-GANJAM - II,Ganjam,760011.0,1.0,"25,22,000",PITABAS SWAIN,"2,143,075",Rejected-AOC,22-Sep-2022,CE RW I||RWCIRCLE-BERHAMPUR||RWDIVISION-GANJAM - II
2022_CERWI_80522_1,06/22-23,Special repair to Chaitanapada Dayapalli via Durabandha Godarapalli road for the year 2022 23,Special repair to Chaitanapada Dayapalli via Durabandha Godarapalli road for the year 2022 23,Works,National Competitive Bid,Percentage,Civil Works - Roads,No,No,NA ,16-Aug-2022 05:00 PM,NA ,90.0,No ,No,Online,22-Aug-2022 05:00 PM,CE RW I||RWCIRCLE-BERHAMPUR||RWDIVISION-GANJAM - II,Ganjam,760011.0,1.0,"13,45,000",LADU KISHORE TRINATH BEHERA,"1,142,631",Rejected-AOC,22-Sep-2022,CE RW I||RWCIRCLE-BERHAMPUR||RWDIVISION-GANJAM - II
2022_CERWI_80523_1,06/22-23,Special Repair to MDR 64 to Sikiri Giria Alapur road for the year 2022-23,Special Repair to MDR 64 to Sikiri Giria Alapur road for the year 2022-23,Works,National Competitive Bid,Percentage,Civil Works - Roads,No,No,NA ,16-Aug-2022 05:00 PM,NA ,90.0,No ,No,Online,22-Aug-2022 05:00 PM,CE RW I||RWCIRCLE-BERHAMPUR||RWDIVISION-GANJAM - II,Ganjam,760011.0,1.0,"8,41,000",BABA PRASAD PADHY,"714,237",Rejected-AOC,27-Sep-2022,CE RW I||RWCIRCLE-BERHAMPUR||RWDIVISION-GANJAM - II
2022_CERWI_80524_1,06/22-23,Special Repair to Sikharpur Sahapur road for the year 2022-23,Special Repair to Sikharpur Sahapur road for the year 2022-23,Works,National Competitive Bid,Percentage,Civil Works - Roads,No,No,NA ,16-Aug-2022 05:00 PM,NA ,90.0,No ,No,Online,22-Aug-2022 05:00 PM,CE RW I||RWCIRCLE-BERHAMPUR||RWDIVISION-GANJAM - II,Ganjam,760011.0,1.0,"16,81,000",Pradeep Kumar Sahu,"1,428,730",Rejected-AOC,22-Sep-2022,CE RW I||RWCIRCLE-BERHAMPUR||RWDIVISION-GANJAM - II
2022_CERWI_80525_1,06/22-23,Special Repair to SH-36 ( Bakilikana ) to Dengapadar road for the year 2022-23,Special Repair to SH-36 ( Bakilikana ) to Dengapadar road for the year 2022-23,Works,National Competitive Bid,Percentage,Civil Works - Roads,No,No,NA ,16-Aug-2022 05:00 PM,NA ,90.0,No ,No,Online,22-Aug-2022 05:00 PM,CE RW I||RWCIRCLE-BERHAMPUR||RWDIVISION-GANJAM - II,Ganjam,760011.0,1.0,"12,61,000",JAYARAM GOUDA,"1,071,487",Rejected-AOC,26-Sep-2022,CE RW I||RWCIRCLE-BERHAMPUR||RWDIVISION-GANJAM - II
2022_CERWI_80527_1,06/22-23,Special Repair to PWD road Sheragada to Ramakrishnapur road for the year 2022-23,Special Repair to PWD road Sheragada to Ramakrishnapur road for the year 2022-23,Works,National Competitive Bid,Percentage,Civil Works - Roads,No,No,NA ,16-Aug-2022 05:00 PM,NA ,90.0,No ,No,Online,22-Aug-2022 05:00 PM,CE RW I||RWCIRCLE-BERHAMPUR||RWDIVISION-GANJAM - II,Ganjam,760011.0,1.0,"8,41,000",Swapna Rani Choudhury,"714,198",Rejected-AOC,06-Sep-2022,CE RW I||RWCIRCLE-BERHAMPUR||RWDIVISION-GANJAM - II
2022_CERWI_80528_1,06/22-23,Special repair to Thuruburai Baliarsingpur road for the year 2022 23,Special repair to Thuruburai Baliarsingpur road for the year 2022 23,Works,National Competitive Bid,Percentage,Civil Works - Roads,No,No,NA ,16-Aug-2022 05:00 PM,NA ,90.0,No ,No,Online,22-Aug-2022 05:00 PM,CE RW I||RWCIRCLE-BERHAMPUR||RWDIVISION-GANJAM - II,Ganjam,760011.0,1.0,"5,05,000",HIMANSU SEKHAR TRIPATHY,"428,526",Rejected-AOC,06-Sep-2022,CE RW I||RWCIRCLE-BERHAMPUR||RWDIVISION-GANJAM - II
2022_CERWI_80529_1,06/22-23,Special repair to Badapahada to Kirtipur via Chhatradhepa Dhabalapur road for the year 2022 23,Special repair to Badapahada to Kirtipur via Chhatradhepa Dhabalapur road for the year 2022 23,Works,National Competitive Bid,Percentage,Civil Works - Roads,No,No,NA ,16-Aug-2022 05:00 PM,NA ,90.0,No ,No,Online,22-Aug-2022 05:00 PM,CE RW I||RWCIRCLE-BERHAMPUR||RWDIVISION-GANJAM - II,Ganjam,760011.0,1.0,"42,02,000",Sanatan Sethy,"3,571,706",Rejected-AOC,09-Sep-2022,CE RW I||RWCIRCLE-BERHAMPUR||RWDIVISION-GANJAM - II
2022_CERWI_80530_1,06/2022-23,Special repair to Alarigada to Khairabethi road for the year 2022 23,Special repair to Alarigada to Khairabethi road for the year 2022 23,Works,National Competitive Bid,Percentage,Civil Works - Roads,No,No,NA ,16-Aug-2022 05:00 PM,NA ,90.0,No ,No,Online,22-Aug-2022 05:00 PM,CE RW I||RWCIRCLE-BERHAMPUR||RWDIVISION-GANJAM - II,Ganjam,760011.0,1.0,"25,22,000",Ashok Kumar Nayak,"2,143,095",Rejected-AOC,09-Sep-2022,CE RW I||RWCIRCLE-BERHAMPUR||RWDIVISION-GANJAM - II
2022_CERWI_80636_1,06 OF 2022-23,SR to Damodarpur to Bilikana via Bangaraguntha road for the year 2022 23 such as New CC from ch 0600 mtr to 0830 mtr and CC repair from ch 0830 mtr to 1700 mtr.,SR to Damodarpur to Bilikana via Bangaraguntha road for the year 2022 23 such as New CC from ch 0600 mtr to 0830 mtr and CC repair from ch 0830 mtr to 1700 mtr.,Works,Open Tender,Percentage,Civil Works - Roads,No,No,NA ,20-Aug-2022 06:50 PM,NA ,90.0,No ,No,Online,29-Aug-2022 11:30 AM,CE RW I||RWCIRCLE-CUTTACK||RWDIVISION-JAJPUR-II,Jaraka,755050.0,1.0,"30,21,025",SAURAV BISWAL,"2,568,173",Rejected-Finance,27-Sep-2022,CE RW I||RWCIRCLE-CUTTACK||RWDIVISION-JAJPUR-II
2022_CERWI_80639_1,06 OF 2022-23,SR to RD road to Jhatiapada for the year 2022 23 such as construction of Retaining wall New CC and BT repair CC repair from ch 0983 mtr to 1000 mtr BT repair from ch 0573 mtr to 0983 mtr and from ch 1000 mtr to 1421mtr.,SR to RD road to Jhatiapada for the year 2022 23 such as construction of Retaining wall New CC and BT repair CC repair from ch 0983 mtr to 1000 mtr BT repair from ch 0573 mtr to 0983 mtr and from ch 1000 mtr to 1421mtr.,Works,Open Tender,Percentage,Civil Works - Roads,No,No,NA ,20-Aug-2022 06:50 PM,NA ,90.0,No ,No,Online,29-Aug-2022 11:30 AM,CE RW I||RWCIRCLE-CUTTACK||RWDIVISION-JAJPUR-II,Jaraka,755050.0,1.0,"8,36,950",SUSAMA SWAIN,"711,491",Rejected-Finance,19-Sep-2022,CE RW I||RWCIRCLE-CUTTACK||RWDIVISION-JAJPUR-II
2022_CERWI_80739_1,Online - SEJSG-03 of 2022-23,Repair to R.D. road to Gopipali for the year 2022-23.,Repair to R.D. road to Gopipali for the year 2022-23.,Works,Open Tender,Percentage,Civil Works - Roads,No,No,NA ,25-Aug-2022 12:00 PM,NA ,90.0,No ,No,Online,05-Sep-2022 11:00 AM,CE RW I||RW-CIRCLE-SUNDARGARH||RW-Division-Jharsuguda,Jharsuguda,768204.0,1.0,"15,91,000",NIRMAL PANDEY,"1,495,337",Rejected-Finance,23-Sep-2022,CE RW I||RW-CIRCLE-SUNDARGARH||RW-Division-Jharsuguda
2022_CERWI_80739_2,Online - SEJSG-03 of 2022-23,Repair to Punjipathar to Beheraguda road for the year 2022-23,Repair to Punjipathar to Beheraguda road for the year 2022-23,Works,Open Tender,Percentage,Civil Works - Roads,No,No,NA ,25-Aug-2022 12:00 PM,NA ,90.0,No ,No,Online,05-Sep-2022 11:00 AM,CE RW I||RW-CIRCLE-SUNDARGARH||RW-Division-Jharsuguda,Jharsuguda,768204.0,1.0,"18,03,000",NIRMAL PANDEY,"1,695,120",Rejected-Finance,23-Sep-2022,CE RW I||RW-CIRCLE-SUNDARGARH||RW-Division-Jharsuguda
2022_CERWI_80745_1,ETCN04/22-23-1,"42/5588-S/R to Anantapur PWD road to Malipur Chhak via Hatsahi, Harizanbasti,Saraswatipur road for 2022-23","42/5588-S/R to Anantapur PWD road to Malipur Chhak via Hatsahi, Harizanbasti,Saraswatipur road for 2022-23",Works,Open Tender,Percentage,Civil Works - Roads,No,No,NA ,25-Aug-2022 11:00 AM,NA ,90.0,No ,No,Online,02-Sep-2022 11:00 AM,CE RW I||RWCIRCLE-BALASORE||RWDIVISION-BALASORE-II,Balasore,756001.0,1.0,"23,89,107",MANAS RANJAN SAHOO,"2,396,556",Rejected-AOC,29-Sep-2022,CE RW I||RWCIRCLE-BALASORE||RWDIVISION-BALASORE-II
2022_EICCL_77691_3,SE (R and B) BLS-II-07/2022-23,Construction of Compound Wall at SDPO Office Jaleswar for the year 2022-23,Construction of Compound Wall at SDPO Office Jaleswar for the year 2022-23,Works,Open Tender,Percentage,Civil Works - Buildings,No,No,NA ,17-May-2022 10:00 AM,NA ,90.0,No ,No,Online,23-May-2022 04:30 PM,EIC-CIVIL||SERNB-CIRCLE-EASTERN||EERNB-DIVISION-BALASORE II,Balasore,756001.0,1.0,"8,79,543",SARMILA SETHI,"747,700",Rejected-Technical,29-Sep-2022,EIC-CIVIL||SERNB-CIRCLE-EASTERN||EERNB-DIVISION-BALASORE II
2022_EICCL_77851_1,Bid Identification No PWDK- 04 / 2022-23.,Renovation to Library of D. N. high School at Keonjhar for the year 2022-23 under DMF. (Civil and E.I.),Renovation to Library of D. N. high School at Keonjhar for the year 2022-23 under DMF. (Civil and E.I.),Works,Open Tender,Percentage,Civil Works - Buildings,No,No,NA ,20-May-2022 03:00 PM,NA ,90.0,No ,No,Online,03-Jun-2022 11:30 AM,EIC-CIVIL||SERNB-CIRCLE-KEONJHAR||EERNB-DIVN-KEONJHAR,Keonjhar,758001.0,1.0,,M/S VIJAY CONSTRUCTION AND CONSULTANCY,"1,062,423.28",Rejected-AOC,22-Sep-2022,EIC-CIVIL||SERNB-CIRCLE-KEONJHAR||EERNB-DIVN-KEONJHAR
2022_EICCL_77851_2,Bid Identification No PWDK- 04 / 2022-23.,"Repair and renovation of class room at D. N. High School, Keonjhar for the year 2022-23 under DMF.","Repair and renovation of class room at D. N. High School, Keonjhar for the year 2022-23 under DMF.",Works,Open Tender,Percentage,Civil Works - Buildings,No,No,NA ,20-May-2022 03:00 PM,NA ,90.0,No ,No,Online,03-Jun-2022 11:30 AM,EIC-CIVIL||SERNB-CIRCLE-KEONJHAR||EERNB-DIVN-KEONJHAR,Keonjhar,758001.0,1.0,,SUBRAT KUMAR SETHY,"2,608,519.71",Rejected-AOC,26-Sep-2022,EIC-CIVIL||SERNB-CIRCLE-KEONJHAR||EERNB-DIVN-KEONJHAR
2022_EICCL_78135_1,"C.C.E.K.C., Keonjhar No. 03 / 2022-23","Construction of 08 Nos. D Type quarter (G Plus 2) with a provision of stilt at Sundargarh (R and B) Division, Sundargarh for the year 2021-22","Construction of 08 Nos. D Type quarter (G Plus 2) with a provision of stilt at Sundargarh (R and B) Division, Sundargarh for the year 2021-22",Works,Open Tender,Percentage,Civil Works - Buildings,No,No,NA ,01-Jun-2022 09:00 AM,NA ,90.0,No ,No,Online,17-Jun-2022 11:30 AM,EIC-CIVIL||SERNB-CIRCLE-KEONJHAR,Sundargarh,770001.0,2.0,,M/S SAHARIA CONSTRUCTION,"20,166,020",Rejected-Finance,22-Sep-2022,EIC-CIVIL||SERNB-CIRCLE-KEONJHAR
2022_EICCL_78215_2,SE CTC (RandB)-08 of 2022-23,"Repair and renovation to Sishubhawan, Cuttack (such as External repair of OPD, MW No.1, MW No.2, MW No.3 and Lecture Theatre building) for the year 2022-23",Building works,Works,National Competitive Bid,Percentage,Civil Works - Buildings,No,No,NA ,04-Jun-2022 03:00 PM,NA ,90.0,No ,No,Online,18-Jun-2022 11:00 AM,EIC-CIVIL||SERNB-CIRCLE-CUTTACK||EERNB-DIVN-CUTTACK,Cuttack,753001.0,1.0,"12,65,233",SMT. BISMITA BEHERA,"1,075,574",Rejected-AOC,30-Sep-2022,EIC-CIVIL||SERNB-CIRCLE-CUTTACK||EERNB-DIVN-CUTTACK
2022_EICCL_78236_1,"C.C.E.K.C., Keonjhar No. 05/ 2022-23",Renewal coat with SDBC to Buxibarigaon - Bayapandadhar Road from 0/00 km to 24/869 km for the year 2022-23,Renewal coat with SDBC to Buxibarigaon - Bayapandadhar Road from 0/00 km to 24/869 km for the year 2022-23,Works,Open Tender,Percentage,Civil Works - Roads,No,No,NA ,06-Jun-2022 01:00 PM,NA ,90.0,No ,No,Online,22-Jun-2022 11:30 AM,EIC-CIVIL||SERNB-CIRCLE-KEONJHAR,Keonjhar,758001.0,2.0,,Rajesh Kumar Sahoo,"19,013,598",Rejected-Finance,22-Sep-2022,EIC-CIVIL||SERNB-CIRCLE-KEONJHAR
2022_EICCL_78857_1,Bid Identification No PWDK- 08 / 2022-23.,New construction of class room building for Anchalika Degree Mahavidyalaya at Padmapur in the district of Keonjhar for the year 2022-23.,New construction of class room building for Anchalika Degree Mahavidyalaya at Padmapur in the district of Keonjhar for the year 2022-23.,Works,Open Tender,Percentage,Civil Works - Buildings,No,No,NA ,21-Jun-2022 09:00 AM,NA ,90.0,No ,No,Online,29-Jun-2022 11:30 AM,EIC-CIVIL||SERNB-CIRCLE-KEONJHAR||EERNB-DIVN-KEONJHAR,Padmapur,758001.0,1.0,,M/S VIJAY CONSTRUCTION AND CONSULTANCY,"1,133,366.89",Rejected-AOC,26-Sep-2022,EIC-CIVIL||SERNB-CIRCLE-KEONJHAR||EERNB-DIVN-KEONJHAR
2022_EICCL_79616_1,Bid Identification No-SE-RandB-SNG-13 OF 2022-23,Construction of Drain on Subdega- Rajpur Road (ODR) from 15/400 Km to 16/000 Km for the year 2022-23.,Construction of Drain on Subdega- Rajpur Road (ODR) from 15/400 Km to 16/000 Km for the year 2022-23.,Works,Open Tender,Percentage,Civil Works - Roads,No,No,NA ,08-Jul-2022 10:00 AM,NA ,90.0,No ,No,Online,25-Jul-2022 11:00 AM,EIC-CIVIL||SERNB-CIRCLE-KEONJHAR||EERNB-DIVN-SUNDERGARH,Sundargarh,770001.0,1.0,"35,67,404",Debaraj Sethi,"3,032,650.56",Rejected-AOC,22-Sep-2022,EIC-CIVIL||SERNB-CIRCLE-KEONJHAR||EERNB-DIVN-SUNDERGARH
2022_EICCL_79616_2,Bid Identification No-SE-RandB-SNG-13 OF 2022-23,"P/R to Rangadhipa to Patrapali , via Sunaripada BS High School , Sub- Collector Residence, Block Colony , Womens College and LIC Office from 0/00 Km to 4/00 Km","P/R to Rangadhipa to Patrapali , via Sunaripada BS High School , Sub- Collector Residence, Block Colony , Womens College and LIC Office from 0/00 Km to 4/00 Km",Works,Open Tender,Percentage,Civil Works - Roads,No,No,NA ,08-Jul-2022 10:00 AM,NA ,90.0,No ,No,Online,25-Jul-2022 11:00 AM,EIC-CIVIL||SERNB-CIRCLE-KEONJHAR||EERNB-DIVN-SUNDERGARH,Sundargarh,770001.0,1.0,"44,63,905",Debajyoti millennium pvt ltd,"3,794,765.61",Rejected-AOC,22-Sep-2022,EIC-CIVIL||SERNB-CIRCLE-KEONJHAR||EERNB-DIVN-SUNDERGARH
2022_IDCL_79501_1,IDCOL/E-PROC/MIN/1688/2022 dated 30.06.2022,"Preparation, Submission and obtaining approval of Final Mine Closure Plan (FMCP) for total area of 65.683 ha. of Talangi Chromite Mines of the Industrial Development Corporation of Odisha Limited(IDCOL) in the district of Jajpur, Odisha","Preparation, Submission and obtaining approval of Final Mine Closure Plan (FMCP) for total area of 65.683 ha. of Talangi Chromite Mines of the Industrial Development Corporation of Odisha Limited(IDCOL) in the district of Jajpur, Odisha",Services,Open Tender,Item Rate,Miscellaneous Services,No,No,NA ,05-Jul-2022 11:00 AM,NA ,90.0,No ,No,Online,19-Jul-2022 05:30 PM,Industrial Development Corporation of Odisha Limited,Talangi Chromite Mines Jajpur Road of IDCOL,755028.0,2.0,,CRACKERS INDIA MINING PVT LTD,"655,844",Accepted-AOC,02-Sep-2022,Industrial Development Corporation of Odisha Limited
2022_IDCO_78463_1,Civil/Est/15/2022-23,"Selection and Engagement of Agency for Design, Supply, Installation, Testing and Commissioning of ICCC with Video Wall, Workstation, Server and UPS Room with acoustic treatments for Wall and Ceiling including Allied Civil Works to retrofit the area","Selection and Engagement of Agency for Design, Supply, Installation, Testing and Commissioning of ICCC with Video Wall, Workstation, Server and UPS Room with acoustic treatments for Wall and Ceiling including Allied Civil Works to retrofit the area",Services,National Competitive Bid,Item Rate,Miscellaneous Services,No,No,NA ,10-Jun-2022 06:30 PM,17-Jun-2022 11:30 AM ,90.0,No ,No,Online,28-Jun-2022 05:30 PM,IDCO||IDCO||IDCO,"krushibhawan ,bhubaneswar",751001.0,2.0,,Prakalpa Contracts Private Limited,"26,696,050",Rejected-Technical,16-Sep-2022,IDCO||IDCO||IDCO
2022_OBCC_78698_6,NO. 10/TOLL/OBCC/2022-23,Mohanadi Bridge toll gate at Mundali on Naraj Athgarh Mundali road.,Mohanadi Bridge toll gate at Mundali on Naraj Athgarh Mundali road.,Works,Open Tender,Lump-sum,Toll Gate,No,No,NA ,20-Jun-2022 10:30 AM,NA ,90.0,No ,No,Online,29-Jun-2022 11:30 AM,Orissa Bridge and Construction Corporation Ltd,Athagarh,754029.0,2.0,"1,93,77,773",ARUNA KUMAR MOHANTY,"22,121,777.77",Accepted-AOC,03-Sep-2022,Orissa Bridge and Construction Corporation Ltd
2022_OBCC_80145_3,NO. 17/TOLL/OBCC/2022-23,Cuttack Paradeep road toll gate near Kandarpur.,Cuttack Paradeep road toll gate near Kandarpur.,Works,Open Tender,Lump-sum,Toll Gate,No,No,NA ,29-Jul-2022 05:30 PM,NA ,90.0,No ,No,Online,10-Aug-2022 11:30 AM,Orissa Bridge and Construction Corporation Ltd,Fakirpada,754100.0,2.0,"3,21,00,000",AMARESH PARIJA,"33,599,999",Accepted-AOC,28-Sep-2022,Orissa Bridge and Construction Corporation Ltd
2022_OBCC_80145_9,NO. 17/TOLL/OBCC/2022-23,Chorda Duburi road toll gate at 15/00 K.M. of the road near Duburi,Chorda Duburi road toll gate at 15/00 K.M. of the road near Duburi,Works,Open Tender,Lump-sum,Toll Gate,No,No,NA ,29-Jul-2022 05:30 PM,NA ,90.0,No ,No,Online,10-Aug-2022 11:30 AM,Orissa Bridge and Construction Corporation Ltd,Duburi,755026.0,2.0,"3,86,89,999",KARAMVIR,"43,114,165",Rejected-AOC,30-Sep-2022,Orissa Bridge and Construction Corporation Ltd
2022_OCTDM_76102_13,OIIPCRA-W2-1/2022,Mahadevbandha MIP inAska block package ID GAM-79 in Ganjam District,Construction of Civil CAD-WM Works of Mahadevbandha Minor Irrigation Project Package ID GAM-79 in Ganjam District,Works,National Competitive Bid,Item Rate,Civil Works - Others,No,No,NA ,07-Mar-2022 10:00 AM,22-Mar-2022 11:30 AM ,90.0,No ,No,Both(Online/Offline),07-Apr-2022 03:30 PM,Orissa Community Tank Development and Management Society,Aska,761110.0,2.0,,Girish Kumar Tripathy,"6,400,436",Accepted-AOC,19-Sep-2022,Orissa Community Tank Development and Management Society
2022_OCTDM_76102_14,OIIPCRA-W2-1/2022,Badaghai Jogimari MIP in Bhanjanagar block package ID GAM-80 in Ganjam District,Construction of Civil Works of Badaghai Jogimari Minor Irrigation Project Package ID GAM-80 in Ganjam District,Works,National Competitive Bid,Item Rate,Civil Works - Others,No,No,NA ,07-Mar-2022 10:00 AM,22-Mar-2022 11:30 AM ,90.0,No ,No,Both(Online/Offline),07-Apr-2022 03:30 PM,Orissa Community Tank Development and Management Society,Bhanjanagar,761126.0,2.0,,Lambodar Samantra,"3,319,151",Accepted-AOC,20-Sep-2022,Orissa Community Tank Development and Management Society
2022_OCTDM_76102_15,OIIPCRA-W2-1/2022,PokasungaAgulaMIP in Bellaguntha block package ID GAM-81 in Ganjam District,Construction of Civil Works of Pokasunga Agula Minor Irrigation Project Package ID GAM-81 in Ganjam District,Works,National Competitive Bid,Item Rate,Civil Works - Others,No,No,NA ,07-Mar-2022 10:00 AM,22-Mar-2022 11:30 AM ,90.0,No ,No,Both(Online/Offline),07-Apr-2022 03:30 PM,Orissa Community Tank Development and Management Society,Bellaguntha,761119.0,2.0,,Prakash Chandra Sahu,"3,152,027.46",Rejected-Technical,20-Sep-2022,Orissa Community Tank Development and Management Society
2022_OCTDM_76102_18,OIIPCRA-W2-1/2022,Aligudighai MIP in Soroda block package ID GAM-84 in Ganjam District,Construction of Civil Works of Aligudighai Minor Irrigation Project Package ID GAM-84 in Ganjam District,Works,National Competitive Bid,Item Rate,Civil Works - Others,No,No,NA ,07-Mar-2022 10:00 AM,22-Mar-2022 11:30 AM ,90.0,No ,No,Both(Online/Offline),07-Apr-2022 03:30 PM,Orissa Community Tank Development and Management Society,Soroda,761108.0,2.0,,Surendranath Gouda,"2,282,159",Rejected-Finance,20-Sep-2022,Orissa Community Tank Development and Management Society
2022_OCTDM_76102_19,OIIPCRA-W2-1/2022,Badabandha Kaithada MIP in Dharakote block package ID GAM-85 in Ganjam District,Construction of Civil Works of Badabandha Kaithada Minor Irrigation Project Package ID GAM-85 in Ganjam District,Works,National Competitive Bid,Item Rate,Civil Works - Others,No,No,NA ,07-Mar-2022 10:00 AM,22-Mar-2022 11:30 AM ,90.0,No ,No,Both(Online/Offline),07-Apr-2022 03:30 PM,Orissa Community Tank Development and Management Society,Dharakote,761107.0,2.0,,UPAMANYU MAHAKHUD,"2,109,658",Rejected-Finance,20-Sep-2022,Orissa Community Tank Development and Management Society
2022_OCTDM_76102_21,OIIPCRA-W2-1/2022,Samarbandha MIP in JNPrasad Block Package ID GAM-87 in Ganjam District,Construction of Civil Works of Samarbandha Minor Irrigation Project Package ID GAM-87 in Ganjam District,Works,National Competitive Bid,Item Rate,Civil Works - Others,No,No,NA ,07-Mar-2022 10:00 AM,22-Mar-2022 11:30 AM ,90.0,No ,No,Both(Online/Offline),07-Apr-2022 03:30 PM,Orissa Community Tank Development and Management Society,JNPrasad,761121.0,2.0,,Prakash Chandra Sahu,"5,714,398",Accepted-AOC,20-Sep-2022,Orissa Community Tank Development and Management Society
2022_OCTDM_76102_22,OIIPCRA-W2-1/2022,Jharanalla MIP in Soroda Block Package ID GAM-88 in Ganjam District,Construction of Civil Works of Jharanalla Minor Irrigation Project Package ID GAM-88 in Ganjam District,Works,National Competitive Bid,Item Rate,Civil Works - Others,No,No,NA ,07-Mar-2022 10:00 AM,22-Mar-2022 11:30 AM ,90.0,No ,No,Both(Online/Offline),07-Apr-2022 03:30 PM,Orissa Community Tank Development and Management Society,Soroda,761108.0,2.0,,Surendranath Gouda,"2,569,480",Rejected-Finance,20-Sep-2022,Orissa Community Tank Development and Management Society
2022_OCTDM_76102_24,OIIPCRA-W2-1/2022,Banaghai Kunjaban MIP in Buguda Block Package ID GAM-90 in Ganjam District,Construction of Civil Works of Banaghai Kunjaban Minor Irrigation Project Package ID GAM-90 in Ganjam District,Works,National Competitive Bid,Item Rate,Civil Works - Others,No,No,NA ,07-Mar-2022 10:00 AM,22-Mar-2022 11:30 AM ,90.0,No ,No,Both(Online/Offline),07-Apr-2022 03:30 PM,Orissa Community Tank Development and Management Society,Buguda,761118.0,2.0,,Girish Kumar Tripathy,"1,137,991",Accepted-AOC,20-Sep-2022,Orissa Community Tank Development and Management Society
2022_OCTDM_76102_27,OIIPCRA-W2-1/2022,Bagadghai Bananai MIP in Purushottampur Block Package ID GAM-93 in Ganjam District,Construction of Civil CADWM Works of Bagadghai Banana iMinor Irrigation Project Package ID GAM-93 in Ganjam District,Works,National Competitive Bid,Item Rate,Civil Works - Roads,No,No,NA ,07-Mar-2022 10:00 AM,22-Mar-2022 11:30 AM ,90.0,No ,No,Both(Online/Offline),07-Apr-2022 03:30 PM,Orissa Community Tank Development and Management Society,Purushottampur,761018.0,2.0,,G.Gopal Rao Dora,"12,976,699",Accepted-AOC,20-Sep-2022,Orissa Community Tank Development and Management Society
2022_OCTDM_76102_28,OIIPCRA-W2-1/2022,Sahabandha at Sunathara MIP in Purushottampur Block Package ID GAM-94 in Ganjam District,Construction of Civil CAD-WM Works of Sahabandha at Sunathara Minor Irrigation Project Package ID GAM-94 in Ganjam District,Works,National Competitive Bid,Item Rate,Civil Works - Others,No,No,NA ,07-Mar-2022 10:00 AM,22-Mar-2022 11:30 AM ,90.0,No ,No,Both(Online/Offline),07-Apr-2022 03:30 PM,Orissa Community Tank Development and Management Society,Purushottampur,761108.0,2.0,,Subash Chandra Mohapatra,"9,408,612",Rejected-Technical,19-Sep-2022,Orissa Community Tank Development and Management Society
2022_OCTDM_76102_29,OIIPCRA-W2-1/2022,Gramabandha MIP at SRatanpalli MIP in Purushottampur block Package ID GAM-95 in Ganjam District,Construction of Civil CAD-WM Works of Gramabandha MIP at SRatanpalli Minor Irrigation Project Package ID GAM-95 in Ganjam District,Works,National Competitive Bid,Item Rate,Civil Works - Others,No,No,NA ,07-Mar-2022 10:00 AM,22-Mar-2022 11:30 AM ,90.0,No ,No,Both(Online/Offline),07-Apr-2022 03:30 PM,Orissa Community Tank Development and Management Society,Purushottampur,761108.0,2.0,,Prakash Chandra Sahu,"7,475,663.23",Accepted-AOC,20-Sep-2022,Orissa Community Tank Development and Management Society
2022_OCTDM_76102_3,OIIPCRA-W2-1/2022,Bananalla Sorisballi MIP package ID GAM-58 in Ganjam District,Construction of Civil CADWM Works of Bananalla Sorisballi Minor Irrigation Project Package ID GAM-58 in Ganjam District,Works,National Competitive Bid,Item Rate,Civil Works - Others,No,No,NA ,07-Mar-2022 10:00 AM,22-Mar-2022 11:30 AM ,90.0,No ,No,Both(Online/Offline),07-Apr-2022 03:30 PM,Orissa Community Tank Development and Management Society,Soroda,761108.0,2.0,,Surendranath Gouda,"9,026,926.24",Accepted-AOC,13-Sep-2022,Orissa Community Tank Development and Management Society
2022_OCTDM_76102_30,OIIPCRA-W2-1/2022,Pattapokhari/Etapokhari MIP in Purushottampur block Package ID GAM-96 in Ganjam District,Construction of Civil CAD-WM Works of Pattapokhari/Etapokhari Minor Irrigation Project Package ID GAM-96 in Ganjam District,Works,National Competitive Bid,Item Rate,Civil Works - Others,No,No,NA ,07-Mar-2022 09:00 AM,22-Mar-2022 11:30 AM ,90.0,No ,No,Both(Online/Offline),07-Apr-2022 03:30 PM,Orissa Community Tank Development and Management Society,Purushottampur,761108.0,2.0,,Prakash Chandra Sahu,"12,779,953",Accepted-AOC,20-Sep-2022,Orissa Community Tank Development and Management Society
2022_OCTDM_76102_32,OIIPCRA-W2-1/2022,NaradaTankMIP in Purushottampur Block Package ID GAM-98 in Ganjam District,Construction of Civil Works of NaradaTank Minor Irrigation Project Package ID GAM-98 in Ganjam District,Works,National Competitive Bid,Item Rate,Civil Works - Others,No,No,NA ,07-Mar-2022 10:00 AM,22-Mar-2022 11:30 AM ,90.0,No ,No,Both(Online/Offline),07-Apr-2022 03:30 PM,Orissa Community Tank Development and Management Society,Purushottampur,761018.0,2.0,,Subash Chandra Mohapatra,"6,051,483",Rejected-Finance,21-Sep-2022,Orissa Community Tank Development and Management Society
