2022_CERWI_79040_1,04 2022 23,Veteswara to Banloi road,Veteswara to Banloi road,Works,Open Tender,Percentage,Civil Works - Roads,No,No,NA ,23-Jun-2022 05:00 PM,NA ,90.0,No ,No,Online,04-Jul-2022 11:00 AM,CE RW I||RWCIRCLE-BHUBANESWAR||RWDIVISION-BHUBANESWAR,Khordha,751013.0,1.0,"7,49,986",PRADEEP KUMAR SAHOO,"637,563",Rejected-Finance,02-Sep-2022,CE RW I||RWCIRCLE-BHUBANESWAR||RWDIVISION-BHUBANESWAR
2022_CERWI_79042_1,04 2022 23,Banapur to Pratap via Kumaranga road,Banapur to Pratap via Kumaranga road,Works,Open Tender,Percentage,Civil Works - Roads,No,No,NA ,23-Jun-2022 05:00 PM,NA ,90.0,No ,No,Online,04-Jul-2022 11:00 AM,CE RW I||RWCIRCLE-BHUBANESWAR||RWDIVISION-BHUBANESWAR,Khordha,751013.0,1.0,"9,99,825",SUDHANSU SEKHAR JAGADEV,"849,951",Rejected-Finance,27-Sep-2022,CE RW I||RWCIRCLE-BHUBANESWAR||RWDIVISION-BHUBANESWAR
2022_CERWI_79043_1,04 2022 23,PWD road to Bengarajpalli road,PWD road to Bengarajpalli road,Works,Open Tender,Percentage,Civil Works - Roads,No,No,NA ,23-Jun-2022 05:00 PM,NA ,90.0,No ,No,Online,04-Jul-2022 11:00 AM,CE RW I||RWCIRCLE-BHUBANESWAR||RWDIVISION-BHUBANESWAR,Khordha,751013.0,1.0,"9,99,815",KAMALJIT PRADHAN,"849,943",Rejected-Finance,16-Sep-2022,CE RW I||RWCIRCLE-BHUBANESWAR||RWDIVISION-BHUBANESWAR
2022_CERWI_79046_1,05 2022 23,N.H. 203 to Sisupalagarh road,N.H. 203 to Sisupalagarh road,Works,National Competitive Bid,Percentage,Civil Works - Roads,No,No,NA ,23-Jun-2022 05:00 PM,NA ,90.0,No ,No,Online,07-Jul-2022 11:00 AM,CE RW I||RWCIRCLE-BHUBANESWAR||RWDIVISION-BHUBANESWAR,Khordha,751013.0,2.0,"89,99,460",RATI RANJAN JENA,"7,650,441",Rejected-AOC,06-Sep-2022,CE RW I||RWCIRCLE-BHUBANESWAR||RWDIVISION-BHUBANESWAR
2022_CERWI_79051_1,TCN-01/RWD-II,Repair and Maintenance of Asura to Sabaranga Road for the year 2022-23 in the District of Bhadrak,Repair and Maintenance of Asura to Sabaranga Road for the year 2022-23 in the District of Bhadrak,Works,Open Tender,Percentage,Miscellaneous Works,No,No,NA ,27-Jun-2022 03:00 PM,NA ,90.0,No ,No,Online,05-Jul-2022 11:00 AM,CE RW I||RWCIRCLE-BALASORE||RWDIVISION-BHADRAK-II,Bhadrak,756100.0,1.0,"8,85,057",RANJIT KUMAR LAHA,"752,387",Rejected-AOC,24-Sep-2022,CE RW I||RWCIRCLE-BALASORE||RWDIVISION-BHADRAK-II
2022_CERWI_79060_1,TCN-01/RWD-II,Repair and Maintenanace of Defence Road to Gokulpur Road for the year 2022-23 in the District of Bhadrak,Repair and Maintenanace of Defence Road to Gokulpur Road for the year 2022-23 in the District of Bhadrak,Works,Open Tender,Percentage,Miscellaneous Works,No,No,NA ,27-Jun-2022 03:00 PM,NA ,90.0,No ,No,Online,05-Jul-2022 11:00 AM,CE RW I||RWCIRCLE-BALASORE||RWDIVISION-BHADRAK-II,Bhadrak,756100.0,1.0,"13,27,371",PRAKASH CHANDRA SETHI,"1,128,398",Rejected-AOC,24-Sep-2022,CE RW I||RWCIRCLE-BALASORE||RWDIVISION-BHADRAK-II
2022_CERWI_79064_1,04 2022 23,NH5 to Kasipur road,NH5 to Kasipur road,Works,Open Tender,Percentage,Civil Works - Roads,No,No,NA ,24-Jun-2022 11:00 AM,NA ,90.0,No ,No,Online,04-Jul-2022 11:00 AM,CE RW I||RWCIRCLE-BHUBANESWAR||RWDIVISION-BHUBANESWAR,Khordha,751013.0,1.0,"5,99,837",MANORANJAN PRADHAN,"509,921",Rejected-Finance,06-Sep-2022,CE RW I||RWCIRCLE-BHUBANESWAR||RWDIVISION-BHUBANESWAR
2022_CERWI_79066_1,02 of 2022 23,Improvement to NH Jn to Labanyapadar PMGSY road such as porthole repair berm filling CD painting work from 0 to 3080 mtr under SR for the year 2022 23,Improvement to NH Jn to Labanyapadar PMGSY road such as porthole repair berm filling CD painting work from 0 to 3080 mtr under SR for the year 2022 23,Works,Open Tender,Percentage,Civil Works - Roads,No,No,NA ,24-Jun-2022 10:00 AM,NA ,90.0,No ,No,Online,11-Jul-2022 11:00 AM,CE RW I||RWCIRCLE-SUNABEDA||RWDIVISION-NAWARANGAPUR,Papadahandi,764071.0,1.0,"5,30,826",KISHORE CHANDRA HARIJAN,"451,255",Rejected-AOC,24-Sep-2022,CE RW I||RWCIRCLE-SUNABEDA||RWDIVISION-NAWARANGAPUR
2022_CERWI_79076_1,TCN-01/RWD-II,Repair and Maintenance to Dhusuri to Gopabandhunagar road (Dhusuri-Hasnabad) Road for the year 2022-23 in the District of Bhadrak.,Repair and Maintenance to Dhusuri to Gopabandhunagar road (Dhusuri-Hasnabad) Road for the year 2022-23 in the District of Bhadrak.,Works,Open Tender,Percentage,Miscellaneous Works,No,No,NA ,27-Jun-2022 03:00 PM,NA ,90.0,No ,No,Online,05-Jul-2022 11:00 AM,CE RW I||RWCIRCLE-BALASORE||RWDIVISION-BHADRAK-II,Bhadrak,756100.0,1.0,"7,07,982",Nanda Kishore Sahoo,"601,855",Rejected-AOC,24-Sep-2022,CE RW I||RWCIRCLE-BALASORE||RWDIVISION-BHADRAK-II
2022_CERWI_79087_1,02 of 2022 23,Improvement to Sunadangri to Kaliaguda PMGSY road such as New Boxcell Culvert 6x3m double span at 1950 mtr under SR for the year 2022 23,Improvement to Sunadangri to Kaliaguda PMGSY road such as New Boxcell Culvert 6x3m double span at 1950 mtr under SR for the year 2022 23,Works,Open Tender,Percentage,Civil Works - Roads,No,No,NA ,24-Jun-2022 10:00 AM,NA ,90.0,No ,No,Online,11-Jul-2022 11:00 AM,CE RW I||RWCIRCLE-SUNABEDA||RWDIVISION-NAWARANGAPUR,Papadahandi,764070.0,1.0,"31,85,670",BHAGABAN BEHERA,"2,708,138",Rejected-AOC,24-Sep-2022,CE RW I||RWCIRCLE-SUNABEDA||RWDIVISION-NAWARANGAPUR
2022_CERWI_79097_1,04 2022 23,Bhagabati temple to Bhuskapada road,Bhagabati temple to Bhuskapada road,Works,Open Tender,Percentage,Civil Works - Roads,No,No,NA ,24-Jun-2022 01:00 PM,NA ,90.0,No ,No,Online,04-Jul-2022 11:00 AM,CE RW I||RWCIRCLE-BHUBANESWAR||RWDIVISION-BHUBANESWAR,Khordha,751013.0,1.0,"24,99,801",SUDHANSU SEKHAR JAGADEV,"2,125,081",Rejected-AOC,27-Sep-2022,CE RW I||RWCIRCLE-BHUBANESWAR||RWDIVISION-BHUBANESWAR
2022_CERWI_79101_1,TCN-01/RWD-II,Repair and Maintenance of BC Road to Palaspur Road for the year 2022-23 in the District of Bhadrak,Repair and Maintenance of BC Road to Palaspur Road for the year 2022-23 in the District of Bhadrak,Works,Open Tender,Percentage,Miscellaneous Works,No,No,NA ,27-Jun-2022 03:00 PM,NA ,90.0,No ,No,Online,05-Jul-2022 11:00 AM,CE RW I||RWCIRCLE-BALASORE||RWDIVISION-BHADRAK-II,Bhadrak,756100.0,1.0,"10,61,970",RAGHUNATH MALIK,"902,781",Rejected-AOC,26-Sep-2022,CE RW I||RWCIRCLE-BALASORE||RWDIVISION-BHADRAK-II
2022_CERWI_79103_1,TCN-01/RWD-II,Repair and Maintenance to Chandimandira to Motto Aradi road via Krushnapur and Barampur road for the year 2022-23 in the District of Bhadrak.,Repair and Maintenance to Chandimandira to Motto Aradi road via Krushnapur and Barampur road for the year 2022-23 in the District of Bhadrak.,Works,Open Tender,Percentage,Miscellaneous Works,No,No,NA ,27-Jun-2022 03:00 PM,NA ,90.0,No ,No,Online,05-Jul-2022 11:00 AM,CE RW I||RWCIRCLE-BALASORE||RWDIVISION-BHADRAK-II,Bhadrak,756100.0,1.0,"13,27,476",RAGHUNATH MALIK,"1,128,488",Rejected-AOC,24-Sep-2022,CE RW I||RWCIRCLE-BALASORE||RWDIVISION-BHADRAK-II
2022_CERWI_79108_1,TCN-01/RWD-II,Repair and Maintenance to RD road to Balipatana road for the year 2022-23 in the District of Bhadrak.,Repair and Maintenance to RD road to Balipatana road for the year 2022-23 in the District of Bhadrak.,Works,Open Tender,Percentage,Miscellaneous Works,No,No,NA ,27-Jun-2022 03:00 PM,NA ,90.0,No ,No,Online,05-Jul-2022 11:00 AM,CE RW I||RWCIRCLE-BALASORE||RWDIVISION-BHADRAK-II,Bhadrak,756100.0,1.0,"21,23,673",Chittaranjan Ghosh,"1,805,335",Rejected-AOC,24-Sep-2022,CE RW I||RWCIRCLE-BALASORE||RWDIVISION-BHADRAK-II
2022_CERWI_79111_1,TCN-01/RWD-II,Repair and Maintenance to Karanjamal - Guansol Road for the year 2022-23in the District of Bhadrak.,Repair and Maintenance to Karanjamal - Guansol Road for the year 2022-23in the District of Bhadrak.,Works,Open Tender,Percentage,Miscellaneous Works,No,No,NA ,27-Jun-2022 03:00 PM,NA ,90.0,No ,No,Online,05-Jul-2022 11:00 AM,CE RW I||RWCIRCLE-BALASORE||RWDIVISION-BHADRAK-II,Bhadrak,756100.0,1.0,"26,54,671",SANJEEB KUMAR BEHERA,"2,256,735.99",Rejected-AOC,23-Sep-2022,CE RW I||RWCIRCLE-BALASORE||RWDIVISION-BHADRAK-II
2022_CERWI_79133_1,TCN-01/RWD-II,Repair and Maintenance of Gadi to Khadalpokhari Road for the Year 2022-23 in the District of Bhadrak,Repair and Maintenance of Gadi to Khadalpokhari Road for the Year 2022-23 in the District of Bhadrak,Works,Open Tender,Percentage,Miscellaneous Works,No,No,NA ,27-Jun-2022 03:00 PM,NA ,90.0,No ,No,Online,05-Jul-2022 11:00 AM,CE RW I||RWCIRCLE-BALASORE||RWDIVISION-BHADRAK-II,Bhadrak,756100.0,1.0,"10,61,748",BASANTI LATA SAHOO,"902,592",Rejected-AOC,24-Sep-2022,CE RW I||RWCIRCLE-BALASORE||RWDIVISION-BHADRAK-II
2022_CERWI_79145_1,TCN-01/RWD-II,Repair and Maintenance to L89- T5 to Baliapal to Brahmatikiri road for the year 2022-23 in the District of Bhadrak,Repair and Maintenance to L89- T5 to Baliapal to Brahmatikiri road for the year 2022-23 in the District of Bhadrak,Works,Open Tender,Percentage,Miscellaneous Works,No,No,NA ,27-Jun-2022 03:00 PM,NA ,90.0,No ,No,Online,05-Jul-2022 11:00 AM,CE RW I||RWCIRCLE-BALASORE||RWDIVISION-BHADRAK-II,Bhadrak,756100.0,1.0,"13,27,594",Biswaranjan Samal,"1,128,588",Rejected-AOC,26-Sep-2022,CE RW I||RWCIRCLE-BALASORE||RWDIVISION-BHADRAK-II
2022_CERWI_79149_1,02/2022-23,A/E to MPV-12 to MPV-14 to MPV-15 Road for the year 2022-23.,A/E to MPV-12 to MPV-14 to MPV-15 Road for the year 2022-23.,Works,Open Tender,Percentage,Civil Works - Roads,No,No,NA ,25-Jun-2022 11:00 AM,NA ,90.0,No ,No,Online,06-Jul-2022 11:00 AM,CE RW I||RWCIRCLE-SUNABEDA||RWDIVISION-MALKANGIRI - II,Malkangiri,764048.0,1.0,"22,12,509",BASUDEV RAO,"1,880,854",Rejected-Finance,09-Sep-2022,CE RW I||RWCIRCLE-SUNABEDA||RWDIVISION-MALKANGIRI - II
2022_CERWI_79155_1,TCN-01/RWD-II,Repair and maintenance to Bhandaripokhari Block HD QRs to Manjuri road for the year 2022-23 in the District of Bhadrak.,Repair and maintenance to Bhandaripokhari Block HD QRs to Manjuri road for the year 2022-23 in the District of Bhadrak,Works,Open Tender,Percentage,Miscellaneous Works,No,No,NA ,27-Jun-2022 03:00 PM,NA ,90.0,No ,No,Online,05-Jul-2022 11:00 AM,CE RW I||RWCIRCLE-BALASORE||RWDIVISION-BHADRAK-II,Bhadrak,756100.0,1.0,"22,12,361",PRAVAT KUMAR SAHOO,"1,880,728",Rejected-AOC,24-Sep-2022,CE RW I||RWCIRCLE-BALASORE||RWDIVISION-BHADRAK-II
2022_CERWI_79156_1,02/2022-23,A/E TO MV-65 TO MPV-15 ROAD TO MPV-17 ROAD FOR THE YEAR 2022-23,A/E TO MV-65 TO MPV-15 ROAD TO MPV-17 ROAD FOR THE YEAR 2022-23,Works,Open Tender,Percentage,Civil Works - Roads,No,No,NA ,25-Jun-2022 11:00 AM,NA ,90.0,No ,No,Online,06-Jul-2022 11:00 AM,CE RW I||RWCIRCLE-SUNABEDA||RWDIVISION-MALKANGIRI - II,Malkangiri,764048.0,1.0,"44,24,819",PUSPALATA MOHANTY,"3,761,539",Rejected-Finance,09-Sep-2022,CE RW I||RWCIRCLE-SUNABEDA||RWDIVISION-MALKANGIRI - II
2022_CERWI_79161_1,02/2022-23,A/E to tumguda to Gumukaguda Road for the Year 2022-23,A/E to tumguda to Gumukaguda Road for the Year 2022-23,Works,Open Tender,Percentage,Civil Works - Roads,No,No,NA ,25-Jun-2022 11:00 AM,NA ,90.0,No ,No,Online,06-Jul-2022 11:00 AM,CE RW I||RWCIRCLE-SUNABEDA||RWDIVISION-MALKANGIRI - II,Malkangiri,764048.0,1.0,"46,02,035",Raj Kumar Sahu,"3,912,190",Rejected-Finance,09-Sep-2022,CE RW I||RWCIRCLE-SUNABEDA||RWDIVISION-MALKANGIRI - II
2022_CERWI_79162_1,02/2022-23,A/E to Link Road to MV-18 to MPV-04 Road for the Year 2022-23,A/E to Link Road to MV-18 to MPV-04 Road for the Year 2022-23,Works,Open Tender,Percentage,Civil Works - Roads,No,No,NA ,25-Jun-2022 11:00 AM,NA ,90.0,No ,No,Online,06-Jul-2022 11:00 AM,CE RW I||RWCIRCLE-SUNABEDA||RWDIVISION-MALKANGIRI - II,Malkangiri,764048.0,1.0,"7,07,985",SANJAY BISWAS,"601,858",Rejected-Finance,09-Sep-2022,CE RW I||RWCIRCLE-SUNABEDA||RWDIVISION-MALKANGIRI - II
2022_CERWI_79163_1,02/2022-23,A/E to MV-80 to MPV-47 Road in the district of Malkangiri for the Year 2022-23,A/E to MV-80 to MPV-47 Road in the district of Malkangiri for the Year 2022-23,Works,Open Tender,Percentage,Civil Works - Roads,No,No,NA ,25-Jun-2022 11:00 AM,NA ,90.0,No ,No,Online,06-Jul-2022 11:00 AM,CE RW I||RWCIRCLE-SUNABEDA||RWDIVISION-MALKANGIRI - II,Malkangiri,764048.0,1.0,"7,07,986",SANDEEP HALDER,"601,859",Rejected-Finance,09-Sep-2022,CE RW I||RWCIRCLE-SUNABEDA||RWDIVISION-MALKANGIRI - II
2022_CERWI_79164_1,02/2022-23,A/E to MV-56 to MV-125 Road in the District of Malkangiri for the year 2022-23.,A/E to MV-56 to MV-125 Road in the District of Malkangiri for the year 2022-23.,Works,Open Tender,Percentage,Civil Works - Roads,No,No,NA ,25-Jun-2022 11:00 AM,NA ,90.0,No ,No,Online,06-Jul-2022 11:00 AM,CE RW I||RWCIRCLE-SUNABEDA||RWDIVISION-MALKANGIRI - II,Malkangiri,764048.0,1.0,"7,08,014",PRAHALLAD DAS,"601,883",Rejected-Finance,09-Sep-2022,CE RW I||RWCIRCLE-SUNABEDA||RWDIVISION-MALKANGIRI - II
2022_CERWI_79165_1,TCN-01/RWD-II,Repair and Maintenance to PWD road to Jayatira road for the year 2022-23 in the District of Bhadrak.,Repair and Maintenance to PWD road to Jayatira road for the year 2022-23 in the District of Bhadrak.,Works,Open Tender,Percentage,Miscellaneous Works,No,No,NA ,27-Jun-2022 03:00 PM,NA ,90.0,No ,No,Online,05-Jul-2022 11:00 AM,CE RW I||RWCIRCLE-BALASORE||RWDIVISION-BHADRAK-II,Bhadrak,756100.0,1.0,"13,27,489",Kailash Chandra Biswal,"1,128,499",Rejected-AOC,24-Sep-2022,CE RW I||RWCIRCLE-BALASORE||RWDIVISION-BHADRAK-II
2022_CERWI_79166_1,TCN-01/RWD-II,Repair and Maintenance to PWD road to Astak road for the year 2022-23 in the District of Bhadrak.,Repair and Maintenance to PWD road to Astak road for the year 2022-23 in the District of Bhadrak.,Works,Open Tender,Percentage,Miscellaneous Works,No,No,NA ,27-Jun-2022 03:00 PM,NA ,90.0,No ,No,Online,05-Jul-2022 11:00 AM,CE RW I||RWCIRCLE-BALASORE||RWDIVISION-BHADRAK-II,Bhadrak,756100.0,1.0,"13,27,932",Nanda Kishore Sahoo,"1,128,875",Rejected-AOC,24-Sep-2022,CE RW I||RWCIRCLE-BALASORE||RWDIVISION-BHADRAK-II
2022_CERWI_79167_1,TCN-01/RWD-II,Repair and Maintenance to L28 -NH5 to Sabarang - Chandigaon road for the year 2022-23 in the District of Bhadrak.,Repair and Maintenance to L28 -NH5 to Sabarang - Chandigaon road for the year 2022-23 in the District of Bhadrak,Works,Open Tender,Percentage,Miscellaneous Works,No,No,NA ,27-Jun-2022 03:00 PM,NA ,90.0,No ,No,Online,05-Jul-2022 11:00 AM,CE RW I||RWCIRCLE-BALASORE||RWDIVISION-BHADRAK-II,Bhadrak,756100.0,1.0,"35,39,890",Priya Ranjan Senapati,"3,009,260",Rejected-AOC,26-Sep-2022,CE RW I||RWCIRCLE-BALASORE||RWDIVISION-BHADRAK-II
2022_CERWI_79168_1,TCN-01/RWD-II,Repair and Maintenance to Asura Sabarang RD road to Chandanpur road for the year 2022-23 in the District of Bhadrak.,Repair and Maintenance to Asura Sabarang RD road to Chandanpur road for the year 2022-23 in the District of Bhadrak.,Works,Open Tender,Percentage,Miscellaneous Works,No,No,NA ,27-Jun-2022 03:00 PM,NA ,90.0,No ,No,Online,05-Jul-2022 11:00 AM,CE RW I||RWCIRCLE-BALASORE||RWDIVISION-BHADRAK-II,Bhadrak,756100.0,1.0,"28,31,956",Purna Chandra Nayak,"2,407,446",Rejected-AOC,29-Sep-2022,CE RW I||RWCIRCLE-BALASORE||RWDIVISION-BHADRAK-II
2022_CERWI_79170_1,TCN-01/RWD-II,Repair and Maintenance to PWD road to Basuni Chhak road for the year 2022-23 in the District of Bhadrak.,Repair and Maintenance to PWD road to Basuni Chhak road for the year 2022-23 in the District of Bhadrak.,Works,Open Tender,Percentage,Miscellaneous Works,No,No,NA ,27-Jun-2022 03:00 PM,NA ,90.0,No ,No,Online,05-Jul-2022 11:00 AM,CE RW I||RWCIRCLE-BALASORE||RWDIVISION-BHADRAK-II,Bhadrak,756100.0,1.0,"22,12,236",Basanta Kumar Barik,"1,880,622",Rejected-AOC,23-Sep-2022,CE RW I||RWCIRCLE-BALASORE||RWDIVISION-BHADRAK-II
2022_CERWI_79174_1,TCN-01/RWD-II,Repair and Maintenance to Kharji Jharadia Gadiali road for the year 2022-23 in the District of Bhadrak.,Repair and Maintenance to Kharji Jharadia Gadiali road for the year 2022-23 in the District of Bhadrak.,Works,Open Tender,Percentage,Miscellaneous Works,No,No,NA ,27-Jun-2022 03:00 PM,NA ,90.0,No ,No,Online,05-Jul-2022 11:00 AM,CE RW I||RWCIRCLE-BALASORE||RWDIVISION-BHADRAK-II,Bhadrak,756100.0,1.0,"22,12,235",BISHNU CHARAN MOHAPATRA,"1,880,621",Accepted-AOC,26-Sep-2022,CE RW I||RWCIRCLE-BALASORE||RWDIVISION-BHADRAK-II
2022_CERWI_79175_1,TCN-01/RWD-II,Repair and Maintenance to Dhamara road to Lunabandha via Budhi Chhak road for the year 2022-23 in the District of Bhadrak.,Repair and Maintenance to Dhamara road to Lunabandha via Budhi Chhak road for the year 2022-23 in the District of Bhadrak.,Works,Open Tender,Percentage,Miscellaneous Works,No,No,NA ,27-Jun-2022 03:00 PM,NA ,90.0,No ,No,Online,05-Jul-2022 11:00 AM,CE RW I||RWCIRCLE-BALASORE||RWDIVISION-BHADRAK-II,Bhadrak,756100.0,1.0,"30,97,337",Sashibhusan Barik,"263,304,600",Rejected-AOC,26-Sep-2022,CE RW I||RWCIRCLE-BALASORE||RWDIVISION-BHADRAK-II
2022_CERWI_79176_1,TCN-01/RWD-II,Repair and Maintenance to Gopalpur to Chudamani road for the year 2022-23 in the District of Bhadrak.,Repair and Maintenance to Gopalpur to Chudamani road for the year 2022-23 in the District of Bhadrak.,Works,Open Tender,Percentage,Miscellaneous Works,No,No,NA ,27-Jun-2022 03:00 PM,NA ,90.0,No ,No,Online,05-Jul-2022 11:00 AM,CE RW I||RWCIRCLE-BALASORE||RWDIVISION-BHADRAK-II,Bhadrak,756100.0,1.0,"8,85,384",PRITIPADMA MOHAPATRA,"752,665",Rejected-AOC,29-Sep-2022,CE RW I||RWCIRCLE-BALASORE||RWDIVISION-BHADRAK-II
2022_CERWI_79187_1,e-Procurement Notice No 01 of 2022-23,S/R to Thaneswar to Uchhabpur road for 2022-23,S/R to Thaneswar to Uchhabpur road for 2022-23,Works,Open Tender,Percentage,Civil Works - Roads,No,No,NA ,28-Jun-2022 05:00 PM,NA ,90.0,No ,No,Both(Online/Offline),13-Jul-2022 11:00 AM,CE RW I||RWCIRCLE-BALASORE||RWDIVISION-BALASORE-II,Balasore,756001.0,1.0,"8,84,341",SUSANTA KUMAR PANDA,"841,992",Rejected-AOC,13-Sep-2022,CE RW I||RWCIRCLE-BALASORE||RWDIVISION-BALASORE-II
2022_CERWI_79189_1,TCN-01/RWD-II,Repair and Maintenance of T1 to Mobarakpur Road for the year 2022-23 in the District of Bhadrak,Repair and Maintenance of T1 to Mobarakpur Road for the year 2022-23 in the District of Bhadrak,Works,Open Tender,Percentage,Miscellaneous Works,No,No,NA ,27-Jun-2022 03:00 PM,NA ,90.0,No ,No,Online,05-Jul-2022 11:00 AM,CE RW I||RWCIRCLE-BALASORE||RWDIVISION-BHADRAK-II,Bhadrak,756100.0,1.0,"22,12,353",BHARAT CHANDRA NAYAK,"1,880,722",Rejected-AOC,23-Sep-2022,CE RW I||RWCIRCLE-BALASORE||RWDIVISION-BHADRAK-II
2022_CERWI_79190_1,TCN-01/RWD-II,Repair and Maintenance RD road to Biroli road for the yea r2022-23 in the distict of Bhadrak.,Repair and Maintenance RD road to Biroli road for the yea r2022-23 in the distict of Bhadrak,Works,Open Tender,Percentage,Miscellaneous Works,No,No,NA ,27-Jun-2022 03:00 PM,NA ,90.0,No ,No,Online,05-Jul-2022 11:00 AM,CE RW I||RWCIRCLE-BALASORE||RWDIVISION-BHADRAK-II,Bhadrak,756100.0,1.0,"17,69,910",Gopal Chandra Das,"1,504,600",Rejected-AOC,24-Sep-2022,CE RW I||RWCIRCLE-BALASORE||RWDIVISION-BHADRAK-II
2022_CERWI_79191_1,TCN-01/RWD-II,Repair and Maintenance NH5 to Jasotikiri road for the year 2022-23 in the District of Bhadrak.,Repair and Maintenance NH5 to Jasotikiri road for the year 2022-23 in the District of Bhadrak.,Works,Open Tender,Percentage,Miscellaneous Works,No,No,NA ,27-Jun-2022 03:00 PM,NA ,90.0,No ,No,Online,05-Jul-2022 11:00 AM,CE RW I||RWCIRCLE-BALASORE||RWDIVISION-BHADRAK-II,Bhadrak,756100.0,1.0,"26,54,991",PRIYANKA MAJHI,"2,257,008",Rejected-AOC,26-Sep-2022,CE RW I||RWCIRCLE-BALASORE||RWDIVISION-BHADRAK-II
2022_CERWI_79192_1,TCN-01/RWD-II,Repair and Maintenance to T3-Chhatabara to Balighati - Ranjit road for the year 2022-23 in the District of Bhadrak.,Repair and Maintenance to T3-Chhatabara to Balighat - Ranjit road for the year 2022-23 in the District of Bhadrak.,Works,Open Tender,Percentage,Miscellaneous Works,No,No,NA ,27-Jun-2022 03:00 PM,NA ,90.0,No ,No,Online,05-Jul-2022 11:00 AM,CE RW I||RWCIRCLE-BALASORE||RWDIVISION-BHADRAK-II,Bhadrak,756100.0,1.0,"26,54,870",Pramod Kumar Nath,"2,256,905",Rejected-AOC,24-Sep-2022,CE RW I||RWCIRCLE-BALASORE||RWDIVISION-BHADRAK-II
2022_CERWI_79195_1,02/2022-23,A/E to MV -19 to MV-39 road for the year 2022-23.,A/E to MV -19 to MV-39 road for the year 2022-23.,Works,Open Tender,Percentage,Civil Works - Roads,No,No,NA ,27-Jun-2022 11:00 AM,NA ,90.0,No ,No,Online,06-Jul-2022 11:00 AM,CE RW I||RWCIRCLE-SUNABEDA||RWDIVISION-MALKANGIRI - II,Malkangiri,764048.0,1.0,"6,19,535",AMIT KUMAR PAUL,"526,666",Accepted-AOC,09-Sep-2022,CE RW I||RWCIRCLE-SUNABEDA||RWDIVISION-MALKANGIRI - II
2022_CERWI_79196_1,ETCN01 of 22-23,42/5583-S/R Podadiha to Kochiakoili Kanthigadia road for 2022-23,42/5583-S/R Podadiha to Kochiakoili Kanthigadia road for 2022-23,Works,Open Tender,Percentage,Civil Works - Roads,No,No,NA ,28-Jun-2022 05:00 PM,NA ,90.0,No ,No,Online,13-Jul-2022 11:00 AM,CE RW I||RWCIRCLE-BALASORE||RWDIVISION-BALASORE-II,Baleswar,756001.0,1.0,"28,63,134",AJAY KUMAR PALITA,"2,726,024",Accepted-AOC,12-Sep-2022,CE RW I||RWCIRCLE-BALASORE||RWDIVISION-BALASORE-II
2022_CERWI_79212_4,02 of 2022-23,S/R to Raghunathpur to Madhusudanpur road for the year 2022-23 Such as BT repair from 0.000 km to 1.000 km.,S/R to Raghunathpur to Madhusudanpur road for the year 2022-23 Such as BT repair from 0.000 km to 1.000 km. in the District of Jajpur,Works,Open Tender,Percentage,Civil Works - Roads,No,No,NA ,27-Jun-2022 04:00 PM,NA ,90.0,No ,No,Online,04-Jul-2022 11:30 AM,CE RW I||RWCIRCLE-CUTTACK||RWDIVISION-JAJPUR-II,Jaraka,755050.0,1.0,"10,61,000",SWAGAT RANJAN BISWAL,"899,335",Rejected-Finance,05-Sep-2022,CE RW I||RWCIRCLE-CUTTACK||RWDIVISION-JAJPUR-II
2022_CERWI_79212_8,02 of 2022-23,S/R to Bhagirathpur to Kujibar road for the year 2022-23 Such Construction of BoxCell (2x6x3) at Chainage 2.05 km.,S/R to Bhagirathpur to Kujibar road for the year 2022-23 Such Construction of BoxCell (2x6x3) at Chainage 2.05 km. in the District of Jajpur,Works,Open Tender,Percentage,Civil Works - Roads,No,No,NA ,27-Jun-2022 04:00 PM,NA ,90.0,No ,No,Online,04-Jul-2022 11:30 AM,CE RW I||RWCIRCLE-CUTTACK||RWDIVISION-JAJPUR-II,Jaraka,755050.0,1.0,"44,20,000",KHAGESWAR JENA,"3,761,409",Rejected-Finance,12-Sep-2022,CE RW I||RWCIRCLE-CUTTACK||RWDIVISION-JAJPUR-II
2022_CERWI_79238_1,03 of 2022-23,SR to Borikina Osakana Road RD 3100 mtr to 3290 mtr B.T repair and Protection work for the Year 2022 23,SR to Borikina Osakana Road RD 3100 mtr to 3290 mtr B.T repair and Protection work for the Year 2022 23,Works,Open Tender,Percentage,Civil Works - Roads,No,No,NA ,27-Jun-2022 05:30 PM,NA ,90.0,No ,No,Online,11-Jul-2022 11:00 AM,CE RW I||RWCIRCLE-CUTTACK||RWDIVISION-JAGATSINGHPUR,Jagatsinghapur,754103.0,1.0,"8,81,457",PRATIMA SWAIN,"749,327",Rejected-AOC,12-Sep-2022,CE RW I||RWCIRCLE-CUTTACK||RWDIVISION-JAGATSINGHPUR
2022_CERWI_79285_1,Tender online SBPR-04 of 22-23,SH-10 to (Majhipali to Chamarpada to Chhatragada) road,SH-10 to (Majhipali to Chamarpada to Chhatragada) road,Works,Open Tender,Percentage,Civil Works - Roads,No,No,NA ,28-Jun-2022 06:00 PM,NA ,90.0,No ,No,Online,08-Jul-2022 11:00 AM,CE RW I||RWCIRCLE-SAMBALPUR||RWDIVISION-SAMBALPUR,Sambalpur,768001.0,1.0,"8,85,000",SATYA PRAKASH HOTA,"750,662",Rejected-Finance,27-Sep-2022,CE RW I||RWCIRCLE-SAMBALPUR||RWDIVISION-SAMBALPUR
2022_CERWI_79285_4,Tender online SBPR-04 of 22-23,Sagjuri Mahantapada road for the year 22-23,Sagjuri Mahantapada road for the year 22-23,Works,Open Tender,Percentage,Civil Works - Roads,No,No,NA ,28-Jun-2022 06:50 PM,NA ,90.0,No ,No,Online,08-Jul-2022 11:00 AM,CE RW I||RWCIRCLE-SAMBALPUR||RWDIVISION-SAMBALPUR,Sambalpur,768001.0,1.0,"46,09,000",SAMBIT MOHAPATRA,"3,912,556",Rejected-Finance,27-Sep-2022,CE RW I||RWCIRCLE-SAMBALPUR||RWDIVISION-SAMBALPUR
2022_CERWI_79285_5,Tender online SBPR-04 of 22-23,RD road to Kasibahal road for the year 22-23,RD road to Kasibahal road for the year 22-23,Works,Open Tender,Percentage,Civil Works - Roads,No,No,NA ,28-Jun-2022 06:50 PM,NA ,90.0,No ,No,Online,08-Jul-2022 11:00 AM,CE RW I||RWCIRCLE-SAMBALPUR||RWDIVISION-SAMBALPUR,Sambalpur,768001.0,1.0,"17,84,000",Rajib Lochan Pradhan,"1,515,547",Rejected-Finance,30-Sep-2022,CE RW I||RWCIRCLE-SAMBALPUR||RWDIVISION-SAMBALPUR
2022_CERWI_79285_6,Tender online SBPR-04 of 22-23,RD road to Manik Munda road for the year 22-23,RD road to Manik Munda road for the year 22-23,Works,Open Tender,Percentage,Civil Works - Roads,No,No,NA ,29-Jun-2022 06:50 PM,NA ,90.0,No ,No,Online,08-Jul-2022 11:00 AM,CE RW I||RWCIRCLE-SAMBALPUR||RWDIVISION-SAMBALPUR,Sambalpur,768001.0,1.0,"32,28,000",NABIN KUMAR MISHRA,"2,741,746",Rejected-Finance,27-Sep-2022,CE RW I||RWCIRCLE-SAMBALPUR||RWDIVISION-SAMBALPUR
2022_CERWI_79289_1,ETCN01 of 22-23,42/5582-S/R to Sabira to Brahaman Sabira road for 2022-23,42/5582-S/R to Sabira to Brahaman Sabira road for 2022-23,Works,Open Tender,Percentage,Civil Works - Roads,No,No,NA ,05-Jul-2022 05:00 PM,NA ,90.0,No ,No,Online,13-Jul-2022 11:00 AM,CE RW I||RWCIRCLE-BALASORE||RWDIVISION-BALASORE-II,Baleswar,756001.0,1.0,"10,61,938",JADU SINGH,"1,011,084",Rejected-AOC,13-Sep-2022,CE RW I||RWCIRCLE-BALASORE||RWDIVISION-BALASORE-II
2022_CERWI_79290_1,02/MOHANA/22-23,S/R to RD road to Bom upto Sikulipadar for the year 2022-23,S/R to RD road to Bom upto Sikulipadar for the year 2022-23,Works,National Competitive Bid,Percentage,Civil Works - Roads,No,No,NA ,28-Jun-2022 06:55 PM,NA ,90.0,No ,No,Online,06-Jul-2022 11:00 AM,CE RW I||RWCIRCLE-BERHAMPUR||RW Division Mohana,Gajapati,761015.0,1.0,"6,19,012",Ganesh Pradhan,"526,222",Rejected-AOC,17-Sep-2022,CE RW I||RWCIRCLE-BERHAMPUR||RW Division Mohana
2022_CERWI_79295_1,SECTC-II-04 of 2022-23 dt. 17.06.2022,"S/R to RD road to Vejiput via Balitaila, Koromei Thakurani for the year 2022-23 in the district of Cuttack","S/R to RD road to Vejiput via Balitaila, Koromei Thakurani for the year 2022-23 in the district of Cuttack",Works,National Competitive Bid,Percentage,Civil Works - Roads,No,No,NA ,29-Jun-2022 11:30 AM,NA ,90.0,No ,No,Online,12-Jul-2022 11:30 AM,CE RW I||RWCIRCLE-CUTTACK||RWDIVISION-CUTTACK-II,Cuttack,753004.0,1.0,"33,93,000",JAKESH KUMAR ROUT,"2,884,240",Rejected-Finance,24-Sep-2022,CE RW I||RWCIRCLE-CUTTACK||RWDIVISION-CUTTACK-II
