2024_CEBBU_102379_7,MDD-e-15/2023-24,"Construction of longitudinal drain of toe road of right dyke of Hirakud Dam from RD 21900 ft. to RD 23300 ft., RD 24700 ft. to RD 25330 ft. and dRD 25950 ft. to RD 26600 ft. at Burla for the year 2024-25","Construction of longitudinal drain of toe road of right dyke of Hirakud Dam from RD 21900 ft. to RD 23300 ft., RD 24700 ft. to RD 25330 ft. and dRD 25950 ft. to RD 26600 ft. at Burla for the year 2024-25",Works,Open Tender,Percentage,Civil Works - Others,No,No,NA ,12-Mar-2024 10:00 AM,NA ,90.0,No ,No,Online,27-Mar-2024 11:00 AM,"CE-BM,UM Basin,Burla||SE,Hirakud Dam Circle,Burla||EE,Main Dam Divn,Burla",BURLA,768017.0,1.0,"15,64,278",Naresh Chandra Mishra,"1,329,793",Rejected-AOC,16-Jun-2024,"CE-BM,UM Basin,Burla||SE,Hirakud Dam Circle,Burla||EE,Main Dam Divn,Burla"
2024_CEBBU_102379_8,MDD-e-15/2023-24,Renovation of the filter drain from RD 10300ft to RD 11150 ft of Right Earth Dam of Hirakud Dam under lump critical for the year 2024-25,Renovation of the filter drain from RD 10300ft to RD 11150 ft of Right Earth Dam of Hirakud Dam under lump critical for the year 2024-25,Works,Open Tender,Percentage,Civil Works - Others,No,No,NA ,12-Mar-2024 10:00 AM,NA ,90.0,No ,No,Online,27-Mar-2024 11:00 AM,"CE-BM,UM Basin,Burla||SE,Hirakud Dam Circle,Burla||EE,Main Dam Divn,Burla",BURLA,768017.0,1.0,"11,40,538",MANOJ KUMAR PANDA,"969,571",Rejected-AOC,16-Jun-2024,"CE-BM,UM Basin,Burla||SE,Hirakud Dam Circle,Burla||EE,Main Dam Divn,Burla"
2024_CEBBU_102379_9,MDD-e-15/2023-24,Renovation of the filter drain from RD 2550 ft to RD 4000 ft D/S of 557ft road of Left Earth Dam of Hirakud Dam for the year 2024-25,Renovation of the filter drain from RD 2550 ft to RD 4000 ft D/S of 557ft road of Left Earth Dam of Hirakud Dam for the year 2024-25,Works,Open Tender,Percentage,Civil Works - Others,No,No,NA ,12-Mar-2024 10:00 AM,NA ,90.0,No ,No,Online,27-Mar-2024 11:00 AM,"CE-BM,UM Basin,Burla||SE,Hirakud Dam Circle,Burla||EE,Main Dam Divn,Burla",BURLA,768017.0,1.0,"25,70,826",HARI SHANKAR PANDA,"2,185,459",Rejected-AOC,16-Jun-2024,"CE-BM,UM Basin,Burla||SE,Hirakud Dam Circle,Burla||EE,Main Dam Divn,Burla"
2024_CEBBU_102773_1,SESID-03(01)/2023-24,Canal Works,Construction of Trough wall in Kankhinda Distributary from RD 600m to 700m for the year 2024-25.,Works,Open Tender,Percentage,Civil Works - Canal,No,No,NA ,18-Mar-2024 11:00 AM,NA ,90.0,No ,No,Online,04-Apr-2024 11:00 AM,"CE-BM,UM Basin,Burla||SE,Hirakud Dam Circle,Burla||EE Sambalpur Irrigation Division Sambalpur","Kankhinda, Sambalpur",768200.0,1.0,"9,95,576",BADRINATH BHOI,"846,339",Rejected-AOC,20-Jul-2024,"CE-BM,UM Basin,Burla||SE,Hirakud Dam Circle,Burla||EE Sambalpur Irrigation Division Sambalpur"
2024_CEBBU_102774_1,SESID-03(02)/2023-24,Canal Works,Construction of Trough wall in Badtitheipali Sub-Minor in between RD 560m to 750m for the year 2024-25.,Works,Open Tender,Percentage,Civil Works - Canal,No,No,NA ,18-Mar-2024 11:00 AM,NA ,90.0,No ,No,Online,04-Apr-2024 11:00 AM,"CE-BM,UM Basin,Burla||SE,Hirakud Dam Circle,Burla||EE Sambalpur Irrigation Division Sambalpur","Titheipali, Sambalpur",768200.0,1.0,"9,87,050",CHANDRAPRAVA CONSTRUCTION AND SUPPLIERS,"839,092",Rejected-AOC,20-Jul-2024,"CE-BM,UM Basin,Burla||SE,Hirakud Dam Circle,Burla||EE Sambalpur Irrigation Division Sambalpur"
2024_CEBBU_102777_1,SESID-03(03)/2023-24,Canal Works,Repair of Existing Slope Lining and Raising of Existing wall at Right side in between RD 300m to RD 540m of Talab Distributary for the year 2024-25.,Works,Open Tender,Percentage,Civil Works - Canal,No,No,NA ,18-Mar-2024 11:00 AM,NA ,90.0,No ,No,Online,04-Apr-2024 11:00 AM,"CE-BM,UM Basin,Burla||SE,Hirakud Dam Circle,Burla||EE Sambalpur Irrigation Division Sambalpur","Talab, Sambalpur",768200.0,1.0,"13,85,922",SATYA PRAKASH HOTA,"1,178,173",Rejected-AOC,20-Jul-2024,"CE-BM,UM Basin,Burla||SE,Hirakud Dam Circle,Burla||EE Sambalpur Irrigation Division Sambalpur"
2024_CEBBU_102778_1,SESID-03(04)/2023-24,Canal Works,Construction of Trough wall in Badthitheipali Sub-Minor from RD 2645m to RD 2750 m for the year 2024-25.,Works,Open Tender,Percentage,Civil Works - Canal,No,No,NA ,18-Mar-2024 11:00 AM,NA ,90.0,No ,No,Online,04-Apr-2024 11:00 AM,"CE-BM,UM Basin,Burla||SE,Hirakud Dam Circle,Burla||EE Sambalpur Irrigation Division Sambalpur","Titheipali, Sambalpur",768200.0,1.0,"9,32,364",ABHILASH SAMAL,,Rejected-AOC,,"CE-BM,UM Basin,Burla||SE,Hirakud Dam Circle,Burla||EE Sambalpur Irrigation Division Sambalpur"
2024_CEBBU_102779_1,SESID-03(05)/2023-24,Canal Works,Construction to guard wall with bed lining from RD 14920m to 14970m of Parmanpur Distributary for 2024-25.,Works,Open Tender,Percentage,Civil Works - Canal,No,No,NA ,18-Mar-2024 11:00 AM,NA ,90.0,No ,No,Online,04-Apr-2024 11:00 AM,"CE-BM,UM Basin,Burla||SE,Hirakud Dam Circle,Burla||EE Sambalpur Irrigation Division Sambalpur",Sambalpur,768200.0,1.0,"6,78,732",SANJEEB KUMAR BISHI,"576,990",Rejected-AOC,20-Jul-2024,"CE-BM,UM Basin,Burla||SE,Hirakud Dam Circle,Burla||EE Sambalpur Irrigation Division Sambalpur"
2024_CEBBU_102780_1,SESID-03(06)/2023-24,Canal Works,Construction to guard wall with bed lining in between RD 300m to 360m of MDR at RD 15360m and RD 00 to 200m of MDR at RD 16455m of Parmanpur Distributary for 2024-25.,Works,Open Tender,Percentage,Civil Works - Canal,No,No,NA ,18-Mar-2024 11:00 AM,NA ,90.0,No ,No,Online,04-Apr-2024 11:00 AM,"CE-BM,UM Basin,Burla||SE,Hirakud Dam Circle,Burla||EE Sambalpur Irrigation Division Sambalpur",Sambalpur,768200.0,1.0,"5,94,760",BIJAYA RANI BOSE,"505,606",Rejected-AOC,20-Jul-2024,"CE-BM,UM Basin,Burla||SE,Hirakud Dam Circle,Burla||EE Sambalpur Irrigation Division Sambalpur"
2024_CEBBU_102782_1,SESID-03(07)/2023-24,Canal Works,Construction of VRB at RD 15075m of Parmanpur Distributary for 2024-25.,Works,Open Tender,Percentage,Civil Works - Canal,No,No,NA ,18-Mar-2024 11:00 AM,NA ,90.0,No ,No,Online,04-Apr-2024 11:00 AM,"CE-BM,UM Basin,Burla||SE,Hirakud Dam Circle,Burla||EE Sambalpur Irrigation Division Sambalpur",Sambalpur,768200.0,1.0,"6,85,405",SANDHYARANI SAHU,"582,663",Rejected-AOC,20-Jul-2024,"CE-BM,UM Basin,Burla||SE,Hirakud Dam Circle,Burla||EE Sambalpur Irrigation Division Sambalpur"
2024_CEBBU_102783_1,SESID-03(08)/2023-24,Canal Works,Construction of VRB at RD 1300m of Parmanpur Distributary for 2024-25.,Works,Open Tender,Percentage,Civil Works - Canal,No,No,NA ,18-Mar-2024 11:00 AM,NA ,90.0,No ,No,Online,04-Apr-2024 11:00 AM,"CE-BM,UM Basin,Burla||SE,Hirakud Dam Circle,Burla||EE Sambalpur Irrigation Division Sambalpur",Sambalpur,768200.0,1.0,"6,89,214",TRIPATHY CONST&SUPPLIERS PROP HIMADRITANAYATRIPATHY,"585,900",Rejected-AOC,20-Jul-2024,"CE-BM,UM Basin,Burla||SE,Hirakud Dam Circle,Burla||EE Sambalpur Irrigation Division Sambalpur"
2024_CEBBU_102785_1,SESID-03(09)/2023-24,Canal Works,Construction of VRB at RD 9500m of Parmanpur Distributary for 2024-25.,Works,Open Tender,Percentage,Civil Works - Canal,No,No,NA ,18-Mar-2024 11:00 AM,NA ,90.0,No ,No,Online,04-Apr-2024 11:00 AM,"CE-BM,UM Basin,Burla||SE,Hirakud Dam Circle,Burla||EE Sambalpur Irrigation Division Sambalpur",Sambalpur,768200.0,1.0,"6,84,895",ABHILASH SAMAL,"582,230",Accepted-AOC,20-Jul-2024,"CE-BM,UM Basin,Burla||SE,Hirakud Dam Circle,Burla||EE Sambalpur Irrigation Division Sambalpur"
2024_CEBBU_102786_1,SESID-03(10)/2023-24,Canal Works,Construction of VRB at RD 51500m of Huma Tail Distributary for 2024-25.,Works,Open Tender,Percentage,Civil Works - Canal,No,No,NA ,18-Mar-2024 11:00 AM,NA ,90.0,No ,No,Online,04-Apr-2024 11:00 AM,"CE-BM,UM Basin,Burla||SE,Hirakud Dam Circle,Burla||EE Sambalpur Irrigation Division Sambalpur",Sambalpur,768005.0,1.0,"10,71,813",ABHILASH SAMAL,"911,149",Accepted-AOC,20-Jul-2024,"CE-BM,UM Basin,Burla||SE,Hirakud Dam Circle,Burla||EE Sambalpur Irrigation Division Sambalpur"
2024_CEBBU_102788_1,SESID-03(11)/2023-24,Canal Works,Construction of both side protection wall on US and DS of CD at RD 12120m of Huma Tail Disty. under Critical lump 2024-25.,Works,Open Tender,Percentage,Civil Works - Canal,No,No,NA ,18-Mar-2024 11:00 AM,NA ,90.0,No ,No,Online,04-Apr-2024 11:00 AM,"CE-BM,UM Basin,Burla||SE,Hirakud Dam Circle,Burla||EE Sambalpur Irrigation Division Sambalpur",Sambalpur,768005.0,1.0,"8,71,005",SANJEEB KUMAR BISHI,"740,441",Rejected-AOC,20-Jul-2024,"CE-BM,UM Basin,Burla||SE,Hirakud Dam Circle,Burla||EE Sambalpur Irrigation Division Sambalpur"
2024_CEBBU_102789_1,SESID-03(12)/2023-24,Canal Works,Construction of VRB at RD 56550m of Huma Tail Distributary for 2024-25.,Works,Open Tender,Percentage,Civil Works - Canal,No,No,NA ,18-Mar-2024 11:00 AM,NA ,90.0,No ,No,Online,04-Apr-2024 11:00 AM,"CE-BM,UM Basin,Burla||SE,Hirakud Dam Circle,Burla||EE Sambalpur Irrigation Division Sambalpur",Sambalpur,768005.0,1.0,"8,36,694",SANDIP KUMAR PATTNAIK,"711,274",Rejected-AOC,20-Jul-2024,"CE-BM,UM Basin,Burla||SE,Hirakud Dam Circle,Burla||EE Sambalpur Irrigation Division Sambalpur"
2024_CEBBU_102790_1,SESID-03(13)/2023-24,Canal Works,"Deweeding, grubbing and removal of slush and vegetation in Tangna Nallah from Sakhipada to RD 3000m (to Kumbharpada) for the year 2024-25.",Works,Open Tender,Percentage,Civil Works - Canal,No,No,NA ,18-Mar-2024 11:00 AM,NA ,90.0,No ,No,Online,04-Apr-2024 11:00 AM,"CE-BM,UM Basin,Burla||SE,Hirakud Dam Circle,Burla||EE Sambalpur Irrigation Division Sambalpur",Sambalpur,768002.0,1.0,"10,93,624",BADRINATH BHOI,"929,689",Accepted-AOC,20-Jul-2024,"CE-BM,UM Basin,Burla||SE,Hirakud Dam Circle,Burla||EE Sambalpur Irrigation Division Sambalpur"
2024_CEBBU_102791_1,SESID-03(14)/2023-24,Canal Works,Deweeding and removal of slush and vegetation in Dhobijore Nallah from Greater Sambalpur (NH 6 Up-stream) to RD 6100m (Binakhandi) and Balibandha Link Drain for the year 2024-25.,Works,Open Tender,Percentage,Civil Works - Canal,No,No,NA ,18-Mar-2024 11:00 AM,NA ,90.0,No ,No,Online,04-Apr-2024 11:00 AM,"CE-BM,UM Basin,Burla||SE,Hirakud Dam Circle,Burla||EE Sambalpur Irrigation Division Sambalpur",Sambalpur,768002.0,1.0,"25,94,615",PRADIP MEHER,"2,205,682",Rejected-AOC,20-Jul-2024,"CE-BM,UM Basin,Burla||SE,Hirakud Dam Circle,Burla||EE Sambalpur Irrigation Division Sambalpur"
2024_CEBBU_102792_1,SESID-03(15)/2023-24,Canal Works,Repair and maintenance to Sason Main Canal in between RD 14000m to 21000m for the year 2024-25.,Works,Open Tender,Percentage,Civil Works - Canal,No,No,NA ,18-Mar-2024 11:00 AM,NA ,90.0,No ,No,Online,04-Apr-2024 11:00 AM,"CE-BM,UM Basin,Burla||SE,Hirakud Dam Circle,Burla||EE Sambalpur Irrigation Division Sambalpur",Sambalpur,768200.0,1.0,"12,00,000",PRASANTA KUMAR SAHU,"1,020,120",Rejected-AOC,20-Jul-2024,"CE-BM,UM Basin,Burla||SE,Hirakud Dam Circle,Burla||EE Sambalpur Irrigation Division Sambalpur"
2024_CEBBU_102793_1,SESID-03(16)/2023-24,Canal Works,Deweeding and desilting of Sambalpur Distributary in between RD 9000m to 18000m for the year 2024-25.,Works,Open Tender,Percentage,Civil Works - Canal,No,No,NA ,18-Mar-2024 11:00 AM,NA ,90.0,No ,No,Online,04-Apr-2024 11:00 AM,"CE-BM,UM Basin,Burla||SE,Hirakud Dam Circle,Burla||EE Sambalpur Irrigation Division Sambalpur",Sambalpur,768001.0,1.0,"8,99,840",BIMAL MAHAPATRA,"764,954",Rejected-AOC,20-Jul-2024,"CE-BM,UM Basin,Burla||SE,Hirakud Dam Circle,Burla||EE Sambalpur Irrigation Division Sambalpur"
2024_CEBBU_102794_1,SESID-03(17)/2023-24,Canal Works,Repair and maintenance of Huma Tail Distributary in between RD 8000m to 12000m for the year 2024-25.,Works,Open Tender,Percentage,Civil Works - Canal,No,No,NA ,18-Mar-2024 11:00 AM,NA ,90.0,No ,No,Online,04-Apr-2024 11:00 AM,"CE-BM,UM Basin,Burla||SE,Hirakud Dam Circle,Burla||EE Sambalpur Irrigation Division Sambalpur",Sambalpur,768005.0,1.0,"8,02,850",PRASANTA KUMAR SAHU,"682,503",Rejected-AOC,20-Jul-2024,"CE-BM,UM Basin,Burla||SE,Hirakud Dam Circle,Burla||EE Sambalpur Irrigation Division Sambalpur"
2024_CEBBU_102795_1,SESID-03(18)/2023-24,Canal Works,Repair and maintenance of Huma Tail Distributary in between RD 36550m to 38800m for the year 2024-25.,Works,Open Tender,Percentage,Civil Works - Canal,No,No,NA ,18-Mar-2024 11:00 AM,NA ,90.0,No ,No,Online,04-Apr-2024 11:00 AM,"CE-BM,UM Basin,Burla||SE,Hirakud Dam Circle,Burla||EE Sambalpur Irrigation Division Sambalpur",Sambalpur,768005.0,1.0,"5,55,344",Shekhar Behera,"472,098",Rejected-AOC,20-Jul-2024,"CE-BM,UM Basin,Burla||SE,Hirakud Dam Circle,Burla||EE Sambalpur Irrigation Division Sambalpur"
2024_CEBMB_100055_5,SE-CHWD-07/2023-24,Construction of Protection Wall and allied works near Maa Kureisuni Temple ramagiri of Chheligada Irrigation Project,Construction of Protection Wall and allied works near Maa Kureisuni Temple ramagiri of Chheligada Irrigation Project,Works,Open Tender,Percentage,Civil Works - Buildings,No,No,NA ,25-Jan-2024 10:00 AM,NA ,120.0,No ,No,Online,08-Feb-2024 11:30 AM,"CE-BM,RVN Basin,Berhampur||SE Southern Irr Circle II Paralakhemundi||EE Chheligada Head Works Divn Mahendragada",Mahendragada,761017.0,1.0,"29,88,000",RAMA KRUSHNA MOHANTY,"2,539,377",Rejected-AOC,27-Jul-2024,"CE-BM,RVN Basin,Berhampur||SE Southern Irr Circle II Paralakhemundi||EE Chheligada Head Works Divn Mahendragada"
2024_CEBMB_102390_1,SE- HID- ADV - 04/2023-24,"Improvement to Ghanatri Minor (including reconstruction of Fall at RD 105m) and Improvement to Taramala sub-Minor (including repairing and construction of Structures, and cc lining) of B.I.P","Improvement to Ghanatri Minor (including reconstruction of Fall at RD 105m) and Improvement to Taramala sub-Minor (including repairing and construction of Structures, and cc lining) of B.I.P",Works,National Competitive Bid,Percentage,Civil Works - Others,No,No,NA ,11-Mar-2024 10:00 AM,NA ,90.0,No ,No,Online,22-Mar-2024 11:00 AM,"CE-BM,RVN Basin,Berhampur||SE Southern Irr Circle II Paralakhemundi",ADAVA,761217.0,1.0,"16,78,218",Goura Chandra Panigrahi,"1,426,653",Rejected-AOC,11-Jul-2024,"CE-BM,RVN Basin,Berhampur||SE Southern Irr Circle II Paralakhemundi"
2024_CEBMB_102390_10,SE- HID- ADV - 04/2023-24,Improvement to service Road in between Left Dyke to Right Dyke of B.I.P,Improvement to service Road in between Left Dyke to Right Dyke of B.I.P,Works,National Competitive Bid,Percentage,Civil Works - Roads,No,No,NA ,11-Mar-2024 10:00 AM,NA ,90.0,No ,No,Online,22-Mar-2024 11:00 AM,"CE-BM,RVN Basin,Berhampur||SE Southern Irr Circle II Paralakhemundi",ADAVA,761217.0,1.0,"29,36,620",BALIA KUMAR PRADHAN,"2,496,421",Rejected-AOC,11-Jul-2024,"CE-BM,RVN Basin,Berhampur||SE Southern Irr Circle II Paralakhemundi"
2024_CEBMB_102390_11,SE- HID- ADV - 04/2023-24,Improvement to service road in-between RD 6750m to RD 8300m of Sri Rampur branch canal of B.I.P. for the year 2024-2025,Improvement to service road in-between RD 6750m to RD 8300m of Sri Rampur branch canal of B.I.P. for the year 2024-2025,Works,National Competitive Bid,Percentage,Civil Works - Roads,No,No,NA ,11-Mar-2024 10:00 AM,NA ,90.0,No ,No,Online,22-Mar-2024 11:00 AM,"CE-BM,RVN Basin,Berhampur||SE Southern Irr Circle II Paralakhemundi",ADAVA,761217.0,1.0,"16,77,922",Abani Ranjan Panigrahi,"1,426,401",Accepted-AOC,11-Jul-2024,"CE-BM,RVN Basin,Berhampur||SE Southern Irr Circle II Paralakhemundi"
2024_CEBMB_102390_12,SE- HID- ADV - 04/2023-24,Protection of right bank of river padma near D/S of village Madhapur,Protection of right bank of river padma near D/S of village Madhapur,Works,National Competitive Bid,Percentage,Civil Works - Others,No,No,NA ,11-Mar-2024 10:00 AM,NA ,90.0,No ,No,Online,22-Mar-2024 11:00 AM,"CE-BM,RVN Basin,Berhampur||SE Southern Irr Circle II Paralakhemundi",ADAVA,761217.0,1.0,"40,37,171",Pintu Panigrahy,"3,432,000",Rejected-AOC,11-Jul-2024,"CE-BM,RVN Basin,Berhampur||SE Southern Irr Circle II Paralakhemundi"
2024_CEBMB_102390_13,SE- HID- ADV - 04/2023-24,Protection of right bank of river padma near D/S of village Talapatma,Protection of right bank of river padma near D/S of village Talapatma,Works,National Competitive Bid,Percentage,Civil Works - Others,No,No,NA ,11-Mar-2024 10:00 AM,NA ,90.0,No ,No,Online,22-Mar-2024 11:00 AM,"CE-BM,RVN Basin,Berhampur||SE Southern Irr Circle II Paralakhemundi",ADAVA,761217.0,1.0,"40,50,980",BALIA KUMAR PRADHAN,"3,443,738",Rejected-AOC,11-Jul-2024,"CE-BM,RVN Basin,Berhampur||SE Southern Irr Circle II Paralakhemundi"
2024_CEBMB_102390_14,SE- HID- ADV - 04/2023-24,Protection of right bank of river padma near D/S of village Golapaju,Protection of right bank of river padma near D/S of village Golapaju,Works,National Competitive Bid,Percentage,Civil Works - Others,No,No,NA ,11-Mar-2024 10:00 AM,NA ,90.0,No ,No,Online,22-Mar-2024 11:00 AM,"CE-BM,RVN Basin,Berhampur||SE Southern Irr Circle II Paralakhemundi",ADAVA,761217.0,1.0,"20,08,983",BALIA KUMAR PRADHAN,"1,707,836",Accepted-AOC,11-Jul-2024,"CE-BM,RVN Basin,Berhampur||SE Southern Irr Circle II Paralakhemundi"
2024_CEBMB_102390_15,SE- HID- ADV - 04/2023-24,Protection of left bank of river padma near D/S of village Dumbula,Protection of left bank of river padma near D/S of village Dumbula,Works,National Competitive Bid,Percentage,Civil Works - Others,No,No,NA ,11-Mar-2024 10:00 AM,NA ,90.0,No ,No,Online,22-Mar-2024 11:00 AM,"CE-BM,RVN Basin,Berhampur||SE Southern Irr Circle II Paralakhemundi",ADAVA,761217.0,1.0,"29,99,557",Pabitra Mohan Bisoyi,"2,549,924",Rejected-AOC,11-Jul-2024,"CE-BM,RVN Basin,Berhampur||SE Southern Irr Circle II Paralakhemundi"
2024_CEBMB_102390_16,SE- HID- ADV - 04/2023-24,Improvement to right bank of river Harabhangi near village Adava and construction of bathing ghat,Improvement to right bank of river Harabhangi near village Adava and construction of bathing ghat,Works,National Competitive Bid,Percentage,Civil Works - Others,No,No,NA ,11-Mar-2024 10:00 AM,NA ,90.0,No ,No,Online,22-Mar-2024 11:00 AM,"CE-BM,RVN Basin,Berhampur||SE Southern Irr Circle II Paralakhemundi",ADAVA,761217.0,1.0,"16,95,011",DEBARAJ BHUYAN,"1,440,929",Rejected-AOC,11-Jul-2024,"CE-BM,RVN Basin,Berhampur||SE Southern Irr Circle II Paralakhemundi"
2024_CEBMB_102390_17,SE- HID- ADV - 04/2023-24,Improvement to Lokamari sub minor-I within RD 00 m to RD 500 m of Harabhangi Irrigation Project,Improvement to Lokamari sub minor-I within RD 00 m to RD 500 m of Harabhangi Irrigation Project,Works,National Competitive Bid,Percentage,Civil Works - Others,No,No,NA ,11-Mar-2024 10:00 AM,NA ,90.0,No ,No,Online,22-Mar-2024 11:00 AM,"CE-BM,RVN Basin,Berhampur||SE Southern Irr Circle II Paralakhemundi",ADAVA,761217.0,1.0,"21,00,758",BALIA KUMAR PRADHAN,,Rejected-AOC,,"CE-BM,RVN Basin,Berhampur||SE Southern Irr Circle II Paralakhemundi"
2024_CEBMB_102390_18,SE- HID- ADV - 04/2023-24,Improvement to Belapada sub minor-II within RD 835 m to 1175m of Harabhangi Irrigation Project,Improvement to Belapada sub minor-II within RD 835 m to 1175m of Harabhangi Irrigation Project,Works,National Competitive Bid,Percentage,Civil Works - Others,No,No,NA ,11-Mar-2024 10:00 AM,NA ,90.0,No ,No,Online,22-Mar-2024 11:00 AM,"CE-BM,RVN Basin,Berhampur||SE Southern Irr Circle II Paralakhemundi",ADAVA,761217.0,1.0,"12,59,747",Prasanta Kumar Pattnayak,"1,070,911",Rejected-AOC,11-Jul-2024,"CE-BM,RVN Basin,Berhampur||SE Southern Irr Circle II Paralakhemundi"
2024_CEBMB_102390_19,SE- HID- ADV - 04/2023-24,Improvement to Dhaupada Sub-minor off-taking from Kadaguda distributary at RD 7270 m of Harabhangi Irrigation Project,Improvement to Dhaupada Sub-minor off-taking from Kadaguda distributary at RD 7270 m of Harabhangi Irrigation Project,Works,National Competitive Bid,Percentage,Civil Works - Others,No,No,NA ,11-Mar-2024 10:00 AM,NA ,90.0,No ,No,Online,22-Mar-2024 11:00 AM,"CE-BM,RVN Basin,Berhampur||SE Southern Irr Circle II Paralakhemundi",ADAVA,761217.0,1.0,"14,26,926",Ratan Kumar Panda,"1,213,030",Rejected-AOC,11-Jul-2024,"CE-BM,RVN Basin,Berhampur||SE Southern Irr Circle II Paralakhemundi"
2024_CEBMB_102390_2,SE- HID- ADV - 04/2023-24,C.C. Lining to Jatili Sub-Minor-I in between RD 3700m to 4152m of B.I.P,C.C. Lining to Jatili Sub-Minor-I in between RD 3700m to 4152m of B.I.P,Works,National Competitive Bid,Percentage,Civil Works - Others,No,No,NA ,11-Mar-2024 10:00 AM,NA ,90.0,No ,No,Online,22-Mar-2024 11:00 AM,"CE-BM,RVN Basin,Berhampur||SE Southern Irr Circle II Paralakhemundi",ADAVA,761217.0,1.0,"12,58,503",PURNA CHANDRA SAHU,"1,069,854",Rejected-AOC,11-Jul-2024,"CE-BM,RVN Basin,Berhampur||SE Southern Irr Circle II Paralakhemundi"
2024_CEBMB_102390_20,SE- HID- ADV - 04/2023-24,Improvement to Haripriyapur sub minor in between RD 00 m to 300 m of Harabhangi Irrigation Project,Improvement to Haripriyapur sub minor in between RD 00 m to 300 m of Harabhangi Irrigation Project,Works,National Competitive Bid,Percentage,Civil Works - Others,No,No,NA ,11-Mar-2024 10:00 AM,NA ,90.0,No ,No,Online,22-Mar-2024 11:00 AM,"CE-BM,RVN Basin,Berhampur||SE Southern Irr Circle II Paralakhemundi",ADAVA,761217.0,1.0,"12,59,028",MAMATA KUMARI SATAPATHY,"1,070,300",Rejected-AOC,11-Jul-2024,"CE-BM,RVN Basin,Berhampur||SE Southern Irr Circle II Paralakhemundi"
2024_CEBMB_102390_21,SE- HID- ADV - 04/2023-24,Construction of VRB at RD 2910 m of Manikpur sub minor-II of Harabhangi Irrigation Project,Construction of VRB at RD 2910 m of Manikpur sub minor-II of Harabhangi Irrigation Project,Works,National Competitive Bid,Percentage,Civil Works - Others,No,No,NA ,11-Mar-2024 10:00 AM,NA ,90.0,No ,No,Online,22-Mar-2024 11:00 AM,"CE-BM,RVN Basin,Berhampur||SE Southern Irr Circle II Paralakhemundi",ADAVA,761217.0,1.0,"10,92,066",Gita Das,"928,365",Rejected-AOC,11-Jul-2024,"CE-BM,RVN Basin,Berhampur||SE Southern Irr Circle II Paralakhemundi"
2024_CEBMB_102390_22,SE- HID- ADV - 04/2023-24,Protection to Aqueduct of Right distributary at RD 6729 m of Harabhangi Irrigation Project,Protection to Aqueduct of Right distributary at RD 6729 m of Harabhangi Irrigation Project,Works,National Competitive Bid,Percentage,Civil Works - Others,No,No,NA ,11-Mar-2024 10:00 AM,NA ,90.0,No ,No,Online,22-Mar-2024 11:00 AM,"CE-BM,RVN Basin,Berhampur||SE Southern Irr Circle II Paralakhemundi",ADAVA,761217.0,1.0,"12,59,968",Sudarshan Gamanga,"1,071,099",Rejected-AOC,11-Jul-2024,"CE-BM,RVN Basin,Berhampur||SE Southern Irr Circle II Paralakhemundi"
2024_CEBMB_102390_23,SE- HID- ADV - 04/2023-24,Protection to syphon of B. Kotibadi sub minor at RD 840m of Harabhangi Irrigation Project,Protection to syphon of B. Kotibadi sub minor at RD 840m of Harabhangi Irrigation Project,Works,National Competitive Bid,Percentage,Civil Works - Others,No,No,NA ,11-Mar-2024 10:00 AM,NA ,90.0,No ,No,Online,22-Mar-2024 11:00 AM,"CE-BM,RVN Basin,Berhampur||SE Southern Irr Circle II Paralakhemundi",ADAVA,761217.0,1.0,"16,80,836",Pabitra Kumar Muni,"1,428,879",Rejected-AOC,11-Jul-2024,"CE-BM,RVN Basin,Berhampur||SE Southern Irr Circle II Paralakhemundi"
2024_CEBMB_102390_3,SE- HID- ADV - 04/2023-24,C.C. Lining to Jatili Sub-Minor-IV in between RD 726m to 1000m of B.I.P,C.C. Lining to Jatili Sub-Minor-IV in between RD 726m to 1000m of B.I.P,Works,National Competitive Bid,Percentage,Civil Works - Others,No,No,NA ,11-Mar-2024 10:00 AM,NA ,90.0,No ,No,Online,22-Mar-2024 11:00 AM,"CE-BM,RVN Basin,Berhampur||SE Southern Irr Circle II Paralakhemundi",ADAVA,761217.0,1.0,"16,77,935",Simadri Trinath Rao,"1,426,412",Rejected-AOC,11-Jul-2024,"CE-BM,RVN Basin,Berhampur||SE Southern Irr Circle II Paralakhemundi"
2024_CEBMB_102390_4,SE- HID- ADV - 04/2023-24,C.C. Lining and Repair of falls of Jatili Sub-Minor-II in between RD 50m to 200m of B.I.P,C.C. Lining and Repair of falls of Jatili Sub-Minor-II in between RD 50m to 200m of B.I.P,Works,National Competitive Bid,Percentage,Civil Works - Others,No,No,NA ,11-Mar-2024 10:00 AM,NA ,90.0,No ,No,Online,22-Mar-2024 11:00 AM,"CE-BM,RVN Basin,Berhampur||SE Southern Irr Circle II Paralakhemundi",ADAVA,761217.0,1.0,"5,98,998",GOURISANKAR MISHRA,"509,208",Rejected-AOC,11-Jul-2024,"CE-BM,RVN Basin,Berhampur||SE Southern Irr Circle II Paralakhemundi"
2024_CEBMB_102390_5,SE- HID- ADV - 04/2023-24,C.C. Lining and Repair of falls of Jatili Sub-Minor-III in between RD 300m to 2100m of B.I.P,C.C. Lining and Repair of falls of Jatili Sub-Minor-III in between RD 300m to 2100m of B.I.P,Works,National Competitive Bid,Percentage,Civil Works - Others,No,No,NA ,11-Mar-2024 10:00 AM,NA ,90.0,No ,No,Online,22-Mar-2024 11:00 AM,"CE-BM,RVN Basin,Berhampur||SE Southern Irr Circle II Paralakhemundi",ADAVA,761217.0,1.0,"16,78,118",Simadri Trinath Rao,"1,426,568",Rejected-AOC,11-Jul-2024,"CE-BM,RVN Basin,Berhampur||SE Southern Irr Circle II Paralakhemundi"
2024_CEBMB_102390_6,SE- HID- ADV - 04/2023-24,Improvement to Koilikota Minor in between RD 970m to RD 993m and RD 1776m to 1966m of B.I.P. for the year 2024-2025 (concrete wall lining),Improvement to Koilikota Minor in between RD 970m to RD 993m and RD 1776m to 1966m of B.I.P. for the year 2024-2025 (concrete wall lining),Works,National Competitive Bid,Percentage,Civil Works - Others,No,No,NA ,11-Mar-2024 10:00 AM,NA ,90.0,No ,No,Online,22-Mar-2024 11:00 AM,"CE-BM,RVN Basin,Berhampur||SE Southern Irr Circle II Paralakhemundi",ADAVA,761217.0,1.0,"20,97,912",SANTOSH DAS,"1,783,435",Rejected-AOC,11-Jul-2024,"CE-BM,RVN Basin,Berhampur||SE Southern Irr Circle II Paralakhemundi"
2024_CEBMB_102390_7,SE- HID- ADV - 04/2023-24,Improvement to lachmanguda Sub-Minor in between RD 00m to 150m of B.I.P. (c.c. wall lining),Improvement to lachmanguda Sub-Minor in between RD 00m to 150m of B.I.P. (c.c. wall lining),Works,National Competitive Bid,Percentage,Civil Works - Others,No,No,NA ,11-Mar-2024 10:00 AM,NA ,90.0,No ,No,Online,22-Mar-2024 11:00 AM,"CE-BM,RVN Basin,Berhampur||SE Southern Irr Circle II Paralakhemundi",ADAVA,761217.0,1.0,"12,58,950",BALAJI PANIGRAHI,"1,070,234",Rejected-AOC,11-Jul-2024,"CE-BM,RVN Basin,Berhampur||SE Southern Irr Circle II Paralakhemundi"
