2024_CERWI_101461_1,NAYAGARH13202324,New construction of Day-Care Sub-Center-cum-Health and Wellness center building at Pantikhari under Odagaon Block in the District of Nayagarh for the year 2023-24,New construction of Day-Care Sub-Center-cum-Health and Wellness center building at Pantikhari under Odagaon Block in the District of Nayagarh for the year 2023-24,Works,Open Tender,Percentage,Civil Works - Buildings,No,No,NA ,20-Feb-2024 11:00 AM,NA ,90.0,No ,No,Online,11-Mar-2024 11:00 AM,CE RW I||RWCIRCLE-BHUBANESWAR||RWDIVISION-NAYAGARH,Nayagarh,752070.0,2.0,"46,32,064",PRABIN KUMAR PATRA,"3,937,717",Rejected-AOC,10-Jul-2024,CE RW I||RWCIRCLE-BHUBANESWAR||RWDIVISION-NAYAGARH
2024_CERWI_101466_1,NAYAGARH13202324,New construction of Day-Care Sub-Center-cum-Health and Wellness center building at MC Odagaon under Odagaon Block in the District of Nayagarh for the year 2023-24,New construction of Day-Care Sub-Center-cum-Health and Wellness center building at MC Odagaon under Odagaon Block in the District of Nayagarh for the year 2023-24,Works,Open Tender,Percentage,Civil Works - Buildings,No,No,NA ,20-Feb-2024 11:30 AM,NA ,90.0,No ,No,Online,11-Mar-2024 11:00 AM,CE RW I||RWCIRCLE-BHUBANESWAR||RWDIVISION-NAYAGARH,Nayagarh,752070.0,2.0,"46,32,071",PRABIN KUMAR PATRA,"3,937,724",Rejected-AOC,10-Jul-2024,CE RW I||RWCIRCLE-BHUBANESWAR||RWDIVISION-NAYAGARH
2024_CERWI_101508_1,BuildingTender Online RWCSBP-60/2023-24,"Construction of Model Government Upper Primary school at Chakramal Village for the students of Chakramal,Kurumkel,Bhutuli and Rengali village of Ambabhona Block of Bargarh District.","Construction of Model Government Upper Primary school at Chakramal Village for the students of Chakramal,Kurumkel,Bhutuli and Rengali village of Ambabhona Block of Bargarh District.",Works,Open Tender,Percentage,Civil Works - Buildings,No,No,NA ,21-Feb-2024 09:00 AM,NA ,90.0,No ,No,Online,01-Mar-2024 11:00 AM,CE RW I||RWCIRCLE-SAMBALPUR,Bargarh,768028.0,2.0,"1,14,16,755",JAYAKUMARI PADHAN,"11,392,779.48",Rejected-Finance,12-Jul-2024,CE RW I||RWCIRCLE-SAMBALPUR
2024_CERWI_101681_3,e-Procurement Notice No.27 of 2023-24,Construction of New Sub-Centre Building at Attapur for 2023-24,Construction of New Sub-Centre Building at Attapur for 2023-24,Works,Open Tender,Percentage,Civil Works - Buildings,No,No,NA ,24-Feb-2024 05:00 PM,NA ,90.0,No ,No,Online,04-Mar-2024 11:00 AM,CE RW I||RWCIRCLE-BALASORE||RWDIVISION-BALASORE-II,Balasore,756001.0,1.0,"37,03,676",SAUMYA SUCHARITA BARIK,"3,148,468",Rejected-AOC,15-Jul-2024,CE RW I||RWCIRCLE-BALASORE||RWDIVISION-BALASORE-II
2024_CERWI_101763_11,Online Tender-BGH-24,Construction of Sub-Centre Building at Keseipali for 2023-24.,Building Works,Works,Open Tender,Percentage,Civil Works - Buildings,No,No,NA ,26-Feb-2024 03:00 PM,NA ,90.0,No ,No,Online,07-Mar-2024 11:00 AM,CE RW I||RWCIRCLE-SAMBALPUR||RWDIVISION-BARGARH,Bargarh,768028.0,1.0,"38,24,000",RATNAKARA SA,"3,765,488",Rejected-Finance,23-Jul-2024,CE RW I||RWCIRCLE-SAMBALPUR||RWDIVISION-BARGARH
2024_CERWI_101763_12,Online Tender-BGH-24,Construction of Sub-Centre Building at Barguda for 2023-24.,Building Works,Works,Open Tender,Percentage,Civil Works - Buildings,No,No,NA ,26-Feb-2024 03:00 PM,NA ,90.0,No ,No,Online,07-Mar-2024 11:00 AM,CE RW I||RWCIRCLE-SAMBALPUR||RWDIVISION-BARGARH,Bargarh,768028.0,1.0,"38,24,000",SAMRIT KUMAR CHAND,"3,785,782",Rejected-AOC,24-Jul-2024,CE RW I||RWCIRCLE-SAMBALPUR||RWDIVISION-BARGARH
2024_CERWI_101763_13,Online Tender-BGH-24,Construction of Sub-Centre Building at Gopaipali for 2023-24.,Building Works,Works,Open Tender,Percentage,Civil Works - Buildings,No,No,NA ,26-Feb-2024 03:00 PM,NA ,90.0,No ,No,Online,07-Mar-2024 11:00 AM,CE RW I||RWCIRCLE-SAMBALPUR||RWDIVISION-BARGARH,Bargarh,768028.0,1.0,"38,24,000",SANANDA SAHU,"3,785,782",Rejected-AOC,24-Jul-2024,CE RW I||RWCIRCLE-SAMBALPUR||RWDIVISION-BARGARH
2024_CERWI_101763_14,Online Tender-BGH-24,Construction of Sub-Centre Building at Mahada for 2023-24.,Building Works,Works,Open Tender,Percentage,Civil Works - Buildings,No,No,NA ,26-Feb-2024 03:00 PM,NA ,90.0,No ,No,Online,07-Mar-2024 11:00 AM,CE RW I||RWCIRCLE-SAMBALPUR||RWDIVISION-BARGARH,Bargarh,768028.0,1.0,"38,24,000",RAJIBA LOCHAN SETH,"3,575,843",Rejected-Finance,24-Jul-2024,CE RW I||RWCIRCLE-SAMBALPUR||RWDIVISION-BARGARH
2024_CERWI_101763_15,Online Tender-BGH-24,Construction of Sub-Centre Building at Tejang for 2023-24.,Building Works,Works,Open Tender,Percentage,Civil Works - Buildings,No,No,NA ,26-Feb-2024 03:00 PM,NA ,90.0,No ,No,Online,07-Mar-2024 11:00 AM,CE RW I||RWCIRCLE-SAMBALPUR||RWDIVISION-BARGARH,Bargarh,768028.0,1.0,"38,24,000",MAHESH KUMAR SETH,"3,575,843",Rejected-Finance,24-Jul-2024,CE RW I||RWCIRCLE-SAMBALPUR||RWDIVISION-BARGARH
2024_CERWI_101763_16,Online Tender-BGH-24,Construction of Sub-Centre Building at Tinkani for 2023-24.,Building Works,Works,Open Tender,Percentage,Civil Works - Buildings,No,No,NA ,26-Feb-2024 03:00 PM,NA ,90.0,No ,No,Online,07-Mar-2024 11:00 AM,CE RW I||RWCIRCLE-SAMBALPUR||RWDIVISION-BARGARH,Bargarh,768028.0,1.0,"38,24,000",MAHESH KUMAR SETH,"3,250,801",Rejected-Finance,24-Jul-2024,CE RW I||RWCIRCLE-SAMBALPUR||RWDIVISION-BARGARH
2024_CERWI_101763_18,Online Tender-BGH-24,Construction of Sub-Centre Building at Khaliapali for 2023-24.,Building Works,Works,Open Tender,Percentage,Civil Works - Buildings,No,No,NA ,26-Feb-2024 03:00 PM,NA ,90.0,No ,No,Online,07-Mar-2024 11:00 AM,CE RW I||RWCIRCLE-SAMBALPUR||RWDIVISION-BARGARH,Bargarh,768028.0,1.0,"38,24,000",M/s SGSM Construction,"3,250,976",Accepted-AOC,26-Jul-2024,CE RW I||RWCIRCLE-SAMBALPUR||RWDIVISION-BARGARH
2024_CERWI_101763_19,Online Tender-BGH-24,Construction of Sub-Centre Building at Kuruan for 2023-24.,Building Works,Works,Open Tender,Percentage,Civil Works - Buildings,No,No,NA ,26-Feb-2024 03:00 PM,NA ,90.0,No ,No,Online,07-Mar-2024 11:00 AM,CE RW I||RWCIRCLE-SAMBALPUR||RWDIVISION-BARGARH,Bargarh,768028.0,1.0,"38,24,000",PRASANTA SEBAK,"3,250,976",Accepted-AOC,24-Jul-2024,CE RW I||RWCIRCLE-SAMBALPUR||RWDIVISION-BARGARH
2024_CERWI_101763_25,Online Tender-BGH-24,Construction of Sub-Centre Building at Karla for 2023-24.,Building Works,Works,Open Tender,Percentage,Civil Works - Buildings,No,No,NA ,26-Feb-2024 03:00 PM,NA ,90.0,No ,No,Online,07-Mar-2024 11:00 AM,CE RW I||RWCIRCLE-SAMBALPUR||RWDIVISION-BARGARH,Bargarh,768028.0,1.0,"38,24,000",SURESH MIRDHA,"3,633,705",Rejected-AOC,24-Jul-2024,CE RW I||RWCIRCLE-SAMBALPUR||RWDIVISION-BARGARH
2024_CERWI_101763_26,Online Tender-BGH-24,Construction of Sub-Centre Building at Banda for 2023-24.,Building Works,Works,Open Tender,Percentage,Civil Works - Buildings,No,No,NA ,26-Feb-2024 03:00 PM,NA ,90.0,No ,No,Online,07-Mar-2024 11:00 AM,CE RW I||RWCIRCLE-SAMBALPUR||RWDIVISION-BARGARH,Bargarh,768028.0,1.0,"38,24,000",PRASANTA SEBAK,"3,250,976",Rejected-AOC,23-Jul-2024,CE RW I||RWCIRCLE-SAMBALPUR||RWDIVISION-BARGARH
2024_CERWI_101763_27,Online Tender-BGH-24,Construction of Sub-Centre Building at Khola for 2023-24.,Building Works,Works,Open Tender,Percentage,Civil Works - Buildings,No,No,NA ,26-Feb-2024 03:00 PM,NA ,90.0,No ,No,Online,07-Mar-2024 11:00 AM,CE RW I||RWCIRCLE-SAMBALPUR||RWDIVISION-BARGARH,Bargarh,768028.0,1.0,"38,24,000",SURESH MIRDHA,"3,633,705",Rejected-AOC,24-Jul-2024,CE RW I||RWCIRCLE-SAMBALPUR||RWDIVISION-BARGARH
2024_CERWI_101763_3,Online Tender-BGH-24,Construction of Sub-Centre Building at Bijapali for 2023-24.,Building Works,Works,Open Tender,Percentage,Civil Works - Buildings,No,No,NA ,26-Feb-2024 03:00 PM,NA ,90.0,No ,No,Online,07-Mar-2024 11:00 AM,CE RW I||RWCIRCLE-SAMBALPUR||RWDIVISION-BARGARH,Bargarh,768028.0,1.0,"38,24,000",KUNALA DEBATA,"3,708,101",Rejected-Finance,24-Jul-2024,CE RW I||RWCIRCLE-SAMBALPUR||RWDIVISION-BARGARH
2024_CERWI_101763_31,Online Tender-BGH-24,Construction of Sub-Centre Building at Bausenmura for 2023-24.,Building Works,Works,Open Tender,Percentage,Civil Works - Buildings,No,No,NA ,26-Feb-2024 03:00 PM,NA ,90.0,No ,No,Online,07-Mar-2024 11:00 AM,CE RW I||RWCIRCLE-SAMBALPUR||RWDIVISION-BARGARH,Bargarh,768028.0,1.0,"38,24,000",CHUDAMANI PADHAN,"3,824,756",Accepted-AOC,23-Jul-2024,CE RW I||RWCIRCLE-SAMBALPUR||RWDIVISION-BARGARH
2024_CERWI_101763_32,Online Tender-BGH-24,Construction of Sub-Centre Building at kharsal for 2023-24.,Building Works,Works,Open Tender,Percentage,Civil Works - Buildings,No,No,NA ,26-Feb-2024 03:00 PM,NA ,90.0,No ,No,Online,07-Mar-2024 11:00 AM,CE RW I||RWCIRCLE-SAMBALPUR||RWDIVISION-BARGARH,Bargarh,768028.0,1.0,"38,24,000",SOMANATH MEHER,"3,786,524",Rejected-Finance,25-Jul-2024,CE RW I||RWCIRCLE-SAMBALPUR||RWDIVISION-BARGARH
2024_CERWI_101763_33,Online Tender-BGH-24,Construction of R W Subdivision Office at Bhatli during 2023-24.,Building Works,Works,Open Tender,Percentage,Civil Works - Buildings,No,No,NA ,26-Feb-2024 06:00 PM,NA ,90.0,No ,No,Online,07-Mar-2024 11:00 AM,CE RW I||RWCIRCLE-SAMBALPUR||RWDIVISION-BARGARH,Bargarh,768028.0,1.0,"29,86,000",CHANCHALA MISHRA,,Rejected-Finance,,CE RW I||RWCIRCLE-SAMBALPUR||RWDIVISION-BARGARH
2024_CERWI_101763_34,Online Tender-BGH-24,Construction of R W D type Quarter at Bhatli during 2023-24.,Building Works,Works,Open Tender,Percentage,Civil Works - Buildings,No,No,NA ,26-Feb-2024 06:00 PM,NA ,90.0,No ,No,Online,07-Mar-2024 11:00 AM,CE RW I||RWCIRCLE-SAMBALPUR||RWDIVISION-BARGARH,Bargarh,768028.0,1.0,"24,51,000",CHANCHALA MISHRA,,Rejected-Finance,25-Jul-2024,CE RW I||RWCIRCLE-SAMBALPUR||RWDIVISION-BARGARH
2024_CERWI_101763_4,Online Tender-BGH-24,Construction of Sub-Centre Building at Kalangapali for 2023-24.,Building Works,Works,Open Tender,Percentage,Civil Works - Buildings,No,No,NA ,26-Feb-2024 03:00 PM,NA ,90.0,No ,No,Online,07-Mar-2024 11:00 AM,CE RW I||RWCIRCLE-SAMBALPUR||RWDIVISION-BARGARH,Bargarh,768028.0,1.0,"38,24,000",MOTIRAM BHOI,"3,813,282",Rejected-Finance,26-Jul-2024,CE RW I||RWCIRCLE-SAMBALPUR||RWDIVISION-BARGARH
2024_CERWI_101763_6,Online Tender-BGH-24,Construction of Sub-Centre Building at Karandola for 2023-24.,Building Works,Works,Open Tender,Percentage,Civil Works - Buildings,No,No,NA ,26-Feb-2024 03:00 PM,NA ,90.0,No ,No,Online,07-Mar-2024 11:00 AM,CE RW I||RWCIRCLE-SAMBALPUR||RWDIVISION-BARGARH,Bargarh,768028.0,1.0,"38,24,000",PARIJA PADHAN,"3,797,600",Rejected-Finance,24-Jul-2024,CE RW I||RWCIRCLE-SAMBALPUR||RWDIVISION-BARGARH
2024_CERWI_101763_8,Online Tender-BGH-24,Construction of Sub-Centre Building at Lebdi for 2023-24.,Building Works,Works,Open Tender,Percentage,Civil Works - Buildings,No,No,NA ,26-Feb-2024 03:00 PM,NA ,90.0,No ,No,Online,07-Mar-2024 11:00 AM,CE RW I||RWCIRCLE-SAMBALPUR||RWDIVISION-BARGARH,Bargarh,768028.0,1.0,"38,24,000",GAJANAN SA,"3,811,752",Rejected-Finance,23-Jul-2024,CE RW I||RWCIRCLE-SAMBALPUR||RWDIVISION-BARGARH
2024_CERWI_101763_9,Online Tender-BGH-24,Construction of Sub-Centre Building at Petupali for 2023-24.,Building Works,Works,Open Tender,Percentage,Civil Works - Buildings,No,No,NA ,26-Feb-2024 03:00 PM,NA ,90.0,No ,No,Online,07-Mar-2024 11:00 AM,CE RW I||RWCIRCLE-SAMBALPUR||RWDIVISION-BARGARH,Bargarh,768028.0,1.0,"38,24,000",JUDHISTHIR MAHAMALLIK,"3,824,756",Rejected-Finance,30-Jul-2024,CE RW I||RWCIRCLE-SAMBALPUR||RWDIVISION-BARGARH
2024_CERWI_101819_1,OnlineTender/16/SERWDG-I/23-24,SR to RW Section office building at Polasara,SR to RW Section office building at Polasara,Works,National Competitive Bid,Percentage,Civil Works - Buildings,No,No,NA ,28-Feb-2024 06:00 PM,NA ,90.0,No ,No,Online,06-Mar-2024 11:00 AM,CE RW I||RWCIRCLE-BERHAMPUR||RWDIVISION-GANJAM - I,Berhampur,760010.0,1.0,"2,86,000",Tapaswini Mahapatra,"242,748",Rejected-AOC,16-Jul-2024,CE RW I||RWCIRCLE-BERHAMPUR||RWDIVISION-GANJAM - I
2024_CERWI_101819_2,OnlineTender/16/SERWDG-I/23-24,SR to RW Sub division office building at Polasara,SR to RW Sub division office building at Polasara,Works,National Competitive Bid,Percentage,Civil Works - Buildings,No,No,NA ,28-Feb-2024 06:00 PM,NA ,90.0,No ,No,Online,06-Mar-2024 11:00 AM,CE RW I||RWCIRCLE-BERHAMPUR||RWDIVISION-GANJAM - I,Berhampur,760010.0,1.0,"1,51,000",MANASI PRADHAN,"128,267",Rejected-AOC,16-Jul-2024,CE RW I||RWCIRCLE-BERHAMPUR||RWDIVISION-GANJAM - I
2024_CERWI_101858_3,EERWELBBSR 52/ 2023-24,Shifting of Electrical poles/ lines for the Work Improvement to Naliamuhan to Satyabhamapur Road of Cuttack,Shifting of Electrical poles/ lines for the Work Improvement to Naliamuhan to Satyabhamapur Road of Cuttack,Works,Open Tender,Percentage,Electrical Works,No,No,NA ,28-Feb-2024 05:00 PM,NA ,90.0,No ,No,Online,11-Mar-2024 04:00 PM,CE RW I||RW Electrical Circle Bhubaneswar||RW Electrical Division Bhubaneswar,Satyabhamapur,754200.0,1.0,"30,31,092",M/S. MAA LAXMI ELECTRICALS,,Rejected-Technical,,CE RW I||RW Electrical Circle Bhubaneswar||RW Electrical Division Bhubaneswar
2024_CERWI_101888_1,22/2023-24,"CONSTRUCTION OF NEW 11KV LINE (MAJHAGAON TO RUPAIM) TO PROVIDE THE POWER SUPPLY TO SUNABEDA AREA DURING THE SHIFTING OF EXISTING LINE and C0NSTRUCTION OF CHERICHUAN TO JAMGAON ROAD (S.E. NO-53/23-24 OF TPWODL, NUAPADA)","CONSTRUCTION OF NEW 11KV LINE (MAJHAGAON TO RUPAIM) TO PROVIDE THE POWER SUPPLY TO SUNABEDA AREA DURING THE SHIFTING OF EXISTING LINE and C0NSTRUCTION OF CHERICHUAN TO JAMGAON ROAD (S.E. NO-53/23-24 OF TPWODL, NUAPADA)",Works,National Competitive Bid,Percentage,Electrical Works,No,No,NA ,28-Feb-2024 12:00 PM,NA ,90.0,No ,No,Online,06-Mar-2024 01:00 PM,CE RW I||RW Electrical Circle Bhubaneswar||RW Electrical Division Berhampur,Berhampur,760011.0,2.0,"74,20,000",Subhendu Dash,"6,678,885",Rejected-AOC,15-Jul-2024,CE RW I||RW Electrical Circle Bhubaneswar||RW Electrical Division Berhampur
2024_CERWI_101888_2,22/2023-24,"SHIFTING OF EXISTING 11KV LINE FOR WIDENING OF ROAD FROM CHERICHUAN TO JAMGAON (S.E. NO-54/23-24 OF TPWODL, NUAPADA)","SHIFTING OF EXISTING 11KV LINE FOR WIDENING OF ROAD FROM CHERICHUAN TO JAMGAON (S.E. NO-54/23-24 OF TPWODL, NUAPADA)",Works,National Competitive Bid,Percentage,Electrical Works,No,No,NA ,28-Feb-2024 12:00 PM,NA ,90.0,No ,No,Online,06-Mar-2024 01:00 PM,CE RW I||RW Electrical Circle Bhubaneswar||RW Electrical Division Berhampur,Berhampur,760011.0,2.0,"53,19,000",Subhendu Dash,"4,521,338",Rejected-AOC,15-Jul-2024,CE RW I||RW Electrical Circle Bhubaneswar||RW Electrical Division Berhampur
2024_CERWI_101926_1,OnlineTender/16/SERWDG-I/23-24,SR to Dengapadara Mardarajpur road,SR to Dengapadara Mardarajpur road,Works,National Competitive Bid,Percentage,Civil Works - Roads,No,No,NA ,28-Feb-2024 06:00 PM,NA ,90.0,No ,No,Online,06-Mar-2024 11:00 AM,CE RW I||RWCIRCLE-BERHAMPUR||RWDIVISION-GANJAM - I,Berhampur,760010.0,1.0,"11,76,000",G PANDA PATRA,"890,386",Accepted-AOC,26-Jul-2024,CE RW I||RWCIRCLE-BERHAMPUR||RWDIVISION-GANJAM - I
2024_CERWI_102003_13,SERWSBD-ONLINE-18/2023-24,New Construction of Day Care Sub-centre Building at Machkund,Building,Works,Open Tender,Percentage,Civil Works - Bridges,No,No,NA ,02-Mar-2024 05:00 PM,NA ,90.0,No ,No,Online,13-Mar-2024 11:00 AM,CE RW I||RWCIRCLE-SUNABEDA||RWDIVISION-SUNABEDA,Sunabeda,763001.0,2.0,"35,03,000",SUKRA HARIJAN,"3,146,653",Rejected-AOC,16-Jul-2024,CE RW I||RWCIRCLE-SUNABEDA||RWDIVISION-SUNABEDA
2024_CERWI_102003_5,SERWSBD-ONLINE-18/2023-24,New Construction of PHC Building at Banamaliput,Building,Works,Open Tender,Percentage,Civil Works - Bridges,No,No,NA ,01-Mar-2024 05:00 PM,NA ,90.0,No ,No,Online,13-Mar-2024 11:00 AM,CE RW I||RWCIRCLE-SUNABEDA||RWDIVISION-SUNABEDA,Sunabeda,763001.0,2.0,"97,98,000",Bhagaban Khora,"8,819,554",Accepted-AOC,25-Jun-2024,CE RW I||RWCIRCLE-SUNABEDA||RWDIVISION-SUNABEDA
2024_CERWI_102003_7,SERWSBD-ONLINE-18/2023-24,New Construction of PHC Building at Mattamput,Building,Works,Open Tender,Percentage,Civil Works - Bridges,No,No,NA ,01-Mar-2024 05:00 PM,NA ,90.0,No ,No,Online,13-Mar-2024 11:00 AM,CE RW I||RWCIRCLE-SUNABEDA||RWDIVISION-SUNABEDA,Sunabeda,763001.0,2.0,"89,54,000",SUKRA HARIJAN,"8,057,519",Rejected-AOC,25-Jun-2024,CE RW I||RWCIRCLE-SUNABEDA||RWDIVISION-SUNABEDA
2024_CERWI_102003_8,SERWSBD-ONLINE-18/2023-24,New Construction of PHC Building at Nilabadi,Building,Works,Open Tender,Percentage,Civil Works - Bridges,No,No,NA ,01-Mar-2024 06:00 PM,NA ,90.0,No ,No,Online,13-Mar-2024 11:00 AM,CE RW I||RWCIRCLE-SUNABEDA||RWDIVISION-SUNABEDA,Sunabeda,763001.0,2.0,"89,55,000",Bhagaban Khora,"8,059,964",Accepted-AOC,16-Jul-2024,CE RW I||RWCIRCLE-SUNABEDA||RWDIVISION-SUNABEDA
2024_CERWI_102013_3,SE/RW/BDKII/TCN17/2023-24,Construction of Sub Centre Building at Nirgundi for the year 2023-24 in the District of Bhadrak,Construction of Sub Centre Building at Nirgundi for the year 2023-24 in the District of Bhadrak,Works,Open Tender,Percentage,Civil Works - Buildings,No,No,NA ,01-Mar-2024 02:15 PM,NA ,90.0,No ,No,Online,07-Mar-2024 04:00 PM,CE RW I||RWCIRCLE-BALASORE||RWDIVISION-BHADRAK-II,Bhadrak,756100.0,1.0,"36,54,000",NILAMBER KUMAR SINGH,"3,106,264",Accepted-AOC,02-Jul-2024,CE RW I||RWCIRCLE-BALASORE||RWDIVISION-BHADRAK-II
2024_CERWI_102013_4,SE/RW/BDKII/TCN17/2023-24,Construction of Sub Centre Building at Bajarpur for the year 2023-24 in the District of Bhadrak,Construction of Sub Centre Building at Bajarpur for the year 2023-24 in the District of Bhadrak,Works,Open Tender,Percentage,Civil Works - Buildings,No,No,NA ,01-Mar-2024 02:15 PM,NA ,90.0,No ,No,Online,07-Mar-2024 04:00 PM,CE RW I||RWCIRCLE-BALASORE||RWDIVISION-BHADRAK-II,Bhadrak,756100.0,1.0,"35,06,000",Diptikanta Sethi,"3,256,054.38",Rejected-AOC,31-Jul-2024,CE RW I||RWCIRCLE-BALASORE||RWDIVISION-BHADRAK-II
2024_CERWI_102060_1,Road Tender Online RWCSBP-68/2023-24,Construction of Dahamunda Ledapara via Bulungpada to Majhapara road in the district of Sambalpur under MMSY Transferred Road Improvement Programme (MMSY-TRIP) for the year 2023-24,Construction of Dahamunda Ledapara via Bulungpada to Majhapara road in the district of Sambalpur under MMSY Transferred Road Improvement Programme (MMSY-TRIP) for the year 2023-24,Works,Open Tender,Percentage,Civil Works - Roads,No,No,NA ,02-Mar-2024 09:00 AM,NA ,90.0,No ,No,Online,12-Mar-2024 09:00 AM,CE RW I||RWCIRCLE-SAMBALPUR,Kuchinda,768222.0,2.0,"5,33,35,305",JISHU KRISHNA PATRA,"52,684,613.785",Accepted-AOC,30-Jul-2024,CE RW I||RWCIRCLE-SAMBALPUR
2024_CERWI_102087_3,RWKHR- 16/2023-24 (Online),Construction of SC-HWC at Ghatmal under Sinapali Block in the district of Nuapada,Construction of SC-HWC at Ghatmal under Sinapali Block in the district of Nuapada,Works,Open Tender,Percentage,Civil Works - Buildings,No,No,NA ,02-Mar-2024 02:15 PM,NA ,90.0,No ,No,Online,11-Mar-2024 05:00 PM,CE RW I||RWCIRCLE-BHAWANIPATNA||RW Division Khariar,KHARIAR,766107.0,1.0,"37,38,648",RAJENDRA PRASAD MEHER,"3,694,523",Rejected-Finance,05-Jul-2024,CE RW I||RWCIRCLE-BHAWANIPATNA||RW Division Khariar
2024_CERWI_102127_6,EEPTNG-Online-17/2023-24,Construction of new Sub-Centre Building at Bharuamunda under Belpara Block for the year 2023-24 State Plan under MMSSM,Construction of new Sub-Centre Building at Bharuamunda under Belpara Block for the year 2023-24 State Plan under MMSSM,Works,Open Tender,Percentage,Civil Works - Buildings,No,No,NA ,04-Mar-2024 11:00 AM,NA ,90.0,No ,No,Online,16-Mar-2024 11:00 AM,CE RW I||RWCIRCLE-BALANGIR||RW Division Patnagarh,Patnagarh,767025.0,1.0,"34,89,000",MANMAYA KUMAR DASH,"2,966,162",Rejected-Finance,22-Jul-2024,CE RW I||RWCIRCLE-BALANGIR||RW Division Patnagarh
2024_CERWI_102227_3,Building Tender Online RWCSBP-65/2023-24,Construction of (24x7) PHC (New) Building at Katarbaga under State Budget for the year 2023-24.,Construction of (24x7) PHC (New) Building at Katarbaga under State Budget for the year 2023-24.,Works,Open Tender,Percentage,Civil Works - Buildings,No,No,NA ,05-Mar-2024 01:00 PM,NA ,90.0,No ,No,Online,12-Mar-2024 11:00 AM,CE RW I||RWCIRCLE-SAMBALPUR,Sambalpur,768001.0,2.0,"2,04,06,134",DASHARATHA MUNDA,"18,367,561.03",Accepted-AOC,31-Jul-2024,CE RW I||RWCIRCLE-SAMBALPUR
2024_CERWI_102227_4,Building Tender Online RWCSBP-65/2023-24,Construction of (24x7) PHC (New) Building at Khinda under State Budget for the year 2023-24.,Construction of (24x7) PHC (New) Building at Khinda under State Budget for the year 2023-24.,Works,Open Tender,Percentage,Civil Works - Buildings,No,No,NA ,05-Mar-2024 01:00 PM,NA ,90.0,No ,No,Online,12-Mar-2024 11:00 AM,CE RW I||RWCIRCLE-SAMBALPUR,Sambalpur,768001.0,2.0,"2,04,05,882",DASHARATHA MUNDA,"18,367,334.68",Rejected-Finance,31-Jul-2024,CE RW I||RWCIRCLE-SAMBALPUR
2024_CERWI_102227_5,Building Tender Online RWCSBP-65/2023-24,Construction of (24x7) PHC (New) Building at Badmal under State Budget for the year 2023-24.,Construction of (24x7) PHC (New) Building at Badmal under State Budget for the year 2023-24.,Works,Open Tender,Percentage,Civil Works - Buildings,No,No,NA ,05-Mar-2024 01:00 PM,NA ,90.0,No ,No,Online,12-Mar-2024 11:00 AM,CE RW I||RWCIRCLE-SAMBALPUR,Sambalpur,768001.0,2.0,"2,04,05,734",MD ZAHIRUDDIN,"18,210,077.35",Rejected-Finance,30-Jul-2024,CE RW I||RWCIRCLE-SAMBALPUR
2024_CERWI_102231_1,Tender Online 35 JJPT- 2023-24,"Construction of Govt. Ayurvedic Dispensary at Mukundupur, of Korei Block in the district of Jajpur for the year 2023-24.","Construction of Govt. Ayurvedic Dispensary at Mukundupur, of Korei Block in the district of Jajpur for the year 2023-24.",Works,National Competitive Bid,Percentage,Civil Works - Buildings,No,No,NA ,05-Mar-2024 05:00 PM,NA ,90.0,No ,No,Online,12-Mar-2024 11:30 AM,CE RW I||RWCIRCLE-CUTTACK||RWDIVISION-JAJPUR,JAJPUR,755007.0,1.0,"27,84,782",SUSHANTA KUMAR TARAI,"2,367,342.9",Rejected-AOC,19-Jul-2024,CE RW I||RWCIRCLE-CUTTACK||RWDIVISION-JAJPUR
2024_CERWI_102235_1,Tender Online 35 jjpt 2023-24,S/R to NH 200A (Sanasailo Chhaka) Mirigichara road via Olia Bhalukantia for the year 2023-24,S/R to NH 200A (Sanasailo Chhaka) Mirigichara road via Olia Bhalukantia for the year 2023-24,Works,National Competitive Bid,Percentage,Civil Works - Roads,No,No,NA ,05-Mar-2024 05:30 PM,NA ,90.0,No ,No,Online,12-Mar-2024 11:30 AM,CE RW I||RWCIRCLE-CUTTACK||RWDIVISION-JAJPUR,JAJPUR,755007.0,1.0,"7,55,147",MAHESWAR PRADHAN,"641,950.09",Rejected-AOC,19-Jul-2024,CE RW I||RWCIRCLE-CUTTACK||RWDIVISION-JAJPUR
2024_CERWI_102235_2,Tender Online 35 jjpt 2023-24,S/R to RandB road to Uchhabali road for the year 2023-24 (Such as providing SDBC from 1/800 km to 2/500 km),S/R to RandB road to Uchhabali road for the year 2023-24 (Such as providing SDBC from 1/800 km to 2/500 km),Works,National Competitive Bid,Percentage,Civil Works - Roads,No,No,NA ,05-Mar-2024 05:30 PM,NA ,90.0,No ,No,Online,12-Mar-2024 11:30 AM,CE RW I||RWCIRCLE-CUTTACK||RWDIVISION-JAJPUR,JAJPUR,755007.0,1.0,"8,39,250",MAHESWAR PRADHAN,"713,446.16",Rejected-AOC,24-Jul-2024,CE RW I||RWCIRCLE-CUTTACK||RWDIVISION-JAJPUR
2024_CERWI_102235_3,Tender Online 35 jjpt 2023-24,Special Repair to RD Road to Dhobabil Road for the Year 2023-24 in the District of Jajpur.,Special Repair to RD Road to Dhobabil Road for the Year 2023-24 in the District of Jajpur.,Works,National Competitive Bid,Percentage,Civil Works - Roads,No,No,NA ,05-Mar-2024 05:30 PM,NA ,90.0,No ,No,Online,12-Mar-2024 11:30 AM,CE RW I||RWCIRCLE-CUTTACK||RWDIVISION-JAJPUR,JAJPUR,755007.0,1.0,"6,71,245",M/S KRUSHNA CHANDRA BEHERA,"664,532.52",Rejected-AOC,24-Jul-2024,CE RW I||RWCIRCLE-CUTTACK||RWDIVISION-JAJPUR
2024_CERWI_102235_4,Tender Online 35 jjpt 2023-24,S/R to Expressway to Baliapal road for the year 2023-24 (Such as providing SDBC in stretches from 0/00 km to 1/900 km).,S/R to Expressway to Baliapal road for the year 2023-24 (Such as providing SDBC in stretches from 0/00 km to 1/900 km).,Works,National Competitive Bid,Percentage,Civil Works - Roads,No,No,NA ,05-Mar-2024 05:30 PM,NA ,90.0,No ,No,Online,12-Mar-2024 11:30 AM,CE RW I||RWCIRCLE-CUTTACK||RWDIVISION-JAJPUR,JAJPUR,755007.0,1.0,"9,23,081",ANANTA NARAYAN JENA,"923,081.46",Accepted-AOC,24-Jul-2024,CE RW I||RWCIRCLE-CUTTACK||RWDIVISION-JAJPUR
2024_CERWI_102235_5,Tender Online 35 jjpt 2023-24,SR to PWD Road to Bantala via Khilipanga for the year 2023-24.road for the year 2023-24 (Such as providing SDBC in stretches from 0/00 km to 1/900 km).,SR to PWD Road to Bantala via Khilipanga for the year 2023-24.,Works,National Competitive Bid,Percentage,Civil Works - Roads,No,No,NA ,05-Mar-2024 05:30 PM,NA ,90.0,No ,No,Online,12-Mar-2024 11:30 AM,CE RW I||RWCIRCLE-CUTTACK||RWDIVISION-JAJPUR,JAJPUR,755007.0,1.0,"7,97,706",ABHIMANYU JENA,"789,729.03",Accepted-AOC,24-Jul-2024,CE RW I||RWCIRCLE-CUTTACK||RWDIVISION-JAJPUR
2024_CERWI_102295_1,Tender Online RWC - 06/24,Construction of Civil Court Building at Tirtol in the dist of Jagatsinghpur for the year 2023-24,Building Works,Works,National Competitive Bid,Percentage,Civil Works - Buildings,No,No,NA ,06-Mar-2024 06:55 PM,NA ,90.0,No ,No,Online,19-Mar-2024 11:30 AM,CE RW I||RWCIRCLE-CUTTACK,JAGATSINGHPUR,754104.0,2.0,"5,57,30,300",PABITRA MOHAN NAYAK,"50,162,793.64",Rejected-Finance,29-Jul-2024,CE RW I||RWCIRCLE-CUTTACK
2024_CERWI_102377_5,CCE-BLS-NCB-84 FOR 2023-24,Costruction of Flood resilient Road from Miripur Khaira School to Raikula road under SDMF in the District of Balasore for the year 2023-24,Costruction of Flood resilient Road from Miripur Khaira School to Raikula road under SDMF in the District of Balasore for the year 2023-24,Works,National Competitive Bid,Percentage,Civil Works - Roads,No,No,NA ,08-Mar-2024 09:00 AM,NA ,90.0,No ,No,Online,18-Mar-2024 11:00 AM,CE RW I||RWCIRCLE-BALASORE,Balasore,756001.0,2.0,"2,11,36,000",MURALIDHAR SAHOO,"17,967,278",Rejected-AOC,11-Jul-2024,CE RW I||RWCIRCLE-BALASORE
