Tender ID,tender_externalreference,tender_title,Work Description,Tender Category,Tender Type,Form of contract,Product Category,Is Multi Currency Allowed For BOQ,Allow Two Stage Bidding,Independent External Monitor/Remarks,Published Date,Pre Bid Meeting Date,Bid Validity(Days),Should Allow NDA Tender,Allow Preferential Bidder,Payment Mode,Bid Opening Date,Organisation Chain,location,Pincode,No of Bids Received,Tender Value in ₹,Bidder Name,Awarded Value,Status,Contract Date :,Department
2023_IDCO_92543_1,PC/EST/E-95/2023-24,"SITC of VRF units at IDCO Head Office, Janpath, Bhubaneswar","SITC of VRF units at IDCO Head Office, Janpath, Bhubaneswar",Works,National Competitive Bid,Item Rate,Electrical Works,No,No,NA ,17-Aug-2023 09:00 AM,NA ,180.0,No ,No,Online,22-Sep-2023 11:30 AM,IDCO||IDCO||IDCO,"IDCO Towers, Janpath, Bhubaneswar",751022.0,2.0,"2,07,66,232",MS ESSAR ELECTRONICS,"18,691,685",Rejected-AOC,26-Jul-2024,IDCO||IDCO||IDCO
2023_IDCO_92932_1,PC/EST/E-105/2023-24,"Up-gradation of Approach Road to MSME Park at Industrial Estate, Ramdaspur, Barang in Cuttack District, Odisha.","Up-gradation of Approach Road to MSME Park at Industrial Estate, Ramdaspur, Barang in Cuttack District, Odisha.",Works,National Competitive Bid,Percentage,Civil Works - Roads,No,No,NA ,22-Aug-2023 06:30 PM,NA ,90.0,No ,No,Online,08-Sep-2023 11:30 AM,IDCO||IDCO||IDCO,"Industrial Estate, Ramdaspur, Barang, Cuttack.",754006.0,2.0,"1,28,50,560",RAMACHANDRA SAMANTA SINGHAR,"10,924,260.98",Rejected-AOC,02-Jul-2024,IDCO||IDCO||IDCO
2023_IDCO_94494_1,CIVIL/EST/21/2023-24,Design Construction Supply Installation Testing Commissioning of packaged Water Treatment Plant WTP Unconventional Type of 1.80 MLD capacity for water supply to Fakir Mohan Medical College Balasore,Design Construction Supply Installation Testing Commissioning of packaged Water Treatment Plant WTP Unconventional Type of 1.80 MLD capacity for water supply to Fakir Mohan Medical College Balasore,Works,Open Tender,Percentage,Civil Works - Water Works,No,No,NA ,16-Sep-2023 06:55 PM,NA ,90.0,No ,No,Online,04-Oct-2023 11:30 AM,IDCO||IDCO||IDCO,FAKIR MOHAN MEDICAL COLLEGE BALASORE,756019.0,2.0,,SANJEEB MOHANTY,"12,029,729.38",Rejected-Finance,25-Jul-2024,IDCO||IDCO||IDCO
2023_IDCO_94578_1,PC/EST/E-119/2023-24,"Construction of SFRC Pre-cast, Pre-tensioned compound wall around 17.641 Ac. MSME Park, Hinjili,Dist- Ganjam.","Construction of SFRC Pre-cast, Pre-tensioned compound wall around 17.641 Ac. MSME Park, Hinjili, Dist- Ganjam.",Works,National Competitive Bid,Percentage,Civil Works - Others,No,No,NA ,18-Sep-2023 06:30 PM,NA ,120.0,No ,No,Online,05-Oct-2023 11:30 AM,IDCO,"Hinjili,Dist,Ganjam",761102.0,2.0,"86,55,450",Shyamlal Goel,"7,357,998.05",Rejected-Technical,30-Jul-2024,IDCO
2023_IDCO_95023_1,BBSR/ELECT-II/e-11/23-24,"Supply, installation, testing and commissioning of 125 KVA Silent type DG set with CT meter panel at Bakery Training Centre of Barabati Palace, Cuttack, Odisha","Supply, installation, testing and commissioning of 125 KVA Silent type DG set with CT meter panel at Bakery Training Centre of Barabati Palace, Cuttack, Odisha",Works,National Competitive Bid,Percentage,Electrical Works,No,No,NA ,30-Sep-2023 06:55 PM,03-Oct-2023 01:00 PM ,120.0,No ,No,Online,07-Oct-2023 04:00 PM,IDCO||IDCO||IDCO,"Barabati Palace, Cuttack",755008.0,2.0,"12,30,058",KAPIL CONSTRUCTION CO.,"1,155,270",Rejected-Technical,25-Jul-2024,IDCO||IDCO||IDCO
2023_IDCO_97959_1,PC/EST/E-158/2023-24,"Construction of CC Road from Cuttack-Chandabali Road to IDCO Plot No.1 and 1/A at Andei Sahi, Jagatpur New Industrial Estate, Cuttack, Odisha.","Construction of CC Road from Cuttack-Chandabali Road to IDCO Plot No.1 and 1/A at Andei Sahi, Jagatpur New Industrial Estate, Cuttack, Odisha.",Works,National Competitive Bid,Percentage,Civil Works - Roads,No,No,NA ,06-Dec-2023 05:00 PM,NA ,90.0,No ,No,Online,22-Dec-2023 11:30 AM,IDCO||IDCO||IDCO,"Jagatpur Industrial Estate, Cuttack, Odisha.",754021.0,2.0,"1,54,01,584",BIBEKANANDA BADAJENA,"13,092,886.67",Rejected-AOC,01-Jul-2024,IDCO||IDCO||IDCO
2023_OCCL_98318_1,E procurement Notice No 49/OCCL/2023-24 (on line),Bid Identification No. OCCL-LSIP/03/2023-24,Construction of FPE on Tel right from Tentulikhunti to Athagaon RD 00m to 15000m (Working Length approx. 6.45 Km).,Works,Open Tender,Percentage,Civil Works - Others,No,No,NA ,14-Dec-2023 03:30 PM,NA ,90.0,No ,No,Online,29-Dec-2023 12:00 PM,ODISHA CONSTRUCTION CORPORATION LTD||CIVIL,"Tentulikhunti,Athagaon, Odisha",767037.0,2.0,"19,94,74,641",M/S SRI SAI CONSTRUCTION,"179,547,124",Rejected-Finance,01-Jul-2024,ODISHA CONSTRUCTION CORPORATION LTD||CIVIL
2023_OHPCL_89005_1,RHEP/TCN/15/2023-24,RHEP/TCN-15-2023-24,"Renovation of 24 nos.(12 block) of E-type qtrs. at Electrical Colony,RHEP, Rengali",Works,Open Tender,Percentage,Civil Works - Buildings,No,No,please refer tender documents ,19-May-2023 10:00 AM,NA ,120.0,No ,No,Online,06-Jun-2023 11:30 AM,Odisha Hydro Power Corporation Ltd||Rengali H.E. Project Rengali,"RHEP,Rengali Dam Site",759105.0,2.0,,RAMA CHANDRA SAHU,"10,649,042",Rejected-Technical,25-Jul-2024,Odisha Hydro Power Corporation Ltd||Rengali H.E. Project Rengali
2023_OLIC_93179_18,Bid Id No.02 /OLIC (CTC) / Dt. 23/08/2,REVIVAL OF KARANJA-II (KFW) LIFT IRRIGATION PROJECT,REVIVAL OF KARANJA-II (KFW) LIFT IRRIGATION PROJECT,Works,Open Tender,Percentage,Civil Works - Lift Irrigation Schemes,No,No,NA ,31-Aug-2023 10:00 AM,NA ,90.0,No ,No,Online,12-Sep-2023 10:00 AM,"Orissa Lift Irrigation Corporation||LI,Central Circle, Cuttack||LI Division Cuttack",NIALI BLOCK,754001.0,1.0,"15,17,719",MAMATA MANJARI MALLICK,"1,290,213",Rejected-Technical,05-Jul-2024,"Orissa Lift Irrigation Corporation||LI,Central Circle, Cuttack||LI Division Cuttack"
2023_OLIC_93560_20,BID ID NO. 03/Dt. 29.08.2023,REVIVAL AND RENOVATION OF GOPALANAGAR LIP,REVIVAL AND RENOVATION OF GOPALANAGAR LIP,Works,Open Tender,Percentage,Civil Works - Lift Irrigation Schemes,No,No,NA ,04-Sep-2023 10:00 AM,NA ,60.0,No ,No,Online,14-Sep-2023 10:00 AM,"Orissa Lift Irrigation Corporation||LI,Central Circle, Cuttack||LI Division Cuttack",KANTAPADA BLOCK,754001.0,1.0,"7,68,689",MAMATA MANJARI MALLICK,"653,463",Accepted-AOC,05-Jul-2024,"Orissa Lift Irrigation Corporation||LI,Central Circle, Cuttack||LI Division Cuttack"
2023_OLIC_93560_23,BID ID NO. 03/Dt. 29.08.2023,REVIVAL AND RENOVATION OF CHHEDA KFW LIP,REVIVAL AND RENOVATION OF CHHEDA KFW LIP,Works,Open Tender,Percentage,Civil Works - Lift Irrigation Schemes,No,No,NA ,04-Sep-2023 10:00 AM,NA ,90.0,No ,No,Online,14-Sep-2023 10:00 AM,"Orissa Lift Irrigation Corporation||LI,Central Circle, Cuttack||LI Division Cuttack",KANTAPADA BLOCK,754001.0,1.0,"15,20,065",MAMATA MANJARI MALLICK,"1,292,207",Rejected-Technical,05-Jul-2024,"Orissa Lift Irrigation Corporation||LI,Central Circle, Cuttack||LI Division Cuttack"
2023_OLIC_94538_15,4557_06_08_09_2023,Pkg15,Revival and restoration of Bhotaka RL Projects,Works,Open Tender,Percentage,Civil Works - Lift Irrigation Schemes,No,No,NA ,18-Sep-2023 10:00 AM,NA ,180.0,No ,No,Online,27-Sep-2023 11:00 AM,"Orissa Lift Irrigation Corporation||LI,Central Circle, Cuttack||LI Division Jajpur Road",Jajpur Road,755019.0,2.0,"4,97,830",ALOKA KUMAR BHUYAN,"499,382",Accepted-AOC,21-Dec-2023,"Orissa Lift Irrigation Corporation||LI,Central Circle, Cuttack||LI Division Jajpur Road"
2023_OLIC_94538_16,4557_06_08_09_2023,Pkg15,Revival and restoration of Baliposi and Brahmani gaon RL Projects,Works,Open Tender,Percentage,Civil Works - Lift Irrigation Schemes,No,No,NA ,18-Sep-2023 10:00 AM,NA ,180.0,No ,No,Online,27-Sep-2023 11:00 AM,"Orissa Lift Irrigation Corporation||LI,Central Circle, Cuttack||LI Division Jajpur Road",Jajpur Road,755019.0,2.0,"29,99,705",ANUP ANURAG SATYAPRAKASH BHUYAN,"3,009,058",Accepted-AOC,29-Dec-2023,"Orissa Lift Irrigation Corporation||LI,Central Circle, Cuttack||LI Division Jajpur Road"
2023_OLIC_94538_26,4557_06_08_09_2023,Pkg26,Revival and restoration of Baliposi and Kantira I RLProjects,Works,Open Tender,Percentage,Civil Works - Lift Irrigation Schemes,No,No,NA ,18-Sep-2023 10:00 AM,NA ,180.0,No ,No,Online,27-Sep-2023 11:00 AM,"Orissa Lift Irrigation Corporation||LI,Central Circle, Cuttack||LI Division Jajpur Road",Jajpur Road,755019.0,2.0,"29,65,677",ANUP ANURAG SATYAPRAKASH BHUYAN,"2,974,924",Accepted-AOC,26-Dec-2023,"Orissa Lift Irrigation Corporation||LI,Central Circle, Cuttack||LI Division Jajpur Road"
2023_OLIC_94566_4,Bid Id No. 07/Dt. 18.09.23,REVIVAL AND RENOVATION OF KHADIBILI-II LIP,REVIVAL AND RENOVATION OF KHADIBILI-II LIP,Works,Open Tender,Percentage,Civil Works - Lift Irrigation Schemes,No,No,NA ,22-Sep-2023 10:00 AM,NA ,90.0,No ,No,Online,28-Sep-2023 10:00 AM,"Orissa Lift Irrigation Corporation||LI,Central Circle, Cuttack||LI Division Cuttack",NIALI BLOCK,754001.0,1.0,"11,27,826",MAMATA MANJARI MALLICK,"1,127,826",Accepted-AOC,05-Jul-2024,"Orissa Lift Irrigation Corporation||LI,Central Circle, Cuttack||LI Division Cuttack"
2023_OLIC_94566_5,Bid Id No. 07/Dt. 18.09.23,REVIVAL AND RENOVATION OF TIHUDI-I LIP,REVIVAL AND RENOVATION OF TIHUDI-I LIP,Works,Open Tender,Percentage,Civil Works - Lift Irrigation Schemes,No,No,NA ,22-Sep-2023 10:00 AM,NA ,90.0,No ,No,Online,28-Sep-2023 10:00 AM,"Orissa Lift Irrigation Corporation||LI,Central Circle, Cuttack||LI Division Cuttack",NIALI BLOCK,754001.0,1.0,"8,58,181",MAMATA MANJARI MALLICK,"858,181",Rejected-Technical,05-Jul-2024,"Orissa Lift Irrigation Corporation||LI,Central Circle, Cuttack||LI Division Cuttack"
2023_OLIC_96404_24,10/Dt. 02.11.23,INSTALLATION AND ENERGISATION OF KASARDA-VI LI PROJECT,INSTALLATION AND ENERGISATION OF KASARDA-VI LI PROJECT,Works,Open Tender,Percentage,Civil Works - Lift Irrigation Schemes,No,No,NA ,08-Nov-2023 10:00 AM,NA ,90.0,No ,No,Online,21-Nov-2023 10:00 AM,"Orissa Lift Irrigation Corporation||LI,Central Circle, Cuttack||LI Division Cuttack",NIALI BLOCK,754001.0,1.0,"19,15,696",MAMATA MANJARI MALLICK,"1,915,696",Accepted-AOC,05-Jul-2024,"Orissa Lift Irrigation Corporation||LI,Central Circle, Cuttack||LI Division Cuttack"
2023_OLIC_96404_26,10/Dt. 02.11.23,INSTALLATION AND ENERGISATION OF ERANCHA-II LI PROJECT,INSTALLATION AND ENERGISATION OF ERANCHA-II LI PROJECT,Works,Open Tender,Percentage,Civil Works - Lift Irrigation Schemes,No,No,NA ,08-Nov-2023 10:00 AM,NA ,90.0,No ,No,Online,21-Nov-2023 10:00 AM,"Orissa Lift Irrigation Corporation||LI,Central Circle, Cuttack||LI Division Cuttack",NIALI BLOCK,754001.0,1.0,"19,16,632",MAMATA MANJARI MALLICK,"1,916,632",Accepted-AOC,05-Jul-2024,"Orissa Lift Irrigation Corporation||LI,Central Circle, Cuttack||LI Division Cuttack"
2023_OLIC_96764_59,04/2023-24,Installation and energisation of Nuagaon_III RL under K_Singpur Block of Rayagada District,Installation and energisation of Nuagaon_III RL under K_Singpur Block of Rayagada District,Works,Open Tender,Percentage,Civil Works - Lift Irrigation Schemes,No,No,NA ,16-Nov-2023 10:00 AM,NA ,90.0,No ,No,Online,24-Nov-2023 03:00 PM,Orissa Lift Irrigation Corporation||LI KORAPUT||LI Division Gunupur,"Executive Enginer, L.I. Division, Gunupur",765022.0,1.0,"26,32,386",BHRAMARLAL SAHU,"2,792,488",Rejected-Technical,14-Jul-2024,Orissa Lift Irrigation Corporation||LI KORAPUT||LI Division Gunupur
2023_OLIC_96764_60,04/2023-24,Installation and energisation of Panasaguda RL under Kashipur Block of Rayagada District,Installation and energisation of Panasaguda RL under Kashipur Block of Rayagada District,Works,Open Tender,Percentage,Civil Works - Lift Irrigation Schemes,No,No,NA ,16-Nov-2023 10:00 AM,NA ,90.0,No ,No,Online,24-Nov-2023 03:00 PM,Orissa Lift Irrigation Corporation||LI KORAPUT||LI Division Gunupur,"Executive Enginer, L.I. Division, Gunupur",765022.0,1.0,"24,54,175",BHRAMARLAL SAHU,"2,600,542",Rejected-Technical,15-Jul-2024,Orissa Lift Irrigation Corporation||LI KORAPUT||LI Division Gunupur
2023_OLIC_96764_61,04/2023-24,Installation and energisation of Boriguma_II RL under Kashipur Block of Rayagada District,Installation and energisation of Boriguma_II RL under Kashipur Block of Rayagada District,Works,Open Tender,Percentage,Civil Works - Lift Irrigation Schemes,No,No,NA ,16-Nov-2023 10:00 AM,NA ,90.0,No ,No,Online,24-Nov-2023 03:00 PM,Orissa Lift Irrigation Corporation||LI KORAPUT||LI Division Gunupur,"Executive Enginer, L.I. Division, Gunupur",765022.0,1.0,"26,43,620",BHRAMARLAL SAHU,"2,798,166",Rejected-Technical,15-Jul-2024,Orissa Lift Irrigation Corporation||LI KORAPUT||LI Division Gunupur
2023_OLIC_96764_62,04/2023-24,Installation and energisation of Telingiri RL under Kashipur Block of Rayagada District,Installation and energisation of Telingiri RL under Kashipur Block of Rayagada District,Works,Open Tender,Percentage,Civil Works - Lift Irrigation Schemes,No,No,NA ,16-Nov-2023 10:00 AM,NA ,90.0,No ,No,Online,24-Nov-2023 03:00 PM,Orissa Lift Irrigation Corporation||LI KORAPUT||LI Division Gunupur,"Executive Enginer, L.I. Division, Gunupur",765022.0,1.0,"25,35,860",KUMAR MAJHI,"2,690,091",Rejected-Technical,15-Jul-2024,Orissa Lift Irrigation Corporation||LI KORAPUT||LI Division Gunupur
2023_OLIC_96764_63,04/2023-24,Installation and energisation of Baliguda RL under Kashipur Block of Rayagada District,Installation and energisation of Baliguda RL under Kashipur Block of Rayagada District,Works,Open Tender,Percentage,Civil Works - Lift Irrigation Schemes,No,No,NA ,16-Nov-2023 10:00 AM,NA ,90.0,No ,No,Online,24-Nov-2023 03:00 PM,Orissa Lift Irrigation Corporation||LI KORAPUT||LI Division Gunupur,"Executive Enginer, L.I. Division, Gunupur",765022.0,1.0,"26,75,677",BHRAMARLAL SAHU,"2,690,091",Rejected-Technical,15-Jul-2024,Orissa Lift Irrigation Corporation||LI KORAPUT||LI Division Gunupur
2023_OLIC_96764_64,04/2023-24,Installation and energisation of Mahalingaguda RL under Kashipur Block of Rayagada District,Installation and energisation of Mahalingaguda RL under Kashipur Block of Rayagada District,Works,Open Tender,Percentage,Civil Works - Lift Irrigation Schemes,No,No,NA ,16-Nov-2023 10:00 AM,NA ,90.0,No ,No,Online,24-Nov-2023 03:00 PM,Orissa Lift Irrigation Corporation||LI KORAPUT||LI Division Gunupur,"Executive Enginer, L.I. Division, Gunupur",765022.0,1.0,"25,97,080",BHRAMARLAL SAHU,"2,748,905",Rejected-Technical,15-Jul-2024,Orissa Lift Irrigation Corporation||LI KORAPUT||LI Division Gunupur
2023_OLIC_96764_65,04/2023-24,Installation and energisation of Raimchha Purunapadar RL under Kashipur Block of Rayagada District,Installation and energisation of Raimchha Purunapadar RL under Kashipur Block of Rayagada District,Works,Open Tender,Percentage,Civil Works - Lift Irrigation Schemes,No,No,NA ,16-Nov-2023 10:00 AM,NA ,90.0,No ,No,Online,24-Nov-2023 03:00 PM,Orissa Lift Irrigation Corporation||LI KORAPUT||LI Division Gunupur,"Executive Enginer, L.I. Division, Gunupur",765022.0,1.0,"25,46,575",BHRAMARLAL SAHU,"2,701,458",Rejected-Technical,15-Jul-2024,Orissa Lift Irrigation Corporation||LI KORAPUT||LI Division Gunupur
2023_OLIC_96764_66,04/2023-24,Installation and energisation of Khajuriguda_I RL under Kashipur Block of Rayagada District,Installation and energisation of Khajuriguda_I RL under Kashipur Block of Rayagada District,Works,Open Tender,Percentage,Civil Works - Lift Irrigation Schemes,No,No,NA ,16-Nov-2023 10:00 AM,NA ,90.0,No ,No,Online,24-Nov-2023 03:00 PM,Orissa Lift Irrigation Corporation||LI KORAPUT||LI Division Gunupur,"Executive Enginer, L.I. Division, Gunupur",765022.0,1.0,"26,74,038",BHRAMARLAL SAHU,"2,830,362",Rejected-Technical,15-Jul-2024,Orissa Lift Irrigation Corporation||LI KORAPUT||LI Division Gunupur
2023_OLIC_96764_67,04/2023-24,Installation and energisation of Khajuriguda_II RL under Kashipur Block of Rayagada District,Installation and energisation of Khajuriguda_II RL under Kashipur Block of Rayagada District,Works,Open Tender,Percentage,Civil Works - Lift Irrigation Schemes,No,No,NA ,16-Nov-2023 10:00 AM,NA ,90.0,No ,No,Online,24-Nov-2023 03:00 PM,Orissa Lift Irrigation Corporation||LI KORAPUT||LI Division Gunupur,"Executive Enginer, L.I. Division, Gunupur",765022.0,1.0,"25,71,849",BHRAMARLAL SAHU,"2,722,199",Rejected-Technical,15-Jul-2024,Orissa Lift Irrigation Corporation||LI KORAPUT||LI Division Gunupur
2023_OLIC_96903_1,EEOLICRKL- 08/23-24,INSTALLATION AND ENERGISATION OF KULKUTTA-II NEW C.L.I.P IN BONAI BLOCK UNDER SUNDARGARH DISTRICT,LIFT IRRIGATION WORKS,Works,Open Tender,Percentage,Civil Works - Lift Irrigation Schemes,No,No,NA ,14-Nov-2023 10:00 AM,NA ,120.0,No ,No,Online,22-Nov-2023 11:00 AM,Orissa Lift Irrigation Corporation||LI Northern Circle Sambalpur||LI Division Rourkella,ROURKELA,769015.0,1.0,"30,31,403",BICHITRA NANDA BEHERA,"3,031,402.7",Rejected-Technical,19-Jul-2024,Orissa Lift Irrigation Corporation||LI Northern Circle Sambalpur||LI Division Rourkella
2023_OLIC_96907_1,EEOLICRKL- 08/23-24,INSTALLATION AND ENERGISATION OF NIKTIMAL NEW C.L.I.P IN BONAI BLOCK UNDER SUNDARGARH DISTRICT,LIFT IRRIGATION WORKS,Works,Open Tender,Percentage,Civil Works - Lift Irrigation Schemes,No,No,NA ,14-Nov-2023 10:00 AM,NA ,120.0,No ,No,Online,22-Nov-2023 11:00 AM,Orissa Lift Irrigation Corporation||LI Northern Circle Sambalpur||LI Division Rourkella,ROURKELA,769015.0,1.0,"29,72,601",BICHITRA NANDA BEHERA,"2,972,601.25",Rejected-Technical,19-Jul-2024,Orissa Lift Irrigation Corporation||LI Northern Circle Sambalpur||LI Division Rourkella
2023_OLIC_96915_1,EEOLICRKL- 08/23-24,INSTALLATION AND ENERGISATION OF N.SATKUTA-II NEW C.L.I.P IN GURUNDIA BLOCK UNDER SUNDARGARH DISTRICT,LIFT IRRIGATION WORKS,Works,Open Tender,Percentage,Civil Works - Lift Irrigation Schemes,No,No,NA ,14-Nov-2023 10:00 AM,NA ,120.0,No ,No,Online,22-Nov-2023 11:00 AM,Orissa Lift Irrigation Corporation||LI Northern Circle Sambalpur||LI Division Rourkella,ROURKELA,769015.0,1.0,"32,13,139",MAA SITA CONSTRUCTION,"3,213,138.53",Rejected-Technical,09-Jul-2024,Orissa Lift Irrigation Corporation||LI Northern Circle Sambalpur||LI Division Rourkella
2023_OLIC_97052_11,02/2023-24 (2108)/OLIC (BDK) dt. 06.11.2023,Installation and Energization of Baramania TW,Installation and Energization of Baramania TW,Works,Open Tender,Turn-key,Civil Works - Lift Irrigation Schemes,No,No,NA ,16-Nov-2023 11:00 AM,NA ,180.0,No ,No,Online,24-Nov-2023 11:00 AM,Orissa Lift Irrigation Corporation||LI BALASORE||LI Division Bhadrak,"L.I Division, Bhadrak",756100.0,1.0,"23,98,998",M/S UNITED ENGINEERING,"2,728,908",Rejected-Finance,28-Jul-2024,Orissa Lift Irrigation Corporation||LI BALASORE||LI Division Bhadrak
2023_OLIC_97052_26,02/2023-24 (2108)/OLIC (BDK) dt. 06.11.2023,Installation and Energization of Thenga TW,Installation and Energization of Thenga TW,Works,Open Tender,Turn-key,Civil Works - Lift Irrigation Schemes,No,No,NA ,16-Nov-2023 11:00 AM,NA ,180.0,No ,No,Online,24-Nov-2023 11:00 AM,Orissa Lift Irrigation Corporation||LI BALASORE||LI Division Bhadrak,"L.I Division, Bhadrak",756100.0,1.0,"23,96,904",LAKSHMIMANI GIRI,"2,718,041",Accepted-AOC,28-Jul-2024,Orissa Lift Irrigation Corporation||LI BALASORE||LI Division Bhadrak
2023_OLIC_97114_13,BID ID NO.12/DT.13.11.23,INSTALLATION AND ENERGISATION OF KUMARI LIP,INSTALLATION AND ENERGISATION OF KUMARI LIP,Works,Open Tender,Percentage,Civil Works - Lift Irrigation Schemes,No,No,NA ,21-Nov-2023 10:00 AM,NA ,90.0,No ,No,Online,01-Dec-2023 10:00 AM,"Orissa Lift Irrigation Corporation||LI,Central Circle, Cuttack||LI Division Cuttack",BALIKUDA BLOCK,754001.0,1.0,"19,32,632",JANAKI LENKA,"1,836,194",Rejected-Technical,06-Jul-2024,"Orissa Lift Irrigation Corporation||LI,Central Circle, Cuttack||LI Division Cuttack"
2023_OLIC_97114_5,BID ID NO.12/DT.13.11.23,INSTALLATION AND ENERGISATION OF GOGALA LIP,INSTALLATION AND ENERGISATION OF GOGALA LIP,Works,Open Tender,Percentage,Civil Works - Lift Irrigation Schemes,No,No,NA ,21-Nov-2023 10:00 AM,NA ,90.0,No ,No,Online,01-Dec-2023 10:00 AM,"Orissa Lift Irrigation Corporation||LI,Central Circle, Cuttack||LI Division Cuttack",BALIKUDA BLOCK,754001.0,1.0,"19,04,047",JANAKI LENKA,"1,809,035",Accepted-AOC,06-Jul-2024,"Orissa Lift Irrigation Corporation||LI,Central Circle, Cuttack||LI Division Cuttack"
2023_OMC_93957_1,RfP No.21 /OMC/CIVIL/2023,SelectionofProjectManagement Consultant for Providing Construction Supervision with QualityControlfor Development of leftover work for the Road from Hill top Quarry to Jharana Chainage 0.000 to 3.150 KM of Gandhamardan in the district of Keonjhar.,SelectionofProjectManagement Consultant for Providing Construction Supervision with QualityControlfor Development of leftover work for the Road from Hill top Quarry to Jharana Chainage 0.000 to 3.150 KM of Gandhamardan in the district of Keonjhar.,Services,Open Tender,Item Rate,Miscellaneous Services,No,No,NA ,07-Sep-2023 04:00 PM,NA ,90.0,No ,No,Online,18-Sep-2023 11:00 AM,Orissa Mining Corporation,GANDHAMARDAN IRON ORE MINES,758018.0,2.0,"12,60,00,000",M/s. CADD CONSULING ENGINEERS PRIVATE LIMITED,"3,651,100",Accepted-AOC,06-May-2024,Orissa Mining Corporation
2023_OMC_96264_3,NIT No.48/OMC/CIVIL/2023,Provision of CC paver road to new Building Infrastructure area with development of lawn to Community Centre at Base Camp of Gandhamardan Mines in the district of Keonjhar.,Provision of CC paver road to new Building Infrastructure area with development of lawn to Community Centre at Base Camp of Gandhamardan Mines in the district of Keonjhar.,Works,Open Tender,Percentage,Civil Works - Others,No,No,NA ,02-Nov-2023 06:00 PM,NA ,180.0,No ,No,Online,18-Nov-2023 11:00 AM,Orissa Mining Corporation,BASE CAMP GANDHAMARDAN,758018.0,2.0,"2,49,51,000",BINOD BEHARI ROUT,"21,210,352.6",Rejected-Finance,06-May-2024,Orissa Mining Corporation
2023_OMC_96331_2,NIT No.49/OMC/CIVIL/2023,"Special Repair to 16 nos D type, 12nos F type, 4 nos C typeand 4 nos UC type quarters at OMC Colony, Barbil in the district of Keonjhar.","Special Repair to 16 nos D type, 12nos F type, 4 nos C typeand 4 nos UC type quarters at OMC Colony, Barbil in the district of Keonjhar.",Works,Open Tender,Percentage,Civil Works - Others,No,No,NA ,03-Nov-2023 06:55 PM,NA ,180.0,No ,No,Online,18-Nov-2023 11:00 AM,Orissa Mining Corporation,BARBIL,758035.0,2.0,"2,09,14,000",BINOD BEHARI ROUT,"17,778,710.57",Accepted-AOC,06-May-2024,Orissa Mining Corporation
2023_OMC_96331_4,NIT No.49/OMC/CIVIL/2023,"Construction of CC Road, RCC Drain, Box Cell Culvert and Gantry Gate at Sukurangi Mines Camp in the district of Jajpur.","Construction of CC Road, RCC Drain, Box Cell Culvert and Gantry Gate at Sukurangi Mines Camp in the district of Jajpur.",Works,Open Tender,Percentage,Civil Works - Others,No,No,NA ,03-Nov-2023 06:55 PM,NA ,180.0,No ,No,Online,18-Nov-2023 11:00 AM,Orissa Mining Corporation,SUKURANGI,755028.0,2.0,"1,96,86,000",JAGAT JYOTI NAYAK,"16,734,975.55",Rejected-Finance,12-Mar-2024,Orissa Mining Corporation
2023_OMC_97139_4,NIT No.51/OMC/CIVIL/2023,"Construction of Store building at Regional Office, Barbil in the district of Keonjhar.","Construction of Store building at Regional Office, Barbil in the district of Keonjhar.",Works,Open Tender,Percentage,Civil Works - Others,No,No,NA ,16-Nov-2023 05:00 PM,NA ,180.0,No ,No,Online,28-Nov-2023 11:00 AM,Orissa Mining Corporation,BARBIL,758035.0,2.0,"42,02,000",BINOD BEHARI ROUT,"3,571,573.86",Accepted-AOC,06-May-2024,Orissa Mining Corporation
2023_OMC_97139_5,NIT No.51/OMC/CIVIL/2023,"Interior Modification of Library at Annex Building of HO, Bhubaneswar in the district of Khurda.","Interior Modification of Library at Annex Building of HO, Bhubaneswar in the district of Khurda.",Works,Open Tender,Percentage,Civil Works - Others,No,No,NA ,16-Nov-2023 05:00 PM,NA ,180.0,No ,No,Online,28-Nov-2023 11:00 AM,Orissa Mining Corporation,BHUBANESWAR,751001.0,2.0,"18,87,000",SHESADEV SRICHANDAN,"1,603,623.68",Rejected-Finance,15-Mar-2024,Orissa Mining Corporation
2023_OMC_97582_2,NIT No.56/OMC/CIVIL/2023,"Renovation of Compound Wall on Main Road of Central Township, Kaliapani in the district of Jajpur.","Renovation of Compound Wall on Main Road of Central Township, Kaliapani in the district of Jajpur.",Works,Open Tender,Percentage,Civil Works - Others,No,No,NA ,28-Nov-2023 05:00 PM,NA ,180.0,No ,No,Online,13-Dec-2023 11:00 AM,Orissa Mining Corporation,KALIAPANI TOWNSHIP,755028.0,2.0,"91,07,000",RAKESH KUMAR PRADHAN,"7,741,221.6",Rejected-Finance,06-May-2024,Orissa Mining Corporation
2023_OMC_97582_6,NIT No.56/OMC/CIVIL/2023,Environmental protection work for extended OB dump of Block-B Mines of Gandhamardan in the district of Keonjhar.,Environmental protection work for extended OB dump of Block-B Mines of Gandhamardan in the district of Keonjhar.,Works,Open Tender,Percentage,Civil Works - Others,No,No,NA ,28-Nov-2023 05:00 PM,NA ,180.0,No ,No,Online,13-Dec-2023 11:00 AM,Orissa Mining Corporation,GANDHAMARDAN IRON ORE MINES,758018.0,2.0,"65,52,000",ANIRUDHA MOHAPATRA,"5,569,417.19",Accepted-AOC,06-May-2024,Orissa Mining Corporation
2023_OMC_98342_2,NIT No.58/OMC/CIVIL/2023,Providing Paver Road from Mines Managers office to Cutting Unit with other Ancillary Civil works at Govindapur Khandolite Mines in the district of Cuttack.,Providing Paver Road from Mines Managers office to Cutting Unit with other Ancillary Civil works at Govindapur Khandolite Mines in the district of Cuttack.,Works,Open Tender,Percentage,Civil Works - Others,No,No,NA ,15-Dec-2023 10:00 AM,NA ,180.0,No ,No,Online,30-Dec-2023 11:00 AM,Orissa Mining Corporation,GOVINDPUR CUTTACK,754003.0,2.0,"2,23,05,000",RAJESH KUMAR PARIDA,"18,961,275.24",Rejected-Finance,06-May-2024,Orissa Mining Corporation
