Organisation Chain,Tender Reference Number,Tender ID,Withdrawal Allowed,Tender Type,Form of contract,Tender Category,No. of Covers,General Technical Evaluation Allowed,ItemWise Technical Evaluation Allowed,Payment Mode,Is Multi Currency Allowed For BOQ,Is Multi Currency Allowed For Fee,Allow Two Stage Bidding,Cover No,Cover,Document Type,Description,Publish Date,Bid Opening Date,Document Download / Sale Start Date,Document Download / Sale End Date,Clarification Start Date,Clarification End Date,Bid Submission Start Date,Bid Submission End Date,Financial Bid Opening Date,EMD Amount in ₹,EMD Exemption Allowed,EMD Fee Type,EMD Percentage,EMD Payable To,EMD Payable At,S.No,Bank Name,Tender Fee in ₹,VAT Charges in ₹,Fee Payable To,Fee Payable At,Tender Fee Exemption Allowed,Name,Address,Title,Work Description,Pre Qualification Details,Independent External Monitor/Remarks,Tender Value in ₹,Product Category,Sub category,Contract Type,Bid Validity(Days),Period Of Work(Days),Location,Pincode,Pre Bid Meeting Place,Pre Bid Meeting Address,Pre Bid Meeting Date,Bid Opening Place,Should Allow NDA Tender,Allow Preferential Bidder,Tender Stage,Contract Date :,Contract Value :,Work Completion Period in days :,Updated By :,Updated on :,AOC document :,AOC Description :,S.No,Bid Number,Bidder Name,Awarded Currency,Awarded Value,S.No.1,Bid Number.1,Bidder Name.1,Submitted Date,Status,Remarks,Status Updated On,Type :,Summary :,Updated By :.1,Updated On :,Document :,BOQ Comparative Chart :,Committee Chairperson/Co-ordinator Name :,Committee Chairperson/Co-ordinator Type :,Committee Members :,Updated By :.2,Updated on :.1,Document :.1,Organisation Chain :,Tender ID :,Tender Ref No :,Tender Title :,Type :.1,Summary :.1,Updated By :.3,Updated On :.1,Document :.2,Committee Chairperson/Co-ordinator Name :.1,Committee Chairperson/Co-ordinator Type :.1,Committee Members :.1,Updated By :.4,Updated On :.2,Financial Bid Opening Date:,Document :.3,Tender Stage
EIC-CIVIL,CE-DPI AND R- 29/2023-24,2023_EICCL_97669_1,Yes,Open Tender,Percentage,Works,2.0,No,No,Online,No,No,No,1.0,Fee/PreQual/Technical,.pdf,"Online proof copy of Tender Cost and EMD, GSTIN, PAN, RC and Affidavit",01-Dec-2023 01:30 PM,16-Dec-2023 11:00 AM,01-Dec-2023 01:30 PM,15-Dec-2023 05:30 PM,NA ,NA ,01-Dec-2023 01:30 PM,15-Dec-2023 05:30 PM,06-Jan-2024 11:30 AM,"16,65,000",Yes,fixed,,Nil,Nil,1.0,ICICI BANK,"10,000",0.0,Nil,Nil,No,"Chief Engineer, DPI and Roads, Odisha","Office of the E.I.C. Civil, Odisha, Nirman Soudha, New Building, Unit-V, Bhubaneswar",Improvement such as widening and strengthening of Sikiri - Nuagaon road via Gupteswar Temple from 0/000 km to 10/240 km in the district of Ganjam under State Plan,Improvement such as widening and strengthening of Sikiri - Nuagaon road via Gupteswar Temple from 0/000 km to 10/240 km in the district of Ganjam under State Plan,Please refer Tender documents. ,NA ,"16,65,18,834",Civil Works - Roads,NA ,Tender,90.0,390.0,In Ganjam Dist,751001.0,NA ,NA ,NA ,"O/o the E.I.C. Civil, Odisha, Bhubaneswar",No ,No,AOC,02-Mar-2024,"INR 147,036,130",390.0,Pradipta Kumar Nayak,13-Mar-2024 06:43 PM,Sikiri.pdf (59.00 KB),137P1 of 2023-24,1.0,2357458.0,SAPNESWAR PROJECTS PRIVATE LIMITED,INR,"147,036,130",1,2355263,B Manoj Kumar Rao,15-Dec-2023 10:53 AM,Rejected-Finance,Other than L1 and L2 bidder,09-Jan-2024 10:05 PM,Finance,Finance opening,Pradipta Kumar Nayak,06-Jan-2024 12:16 PM,,BOQ Comparative Chart,CE DPI and R Odisha,Internal,,Pradipta Kumar Nayak,09-Jan-2024 10:05 PM,finsummary_476832.pdf (199.35 KB),EIC-CIVIL,2023_EICCL_97669_1,CE-DPI AND R- 29/2023-24,Improvement such as widening and strengthening of Sikiri - Nuagaon road via Gupteswar Temple from 0/000 km to 10/240 km in the district of Ganjam under State Plan,Technical,Technical opening,Pradipta Kumar Nayak,16-Dec-2023 01:59 PM,,EIC Civil Odisha,Internal,,Pradipta Kumar Nayak,05-Jan-2024 06:58 PM,06-Jan-2024 11:30 AM,techsummary_476832.pdf (181.98 KB),AOC
,,,,,,,,,,,,,,,,.pdf,Machineries and work experience,,,,,,,,,,,,,,,,2.0,ICICI NEFT/RTGS,,,,,,,,,,,,,,,,,,,,,,,,,,AOC,,,,,,,,,,,,,2,2356530,G.Gopal Rao Dora,15-Dec-2023 06:35 AM,Rejected-AOC,L2 bidder,13-Mar-2024 06:43 PM,,,,,,,,,,,,,,,,,,,,,,,,,,,,,AOC
,,,,,,,,,,,,,,,,.pdf,Other documents as per DTCN,,,,,,,,,,,,,,,,,,,,,,,,,,,,,,,,,,,,,,,,,,,AOC,,,,,,,,,,,,,3,2356844,KVR Construction Heights Pvt Ltd,15-Dec-2023 02:03 PM,Rejected-Finance,Other than L1 and L2 bidder,09-Jan-2024 10:05 PM,,,,,,,,,,,,,,,,,,,,,,,,,,,,,AOC
,,,,,,,,,,,,,,2.0,Finance,.xls,Bill of quantities,,,,,,,,,,,,,,,,,,,,,,,,,,,,,,,,,,,,,,,,,,,AOC,,,,,,,,,,,,,4,2356208,M/S PANIGRAHI CONSTRUCTION,13-Dec-2023 10:00 PM,Rejected-Finance,Other than L1 and L2 bidder,09-Jan-2024 10:05 PM,,,,,,,,,,,,,,,,,,,,,,,,,,,,,AOC
,,,,,,,,,,,,,,,,,,,,,,,,,,,,,,,,,,,,,,,,,,,,,,,,,,,,,,,,,,,,AOC,,,,,,,,,,,,,5,2357465,M/S SRI OMI INFRA,15-Dec-2023 01:50 PM,Rejected-Finance,Other than L1 and L2 bidder,09-Jan-2024 10:05 PM,,,,,,,,,,,,,,,,,,,,,,,,,,,,,AOC
,,,,,,,,,,,,,,,,,,,,,,,,,,,,,,,,,,,,,,,,,,,,,,,,,,,,,,,,,,,,AOC,,,,,,,,,,,,,6,2357458,SAPNESWAR PROJECTS PRIVATE LIMITED,15-Dec-2023 01:09 PM,Accepted-AOC,L1 bidder,13-Mar-2024 06:43 PM,,,,,,,,,,,,,,,,,,,,,,,,,,,,,AOC
