Organisation Chain,Tender Reference Number,Tender ID,Withdrawal Allowed,Tender Type,Form of contract,Tender Category,No. of Covers,General Technical Evaluation Allowed,ItemWise Technical Evaluation Allowed,Payment Mode,Is Multi Currency Allowed For BOQ,Is Multi Currency Allowed For Fee,Allow Two Stage Bidding,Cover No,Cover,Document Type,Description,Publish Date,Bid Opening Date,Document Download / Sale Start Date,Document Download / Sale End Date,Clarification Start Date,Clarification End Date,Bid Submission Start Date,Bid Submission End Date,Financial Bid Opening Date,EMD Amount in ₹,EMD Exemption Allowed,EMD Fee Type,EMD Percentage,EMD Payable To,EMD Payable At,S.No,Bank Name,Tender Fee in ₹,VAT Charges in ₹,Fee Payable To,Fee Payable At,Tender Fee Exemption Allowed,Name,Address,Title,Work Description,Pre Qualification Details,Independent External Monitor/Remarks,Tender Value in ₹,Product Category,Sub category,Contract Type,Bid Validity(Days),Period Of Work(Days),Location,Pincode,Pre Bid Meeting Place,Pre Bid Meeting Address,Pre Bid Meeting Date,Bid Opening Place,Should Allow NDA Tender,Allow Preferential Bidder,Tender Stage,Contract Date :,Contract Value :,Work Completion Period in days :,Updated By :,Updated on :,AOC document :,AOC Description :,S.No,Bid Number,Bidder Name,Awarded Currency,Awarded Value,S.No.1,Bid Number.1,Bidder Name.1,Submitted Date,Status,Remarks,Status Updated On,Type :,Summary :,Updated By :.1,Updated On :,Document :,BOQ Comparative Chart :,Committee Chairperson/Co-ordinator Name :,Committee Chairperson/Co-ordinator Type :,Committee Members :,Updated By :.2,Updated on :.1,Document :.1,Organisation Chain :,Tender ID :,Tender Ref No :,Tender Title :,Type :.1,Summary :.1,Updated By :.3,Updated On :.1,Document :.2,Committee Chairperson/Co-ordinator Name :.1,Committee Chairperson/Co-ordinator Type :.1,Committee Members :.1,Updated By :.4,Updated On :.2,Financial Bid Opening Date:,Document :.3,Tender Stage
EIC-CIVIL||SERNB-CIRCLE-EASTERN,CCEEC-23/2023-24,2023_EICCL_96411_4,Yes,Open Tender,Percentage,Works,2.0,No,No,Online,No,No,No,1.0,Fee/PreQual/Technical,.pdf,"Online payment receipt of Paper cost, EMD ONLINE PAPER RECEIVED, GSTIN, PAN, Registration Certificat",06-Nov-2023 10:00 AM,22-Nov-2023 11:00 AM,06-Nov-2023 10:00 AM,21-Nov-2023 05:00 PM,NA ,NA ,06-Nov-2023 10:00 AM,21-Nov-2023 05:00 PM,30-Dec-2023 11:30 AM,"1,40,000",Yes,fixed,,Nil,Nil,1.0,ICICI BANK,"10,000",0.0,Nil,Nil,No,"Office of the CCEEC R and B Balasore, Station Road","Office of the CCEEC R and B Balasore, Station Road",S/R to Baliapal Chaumukh Road (ODR) from 2/230Km to 10/500Km for the year 2023-24.,S/R to Baliapal Chaumukh Road (ODR) from 2/230Km to 10/500Km for the year 2023-24.,Please refer Tender documents. ,NA ,,Civil Works - Roads,Road Works ,Tender,90.0,90.0,Balasore,756001.0,NA ,NA ,NA ,"Office of the CCEEC R and B Balasore, Station Road",No ,No,AOC,21-Mar-2024,"INR 13,999,999.914",90.0,Sarada Prasanna Das,21-Mar-2024 05:27 PM,Agmt_Baliapal_Chaumukh.pdf (759.00 KB),AOC,1.0,2324465.0,RANJIT KUMAR BISWAL,INR,"11,901,399.927",1,2324847,Byomakesh Mohanty,21-Nov-2023 02:59 PM,Rejected-Finance,Looser the Transparent Lottery,21-Mar-2024 05:25 PM,Finance,Admitted for Financial Acceptance.,Sarada Prasanna Das,21-Mar-2024 05:22 PM,finance_470706.pdf,BOQ Comparative Chart,Er RATHANGDHAR ROUT (CCEEC RNB BALASORE),Internal,"Er RATHANGDHAR ROUT (CCEEC RNB BALASORE),Er R G Ray (E.E RNB MAYURBHANJ),Justin J.S.G. Richards (D.A.O MAYURBHANJ),Er P.K. BEHERA (E.E. CCE,EC,BLS), Er S.P. Das (A.E.E. ESTIMATOR).",Sarada Prasanna Das,21-Mar-2024 05:25 PM,finsummary_470706.pdf (759.31 KB),EIC-CIVIL||SERNB-CIRCLE-EASTERN,2023_EICCL_96411_4,CCEEC-23/2023-24,S/R to Baliapal Chaumukh Road (ODR) from 2/230Km to 10/500Km for the year 2023-24.,Technical,Admitted for Technical Evaluation.,Rathangadhar Rout,28-Dec-2023 01:36 PM,technical_470706.pdf,Er RATHANGDHAR ROUT (CCEEC RNB BALASORE),Internal,"Er RATHANGDHAR ROUT (CCEEC RNB BALASORE),Er P P SWAIN (E.E RNB BALASORE-II),ASHOK KUMAR SINGH (D.A.O BALASORE-II),Er CHITTA BEHERA(PA to CCEEC), Er S.P. Das (Estimator).",Rathangadhar Rout,28-Dec-2023 01:39 PM,30-Dec-2023 11:30 AM,techsummary_470706.pdf (1426.26 KB),AOC
,,,,,,,,,,,,,,,,.pdf,"No relation Certificates, work experience, work in hand and other documents as per DTCN.",,,,,,,,,,,,,,,,2.0,ICICI NEFT/RTGS,,,,,,,,,,,,,,,,,,,,,,,,,,AOC,,,,,,,,,,,,,2,2324711,GYANABRATA SAHOO,21-Nov-2023 04:33 PM,Rejected-Technical,Technically Disqualified,28-Dec-2023 01:39 PM,,,,,,,,,,,,,,,,,,,,,,,,,,,,,AOC
,,,,,,,,,,,,,,,,.pdf,"Machineries as per DTCN, affidavit for Schedule F, information as per Schedule E.",,,,,,,,,,,,,,,,,,,,,,,,,,,,,,,,,,,,,,,,,,,AOC,,,,,,,,,,,,,3,2324465,RANJIT KUMAR BISWAL,21-Nov-2023 03:51 PM,Accepted-AOC,Work awarded,21-Mar-2024 05:27 PM,,,,,,,,,,,,,,,,,,,,,,,,,,,,,AOC
,,,,,,,,,,,,,,2.0,Finance,.xls,Bill of Quantity,,,,,,,,,,,,,,,,,,,,,,,,,,,,,,,,,,,,,,,,,,,AOC,,,,,,,,,,,,,4,2325904,SMITA SAW,21-Nov-2023 04:29 PM,Rejected-Finance,Looser the Transparent Lottery,21-Mar-2024 05:25 PM,,,,,,,,,,,,,,,,,,,,,,,,,,,,,AOC
,,,,,,,,,,,,,,,,,,,,,,,,,,,,,,,,,,,,,,,,,,,,,,,,,,,,,,,,,,,,AOC,,,,,,,,,,,,,5,2319775,SRIKANTA PADHI,21-Nov-2023 09:27 AM,Rejected-Finance,3rd lowest bidder,21-Mar-2024 05:25 PM,,,,,,,,,,,,,,,,,,,,,,,,,,,,,AOC
