Organisation Chain,Tender Reference Number,Tender ID,Withdrawal Allowed,Tender Type,Form of contract,Tender Category,No. of Covers,General Technical Evaluation Allowed,ItemWise Technical Evaluation Allowed,Payment Mode,Is Multi Currency Allowed For BOQ,Is Multi Currency Allowed For Fee,Allow Two Stage Bidding,Cover No,Cover,Document Type,Description,Publish Date,Bid Opening Date,Document Download / Sale Start Date,Document Download / Sale End Date,Clarification Start Date,Clarification End Date,Bid Submission Start Date,Bid Submission End Date,Financial Bid Opening Date,EMD Amount in ₹,EMD Exemption Allowed,EMD Fee Type,EMD Percentage,EMD Payable To,EMD Payable At,S.No,Bank Name,Tender Fee in ₹,VAT Charges in ₹,Fee Payable To,Fee Payable At,Tender Fee Exemption Allowed,Name,Address,Title,Work Description,Pre Qualification Details,Independent External Monitor/Remarks,Tender Value in ₹,Product Category,Sub category,Contract Type,Bid Validity(Days),Period Of Work(Days),Location,Pincode,Pre Bid Meeting Place,Pre Bid Meeting Address,Pre Bid Meeting Date,Bid Opening Place,Should Allow NDA Tender,Allow Preferential Bidder,Tender Stage,Contract Date :,Contract Value :,Work Completion Period in days :,Updated By :,Updated on :,AOC document :,S.No,Bid Number,Bidder Name,Awarded Currency,Awarded Value,S.No.1,Bid Number.1,Bidder Name.1,Submitted Date,Status,Remarks,Status Updated On,Type :,Summary :,Updated By :.1,Updated On :,Document :,BOQ Comparative Chart :,Committee Chairperson/Co-ordinator Name :,Committee Chairperson/Co-ordinator Type :,Committee Members :,Updated By :.2,Updated on :.1,Document :.1,Organisation Chain :,Tender ID :,Tender Ref No :,Tender Title :,Type :.1,Summary :.1,Updated By :.3,Updated On :.1,Document :.2,Committee Chairperson/Co-ordinator Name :.1,Committee Chairperson/Co-ordinator Type :.1,Committee Members :.1,Updated By :.4,Updated On :.2,Financial Bid Opening Date:,Document :.3,Tender Stage
CE RW I||RWCIRCLE-BARIPADA,Road Online N.C.B. No-331,2023_CERWI_97848_3,Yes,National Competitive Bid,Percentage,Works,2.0,No,No,Online,No,No,No,1.0,Fee/PreQual/Technical,.pdf,"Paper cost, RC, PAN, GSTIN and EMD etc as per DTCN",05-Dec-2023 03:00 PM,19-Dec-2023 11:00 AM,05-Dec-2023 03:00 PM,18-Dec-2023 05:00 PM,05-Dec-2023 03:00 PM ,16-Dec-2023 05:00 PM ,05-Dec-2023 03:00 PM,18-Dec-2023 05:00 PM,03-Jan-2024 11:30 AM,"5,62,950",Yes,percentage,1.0%,Nil,Nil,1.0,ICICI BANK,"10,000",0.0,Nil,Nil,No,CCE RWC Baripada,CCE RWC Baripada,Construction of Manatapal to murukundia road under MMSY-TRIP in the District of Mayurbhanj for the year 2023-24.,Construction of Manatapal to murukundia road under MMSY-TRIP in the District of Mayurbhanj for the year 2023-24.,Please refer Tender documents. ,NA ,"5,62,95,000",Civil Works - Roads,NA ,Tender,90.0,334.0,SE RWD Baripada,757105.0,NA ,NA ,NA ,CCE RWC Baripada,No ,No,AOC,22-Feb-2024,"INR 50,670,717",334.0,Ashwani Pradhan,22-Mar-2024 11:57 AM,Mantapal.pdf (267.00 KB),1.0,2359891.0,SRI BIBHAS CHANDRA BEHERA,INR,"50,670,717",1,2360082,KRUSHNA KUMAR KHANDELWAL,18-Dec-2023 03:15 PM,Rejected-Technical,Insufficient ATO and similar nature of work.,30-Dec-2023 12:40 PM,Finance,03 Nos of bidders admitted,Sucharita Mohanty,04-Jan-2024 04:25 PM,,BOQ Comparative Chart,"CCE RW Circle, Baripada",Internal,,Sucharita Mohanty,04-Jan-2024 04:50 PM,finsummary_477585.pdf (681.61 KB),CE RW I||RWCIRCLE-BARIPADA,2023_CERWI_97848_3,Road Online N.C.B. No-331,Construction of Manatapal to murukundia road under MMSY-TRIP in the District of Mayurbhanj for the year 2023-24.,Technical,05 Nos of bidders participated,Ashwani Pradhan,30-Dec-2023 12:23 PM,,"CCE RW Circle, Baripada",Internal,,Ashwani Pradhan,30-Dec-2023 12:40 PM,03-Jan-2024 11:30 AM,techsummary_477585.pdf (750.93 KB),AOC
,,,,,,,,,,,,,,,,.pdf,"ATO, similar nature of work experience etc as per DTCN",,,,,,,,,,,,,,,,2.0,ICICI NEFT/RTGS,,,,,,,,,,,,,,,,,,,,,,,,,,AOC,,,,,,,,,,,,2,2360396,PANKAJ KUMAR PANDA,18-Dec-2023 03:31 PM,Rejected-Technical,Insufficient ATO and bid capacity,30-Dec-2023 12:40 PM,,,,,,,,,,,,,,,,,,,,,,,,,,,,,AOC
,,,,,,,,,,,,,,,,.pdf,"Machineries, Affidavit etc as per DTCN",,,,,,,,,,,,,,,,,,,,,,,,,,,,,,,,,,,,,,,,,,,AOC,,,,,,,,,,,,3,2359838,Ranjit Kumar Sahu,18-Dec-2023 02:37 PM,Rejected-AOC,L1,22-Mar-2024 11:57 AM,,,,,,,,,,,,,,,,,,,,,,,,,,,,,AOC
,,,,,,,,,,,,,,2.0,Finance,.xls,Bill of Quantity,,,,,,,,,,,,,,,,,,,,,,,,,,,,,,,,,,,,,,,,,,,AOC,,,,,,,,,,,,4,2347533,SANTOSH KUMAR SAHOO,12-Dec-2023 11:47 PM,Rejected-AOC,L1,22-Mar-2024 11:57 AM,,,,,,,,,,,,,,,,,,,,,,,,,,,,,AOC
,,,,,,,,,,,,,,,,,,,,,,,,,,,,,,,,,,,,,,,,,,,,,,,,,,,,,,,,,,,,AOC,,,,,,,,,,,,5,2359891,SRI BIBHAS CHANDRA BEHERA,18-Dec-2023 02:30 PM,Accepted-AOC,L1,22-Mar-2024 11:57 AM,,,,,,,,,,,,,,,,,,,,,,,,,,,,,AOC
