Organisation Chain,Tender Reference Number,Tender ID,Withdrawal Allowed,Tender Type,Form of contract,Tender Category,No. of Covers,General Technical Evaluation Allowed,ItemWise Technical Evaluation Allowed,Payment Mode,Is Multi Currency Allowed For BOQ,Is Multi Currency Allowed For Fee,Allow Two Stage Bidding,Cover No,Cover,Document Type,Description,Publish Date,Bid Opening Date,Document Download / Sale Start Date,Document Download / Sale End Date,Clarification Start Date,Clarification End Date,Bid Submission Start Date,Bid Submission End Date,Financial Bid Opening Date,EMD Amount in ₹,EMD Exemption Allowed,EMD Fee Type,EMD Percentage,EMD Payable To,EMD Payable At,S.No,Corrigendum Title,Corrigendum Type,View,S.No.1,Bank Name,Tender Fee in ₹,VAT Charges in ₹,Fee Payable To,Fee Payable At,Tender Fee Exemption Allowed,Name,Address,Title,Work Description,Pre Qualification Details,Independent External Monitor/Remarks,Tender Value in ₹,Product Category,Sub category,Contract Type,Bid Validity(Days),Period Of Work(Days),Location,Pincode,Pre Bid Meeting Place,Pre Bid Meeting Address,Pre Bid Meeting Date,Bid Opening Place,Should Allow NDA Tender,Allow Preferential Bidder,Tender Stage,Contract Date :,Contract Value :,Work Completion Period in days :,Updated By :,Updated on :,AOC document :,S.No,Bid Number,Bidder Name,Awarded Currency,Awarded Value,S.No.1,Bid Number.1,Bidder Name.1,Submitted Date,Status,Remarks,Status Updated On,Type :,Summary :,Updated By :.1,Updated On :,Document :,BOQ Comparative Chart :,Committee Chairperson/Co-ordinator Name :,Committee Chairperson/Co-ordinator Type :,Committee Members :,Updated By :.2,Updated on :.1,Document :.1,Organisation Chain :,Tender ID :,Tender Ref No :,Tender Title :,Type :.1,Summary :.1,Updated By :.3,Updated On :.1,Document :.2,Committee Chairperson/Co-ordinator Name :.1,Committee Chairperson/Co-ordinator Type :.1,Committee Members :.1,Updated By :.4,Updated On :.2,Financial Bid Opening Date:,Document :.3,Tender Stage
CE RW I,Tender Online-03/2023-24 ( Bridges),2023_CERWI_92180_23,Yes,National Competitive Bid,Percentage,Works,2.0,No,No,Online,No,No,No,1.0,Fee/PreQual/Technical,.pdf,"Paper cost, EMD, GST, PAN, RC, Affidavit correctness certificate and no relation certificate",12-Aug-2023 05:00 PM,25-Aug-2023 11:00 AM,12-Aug-2023 05:00 PM,24-Aug-2023 05:00 PM,12-Aug-2023 05:00 PM ,23-Aug-2023 02:00 PM ,12-Aug-2023 05:00 PM,24-Aug-2023 05:00 PM,26-Oct-2023 11:30 AM,"31,69,456",Yes,percentage,1.0%,Nil,Nil,1.0,1st Corrigendum,Other,,1.0,ICICI BANK,"10,000",0.0,Nil,Nil,No,CE Buildings and Bridges,Office of EIC RW Odisha Bhubaneswar,Construction of HL Bridge over river PAIKA at 5.435 K.M. on Gobara Chhaka to Chaulia Bamara Road under BSY,Construction of HL Bridge over river PAIKA at 5.435 K.M. on Gobara Chhaka to Chaulia Bamara Road under BSY in the district of Kendrapara for the year 2022-23,Please refer Tender documents. ,NA ,"31,69,45,607",Civil Works - Bridges,NA ,Tender,90.0,730.0,Kendrapara,751001.0,NA ,NA ,NA ,Office of EIC RW Odisha Bhubaneswar,No ,No,AOC,20-Feb-2024,"INR 278,943,829",730.0,Dinabandhu Behura,20-Mar-2024 05:04 PM,1-Gobara-Kendrapara.pdf (340.00 KB),1.0,2205973.0,SAILABALA INFRASTRUCTURE PRIVATE LIMITED,INR,"278,943,829",1,2209202,ASTHALAKSHMI CONSTRUCTION,23-Aug-2023 05:08 PM,Rejected-Technical,Disqualified,19-Oct-2023 06:59 PM,Finance,Price bid opened,Ramesh Chandra Behera,06-Nov-2023 04:29 PM,,BOQ Comparative Chart,EIC RW,Internal,,Ramesh Chandra Behera,02-Dec-2023 06:02 PM,finsummary_448335.pdf (187.53 KB),CE RW I,2023_CERWI_92180_23,Tender Online-03/2023-24 ( Bridges),Construction of HL Bridge over river PAIKA at 5.435 K.M. on Gobara Chhaka to Chaulia Bamara Road under BSY,Technical,Five bidders participated,Kishor kumar Mishra,28-Aug-2023 11:58 AM,,EIC RW,Internal,CE Bridge and Buildings EE Bridges AO DAO,Ramesh Chandra Behera,19-Oct-2023 06:59 PM,26-Oct-2023 11:30 AM,techsummary_448335.pdf (106.61 KB),AOC
,,,,,,,,,,,,,,,,.pdf,"Labour licence, Work experience, Work in hand, ATO, Similar nature of work",,,,,,,,,,,,,,,,,,,,2.0,ICICI NEFT/RTGS,,,,,,,,,,,,,,,,,,,,,,,,,,AOC,,,,,,,,,,,,2,2215185,C P MOHANTY AND ASSOCIATES,24-Aug-2023 12:43 PM,Rejected-AOC,Rejected,20-Mar-2024 05:04 PM,,,,,,,,,,,,,,,,,,,,,,,,,,,,,AOC
,,,,,,,,,,,,,,,,.pdf,Machineries owned obtained on hire and other documents as per DTCN,,,,,,,,,,,,,,,,,,,,,,,,,,,,,,,,,,,,,,,,,,,,,,,AOC,,,,,,,,,,,,3,2209005,PRATAP PADHIARI,23-Aug-2023 04:47 PM,Rejected-AOC,Rejected,20-Mar-2024 05:04 PM,,,,,,,,,,,,,,,,,,,,,,,,,,,,,AOC
,,,,,,,,,,,,,,2.0,Finance,.xls,BOQ,,,,,,,,,,,,,,,,,,,,,,,,,,,,,,,,,,,,,,,,,,,,,,,AOC,,,,,,,,,,,,4,2213126,RAJLAXMI CONSTRUCTIONS LIMITED,24-Aug-2023 01:36 PM,Rejected-Finance,3rd Lowest,02-Dec-2023 06:02 PM,,,,,,,,,,,,,,,,,,,,,,,,,,,,,AOC
,,,,,,,,,,,,,,,,,,,,,,,,,,,,,,,,,,,,,,,,,,,,,,,,,,,,,,,,,,,,,,,,AOC,,,,,,,,,,,,5,2205973,SAILABALA INFRASTRUCTURE PRIVATE LIMITED,22-Aug-2023 04:41 PM,Accepted-AOC,Agreement No 183 P1 of 2023-24,20-Mar-2024 05:04 PM,,,,,,,,,,,,,,,,,,,,,,,,,,,,,AOC
