Organisation Chain,Tender Reference Number,Tender ID,Withdrawal Allowed,Tender Type,Form of contract,Tender Category,No. of Covers,General Technical Evaluation Allowed,ItemWise Technical Evaluation Allowed,Payment Mode,Is Multi Currency Allowed For BOQ,Is Multi Currency Allowed For Fee,Allow Two Stage Bidding,Cover No,Cover,Document Type,Description,Publish Date,Bid Opening Date,Document Download / Sale Start Date,Document Download / Sale End Date,Clarification Start Date,Clarification End Date,Bid Submission Start Date,Bid Submission End Date,Financial Bid Opening Date,EMD Amount in ₹,EMD Exemption Allowed,EMD Fee Type,EMD Percentage,EMD Payable To,EMD Payable At,S.No,Bank Name,Tender Fee in ₹,VAT Charges in ₹,Fee Payable To,Fee Payable At,Tender Fee Exemption Allowed,Name,Address,Title,Work Description,Pre Qualification Details,Independent External Monitor/Remarks,Tender Value in ₹,Product Category,Sub category,Contract Type,Bid Validity(Days),Period Of Work(Days),Location,Pincode,Pre Bid Meeting Place,Pre Bid Meeting Address,Pre Bid Meeting Date,Bid Opening Place,Should Allow NDA Tender,Allow Preferential Bidder,Tender Stage,Contract Date :,Contract Value :,Work Completion Period in days :,Updated By :,Updated on :,AOC document :,S.No,Bid Number,Bidder Name,Awarded Currency,Awarded Value,S.No.1,Bid Number.1,Bidder Name.1,Submitted Date,Status,Remarks,Status Updated On,Type :,Summary :,Updated By :.1,Updated On :,Document :,BOQ Comparative Chart :,Committee Chairperson/Co-ordinator Name :,Committee Chairperson/Co-ordinator Type :,Committee Members :,Updated By :.2,Updated on :.1,Document :.1,Organisation Chain :,Tender ID :,Tender Ref No :,Tender Title :,Type :.1,Summary :.1,Updated By :.3,Updated On :.1,Document :.2,Tender Stage
CE RW I||RW-CIRCLE-SUNDARGARH,RWCCESNG- 29 of 2023-24,2023_CERWI_94842_2,Yes,National Competitive Bid,Percentage,Works,2.0,No,No,Online,No,No,No,1.0,Fee/PreQual/Technical,.pdf,"Registration certificate,GSTIN,PAN,Affidavits etc",27-Sep-2023 02:00 PM,09-Oct-2023 11:00 AM,27-Sep-2023 02:00 PM,07-Oct-2023 05:00 PM,27-Sep-2023 02:00 PM ,06-Oct-2023 05:00 PM ,27-Sep-2023 02:00 PM,07-Oct-2023 05:00 PM,15-Nov-2023 04:00 PM,"2,83,853",Yes,percentage,1.0%,Nil,Nil,1.0,ICICI BANK,"10,000",0.0,Nil,Nil,No,"CCE,RW Circle,Sundargarh.","O/O The CCE,RW Circle,Sundargarh",Construction of Road from Raiberna to Turiberna Railway gate road in the District of Sundargarh under DMF for the year 2023-24.,Construction of Road from Raiberna to Turiberna Railway gate road in the District of Sundargarh under DMF for the year 2023-24.,Please refer Tender documents. ,NA ,"2,83,85,344",Civil Works - Roads,NA ,Tender,90.0,270.0,Rourkela,769004.0,NA ,NA ,NA ,"O/O The CCE,RW Circle,Sundargarh.",No ,No,AOC,12-Mar-2024,"INR 28,385,343.88",270.0,Biswanath Sethy,12-Mar-2024 11:49 AM,1015.pdf (500.00 KB),1.0,2281844.0,JAGANNATH NAIK,INR,"24,130,380.83",1,2281530,AJAY TIWARI,07-Oct-2023 11:50 AM,Rejected-Finance,Not Qualified,12-Mar-2024 11:44 AM,Finance,Four nos of bidder only,Biswanath Sethy,15-Nov-2023 04:37 PM,finance_464458.pdf,BOQ Comparative Chart,B.Sethy,Internal,,Biswanath Sethy,12-Mar-2024 11:44 AM,finsummary_464458.pdf (21.75 KB),CE RW I||RW-CIRCLE-SUNDARGARH,2023_CERWI_94842_2,RWCCESNG- 29 of 2023-24,Construction of Road from Raiberna to Turiberna Railway gate road in the District of Sundargarh under DMF for the year 2023-24.,Technical,Total five nos of bidder participated.,Biswanath Sethy,09-Oct-2023 12:04 PM,,AOC
,,,,,,,,,,,,,,,,.pdf,"Annual turnover, work experience, machinaries and other documents as per DTCN.",,,,,,,,,,,,,,,,2.0,ICICI NEFT/RTGS,,,,,,,,,,,,,,,,,,,,,,,,,,AOC,,,,,,,,,,,,2,2280500,AKSHAYA KUMAR ROUT,06-Oct-2023 02:08 PM,Rejected-Technical,Work in hand more about 1668.60 lakh .The agency is not capable to provide machinaries for all the works simultaneously.,10-Nov-2023 12:15 PM,,,,,,,,,,,,,,,,,,,,,,AOC
,,,,,,,,,,,,,,2.0,Finance,.xls,BOQ,,,,,,,,,,,,,,,,,,,,,,,,,,,,,,,,,,,,,,,,,,,AOC,,,,,,,,,,,,3,2281844,JAGANNATH NAIK,07-Oct-2023 04:56 PM,Accepted-AOC,Successful bidder by ST SC Preference.,12-Mar-2024 11:49 AM,,,,,,,,,,,,,,,,,,,,,,AOC
,,,,,,,,,,,,,,,,,,,,,,,,,,,,,,,,,,,,,,,,,,,,,,,,,,,,,,,,,,,,AOC,,,,,,,,,,,,4,2280886,NRUSINGHA CHARAN SAMAL,06-Oct-2023 03:28 PM,Rejected-Finance,Not Qualified,12-Mar-2024 11:44 AM,,,,,,,,,,,,,,,,,,,,,,AOC
,,,,,,,,,,,,,,,,,,,,,,,,,,,,,,,,,,,,,,,,,,,,,,,,,,,,,,,,,,,,AOC,,,,,,,,,,,,5,2281426,Suryakanta Mishra,07-Oct-2023 08:24 AM,Rejected-AOC,Unsuccessful bidder,12-Mar-2024 11:49 AM,,,,,,,,,,,,,,,,,,,,,,AOC
