Organisation Chain,Tender Reference Number,Tender ID,Withdrawal Allowed,Tender Type,Form of contract,Tender Category,No. of Covers,General Technical Evaluation Allowed,ItemWise Technical Evaluation Allowed,Payment Mode,Is Multi Currency Allowed For BOQ,Is Multi Currency Allowed For Fee,Allow Two Stage Bidding,Cover No,Cover,Document Type,Description,Publish Date,Bid Opening Date,Document Download / Sale Start Date,Document Download / Sale End Date,Clarification Start Date,Clarification End Date,Bid Submission Start Date,Bid Submission End Date,Financial Bid Opening Date,EMD Amount in ₹,EMD Exemption Allowed,EMD Fee Type,EMD Percentage,EMD Payable To,EMD Payable At,S.No,Bank Name,Tender Fee in ₹,VAT Charges in ₹,Fee Payable To,Fee Payable At,Tender Fee Exemption Allowed,Name,Address,Title,Work Description,Pre Qualification Details,Independent External Monitor/Remarks,Tender Value in ₹,Product Category,Sub category,Contract Type,Bid Validity(Days),Period Of Work(Days),Location,Pincode,Pre Bid Meeting Place,Pre Bid Meeting Address,Pre Bid Meeting Date,Bid Opening Place,Should Allow NDA Tender,Allow Preferential Bidder,Tender Stage,Contract Date :,Contract Value :,Work Completion Period in days :,Updated By :,Updated on :,AOC document :,AOC Description :,S.No,Bid Number,Bidder Name,Awarded Currency,Awarded Value,S.No.1,Bid Number.1,Bidder Name.1,Submitted Date,Status,Remarks,Status Updated On,Type :,Summary :,Updated By :.1,Updated On :,Document :,BOQ Comparative Chart :,Committee Chairperson/Co-ordinator Name :,Committee Chairperson/Co-ordinator Type :,Committee Members :,Updated By :.2,Updated on :.1,Document :.1,Organisation Chain :,Tender ID :,Tender Ref No :,Tender Title :,Type :.1,Summary :.1,Updated By :.3,Updated On :.1,Document :.2,Committee Chairperson/Co-ordinator Name :.1,Committee Chairperson/Co-ordinator Type :.1,Committee Members :.1,Updated By :.4,Updated On :.2,Financial Bid Opening Date:,Document :.3,Tender Stage
EIC-CIVIL||SERNB-CIRCLE-NORTHERN,CCENC (R AND B) /28/ 2023-24,2023_EICCL_98708_2,Yes,National Competitive Bid,Percentage,Works,2.0,No,No,Online,No,No,No,1.0,Fee/PreQual/Technical,.pdf,"Online Proof Copy of Tender Cost, Bid Security, GSTIN, PAN, R.C and Affidavit",21-Dec-2023 06:30 PM,05-Jan-2024 06:00 PM,21-Dec-2023 06:30 PM,05-Jan-2024 05:00 PM,21-Dec-2023 06:30 PM ,29-Dec-2023 05:00 PM ,21-Dec-2023 06:30 PM,05-Jan-2024 05:00 PM,07-Feb-2024 04:00 PM,"1,28,500",Yes,fixed,,Nil,Nil,1.0,ICICI BANK,"10,000",0.0,Nil,Nil,No,"C.C.E, Northern R AND B Circle, SAMBALPUR","O/O THE C.C.E, Northern R AND B Circle, SAMBALPUR","Construction of Multipurpose-Hall at D.I.E.T., Sambalpur for 2023-24.",BUILDING WORK,Please refer Tender documents. ,NA ,"1,28,37,008",Civil Works - Buildings,NA ,Tender,90.0,210.0,SAMBALPUR,768001.0,NA ,NA ,NA ,"O/O THE C.C.E, Northern R AND B Circle, SAMBALPUR",No ,No,AOC,30-Mar-2024,"INR 10,912,741",210.0,Arun Kumar Pattnaik,30-Mar-2024 08:12 PM,AGTDIET.pdf (988.00 KB),AGT DRAWN,1.0,2374341.0,NIRMAN BUILDERS,INR,"10,912,741",1,2378115,A S SUPPLIERS AND CONSTRUCTION PROPRIETOR AJAY KUMAR SHARMA,05-Jan-2024 02:34 PM,Rejected-Finance,UNSUCCESSFUL BIDDER,30-Mar-2024 08:10 PM,Finance,FINANCIAL BID OPENED,Anam Charan Sahoo,07-Feb-2024 05:28 PM,,BOQ Comparative Chart,ARUN KU PATTNAIK,Internal,"M.R. Sethy, A.K.Singh,D Behera",Arun Kumar Pattnaik,30-Mar-2024 08:10 PM,finsummary_480744.pdf (450.88 KB),EIC-CIVIL||SERNB-CIRCLE-NORTHERN,2023_EICCL_98708_2,CCENC (R AND B) /28/ 2023-24,"Construction of Multipurpose-Hall at D.I.E.T., Sambalpur for 2023-24.",Technical,TECHNICAL BID ( COVER-I) OPENED,Anam Charan Sahoo,05-Jan-2024 08:16 PM,,ARUN KU PATTNAIK,Internal,"M.R. Sethy, A.K.Singh,D Behera",Anam Charan Sahoo,06-Feb-2024 08:56 PM,07-Feb-2024 04:00 PM,techsummary_480744.pdf (71.71 KB),AOC
,,,,,,,,,,,,,,,,.pdf,"Ownership of machineries, work experience and MOU for composite Building work etc",,,,,,,,,,,,,,,,2.0,ICICI NEFT/RTGS,,,,,,,,,,,,,,,,,,,,,,,,,,AOC,,,,,,,,,,,,,2,2375392,BISWA MOHAN MISHRA,05-Jan-2024 04:52 PM,Rejected-Finance,UNSUCCESSFUL THROUGH TRANSPARENT LOTTERY SYSTEM,30-Mar-2024 08:10 PM,,,,,,,,,,,,,,,,,,,,,,,,,,,,,AOC
,,,,,,,,,,,,,,,,.pdf,Work experience certificate and other related documents as per DTCN.,,,,,,,,,,,,,,,,,,,,,,,,,,,,,,,,,,,,,,,,,,,AOC,,,,,,,,,,,,,3,2369096,Dinabandhu Mirdha,27-Dec-2023 11:51 AM,Rejected-Finance,UNSUCCESSFUL BIDDER,30-Mar-2024 08:10 PM,,,,,,,,,,,,,,,,,,,,,,,,,,,,,AOC
,,,,,,,,,,,,,,2.0,Finance,.xls,BILL OF QUANTITY (BOQ),,,,,,,,,,,,,,,,,,,,,,,,,,,,,,,,,,,,,,,,,,,AOC,,,,,,,,,,,,,4,2376862,MD ZAHIRUDDIN,05-Jan-2024 04:30 PM,Rejected-Finance,UNSUCCESSFUL THROUGH TRANSPARENT LOTTERY SYSTEM,30-Mar-2024 08:10 PM,,,,,,,,,,,,,,,,,,,,,,,,,,,,,AOC
,,,,,,,,,,,,,,,,,,,,,,,,,,,,,,,,,,,,,,,,,,,,,,,,,,,,,,,,,,,,AOC,,,,,,,,,,,,,5,2377242,MINAKHI BEHERA,05-Jan-2024 10:41 AM,Rejected-Finance,UNSUCCESSFUL THROUGH TRANSPARENT LOTTERY SYSTEM,30-Mar-2024 08:10 PM,,,,,,,,,,,,,,,,,,,,,,,,,,,,,AOC
,,,,,,,,,,,,,,,,,,,,,,,,,,,,,,,,,,,,,,,,,,,,,,,,,,,,,,,,,,,,AOC,,,,,,,,,,,,,6,2374341,NIRMAN BUILDERS,04-Jan-2024 08:38 PM,Accepted-AOC,AGT DRAWN,30-Mar-2024 08:12 PM,,,,,,,,,,,,,,,,,,,,,,,,,,,,,AOC
,,,,,,,,,,,,,,,,,,,,,,,,,,,,,,,,,,,,,,,,,,,,,,,,,,,,,,,,,,,,AOC,,,,,,,,,,,,,7,2378078,N.K AND CO. PROP. NAVIN KUMAR,05-Jan-2024 02:12 PM,Rejected-Finance,UNSUCCESSFUL BIDDER,30-Mar-2024 08:10 PM,,,,,,,,,,,,,,,,,,,,,,,,,,,,,AOC
,,,,,,,,,,,,,,,,,,,,,,,,,,,,,,,,,,,,,,,,,,,,,,,,,,,,,,,,,,,,AOC,,,,,,,,,,,,,8,2376586,RAJAT KUMAR KAR,05-Jan-2024 04:17 PM,Rejected-Technical,As per the decision of Tender Evaluation Committee,06-Feb-2024 08:56 PM,,,,,,,,,,,,,,,,,,,,,,,,,,,,,AOC
,,,,,,,,,,,,,,,,,,,,,,,,,,,,,,,,,,,,,,,,,,,,,,,,,,,,,,,,,,,,AOC,,,,,,,,,,,,,9,2377779,SANDIP SHARMA,05-Jan-2024 01:00 PM,Rejected-Finance,UNSUCCESSFUL BIDDER,30-Mar-2024 08:10 PM,,,,,,,,,,,,,,,,,,,,,,,,,,,,,AOC
