Organisation Chain,Tender Reference Number,Tender ID,Withdrawal Allowed,Tender Type,Form of contract,Tender Category,No. of Covers,General Technical Evaluation Allowed,ItemWise Technical Evaluation Allowed,Payment Mode,Is Multi Currency Allowed For BOQ,Is Multi Currency Allowed For Fee,Allow Two Stage Bidding,Cover No,Cover,Document Type,Description,Publish Date,Bid Opening Date,Document Download / Sale Start Date,Document Download / Sale End Date,Clarification Start Date,Clarification End Date,Bid Submission Start Date,Bid Submission End Date,EMD Amount in ₹,EMD Exemption Allowed,EMD Fee Type,EMD Percentage,EMD Payable To,EMD Payable At,S.No,Bank Name,Tender Fee in ₹,VAT Charges in ₹,Fee Payable To,Fee Payable At,Tender Fee Exemption Allowed,Name,Address,Title,Work Description,Pre Qualification Details,Independent External Monitor/Remarks,Tender Value in ₹,Product Category,Sub category,Contract Type,Bid Validity(Days),Period Of Work(Days),Location,Pincode,Pre Bid Meeting Place,Pre Bid Meeting Address,Pre Bid Meeting Date,Bid Opening Place,Should Allow NDA Tender,Allow Preferential Bidder,Tender Stage,Contract Date :,Contract Value :,Work Completion Period in days :,Updated By :,Updated on :,AOC document :,S.No,Bid Number,Bidder Name,Awarded Currency,Awarded Value,S.No.1,Bid Number.1,Bidder Name.1,Submitted Date,Status,Remarks,Status Updated On,Type :,Summary :,Updated By :.1,Updated On :,Document :,BOQ Comparative Chart :,Committee Chairperson/Co-ordinator Name :,Committee Chairperson/Co-ordinator Type :,Committee Members :,Updated By :.2,Updated on :.1,Document :.1,Organisation Chain :,Tender ID :,Tender Ref No :,Tender Title :,Committee Chairperson/Co-ordinator Name :.1,Committee Chairperson/Co-ordinator Type :.1,Committee Members :.1,Updated By :.3,Updated On :.1,Document :.2,Tender Stage
"CE-BM,LMB Basin,BBSR||SE, Eastern Circle,Cuttack||EE, Mahanadi North Division,Jagatpur",MND-18 OF 2023-24,2024_CELBB_99182_31,Yes,National Competitive Bid,Percentage,Works,1.0,No,No,Online,No,No,No,1.0,Fee/PreQual/Technical/Finance,.pdf,"TENDER PAPER COST, EMD,PAN, GSTIN,VALID RC, AFFIDAVIT,NRC AND OTHER DOCUMENTS AS PER DTCN",06-Jan-2024 10:00 AM,17-Jan-2024 11:30 AM,06-Jan-2024 10:00 AM,16-Jan-2024 05:30 PM,06-Jan-2024 10:00 AM ,12-Jan-2024 05:30 PM ,06-Jan-2024 10:00 AM,16-Jan-2024 05:30 PM,"15,100",Yes,fixed,,Nil,Nil,1.0,ICICI BANK,"6,000",0.0,Nil,Nil,No,"SUPERINTENDING ENGINEER, MAHANADI NORTH DIVISION-I","O/O THE SUPERINTENDING ENGINEER, MAHANADI NORTH DIVISION-I, JAGATPUR",Improvement to left bank service road from RD 00 to RD 330 m of Disty No-6D3 and right bank service road from RD 00 to RD 265 m of Kendrapara Canal,Improvement to left bank service road from RD 00 to RD 330 m of Disty No-6D3 and right bank service road from RD 00 to RD 265 m of Kendrapara Canal,Please refer Tender documents. ,NA ,"15,06,337",Civil Works - Others,NA ,Tender,90.0,90.0,KENDUPATANA,754021.0,NA ,NA ,NA ,"O/O THE S.E. MAHANADI NORTH DIVISION-I, JAGATPUR",No ,No,AOC,01-Mar-2024,"INR 1,280,537",90.0,Sandeep Kumar,13-Sep-2024 04:50 PM,1831.pdf (348.00 KB),1.0,2391433.0,BISHAL PATRA,INR,"1,280,537",1,2390916,AMAR KUMAR MALLA,15-Jan-2024 08:26 PM,Rejected-AOC,NOT SELECTED IN LOTTERY,13-Sep-2024 04:50 PM,Finance,5 BIDDERS PARTICIPATED,Debendra Kumar Biswal,20-Jan-2024 06:48 PM,,BOQ Comparative Chart,ER S.KUMAR,Internal,,Sandeep Kumar,01-Mar-2024 12:10 PM,finsummary_482599.pdf (323.35 KB),"CE-BM,LMB Basin,BBSR||SE, Eastern Circle,Cuttack||EE, Mahanadi North Division,Jagatpur",2024_CELBB_99182_31,MND-18 OF 2023-24,Improvement to left bank service road from RD 00 to RD 330 m of Disty No-6D3 and right bank service road from RD 00 to RD 265 m of Kendrapara Canal,ER S.KUMAR,Internal,,Sandeep Kumar,01-Mar-2024 12:07 PM,techsummary_482599.pdf (245.21 KB),AOC
,,,,,,,,,,,,,,,,.xls,BILL OF QUANTITY,,,,,,,,,,,,,,,2.0,ICICI NEFT/RTGS,,,,,,,,,,,,,,,,,,,,,,,,,,AOC,,,,,,,,,,,,2,2391433,BISHAL PATRA,15-Jan-2024 08:11 PM,Accepted-AOC,SELECTED IN LOTTERY,13-Sep-2024 04:50 PM,,,,,,,,,,,,,,,,,,,,,,,AOC
,,,,,,,,,,,,,,,,,,,,,,,,,,,,,,,,,,,,,,,,,,,,,,,,,,,,,,,,,,,AOC,,,,,,,,,,,,3,2391226,MAHESWAR BEHURA,15-Jan-2024 04:24 PM,Rejected-AOC,NOT SELECTED IN LOTTERY,13-Sep-2024 04:50 PM,,,,,,,,,,,,,,,,,,,,,,,AOC
,,,,,,,,,,,,,,,,,,,,,,,,,,,,,,,,,,,,,,,,,,,,,,,,,,,,,,,,,,,AOC,,,,,,,,,,,,4,2390881,SARAT CHANDRA MOHARANA,15-Jan-2024 08:41 PM,Rejected-AOC,NOT SELECTED IN LOTTERY,13-Sep-2024 04:50 PM,,,,,,,,,,,,,,,,,,,,,,,AOC
,,,,,,,,,,,,,,,,,,,,,,,,,,,,,,,,,,,,,,,,,,,,,,,,,,,,,,,,,,,AOC,,,,,,,,,,,,5,2390897,SRI PRADYUMNA KUMAR ROUT,15-Jan-2024 08:32 PM,Rejected-AOC,NOT SELECTED IN LOTTERY,13-Sep-2024 04:50 PM,,,,,,,,,,,,,,,,,,,,,,,AOC
