Organisation Chain,Tender Reference Number,Tender ID,Withdrawal Allowed,Tender Type,Form of contract,Tender Category,No. of Covers,General Technical Evaluation Allowed,ItemWise Technical Evaluation Allowed,Payment Mode,Is Multi Currency Allowed For BOQ,Is Multi Currency Allowed For Fee,Allow Two Stage Bidding,Cover No,Cover,Document Type,Description,Publish Date,Bid Opening Date,Document Download / Sale Start Date,Document Download / Sale End Date,Clarification Start Date,Clarification End Date,Bid Submission Start Date,Bid Submission End Date,Financial Bid Opening Date,EMD Amount in ₹,EMD Exemption Allowed,EMD Fee Type,EMD Percentage,EMD Payable To,EMD Payable At,S.No,Bank Name,Tender Fee in ₹,VAT Charges in ₹,Fee Payable To,Fee Payable At,Tender Fee Exemption Allowed,Name,Address,Title,Work Description,Pre Qualification Details,Independent External Monitor/Remarks,Tender Value in ₹,Product Category,Sub category,Contract Type,Bid Validity(Days),Period Of Work(Days),Location,Pincode,Pre Bid Meeting Place,Pre Bid Meeting Address,Pre Bid Meeting Date,Bid Opening Place,Should Allow NDA Tender,Allow Preferential Bidder,Tender Stage,Contract Date :,Contract Value :,Work Completion Period in days :,Updated By :,Updated on :,AOC document :,AOC Description :,S.No,Bid Number,Bidder Name,Awarded Currency,Awarded Value,S.No.1,Bid Number.1,Bidder Name.1,Submitted Date,Status,Remarks,Status Updated On,Type :,Summary :,Updated By :.1,Updated On :,Document :,BOQ Comparative Chart :,Committee Chairperson/Co-ordinator Name :,Committee Chairperson/Co-ordinator Type :,Committee Members :,Updated By :.2,Updated on :.1,Document :.1,Organisation Chain :,Tender ID :,Tender Ref No :,Tender Title :,Type :.1,Summary :.1,Updated By :.3,Updated On :.1,Document :.2,Committee Chairperson/Co-ordinator Name :.1,Committee Chairperson/Co-ordinator Type :.1,Committee Members :.1,Updated By :.4,Updated On :.2,Financial Bid Opening Date:,Document :.3,Tender Stage
EIC-CIVIL,CE-DPI AND R- 25/2023-24,2023_EICCL_95364_18,Yes,Open Tender,Percentage,Works,2.0,No,No,Online,No,No,No,1.0,Fee/PreQual/Technical,.pdf,"Online proof copy of Tender Cost and EMD, GSTIN, PAN, RC and Affidavit",10-Oct-2023 02:00 PM,27-Oct-2023 11:00 AM,10-Oct-2023 02:00 PM,26-Oct-2023 05:30 PM,NA ,NA ,10-Oct-2023 02:00 PM,26-Oct-2023 05:30 PM,04-Dec-2023 11:30 AM,"40,76,000",Yes,fixed,,Nil,Nil,1.0,ICICI BANK,"10,000",0.0,Nil,Nil,No,"Chief Engineer, DPI and Roads, Odisha","Office of the E.I.C. Civil, Odisha, Nirman Soudha, New Building, Unit-V, Bhubaneswar",Improvement of Ichhapur-Basudevpur road from 0/000 km to 23/700 km (except 10/000 km to 10/600 km) in the district of Bhadrak under State Plan,Improvement of Ichhapur-Basudevpur road from 0/000 km to 23/700 km (except 10/000 km to 10/600 km) in the district of Bhadrak under State Plan,Please refer Tender documents. ,NA ,"40,75,81,083",Civil Works - Roads,NA ,Tender,90.0,660.0,In Bhadrak Dist,751001.0,NA ,NA ,NA ,"O/o the E.I.C. Civil, Odisha, Bhubaneswar",No ,No,AOC,02-Mar-2024,"INR 366,863,733",660.0,Pradipta Kumar Nayak,02-Mar-2024 06:24 PM,Ichhapur_basudevpur.pdf (81.00 KB),541P1 of 2023-24,1.0,2293277.0,MESSERS BIRAJA CONSTRUCTION,INR,"366,863,733",1,2293277,MESSERS BIRAJA CONSTRUCTION,26-Oct-2023 11:39 AM,Accepted-AOC,Selected as L1 bidder,02-Mar-2024 06:25 PM,Finance,Finance opening,Pradipta Kumar Nayak,04-Dec-2023 12:47 PM,,BOQ Comparative Chart,CE DPI and R Odisha,Internal,,Pradipta Kumar Nayak,02-Mar-2024 06:20 PM,finsummary_466433.pdf (80.67 KB),EIC-CIVIL,2023_EICCL_95364_18,CE-DPI AND R- 25/2023-24,Improvement of Ichhapur-Basudevpur road from 0/000 km to 23/700 km (except 10/000 km to 10/600 km) in the district of Bhadrak under State Plan,Technical,Opening,Pradipta Kumar Nayak,27-Oct-2023 01:52 PM,,EIC Civil Odisha,Internal,,Pradipta Kumar Nayak,02-Dec-2023 05:29 PM,04-Dec-2023 11:30 AM,techsummary_466433.pdf (195.27 KB),AOC
,,,,,,,,,,,,,,,,.pdf,Machineries and work experience,,,,,,,,,,,,,,,,2.0,ICICI NEFT/RTGS,,,,,,,,,,,,,,,,,,,,,,,,,,AOC,,,,,,,,,,,,,2,2294718,Prafulla Kumar Mohapatra,26-Oct-2023 05:15 PM,Rejected-Finance,Other than L1 and L2 bidder,02-Mar-2024 06:20 PM,,,,,,,,,,,,,,,,,,,,,,,,,,,,,AOC
,,,,,,,,,,,,,,,,.pdf,Other documents as per DTCN,,,,,,,,,,,,,,,,,,,,,,,,,,,,,,,,,,,,,,,,,,,AOC,,,,,,,,,,,,,3,2284807,SBB CONSTRUCTIONS PVT LTD,26-Oct-2023 04:46 PM,Rejected-AOC,L2 bidder,02-Mar-2024 06:25 PM,,,,,,,,,,,,,,,,,,,,,,,,,,,,,AOC
,,,,,,,,,,,,,,2.0,Finance,.xls,Bill of quantities,,,,,,,,,,,,,,,,,,,,,,,,,,,,,,,,,,,,,,,,,,,AOC,,,,,,,,,,,,,4,2296829,Shivam Condev Private Limited,26-Oct-2023 03:19 PM,Rejected-AOC,L1 bidder,02-Mar-2024 06:25 PM,,,,,,,,,,,,,,,,,,,,,,,,,,,,,AOC
,,,,,,,,,,,,,,,,,,,,,,,,,,,,,,,,,,,,,,,,,,,,,,,,,,,,,,,,,,,,AOC,,,,,,,,,,,,,5,2294727,SIBA PRASAD PARIDA,25-Oct-2023 09:37 PM,Rejected-Finance,Other than L1 and L2 bidder,02-Mar-2024 06:20 PM,,,,,,,,,,,,,,,,,,,,,,,,,,,,,AOC
