Organisation Chain,Tender Reference Number,Tender ID,Withdrawal Allowed,Tender Type,Form of contract,Tender Category,No. of Covers,General Technical Evaluation Allowed,ItemWise Technical Evaluation Allowed,Payment Mode,Is Multi Currency Allowed For BOQ,Is Multi Currency Allowed For Fee,Allow Two Stage Bidding,Cover No,Cover,Document Type,Description,Publish Date,Bid Opening Date,Document Download / Sale Start Date,Document Download / Sale End Date,Clarification Start Date,Clarification End Date,Bid Submission Start Date,Bid Submission End Date,Financial Bid Opening Date,EMD Amount in ₹,EMD Exemption Allowed,EMD Fee Type,EMD Percentage,EMD Payable To,EMD Payable At,S.No,Corrigendum Title,Corrigendum Type,View,S.No.1,Bank Name,Tender Fee in ₹,VAT Charges in ₹,Fee Payable To,Fee Payable At,Tender Fee Exemption Allowed,Name,Address,Title,Work Description,Pre Qualification Details,Independent External Monitor/Remarks,Tender Value in ₹,Product Category,Sub category,Contract Type,Bid Validity(Days),Period Of Work(Days),Location,Pincode,Pre Bid Meeting Place,Pre Bid Meeting Address,Pre Bid Meeting Date,Bid Opening Place,Should Allow NDA Tender,Allow Preferential Bidder,Tender Stage,Contract Date :,Contract Value :,Work Completion Period in days :,Updated By :,Updated on :,AOC document :,AOC Description :,S.No,Bid Number,Bidder Name,Awarded Currency,Awarded Value,S.No.1,Bid Number.1,Bidder Name.1,Submitted Date,Status,Remarks,Status Updated On,Type :,Summary :,Updated By :.1,Updated On :,Document :,BOQ Comparative Chart :,Committee Chairperson/Co-ordinator Name :,Committee Chairperson/Co-ordinator Type :,Committee Members :,Updated By :.2,Updated on :.1,Document :.1,Organisation Chain :,Tender ID :,Tender Ref No :,Tender Title :,Type :.1,Summary :.1,Updated By :.3,Updated On :.1,Document :.2,Committee Chairperson/Co-ordinator Name :.1,Committee Chairperson/Co-ordinator Type :.1,Committee Members :.1,Updated By :.4,Updated On :.2,Financial Bid Opening Date:,Document :.3,S.No.2,Revocation Title,Revocation Description,Published Date,Document Name,Document Size(in KB),Revocated To,Tender Stage
CE RW I||RWCIRCLE-BHUBANESWAR,Tender Online C.C-32 of 2023,2023_CERWI_93868_7,Yes,National Competitive Bid,Percentage,Works,2.0,No,No,Online,No,No,No,1.0,Fee/PreQual/Technical,.pdf,"Tender Paper Cost, EMD, GSTIN, PAN, Registration Certificate",06-Sep-2023 12:00 PM,16-Sep-2023 11:00 AM,06-Sep-2023 12:00 PM,15-Sep-2023 05:00 PM,NA ,NA ,06-Sep-2023 12:00 PM,15-Sep-2023 05:00 PM,02-Jan-2024 05:40 PM,"5,67,657",Yes,percentage,1.0%,Nil,Nil,1.0,Corrigendum,Other,,1.0,ICICI BANK,"10,000",0.0,Nil,Nil,No,ChiefConstructionEngineer,"O/o ChiefConstructionEngineer,CentralRWCircle,BBSR","Construction of road from Champatipur to Nadiabhanga Chhaka via Brajarajpur, Latar under SACI in the Dist. of Nayagarh for the year 2023-24","Construction of road from Champatipur to Nadiabhanga Chhaka via Brajarajpur, Latar under SACI in the Dist. of Nayagarh for the year 2023-24",Please refer Tender documents. ,NA ,"5,67,65,665",Civil Works - Roads,NA ,Tender,90.0,270.0,Bhubaneswar,751022.0,NA ,NA ,NA ,"O/o ChiefConstructionEngineer,CentralRWCircle,BBSR",No ,No,AOC,19-Mar-2024,"INR 53,933,058",270.0,Priyadarshini Dalai,19-Mar-2024 12:33 PM,ChampatipurAgmtDetails.pdf (1107.00 KB),"Work order letter No.1758 dtd.15.03.2024 and Agmt No.179 P1 of 2023-24 dtd,15.03.2024 of Superintending Engineer, Rural Works Division, Nayagarh",1.0,2245818.0,TARINI PRASAD DAS,INR,"53,933,058",1,2256563,DILLIP KUMAR SWAIN,15-Sep-2023 12:37 PM,Rejected-Finance,Other than L1,19-Mar-2024 12:29 PM,Finance,3 nos bidder qualified in the tender,Priyadarshini Dalai,02-Jan-2024 06:42 PM,finance_458809.pdf,BOQ Comparative Chart,"Chief Construction Engineer CentralRWCircle,BBSR",Internal,ExecutiveEngineerRWDivisionII Nayagarh SrDAORWDivision Nayagarh PAtoChiefConstructionEngineerCentralRuralWorksCircleBBSR,Priyadarshini Dalai,19-Mar-2024 12:29 PM,finsummary_458809.pdf (130.64 KB),CE RW I||RWCIRCLE-BHUBANESWAR,2023_CERWI_93868_7,Tender Online C.C-32 of 2023,"Construction of road from Champatipur to Nadiabhanga Chhaka via Brajarajpur, Latar under SACI in the Dist. of Nayagarh for the year 2023-24",Technical,QUALIFIED AND DISQUALIFIED LIST,Priyadarshini Dalai,02-Jan-2024 05:33 PM,technical_458809.pdf,"Chief Construction Engineer CentralRWCircle,BBSR",Internal,ExecutiveEngineerRWDivisionII Nayagarh SrDAORWDivision Nayagarh PAtoChiefConstructionEngineerCentralRuralWorksCircleBBSR,Priyadarshini Dalai,02-Jan-2024 05:38 PM,02-Jan-2024 05:40 PM,techsummary_458809.pdf (130.64 KB),1.0,Tender Revocation,Tender Revocation,02-Jan-2024 05:11 PM,13.pdf ,196.25,Technical Opening,AOC
,,,,,,,,,,,,,,,,.pdf,"Work in Hand, Machineries, Affidavit of Correctness Certificate",,,,,,,,,,,,,,,,,,,,2.0,ICICI NEFT/RTGS,,,,,,,,,,,,,,,,,,,,,,,,,,AOC,,,,,,,,,,,,,2,2256879,Nitish Biswal,15-Sep-2023 01:57 PM,Rejected-Technical,As per Clause No.2.1(1) of the Eligibility Criteria of General Instructions To the Tenderers of the DTCN,02-Jan-2024 05:38 PM,,,,,,,,,,,,,,,,,,,,,,,,,,,,,,,,,,,,AOC
,,,,,,,,,,,,,,,,.pdf,"No Relationship Certificate, ATO, Work Experience and required documents as per DTCN",,,,,,,,,,,,,,,,,,,,,,,,,,,,,,,,,,,,,,,,,,,,,,,AOC,,,,,,,,,,,,,3,2256955,Subash Chandra Mohanty,15-Sep-2023 03:42 PM,Rejected-Finance,During combined evaluation the agency has not meet the qualifying criteria for 2 no. Of packages,19-Mar-2024 12:29 PM,,,,,,,,,,,,,,,,,,,,,,,,,,,,,,,,,,,,AOC
,,,,,,,,,,,,,,2.0,Finance,.xls,BOQ,,,,,,,,,,,,,,,,,,,,,,,,,,,,,,,,,,,,,,,,,,,,,,,AOC,,,,,,,,,,,,,4,2256472,SUMANTA KUMAR SAHOO,15-Sep-2023 11:56 AM,Rejected-Technical,As per Clause No.2.6(b) of the Eligibility Criteria of General Instructions To the Tenderers of the DTCN,02-Jan-2024 05:38 PM,,,,,,,,,,,,,,,,,,,,,,,,,,,,,,,,,,,,AOC
,,,,,,,,,,,,,,,,,,,,,,,,,,,,,,,,,,,,,,,,,,,,,,,,,,,,,,,,,,,,,,,,AOC,,,,,,,,,,,,,5,2245818,TARINI PRASAD DAS,09-Sep-2023 05:50 AM,Accepted-AOC,Accepted,19-Mar-2024 12:33 PM,,,,,,,,,,,,,,,,,,,,,,,,,,,,,,,,,,,,AOC
