Organisation Chain,Tender Reference Number,Tender ID,Withdrawal Allowed,Tender Type,Form of contract,Tender Category,No. of Covers,General Technical Evaluation Allowed,ItemWise Technical Evaluation Allowed,Payment Mode,Is Multi Currency Allowed For BOQ,Is Multi Currency Allowed For Fee,Allow Two Stage Bidding,Cover No,Cover,Document Type,Description,Publish Date,Bid Opening Date,Document Download / Sale Start Date,Document Download / Sale End Date,Clarification Start Date,Clarification End Date,Bid Submission Start Date,Bid Submission End Date,EMD Amount in ₹,EMD Exemption Allowed,EMD Fee Type,EMD Percentage,EMD Payable To,EMD Payable At,S.No,Bank Name,Tender Fee in ₹,VAT Charges in ₹,Fee Payable To,Fee Payable At,Tender Fee Exemption Allowed,Name,Address,Title,Work Description,Pre Qualification Details,Independent External Monitor/Remarks,Tender Value in ₹,Product Category,Sub category,Contract Type,Bid Validity(Days),Period Of Work(Days),Location,Pincode,Pre Bid Meeting Place,Pre Bid Meeting Address,Pre Bid Meeting Date,Bid Opening Place,Should Allow NDA Tender,Allow Preferential Bidder,Tender Stage,Contract Date :,Contract Value :,Work Completion Period in days :,Updated By :,Updated on :,AOC document :,S.No,Bid Number,Bidder Name,Awarded Currency,Awarded Value,S.No.1,Bid Number.1,Bidder Name.1,Submitted Date,Status,Remarks,Status Updated On,Type :,Summary :,Updated By :.1,Updated On :,Document :,BOQ Comparative Chart :,Committee Chairperson/Co-ordinator Name :,Committee Chairperson/Co-ordinator Type :,Committee Members :,Updated By :.2,Updated on :.1,Document :.1,Organisation Chain :,Tender ID :,Tender Ref No :,Tender Title :,Committee Chairperson/Co-ordinator Name :.1,Committee Chairperson/Co-ordinator Type :.1,Committee Members :.1,Updated By :.3,Updated On :.1,Document :.2,Tender Stage
CE RW I||RWCIRCLE-SUNABEDA||RWDIVISION-NAWARANGAPUR,EERWNGP-Online-09/2023-24,2024_CERWI_99377_4,Yes,Open Tender,Percentage,Works,1.0,No,No,Online,No,No,No,1.0,Fee/PreQual/Technical/Finance,.pdf,"Licencse, PAN Card, GSTIN, Affidavit and as per DTCN",08-Jan-2024 10:00 AM,17-Jan-2024 11:00 AM,08-Jan-2024 10:00 AM,16-Jan-2024 03:00 PM,08-Jan-2024 10:00 AM ,16-Jan-2024 03:00 PM ,08-Jan-2024 10:00 AM,16-Jan-2024 03:00 PM,"5,079",Yes,percentage,1.0%,Nil,Nil,1.0,ICICI BANK,"4,000",0.0,Nil,Nil,No,Executive Engineer,"O/o the SE, RW Division-I, Nabarangpur",S/R to Panditguda to Chandrapur road at Ch-2/500 to 4/400 Km in Papadahandi block for the year 2023-24,S/R to Panditguda to Chandrapur road at Ch-2/500 to 4/400 Km in Papadahandi block for the year 2023-24,Please refer tender documents ,NA ,"5,07,916",Civil Works - Roads,NA ,Tender,90.0,45.0,Papadahandi,764071.0,NA ,NA ,NA ,"O/o the SE, RW Division-I, Nabarangpur",No ,No,AOC,01-Mar-2024,"INR 507,915.86",45.0,Nibedita Tadingi,09-Mar-2024 05:35 PM,10.pdf (656.00 KB),1.0,2392141.0,M/S ABANI KUMAR MISHRA,INR,"431,779.27",1,2391530,Brajendra Naik,15-Jan-2024 07:26 PM,Rejected-AOC,Disqualified in transparent lottery,09-Mar-2024 05:36 PM,Finance,Bid Opening,Nibedita Tadingi,20-Jan-2024 07:20 PM,finance_483166.pdf,BOQ Comparative Chart,Executive Engineer,Internal,"EE,DAO,Estimator",Nibedita Tadingi,20-Feb-2024 06:01 PM,finsummary_483166.pdf (908.87 KB),CE RW I||RWCIRCLE-SUNABEDA||RWDIVISION-NAWARANGAPUR,2024_CERWI_99377_4,EERWNGP-Online-09/2023-24,S/R to Panditguda to Chandrapur road at Ch-2/500 to 4/400 Km in Papadahandi block for the year 2023-24,Executive Engineer,Internal,"EE,DAO,Estimator",Nibedita Tadingi,20-Feb-2024 05:58 PM,techsummary_483166.pdf (908.87 KB),AOC
,,,,,,,,,,,,,,,,.xls,BOQ,,,,,,,,,,,,,,,2.0,ICICI NEFT/RTGS,,,,,,,,,,,,,,,,,,,,,,,,,,AOC,,,,,,,,,,,,2,2392375,CHANDRA HARIJAN,16-Jan-2024 03:35 AM,Rejected-AOC,Disqualified in transparent lottery,09-Mar-2024 05:36 PM,,,,,,,,,,,,,,,,,,,,,,,AOC
,,,,,,,,,,,,,,,,,,,,,,,,,,,,,,,,,,,,,,,,,,,,,,,,,,,,,,,,,,,AOC,,,,,,,,,,,,3,2392141,M/S ABANI KUMAR MISHRA,15-Jan-2024 10:35 PM,Accepted-AOC,Qualified in transparent lottery,09-Mar-2024 05:36 PM,,,,,,,,,,,,,,,,,,,,,,,AOC
,,,,,,,,,,,,,,,,,,,,,,,,,,,,,,,,,,,,,,,,,,,,,,,,,,,,,,,,,,,AOC,,,,,,,,,,,,4,2389394,SOFIA BEGUM,14-Jan-2024 01:20 PM,Rejected-AOC,Disqualified in transparent lottery,09-Mar-2024 05:36 PM,,,,,,,,,,,,,,,,,,,,,,,AOC
,,,,,,,,,,,,,,,,,,,,,,,,,,,,,,,,,,,,,,,,,,,,,,,,,,,,,,,,,,,AOC,,,,,,,,,,,,5,2391455,SUSMA SANTA,15-Jan-2024 05:26 PM,Rejected-AOC,Disqualified in transparent lottery,09-Mar-2024 05:36 PM,,,,,,,,,,,,,,,,,,,,,,,AOC
