Organisation Chain,Tender Reference Number,Tender ID,Withdrawal Allowed,Tender Type,Form of contract,Tender Category,No. of Covers,General Technical Evaluation Allowed,ItemWise Technical Evaluation Allowed,Payment Mode,Is Multi Currency Allowed For BOQ,Is Multi Currency Allowed For Fee,Allow Two Stage Bidding,Cover No,Cover,Document Type,Description,Publish Date,Bid Opening Date,Document Download / Sale Start Date,Document Download / Sale End Date,Clarification Start Date,Clarification End Date,Bid Submission Start Date,Bid Submission End Date,EMD Amount in ₹,EMD Exemption Allowed,EMD Fee Type,EMD Percentage,EMD Payable To,EMD Payable At,S.No,Bank Name,Tender Fee in ₹,Fee Payable To,Fee Payable At,Tender Fee Exemption Allowed,Name,Address,Title,Work Description,Pre Qualification Details,Independent External Monitor/Remarks,Tender Value in ₹,Product Category,Sub category,Contract Type,Bid Validity(Days),Period Of Work(Days),Location,Pincode,Pre Bid Meeting Place,Pre Bid Meeting Address,Pre Bid Meeting Date,Bid Opening Place,Should Allow NDA Tender,Allow Preferential Bidder,Tender Stage,Contract Date :,Contract Value :,Work Completion Period in days :,Updated By :,Updated on :,AOC document :,AOC Description :,S.No,Bid Number,Bidder Name,Awarded Currency,Awarded Value,S.No.1,Bid Number.1,Bidder Name.1,Submitted Date,Status,Remarks,Status Updated On,Type :,Summary :,Updated By :.1,Updated On :,Document :,BOQ Comparative Chart :,Committee Chairperson/Co-ordinator Name :,Committee Chairperson/Co-ordinator Type :,Committee Members :,Updated By :.2,Updated on :.1,Document :.1,Organisation Chain :,Tender ID :,Tender Ref No :,Tender Title :,Committee Chairperson/Co-ordinator Name :.1,Committee Chairperson/Co-ordinator Type :.1,Committee Members :.1,Updated By :.3,Updated On :.1,Document :.2,Tender Stage
CE AND BM IK BASIN BARINIPUT JEYPORE||Upper Kolab Project Bariniput||Upper Kolab Irrigation Division Borigumma,SEUKID 03/2023-24 (SL19),2023_UPIDB_97887_1,Yes,Open Tender,Percentage,Works,1.0,No,No,Online,No,No,No,1.0,Fee/PreQual/Technical/Finance,.pdf,"Affidavit, EMD, GST Registration Certificate, GSTIN, PAN and Contractor RC",06-Dec-2023 11:00 AM,18-Dec-2023 11:00 AM,06-Dec-2023 11:00 AM,16-Dec-2023 05:30 PM,NA ,NA ,06-Dec-2023 11:00 AM,16-Dec-2023 05:30 PM,"7,900",Yes,fixed,,Nil,Nil,1.0,ICICI BANK,"4,000",Nil,Nil,No,"SE UKIDIVN, Borigumma,Dist-Koraput","Office of the Superintending Engineer, U.K.I.Division,Borigumma, Dist- Koraput, PIN 764056",Construction of VRB at RD 3.000 km of Makaput minor.,CANAL ROAD WORK,AS PER DTCN ,NA ,"7,84,761",Civil Works - Roads,NA ,Tender,90.0,60.0,BORIGUMMA,764056.0,NA ,NA ,NA ,"Office of the SE UKIDIVN, Borigumma,Dist-Koraput.",No ,No,AOC,24-Jan-2024,"INR 784,761",60.0,Hemanta Kumar Hotta,05-Mar-2024 06:57 PM,WO19.pdf (218.00 KB),Work Order,1.0,2358653.0,ANUPAMA PANDA,INR,"667,125",1,2358653,ANUPAMA PANDA,16-Dec-2023 02:05 PM,Accepted-AOC,Qualified in transparent lottery system.,05-Mar-2024 06:57 PM,Finance,Bid opening summary,Hemanta Kumar Hotta,05-Jan-2024 09:19 AM,finance_477639.pdf,BOQ Comparative Chart,"SE,UKID, Borigumma",Internal,"Divisional Accountant , Estimator",Hemanta Kumar Hotta,22-Jan-2024 01:01 PM,finsummary_477639.pdf (311.14 KB),CE AND BM IK BASIN BARINIPUT JEYPORE||Upper Kolab Project Bariniput||Upper Kolab Irrigation Division Borigumma,2023_UPIDB_97887_1,SEUKID 03/2023-24 (SL19),Construction of VRB at RD 3.000 km of Makaput minor.,"SE,UKID, Borigumma",Internal,"Divisional Accountant , Estimator",Hemanta Kumar Hotta,22-Jan-2024 12:02 PM,techsummary_477639.pdf (239.44 KB),AOC
,,,,,,,,,,,,,,,,.pdf,"Tender cost, undertaking, Check list, No Relation Certificate and any other documents as per DTCN",,,,,,,,,,,,,,,2.0,ICICI NEFT/RTGS,,,,,,,,,,,,,,,,,,,,,,,,,AOC,,,,,,,,,,,,,2,2358277,HEMANT DASH,16-Dec-2023 09:55 AM,Rejected-Finance,Disqualified in transparent lottery system.,22-Jan-2024 01:01 PM,,,,,,,,,,,,,,,,,,,,,,,AOC
,,,,,,,,,,,,,,,,.xls,BOQ,,,,,,,,,,,,,,,,,,,,,,,,,,,,,,,,,,,,,,,,,AOC,,,,,,,,,,,,,3,2358321,M/S SANJAYA KUMAR NAIK,16-Dec-2023 10:55 AM,Rejected-Finance,Disqualified in transparent lottery system.,22-Jan-2024 01:01 PM,,,,,,,,,,,,,,,,,,,,,,,AOC
,,,,,,,,,,,,,,,,,,,,,,,,,,,,,,,,,,,,,,,,,,,,,,,,,,,,,,,,,,AOC,,,,,,,,,,,,,4,2352033,PRASANNA KUMAR PANDA,09-Dec-2023 08:38 PM,Rejected-Finance,Disqualified in transparent lottery system.,22-Jan-2024 01:01 PM,,,,,,,,,,,,,,,,,,,,,,,AOC
,,,,,,,,,,,,,,,,,,,,,,,,,,,,,,,,,,,,,,,,,,,,,,,,,,,,,,,,,,AOC,,,,,,,,,,,,,5,2358320,PRASANTA KUMAR PATTNAIK,16-Dec-2023 11:33 AM,Rejected-Finance,Disqualified in transparent lottery system.,22-Jan-2024 01:01 PM,,,,,,,,,,,,,,,,,,,,,,,AOC
,,,,,,,,,,,,,,,,,,,,,,,,,,,,,,,,,,,,,,,,,,,,,,,,,,,,,,,,,,AOC,,,,,,,,,,,,,6,2352149,RASHMITA BISHOI,10-Dec-2023 12:04 PM,Rejected-Finance,Disqualified in transparent lottery system.,22-Jan-2024 01:01 PM,,,,,,,,,,,,,,,,,,,,,,,AOC
