Organisation Chain,Tender Reference Number,Tender ID,Withdrawal Allowed,Tender Type,Form of contract,Tender Category,No. of Covers,General Technical Evaluation Allowed,ItemWise Technical Evaluation Allowed,Payment Mode,Is Multi Currency Allowed For BOQ,Is Multi Currency Allowed For Fee,Allow Two Stage Bidding,Cover No,Cover,Document Type,Description,Publish Date,Bid Opening Date,Document Download / Sale Start Date,Document Download / Sale End Date,Clarification Start Date,Clarification End Date,Bid Submission Start Date,Bid Submission End Date,Financial Bid Opening Date,EMD Amount in ₹,EMD Exemption Allowed,EMD Fee Type,EMD Percentage,EMD Payable To,EMD Payable At,S.No,Bank Name,Tender Fee in ₹,VAT Charges in ₹,Fee Payable To,Fee Payable At,Tender Fee Exemption Allowed,Name,Address,Title,Work Description,Pre Qualification Details,Independent External Monitor/Remarks,Tender Value in ₹,Product Category,Sub category,Contract Type,Bid Validity(Days),Period Of Work(Days),Location,Pincode,Pre Bid Meeting Place,Pre Bid Meeting Address,Pre Bid Meeting Date,Bid Opening Place,Should Allow NDA Tender,Allow Preferential Bidder,Tender Stage,Contract Date :,Contract Value :,Work Completion Period in days :,Updated By :,Updated on :,AOC document :,AOC Description :,S.No,Bid Number,Bidder Name,Awarded Currency,Awarded Value,S.No.1,Bid Number.1,Bidder Name.1,Submitted Date,Status,Remarks,Status Updated On,Type :,Summary :,Updated By :.1,Updated On :,Document :,BOQ Comparative Chart :,Committee Chairperson/Co-ordinator Name :,Committee Chairperson/Co-ordinator Type :,Committee Members :,Updated By :.2,Updated on :.1,Document :.1,Organisation Chain :,Tender ID :,Tender Ref No :,Tender Title :,Type :.1,Summary :.1,Updated By :.3,Updated On :.1,Document :.2,Committee Chairperson/Co-ordinator Name :.1,Committee Chairperson/Co-ordinator Type :.1,Committee Members :.1,Updated By :.4,Updated On :.2,Financial Bid Opening Date:,Document :.3,Tender Stage
Orissa State Police Housing and Welfare Corporation Ltd,42/OPHWC/2023-24,2024_OSPHW_101092_47,Yes,National Competitive Bid,Percentage,Works,2.0,No,No,Online,No,No,No,1.0,Fee/PreQual/Technical,.pdf,"GST, GSTR-1, PAN, Contractor Registration Certificate and Affidavit",14-Feb-2024 05:00 PM,29-Feb-2024 11:00 AM,14-Feb-2024 05:00 PM,28-Feb-2024 05:00 PM,NA ,NA ,14-Feb-2024 05:00 PM,28-Feb-2024 05:00 PM,06-Mar-2024 11:30 AM,"5,01,600",Yes,fixed,,Nil,Nil,1.0,ICICI BANK,"11,800",0.0,Nil,Nil,No,CHIEF ENGINEER OPHWC,OPHWC BHUBANESWAR,"Constn. of Ama Bus Stand (C type) at Khajuripada under Khajuripada Block, Kandhamal",Building Work,Please refer Tender documents  ,NA ,"5,01,58,129",Civil Works - Buildings,NA ,Tender,90.0,365.0,Kandhamal.,751022.0,NA ,NA ,NA ,OPHWC BHUBANESWAR,No ,No,AOC,20-Mar-2024,"INR 45,147,332.14",365.0,DURGA CHARANA MISHRA,20-Mar-2024 03:05 PM,WOKHAJURIPADA.pdf (505.00 KB),AWARDED AS L1 TENDERER AND AWARDED ON DT 13.03.2024,1.0,2450919.0,JOGENDRA KUMAR MOHANTY,INR,"45,147,332.14",1,2464760,AJAY PRADHAN,28-Feb-2024 04:25 PM,Rejected-Finance,DUE TO L3 BIDDER,20-Mar-2024 03:03 PM,Finance,FINANCIAL BID OPENED,Bikram Keshari Malla,06-Mar-2024 11:50 AM,,BOQ Comparative Chart,AS PER ACCEPTANCE,Internal,AS PER ACCEPTANCE,DURGA CHARANA MISHRA,20-Mar-2024 03:03 PM,finsummary_493105.pdf (384.95 KB),Orissa State Police Housing and Welfare Corporation Ltd,2024_OSPHW_101092_47,42/OPHWC/2023-24,"Constn. of Ama Bus Stand (C type) at Khajuripada under Khajuripada Block, Kandhamal",Technical,FIVE BIDDER HAVE PARTICIPATE,DURGA CHARANA MISHRA,29-Feb-2024 02:50 PM,,AS PER TC MINUTES,Internal,AS PER TC MINUTES,DURGA CHARANA MISHRA,06-Mar-2024 10:25 AM,06-Mar-2024 11:30 AM,techsummary_493105.pdf (109.87 KB),AOC
,,,,,,,,,,,,,,,,.pdf,Other Document as per DTCN,,,,,,,,,,,,,,,,2.0,ICICI NEFT/RTGS,,,,,,,,,,,,,,,,,,,,,,,,,,AOC,,,,,,,,,,,,,2,2464626,AJIT KUMAR RANJIT,28-Feb-2024 02:22 PM,Rejected-Technical,"NON SUBMISSION OF REQUISITE DOCUMENTS AS PER DTCN CLAUSE-13 AND 110(f),CL-11 AND 110(j),CL-12 AND 110(i),CL-10 AND 110(h),CL-10(vi)",06-Mar-2024 10:24 AM,,,,,,,,,,,,,,,,,,,,,,,,,,,,,AOC
,,,,,,,,,,,,,,2.0,Finance,.xls,Bill of Quantity,,,,,,,,,,,,,,,,,,,,,,,,,,,,,,,,,,,,,,,,,,,AOC,,,,,,,,,,,,,3,2450919,JOGENDRA KUMAR MOHANTY,28-Feb-2024 04:40 PM,Accepted-AOC,QUALIFIED BIDDER,20-Mar-2024 03:06 PM,,,,,,,,,,,,,,,,,,,,,,,,,,,,,AOC
,,,,,,,,,,,,,,,,,,,,,,,,,,,,,,,,,,,,,,,,,,,,,,,,,,,,,,,,,,,,AOC,,,,,,,,,,,,,4,2464324,SUBHASHKUMAR S JENA,28-Feb-2024 01:11 PM,Rejected-Finance,DUE TO L2 BIDDER,20-Mar-2024 03:03 PM,,,,,,,,,,,,,,,,,,,,,,,,,,,,,AOC
,,,,,,,,,,,,,,,,,,,,,,,,,,,,,,,,,,,,,,,,,,,,,,,,,,,,,,,,,,,,AOC,,,,,,,,,,,,,5,2464466,Subrata Kumar Mohanty,28-Feb-2024 01:38 PM,Rejected-Technical,NOT HAVING ADEQUATE TURNOVER TO CALCULATE BID CAPACITY AS PER DTCN CLAUSE NO-12 AND 110(i) AND SCH-C i.e. REQUIRED TOOLS AND PLANT AS PER DTCN CLAUSE NO-13 AND 110(f),06-Mar-2024 10:24 AM,,,,,,,,,,,,,,,,,,,,,,,,,,,,,AOC
