Organisation Chain,Tender Reference Number,Tender ID,Withdrawal Allowed,Tender Type,Form of contract,Tender Category,No. of Covers,General Technical Evaluation Allowed,ItemWise Technical Evaluation Allowed,Payment Mode,Is Multi Currency Allowed For BOQ,Is Multi Currency Allowed For Fee,Allow Two Stage Bidding,Cover No,Cover,Document Type,Description,Publish Date,Bid Opening Date,Document Download / Sale Start Date,Document Download / Sale End Date,Clarification Start Date,Clarification End Date,Bid Submission Start Date,Bid Submission End Date,Financial Bid Opening Date,EMD Amount in ₹,EMD Exemption Allowed,EMD Fee Type,EMD Percentage,EMD Payable To,EMD Payable At,S.No,Bank Name,Tender Fee in ₹,VAT Charges in ₹,Fee Payable To,Fee Payable At,Tender Fee Exemption Allowed,Name,Address,Title,Work Description,Pre Qualification Details,Independent External Monitor/Remarks,Tender Value in ₹,Product Category,Sub category,Contract Type,Bid Validity(Days),Period Of Work(Days),Location,Pincode,Pre Bid Meeting Place,Pre Bid Meeting Address,Pre Bid Meeting Date,Bid Opening Place,Should Allow NDA Tender,Allow Preferential Bidder,Tender Stage,Contract Date :,Contract Value :,Work Completion Period in days :,Updated By :,Updated on :,AOC document :,AOC Description :,S.No,Bid Number,Bidder Name,Awarded Currency,Awarded Value,S.No.1,Bid Number.1,Bidder Name.1,Submitted Date,Status,Remarks,Status Updated On,Type :,Summary :,Updated By :.1,Updated On :,Document :,BOQ Comparative Chart :,Committee Chairperson/Co-ordinator Name :,Committee Chairperson/Co-ordinator Type :,Committee Members :,Updated By :.2,Updated on :.1,Document :.1,Organisation Chain :,Tender ID :,Tender Ref No :,Tender Title :,Type :.1,Summary :.1,Updated By :.3,Updated On :.1,Document :.2,Committee Chairperson/Co-ordinator Name :.1,Committee Chairperson/Co-ordinator Type :.1,Committee Members :.1,Updated By :.4,Updated On :.2,Financial Bid Opening Date:,Document :.3,Tender Stage
EIC-CIVIL,CE-DPI AND R- 33/2023-24,2024_EICCL_99421_41,Yes,Open Tender,Percentage,Works,2.0,No,No,Online,No,No,No,1.0,Fee/PreQual/Technical,.pdf,"Online proof copy of Tender Cost and EMD, GSTIN, PAN, RC and Affidavit",11-Jan-2024 06:30 PM,25-Jan-2024 04:35 PM,11-Jan-2024 06:30 PM,25-Jan-2024 04:30 PM,NA ,NA ,11-Jan-2024 06:30 PM,25-Jan-2024 04:30 PM,02-Feb-2024 11:30 AM,"24,46,000",Yes,fixed,,Nil,Nil,1.0,ICICI BANK,"10,000",0.0,Nil,Nil,No,"Chief Engineer, DPI and Roads, Odisha","Office of the E.I.C. Civil, Odisha, Nirman Soudha, New Building, Unit-V, Bhubaneswar.","Improvement to Dasarathpur IB to Susua Shiv Tandav via Chhachina, Nagapatna, Akhusahi road from 0/000 km to 15/000 km in the district of Jajpur under State Plan.","Improvement to Dasarathpur IB to Susua Shiv Tandav via Chhachina, Nagapatna, Akhusahi road from 0/000 km to 15/000 km in the district of Jajpur under State Plan.",Please refer Tender documents. ,NA ,"24,45,76,237",Civil Works - Roads,NA ,Tender,90.0,480.0,Jajpur Dist.,751001.0,NA ,NA ,NA ,"O/o the E.I.C. Civil, Odisha, Bhubaneswar",No ,No,AOC,20-Mar-2024,"INR 220,143,071",480.0,Pradipta Kumar Nayak,20-Mar-2024 08:05 PM,DasrathpurIB.pdf (409.00 KB),1473P1 of 2023-24,1.0,2401434.0,Bhagabati build and constructions Pvt Ltd,INR,"220,143,071",1,2401434,Bhagabati build and constructions Pvt Ltd,25-Jan-2024 12:34 PM,Accepted-AOC,Selected as L1 bidder,20-Mar-2024 08:05 PM,Finance,Finance opening,Pradipta Kumar Nayak,02-Feb-2024 01:35 PM,,BOQ Comparative Chart,CE DPI and R Odisha,Internal,,Pradipta Kumar Nayak,20-Mar-2024 08:02 PM,finsummary_483910.pdf (408.79 KB),EIC-CIVIL,2024_EICCL_99421_41,CE-DPI AND R- 33/2023-24,"Improvement to Dasarathpur IB to Susua Shiv Tandav via Chhachina, Nagapatna, Akhusahi road from 0/000 km to 15/000 km in the district of Jajpur under State Plan.",Technical,Opening,Pradipta Kumar Nayak,25-Jan-2024 07:45 PM,,EIC Civil Odisha,Internal,,Pradipta Kumar Nayak,01-Feb-2024 05:17 PM,02-Feb-2024 11:30 AM,techsummary_483910.pdf (180.81 KB),AOC
,,,,,,,,,,,,,,,,.pdf,Machineries and work experience,,,,,,,,,,,,,,,,2.0,ICICI NEFT/RTGS,,,,,,,,,,,,,,,,,,,,,,,,,,AOC,,,,,,,,,,,,,2,2402811,BP Constructions and Engineers PVT. LTD.,23-Jan-2024 07:14 PM,Rejected-AOC,L2 bidder,20-Mar-2024 08:05 PM,,,,,,,,,,,,,,,,,,,,,,,,,,,,,AOC
,,,,,,,,,,,,,,,,.pdf,Other documents as per DTCN,,,,,,,,,,,,,,,,,,,,,,,,,,,,,,,,,,,,,,,,,,,AOC,,,,,,,,,,,,,3,2404319,MESSERS BIRAJA CONSTRUCTION,25-Jan-2024 02:31 PM,Rejected-Finance,Other than L1 and L2 bidder,20-Mar-2024 08:02 PM,,,,,,,,,,,,,,,,,,,,,,,,,,,,,AOC
,,,,,,,,,,,,,,2.0,Finance,.xls,Bill of quantities,,,,,,,,,,,,,,,,,,,,,,,,,,,,,,,,,,,,,,,,,,,AOC,,,,,,,,,,,,,4,2398377,M/S RAJ CONSTRUCTION,19-Jan-2024 05:41 PM,Rejected-AOC,L1 bidder,20-Mar-2024 08:05 PM,,,,,,,,,,,,,,,,,,,,,,,,,,,,,AOC
,,,,,,,,,,,,,,,,,,,,,,,,,,,,,,,,,,,,,,,,,,,,,,,,,,,,,,,,,,,,AOC,,,,,,,,,,,,,5,2404806,TARINI CONDEV PRIVATE LIMITED,25-Jan-2024 02:25 PM,Rejected-Finance,Other than L1 and L2 bidder,20-Mar-2024 08:02 PM,,,,,,,,,,,,,,,,,,,,,,,,,,,,,AOC
