Organisation Chain,Tender Reference Number,Tender ID,Withdrawal Allowed,Tender Type,Form of contract,Tender Category,No. of Covers,General Technical Evaluation Allowed,ItemWise Technical Evaluation Allowed,Payment Mode,Is Multi Currency Allowed For BOQ,Is Multi Currency Allowed For Fee,Allow Two Stage Bidding,Cover No,Cover,Document Type,Description,Publish Date,Bid Opening Date,Document Download / Sale Start Date,Document Download / Sale End Date,Clarification Start Date,Clarification End Date,Bid Submission Start Date,Bid Submission End Date,Financial Bid Opening Date,EMD Amount in ₹,EMD Exemption Allowed,EMD Fee Type,EMD Percentage,EMD Payable To,EMD Payable At,S.No,Bank Name,Tender Fee in ₹,VAT Charges in ₹,Fee Payable To,Fee Payable At,Tender Fee Exemption Allowed,Name,Address,Title,Work Description,Pre Qualification Details,Independent External Monitor/Remarks,Tender Value in ₹,Product Category,Sub category,Contract Type,Bid Validity(Days),Period Of Work(Days),Location,Pincode,Pre Bid Meeting Place,Pre Bid Meeting Address,Pre Bid Meeting Date,Bid Opening Place,Should Allow NDA Tender,Allow Preferential Bidder,Tender Stage,Contract Date :,Contract Value :,Work Completion Period in days :,Updated By :,Updated on :,AOC document :,AOC Description :,S.No,Bid Number,Bidder Name,Awarded Currency,Awarded Value,S.No.1,Bid Number.1,Bidder Name.1,Submitted Date,Status,Remarks,Status Updated On,Type :,Summary :,Updated By :.1,Updated On :,Document :,BOQ Comparative Chart :,Committee Chairperson/Co-ordinator Name :,Committee Chairperson/Co-ordinator Type :,Committee Members :,Updated By :.2,Updated on :.1,Document :.1,Organisation Chain :,Tender ID :,Tender Ref No :,Tender Title :,Type :.1,Summary :.1,Updated By :.3,Updated On :.1,Document :.2,Committee Chairperson/Co-ordinator Name :.1,Committee Chairperson/Co-ordinator Type :.1,Committee Members :.1,Updated By :.4,Updated On :.2,Financial Bid Opening Date:,Document :.3,Tender Stage
EIC-CIVIL,CE-DPI AND R- 24/2023-24,2023_EICCL_95012_2,Yes,Open Tender,Percentage,Works,2.0,No,No,Online,No,No,No,1.0,Fee/PreQual/Technical,.pdf,"Online proof copy of Tender Cost and EMD, GSTIN, PAN, RC and Affidavit",02-Oct-2023 12:40 PM,17-Oct-2023 11:00 AM,02-Oct-2023 12:40 PM,16-Oct-2023 05:30 PM,NA ,NA ,02-Oct-2023 12:40 PM,16-Oct-2023 05:30 PM,11-Dec-2023 12:30 PM,"12,78,000",Yes,fixed,,Nil,Nil,1.0,ICICI BANK,"10,000",0.0,Nil,Nil,No,"Chief Engineer, DPI and Roads, Odisha","Office of the E.I.C. Civil, Odisha, Nirman Soudha, New Building, Unit-V, Bhubaneswar",Improvement of Keshapali-Badamal road from 9/000 km to 18/000 km in the district of Sambalpur under State Plan,Improvement of Keshapali-Badamal road from 9/000 km to 18/000 km in the district of Sambalpur under State Plan,Please refer Tender documents. ,NA ,"12,78,23,676",Civil Works - Roads,NA ,Tender,90.0,365.0,Sambalpur Dist,751001.0,NA ,NA ,NA ,"O/o the E.I.C. Civil, Odisha, Bhubaneswar",No ,No,AOC,01-Mar-2024,"INR 127,823,676",365.0,Pradipta Kumar Nayak,30-Mar-2024 11:43 AM,Keshapali.pdf (113.00 KB),1316P1 of 2023-24,1.0,2289343.0,SHANTI CONSTRUCTION SAMBALPUR PVT. LTD.,INR,"115,054,091",1,2287911,Ashok Kumar Jalan,14-Oct-2023 05:30 PM,Rejected-AOC,L2 bidder,30-Mar-2024 11:43 AM,Finance,Finance opening,Siba Prasad Panigrahy,11-Dec-2023 12:43 PM,,BOQ Comparative Chart,CE DPI and R Odisha,Internal,,Pradipta Kumar Nayak,30-Jan-2024 04:36 PM,finsummary_465063.pdf (77.34 KB),EIC-CIVIL,2023_EICCL_95012_2,CE-DPI AND R- 24/2023-24,Improvement of Keshapali-Badamal road from 9/000 km to 18/000 km in the district of Sambalpur under State Plan,Technical,Opening of tender,Pradipta Kumar Nayak,17-Oct-2023 01:01 PM,,EIC Civil Odisha,Internal,,Pradipta Kumar Nayak,08-Dec-2023 04:32 PM,11-Dec-2023 12:30 PM,techsummary_465063.pdf (147.31 KB),AOC
,,,,,,,,,,,,,,,,.pdf,Machineries and work experience,,,,,,,,,,,,,,,,2.0,ICICI NEFT/RTGS,,,,,,,,,,,,,,,,,,,,,,,,,,AOC,,,,,,,,,,,,,2,2287310,M/S SUMEET & ASSOCIATES,16-Oct-2023 01:42 PM,Rejected-AOC,L1 bidder,30-Mar-2024 11:43 AM,,,,,,,,,,,,,,,,,,,,,,,,,,,,,AOC
,,,,,,,,,,,,,,,,.pdf,Other documents as per DTCN,,,,,,,,,,,,,,,,,,,,,,,,,,,,,,,,,,,,,,,,,,,AOC,,,,,,,,,,,,,3,2288776,Paban Kumar Agrawal,16-Oct-2023 03:23 PM,Rejected-Finance,Other than L1 and L2 bidder,30-Jan-2024 04:36 PM,,,,,,,,,,,,,,,,,,,,,,,,,,,,,AOC
,,,,,,,,,,,,,,2.0,Finance,.xls,Bill of quantities,,,,,,,,,,,,,,,,,,,,,,,,,,,,,,,,,,,,,,,,,,,AOC,,,,,,,,,,,,,4,2284701,PRASANTA KUMAR SAMANTRAY,16-Oct-2023 10:53 AM,Rejected-Finance,Other than L1 and L2 bidder,30-Jan-2024 04:36 PM,,,,,,,,,,,,,,,,,,,,,,,,,,,,,AOC
,,,,,,,,,,,,,,,,,,,,,,,,,,,,,,,,,,,,,,,,,,,,,,,,,,,,,,,,,,,,AOC,,,,,,,,,,,,,5,2289838,Santosh Kumar Mishra,16-Oct-2023 05:25 PM,Rejected-AOC,L1 bidder,30-Mar-2024 11:43 AM,,,,,,,,,,,,,,,,,,,,,,,,,,,,,AOC
,,,,,,,,,,,,,,,,,,,,,,,,,,,,,,,,,,,,,,,,,,,,,,,,,,,,,,,,,,,,AOC,,,,,,,,,,,,,6,2289343,SHANTI CONSTRUCTION SAMBALPUR PVT. LTD.,16-Oct-2023 04:54 PM,Accepted-AOC,Selected as L1 bidder,30-Mar-2024 11:43 AM,,,,,,,,,,,,,,,,,,,,,,,,,,,,,AOC
