Organisation Chain,Tender Reference Number,Tender ID,Withdrawal Allowed,Tender Type,Form of contract,Tender Category,No. of Covers,General Technical Evaluation Allowed,ItemWise Technical Evaluation Allowed,Payment Mode,Is Multi Currency Allowed For BOQ,Is Multi Currency Allowed For Fee,Allow Two Stage Bidding,Cover No,Cover,Document Type,Description,Publish Date,Bid Opening Date,Document Download / Sale Start Date,Document Download / Sale End Date,Clarification Start Date,Clarification End Date,Bid Submission Start Date,Bid Submission End Date,Financial Bid Opening Date,EMD Amount in ₹,EMD Exemption Allowed,EMD Fee Type,EMD Percentage,EMD Payable To,EMD Payable At,S.No,Bank Name,Tender Fee in ₹,VAT Charges in ₹,Fee Payable To,Fee Payable At,Tender Fee Exemption Allowed,Name,Address,Title,Work Description,Pre Qualification Details,Independent External Monitor/Remarks,Tender Value in ₹,Product Category,Sub category,Contract Type,Bid Validity(Days),Period Of Work(Days),Location,Pincode,Pre Bid Meeting Place,Pre Bid Meeting Address,Pre Bid Meeting Date,Bid Opening Place,Should Allow NDA Tender,Allow Preferential Bidder,Tender Stage,Contract Date :,Contract Value :,Work Completion Period in days :,Updated By :,Updated on :,AOC document :,AOC Description :,S.No,Bid Number,Bidder Name,Awarded Currency,Awarded Value,S.No.1,Bid Number.1,Bidder Name.1,Submitted Date,Status,Remarks,Status Updated On,Type :,Summary :,Updated By :.1,Updated On :,Document :,BOQ Comparative Chart :,Committee Chairperson/Co-ordinator Name :,Committee Chairperson/Co-ordinator Type :,Committee Members :,Updated By :.2,Updated on :.1,Document :.1,Organisation Chain :,Tender ID :,Tender Ref No :,Tender Title :,Type :.1,Summary :.1,Updated By :.3,Updated On :.1,Document :.2,Committee Chairperson/Co-ordinator Name :.1,Committee Chairperson/Co-ordinator Type :.1,Committee Members :.1,Updated By :.4,Updated On :.2,Financial Bid Opening Date:,Document :.3,S.No.2,Revocation Title,Revocation Description,Published Date,Document Name,Document Size(in KB),Revocated To,Tender Stage
EIC-CIVIL||SERNB-CIRCLE-EASTERN,CCEEC-13/2023-24,2023_EICCL_92133_4,Yes,Open Tender,Percentage,Works,2.0,No,No,Online,No,No,No,1.0,Fee/PreQual/Technical,.pdf,"Online payment receipt of Paper cost, EMD ONLINE PAPER RECEIVED, GSTIN, PAN, Registration Certificat",11-Aug-2023 10:00 AM,28-Aug-2023 11:00 AM,11-Aug-2023 10:00 AM,25-Aug-2023 05:00 PM,NA ,NA ,11-Aug-2023 10:00 AM,25-Aug-2023 05:00 PM,16-Oct-2023 11:30 AM,"7,78,500",Yes,fixed,,Nil,Nil,1.0,ICICI BANK,"10,000",0.0,Nil,Nil,No,"Office of the CCEEC R and B Balasore, Station Road","Office of the CCEEC R and B Balasore, Station Road",Improvement such as Widening and Strengthening of PWD Road to Chakradharpur via Kuradiha from 0.000Km to 4.130Km in the district of Mayurbhanj for the year 2023-24.,Improvement such as Widening and Strengthening of PWD Road to Chakradharpur via Kuradiha from 0.000Km to 4.130Km in the district of Mayurbhanj for the year 2023-24.,Please refer Tender documents. ,NA ,,Civil Works - Roads,Road Works ,Tender,90.0,240.0,Baripada,757001.0,NA ,NA ,NA ,"Office of the CCEEC R and B Balasore, Station Road",No ,No,AOC,07-Mar-2024,"INR 77,847,750.045",240.0,Rathangadhar Rout,07-Mar-2024 12:50 PM,Agmt_Chakaradharpur1434.pdf (292.00 KB),AOC,1.0,2217023.0,KIRAN KUMAR DAS,INR,"66,178,372.313",1,2211408,AJAY KUMAR ROUT,25-Aug-2023 04:21 PM,Rejected-Finance,Looser of the transparent lottery system.,07-Mar-2024 12:47 PM,Finance,Admitted for Financial Acceptance.,Rathangadhar Rout,07-Mar-2024 12:41 PM,finance_447353.pdf,BOQ Comparative Chart,Er RATHANGDHAR ROUT (CCEEC RNB BALASORE),Internal,"Er RATHANGDHAR ROUT (CCEEC RNB BALASORE),Er R G Ray (E.E RNB MAYURBHANJ),Justin J.S.G. Richards (D.A.O MAYURBHANJ),Er P.K. BEHERA (E.E. CCE,EC,BLS), Er S.P. Das (A.E.E. ESTIMATOR).",Rathangadhar Rout,07-Mar-2024 12:47 PM,finsummary_447353.pdf (292.47 KB),EIC-CIVIL||SERNB-CIRCLE-EASTERN,2023_EICCL_92133_4,CCEEC-13/2023-24,Improvement such as Widening and Strengthening of PWD Road to Chakradharpur via Kuradiha from 0.000Km to 4.130Km in the district of Mayurbhanj for the year 2023-24.,Technical,Admitted for Technical Evaluation.,Anil Kumar Das,13-Oct-2023 06:53 PM,technical_447353.pdf,Er RATHANGDHAR ROUT (CCEEC RNB BALASORE),Internal,"Er RATHANGDHAR ROUT (CCEEC RNB BALASORE),Er R G Ray (E.E RNB MAYURBHANJ),Justin J.S.G. Richards (D.A.O MAYURBHANJ),Er P.K. BEHERA (E.E. CCE,EC,BLS), Er S.P. Das (A.E.E. ESTIMATOR).",Anil Kumar Das,13-Oct-2023 07:03 PM,16-Oct-2023 11:30 AM,techsummary_447353.pdf (1610.04 KB),1.0,Revocation of Tender,After getting a complain regarding some discrepancies from one of the bidder for the following work a committee comprising following members unanimously opined for revocation.,13-Oct-2023 06:39 PM,Revocation.pdf ,602.11,Technical Opening,AOC
,,,,,,,,,,,,,,,,.pdf,"No relation Certificates, work experience, work in hand and other documents as per DTCN.",,,,,,,,,,,,,,,,2.0,ICICI NEFT/RTGS,,,,,,,,,,,,,,,,,,,,,,,,,,AOC,,,,,,,,,,,,,2,2217023,KIRAN KUMAR DAS,24-Aug-2023 10:01 PM,Accepted-AOC,Work awarded,07-Mar-2024 12:50 PM,,,,,,,,,,,,,,,,,,,,,,,,,,,,,,,,,,,,AOC
,,,,,,,,,,,,,,,,.pdf,"Machineries as per DTCN, affidavit for Schedule F, information as per Schedule E.",,,,,,,,,,,,,,,,,,,,,,,,,,,,,,,,,,,,,,,,,,,AOC,,,,,,,,,,,,,3,2209029,MESSERS ADAITYA CONSTRUCTION COMPANY,22-Aug-2023 09:43 PM,Rejected-Finance,Looser of the transparent lottery system.,07-Mar-2024 12:47 PM,,,,,,,,,,,,,,,,,,,,,,,,,,,,,,,,,,,,AOC
,,,,,,,,,,,,,,2.0,Finance,.xls,Bill of Quantity,,,,,,,,,,,,,,,,,,,,,,,,,,,,,,,,,,,,,,,,,,,AOC,,,,,,,,,,,,,4,2217188,MESSERS S P CONSTRUCTION,25-Aug-2023 02:57 PM,Rejected-Finance,Looser of the transparent lottery system.,07-Mar-2024 12:47 PM,,,,,,,,,,,,,,,,,,,,,,,,,,,,,,,,,,,,AOC
,,,,,,,,,,,,,,,,,,,,,,,,,,,,,,,,,,,,,,,,,,,,,,,,,,,,,,,,,,,,AOC,,,,,,,,,,,,,5,2213959,M/S BIG BUILD INFRASTRUCTURE & CO,25-Aug-2023 02:05 PM,Rejected-Finance,Looser of the transparent lottery system.,07-Mar-2024 12:47 PM,,,,,,,,,,,,,,,,,,,,,,,,,,,,,,,,,,,,AOC
,,,,,,,,,,,,,,,,,,,,,,,,,,,,,,,,,,,,,,,,,,,,,,,,,,,,,,,,,,,,AOC,,,,,,,,,,,,,6,2212284,Nanda Kishore Bindhani,24-Aug-2023 07:07 PM,Rejected-Finance,3rd lowest bidder,07-Mar-2024 12:47 PM,,,,,,,,,,,,,,,,,,,,,,,,,,,,,,,,,,,,AOC
,,,,,,,,,,,,,,,,,,,,,,,,,,,,,,,,,,,,,,,,,,,,,,,,,,,,,,,,,,,,AOC,,,,,,,,,,,,,7,2213008,SANTOSH KUMAR SAHOO,23-Aug-2023 04:38 PM,Rejected-Finance,Looser of the transparent lottery system.,07-Mar-2024 12:47 PM,,,,,,,,,,,,,,,,,,,,,,,,,,,,,,,,,,,,AOC
,,,,,,,,,,,,,,,,,,,,,,,,,,,,,,,,,,,,,,,,,,,,,,,,,,,,,,,,,,,,AOC,,,,,,,,,,,,,8,2210444,SRI BIBHAS CHANDRA BEHERA,25-Aug-2023 03:07 PM,Rejected-Finance,Looser of the transparent lottery system.,07-Mar-2024 12:47 PM,,,,,,,,,,,,,,,,,,,,,,,,,,,,,,,,,,,,AOC
,,,,,,,,,,,,,,,,,,,,,,,,,,,,,,,,,,,,,,,,,,,,,,,,,,,,,,,,,,,,AOC,,,,,,,,,,,,,9,2214019,TARUN MOHANTY,25-Aug-2023 04:14 PM,Rejected-Finance,Looser of the transparent lottery system.,07-Mar-2024 12:47 PM,,,,,,,,,,,,,,,,,,,,,,,,,,,,,,,,,,,,AOC
