Organisation Chain,Tender Reference Number,Tender ID,Withdrawal Allowed,Tender Type,Form of contract,Tender Category,No. of Covers,General Technical Evaluation Allowed,ItemWise Technical Evaluation Allowed,Payment Mode,Is Multi Currency Allowed For BOQ,Is Multi Currency Allowed For Fee,Allow Two Stage Bidding,Cover No,Cover,Document Type,Description,Publish Date,Bid Opening Date,Document Download / Sale Start Date,Document Download / Sale End Date,Clarification Start Date,Clarification End Date,Bid Submission Start Date,Bid Submission End Date,Financial Bid Opening Date,EMD Amount in ₹,EMD Exemption Allowed,EMD Fee Type,EMD Percentage,EMD Payable To,EMD Payable At,S.No,Bank Name,Tender Fee in ₹,VAT Charges in ₹,Fee Payable To,Fee Payable At,Tender Fee Exemption Allowed,Name,Address,Title,Work Description,Pre Qualification Details,Independent External Monitor/Remarks,Tender Value in ₹,Product Category,Sub category,Contract Type,Bid Validity(Days),Period Of Work(Days),Location,Pincode,Pre Bid Meeting Place,Pre Bid Meeting Address,Pre Bid Meeting Date,Bid Opening Place,Should Allow NDA Tender,Allow Preferential Bidder,Tender Stage,Contract Date :,Contract Value :,Work Completion Period in days :,Updated By :,Updated on :,AOC document :,S.No,Bid Number,Bidder Name,Awarded Currency,Awarded Value,S.No.1,Bid Number.1,Bidder Name.1,Submitted Date,Status,Remarks,Status Updated On,Type :,Summary :,Updated By :.1,Updated On :,Document :,BOQ Comparative Chart :,Committee Chairperson/Co-ordinator Name :,Committee Chairperson/Co-ordinator Type :,Committee Members :,Updated By :.2,Updated on :.1,Document :.1,Organisation Chain :,Tender ID :,Tender Ref No :,Tender Title :,Type :.1,Summary :.1,Updated By :.3,Updated On :.1,Document :.2,Committee Chairperson/Co-ordinator Name :.1,Committee Chairperson/Co-ordinator Type :.1,Committee Members :.1,Updated By :.4,Updated On :.2,Financial Bid Opening Date:,Document :.3,Tender Stage
EIC-CIVIL||SERNB-CIRCLE-BOLANGIR,CCE (R and B) BGR-12-2023-24,2023_EICCL_92164_5,Yes,National Competitive Bid,Percentage,Works,2.0,No,No,Online,No,No,No,1.0,Fee/PreQual/Technical,.pdf,"Online proof copy of tender paper cost and EMD, GSTIN, PAN, RC and Affidavit.",10-Aug-2023 06:55 PM,28-Aug-2023 11:00 AM,10-Aug-2023 06:55 PM,25-Aug-2023 05:00 PM,10-Aug-2023 06:55 PM ,17-Aug-2023 05:00 PM ,10-Aug-2023 06:55 PM,25-Aug-2023 05:00 PM,02-Dec-2023 11:00 AM,"3,50,000",Yes,fixed,,Nil,Nil,1.0,ICICI BANK,"10,000",0.0,Nil,Nil,No,"CCE, Balangir (R and B) Circle, Balangir","O/o CCE, Balangir (R and B) Circle, Balangir",Construction of 100 Bedded Boys Hostel Building in Odisha Adarsha Vidyalaya at Belpada under Bharuamunda Block in Bolangir District.,Building Work,Please refer Tender documents. ,NA ,"3,49,90,933",Civil Works - Buildings,NA ,Tender,90.0,330.0,Kantabanji,767039.0,NA ,NA ,NA ,"O/o CCE, Balangir (R and B) Circle, Balangir",No ,No,AOC,19-Feb-2024,"INR 29,745,792",330.0,Basistha Kumar Pattanaik,12-Mar-2024 04:44 PM,1115p1.pdf (721.00 KB),1.0,2211544.0,Sanjaya Kumar Agrawal,INR,"29,745,792",1,2217149,HAZI MOHAMMAD SAKIL,25-Aug-2023 03:31 PM,Rejected-Finance,As per DTCN,31-Jan-2024 06:58 PM,Finance,The Financial bids of 05 (Five) Nos. of bidders are opened for further consideration.,Santosh Kumar Behera,02-Dec-2023 11:56 AM,finance_447605.pdf,BOQ Comparative Chart,B K Pattanaik,Internal,,Basistha Kumar Pattanaik,31-Jan-2024 06:58 PM,finsummary_447605.pdf (1084.73 KB),EIC-CIVIL||SERNB-CIRCLE-BOLANGIR,2023_EICCL_92164_5,CCE (R and B) BGR-12-2023-24,Construction of 100 Bedded Boys Hostel Building in Odisha Adarsha Vidyalaya at Belpada under Bharuamunda Block in Bolangir District.,Technical,The Technical bids of 05 (Five) Nos. of bidders are opened for further consideration.,Basistha Kumar Pattanaik,28-Aug-2023 11:58 AM,,B K Pattanaik,Internal,,Basistha Kumar Pattanaik,30-Nov-2023 05:26 PM,02-Dec-2023 11:00 AM,techsummary_447605.pdf (634.82 KB),AOC
,,,,,,,,,,,,,,,,.pdf,Machineries and work Experience.,,,,,,,,,,,,,,,,2.0,ICICI NEFT/RTGS,,,,,,,,,,,,,,,,,,,,,,,,,,AOC,,,,,,,,,,,,2,2211544,Sanjaya Kumar Agrawal,25-Aug-2023 11:52 AM,Accepted-AOC,As per DTCN,12-Mar-2024 04:45 PM,,,,,,,,,,,,,,,,,,,,,,,,,,,,,AOC
,,,,,,,,,,,,,,,,.pdf,Other documents as per DTCN.,,,,,,,,,,,,,,,,,,,,,,,,,,,,,,,,,,,,,,,,,,,AOC,,,,,,,,,,,,3,2217525,SHAKTI PRASAD THATI,25-Aug-2023 01:31 PM,Rejected-Finance,As per DTCN,31-Jan-2024 06:58 PM,,,,,,,,,,,,,,,,,,,,,,,,,,,,,AOC
,,,,,,,,,,,,,,2.0,Finance,.xls,Bill of Quantity.,,,,,,,,,,,,,,,,,,,,,,,,,,,,,,,,,,,,,,,,,,,AOC,,,,,,,,,,,,4,2217368,SOBIKA AGRAWAL,25-Aug-2023 03:16 PM,Rejected-Finance,As per DTCN,31-Jan-2024 06:58 PM,,,,,,,,,,,,,,,,,,,,,,,,,,,,,AOC
,,,,,,,,,,,,,,,,,,,,,,,,,,,,,,,,,,,,,,,,,,,,,,,,,,,,,,,,,,,,AOC,,,,,,,,,,,,5,2216231,Tanay Kumar Agrawal,24-Aug-2023 02:20 PM,Rejected-Finance,As per DTCN,31-Jan-2024 06:58 PM,,,,,,,,,,,,,,,,,,,,,,,,,,,,,AOC
