Organisation Chain,Tender Reference Number,Tender ID,Withdrawal Allowed,Tender Type,Form of contract,Tender Category,No. of Covers,General Technical Evaluation Allowed,ItemWise Technical Evaluation Allowed,Payment Mode,Is Multi Currency Allowed For BOQ,Is Multi Currency Allowed For Fee,Allow Two Stage Bidding,Cover No,Cover,Document Type,Description,Publish Date,Bid Opening Date,Document Download / Sale Start Date,Document Download / Sale End Date,Clarification Start Date,Clarification End Date,Bid Submission Start Date,Bid Submission End Date,Financial Bid Opening Date,EMD Amount in ₹,EMD Exemption Allowed,EMD Fee Type,EMD Percentage,EMD Payable To,EMD Payable At,S.No,Bank Name,Tender Fee in ₹,VAT Charges in ₹,Fee Payable To,Fee Payable At,Tender Fee Exemption Allowed,Name,Address,Title,Work Description,Pre Qualification Details,Independent External Monitor/Remarks,Tender Value in ₹,Product Category,Sub category,Contract Type,Bid Validity(Days),Period Of Work(Days),Location,Pincode,Pre Bid Meeting Place,Pre Bid Meeting Address,Pre Bid Meeting Date,Bid Opening Place,Should Allow NDA Tender,Allow Preferential Bidder,Tender Stage,Contract Date :,Contract Value :,Work Completion Period in days :,Updated By :,Updated on :,AOC document :,AOC Description :,S.No,Bid Number,Bidder Name,Awarded Currency,Awarded Value,S.No.1,Bid Number.1,Bidder Name.1,Submitted Date,Status,Remarks,Status Updated On,Type :,Summary :,Updated By :.1,Updated On :,Document :,BOQ Comparative Chart :,Committee Chairperson/Co-ordinator Name :,Committee Chairperson/Co-ordinator Type :,Committee Members :,Updated By :.2,Updated on :.1,Document :.1,Organisation Chain :,Tender ID :,Tender Ref No :,Tender Title :,Type :.1,Summary :.1,Updated By :.3,Updated On :.1,Document :.2,Committee Chairperson/Co-ordinator Name :.1,Committee Chairperson/Co-ordinator Type :.1,Committee Members :.1,Updated By :.4,Updated On :.2,Financial Bid Opening Date:,Document :.3,Tender Stage
EIC-CIVIL||SERNB-CIRCLE-EASTERN,CCEEC-19/2023-24,2023_EICCL_94837_6,Yes,Open Tender,Percentage,Works,2.0,No,No,Online,No,No,No,1.0,Fee/PreQual/Technical,.pdf,"Online payment receipt of Paper cost, EMD ONLINE PAPER RECEIVED, GSTIN, PAN, Registration Certificat",27-Sep-2023 10:00 AM,13-Oct-2023 11:00 AM,27-Sep-2023 10:00 AM,12-Oct-2023 05:00 PM,NA ,NA ,27-Sep-2023 10:00 AM,12-Oct-2023 05:00 PM,08-Nov-2023 11:00 AM,"5,95,400",Yes,fixed,,Nil,Nil,1.0,ICICI BANK,"10,000",0.0,Nil,Nil,No,"Office of the CCEEC R and B Balasore, Station Road","Office of the CCEEC R and B Balasore, Station Road",Construction of H.L. Bridge (Box Cell Bridge of 4/87m) over Khejuria Nallah at 14/300 Km on Baripada Chitrada Amarda railway Station Road in the District of Mayurbhanj under State Plan for the year 2023-24.,Construction of H.L. Bridge (Box Cell Bridge of 4/87m) over Khejuria Nallah at 14/300 Km on Baripada Chitrada Amarda railway Station Road in the District of Mayurbhanj under State Plan for the year 2023-24.,Please refer Tender documents. ,NA ,,Civil Works - Bridges,Bridges Works ,Tender,90.0,540.0,Baripada,757001.0,NA ,NA ,NA ,"Office of the CCEEC R and B Balasore, Station Road",No ,No,AOC,11-Mar-2024,"INR 59,537,450.06",540.0,Rathangadhar Rout,11-Mar-2024 04:49 PM,Agmt_Kejuria_Nallah.pdf (86.00 KB),AOC,1.0,2284514.0,SRI BIBHAS CHANDRA BEHERA,INR,"50,612,786.296",1,2285120,LALIT KUMAR MOHANTY,12-Oct-2023 02:05 PM,Rejected-Finance,2nd lowest bidder,11-Mar-2024 04:47 PM,Finance,Admitted for Financial Acceptance.,Rathangadhar Rout,11-Mar-2024 04:44 PM,finance_464310.pdf,BOQ Comparative Chart,Er RATHANGDHAR ROUT (CCEEC RNB BALASORE),Internal,"Er RATHANGDHAR ROUT (CCEEC RNB BALASORE),Er R G Ray (E.E RNB MAYURBHANJ),Justin J.S.G. Richards (D.A.O MAYURBHANJ),Er P.K. BEHERA (E.E. CCE,EC,BLS), Er S.P. Das (A.E.E. ESTIMATOR).",Rathangadhar Rout,11-Mar-2024 04:47 PM,finsummary_464310.pdf (86.47 KB),EIC-CIVIL||SERNB-CIRCLE-EASTERN,2023_EICCL_94837_6,CCEEC-19/2023-24,Construction of H.L. Bridge (Box Cell Bridge of 4/87m) over Khejuria Nallah at 14/300 Km on Baripada Chitrada Amarda railway Station Road in the District of Mayurbhanj under State Plan for the year 2023-24.,Technical,Admitted for Technical Evaluation.,Sarada Prasanna Das,06-Nov-2023 02:11 PM,technical_464310.pdf,Er RATHANGDHAR ROUT (CCEEC RNB BALASORE),Internal,"Er RATHANGDHAR ROUT (CCEEC RNB BALASORE),Er R G Ray (E.E RNB MAYURBHANJ),Justin J.S.G. Richards (D.A.O MAYURBHANJ),Er P.K. BEHERA (E.E. CCE,EC,BLS), Er S.P. Das (A.E.E. ESTIMATOR).",Sarada Prasanna Das,06-Nov-2023 02:13 PM,08-Nov-2023 11:00 AM,techsummary_464310.pdf (1454.33 KB),AOC
,,,,,,,,,,,,,,,,.pdf,"No relation Certificates, work experience, work in hand and other documents as per DTCN.",,,,,,,,,,,,,,,,2.0,ICICI NEFT/RTGS,,,,,,,,,,,,,,,,,,,,,,,,,,AOC,,,,,,,,,,,,,2,2285777,PURUSOTTAM BEHERA,12-Oct-2023 08:51 AM,Rejected-Finance,2nd lowest bidder,11-Mar-2024 04:47 PM,,,,,,,,,,,,,,,,,,,,,,,,,,,,,AOC
,,,,,,,,,,,,,,,,.pdf,"Machineries as per DTCN, affidavit for Schedule F, information as per Schedule E.",,,,,,,,,,,,,,,,,,,,,,,,,,,,,,,,,,,,,,,,,,,AOC,,,,,,,,,,,,,3,2285725,SIDDHARTHA SANKAR PANDA,11-Oct-2023 11:58 PM,Rejected-Finance,2nd lowest bidder,11-Mar-2024 04:47 PM,,,,,,,,,,,,,,,,,,,,,,,,,,,,,AOC
,,,,,,,,,,,,,,2.0,Finance,.xls,Bill of Quantity,,,,,,,,,,,,,,,,,,,,,,,,,,,,,,,,,,,,,,,,,,,AOC,,,,,,,,,,,,,4,2284514,SRI BIBHAS CHANDRA BEHERA,12-Oct-2023 03:21 PM,Accepted-AOC,Work awarded,11-Mar-2024 04:49 PM,,,,,,,,,,,,,,,,,,,,,,,,,,,,,AOC
,,,,,,,,,,,,,,,,,,,,,,,,,,,,,,,,,,,,,,,,,,,,,,,,,,,,,,,,,,,,AOC,,,,,,,,,,,,,5,2285876,TAPASH KUMAR SAHU,12-Oct-2023 10:00 AM,Rejected-Finance,3rd lowest bidder,11-Mar-2024 04:47 PM,,,,,,,,,,,,,,,,,,,,,,,,,,,,,AOC
