Organisation Chain,Tender Reference Number,Tender ID,Withdrawal Allowed,Tender Type,Form of contract,Tender Category,No. of Covers,General Technical Evaluation Allowed,ItemWise Technical Evaluation Allowed,Payment Mode,Is Multi Currency Allowed For BOQ,Is Multi Currency Allowed For Fee,Allow Two Stage Bidding,Cover No,Cover,Document Type,Description,Publish Date,Bid Opening Date,Document Download / Sale Start Date,Document Download / Sale End Date,Clarification Start Date,Clarification End Date,Bid Submission Start Date,Bid Submission End Date,EMD Amount in ₹,EMD Exemption Allowed,EMD Fee Type,EMD Percentage,EMD Payable To,EMD Payable At,S.No,Bank Name,Tender Fee in ₹,VAT Charges in ₹,Fee Payable To,Fee Payable At,Tender Fee Exemption Allowed,Name,Address,Title,Work Description,Pre Qualification Details,Independent External Monitor/Remarks,Tender Value in ₹,Product Category,Sub category,Contract Type,Bid Validity(Days),Period Of Work(Days),Location,Pincode,Pre Bid Meeting Place,Pre Bid Meeting Address,Pre Bid Meeting Date,Bid Opening Place,Should Allow NDA Tender,Allow Preferential Bidder,Tender Stage,Contract Date :,Contract Value :,Work Completion Period in days :,Updated By :,Updated on :,AOC document :,AOC Description :,S.No,Bid Number,Bidder Name,Awarded Currency,Awarded Value,S.No.1,Bid Number.1,Bidder Name.1,Submitted Date,Status,Remarks,Status Updated On,Type :,Summary :,Updated By :.1,Updated On :,Document :,BOQ Comparative Chart :,Committee Chairperson/Co-ordinator Name :,Committee Chairperson/Co-ordinator Type :,Committee Members :,Updated By :.2,Updated on :.1,Document :.1,Organisation Chain :,Tender ID :,Tender Ref No :,Tender Title :,Committee Chairperson/Co-ordinator Name :.1,Committee Chairperson/Co-ordinator Type :.1,Committee Members :.1,Updated By :.3,Updated On :.1,Document :.2,Tender Stage
CE RW I||RWCIRCLE-CUTTACK||RWDIVISION-CUTTACK-II,SECTC-II-22 of 2023-24 dt. 24.01.2024,2024_CERWI_100430_2,Yes,National Competitive Bid,Percentage,Works,1.0,No,No,Online,No,No,No,1.0,Fee/PreQual/Technical/Finance,.pdf,"TenderCost,Valid GSTIN, PAN, License,WorkAffidavit,Labour License, Other documents as per DTCN",01-Feb-2024 06:55 PM,09-Feb-2024 11:30 AM,01-Feb-2024 06:55 PM,08-Feb-2024 04:00 PM,NA ,NA ,01-Feb-2024 06:55 PM,08-Feb-2024 04:00 PM,"8,580",Yes,percentage,1.0%,Nil,Nil,1.0,ICICI BANK,"4,000",0.0,Nil,Nil,No,Executive Engineer,"REO Colony, Nayabazar, Potapokhari, Cuttack-753004",S/R to Raghunathpur to Hemamalpur road for the year 2023-24 in the district of Cuttack,S/R to Raghunathpur to Hemamalpur road for the year 2023-24 in the district of Cuttack,Please refer Tender documents. ,NA ,"8,58,000",Civil Works - Roads,NA ,Tender,90.0,15.0,Raghunathpur,754005.0,NA ,NA ,NA ,"O/o the S.E.R.W. Divn-II, Ctc",No ,No,AOC,15-Mar-2024,"INR 729,115",15.0,Abhisek Swain,15-Mar-2024 06:00 PM,AOC-Raghunathpur.pdf (494.00 KB),Agreement,1.0,2424919.0,TARAMANI SETHI,INR,"729,115",1,2428763,BANDITA DAS,08-Feb-2024 01:26 PM,Rejected-Finance,Not qualified in lottery,15-Mar-2024 05:59 PM,Finance,Bid Opening Summary,Abhisek Swain,15-Mar-2024 05:17 PM,,BOQ Comparative Chart,Executive Engineer,Internal,"DAO,AEE(Est),JE(Est)",Abhisek Swain,15-Mar-2024 05:59 PM,finsummary_489068.pdf (199.65 KB),CE RW I||RWCIRCLE-CUTTACK||RWDIVISION-CUTTACK-II,2024_CERWI_100430_2,SECTC-II-22 of 2023-24 dt. 24.01.2024,S/R to Raghunathpur to Hemamalpur road for the year 2023-24 in the district of Cuttack,Executive Engineer,Internal,"DAO,AEE(Est),JE(Est)",Abhisek Swain,15-Mar-2024 05:56 PM,techsummary_489068.pdf (199.65 KB),AOC
,,,,,,,,,,,,,,,,.xls,BOQ,,,,,,,,,,,,,,,2.0,ICICI NEFT/RTGS,,,,,,,,,,,,,,,,,,,,,,,,,,AOC,,,,,,,,,,,,,2,2427344,Lija Rout,07-Feb-2024 05:27 PM,Rejected-Finance,Not qualified in lottery,15-Mar-2024 05:59 PM,,,,,,,,,,,,,,,,,,,,,,,AOC
,,,,,,,,,,,,,,,,,,,,,,,,,,,,,,,,,,,,,,,,,,,,,,,,,,,,,,,,,,,AOC,,,,,,,,,,,,,3,2424852,M/S. RAJ RIYANSH CONSTRUCTIONS,07-Feb-2024 04:35 PM,Rejected-Finance,Not qualified in lottery,15-Mar-2024 05:59 PM,,,,,,,,,,,,,,,,,,,,,,,AOC
,,,,,,,,,,,,,,,,,,,,,,,,,,,,,,,,,,,,,,,,,,,,,,,,,,,,,,,,,,,AOC,,,,,,,,,,,,,4,2428858,RANJITA PAL,08-Feb-2024 01:58 PM,Rejected-Finance,Not qualified in lottery,15-Mar-2024 05:59 PM,,,,,,,,,,,,,,,,,,,,,,,AOC
,,,,,,,,,,,,,,,,,,,,,,,,,,,,,,,,,,,,,,,,,,,,,,,,,,,,,,,,,,,AOC,,,,,,,,,,,,,5,2424919,TARAMANI SETHI,07-Feb-2024 12:45 PM,Accepted-AOC,AOC,15-Mar-2024 06:00 PM,,,,,,,,,,,,,,,,,,,,,,,AOC
