Organisation Chain,Tender Reference Number,Tender ID,Withdrawal Allowed,Tender Type,Form of contract,Tender Category,No. of Covers,General Technical Evaluation Allowed,ItemWise Technical Evaluation Allowed,Payment Mode,Is Multi Currency Allowed For BOQ,Is Multi Currency Allowed For Fee,Allow Two Stage Bidding,Cover No,Cover,Document Type,Description,Publish Date,Bid Opening Date,Document Download / Sale Start Date,Document Download / Sale End Date,Clarification Start Date,Clarification End Date,Bid Submission Start Date,Bid Submission End Date,Financial Bid Opening Date,EMD Amount in ₹,EMD Exemption Allowed,EMD Fee Type,EMD Percentage,EMD Payable To,EMD Payable At,S.No,Corrigendum Title,Corrigendum Type,View,S.No.1,Bank Name,Tender Fee in ₹,VAT Charges in ₹,Fee Payable To,Fee Payable At,Tender Fee Exemption Allowed,Name,Address,Title,Work Description,Pre Qualification Details,Independent External Monitor/Remarks,Tender Value in ₹,Product Category,Sub category,Contract Type,Bid Validity(Days),Period Of Work(Days),Location,Pincode,Pre Bid Meeting Place,Pre Bid Meeting Address,Pre Bid Meeting Date,Bid Opening Place,Should Allow NDA Tender,Allow Preferential Bidder,Tender Stage,Contract Date :,Contract Value :,Work Completion Period in days :,Updated By :,Updated on :,AOC document :,AOC Description :,S.No,Bid Number,Bidder Name,Awarded Currency,Awarded Value,S.No.1,Bid Number.1,Bidder Name.1,Submitted Date,Status,Remarks,Status Updated On,Type :,Summary :,Updated By :.1,Updated On :,Document :,BOQ Comparative Chart :,Committee Chairperson/Co-ordinator Name :,Committee Chairperson/Co-ordinator Type :,Committee Members :,Updated By :.2,Updated on :.1,Document :.1,Organisation Chain :,Tender ID :,Tender Ref No :,Tender Title :,Type :.1,Summary :.1,Updated By :.3,Updated On :.1,Document :.2,Committee Chairperson/Co-ordinator Name :.1,Committee Chairperson/Co-ordinator Type :.1,Committee Members :.1,Updated By :.4,Updated On :.2,Financial Bid Opening Date:,Document :.3,Tender Stage
EIC-CIVIL||SERNB-CIRCLE-CUTTACK,CCE.Ctc.(RandB)15/2023-24,2023_EICCL_93678_7,Yes,National Competitive Bid,Percentage,Works,2.0,No,No,Online,No,No,No,1.0,Fee/PreQual/Technical,.pdf,"Paper cost, EMD, GSTIN, PAN, RC, Affidavit and correctness certificate",02-Sep-2023 10:00 AM,16-Sep-2023 11:00 AM,02-Sep-2023 10:00 AM,15-Sep-2023 05:30 PM,NA ,NA ,02-Sep-2023 10:00 AM,15-Sep-2023 05:30 PM,25-Oct-2023 11:30 AM,"5,48,200",Yes,fixed,,Nil,Nil,1.0,Corrigendum date,Date,,1.0,ICICI BANK,"10,000",0.0,Nil,Nil,No,CCE Cuttack RandB Circle,O/o CCE Cuttack RandB Circle,Widening and strengthening of road from Karanja to Dahimacha via Gokhapada from 0.000 km. to 2.000 km. under State Planin the District of Kendrapara.,Road work,As per DTCN ,NA ,"5,48,14,160",Civil Works - Roads,NA ,Tender,90.0,210.0,Kendrapara,754103.0,NA ,NA ,NA ,O/o CCE Cuttack RandB Circle,No ,No,AOC,13-Mar-2024,"INR 46,597,517",210.0,Pradeep Kumar Rath,13-Mar-2024 05:45 PM,Agtdahimachha.pdf (3110.00 KB),The date of commencement and completion may be read as 19.02.2024 to complete the work within 8 calander months,1.0,2253195.0,Prasanta Kumar Behera,INR,"46,597,517",1,2241219,ANANTA PRASAD MALIK,14-Sep-2023 08:07 PM,Rejected-Finance,Due to transparent lottery,01-Mar-2024 06:31 PM,Finance,5 bidders have participated,Pradeep Kumar Rath,25-Oct-2023 01:23 PM,,BOQ Comparative Chart,Pradeep Kumar Rath,Internal,Jyoti Ranjan Pati EE Sandhyarani Jena EE DAO Sipra Mohanty JE Estr,Pradeep Kumar Rath,01-Mar-2024 06:31 PM,finsummary_457748.pdf (978.78 KB),EIC-CIVIL||SERNB-CIRCLE-CUTTACK,2023_EICCL_93678_7,CCE.Ctc.(RandB)15/2023-24,Widening and strengthening of road from Karanja to Dahimacha via Gokhapada from 0.000 km. to 2.000 km. under State Planin the District of Kendrapara.,Technical,5 bidders have participated,Pradeep Kumar Rath,18-Sep-2023 09:25 PM,,Pradeep Kumar Rath,Internal,Jyoti Ranjan Pati EE Sandhyarani Jena EE Pintu Bera DAO Sipra Mohanty JE Estr,Pradeep Kumar Rath,19-Oct-2023 03:25 PM,25-Oct-2023 11:30 AM,techsummary_457748.pdf (532.00 KB),AOC
,,,,,,,,,,,,,,,,.pdf,Machineries and other documents as per DTCN,,,,,,,,,,,,,,,,,,,,2.0,ICICI NEFT/RTGS,,,,,,,,,,,,,,,,,,,,,,,,,,AOC,,,,,,,,,,,,,2,2251948,NRUSINGH CHARAN BEURA,14-Sep-2023 08:56 PM,Rejected-Finance,Due to transparent lottery,01-Mar-2024 06:31 PM,,,,,,,,,,,,,,,,,,,,,,,,,,,,,AOC
,,,,,,,,,,,,,,2.0,Finance,.xls,Bill of Quanities,,,,,,,,,,,,,,,,,,,,,,,,,,,,,,,,,,,,,,,,,,,,,,,AOC,,,,,,,,,,,,,3,2253195,Prasanta Kumar Behera,13-Sep-2023 01:40 PM,Accepted-AOC,Due to 1st lowest,13-Mar-2024 05:46 PM,,,,,,,,,,,,,,,,,,,,,,,,,,,,,AOC
,,,,,,,,,,,,,,,,,,,,,,,,,,,,,,,,,,,,,,,,,,,,,,,,,,,,,,,,,,,,,,,,AOC,,,,,,,,,,,,,4,2256735,SAMBIT KUMAR JENA,15-Sep-2023 01:03 PM,Rejected-Finance,Due to transparent lottery,01-Mar-2024 06:31 PM,,,,,,,,,,,,,,,,,,,,,,,,,,,,,AOC
,,,,,,,,,,,,,,,,,,,,,,,,,,,,,,,,,,,,,,,,,,,,,,,,,,,,,,,,,,,,,,,,AOC,,,,,,,,,,,,,5,2252432,SATYAJIT PATRA,15-Sep-2023 04:19 PM,Rejected-Finance,Due to transparent lottery,01-Mar-2024 06:31 PM,,,,,,,,,,,,,,,,,,,,,,,,,,,,,AOC
