Organisation Chain,Tender Reference Number,Tender ID,Withdrawal Allowed,Tender Type,Form of contract,Tender Category,No. of Covers,General Technical Evaluation Allowed,ItemWise Technical Evaluation Allowed,Payment Mode,Is Multi Currency Allowed For BOQ,Is Multi Currency Allowed For Fee,Allow Two Stage Bidding,Cover No,Cover,Document Type,Description,Publish Date,Bid Opening Date,Document Download / Sale Start Date,Document Download / Sale End Date,Clarification Start Date,Clarification End Date,Bid Submission Start Date,Bid Submission End Date,Financial Bid Opening Date,EMD Amount in ₹,EMD Exemption Allowed,EMD Fee Type,EMD Percentage,EMD Payable To,EMD Payable At,S.No,Bank Name,Tender Fee in ₹,VAT Charges in ₹,Fee Payable To,Fee Payable At,Tender Fee Exemption Allowed,Name,Address,Title,Work Description,Pre Qualification Details,Independent External Monitor/Remarks,Tender Value in ₹,Product Category,Sub category,Contract Type,Bid Validity(Days),Period Of Work(Days),Location,Pincode,Pre Bid Meeting Place,Pre Bid Meeting Address,Pre Bid Meeting Date,Bid Opening Place,Should Allow NDA Tender,Allow Preferential Bidder,Tender Stage,Contract Date :,Contract Value :,Work Completion Period in days :,Updated By :,Updated on :,AOC document :,AOC Description :,S.No,Bid Number,Bidder Name,Awarded Currency,Awarded Value,S.No.1,Bid Number.1,Bidder Name.1,Submitted Date,Status,Remarks,Status Updated On,Type :,Summary :,Updated By :.1,Updated On :,Document :,BOQ Comparative Chart :,Committee Chairperson/Co-ordinator Name :,Committee Chairperson/Co-ordinator Type :,Committee Members :,Updated By :.2,Updated on :.1,Document :.1,Organisation Chain :,Tender ID :,Tender Ref No :,Tender Title :,Type :.1,Summary :.1,Updated By :.3,Updated On :.1,Document :.2,Committee Chairperson/Co-ordinator Name :.1,Committee Chairperson/Co-ordinator Type :.1,Committee Members :.1,Updated By :.4,Updated On :.2,Financial Bid Opening Date:,Document :.3,Tender Stage
EIC-CIVIL,CE-DPI AND R- 24/2023-24,2023_EICCL_95012_39,Yes,Open Tender,Percentage,Works,2.0,No,No,Online,No,No,No,1.0,Fee/PreQual/Technical,.pdf,"Online proof copy of Tender Cost and EMD, GSTIN, PAN, RC and Affidavit",02-Oct-2023 12:00 PM,17-Oct-2023 11:00 AM,02-Oct-2023 12:00 PM,16-Oct-2023 05:30 PM,NA ,NA ,02-Oct-2023 12:00 PM,16-Oct-2023 05:30 PM,15-Dec-2023 11:30 AM,"26,49,000",Yes,fixed,,Nil,Nil,1.0,ICICI BANK,"10,000",0.0,Nil,Nil,No,"Chief Engineer, DPI and Roads, Odisha","Office of the E.I.C. Civil, Odisha, Nirman Soudha, New Building, Unit-V, Bhubaneswar",Improvement such as widening and strengthening of Sahadevpur - Tarata Sasana Road from 0/000 km to 11/070 km in the district of Cuttack under State Plan,Improvement such as widening and strengthening of Sahadevpur - Tarata Sasana Road from 0/000 km to 11/070 km in the district of Cuttack under State Plan,Please refer Tender documents. ,NA ,"26,49,23,178",Civil Works - Roads,NA ,Tender,90.0,420.0,Cuttack Dist,751001.0,NA ,NA ,NA ,"O/o the E.I.C. Civil, Odisha, Bhubaneswar",No ,No,AOC,19-Mar-2024,"INR 238,457,353",420.0,Pradipta Kumar Nayak,19-Mar-2024 01:05 PM,Sahadevpur_Taratsasan.pdf (117.00 KB),637P1 of 2023-24,1.0,2289235.0,BP Constructions and Engineers PVT. LTD.,INR,"238,457,353",1,2288621,BIJOY BUILDCONS PVT. LTD.,16-Oct-2023 02:32 PM,Rejected-AOC,L1 bidder,19-Mar-2024 01:05 PM,Finance,Finance opening,Pradipta Kumar Nayak,15-Dec-2023 12:34 PM,,BOQ Comparative Chart,CE DPI and R Odisha,Internal,,Pradipta Kumar Nayak,19-Mar-2024 12:52 PM,finsummary_465240.pdf (117.43 KB),EIC-CIVIL,2023_EICCL_95012_39,CE-DPI AND R- 24/2023-24,Improvement such as widening and strengthening of Sahadevpur - Tarata Sasana Road from 0/000 km to 11/070 km in the district of Cuttack under State Plan,Technical,Opening of tender,Pradipta Kumar Nayak,17-Oct-2023 04:46 PM,,EIC Civil Odisha,Internal,,Pradipta Kumar Nayak,14-Dec-2023 12:36 PM,15-Dec-2023 11:30 AM,techsummary_465240.pdf (176.37 KB),AOC
,,,,,,,,,,,,,,,,.pdf,Machineries and work experience,,,,,,,,,,,,,,,,2.0,ICICI NEFT/RTGS,,,,,,,,,,,,,,,,,,,,,,,,,,AOC,,,,,,,,,,,,,2,2287156,BINAYAK CONSTRUCTION AND ENGINEERS PVT LTD,13-Oct-2023 02:22 PM,Rejected-AOC,L2 bidder,19-Mar-2024 01:05 PM,,,,,,,,,,,,,,,,,,,,,,,,,,,,,AOC
,,,,,,,,,,,,,,,,.pdf,Other documents as per DTCN,,,,,,,,,,,,,,,,,,,,,,,,,,,,,,,,,,,,,,,,,,,AOC,,,,,,,,,,,,,3,2289235,BP Constructions and Engineers PVT. LTD.,16-Oct-2023 03:33 PM,Accepted-AOC,Selected as L1 bidder,19-Mar-2024 01:05 PM,,,,,,,,,,,,,,,,,,,,,,,,,,,,,AOC
,,,,,,,,,,,,,,2.0,Finance,.xls,Bill of quantities,,,,,,,,,,,,,,,,,,,,,,,,,,,,,,,,,,,,,,,,,,,AOC,,,,,,,,,,,,,4,2289234,MRD INFRACON,16-Oct-2023 01:42 PM,Rejected-AOC,L1 bidder,19-Mar-2024 01:05 PM,,,,,,,,,,,,,,,,,,,,,,,,,,,,,AOC
,,,,,,,,,,,,,,,,,,,,,,,,,,,,,,,,,,,,,,,,,,,,,,,,,,,,,,,,,,,,AOC,,,,,,,,,,,,,5,2287306,Shivam Condev Private Limited,16-Oct-2023 01:22 PM,Rejected-Technical,Non-responsive,14-Dec-2023 12:35 PM,,,,,,,,,,,,,,,,,,,,,,,,,,,,,AOC
,,,,,,,,,,,,,,,,,,,,,,,,,,,,,,,,,,,,,,,,,,,,,,,,,,,,,,,,,,,,AOC,,,,,,,,,,,,,6,2282551,SIBA PRASAD PARIDA,16-Oct-2023 11:49 AM,Rejected-Finance,Other than L1 and L2 bidder,19-Mar-2024 12:52 PM,,,,,,,,,,,,,,,,,,,,,,,,,,,,,AOC
