Organisation Chain,Tender Reference Number,Tender ID,Withdrawal Allowed,Tender Type,Form of contract,Tender Category,No. of Covers,General Technical Evaluation Allowed,ItemWise Technical Evaluation Allowed,Payment Mode,Is Multi Currency Allowed For BOQ,Is Multi Currency Allowed For Fee,Allow Two Stage Bidding,Cover No,Cover,Document Type,Description,Publish Date,Bid Opening Date,Document Download / Sale Start Date,Document Download / Sale End Date,Clarification Start Date,Clarification End Date,Bid Submission Start Date,Bid Submission End Date,Financial Bid Opening Date,EMD Amount in ₹,EMD Exemption Allowed,EMD Fee Type,EMD Percentage,EMD Payable To,EMD Payable At,S.No,Corrigendum Title,Corrigendum Type,View,S.No.1,Bank Name,Tender Fee in ₹,VAT Charges in ₹,Fee Payable To,Fee Payable At,Tender Fee Exemption Allowed,Name,Address,Title,Work Description,Pre Qualification Details,Independent External Monitor/Remarks,Tender Value in ₹,Product Category,Sub category,Contract Type,Bid Validity(Days),Period Of Work(Days),Location,Pincode,Pre Bid Meeting Place,Pre Bid Meeting Address,Pre Bid Meeting Date,Bid Opening Place,Should Allow NDA Tender,Allow Preferential Bidder,Tender Stage,Contract Date :,Contract Value :,Work Completion Period in days :,Updated By :,Updated on :,AOC document :,AOC Description :,S.No,Bid Number,Bidder Name,Awarded Currency,Awarded Value,S.No.1,Bid Number.1,Bidder Name.1,Submitted Date,Status,Remarks,Status Updated On,Type :,Summary :,Updated By :.1,Updated On :,Document :,BOQ Comparative Chart :,Committee Chairperson/Co-ordinator Name :,Committee Chairperson/Co-ordinator Type :,Committee Members :,Updated By :.2,Updated on :.1,Document :.1,Organisation Chain :,Tender ID :,Tender Ref No :,Tender Title :,Type :.1,Summary :.1,Updated By :.3,Updated On :.1,Document :.2,Committee Chairperson/Co-ordinator Name :.1,Committee Chairperson/Co-ordinator Type :.1,Committee Members :.1,Updated By :.4,Updated On :.2,Financial Bid Opening Date:,Document :.3,Tender Stage
CE RW I||RWCIRCLE-BHUBANESWAR,Tender Online C.C-24 of 2023,2023_CERWI_92450_42,Yes,National Competitive Bid,Percentage,Works,2.0,No,No,Online,No,No,No,1.0,Fee/PreQual/Technical,.pdf,"Tender Paper Cost, EMD, GSTIN, PAN, Registration Certificate",31-Aug-2023 09:00 AM,12-Sep-2023 11:00 AM,31-Aug-2023 09:00 AM,11-Sep-2023 05:00 PM,NA ,NA ,31-Aug-2023 09:00 AM,11-Sep-2023 05:00 PM,29-Sep-2023 11:00 AM,"8,61,166",Yes,percentage,1.0%,Nil,Nil,1.0,Date Corrigendum,Date,,1.0,ICICI BANK,"10,000",0.0,Nil,Nil,No,Chief Construction Engineer,"O/o ChiefConstructionEngineer,CentralRWCircle,BBSR","Construction of Udayapur Banti (RD Road Culvert) to Kakatpur Konark PWD road via Swain Sahi, CHC Bangurigaon Tikarpada to Kalamapata Biribasta PWD Road under MMSY-TRIP for the year 2023-24","Construction of Udayapur Banti (RD Road Culvert) to Kakatpur Konark PWD road via Swain Sahi, CHC Bangurigaon Tikarpada to Kalamapata Biribasta PWD Road under MMSY-TRIP for the year 2023-24",Please refer Tender documents. ,NA ,"8,61,16,589",Civil Works - Roads,NA ,Tender,90.0,270.0,Nimapara,752106.0,NA ,NA ,NA ,"O/o ChiefConstructionEngineer,CentralRWCircle,BBSR",No ,No,AOC,21-Mar-2024,"INR 77,513,542",270.0,Priyadarshini Dalai,21-Mar-2024 03:53 PM,UdaypurAgmtDetails.pdf (966.00 KB),"Work order letter No.1375 dtd.14.03.2024 and Agmt No.196 P1 of 2023-24 dtd.14.03.2024 of Superintending Engineer, Rural Works Division, Nimapara",1.0,2245008.0,M/S JAGANNATH CONSTRUCTION CO,INR,"77,513,542",1,2247827,BISWOJIT PANDA,11-Sep-2023 03:50 PM,Rejected-Finance,Other than L1,27-Oct-2023 06:23 PM,Finance,5 nos bidder qualified in the tender,Priyadarshini Dalai,27-Oct-2023 06:16 PM,finance_448870.pdf,BOQ Comparative Chart,"Chief Construction Engineer CentralRWCircle,BBSR",Internal,SuperintendingEngineerRWDivision Puri SrDAORWDivision Nimapara PAtoChiefConstructionEngineerCentralRuralWorksCircleBBSR,Priyadarshini Dalai,27-Oct-2023 06:23 PM,finsummary_448870.pdf (141.14 KB),CE RW I||RWCIRCLE-BHUBANESWAR,2023_CERWI_92450_42,Tender Online C.C-24 of 2023,"Construction of Udayapur Banti (RD Road Culvert) to Kakatpur Konark PWD road via Swain Sahi, CHC Bangurigaon Tikarpada to Kalamapata Biribasta PWD Road under MMSY-TRIP for the year 2023-24",Technical,QUALIFIED AND DISQUALIFIED LIST,Priyadarshini Dalai,26-Sep-2023 07:28 PM,technical_448870.pdf,"Chief Construction Engineer CentralRWCircle,BBSR",Internal,SuperintendingEngineerRWDivision Puri SrDAORWDivision Nimapara PAtoChiefConstructionEngineerCentralRuralWorksCircleBBSR,Priyadarshini Dalai,26-Sep-2023 07:29 PM,29-Sep-2023 11:00 AM,techsummary_448870.pdf (141.14 KB),AOC
,,,,,,,,,,,,,,,,.pdf,"Work in Hand, Machineries, Affidavit of Correctness Certificate",,,,,,,,,,,,,,,,,,,,2.0,ICICI NEFT/RTGS,,,,,,,,,,,,,,,,,,,,,,,,,,AOC,,,,,,,,,,,,,2,2238603,MAHAVIR INFRA-DEVELOPERS PVT. LTD.,07-Sep-2023 04:10 PM,Rejected-AOC,Rejected,21-Mar-2024 03:54 PM,,,,,,,,,,,,,,,,,,,,,,,,,,,,,AOC
,,,,,,,,,,,,,,,,.pdf,"No Relationship Certificate, ATO, Work Experience and required documents as per DTCN",,,,,,,,,,,,,,,,,,,,,,,,,,,,,,,,,,,,,,,,,,,,,,,AOC,,,,,,,,,,,,,3,2234778,MANORANJAN SWAIN,11-Sep-2023 01:46 PM,Rejected-Finance,Other than L1 and L2,27-Oct-2023 06:23 PM,,,,,,,,,,,,,,,,,,,,,,,,,,,,,AOC
,,,,,,,,,,,,,,2.0,Finance,.xls,BOQ,,,,,,,,,,,,,,,,,,,,,,,,,,,,,,,,,,,,,,,,,,,,,,,AOC,,,,,,,,,,,,,4,2245008,M/S JAGANNATH CONSTRUCTION CO,11-Sep-2023 03:51 PM,Accepted-AOC,Accepted,21-Mar-2024 03:54 PM,,,,,,,,,,,,,,,,,,,,,,,,,,,,,AOC
,,,,,,,,,,,,,,,,,,,,,,,,,,,,,,,,,,,,,,,,,,,,,,,,,,,,,,,,,,,,,,,,AOC,,,,,,,,,,,,,5,2239390,PRATAP KUMAR UDAYASINGH,06-Sep-2023 02:13 PM,Rejected-Finance,Other than L1 and L2,27-Oct-2023 06:23 PM,,,,,,,,,,,,,,,,,,,,,,,,,,,,,AOC
