Organisation Chain,Tender Reference Number,Tender ID,Withdrawal Allowed,Tender Type,Form of contract,Tender Category,No. of Covers,General Technical Evaluation Allowed,ItemWise Technical Evaluation Allowed,Payment Mode,Is Multi Currency Allowed For BOQ,Is Multi Currency Allowed For Fee,Allow Two Stage Bidding,Cover No,Cover,Document Type,Description,Publish Date,Bid Opening Date,Document Download / Sale Start Date,Document Download / Sale End Date,Clarification Start Date,Clarification End Date,Bid Submission Start Date,Bid Submission End Date,EMD Amount in ₹,EMD Exemption Allowed,EMD Fee Type,EMD Percentage,EMD Payable To,EMD Payable At,S.No,Bank Name,Tender Fee in ₹,VAT Charges in ₹,Fee Payable To,Fee Payable At,Tender Fee Exemption Allowed,Name,Address,Title,Work Description,Pre Qualification Details,Independent External Monitor/Remarks,Tender Value in ₹,Product Category,Sub category,Contract Type,Bid Validity(Days),Period Of Work(Days),Location,Pincode,Pre Bid Meeting Place,Pre Bid Meeting Address,Pre Bid Meeting Date,Bid Opening Place,Should Allow NDA Tender,Allow Preferential Bidder,Tender Stage,S.No,Bid Number,Bidder Name,Submitted Date,Status,Remarks,Status Updated On,Type :,Summary :,Updated By :,Updated On :,Document :,BOQ Comparative Chart :,Organisation Chain :,Tender ID :,Tender Ref No :,Tender Title :,Committee Chairperson/Co-ordinator Name :,Committee Chairperson/Co-ordinator Type :,Committee Members :,Updated By :.1,Updated On :.1,Document :.1,Tender Stage
"CE-BM,RVN Basin,Berhampur||SE Southern Irr Circle II Paralakhemundi||EE Paralakhemundi Irr Divn Paralakhemundi",SE-GID-05/2023-24,2024_CEBMB_100569_3,Yes,National Competitive Bid,Percentage,Works,1.0,No,No,Online,No,No,No,1.0,Fee/PreQual/Technical/Finance,.pdf,"REGISTRATION CERTIFICATE, GSTIN, PAN CARD, NO RELATION CERTIFICATE, AFFIDAVIT, EMD,TENDER PAPER COST",05-Feb-2024 10:00 AM,16-Feb-2024 11:00 AM,05-Feb-2024 10:00 AM,15-Feb-2024 05:30 PM,05-Feb-2024 10:00 AM ,09-Feb-2024 05:30 PM ,05-Feb-2024 10:00 AM,15-Feb-2024 05:30 PM,"43,700",Yes,fixed,,Nil,Nil,1.0,ICICI BANK,"6,000",0.0,Nil,Nil,No,Superintending Engineer,"O/O the Superintending Engineer, Gajapati Irrigation Division, Paralakhemundi, At- Jalasampad Bhawan, Dist- Gajapati, Pin- 761200",Flood protection work on right side of river Vanasadhara near village Old Serama in Ramanaguda Block of Rayagada District,Flood protection work on right side of river Vanasadhara near village Old Serama in Ramanaguda Block of Rayagada District,Please refer Tender documents. ,NA ,"43,64,428",Civil Works - Others,NA ,Tender,90.0,180.0,Ramanaguda,765029.0,NA ,NA ,NA ,"O/o SE, GID, Paralakhemundi",No ,No,AOC,1,2437168,BEJIPURAM KHAGESWAR RAO,13-Feb-2024 11:41 AM,Accepted-AOC,Accepted and Successful bidder on Transparency lottery,01-Mar-2024 07:11 PM,Finance,Technical Bid Summary uploaded,Roja Rani Pattanaik,26-Feb-2024 12:31 PM,,BOQ Comparative Chart,"CE-BM,RVN Basin,Berhampur||SE Southern Irr Circle II Paralakhemundi||EE Paralakhemundi Irr Divn Paralakhemundi",2024_CEBMB_100569_3,SE-GID-05/2023-24,Flood protection work on right side of river Vanasadhara near village Old Serama in Ramanaguda Block of Rayagada District,Superintending Engineer,Internal,,Jyotiraj Adhikari,26-Feb-2024 12:59 PM,techsummary_489696.pdf (255.38 KB),AOC
,,,,,,,,,,,,,,,,.pdf,Any other documents as per SBD and DTCN,,,,,,,,,,,,,,,2.0,ICICI NEFT/RTGS,,,,,,,,,,,,,,,,,,,,,,,,,,AOC,2,2440693,D.HARISH KUMAR,15-Feb-2024 07:16 AM,Rejected-AOC,Rejected and Unsuccessful bidder on transparency lottery,01-Mar-2024 07:11 PM,,,,,,,,,,,,,,,,,AOC
,,,,,,,,,,,,,,,,.xls,BOQ,,,,,,,,,,,,,,,,,,,,,,,,,,,,,,,,,,,,,,,,,,AOC,3,2442384,GOTTIPILLI LOKESH,15-Feb-2024 01:33 PM,Rejected-AOC,Rejected and Unsuccessful bidder on transparency lottery,01-Mar-2024 07:11 PM,,,,,,,,,,,,,,,,,AOC
,,,,,,,,,,,,,,,,,,,,,,,,,,,,,,,,,,,,,,,,,,,,,,,,,,,,,,,,,,,AOC,4,2443112,PADMALOCHAN PRADHAN,15-Feb-2024 03:35 PM,Rejected-AOC,Rejected and Unsuccessful bidder on transparency lottery,01-Mar-2024 07:11 PM,,,,,,,,,,,,,,,,,AOC
,,,,,,,,,,,,,,,,,,,,,,,,,,,,,,,,,,,,,,,,,,,,,,,,,,,,,,,,,,,AOC,5,2427774,P.Yogeswer Rao,12-Feb-2024 04:58 PM,Rejected-AOC,Rejected and Unsuccessful bidder on transparency lottery,01-Mar-2024 07:11 PM,,,,,,,,,,,,,,,,,AOC
