Organisation Chain,Tender Reference Number,Tender ID,Withdrawal Allowed,Tender Type,Form of contract,Tender Category,No. of Covers,General Technical Evaluation Allowed,ItemWise Technical Evaluation Allowed,Payment Mode,Is Multi Currency Allowed For BOQ,Is Multi Currency Allowed For Fee,Allow Two Stage Bidding,Cover No,Cover,Document Type,Description,Publish Date,Bid Opening Date,Document Download / Sale Start Date,Document Download / Sale End Date,Clarification Start Date,Clarification End Date,Bid Submission Start Date,Bid Submission End Date,EMD Amount in ₹,EMD Exemption Allowed,EMD Fee Type,EMD Percentage,EMD Payable To,EMD Payable At,S.No,Bank Name,Tender Fee in ₹,VAT Charges in ₹,Fee Payable To,Fee Payable At,Tender Fee Exemption Allowed,Name,Address,Title,Work Description,Pre Qualification Details,Independent External Monitor/Remarks,Tender Value in ₹,Product Category,Sub category,Contract Type,Bid Validity(Days),Period Of Work(Days),Location,Pincode,Pre Bid Meeting Place,Pre Bid Meeting Address,Pre Bid Meeting Date,Bid Opening Place,Should Allow NDA Tender,Allow Preferential Bidder,Tender Stage,Contract Date :,Contract Value :,Work Completion Period in days :,Updated By :,Updated on :,AOC document :,S.No,Bid Number,Bidder Name,Awarded Currency,Awarded Value,S.No.1,Bid Number.1,Bidder Name.1,Submitted Date,Status,Remarks,Status Updated On,Type :,Summary :,Updated By :.1,Updated On :,Document :,BOQ Comparative Chart :,Committee Chairperson/Co-ordinator Name :,Committee Chairperson/Co-ordinator Type :,Committee Members :,Updated By :.2,Updated on :.1,Document :.1,Organisation Chain :,Tender ID :,Tender Ref No :,Tender Title :,Committee Chairperson/Co-ordinator Name :.1,Committee Chairperson/Co-ordinator Type :.1,Committee Members :.1,Updated By :.3,Updated On :.1,Document :.2,Tender Stage
CE RW I||RWCIRCLE-BALASORE||RWDIVISION-BHADRAK,TCN13 of 2023-24,2023_CERWI_98374_6,Yes,Open Tender,Percentage,Works,1.0,No,No,Online,No,No,No,1.0,Fee/PreQual/Technical/Finance,.pdf,DTCN,16-Dec-2023 09:00 AM,27-Dec-2023 11:00 AM,16-Dec-2023 09:00 AM,26-Dec-2023 04:00 PM,16-Dec-2023 09:00 AM ,26-Dec-2023 02:00 PM ,16-Dec-2023 09:00 AM,26-Dec-2023 04:00 PM,"23,596",Yes,percentage,1.0%,Nil,Nil,1.0,ICICI BANK,"6,000",0.0,Nil,Nil,No,Executive Engineer,"Office of the Executive Engineer,R.W.Division,Bhadrak",Construction of Govt. Ayurvedic Dispensary Building at Nuasahi in the district of Bhadrak for the year 2023-24,Repir of Building Works,"PAN,GST, RC and other relevant documents as per DTCN ",NA ,"23,59,581",Civil Works - Buildings,NA ,Tender,90.0,120.0,Bhadrak,756100.0,NA ,NA ,NA ,"Office of the Executive Engineer,R.W.Division,Bhad",No ,No,AOC,04-Mar-2024,"INR 2,005,879",120.0,Kanan Pradhan,04-Mar-2024 06:46 PM,ManojKumarSahoo.pdf (67.00 KB),1.0,2366909.0,MANOJ KUMAR SAHOO,INR,"2,005,879",1,2364959,ANIYA KUMAR MALIK,22-Dec-2023 10:55 AM,Rejected-AOC,Unsuccessful Bidder selected through transparent lottery system.,04-Mar-2024 06:46 PM,Finance,Total 5 nos Bidder,Pallishree Sahoo,22-Feb-2024 01:42 PM,finance_479521.pdf,BOQ Comparative Chart,Executive Engineer,Internal,,Pallishree Sahoo,24-Feb-2024 06:01 PM,finsummary_479521.pdf (126.30 KB),CE RW I||RWCIRCLE-BALASORE||RWDIVISION-BHADRAK,2023_CERWI_98374_6,TCN13 of 2023-24,Construction of Govt. Ayurvedic Dispensary Building at Nuasahi in the district of Bhadrak for the year 2023-24,Executive Engineer,Internal,,Pallishree Sahoo,23-Feb-2024 05:19 PM,techsummary_479521.pdf (126.30 KB),AOC
,,,,,,,,,,,,,,,,.xls,BOQ,,,,,,,,,,,,,,,2.0,ICICI NEFT/RTGS,,,,,,,,,,,,,,,,,,,,,,,,,,AOC,,,,,,,,,,,,2,2366909,MANOJ KUMAR SAHOO,25-Dec-2023 05:50 PM,Accepted-AOC,Successful Bidder selected through transparent lottery system.,04-Mar-2024 06:46 PM,,,,,,,,,,,,,,,,,,,,,,,AOC
,,,,,,,,,,,,,,,,,,,,,,,,,,,,,,,,,,,,,,,,,,,,,,,,,,,,,,,,,,,AOC,,,,,,,,,,,,3,2367609,Mrs.SANJULATA MALIK (s.c),26-Dec-2023 12:30 PM,Rejected-AOC,Unsuccessful Bidder selected through transparent lottery system.,04-Mar-2024 06:46 PM,,,,,,,,,,,,,,,,,,,,,,,AOC
,,,,,,,,,,,,,,,,,,,,,,,,,,,,,,,,,,,,,,,,,,,,,,,,,,,,,,,,,,,AOC,,,,,,,,,,,,4,2362297,PRASANTA KUMAR LENKA,19-Dec-2023 10:03 PM,Rejected-AOC,Unsuccessful Bidder selected through transparent lottery system.,04-Mar-2024 06:46 PM,,,,,,,,,,,,,,,,,,,,,,,AOC
,,,,,,,,,,,,,,,,,,,,,,,,,,,,,,,,,,,,,,,,,,,,,,,,,,,,,,,,,,,AOC,,,,,,,,,,,,5,2366846,Rajesh Pattanaik,25-Dec-2023 05:11 PM,Rejected-AOC,Unsuccessful Bidder selected through transparent lottery system.,04-Mar-2024 06:46 PM,,,,,,,,,,,,,,,,,,,,,,,AOC
