Organisation Chain,Tender Reference Number,Tender ID,Withdrawal Allowed,Tender Type,Form of contract,Tender Category,No. of Covers,General Technical Evaluation Allowed,ItemWise Technical Evaluation Allowed,Payment Mode,Is Multi Currency Allowed For BOQ,Is Multi Currency Allowed For Fee,Allow Two Stage Bidding,Cover No,Cover,Document Type,Description,Publish Date,Bid Opening Date,Document Download / Sale Start Date,Document Download / Sale End Date,Clarification Start Date,Clarification End Date,Bid Submission Start Date,Bid Submission End Date,Financial Bid Opening Date,EMD Amount in ₹,EMD Exemption Allowed,EMD Fee Type,EMD Percentage,EMD Payable To,EMD Payable At,S.No,Bank Name,Tender Fee in ₹,VAT Charges in ₹,Fee Payable To,Fee Payable At,Tender Fee Exemption Allowed,Name,Address,Title,Work Description,Pre Qualification Details,Independent External Monitor/Remarks,Tender Value in ₹,Product Category,Sub category,Contract Type,Bid Validity(Days),Period Of Work(Days),Location,Pincode,Pre Bid Meeting Place,Pre Bid Meeting Address,Pre Bid Meeting Date,Bid Opening Place,Should Allow NDA Tender,Allow Preferential Bidder,Tender Stage,Contract Date :,Contract Value :,Work Completion Period in days :,Updated By :,Updated on :,AOC document :,AOC Description :,S.No,Bid Number,Bidder Name,Awarded Currency,Awarded Value,S.No.1,Bid Number.1,Bidder Name.1,Submitted Date,Status,Remarks,Status Updated On,Type :,Summary :,Updated By :.1,Updated On :,Document :,BOQ Comparative Chart :,Committee Chairperson/Co-ordinator Name :,Committee Chairperson/Co-ordinator Type :,Committee Members :,Updated By :.2,Updated on :.1,Document :.1,Organisation Chain :,Tender ID :,Tender Ref No :,Tender Title :,Type :.1,Summary :.1,Updated By :.3,Updated On :.1,Document :.2,Committee Chairperson/Co-ordinator Name :.1,Committee Chairperson/Co-ordinator Type :.1,Committee Members :.1,Updated By :.4,Updated On :.2,Financial Bid Opening Date:,Document :.3,S.No.2,Revocation Title,Revocation Description,Published Date,Document Name,Document Size(in KB),Revocated To,Tender Stage
CE RW I||RWCIRCLE-KEONJHAR,Road Online NCB No.411,2024_CERWI_99297_4,Yes,National Competitive Bid,Percentage,Works,2.0,No,No,Online,No,No,No,1.0,Fee/PreQual/Technical,.pdf,"Tender Paper Cost, EMD, Registration Certificate, GSTIN, PAN, Affidavits etc.",08-Jan-2024 06:55 PM,18-Jan-2024 11:00 AM,08-Jan-2024 06:55 PM,17-Jan-2024 05:00 PM,08-Jan-2024 06:55 PM ,16-Jan-2024 05:00 PM ,08-Jan-2024 06:55 PM,17-Jan-2024 05:00 PM,20-Feb-2024 05:00 PM,"3,92,375",Yes,percentage,1.0%,Nil,Nil,1.0,ICICI BANK,"10,000",0.0,Nil,Nil,No,"Chief Construction Engineer, R.W. Circle, Keonjhar","O/o C.C.E., R.W. Circle, Keonjhar",Improvement of road from Tandibeda to Manoharpur via-Laxmiposi under OMBADC in the District of Keonjhar for the year 2023-24.,Improvement of road from Tandibeda to Manoharpur via-Laxmiposi under OMBADC in the District of Keonjhar for the year 2023-24.,Please refer Tender documents. ,NA ,"3,92,37,532",Civil Works - Roads,NA ,Tender,90.0,330.0,Keonjhar,758001.0,NA ,NA ,NA ,"O/o C.C.E., R.W. Circle, Keonjhar",No ,No,AOC,04-Mar-2024,"INR 33,355,825.85",330.0,Monalisa Behera,15-Mar-2024 09:29 PM,AGTTANDIBEDA.pdf (816.00 KB),Award of Contract.,1.0,2393506.0,GADADHAR NAYAK,INR,"33,355,825.85",1,2396226,ANUP KUMAR SAHOO,17-Jan-2024 03:10 PM,Rejected-Technical,Non-responsive.,17-Feb-2024 06:03 PM,Finance,Cover-II,Monalisa Behera,22-Feb-2024 12:19 PM,finance_482932.pdf,BOQ Comparative Chart,Shishir Kumar Mishra,Internal,Puspanjali Bangsingh Monalisha Hembram Monalisa Behera,Monalisa Behera,02-Mar-2024 06:00 PM,finsummary_482932.pdf (464.74 KB),CE RW I||RWCIRCLE-KEONJHAR,2024_CERWI_99297_4,Road Online NCB No.411,Improvement of road from Tandibeda to Manoharpur via-Laxmiposi under OMBADC in the District of Keonjhar for the year 2023-24.,Technical,Total 5 Nos. bidder participated.,Monalisa Behera,17-Feb-2024 05:07 PM,technical_482932.pdf,Shishir Kumar Mishra,Internal,Puspanjali Bangsingh Monalisha Hembram Monalisa Behera,Shishir Kumar Mishra,17-Feb-2024 06:03 PM,20-Feb-2024 05:00 PM,techsummary_482932.pdf (850.72 KB),1.0,Tender Revocation,Tender Revocation,17-Feb-2024 01:28 PM,MODIFIEDRESULT.pdf ,836.91,Technical Opening,AOC
,,,,,,,,,,,,,,,,.pdf,"Profit Loss statement, List of similar nature of work, Work in hand and other documents as per DTCN.",,,,,,,,,,,,,,,,2.0,ICICI NEFT/RTGS,,,,,,,,,,,,,,,,,,,,,,,,,,AOC,,,,,,,,,,,,,2,2396636,DEBENDRA KUMAR JENA,17-Jan-2024 04:30 PM,Rejected-Finance,L3,02-Mar-2024 06:00 PM,,,,,,,,,,,,,,,,,,,,,,,,,,,,,,,,,,,,AOC
,,,,,,,,,,,,,,,,.pdf,Machineries and all other documents required as per DTCN.,,,,,,,,,,,,,,,,,,,,,,,,,,,,,,,,,,,,,,,,,,,AOC,,,,,,,,,,,,,3,2393506,GADADHAR NAYAK,16-Jan-2024 01:53 PM,Accepted-AOC,L1,15-Mar-2024 09:30 PM,,,,,,,,,,,,,,,,,,,,,,,,,,,,,,,,,,,,AOC
,,,,,,,,,,,,,,2.0,Finance,.xls,BOQ,,,,,,,,,,,,,,,,,,,,,,,,,,,,,,,,,,,,,,,,,,,AOC,,,,,,,,,,,,,4,2393740,Ghanashyam Samal,16-Jan-2024 08:38 PM,Rejected-Finance,L4,02-Mar-2024 06:00 PM,,,,,,,,,,,,,,,,,,,,,,,,,,,,,,,,,,,,AOC
,,,,,,,,,,,,,,,,,,,,,,,,,,,,,,,,,,,,,,,,,,,,,,,,,,,,,,,,,,,,AOC,,,,,,,,,,,,,5,2393194,SRI SANJIT DUTTA,17-Jan-2024 01:38 PM,Rejected-AOC,L2,15-Mar-2024 09:30 PM,,,,,,,,,,,,,,,,,,,,,,,,,,,,,,,,,,,,AOC
